citation_id,source_paragraph,retrieved_paper,retrieved_chunk,retrieved_contexts,relevant,citation_text,reasoning
105,"this study was validated on the DEAP, public dataset. The results of the emotional val- idation experiment using EEG are divided into two parts, namely intra-subject and inter-subject validation. The pro- posed method involves the processing of the raw data with fewer preprocessing steps. The Python development environ- ment has been used to downsample data to 128 Hz, remove EOG artifacts, and perform bandpass frequency filtering from 4–45 Hz. The raw EEG data is transformed into a spectrogram image using the STFT method and stored as RGB images. This is done using the MATLAB (octave and oc2py) library in Python. After the spectrogram is generated, the next step is to classify emotions using a deep learning network. The archi- tecture",Cross-Subject Channel Selection Using Modified Relief and Simplified CNN-Based Deep Learning for EEG-Based Emotion Recognition,The architecture proposed in this research was validated using the publicly available DEAP dataset.,"["". ABSTRACT Emotion recognition based on EEG has been implemented in numerous studies. In most of them, there are two observations made: first, extensive implementation is negatively associated with the performed validation. Cross-subject validation is more difficult than subject-dependent validation due to thehighvariabilitybetweenEEGrecordingscausedbydomainshifts.Second,alargenumberofchannels requires extensive computation"", "". 10.3390/s20123491. [28] P.PandeyandK.R.Seeja,‘‘Subjectindependentemotionrecognitionsys- [46] H. Donmez and N. Ozkurt, ‘‘Classification of emotional states from temforpeoplewithfacialdeformity:AnEEGbasedapproach,’’J.Ambient multi-channel EEG signals by convolutional neural networks,’’ in Intell.HumanizedComput.,vol.12,no.2,pp.2311–2320,Feb.2021,doi: Proc. Innov. Intell. Syst. Appl. Conf. (ASYU), 2022, pp.1–6, doi: 10.1007/s12652-020-02338-8. 10.1109/ASYU56188.2022.9925308. [29] Y. Cimtay and E"", "". These selected channels are then subjected to the EEG-based emotion recognition model (AP-CapsNet) with Morlettransform,transformingthedatainto2Dimagesthat subject-dependent and cross-subject experiments, achiev- effectivelyencapsulateintricatetemporalandspectralinforing high accuracies of 62.7% and 63.51% in valence and mation.Subsequently,employingasimplifieddeeplearning arousal class"", "". Reference [31] introduces a subject-independent sis,themodelemploystwoadditionalvalidationtechniques, or cross-subject approach with Inception-V3 CNN achiev- namely random split, and leave-one-out subject. The archiing accuracies of average 90.7%. Reference [60] presents tecture proposed in this research was validated using the BiSMSM for EEG-based emotion recognition, achieving publiclyavailableDEAPdataset.Thedependentsubjectand 63.10% to 61.89% accuracy"", "". First, this study into studies focused racy in the valence class and 85% accuracy in the arousal on channel selection methods within EEG signals using the class. Pandey and Seeja conducted research using CNN DEAP dataset, encompassing a diverse array of techniques architecture, achieving 59% and 59% accuracy for valence aimedatisolatingthemostinformativechannelsforemotion and arousal, respectively [28]. Using Inception Resnet-V2, analysis""]",True,The architecture proposed in this research was validated using the publicly available DEAP dataset (Cross-Subject Channel Selection Using Modified Relief and Simplified CNN-Based Deep Learning for EEG-Based Emotion Recognition).,"The retrieved reference explicitly states that the architecture was validated using the DEAP dataset, which directly supports the claim made in the source paragraph."
106,"DATASET The DEAP dataset has 32 participants with a composition of 50% male and 50% female samples . The stimulus used is a video with a duration of 60 seconds. The results of the EEG recording have a duration of 63 seconds, of which 3 seconds are the baseline. One participant has 40 recordings of the EEG trials. The results of the EEG trial recordings have been mea- sured using the Self-Assessment Manikin (SAM). SAM has four emotional dimensions, namely valence, arousal, domi- nance, and liking, with ratings 0-9. For valence and arousal classes, emotion labels are divided into two categories: low and high. In this study, the low class has a rating below 4.5 and the high class is",Cross-Subject Channel Selection Using Modified Relief and Simplified CNN-Based Deep Learning for EEG-Based Emotion Recognition,"This study into studies focused on channel selection methods within EEG signals using the DEAP dataset, encompassing a diverse array of techniques aimed at isolating the most informative channels for emotion analysis.","["". reflect the ongoing advancements and interdisciplinary collaboration in the field of EEG-based research, aiming to Emotion recognition is another key area explored. The enhance user experiences, improve health outcomes, and study in [20] examines the impact of HDR videos on emotion develop innovative assistive technologies. recognition, achieving an accuracy of 80.55% for arousal and 70.37% for valence. Similarly, [33] develops a hybrid control TABLE I"", "". First, this study into studies focused racy in the valence class and 85% accuracy in the arousal on channel selection methods within EEG signals using the class. Pandey and Seeja conducted research using CNN DEAP dataset, encompassing a diverse array of techniques architecture, achieving 59% and 59% accuracy for valence aimedatisolatingthemostinformativechannelsforemotion and arousal, respectively [28]. Using Inception Resnet-V2, analysis"", "". 10.3390/s20123491. [28] P.PandeyandK.R.Seeja,‘‘Subjectindependentemotionrecognitionsys- [46] H. Donmez and N. Ozkurt, ‘‘Classification of emotional states from temforpeoplewithfacialdeformity:AnEEGbasedapproach,’’J.Ambient multi-channel EEG signals by convolutional neural networks,’’ in Intell.HumanizedComput.,vol.12,no.2,pp.2311–2320,Feb.2021,doi: Proc. Innov. Intell. Syst. Appl. Conf. (ASYU), 2022, pp.1–6, doi: 10.1007/s12652-020-02338-8. 10.1109/ASYU56188.2022.9925308. [29] Y. Cimtay and E"", "". ABSTRACT Emotion recognition based on EEG has been implemented in numerous studies. In most of them, there are two observations made: first, extensive implementation is negatively associated with the performed validation. Cross-subject validation is more difficult than subject-dependent validation due to thehighvariabilitybetweenEEGrecordingscausedbydomainshifts.Second,alargenumberofchannels requires extensive computation"", "". Thirdly, and 96.7% valence and arousal class accuracy, respectively. they combined DCERNET and SVM to achieve 88.10% These papers collectively contribute diverse approaches to valence class performance. Farokhah et al. [26] integrated EEG-basedemotionrecognition,eachdemonstratingpromisthe development of a simplified CNN architecture, the best ing results in addressing various challenges""]",True,"The DEAP dataset has been utilized in studies focusing on channel selection methods for EEG signals to enhance emotion recognition accuracy (Pandey & Seeja, 2021).","The retrieved reference discusses the use of the DEAP dataset in the context of EEG-based emotion recognition, which directly supports the claims made in the source paragraph regarding the dataset and its application."
107,"find the accuracy is shown in Eq. 2. Accuracy = TP + TN TP + TN + FP + FN (2) where TP, TN, FP, and FN are true positives, true negatives, false positives, and false negatives. The precision and recall are then evaluated, as shown in Eq. 3 and 4, respectively. Precision = Recall = TP TP + FP TP TP + FP (3) (4) The next evaluation is the F-score, which is a combination of accuracy between recall and precision. The F-score formula is shown in Eq. 5. F1score = 2(precision)(recall) recall + precision (5) In measuring the evaluation, eight scenarios will be used, as shown in Table 3. For inter-subject classification, it used leave one out subject",Multi-class Oil Palm Trees Condition Detection from UAV Images using Faster R-CNN with EfficientNetV2,"These metrics can be calculated by (1) – (3). This study's calculation of True Positive, False Positive, and False Negative differs from other classifications or detections.","["". These metrics can be calculated by (1) – (3). This study's calculation of True Positive, False Positive, and False Negative differs from other classifications or detections [20]-[23]. These are chosen and calculated following previous studies [1]. Precision detects the truly correct prediction out of all predictions. Recall detects the truly correct prediction out of all actual classes. F1 scores are harmonic mean between these two that measure overall model performance"", ""L.Farokhahetal.:Cross-SubjectChannelSelection FIGURE5. TrainingcurvesforValence.a.trainingandvalidationaccuracy. FIGURE6. Trainingcurvesforarousala.trainingandvalidationaccuracy. b.trainingandvalidationloss. b.trainingandvalidationloss. TABLE9. Cross-subjectperformanceoutcomeswithvaryinginput treatmentorchannelselectionmethod. inter-subject classification performance"", "". performance evaluation score, where the highest accuracy Following the definition in the previous paragraph, we plot is under 85%, the model needs further improvement so that the frequency of each misclassification type in Fig 13 and thedetectionvaliditycanbeenhancedandthatthedetection Fig 14"", ""classification validation have helped develop the motivation for this work which is [34],[35],[36]"", "". Complying withthemultitasklearningnature,twotargetlabelrepresentationsaredesignedtoleveragethesharedlowlevelcommonfeaturesoftheinputmessagesovervariousseveritylevels.Anextensiveexperimentwitha significant hyperparameter search space is performed to find the best-performing model to compare with several baselines and state-of-the-art methods from previous studies. The integrated gradient is employed to investigate the best-performing model’s trustworthiness and interpretability""]",True,"The calculation of True Positives, False Positives, and False Negatives, as well as the metrics of precision and recall, can be derived from established formulas (Referensi 1).","This reference directly discusses the calculation of True Positives, False Positives, and False Negatives, which aligns with the metrics and formulas presented in the source paragraph."
108,"82.45% in the valence and arousal classes, respectively. In the ReliefF method (R-HOLO-FM), it is 83.26% and 83.85% in the valence and arousal classes. This is different when using the proposed architecture, which results in increased performance accuracy on the NCA: 10.32% and 9.85% in the valence and arousal and ReliefF method classes, respectively, with a performance increase of 7.64% and 8.85% in the valence and arousal classes. The proposed channel selection method outperforms the other selection methods in the valence and arousal classes . The input for selecting the best channel for the proposed method uses EEG data to be classified, namely spectrogram data. The accuracy and loss plot results in Table 5 are shown in Figures 6, 7,",Cross-Subject Channel Selection Using Modified Relief and Simplified CNN-Based Deep Learning for EEG-Based Emotion Recognition,"These selected channels are then subjected to the EEG-based emotion recognition model (AP-CapsNet) with Morlet transform, transforming the data into 2D images that effectively encapsulate intricate temporal and spectral information.","["". DigitalObjectIdentifier10.1109/ACCESS.2023.3322294 Cross-Subject Channel Selection Using Modified Relief and Simplified CNN-Based Deep Learning for EEG-Based Emotion Recognition LIAFAROKHAH1,2,RIYANARTOSARNO 1,(SeniorMember,IEEE), ANDCHASTINEFATICHAH 1,(Member,IEEE) 1DepartmentofInformatics,FacultyofIntelligentElectricalandInformaticsTechnology,InstitutTeknologiSepuluhNopember(ITS),Surabaya60111,Indonesia"", ""L.Farokhahetal.:Cross-SubjectChannelSelection preponderanceofthepowerbandratioviathereliefmethod. [8] M.N.Munawar,R.Sarno,D.A.Asfani,T.Igasaki,andB.T.Nugraha, Third, collaboration of scalogram, PR-Relief for channel ‘‘Significant preprocessing method in EEG-based emotions classification,’’ J. Theor. Appl. Inf. Technol., vol. 87, no. 2, pp.176–190, selection, and simplified CNN for classification have pro2016. posed. In the proposed channel selection, the number of [9] Y. Wu, M. Xia, L. Nie, Y. Zhang, and A"", "". First, this study into studies focused racy in the valence class and 85% accuracy in the arousal on channel selection methods within EEG signals using the class. Pandey and Seeja conducted research using CNN DEAP dataset, encompassing a diverse array of techniques architecture, achieving 59% and 59% accuracy for valence aimedatisolatingthemostinformativechannelsforemotion and arousal, respectively [28]. Using Inception Resnet-V2, analysis"", "". These selected channels are then subjected to the EEG-based emotion recognition model (AP-CapsNet) with Morlettransform,transformingthedatainto2Dimagesthat subject-dependent and cross-subject experiments, achiev- effectivelyencapsulateintricatetemporalandspectralinforing high accuracies of 62.7% and 63.51% in valence and mation.Subsequently,employingasimplifieddeeplearning arousal class"", "". 10.1016/j.patrec.2022.08.018. [26] L. Farokhah, R. Sarno, and C. Fatichah, ‘‘Simplified 2D CNN archi[7] A.J.Bidgoly,H.J.Bidgoly,andZ.Arezoumand,‘‘Asurveyonmethods tecture with channel selection for emotion recognition using EEG andchallengesinEEGbasedauthentication,’’Comput.Secur.,vol.93, spectrogram,’’ IEEE Access, vol. 11, pp.46330–46343, 2023, doi: Jun.2020,Art.no.101788,doi:10.1016/j.cose.2020.101788. 10.1109/ACCESS.2023.3275565. 110148 VOLUME11,2023""]",True,"The proposed channel selection method utilizes EEG data transformed into 2D images for emotion recognition, achieving high accuracy in valence and arousal classifications (Farokhah et al., 2023).","The reference discusses the use of EEG data and the application of a specific model for emotion recognition, which aligns with the source paragraph's focus on channel selection methods and performance accuracy in valence and arousal classes."
109,predictions to the total test data. Models with high accuracy can predict new data correctly. Precision = TP TP + FP (5) Precision (5) is the ability to identify relevant data. High precision and accuracy can represent a better model. Recall = TP TP + FN (6) Recall (6) is the ability to find all relevant cases in a dataset. Recall can be explained by the success of the model in retrieving information. F1 − Score = 2 × Precision × Recall Precision + Recall (7) F1-Score (7) is an evaluation metric to determine the perfor- mance of the model accuracy against the dataset. F1-score is a calculation that involves a combination of precision and recall values. E. GENETIC ALGORITHM,Multi-class Oil Palm Trees Condition Detection from UAV Images using Faster R-CNN with EfficientNetV2,Precision detects the truly correct prediction out of all predictions. Recall detects the truly correct prediction out of all actual classes. F1 scores are harmonic mean between these two that measure overall model performance,"["". We applied various machine learning models, accurate predictions, as machine learning models learn from including Random Forest and XGBoost, to improve the the input data, following the principle of 'garbage-ingarbage-out' [29]. Once they complete the preprocessing steps, the data will be ready for the machine learning model. TABLE II. RESULTS TABLE OF THE FOUR KEY METRICS Metrics ID Description Value D"", "". In stage 1, theperformanceevaluationanalysisonsystemperformance has the form of average system performance (mAP, recall, andF1score)ontheobjectivefunctionaswellasthelowest lossvalue.Then,identifymultiplehyperparametercandidates thatperformwellonobjectivefunctionswithlowlossvalues and good system performance. Furthermore, stage 2 data processing in the Search-Space model has better system performanceandthelowestloss"", "". Anextensivehyperparametertuningisperformedtofindthe bestconfigurationforeachencodertype.Afterexperimenting DATAAVAILABILITY with all the resulting model configurations, the proposed The dataset used in the experiment is available upon a label schemas achieved the highest accuracy and improved reasonablerequest.Thecodefortheexperiment,theresulting thebaselinesandstate-of-the-artmodels’performancetested performance evaluation, the scripts for data analysis, and on filtered and unfiltered datasets"", "". These metrics can be calculated by (1) – (3). This study's calculation of True Positive, False Positive, and False Negative differs from other classifications or detections [20]-[23]. These are chosen and calculated following previous studies [1]. Precision detects the truly correct prediction out of all predictions. Recall detects the truly correct prediction out of all actual classes. F1 scores are harmonic mean between these two that measure overall model performance"", "". The research aims to provide practitioners with how modern technology evolved. Machine learning-based tools and workflow allowing efficient machine learning approaches have been adopted throughout science, development and deployment. They highlighted the technology, and industry, allowing a more evidence-based importance of sharing and reusing machine learning decision-making on different aspects of life [1]. Examples models""]",True,"The precision and recall metrics, which measure the accuracy of predictions and the ability to identify relevant cases, respectively, are essential for evaluating model performance, as highlighted in the study on multi-class oil palm tree condition detection (Reference 4).","This reference directly discusses precision, recall, and F1 scores, which are the specific metrics mentioned in the source paragraph, making it highly relevant."
110,"highly relevant to various incident cases, as shown in Fig 3. Not only is it highly relevant, but it is also highly prioritised evidence in diverse investigation cases. 2) Flight log messages cover events from the drone’s sensors, features, and components, making it one piece of evidence to perform analysis related to different drone software and hardware components. Therefore, analysing the log messages means analysing the whole device for various possible incident scenarios. 3) Flight log messages contain contextual information about the occurring event as a description that involves multiple parts of the drone simultaneously. For example, a certain circumstance fails a feature or an operation, as shown in message group number 4 in Table 1. TABLE 1. Groups of",Forensic Investigation of Drone Malfunctions with Transformer,"analysis of drone logs can also provide evidence that can be used in legal proceedings. This evidence can be particularly valuable in cases where there are disputes over liability, such caused by sensor failure, a broken motor, or CPU failure.","[""robust predictions, enabling drone operators to detect and Furthermore, Jain et al. [10] proposed a framework for diagnose malfunctions quickly and take corrective actions. sensor data identification and verification. An analysis of a Thestructureofthispaperisasfollows.SectionIIpresents drone’sarchitectureandaforensicmodelwithgenericfeatures previous research relating to the drone log analysis and drone are proposed here in order to enhance the digital investigation forensics"", "". DigitalObjectIdentifier10.1109/ACCESS.2024.3396926 Severity-Oriented Multiclass Drone Flight Logs Anomaly Detection SWARDIANTARASILALAHI 1,(GraduateStudentMember,IEEE), TOHARIAHMAD 1,(Member,IEEE),HUDANSTUDIAWAN 1,(Member,IEEE), EIRINIANTHI 2,ANDLOWRIWILLIAMS 2 1DepartmentofInformatics,InstitutTeknologiSepuluhNopember,Surabaya60111,Indonesia 2SchoolofComputerScienceandInformatics,CardiffUniversity,CF244AGCardiff,U.K"", "". The main ananomaly,aninvestigatorcanadjusttheanalysisobjectives contributionsofthispaperaresummarisedasfollows: targeting a certain level only, depending on the needs and cases. 1) Propose Drone Log Severity (DroLoVe), a severityAs shown in Fig. 1, the drone experiences several events oriented multiclass anomaly detection approach on during a flight. When analysing the flight logs from a droneflightlogdata"", "". There is yet to come incident scenarios to perform case studies to verify the a publicly available dataset of log messages from other performanceoftheproposedmethod,andmakingitpublicly dronemanufacturers.Severalpubliclyavailabledatasetsare available. 64264 VOLUME12,2024"", "". Most drone incidents are caused analysis of drone logs can also provide evidence that can be by bird attacks, collide with other drones, and malfunctioning used in legal proceedings. This evidence can be particularly systems.Sometimesthedronemayhaveamalfunctioningsystem valuable in cases where there are disputes over liability, such caused by sensor failure, a broken motor, or CPU failure. This cancauseanaccident.Therefore,aforensicinvestigationsupports as in cases of property damage or personal injury""]",True,"The analysis of drone logs can provide crucial evidence for legal proceedings, especially in cases involving disputes over liability due to sensor failures or malfunctions (Jain et al.).","The retrieved reference discusses the importance of analyzing drone logs as evidence in legal contexts, which directly supports the claims made in the source paragraph about the relevance and significance of flight log messages in investigations."
111,"To do so, several artefacts such as flight logs, images, videos, firmware logs, and controller applications can be analysed, as illustrated in Fig 1. For instance, GPS records can be utilised to reconstruct and analyse the path taken by the drone during a flight . The deviation between the empirical flight and reconstructed paths can happen if the drone encounters a GPS spoofing . Among the published drone forensics studies, popular works include case studies, evidence analysis, tools develop- ment, and forensic framework development . The widely investigated source of evidence is sensor data, such as GPS , which provides a concise diagnosis of a flight to the investigator when performing anomaly detection . In fact, a flight log not",Forensic Investigation of Drone Malfunctions with Transformer,"analyze the actions taken by these drones, identify their owners or operators, and extract data from associated mobile devices.","["". system(UAS)forensics:Dataextraction&analysis,’’ForensicSci.Int., [28] S.ViswanathanandZ.Baig,‘‘Digitalforensicsfordrones:Astudyoftools Digit.Invest.,vol.41,Jun.2022,Art.no.301379. andtechniques,’’inApplicationsandTechniquesinInformationSecurity, [6] E. Mantas and C. Patsakis, ‘‘GRYPHON: Drone forensics in dataflash L.BatinaandG.Li,Eds.Singapore:Springer,2020,pp.29–41. andtelemetrylogs,’’inAdvancesinInformationandComputerSecurity, [29] M. Debinski, F. Breitinger, and P. Mohan, ‘‘Timeline2GUI: N"", ""robust predictions, enabling drone operators to detect and Furthermore, Jain et al. [10] proposed a framework for diagnose malfunctions quickly and take corrective actions. sensor data identification and verification. An analysis of a Thestructureofthispaperisasfollows.SectionIIpresents drone’sarchitectureandaforensicmodelwithgenericfeatures previous research relating to the drone log analysis and drone are proposed here in order to enhance the digital investigation forensics"", "". with limitations and threats to validity. As drone forensics Furtherfuturestudiesmayincludeexploringthepossibility is an emerging topic, there are very limited public datasets of doing high-level oversampling to introduce the models available. The log messages used in this study are mainly with more log message patterns, producing a dataset with acquired from DJI-made devices"", "". theexperimentalresults,theTransformerobtainsthehighestF1 In the context of classifying drone malfunctions, the Transscore value of 93.04%. former model can be trained on a dataset of labeled drone Index Terms—drone forensics, forensic investigation, malfunctelemetry data to learn patterns and relationships between the tions, infrastructure, Transformer, Informer, FEDformer drone’s behavior and the root cause of a malfunction. The dataset can include features such as altitude, velocity, battery I"", "". Section III explains the proposed method, applying process. Also, Barton et al. [11] conducted the research to the Transformer technique to forensics of drone malfunctions. reconstruct the actions taken by these drones, identify their InSectionIV,thediscussionofperformancemethod,followed owners or operators, and extract data from associated mobile by conclusions and future works in Section V. devices. In other research in drone forensics, this paper also analyze II""]",True,"The analysis of drone actions and the identification of their operators can be supported by extracting data from associated mobile devices (Barton et al., 2022).","This reference discusses the analysis of drone actions and the extraction of relevant data, which directly supports the source paragraph's claim about using various artefacts for forensic investigation."
