user_input,retrieved_contexts,response,reference,faithfulness,answer_relevancy
"in improved validation results. Using the previous method, Res U-Net produced the best loss value in the validation set generated from the training dataset in 142 epochs. However, by using our proposed approach, the architecture achieves almost identical results, with a loss value of 0.6838005 over 125 epochs. Thereafter, it continues to improve and displays the best results at 152 epochs. The Dense U-Net result shows the most significant results. Since Dense U-Net requires higher computational power due to the dense block used, the training time of this architecture is generally slower than two other architectures. Using our proposed method, the network training time can be significantly faster. However, our method produces better segmentation results and requires a shorter training","['“Two-layer Ensemble of Deep Learning Models for Medical Image\nSegmentation,” Cognit. Comput., vol. 16, no. 3, pp. 1141–1160, 2024,\ndoi: 10.1007/s12559-024-10257-5.\n[20] D. P. Kingma and J. L. Ba, “Adam: A method for stochastic\noptimization,” 3rd Int. Conf. Learn. Represent. ICLR 2015 - Conf.\nTrack Proc., pp. 1–15, 2015.\n[21] A. C. Ian Goodfellow, Yoshua Bengio, “Deep Learning,” Prmu, pp. 1–\n10, 2016, [Online]. Available: www.deeplearningbook.org', 'in Section 3, also discussion, conclusion of this paper in\nSection 4\nII. MATERIAL AND METHODS\nIn this section, we describe the data set of MRI data\nsamples, pre-processing steps, U-net network architecture and\n3D patch based consisting of sub-chapters including training,\nuncertainty of whole segmentation, and post-processing steps\nused in this study. All pre-processing and post-processing\nsteps are used in both conventional machine learning and deep\nlearning.', '10427296.\n[10] Z. Wang, J.-Q. Zheng, Y. Zhang, G. Cui, and L. Li, “Mamba-UNet:\nUNet-Like Pure Visual Mamba for Medical Image Segmentation,” pp.\n1–12, 2024, [Online]. Available: http://arxiv.org/abs/2402.05079\n[11] H. Lu, Y. She, J. Tie, and S. Xu, “Half-UNet: A Simplified U-Net\nArchitecture for Medical Image Segmentation,” Front. Neuroinform.,\nvol. 16, no. June, pp. 1–10, 2022, doi: 10.3389/fninf.2022.911679.\n[12] H. Huang et al., “UNet 3+: A Full-Scale Connected UNet for Medical', 'L9&sig=9AkIZYQ6Jnz-Kx1V0G7xTKFmeig&redir_esc=y#v=\nonepage&q&f=false\n[38] O. Ronneberger, P. Fischer, and T. Brox, ‘‘U-Net: Convolutional networks\nfor biomedical image segmentation,’’ in Proc. Int. Conf. Med. Image\nComput. Comput.-Assist. Intervent (MICCAI), Oct. 2015, pp. 234–241.\nTRI A. SARDJONO was born in Surabaya,\nin 12 February 1970. He received the graduate\ndegree in electrical engineering and the degree\nin biomedical engineering program on health\nmanagement information system for community', 'by the two models. It is hoped that the results of this study\nwill provide new insights into the effectiveness of U-Net and\nLink-Net architectures in medical segmentation applications,\nas well as help medical personnel in observing abnormal\nstructures and movements in medical images.\nII. MATERIAL AND METHOD\nA. Review of Related Methods\n1) U-Net\nU-Net is an architecture of CNN used for image segmen-\ntation that was first introduced by [7] and has become a pop-']","U-Net is a convolutional neural network architecture that has been widely used for image segmentation tasks (Ronneberger et al., 2015).","num- ber of parameters is directly proportional to the results of the average loss and average accuracy in training and validation. The U-Net design performs better than Link-Net on average, with smaller training and validation loss values and higher training and validation accuracy values. Table 1 show that the average loss in U-Net is 21% greater than Link-Net, but with the sacrifice of longer training time. So that the Link-Net ar- chitecture provides more stable and parsimonious results. TABLE I. PERFORMANCE SUMMARY OF U-NET AND LINK-NET ARCHITECTURES Training Validation Model U-Net Link- Net Average Loss (St. Dev.) 0.0101 (0.0065) 0.0123 (0.0076) Average Accuracy (St. Dev.) 0.9956 (0.0027) 0.9948 (0.0027) Average Loss (St. Dev.) 0.0188 (0.0194) 0.0216 (0.0057) Average Accuracy (St.",1.0,0.8623488462657675
"company goals by proposing a novel recommendation system for internal business processes, grounded in the COBIT 2019 framework. The system employs graph algorithms to map relationships, semantic similarity measure- ments to align enterprise goals with management objectives, and LSTM combined with TF-IDF methods to analyze and recommend specific activities. Experimental results show that this system optimizes IT management practices, enhances operational efficiency, and ensures regulatory compliance. Additionally, a user-friendly graphical representation of internal business pro- cesses using Neo4j enables stakeholders to visualize complex relationships within the COBIT framework, facilitating informed decision-making. This research advances IT governance practices by providing organizations with a valuable tool to automate and improve IT strategies, effectively achieving business objectives. Index Terms—COBIT 2019, graph algorithms, IT","['to assess its capability to meet these criteria and can also\nserve as a reference for formulating policies to prioritize the\nimplementation of these activities in the future.\nV. CONCLUSION\nIn conclusion, the developed Activity Recommendation\nSystem based on COBIT 2019 framework offers a practical\nsolution to the challenges faced by auditors in identifying\nand aligning activities with company strategy. By leveraging\nNLP techniques and graph queries, the system efficiently', 'Frequency-Inverse Document Frequency (TF-IDF) calculation\nand measuring similarity between strategy nodes to identify\nrelevance and influence among strategy components. The main\noutput of this research is the ability of system to display a list\nof activities that need to be carried out by the company related\nto the inputted company strategy within the system.\nDownloaded on July 14,2025 at 08:18:28 UTC from IEEE Xplore. Restrictions apply.\nII. RESEARCH LITERATURE\nA. Previous Research', 'comprehensively, covering all systems regardless of their lo-\ncation within the organization.\nIn essence, Enterprise I&T extends beyond the confines of\ndn2\nthe IT department and encompasses all facets of technology\n4202\n979-8-3503-5161-3/24/$31.00 © 2024 IEEE\nAuthorized licensed use limited to: Institut Teknologi Sepuluh Nopember.\nRecommendation System of\nScorecard for COBIT 2019\nCompany Strategy\nInas Shabrina 3rd William Phedra\nof Informatics Department of Informatics', '10.1109/ICTKE55848.2022.9983238.\nAuthorized licensed use limited to: Institut Teknologi Sepuluh Nopember. Downloaded\nP. Kwak and R. I. Desanti, “IT Governance Evaluation Using COBIT\n2019 Framework in A Manufacturing Company,” in 2023 7th\nInternational Conference on New Media Studies (CONMEDIA), IEEE,\nDec. 2023, pp. 62–67. doi:\n10.1109/CONMEDIA60526.2023.10428517.\nM. Anjelina and Wella, “Information Technology Capability Using\nCOBIT 2019 Framework (Case Study: PT. Emobile Indonesia),” in', 'Computers, vol. 70, no. 8, pp. 1225–1238, 2021, doi:\n10.1109/TC.2021.3053199.\n[14] A. W. Pradipta and A. D. Manuputty, “Perancangan Tata Kelola [32]\nTeknologi Informasi Menggunakan COBIT 2019 Pada Dinas\nPerpustakaan Dan Kearsipan Kota Salatiga,” Journal of Software\nEngineering Ampera, vol. 3, no. 3, pp. 153–169, Oct. 2022.\n[15] P. Rozehnal and V. Novák, “Analysis of Processes Information Flows\nand Items as Additional Design Factor in COBIT Framework,” Central [33]']","The developed Activity Recommendation System based on the COBIT 2019 framework provides a practical solution for aligning activities with company strategy, which supports the optimization of IT management practices.","research introduces a novel Activity Recom- mendation System built on the COBIT 2019 framework tailored for Financial Balance Scorecard. The motivation stems from the challenges faced by auditors when identifying essential activities aligned with strategy of a company, often hindered by manual COBIT 2019 guideline navigation. To address this, a system was developed, where inputting the company strategy, triggers the display of recommended activities automatically. The methodology involved creating interconnected nodes from COBIT 2019 Element in Neo4J. This research uses a real strategy plan case study from 3 different companies as input, followed by a preprocessing step, then compares it to Enterprise Goals using TF-IDF and cosine similarity. Goals with high similarity scores trigger a graph query to reveal connected",0.6666666666666666,0.9140492197253043
"assist organizations in managing and optimizing their use of information technology (IT) . landscape, effective IT In today’s rapidly evolving digital governance is essential for organizations to ensure that their IT investments align with business objectives, comply with regulations, and mitigate risks . COBIT 2019 provides a structured approach for organiza- tions to establish, implement, and maintain effective gover- nance over IT. It defines the components necessary to create and sustain a governance system, as well as guidelines for building the most suitable governance system for an enterprise . By utilizing COBIT 2019, organizations can enhance the efficiency, effectiveness, and reliability of their IT usage, while also ensuring compliance with relevant regulations, policies, and standards . One of the key","['provided recommendations to enhance IT governance, em-\nphasizing effectiveness of COBIT 2019 in managing IT risks.\nThese studies highlight the benefits of framework in improving\nIT governance in educational institutions.\nResearch by [4] assessed the effectiveness of IT governance\nat Mandiri University using the COBIT 2019 framework.\nThe findings highlighted the critical role of IT governance\nin achieving organizational objectives and emphasized the\nimportance of implementing IT governance practices.', '[15], [16]. By utilizing the COBIT 2019 framework,\norganizations can prioritize processes, set target capability\nlevels, and design effective governance systems for IT\nprojects [17], [18]. Implementing COBIT 2019 in software\ndevelopment projects allows for mapping IT resources,\nprioritization of governance objectives, and alignment of\nbusiness and IT strategies, ultimately enhancing project\nsuccess. Additionally, the BAI approach emphasizes managed\norganizational change, which is crucial for preparing', '10.1109/ICTKE55848.2022.9983238.\nAuthorized licensed use limited to: Institut Teknologi Sepuluh Nopember. Downloaded\nP. Kwak and R. I. Desanti, “IT Governance Evaluation Using COBIT\n2019 Framework in A Manufacturing Company,” in 2023 7th\nInternational Conference on New Media Studies (CONMEDIA), IEEE,\nDec. 2023, pp. 62–67. doi:\n10.1109/CONMEDIA60526.2023.10428517.\nM. Anjelina and Wella, “Information Technology Capability Using\nCOBIT 2019 Framework (Case Study: PT. Emobile Indonesia),” in', 'Information System Governance using Framework COBIT 2019,” Int\nJ Comput Appl, vol. 174, no. 31, pp. 23–30, Apr. 2021, doi:\n10.5120/ijca2021921253.\n[4] A. C. Amorim, M. Mira da Silva, R. Pereira, and M. Gonçalves, “Using\nagile methodologies for adopting COBIT,” Inf Syst, vol. 101, p.\n101496, Nov. 2021, doi: 10.1016/j.is.2020.101496.\n[5] C. H. Heruatmadja, F. L. Gaol, S. H. Supangkat, and B. Ranti,\n“Ensuring Success in Quick Commerce by Evaluating Its Application', 'Jul. 2022, pp. 1–6. doi: 10.1109/ICCED56140.2022.10009924.\nW. Febriyani, F. R. Hendrawan, and T. F. Kusumasari, “Advancing\nTowards IT Maturity Governance Excellence: COBIT 2019 in Higher\nEducation (Indonesia),” in 2023 Eighth International Conference on\nInformatics and Computing (ICIC), IEEE, Dec. 2023, pp. 1–6. doi:\n10.1109/ICIC60109.2023.10382082.\non July 14,2025 at 08:18:28 UTC from IEEE Xplore. Restrictions apply.']",The effectiveness of COBIT 2019 in managing IT risks and enhancing IT governance has been emphasized in recent studies.,"process, an audit involves acquiring and objectively evaluating evidence related to allegations of economic activities and other operations. The aim is to assess the level of conformity between the reports and predefined criteria, and to communicate the results to relevant users, in this case, the organization responsible for establishing information system gover nan nance. One of the proven frameworks for information system auditing is the Control Objectives for Information and Related Technology (COBIT) 2019, which is utilized as the reference framework in this research . COBIT 2019 offers an effective methodology for evaluating the capability of information technology processes, specifically focusing on Deliver, Service and Support - Operation Management. This framework guarantees that the data (DSS01) is received, managed fully,",1.0,0.8945805421962634
"technology, thus helping them achieve their business objectives more effectively . Several previous papers still rely on manual approaches to COBIT 2019, which have limitations in providing automated recommendations for audit activities based on company goals. Thus, this research contributes significantly by addressing this gap and overcoming the challenges associated with manual COBIT utilization. The primary objective of this paper is to develop a rec- ommendation system that aligns with the internal business process strategy governed by COBIT 2019. This system aims to help organizations manage risk, ensure compliance, and enhance performance in the context of information technology. To achieve this, the research will utilize graph algorithms to build a recommendation system based on the internal business processes outlined in","['to assess its capability to meet these criteria and can also\nserve as a reference for formulating policies to prioritize the\nimplementation of these activities in the future.\nV. CONCLUSION\nIn conclusion, the developed Activity Recommendation\nSystem based on COBIT 2019 framework offers a practical\nsolution to the challenges faced by auditors in identifying\nand aligning activities with company strategy. By leveraging\nNLP techniques and graph queries, the system efficiently', 'management. Thus, audit with COBIT and process mining\nfrom event logs aids organizations in improving the reliability,\nDownloaded on July 14,2025 at 08:18:28 UTC from IEEE Xplore. Restrictions apply.\nsecurity, and operational efficiency of their information\nsystems.\nSungkono K et al., [13] explores the use of graphs to\nidentify incorrect judgments and patterns in corporate\noperations. This research aims to assist companies in\npreventing fraud by identifying anomalies in their business', ""mining enables auditors to delve into the event log data\ngenerated by information systems to visually map process\nflows. By combining these two approaches, auditors can\nconduct in-depth analyses of system compliance with COBIT\nstandards and identify noises from established procedures.\nThis integrated audit approach provides comprehensive\ninsights into the performance of the organization's information\nsystems, along with recommendations for more effective IT"", 'pp. 1–5. DOI: 10.1109/TSSA51342.2020.9310875.\n[4] H. Nurcahya, E. Setiawan, and B. Permana, “Information\ntechnology governance audit using cobit framework 2019\n(case study: Mandiri university),” Budapest International Re- [18]\nsearch and Critics Institute-Journal (BIRCI-Journal), vol. 5,\npp. 8030–8038, Feb. 2022. DOI: 10.33258/birci.v5i1.4566.\n[5] M. Damayanti and A. A. Chrismastuti, “Internal audit model\npost-erp implementation (enterprise resource planning) at pt [19]', 'mendation System built on the COBIT 2019 framework tailored\n00.13$/42/3-1615-3053-8-979 for Financial Balance Scorecard. The motivation stems from\nthe challenges faced by auditors when identifying essential\nactivities aligned with strategy of a company, often hindered\nby manual COBIT 2019 guideline navigation. To address this,\na system was developed, where inputting the company strategy,\ntriggers the display of recommended activities automatically. The']","The developed Activity Recommendation System based on the COBIT 2019 framework provides a practical solution for auditors in aligning activities with company strategy (Nurcahya et al., 2022).","process, an audit involves acquiring and objectively evaluating evidence related to allegations of economic activities and other operations. The aim is to assess the level of conformity between the reports and predefined criteria, and to communicate the results to relevant users, in this case, the organization responsible for establishing information system gover nan nance. One of the proven frameworks for information system auditing is the Control Objectives for Information and Related Technology (COBIT) 2019, which is utilized as the reference framework in this research . COBIT 2019 offers an effective methodology for evaluating the capability of information technology processes, specifically focusing on Deliver, Service and Support - Operation Management. This framework guarantees that the data (DSS01) is received, managed fully,",0.75,0.9223623916510951
"is linked to the appropriate business objec- tives and control needs, thus enhancing overall governance effectiveness . One effective way to perform this mapping is by utilizing a graph database such as Neo4j . Neo4j is a graph database specifically designed to store and manage data with complex relationships . In the context of COBIT 2019, Neo4j can be utilized to build dynamic graphical representations of various COBIT elements . By using Neo4j, organizations can create dynamic and interactive graphical models to better understand and manage the complex relationships between different COBIT 2019 elements . This allows for deeper analysis, real-time monitoring, and better decision-making in IT management, ultimately aiding in the achievement of business goals . In summary, this","['[15], [16]. By utilizing the COBIT 2019 framework,\norganizations can prioritize processes, set target capability\nlevels, and design effective governance systems for IT\nprojects [17], [18]. Implementing COBIT 2019 in software\ndevelopment projects allows for mapping IT resources,\nprioritization of governance objectives, and alignment of\nbusiness and IT strategies, ultimately enhancing project\nsuccess. Additionally, the BAI approach emphasizes managed\norganizational change, which is crucial for preparing', '10.1109/ICTKE55848.2022.9983238.\nAuthorized licensed use limited to: Institut Teknologi Sepuluh Nopember. Downloaded\nP. Kwak and R. I. Desanti, “IT Governance Evaluation Using COBIT\n2019 Framework in A Manufacturing Company,” in 2023 7th\nInternational Conference on New Media Studies (CONMEDIA), IEEE,\nDec. 2023, pp. 62–67. doi:\n10.1109/CONMEDIA60526.2023.10428517.\nM. Anjelina and Wella, “Information Technology Capability Using\nCOBIT 2019 Framework (Case Study: PT. Emobile Indonesia),” in', 'integrating the COBIT 2019 framework with an AI-powered\nsolution.\nIn this context, Control Objectives for Information and\nRelated Technologies (COBIT) is a well-recognized\nframework for enhancing enterprise IT governance, focusing\non effective governance, risk management, and resource\noptimization [6]. COBIT has several domains, including\nBuild, Acquire and Implement (BAI). This domain\nencompasses the management of projects related to IT\nservices acquisition and implementation. BAI11 focuses', 'Information System Governance using Framework COBIT 2019,” Int\nJ Comput Appl, vol. 174, no. 31, pp. 23–30, Apr. 2021, doi:\n10.5120/ijca2021921253.\n[4] A. C. Amorim, M. Mira da Silva, R. Pereira, and M. Gonçalves, “Using\nagile methodologies for adopting COBIT,” Inf Syst, vol. 101, p.\n101496, Nov. 2021, doi: 10.1016/j.is.2020.101496.\n[5] C. H. Heruatmadja, F. L. Gaol, S. H. Supangkat, and B. Ranti,\n“Ensuring Success in Quick Commerce by Evaluating Its Application', 'of Informatics Department of Informatics\nSepuluh Nopember Institut Teknologi Sepuluh Nopember\nIndonesia Surabaya, Indonesia\n6025231046@student.its.ac.id 6025231067@student.its.ac.id\n5th Kelly Rossa Sungkono\nDepartment of Informatics\nInstitut Teknologi Sepuluh Nopember\nSurabaya, Indonesia\nkelly@its.ac.id\nand information processing within the organization [1]. There\nare important elements in COBIT 2019 such as the Balanced\nScorecard (BSC), Enterprise Goals (EG), Alignment Goals']","Utilizing the COBIT 2019 framework allows organizations to prioritize processes and design effective governance systems, enhancing overall governance effectiveness (Optimizing IT Governance and Project Management in Software Development through AI Integration and COBIT 2019 Framework).","COBIT Core Model and Capability Scores, it is necessary to undergo a mapping process according to the instructions in the COBIT 2019 manual. This can be time-consuming, especially when auditor should auditing multiple companies simultaneously. This research aim to simplify the process to get Activities of COBIT 2019 automatically from Input Text Company Strategy that aligned with the description of related Enterprise Goals. This research adopts Neo4j, a graph database platform, to manage KG and process data related to these objectives, to gain deeper and more applicable insights into the relationships between strategic and operational objectives in a company . Furthermore, this research also involves the function of preprocessing the input text in the form of Company Strat- egy using",0.5,0.9249802563251616
"tool for processing sequential data and learning long-term dependencies, making it a crucial component in many applications of artificial intelligence and machine learn- ing. Choose Suitable Enterprise Goal based on Company Goal by using Similarity LSTM-TF IDF. III. METHODOLOGY III. METHODOLOGY This section outlines the methodology for developing a recommendation system based on COBIT 2019’s internal business processes. The approach integrates data collection, preprocessing, graph database modeling with Neo4j, and rec- ommendation generation using graph algorithms and similarity methods. The complete process shown in figure 1 A. Input Dataset The input dataset comprises information from the COBIT 2019 framework, including internal business processes, control objectives, IT processes, and related elements. Additionally, company-specific goals are incorporated to ensure that the recommendations","['Frequency-Inverse Document Frequency (TF-IDF) calculation\nand measuring similarity between strategy nodes to identify\nrelevance and influence among strategy components. The main\noutput of this research is the ability of system to display a list\nof activities that need to be carried out by the company related\nto the inputted company strategy within the system.\nDownloaded on July 14,2025 at 08:18:28 UTC from IEEE Xplore. Restrictions apply.\nII. RESEARCH LITERATURE\nA. Previous Research', 'Input Enterprise\nStrategy\nSimilarity\nPreprocessing\nMeasurement\nTokenizer\nGra p h Q u ery\nCalculate TF-IDF\nS e a r ch\nStop Word\nRemoval\nCalculate Cosine Activity List\nSimilarity\nLemmatization\nEND\nRecommendation System\n(cid:80)n\na b\nsimilarity(a, b) = i = 1 i i\ncosine (2)\n(cid:112)(cid:80)n (cid:112) (cid:80) n\na 2 b2\ni=1 i i=1 i\nWhere a and b are two vectors being compared, and n is\nthe number of dimensions in the vector space. This method\nis widely used in various libraries and frameworks, including', 'comprehensively, covering all systems regardless of their lo-\ncation within the organization.\nIn essence, Enterprise I&T extends beyond the confines of\ndn2\nthe IT department and encompasses all facets of technology\n4202\n979-8-3503-5161-3/24/$31.00 © 2024 IEEE\nAuthorized licensed use limited to: Institut Teknologi Sepuluh Nopember.\nRecommendation System of\nScorecard for COBIT 2019\nCompany Strategy\nInas Shabrina 3rd William Phedra\nof Informatics Department of Informatics', 'C. R. Berger, “Semantic modelling of organizational knowl-\nedge as a basis for enterprise data governance 4.0 – application\nto a unified clinical data model,” arXiv:2311.02082 [cs.AI],\n2023. DOI: 10.48550/arXiv.2311.02082.\nY. Setiawan, K. Sungkono, and R. Sarno, “A new similarity\nmethod based on weighted graph models for matching parallel\nbusiness process models,” International Journal of Intelligent\nEngineering and Systems, vol. 13, no. 5, pp. 267–276, 2020.\nDOI: 10.22266/ijies2020.1031.24.', 'organizations.\nDownloaded on July 14,2025 at 08:18:28 UTC from IEEE Xplore. Restrictions apply.\nTABLE IX [10]\nEXAMPLE OUTPUT RECOMMENDATION OF ACTIVITY\nInput Enterprise Activity\nGoals\nEG04 DSS05.02 ACT08\nSoftware Service Provider\nEG04 DSS05.03 ACT05\nCompany [11]\nEG04 DSS05.07 ACT03\nEG04 MEA01.01 ACT05\nIT Healthcare Company EG04 MEA01.02 ACT01\nEG04 MEA01.03 ACT04\n[12]\nVI. ACKNOWLEDGEMENT\nThis research was funded by Institut Teknologi Sepuluh\nNopember (ITS) under Penelitian Dana Departemen Program,']","The methodology includes a Frequency-Inverse Document Frequency (TF-IDF) calculation and measures similarity between strategy nodes to identify relevance and influence among strategy components (Inas Shabrina et al., 2024).","IX, it can serve as an internal reference for the company to assess its capability to meet these criteria and can also serve as a reference for formulating policies to prioritize the implementation of these activities in the future. V. CONCLUSION V. CONCLUSION In conclusion, the developed Activity Recommendation System based on COBIT 2019 framework offers a practical solution to the challenges faced by auditors in identifying and aligning activities with company strategy. By leveraging NLP techniques and graph queries, the system efficiently matches user input of company strategy with relevant activities automatically, eliminating the need for manual navigation through COBIT 2019 guidelines. The effectiveness of the system was demonstrated by in- putting company strategies from three companies in different",0.8,0.8820635965045811
"used as references for the next graph query execution to obtain the required activities. The output matches the mapping results, displaying only activities that correlate with Enterprise Goal EG02, which describes ”Optimization of business process functionality.” Using Algorithm 3, a graphical representation is created, as Fig. 3. Mapping Alignment Goals (AG) Fig. 4. Mapping Objectives illustrated in Figure 5. This graphical representation allows users to easily visualize the need for additional activity recommendations without documentation such as spreadsheets, thereby reducing the need for extra work. V. CONCLUSION V. CONCLUSION This paper propose a novel recommendation system for internal business processes based on the COBIT 2019 frame- work. By integrating graph algorithms and similarity methods, our approach provides tailored activity recommendations","['to assess its capability to meet these criteria and can also\nserve as a reference for formulating policies to prioritize the\nimplementation of these activities in the future.\nV. CONCLUSION\nIn conclusion, the developed Activity Recommendation\nSystem based on COBIT 2019 framework offers a practical\nsolution to the challenges faced by auditors in identifying\nand aligning activities with company strategy. By leveraging\nNLP techniques and graph queries, the system efficiently', 'organizations.\nDownloaded on July 14,2025 at 08:18:28 UTC from IEEE Xplore. Restrictions apply.\nTABLE IX [10]\nEXAMPLE OUTPUT RECOMMENDATION OF ACTIVITY\nInput Enterprise Activity\nGoals\nEG04 DSS05.02 ACT08\nSoftware Service Provider\nEG04 DSS05.03 ACT05\nCompany [11]\nEG04 DSS05.07 ACT03\nEG04 MEA01.01 ACT05\nIT Healthcare Company EG04 MEA01.02 ACT01\nEG04 MEA01.03 ACT04\n[12]\nVI. ACKNOWLEDGEMENT\nThis research was funded by Institut Teknologi Sepuluh\nNopember (ITS) under Penelitian Dana Departemen Program,', 'comprehensively, covering all systems regardless of their lo-\ncation within the organization.\nIn essence, Enterprise I&T extends beyond the confines of\ndn2\nthe IT department and encompasses all facets of technology\n4202\n979-8-3503-5161-3/24/$31.00 © 2024 IEEE\nAuthorized licensed use limited to: Institut Teknologi Sepuluh Nopember.\nRecommendation System of\nScorecard for COBIT 2019\nCompany Strategy\nInas Shabrina 3rd William Phedra\nof Informatics Department of Informatics', 'mendation System built on the COBIT 2019 framework tailored\n00.13$/42/3-1615-3053-8-979 for Financial Balance Scorecard. The motivation stems from\nthe challenges faced by auditors when identifying essential\nactivities aligned with strategy of a company, often hindered\nby manual COBIT 2019 guideline navigation. To address this,\na system was developed, where inputting the company strategy,\ntriggers the display of recommended activities automatically. The', 'matches user input of company strategy with relevant activities\nautomatically, eliminating the need for manual navigation\nthrough COBIT 2019 guidelines.\nThe effectiveness of the system was demonstrated by in-\nputting company strategies from three companies in different\nsectors. The system provided a list of recommended activities\nthat can be undertaken to achieve strategic objectives of each\ncompanies.\nMoving forward, there are opportunities to enhance and']","The developed Activity Recommendation System based on the COBIT 2019 framework offers a practical solution to the challenges faced by auditors in identifying and aligning activities with company strategy (Inas Shabrina, 2024).","research introduces a novel Activity Recom- mendation System built on the COBIT 2019 framework tailored for Financial Balance Scorecard. The motivation stems from the challenges faced by auditors when identifying essential activities aligned with strategy of a company, often hindered by manual COBIT 2019 guideline navigation. To address this, a system was developed, where inputting the company strategy, triggers the display of recommended activities automatically. The methodology involved creating interconnected nodes from COBIT 2019 Element in Neo4J. This research uses a real strategy plan case study from 3 different companies as input, followed by a preprocessing step, then compares it to Enterprise Goals using TF-IDF and cosine similarity. Goals with high similarity scores trigger a graph query to reveal connected",0.75,0.9201871133971475
"the need for extra work. V. CONCLUSION V. CONCLUSION This paper propose a novel recommendation system for internal business processes based on the COBIT 2019 frame- work. By integrating graph algorithms and similarity methods, our approach provides tailored activity recommendations that align with an organization’s strategic goals. We mapped enter- prise goals to management objectives, identified relevant ac- tivities, and used graph queries to retrieve actionable insights. Utilizing Cypher Query Language (CQL) and Neo4j’s graph database, we created an interactive graphical representation of COBIT 2019-governed processes. This allows organizations to visualize relationships between COBIT elements, facilitating deeper analysis, real-time monitoring, and informed IT man- agement decisions. Our results demonstrated the system’s effectiveness in sug- gesting activities tailored to enterprise goals,","['to assess its capability to meet these criteria and can also\nserve as a reference for formulating policies to prioritize the\nimplementation of these activities in the future.\nV. CONCLUSION\nIn conclusion, the developed Activity Recommendation\nSystem based on COBIT 2019 framework offers a practical\nsolution to the challenges faced by auditors in identifying\nand aligning activities with company strategy. By leveraging\nNLP techniques and graph queries, the system efficiently', 'C. R. Berger, “Semantic modelling of organizational knowl-\nedge as a basis for enterprise data governance 4.0 – application\nto a unified clinical data model,” arXiv:2311.02082 [cs.AI],\n2023. DOI: 10.48550/arXiv.2311.02082.\nY. Setiawan, K. Sungkono, and R. Sarno, “A new similarity\nmethod based on weighted graph models for matching parallel\nbusiness process models,” International Journal of Intelligent\nEngineering and Systems, vol. 13, no. 5, pp. 267–276, 2020.\nDOI: 10.22266/ijies2020.1031.24.', 'methodology involved creating interconnected nodes from COBIT\n2019 Element in Neo4J. This research uses a real strategy plan\ncase study from 3 different companies as input, followed by a\npreprocessing step, then compares it to Enterprise Goals using\n| TF-IDF and cosine similarity. Goals with high similarity scores\n)AIITCI(\ntrigger a graph query to reveal connected activities. The results\nshow a list of recommended activities based on the company', 'comprehensively, covering all systems regardless of their lo-\ncation within the organization.\nIn essence, Enterprise I&T extends beyond the confines of\ndn2\nthe IT department and encompasses all facets of technology\n4202\n979-8-3503-5161-3/24/$31.00 © 2024 IEEE\nAuthorized licensed use limited to: Institut Teknologi Sepuluh Nopember.\nRecommendation System of\nScorecard for COBIT 2019\nCompany Strategy\nInas Shabrina 3rd William Phedra\nof Informatics Department of Informatics', 'of Informatics Department of Informatics\nSepuluh Nopember Institut Teknologi Sepuluh Nopember\nIndonesia Surabaya, Indonesia\n6025231046@student.its.ac.id 6025231067@student.its.ac.id\n5th Kelly Rossa Sungkono\nDepartment of Informatics\nInstitut Teknologi Sepuluh Nopember\nSurabaya, Indonesia\nkelly@its.ac.id\nand information processing within the organization [1]. There\nare important elements in COBIT 2019 such as the Balanced\nScorecard (BSC), Enterprise Goals (EG), Alignment Goals']",The developed Activity Recommendation System based on the COBIT 2019 framework provides a practical solution for aligning activities with company strategy (Referensi 1).,"research introduces a novel Activity Recom- mendation System built on the COBIT 2019 framework tailored for Financial Balance Scorecard. The motivation stems from the challenges faced by auditors when identifying essential activities aligned with strategy of a company, often hindered by manual COBIT 2019 guideline navigation. To address this, a system was developed, where inputting the company strategy, triggers the display of recommended activities automatically. The methodology involved creating interconnected nodes from COBIT 2019 Element in Neo4J. This research uses a real strategy plan case study from 3 different companies as input, followed by a preprocessing step, then compares it to Enterprise Goals using TF-IDF and cosine similarity. Goals with high similarity scores trigger a graph query to reveal connected",0.6666666666666666,0.9302559647260171
"graphical representation of COBIT 2019-governed processes. This allows organizations to visualize relationships between COBIT elements, facilitating deeper analysis, real-time monitoring, and informed IT man- agement decisions. Our results demonstrated the system’s effectiveness in sug- gesting activities tailored to enterprise goals, enhancing IT management practices and operational efficiency. The Neo4j visualization tool offers a user-friendly interface for explor- ing COBIT framework relationships, enabling stakeholders to make data-driven decisions. TABLE III SIMILARITY SCORE Enterprise Goal (EG) Optimization of business process functionality Optimization of business process costs Staff skills, motivation and productivity Compliance with internal policies Similarity 0.5701785 0.29179826 0.02301607 0.029643951 M. M. Jawad, M. H. Ali, A. A. Khaleel, and M. F. Hasan, “Evaluating the performance of it management under the implementation","['[15], [16]. By utilizing the COBIT 2019 framework,\norganizations can prioritize processes, set target capability\nlevels, and design effective governance systems for IT\nprojects [17], [18]. Implementing COBIT 2019 in software\ndevelopment projects allows for mapping IT resources,\nprioritization of governance objectives, and alignment of\nbusiness and IT strategies, ultimately enhancing project\nsuccess. Additionally, the BAI approach emphasizes managed\norganizational change, which is crucial for preparing', 'methodology involved creating interconnected nodes from COBIT\n2019 Element in Neo4J. This research uses a real strategy plan\ncase study from 3 different companies as input, followed by a\npreprocessing step, then compares it to Enterprise Goals using\n| TF-IDF and cosine similarity. Goals with high similarity scores\n)AIITCI(\ntrigger a graph query to reveal connected activities. The results\nshow a list of recommended activities based on the company', '10.1109/ICTKE55848.2022.9983238.\nAuthorized licensed use limited to: Institut Teknologi Sepuluh Nopember. Downloaded\nP. Kwak and R. I. Desanti, “IT Governance Evaluation Using COBIT\n2019 Framework in A Manufacturing Company,” in 2023 7th\nInternational Conference on New Media Studies (CONMEDIA), IEEE,\nDec. 2023, pp. 62–67. doi:\n10.1109/CONMEDIA60526.2023.10428517.\nM. Anjelina and Wella, “Information Technology Capability Using\nCOBIT 2019 Framework (Case Study: PT. Emobile Indonesia),” in', 'of Informatics Department of Informatics\nSepuluh Nopember Institut Teknologi Sepuluh Nopember\nIndonesia Surabaya, Indonesia\n6025231046@student.its.ac.id 6025231067@student.its.ac.id\n5th Kelly Rossa Sungkono\nDepartment of Informatics\nInstitut Teknologi Sepuluh Nopember\nSurabaya, Indonesia\nkelly@its.ac.id\nand information processing within the organization [1]. There\nare important elements in COBIT 2019 such as the Balanced\nScorecard (BSC), Enterprise Goals (EG), Alignment Goals', 'ment Objective, based on COBIT guidelines, as demonstrated\nin TABLE II. A total of 1202 activities were found to correlate\nwith the Balanced Scorecard Financial perspective during the\nmapping process.\nB. Create Graph Database\nAfter the completion of the Mapping process, the next step\nis to create nodes and their relationships using Neo4J Graph\nDatabase Tools, in order to construct a Knowledge Graph from\nthe mapped results. The procedure for accomplishing this can']","The methodology involved creating interconnected nodes from COBIT 2019 elements using Neo4J, facilitating the visualization of relationships and enhancing IT management practices.","COBIT Core Model and Capability Scores, it is necessary to undergo a mapping process according to the instructions in the COBIT 2019 manual. This can be time-consuming, especially when auditor should auditing multiple companies simultaneously. This research aim to simplify the process to get Activities of COBIT 2019 automatically from Input Text Company Strategy that aligned with the description of related Enterprise Goals. This research adopts Neo4j, a graph database platform, to manage KG and process data related to these objectives, to gain deeper and more applicable insights into the relationships between strategic and operational objectives in a company . Furthermore, this research also involves the function of preprocessing the input text in the form of Company Strat- egy using",0.3333333333333333,0.9367832079661038
"(TP+FP). To determine how well a positive value is found, recall is employed. It applies true positives (TP) to all ground truth values, which include both true positives and false negatives (FN). The F1 score is an evaluation metric that combines a model’s precision and recall scores, as illustrated in the equation that calculates accuracy. The accuracy statistic computes the number of times the iYOLOV7-TPE-SS model predicted accurately throughout the entire dataset , : F1score = 2 · (P · R) (P + R) (13) The system performance of the iYOLOV7-TPE-SS model has been evaluated using a metric known as mean average accuracy (mAP), which takes into account the average recall (AR), F1-score, and inference time. The inference time has","['provides a comprehensive evaluation of the object detection\nmodel. mAP considers precision and recall values across\nDownloaded on July 14,2025 at 08:18:27 UTC from IEEE Xplore. Restrictions apply.\nTABLE II.\nF1 Score F1\nBackbone\nIoU@50\nResNet50v2 0.682\nResNet101 0.630\nMobileNetV3-Large 0.736\nEfficientNetV2-S 0.805\nTABLE III. PRECISION, RECALL,\nBackbone Metrics Healthy\nPrecision 0.970\nMobileNetV3-Large Recall 0.987\nF1 Score 0.978\nPrecision 0.985\nEfficientNetV2-S Recall 0.968\nF1 Score 0.977', 'error). In addition, mean average precision (mAP) is a widely\nused metric to evaluate the performance of object detection\nmodels. The mapping result represents the precision of the\nmodel in predicting an object. To obtain the mapping result,\nthe previously calculated precision and recall values are used\nto form a curve known as the precision-recall curve, which\nillustrates the trade-off between precision and recall at differ-\nent thresholds, providing insight into the model’s accuracy', 'model is suitable for detection tasks that prioritize the\naccuracy of object predictions in vehicle detection cases. In\nother hand, mobilenet v3 large model is suitable for detection\ntasks that prioritize detection speed in vehicle detection cases.\nTABLE II. SUMMARY COMPARISON OF MODEL EVALUATION\nModel Backbone Ap FPS\nFaster R-CNN ConvNext v1 Tiny 0.818 7\nFaster R-CNN Mobilenet v3 Large 0.303 18\nTABLE III. COMPARISON OF AVERAGE PRECISION IN MODEL\nModel Backbone Ap Ap50 Ap75', ""different IoU thresholds, capturing the model's ability to\ndetect objects with varying degrees of overlap between\npredicted and ground truth bounding boxes. Together, recall\nand mAP offer insights into the effectiveness of object\ndetection models, providing a robust assessment of their\nperformance across different thresholds and conditions.\nIV. RESULTS AND DISCUSSION\nThree variations were employed in the model for this\nexperiment. The first variation involved datasets detailing"", 'in the early layers. This study chose to adopt\nEfficientNetV2-S, the baseline architecture from this\nfamily, due to computational resource reasons to construct\na smaller model while still maintaining model performance.\nThe EfficientNetV1 family is the backbone of the\nEfficientDet family, which has achieved state-of-the-art\nresults on object detection challenges.\nC. Model Evaluation\nEvaluation Metrics used in this study to evaluate model\nperformance are precision, recall, and F1 Score. These']","The evaluation metrics employed in this study include precision, recall, and F1 Score, which are essential for assessing model performance (Multi-class Oil Palm Trees Condition Detection from UAV Images using Faster R-CNN with EfficientNetV2).","with the following formula: TP + TN TP + TN + FP + FN Accuracy = Precision = Recall/True Positive Rate(TPR) TP TP + FP TP TP + FN F1 = 2 × precision × recall precision + recall FP TN + TP (cid:90) 1 TPRd(FPR) False Positive Rate(FPR) = AUC = (4) (5) (6) (7) (8) (9) where TP is the number of correctly predicted positive labels, TN is the number of correctly predicted negative labels, FP is the number of incorrectly predicted positive labels, and FN is the number of incorrectly predicted negative labels. Accuracy is the ratio of true predictions to the overall data. Precision is the ratio between TP to the total number of positive predic-",0.8,0.909241700597935
"The interesting aspect of the stock transaction dataset is that the standard deviation from TPIA and BRPT is larger than the mean, which means that two stock issuers have high volatility. 2) DATASET OF NEWS HEADLINES The news portal kontan.co.id in the Indonesian language is used as a source of the news dataset with news published dates between 1 January 2017 and 31 May 2024. The news dataset contains the title, description, published date, and category gathered using scraping technique under sections investment, industry, and finance. This research uses the news section in the news portal as an aspect category. The rule of collecting the dataset is the stock issuer ticker is shown explicitly in the news title to distinguish","['January 2017 and March 2022 because of date range\nlimitations on news sentiment. As shown in Table 10, the\nproposed model TEGRU outperformed the previous model on\nMAPE score. The BMRI stock issuer had the lowest MAPE\nscore with an RMSE score of 167.52, lower by 51.50%\nthan the FEDformer architecture. SMMT and INDX issuers\ngained better performance than only using the technical\nindicator on stock forecasting.\n5) MULTIVARIATE EXPAND TECHNICAL AND ASPECT\nSENTIMENT INDICATOR (ETS)', 'TABLE 2. Example headlines news on each category and sentiment.\n2\ntop gain, are used. INDX, SMMT, and HITS are the issuers\nwith the highest gains in March 2022. Stock price forecasting\nuses a combination of extensive market capitalization and\nVOLUME 11, 2023\nA. T. Haryono et al.: Transformer-Gated Recurrent Unit Method for Predicting\nFIGURE 3. The architecture of the active learning model.\nTABLE 3. Issuer stock transaction statistical.\ntop gain issuers to validate the forecasting model on various', 'Art. no. 102741, doi: 10.1016/j.dsp.2020.102741.\n[28] E. Teti, M. Dallocchio, and A. Aniasi, ‘‘The relationship between Twitter\nand stock prices. Evidence from the US technology industry,’’ Technologi-\ncal Forecasting Social Change, vol. 149, Dec. 2019, Art. no. 119747, doi:\n10.1016/j.techfore.2019.119747.\n[29] N. Jing, Z. Wu, and H. Wang, ‘‘A hybrid model integrating deep\nlearning with investor sentiment analysis for stock price predic-\ntion,’’ Exp. Syst. Appl., vol. 178, Sep. 2021, Art. no. 115019, doi:', 'SENTIMENT INDICATOR (ETS)\nConcatenate expanded technical indicator and news sen-\ntiment produced 78 features to forecasting close stock\nprice in one day. Eq. (6) uses to make features with\nlower multicollinearity. The proposed model TEGRU and\nFEDformer equally outperformed on 4 of 8 stock issuers,\nas shown in Table 11. TEGRU best fitted on BBRI, TLKM,\nBMRI, and ASII, whereas FEDformer best fitted on BBCA,\nINDX, SMMT, and HITS. The best performance TEGRU\ngained by BBRI issuer with a 2.68 MAPE score, whereas', 'INDICATOR (CAS)\nThe features combined one technical indicator, the close\nprice, and 35 news sentiment indicators to forecast stock\nprice in a one-time step. Appropriate feature on each\nissuer produced by process removed feature with high\nVOLUME 11, 2023\nStock Price\nTABLE 11. Stock forecasting performance using the multivariate\ncombination of aspect sentiment and technical indicator dataset.\nmulticollinearity with Eq. (6). Data usage ranged between\nJanuary 2017 and March 2022 because of date range']","The dataset used for news sentiment analysis spans from January 2017 to March 2022, indicating a focus on the volatility of stock issuers during this period (A. T. Haryono et al., 2023).","DATASET A. DATASET This sub-section explains the collection, labeling, and prepa- ration of the dataset used in this research. The dataset consists of time series and text; each is prepared independently. 1) DATASET OF NEWS HEADLINES The text dataset used in this work was gathered from the Indonesian news portal at kontan.co.id under the categories investment, finance, industry, national, and international. The scraping technique collects data between 1 January 2017 to 31 March 2022 and produces a title, URL, description, postdate, category, and subcategory. Statistics from collected data are shown in Table 1. To evaluate performance prediction, task classification in text requires ground truth. The dataset already has ground truth for aspect categorization, but sentiment classification does not have the",0.6666666666666666,0.8972296941299706
"titles on each stock issuer based on aspect category. available in English. The trained model siebert/sentiment- roberta-large-english is a binary sentiment classification with an accuracy of 93.2% and is used to determine sentiment polarity, negative and positive. The news dataset contains news published date, aspect category, sentiment polarity, stock ticker, and news title. FIGURE 3. Framework of labeling aspect-sentiment quadruplet. The pair aspect category-sentiment polarity with news trained using various pre-trained models titles was such as indobert-large-p2 , mxbai-embed-large-v1 , multilingual-e5-large , distiluse-base-multilingual- to develop cased-v2 , and bge-base-en-v1.5 VOLUME 12, 2024 178677 A. T. Haryono et al.: pTKANs for Stock Price Forecasting Using Generative ABSA aspect categorization and sentiment classification models. The indobert-large-p2 model is specifically designed for Indonesians,","['construct aspect categorization and sentiment classification\nmodels with a scenario of split data are January 2017 to\nFebruary 2022 as data training and March 2022 as data\ntesting. Evaluation aspect categorization and sentiment\nVOLUME 11, 2023\nStock Price\nclassification models using confusion matrix and then\ncalculated into accuracy, recall, precision, and f1-score. The\npre-trained model with the best performance is used to build\nan active learning model.\nn\nX\nH(X) = H(p , . . . , p ) = − p log p (5)', 'english. The label sentiment complements the ground truth of\nthe headline news dataset. A trained model siebert/sentiment-\nroberta-large-english has an accuracy of 93.2% in a binary\nsentiment classification task, positive or negative. Table\nshows an example of a text dataset used to build a model.\nPre-processing phase, transform to lowercase, remove HTML\ntags, and remove the date. The BERT tokenizer is used to\ntokenize cleaned sentences.\n2) DATASET OF STOCK PRICES', 'SENTIMENT INDICATOR (ETS)\nConcatenate expanded technical indicator and news sen-\ntiment produced 78 features to forecasting close stock\nprice in one day. Eq. (6) uses to make features with\nlower multicollinearity. The proposed model TEGRU and\nFEDformer equally outperformed on 4 of 8 stock issuers,\nas shown in Table 11. TEGRU best fitted on BBRI, TLKM,\nBMRI, and ASII, whereas FEDformer best fitted on BBCA,\nINDX, SMMT, and HITS. The best performance TEGRU\ngained by BBRI issuer with a 2.68 MAPE score, whereas', 'forecasting correlation in close price and aspect sentiment\nindicator. All correlation values were under 0.9, which means\nthe features had a weak correlation. Industry, international,\ninvestment, finance, and national sentiment can influence\nstock issuers. The positive and negative sentiment with\na mostly minimum daily score is selected to increase\nperformance stock forecasting.\nVI. CONCLUSION AND FUTURE WORKS\nIn this paper, we presented quantifying multi-aspect news', 'TABLE 2. Example headlines news on each category and sentiment.\n2\ntop gain, are used. INDX, SMMT, and HITS are the issuers\nwith the highest gains in March 2022. Stock price forecasting\nuses a combination of extensive market capitalization and\nVOLUME 11, 2023\nA. T. Haryono et al.: Transformer-Gated Recurrent Unit Method for Predicting\nFIGURE 3. The architecture of the active learning model.\nTABLE 3. Issuer stock transaction statistical.\ntop gain issuers to validate the forecasting model on various']","The trained model siebert/sentiment-roberta-large-english achieves an accuracy of 93.2% in binary sentiment classification, as noted in the study by Haryono et al. (2023).","learning with VOLUME 11, 2023 77135 A. T. Haryono et al.: Transformer-Gated Recurrent Unit Method for Predicting Stock Price TABLE 1. Statistic dataset of headline news. TABLE 2. Example headlines news on each category and sentiment. FIGURE 2. The method of Indonesian headline news dataset sentiment labeling. an English language-trained model. The labeling method is shown in Fig. 2. The cleaned news title will be translated from Indonesian to English using a translator application. The resulting translated news title will be passed into the sentiment label- ing using a trained model siebert/sentiment-roberta-large- english. The label sentiment complements the ground truth of the headline news dataset. A trained model siebert/sentiment- roberta-large-english has an accuracy of 93.2% in a binary sentiment classification",0.75,0.9289106334357743
"using the mean sentiment score on each day trading, if not found, filled with zero value. The daily stock issuer sentiment score can be combined with stock transaction history. The illustration of the final dataset in the form of panel data is shown in Table. 2. D. FORECASTING MODELS D. FORECASTING MODELS This sub-section presents modified Transformer architec- ture, which are Transformer GRU (FormerGRU), Trans- former LSTM (FormerLSTM), Transformer Encoder GRU (TEGRU), and Transformer Encoder LSTM (TELSTM). Modified Transformer was chosen because TEGRU outper- formed other Transformer variants, such as vanilla Trans- former, Informer, FEDformer, and Transformer Encoder in stock price forecasting . This research proposes permuted Temporal Kolmogorov-Arnold Networks (pTKAN) architec- ture to develop a unified stock forecasting model","['VOLUME 11, 2023\nStock Price\nFIGURE 5. Architecture of Transformer Encoder-GRU stock forecasting\nmodel.\nInformer architecture [36]. In our experiment, the global time\nstamp embedding is daily to forecast stock prices the next day.\n3) FEDformer\nThe FEDformer architecture is built to resolve limitations\non trend capture in long-term time series forecasting. The\nFEDformer is a Transformer architecture integrated with a\nseasonal decomposition mechanism [15]. In Vanilla Trans-', 'price trends. Our experiment showed that the sentiment indicator\nincreased performance of the stock price forecasting model. The\ntransformer architecture on five feature scenarios. In addition,\nproduce low financial risk for each stock issuer.\nINDEX TERMS Active learning, financial loss, quantifying\ntransformer time series.\nI. INTRODUCTION\nSentiment analysis research is increasingly developing,\nmaking stock price analysis break through the limitation of', 'sentiment with considered time sequence data and then\nforecasting stock prices next days using sentiment and\ntechnical indicators. In feature extraction, a daily confidence\nscore from the classification model is used to quantify\nsentiment. The active learning model produced a monthly\nclassification model to represent model knowledge. The\nTransformer Encoder Gated Recurrent Unit (TEGRU) out-\nperformed another Transformer architecture for stock price\nforecasting on eight stock issuers. The TEGRU model', '10.1186/s40537-021-00495-x.\n[18] Z. Jin, Y. Yang, and Y. Liu, ‘‘Stock closing price prediction based on\nsentiment analysis and LSTM,’’ Neural Comput. Appl., vol. 32, no. 13,\npp. 9713–9729, Jul. 2020, doi: 10.1007/s00521-019-04504-2.\n[19] C. Li and G. Qian, ‘‘Stock price prediction using a frequency decompo-\nsition based GRU transformer neural network,’’ Appl. Sci., vol. 13, no.\np. 222, Dec. 2022, doi: 10.3390/app13010222.\n[20] M. D. Pratama, R. Sarno, and R. Abdullah, ‘‘Sentiment analysis user', 'The stock price as input data is transformed into another form\nusing Complete Ensemble Empirical Mode Decomposition\n(CEEMD). Then, the sequence matrix passes to GRU,\nLSTM, and Transformer layer [19]. Our research proposes\ncombination of Transformer and GRU architecture, in which\nthe Transformer is a learner of input features, and GRU is\nlearner of sequence data to predict stock prices. The input data\nis numerically represented by indicator technical and news\nsentiment in quantitative form.']","The Transformer Encoder Gated Recurrent Unit (TEGRU) model has been shown to outperform other Transformer architectures in stock price forecasting, specifically on eight stock issuers.","forecasting using Transformer Encoder Gated Recurrent Unit (TEGRU). The TEGRU can extract information with a multi-head attention layer and recognize pattern sequence data. The evaluation performance of the forecasting model uses Accuracy Mean Absolute Percentage Error (AcMAPE), which have sensitive to the misclassification of stock price trends. The significant contributions of this paper are summarized as follows. 1) The feature extraction method uses an active learning model to produce a multi-aspect sentiment indicator with time sequence data consideration to describe detailed stock market conditions. 2) The Transformer Encoder Gated Recurrent Unit (TEGRU) architecture, which consists of a Trans- former Encoder as extraction information and GRU as a recognized sequence data pattern, is used in stock price forecasting. 3) The Accuracy",1.0,0.9545237460376853
"and radial velocity detection of targets is not discussed yet. The contribution of this paper is in the receiver processing of CC-OFDM-MIMO radar, which is different from those in other types of OFDM MIMO radars or other multi-TRM radars due to the nature of the orthogonal multi-beam generation with Golay-coded OFDM waveforms and subbands. There are previous research on radar waveform for ISAC purposes , which discussed about cyclic prefix (CP) based OFDM waveform and how the CP is very much defining the maximum unambiguous range of the radar system. CC-OFDM MIMO radar waveform design which is discussed in this paper is not a CP based radar, the transmitters are transmitting multiple orthogonal symbols in series without any guard time","['VOLUME 10, 2022\nD. Kuswidiastuti et al.: Transmitter Design for Multibeam CC-OFDM Azimuth\nthe OFDM symbols, which in turn can extend the maxi-\nmum unambiguous range of the radar. The orthogonalities\nbetween OFDM subcarriers and between OFDM symbols\nallow OFDM radar to produce a range and Doppler profile\nindependent from each other [41]. This is one of the advan-\ntages of using OFDM instead of LFM as radar waveform. The\nabove considerations motivate the development of digitally', 'The receiver design of CC-OFDM radar, including the\nbeam, range and Doppler processing of the received signal\nwill be discussed in a separate paper.\nREFERENCES\n[1] M. I. Skolnik, Radar Handbook, 3rd ed. New York, NY, USA:\nMcGraw-Hill, 2008.\nVOLUME 10, 2022\nScanning MIMO Radar\n[2] C.A.Balanis,AntennaTheory:AnalysisandDesign,3rded.Hoboken,NJ,\nUSA: Wiley, 2012.\n[3] D. Gromek, P. Samczyński, J. Misiurewicz, M. Malanowski, K. Kulpa,\nA.Gromek,A.Gadós,A.Jarze¸bska,andM.Smolarczyk,‘‘Implementation', 'and fully describe the concept of CC-OFDM MIMO radar,\nwhile at the same time providing a realistic example of its use\nin a radar application, in the sequel we focus the discussion\non the design of a surveillance radar system. In the example,\nparameters of the CC-OFDM MIMO radars are determined\nso as to achieve a specified list of mission requirements.\nWe start the discussion with the motivation and princi-\nple of the CC-OFDM MIMO radar in Section II. To better\n53684', 'VOLUME 10, 2022\nD. Kuswidiastuti et al.: Transmitter Design for Multibeam CC-OFDM Azimuth\nthe aforesaid problem of limited time-on-target. Multi-beam\nradar technology is beneficial to various radar applications,\nsuch as surveillance [3], [4], automotive radar [5], [6], radar\nimaging [7], [8], joint multiuser communication and radar [9],\n[10], etc. In this paper, we are interested in multi-beam\nradar systems capable of covering a large angular swath with', '53684\net al.: Transmitter Design for Multibeam CC-OFDM Azimuth Scanning MIMO Radar\nexplain the concept, system and processes pertinent with the\nCC-OFDM MIMO radar, an example of long-range surveil-\nlance radar design is introduced in Section III. It is fol-\nlowed by Sections IV-VI that discuss the multi-beam pattern,\nthe PAPR issue and the ambiguity functions, taking the\nlong-range radar case as a reference. Discussions on the\ndesign results and the adoption of SDR concept for such']","The orthogonalities between OFDM subcarriers and symbols enable OFDM radar to generate range and Doppler profiles independently, which is a significant advantage in radar waveform design (Kuswidiastuti et al., 2022).","MIMO radar, intended to produce correlated waveforms with the purpose of acquiring better control over the beampattern. CC have been proposed for application in MIMO radars, originally for optimizing low sidelobes in MIMO radars employing LFM waveforms , but only recently the CC has gained attention in terms of in-depth analysis of LFM waveform optimization . Later in this paper, it can be seen that CC ﬁnd a different role as a consequence of their combination with OFDM waveforms. In this paper, a novel concept of CC-OFDM MIMO† radar is proposed as a solution for the wide-scanning multi-beam radar, which is based on the following principles. Firstly, a train of OFDM pulses are transmitted on an array of transmit antennas",1.0,0.9297526853979602
"much defining the maximum unambiguous range of the radar system. CC-OFDM MIMO radar waveform design which is discussed in this paper is not a CP based radar, the transmitters are transmitting multiple orthogonal symbols in series without any guard time interval between the symbols. to each other, hence The symbol series are orthogonal VOLUME 13, 2025 109895 D. Kuswidiastuti et al.: Receiver Processing of the Multibeam Azimuth Scanning CC-OFDM-MIMO Radar receivers know how to distinguish the symbols received, and this could extend the maximum unambiguous range of the radar. The contributions of this paper are described as follow: 1) This paper describes the receiver processing of multi- beam CC-OFDM MIMO Radar which is designed for long-range radar surveillance application. The","['VOLUME 10, 2022\nD. Kuswidiastuti et al.: Transmitter Design for Multibeam CC-OFDM Azimuth\nthe OFDM symbols, which in turn can extend the maxi-\nmum unambiguous range of the radar. The orthogonalities\nbetween OFDM subcarriers and between OFDM symbols\nallow OFDM radar to produce a range and Doppler profile\nindependent from each other [41]. This is one of the advan-\ntages of using OFDM instead of LFM as radar waveform. The\nabove considerations motivate the development of digitally', 'symbols and frames of symbols. Consequently, the adoption\nof the concept of software-defined radar (SDR) platform\nis advantageous and instrumental in the CC-OFDM MIMO\nradar, promotes the flexibility of the radar and opens up\nvarious possibilities of design applications.\nUsing the long-range surveillance radar introduced in\na Section III as reference, Fig. 5 shows the detailed proce-\ndure of CC-OFDM digital WG and coding block in Fig. 4.\nThe Golay code generator programmed in the SDR gener-', 'The receiver design of CC-OFDM radar, including the\nbeam, range and Doppler processing of the received signal\nwill be discussed in a separate paper.\nREFERENCES\n[1] M. I. Skolnik, Radar Handbook, 3rd ed. New York, NY, USA:\nMcGraw-Hill, 2008.\nVOLUME 10, 2022\nScanning MIMO Radar\n[2] C.A.Balanis,AntennaTheory:AnalysisandDesign,3rded.Hoboken,NJ,\nUSA: Wiley, 2012.\n[3] D. Gromek, P. Samczyński, J. Misiurewicz, M. Malanowski, K. Kulpa,\nA.Gromek,A.Gadós,A.Jarze¸bska,andM.Smolarczyk,‘‘Implementation', '53684\net al.: Transmitter Design for Multibeam CC-OFDM Azimuth Scanning MIMO Radar\nexplain the concept, system and processes pertinent with the\nCC-OFDM MIMO radar, an example of long-range surveil-\nlance radar design is introduced in Section III. It is fol-\nlowed by Sections IV-VI that discuss the multi-beam pattern,\nthe PAPR issue and the ambiguity functions, taking the\nlong-range radar case as a reference. Discussions on the\ndesign results and the adoption of SDR concept for such', 'LONG-RANGE SURVEILLANCE\nA. REQUIREMENTS\nTo elucidate the novel concept and detailed implementation\nof the CC-OFDM MIMO radar, we will take a surveillance\nradar design as an example for analyses in the subsequent\nsections. The CC-OFDM MIMO radar waveform designed\nherein is based on the requirement of surveillance radars\nused in coastal areas, where the target of interest are ships\nand small aircrafts in the area within 180 km from the radar\nsite. OFDM signals with subcarrier spacing of 10 KHz will']","The use of OFDM symbols can extend the maximum unambiguous range of the radar (Kuswidiastuti et al., 2022).","to realize high gain, which makes the production cost higher. In addition, when operating in beam- scanning mode, the time-on-target achieved by electronically scanning radars is limited. Multi-beam radars, in which multiple beams are formed simultaneously and continuously at both the transmitter and the receiver at different angular directions, can eliminate 53682 This work is licensed under a Creative Commons Attribution 4.0 License. For more information, see VOLUME 10, 2022 D. Kuswidiastuti et al.: Transmitter Design for Multibeam CC-OFDM Azimuth Scanning MIMO Radar the aforesaid problem of limited time-on-target. Multi-beam radar technology is beneﬁcial to various radar applications, such as surveillance , , automotive radar , , radar imaging , , joint multiuser communication and radar , , etc. In",1.0,0.9335559079445317
"the transmitters transmit a frame consisting of 12 consecutive symbols in series. The frame period is 1.2 ms, when the symbols are orthogonal, then the maximum unambiguous range is not only 15 km but 12 times longer (i.e. 180 km). CC-OFDM transmitter and receiver block diagram incor- porates simple transmit and receive modules. Fig. 1 depicts the block diagram of a transmit/receive (T/R) module, which is one out of 101 that constitute the MIMO transmitter system 109896 VOLUME 13, 2025 D. Kuswidiastuti et al.: Receiver Processing of the Multibeam Azimuth Scanning CC-OFDM-MIMO Radar FIGURE 1. Block diagram of a transmit receive module of CC-OFDM MIMO radar. TABLE 1. CC-OFDM MIMO radar system specifications for surveillance applications. of the surveillance radar.","['mission requirements. Finally, an example of the transmitter\ndesign for long-range surveillance radar has been described\nto clarify the concept and demonstrate the potential advan-\ntages of the CC-OFDM MIMO radar. By using the proposed\ndesign, a range resolution of 52 meter and an azimuth resolu-\ntion of 1.7◦ can be achieved. For the multi-beam scheme, the\nbeam isolation of −30 dB can be achieved for both between\nthe co-channel beams and between the neighboring beams.', 'surveillance radar has been described to clarify the con-\ncept and demonstrate the potential issues and advantages of\nthe CC-OFDM MIMO radar. The radar is designed using\n20.48 MHz bandwidth, which are divided into 8 sub bands\nwith a bandwidth of 2.56 MHz each. Therefore, the expected\nrange resolution of each beam is around 60 meters. From the\nambiguity function result, the range resolution requirement\nof less than 60 meter could be obtained both for broadside', 'LONG-RANGE SURVEILLANCE\nA. REQUIREMENTS\nTo elucidate the novel concept and detailed implementation\nof the CC-OFDM MIMO radar, we will take a surveillance\nradar design as an example for analyses in the subsequent\nsections. The CC-OFDM MIMO radar waveform designed\nherein is based on the requirement of surveillance radars\nused in coastal areas, where the target of interest are ships\nand small aircrafts in the area within 180 km from the radar\nsite. OFDM signals with subcarrier spacing of 10 KHz will', 'The receiver design of CC-OFDM radar, including the\nbeam, range and Doppler processing of the received signal\nwill be discussed in a separate paper.\nREFERENCES\n[1] M. I. Skolnik, Radar Handbook, 3rd ed. New York, NY, USA:\nMcGraw-Hill, 2008.\nVOLUME 10, 2022\nScanning MIMO Radar\n[2] C.A.Balanis,AntennaTheory:AnalysisandDesign,3rded.Hoboken,NJ,\nUSA: Wiley, 2012.\n[3] D. Gromek, P. Samczyński, J. Misiurewicz, M. Malanowski, K. Kulpa,\nA.Gromek,A.Gadós,A.Jarze¸bska,andM.Smolarczyk,‘‘Implementation', 'VOLUME 10, 2022\nD. Kuswidiastuti et al.: Transmitter Design for Multibeam CC-OFDM Azimuth\nthe OFDM symbols, which in turn can extend the maxi-\nmum unambiguous range of the radar. The orthogonalities\nbetween OFDM subcarriers and between OFDM symbols\nallow OFDM radar to produce a range and Doppler profile\nindependent from each other [41]. This is one of the advan-\ntages of using OFDM instead of LFM as radar waveform. The\nabove considerations motivate the development of digitally']","The use of OFDM symbols can extend the maximum unambiguous range of the radar, allowing for independent range and Doppler profiles due to the orthogonalities between OFDM subcarriers and symbols (D. Kuswidiastuti et al., 2022).","symbols and frame transmission and reception schedul- ing, including the low/high-power modes, beam processing at the receiver by parallel processing, range and Doppler processing involving OFDM symbols and frames. VOLUME 10, 2022 53683 D. Kuswidiastuti et al.: Transmitter Design for Multibeam CC-OFDM Azimuth Scanning MIMO Radar beamforming applications, SDR technology is preferred for its ﬂexibility and low cost , . In our case, the SDR implements all baseband processing at the transmitter and the receiver, including generating inter-element delay required for the application of CC at the transmitter. Beamforming design that meets the required maximum beamwidth in the azimuth is achieved by determining the suitable number of elements employed on the horizontal axis. A good beam pattern can be obtained",0.75,0.947258041059441
"for the n-th subcarrier for symbol a in beam b is given by gn,a,b, with the sampling period of Ts. The maximum unambiguous range, Rmax, will depend on the OFDM symbol period of T0. However, by transmitting Ns orthogonal symbols in series can extend the maximum range up to Ns times further. According to the waveform specification in Table 1, the 12 symbols are transmitted in series over 12T0 to extend the maximum range from 15 up to 180 km. The beams and the CC-OFDM symbols are Golay VOLUME 13, 2025 109897 D. Kuswidiastuti et al.: Receiver Processing of the Multibeam Azimuth Scanning CC-OFDM-MIMO Radar coded and transmitted using the allocated sub-band following a specific schedule that is well known","['VOLUME 10, 2022\nD. Kuswidiastuti et al.: Transmitter Design for Multibeam CC-OFDM Azimuth\nthe OFDM symbols, which in turn can extend the maxi-\nmum unambiguous range of the radar. The orthogonalities\nbetween OFDM subcarriers and between OFDM symbols\nallow OFDM radar to produce a range and Doppler profile\nindependent from each other [41]. This is one of the advan-\ntages of using OFDM instead of LFM as radar waveform. The\nabove considerations motivate the development of digitally', 'unique Golay codes for the beams which are transmitted\n53698\net al.: Transmitter Design for Multibeam CC-OFDM Azimuth Scanning MIMO Radar\nFIGURE 10. Ambiguity function as a function of Doppler frequency and\ntime delay variable τ when the target is at: (a) broadside, (b) the edge,\nand (c) the detailed observation on the doppler effect at θ = θ and τ = 0.\n0\nsimultaneously at the same symbol duration. All of these\narrangements are made to provide a high isolation between\nneighboring beams.', 'VOLUME 10, 2022\nD. Kuswidiastuti et al.: Transmitter Design for Multibeam CC-OFDM Azimuth\nthe aforesaid problem of limited time-on-target. Multi-beam\nradar technology is beneficial to various radar applications,\nsuch as surveillance [3], [4], automotive radar [5], [6], radar\nimaging [7], [8], joint multiuser communication and radar [9],\n[10], etc. In this paper, we are interested in multi-beam\nradar systems capable of covering a large angular swath with', '53696\net al.: Transmitter Design for Multibeam CC-OFDM Azimuth Scanning MIMO Radar\nradar example, we have I = I and N = N = 101 and the\np q t r\nambiguity function is analyzed for a(cid:48) = a,and b(cid:48) = b and due\nto orthogonality, it is analyzed when n = m and p = q.\nIn the following, various ambiguity functions, each a func-\ntion of beam, of delay and of Doppler frequency, are pre-\nsented with transmitter time, sub band and codes scheduling\nfor symbol-1 as visually described in Table 2. Based on', 'mission requirements. Finally, an example of the transmitter\ndesign for long-range surveillance radar has been described\nto clarify the concept and demonstrate the potential advan-\ntages of the CC-OFDM MIMO radar. By using the proposed\ndesign, a range resolution of 52 meter and an azimuth resolu-\ntion of 1.7◦ can be achieved. For the multi-beam scheme, the\nbeam isolation of −30 dB can be achieved for both between\nthe co-channel beams and between the neighboring beams.']","The use of OFDM symbols can extend the maximum unambiguous range of radar systems due to the orthogonalities between OFDM subcarriers and symbols, allowing for independent range and Doppler profiling (Kuswidiastuti et al., 2022).","the high PAPR of the OFDM signal. If orthogonal codes are given to successive OFDM symbols, it could also provide orthogonality between 53684 VOLUME 10, 2022 D. Kuswidiastuti et al.: Transmitter Design for Multibeam CC-OFDM Azimuth Scanning MIMO Radar the OFDM symbols, which in turn can extend the maxi- mum unambiguous range of the radar. The orthogonalities between OFDM subcarriers and between OFDM symbols allow OFDM radar to produce a range and Doppler proﬁle independent from each other . This is one of the advan- tages of using OFDM instead of LFM as radar waveform. The above considerations motivate the development of digitally generated beam steering without phase shifter, by providing phase control of the signal directly from waveform generation",0.75,0.9357701130548165
"The beams and the CC-OFDM symbols are Golay VOLUME 13, 2025 109897 D. Kuswidiastuti et al.: Receiver Processing of the Multibeam Azimuth Scanning CC-OFDM-MIMO Radar coded and transmitted using the allocated sub-band following a specific schedule that is well known by the transmitter and receiver. The neighboring beam must use different sub-band and sub-band reuse is allowed for beams that are at least 10◦ in separation. In order to generate CC-OFDM waveform, additional phase steering β(fn,a,b, (cid:49)tb) is given to the specified OFDM sub-band frequencies of beam b to provide phase difference between the transmit elements for creating the beam b. Circulating code in LFM MIMO radar which is discussed in , obtain this phase difference by transmitting coherent signals","['VOLUME 10, 2022\nD. Kuswidiastuti et al.: Transmitter Design for Multibeam CC-OFDM Azimuth\nthe aforesaid problem of limited time-on-target. Multi-beam\nradar technology is beneficial to various radar applications,\nsuch as surveillance [3], [4], automotive radar [5], [6], radar\nimaging [7], [8], joint multiuser communication and radar [9],\n[10], etc. In this paper, we are interested in multi-beam\nradar systems capable of covering a large angular swath with', 'VOLUME 10, 2022\nD. Kuswidiastuti et al.: Transmitter Design for Multibeam CC-OFDM Azimuth\nthe OFDM symbols, which in turn can extend the maxi-\nmum unambiguous range of the radar. The orthogonalities\nbetween OFDM subcarriers and between OFDM symbols\nallow OFDM radar to produce a range and Doppler profile\nindependent from each other [41]. This is one of the advan-\ntages of using OFDM instead of LFM as radar waveform. The\nabove considerations motivate the development of digitally', 'the available bandwidth is limited, so that there are\nbeams which are transmitted simultaneously using the\nVOLUME 10, 2022\nD. Kuswidiastuti et al.: Transmitter Design for Multibeam CC-OFDM Azimuth\nsame frequency. This will cause couplings between\nthe co-channel beams. Hence, in the scheduling of the\nsub band frequency reuse, the beam spacing between\nco-channel beams must be long enough to minimize the\ncoupling effects.\nIX. CONCLUSION\nA transmitter design for CC-OFDM MIMO radar has been', 'The receiver design of CC-OFDM radar, including the\nbeam, range and Doppler processing of the received signal\nwill be discussed in a separate paper.\nREFERENCES\n[1] M. I. Skolnik, Radar Handbook, 3rd ed. New York, NY, USA:\nMcGraw-Hill, 2008.\nVOLUME 10, 2022\nScanning MIMO Radar\n[2] C.A.Balanis,AntennaTheory:AnalysisandDesign,3rded.Hoboken,NJ,\nUSA: Wiley, 2012.\n[3] D. Gromek, P. Samczyński, J. Misiurewicz, M. Malanowski, K. Kulpa,\nA.Gromek,A.Gadós,A.Jarze¸bska,andM.Smolarczyk,‘‘Implementation', '53691\nD. Kuswidiastuti\nFIGURE 4. Block diagram of a T-R module of CC-OFDM MIMO radar system.\nFIGURE 5. CC-OFDM digital WG and coding for symbol 1 in beam b = −31\nbaseband to the first IF. Each sub-band consists of 256 subcarriers.\n53692\net al.: Transmitter Design for Multibeam CC-OFDM Azimuth Scanning MIMO Radar\non the p-th transmitter, which also involves digital up-conversion from\nVOLUME 10, 2022\nD. Kuswidiastuti et al.: Transmitter Design for Multibeam CC-OFDM Azimuth']","The orthogonalities between OFDM subcarriers and symbols enable the CC-OFDM radar to produce independent range and Doppler profiles, which is essential for effective beam processing (Kuswidiastuti et al., 2022).","beams pointing at increasing scan angles. In a previous patent , simultaneous multiple beams are generated using OFDM multiple antennas being fed at different points along a trans- mission line providing delay or phase differences between successive antennas, but the use of such a physical delay source limits its capability and ﬂexibility. On the other hand, OFDM signals with various delays can be produced with CC by ﬂexibly exploiting a programmable waveform gener- ator (WG). In the CC-OFDM MIMO radar, a novel technique can be used further to mitigate beam broadening for large scanning angles. In a way, the strategy of CC-OFDM MIMO radar can be viewed as a realization of hybrid between phased array and MIMO techniques , .",0.6666666666666666,0.9531386361092364
"the specified OFDM sub-band frequencies of beam b to provide phase difference between the transmit elements for creating the beam b. Circulating code in LFM MIMO radar which is discussed in , obtain this phase difference by transmitting coherent signals with a small time delay difference ((cid:49)tb) between the antenna element. However, using an OFDM signal, this phase steering can be provided by giving a phase difference to the OFDM subcarrier phase in the frequency domain of the OFDM signal generation stage. The phase steering given to the CC-OFDM waveform can be defined as follow: β(fn,a,b, (cid:49)tb) = 2πfn,a,b(cid:49)tb Hence, the array factor of CC-OFDM will be: AF(θ, fn,a,b, (cid:49)tb) = Nt −1 2X Ipejp(α(θ)+β(fn,a,b,(cid:49)tb) where α(θ) = p=− Nt","['generated beam steering without phase shifter, by providing\nphase control of the signal directly from waveform generation\nstage by using OFDM as radar waveform.\nAs given in (2), adopting the CC scheme produces a beam\npattern, essentially like a phased array with phase differ-\nences between elements. When multicarrier OFDM signals\nare transmitted from multiple antennas with a specified time\ndelay difference of (cid:49)t, each (cid:49)t value produces a beam', 'The receiver design of CC-OFDM radar, including the\nbeam, range and Doppler processing of the received signal\nwill be discussed in a separate paper.\nREFERENCES\n[1] M. I. Skolnik, Radar Handbook, 3rd ed. New York, NY, USA:\nMcGraw-Hill, 2008.\nVOLUME 10, 2022\nScanning MIMO Radar\n[2] C.A.Balanis,AntennaTheory:AnalysisandDesign,3rded.Hoboken,NJ,\nUSA: Wiley, 2012.\n[3] D. Gromek, P. Samczyński, J. Misiurewicz, M. Malanowski, K. Kulpa,\nA.Gromek,A.Gadós,A.Jarze¸bska,andM.Smolarczyk,‘‘Implementation', 'radar,’’ IEEE Sensors J., vol. 20, no. 3, pp. 1485–1498, Feb. 2020, doi:\n10.1109/JSEN.2019.2946643.\n[34] K. V. Caekenberghe, K. Brakora, and K. Sarabandi, ‘‘OFDM frequency\nscanning radar,’’ Google Patent US7994969 B2, Sep. 21, 2007.\n[35] A. Hassanien and S. A. Vorobyov, ‘‘Phased-MIMO radar: A tradeoff\nbetween phased-array and MIMO radars,’’ IEEE Trans. Signal Process.,\nvol. 58, no. 6, pp. 3137–3151, Jun. 2010, doi: 10.1109/TSP.2010.2043976.', 'ified delay between successive antennas of a MIMO radar,\nintended to produce correlated waveforms with the purpose\nof acquiring better control over the beampattern. CC have\nbeen proposed for application in MIMO radars, originally\nfor optimizing low sidelobes in MIMO radars employing\nLFM waveforms [32], but only recently the CC has gained\nattention in terms of in-depth analysis of LFM waveform\noptimization [33]. Later in this paper, it can be seen that CC', 'INDEX TERMS MIMO radar, parameter estimation, phased\ndetection.\nI. INTRODUCTION\nMulti-antenna radar systems have been known and used in\nvarious applications since 1930s. The most common type is\none with phased array (PA), in which multiple elements are\nfed with different phases to obtain a high coherent gain at\na certain direction [1]–[3]. With this advantage, PA radars\nhave been used for such applications as micro-scale radars\nThe associate editor coordinating the review of this manuscript and']","The CC-OFDM radar system achieves beam steering by directly controlling the phase of the signal during the waveform generation stage, eliminating the need for phase shifters.","signal is circulated from one antenna element to another with a relatively small time-delay differ- ence ((cid:49)t), made possible by circulating codes (CC) , , . Hence the transmit signal from the p-th element for a transmit antenna array with an odd number of elements, Nt , can be written as: xp(t) = x(t − p(cid:49)t), Nt − 1 , . . . , Nt − 1 (1) The time delay difference of the circulating signal corre- sponds to a phase difference between the antenna elements at a given frequency: (cid:49)ϕ = 2πf (cid:49)t (2) It means that the phase steering that is usually provided by a phase shifter at each antenna element now can be realized directly in the",1.0,0.9388114813111293
"together with transmit scheduling to avoid transmit receive coupling. The receive scheduling is also related to the time scheduling of the correlation between symbols, which is an important stage in the beam and range processing. The transmit and receive time schedule of CC-OFDM radar is described in Fig. 4. The receive scheduling is very important, especially in a multiple target scheme. The echo signals caused by two or more targets at different ranges (i.e., one target is near to the radar, and the other is far) could cause range ambiguity. The clock synchronization between the multiple transmitters and the multiple receivers of CC-OFDM radars are very crucial to guarantee that the receiver can give the accurate detection. It can be","['VOLUME 10, 2022\nD. Kuswidiastuti et al.: Transmitter Design for Multibeam CC-OFDM Azimuth\nthe aforesaid problem of limited time-on-target. Multi-beam\nradar technology is beneficial to various radar applications,\nsuch as surveillance [3], [4], automotive radar [5], [6], radar\nimaging [7], [8], joint multiuser communication and radar [9],\n[10], etc. In this paper, we are interested in multi-beam\nradar systems capable of covering a large angular swath with', 'VOLUME 10, 2022\nD. Kuswidiastuti et al.: Transmitter Design for Multibeam CC-OFDM Azimuth\nthe OFDM symbols, which in turn can extend the maxi-\nmum unambiguous range of the radar. The orthogonalities\nbetween OFDM subcarriers and between OFDM symbols\nallow OFDM radar to produce a range and Doppler profile\nindependent from each other [41]. This is one of the advan-\ntages of using OFDM instead of LFM as radar waveform. The\nabove considerations motivate the development of digitally', 'receiver could properly detect and distinguish targets\nnearby and far away from the radar.\nIn this paper we describe the waveform design of\na CC-OFDM quasi-continuous wave for MIMO long\nrange radar. Quasi-CW transmission could limit the\nVOLUME 10, 2022\nScanning MIMO Radar\nleakage/coupling problem by time-isolation of the transmis-\nsion and reception of the radar system as in a pulse radar sys-\ntem, while it also has the advantage of a CW radar that has a', 'The receiver design of CC-OFDM radar, including the\nbeam, range and Doppler processing of the received signal\nwill be discussed in a separate paper.\nREFERENCES\n[1] M. I. Skolnik, Radar Handbook, 3rd ed. New York, NY, USA:\nMcGraw-Hill, 2008.\nVOLUME 10, 2022\nScanning MIMO Radar\n[2] C.A.Balanis,AntennaTheory:AnalysisandDesign,3rded.Hoboken,NJ,\nUSA: Wiley, 2012.\n[3] D. Gromek, P. Samczyński, J. Misiurewicz, M. Malanowski, K. Kulpa,\nA.Gromek,A.Gadós,A.Jarze¸bska,andM.Smolarczyk,‘‘Implementation', 'radar,’’ IEEE Sensors J., vol. 20, no. 3, pp. 1485–1498, Feb. 2020, doi:\n10.1109/JSEN.2019.2946643.\n[34] K. V. Caekenberghe, K. Brakora, and K. Sarabandi, ‘‘OFDM frequency\nscanning radar,’’ Google Patent US7994969 B2, Sep. 21, 2007.\n[35] A. Hassanien and S. A. Vorobyov, ‘‘Phased-MIMO radar: A tradeoff\nbetween phased-array and MIMO radars,’’ IEEE Trans. Signal Process.,\nvol. 58, no. 6, pp. 3137–3151, Jun. 2010, doi: 10.1109/TSP.2010.2043976.']","The receiver design of CC-OFDM radar enables the proper detection and distinction of targets at varying ranges, addressing the issue of range ambiguity (Kuswidiastuti et al., 2022).","In our case, quasi-continuous transmission is used through proper scheduling of OFDM transmission and echoes reception to prevent the coupling. • The receiver that continuously receives signal echoes coming from multiple targets must be able to distinguish which targets are very near or very far from the radar. This is the reason in this paper that orthogonal codes are given to successive CC-OFDM symbols. These unique codes are given and known by the receiver, so that the receiver could properly detect and distinguish targets nearby and far away from the radar. In this paper we describe the waveform design of a CC-OFDM quasi-continuous wave for MIMO long the range radar. Quasi-CW transmission could limit leakage/coupling problem by time-isolation of the",0.6666666666666666,0.9299819038868553
"correlation function between the received signals with the reference signal can be derived as follow: χyx(θ, θ ′, τ, τ0, fD) = σ ejϑ R4 2NsT0X (cid:26) (Nt −1) 2X (Nt −1) 2X k=0 p=− (Nt −1) q=− (Nt −1) {IpIqejpα(θ)e−jqα(θ ′) Nc−1 Nc−1 n=0 m=0 (cid:26) Cn,p,a,bC ∗ m,q,a′,b′gn,a,bgm,a′,b′ × ej2πkTs(fIF +fn,a,b+fD) × e−j2πkTs(fIF +fm,a′,b′ ) × ej2πfn,a,b[p(cid:49)tb−(a−1)T0] × e−j2πfm,a′,b′ [q(cid:49)tb−(a′−1)T0]ej2π(τ −τ0)(fIF +fn,a,b) (cid:27)(cid:27) (14) PNc−1 Because the subcarrier frequency of the OFDM signal and the Golay codes are orthogonal, then the term PNc−1 m=0 gn,a,bgm,a′,b′ = 0 for n ̸= m, a ̸= a′, n=0 or b ̸= b′, hence the cross correlation, χyx(θ, θ ′, τ, τ0, fD) will be zero. The correlation function value will be","['symbols, which can be realized using the Golay codes pre-\nviously chosen to mitigate PAPR. Moreover, the use of mul-\ntiple orthogonal OFDM symbols in coherent processing can\n53685\nD. Kuswidiastuti\nimprove the Doppler resolution of the radar. Up to this point\nGolay codes play three important roles in CC-OFDM radar.\nThe codes help to lower the PAPR of the OFDM signals,\nprovide orthogonalities between the beams and achieve the\nsame for the serially transmitted symbols.\nB. PRINCIPLE OF CC-OFDM MIMO RADAR', 'good signal-to-noise power ratio (SNR) in a beam pointing\ntoward the direction of a target can be achieved by trans-\nmitting a frame consisting of a number of OFDM symbols,\nwhose echoes that arrive in overlap at the receiver are orthog-\nonal to each other. This is achieved by extending the use of\nthe Golay codes to orthogonalization of different symbols in\na frame in the same beam. Doppler detection can further be\naccomplished by transmitting a frame of symbols repeatedly', 'subcarrier interleaving technique [30], and by using a coded\nVOLUME 10, 2022\nScanning MIMO Radar\nOFDM MIMO waveform [31]. A set of orthogonal wave-\nforms can be simply acquired by arranging the allocation of\northogonal subcarriers into different antennas of the MIMO\nradar system. In this radar, the pulse width or the OFDM\nsymbol duration is obtained as the inverse of the subcarrier\nspacing.\nAnother key element of our proposed radar system is the\ncirculating codes (CC), which are applied by imposing a spec-', 'aspects are detailed.\n• Single CC OFDM symbol\nIn this example, one symbol of CC-OFDM waveform\ncontributes to 63 beam signals. The 63 beam signals\nare carried by a limited number of sub-bands. Hence\nit is crucial to have a unique Golay code for each of\nthe 63 beams. In the surveillance radar design, there are\nonly 8 sub-bands available and, hence, each sub-band is\ntransmitting 7 to 8 beams at the same time.\n• Multiple CC OFDM symbols\nThe orthogonality between symbols is provided by dif-', 'unique Golay codes for the beams which are transmitted\n53698\net al.: Transmitter Design for Multibeam CC-OFDM Azimuth Scanning MIMO Radar\nFIGURE 10. Ambiguity function as a function of Doppler frequency and\ntime delay variable τ when the target is at: (a) broadside, (b) the edge,\nand (c) the detailed observation on the doppler effect at θ = θ and τ = 0.\n0\nsimultaneously at the same symbol duration. All of these\narrangements are made to provide a high isolation between\nneighboring beams.']","The use of multiple orthogonal OFDM symbols in coherent processing can enhance the Doppler resolution of the radar (Kuswidiastuti, 2022).","frequency fa,n,b of the b-th beam, and C (cid:48)∗ m,q,a(cid:48),b(cid:48) denotes the complex conjugate of the correction phase of the received CC-OFDM symbols, given to the m-th carrier frequency of b(cid:48)-th beam, which use subcarrier fa(cid:48),m,b(cid:48). For the surveillance In the following, various ambiguity functions, each a func- tion of beam, of delay and of Doppler frequency, are pre- sented with transmitter time, sub band and codes scheduling for symbol-1 as visually described in Table 2. Based on the ambiguity function formulation in (32), the analyses are described as follows: i. χa(cid:48)=a=1,b(cid:48)=b(τ = 0, fD = 0, θ0, θ, (cid:49)tb) is the radar ambiguity function analyzed by taking a variable value of θ0 as a function of angular variable, θ.",0.5,0.9061454894366086
"B. DOPPLER PROCESSING SIMULATION AND ANALYSIS B. DOPPLER PROCESSING SIMULATION AND ANALYSIS In this subsection, the Doppler processing of a moving target is analyzed. For the Doppler processing in this paper, we set VOLUME 13, 2025 109903 D. Kuswidiastuti et al.: Receiver Processing of the Multibeam Azimuth Scanning CC-OFDM-MIMO Radar echoes received from targets. Beams that receive echoes by targets in their respective directions can be identified correctly by correlating the sum of signals containing echoes from all receive modules with individual signals transmitted individual beams. Correlations are done per symbol, and after delay compensation, coherence processing is done for all the 12 symbols. The simulation results based on the detection of 2 targets at 3 different scenarios show that","['53684\net al.: Transmitter Design for Multibeam CC-OFDM Azimuth Scanning MIMO Radar\nexplain the concept, system and processes pertinent with the\nCC-OFDM MIMO radar, an example of long-range surveil-\nlance radar design is introduced in Section III. It is fol-\nlowed by Sections IV-VI that discuss the multi-beam pattern,\nthe PAPR issue and the ambiguity functions, taking the\nlong-range radar case as a reference. Discussions on the\ndesign results and the adoption of SDR concept for such', 'Aerosp. Electron. Syst., vol. 53, no. 6, pp. 2998–3007, Dec. 2017, doi:\n10.1109/TAES.2017.2724358.\n53702\net al.: Transmitter Design for Multibeam CC-OFDM Azimuth Scanning MIMO Radar\n[43] A. S. Paulus, W. L. Melvin, and D. B. Williams, ‘‘Improved\ntarget detection through extended dwell time algorithm,’’ in Proc.\nIEEE Radar Conf. (RadarCon), May 2015, pp. 0484–0489, doi:\n10.1109/RADAR.2015.7131047.\nDEVY KUSWIDIASTUTI (Student Member,\nIEEE) was born in Indonesia, in September', '53696\net al.: Transmitter Design for Multibeam CC-OFDM Azimuth Scanning MIMO Radar\nradar example, we have I = I and N = N = 101 and the\np q t r\nambiguity function is analyzed for a(cid:48) = a,and b(cid:48) = b and due\nto orthogonality, it is analyzed when n = m and p = q.\nIn the following, various ambiguity functions, each a func-\ntion of beam, of delay and of Doppler frequency, are pre-\nsented with transmitter time, sub band and codes scheduling\nfor symbol-1 as visually described in Table 2. Based on', 'VOLUME 10, 2022\nD. Kuswidiastuti et al.: Transmitter Design for Multibeam CC-OFDM Azimuth\nthe aforesaid problem of limited time-on-target. Multi-beam\nradar technology is beneficial to various radar applications,\nsuch as surveillance [3], [4], automotive radar [5], [6], radar\nimaging [7], [8], joint multiuser communication and radar [9],\n[10], etc. In this paper, we are interested in multi-beam\nradar systems capable of covering a large angular swath with', 'VOLUME 10, 2022\nD. Kuswidiastuti et al.: Transmitter Design for Multibeam CC-OFDM Azimuth\nthe OFDM symbols, which in turn can extend the maxi-\nmum unambiguous range of the radar. The orthogonalities\nbetween OFDM subcarriers and between OFDM symbols\nallow OFDM radar to produce a range and Doppler profile\nindependent from each other [41]. This is one of the advan-\ntages of using OFDM instead of LFM as radar waveform. The\nabove considerations motivate the development of digitally']","The orthogonalities between OFDM subcarriers and between OFDM symbols enable the CC-OFDM radar to generate a Doppler profile that is independent from the range profile (D. Kuswidiastuti et al., 2022).","symbols and frame transmission and reception schedul- ing, including the low/high-power modes, beam processing at the receiver by parallel processing, range and Doppler processing involving OFDM symbols and frames. VOLUME 10, 2022 53683 D. Kuswidiastuti et al.: Transmitter Design for Multibeam CC-OFDM Azimuth Scanning MIMO Radar beamforming applications, SDR technology is preferred for its ﬂexibility and low cost , . In our case, the SDR implements all baseband processing at the transmitter and the receiver, including generating inter-element delay required for the application of CC at the transmitter. Beamforming design that meets the required maximum beamwidth in the azimuth is achieved by determining the suitable number of elements employed on the horizontal axis. A good beam pattern can be obtained",0.5,0.9434338942903728
"and at the same beam direction, in this case around the range resolution of the radar, which is 60 meter are also can be distinguished with PSLL of −45 dB. The simulation results show that the coupling between beams and symbols are very low as the result of codes and sub-band scheduling at the transmitter. These results are valid for the three scenarios whether the targets are in the same beam, at the nearest neighboring beams and at the nearest co-channel beams. It shows that with the concept proposed in CC-OFDM MIMO Radar, it is possible to design a long-range radar with low power transmission by transmitting multi-orthogonal CC-OFDM symbols in series, to improve the Signal-to-Noise of the radar system.","['mission requirements. Finally, an example of the transmitter\ndesign for long-range surveillance radar has been described\nto clarify the concept and demonstrate the potential advan-\ntages of the CC-OFDM MIMO radar. By using the proposed\ndesign, a range resolution of 52 meter and an azimuth resolu-\ntion of 1.7◦ can be achieved. For the multi-beam scheme, the\nbeam isolation of −30 dB can be achieved for both between\nthe co-channel beams and between the neighboring beams.', '53684\net al.: Transmitter Design for Multibeam CC-OFDM Azimuth Scanning MIMO Radar\nexplain the concept, system and processes pertinent with the\nCC-OFDM MIMO radar, an example of long-range surveil-\nlance radar design is introduced in Section III. It is fol-\nlowed by Sections IV-VI that discuss the multi-beam pattern,\nthe PAPR issue and the ambiguity functions, taking the\nlong-range radar case as a reference. Discussions on the\ndesign results and the adoption of SDR concept for such', 'The receiver design of CC-OFDM radar, including the\nbeam, range and Doppler processing of the received signal\nwill be discussed in a separate paper.\nREFERENCES\n[1] M. I. Skolnik, Radar Handbook, 3rd ed. New York, NY, USA:\nMcGraw-Hill, 2008.\nVOLUME 10, 2022\nScanning MIMO Radar\n[2] C.A.Balanis,AntennaTheory:AnalysisandDesign,3rded.Hoboken,NJ,\nUSA: Wiley, 2012.\n[3] D. Gromek, P. Samczyński, J. Misiurewicz, M. Malanowski, K. Kulpa,\nA.Gromek,A.Gadós,A.Jarze¸bska,andM.Smolarczyk,‘‘Implementation', 'VOLUME 10, 2022\nD. Kuswidiastuti et al.: Transmitter Design for Multibeam CC-OFDM Azimuth\nthe aforesaid problem of limited time-on-target. Multi-beam\nradar technology is beneficial to various radar applications,\nsuch as surveillance [3], [4], automotive radar [5], [6], radar\nimaging [7], [8], joint multiuser communication and radar [9],\n[10], etc. In this paper, we are interested in multi-beam\nradar systems capable of covering a large angular swath with', 'LONG-RANGE SURVEILLANCE\nA. REQUIREMENTS\nTo elucidate the novel concept and detailed implementation\nof the CC-OFDM MIMO radar, we will take a surveillance\nradar design as an example for analyses in the subsequent\nsections. The CC-OFDM MIMO radar waveform designed\nherein is based on the requirement of surveillance radars\nused in coastal areas, where the target of interest are ships\nand small aircrafts in the area within 180 km from the radar\nsite. OFDM signals with subcarrier spacing of 10 KHz will']","The proposed transmitter design for long-range surveillance radar demonstrates the potential advantages of the CC-OFDM MIMO radar system (Kuswidiastuti et al., 2022).","the transmitter design for long-range surveillance radar has been described to clarify the concept and demonstrate the potential advan- tages of the CC-OFDM MIMO radar. By using the proposed design, a range resolution of 52 meter and an azimuth resolu- tion of 1.7◦ can be achieved. For the multi-beam scheme, the beam isolation of −30 dB can be achieved for both between the co-channel beams and between the neighboring beams. The receiver design of CC-OFDM radar, including the beam, range and Doppler processing of the received signal will be discussed in a separate paper.",1.0,0.9270204656723982
"with the following formula: TP + TN TP + TN + FP + FN Accuracy = Precision = Recall/True Positive Rate(TPR) TP TP + FP TP TP + FN F1 = 2 × precision × recall precision + recall FP TN + TP (cid:90) 1 TPRd(FPR) False Positive Rate(FPR) = AUC = (4) (5) (6) (7) (8) (9) where TP is the number of correctly predicted positive labels, TN is the number of correctly predicted negative labels, FP is the number of incorrectly predicted positive labels, and FN is the number of incorrectly predicted negative labels. Accuracy is the ratio of true predictions to the overall data. Precision is the ratio between TP to the total number of positive predic-","['and compare the performance of various models tested on\ndifferent datasets for lesion detection. Although the origi-\nnal data table presents a comprehensive set of performance\nmetrics, the graphs we created display the averages of four\nkey metrics: Accuracy (Acc), Precision (Prec), Recall (Rec),\nand Specificity (Spec) across different categories and stages.\nThese metrics were selected for their relevance in evaluating\nmodel performance for lesion detection and their widespread\nuse in related literature.', 'presence of lesions often indicates a serious\nlesions is crucial for effective treatment and\nfor lesion identification and evaluation, and the\nits potential. This systematic literature review\noverview of lesion detection using deep learning\ntechniques, modifications to baseline models,\nevaluation metrics. A meta-analysis of average\nspecificity—was also conducted to identify trends\ntrends such as federated learning, lightweight\naddressing critical aspects for clinical translation.', 'use in related literature.\n43545\nN. Rochmawati et al.:\nGiven the complexity of the data, which includes more\nthan 15 performance metrics and over 30 types of lesions,\ncomparing performance on a per-lesion and per-metric basis\nwas deemed impractical. Such an approach would result in an\noverly complex and difficult-to-interpret analysis. To address\nthis, we focused on four key metrics: Accuracy, Precision,\nRecall, and Specificity as they are widely recognized as fun-', 'tial to reduce interpretation errors [12] and improve patient\ncare effectiveness. Thus, exploration in this field presents\ngreat opportunity for the development of more advanced diag-\nnostic technologies and better clinical outcomes for patients\noverall.\nAs a team with diverse backgrounds, we have a deep\ninterest in exploring various methods used in lesion detection,\nthe types of lesions detected, deep learning methods and their\nvariations, the datasets used for lesion detection, data pre-', 'endoscopic images [36]. These techniques generate heatmaps\nthat highlight the most relevant regions in the image, provid-\ning a visual explanation of how the CNN-based GINet model\nidentifies lesions. By visualizing the decision-making pro-\ncess, clinicians gain deeper insights into the model’s outputs,\nfostering greater confidence in its use.\nSimilarly, Grad-CAM has been employed in the detection\nof ulcerative colitis lesions using the UCFN-Net model [42].']","The evaluation of model performance for lesion detection commonly utilizes four key metrics: Accuracy, Precision, Recall, and Specificity, which are recognized for their importance in reducing interpretation errors and enhancing patient care (N. Rochmawati et al.).","(TP+FP). To determine how well a positive value is found, recall is employed. It applies true positives (TP) to all ground truth values, which include both true positives and false negatives (FN). The F1 score is an evaluation metric that combines a model’s precision and recall scores, as illustrated in the equation that calculates accuracy. The accuracy statistic computes the number of times the iYOLOV7-TPE-SS model predicted accurately throughout the entire dataset , : F1score = 2 · (P · R) (P + R) (13) The system performance of the iYOLOV7-TPE-SS model has been evaluated using a metric known as mean average accuracy (mAP), which takes into account the average recall (AR), F1-score, and inference time. The inference time has",0.8,0.9045234127859535
"exhib- ited better performance than the MobileNet model, in which the models achieved an accuracy of 85% and 84.52%, respectively. Furthermore, the ResNet-101 model achieved a higher recognition performance of 88.37%, while the MobileNetV2 achieved the performance with an accuracy of 85.46% and a precision, recall, and F1 of 91%, 84%, and 85%, respectively. Furthermore, we performed more experi- ments using several different architectures i.e., DenseNet169, InceptionResNetV2, Xception, and EfﬁcientNetB4 that yielded accuracy of 88.76%, 87.16%, 89.31%, and 88.21%, respectively. The highest accuracy achieved by the benchmark models was only 89.31%. Our previous study proposed a data aug- mentation technique based on neural style transfer and geo- metric transformation to address the scantiness of Balinese carving data , which increased","['such as ResNet, Mascarenhas and Agarwal [10] showed that\nthe performance of VGG architectures in image classification\nis slightly less accurate. However, the study of Wang et al. [3]\nand Ihsan [7] pointed out that architectures with better\naccuracy struggle to properly migrate over the features of style\nimages. Although the former study introduced a novel\nstylization to improve other architectures, literature about\nneural style transfer and batik image are only a few.', '2024 International Conference on Smart\nA Comparison of VGG\nLayers in Migrating Batik\nBenny Hansen Lifindra Darlis\nDepartment of Informatics Department\n38187501.4202.51816LMIS/9011.01 Institut Teknologi Sepuluh Nopember Institut Teknologi\nSurabaya, Indonesia Surabaya,\n6025221011@student.its.ac.id\nAbstract—— The neural style transfer algorithm is created\nto produce high-quality artistic images. Many studies have been\nperformed to advance its implementations. However, the', 'architecture was regarded as the best neural network model to\nperform style transfer on batik-style images. Among its layers,\nthe layer ""conv3_1"" performs better than other layers in the\nsame network. The study concluded that batik-style transfer\nimages can be regarded as a form of batik art. However, the\nstudy failed to elevate the artistic value of the synthesized\nimages using image filtering.\nUnlike previous studies [3], [4], [5], this experiment used', '“conv3_1”, “conv4_1”, and “conv5_1” to store the style\nrepresentation similar to Gatys et al. [2]. The models were\nimplemented using Python programming language on\ncomputers with Intel® UHD Graphics 770 GPU. Both models\nperformed style transfer for 100 epochs. One epoch was equal\nto 40 iterations. Fig. 2 showcases the processes of neural style\ntransfer models implemented in this study.\nIn this experiment, the weighting factors of each\nconvolutional layer responsible for storing style information', 'Authorized licensed use limited to: Institut Teknologi Sepuluh Nopember.\nComputing, IoT and Machine Learning (SIML)\nrecorded sequences of style transfer image generation. The\nsecond batch was a collection of style reconstruction of the\nbatik-style images with different convolutional layers. The\nthird batch was a style transfer image collection with different\nweighting factors compositions. The fourth batch was six\nimages produced to be post-processed. Table II displays the\npost-processing result.']","The performance of VGG architectures in image classification is noted to be slightly less accurate, with better architectures struggling to migrate features of style images (Hansen et al., 2024).","Results from the performance evaluation for CNN, BiLSTM, BiGRU, CNN-BiGRU, HWE-CBiGRU without attention, and HWE-CBiGRU with soft attention, with respect to accu- racy, recall, precision, and F1 score, are presented in Table 4. The conventional CNN architecture produced good per- formance with an accuracy, recall, precision, and F1 score of 84.35%, 86.24%, 84.26%, and 85.24%, respectively. The BiLSTM model obtained a lower accuracy and F1 score of 81.24% and 84.84%, respectively, compared to CNN despite having a relatively high recall rate. Mean- while, the BiGRU model obtained the highest accuracy, recall, precision, and F1 score among the baseline mod- els, with a value of 85.46%, 87.80%, 86.85%, and 86.31%, respectively. The CNN-BiGRU model exhibited enhanced accuracy and F1 score in",0.6666666666666666,0.8988175887720561
"process, an audit involves acquiring and objectively evaluating evidence related to allegations of economic activities and other operations. The aim is to assess the level of conformity between the reports and predefined criteria, and to communicate the results to relevant users, in this case, the organization responsible for establishing information system gover nan nance. One of the proven frameworks for information system auditing is the Control Objectives for Information and Related Technology (COBIT) 2019, which is utilized as the reference framework in this research . COBIT 2019 offers an effective methodology for evaluating the capability of information technology processes, specifically focusing on Deliver, Service and Support - Operation Management. This framework guarantees that the data (DSS01) is received, managed fully,","['ERP implementation with an audit model utilizing the COBIT\n2019 framework in the Monitor, Evaluate, and Assess domain.\nThe findings demonstrated the model in achieving audit objec-\ntives within ERP systems, highlighting the framework’s utility\nin ensuring comprehensive audit coverage and control.\nResearch by [6] and [17] audited academic information\nsystems using the COBIT 2019 framework, focusing on the\nAPO12 domain. They identified areas for improvement and', ""audits add a qualitative dimension to audit evaluations,\nfacilitating better decision-making and more effective\nimplementation of improvements.\nAudit with COBIT 2019 and process mining from event\na\nlogs represents a holistic approach to evaluating and\nenhancing the effectiveness of an organization's information\nsystems [12]. Through the use of the COBIT 2019 framework,\nauditors can pinpoint key controls necessary to achieve\npredefined business objectives. Meanwhile, event log process"", 'pp. 1–5. DOI: 10.1109/TSSA51342.2020.9310875.\n[4] H. Nurcahya, E. Setiawan, and B. Permana, “Information\ntechnology governance audit using cobit framework 2019\n(case study: Mandiri university),” Budapest International Re- [18]\nsearch and Critics Institute-Journal (BIRCI-Journal), vol. 5,\npp. 8030–8038, Feb. 2022. DOI: 10.33258/birci.v5i1.4566.\n[5] M. Damayanti and A. A. Chrismastuti, “Internal audit model\npost-erp implementation (enterprise resource planning) at pt [19]', '(ICADEIS), IEEE, Aug. 2023, pp. 1–5. doi:\n10.1109/ICADEIS58666.2023.10271040.\n[11] S. BOZKUŞ KAHYAOĞLU, R. SARIKAYA, and B. TOPAL,\n“Continuous Auditing as a Strategic Tool in Public Sector Internal\nAudit: The Turkish Case,” Selçuk Üniversitesi Sosyal Bilimler Meslek\nYüksekokulu Dergisi, vol. 23, no. 1, pp. 208–225, Apr. 2020, doi:\n10.29249/selcuksbmyd.670261.\n[12] I. Tello, C. Ruiz, and S. G. Yoo, “Analysis of COBIT 5 Process ‘DSS02\n- Manage Service Requests and Incidents’ for the Service Desk Using', 'existing methods.\nB. Previous Research of Audit using COBIT 2019\nPrevious research on auditing with COBIT 2019 has investi-\ngated multiple facets of IT governance and auditing, applying\nthe framework across diverse domains and industries. One\nmajor area of research is the application of the COBIT 2019\nframework in different contexts, such as the development of\ninternal audit models post-ERP system implementation.\nResearch by [5] compared the audit process conducted after']","The COBIT 2019 framework has been shown to effectively achieve audit objectives within ERP systems, ensuring comprehensive audit coverage and control (Referensi 1).","assist organizations in managing and optimizing their use of information technology (IT) . landscape, effective IT In today’s rapidly evolving digital governance is essential for organizations to ensure that their IT investments align with business objectives, comply with regulations, and mitigate risks . COBIT 2019 provides a structured approach for organiza- tions to establish, implement, and maintain effective gover- nance over IT. It defines the components necessary to create and sustain a governance system, as well as guidelines for building the most suitable governance system for an enterprise . By utilizing COBIT 2019, organizations can enhance the efficiency, effectiveness, and reliability of their IT usage, while also ensuring compliance with relevant regulations, policies, and standards . One of the key",0.6666666666666666,0.9304475844534018
"the Deliver, Service, and Support (DSS) domain to assess the performance of the system and the standards the governance capabilities at the Customer Care unit using the COBIT framework, specifically within the Deliver, Service, and Support (DSS) domain. The primary focus is on assessing process controls related to Information Technology (IT) services and technical support. Data collection is conducted through surveys to support this evaluation. This study adopts a novel approach in identifying COBIT processes, specifically DSS01, through process mining techniques rather than traditional surveys. Process mining utilizes event logs recorded from daily operations. This technique enables real-time process analysis by applying various analytical methods to process these logs. This approach provides deeper and more accurate insights into the effectiveness","[""and regulatory compliance. This combined approach\nimproves project efficiency and strengthens IT governance\nand resource management for long-term sustainability.\nOverall, this study's findings support the importance of\nadopting a data-driven approach in IT project management\nand governance and provide practical guidance for\norganizations seeking to improve the efficiency of their IT\nservice delivery using proven management technologies and\nframeworks.\nACKNOWLEDGMENT"", 'recommend specific activities. Experimental results show that this\nsystem optimizes IT management practices, enhances operational\n| efficiency, and ensures regulatory compliance. Additionally, a\n)AIITCI(\nuser-friendly graphical representation of internal business pro-\ncesses using Neo4j enables stakeholders to visualize complex\nsnoitacilppA relationships within the COBIT framework, facilitating informed\ndecision-making. This research advances IT governance practices', 'collect data from individuals or groups involved in the process\nor system being assessed. These surveys help identify\nweaknesses, potential risks, and practical insights from those\ninteracting directly with the process or system. The results\nprovide valuable insights into operational dynamics and\nstakeholder sentiments. Survey audits enhance participation\nand engagement, allowing stakeholders to contribute to\nimproving effectiveness and efficiency. Consequently, survey', ""mining enables auditors to delve into the event log data\ngenerated by information systems to visually map process\nflows. By combining these two approaches, auditors can\nconduct in-depth analyses of system compliance with COBIT\nstandards and identify noises from established procedures.\nThis integrated audit approach provides comprehensive\ninsights into the performance of the organization's information\nsystems, along with recommendations for more effective IT"", 'implementing effective and efficient IT management\nprinciples [21]. By adopting COBIT 2019, organizations can\nimprove their IT performance, reduce risks, and ensure that IT\nis used to support the achievement of business objectives\noptimally.\na\nDomain DSS01 in COBIT 2019, titled ""Define and\nManage Service Levels,"" addresses the management and\nestablishment of service levels within the scope of an\norganization\'s IT [22]. Within DSS01, organizations are']","Process mining allows for the analysis of event log data from information systems, facilitating the visual mapping of process flows (Identifying Non-Conforming Process in Automobile Insurance Claims Using Process Mining and COBIT 2019).","guidance for understanding, planning, and implementing effective and efficient IT management principles . By adopting COBIT 2019, organizations can improve their IT performance, reduce risks, and ensure that IT is used to support the achievement of business objectives optimally. Domain DSS01 in COBIT 2019, titled ""Define and Manage Service Levels,"" addresses the management and establishment of service levels within the scope of an organization's IT . Within DSS01, organizations are required to identify specific service requirements, including performance and reliability criteria, and manage user expectations regarding IT services. Additionally, this domain also covers the measurement and monitoring of service performance, as well as the adjustment processes necessary to ensure that the services provided remain in line with established standards. III.",0.6666666666666666,0.8787368280362475
"workflow progress and delivering important insights . A major benefit of this method is its ability to use existing database logs, which can decrease the time and cost needed for data collection. Furthermore, using recorded data can reduce the likelihood of information distortion. Given its capability to analyze log data across different systems, process mining has become popular among companies aiming to examine their processe Thus, process mining not only plays a role in improving operational efficiency but also in enhancing the overall quality of healthcare services. This study discusses how process mining can be implemented to support information system audits based on COBIT 2019 for DSS01 Objective, particularly as a method of collecting and validating data within the process","[""mining enables auditors to delve into the event log data\ngenerated by information systems to visually map process\nflows. By combining these two approaches, auditors can\nconduct in-depth analyses of system compliance with COBIT\nstandards and identify noises from established procedures.\nThis integrated audit approach provides comprehensive\ninsights into the performance of the organization's information\nsystems, along with recommendations for more effective IT"", ""audits add a qualitative dimension to audit evaluations,\nfacilitating better decision-making and more effective\nimplementation of improvements.\nAudit with COBIT 2019 and process mining from event\na\nlogs represents a holistic approach to evaluating and\nenhancing the effectiveness of an organization's information\nsystems [12]. Through the use of the COBIT 2019 framework,\nauditors can pinpoint key controls necessary to achieve\npredefined business objectives. Meanwhile, event log process"", 'management. Thus, audit with COBIT and process mining\nfrom event logs aids organizations in improving the reliability,\nDownloaded on July 14,2025 at 08:18:28 UTC from IEEE Xplore. Restrictions apply.\nsecurity, and operational efficiency of their information\nsystems.\nSungkono K et al., [13] explores the use of graphs to\nidentify incorrect judgments and patterns in corporate\noperations. This research aims to assist companies in\npreventing fraud by identifying anomalies in their business', ""processes. The proposed graph-based method provides\nunique approach in identifying these anomalies and improving\noperational efficiency. An analysis of the method's\nperformance using an event log from a bank's credit\napplication process revealed that it was 100% accurate in\nidentifying incorrect patterns and judgments.\nIn this research, we will be doing an audit with the COBIT\n2019 framework (domain DSS01) and process mining to\ndetect processes that do not comply with Standard Operating"", 'systems makes business model development easier.\nB. Process Mining\nProcess mining is an analytical method used to study,\nunderstand, and improve business processes by leveraging\ndata automatically generated by information systems [16].\nThis technique involves analyzing event logs or records of\nevents that occur within a system, such as business\ntransactions or user activities. From this data, process mining\nmaps the actual workflow, identifies patterns, trends, and']","Process mining allows auditors to analyze event log data from information systems, facilitating the visual mapping of process flows and enhancing compliance evaluations with COBIT standards.","audits enhance participation and engagement, allowing stakeholders to contribute to improving effectiveness and efficiency. Consequently, survey audits add a qualitative dimension to audit evaluations, facilitating better decision-making and more effective implementation of improvements. Audit with COBIT 2019 and process mining from event logs represents a holistic approach to evaluating and enhancing the effectiveness of an organization's information systems . Through the use of the COBIT 2019 framework, auditors can pinpoint key controls necessary to achieve predefined business objectives. Meanwhile, event log process mining enables auditors to delve into the event log data generated by information systems to visually map process flows. By combining these two approaches, auditors can conduct in-depth analyses of system compliance with COBIT standards and identify noises",1.0,0.9133606322613969
"stage is performance analysis, where the effectiveness and efficiency of the billing processes are reviewed to identify potential areas for improvement. Overall, these stages are crucial to ensure that the billing practices at the hospital are conducted efficiently and transparently. A. Dataset The ""Hospital Billing"" event log was obtained from the financial module of the ERP system used by a regional hospital , This log records various incidents related to the billing of medical services provided by the hospital. Over a three-year period, from 2013 to 2016, a random sample of 100,000 traces was collected, each representing a recorded example of the process in the system. Within this event log, there are 18 different activities, each depicting distinct stages in","[""in order to give patients higher-quality care. In this study, data\nfrom the finance module of the hospital's ERP system was\nexplored to determine bottleneck activities in the invoice\nprocedure. Using anonymised event logs, this study aims to\nfind causality in the hospital's billing process and identify\npotential bottleneck activities.\nAudit with surveys is an effective method for gathering\nessential information to evaluate a process or system [11].\nUsing carefully crafted questionnaires, auditors directly"", ""2019\nLauretha Fajar Vantie\nDepartment of Informatics\nInstitut Teknologi Sepuluh Nopember\nSurabaya 60111, Indonesia\n6025231062@student.its.ac.id\nKelly Sungkono\nDepartment of Informatics\nInstitut Teknologi Sepuluh Nopember\nSurabaya 60111, Indonesia\nkelly@its.ac.id\nPrema et al [10] use process mining techniques to examine\na regional hospital's billing procedure. This study emphasizes\nhow crucial it is to increase the billing process' effectiveness"", 'systems makes business model development easier.\nB. Process Mining\nProcess mining is an analytical method used to study,\nunderstand, and improve business processes by leveraging\ndata automatically generated by information systems [16].\nThis technique involves analyzing event logs or records of\nevents that occur within a system, such as business\ntransactions or user activities. From this data, process mining\nmaps the actual workflow, identifies patterns, trends, and', '184–189. doi: 10.1109/ICTS52701.2021.9608229.\n[14] Y. Caesarita, R. Sarno, and K. R. Sungkono, “Identifying bottlenecks\nand fraud of business process using alpha ++ and heuristic miner\nalgorithms (Case study: CV. Wicaksana Artha),” in 2017 11th\nInternational Conference on Information & Communication [20]\nTechnology and System (ICTS), IEEE, Oct. 2017, pp. 143–148. doi:\n10.1109/ICTS.2017.8265660.\n[15] R. Sarno, Y. A. Effendi, and F. Haryadita, “Modified Time-Based', 'This means that the model produced by Heuristic Miner is the\nmost accurate in representing the actual business process\ncompared to the models produced by the other algorithms.\nApart from identifying traces and developing a process\nmodel, this research also analyzing the duration of case\ncompletion. In analyzing the case duration, this study utilizes\nthe overview feature within the DISCO application. Based on\nthe data shown in the DISCO application, on average, 1']","Prema et al. (2019) utilized process mining techniques to analyze a regional hospital's billing procedure, highlighting the importance of enhancing the effectiveness of billing processes.","organizations improve the reliability, security, and operational efficiency in managing their information technology. , Prema et al use process mining techniques to examine a regional hospital's billing procedure. This study emphasizes how crucial it is to increase the billing process' effectiveness in order to give patients higher-quality care. In this study, data from the finance module of the hospital's ERP system was explored to determine bottleneck activities in the invoice procedure. Using anonymised event logs, this study aims to find causality in the hospital's billing process and identify potential bottleneck activities. Audit with surveys is an effective method for gathering essential information to evaluate a process or system . Using carefully crafted questionnaires, auditors directly collect data from individuals or",1.0,0.9420881487985382
"Long Short-Term Memory (LSTM) , is a variation of Recurrent Neural Networks (RNN) that has been successfully applied to various Natural Language Processing (NLP) tasks. LSTM has the ability to capture long-range dependencies with sequences making it suitable for solving sequence labeling problems , , , such as Named Entity Recognition tagging (POS-Tag) and Neural (NER), Part-of-Speech combining (NMT). Study Machine Translation Bidirectional LSTM (BiLSTM) model with Conditional Random Field (CRF) to solve NER and POS-Tag Task. BiLSTM encodes word or character vectors into features, while CRF is a classifier to predict the target labels. Previous research has explored enhancing the feature extractor by integrating serves attention mechanisms with existing models or introducing alternative extractors such as Convolutional Neural Networks","['may be associated with a specific type of entity [33]. NER\ntask is not a new research topic. There have been many studies\non the development of NER models. The capability of captur-\ning bidirectional relations among words in a sentence posses\nby BiLSTM has been around for many years as the state-of-\nthe-art method in the sequence labeling task. Accompanied\nby a statistical model, CRF, which can maximize the proba-\nbility of a label sequence, has proven to improve the BiLSTM', 'Model and the Maximum Entropy Markov Model (MEMM)\nare ineffective at analyzing sentence-level sequences com-\npared to the CRF approach [15]. The main CRF features that\ncan compute cross-position label combination probability\ngrab the researchers’ attention to apply this method to the\nNER problem. Combining the previous state-of-the-art NER\nmodel, BiLSTM, with CRF has proven to improve perfor-\nmance [56]. In this paper, CRF is used as the decoder for', 'for data extraction and annotation.\n3) We propose and investigate cosine similarity as a sub-\nstitutive of dot-product in the self-attention sub-layer\nof the Transformer encoder to model contextual depen-\ndency in a sequence. We also propose a new NER\narchitecture consisting of CNN character embedding,\nBERT word embedding, a Transformer with scaled\ndot-product attention as the encoder, and CRF as the\ndecoder.\nThe paper comprises five sections. The remainder of this', 'embedding to the input vector can improve the BiLSTM-CRF\nmodel equipped with an attention mechanism [19].\nSupervised-based deep learning models can take advantage\nof the label information attached to the data points in the\ntraining process. Besides updating the weight parameters,\nlabel information can also be injected into the input vector,\nas proposed in LUKE [38], to provide a rich input. An entity-\naware self-attention mechanism is proposed to separate the', 'To perform NER, two common deep learning mod-\nels can be used, either RNN-based or Transformer-based\nmodels. The latest state-of-the-art include BiLSTM-CRF\nand a pre-trained Transformer-based Language Model. The\nrise of Transformer-based language models (LM) such\nas BERT [22], one of the first pre-trained LM models,\nRoBERTa [23] as an optimized version of BERT, Distil-\nBERT [24], a smaller, faster, cheaper, and lighter version of\nBERT and GPT [25], types of pre-trained language model']",The combination of BiLSTM with CRF has been shown to enhance performance in Named Entity Recognition tasks.,"concept of concatenating the word’s vector representation with the Bidirectional Long Short-Term Memory (LSTM) layer output. The Conditional Random Field (CRF) layer is 3260 VOLUME 11, 2023 S. Silalahi et al.: Transformer-Based NER on Drone Flight Logs to Support Forensic Investigation used to decode the concatenated output since it can determine how the sequence labels relate to one another. Most of the work involved in implementing deep learning models is predominantly spent on ﬁguring out how to prepare adequate input representations. Most often, word embedding techniques like GloVe , Word2vec , BERT , and ELMo are used to learn the input representation. Pre- trained language models, such as BERT and ELMo, can generate contextualized representational vectors after going through a",1.0,0.9063784551587273
"as runtime logs that are constantly generated during the operational period of the device. The information recorded in log data is highly valuable for many purposes, including running system monitoring, running process conformance checks, and overall system evaluation . The use of log data is critical when incident cases occur, as the empirical events and incident scenarios can be discovered by analysing the log artefacts. Assuming that 64252 2024 The Authors. This work is licensed under a Creative Commons Attribution-NonCommercial-NoDerivatives 4.0 License. For more information, see VOLUME 12, 2024 S. Silalahi et al.: Severity-Oriented Multiclass Drone Flight Logs Anomaly Detection the integrity of the log is guaranteed, log data is one of the artefacts with the highest priority for investigating","['and activities that happen during a flight and stores the\nrecorded events in log files. These files contain not only\nempirical processes but also record the sensor data for every\ncertain time period, making the drone forensic-ready in case\nencounters an accident or incident. Assuming that the log data\nare admissible, a forensic investigation can be conducted to\nunderstand the incident scenario and uncover the root cause.\nTo do so, several artefacts such as flight logs, images, videos,', 'investigated source of evidence is sensor data, such as\nGPS [2], which provides a concise diagnosis of a flight\nto the investigator when performing anomaly detection [3].\nIn fact, a flight log not only contains sensor data and\ncomponent status, as illustrated in Fig 2, but also human-\nreadable messages describing the occurring events during the\noperation of a drone. This file stores all information during\na flight, such as flight timestamps, flight parameters, sensor', 'investigation cases.\n2) Flight log messages cover events from the drone’s\nsensors, features, and components, making it one piece\nof evidence to perform analysis related to different\ndrone software and hardware components. Therefore,\nanalysing the log messages means analysing the whole\ndevice for various possible incident scenarios.\n3) Flight log messages contain contextual information\nabout the occurring event as a description that\ninvolves multiple parts of the drone simultaneously.', 'explored in the drone forensics space compared to other types\nof evidence. In this case, we identify three reasons as to why\nthey may be used:\n105362\nInterpretable Ordinal-Aware With Contrastive-Enhanced Anomaly Severity Detection\n1) Human-readable log messages can be found in the\nflight log, which is highly relevant to various incident\ncases, as shown in Fig 3. Not only is it highly relevant,\nbut it is also highly prioritised evidence in diverse\ninvestigation cases.', 'based multiclass drone flight log anomaly detection\nframework that includes three anomaly severity levels:\nlow, medium, and high. Providing the severity level can\nprovide better detection results for the investigator to\npinpoint the event of interest. Interpretability makes\nthe model training and testing more transparent,\ntrustworthy, and human-friendly.\n2) We propose DroneSBERT,1 a domain-specific embed-\nding to extract semantic features that are well-aligned']","Flight log messages serve as crucial evidence for analyzing various incident scenarios by covering events from the drone's sensors and components (Silalahi et al., 2024).","highly relevant to various incident cases, as shown in Fig 3. Not only is it highly relevant, but it is also highly prioritised evidence in diverse investigation cases. 2) Flight log messages cover events from the drone’s sensors, features, and components, making it one piece of evidence to perform analysis related to different drone software and hardware components. Therefore, analysing the log messages means analysing the whole device for various possible incident scenarios. 3) Flight log messages contain contextual information about the occurring event as a description that involves multiple parts of the drone simultaneously. For example, a certain circumstance fails a feature or an operation, as shown in message group number 4 in Table 1. TABLE 1. Groups of",0.6666666666666666,0.9256208757337839
"particular system log may need different techniques from one type to another. Generally, log-based anomaly detection can be performed using either point, collective, or contextual approaches. In the log-based anomaly detection literature, most of the existing studies propose either a contextual or collective approach, where the decision is taken by examining a sequence of log events. However, detecting abnormalities in log data can be performed using a point-based approach, where one single log record is the only feature needed. Therefore, several studies explored utilising a point-based approach to detect anomalous events on logs data, such as in operating systems , , drone devices , and distribution systems , . In the drone context, a log message contains a description of","['As an example, the flight path taken by a drone during a\nflight is recorded in longitude and latitude coordinates. These\ndata can be used to detect an anomaly by finding a peculiar\nvalue within the log records by contrasting the normal values\nto abnormal values using a certain threshold [11]. Unique to\nthe previous two approaches, collective anomaly establishes\nanomaly criteria based on a set of instances associated with\neach other, distinct from the overall data. Statistical anomaly', 'based multiclass drone flight log anomaly detection\nframework that includes three anomaly severity levels:\nlow, medium, and high. Providing the severity level can\nprovide better detection results for the investigator to\npinpoint the event of interest. Interpretability makes\nthe model training and testing more transparent,\ntrustworthy, and human-friendly.\n2) We propose DroneSBERT,1 a domain-specific embed-\nding to extract semantic features that are well-aligned', 'share common samples. The dataset composition is presented\nin Table 4. After reading all the messages carefully, we infer\nthe characteristics of each severity level, as summarised in\nTable 5.\nB. BASELINES\nMost of the studies use a sequence-based approach in the\nlog-based anomaly detection research, as shown in Table 2.\nIn contrast, this paper uses a point-based approach based on\nthe characteristics of the problem and the dataset. Therefore,\nthere are limited references that can be used as baselines for', 'detection approach.\nIII. PROPOSED FRAMEWORK\nA. OVERVIEW\nAdopting the concept of sentiment analysis in the general\ndomain into log anomaly detection was first introduced\nby [7]. Inspired by the study, anomalous events on drone\nflight logs can be detected by analysing log messages and\nidentifying suspect key phrases closely related to drone\nincident scenarios. Therefore, the region of interest in this\npaper is analysing sentiment contained within a log message', 'a point, contextual, or collective setting. Point anomaly\ndetection characterises each log entry, whether an event is an\nabnormality or a normal event. For instance, if a user types the\nwrong password when trying to gain access to an operating\nsystem prompt, the generated log message can be considered\nas an anomaly [7], [20], [21]. As for contextual anomaly,\nthe detection involves analysing some contextually related\nattributes to determine whether a log entry is an anomaly.']","This study employs a point-based approach for log anomaly detection, contrasting with the prevalent sequence-based methods in the literature.","Existing anomaly detection modelling techniques can be conducted either in a point, contextual, or collective setting. Point anomaly detection characterises each log entry, whether an event is an abnormality or a normal event. For instance, if a user types the wrong password when trying to gain access to an operating system prompt, the generated log message can be considered as an anomaly , , . As for contextual anomaly, the detection involves analysing some contextually related attributes to determine whether a log entry is an anomaly. As an example, the flight path taken by a drone during a flight is recorded in longitude and latitude coordinates. These data can be used to detect an anomaly by finding a peculiar value",1.0,0.9637108287796952
"several studies explored utilising a point-based approach to detect anomalous events on logs data, such as in operating systems , , drone devices , and distribution systems , . In the drone context, a log message contains a description of occurring events which are triggered by various components such as sensors, peripherals, and firmware. Analysing the log message means analysing events from all aspects of the drone, including sensors, components and features . Typically, existing log-based anomaly detection stud- ies classify log events into two categories: normal and anomaly . This is helpful in an online setting, where the number of detected abnormalities in a certain period of time is considerably small. However, in a digital forensic setting, where the","['be used to analyze the value of sensors, especially in drone\nmalfunction classification cases. It can improve the forensics\nperformance, and analyse the drone’s malfunction when it\nflies. The detail of the method can be described in the followin\nsubsections.\nA. Data Preprocessing\nThe dataset for the experiment and its preprocessing stage\nto satisfy the needs in drone forensics can be explained as\nfollows. Once the drone log data downloaded from the Airlab', 'messages acquired from 82 drone models, mostly from\nDJI. This is one of the main challenges in drone forensics\nresearch, where human-readable flight log datasets from\nother drone models are unavailable. In the future, we plan\nto explore the flight logs of other drone models to train more\ngeneral anomaly detection models. As for the method, multi-\nobjective learning that employs multiple loss functions to\ntrain an anomaly detection model will be explored.\nDATA AVAILABILITY', 'and activities that happen during a flight and stores the\nrecorded events in log files. These files contain not only\nempirical processes but also record the sensor data for every\ncertain time period, making the drone forensic-ready in case\nencounters an accident or incident. Assuming that the log data\nare admissible, a forensic investigation can be conducted to\nunderstand the incident scenario and uncover the root cause.\nTo do so, several artefacts such as flight logs, images, videos,', 'state. From those columns, we take the data from the message,\ntip, and warning columns. Not every log entry has a message,\nas the log message is generated and triggered by certain\nevents or incidents. This message contains useful information\nfor the forensic investigator to conduct forensic analysis and\ninvestigation. Therefore, the other columns in the drone flight\nlog message are ignored.\nAfter collecting all the log messages from the flight log', 'explored in the drone forensics space compared to other types\nof evidence. In this case, we identify three reasons as to why\nthey may be used:\n105362\nInterpretable Ordinal-Aware With Contrastive-Enhanced Anomaly Severity Detection\n1) Human-readable log messages can be found in the\nflight log, which is highly relevant to various incident\ncases, as shown in Fig 3. Not only is it highly relevant,\nbut it is also highly prioritised evidence in diverse\ninvestigation cases.']","Human-readable log messages in drone flight logs are crucial for forensic investigations, as they provide relevant evidence in various incident cases.","highly relevant to various incident cases, as shown in Fig 3. Not only is it highly relevant, but it is also highly prioritised evidence in diverse investigation cases. 2) Flight log messages cover events from the drone’s sensors, features, and components, making it one piece of evidence to perform analysis related to different drone software and hardware components. Therefore, analysing the log messages means analysing the whole device for various possible incident scenarios. 3) Flight log messages contain contextual information about the occurring event as a description that involves multiple parts of the drone simultaneously. For example, a certain circumstance fails a feature or an operation, as shown in message group number 4 in Table 1. TABLE 1. Groups of",1.0,0.9424729183298133
"classify log events into two categories: normal and anomaly . This is helpful in an online setting, where the number of detected abnormalities in a certain period of time is considerably small. However, in a digital forensic setting, where the detection is performed on all collected artefacts which might be large in size, the number of the abnormalities is likely to be large . Thus, analysing the detection result in a binary setting is impractical for the investigator. Moreover, out of all detected peculiarities, there might be several negligible ones with less severe impacts on the system or less likely to be related to an incident. Extending binary to multiclass anomaly detection can provide more detailed and contextual detection results","['to multiclass anomaly detection while exploiting the shared\nhigh- and low-level features within the log messages that\nbelong to different severity levels. Therefore, the forensic\ninvestigator can better pinpoint and prioritise the anomalies\nto focus on critical findings. The proposed embedding,\nDroneSBERT, improved the trustworthiness of the model,\nas evidenced by the word’s importance report.\nDespite the promising results, the model’s generality\nremains untested as the training dataset contains only log', 'using the sequence of normal events. The anomaly is detected\nif a subsequent event exceeds a pre-defined threshold [11].\nAnother closely related study fine-tuned several pre-trained\nLLMs to detect anomalous log entries in a point-based\napproach [6]. However, existing studies only detect whether\nan event or subsequent event is an anomaly. In a forensic\nsetting, analysing a large number of log entries resulting\nfrom binary anomaly detection is considered inefficient', 'and labour-intensive as the detection is performed on the\nacquired evidence at one time [12]. Therefore, too many\ndetected anomalies need to be detailed into a more fine-\ngrained detection to help the investigator better prioritise\nthe analysis objective. As a result, this study extends the\nbinary anomaly detection to multi-class anomaly detection,\nas exemplified by another domain application such as plane\nflight data [13], image data [14], and internet of vehicle [15].', '[29] X. Li, X. Li, J. Jia, L. Li, J. Yuan, Y. Gao, and S. Yu, ‘‘A high accuracy and\nadaptive anomaly detection model with dual-domain graph convolutional\nnetwork for insider threat detection,’’ IEEE Trans. Inf. Forensics Security,\nvol. 18, pp. 1638–1652, 2023.\n[30] S. Han, Q. Wu, H. Zhang, B. Qin, J. Hu, X. Shi, L. Liu, and X. Yin,\n‘‘Log-based anomaly detection with robust feature extraction and online\nlearning,’’ IEEE Trans. Inf. Forensics Security, vol. 16, pp. 2300–2311,\n2021.', 'found to aid the forensic investigator in selecting the best\nsuitable tools for a particular type of task. In the general\ndigital forensics domain, log2timeline is commonly used to\nconstruct a forensic timeline from log records. The result is\nin.CSV format consisting of log records with corresponding\ntimestamps. Timeline2GUI can be used to parse and analyze\nthe log2timeline output file’s contents. It offers an automatic\nanalysis that is too complex if conducted manually. It is also']","The study extends binary anomaly detection to multi-class anomaly detection, allowing forensic investigators to better prioritize analysis objectives by detailing detected anomalies into a more fine-grained detection.","LLMs to detect anomalous log entries in a point-based approach . However, existing studies only detect whether an event or subsequent event is an anomaly. In a forensic setting, analysing a large number of log entries resulting from binary anomaly detection is considered inefficient and labour-intensive as the detection is performed on the acquired evidence at one time . Therefore, too many detected anomalies need to be detailed into a more fine- grained detection to help the investigator better prioritise the analysis objective. As a result, this study extends the binary anomaly detection to multi-class anomaly detection, as exemplified by another domain application such as plane flight data , image data , and internet of vehicle . As a consequence,",1.0,0.9437877705191099
"comparison of the proposed framework, several baselines are constructed, including those that are proposed in published works. This paper proposes a transformer encoder-based log- based anomaly detection optimised using multitask label representation to help the model learn from the overlapped features shared by the samples from different severity levels. A domain-specific decoding procedure is also proposed to infer the prediction result. In-depth analyses are performed to evaluate the proposed framework thoroughly. The main contributions of this paper are summarised as follows: 1) Propose Drone Log Severity (DroLoVe), a severity- oriented multiclass anomaly detection approach on drone flight log data. 2) Propose a data-driven vector representation of the label and a severity-oriented decoding procedure of the VOLUME 12, 2024 64253 S.","['based multiclass drone flight log anomaly detection\nframework that includes three anomaly severity levels:\nlow, medium, and high. Providing the severity level can\nprovide better detection results for the investigator to\npinpoint the event of interest. Interpretability makes\nthe model training and testing more transparent,\ntrustworthy, and human-friendly.\n2) We propose DroneSBERT,1 a domain-specific embed-\nding to extract semantic features that are well-aligned', 'seven out of eight examples belonging to the High severity\nhaving positive attribution scores. The model perceives the\nlog messages better than the previous BERT-based model.\nThe complete report of attributions toward each severity label\ncan be accessed on the repo.\nVI. CONCLUSION\nThis paper investigates utilising a multitask learning\nparadigm to perform multiclass anomaly detection on drone\nflight log messages. Aligning to the nature of multitask', '‘‘DronLomaly: Runtime detection of anomalous drone behaviors via log\nanalysis and deep learning,’’ in Proc. 29th Asia–Pacific Softw. Eng. Conf.\n(APSEC), Dec. 2022, pp. 119–128.\n[12] Z. Zhao, C. Xu, and B. Li, ‘‘A LSTM-based anomaly detection model\nfor log analysis,’’ J. Signal Process. Syst., vol. 93, no. 7, pp. 745–751,\nJul. 2021.\n[13] M. Memarzadeh, B. Matthews, and T. Templin, ‘‘Multiclass anomaly\ndetection in flight data using semi-supervised explainable deep learning', 'predictions on unseen data [5].\nThis paper proposes the Transformer method for classifying\ndrone malfunctions based on telemetry data. By leveraging\ntheir ability to handle sequential data and capture complex\nrelationships, Transformer model can provide accurate and\nDownloaded on July 14,2025 at 08:24:14 UTC from IEEE Xplore. Restrictions apply.\nrobust predictions, enabling drone operators to detect and\ndiagnose malfunctions quickly and take corrective actions.', 'heads as the substitute for the GRU in the encoder\nlayer of pylogsentiment and incorporated integrated\ngradients to perform explainability analysis.\n5) DroLoVe [9]. The study proposed a multitask learning-\nbased anomaly severity detection on drone flight\nlogs with an assumption that, samples belonging to\nTABLE 4. Dataset composition before and after unique filtering.\nTABLE 5. Anomaly severity characteristics.\n105369\nS. Silalahi et al.:\nTABLE 6. Hyperparameter search space for all scenarios.']","The proposed framework utilizes a domain-specific embedding, DroneSBERT, to enhance the extraction of semantic features for multiclass anomaly detection in drone flight logs.","depicted in Fig 18, the highlighted words align more with the attribution label, supported by seven out of eight examples belonging to the High severity having positive attribution scores. The model perceives the log messages better than the previous BERT-based model. The complete report of attributions toward each severity label can be accessed on the repo. VI. CONCLUSION VI. CONCLUSION This paper investigates utilising a multitask learning paradigm to perform multiclass anomaly detection on drone flight log messages. Aligning to the nature of multitask learning, we propose two target label representations, namely Multitask-101 and Multitask-111. The integrated gradient is employed to interpret the model’s behavior. During the interpretability analysis, we found that the embedding vectors from BERT do not align",1.0,0.953010519441616
"follows: 1) Propose Drone Log Severity (DroLoVe), a severity- oriented multiclass anomaly detection approach on drone flight log data. 2) Propose a data-driven vector representation of the label and a severity-oriented decoding procedure of the VOLUME 12, 2024 64253 S. Silalahi et al.: Severity-Oriented Multiclass Drone Flight Logs Anomaly Detection FIGURE 2. A word cloud visualisation to see that the samples from different severity levels share common words and phrases. The remainder of the paper is structured as follows: Section II discusses relevant previous studies related to log-based anomaly detection and how to deal with class imbalance problems in log-based anomaly detection task, the proposed framework is explained in detail in Section III, Section IV provides the experimental setup, followed","['based multiclass drone flight log anomaly detection\nframework that includes three anomaly severity levels:\nlow, medium, and high. Providing the severity level can\nprovide better detection results for the investigator to\npinpoint the event of interest. Interpretability makes\nthe model training and testing more transparent,\ntrustworthy, and human-friendly.\n2) We propose DroneSBERT,1 a domain-specific embed-\nding to extract semantic features that are well-aligned', 'pp. 100–105.\n[9] S. Silalahi, T.Ahmad, H. Studiawan, E. Anthi, andL. Williams, ‘‘Severity-\noriented multiclass drone flight logs anomaly detection,’’ IEEE Access,\nvol. 12, pp. 64252–64266, 2024.\n[10] J.Cheng,Z.Wang,andG.Pollastri,‘‘Aneuralnetworkapproachtoordinal\nregression,’’ in Proc. IEEE Int. Joint Conf. Neural Netw. (IEEE World\nCongr. Comput. Intell.), Jun. 2008, pp. 1279–1284.\n[11] L. K. Shar, W. Minn, N. B. D. Ta, J. Fan, L. Jiang, and D. L. W. Kiat,', '‘‘DronLomaly: Runtime detection of anomalous drone behaviors via log\nanalysis and deep learning,’’ in Proc. 29th Asia–Pacific Softw. Eng. Conf.\n(APSEC), Dec. 2022, pp. 119–128.\n[12] Z. Zhao, C. Xu, and B. Li, ‘‘A LSTM-based anomaly detection model\nfor log analysis,’’ J. Signal Process. Syst., vol. 93, no. 7, pp. 745–751,\nJul. 2021.\n[13] M. Memarzadeh, B. Matthews, and T. Templin, ‘‘Multiclass anomaly\ndetection in flight data using semi-supervised explainable deep learning', 'predictions on unseen data [5].\nThis paper proposes the Transformer method for classifying\ndrone malfunctions based on telemetry data. By leveraging\ntheir ability to handle sequential data and capture complex\nrelationships, Transformer model can provide accurate and\nDownloaded on July 14,2025 at 08:24:14 UTC from IEEE Xplore. Restrictions apply.\nrobust predictions, enabling drone operators to detect and\ndiagnose malfunctions quickly and take corrective actions.', 'seven out of eight examples belonging to the High severity\nhaving positive attribution scores. The model perceives the\nlog messages better than the previous BERT-based model.\nThe complete report of attributions toward each severity label\ncan be accessed on the repo.\nVI. CONCLUSION\nThis paper investigates utilising a multitask learning\nparadigm to perform multiclass anomaly detection on drone\nflight log messages. Aligning to the nature of multitask']","The proposed framework includes a multiclass anomaly detection approach that categorizes drone flight log anomalies into three severity levels: low, medium, and high (Silalahi et al., 2024).","be employed to force the model to learn a distinctive representation of the positive FIGURE 4. An illustration of anomalies that occur during a drone’s flight. inclusive. Therefore, this paper proposes a multitask-based multiclass drone anomaly detection to assist in a forensic investigation. The main contributions of this paper are summarized as follows: 1) We propose DroneLog, an interpretable sentiment- based multiclass drone flight log anomaly detection framework that includes three anomaly severity levels: low, medium, and high. Providing the severity level can provide better detection results for the investigator to pinpoint the event of interest. Interpretability makes training and testing more transparent, the model trustworthy, and human-friendly. 2) We propose DroneSBERT,1 a domain-specific embed- ding to extract semantic features",1.0,0.9530923653094693
"anomaly detection approach is adopted in this paper. Table 1 presents the summary of the previous related works. B. CLASS IMBALANCE PROBLEM (CIP) IN LOG-BASED ANOMALY DETECTION It is assured that in log-based anomaly detection, the number of anomalous samples is significantly less than the normal ones. Employing a supervised-based technique is prone to bias, as the model tends to learn from the majority samples. To overcome CIP, several studies proposed data-level and algorithm-level solutions . Moreover, in a certain case, there are no anomalous samples available. In this particular situation, a one-class approach can be used to construct a normal baseline model. During the detection, an anomaly score is used to decide if an input event is anomalous based","['settings and procedure are described in Section IV, while the\nresults, findings, and discussions are elaborated in Section V.\nFinally, we conclude the paper in Section VI.\nII. RELATED WORKS\nA. LOG-BASED ANOMALY DETECTION\nLog-based anomaly detection is relatively well-studied,\nincluding incorporating ML [1] and deep learning-based [18],\n[19] to facilitate log anomaly detection. Existing anomaly\ndetection modelling techniques can be conducted either in', 'share common samples. The dataset composition is presented\nin Table 4. After reading all the messages carefully, we infer\nthe characteristics of each severity level, as summarised in\nTable 5.\nB. BASELINES\nMost of the studies use a sequence-based approach in the\nlog-based anomaly detection research, as shown in Table 2.\nIn contrast, this paper uses a point-based approach based on\nthe characteristics of the problem and the dataset. Therefore,\nthere are limited references that can be used as baselines for', 'detection accuracy for binary and multi-class settings [16].\nAs described in Section IV-A, the dataset used in this paper is\nimbalanced. In this case, Section III-B discusses the approach\nto handle this imbalance.\nThis study proposes to extend the binary anomaly detection\ninto a multiclass anomaly detection involving four classes:\nNormal, Low, Medium, and High. The three anomaly classes\nrepresenting the severity of the abnormality are distinguished', 'results, the proposed method achieves the\nscores of 5.128% and 4.453% on the unique-\naccordingly addresses the task objective with\nordinal classification, integrated gradient,\nbanking, medical, and manufacturing. To prevent loss and\nminimize risks due to anomalies and incidents, a num-\nber of approaches have been proposed in the literature.\nA common approach is the log-based anomaly detec-\ntion approach, which involves the analysis of log entries\nrecorded by systems either in sequence-based or point-', 'to detect anomalous events. More specifically, we can\ndistinguish between normal and abnormal events and also\ndetail the severity of the detected abnormalities. Therefore,\n105365\nS. Silalahi et al.:\nTABLE 2. Related works in log-based anomaly detection.\nthe investigator can prioritise the analysis objective to focus\nonly on severe abnormalities. Therefore, we propose an\ninterpretable log anomaly detection framework based on\nsentiment analysis, as depicted in Fig. 5. During the training']","This study discusses approaches to handle class imbalance in log-based anomaly detection, emphasizing the challenges posed by the scarcity of anomalous samples.","sequence-based approach in the log-based anomaly detection research, as shown in Table 2. In contrast, this paper uses a point-based approach based on the characteristics of the problem and the dataset. Therefore, there are limited references that can be used as baselines for comparison, as described in the following: 1) Pylogsentiment . Using a point-based approach, a sentiment analysis model is trained using a one-layer VOLUME 13, 2025 105369 S. Silalahi et al.: Interpretable Ordinal-Aware With Contrastive-Enhanced Anomaly Severity Detection TABLE 6. Hyperparameter search space for all scenarios. neighbouring classes share common features. GRU, LSTM, and Transformer are explored to find the best- performing encoder. To provide a fair comparison, the GloVe embedding used in pylogsentiment, SentiLog, and TransSentLog are",0.5,0.9803318357573383
"detection approach for drone flight log data. The overall flow of the proposed framework is depicted in Fig 4. The following section describes the approach in more detail. A. OVERVIEW A. OVERVIEW Performing point log-based anomaly detection that takes human-readable log messages as input is similar to conduct- ing sequence or text classification. As mentioned in Section I, this task may be interpreted as a sentiment analysis task that aims to detect negative sentiments within log messages. Taking an n-length log message m = [w1, w2, . . . , wn] from the dataset D = {(mi, ci)}|D| i=1 as the input, where c is the label class name, BERT is used to tokenise the input into a fixed length","['predictions on unseen data [5].\nThis paper proposes the Transformer method for classifying\ndrone malfunctions based on telemetry data. By leveraging\ntheir ability to handle sequential data and capture complex\nrelationships, Transformer model can provide accurate and\nDownloaded on July 14,2025 at 08:24:14 UTC from IEEE Xplore. Restrictions apply.\nrobust predictions, enabling drone operators to detect and\ndiagnose malfunctions quickly and take corrective actions.', 'detection approach.\nIII. PROPOSED FRAMEWORK\nA. OVERVIEW\nAdopting the concept of sentiment analysis in the general\ndomain into log anomaly detection was first introduced\nby [7]. Inspired by the study, anomalous events on drone\nflight logs can be detected by analysing log messages and\nidentifying suspect key phrases closely related to drone\nincident scenarios. Therefore, the region of interest in this\npaper is analysing sentiment contained within a log message', 'based multiclass drone flight log anomaly detection\nframework that includes three anomaly severity levels:\nlow, medium, and high. Providing the severity level can\nprovide better detection results for the investigator to\npinpoint the event of interest. Interpretability makes\nthe model training and testing more transparent,\ntrustworthy, and human-friendly.\n2) We propose DroneSBERT,1 a domain-specific embed-\nding to extract semantic features that are well-aligned', '‘‘DronLomaly: Runtime detection of anomalous drone behaviors via log\nanalysis and deep learning,’’ in Proc. 29th Asia–Pacific Softw. Eng. Conf.\n(APSEC), Dec. 2022, pp. 119–128.\n[12] Z. Zhao, C. Xu, and B. Li, ‘‘A LSTM-based anomaly detection model\nfor log analysis,’’ J. Signal Process. Syst., vol. 93, no. 7, pp. 745–751,\nJul. 2021.\n[13] M. Memarzadeh, B. Matthews, and T. Templin, ‘‘Multiclass anomaly\ndetection in flight data using semi-supervised explainable deep learning', 'and ‘‘failed’’. However, these words might have positive\nmeanings in certain contexts, such as the word ‘‘failed’’ in\ne that undergoes a double negation. Therefore, considering\n5\nthe context when performing sentiment analysis to detect\nanomalies in drone log messages is crucial, especially when\nthe log messages from different classes share common words\nor phrases.\nC. SCOPE AND CONTRIBUTIONS\nPerforming multiclass classification typically encodes the']","The concept of applying sentiment analysis to log anomaly detection, which involves analyzing log messages to identify key phrases related to drone incidents, has been previously established (Interpretable Ordinal-Aware With Contrastive-Enhanced Anomaly Severity Detection on UAV Flight Log Messages).","be employed to force the model to learn a distinctive representation of the positive FIGURE 4. An illustration of anomalies that occur during a drone’s flight. inclusive. Therefore, this paper proposes a multitask-based multiclass drone anomaly detection to assist in a forensic investigation. The main contributions of this paper are summarized as follows: 1) We propose DroneLog, an interpretable sentiment- based multiclass drone flight log anomaly detection framework that includes three anomaly severity levels: low, medium, and high. Providing the severity level can provide better detection results for the investigator to pinpoint the event of interest. Interpretability makes training and testing more transparent, the model trustworthy, and human-friendly. 2) We propose DroneSBERT,1 a domain-specific embed- ding to extract semantic features",0.6666666666666666,0.9588943332942276
"log message m = [w1, w2, . . . , wn] from the dataset D = {(mi, ci)}|D| i=1 as the input, where c is the label class name, BERT is used to tokenise the input into a fixed length sequence with m maximum length and retrieve the contextual embeddings, resulting in an input matrix X ∈ Rm×dBERT which is then paired with the encoded label y. Thus, the numerical input becomes (X, y). This study aims to train a neural network model Mθ to classify the message m into one of the predefined classes c ∈ C = {high, medium, low, normal}, or can be written as Mθ : m → c. Based on past literature discussed in Section","['several baselines and state-of-the-art methods from previous\nto investigate the best-performing model’s trustworthiness\nperceived the log messages’ semantics differently and were\nTherefore, DroneSBERT, a domain-specific embedding trained\nfollow-up to the interpretability findings. From the experimental\nhighest performance with an improvement in accuracy and F1\nfiltered dataset, respectively. Therefore, the proposed method\na promising performance while being interpretable and trustworthy.', 'assumption that, log messages that contain words or phrases\nwith negative connotations considered anomalies. Another\nrecent study employs sentence embedding to extract the\nsemantic features from log messages, and utilize various\nmachine learning (ML) models to classify anomaly sever-\nity [8]. The most recent study employs a multitask learning-\nbased solution to solve a mutually inclusive dataset [9].\nThe study relies on the assumption that the neighbouring', 'every entity type in the train and test set of the annotated\ndatasets is shown in Table 2 and Table 3. The final composi-\ntion of the dataset is 76:24 for train and test sets, respectively,\nfrom a total of 1850 log messages. The final proportion is\nuncontrollable since the splitting is done based on the drone\nmodels instead of directly dividing the message into a certain\ncommon ratio used in existing research.\nB. EXPERIMENT SETTINGS\nThe experiment was conducted using the publicly available', 'into vectors. Landmark embedding utilizes three\nconvolutional layers to get feature from Landmarks\nMediaPipe results. Character level tokens will be used as\nembedding tokens. Landmarks embedding will be used as the\nsource and becomes the input for Transformer Encoder, while\nToken Embedding becomes the input for Transformer\nDecoder. The data results are then divided into training,\nvalidation, and testing. Training data uses 80% of the total\ndata, validation data uses 20%, while testing data for', 'machine learning algorithms can interpret and use. Feature\nengineering aims to highlight the text’s critical information,\nmaking it accessible for further analysis or modeling [31].\nThe choice of the BERT embedding model is crucial due\nto the varying architectures, sizes, and traits of these mod-\nels. Selecting the appropriate model requires considering the\nsize of the model, the relevance of its pre-training corpus\nt o th e s pe c i fi c d o m a i n or ta sk , a n d its p e rfo r m an c e o n t h e']",A recent study utilized sentence embedding to extract semantic features from log messages and employed various machine learning models for classification (Interpretable Ordinal-Aware With Contrastive-Enhanced Anomaly Severity Detection on UAV Flight Log Messages).,"detection on the test data, which is then analysed further. In this paper, M = (cid:2)m1, m2, . . . , m|M| (cid:3) is defined as the collection of log messages in the dataset. Given a log record m = [w1, w2, . . . , wn] containing n number of words as input, with m ∈ M, BERTbase is used to tokenize and obtain the input vector representation. In the implementation, computation is undertaken using matrix multiplication. Thus, a term maximum sequence length, m, is introduced to pack the input messages that vary in length into a matrix with a consistent size throughout all the samples in the dataset. Therefore, for each single input message, the input matrix becomes",0.6666666666666666,0.9196270508755433
"logits z ∈ R|C|, where |C| denotes the number of target class in the dataset. During the training phase, these vectors are used to compute the loss and update the parameter of the model after passing through a normalisation function. For the typical one-hot encoding representation of the label, the standard cross-entropy is used to compute the loss, as defined in the following equation: |C| LCE = − yi · log(ˆyi) i=1 ˆy = softmax(z) exp(zi) ˆyi = Pdim(z) exp(zj) (1) (2) (3) where y and ˆy are the true label vector and the prediction probability distribution, respectively. The prediction proba- bility ˆy is obtained from Eq 2, where each of the element in ˆy is computed using Eq 3.","['unnormalized logits vector using the following equation:\nα = ⊤ + b, ∈ R|C|\nzW (3)\nwhere W ∈ R|C|×768, and b ∈ R|C| are the typical trainable\nweight and bias parameters in a linear layer. Knowing that\nthe number of classes is more than two, the task belongs\nto multiclass classification. Typically, the target label is\nrepresented in a one-hot encoded vector, as depicted in\nFig. 8a. Therefore, the training objective is to minimise the\ncross-entropy loss, which is computed using the following\nequation:\n|C|\nX', '|M|\nλbal = (8)\nc |C| · |M |\nc\n(cid:18)|M |(cid:19)−1\nλinv = c\n(9)\nc |M|\nwhere |M| is number of samples in the dataset, |C| is the\nnumber of target class, and |M | is the number of samples\nc\nbelonging to class c with M ∈ M.\nc\nAs an alternative way to deal with the imbalance problem,\nwe replace the cross-entropy with the focal loss to force\nthe model to learn from the hard-to-classify examples by\npenalising the predicted probability with low confidence', 'interpreting it as a probability. The sigmoid function’s dis-\ntinctive ‘S’ shape allows for a smooth and gradual transition\nbetween the two extremes of probability. This transition is\nparticularly important in cases where the decision boundary\nbetween two classes is unclear. Finally, the model utilizes\nthe binary cross-entropy loss function, deemed appropri-\nate for binary classification tasks. The binary cross-entropy\nloss, a conventional loss function for binary classification,', 'model to effectively categorize a wide range of classes. The\nloss calculation formula for cross-entropy is given by (9).\nN\n1 X\nH (q) = − y .log(p(y )) + (1 − y ).log(1 − p(y ))\np 1 i i i\nn\ni=1\n(9)\nwhere y is the actual target probability (0 or 1), p is the\npredicted probability, and the sum is calculated for all classes.\nHowever, assuming there are n training examples, then the\ntotal loss H is computed as the average of the individual losses\nacross all examples.\nIV. EXPERIMENTS', '[43] Y. Zhang and Q. Yang, ‘‘A survey on multi-task learning,’’ IEEE Trans.\nKnowl. Data Eng., vol. 34, no. 12, pp. 5586–5609, Dec. 2022.\n[44] F. Cheng, C. Zhang, and X. Zhang, ‘‘An evolutionary multitasking method\nfor multiclass classification [research frontier],’’ IEEE Comput. Intell.\nMag., vol. 17, no. 4, pp. 54–69, Nov. 2022.\n[45] J. Baek, S. Baek, and S. Han, ‘‘Efficient multitask reinforcement learning\nwithoutperformanceloss,’’IEEETrans.NeuralNetw.Learn.Syst.,vol.35,\nno. 10, pp. 1–15, Oct. 2024.']","The target label is represented in a one-hot encoded vector, and the training objective is to minimize the cross-entropy loss (Zhang et al., 2022).","final unnormalized logits vector using the following equation: α = zW⊤ + b, ∈ R|C| (3) where W ∈ R|C|×768, and b ∈ R|C| are the typical trainable weight and bias parameters in a linear layer. Knowing that the number of classes is more than two, the task belongs to multiclass classification. Typically, the target label is represented in a one-hot encoded vector, as depicted in Fig. 8a. Therefore, the training objective is to minimise the cross-entropy loss, which is computed using the following equation: LCE(y, ˆy) = − |C| yi · log(ˆyi) i=1 ˆy = softmax(α) (4) (5) where y and ˆy are the truth and the predicted label probability distribution respectively. The normalized logits in Eq. 5 is",0.6666666666666666,0.9335496702481915
"study, one of the artefacts of drone devices, the flight log message, is used as the source of the evidence to perform multiclass anomaly severity detection. These human-readable messages, such as ‘‘Aircraft Core Board Overheated’’ and ‘‘Compass error, calibration required’’, can be found in most DJI-make flight logs in three columns: warning, tip, and message. Originally, the flight log was in encrypted.CSV files . Thus, the drone phantom help2 is needed to decrypt the flight log files and then extract the contents. The 2 FIGURE 6. Proposed vector representation of the label based on the dataset characteristics. is computed based on the frequency distribution of the class in the dataset. In this study, three class weights are explored and used","['messages acquired from 82 drone models, mostly from\nDJI. This is one of the main challenges in drone forensics\nresearch, where human-readable flight log datasets from\nother drone models are unavailable. In the future, we plan\nto explore the flight logs of other drone models to train more\ngeneral anomaly detection models. As for the method, multi-\nobjective learning that employs multiple loss functions to\ntrain an anomaly detection model will be explored.\nDATA AVAILABILITY', 'based multiclass drone flight log anomaly detection\nframework that includes three anomaly severity levels:\nlow, medium, and high. Providing the severity level can\nprovide better detection results for the investigator to\npinpoint the event of interest. Interpretability makes\nthe model training and testing more transparent,\ntrustworthy, and human-friendly.\n2) We propose DroneSBERT,1 a domain-specific embed-\nding to extract semantic features that are well-aligned', 'integrity checks, anomaly detection on the visual flight path,\ncommand verification, error reporting, and hardware error\ndetection. GRYPHON is proposed as an open-source tool\nto perform the aforementioned tasks [6]. Previously, DROP,\nas the first open-source tool for parsing drone flight log data\nfrom DJI, was proposed to help the process of acquiring the\nplain information encrypted in the proprietary.DAT dan.TXT\nlog files of the DJI model [7]. Other than that, most of the', 'pp. 100–105.\n[9] S. Silalahi, T.Ahmad, H. Studiawan, E. Anthi, andL. Williams, ‘‘Severity-\noriented multiclass drone flight logs anomaly detection,’’ IEEE Access,\nvol. 12, pp. 64252–64266, 2024.\n[10] J.Cheng,Z.Wang,andG.Pollastri,‘‘Aneuralnetworkapproachtoordinal\nregression,’’ in Proc. IEEE Int. Joint Conf. Neural Netw. (IEEE World\nCongr. Comput. Intell.), Jun. 2008, pp. 1279–1284.\n[11] L. K. Shar, W. Minn, N. B. D. Ta, J. Fan, L. Jiang, and D. L. W. Kiat,', '‘‘DronLomaly: Runtime detection of anomalous drone behaviors via log\nanalysis and deep learning,’’ in Proc. 29th Asia–Pacific Softw. Eng. Conf.\n(APSEC), Dec. 2022, pp. 119–128.\n[12] Z. Zhao, C. Xu, and B. Li, ‘‘A LSTM-based anomaly detection model\nfor log analysis,’’ J. Signal Process. Syst., vol. 93, no. 7, pp. 745–751,\nJul. 2021.\n[13] M. Memarzadeh, B. Matthews, and T. Templin, ‘‘Multiclass anomaly\ndetection in flight data using semi-supervised explainable deep learning']","The proposed multiclass drone flight log anomaly detection framework includes three severity levels: low, medium, and high, which enhances detection results for investigators (Silalahi et al., 2024).","the data is the DJI. After collecting the ﬂight log ﬁles, we use DJI Phantom Help tools to decrypt the ﬁles and get the plain data, which then is parsed to get the log message data. The number of messages from every drone image is shown in Table 1. The next step is identifying the entity type mentioned in the drone log messages. Before reading the log messages, we ﬁltered the duplicate message and got the unique message to read. After carefully reading the unique log message and comprehensively studying what every log message indicates, we categorized the entity types mentioned in the ﬂight log message into six groups, i.e., Component, Action, Parameter, Function, State, and Issue. These entity types",1.0,0.9663368255776366
"the unfiltered is the actual collection of drone flight log messages gathered from the two sources mentioned previously. The dataset is split into training and testing with an 80:20 ratio. The summary of the per-class distribution in the dataset is presented in Table 2. B. BASELINES B. BASELINES In this study, an extensive experiment with various types of encoders is conducted to construct strong baselines for performance comparison. Ensuring the objectivity of the comparison, the hyperparameters of these baselines are fine-tuned using grid search on a finite search space, as shown in Table 3. The details of the baseline construction are described in the following subsections. 1) BASELINE FROM DIVERSE SUITABLE ENCODERS The distinction between the baseline and the proposed","['Artif. Intell., vol. 3, no. 6, pp. 973–993, Dec. 2022.\n[51] S. Silalahi, T. Ahmad, and H. Studiawan, ‘‘DroNER: Dataset for drone\nnamedentityrecognition,’’DataBrief,vol.48,Jun.2023,Art. no. 109179.\n[52] I. AirData UAV. (2023). Drone Error and Warning Codes-World’s\nMost Comprehensive List. [Online]. Available: https://app.airdata.\ncom/wiki/Notifications/\n[53] C. Wang, P. Nulty, and D. Lillis, ‘‘A comparative study on word\nembeddings in deep learning for text classification,’’ in Proc. 4th Int. Conf.', 'In the table, the reported score of our proposed framework’s\nperformance is taken from the best-performing configuration\nas shown in Table 7 and Table 8. It can be seen from the scores\nshown in Table 9 that Neurallog consistently outperforms\nthe other baselines on both datasets. However, our proposed\napproach outperforms all the baselines significantly tested on\nthe filtered dataset, with a 2.564% improvement in accuracy\nthan Neurallog. While for the unfiltered dataset, Dronelog', '[13], we select features into those that only have a value of\nCPU, network sensor, gyroscope sensor, altitude sensor, and\nGPS sensor. Firstly, we write a script that drops the unused\ncolumn from the dataset, as shown in Algorithm 1.\nAlgorithm 1 Algorithm to Drop Unused Column in Datasets\n1: delcolumn = [unused column]\n2: drop(columns=delcolumn)\n3: delcolumn.to csv(filename)\nDownloaded on July 14,2025 at 08:24:14 UTC from IEEE Xplore. Restrictions apply.\nData Preprocessing\nTransformer\nDrone Log Dataset', 'heads as the substitute for the GRU in the encoder\nlayer of pylogsentiment and incorporated integrated\ngradients to perform explainability analysis.\n5) DroLoVe [9]. The study proposed a multitask learning-\nbased anomaly severity detection on drone flight\nlogs with an assumption that, samples belonging to\nTABLE 4. Dataset composition before and after unique filtering.\nTABLE 5. Anomaly severity characteristics.\n105369\nS. Silalahi et al.:\nTABLE 6. Hyperparameter search space for all scenarios.', '‘‘DronLomaly: Runtime detection of anomalous drone behaviors via log\nanalysis and deep learning,’’ in Proc. 29th Asia–Pacific Softw. Eng. Conf.\n(APSEC), Dec. 2022, pp. 119–128.\n[12] Z. Zhao, C. Xu, and B. Li, ‘‘A LSTM-based anomaly detection model\nfor log analysis,’’ J. Signal Process. Syst., vol. 93, no. 7, pp. 745–751,\nJul. 2021.\n[13] M. Memarzadeh, B. Matthews, and T. Templin, ‘‘Multiclass anomaly\ndetection in flight data using semi-supervised explainable deep learning']","The performance scores of the proposed framework are derived from the best-performing configurations, as detailed in the analysis of baseline comparisons (Silalahi et al., 2022).",". There are two datasets: unfiltered and filtered. The unfiltered dataset is a collection of log messages in its original condition gathered from the two sources without performing unique filtering. Therefore, there are several duplicate log messages both in training and testing sets. This is aligned with the real case scenario, where a drone tends to generate the same log message when the event is still happening. It indicates that the current event has yet to be changed or solved (if it is an issue). On the other hand, the filtered dataset is a collection of log messages after a unique filtering process. This is aligned with the norm in supervised learning, where the train and test set must not",0.3333333333333333,0.9021182347360471
"PREVIOUS WORKS Among the relevant published studies in the log-based anomaly detection space, sequence-based is one of the most commonly used approaches. Therefore, there are limited relevant references as this study employs a point-based approach. Below are the relevant baselines from previous research: 1) Pylogsentiment is the first study which employs sentiment analysis-based anomaly detection on operat- ing system logs using GRU and GloVe embedding. 2) SentiLog , similar to , use a two-layered BiLSTM and GloVe embedding model to perform anomaly detection on parallel file system logs. 3) TransSentLog is a further development of and uses a two-layered transformer encoder which used two attention heads and GloVe embedding along with integrated gradients to add explainability to the trained model.","['settings and procedure are described in Section IV, while the\nresults, findings, and discussions are elaborated in Section V.\nFinally, we conclude the paper in Section VI.\nII. RELATED WORKS\nA. LOG-BASED ANOMALY DETECTION\nLog-based anomaly detection is relatively well-studied,\nincluding incorporating ML [1] and deep learning-based [18],\n[19] to facilitate log anomaly detection. Existing anomaly\ndetection modelling techniques can be conducted either in', 'pp. 121–133, Jan. 2022.\n[18] X. Zhao, Z. Jiang, and J. Ma, ‘‘A survey of deep anomaly detection for\nsystem logs,’’ in Proc. Int. Joint Conf. Neural Netw. (IJCNN), Jul. 2022,\npp. 1–8.\n[19] M. Landauer, S. Onder, F. Skopik, and M. Wurzenberger, ‘‘Deep learning\nfor anomaly detection in log data: A survey,’’ Mach. Learn. With Appl.,\nvol. 12, Jun. 2023, Art. no. 100470.\n[20] D. Zhang, D. Dai, R. Han, and M. Zheng, ‘‘SentiLog: Anomaly detecting', 'anomalous log records in a point-based setting.\n3) NeuralLog [21]. The study proposed a log-based\nanomaly detection without parsing to preprocess the\nlogs. BERT is used as the embedding and one-layer\nTransformer encoder with 12 attention heads trained on\nseveral public log datasets in a sequence-based setting.\n4) TransSentLog [36]. The study is an extended work\nof the first baseline, pylogsentiment, which employed\na two-layer Transformer encoder with two attention', 'log-based anomaly detection by pre-training hierarchical transformers,’’\nIEEE Trans. Comput., vol. 72, no. 9, pp. 2656–2667, Sep. 2023.\n[34] T. Zhang, X. Huang, W. Zhao, S. Bian, and P. Du, ‘‘LogPrompt: A log-\nbased anomaly detection framework using prompts,’’ in Proc. Int. Joint\nConf. Neural Netw. (IJCNN), Jun. 2023, pp. 1–8.\n[35] C. Duan, T. Jia, Y. Li, and G. Huang, ‘‘AcLog: An approach to detecting\nanomalies from system logs with active learning,’’ in Proc. IEEE Int. Conf.', 'results, the proposed method achieves the\nscores of 5.128% and 4.453% on the unique-\naccordingly addresses the task objective with\nordinal classification, integrated gradient,\nbanking, medical, and manufacturing. To prevent loss and\nminimize risks due to anomalies and incidents, a num-\nber of approaches have been proposed in the literature.\nA common approach is the log-based anomaly detec-\ntion approach, which involves the analysis of log entries\nrecorded by systems either in sequence-based or point-']","The study extends the work of pylogsentiment by employing a two-layer Transformer encoder with two attention heads for log-based anomaly detection (Zhang et al., 2023).","analysing sentiment contained within a log message to detect anomalous events. More specifically, we can distinguish between normal and abnormal events and also detail the severity of the detected abnormalities. Therefore, VOLUME 13, 2025 105365 S. Silalahi et al.: Interpretable Ordinal-Aware With Contrastive-Enhanced Anomaly Severity Detection TABLE 2. Related works in log-based anomaly detection. the investigator can prioritise the analysis objective to focus only on severe abnormalities. Therefore, we propose an interpretable log anomaly detection framework based on sentiment analysis, as depicted in Fig. 5. During the training phase, we investigate the model’s perception of the semantics of the messages when making predictions. The model is expected to associate the contextual dependency among words and phrases within the input message",0.75,0.8542379873251977
"this section reports the experimental results along with in-depth discussions and analyses. A. BEST PERFORMING SCENARIO A. BEST PERFORMING SCENARIO 1) EVALUATION METRIC After experimenting with all the designed scenarios, the models’ performance is evaluated on the test dataset. The best-performing model from each pair of encoder type and loss function is reported in Table 4 and Table 5 for unfiltered and filtered datasets. Based on the evaluation metrics shown in both tables, the proposed scenario outperforms all baseline scenarios on all encoder types tested on the unfiltered dataset, with an accuracy of 96.875 and an F1 score of 96.851. As for the filtered dataset, the transformer encoder trained on the baseline scenario outperforms the other scenarios on all encoder","['recall, and F1. Note that the weighted average is used to\ncompute the average score of precision, recall, F1, and\nprediction confidence. We investigate the confusion matrix,\nlearned representation, and the interpretability of the model’s\nprediction to increase understanding of the model. Captum,\na tool developed by [57] version 0.7.0 is used for model’s\ninterpretability analysis.\na\nV. EVALUATION AND DISCUSSION\nA. PERFORMANCE EVALUATION\nAfter conducting an extensive experiment on a vast amount', '19,016.86043 MSE, 0.00744 sMAPE, 0.33052 F1-score,\nand 0.50397 MWRE@0.75. The best-performing machine\nlearning model was LightGBM, with evaluation scores\nof 0.99843 R2, 96.76132 MAE, 56,754.18872 MSE,\n0.00833 sMAPE, 0.32185 F1-score, and 0.51070\nMWRE@0.75. CEM and REM outperformed LightGBM.\nAmong MLP, LSTM, GRU, and CNN-LSTM, GRU delivered\nthe best performance in 3 out of 6 metrics, with scores of\n0.99986 R2, 45.81115 MAE, and 5,031.56097 MSE. CNN-\nLSTM excelled in the sMAPE metric, while LSTM surpassed', 'are used in the experiment, there are 1,584 resulting model\nconfigurations in total, 729 for each dataset.\nConsidering the extensive number of hyperparameter\nsearch spaces, not all the results are presented in this paper.\nTherefore, for each encoder type and scenario, only the best-\nperforming one is presented for comparison and explained in\nthe following subsection. Several metrics are used to evaluate\nthe overall models’ performance, i.e., accuracy, precision,', 'TABLE II. COMPARISON OF PARAMETERS AND TRAINING\nDURATION FOR U-NET AND LINK-NET MODELS\nModel Number of Parameters Training Duration\nU-Net 28,953,474 9,155 seconds\nLink-Net 7,041,090 7,981 seconds\nFig. 4 is the distribution of F1-Score values from the best\nmodel testing results for each architecture. Both U-Net and\nLink-Net have asymmetric distributions. The F1-Score val-\nues of both architectures tend to be skewed to the left, where\nthe peak appeared on the right side. There is no F1-Score', 'vector (y), as shown in Equation (19).\ny = Q[O ; O ] (19)\nP H\nB. EVALUATION\nWe evaluated our model for RTE based on its performance\nduring training (t − acc) and validation (v − acc). We mon-\nitored training loss (t − lss) and validation loss (v − lss)\nto guide the training process. To assess the final model’s\ngeneralization ability, we measured precision (P), recall (R),\nF1 score (F1), and accuracy (te − acc) on a separate testing\ndataset.\nIV. EXPERIMENTS\nA. DATA']",The evaluation of model performance includes metrics such as accuracy and F1 score (Interpretable Ordinal-Aware With Contrastive-Enhanced Anomaly Severity Detection on UAV Flight Log Messages).,"there are 1,584 resulting model configurations in total, 729 for each dataset. Considering the extensive number of hyperparameter search spaces, not all the results are presented in this paper. Therefore, for each encoder type and scenario, only the best- performing one is presented for comparison and explained in the following subsection. Several metrics are used to evaluate the overall models’ performance, i.e., accuracy, precision, recall, and F1. Note that the weighted average is used to compute the average score of precision, recall, F1, and prediction confidence. We investigate the confusion matrix, learned representation, and the interpretability of the model’s prediction to increase understanding of the model. Captum, a tool developed by version 0.7.0 is used for model’s interpretability analysis. V.",0.5,0.8637086621686076
"on all encoder types tested on the unfiltered dataset, with an accuracy of 96.875 and an F1 score of 96.851. As for the filtered dataset, the transformer encoder trained on the baseline scenario outperforms the other scenarios on all encoder types with an accuracy of 83.761 and an F1 score of 82.967. The proposed scenario only performs better on the GRU and LSTM encoders than the baseline scenarios. 2) PREDICTION CONFIDENCE Evaluating the performance of a neural model strongly depends on the task and domain problem. In a particular task, accuracy can be the only important metric. However, in some other domains, having a high accuracy does not suffice. For example, in this study, the model needs to be sure","['19,016.86043 MSE, 0.00744 sMAPE, 0.33052 F1-score,\nand 0.50397 MWRE@0.75. The best-performing machine\nlearning model was LightGBM, with evaluation scores\nof 0.99843 R2, 96.76132 MAE, 56,754.18872 MSE,\n0.00833 sMAPE, 0.32185 F1-score, and 0.51070\nMWRE@0.75. CEM and REM outperformed LightGBM.\nAmong MLP, LSTM, GRU, and CNN-LSTM, GRU delivered\nthe best performance in 3 out of 6 metrics, with scores of\n0.99986 R2, 45.81115 MAE, and 5,031.56097 MSE. CNN-\nLSTM excelled in the sMAPE metric, while LSTM surpassed', 'scores on the filtered and unfiltered datasets with significant\nimprovements. This is also the case for the LSTM-based\napproach, which outperforms the Sentilog on the filtered\nand unfiltered datasets. Our best-performing approach, which\nuses a Transformer as the encoder, achieves the highest\namong all the encoders and outperforms the two Transformer-\nbased baselines, Neurallog and TransSentLog. Therefore, the\nproposed approach is superior not only to our own baselines', 'MWRE@0.75. The CEM and REM perform better than\nLightGBM. The best DL architectures without the Trans-\nformer variant and TKAN variant are GRU and CNN-\nLSTM. The GRU has best evaluation score in R2, MAE,\nand MSE. The CNN-LSTM has the best evaluation score\nin sMAPE, F1-score, and MWRE@0.75. The GRU and\nCNN-LSTM perform better than CEM and REM. In the\nTransformer and TKAN variants, the vanilla Transformer\nhas the best performance in 4 of 5 evaluation metrics\nwith evaluation scores of 0.99992 R2, 42.54592 MAE,', 'The BiLSTM model obtained a lower accuracy and F1\nscore of 81.24% and 84.84%, respectively, compared to\nCNN despite having a relatively high recall rate. Mean-\nwhile, the BiGRU model obtained the highest accuracy,\nrecall, precision, and F1 score among the baseline mod-\nels, with a value of 85.46%, 87.80%, 86.85%, and 86.31%,\nrespectively. The CNN-BiGRU model exhibited enhanced\naccuracy and F1 score in contrast to the baseline mod-\nels, with a value of 87.53% and 86.89%, respectively.', 'outperforms all the baselines with a 0.446% improvement in\naccuracy compared to Neurallog.\nConsidering the underlying encoder type used in the\nbaseline approaches, Table 9 presents the performance of\nGRU, BiLSTM, and Transformer paired with the proposed\nlabel schema. Note that the reported scores are the best-\nperforming ones as a result of hyperparameter tuning.\nCompared to pylogsentiment, our proposed approach, which\nuses GRU as the encoder, consistently achieves higher']","The transformer encoder utilized in the study achieved the highest performance among all encoder types tested, outperforming baseline models (Interpretable Ordinal-Aware With Contrastive-Enhanced Anomaly Severity Detection on UAV Flight Log Messages).","precision, recall, F1, and prediction confidence. We investigate the confusion matrix, learned representation, and the interpretability of the model’s prediction to increase understanding of the model. Captum, a tool developed by version 0.7.0 is used for model’s interpretability analysis. V. EVALUATION AND DISCUSSION V. EVALUATION AND DISCUSSION A. PERFORMANCE EVALUATION A. PERFORMANCE EVALUATION After conducting an extensive experiment on a vast amount of hyperparameter search space, the best-performing models for each encoder-scenario pair tested on the unfiltered and filtered dataset are reported on Table 7 and Table 8, respectively. From both tables, it can be seen that the highest score is achieved by the proposed scenario. It demonstrates the advantages of incorporating multitask label schema to train multiclass anomaly severity",0.6666666666666666,0.9384891259934763
"which hyperparameter the accuracy depends on. The dependency can be either increasing or decreasing the accuracy. Nevertheless, it can help choose which hyperparameter to modify in the next experiments. C. COMPARISON WITH STATE-OF-THE-ART MODELS C. COMPARISON WITH STATE-OF-THE-ART MODELS In this study, several baselines from previous studies are reproduced on the dataset to perform performance compar- isons. The reproduced performance from an experimental procedure explained in subsection IV-B2 is presented in Table 6. On both datasets, the proposed scenario outper- forms all the baselines with an improvement of 0.423 and 0.665 in the F1 score on the filtered and unfiltered datasets, respectively. Considering that Pylogsentiment used a GRU-based encoder and SentiLog used an LSTM-based the proposed scenarios on these two","['ensure that the best hyperparameter provided stable accuracy\non each fold.\nDNN is a part of deep learning used in thousands of\napplications (Sabilla et al., 2020) and consists of more\nthan one hidden layer. The main advantage of DNN is that\nit is a ‘‘structure agnostic’’ which means that no special\nassumptions need to be made about the format of the input\n(for example, the input must be an image, video, sound,\nor something else). The number of MOS in the E-nose was', 'various options to improve inference time and FPS, such as\nusing accelerators, adding pruning techniques, post-training\nquantization, and others [74], [75], [76], [77].\nV. CONCLUSION\nThis study’s iYOLOV7-TPE-SS model investigates system\nperformance as mAP, recall, and F1-score improvement\nutilizing multilevel hyperparameter optimization with a\nTree-Structured Parzen Estimator and Space search. Based\non the results, the iYOLOV7-TPE-SS model that uses', 'number of folds that produced the best result is 5-fold, which\nthe data is divided into five equal folds; in each fold, the\nclass distribution became balanced according to the class\ndistribution of the entire population. This stratified k-fold\nis carried out to ensure that the DNN base-models obtained\nfrom hyperparameter tuning and stacked DNN model had\na good performance using different validation and training\ndata. This cross-validated hyperparameter tuning aimed to', '19,016.86043 MSE, 0.00744 sMAPE, 0.33052 F1-score,\nand 0.50397 MWRE@0.75. The best-performing machine\nlearning model was LightGBM, with evaluation scores\nof 0.99843 R2, 96.76132 MAE, 56,754.18872 MSE,\n0.00833 sMAPE, 0.32185 F1-score, and 0.51070\nMWRE@0.75. CEM and REM outperformed LightGBM.\nAmong MLP, LSTM, GRU, and CNN-LSTM, GRU delivered\nthe best performance in 3 out of 6 metrics, with scores of\n0.99986 R2, 45.81115 MAE, and 5,031.56097 MSE. CNN-\nLSTM excelled in the sMAPE metric, while LSTM surpassed', 'are used in the experiment, there are 1,584 resulting model\nconfigurations in total, 729 for each dataset.\nConsidering the extensive number of hyperparameter\nsearch spaces, not all the results are presented in this paper.\nTherefore, for each encoder type and scenario, only the best-\nperforming one is presented for comparison and explained in\nthe following subsection. Several metrics are used to evaluate\nthe overall models’ performance, i.e., accuracy, precision,']","The selection of hyperparameters is crucial as it ensures stable accuracy across different folds in model evaluation (Sabilla et al., 2020).","sequence-based approach in the log-based anomaly detection research, as shown in Table 2. In contrast, this paper uses a point-based approach based on the characteristics of the problem and the dataset. Therefore, there are limited references that can be used as baselines for comparison, as described in the following: 1) Pylogsentiment . Using a point-based approach, a sentiment analysis model is trained using a one-layer VOLUME 13, 2025 105369 S. Silalahi et al.: Interpretable Ordinal-Aware With Contrastive-Enhanced Anomaly Severity Detection TABLE 6. Hyperparameter search space for all scenarios. neighbouring classes share common features. GRU, LSTM, and Transformer are explored to find the best- performing encoder. To provide a fair comparison, the GloVe embedding used in pylogsentiment, SentiLog, and TransSentLog are",0.3333333333333333,0.9076086735454211
"proposed scenario can improve the detection performance of the model. D. ABLATION STUDY D. ABLATION STUDY Following the rapid advancement in neural network research, more complex and sophisticated architectures are emerging. A model can consist of layers of components that have a specific role in the learning process. After conducting an experiment on a certain dataset and task, verifying and checking which component in the model contributes posi- tively to the performance is crucial. Therefore, we perform an ablation study to explain which part of the proposed approach has a significant impact on the performance. Note that only the best-performing scenario on each dataset is explored. First, we investigate the significance of the CLS token from the BERT embedding. Secondly,","['optimizer for integration within the MHA-CovBi model,\naligning with its superior performance metrics.\nE. EFFECT OF ACTIVATION FUNCTION\nThe selection of an appropriate activation function is pivotal\nin the construction of a high-performing deep learning model.\nActivation functions are integral to the architecture of neural\nnetworks, as they introduce non-linear properties, enabling\nthe network to decipher complex patterns within datasets.\nThis research undertakes a comparative analysis of two dis-', 'performance. Secondly, we investigate the effect of using all\nzeroes for the Normal class label’s representation. Thirdly,\nthe importance of the [CLS] token’s embedding vector and\nthe BERT’s parameters are investigated. Lastly, we com-\nprehensively study the effect of the proposed DroneSBERT\nembedding on the model’s performance, interpretability, and\nlearned representations.\nOverall, the multitask label can improve the detection\nperformance, where the best-performing models on both', 'quently evaluate its performance on the given task. For this\nstudy, we configured the training process with the following\nparameters: Epochs: 20, chosen based on experimentation,\nas the validation loss value showed no significant change\nbeyond this point (satisfying min_delta = 0.01). Batch size:\n32. Dropout ratio: 0.5, applied to both the BiLSTM layer\nand the MLP in the classifier layer. Learning rate: 0.1. MLP\nhidden layers: Configured with a tiered structure containing\n512, 64, and 32 hidden states.', '19,016.86043 MSE, 0.00744 sMAPE, 0.33052 F1-score,\nand 0.50397 MWRE@0.75. The best-performing machine\nlearning model was LightGBM, with evaluation scores\nof 0.99843 R2, 96.76132 MAE, 56,754.18872 MSE,\n0.00833 sMAPE, 0.32185 F1-score, and 0.51070\nMWRE@0.75. CEM and REM outperformed LightGBM.\nAmong MLP, LSTM, GRU, and CNN-LSTM, GRU delivered\nthe best performance in 3 out of 6 metrics, with scores of\n0.99986 R2, 45.81115 MAE, and 5,031.56097 MSE. CNN-\nLSTM excelled in the sMAPE metric, while LSTM surpassed', 'The BiLSTM model obtained a lower accuracy and F1\nscore of 81.24% and 84.84%, respectively, compared to\nCNN despite having a relatively high recall rate. Mean-\nwhile, the BiGRU model obtained the highest accuracy,\nrecall, precision, and F1 score among the baseline mod-\nels, with a value of 85.46%, 87.80%, 86.85%, and 86.31%,\nrespectively. The CNN-BiGRU model exhibited enhanced\naccuracy and F1 score in contrast to the baseline mod-\nels, with a value of 87.53% and 86.89%, respectively.']",The significance of the [CLS] token's embedding vector in enhancing model performance is highlighted (Interpretable Ordinal-Aware With Contrastive-Enhanced Anomaly Severity Detection on UAV Flight Log Messages).,"model plays a significant role in performing the task is crucial to developing a high-performing model. To this end, in this paper, an ablation study is performed. First, we investigate the effect of employing multitask learning on the model’s performance. Secondly, we investigate the effect of using all zeroes for the Normal class label’s representation. Thirdly, the importance of the [CLS] token’s embedding vector and the BERT’s parameters are investigated. Lastly, we com- prehensively study the effect of the proposed DroneSBERT embedding on the model’s performance, interpretability, and learned representations. Overall, the multitask label can improve the detection performance, where the best-performing models on both datasets are achieved by the proposed Multitas-111 label. Using all zeroes to represent the Normal",0.0,0.927210158053071
"to explain which part of the proposed approach has a significant impact on the performance. Note that only the best-performing scenario on each dataset is explored. First, we investigate the significance of the CLS token from the BERT embedding. Secondly, we analyse the impact of freezing the BERT’s parameter during training. Thirdly, we vary the batch size during the training. Finally, FIGURE 11. Analysis of the effect of different batch sizes on the evaluation scores of the best-performing models. we examine the effect of increasing the prediction threshold used in our proposed approach on the accuracy and F1 scores. As shown in Table 6, excluding the CLS token embedding before feeding the input matrix to the encoder significantly decreases performance.","['pattern is shown in Table 8 regarding the hyperparameter\nvalues on each encoder type. The GRU works well with\nmore layers, average pooling, and uniform class weighting.\nDifferently, the Linear model has benefited from the [CLS]\ntoken’s representation, balanced class weight for baseline\nand focal scenarios, and uniform weighting for the multitask\nscenarios. Similar to the Linear model, transformer-based\nbest-performing models use [CLS] tokens as the final', 'embeddings. These embedding methods were chosen to\neffectively capture the syntactic and semantic information of\nwords [38], [39]. At this stage, we deliberately opted not to\nuse transformer-based word embedding techniques such as\nBERT or similar models, focusing instead on the more tra-\nditional word embedding methods to maintain computational\nefficiency while addressing the study’s primary goals.\nThe training process of the neural network involves\noptimizing parameter values to learn a model and subse-', 'ever, using the BiLSTM model is computationally expensive,\nespecially when dealing with large datasets [18]. BiLSTM is\nalso prone to overfitting, especially when trained on small\ndatasets [19].\nPrevious studies have not considered using different\npre-trained word embeddings when dealing with multiple\nlanguages in one model. One of the challenges of multilingual\ntext classification is how to create effective word or sentence\nembeddings that can be used in various languages. Multilin-', '4: word index ← tokenizer.word index\n5: seqs ← tokenizer.texts to sequences(all sents)\n6: max len ← max length of seqs\n7: seqs padded ← pad sequences(seqs,maxlen = max len)\n8: seqs padded ← normalize(seqs padded) ▷ Normalize input data\n9: model ← Sequential()\n10: model.add(Embedding(len(word index) + 1,64))\n11: model.add(LSTM(64))\n12: model.add(Dense(1,activation =′ sigmoid′))\n13: model.compile(loss =′ binary crossentropy′,optimizer =′\nadam′,metrics = [′accuracy′])', 'embedding on the models’ performance.\nThe scale factor implemented in scaled dot-product atten-\ntion, as proposed in the vanilla Transformer, has been argued\nbetter not be used in the NER task [37]. The reason is to\nsharpen the probability distribution yielded by the softmax\nin the self-attention mechanism. The sharper the attention,\nthe fewer contexts are captured by the attention, aligning to\nthe span length of mentioned entities commonly exist [37].']",The CLS token's representation has been shown to significantly enhance the performance of transformer-based models (Referensi 1).,"CRF is used as the decoder. In terms of convergence speed, as depicted in Fig. 11, the proposed method converges as fast as Transformer and AdaTrans. Moreover, cosine atten- tion outperforms the BiLSTM model. From the F1 score, our proposed method achieves the second-best performance FIGURE 10. Comparison between different encoders with the best performance on the test set of the contextual dataset. results reported in Table 7 to 9, the involvement of either con- textual or static embedding signiﬁcantly affects the model’s performance evaluation score. This can be seen from the dot-product attention performance, with a 3.782% difference between the best dot-product attention that uses BERT and GloVe. This signiﬁcant difference is also happening to the cosine attention, with",0.0,0.8750051978620851
"effect of increasing the threshold on the accuracy and F1 scores of the best-performing model tested on both datasets. An interesting case is shown in Fig 12a when λ = 0.65, the accuracy reaches 97%, exceeding the best model’s accuracy when λ = 0.5. This happens when the prediction confidence score surpasses the threshold while the true label’s severity is lower than the prediction label’s. Thus, following the decoding procedure in section III-C, the predicted label is incorrect. This phenomenon also happens on the filtered dataset when λ > 0.94. Overall, the decrement in the accuracy and F1 scores is insignificant until λ = 0.9 and λ = 0.8 on the unfiltered and filtered datasets, respectively. Thus, it confirms the","[""metrics can be calculated by (1) – (3). This study's\ncalculation of True Positive, False Positive, and False\nNegative differs from other classifications or detections\n[20]-[23]. These are chosen and calculated following\nprevious studies [1]. Precision detects the truly correct\nprediction out of all predictions. Recall detects the truly\ncorrect prediction out of all actual classes. F1 scores are\nharmonic mean between these two that measure overall\nmodel performance. These metrics are produced by"", 'recall, and F1. Note that the weighted average is used to\ncompute the average score of precision, recall, F1, and\nprediction confidence. We investigate the confusion matrix,\nlearned representation, and the interpretability of the model’s\nprediction to increase understanding of the model. Captum,\na tool developed by [57] version 0.7.0 is used for model’s\ninterpretability analysis.\na\nV. EVALUATION AND DISCUSSION\nA. PERFORMANCE EVALUATION\nAfter conducting an extensive experiment on a vast amount', 'range of points of view, like precision, accuracy, recall, and\nF1 score. Subsequently, the model exhibiting the best\nperformance was reviewed extensively through the analysis of\na confusion matrix.\nThis study utilized Python for analysis and all\nprogramming tasks were conducted within the Scikit-learn\nframework. In scikit-learn (sklearn), the dataset is divided into\ntraining data and testing data utilizing train_test_split to\nfacilitate classifier training and performance evaluation[20].', 'interpreting it as a probability. The sigmoid function’s dis-\ntinctive ‘S’ shape allows for a smooth and gradual transition\nbetween the two extremes of probability. This transition is\nparticularly important in cases where the decision boundary\nbetween two classes is unclear. Finally, the model utilizes\nthe binary cross-entropy loss function, deemed appropri-\nate for binary classification tasks. The binary cross-entropy\nloss, a conventional loss function for binary classification,', 'apt for binary classification tasks, as corroborated by exist-\ning literature [45]. This function is prevalently utilized in\nbinary classification scenarios to ascertain the likelihood of\ndata points belonging to one of two categories, producing\nan output value ranging between 0 and 1, which is con-\nducive to probability interpretation. Conversely, the softmax\nfunction is tailored for multiclass classification contexts, gen-\nerating a probability distribution across numerous classes.']",The evaluation of model performance includes an investigation of the confusion matrix to enhance understanding of predictions (Referensi 2).,"we further analyse the effect of increasing the prediction threshold upon inferring the label. As the threshold value is closer to 1, a notable decrease can be seen in Fig. 13b, starting from 0.94. Conversely, the unfiltered dataset in Fig 13a shows a negligible decrease. C. ERROR ANALYSIS C. ERROR ANALYSIS This section discusses the confusion matrix, learned rep- resentation, and the interpretability of the best-performing model on the filtered dataset. The confusion matrix in this paper is redefined to align with the anomaly severity context, where the distance between true and predicted labels matters. If the predicted label is lower than the true label, we define it False Positive (FP). Conversely, if the true label is lower than the",0.6666666666666666,0.9264424569381146
"each scenario. FIGURE 14. The number of misclassified samples from the best-performing model on each loss function tested on the unfiltered dataset. In a binary setting, let the Normal class be positive and the Anomaly is negative. Then, False Positive (FP) refers to samples with a true label negative but predicted as positive. At the same time, a False Negative (FN) is a case when a sample belongs to a positive class but is predicted as negative. However, in this study, we define the misclassification cases differently: • False Positive refers to a case when the true class is higher than the predicted class. • False Negative is a misclassification case where the true class is lower than the predicted","['detection accuracy for binary and multi-class settings [16].\nAs described in Section IV-A, the dataset used in this paper is\nimbalanced. In this case, Section III-B discusses the approach\nto handle this imbalance.\nThis study proposes to extend the binary anomaly detection\ninto a multiclass anomaly detection involving four classes:\nNormal, Low, Medium, and High. The three anomaly classes\nrepresenting the severity of the abnormality are distinguished', 'threshold upon inferring the label. As the threshold value is\ncloser to 1, a notable decrease can be seen in Fig. 13b, starting\nfrom 0.94. Conversely, the unfiltered dataset in Fig 13a shows\na negligible decrease.\nC. ERROR ANALYSIS\nThis section discusses the confusion matrix, learned rep-\nresentation, and the interpretability of the best-performing\nmodel on the filtered dataset. The confusion matrix in this\npaper is redefined to align with the anomaly severity context,', 'where the distance between true and predicted labels matters.\nIf the predicted label is lower than the true label, we define\nit False Positive (FP). Conversely, if the true label is lower\nthan the predicted label, we define it False Negative (FN).\nIn this context, having less FP is more important than\nhaving less FN, as the task objective is anomaly severity\ndetection, where we aim to detect all abnormalities along\nwith the severity level. Therefore, undetected abnormalities,', 'settings and procedure are described in Section IV, while the\nresults, findings, and discussions are elaborated in Section V.\nFinally, we conclude the paper in Section VI.\nII. RELATED WORKS\nA. LOG-BASED ANOMALY DETECTION\nLog-based anomaly detection is relatively well-studied,\nincluding incorporating ML [1] and deep learning-based [18],\n[19] to facilitate log anomaly detection. Existing anomaly\ndetection modelling techniques can be conducted either in', 'results, the proposed method achieves the\nscores of 5.128% and 4.453% on the unique-\naccordingly addresses the task objective with\nordinal classification, integrated gradient,\nbanking, medical, and manufacturing. To prevent loss and\nminimize risks due to anomalies and incidents, a num-\nber of approaches have been proposed in the literature.\nA common approach is the log-based anomaly detec-\ntion approach, which involves the analysis of log entries\nrecorded by systems either in sequence-based or point-']","In this study, False Positive (FP) is defined as a case when the predicted label is lower than the true label, while False Negative (FN) occurs when the true label is lower than the predicted label (Interpretable Ordinal-Aware With Contrastive-Enhanced Anomaly Severity Detection on UAV Flight Log Messages).","we further analyse the effect of increasing the prediction threshold upon inferring the label. As the threshold value is closer to 1, a notable decrease can be seen in Fig. 13b, starting from 0.94. Conversely, the unfiltered dataset in Fig 13a shows a negligible decrease. C. ERROR ANALYSIS C. ERROR ANALYSIS This section discusses the confusion matrix, learned rep- resentation, and the interpretability of the best-performing model on the filtered dataset. The confusion matrix in this paper is redefined to align with the anomaly severity context, where the distance between true and predicted labels matters. If the predicted label is lower than the true label, we define it False Positive (FP). Conversely, if the true label is lower than the",0.6666666666666666,0.9310499226469858
"study, we define the misclassification cases differently: • False Positive refers to a case when the true class is higher than the predicted class. • False Negative is a misclassification case where the true class is lower than the predicted class. Table 7 shows the position of FP and FN based on the above definition in a multiclass confusion matrix. VOLUME 12, 2024 64263 S. Silalahi et al.: Severity-Oriented Multiclass Drone Flight Logs Anomaly Detection FIGURE 15. A 2D visualisation of the filtered dataset representation obtained from the best model from each loss function tested on the filtered dataset. t-SNE is used to reduce the dimension of the embeddings. In an anomaly detection setting, FP is more important than FN","['pp. 100–105.\n[9] S. Silalahi, T.Ahmad, H. Studiawan, E. Anthi, andL. Williams, ‘‘Severity-\noriented multiclass drone flight logs anomaly detection,’’ IEEE Access,\nvol. 12, pp. 64252–64266, 2024.\n[10] J.Cheng,Z.Wang,andG.Pollastri,‘‘Aneuralnetworkapproachtoordinal\nregression,’’ in Proc. IEEE Int. Joint Conf. Neural Netw. (IEEE World\nCongr. Comput. Intell.), Jun. 2008, pp. 1279–1284.\n[11] L. K. Shar, W. Minn, N. B. D. Ta, J. Fan, L. Jiang, and D. L. W. Kiat,', '‘‘DronLomaly: Runtime detection of anomalous drone behaviors via log\nanalysis and deep learning,’’ in Proc. 29th Asia–Pacific Softw. Eng. Conf.\n(APSEC), Dec. 2022, pp. 119–128.\n[12] Z. Zhao, C. Xu, and B. Li, ‘‘A LSTM-based anomaly detection model\nfor log analysis,’’ J. Signal Process. Syst., vol. 93, no. 7, pp. 745–751,\nJul. 2021.\n[13] M. Memarzadeh, B. Matthews, and T. Templin, ‘‘Multiclass anomaly\ndetection in flight data using semi-supervised explainable deep learning', 'based multiclass drone flight log anomaly detection\nframework that includes three anomaly severity levels:\nlow, medium, and high. Providing the severity level can\nprovide better detection results for the investigator to\npinpoint the event of interest. Interpretability makes\nthe model training and testing more transparent,\ntrustworthy, and human-friendly.\n2) We propose DroneSBERT,1 a domain-specific embed-\nding to extract semantic features that are well-aligned', 'predictions on unseen data [5].\nThis paper proposes the Transformer method for classifying\ndrone malfunctions based on telemetry data. By leveraging\ntheir ability to handle sequential data and capture complex\nrelationships, Transformer model can provide accurate and\nDownloaded on July 14,2025 at 08:24:14 UTC from IEEE Xplore. Restrictions apply.\nrobust predictions, enabling drone operators to detect and\ndiagnose malfunctions quickly and take corrective actions.', 'heads as the substitute for the GRU in the encoder\nlayer of pylogsentiment and incorporated integrated\ngradients to perform explainability analysis.\n5) DroLoVe [9]. The study proposed a multitask learning-\nbased anomaly severity detection on drone flight\nlogs with an assumption that, samples belonging to\nTABLE 4. Dataset composition before and after unique filtering.\nTABLE 5. Anomaly severity characteristics.\n105369\nS. Silalahi et al.:\nTABLE 6. Hyperparameter search space for all scenarios.']",Silalahi et al. (2024) define False Positive as a case when the true class is higher than the predicted class and False Negative as a case where the true class is lower than the predicted class.,"be employed to force the model to learn a distinctive representation of the positive FIGURE 4. An illustration of anomalies that occur during a drone’s flight. inclusive. Therefore, this paper proposes a multitask-based multiclass drone anomaly detection to assist in a forensic investigation. The main contributions of this paper are summarized as follows: 1) We propose DroneLog, an interpretable sentiment- based multiclass drone flight log anomaly detection framework that includes three anomaly severity levels: low, medium, and high. Providing the severity level can provide better detection results for the investigator to pinpoint the event of interest. Interpretability makes training and testing more transparent, the model trustworthy, and human-friendly. 2) We propose DroneSBERT,1 a domain-specific embed- ding to extract semantic features",0.0,0.8975060333234026
"the performance of the proposed framework has been discussed and analysed. In this section, challenges encountered during the study are disclosed, along with limitations and threats to validity. As drone forensics is an emerging topic, there are very limited public datasets available. The log messages used in this study are mainly acquired from DJI-made devices. There is yet to come a publicly available dataset of log messages from other drone manufacturers. Several publicly available datasets are mainly about sensor data and multimedia artefacts . While in this study, we solely depend on the human-readable messages generated by the drone during a flight. Given the condition where a small number of unique messages and most of them are acquired from DJI","['messages acquired from 82 drone models, mostly from\nDJI. This is one of the main challenges in drone forensics\nresearch, where human-readable flight log datasets from\nother drone models are unavailable. In the future, we plan\nto explore the flight logs of other drone models to train more\ngeneral anomaly detection models. As for the method, multi-\nobjective learning that employs multiple loss functions to\ntrain an anomaly detection model will be explored.\nDATA AVAILABILITY', 'and activities that happen during a flight and stores the\nrecorded events in log files. These files contain not only\nempirical processes but also record the sensor data for every\ncertain time period, making the drone forensic-ready in case\nencounters an accident or incident. Assuming that the log data\nare admissible, a forensic investigation can be conducted to\nunderstand the incident scenario and uncover the root cause.\nTo do so, several artefacts such as flight logs, images, videos,', 'Furthermore, Jain et al. [10] proposed a framework for\nsensor data identification and verification. An analysis of a\ndrone’s architecture and a forensic model with generic features\nare proposed here in order to enhance the digital investigation\nprocess. Also, Barton et al. [11] conducted the research to\nreconstruct the actions taken by these drones, identify their\nowners or operators, and extract data from associated mobile\ndevices.\nIn other research in drone forensics, this paper also analyze', 'drones. Therefore, it is critical to guarantee the security of the\ndevice. To this end, more sophisticated security and forensic\nprocedures are needed to develop to diminish the risk caused\nby any attack or incident [3].\nLicense. For more information, see https://creativecommons.org/licenses/by/4.0/ 3257\nS. Silalahi et al.:\nFIGURE 1. An illustration of entity types in a forensic timeline\nIn the digital forensic research area, drone forensics is a\nquite new research topic. Generally, it is categorized into', 'The drone images are stored in several different formats,\nsuch as.ZIP,.001, and.BIN. These images are acquired from\nthe controller devices, which are considered the primary\nevidence close to the owner and contain incident-related\ninformation [58]. After exploring the drone images with the\n3https://www.vtolabs.com/drone-forensics\n3266\net al.: Transformer-Based NER on Drone Flight Logs to Support Forensic Investigation\nfolders are the location of the flight log files containing human-readable']","The challenges in drone forensics include the limited availability of human-readable flight log datasets, primarily sourced from DJI devices, as noted in the study of UAV flight log messages (Interpretable Ordinal-Aware With Contrastive-Enhanced Anomaly Severity Detection on UAV Flight Log Messages).","a scenario design, data generation and acquisi- tion, data analysis, and ﬁnally, reporting. Several references are using DJI , , , Cheerson , Parrot , and Yuneec model as experimental devices. However, there is no attempt to utilize speciﬁc data, in this case, the log message, to perform a drone forensic investigation. For this reason, we propose a deep learning-based Natural Language Processing (NLP) technique to perform information extrac- tion from the log message to assist the forensic investigation process. Information Extraction (IE) is one of the sub-topic in the NLP research domain, which aims to infer knowledge from a lake of text data. There are several steps in performing information extraction; after data source collection and pre- processing, Named",0.75,0.9586226579905732
"the model can be convincing and accountable enough to the investigator to be included in the investigation report. VII. CONCLUSION AND FUTURE WORK VII. CONCLUSION AND FUTURE WORK In this paper, we demonstrate how to train a log-based anomaly detection model that can prioritise the prediction of higher severity anomalies on drone flight logs while increasing the prediction confidence score at the same time. Considering the nature of the dataset, where samples that belong to different severity levels share common features, a multitask vector label representation along with severity-oriented decoding is proposed. An extensive experiment proved that the proposed approach is better than the previous work baselines while being inferior to our baseline scenario based on the accuracy and F1","['based multiclass drone flight log anomaly detection\nframework that includes three anomaly severity levels:\nlow, medium, and high. Providing the severity level can\nprovide better detection results for the investigator to\npinpoint the event of interest. Interpretability makes\nthe model training and testing more transparent,\ntrustworthy, and human-friendly.\n2) We propose DroneSBERT,1 a domain-specific embed-\nding to extract semantic features that are well-aligned', 'seven out of eight examples belonging to the High severity\nhaving positive attribution scores. The model perceives the\nlog messages better than the previous BERT-based model.\nThe complete report of attributions toward each severity label\ncan be accessed on the repo.\nVI. CONCLUSION\nThis paper investigates utilising a multitask learning\nparadigm to perform multiclass anomaly detection on drone\nflight log messages. Aligning to the nature of multitask', 'heads as the substitute for the GRU in the encoder\nlayer of pylogsentiment and incorporated integrated\ngradients to perform explainability analysis.\n5) DroLoVe [9]. The study proposed a multitask learning-\nbased anomaly severity detection on drone flight\nlogs with an assumption that, samples belonging to\nTABLE 4. Dataset composition before and after unique filtering.\nTABLE 5. Anomaly severity characteristics.\n105369\nS. Silalahi et al.:\nTABLE 6. Hyperparameter search space for all scenarios.', 'are considered equally important. However, the peculiar\nmight contain distinct features indicating the anomalies’\nmessage ‘‘Critically low power. Aircraft is landing’’ is more\nnot Working’’. This study proposes DroneLog, an interpretable\nseverity levels on drone flight logs, using a multitask learning\nwith the multitask learning nature, two target label representations\nlevel common features of the input messages over various\nsignificant hyperparameter search space is performed to find', '‘‘DronLomaly: Runtime detection of anomalous drone behaviors via log\nanalysis and deep learning,’’ in Proc. 29th Asia–Pacific Softw. Eng. Conf.\n(APSEC), Dec. 2022, pp. 119–128.\n[12] Z. Zhao, C. Xu, and B. Li, ‘‘A LSTM-based anomaly detection model\nfor log analysis,’’ J. Signal Process. Syst., vol. 93, no. 7, pp. 745–751,\nJul. 2021.\n[13] M. Memarzadeh, B. Matthews, and T. Templin, ‘‘Multiclass anomaly\ndetection in flight data using semi-supervised explainable deep learning']","The inclusion of severity levels in anomaly detection models enhances the ability to identify events of interest in drone flight logs (S. Silalahi et al., 2022).","severity level can provide better detection results for the investigator to pinpoint the event of interest. Interpretability makes training and testing more transparent, the model trustworthy, and human-friendly. 2) We propose DroneSBERT,1 a domain-specific embed- ding to extract semantic features that are well-aligned to the human perception of the log message samples. Supervised contrastive learning is employed to learn distinct representations for each anomaly severity level. 3) We explore two target label representations to augment a multitask learning paradigm for training multiclass classification models. Aligning to the dataset character- istics where the log messages from different anomaly severity levels share common words and phrases, multitask learning can help the model make use of the shared low-level features in the log",0.5,0.9165052232662577
"ANALYSIS We conducted a controlled experiment to evaluate the influence of various word embedding methods on our model’s performance. We used different word embedding techniques, explicitly using fastText as an alternative method to provide comparative performance data for the architecture with different word embedding inputs. This experiment used 540k sentence pairs and maintained the same settings as the previous experiments. This experi- ment compared the results obtained in a previous experiment using the Glove word embedding technique. The performance comparison of the model using different word embedding techniques is shown in Table 4. As seen in 4, our model performs better with Glove word embedding than FastText. Glove’s advantages align with the findings of , which state that the Glove","['adequate input representations. Most often, word embedding\ntechniques like GloVe [39], Word2vec [40], BERT [22], and\nELMo [41] are used to learn the input representation. Pre-\ntrained language models, such as BERT and ELMo, can\ngenerate contextualized representational vectors after going\nthrough a pre-trained procedure on a large corpus. Contrary,\nGloVe employs local and global statistics to build a word\nvector, yielding a static lookup dictionary after being trained', 'ships among words, where aligned vectors often represent\nwords with similar meanings. Applying word embeddings\nextends to various fields, such as text classification, machine\ntranslation, and recommender systems. Word embeddings\ncan filter and encode linguistic information into a compact\nvector form, making them an indispensable tool in NLP.\nIn this study, pretrained word embedding is created using\na combination of FastText and GloVe embeddings. The', 'than Indonesian and English), the word is translated into\nEnglish, and the GloVe word embedding is used. The trans-\nlation process is carried out using the Google Translate API.\nThe choice of English is driven by its widespread use as a\nglobal language. The different selection of word embedding\nfor words in different languages aims to produce feature\nvectors superior to feature vectors generated from a single\nword embedding model. In addition, this selection strategy', 'showed that FastText produced the best results for Indonesian\ntext.\nOn the other hand, the GloVe model constructs vector\nrepresentations of words within a corpus predicated upon\nthe statistical co-occurrence frequencies of words in analo-\ngous contexts. The foundational premise of GloVe posits that\nwords manifesting with high frequency in similar contexts\nare likely to bear akin or related semantic meanings. The\nobjective of the training regimen is to cultivate a vector', 'Comput., vol. 9, no. 8, pp. 1735–1780, Nov. 1997.\n[49] K. Cho, B. van Merrienboer, C. Gulcehre, D. Bahdanau, F. Bougares,\nH. Schwenk, and Y. Bengio, ‘‘Learning phrase representations using\nRNN encoder–decoder for statistical machine translation,’’ in Proc.\nConf. Empirical Methods Natural Lang. Process. (EMNLP), 2014,\npp. 1724–1734.\n[50] C. Wang, P. Nulty, and D. Lillis, ‘‘A comparative study on word\nembeddings in deep learning for text classification,’’ in Proc. 4th Int. Conf.']","The GloVe word embedding technique constructs vector representations of words based on statistical co-occurrence frequencies, resulting in a static lookup dictionary after training (Referensi 1).","6 show the models’ architecture where LSTM and CNN were used as the character embedding, respectively. From the evaluation score presented in Table 4 to 6, the best performance was achieved by GloVe – Scaled AdaTrans combination with an 87.771% F1 score. AdaTrans atten- tion consistently achieves the highest score for all character embedding and word embedding options. GloVe outperforms the BERT embedding evaluated on the non-contextual dataset for all scenarios. This is because the ﬁrst dataset has con- sistent tagging, meaning that a word has a consistent tag for all different contexts in the dataset. It complies with the GloVe behavior, where each word has exactly one representa- tional vector. BERT – Scaled Transformer achieved the best overall performance",0.75,0.9586616369104259
"research introduces a novel Activity Recom- mendation System built on the COBIT 2019 framework tailored for Financial Balance Scorecard. The motivation stems from the challenges faced by auditors when identifying essential activities aligned with strategy of a company, often hindered by manual COBIT 2019 guideline navigation. To address this, a system was developed, where inputting the company strategy, triggers the display of recommended activities automatically. The methodology involved creating interconnected nodes from COBIT 2019 Element in Neo4J. This research uses a real strategy plan case study from 3 different companies as input, followed by a preprocessing step, then compares it to Enterprise Goals using TF-IDF and cosine similarity. Goals with high similarity scores trigger a graph query to reveal connected","['for extra work.\nV. CONCLUSION\nThis paper propose a novel recommendation system for\ninternal business processes based on the COBIT 2019 frame-\nwork. By integrating graph algorithms and similarity methods,\nour approach provides tailored activity recommendations that\nalign with an organization’s strategic goals. We mapped enter-\nprise goals to management objectives, identified relevant ac-\ntivities, and used graph queries to retrieve actionable insights.\nUtilizing Cypher Query Language (CQL) and Neo4j’s graph', 'capabilities of Graph Databases, especially Neo4j, in providing\neffective solutions to complex problems.\nA. Dataset and Preprocessing\nThe experimental process involves collecting datasets from\nCOBIT 2019, specifically focusing on the Balanced Scorecard\nfor internal business processes. Process mapping is then con-\nducted as the basis for forming nodes later on. An example\nof this mapping process is shown in Table I, which maps\nthe Balanced Scorecard (BSC), Enterprise Goals (EG), and\nAlignment Goals (AG).', 'This allows for deeper analysis, real-time monitoring, and\nbetter decision-making in IT management, ultimately aiding\nin the achievement of business goals [11].\nIn summary, this paper proposes the development of a\nrecommendation system based on COBIT 2019’s internal\nbusiness processes, utilizing graph algorithms and similarity\nmethod to provide organizations with a dynamic tool for\nmanaging risk, compliance, and performance in the realm of\ninformation technology [12].\nII. LITERATURE STUDY', 'by providing organizations with a valuable tool to automate and\nimprove IT strategies, effectively achieving business objectives.\nstI Index Terms—COBIT 2019, graph algorithms, IT governance,\ndna LSTM, Neo4j, recommendation system, regulatory compliance,\nsemantic similarity, TF-IDF\nnoitavonnI\nI. INTRODUCTION\nCOBIT 2019, which stands for Control Objectives for\nygolonhceT\nInformation and Related Technologies, is a comprehensive\nframework developed by ISACA (Information Systems Audit', '[6]\n[7]\n[8]\n[9]\nFig. 5. The graphical representation obtained in Neo4J\n[10]\nIn conclusion, our research advances IT governance by\nleveraging graph algorithms and Neo4j to develop a rec-\nommendation system for internal business processes based [11]\non COBIT 2019. Future research could address scalability,\nintegration with other frameworks, and adaptation for different\nindustries, with our approach holding potential for broad\npractical implementation. [12]\nACKNOWLEDGMENT']",The proposed recommendation system integrates graph algorithms and similarity methods to provide tailored activity recommendations aligned with an organization’s strategic goals (A Recommendation System for Internal Business Processes of COBIT 2019 Using Graph Algorithm and Similarity Methods).,"company goals by proposing a novel recommendation system for internal business processes, grounded in the COBIT 2019 framework. The system employs graph algorithms to map relationships, semantic similarity measure- ments to align enterprise goals with management objectives, and LSTM combined with TF-IDF methods to analyze and recommend specific activities. Experimental results show that this system optimizes IT management practices, enhances operational efficiency, and ensures regulatory compliance. Additionally, a user-friendly graphical representation of internal business pro- cesses using Neo4j enables stakeholders to visualize complex relationships within the COBIT framework, facilitating informed decision-making. This research advances IT governance practices by providing organizations with a valuable tool to automate and improve IT strategies, effectively achieving business objectives. Index Terms—COBIT 2019, graph algorithms, IT",0.75,0.8798053908422102
"management are vital for businesses in rapidly evolving landscape nowadays. Imple- menting an IT governance framework is crucial for several reasons. Firstly, it enables effective risk management against cyber threats, data breaches, and regulatory requirements, enhancing resilience and protecting sensitive data. Secondly, it ensures alignment between IT strategies and business ob- jectives, driving efficiency, innovation, and competitiveness. Lastly, it facilitates compliance with data privacy regulations and industry standards, ensuring transparency and accountabil- ity. Among these frameworks, COBIT is globally recognized for overseeing Enterprise Information and Technology (I&T) comprehensively, covering all systems regardless of their lo- cation within the organization. In essence, Enterprise I&T extends beyond the confines of the IT department and encompasses all facets of technology and information processing","['[15], [16]. By utilizing the COBIT 2019 framework,\norganizations can prioritize processes, set target capability\nlevels, and design effective governance systems for IT\nprojects [17], [18]. Implementing COBIT 2019 in software\ndevelopment projects allows for mapping IT resources,\nprioritization of governance objectives, and alignment of\nbusiness and IT strategies, ultimately enhancing project\nsuccess. Additionally, the BAI approach emphasizes managed\norganizational change, which is crucial for preparing', ""and regulatory compliance. This combined approach\nimproves project efficiency and strengthens IT governance\nand resource management for long-term sustainability.\nOverall, this study's findings support the importance of\nadopting a data-driven approach in IT project management\nand governance and provide practical guidance for\norganizations seeking to improve the efficiency of their IT\nservice delivery using proven management technologies and\nframeworks.\nACKNOWLEDGMENT"", 'Deliver, Service, and Support (DSS) domain of the\nCOBIT framework, with a specific emphasis on managing IT\noperations [5]. Its main goal is to guarantee that IT operations\nare executed effectively, securely, and in accordance with\nbusiness requirements. Essential activities under this process\ninclude the monitoring and management of IT service\nperformance, handling incidents and problems, and ensuring\nthe security of the system[7]. TABLE I provides a detailed', '4th Kelly Sungkono\nInformatics Departments\nInstitut Teknologi Sepuluh Nopember\nSurabaya, Indonesia\nkelly@its.ac.id\nbuilding the most suitable governance system for an enterprise\n[3]. By utilizing COBIT 2019, organizations can enhance the\nefficiency, effectiveness, and reliability of their IT usage, while\nalso ensuring compliance with relevant regulations, policies,\nand standards [4].\nOne of the key features of COBIT 2019 is its ability to\nassist organizations in identifying, measuring, and managing', 'M. M. Jawad, M. H. Ali, A. A. Khaleel, and M. F.\nHasan, “Evaluating the performance of it management\nunder the implementation of the cobit 2019 framework,”\nEximia, vol. 12, pp. 18–36, 2023.\nA. Safitri, I. Syafii, and K. Adi, “Measuring the perfor-\nmance of information system governance using frame-\nwork cobit 2019,” International Journal of Computer\nApplications, vol. 174, no. 31, pp. 23–30, 2021.\nS. De Haes, W. Van Grembergen, A. Joshi, T. Huygh, S.\nDe Haes, W. Van Grembergen, A. Joshi, and T. Huygh,']","Utilizing the COBIT 2019 framework allows organizations to prioritize processes and design effective governance systems for IT projects, enhancing alignment between IT strategies and business objectives.","assist organizations in managing and optimizing their use of information technology (IT) . landscape, effective IT In today’s rapidly evolving digital governance is essential for organizations to ensure that their IT investments align with business objectives, comply with regulations, and mitigate risks . COBIT 2019 provides a structured approach for organiza- tions to establish, implement, and maintain effective gover- nance over IT. It defines the components necessary to create and sustain a governance system, as well as guidelines for building the most suitable governance system for an enterprise . By utilizing COBIT 2019, organizations can enhance the efficiency, effectiveness, and reliability of their IT usage, while also ensuring compliance with relevant regulations, policies, and standards . One of the key",1.0,0.8947837379629375
"COBIT Core Model and Capability Scores, it is necessary to undergo a mapping process according to the instructions in the COBIT 2019 manual. This can be time-consuming, especially when auditor should auditing multiple companies simultaneously. This research aim to simplify the process to get Activities of COBIT 2019 automatically from Input Text Company Strategy that aligned with the description of related Enterprise Goals. This research adopts Neo4j, a graph database platform, to manage KG and process data related to these objectives, to gain deeper and more applicable insights into the relationships between strategic and operational objectives in a company . Furthermore, this research also involves the function of preprocessing the input text in the form of Company Strat- egy using","['capabilities of Graph Databases, especially Neo4j, in providing\neffective solutions to complex problems.\nA. Dataset and Preprocessing\nThe experimental process involves collecting datasets from\nCOBIT 2019, specifically focusing on the Balanced Scorecard\nfor internal business processes. Process mapping is then con-\nducted as the basis for forming nodes later on. An example\nof this mapping process is shown in Table I, which maps\nthe Balanced Scorecard (BSC), Enterprise Goals (EG), and\nAlignment Goals (AG).', '[6]\n[7]\n[8]\n[9]\nFig. 5. The graphical representation obtained in Neo4J\n[10]\nIn conclusion, our research advances IT governance by\nleveraging graph algorithms and Neo4j to develop a rec-\nommendation system for internal business processes based [11]\non COBIT 2019. Future research could address scalability,\nintegration with other frameworks, and adaptation for different\nindustries, with our approach holding potential for broad\npractical implementation. [12]\nACKNOWLEDGMENT', 'processes outlined in COBIT 2019.\nMapping is a crucial aspect of COBIT 2019, as it involves\nestablishing relationships between various elements such as\nbusiness objectives, IT processes, control needs, and technol-\nogy resources [6]. This mapping ensures that every aspect of\nIT management is linked to the appropriate business objec-\ntives and control needs, thus enhancing overall governance\neffectiveness [1]. One effective way to perform this mapping\nis by utilizing a graph database such as Neo4j [7].', 'by providing organizations with a valuable tool to automate and\nimprove IT strategies, effectively achieving business objectives.\nstI Index Terms—COBIT 2019, graph algorithms, IT governance,\ndna LSTM, Neo4j, recommendation system, regulatory compliance,\nsemantic similarity, TF-IDF\nnoitavonnI\nI. INTRODUCTION\nCOBIT 2019, which stands for Control Objectives for\nygolonhceT\nInformation and Related Technologies, is a comprehensive\nframework developed by ISACA (Information Systems Audit', 'c) Determine Management Objectives (COBIT Core\nModel) related to the identified Alignment Goals.\nd) Compile a list of Activities and Activity Descrip-\ntions for each Management Objective, as per CO-\nBIT 2019 guidelines.\nB. Preprocessing\nData Cleaning and Transformation: Preprocess the col-\nlected data to ensure consistency and completeness. This\ninvolves:\n1) Removing duplicates and resolving inconsistencies.\n2) Transforming the data into a format suitable for integra-\ntion with Neo4j.']","Mapping is essential in COBIT 2019 as it establishes relationships between business objectives, IT processes, control needs, and technology resources (A Recommendation System for Internal Business Processes of COBIT 2019 Using Graph Algorithm and Similarity Methods).","company goals by proposing a novel recommendation system for internal business processes, grounded in the COBIT 2019 framework. The system employs graph algorithms to map relationships, semantic similarity measure- ments to align enterprise goals with management objectives, and LSTM combined with TF-IDF methods to analyze and recommend specific activities. Experimental results show that this system optimizes IT management practices, enhances operational efficiency, and ensures regulatory compliance. Additionally, a user-friendly graphical representation of internal business pro- cesses using Neo4j enables stakeholders to visualize complex relationships within the COBIT framework, facilitating informed decision-making. This research advances IT governance practices by providing organizations with a valuable tool to automate and improve IT strategies, effectively achieving business objectives. Index Terms—COBIT 2019, graph algorithms, IT",0.6666666666666666,0.9140746495037472
"in business process modeling. Using real- life data and public datasets, the research compared GPD++ to traditional methods like Inductive Miner (IM) and Split Miner (SM). Results showed that GPD++ effectively addressed ICRs and detected hierarchical blocks. The paper introduces the Invisible-Task Prime and Non-Prime ITPNP algorithm for mining invisible tasks in process models, focusing on XOR and AND/OR relationships. It detects invisible non-prime tasks in hybrid parallel rela- tionships. Tested on seven models, it outperformed traditional methods, achieving high fitness and precision, especially in complex scenarios. Research by introduces an improved method for detect- ing parallel process models in graph-based process discovery. By establishing relationship frequencies and using specific algorithms, the method accurately distinguishes XOR, AND, and OR relationships.","['f10b-45da-b98b-86ae4c7a310b.\n[13] S.J.J.Leemans,D.Fahland,andW.M.P.vanderAalst,‘‘Scalableprocess\ndiscovery and conformance checking,’’ Softw. Syst. Model., vol. 17, no. 2,\npp. 599–631, Jul. 2016.\n[14] R. Sarno, K. R. Sungkono, M. Taufiqulsa’di, H. Darmawan, A. Fahmi,\nand K. Triyana, ‘‘Improving efficiency for discovering business processes\ncontaining invisible tasks in non-free choice,’’ J. Big Data, vol. 8, no. 1,\npp. 1–17, Dec. 2021.\n[15] W. van der Aalst, Process Mining: Data Science in Action. Berlin,', 'discovering business processes,’’ Int. J. Adv. Intell. Informat., vol. 5, no. 2,\np. 137, Jul. 2019.\n[9] I. Waspada, R. Sarno, and K. Sungkono, ‘‘An improved method of parallel\nmodel detection for graph-based process model discovery,’’ Int. J. Intell.\nEng. Syst., vol. 13, no. 2, pp. 127–139, Apr. 2020.\n[10] I. Waspada, R. Sarno, E. S. Astuti, H. N. Prasetyo, and R. Budirahario,\n‘‘Improvingparallelpatterndiscoveryfromdirectlyfollowsgraphmodel,’’', 'Inductive Miner helps in identifying the underlying process\nstructure and can handle complex behaviors such as\nparallelism and choices effectively. Heuristic Miner is an\nalgorithm that uses a heuristic approach to extract process\nmodels from event log. Heuristic Miner is more robust and\ncapable of handling noisy logs and more complex\nrelationships between activities.\nE. Evaluation Metric\nIn this research, the evaluation of business process models\ngenerated by the algorithms is conducted using the fitness', '197\nVOLUME 10, 2022\nprocess model discovery that contains invisible tasks. Next,\n198\nSarno et al. [7] designed an event log storage directly from\n199\nERP to the graph database so that there is no need to\n200\nconvert the event log format to perform process discovery.\n201\nThe graph-based process discovery algorithm is superior in\n202\ntime complexity and computational time to other discovery\n203\nmethods [7].\n204\nIn this paper, our work is aligned with the Graph-Based\n205', 'hierarchy, GPD++.\nI. INTRODUCTION\nAutomatic discovery of process models from event logs\nmakes a significant contribution to many organizations, from\nfinance, health, industry, government, and many other fields,\nin capturing descriptions of business process execution mod-\nels from real-world activities.\nThe associate editor coordinating the review of this manuscript and\napproving it for publication was Zhangbing Zhou .\n2023 The Authors. This work is licensed under a Creative\n123382 For more information, see']",Sarno et al. (2021) developed a method for discovering business processes that effectively handles invisible tasks and improves efficiency in process discovery.,"more reliable in detecting and handling ICR patterns. B. GRAPH-BASED PROCESS DISCOVERY PLUS B. GRAPH-BASED PROCESS DISCOVERY PLUS PLUS (GPD++) GPD++ consists of the main algorithm for detecting split and join blocks presented in Algorithm 1 and the algorithm for finding the block hierarchy and its types (XOR or AND) in Algorithm 2 and Algorithm 3. GPD++ utilizes the detected block structure to identify ICR in blocks parallel (long). As an illustration of how Algorithm 1 works in finding split-join blocks, an example of a DFG model with one split node (|T| = 1) and one join node is given in figure 4. The input for Algorithm 1 is the DFG model with split-node and join-node information. The results of",0.6666666666666666,0.8743569991724159
"by identifying Enterprise Goals corre- lated with the Balanced Scorecard Financial. Then, Alignment Goals related to these Enterprise Goals were mapped. Subse- quently, Management Objectives from the COBIT Core Model associated with Alignment Goals were identified. Examples of these mappings are shown in TABLE I. Following this, Activ- ities and their descriptions were compiled for each Manage- ment Objective, based on COBIT guidelines, as demonstrated in TABLE II. A total of 1202 activities were found to correlate with the Balanced Scorecard Financial perspective during the mapping process. B. Create Graph Database After the completion of the Mapping process, the next step is to create nodes and their relationships using Neo4J Graph Database Tools, in order to construct a Knowledge Graph","['Fig. 1. Architecture\non internal business processes, control objectives, IT\nprocesses, and enterprise goals.\n2) Mapping from Balanced Scorecard to Activity: Estab-\nlish relationships between Enterprise Goals, Alignment\nGoals, Management Objectives, and Activities. This\nmapping follows these steps:\na) Identify Enterprise Goals (EG) from the Balanced\nScorecard (BSC).\nb) Map Alignment Goals (AG) to corresponding En-\nterprise Goals.\nc) Determine Management Objectives (COBIT Core', 'Alignment Goals (AG).\nFollowing this mapping process, a comprehensive list of\nActivities and Activity Descriptions was compiled for each\nManagement Objective (COBIT Core Model), as shown in\nTable II.\nAfter completing the mapping, the data is saved in CSV\nformat for loading into Neo4j.\nB. Node and Relation Generation\nFollowing the mapping process, nodes and relationships\nare created using Neo4j Graph Database tools to construct a\nKnowledge Graph based on the mapped results. The prepared', 'c) Determine Management Objectives (COBIT Core\nModel) related to the identified Alignment Goals.\nd) Compile a list of Activities and Activity Descrip-\ntions for each Management Objective, as per CO-\nBIT 2019 guidelines.\nB. Preprocessing\nData Cleaning and Transformation: Preprocess the col-\nlected data to ensure consistency and completeness. This\ninvolves:\n1) Removing duplicates and resolving inconsistencies.\n2) Transforming the data into a format suitable for integra-\ntion with Neo4j.', '(financial, business processes, customers, and learning &\ngrowth), which are easy to understand and implement,\nallowing for a more holistic assessment. IPMS is also\nAuthorized licensed use limited to: Institut Teknologi Sepuluh Nopember.\ndesigned to be flexible and easily adaptable to various\norganizational contexts. Performance Prism is a model that\nillustrates corporate performance in five areas: stakeholder\nsatisfaction, strategy, processes, and capabilities.', 'according to their specific goals and strategies. Among the\nfour commonly used models, most previous studies have used\n[9]\nthe Balanced Scorecard, IPMS, and Performance Prism\nbecause these three models provide more intuitive and user-\nfriendly frameworks. The research also highlights that in\ndetermining performance indicators, there are variations due\nto differences in research themes, subjects studied, and\n[10]\nregional contexts. Based on content analysis, the findings']","The mapping process establishes relationships between Enterprise Goals, Alignment Goals, Management Objectives, and Activities, as outlined in the COBIT framework.","is linked to the appropriate business objec- tives and control needs, thus enhancing overall governance effectiveness . One effective way to perform this mapping is by utilizing a graph database such as Neo4j . Neo4j is a graph database specifically designed to store and manage data with complex relationships . In the context of COBIT 2019, Neo4j can be utilized to build dynamic graphical representations of various COBIT elements . By using Neo4j, organizations can create dynamic and interactive graphical models to better understand and manage the complex relationships between different COBIT 2019 elements . This allows for deeper analysis, real-time monitoring, and better decision-making in IT management, ultimately aiding in the achievement of business goals . In summary, this",0.5,0.9295828822425168
"IX, it can serve as an internal reference for the company to assess its capability to meet these criteria and can also serve as a reference for formulating policies to prioritize the implementation of these activities in the future. V. CONCLUSION V. CONCLUSION In conclusion, the developed Activity Recommendation System based on COBIT 2019 framework offers a practical solution to the challenges faced by auditors in identifying and aligning activities with company strategy. By leveraging NLP techniques and graph queries, the system efficiently matches user input of company strategy with relevant activities automatically, eliminating the need for manual navigation through COBIT 2019 guidelines. The effectiveness of the system was demonstrated by in- putting company strategies from three companies in different","['for extra work.\nV. CONCLUSION\nThis paper propose a novel recommendation system for\ninternal business processes based on the COBIT 2019 frame-\nwork. By integrating graph algorithms and similarity methods,\nour approach provides tailored activity recommendations that\nalign with an organization’s strategic goals. We mapped enter-\nprise goals to management objectives, identified relevant ac-\ntivities, and used graph queries to retrieve actionable insights.\nUtilizing Cypher Query Language (CQL) and Neo4j’s graph', 'by providing organizations with a valuable tool to automate and\nimprove IT strategies, effectively achieving business objectives.\nstI Index Terms—COBIT 2019, graph algorithms, IT governance,\ndna LSTM, Neo4j, recommendation system, regulatory compliance,\nsemantic similarity, TF-IDF\nnoitavonnI\nI. INTRODUCTION\nCOBIT 2019, which stands for Control Objectives for\nygolonhceT\nInformation and Related Technologies, is a comprehensive\nframework developed by ISACA (Information Systems Audit', 'recommend specific activities. Experimental results show that this\nsystem optimizes IT management practices, enhances operational\n| efficiency, and ensures regulatory compliance. Additionally, a\n)AIITCI(\nuser-friendly graphical representation of internal business pro-\ncesses using Neo4j enables stakeholders to visualize complex\nsnoitacilppA relationships within the COBIT framework, facilitating informed\ndecision-making. This research advances IT governance practices', 'This allows for deeper analysis, real-time monitoring, and\nbetter decision-making in IT management, ultimately aiding\nin the achievement of business goals [11].\nIn summary, this paper proposes the development of a\nrecommendation system based on COBIT 2019’s internal\nbusiness processes, utilizing graph algorithms and similarity\nmethod to provide organizations with a dynamic tool for\nmanaging risk, compliance, and performance in the realm of\ninformation technology [12].\nII. LITERATURE STUDY', ""audits add a qualitative dimension to audit evaluations,\nfacilitating better decision-making and more effective\nimplementation of improvements.\nAudit with COBIT 2019 and process mining from event\na\nlogs represents a holistic approach to evaluating and\nenhancing the effectiveness of an organization's information\nsystems [12]. Through the use of the COBIT 2019 framework,\nauditors can pinpoint key controls necessary to achieve\npredefined business objectives. Meanwhile, event log process""]",The developed recommendation system integrates graph algorithms and similarity methods to provide tailored activity recommendations that align with an organization’s strategic goals (A Recommendation System for Internal Business Processes of COBIT 2019 Using Graph Algorithm and Similarity Methods).,"company goals by proposing a novel recommendation system for internal business processes, grounded in the COBIT 2019 framework. The system employs graph algorithms to map relationships, semantic similarity measure- ments to align enterprise goals with management objectives, and LSTM combined with TF-IDF methods to analyze and recommend specific activities. Experimental results show that this system optimizes IT management practices, enhances operational efficiency, and ensures regulatory compliance. Additionally, a user-friendly graphical representation of internal business pro- cesses using Neo4j enables stakeholders to visualize complex relationships within the COBIT framework, facilitating informed decision-making. This research advances IT governance practices by providing organizations with a valuable tool to automate and improve IT strategies, effectively achieving business objectives. Index Terms—COBIT 2019, graph algorithms, IT",0.8,0.8965121195177894
"the system efficiently matches user input of company strategy with relevant activities automatically, eliminating the need for manual navigation through COBIT 2019 guidelines. The effectiveness of the system was demonstrated by in- putting company strategies from three companies in different sectors. The system provided a list of recommended activities that can be undertaken to achieve strategic objectives of each companies. Moving forward, there are opportunities to enhance and refine the system to improve both the accuracy of the rec- ommendations and the user experience, ensuring its continued utility and influence in enterprise governance and audit man- agement. Future upgrades could focus on enhancing the user interface to accommodate users with less technical expertise and improving the integration of the proposed","['recommend specific activities. Experimental results show that this\nsystem optimizes IT management practices, enhances operational\n| efficiency, and ensures regulatory compliance. Additionally, a\n)AIITCI(\nuser-friendly graphical representation of internal business pro-\ncesses using Neo4j enables stakeholders to visualize complex\nsnoitacilppA relationships within the COBIT framework, facilitating informed\ndecision-making. This research advances IT governance practices', 'for extra work.\nV. CONCLUSION\nThis paper propose a novel recommendation system for\ninternal business processes based on the COBIT 2019 frame-\nwork. By integrating graph algorithms and similarity methods,\nour approach provides tailored activity recommendations that\nalign with an organization’s strategic goals. We mapped enter-\nprise goals to management objectives, identified relevant ac-\ntivities, and used graph queries to retrieve actionable insights.\nUtilizing Cypher Query Language (CQL) and Neo4j’s graph', ""audits add a qualitative dimension to audit evaluations,\nfacilitating better decision-making and more effective\nimplementation of improvements.\nAudit with COBIT 2019 and process mining from event\na\nlogs represents a holistic approach to evaluating and\nenhancing the effectiveness of an organization's information\nsystems [12]. Through the use of the COBIT 2019 framework,\nauditors can pinpoint key controls necessary to achieve\npredefined business objectives. Meanwhile, event log process"", 'A. Input Dataset\nThe input dataset comprises information from the COBIT\n2019 framework, including internal business processes, control\nobjectives, IT processes, and related elements. Additionally,\ncompany-specific goals are incorporated to ensure that the\nrecommendations align with organizational objectives.\n1) Data Collection: Gather data from COBIT 2019 doc-\numentation and relevant enterprise sources, focusing\nDownloaded on July 14,2025 at 08:22:06 UTC from IEEE Xplore. Restrictions apply.', 'ing COBIT framework relationships, enabling stakeholders to\nmake data-driven decisions.\nDownloaded on July 14,2025 at 08:22:06 UTC from IEEE Xplore. Restrictions apply.\nTABLE III [4]\nSIMILARITY SCORE\nEnterprise Goal (EG) Similarity\nOptimization of business process functionality 0.5701785\nOptimization of business process costs 0.29179826 [5]\nStaff skills, motivation and productivity 0.02301607\nCompliance with internal policies 0.029643951\n[6]\n[7]\n[8]\n[9]']","The proposed recommendation system offers tailored activity recommendations that align with an organization’s strategic goals, optimizing IT management practices and enhancing operational efficiency (A Recommendation System for Internal Business Processes of COBIT 2019 Using Graph Algorithm and Similarity Methods).","technology, thus helping them achieve their business objectives more effectively . Several previous papers still rely on manual approaches to COBIT 2019, which have limitations in providing automated recommendations for audit activities based on company goals. Thus, this research contributes significantly by addressing this gap and overcoming the challenges associated with manual COBIT utilization. The primary objective of this paper is to develop a rec- ommendation system that aligns with the internal business process strategy governed by COBIT 2019. This system aims to help organizations manage risk, ensure compliance, and enhance performance in the context of information technology. To achieve this, the research will utilize graph algorithms to build a recommendation system based on the internal business processes outlined in",0.8,0.8778334541550993
"whereas 27 chops had quality defects. B. Volatile Organic Compounds Identification Through Chromatography-Mass Spectrometry (GC-MS), it was found that there were 143 VOCs in the good-quality sample and 118 VOCs in the quality-defect sample. Then it also obtained that there were 102 similar compounds present Fig. 4. Number of Compounds in Each Classes Fig. 5. Percentage of Area of Compounds in Each Classes in both sample 1 and sample 2, which are detailed in TABLE II. The results of grouping chemical substances into several groups, including nitrogenous compounds, alcohols, esters, hydrocarbons, hetero- oxygenates, and others. Substance content in each class of compounds means that different concentrations are shown as Area as shown in TABLE II. aldehydes, phenols, ketones, In GC-MS,","['gories of food analysis that can be used: monitoring, expiry\nchecking, freshness evaluation, purity testing, and other food\nquality control investigations. Hence, the motivation for this\nstudy can be formulated as follows:\n1. Several types of research have used an e-nose to iden-\ntify pork adulteration in beef for food quality control.\nHowever, most of them were focused on the differen-\ntiation and classification of species of meat. Only a\nfew researchers have tried to determine different gas', 'chemometric approaches,’’ Food Res. Int., vol. 60, pp. 2–18, Jun. 2014.\n[24] X.Tian,J.Wang,andS.Cui,‘‘Analysisofporkadulterationinmincedmut-\nton using electronic nose of metal oxide sensors,’’ J. Food Eng., vol. 119,\nno. 4, pp. 744–749, 2013.\n[25] H. Shi, M. Zhang, and B. Adhikari, ‘‘Advances of electronic nose and\nits application in fresh foods: A review,’’ Crit. Rev. Food Sci. Nutrition,\nvol. 58, no. 16, pp. 1–11, Jun. 2017.\n[26] F. Tian, S. Yang, and K. Dong, ‘‘Circuit and noise analysis of odorant gas', 'as cost, time, and experience [15], [16]. The price of GC-MS\ninstrument is around USD 120,000 in 2017 [17], while the\ncost of testing a sample is about USD 50. In addition, the\ntesting process of one sample can take about 1 to 2 days,\ndepending on the complexity of the gases. Another consid-\neration is the assistance of a person who has experience with\noperating the GC-MS instruments.\nA solution is needed to meet these considerations using\nmore practical and economical methods and instruments, and', 'Compounds (VOCs) [2]. Besides being produced by\nVOCs are also produced from several other sources;\nAttribution-NonCommercial-NoDerivatives 4.0 License.\nhttps://creativecommons.org/licenses/by-nc-nd/4.0/ 51285\nMalikhah et al.:\nbreath, blood, urine, feces, and more. VOCs released through\nthe body are not only influenced by human metabolism but\ncan also indicate the health status of a person [3], [4].\nSeveral methods have been used to detect diseases by\ntaking samples from blood, saliva, phlegm, feces, and', '2\ncompounds can be measured by a specific tool called gas\nchromatography. However, this requires a long time and is\nexpensive. As a result, it is only used in laboratories. For\nthis reason, an electronic nose can be offered as an alter-\nnative tool to measure and analyze chemical compounds’\ncontent in exhaled breath [5]. The electronic nose has been\nwidely applied in various fields, such as the classification\nof perfume [6], food quality [7], and diseases in the human\nbody [8], [9].']","The study highlights that while many researchers have focused on differentiating meat species, few have investigated the identification of volatile organic compounds (VOCs) in food quality control, which aligns with the findings of varying VOCs in quality-defect and good-quality samples.","baked goods’ quality can be determined by the gas or vapor content. Gas chromatography is the standard instrument for quantitatively and qualitatively analyzing volatile organic compounds (VOCs). This method separates compounds in a mixture by injecting a gas sample into the mobile phase, usually called the carrier gas, and passing the gas through the stationary phase , , . Volatile compounds identified in aldehydes, alcohols, acids, alkanes, and ketones are the main components that contribute VOLUME 12, 2024 2024 The Authors. This work is licensed under a Creative Commons Attribution-NonCommercial-NoDerivatives 4.0 License. For more information, see 97235 TABLE 1. The ingredients of the cookie. to the cookie flavor . Chemical compounds grouped as hydrocarbons are also released while making and",0.3333333333333333,0.8751889765447607
"Recall or sensitivity is the number of true positive predictions compared to all true positive data. Precision is the number of positive results compared to all positive predicted data. F-Score is the average precision and recall compared to weighting. Speciﬁcity is the number of true negative predictions compared to all negative data. Equations 15 to 19 are used to calculate these metrics. In addition to these metrics, the measurement of model performance evaluation also uses Receiver Operating Characteristics (ROC) and Area Under Curve (AUC). ROC is a probability curve and AUC is an area that shows the level of accuracy of the model empirically. The classiﬁcation results show poor performance if the ROC Curve is close to the baseline and","['curve depicts the relationship between the true positive rate\n(TPR) and the false positive rate (FPR) across various clas-\nsification thresholds. The horizontal axis of an ROC graph\nrepresents the FPR, which indicates the proportion of neg-\native instances misclassified as positive. In contrast, the\nvertical axis represents the TPR, which measures the model’s\neffectiveness in correctly classifying positive instances. The\nROC curves demonstrated that the MHA-CovBi model dis-', 'range of points of view, like precision, accuracy, recall, and\nF1 score. Subsequently, the model exhibiting the best\nperformance was reviewed extensively through the analysis of\na confusion matrix.\nThis study utilized Python for analysis and all\nprogramming tasks were conducted within the Scikit-learn\nframework. In scikit-learn (sklearn), the dataset is divided into\ntraining data and testing data utilizing train_test_split to\nfacilitate classifier training and performance evaluation[20].', ""metrics can be calculated by (1) – (3). This study's\ncalculation of True Positive, False Positive, and False\nNegative differs from other classifications or detections\n[20]-[23]. These are chosen and calculated following\nprevious studies [1]. Precision detects the truly correct\nprediction out of all predictions. Recall detects the truly\ncorrect prediction out of all actual classes. F1 scores are\nharmonic mean between these two that measure overall\nmodel performance. These metrics are produced by"", 'that although it is reasonably accurate, it loses out to other\nmodels. Decision Tree showed poor performance with an R²\nof 0.18 and the highest MAPE of 64.64, making it less suitable\nfor this analysis. Random Forest had an R² of 0.49, but the\nhigher MAE and RMSE than linear regression showed relative\ninaccuracy.\nGradient Boosting showed a fairly good fit with an R² of\n0.61 and moderate MAE and RMSE values, but not the best\namong the evaluated models. The Support Vector Machine', 'logistic regression, support vector machine, decision trees,\nand random forest.\nLogistic regression is a statistical technique commonly\nused to categorize data observations into distinct classes,\ntypically focusing on a binary outcome variable[16]. While\nsupport vector machine (SVM) finds the optimal hyperplane\nto separate classes in feature. With a kernel, SVM can handle\nimbalanced data classification[17]. A decision tree splits the\ndataset into subsets based on input attributes and forms a tree']","The ROC curve illustrates the relationship between the true positive rate and the false positive rate across various classification thresholds, providing insight into the model's effectiveness in classifying positive instances (Sarcasm Detection in Indonesian-English Code-Mixed Text Using Multihead Attention-Based Convolutional and Bi-Directional GRU).","with the following formula: TP + TN TP + TN + FP + FN Accuracy = Precision = Recall/True Positive Rate(TPR) TP TP + FP TP TP + FN F1 = 2 × precision × recall precision + recall FP TN + TP (cid:90) 1 TPRd(FPR) False Positive Rate(FPR) = AUC = (4) (5) (6) (7) (8) (9) where TP is the number of correctly predicted positive labels, TN is the number of correctly predicted negative labels, FP is the number of incorrectly predicted positive labels, and FN is the number of incorrectly predicted negative labels. Accuracy is the ratio of true predictions to the overall data. Precision is the ratio between TP to the total number of positive predic-",0.6666666666666666,0.9462839997409876
"forming non-overlapping sub- arrays within the array , naturally limiting the achievable beamwidth of each beam and making inefﬁcient use of the available aperture. A third option can be taken by arranging the array into partially or fully overlapping subarrays coupled with the use of orthogonal waveforms, each associated to a generated beam, a solution belonging to the class of the multi- input multi-output (MIMO) radars discussed below. MIMO radars have developed into a strong contender for multi-antenna radar systems, applying the concept of virtual sensors with orthogonal waveform diversity –. Our interest in MIMO radars in relevance to the problem at hand arises due to their capability to produce multiple orthog- onal beams by selecting an appropriate set of","['for linear arrays based on overlapped sub-arrays,’’ IEEE Trans. Antennas\nPropag., vol. 62, no. 4, pp. 1769–1778, Apr. 2014.\n[22] A. Hassanien and S. A. Vorobyov, ‘‘Phased-MIMO radar: A tradeoff\nbetween phased-array and MIMO radars,’’ IEEE Trans. Signal Process.,\nvol. 58, no. 6, pp. 3137–3151, Jun. 2010.\n[23] A. Roshanzamir and M. Bastani, ‘‘Hybrid orthogonal-phased array MIMO\nRADAR,’’ in Proc. IET Int. Radar Conf., 2013, pp. 1–5.\n[24] W.-Q. Wang, ‘‘Phased-MIMO radar with frequency diversity for range-', 'PA radar, the PMIMO radar with transmit subarrays as its\n‘‘elements’’ has a high directional gain in individual subar-\nrays, which in this case look at the same direction [29].\nIn the works on the PMIMO radar in [22]–[29],\nthe improvement in radar performance factors such as\nspatial resolution, parameter identifiability, transmit-receive\n(T-R) gain, and signal-to-interference-plus-noise power ratio\n(SINR) has been reported. The results of investigations in [29]', '11262\nGeneral MIMO Structure With Overlapping Subarrays for Various Radar Applications\nFIGURE 13. The detection performance vs. threshold (VT) for all radar\nvariations in: (a) the probability of false alarm (Pfa) and (b) the\nprobability of detection (Pd).\nperformance of the P based on the conditions of the desired\nfa\ntarget. The P value for all radar systems is below 10−4 for\nfa\nV over 30.\nT\nFig. 13b demonstrates that the (M = 3, N = 6) con-\nfiguration outperforms the others, because P is a function\nd', 'MIMO radar,’’ IEEE Signal Process. Lett., vol. 14, no. 12, pp. 968–971,\nDec. 2007.\n[14] L. Xu, J. Li, and P. Stoica, ‘‘Target detection and parameter estimation for\nMIMO radar systems,’’ IEEE Trans. Aerosp. Electron. Syst., vol. 44, no. 3,\npp. 927–939, Jul. 2008.\n[15] T. D. Backes, ‘‘Parameter identifiability in a phased-subarray MIMO\nradar,’’ in Proc. IEEE Aerosp. Conf., Big Sky, MT, USA, Mar. 2014,\npp. 1–6.\n[16] X. Song, N. Zheng, and T. Bai, ‘‘Resource allocation schemes for multiple', 'targets tracking in distributed MIMO radar systems,’’ Int. J. Antennas\nPropag., vol. 2017, Jul. 2017, Art. no. 7241281.\n[17] M. Davis, G. Showman, and A. Lanterman, ‘‘Coherent MIMO radar: The\nphased array and orthogonal waveforms,’’ IEEE Aerosp. Electron. Syst.\nMag., vol. 29, no. 8, pp. 76–91, Aug. 2014.\n[18] Z. Qiu, X. Li, H. Chen, Z. Zhuang, and J. Yang, ‘‘Effects of transmitting\ncorrelated waveforms for co-located multi-input multi-output radar with']","The PMIMO radar structure utilizes overlapping subarrays to achieve high directional gain in individual beams, enhancing radar performance (FPMIMO A General MIMO Structure With Overlapping Subarrays for Various Radar Applications).","biomedical engineering, macro-scale radars on radio- astronomy, and so on , . However, in PA radars the number of detected targets is limited by the angular and range resolution. More recently, the multi-input multi-output (MIMO) radar has become an interesting research sub- ject –. Unlike the PA radar, the MIMO radar utilizes many antennas that transmit orthogonal signals to obtain the signal reﬂected from the target at the receiver, a scheme known as waveform diversity . Consequently, MIMO radars have been successfully applied for radar imaging, 11248 This work is licensed under a Creative Commons Attribution 4.0 License. For more information, see VOLUME 8, 2020 S. Tahcfulloh, G. Hendrantoro: FPMIMO: General MIMO Structure With Overlapping Subarrays for Various Radar Applications",0.5,0.912058052969013
"of the Golay codes to orthogonalization of different symbols in a frame in the same beam. Doppler detection can further be accomplished by transmitting a frame of symbols repeatedly for several times, thus allowing the receiver to detect the changes in phase along different frames. The realization of such multi-beam radars that adopts the CC-OFDM MIMO concept also allows for application of further signal process- ing, such as monopulse processing to determine the angular direction of the target more accurately, but this is beyond the scope of our paper. The CC-OFDM MIMO concept presents a breakthrough in the realization of multi-beam radar in a way that has not been tried before, combining different strategies in a novel way to obtain","['flexibility in the CC-OFDM waveform design, where\nthe radar system can operate with multiple PRFs as per\nthe application requirements.\nThese processing steps are discussed by taking the\nsurveillance radar specification in Table 1 as an example. The\ndiscussion starts with a brief introduction on the surveillance\nradar specifications in Section II, followed by description of\nthe receiver processing concept of the CC-OFDM MIMO\nradar in Section III, including the beam and range processing', 'other multi-TRM radars due to the nature of the orthogonal\nmulti-beam generation with Golay-coded OFDM waveforms\nand subbands.\nThere are previous research on radar waveform for ISAC\npurposes [25], [26] which discussed about cyclic prefix (CP)\nbased OFDM waveform and how the CP is very much\ndefining the maximum unambiguous range of the radar\nsystem. CC-OFDM MIMO radar waveform design which\nis discussed in this paper is not a CP based radar, the\ntransmitters are transmitting multiple orthogonal symbols in', 'series without any guard time interval between the symbols.\nThe symbol series are orthogonal to each other, hence\n109895\nD. Kuswidiastuti et\nreceivers know how to distinguish the symbols received, and\nthis could extend the maximum unambiguous range of the\nradar. The contributions of this paper are described as follow:\n1) This paper describes the receiver processing of multi-\nbeam CC-OFDM MIMO Radar which is designed\nfor long-range radar surveillance application. The', '10.1109/TAES.2015.140477.\n[26] Y. Liu, G. Liao, Z. Yang, and J. Xu, ‘‘Design of integrated radar\nand communication system based on MIMO-OFDM waveform,’’ J.\nSyst. Eng. Electron., vol. 28, no. 4, pp. 669–680, Aug. 2017, doi:\n10.21629/JSEE.2017.04.06.\nVOLUME 13, 2025\nCC-OFDM-MIMO Radar\nDEVY KUSWIDIASTUTI (Member, IEEE) was\nborn in Indonesia, in September 1981. She\nreceived the B.Eng. degree in electrical engi-\nneering from the Institut Teknologi Sepuluh\nNopember (ITS), Indonesia, the M.Sc. degree', 'The results show that the radar could distinguish two\nlow as -80dB. Additionally, the radar is able to detect\nvelocity can be obtained from the phase variation over one\ninterference, MIMO-radar, multibeam, OFDM-radar,\nI. INTRODUCTION\nMany radar applications demand scanning capability to allow\nand coverage over a range of angular direction, such as those\nfor surveillance, vehicular, weather monitoring, imaging, and\nlicensed under a Creative Commons Attribution 4.0 License.']","The CC-OFDM MIMO radar system utilizes Golay-coded OFDM waveforms to achieve orthogonal multi-beam generation, enhancing its capability for Doppler detection and phase change analysis (Kuswidiastuti et al., 2025).","and radial velocity detection of targets is not discussed yet. The contribution of this paper is in the receiver processing of CC-OFDM-MIMO radar, which is different from those in other types of OFDM MIMO radars or other multi-TRM radars due to the nature of the orthogonal multi-beam generation with Golay-coded OFDM waveforms and subbands. There are previous research on radar waveform for ISAC purposes , which discussed about cyclic prefix (CP) based OFDM waveform and how the CP is very much defining the maximum unambiguous range of the radar system. CC-OFDM MIMO radar waveform design which is discussed in this paper is not a CP based radar, the transmitters are transmitting multiple orthogonal symbols in series without any guard time",0.6,0.9579028591015464
"signal is circulated from one antenna element to another with a relatively small time-delay differ- ence ((cid:49)t), made possible by circulating codes (CC) , , . Hence the transmit signal from the p-th element for a transmit antenna array with an odd number of elements, Nt , can be written as: xp(t) = x(t − p(cid:49)t), Nt − 1 , . . . , Nt − 1 (1) The time delay difference of the circulating signal corre- sponds to a phase difference between the antenna elements at a given frequency: (cid:49)ϕ = 2πf (cid:49)t (2) It means that the phase steering that is usually provided by a phase shifter at each antenna element now can be realized directly in the","['Circulating code (CC) in LFM-MIMO radar has been\ndiscussed in [19], where the phase difference for beam\nsteering is provided by transmitting coherent signals with\na small time delay difference ((cid:49)t ) between the array\nb\nantenna element. While in [20] a new concept of multibeam\nradars is reported, which combines the versatility of OFDM\nwaveform, the orthogonal Golay codes and the CC-MIMO\narchitecture. The transmitters, each of which is connected\nto an element of the phased array, work together by each', 'Circulating codes,’’ J. Electr. Comput. Eng., vol. 2013, pp. 1–8, Jan. 2013,\ndoi: 10.1155/2013/809691.\n[20] D.Kuswidiastuti,L.P.Ligthart,andG.Hendrantoro,‘‘Atransmitterdesign\nfor the multi-beam CC-OFDM azimuth scanning MIMO radar,’’ IEEE\nAccess, vol. 10, pp. 53682–53702, 2022.\n[21] Z. Xu and A. Petropulu, ‘‘A bandwidth efficient dual-function radar\ncommunication system based on a MIMO radar using OFDM wave-\nforms,’’ IEEE Trans. Signal Process., vol. 71, pp. 401–416, 2023, doi:\n10.1109/TSP.2023.3241779.', 'each of the 101 T/R modules that are individually associated\nwith the 101-element antennas.\nVOLUME 13, 2025\nD. Kuswidiastuti et al.: Receiver Processing of the Multibeam Azimuth Scanning\nFIGURE 4. Transmit and receive scheduling of CC-OFDM MIMO Radar.\nIn each module, the horizontal array element takes the form\nof a 21-element vertical array. A target echo is received by\neach of the 21-elements, each of which is connected to a\ncirculator with 40 dB isolation. A combiner takes the signals', 'the transmit element has already have phase difference for\nsteering the beam to the intended direction. By doing so,\nthe phase-shifter components which are usually required in\na phase array or in a coherent MIMO radars are no longer\nneeded.\nThe principles of CC-OFDM MIMO radars have been\ndiscussed in [20] by way of an exemplary radar design for\na long-range surveillance mission. The design includes the\nsystem architecture and parameters, the waveform design', 'p\nwith p = 1, ..., P, then the N-element received complex\nvector is\nP\n(cid:88)\ny (t) = r(t, θ )(g(θ ) ◦ h(θ )) + n(t) (8)\nFPMIMO p p p\np=1\nor\nP\n(cid:112) (cid:88)\ny (t) = K/M σ (θ )[g(θ ) ◦ h(θ )]\nFPMIMO p p p p\np=1\n·[c(θ ) ◦ d(θ )]T ψ(t) + n(t) (9)\np p\nwith\ng(θ) = (cid:2) vH (θ) vH (θ) . . . vH (θ) (cid:3)T\nb b b (10)\n1 1 2 2 N N\nh(θ) = (cid:2) e−j2πf τ 1(θ) e−j2πf τ 2(θ) . . . e−j2πf τ N(θ) (cid:3)T\n(11)\nwhere b (θ) denotes the L-element receive steering vector\nn']","The phase difference for beam steering in LFM-MIMO radar is achieved by transmitting coherent signals with a small time delay difference between the array antenna elements (Kuswidiastuti et al., 2013).","the specified OFDM sub-band frequencies of beam b to provide phase difference between the transmit elements for creating the beam b. Circulating code in LFM MIMO radar which is discussed in , obtain this phase difference by transmitting coherent signals with a small time delay difference ((cid:49)tb) between the antenna element. However, using an OFDM signal, this phase steering can be provided by giving a phase difference to the OFDM subcarrier phase in the frequency domain of the OFDM signal generation stage. The phase steering given to the CC-OFDM waveform can be defined as follow: β(fn,a,b, (cid:49)tb) = 2πfn,a,b(cid:49)tb Hence, the array factor of CC-OFDM will be: AF(θ, fn,a,b, (cid:49)tb) = Nt −1 2X Ipejp(α(θ)+β(fn,a,b,(cid:49)tb) where α(θ) = p=− Nt",0.6666666666666666,0.8878181849739697
"the high PAPR of the OFDM signal. If orthogonal codes are given to successive OFDM symbols, it could also provide orthogonality between 53684 VOLUME 10, 2022 D. Kuswidiastuti et al.: Transmitter Design for Multibeam CC-OFDM Azimuth Scanning MIMO Radar the OFDM symbols, which in turn can extend the maxi- mum unambiguous range of the radar. The orthogonalities between OFDM subcarriers and between OFDM symbols allow OFDM radar to produce a range and Doppler proﬁle independent from each other . This is one of the advan- tages of using OFDM instead of LFM as radar waveform. The above considerations motivate the development of digitally generated beam steering without phase shifter, by providing phase control of the signal directly from waveform generation","['flexibility in the CC-OFDM waveform design, where\nthe radar system can operate with multiple PRFs as per\nthe application requirements.\nThese processing steps are discussed by taking the\nsurveillance radar specification in Table 1 as an example. The\ndiscussion starts with a brief introduction on the surveillance\nradar specifications in Section II, followed by description of\nthe receiver processing concept of the CC-OFDM MIMO\nradar in Section III, including the beam and range processing', '10.1109/TAES.2015.140477.\n[26] Y. Liu, G. Liao, Z. Yang, and J. Xu, ‘‘Design of integrated radar\nand communication system based on MIMO-OFDM waveform,’’ J.\nSyst. Eng. Electron., vol. 28, no. 4, pp. 669–680, Aug. 2017, doi:\n10.21629/JSEE.2017.04.06.\nVOLUME 13, 2025\nCC-OFDM-MIMO Radar\nDEVY KUSWIDIASTUTI (Member, IEEE) was\nborn in Indonesia, in September 1981. She\nreceived the B.Eng. degree in electrical engi-\nneering from the Institut Teknologi Sepuluh\nNopember (ITS), Indonesia, the M.Sc. degree', 'The results show that the radar could distinguish two\nlow as -80dB. Additionally, the radar is able to detect\nvelocity can be obtained from the phase variation over one\ninterference, MIMO-radar, multibeam, OFDM-radar,\nI. INTRODUCTION\nMany radar applications demand scanning capability to allow\nand coverage over a range of angular direction, such as those\nfor surveillance, vehicular, weather monitoring, imaging, and\nlicensed under a Creative Commons Attribution 4.0 License.', 'matrix or [6], [7], [8], or by adopting a phased array with\nnon-overlapping subarrays [18]. However, all of the above\nmentioned methods have problems in beam limitation and\ncost.\nCurrent trends regarding dual functional radar communi-\ncation (DFRC) systems which lead to an integrated sensing\nand communication (ISAC) systems motivate furthermore the\nuse of OFDM for radar waveform. Research on finding the\nperfect waveform that can serve for both function is still an', 'RF phase shifters because the amplitude and phase\nfrom the waveform generation stage. The multiple\nwithout beams switching that makes the radar has\n−45 to 45 degree. The proposed design of long-range\nby transmitting multi-orthogonal CC-OFDM symbols\nrange and improves the Signal-to-Noise of the\nsymbols obtained by applying orthogonal Golay\nto avoid interference between beams and between\nworks by correlating the received signals with the\ntransmitters and receivers. The output of the multibeam']","The proposed design utilizes multi-orthogonal CC-OFDM symbols to enhance the signal-to-noise ratio and mitigate interference, thereby supporting the orthogonality between OFDM symbols.","for the n-th subcarrier for symbol a in beam b is given by gn,a,b, with the sampling period of Ts. The maximum unambiguous range, Rmax, will depend on the OFDM symbol period of T0. However, by transmitting Ns orthogonal symbols in series can extend the maximum range up to Ns times further. According to the waveform specification in Table 1, the 12 symbols are transmitted in series over 12T0 to extend the maximum range from 15 up to 180 km. The beams and the CC-OFDM symbols are Golay VOLUME 13, 2025 109897 D. Kuswidiastuti et al.: Receiver Processing of the Multibeam Azimuth Scanning CC-OFDM-MIMO Radar coded and transmitted using the allocated sub-band following a specific schedule that is well known",0.75,0.909095340290109
"a speciﬁed time delay difference of (cid:49)t, each (cid:49)t value produces a beam pattern equivalent to a phased array having inter-element phase difference that depends on the corresponding subcarrier frequencies. Multiple beams can be formed simultaneously, by assigning multiple subcarrier sets which are transmit- ted using different value of (cid:49)t. This idea is the primary contribution of this paper, which will be elaborated in the sequel. A second contribution in this paper concerns the improvement of time on target in a MIMO radar adopting CC-OFDM waveforms. While multiple beamscanning in tra- ditional phased array radar results in limited time on target, CC-OFDM MIMO radar could give a much longer time on target because multiple beams in CC-OFDM radar can be","['flexibility in the CC-OFDM waveform design, where\nthe radar system can operate with multiple PRFs as per\nthe application requirements.\nThese processing steps are discussed by taking the\nsurveillance radar specification in Table 1 as an example. The\ndiscussion starts with a brief introduction on the surveillance\nradar specifications in Section II, followed by description of\nthe receiver processing concept of the CC-OFDM MIMO\nradar in Section III, including the beam and range processing', 'targets tracking in distributed MIMO radar systems,’’ Int. J. Antennas\nPropag., vol. 2017, Jul. 2017, Art. no. 7241281.\n[17] M. Davis, G. Showman, and A. Lanterman, ‘‘Coherent MIMO radar: The\nphased array and orthogonal waveforms,’’ IEEE Aerosp. Electron. Syst.\nMag., vol. 29, no. 8, pp. 76–91, Aug. 2014.\n[18] Z. Qiu, X. Li, H. Chen, Z. Zhuang, and J. Yang, ‘‘Effects of transmitting\ncorrelated waveforms for co-located multi-input multi-output radar with', '10.1109/TAES.2015.140477.\n[26] Y. Liu, G. Liao, Z. Yang, and J. Xu, ‘‘Design of integrated radar\nand communication system based on MIMO-OFDM waveform,’’ J.\nSyst. Eng. Electron., vol. 28, no. 4, pp. 669–680, Aug. 2017, doi:\n10.21629/JSEE.2017.04.06.\nVOLUME 13, 2025\nCC-OFDM-MIMO Radar\nDEVY KUSWIDIASTUTI (Member, IEEE) was\nborn in Indonesia, in September 1981. She\nreceived the B.Eng. degree in electrical engi-\nneering from the Institut Teknologi Sepuluh\nNopember (ITS), Indonesia, the M.Sc. degree', 'the transmit element has already have phase difference for\nsteering the beam to the intended direction. By doing so,\nthe phase-shifter components which are usually required in\na phase array or in a coherent MIMO radars are no longer\nneeded.\nThe principles of CC-OFDM MIMO radars have been\ndiscussed in [20] by way of an exemplary radar design for\na long-range surveillance mission. The design includes the\nsystem architecture and parameters, the waveform design', 'The results show that the radar could distinguish two\nlow as -80dB. Additionally, the radar is able to detect\nvelocity can be obtained from the phase variation over one\ninterference, MIMO-radar, multibeam, OFDM-radar,\nI. INTRODUCTION\nMany radar applications demand scanning capability to allow\nand coverage over a range of angular direction, such as those\nfor surveillance, vehicular, weather monitoring, imaging, and\nlicensed under a Creative Commons Attribution 4.0 License.']","The principles of CC-OFDM MIMO radars, including their design for long-range surveillance missions, have been elaborated in the context of multibeam scanning capabilities (Kuswidiastuti, 2025).","the specified OFDM sub-band frequencies of beam b to provide phase difference between the transmit elements for creating the beam b. Circulating code in LFM MIMO radar which is discussed in , obtain this phase difference by transmitting coherent signals with a small time delay difference ((cid:49)tb) between the antenna element. However, using an OFDM signal, this phase steering can be provided by giving a phase difference to the OFDM subcarrier phase in the frequency domain of the OFDM signal generation stage. The phase steering given to the CC-OFDM waveform can be defined as follow: β(fn,a,b, (cid:49)tb) = 2πfn,a,b(cid:49)tb Hence, the array factor of CC-OFDM will be: AF(θ, fn,a,b, (cid:49)tb) = Nt −1 2X Ipejp(α(θ)+β(fn,a,b,(cid:49)tb) where α(θ) = p=− Nt",0.0,0.9425118174410141
"In our case, quasi-continuous transmission is used through proper scheduling of OFDM transmission and echoes reception to prevent the coupling. • The receiver that continuously receives signal echoes coming from multiple targets must be able to distinguish which targets are very near or very far from the radar. This is the reason in this paper that orthogonal codes are given to successive CC-OFDM symbols. These unique codes are given and known by the receiver, so that the receiver could properly detect and distinguish targets nearby and far away from the radar. In this paper we describe the waveform design of a CC-OFDM quasi-continuous wave for MIMO long the range radar. Quasi-CW transmission could limit leakage/coupling problem by time-isolation of the","['flexibility in the CC-OFDM waveform design, where\nthe radar system can operate with multiple PRFs as per\nthe application requirements.\nThese processing steps are discussed by taking the\nsurveillance radar specification in Table 1 as an example. The\ndiscussion starts with a brief introduction on the surveillance\nradar specifications in Section II, followed by description of\nthe receiver processing concept of the CC-OFDM MIMO\nradar in Section III, including the beam and range processing', '10.1109/TAES.2015.140477.\n[26] Y. Liu, G. Liao, Z. Yang, and J. Xu, ‘‘Design of integrated radar\nand communication system based on MIMO-OFDM waveform,’’ J.\nSyst. Eng. Electron., vol. 28, no. 4, pp. 669–680, Aug. 2017, doi:\n10.21629/JSEE.2017.04.06.\nVOLUME 13, 2025\nCC-OFDM-MIMO Radar\nDEVY KUSWIDIASTUTI (Member, IEEE) was\nborn in Indonesia, in September 1981. She\nreceived the B.Eng. degree in electrical engi-\nneering from the Institut Teknologi Sepuluh\nNopember (ITS), Indonesia, the M.Sc. degree', '[24] W. Zhang, Y. Huang, J. Heredia-Juesas, and J. A. Martinez-Lorenzo,\n‘‘Software-defined millimeter-wave multistatic radar with space-time-\ncoded orthogonal frequency-division multiplexing,’’ IEEE Trans.\nMicrow. Theory Techn., vol. 70, no. 3, pp. 1620–1629, Mar. 2022, doi:\n10.1109/TMTT.2021.3134182.\n[25] X.-G. Xia, T. Zhang, and L. Kong, ‘‘MIMO OFDM radar IRCI\nfree range reconstruction with sufficient cyclic prefix,’’ IEEE Trans.\nAerosp. Electron. Syst., vol. 51, no. 3, pp. 2276–2293, Jul. 2015, doi:', 'Circulating codes,’’ J. Electr. Comput. Eng., vol. 2013, pp. 1–8, Jan. 2013,\ndoi: 10.1155/2013/809691.\n[20] D.Kuswidiastuti,L.P.Ligthart,andG.Hendrantoro,‘‘Atransmitterdesign\nfor the multi-beam CC-OFDM azimuth scanning MIMO radar,’’ IEEE\nAccess, vol. 10, pp. 53682–53702, 2022.\n[21] Z. Xu and A. Petropulu, ‘‘A bandwidth efficient dual-function radar\ncommunication system based on a MIMO radar using OFDM wave-\nforms,’’ IEEE Trans. Signal Process., vol. 71, pp. 401–416, 2023, doi:\n10.1109/TSP.2023.3241779.', 'matrix or [6], [7], [8], or by adopting a phased array with\nnon-overlapping subarrays [18]. However, all of the above\nmentioned methods have problems in beam limitation and\ncost.\nCurrent trends regarding dual functional radar communi-\ncation (DFRC) systems which lead to an integrated sensing\nand communication (ISAC) systems motivate furthermore the\nuse of OFDM for radar waveform. Research on finding the\nperfect waveform that can serve for both function is still an']","The receiver processing concept of the CC-OFDM MIMO radar includes methods for distinguishing targets at varying distances, which is essential for effective radar operation (Kuswidiastuti et al., 2025).","much defining the maximum unambiguous range of the radar system. CC-OFDM MIMO radar waveform design which is discussed in this paper is not a CP based radar, the transmitters are transmitting multiple orthogonal symbols in series without any guard time interval between the symbols. to each other, hence The symbol series are orthogonal VOLUME 13, 2025 109895 D. Kuswidiastuti et al.: Receiver Processing of the Multibeam Azimuth Scanning CC-OFDM-MIMO Radar receivers know how to distinguish the symbols received, and this could extend the maximum unambiguous range of the radar. The contributions of this paper are described as follow: 1) This paper describes the receiver processing of multi- beam CC-OFDM MIMO Radar which is designed for long-range radar surveillance application. The",0.0,0.9334896677225916
"attention is paid to utilizing this multi-dimensional orthogonality. The orthogonality between the CC-OFDM symbols is beneﬁcial in obtaining an optimum SNR for increasing the maximum unambiguous range of the radar. Another main contribution of this paper is the design of a radar waveform which could extend its maximum unambiguous range by transmitting quasi-continuously multiple orthogonal CC-OFDM symbols in series. It means that the radar will have a longer pulse rep- etition interval (PRI) which leads to a longer-range detection. The additional requirement is that there must be orthogonal- ities between the symbol series. The orthogonality is pro- vided by using orthogonal codes for coding the CC-OFDM symbols, which can be realized using the Golay codes pre- viously chosen to mitigate","['flexibility in the CC-OFDM waveform design, where\nthe radar system can operate with multiple PRFs as per\nthe application requirements.\nThese processing steps are discussed by taking the\nsurveillance radar specification in Table 1 as an example. The\ndiscussion starts with a brief introduction on the surveillance\nradar specifications in Section II, followed by description of\nthe receiver processing concept of the CC-OFDM MIMO\nradar in Section III, including the beam and range processing', '10.1109/TAES.2015.140477.\n[26] Y. Liu, G. Liao, Z. Yang, and J. Xu, ‘‘Design of integrated radar\nand communication system based on MIMO-OFDM waveform,’’ J.\nSyst. Eng. Electron., vol. 28, no. 4, pp. 669–680, Aug. 2017, doi:\n10.21629/JSEE.2017.04.06.\nVOLUME 13, 2025\nCC-OFDM-MIMO Radar\nDEVY KUSWIDIASTUTI (Member, IEEE) was\nborn in Indonesia, in September 1981. She\nreceived the B.Eng. degree in electrical engi-\nneering from the Institut Teknologi Sepuluh\nNopember (ITS), Indonesia, the M.Sc. degree', 'other multi-TRM radars due to the nature of the orthogonal\nmulti-beam generation with Golay-coded OFDM waveforms\nand subbands.\nThere are previous research on radar waveform for ISAC\npurposes [25], [26] which discussed about cyclic prefix (CP)\nbased OFDM waveform and how the CP is very much\ndefining the maximum unambiguous range of the radar\nsystem. CC-OFDM MIMO radar waveform design which\nis discussed in this paper is not a CP based radar, the\ntransmitters are transmitting multiple orthogonal symbols in', 'and the scheduling of Golay codes and subbands. The\ntransmitter architecture that adopts software-defined radar\n(SDR) concept provides flexibility in design for a variety of\napplications. However, the receiver processing required for\nthe angular, range, and radial velocity detection of targets\nis not discussed yet. The contribution of this paper is in\nthe receiver processing of CC-OFDM-MIMO radar, which is\ndifferent from those in other types of OFDM MIMO radars or', 'The results show that the radar could distinguish two\nlow as -80dB. Additionally, the radar is able to detect\nvelocity can be obtained from the phase variation over one\ninterference, MIMO-radar, multibeam, OFDM-radar,\nI. INTRODUCTION\nMany radar applications demand scanning capability to allow\nand coverage over a range of angular direction, such as those\nfor surveillance, vehicular, weather monitoring, imaging, and\nlicensed under a Creative Commons Attribution 4.0 License.']","The receiver processing of CC-OFDM-MIMO radar is distinct from other types of OFDM MIMO radars, highlighting the unique contributions of this waveform design (Receiver Processing of the Multibeam Azimuth Scanning CC-OFDM-MIMO Radar).","and radial velocity detection of targets is not discussed yet. The contribution of this paper is in the receiver processing of CC-OFDM-MIMO radar, which is different from those in other types of OFDM MIMO radars or other multi-TRM radars due to the nature of the orthogonal multi-beam generation with Golay-coded OFDM waveforms and subbands. There are previous research on radar waveform for ISAC purposes , which discussed about cyclic prefix (CP) based OFDM waveform and how the CP is very much defining the maximum unambiguous range of the radar system. CC-OFDM MIMO radar waveform design which is discussed in this paper is not a CP based radar, the transmitters are transmitting multiple orthogonal symbols in series without any guard time",0.3333333333333333,0.9436549134468767
"also be eliminated because it is possible to design a wave- form to produce an array pattern with a low sidelobe-level characteristic directly from the waveform generation stage. This paper describes a novel design of software deﬁned radar (SDR) using CC OFDM waveforms by giving the phase difference for beam steering and the amplitude tapering coef- ﬁcient at digital waveform generation stage. Hence, when the CC OFDM waveforms are transmitted simultaneously from multiple array antennas, as illustrated in Fig. 1 (a), they will create beams heading to a certain θb direction and exhibiting low side lobe levels. Assume for now that the system is a uniform linear array (ULA) with equal spacing d as depicted in Fig. 1(b). By taking","['flexibility in the CC-OFDM waveform design, where\nthe radar system can operate with multiple PRFs as per\nthe application requirements.\nThese processing steps are discussed by taking the\nsurveillance radar specification in Table 1 as an example. The\ndiscussion starts with a brief introduction on the surveillance\nradar specifications in Section II, followed by description of\nthe receiver processing concept of the CC-OFDM MIMO\nradar in Section III, including the beam and range processing', 'INDEX TERMS MIMO radar, parameter estimation, phased\ndetection.\nI. INTRODUCTION\nMulti-antenna radar systems have been known and used in\nvarious applications since 1930s. The most common type is\none with phased array (PA), in which multiple elements are\nfed with different phases to obtain a high coherent gain at\na certain direction [1]–[3]. With this advantage, PA radars\nhave been used for such applications as micro-scale radars\nThe associate editor coordinating the review of this manuscript and', '10.1109/TAES.2015.140477.\n[26] Y. Liu, G. Liao, Z. Yang, and J. Xu, ‘‘Design of integrated radar\nand communication system based on MIMO-OFDM waveform,’’ J.\nSyst. Eng. Electron., vol. 28, no. 4, pp. 669–680, Aug. 2017, doi:\n10.21629/JSEE.2017.04.06.\nVOLUME 13, 2025\nCC-OFDM-MIMO Radar\nDEVY KUSWIDIASTUTI (Member, IEEE) was\nborn in Indonesia, in September 1981. She\nreceived the B.Eng. degree in electrical engi-\nneering from the Institut Teknologi Sepuluh\nNopember (ITS), Indonesia, the M.Sc. degree', 'The results show that the radar could distinguish two\nlow as -80dB. Additionally, the radar is able to detect\nvelocity can be obtained from the phase variation over one\ninterference, MIMO-radar, multibeam, OFDM-radar,\nI. INTRODUCTION\nMany radar applications demand scanning capability to allow\nand coverage over a range of angular direction, such as those\nfor surveillance, vehicular, weather monitoring, imaging, and\nlicensed under a Creative Commons Attribution 4.0 License.', 'matrix or [6], [7], [8], or by adopting a phased array with\nnon-overlapping subarrays [18]. However, all of the above\nmentioned methods have problems in beam limitation and\ncost.\nCurrent trends regarding dual functional radar communi-\ncation (DFRC) systems which lead to an integrated sensing\nand communication (ISAC) systems motivate furthermore the\nuse of OFDM for radar waveform. Research on finding the\nperfect waveform that can serve for both function is still an']","The design of CC-OFDM waveforms allows for flexibility in radar systems, enabling operation with multiple pulse repetition frequencies tailored to application needs (Kuswidiastuti, 2025).","the specified OFDM sub-band frequencies of beam b to provide phase difference between the transmit elements for creating the beam b. Circulating code in LFM MIMO radar which is discussed in , obtain this phase difference by transmitting coherent signals with a small time delay difference ((cid:49)tb) between the antenna element. However, using an OFDM signal, this phase steering can be provided by giving a phase difference to the OFDM subcarrier phase in the frequency domain of the OFDM signal generation stage. The phase steering given to the CC-OFDM waveform can be defined as follow: β(fn,a,b, (cid:49)tb) = 2πfn,a,b(cid:49)tb Hence, the array factor of CC-OFDM will be: AF(θ, fn,a,b, (cid:49)tb) = Nt −1 2X Ipejp(α(θ)+β(fn,a,b,(cid:49)tb) where α(θ) = p=− Nt",0.75,0.93647151140705
"of the beampattern, p = Ipejp2πfnc,b(cid:49)tb. so that we can deﬁne I (cid:48) The array factor (AF) of the CC-OFDM waveform as a function of angle θ, center frequency of the allocated sub band for the b-th beam, fnc,b, and time delay (cid:49)tb for phase steering of the b-th beam is given by: AF(θ, fnc,b, (cid:49)tb) = Nt −1 2(cid:88) pejpα(θ) I (cid:48) p=− Nt −1 Nt −1 2(cid:88) p=− Nt −1 Ipejp2πfnc,b(cid:49)tb (cid:125) (cid:123)(cid:122) (cid:124) the waveform effect ejpα(θ) (cid:124) (cid:123)(cid:122) (cid:125) the array radiation effect (7) The rightmost form consists of the sum of product of two factors. The ﬁrst represents the waveform effect, which is the Taylor amplitude distribution of the array elements and the phase factor","['number of the Tx-Rx subarrays and which lead to some well-\nknown radar forms as special cases, including the PA radar,\nthe MIMO radar, and the PMIMO radar.\nIn this manner, the FPMIMO radar can achieve a desired\nmagnitude of complex amplitude, again by adjusting the\nnumber of Tx-Rx subarrays, which essentially is equivalent\nto trading off between the waveform diversity gain and the\ndirectional coherent gain. This flexibility suits the FPMIMO\nradar for various applications having different requirements', 'ongoing research until nowadays [20], [21], [22], [23]. When\nthe available bandwidth can be divided into several subbands,\nthe degree of orthogonality can be further improved by\nassigning different subbands, for the neighboring beams, and\nthe same subband can be reused for the non-adjacent beams.\nThe interference among these co-channel beams can be\nVOLUME 13, 2025\nCC-OFDM-MIMO Radar\nsuppressed further through the generation of low sidelobes by\ntapering the array element feeds. The co-channel beams are', 'flexibility in the CC-OFDM waveform design, where\nthe radar system can operate with multiple PRFs as per\nthe application requirements.\nThese processing steps are discussed by taking the\nsurveillance radar specification in Table 1 as an example. The\ndiscussion starts with a brief introduction on the surveillance\nradar specifications in Section II, followed by description of\nthe receiver processing concept of the CC-OFDM MIMO\nradar in Section III, including the beam and range processing', 'Received November 21, 2019, accepted December 27, 2019, date of publication\nDigital Object Identifier 10.1109/ACCESS.2020.2965192\nFPMIMO: A General MIMO\nWith Overlapping Subarrays\nVarious Radar Applications\nSYAHFRIZAL TAHCFULLOH 1,2, (Student Member, IEEE),\nGAMANTYO HENDRANTORO 1, (Senior Member, IEEE)\n1Department of Electrical Engineering, Institut Teknologi Sepuluh Nopember, Surabaya 60111,\n2Department of Electrical Engineering, Universitas Borneo Tarakan, Tarakan 77123, Indonesia', 'i.e. the MIMO, are 0.91, 0.79, and 0.73, respectively.\nThe trend of decreasing MCA with the increasing number\nof Tx-Rx subarrays, i.e., M and N, occurs on the FPMIMO\nradar in general, as shown in Fig. 3. Assuming an FPMIMO\nradar with conditions M = 8 and M = 13, the MCA will tend\nto decrease if the number of receive subarrays (N) increases.\nThis shows that the greater value of M means that there will\nbe as many orthogonal waveforms, which greatly determines']",The degree of orthogonality in CC-OFDM-MIMO radar can be enhanced by assigning different subbands to neighboring beams while reusing the same subband for non-adjacent beams (Receiver Processing of the Multibeam Azimuth Scanning CC-OFDM-MIMO Radar).,"the specified OFDM sub-band frequencies of beam b to provide phase difference between the transmit elements for creating the beam b. Circulating code in LFM MIMO radar which is discussed in , obtain this phase difference by transmitting coherent signals with a small time delay difference ((cid:49)tb) between the antenna element. However, using an OFDM signal, this phase steering can be provided by giving a phase difference to the OFDM subcarrier phase in the frequency domain of the OFDM signal generation stage. The phase steering given to the CC-OFDM waveform can be defined as follow: β(fn,a,b, (cid:49)tb) = 2πfn,a,b(cid:49)tb Hence, the array factor of CC-OFDM will be: AF(θ, fn,a,b, (cid:49)tb) = Nt −1 2X Ipejp(α(θ)+β(fn,a,b,(cid:49)tb) where α(θ) = p=− Nt",0.6666666666666666,0.9325079812049578
"beamforming at transmit is produced by divid- ing the total OFDM bandwidth B, consisting of Nc subcarriers into Nsb sub bands with smaller bandwidth of Bb, consisting of Ncb subcarriers. The bandwidth per sub-band Bb will deter- mine the range resolution of the CC-OFDM radar as follows: (cid:49)R = 2Bb (8) VOLUME 10, 2022 D. Kuswidiastuti et al.: Transmitter Design for Multibeam CC-OFDM Azimuth Scanning MIMO Radar FIGURE 1. Circulating code in OFDM MIMO radar transmitters with Nt elements transmitting coherence signals, delay difference of (cid:49)t and array factor is defined in the xy plane: (a) time domain and (b) space domain. where (cid:49)R is the range resolution in each beam. If the fre- quency spacing between the OFDM subcarriers","['flexibility in the CC-OFDM waveform design, where\nthe radar system can operate with multiple PRFs as per\nthe application requirements.\nThese processing steps are discussed by taking the\nsurveillance radar specification in Table 1 as an example. The\ndiscussion starts with a brief introduction on the surveillance\nradar specifications in Section II, followed by description of\nthe receiver processing concept of the CC-OFDM MIMO\nradar in Section III, including the beam and range processing', 'for linear arrays based on overlapped sub-arrays,’’ IEEE Trans. Antennas\nPropag., vol. 62, no. 4, pp. 1769–1778, Apr. 2014.\n[22] A. Hassanien and S. A. Vorobyov, ‘‘Phased-MIMO radar: A tradeoff\nbetween phased-array and MIMO radars,’’ IEEE Trans. Signal Process.,\nvol. 58, no. 6, pp. 3137–3151, Jun. 2010.\n[23] A. Roshanzamir and M. Bastani, ‘‘Hybrid orthogonal-phased array MIMO\nRADAR,’’ in Proc. IET Int. Radar Conf., 2013, pp. 1–5.\n[24] W.-Q. Wang, ‘‘Phased-MIMO radar with frequency diversity for range-', '[24] W. Zhang, Y. Huang, J. Heredia-Juesas, and J. A. Martinez-Lorenzo,\n‘‘Software-defined millimeter-wave multistatic radar with space-time-\ncoded orthogonal frequency-division multiplexing,’’ IEEE Trans.\nMicrow. Theory Techn., vol. 70, no. 3, pp. 1620–1629, Mar. 2022, doi:\n10.1109/TMTT.2021.3134182.\n[25] X.-G. Xia, T. Zhang, and L. Kong, ‘‘MIMO OFDM radar IRCI\nfree range reconstruction with sufficient cyclic prefix,’’ IEEE Trans.\nAerosp. Electron. Syst., vol. 51, no. 3, pp. 2276–2293, Jul. 2015, doi:', '3Research center for Telecommunication-National Research and Innovation Agency\nCorresponding author: Devy Kuswidiastuti (devy@ee.its.ac.id)\nThis work was supported by Indonesia National Research and Innovation\nAgency (LPDP) within the Program of Research and Innovation for\nContract 79/IV/KS/11/2022 and Contract 2582/PKS/ITS/2022.\nABSTRACT The proposed CC-OFDM-MIMO radar\nusing array antennas to provide multiple high-resolution\nRF phase shifters because the amplitude and phase', 'ongoing research until nowadays [20], [21], [22], [23]. When\nthe available bandwidth can be divided into several subbands,\nthe degree of orthogonality can be further improved by\nassigning different subbands, for the neighboring beams, and\nthe same subband can be reused for the non-adjacent beams.\nThe interference among these co-channel beams can be\nVOLUME 13, 2025\nCC-OFDM-MIMO Radar\nsuppressed further through the generation of low sidelobes by\ntapering the array element feeds. The co-channel beams are']","The degree of orthogonality in CC-OFDM radar can be enhanced by assigning different subbands for neighboring beams while reusing the same subband for non-adjacent beams (Kuswidiastuti et al., 2022).","for the n-th subcarrier for symbol a in beam b is given by gn,a,b, with the sampling period of Ts. The maximum unambiguous range, Rmax, will depend on the OFDM symbol period of T0. However, by transmitting Ns orthogonal symbols in series can extend the maximum range up to Ns times further. According to the waveform specification in Table 1, the 12 symbols are transmitted in series over 12T0 to extend the maximum range from 15 up to 180 km. The beams and the CC-OFDM symbols are Golay VOLUME 13, 2025 109897 D. Kuswidiastuti et al.: Receiver Processing of the Multibeam Azimuth Scanning CC-OFDM-MIMO Radar coded and transmitted using the allocated sub-band following a specific schedule that is well known",0.6666666666666666,0.9267312572053604
"Multibeam CC-OFDM Azimuth Scanning MIMO Radar The phase steering is deﬁned as: β(fn,a,b, (cid:49)tb) = 2π fn,a,b(cid:49)tb (13) hence, at any transmitter p, the WG generates Nb beams simultaneously during the Nsym symbol periods with ampli- tude control Ip. The CC-OFDM complex signal of symbol a in beam b at the p-th transmitter is: xp,a,b(t) = Ip −1 Ncb (cid:88) n=0 Cn,pga,b,nejpβ(fn,a,b,(cid:49)tb) × ej2π(n+(za,b−1)Ncb )(cid:49)f (t−(a−1)T0) for 0 ≤ t − (a − 1)T0 + p(cid:49)tb ≤ T0. (14) The complex discrete-time signal of the baseband CC-OFDM signal in (14) is: xp,a,b(t) = Ip −1 Ncb (cid:88) n=0 Cn,pga,b,nejpβ(fn,a,b,(cid:49)tb) × ej2π(n+(za,b−1)Ncb )(cid:49)f (kTs−(a−1)T0) for 0 ≤ kTs − (a − 1)T0 + p(cid:49)tb ≤ T0. (15) The time delay (cid:49)tb","['flexibility in the CC-OFDM waveform design, where\nthe radar system can operate with multiple PRFs as per\nthe application requirements.\nThese processing steps are discussed by taking the\nsurveillance radar specification in Table 1 as an example. The\ndiscussion starts with a brief introduction on the surveillance\nradar specifications in Section II, followed by description of\nthe receiver processing concept of the CC-OFDM MIMO\nradar in Section III, including the beam and range processing', 'each of the 101 T/R modules that are individually associated\nwith the 101-element antennas.\nVOLUME 13, 2025\nD. Kuswidiastuti et al.: Receiver Processing of the Multibeam Azimuth Scanning\nFIGURE 4. Transmit and receive scheduling of CC-OFDM MIMO Radar.\nIn each module, the horizontal array element takes the form\nof a 21-element vertical array. A target echo is received by\neach of the 21-elements, each of which is connected to a\ncirculator with 40 dB isolation. A combiner takes the signals', 'is one out of 101 that constitute the MIMO transmitter system\nVOLUME 13, 2025\nD. Kuswidiastuti et al.: Receiver Processing of the Multibeam Azimuth Scanning\nFIGURE 1. Block diagram of a transmit receive module of CC-OFDM\nTABLE 1. CC-OFDM MIMO radar system specifications for surveillance\napplications.\nof the surveillance radar. The T/R module which feeds an\nantenna element belonging to the horizontal MIMO array that\nprovides the azimuth scanning. The analog subsystems of the', '109902\nal.: Receiver Processing of the Multibeam Azimuth Scanning CC-OFDM-MIMO Radar\nFIGURE 8. The correlator outputs of: a) beam −8, b) beam 0, and\nc) beam 8.\nFIGURE 9. The correlator outputs of beam 0 with two targets present at\n100 km with a space of 60 meter from each other.\nThe complete schedule for the 63 beams can be found\nin [20]. Interference between the neigboring beams\nare very low because they use a different sub-band,\nhowever, because of bandwidth limitation, the available', '3Research center for Telecommunication-National Research and Innovation Agency\nCorresponding author: Devy Kuswidiastuti (devy@ee.its.ac.id)\nThis work was supported by Indonesia National Research and Innovation\nAgency (LPDP) within the Program of Research and Innovation for\nContract 79/IV/KS/11/2022 and Contract 2582/PKS/ITS/2022.\nABSTRACT The proposed CC-OFDM-MIMO radar\nusing array antennas to provide multiple high-resolution\nRF phase shifters because the amplitude and phase']","The radar system can operate with multiple pulse repetition frequencies (PRFs) as per the application requirements (Kuswidiastuti et al., 2025).","the specified OFDM sub-band frequencies of beam b to provide phase difference between the transmit elements for creating the beam b. Circulating code in LFM MIMO radar which is discussed in , obtain this phase difference by transmitting coherent signals with a small time delay difference ((cid:49)tb) between the antenna element. However, using an OFDM signal, this phase steering can be provided by giving a phase difference to the OFDM subcarrier phase in the frequency domain of the OFDM signal generation stage. The phase steering given to the CC-OFDM waveform can be defined as follow: β(fn,a,b, (cid:49)tb) = 2πfn,a,b(cid:49)tb Hence, the array factor of CC-OFDM will be: AF(θ, fn,a,b, (cid:49)tb) = Nt −1 2X Ipejp(α(θ)+β(fn,a,b,(cid:49)tb) where α(θ) = p=− Nt",1.0,0.9115694485646094
"the n-th subcarrier for symbol a in beam b is given by ga,b,n. In order to generate CC-OFDM waveform, additional phase steering β(fn,a,b, (cid:49)tb) is given to the speciﬁed OFDM sub-band frequencies of beam b for generating a required time delay between the transmit elements for beam b. 53688 VOLUME 10, 2022 D. Kuswidiastuti et al.: Transmitter Design for Multibeam CC-OFDM Azimuth Scanning MIMO Radar TABLE 1. Surveillance radar system and waveform specifications. strict requirement for the time and frequency accuracy of the oscillator clocks at transmitters and receivers. For instance, with an IF of 20 MHz and a carrier frequency offset of 10 kHz the error in beam direction becomes 0.1◦ and the estimated range error equals 0.27 meter","['flexibility in the CC-OFDM waveform design, where\nthe radar system can operate with multiple PRFs as per\nthe application requirements.\nThese processing steps are discussed by taking the\nsurveillance radar specification in Table 1 as an example. The\ndiscussion starts with a brief introduction on the surveillance\nradar specifications in Section II, followed by description of\nthe receiver processing concept of the CC-OFDM MIMO\nradar in Section III, including the beam and range processing', '109902\nal.: Receiver Processing of the Multibeam Azimuth Scanning CC-OFDM-MIMO Radar\nFIGURE 8. The correlator outputs of: a) beam −8, b) beam 0, and\nc) beam 8.\nFIGURE 9. The correlator outputs of beam 0 with two targets present at\n100 km with a space of 60 meter from each other.\nThe complete schedule for the 63 beams can be found\nin [20]. Interference between the neigboring beams\nare very low because they use a different sub-band,\nhowever, because of bandwidth limitation, the available', 'see https://creativecommons.org/licenses/by/4.0/ VOLUME 13, 2025\nD. Kuswidiastuti et al.: Receiver Processing of the Multibeam Azimuth Scanning\nso on. The traditional scanning radars with mechanically\nrotating platform can only scan slowly at the angular speed of\nthe rotator and are prone to mechanical errors and inaccuracy\nin angular direction [1].\nElectronically scanning radars employing a phased array,\nwhich requires a phase-shifter per element to allow for beam', 'is very much depending on the synchronization between the\nWGs, the DSPs and the oscillators on the T/R modules of\nCC-OFDM MIMO radar.\nREFERENCES\n[1] J. A. Scheer, ‘‘Radar search and overview of detection in interference,\n‘‘Radar search and overview of detection in interference,’’ in Principles\nModern Radar, vol. 1. SciTech Publishing, 2010, pp. 87–113.\n[2] C. A. Balanis, Antenna Theory: Analysis and Design, 4th ed. Wiley, 2016.\n[3] M. J. P. Porras, T. Bertuch, C. Loecker, R. Adams, R. Wunderlich, and', 'is one out of 101 that constitute the MIMO transmitter system\nVOLUME 13, 2025\nD. Kuswidiastuti et al.: Receiver Processing of the Multibeam Azimuth Scanning\nFIGURE 1. Block diagram of a transmit receive module of CC-OFDM\nTABLE 1. CC-OFDM MIMO radar system specifications for surveillance\napplications.\nof the surveillance radar. The T/R module which feeds an\nantenna element belonging to the horizontal MIMO array that\nprovides the azimuth scanning. The analog subsystems of the']","The processing steps for the CC-OFDM waveform design in a surveillance radar system are discussed, highlighting the specifications outlined in Table 1.","The beams and the CC-OFDM symbols are Golay VOLUME 13, 2025 109897 D. Kuswidiastuti et al.: Receiver Processing of the Multibeam Azimuth Scanning CC-OFDM-MIMO Radar coded and transmitted using the allocated sub-band following a specific schedule that is well known by the transmitter and receiver. The neighboring beam must use different sub-band and sub-band reuse is allowed for beams that are at least 10◦ in separation. In order to generate CC-OFDM waveform, additional phase steering β(fn,a,b, (cid:49)tb) is given to the specified OFDM sub-band frequencies of beam b to provide phase difference between the transmit elements for creating the beam b. Circulating code in LFM MIMO radar which is discussed in , obtain this phase difference by transmitting coherent signals",1.0,0.9488810892583118
"FOR LONG-RANGE SURVEILLANCE A. REQUIREMENTS A. REQUIREMENTS To elucidate the novel concept and detailed implementation of the CC-OFDM MIMO radar, we will take a surveillance radar design as an example for analyses in the subsequent sections. The CC-OFDM MIMO radar waveform designed herein is based on the requirement of surveillance radars used in coastal areas, where the target of interest are ships and small aircrafts in the area within 180 km from the radar site. OFDM signals with subcarrier spacing of 10 KHz will give a maximum unambiguous range of 15 km. In order to extend the maximum unambiguous range of the radar up to 180 km, 12 orthogonal OFDM symbols with symbol time of 0.1 ms are transmitted in","['flexibility in the CC-OFDM waveform design, where\nthe radar system can operate with multiple PRFs as per\nthe application requirements.\nThese processing steps are discussed by taking the\nsurveillance radar specification in Table 1 as an example. The\ndiscussion starts with a brief introduction on the surveillance\nradar specifications in Section II, followed by description of\nthe receiver processing concept of the CC-OFDM MIMO\nradar in Section III, including the beam and range processing', '10.1109/TAES.2015.140477.\n[26] Y. Liu, G. Liao, Z. Yang, and J. Xu, ‘‘Design of integrated radar\nand communication system based on MIMO-OFDM waveform,’’ J.\nSyst. Eng. Electron., vol. 28, no. 4, pp. 669–680, Aug. 2017, doi:\n10.21629/JSEE.2017.04.06.\nVOLUME 13, 2025\nCC-OFDM-MIMO Radar\nDEVY KUSWIDIASTUTI (Member, IEEE) was\nborn in Indonesia, in September 1981. She\nreceived the B.Eng. degree in electrical engi-\nneering from the Institut Teknologi Sepuluh\nNopember (ITS), Indonesia, the M.Sc. degree', 'VOLUME 13, 2025\nCC-OFDM-MIMO Radar\nFIGURE 11. The range profile of two targets at: a) beam 0 and b) beam 1.\nFIGURE 12. The correlator output of the co-channel: a) beam −7,\nb) beam 1, and c) beam 9.\nFIGURE 13. The correlator output of: a) beam 0 with a target at 100 km,\nand b) beam 8 with a target at 101 km respectively.\nthe targets are located at beam 0 and beam 8 at the\nrange of 100 km and 101 km respectively. The beams\nare 10.2◦ apart in the angular space, and the beams are', 'The results show that the radar could distinguish two\nlow as -80dB. Additionally, the radar is able to detect\nvelocity can be obtained from the phase variation over one\ninterference, MIMO-radar, multibeam, OFDM-radar,\nI. INTRODUCTION\nMany radar applications demand scanning capability to allow\nand coverage over a range of angular direction, such as those\nfor surveillance, vehicular, weather monitoring, imaging, and\nlicensed under a Creative Commons Attribution 4.0 License.', 'VOLUME 8, 2020\nS. Tahcfulloh, G. Hendrantoro: FPMIMO: General MIMO Structure With Overlapping\nsonar, aerospace remote sensing, and so on [6]–[8]. How-\never, the MIMO radar, albeit superior in waveform diversity,\nis weak in directional gain [11].\nThe problems inherent in the PA and MIMO radars are par-\ntially solved by the Phased MIMO radar approach (PMIMO),\nwhich exploits the main advantage of the PA radar, i.e., the\ncoherent gain, and that of the MIMO radar, i.e., the diversity']","The processing steps for the CC-OFDM MIMO radar are discussed with reference to surveillance radar specifications, illustrating the design requirements for long-range surveillance applications.","much defining the maximum unambiguous range of the radar system. CC-OFDM MIMO radar waveform design which is discussed in this paper is not a CP based radar, the transmitters are transmitting multiple orthogonal symbols in series without any guard time interval between the symbols. to each other, hence The symbol series are orthogonal VOLUME 13, 2025 109895 D. Kuswidiastuti et al.: Receiver Processing of the Multibeam Azimuth Scanning CC-OFDM-MIMO Radar receivers know how to distinguish the symbols received, and this could extend the maximum unambiguous range of the radar. The contributions of this paper are described as follow: 1) This paper describes the receiver processing of multi- beam CC-OFDM MIMO Radar which is designed for long-range radar surveillance application. The",0.6666666666666666,0.9400022695723562
"of 10 KHz will give a maximum unambiguous range of 15 km. In order to extend the maximum unambiguous range of the radar up to 180 km, 12 orthogonal OFDM symbols with symbol time of 0.1 ms are transmitted in series. The 12 OFDM signals are transmitted in quasi-continuous way, since the transmitter is idle during the reception period within one repetition time interval. The CC-OFDM MIMO radar system and waveform speciﬁcations are described in Table 1 In this case, each sub band which consists of 256 subcarriers are used for beam- forming; that leads to 2.56 MHz bandwidth and results in a range resolution of 60 meters in each beam. The OFDM signal period is 0.1 ms and the","['flexibility in the CC-OFDM waveform design, where\nthe radar system can operate with multiple PRFs as per\nthe application requirements.\nThese processing steps are discussed by taking the\nsurveillance radar specification in Table 1 as an example. The\ndiscussion starts with a brief introduction on the surveillance\nradar specifications in Section II, followed by description of\nthe receiver processing concept of the CC-OFDM MIMO\nradar in Section III, including the beam and range processing', 'VOLUME 13, 2025\nCC-OFDM-MIMO Radar\nFIGURE 11. The range profile of two targets at: a) beam 0 and b) beam 1.\nFIGURE 12. The correlator output of the co-channel: a) beam −7,\nb) beam 1, and c) beam 9.\nFIGURE 13. The correlator output of: a) beam 0 with a target at 100 km,\nand b) beam 8 with a target at 101 km respectively.\nthe targets are located at beam 0 and beam 8 at the\nrange of 100 km and 101 km respectively. The beams\nare 10.2◦ apart in the angular space, and the beams are', 'ongoing research until nowadays [20], [21], [22], [23]. When\nthe available bandwidth can be divided into several subbands,\nthe degree of orthogonality can be further improved by\nassigning different subbands, for the neighboring beams, and\nthe same subband can be reused for the non-adjacent beams.\nThe interference among these co-channel beams can be\nVOLUME 13, 2025\nCC-OFDM-MIMO Radar\nsuppressed further through the generation of low sidelobes by\ntapering the array element feeds. The co-channel beams are', 'range resolution will be 60 meter. The CC-OFDM individual\nsymbol duration is 0.1 ms, and the transmitters transmit a\nframe consisting of 12 consecutive symbols in series. The\nframe period is 1.2 ms, when the symbols are orthogonal,\nthen the maximum unambiguous range is not only 15 km but\n12 times longer (i.e. 180 km).\nCC-OFDM transmitter and receiver block diagram incor-\nporates simple transmit and receive modules. Fig. 1 depicts\nthe block diagram of a transmit/receive (T/R) module, which', '109902\nal.: Receiver Processing of the Multibeam Azimuth Scanning CC-OFDM-MIMO Radar\nFIGURE 8. The correlator outputs of: a) beam −8, b) beam 0, and\nc) beam 8.\nFIGURE 9. The correlator outputs of beam 0 with two targets present at\n100 km with a space of 60 meter from each other.\nThe complete schedule for the 63 beams can be found\nin [20]. Interference between the neigboring beams\nare very low because they use a different sub-band,\nhowever, because of bandwidth limitation, the available']","The CC-OFDM individual symbol duration is 0.1 ms, and the transmitters transmit a frame consisting of 12 consecutive symbols in series, resulting in a maximum unambiguous range of 180 km (Receiver Processing of the Multibeam Azimuth Scanning CC-OFDM-MIMO Radar).","much defining the maximum unambiguous range of the radar system. CC-OFDM MIMO radar waveform design which is discussed in this paper is not a CP based radar, the transmitters are transmitting multiple orthogonal symbols in series without any guard time interval between the symbols. to each other, hence The symbol series are orthogonal VOLUME 13, 2025 109895 D. Kuswidiastuti et al.: Receiver Processing of the Multibeam Azimuth Scanning CC-OFDM-MIMO Radar receivers know how to distinguish the symbols received, and this could extend the maximum unambiguous range of the radar. The contributions of this paper are described as follow: 1) This paper describes the receiver processing of multi- beam CC-OFDM MIMO Radar which is designed for long-range radar surveillance application. The",0.75,0.9507003937280768
"it can be seen from (11) that the phase correction, Cn,p,a,b is given to the n-th subcarrier frequency of the OFDM waveform generated for the p-th transmitter for beamforming to θb of symbol a. The Taylor coefﬁcient for sidelobe suppression Ip in (7) is also digitally generated directly from the WG. It is for these two reasons that the CC-OFDM waveforms must be generated simultane- ously per row of the azimuth antenna elements. It is therefore necessary to implement a digital WG at each transmitter with programmability feature, since different radar applications might require different parameters for the beams, waveforms, symbols and frames of symbols. Consequently, the adoption of the concept of software-deﬁned radar (SDR) platform is advantageous and instrumental","['flexibility in the CC-OFDM waveform design, where\nthe radar system can operate with multiple PRFs as per\nthe application requirements.\nThese processing steps are discussed by taking the\nsurveillance radar specification in Table 1 as an example. The\ndiscussion starts with a brief introduction on the surveillance\nradar specifications in Section II, followed by description of\nthe receiver processing concept of the CC-OFDM MIMO\nradar in Section III, including the beam and range processing', '10.1109/EURAD.2015.7346252.\n[12] A. S. Kumar, N. Unnikrishnan, R. Raghu, and R. Rajesh, ‘‘FPGA based\nOFDM MIMO transmit beamformer for multi-functional software defined\nradars,’’ in Proc. IEEE Space, Aerosp. Defence Conf. (SPACE), Bangalore,\nIndia, Jul. 2024, pp. 527–531, doi: 10.1109/space63117.2024.10668277.\n[13] J. Moghaddasi and K. Wu, ‘‘Multifunctional transceiver for future radar\nsensing and radio communicating data-fusion platform,’’ IEEE Access,', 'Radar\nLIGTHART 2, (Life Fellow, IEEE),\nIEEE), TITIEK SURYANI 1, (Member, IEEE),\nAND YUYU WAHYU 3, (Member, IEEE)\nSurabaya 60111, Indonesia\n(Retired)\n(BRIN), Bandung 40135, Indonesia\nAgency (BRIN) from Indonesia Endowment Fund for Education\nAdvanced Indonesia (RIIM) Batch 2, in November 2022, under\nenables the development of software-defined radar by\nbeams with low peak SLLs. The radar requires no\ncontrol for multiple beamforming are provided directly\nbeams are transmitted simultaneously and continuously', 'radar T/R modules seem like a common phased array radar\nsystem but without any phase shifter components. On the\ncontrary, the digital parts i.e. the digital waveform generator\n(DWG) and the digital signal processor (DSP) are rather\ndifferent because both devices are needed as part of the T/R\nVOLUME 13, 2025\nCC-OFDM-MIMO Radar\nMIMO radar.\nmodule that goes to the azimuth array element. The phase\ndifference value for beamforming to a specific beam, the\nphase correction for mitigating beam squinting caused by', 'The results show that the radar could distinguish two\nlow as -80dB. Additionally, the radar is able to detect\nvelocity can be obtained from the phase variation over one\ninterference, MIMO-radar, multibeam, OFDM-radar,\nI. INTRODUCTION\nMany radar applications demand scanning capability to allow\nand coverage over a range of angular direction, such as those\nfor surveillance, vehicular, weather monitoring, imaging, and\nlicensed under a Creative Commons Attribution 4.0 License.']","The phase correction for mitigating beam squinting is essential for effective beamforming in CC-OFDM radar systems (LIGTHART et al., 2025).","waveform will be transmitted through. Hence, instead of just have one DWG at the transmitter side like a common conventional phased array radar, CC-OFDM Radar will need DWGs as many as the number of the transmit array elements needed for digital beamforming purposes . The digital baseband OFDM signal of symbol a in beam b is coded with Golay codes can be defined as: sa,b(k) = Nc−1 n=0 ga,b,nej2πfn,a,b(kTs−(a−1)T0) for [0 ≤ kTs − (a − 1)T0 ≤ T0) (1) where a = [1, 2, . . . , Ns], b = [−(Nb − 1)/2, . . . , 0, . . . , (Nb − 1)/2], n = 0, 1, . . . , Nc − 1, and k",0.5,0.8742677559486357
"xIF p,a,b, will be converted to analog signals through a DAC device of the p-th transmitter. Using the same procedure, the 63 beam signals are generated simultaneously by the digital WG at each transmit element. For a good operational performance of CC OFDM MIMO radar an important and crucial note should be made now, that is: Transmitting multiple symbols in series and in parallel contributing simultaneously to multiple beams effective in various range intervals, the quasi - CW transmission neces- sitates that the CC OFDM symbols should be orthogonal in time, frequency and code. In the following the orthogonality aspects are detailed. • Single CC OFDM symbol In this example, one symbol of CC-OFDM waveform contributes to 63 beam signals.","['flexibility in the CC-OFDM waveform design, where\nthe radar system can operate with multiple PRFs as per\nthe application requirements.\nThese processing steps are discussed by taking the\nsurveillance radar specification in Table 1 as an example. The\ndiscussion starts with a brief introduction on the surveillance\nradar specifications in Section II, followed by description of\nthe receiver processing concept of the CC-OFDM MIMO\nradar in Section III, including the beam and range processing', '10.1109/TAES.2015.140477.\n[26] Y. Liu, G. Liao, Z. Yang, and J. Xu, ‘‘Design of integrated radar\nand communication system based on MIMO-OFDM waveform,’’ J.\nSyst. Eng. Electron., vol. 28, no. 4, pp. 669–680, Aug. 2017, doi:\n10.21629/JSEE.2017.04.06.\nVOLUME 13, 2025\nCC-OFDM-MIMO Radar\nDEVY KUSWIDIASTUTI (Member, IEEE) was\nborn in Indonesia, in September 1981. She\nreceived the B.Eng. degree in electrical engi-\nneering from the Institut Teknologi Sepuluh\nNopember (ITS), Indonesia, the M.Sc. degree', 'matrix or [6], [7], [8], or by adopting a phased array with\nnon-overlapping subarrays [18]. However, all of the above\nmentioned methods have problems in beam limitation and\ncost.\nCurrent trends regarding dual functional radar communi-\ncation (DFRC) systems which lead to an integrated sensing\nand communication (ISAC) systems motivate furthermore the\nuse of OFDM for radar waveform. Research on finding the\nperfect waveform that can serve for both function is still an', 'the transmit element has already have phase difference for\nsteering the beam to the intended direction. By doing so,\nthe phase-shifter components which are usually required in\na phase array or in a coherent MIMO radars are no longer\nneeded.\nThe principles of CC-OFDM MIMO radars have been\ndiscussed in [20] by way of an exemplary radar design for\na long-range surveillance mission. The design includes the\nsystem architecture and parameters, the waveform design', 'Circulating codes,’’ J. Electr. Comput. Eng., vol. 2013, pp. 1–8, Jan. 2013,\ndoi: 10.1155/2013/809691.\n[20] D.Kuswidiastuti,L.P.Ligthart,andG.Hendrantoro,‘‘Atransmitterdesign\nfor the multi-beam CC-OFDM azimuth scanning MIMO radar,’’ IEEE\nAccess, vol. 10, pp. 53682–53702, 2022.\n[21] Z. Xu and A. Petropulu, ‘‘A bandwidth efficient dual-function radar\ncommunication system based on a MIMO radar using OFDM wave-\nforms,’’ IEEE Trans. Signal Process., vol. 71, pp. 401–416, 2023, doi:\n10.1109/TSP.2023.3241779.']","The principles of CC-OFDM MIMO radars, including the transmission of multiple symbols contributing to various beam signals, have been discussed in the context of radar design for long-range surveillance missions (Kuswidiastuti et al., 2022).","much defining the maximum unambiguous range of the radar system. CC-OFDM MIMO radar waveform design which is discussed in this paper is not a CP based radar, the transmitters are transmitting multiple orthogonal symbols in series without any guard time interval between the symbols. to each other, hence The symbol series are orthogonal VOLUME 13, 2025 109895 D. Kuswidiastuti et al.: Receiver Processing of the Multibeam Azimuth Scanning CC-OFDM-MIMO Radar receivers know how to distinguish the symbols received, and this could extend the maximum unambiguous range of the radar. The contributions of this paper are described as follow: 1) This paper describes the receiver processing of multi- beam CC-OFDM MIMO Radar which is designed for long-range radar surveillance application. The",0.6666666666666666,0.9332382137295365
"VII. THE COUPLING BETWEEN CC-OFDM MULTI-BEAMS VII. THE COUPLING BETWEEN CC-OFDM MULTI-BEAMS A. THE COUPLING BETWEEN NEIGHBORING BEAMS A. THE COUPLING BETWEEN NEIGHBORING BEAMS This section analyzes the coupling between beams which are transmitted simultaneously over the same period of sym- bol duration. Analysis is done to the beams transmitted on the ﬁrst symbol period, with the scheduling as described in Table 2. It is necessary to make sure that the coupling between the multi-beam CC-OFDM which are transmitted simultaneously using limited bandwidth are low to avoid the probability of false alarm on radar receiver. In this paper, coupling analysis are done for near broadside and near edge beams (i.e., beams that spatially close to each other) and for co-channel","['flexibility in the CC-OFDM waveform design, where\nthe radar system can operate with multiple PRFs as per\nthe application requirements.\nThese processing steps are discussed by taking the\nsurveillance radar specification in Table 1 as an example. The\ndiscussion starts with a brief introduction on the surveillance\nradar specifications in Section II, followed by description of\nthe receiver processing concept of the CC-OFDM MIMO\nradar in Section III, including the beam and range processing', 'ongoing research until nowadays [20], [21], [22], [23]. When\nthe available bandwidth can be divided into several subbands,\nthe degree of orthogonality can be further improved by\nassigning different subbands, for the neighboring beams, and\nthe same subband can be reused for the non-adjacent beams.\nThe interference among these co-channel beams can be\nVOLUME 13, 2025\nCC-OFDM-MIMO Radar\nsuppressed further through the generation of low sidelobes by\ntapering the array element feeds. The co-channel beams are', 'Circulating codes,’’ J. Electr. Comput. Eng., vol. 2013, pp. 1–8, Jan. 2013,\ndoi: 10.1155/2013/809691.\n[20] D.Kuswidiastuti,L.P.Ligthart,andG.Hendrantoro,‘‘Atransmitterdesign\nfor the multi-beam CC-OFDM azimuth scanning MIMO radar,’’ IEEE\nAccess, vol. 10, pp. 53682–53702, 2022.\n[21] Z. Xu and A. Petropulu, ‘‘A bandwidth efficient dual-function radar\ncommunication system based on a MIMO radar using OFDM wave-\nforms,’’ IEEE Trans. Signal Process., vol. 71, pp. 401–416, 2023, doi:\n10.1109/TSP.2023.3241779.', '10.1109/TAES.2015.140477.\n[26] Y. Liu, G. Liao, Z. Yang, and J. Xu, ‘‘Design of integrated radar\nand communication system based on MIMO-OFDM waveform,’’ J.\nSyst. Eng. Electron., vol. 28, no. 4, pp. 669–680, Aug. 2017, doi:\n10.21629/JSEE.2017.04.06.\nVOLUME 13, 2025\nCC-OFDM-MIMO Radar\nDEVY KUSWIDIASTUTI (Member, IEEE) was\nborn in Indonesia, in September 1981. She\nreceived the B.Eng. degree in electrical engi-\nneering from the Institut Teknologi Sepuluh\nNopember (ITS), Indonesia, the M.Sc. degree', 'multiple transmitters and the multiple receivers of CC-OFDM\nradars are very crucial to guarantee that the receiver can\ngive the accurate detection. It can be seen from Fig. 4, that\nthe receiver are continuously active and ready to receive the\npossible incoming beam symbols. Taken an example of the\nreceiver schedule from 0 to 0.1 ms, the receiver is expecting\nonly the echo of the first symbol to arrive. However, in the\nnext 0.1 to 0.2 ms, there are 2 possible symbols that may']","The degree of orthogonality among neighboring beams can be enhanced by assigning different subbands, while the same subband may be reused for non-adjacent beams (Kuswidiastuti et al., 2022).","together with transmit scheduling to avoid transmit receive coupling. The receive scheduling is also related to the time scheduling of the correlation between symbols, which is an important stage in the beam and range processing. The transmit and receive time schedule of CC-OFDM radar is described in Fig. 4. The receive scheduling is very important, especially in a multiple target scheme. The echo signals caused by two or more targets at different ranges (i.e., one target is near to the radar, and the other is far) could cause range ambiguity. The clock synchronization between the multiple transmitters and the multiple receivers of CC-OFDM radars are very crucial to guarantee that the receiver can give the accurate detection. It can be",0.6666666666666666,0.9315500987576335
"beam isolation, the range resolution, the Doppler resolution, those parameters can be modiﬁed and optimized based on the characteristic of the target of interest. Some of the radar speciﬁcations that can be achieved by modifying some of the CC-OFDM waveform parameters are as follows: • The maximum unambiguous range for conventional OFDM radar is mainly limited by the spacing between the OFDM subcarriers. However, one could extend the maximum unambiguous range of the radar by send- ing multiple successive orthogonal CC-OFDM symbols containing orthogonal Golay codes. How many symbols that must be sent will depend on how far the maximum unambiguous range is that the application requires. • The maximum velocity depends on the frequency spac- ing between the OFDM","['flexibility in the CC-OFDM waveform design, where\nthe radar system can operate with multiple PRFs as per\nthe application requirements.\nThese processing steps are discussed by taking the\nsurveillance radar specification in Table 1 as an example. The\ndiscussion starts with a brief introduction on the surveillance\nradar specifications in Section II, followed by description of\nthe receiver processing concept of the CC-OFDM MIMO\nradar in Section III, including the beam and range processing', '10.1109/TAES.2015.140477.\n[26] Y. Liu, G. Liao, Z. Yang, and J. Xu, ‘‘Design of integrated radar\nand communication system based on MIMO-OFDM waveform,’’ J.\nSyst. Eng. Electron., vol. 28, no. 4, pp. 669–680, Aug. 2017, doi:\n10.21629/JSEE.2017.04.06.\nVOLUME 13, 2025\nCC-OFDM-MIMO Radar\nDEVY KUSWIDIASTUTI (Member, IEEE) was\nborn in Indonesia, in September 1981. She\nreceived the B.Eng. degree in electrical engi-\nneering from the Institut Teknologi Sepuluh\nNopember (ITS), Indonesia, the M.Sc. degree', 'and the scheduling of Golay codes and subbands. The\ntransmitter architecture that adopts software-defined radar\n(SDR) concept provides flexibility in design for a variety of\napplications. However, the receiver processing required for\nthe angular, range, and radial velocity detection of targets\nis not discussed yet. The contribution of this paper is in\nthe receiver processing of CC-OFDM-MIMO radar, which is\ndifferent from those in other types of OFDM MIMO radars or', '[24] W. Zhang, Y. Huang, J. Heredia-Juesas, and J. A. Martinez-Lorenzo,\n‘‘Software-defined millimeter-wave multistatic radar with space-time-\ncoded orthogonal frequency-division multiplexing,’’ IEEE Trans.\nMicrow. Theory Techn., vol. 70, no. 3, pp. 1620–1629, Mar. 2022, doi:\n10.1109/TMTT.2021.3134182.\n[25] X.-G. Xia, T. Zhang, and L. Kong, ‘‘MIMO OFDM radar IRCI\nfree range reconstruction with sufficient cyclic prefix,’’ IEEE Trans.\nAerosp. Electron. Syst., vol. 51, no. 3, pp. 2276–2293, Jul. 2015, doi:', 'target is obtained by exploiting the high-rate samples\nof the received echoes that shows phase shifts due to\nDoppler. The high sampling rate allows detection of\nmoving targets, and by applying coherence processing\nover one symbol, over the whole duration of the\northogonal symbol series and even over the duration\nof N repetition of the symbol series a higher Doppler\nfr\nresolution can be obtained. This means that there is\nflexibility in the CC-OFDM waveform design, where']","The flexibility in the CC-OFDM waveform design allows for optimization of radar specifications such as range and Doppler resolution through advanced receiver processing techniques (Kuswidiastuti et al., 2025).","and radial velocity detection of targets is not discussed yet. The contribution of this paper is in the receiver processing of CC-OFDM-MIMO radar, which is different from those in other types of OFDM MIMO radars or other multi-TRM radars due to the nature of the orthogonal multi-beam generation with Golay-coded OFDM waveforms and subbands. There are previous research on radar waveform for ISAC purposes , which discussed about cyclic prefix (CP) based OFDM waveform and how the CP is very much defining the maximum unambiguous range of the radar system. CC-OFDM MIMO radar waveform design which is discussed in this paper is not a CP based radar, the transmitters are transmitting multiple orthogonal symbols in series without any guard time",0.0,0.9152132888764744
"our knowledge, there is no publicly available NER dataset for drone forensic problems yet. We identify and propose six entity types as the tagset in the annotation process. The proposed model achieves a competitive score compared to the state-of-the-art methods, with a 91.146% F1 score. Yet, one of the scenarios achieves high perfor- mance, with a 91.348% F1 score. 2) This work showcases how to utilize speciﬁc evidence data to perform forensic information extraction to assist a forensic investigation, including a simple framework for data extraction and annotation. 3) We propose and investigate cosine similarity as a sub- stitutive of dot-product in the self-attention sub-layer of the Transformer encoder to model contextual depen- dency in a sequence. We also propose","['of 98.63% and 95.9%, respectively.\nFurthermore, Silalahi et al. [6] developed the Transformer\nusing cosine similiarity to discover and extract some incident-\nrelated information. Cosine similiarity is used to substitute dot-\nproduct in the self-attention mechanism of the Transformer\nencoder layer. The datasets that were used are drone logs from\nthe DJI Phantom. The purposeful method has an F1 score\n91.35% compared with another Transformer model.\nOther research proposed a method in forensic event re-']","Silalahi et al. developed a Transformer model that utilizes cosine similarity in place of dot-product within the self-attention mechanism to extract incident-related information, achieving an F1 score of 91.35% (Silalahi et al.).","perform information extraction from drone flight log data. The result of the research is that BERT and DistilBERT have F1 scores of 98.63% and 95.9%, respectively. Furthermore, Silalahi et al. developed the Transformer using cosine similiarity to discover and extract some incident- related information. Cosine similiarity is used to substitute dot- product in the self-attention mechanism of the Transformer encoder layer. The datasets that were used are drone logs from the DJI Phantom. The purposeful method has an F1 score 91.35% compared with another Transformer model. Other research proposed a method in forensic event re- construction using directed graphs to identify and reconstruct events in a drone or its control station device . The study allows the investigator to find",0.6,0.8993617502009716
". According to those case studies, the drone’s controller devices stored valuable data that can be compared to the other artifacts enabling a correlation study between the UAV and the mobile application used to control the drone. Some studies also suggest a technical procedure for drone forensic inquiry. In order to perform an end-to-end analysis from the preparation to the reporting of the ﬁndings, ten procedures proposed by Salamh et al. must be followed. Analyzing the encrypted ﬁles is one of the obstacles in the data collection phase. For the DJI models, encrypted evidentiary data is a certainty. However, sometimes we have no access to the DJI proprietary tools. Therefore, the data must be decrypted without using DJI’s proprietary tool,","['challenges for drone digital forensics investigations,’’ Array, vol. 14,\nJul. 2022, Art. no. 100135.\n[5] H. Studiawan, G. Grispos, and K.-K.-R. Choo, ‘‘Unmanned aerial vehicle\n(UAV)forensics:Thegood,thebad,andtheunaddressed,’’Comput.Secur.,\nvol. 132, Sep. 2023, Art. no. 103340.\n[6] S. Silalahi, T. Ahmad, and H. Studiawan, ‘‘Transformer-based sentiment\nanalysis for anomaly detection on drone forensic timeline,’’ in Proc. 11th\nInt. Symp. Digit. Forensics Secur. (ISDFS), May 2023, pp. 1–6.', 'Furthermore, Jain et al. [10] proposed a framework for\nsensor data identification and verification. An analysis of a\ndrone’s architecture and a forensic model with generic features\nare proposed here in order to enhance the digital investigation\nprocess. Also, Barton et al. [11] conducted the research to\nreconstruct the actions taken by these drones, identify their\nowners or operators, and extract data from associated mobile\ndevices.\nIn other research in drone forensics, this paper also analyze', 'challenges encountered during the study are disclosed, along\nwith limitations and threats to validity. As drone forensics\nis an emerging topic, there are very limited public datasets\navailable. The log messages used in this study are mainly\nacquired from DJI-made devices. There is yet to come\na publicly available dataset of log messages from other\ndrone manufacturers. Several publicly available datasets are\n64264\nSilalahi et al.: Severity-Oriented Multiclass Drone Flight Logs Anomaly Detection', 'Systems (ISRITI), pp. 41–45, 2021.\nH. Studiawan, T. Ahmad, B. J. Santoso, A. M. Shiddiqi, and B. A.\nPratomo, “Dronetimeline: Forensic timeline analysis for drones,” Soft-\nwareX, vol. 20, p. 101255, 2022.\nA. Al-Dhaqm, R. A. Ikuesan, V. R. Kebande, S. Razak, and F. M.\nGhabban, “Research challenges and opportunities in drone forensics\nmodels,” Electronics, vol. 10, p. 1519, June 2021.\nU. Jain, M. Rogers, and E. T. Matson, “Drone forensic framework:']","Barton et al. conducted research to reconstruct the actions of drones and extract data from associated mobile devices, which is crucial for drone forensic inquiries (Barton et al., 2022).","the performance of the proposed framework has been discussed and analysed. In this section, challenges encountered during the study are disclosed, along with limitations and threats to validity. As drone forensics is an emerging topic, there are very limited public datasets available. The log messages used in this study are mainly acquired from DJI-made devices. There is yet to come a publicly available dataset of log messages from other drone manufacturers. Several publicly available datasets are mainly about sensor data and multimedia artefacts . While in this study, we solely depend on the human-readable messages generated by the drone during a flight. Given the condition where a small number of unique messages and most of them are acquired from DJI",0.5,0.9538269157569321
"concept of concatenating the word’s vector representation with the Bidirectional Long Short-Term Memory (LSTM) layer output. The Conditional Random Field (CRF) layer is 3260 VOLUME 11, 2023 S. Silalahi et al.: Transformer-Based NER on Drone Flight Logs to Support Forensic Investigation used to decode the concatenated output since it can determine how the sequence labels relate to one another. Most of the work involved in implementing deep learning models is predominantly spent on ﬁguring out how to prepare adequate input representations. Most often, word embedding techniques like GloVe , Word2vec , BERT , and ELMo are used to learn the input representation. Pre- trained language models, such as BERT and ELMo, can generate contextualized representational vectors after going through a",['nan'],,"Long Short-Term Memory (LSTM) , is a variation of Recurrent Neural Networks (RNN) that has been successfully applied to various Natural Language Processing (NLP) tasks. LSTM has the ability to capture long-range dependencies with sequences making it suitable for solving sequence labeling problems , , , such as Named Entity Recognition tagging (POS-Tag) and Neural (NER), Part-of-Speech combining (NMT). Study Machine Translation Bidirectional LSTM (BiLSTM) model with Conditional Random Field (CRF) to solve NER and POS-Tag Task. BiLSTM encodes word or character vectors into features, while CRF is a classifier to predict the target labels. Previous research has explored enhancing the feature extractor by integrating serves attention mechanisms with existing models or introducing alternative extractors such as Convolutional Neural Networks",,0.0
"I. INTRODUCTION I. INTRODUCTION The use of drones has become increasingly common in various applications, including aerial photography, surveying, and monitoring. However, drones can also be involved in incidents such as accidents, violations, or even crimes, making it necessary to investigate drone logs as part of forensic investigations. In a forensic investigation, drone logs are essential sources of information that can help investigators reconstruct the events leading up to an incident. Drone logs typically include information such as flight paths, altitude, speed, battery life, sensor data, and other telemetry information . Important analysis of drone logs involves the identification of the most critical pieces of information in the log data and the analysis of how they relate to the incident","['and activities that happen during a flight and stores the\nrecorded events in log files. These files contain not only\nempirical processes but also record the sensor data for every\ncertain time period, making the drone forensic-ready in case\nencounters an accident or incident. Assuming that the log data\nare admissible, a forensic investigation can be conducted to\nunderstand the incident scenario and uncover the root cause.\nTo do so, several artefacts such as flight logs, images, videos,', 'an anomaly, an investigator can adjust the analysis objectives\ntargeting a certain level only, depending on the needs and\ncases.\nAs shown in Fig. 1, the drone experiences several events\nduring a flight. When analysing the flight logs from a\nforensic perspective, distinguishing the severity levels can\nhelp the investigator pinpoint critical anomalies to less severe\nVOLUME 12, 2024\nFIGURE 1. An illustration of a flight scenario where several anomalous\nevents with different severity levels happen.', 'In order to fill the research gap, this work investigates the use\nVOLUME 11, 2023\nInvestigation\nof information extraction techniques to obtain insight from\nunstructured evidentiary data. The retrieved information is\nexpected can assist the forensic investigator in pinpointing\nthe critical information related to an incident in the flight logs\nfaster.\nA. DATA PREPROCESSING\nDrone flight log data contains a number of columns with\nnumerous information regarding the drone’s condition and', 'challenges encountered during the study are disclosed, along\nwith limitations and threats to validity. As drone forensics\nis an emerging topic, there are very limited public datasets\navailable. The log messages used in this study are mainly\nacquired from DJI-made devices. There is yet to come\na publicly available dataset of log messages from other\ndrone manufacturers. Several publicly available datasets are\n64264\nSilalahi et al.: Severity-Oriented Multiclass Drone Flight Logs Anomaly Detection', 'explored in the drone forensics space compared to other types\nof evidence. In this case, we identify three reasons as to why\nthey may be used:\n105362\nInterpretable Ordinal-Aware With Contrastive-Enhanced Anomaly Severity Detection\n1) Human-readable log messages can be found in the\nflight log, which is highly relevant to various incident\ncases, as shown in Fig 3. Not only is it highly relevant,\nbut it is also highly prioritised evidence in diverse\ninvestigation cases.']",Drone flight logs contain empirical processes and sensor data that make them essential for forensic investigations in the event of accidents or incidents (Interpretable Ordinal-Aware With Contrastive-Enhanced Anomaly Severity Detection on UAV Flight Log Messages).,"highly relevant to various incident cases, as shown in Fig 3. Not only is it highly relevant, but it is also highly prioritised evidence in diverse investigation cases. 2) Flight log messages cover events from the drone’s sensors, features, and components, making it one piece of evidence to perform analysis related to different drone software and hardware components. Therefore, analysing the log messages means analysing the whole device for various possible incident scenarios. 3) Flight log messages contain contextual information about the occurring event as a description that involves multiple parts of the drone simultaneously. For example, a certain circumstance fails a feature or an operation, as shown in message group number 4 in Table 1. TABLE 1. Groups of",0.8,0.9578110785457044
"perform information extraction from drone flight log data. The result of the research is that BERT and DistilBERT have F1 scores of 98.63% and 95.9%, respectively. Furthermore, Silalahi et al. developed the Transformer using cosine similiarity to discover and extract some incident- related information. Cosine similiarity is used to substitute dot- product in the self-attention mechanism of the Transformer encoder layer. The datasets that were used are drone logs from the DJI Phantom. The purposeful method has an F1 score 91.35% compared with another Transformer model. Other research proposed a method in forensic event re- construction using directed graphs to identify and reconstruct events in a drone or its control station device . The study allows the investigator to find","['to find all the locations of flight log data in all directories\nof every drone image we have downloaded and extracted.\nUnfortunately, we did not find the expected data from Yuneec\n4https://www.autopsy.com/\n5https://www.phantomhelp.com/LogViewer/upload/\nVOLUME 11, 2023\nS. Silalahi et al.: Transformer-Based NER on Drone Flight Logs to Support Forensic\nFIGURE 7. Difference between IOB2 and BIOES annotation scheme for the\nprocedure.\nTABLE 1. Number of extracted messages from every drone model.', 'In order to fill the research gap, this work investigates the use\nVOLUME 11, 2023\nInvestigation\nof information extraction techniques to obtain insight from\nunstructured evidentiary data. The retrieved information is\nexpected can assist the forensic investigator in pinpointing\nthe critical information related to an incident in the flight logs\nfaster.\nA. DATA PREPROCESSING\nDrone flight log data contains a number of columns with\nnumerous information regarding the drone’s condition and', 'The existing studies show that most drone forensic research\nis based on case studies, tool development, and tool testing\nand evaluation. There are presently few studies performing\nanalytics against certain drone data artifacts, specifically log\nmessage data. Inspired by the success of Transformer-based\nNER model implementation in various domains, including\ncybersecurity, this paper intends to take advantage of NER in\nrecognizing mentioned entities in drone flight log messages.', 'such as telemetry, dataflash, and flight log data. Therefore,\nmessage data to discover and extract some incident-related\ntechnique, i.e., named entity recognition using the Transformer.\nfor dot-product in the self-attention mechanism of the\nNER architecture built from a mix of several existing\nWe extract the DJI drone forensic image from a publicly\nHelp and collect the decrypted log messages. Six entity\nmessage. These entity types are used in the manual annotation', 'paper is as follows. Section II reviews the recent related\nworks on drone forensic research, deep learning for named\nentity recognition, and the use of named entity recogni-\ntion in cybersecurity. The proposed method is elucidated in\nSection III. Section IV explains the experimental results and\nanalysis. We conclude the paper in Section V with several\nfuture directions.\nII. RELATED WORKS\nThe advancement of the Unmanned Aerial Vehicle (UAV),\ncommonly called a drone, followed by a constantly increasing']","Silalahi et al. developed a Transformer-based method for named entity recognition on drone flight logs, achieving an F1 score of 91.35% in their analysis (Silalahi et al., 2023).","availability of a public dataset is one of the considerations for this research to be veriﬁable and reproducible. V. CONCLUSION AND FUTURE WORKS V. CONCLUSION AND FUTURE WORKS In this research, we have experimented with the employ- ment of cosine similarity as a substitute for dot-product self-attention in the encoder sub-layer of Transformer archi- tecture. To evaluate our proposed approach, we construct our own NER dataset by manually extracting several drone forensic image datasets that are publicly available from the VTO Labs. For a relatively small dataset, we obtain a good result indicated by the F1 score of 91.348% achieved by the dot-product attention supported by CNN character embed- ding and BERT word embedding. Our proposed approach outperforms the RNN-based",0.6666666666666666,0.9266461530633627
"devices at the ground station are merged into a drone super timeline. By using the tool, the investigator will be able to easily analyze the drone accident. B. Drone Forensics Drone forensics is a technique to get, collect, and analyze the data stored in drones to determine the cause of drone incidents. Research has been done to solve various problems arising and improve the performance. Al-Dahqm et al. proposed a forensic framework for drone. The method supports the majority of drone types on the market. The developed framework has three phases. In the preparatory phase, the investigator may analyze all components of the drone and conclude which components were used. Second is the data acquisition phase; the data from the","['Doktor untuk Sarjana Unggul (PMDSU) Scholarship from the Ministry of\nGrant 1483/PKS/ITS/2022.\nABSTRACT The increase in drone usage by the public\nup. Sophisticated preventive mechanisms, as well as\nForensic investigation is performed upon a drone incident,\nthe risk and report the examination results. Generally,\nstages, i.e., evidence acquisition, evidence analysis, and\nattempts have been made in framework proposal and\nevaluation. However, less research focuses on utilizing', 'of pre- and post-incident preparation. Pre-incident prepara-\ntion is an important step that is not yet covered in most\nforensic frameworks. This step aims to understand several\npossible indicators of compromise, define potential forensic\nevidence, and measure a drone device’s forensic readiness\nbefore a flight. The remaining phases, including post-incident\npreparation, data acquisition, and data analysis, are likely the\nsame as the other frameworks but more thorough.', 'and activities that happen during a flight and stores the\nrecorded events in log files. These files contain not only\nempirical processes but also record the sensor data for every\ncertain time period, making the drone forensic-ready in case\nencounters an accident or incident. Assuming that the log data\nare admissible, a forensic investigation can be conducted to\nunderstand the incident scenario and uncover the root cause.\nTo do so, several artefacts such as flight logs, images, videos,', 'In order to fill the research gap, this work investigates the use\nVOLUME 11, 2023\nInvestigation\nof information extraction techniques to obtain insight from\nunstructured evidentiary data. The retrieved information is\nexpected can assist the forensic investigator in pinpointing\nthe critical information related to an incident in the flight logs\nfaster.\nA. DATA PREPROCESSING\nDrone flight log data contains a number of columns with\nnumerous information regarding the drone’s condition and', 'research category, a forensic examination is performed on a\ndrone device after having a scened flight under a controlled\nenvironment. The procedure starts with the data collection\nstage and ends with the investigation report. Yousef and\nIqbal [10] proposed a series of guidelines to help forensic\ninvestigators conduct forensic investigations using the DJI\nMavic Air drone model. In order to gather the evidence and\nexplain the successfully collected data, various techniques']","The forensic investigation of drone incidents involves stages such as evidence acquisition and analysis, which are critical for understanding the incident and reporting the examination results (Yousef and Iqbal, 2023).",". According to those case studies, the drone’s controller devices stored valuable data that can be compared to the other artifacts enabling a correlation study between the UAV and the mobile application used to control the drone. Some studies also suggest a technical procedure for drone forensic inquiry. In order to perform an end-to-end analysis from the preparation to the reporting of the ﬁndings, ten procedures proposed by Salamh et al. must be followed. Analyzing the encrypted ﬁles is one of the obstacles in the data collection phase. For the DJI models, encrypted evidentiary data is a certainty. However, sometimes we have no access to the DJI proprietary tools. Therefore, the data must be decrypted without using DJI’s proprietary tool,",0.5,0.9556819948493641
"drone types on the market. The developed framework has three phases. In the preparatory phase, the investigator may analyze all components of the drone and conclude which components were used. Second is the data acquisition phase; the data from the drone component will be downloaded and stored on the computer. The last phase is the data analysis phase. In this phase, the data is analyzed using different methods to extract and draw conclusions about the causes of drone engine failure . in this phase, Furthermore, Jain et al. proposed a framework for sensor data identification and verification. An analysis of a drone’s architecture and a forensic model with generic features are proposed here in order to enhance the digital investigation","['of drones systems: Attacks, limitations, and recommendations,’’ Internet\nThings, vol. 11, Sep. 2020, Art. no. 100218.\n[3] A.Al-Dhaqm,R.A.Ikuesan,V.R.Kebande,S.Razak,andF. M. Ghabban,\n‘‘Research challenges and opportunities in drone forensics models,’’ Elec-\ntronics, vol. 10, no. 13, p. 1519, Jun. 2021.\n[4] F. Iqbal, B. Yankson, M. A. AlYammahi, N. AlMansoori, S. M. Qayed,\nB. Shah, and T. Baker, ‘‘Drone forensics: Examination and analysis,’’ Int.', 'Doktor untuk Sarjana Unggul (PMDSU) Scholarship from the Ministry of\nGrant 1483/PKS/ITS/2022.\nABSTRACT The increase in drone usage by the public\nup. Sophisticated preventive mechanisms, as well as\nForensic investigation is performed upon a drone incident,\nthe risk and report the examination results. Generally,\nstages, i.e., evidence acquisition, evidence analysis, and\nattempts have been made in framework proposal and\nevaluation. However, less research focuses on utilizing', 'challenges encountered during the study are disclosed, along\nwith limitations and threats to validity. As drone forensics\nis an emerging topic, there are very limited public datasets\navailable. The log messages used in this study are mainly\nacquired from DJI-made devices. There is yet to come\na publicly available dataset of log messages from other\ndrone manufacturers. Several publicly available datasets are\n64264\nSilalahi et al.: Severity-Oriented Multiclass Drone Flight Logs Anomaly Detection', 'challenges for drone digital forensics investigations,’’ Array, vol. 14,\nJul. 2022, Art. no. 100135.\n[5] H. Studiawan, G. Grispos, and K.-K.-R. Choo, ‘‘Unmanned aerial vehicle\n(UAV)forensics:Thegood,thebad,andtheunaddressed,’’Comput.Secur.,\nvol. 132, Sep. 2023, Art. no. 103340.\n[6] S. Silalahi, T. Ahmad, and H. Studiawan, ‘‘Transformer-based sentiment\nanalysis for anomaly detection on drone forensic timeline,’’ in Proc. 11th\nInt. Symp. Digit. Forensics Secur. (ISDFS), May 2023, pp. 1–6.', 'pp. 377–390.\n[7] D. R. Clark, C. Meffert, I. Baggili, and F. Breitinger, ‘‘DROP (DRone open\nsourceparser)yourdrone:ForensicanalysisoftheDJIphantomIII,’’Digit.\nInvest., vol. 22, pp. S3–S14, Aug. 2017.\n[8] F. E. Salamh, M. M. Mirza, and U. Karabiyik, ‘‘UAV forensic analysis and\nsoftwaretoolsassessment:DJIphantom4andmatrice210ascasestudies,’’\nElectronics, vol. 10, no. 6, p. 733, Mar. 2021.\n[9] M. Maarse, L. Sangers, J. van Ginkel, and M. Pouw, ‘‘Digital forensics']","The framework for drone forensics includes stages such as evidence acquisition and evidence analysis, highlighting the need for structured approaches in forensic investigations (Al-Dhaqm et al., 2021).","Transformer-Based NER on Drone Flight Logs to Support Forensic Investigation Accordingly, Jain et al. proposed a framework com- prising 12 phases. The ﬁrst ﬁve phases were used to locate and validate the drone’s sensors and data. The other seven steps were used to analyze physical evidence like ﬁngerprints and digital evidence from several sources, such as memory cards, ﬂight logs, and network logs. However, the proposed framework has not explained the preparation phase in detail. Therefore, another framework consisting of four investigative phases with a more comprehensive analysis is proposed by Al-Dhaqm et al. . One of the primary distinctions of this framework is a more extensive preparation phase consisting of pre- and post-incident preparation. Pre-incident prepara- tion is an",0.3333333333333333,0.9578005954311762
"organizations improve the reliability, security, and operational efficiency in managing their information technology. , Prema et al use process mining techniques to examine a regional hospital's billing procedure. This study emphasizes how crucial it is to increase the billing process' effectiveness in order to give patients higher-quality care. In this study, data from the finance module of the hospital's ERP system was explored to determine bottleneck activities in the invoice procedure. Using anonymised event logs, this study aims to find causality in the hospital's billing process and identify potential bottleneck activities. Audit with surveys is an effective method for gathering essential information to evaluate a process or system . Using carefully crafted questionnaires, auditors directly collect data from individuals or","[""bottlenecks, which is one of the primary objectives of this\nanalysis. By pinpointing bottlenecks, the team can target and\naddress the area’s most affecting workflow, thereby enabling\nsignificant operational improvements. The analysis also aims\nto evaluate the overall effectiveness of the hospital's billing\npractices. Insights gained from this analysis can help optimize\nprocesses to enhance overall operational performance.\nIV. RESULTS\nA. Process Discovery Results\n1) Overall Case"", 'actual billing process patterns are explored and modeled based\non the available data. The final stage is performance analysis,\nwhere the effectiveness and efficiency of the billing processes\nare reviewed to identify potential areas for improvement.\nOverall, these stages are crucial to ensure that the billing\npractices at the hospital are conducted efficiently and\ntransparently.\nA. Dataset\nThe ""Hospital Billing"" event log was obtained from the\nfinancial module of the ERP system used by a regional', '4202©\nhospital billing system to demonstrate how process mining can\nidentify bottlenecks in processes in the system for providing\n00.13$/42/3-1615-3053-8-979 insight for process improvement. Our findings highlight\nsignificant bottlenecks within five key connection processes and\nidentify specific activities that impede the optimal flow of\noperations. These discoveries are aligned with the DSS01\nobjective of COBIT 2019, which aims to enhance the\nmanagement of IT delivery and support services.', ""process mining techniques to automatically evaluate the\nDSS01 objective of the COBIT 2019 framework within\nhospital billing system. This approach leverages event log\ndata to analyze and optimize operational processes in real-\ntime, focusing specifically on the effectiveness of IT delivery\nand support services. Our method successfully identified\nsignificant inefficiencies within the hospital's billing system,\npinpointing several critical bottlenecks that can be targeted\nfor process improvements."", ""involved in managing and analyzing the event log dataset\nwithin the hospital billing system. These steps are designed to\noptimize data collection, processing, and evaluation of the\nbilling processes. The process begins with the collection of\nraw data from the event logs gathered by the hospital's\nEnterprise Resource Planning (ERP) system. Following this,\nthe preprocessing stage involves cleaning and preparing the\ndata for further analysis. During the process discovery phase,""]","The study successfully identified significant inefficiencies and critical bottlenecks within the hospital's billing system, which can be targeted for process improvements (Process Mining for Evaluating Hospital Billing System Based on DSS01 Domain COBIT 2019 Framework).","stage is performance analysis, where the effectiveness and efficiency of the billing processes are reviewed to identify potential areas for improvement. Overall, these stages are crucial to ensure that the billing practices at the hospital are conducted efficiently and transparently. A. Dataset The ""Hospital Billing"" event log was obtained from the financial module of the ERP system used by a regional hospital , This log records various incidents related to the billing of medical services provided by the hospital. Over a three-year period, from 2013 to 2016, a random sample of 100,000 traces was collected, each representing a recorded example of the process in the system. Within this event log, there are 18 different activities, each depicting distinct stages in",0.75,0.9357941988688213
"baked goods’ quality can be determined by the gas or vapor content. Gas chromatography is the standard instrument for quantitatively and qualitatively analyzing volatile organic compounds (VOCs). This method separates compounds in a mixture by injecting a gas sample into the mobile phase, usually called the carrier gas, and passing the gas through the stationary phase , , . Volatile compounds identified in aldehydes, alcohols, acids, alkanes, and ketones are the main components that contribute VOLUME 12, 2024 2024 The Authors. This work is licensed under a Creative Commons Attribution-NonCommercial-NoDerivatives 4.0 License. For more information, see 97235 TABLE 1. The ingredients of the cookie. to the cookie flavor . Chemical compounds grouped as hydrocarbons are also released while making and","['gories of food analysis that can be used: monitoring, expiry\nchecking, freshness evaluation, purity testing, and other food\nquality control investigations. Hence, the motivation for this\nstudy can be formulated as follows:\n1. Several types of research have used an e-nose to iden-\ntify pork adulteration in beef for food quality control.\nHowever, most of them were focused on the differen-\ntiation and classification of species of meat. Only a\nfew researchers have tried to determine different gas', 'Downloaded on July 14,2025 at 08:22:06 UTC from IEEE Xplore. Restrictions apply.\nTABLE I. ORGANOLEPTIC SCORE FOR AROMA\nGambung Tea Research Center\nSNI 3945-2016\nRepresentation\nA = normal typical green tea;\nB = normal typical green tea;\n1 5\nC = normal typical green tea; Quality Defect 2.8\nGood Quality\nD = less typical green tea;\nE = abnormal.\nThe volatile compounds were determined through\ncomparison of the acquired mass spectra with established\nstandards from the NIST Mass Spectral library and by the', 'IV. RESULT AND ANALYSIS\nThe process of obtaining data starts from an organoleptic\ntesting approach, and then representatives of the two\ncategories are studied using GCMS to define VOCs so that the\nmost relevant sensors can be determined.\nA. Organoleptic Score\nThe organoleptic tests carried out in this test include dried\nappearance, steeped color, taste, aroma, and steeped dregs.\nOut of the 78 chops that were accessible, 51 chops exhibited\ngood quality, whereas 27 chops had quality defects.', '0.1%, 0.5%, 1%, 5%, 10%, 50%, and 100%. This research\ntook less than 2 hours to process. Various scientific methods\nhave been developed to identify mixed meats, including gas\nchromatography (GC) and mass spectrometry (MS) [12],\nhigh-performance liquid chromatography (HPLC), nuclear\nmagnetic resonance (NMR) spectroscopy [13], and Fourier\ntransform infrared (FTIR) spectroscopy [14]. However, sev-\neral things have to be considered when using these tools, such', 'mass spectrometry[10]. Researchers find this method highly\nbeneficial in establishing a reliable ground truth, enabling the\nprecise identification of volatile organic compounds.\nVarious evaluation standards for green tea, such as\nISO11287-2011 defining the essential requirements of green\ntea; (GB/T 23776-2018) outlining the sensory evaluation\nmethodology for tea in the Chinese national guideline; and the\nIndonesian national regulation (SNI3945:2016) concerning']","Gas chromatography (GC) is one of the scientific methods developed for identifying mixed meats, highlighting its role in food quality analysis (Reference 4).","whereas 27 chops had quality defects. B. Volatile Organic Compounds Identification Through Chromatography-Mass Spectrometry (GC-MS), it was found that there were 143 VOCs in the good-quality sample and 118 VOCs in the quality-defect sample. Then it also obtained that there were 102 similar compounds present Fig. 4. Number of Compounds in Each Classes Fig. 5. Percentage of Area of Compounds in Each Classes in both sample 1 and sample 2, which are detailed in TABLE II. The results of grouping chemical substances into several groups, including nitrogenous compounds, alcohols, esters, hydrocarbons, hetero- oxygenates, and others. Substance content in each class of compounds means that different concentrations are shown as Area as shown in TABLE II. aldehydes, phenols, ketones, In GC-MS,",0.6666666666666666,0.9156944838158784
"measured the ratio of correct recognition results to the entire dataset. Accuracy = TP + TN TP + FN + TN + FP (11) 2) Precision (12) estimated how many of the positive pre- dictions were correct. Precision = TP TP + FP (12) 3) Recall can also be called Sensitivity (13) calculated how many positive cases the classifier correctly pre- dicted over all the positive instances in the data. Recall = TP TP + FN (13) 4) F1-measure (14) assessed the predictive skill of a model by elaborating on its class-wise performance. F1 − measure = 2 × Precision × Recall Precision + Recall (14) 97240 VOLUME 12, 2024 M. Rivai, D. Aulia: Use of Electronic Nose to Identify","['III. MATERIALS AND METHODS\nIn order to construct the electronic nose equipment, an\ninitial assessment of the volatile organic compound (VOC)\nwas conducted. Following identifying the organic\ncompounds, a classification of these compounds was\nperformed, leading to the determination of the suitable gas\nsensors to be utilized. Through the utilization of the data\nobtained from the sensor readings, a predictive analysis was\nconducted to derive the model demonstrating optimal\nperformance as illustrated in Fig. 3.', 'Fig. 2. General diagram of electronic nose system\nAuthorized licensed use limited to: Institut Teknologi Sepuluh Nopember.\nExperimental Specimens and Olfactory Analysis\nGambung Green Organoleptic\nTea Samples Results\nCompounds Classification\nVolatile Compound\nHS-SPME GC-MS Identification\nData Acquiring and Predicting Analysis\nELECTRONIC Sensor Array\nNOSE Determination\nPre-Processing Predicting Model\nData Analytics Performance\nModel\nValidation\nFig. 3. Research Methods\nIII. MATERIALS AND METHODS', 'For interested readers, recent development and challenges for\ne-nose signal processing are summarized here [42].\nIII. MATERIALS AND METHOD\nA. MATERIALS\nIn this study, an e-nose was built using nine MQ series\ngas sensors from Zhengzhou Winsen Electronics Technology\nCo., Ltd. The gas sensors were also used to detect different\ntypes of gases, as in our previous study [19]. The list of gas\nsensors is given in TABLE 2. These gas sensors were assem-\nbled to an Arduino microcontroller. For data communication,', 'a faster analysis process with reliable results. This paper\nproposes the Optimized Electronic Nose System (OENS).\nAn electronic nose (e-nose) is the main instrument in OENS.\nE-noses are devices with several advantages over other tech-\nniques for analyzing food smell, for example, the small\namount of sample required, fast performance, simple usage,\nhigh sensitivity, and good correlation between the data from\nsensor analysis. The e-nose features offer five main cate-', 'processes are divided into testing data (30%) and training data\n(70%) to be evaluated by the classification model. The data\nacquired from the e-nose are processed using a computer with\nscikit-learn by Python-based machine-learning software [45].\n1) SIGNAL PRE-PROCESSING\nSignal pre-processing is carried out to eliminate noise in\nthe signals [46]. In this research, the noise was caused by\nthe internal sensors, changes in ambient conditions such as\nhumidity and temperature, and changes in electrical condi-']",,"with the following formula: TP + TN TP + TN + FP + FN Accuracy = Precision = Recall/True Positive Rate(TPR) TP TP + FP TP TP + FN F1 = 2 × precision × recall precision + recall FP TN + TP (cid:90) 1 TPRd(FPR) False Positive Rate(FPR) = AUC = (4) (5) (6) (7) (8) (9) where TP is the number of correctly predicted positive labels, TN is the number of correctly predicted negative labels, FP is the number of incorrectly predicted positive labels, and FN is the number of incorrectly predicted negative labels. Accuracy is the ratio of true predictions to the overall data. Precision is the ratio between TP to the total number of positive predic-",,0.0
"presented a novel multi-head attention mechanism that uses various atten- tion functions to capture diverse contextual elements. The multi-head attention approach allows attention to be simul- taneously allocated to information from different subspaces and representational positions. In contrast to soft attention, which focuses attention softly on the entire input to produce a context representation with weights determined based on the relevance of each part of the input, soft attention relies on only one attention mechanism. Kumar et al. developed the multi-head attention- based BiLSTM (MHA-BiLSTM) model. The results are quite promising compared to the use of single-head attention. How- ever, using the BiLSTM model is computationally expensive, especially when dealing with large datasets . BiLSTM is also prone to overfitting,","['requires additional methods to capture sequence information.\nBiLSTM can accommodate sequence information, which\nis then used by multi-head attention to learn information\nfrom various dimensions and subspace representations,\nfully capturing long-distance text features. Consequently,\nthe combination of BiLSTM and multi-head attention\ncomplements each other. Enhances the model’s ability to\nanalyze contextually important information compared with\ndifferent attention mechanisms, which tend to have similar', 'and Hypothesis sentences, processed through BiLSTM and\nmulti-attention mechanisms. This method allows for a more\nVOLUME 13, 2025\nFIGURE 1. The proposed architecture utilizes BiLSTM and multi-head\nattention (Indo-BiEnt).\nnuanced understanding and alignment of syntactic and\nsemantic elements, thus improving RTE performance.\nIII. METHOD\nA. PROPOSED MODEL RTE\nThe neural network architecture model employed in this study\nis built upon an interaction-based framework [9], utilizing', 'attention mechanism to model sentence pairs and adopted\nBiLSTM, namely ESIM [27]. These models were tested using\nthe SNLI Indo dataset according to the settings described\nin the previous subsection. We also conducted an ablation\nanalysis to measure the impact of multi-head attention on the\nproposed model.\nTo provide a stronger benchmark. We used transformer-\nbased methods to demonstrate performance both in terms\nof accuracy and processing time, compared to our proposed', 'sentences during training. If these elements are not detected,\nthe model relies only on lexical values when detecting labels,\nas with whole sentence input.\nFigure 8 displays the confusion matrix for the proposed\nBiLSTM and multi-head attention model using whole\nsentence input, showing a lower classification percentage for\nthe neutral relationship label than other labels. In contrast, the\nconfusion matrix for the proposed model using Biplet (h-d),\nas shown in Figure 6, demonstrates higher performance for', 'syntactic trees that capture relationships between words,\nBiplets allow us to extract these relationships in a simplified\nVOLUME 13, 2025\nI. M. S. Putra et al.: RTE in Indonesian Using Individual Biplet Head-Dependent\nFIGURE 7. Heat map of multi-head attention with BiLSTM for\nillustration produced by the model with input without Biplets;\n(h-d) input.\nand linearized form. This reduces the complexity of the\nsyntactic analysis and can be more easily processed by']",The combination of BiLSTM and multi-head attention effectively captures long-distance text features by accommodating sequence information and learning from various dimensions and subspace representations (Putra et al.).,"Based on the results presented in Table 3, the multi-head attention module positively impacts the model’s performance. When multi-head attention in our proposed model is replaced with self-attention, the testing accuracy drops from 79% to 71%. Furthermore, if we remove the attention component in the aggregation layer and only use soft alignment attention in the matching layer, the testing accuracy is 72%. In the last experiment, we used only BiLSTM for inference composition, which resulted in a test accuracy of 71%. These results provide evidence that the absence of the multi-head attention module can decrease the model’s performance. While multi-head attention is effective in capturing long-range dependencies and global contextual information, it tends to be less adept at modeling sequential",0.75,0.9388851924161676
"rate (FPR) across various clas- sification thresholds. The horizontal axis of an ROC graph represents the FPR, which indicates the proportion of neg- ative instances misclassified as positive. In contrast, the vertical axis represents the TPR, which measures the model’s effectiveness in correctly classifying positive instances. The ROC curves demonstrated that the MHA-CovBi model dis- played exceptional efficacy, achieving an area under the curve (AUC) value of 0.96 for the DS1 dataset and 0.94 for the DS2 dataset, which are both significantly high values that are close to the perfect value of 1.0 and well above the value of 0.5 which indicates random performance. These values indicate that the MHA-CovBi model shows a high discriminatory ability in differentiating between positive","['recall, and F1. Note that the weighted average is used to\ncompute the average score of precision, recall, F1, and\nprediction confidence. We investigate the confusion matrix,\nlearned representation, and the interpretability of the model’s\nprediction to increase understanding of the model. Captum,\na tool developed by [57] version 0.7.0 is used for model’s\ninterpretability analysis.\na\nV. EVALUATION AND DISCUSSION\nA. PERFORMANCE EVALUATION\nAfter conducting an extensive experiment on a vast amount', ""metrics can be calculated by (1) – (3). This study's\ncalculation of True Positive, False Positive, and False\nNegative differs from other classifications or detections\n[20]-[23]. These are chosen and calculated following\nprevious studies [1]. Precision detects the truly correct\nprediction out of all predictions. Recall detects the truly\ncorrect prediction out of all actual classes. F1 scores are\nharmonic mean between these two that measure overall\nmodel performance. These metrics are produced by"", 'TABLE 6. Performance comparison with several baselines from previous works.\nFIGURE 12. Analysis of the effect of increasing the prediction threshold\non the evaluation scores of the best-performing models.\nTABLE 7. Custom confusion matrix for error analysis.\nE. ERROR ANALYSIS\nIn the previous section, the performance evaluation has been\ndiscussed thoroughly from a quantitative perspective. Here,\nwe investigate the samples from the test set that are predicted', 'the system by providing performance variables, including\naccuracy, precision, recall, and F1-measure, based on several\nindicators, such as true positive (TP), false positive (FP), true\nnegative (TN), and false negative (FN) [50]. The performance\nvariables were as follows:\n1) Accuracy (11) measured the ratio of correct recognition\nresults to the entire dataset.\nTP + TN\nAccuracy = (11)\nTP + FN + TN + FP\n2) Precision (12) estimated how many of the positive pre-\ndictions were correct.\nTP\nPrecision = (12)', 'in the model, an ablation study is performed on several\naspects. To provide an in-depth analysis from a domain-\nspecific perspective, error analyses are also conducted by\ninvestigating the the misclassification cases. Finally, the\nlearned representation of the dataset is examined to check if\nthe model successfully learns a decent representation during\nthe training.\nV. PERFORMANCE EVALUATION AND DISCUSSION\nFollowing the procedure and details in the previous section,']","The performance evaluation of the MHA-CovBi model, which achieved an area under the curve (AUC) value of 0.96 and 0.94 for the DS1 and DS2 datasets respectively, aligns with the performance metrics discussed in the severity-oriented multiclass anomaly detection study, which includes comparisons with several baselines.","the ROC curve, we could see the ability of the model to separate true positive and true negative cases. In ROC, True Positive Rate (TPR) was compared to False Positive Rate (FPR). The proposed stacked DNN model had the best performance compared to the DNN base-models and produced an AUC score of 0.981. Tested DNN models produced lower AUC than the proposed stacked DNN as shown in Fig. 9. Based on the confusion matrix in Table 8, tested DNN models had a higher number of FN than stacked DNN. Hav- ing a small number of FN was signiﬁcant because incorrectly identifying the positive class (sick) to negative class (healthy) can cause the patient not to obtain the proper treatment and",0.0,0.9075435433887103
"pre-cancers , gastric cancer lesions , and cervical squamous intraepithelial lesions . The choice between one-stage and two-stage object detec- tion models depends heavily on the specific demands of the task, particularly in medical imaging contexts such as colorectal cancer (CRC), squamous cell carcinoma (SCC), gastric lesions, and polypoid lesions. One-stage detectors, such as YOLO and SSD, excel in speed and computational efficiency, making them ideal for real-time applications. For instance, YOLOv5 demonstrated remarkable performance in CRC detection with nearly perfect metrics—precision (99.071%), recall (98.064%), and mAP (98.8%)—allowing clinicians to analyze colonoscopy videos efficiently during live procedures . SSD also performed well in CRC detection, achieving precision (90.42%) and recall (91.32%), though its mAP (87.5%) was slightly lower than YOLO-","['detect PC using a dataset of 4,197 laparoscopy images.\n|\n)EEVCI(\nYOLOv8 was chosen for its capability in fast and accurate\nobject detection. The model training process involves using\npretrained weights for fine-tuning to enhance detection\ngnireenignE\nperformance. Model hyperparameters were optimized, and\ndata augmentation was applied to improve model\ngeneralization. Experimental results show that the YOLOv8m\nmodel performs the best, with a mean Average Precision\nlacirtcelE', 'manufacture [11], and also in the medical field [12].\nYOLO has great potential to improve detection accuracy\nand reduce the time required for image analysis. Pretrained\nfine-tuning allows for the utilization of weights from models\ntrained on large datasets, which are then adapted to specific\ndatasets for particular tasks [13], in this case, PC detection.\nTherefore, the aim of this study is to develop and evaluate a\nPeritoneal Carcinomatosis (PC) detection model using', 'datasets, can be used to obtain pretrained weights that can be\nfine-tuned into our dataset.\nV. CONCLUSION\nThis research demonstrates that the YOLOv8 model,\nspecifically the YOLOv8m variant, provides excellent results\nin detecting Peritoneal Carcinomatosis (PC) from the used\nlaparoscopic image dataset. By utilizing and fine-tuning the\npre-trained YOLOv8 weights, this model shows superior\nperformance with a mean Average Precision (mAP50) of\n0.871, precision of 0.893, recall of 0.785, and an F1 score of', '• We trained the model using pretrained weights\nobtained from training on a larger dataset, COCO.\nBy using these pretrained weights, we could leverage\nfeature representations learned from a rich and\ndiverse dataset, thereby speeding up convergence\nand improving detection accuracy on our dataset.\nNext, we fine-tuned this model on our research\ndataset consisting of laparoscopic images to adapt\nthe model to the specific characteristics of peritoneal\ncarcinomatosis. This fine-tuning process ensures that']",The YOLO model has significant potential to enhance detection accuracy and minimize the time needed for image analysis in medical contexts (Leveraging Fine-Tuned YOLOv8 with Transfer Learning for Peritoneal Carcinomatosis Detection).,"improved speed, accuracy, and effi- ciency . Among these, the YOLO (You Only Look Once) algorithms are frequently preferred due to their bal- ance between accuracy and speed, making them particularly VOLUME 13, 2025 23619 A. D. Sanjaya et al.: RNA-BioLens: A Novel Raspberry Pi-Based Digital Microscope With Image Processing suitable for applications like medical image analysis, where rapid and accurate detection is essential. For example, Fatichah et al. evaluated the performance of three popu- lar detection methods: You Only Look Once v4 (YOLOv4), You Only Look Once v5 (YOLOv5), and Mask Region-based Convolutional Neural Network (Mask R-CNN) in classifying ALL types. Their findings showed that YOLOv4 achieved the highest mean Average Precision (mAP) at 93.2%, followed by YOLOv5 at",0.6666666666666666,0.83002937928223
"represents a significant challenge in devel- oping deep learning-based lesion detection models. Various forms of bias, including category imbalance, biases stem- ming from dataset sources, inconsistencies in annotation 1) CATEGORY IMBALANCE IN DATASETS Category imbalance is a recurring issue that can affect a model’s ability to accurately detect minority classes. For instance, the SSPH_WL dataset in highlights an uneven distribution, where adenomas (1048) are significantly more prevalent compared to polyps (381) and cancers (280). This VOLUME 13, 2025 43547 N. Rochmawati et al.: Deep Learning-Based Lesion Detection in Endoscopy: A Systematic Literature Review study mitigated the imbalance by employing LSDA-Loss, which prioritizes minority categories using prior probabili- ties, demonstrating an effective strategy for addressing this challenge. Similarly, the KID dataset",['nan'],,"while false positives were observed for normal cases with overlapping features or imaging artifacts. These errors are likely due to the imbalanced dataset, which predominantly consists of normal or frequently occurring abnormalities, limiting the model's ability to generalize to less common cases. To evaluate the model’s ability to detect rare abnormalities, we analyzed performance on a subset of low- frequency labels as shown in Table V. Results indicate that while overall precision remains high, recall for these classes is lower (e.g., 0.62 for Cardiomegaly vs. 0.81 average), confirming the effect of class imbalance. Incorporating targeted sampling or multi-label loss re-weighting could help address this in future work. TABLE V PERFORMANCE ON RARE ABNORMALITIES Abnormality Cardiomegaly Pneumothorax Pulmonary Edema Aortic Enlargement",0.0,0.0
"a ratio of 70-15-15, this study aims to compare respectively. The splitting process was carefully conducted to ensure a balanced class distribution and to avoid any selective tendencies in each data subset. This balanced distribution helps prevent biases in the model's training process and ensures that it learns effectively from all classes of data. The object detection model was trained using the training data, tested using the testing data, and validated using the validation data. The size of the dataset and the split sizes for each dataset are presented in Table I. This research focuses on leveraging the latest YOLO (You Only Look Once) object detection model, specifically YOLOv8, renowned for its exceptional speed and accuracy. The choice of YOLOv8","['YOLOX [55], and YOLOv9 [32]. To train the object detection\nmodel, this experiment used 36 epochs, 8 batch size, and\nvideo frame resized to 640*640. Other hyperparameters,\nincluding the augmentation setups, follow default recipe from\nthe original paper. For the tracking module, this experiment\nused two tracking algorithms namely ByteTrack [17] and\nSORT [34].\nVOLUME 12, 2024\nFIGURE 7. Video scenes used for testing the proposed framework.\nSimilar to the object detection model, this tracking', 'provides a comprehensive evaluation of the object detection\nmodel. mAP considers precision and recall values across\nDownloaded on July 14,2025 at 08:18:27 UTC from IEEE Xplore. Restrictions apply.\nTABLE II.\nF1 Score F1\nBackbone\nIoU@50\nResNet50v2 0.682\nResNet101 0.630\nMobileNetV3-Large 0.736\nEfficientNetV2-S 0.805\nTABLE III. PRECISION, RECALL,\nBackbone Metrics Healthy\nPrecision 0.970\nMobileNetV3-Large Recall 0.987\nF1 Score 0.978\nPrecision 0.985\nEfficientNetV2-S Recall 0.968\nF1 Score 0.977', 'tuning on YOLO from the COCO dataset.\nIII. MATERIALS AND METHODS.\nA. YOLO\nObject detection has seen significant advancements since\nthe introduction of YOLO (You Only Look Once) in 2016.\nYOLOv1 [20] was an early breakthrough that introduced an\nend-to-end detection approach, enabling real-time detection\nby dividing images into grids and predicting bounding boxes\nand object classes directly from these grids. Since then, each\non July 14,2025 at 08:17:34 UTC from IEEE Xplore. Restrictions apply.', 'ongoing enhancements persist for these targeted objects.\nA. Faster R-CNN\nThe foundation of Faster R-CNN lies in the Regional\nConvolutional Neural Networks (R-CNN) approach to\nobject detection. In the study [6], R-CNN involves\nsegmenting the input image into approximately 2000 region\nproposals, extracting features from each proposal using\ndeep convolutional neural networks (CNNs), and\nsubsequently classifying these regions using class-specific\nlinear Support Vector Machines (SVMs).', 'objects.\n• False Positives (FP): Refers to the number of erroneous\ndetections of non-existent objects by the model.\n• False Negatives (FN): Refers to the number of actual\nobjects that the model failed to detect.\nFrom the reviewed papers, we compiled a list of commonly\nused metrics for detection, classification, and segmentation\ntasks, as summarized in Table 4. The metrics considered\nhere include accuracy, which calculates the percentage of\ncorrect predictions by dividing the combined total of true']","The YOLO (You Only Look Once) object detection model has undergone significant advancements since its introduction, with the latest version being YOLOv8, which is noted for its speed and accuracy.","tracked in each subsequent frame, enhancing processing efficiency and speed. The detection algorithm always begins the search from the start, where the filter response is evaluated, and the maximum value per frame (frames/second) is used to determine the target position. The use of keyframes simplifies the processing and analysis of video by reducing the number of frames, thus saving time and computational complexity. Keyframe extraction minimizes redundancy and improves efficiency, as processing focuses only on essential information. B. Object Detection Object detection using YOLOv8 based on deep learning is chosen in this study due to its efficient one-stage detection approach, which enhances both accuracy and speed. With the anchor-free version, the model can directly predict the center of objects, making",0.3333333333333333,0.960347439517602
". This integration can also enable real-time monitoring and detection of potential risks, allowing organizations to proactively address issues and ensure regulation adherence. III. METHODOLOGY III. METHODOLOGY This research uses quantitative methods to investigate the integration of AI in IT governance. It uses COBIT 2019 guidelines as an initial analysis, then extends to further analyze common factors causing delays in software development projects. The analysis identifies variables that cause problems in software development projects and then extends them with machine learning algorithms using feature engineering. This method helps understand the factors influencing project outcomes for better decision-making in IT service delivery. The proposed methodology will utilize machine learning techniques to optimize project completion time. By utilizing machine learning algorithms, the","['pp. 1–5. DOI: 10.1109/TSSA51342.2020.9310875.\n[4] H. Nurcahya, E. Setiawan, and B. Permana, “Information\ntechnology governance audit using cobit framework 2019\n(case study: Mandiri university),” Budapest International Re- [18]\nsearch and Critics Institute-Journal (BIRCI-Journal), vol. 5,\npp. 8030–8038, Feb. 2022. DOI: 10.33258/birci.v5i1.4566.\n[5] M. Damayanti and A. A. Chrismastuti, “Internal audit model\npost-erp implementation (enterprise resource planning) at pt [19]', 'provided recommendations to enhance IT governance, em-\nphasizing effectiveness of COBIT 2019 in managing IT risks.\nThese studies highlight the benefits of framework in improving\nIT governance in educational institutions.\nResearch by [4] assessed the effectiveness of IT governance\nat Mandiri University using the COBIT 2019 framework.\nThe findings highlighted the critical role of IT governance\nin achieving organizational objectives and emphasized the\nimportance of implementing IT governance practices.', 'by providing organizations with a valuable tool to automate and\nimprove IT strategies, effectively achieving business objectives.\nstI Index Terms—COBIT 2019, graph algorithms, IT governance,\ndna LSTM, Neo4j, recommendation system, regulatory compliance,\nsemantic similarity, TF-IDF\nnoitavonnI\nI. INTRODUCTION\nCOBIT 2019, which stands for Control Objectives for\nygolonhceT\nInformation and Related Technologies, is a comprehensive\nframework developed by ISACA (Information Systems Audit', 'M. M. Jawad, M. H. Ali, A. A. Khaleel, and M. F.\nHasan, “Evaluating the performance of it management\nunder the implementation of the cobit 2019 framework,”\nEximia, vol. 12, pp. 18–36, 2023.\nA. Safitri, I. Syafii, and K. Adi, “Measuring the perfor-\nmance of information system governance using frame-\nwork cobit 2019,” International Journal of Computer\nApplications, vol. 174, no. 31, pp. 23–30, 2021.\nS. De Haes, W. Van Grembergen, A. Joshi, T. Huygh, S.\nDe Haes, W. Van Grembergen, A. Joshi, and T. Huygh,', 'Development Capability Maturity Using COBIT 2019,” in 2023\nInternational Conference on Information Management and Technology\n(ICIMTech), IEEE, Aug. 2023, pp. 265–270. doi:\n10.1109/ICIMTech59029.2023.10277994.\n[6] J. Mökander, J. Schuett, H. R. Kirk, and L. Floridi, “Auditing large\nlanguage models: a three-layered approach,” AI and Ethics, May 2023,\ndoi: 10.1007/s43681-023-00289-2.\n[7] J. Mökander, J. Morley, M. Taddeo, and L. Floridi, “Ethics-Based']","The critical role of IT governance in achieving organizational objectives and the importance of implementing IT governance practices have been emphasized in the context of COBIT 2019 (Nurcahya, Setiawan, & Permana, 2022).","assist organizations in managing and optimizing their use of information technology (IT) . landscape, effective IT In today’s rapidly evolving digital governance is essential for organizations to ensure that their IT investments align with business objectives, comply with regulations, and mitigate risks . COBIT 2019 provides a structured approach for organiza- tions to establish, implement, and maintain effective gover- nance over IT. It defines the components necessary to create and sustain a governance system, as well as guidelines for building the most suitable governance system for an enterprise . By utilizing COBIT 2019, organizations can enhance the efficiency, effectiveness, and reliability of their IT usage, while also ensuring compliance with relevant regulations, policies, and standards . One of the key",1.0,0.9166464807860756
"weekly. In addition, use the AcMAPE score as a loss function to create a stock price forecasting model. VI. CONCLUSION AND FUTURE WORKS VI. CONCLUSION AND FUTURE WORKS In this paper, we presented quantifying multi-aspect news sentiment with considered time sequence data and then forecasting stock prices next days using sentiment and technical indicators. In feature extraction, a daily confidence score from the classification model is used to quantify sentiment. The active learning model produced a monthly classification model to represent model knowledge. The Transformer Encoder Gated Recurrent Unit (TEGRU) out- performed another Transformer architecture for stock price forecasting on eight stock issuers. The TEGRU model consists of the transformer encoder to learn time series pattern data with multi-head attention","['training data has been a method used to forecast stock\nprices [3] to create models for predicting stock trends [4].\nThe sentiment of financial news, covering stock, corporate,\neconomic news, and the market, is seen to reflect the stock\na Creative Commons Attribution 4.0 License.\nhttps://creativecommons.org/licenses/by/4.0/ VOLUME 12, 2024\nA. T. Haryono et al.: pTKANs for Stock Price Forecasting Using Generative ABSA\nmarket [5]. Analyzing sentiment based on various aspects', 'Comput., vol. 21, no. 13, pp. 3735–3757, Jul. 2017, doi: 10.1007/s00500-\n016-2028-y.\n[3] P. Mehta, S. Pandya, and K. Kotecha, ‘‘Harvesting social media sentiment\nanalysis to enhance stock market prediction using deep learning,’’ PeerJ\nComput. Sci., vol. 7, p. e476, Apr. 2021, doi: 10.7717/peerj-cs.476.\n[4] P.-Y. Hao, C.-F. Kung, C.-Y. Chang, and J.-B. Ou, ‘‘Predicting stock price\ntrends based on financial news articles and using a novel twin support', '1) STOCK FORECASTING WITHOUT ABSA SENTIMENT\nUnified stock forecasting uses open, high, low, and close\nprices and volume in previous transactions to predict\nprices one step ahead. Our proposed architecture, pTKAN,\noutperformed the traditional, ML, and other DL in\n6 of 6 metrics evaluations, as shown in Table. 10 The\npTKAN performance has 0.99999 R2, 11.08959 MAE,\nVOLUME 12, 2024\nA. T. Haryono et al.: pTKANs for Stock Price Forecasting Using Generative ABSA\n450.02682 MSE, 0.00143 sMAPE, 0.60539 F1-score,', 'Proc.2ndInt.Conf.BigDataArtif.Intell.Softw.Eng.(ICBASE),Sep.2021,\npp. 642–648, doi: 10.1109/ICBASE53849.2021.00127.\n[20] A. T. Haryono, R. Sarno, and K. R. Sungkono, ‘‘Transformer-gated\nrecurrent unit method for predicting stock price based on news sentiments\nand technical indicators,’’ IEEE Access, vol. 11, pp. 77132–77146, 2023,\ndoi: 10.1109/ACCESS.2023.3298445.\n[21] S. Ren, X. Wang, X. Zhou, and Y. Zhou, ‘‘A novel hybrid model\nfor stock price forecasting integrating encoder forest and informer,’’', 'VI. CONCLUSION AND FUTURE WORKS\nThis research proposed the Permuted Temporal Kolmogorov-\nArnold Network (pTKAN) architecture for unified stock\nprice forecasting using generative aspect-based sentiment\nanalysis (ABSA). The generative ABSA outperforms the\nconventional classification in the pair aspect-sentiment\nclassification task. The FlanT5-Base performed better than\nthe other pre-trained model to produce aspect-sentiment\nVOLUME 12, 2024\nforecasting in the stock issuer.']","The generative aspect-based sentiment analysis (ABSA) method demonstrated superior performance compared to conventional classification techniques in the context of stock price forecasting (Haryono et al., 2023).","using the mean sentiment score on each day trading, if not found, filled with zero value. The daily stock issuer sentiment score can be combined with stock transaction history. The illustration of the final dataset in the form of panel data is shown in Table. 2. D. FORECASTING MODELS D. FORECASTING MODELS This sub-section presents modified Transformer architec- ture, which are Transformer GRU (FormerGRU), Trans- former LSTM (FormerLSTM), Transformer Encoder GRU (TEGRU), and Transformer Encoder LSTM (TELSTM). Modified Transformer was chosen because TEGRU outper- formed other Transformer variants, such as vanilla Trans- former, Informer, FEDformer, and Transformer Encoder in stock price forecasting . This research proposes permuted Temporal Kolmogorov-Arnold Networks (pTKAN) architec- ture to develop a unified stock forecasting model",0.6666666666666666,0.9328224320970051
"of the dataset, the experimental scenarios, the pro- posed methodology, and the evaluation. Section IV describes the results of experimental research compared to previous studies on both intra-subject and inter-subject validation. Part 5 is the conclusion. II. RELATED WORK II. RELATED WORK Research related to emotion recognition using the DEAP open-source repositories attempts to improve performance accuracy. Intra-subject research has been carried out in many previous studies and obtained accuracy rates above 90%, even up to 99%. According to the existing research, intra- subject accuracy measures are superior to inter-subject accu- racy measures. In inter-subject research, the work is still very rare, resulting in poor performance, using a large number of channels, and often using a very deep architecture for","['EEG-based emotion recognition model (AP-CapsNet) with\nsubject-dependent and cross-subject experiments, achiev-\ning high accuracies of 62.7% and 63.51% in valence and\narousal class. In [59], MTLFuseNet combines VAE and\nGCN/GRU for EEG-based emotion recognition, outperform-\ning state-of-the-art methods with accuracies of 71.33% to\n73.28%. Reference [31] introduces a subject-independent\nor cross-subject approach with Inception-V3 CNN achiev-\ning accuracies of average 90.7%. Reference [60] presents', 'CNN and spectrogram with 32 channels that achieve 98.3%\nand 96.7% valence and arousal class accuracy, respectively.\nThese papers collectively contribute diverse approaches to\nEEG-based emotion recognition, each demonstrating promis-\ning results in addressing various challenges. A summary of\nthe articles making use of deep learning methods on all\n32 channels has been presented in Table 2.\nIII. MATERIALS AND METHOD\nThe methodology adopted in this study comprises a multi-', 'supplement our knowledge with some non-2D research.\nSection III describes the dataset, methodology proposed, and\nevaluation. In Section IV, the results of experimental research\non cross-subject validation with selected channels are com-\npared to previous studies. Section V serves as the conclusion\nsegment.\nII. RELATED WORK\nIn the domain of EEG-based emotion classification problems,\nthe DEAP dataset is the most studied public dataset [5], [46].\nThe comprehensive literature review presented herein encap-', 'sulates a multifaceted exploration of research pertaining to\nEEG-based emotion recognition. This review encompasses\ntwo distinct categories of articles, each contributing unique\ninsights to the field. First, this study into studies focused\non channel selection methods within EEG signals using the\nDEAP dataset, encompassing a diverse array of techniques\naimed at isolating the most informative channels for emotion\nanalysis. Second, this study explores articles that make use', 'In the domain of emotion recognition using EEG data,\na critical challenge lies in optimizing classification accuracy\nwhile mitigating computational complexity. Currently, the\nreliance on transfer learning with pre-trained models, such\nas DenseNets or ResNets or CNN with deep layer, applied\nto all EEG channels necessitates substantial computational\nresources. Such approaches have been successful in attaining\na higher classification rate of over 99 percent in dependent\nVOLUME 11, 2023']","A subject-independent approach utilizing Inception-V3 CNN has achieved average accuracies of 90.7% in emotion recognition, supporting the claim that intra-subject accuracy measures are superior to inter-subject measures.","Subsequently, employing a simplified deep learning architecture, we conduct a precise classification task, cate- gorizing emotional states into valence and arousal groups. For dependent subject and cross-subject performance analy- sis, the model employs two additional validation techniques, namely random split, and leave-one-out subject. The archi- tecture proposed in this research was validated using the publicly available DEAP dataset. The dependent subject and cross-subject validation portions of the emotional validation VOLUME 11, 2023 110139 TABLE 2. Recent articles on deep learning for EEG classification. L. Farokhah et al.: Cross-Subject Channel Selection TABLE 3. DEAP dataset attributes. FIGURE 1. Proposed research framework. experiment using EEG are separated into two segments. The general proposed research framework order is depicted in Fig. 1. A.",0.5,0.9649152467913285
". The 2D frame sequence research that has used training with various subjects is Chao’s research, which pro- duces 68.28% and 66.73% valence and arousal accuracy performances, respectively. Some inter-subject studies based on 2D images have lower performance measures. Pandey and Seeja researched 2D images of scalograms using 32 channels and frontal channels in the valence and arousal classes . The accuracy perfor- mance obtained for valence and arousal is 59% and 58%, respectively, while with the frontal channel, the accuracy performance is 61% for the valence class and 58% for the arousal class. Another study used the Inception Resnet-V2 architecture for positive and negative emotion classes . These emotions, transformed into the DEAP dataset, are called valence classes. The","['Some cross-subject studies are based on 2D or 3D forms\nwith 32 channels. Yin et al. [55] presented a 3D cube\nECLGCNN that was based on graphs and had 84% accu-\nracy in the valence class and 85% accuracy in the arousal\nclass. Pandey and Seeja conducted research using CNN\narchitecture, achieving 59% and 59% accuracy for valence\nand arousal, respectively [28]. Using Inception Resnet-V2,\nCimtay and Ekmekcioglu achieved a valence of 72.81%\n[29]. Using 2D frame sequences and BiDCNN, Huang et al.', 'high and low for valence and arousal classes. The architec-\ntural framework suggested in this study was assessed for its\nefficacy by employing the publicly accessible DEAP dataset.\nThe emotional validation experiment utilizing EEG is divided\ninto two distinct segments: the dependent subject validation\nand the cross-subject validation. Four sample images are\ndepicted in Fig. 2.\nC. PROPOSED CHANNEL SELECTION\nThe EEG pre-processing involves the application of', 'CNN and spectrogram with 32 channels that achieve 98.3%\nand 96.7% valence and arousal class accuracy, respectively.\nThese papers collectively contribute diverse approaches to\nEEG-based emotion recognition, each demonstrating promis-\ning results in addressing various challenges. A summary of\nthe articles making use of deep learning methods on all\n32 channels has been presented in Table 2.\nIII. MATERIALS AND METHOD\nThe methodology adopted in this study comprises a multi-', 'supplement our knowledge with some non-2D research.\nSection III describes the dataset, methodology proposed, and\nevaluation. In Section IV, the results of experimental research\non cross-subject validation with selected channels are com-\npared to previous studies. Section V serves as the conclusion\nsegment.\nII. RELATED WORK\nIn the domain of EEG-based emotion classification problems,\nthe DEAP dataset is the most studied public dataset [5], [46].\nThe comprehensive literature review presented herein encap-', 'EEG-based emotion recognition model (AP-CapsNet) with\nsubject-dependent and cross-subject experiments, achiev-\ning high accuracies of 62.7% and 63.51% in valence and\narousal class. In [59], MTLFuseNet combines VAE and\nGCN/GRU for EEG-based emotion recognition, outperform-\ning state-of-the-art methods with accuracies of 71.33% to\n73.28%. Reference [31] introduces a subject-independent\nor cross-subject approach with Inception-V3 CNN achiev-\ning accuracies of average 90.7%. Reference [60] presents']","Pandey and Seeja achieved 59% accuracy for both valence and arousal classes using CNN architecture (Yin et al., 2023).","81.27% and 82.37% for valence and arousal clas- sifications . Pandey and Seeja used frontal lobe channel to channel selection with accuracy on valence and arousal around 50% until 60% . Reference used best single collaboration with confusion matrix as an indicator for chan- nel selection with accuracy on valence and arousal around 92%. The application of reduction channels for cross-subject classification has not been thoroughly investigated. Addition- ally, the result can be enhanced. A summary of the existing articles on channel selection has been presented in Table 1. Some cross-subject studies are based on 2D or 3D forms with 32 channels. Yin et al. presented a 3D cube ECLGCNN that was based on graphs and had 84% accu- racy",0.75,0.9282965132149971
"accuracy performance is 61% for the valence class and 58% for the arousal class. Another study used the Inception Resnet-V2 architecture for positive and negative emotion classes . These emotions, transformed into the DEAP dataset, are called valence classes. The performance obtained is 72.81%. Furthermore, the highest performance for inter-subjects research currently available is obtained by using a spec- trogram with the DenseNet-121 and DCERNET architec- tures, which only provide performance details on the valence class . The performance of the valence class using Densenet-121 is 85.57%, while the performance of the valence class using DCERNET and softmax is 88.57%, and DCERNET and SVM is 88.10%. In addition, the valida- tion of inter-subject emotions using the 2D frame sequences resulted","['CNN and spectrogram with 32 channels that achieve 98.3%\nand 96.7% valence and arousal class accuracy, respectively.\nThese papers collectively contribute diverse approaches to\nEEG-based emotion recognition, each demonstrating promis-\ning results in addressing various challenges. A summary of\nthe articles making use of deep learning methods on all\n32 channels has been presented in Table 2.\nIII. MATERIALS AND METHOD\nThe methodology adopted in this study comprises a multi-', 'the DenseNet-121 architecture yields performance in the\n85.57% valence class. In a second experiment, they collab-\norated on DCERNET architectures and Softmax to achieve\na valence class performance of 88.57 percent. Thirdly,\nthey combined DCERNET and SVM to achieve 88.10%\nvalence class performance. Farokhah et al. [26] integrated\nthe development of a simplified CNN architecture, the best\nsingle collaboration for channel selection, and a spectro-\ngram with the greatest accuracy in the valence and arousal', 'EEG-based emotion recognition model (AP-CapsNet) with\nsubject-dependent and cross-subject experiments, achiev-\ning high accuracies of 62.7% and 63.51% in valence and\narousal class. In [59], MTLFuseNet combines VAE and\nGCN/GRU for EEG-based emotion recognition, outperform-\ning state-of-the-art methods with accuracies of 71.33% to\n73.28%. Reference [31] introduces a subject-independent\nor cross-subject approach with Inception-V3 CNN achiev-\ning accuracies of average 90.7%. Reference [60] presents', 'classes, enabling the network to make emotion predictions.\nVOLUME 11, 2023\nTABLE 5. Hyperparameter of deep learning.\nThe outcomes are rendered as high-valence, low-valence,\nor high-arousal, low-arousal.\nThe following simulation parameters have been adopted\nfor carrying out the training and evaluation of the model as\npresented in Table 5.\nE. EVALUATION\nThis publication provides more depth about cross-subject\nvalidation. Dependent subject validation was used as supple-', '110137\nC. SIMPLIFIED DEEP LEARNING MODEL\nTo reduce computational cost while maintaining classifi-\ncation accuracy, this research introduces a simplified deep\nlearning architecture tailored to EEG emotion recognition\ntasks. The architecture had been added in our recent publi-\ncation also [26] yet tailored for spectrogram images. Instead\nof relying on resource-intensive transfer learning models, our\napproach optimizes model efficiency, making it more com-']","The DenseNet-121 architecture achieved a performance of 85.57% in the valence class, while the DCERNET combined with Softmax and SVM reached performances of 88.57% and 88.10%, respectively (Farokhah et al., 2023).","72.81% . Using 2D frame sequences and BiDCNN, Huang et al. achieved 68% valence accuracy and 63% arousal accu- racy . Another study used a matrix sequence-based 110138 VOLUME 11, 2023 L. Farokhah et al.: Cross-Subject Channel Selection TABLE 1. Summary of the channel selection approaches. meta-learner with a class performance of 69.92% for valence and 68.89% for arousal . Pusarla et al. conducted three experiments simultaneously on cross-subject valida- tion . First, using a spectrogram in conjunction with the DenseNet-121 architecture yields performance in the 85.57% valence class. In a second experiment, they collab- orated on DCERNET architectures and Softmax to achieve a valence class performance of 88.57 percent. Thirdly, they combined DCERNET and SVM to achieve 88.10% valence",0.75,0.9507853027302345
"the valence class using Densenet-121 is 85.57%, while the performance of the valence class using DCERNET and softmax is 88.57%, and DCERNET and SVM is 88.10%. In addition, the valida- tion of inter-subject emotions using the 2D frame sequences resulted in 68% and 63% accuracy on valence and arousal, respectively . Non-2D research, such as the use of 3D meta-learners, yields valence and arousal performance of 69.92% and 68.89%, respectively . Research on 3D cubes with inter-subjects has been carried out with valence and arousal performances of 84% and 85% . Based on pre- vious studies, it is concluded that the highest accuracy per- formance in the valence class is 88.57% and the arousal class is 85%. Previous inter-subject research","['EEG-based emotion recognition model (AP-CapsNet) with\nsubject-dependent and cross-subject experiments, achiev-\ning high accuracies of 62.7% and 63.51% in valence and\narousal class. In [59], MTLFuseNet combines VAE and\nGCN/GRU for EEG-based emotion recognition, outperform-\ning state-of-the-art methods with accuracies of 71.33% to\n73.28%. Reference [31] introduces a subject-independent\nor cross-subject approach with Inception-V3 CNN achiev-\ning accuracies of average 90.7%. Reference [60] presents', 'classes, enabling the network to make emotion predictions.\nVOLUME 11, 2023\nTABLE 5. Hyperparameter of deep learning.\nThe outcomes are rendered as high-valence, low-valence,\nor high-arousal, low-arousal.\nThe following simulation parameters have been adopted\nfor carrying out the training and evaluation of the model as\npresented in Table 5.\nE. EVALUATION\nThis publication provides more depth about cross-subject\nvalidation. Dependent subject validation was used as supple-', 'CNN and spectrogram with 32 channels that achieve 98.3%\nand 96.7% valence and arousal class accuracy, respectively.\nThese papers collectively contribute diverse approaches to\nEEG-based emotion recognition, each demonstrating promis-\ning results in addressing various challenges. A summary of\nthe articles making use of deep learning methods on all\n32 channels has been presented in Table 2.\nIII. MATERIALS AND METHOD\nThe methodology adopted in this study comprises a multi-', 'Some cross-subject studies are based on 2D or 3D forms\nwith 32 channels. Yin et al. [55] presented a 3D cube\nECLGCNN that was based on graphs and had 84% accu-\nracy in the valence class and 85% accuracy in the arousal\nclass. Pandey and Seeja conducted research using CNN\narchitecture, achieving 59% and 59% accuracy for valence\nand arousal, respectively [28]. Using Inception Resnet-V2,\nCimtay and Ekmekcioglu achieved a valence of 72.81%\n[29]. Using 2D frame sequences and BiDCNN, Huang et al.', 'the DenseNet-121 architecture yields performance in the\n85.57% valence class. In a second experiment, they collab-\norated on DCERNET architectures and Softmax to achieve\na valence class performance of 88.57 percent. Thirdly,\nthey combined DCERNET and SVM to achieve 88.10%\nvalence class performance. Farokhah et al. [26] integrated\nthe development of a simplified CNN architecture, the best\nsingle collaboration for channel selection, and a spectro-\ngram with the greatest accuracy in the valence and arousal']","The DenseNet-121 architecture achieved an 85.57% accuracy in the valence class, while a combination of DCERNET and Softmax reached an accuracy of 88.57% (Cross-Subject Channel Selection Using Modified Relief and Simplified CNN-Based Deep Learning for EEG-Based Emotion Recognition).","72.81% . Using 2D frame sequences and BiDCNN, Huang et al. achieved 68% valence accuracy and 63% arousal accu- racy . Another study used a matrix sequence-based 110138 VOLUME 11, 2023 L. Farokhah et al.: Cross-Subject Channel Selection TABLE 1. Summary of the channel selection approaches. meta-learner with a class performance of 69.92% for valence and 68.89% for arousal . Pusarla et al. conducted three experiments simultaneously on cross-subject valida- tion . First, using a spectrogram in conjunction with the DenseNet-121 architecture yields performance in the 85.57% valence class. In a second experiment, they collab- orated on DCERNET architectures and Softmax to achieve a valence class performance of 88.57 percent. Thirdly, they combined DCERNET and SVM to achieve 88.10% valence",0.6666666666666666,0.9352071066054856
"uses the old method, which is based on the brain area. Yin et al. conduct channel selection for inter-subject classification by developing locally-robust feature selection (LRFS) with approximately 60% accuracy performance for valence and arousal classes . Arjun et al. used the attention channel for inter-subject classification, collaborating LSTM and autoencoder, and achieved accuracy rates of 65.9% and 69.5% for valence and arousal classes, 46332 VOLUME 11, 2023 L. Farokhah et al.: Simplified 2D CNN Architecture With Channel Selection for Emotion Recognition respectively . Yang et al. used ReliefF and random forest to select the best 10 channels and 11 channels for intra-subject and inter-subject classification, with inter-subject perfor- mance results of 81.27% and 82.36% in valence and arousal classes","['CNN and spectrogram with 32 channels that achieve 98.3%\nand 96.7% valence and arousal class accuracy, respectively.\nThese papers collectively contribute diverse approaches to\nEEG-based emotion recognition, each demonstrating promis-\ning results in addressing various challenges. A summary of\nthe articles making use of deep learning methods on all\n32 channels has been presented in Table 2.\nIII. MATERIALS AND METHOD\nThe methodology adopted in this study comprises a multi-', 'Received 19 September 2023, accepted 28 September 2023, date of publication 5\ndate of current version 11 October 2023.\nDigital Object Identifier 10.1109/ACCESS.2023.3322294\nCross-Subject Channel Selection\nRelief and Simplified CNN-Based\nfor EEG-Based Emotion Recognition\nLIA FAROKHAH1,2, RIYANARTO SARNO 1, (Senior Member,\nAND CHASTINE FATICHAH 1, (Member, IEEE)\n1Department of Informatics, Faculty of Intelligent Electrical and Informatics Technology, Institut', 'using PR-Relief (Power ratio -Relief) resulted in an increase\nin accuracy performance of around 2% from the previous\nhighest research in inter-subject or cross-subject validation.\nIn the 2D EEG and 3D EEG domains in Table 12 as well as\nother domains in Sub-Chapter II Related Work. The accuracy\nperformance produced in this study resulted in the highest\nperformance.\nV. CONCLUSION\nIn this paper, we were able to improve the accuracy of\nemotion recognition for cross-subject validation by keeping', 'EEG-based emotion recognition model (AP-CapsNet) with\nsubject-dependent and cross-subject experiments, achiev-\ning high accuracies of 62.7% and 63.51% in valence and\narousal class. In [59], MTLFuseNet combines VAE and\nGCN/GRU for EEG-based emotion recognition, outperform-\ning state-of-the-art methods with accuracies of 71.33% to\n73.28%. Reference [31] introduces a subject-independent\nor cross-subject approach with Inception-V3 CNN achiev-\ning accuracies of average 90.7%. Reference [60] presents', 'the classification results of emotions. Compared to previous\nstudies, collaborative EEG representation, simplified CNN,\nand channel selection methods produced the highest per-\nformance. Validation of cross-subject emotion classification\nthat collaborates with channel selection in the image domain\nis still limited. As additional information to demonstrate\ngenuine contribution, this study includes additional domain\nresearch in subchapter II Related work. Our research keeps']","The use of PR-Relief for channel selection improved accuracy performance by approximately 2% over previous highest results in inter-subject validation (Farokhah et al., 2023).","valence and arousal around 80% . Javidan et al. validate cross-subject performance in the valence class (2 channels) utilizing the RReliefF selection strategy with input MSCE and SVR classifiers, yielding an accuracy of 67.45% . Msonda et al. reconstruct features (using 2, 3, 4, 5, 6, 7, and 8 channels) and search for the minimal errors using Adaboost, LR, Linear SVC, Polynomial SVC, and RF, with average performance results between 50 and 60%. Using locally robust feature selection (LRFS), Yin et al. execute channel selection for cross-subject classification with an estimated accuracy of 60% for valence and arousal classes . Arjun et al. employed the attention channel when combined with the LSTM and autoen- coder for cross-subject classification and obtained",0.75,0.9248582686648609
"accuracy performance when using 32 channels either intra-subject or inter-subject. Second, it is desired that the research should lead to the use of minimal channels but well-performing. Third, the architecture com- plexity is seen as a trade-off with the performance measures. Therefore, the proposed research targets all these gaps and investigates inter-subject performance using minimal chan- nels and a simplified architecture, without the need for con- tinuous re-trainings. III. MATERIALS AND METHOD III. MATERIALS AND METHOD The architecture proposed in this study was validated on the DEAP, public dataset. The results of the emotional val- idation experiment using EEG are divided into two parts, namely intra-subject and inter-subject validation. The pro- posed method involves the processing of the raw data","['sulates a multifaceted exploration of research pertaining to\nEEG-based emotion recognition. This review encompasses\ntwo distinct categories of articles, each contributing unique\ninsights to the field. First, this study into studies focused\non channel selection methods within EEG signals using the\nDEAP dataset, encompassing a diverse array of techniques\naimed at isolating the most informative channels for emotion\nanalysis. Second, this study explores articles that make use', 'CNN and spectrogram with 32 channels that achieve 98.3%\nand 96.7% valence and arousal class accuracy, respectively.\nThese papers collectively contribute diverse approaches to\nEEG-based emotion recognition, each demonstrating promis-\ning results in addressing various challenges. A summary of\nthe articles making use of deep learning methods on all\n32 channels has been presented in Table 2.\nIII. MATERIALS AND METHOD\nThe methodology adopted in this study comprises a multi-', '110137\nC. SIMPLIFIED DEEP LEARNING MODEL\nTo reduce computational cost while maintaining classifi-\ncation accuracy, this research introduces a simplified deep\nlearning architecture tailored to EEG emotion recognition\ntasks. The architecture had been added in our recent publi-\ncation also [26] yet tailored for spectrogram images. Instead\nof relying on resource-intensive transfer learning models, our\napproach optimizes model efficiency, making it more com-', '110139\nTABLE 2. Recent articles on deep learning for EEG classification.\nFIGURE 1. Proposed research framework.\nexperiment using EEG are separated into two segments. The\ngeneral proposed research framework order is depicted in\nFig. 1.\nA. DEAP DATASET\nDEAP is an open-source database that is known to offer EEG,\nphysiological, and audiovisual signals that can be widely used\nin the domain of computing and emotion recognition. Numer-\nous subjects are involved in the experimentation which can', 'EEG-based emotion recognition model (AP-CapsNet) with\nsubject-dependent and cross-subject experiments, achiev-\ning high accuracies of 62.7% and 63.51% in valence and\narousal class. In [59], MTLFuseNet combines VAE and\nGCN/GRU for EEG-based emotion recognition, outperform-\ning state-of-the-art methods with accuracies of 71.33% to\n73.28%. Reference [31] introduces a subject-independent\nor cross-subject approach with Inception-V3 CNN achiev-\ning accuracies of average 90.7%. Reference [60] presents']","The proposed research targets inter-subject performance using minimal channels and a simplified architecture, as validated on the DEAP dataset, which is known to offer EEG signals for emotion recognition (Cross-Subject Channel Selection Using Modified Relief and Simplified CNN-Based Deep Learning for EEG-Based Emotion Recognition).","added in our recent publi- cation also yet tailored for spectrogram images. Instead of relying on resource-intensive transfer learning models, our approach optimizes model efficiency, making it more com- putationally friendly or resource-constrained applications. This contribution aims to streamline the implementation of emotion recognition systems without compromising perfor- mance. The proposed research is based on a simplified deep learn- ing architecture and channel selection approach that leads towards closer and resource-constrained real-time implemen- tation. In addition, research for cross-subject validation is more likely to be implemented widely than dependent subject validation. Cross-subject validation has a better generaliza- tion model than dependent-subject validation. This makes this research applicable across a wide range of industries where emotion recognition enables the development of",0.3333333333333333,0.8446609137241136
"this study was validated on the DEAP, public dataset. The results of the emotional val- idation experiment using EEG are divided into two parts, namely intra-subject and inter-subject validation. The pro- posed method involves the processing of the raw data with fewer preprocessing steps. The Python development environ- ment has been used to downsample data to 128 Hz, remove EOG artifacts, and perform bandpass frequency filtering from 4–45 Hz. The raw EEG data is transformed into a spectrogram image using the STFT method and stored as RGB images. This is done using the MATLAB (octave and oc2py) library in Python. After the spectrogram is generated, the next step is to classify emotions using a deep learning network. The archi- tecture","['CNN and spectrogram with 32 channels that achieve 98.3%\nand 96.7% valence and arousal class accuracy, respectively.\nThese papers collectively contribute diverse approaches to\nEEG-based emotion recognition, each demonstrating promis-\ning results in addressing various challenges. A summary of\nthe articles making use of deep learning methods on all\n32 channels has been presented in Table 2.\nIII. MATERIALS AND METHOD\nThe methodology adopted in this study comprises a multi-', 'sulates a multifaceted exploration of research pertaining to\nEEG-based emotion recognition. This review encompasses\ntwo distinct categories of articles, each contributing unique\ninsights to the field. First, this study into studies focused\non channel selection methods within EEG signals using the\nDEAP dataset, encompassing a diverse array of techniques\naimed at isolating the most informative channels for emotion\nanalysis. Second, this study explores articles that make use', '110139\nTABLE 2. Recent articles on deep learning for EEG classification.\nFIGURE 1. Proposed research framework.\nexperiment using EEG are separated into two segments. The\ngeneral proposed research framework order is depicted in\nFig. 1.\nA. DEAP DATASET\nDEAP is an open-source database that is known to offer EEG,\nphysiological, and audiovisual signals that can be widely used\nin the domain of computing and emotion recognition. Numer-\nous subjects are involved in the experimentation which can', 'EEG-based emotion recognition model (AP-CapsNet) with\nsubject-dependent and cross-subject experiments, achiev-\ning high accuracies of 62.7% and 63.51% in valence and\narousal class. In [59], MTLFuseNet combines VAE and\nGCN/GRU for EEG-based emotion recognition, outperform-\ning state-of-the-art methods with accuracies of 71.33% to\n73.28%. Reference [31] introduces a subject-independent\nor cross-subject approach with Inception-V3 CNN achiev-\ning accuracies of average 90.7%. Reference [60] presents', 'supplement our knowledge with some non-2D research.\nSection III describes the dataset, methodology proposed, and\nevaluation. In Section IV, the results of experimental research\non cross-subject validation with selected channels are com-\npared to previous studies. Section V serves as the conclusion\nsegment.\nII. RELATED WORK\nIn the domain of EEG-based emotion classification problems,\nthe DEAP dataset is the most studied public dataset [5], [46].\nThe comprehensive literature review presented herein encap-']","The DEAP dataset is recognized as an open-source database that provides EEG, physiological, and audiovisual signals useful for emotion recognition (Cross-Subject Channel Selection Using Modified Relief and Simplified CNN-Based Deep Learning for EEG-Based Emotion Recognition).","experimentation which can aid in gathering a diverse set of information under the con- trolled environment as they experience a variety of emotional stimuli. Primarily, DEAP offers access to numerous kinds of physiological signals including EEG, ECG, GSR, and others, yet in this study, EEG data available for 32 subjects has been employed. Each of the subjects has been exposed to numer- ous types of 40 video clips (1 minute each) associated with content related to different emotional states. The associated EEG responses are recorded at a high sampling rate utiliz- ing BioSemi ActiveTwo EEG instruments with 32 principal channels. The data is later passed on through pre-processing stages that involve data downsampling to 128 Hz, removal of the EOG",0.8333333333333334,0.8634385367422631
"DATASET The DEAP dataset has 32 participants with a composition of 50% male and 50% female samples . The stimulus used is a video with a duration of 60 seconds. The results of the EEG recording have a duration of 63 seconds, of which 3 seconds are the baseline. One participant has 40 recordings of the EEG trials. The results of the EEG trial recordings have been mea- sured using the Self-Assessment Manikin (SAM). SAM has four emotional dimensions, namely valence, arousal, domi- nance, and liking, with ratings 0-9. For valence and arousal classes, emotion labels are divided into two categories: low and high. In this study, the low class has a rating below 4.5 and the high class is","['sulates a multifaceted exploration of research pertaining to\nEEG-based emotion recognition. This review encompasses\ntwo distinct categories of articles, each contributing unique\ninsights to the field. First, this study into studies focused\non channel selection methods within EEG signals using the\nDEAP dataset, encompassing a diverse array of techniques\naimed at isolating the most informative channels for emotion\nanalysis. Second, this study explores articles that make use', 'CNN and spectrogram with 32 channels that achieve 98.3%\nand 96.7% valence and arousal class accuracy, respectively.\nThese papers collectively contribute diverse approaches to\nEEG-based emotion recognition, each demonstrating promis-\ning results in addressing various challenges. A summary of\nthe articles making use of deep learning methods on all\n32 channels has been presented in Table 2.\nIII. MATERIALS AND METHOD\nThe methodology adopted in this study comprises a multi-', 'suitability for various EEG applications. For instance, [26]\nevaluates the effectiveness of consumer-grade EEG headsets\nfor classifying emotional expressions, achieving an accuracy\nof 72% across 3 classes.\nOverall, Table I underscores the versatility of EEG in\nresearch and practical applications, showcasing a broad range\nof studies with varying methodologies, participant numbers,\nand software tools. These studies, referenced from [6] to [42],\nreflect the ongoing advancements and interdisciplinary', ""analysis of human emotions through computational\nsystems. BCIs play a crucial role in affective\ncomputing by providing insights into the emotional\nand cognitive states of individuals based on their brain\nactivity[34], [42].\n• Emotional Responses to Stimuli: [8] conducted a study\nusing the EMOTIV Insight headset to measure the\nbrain's response to visual and auditory stimuli. The\nstudy aimed to determine how different types of\nstimuli affect engagement, stress, and relaxation levels"", 'supplement our knowledge with some non-2D research.\nSection III describes the dataset, methodology proposed, and\nevaluation. In Section IV, the results of experimental research\non cross-subject validation with selected channels are com-\npared to previous studies. Section V serves as the conclusion\nsegment.\nII. RELATED WORK\nIn the domain of EEG-based emotion classification problems,\nthe DEAP dataset is the most studied public dataset [5], [46].\nThe comprehensive literature review presented herein encap-']",The DEAP dataset is noted as the most studied public dataset in EEG-based emotion classification problems (Cross-Subject Channel Selection Using Modified Relief and Simplified CNN-Based Deep Learning for EEG-Based Emotion Recognition).,"for EEG classification. L. Farokhah et al.: Cross-Subject Channel Selection TABLE 3. DEAP dataset attributes. FIGURE 1. Proposed research framework. experiment using EEG are separated into two segments. The general proposed research framework order is depicted in Fig. 1. A. DEAP DATASET A. DEAP DATASET DEAP is an open-source database that is known to offer EEG, physiological, and audiovisual signals that can be widely used in the domain of computing and emotion recognition. Numer- ous subjects are involved in the experimentation which can aid in gathering a diverse set of information under the con- trolled environment as they experience a variety of emotional stimuli. Primarily, DEAP offers access to numerous kinds of physiological signals including EEG, ECG, GSR, and others,",0.5,0.9398036828526294
"find the accuracy is shown in Eq. 2. Accuracy = TP + TN TP + TN + FP + FN (2) where TP, TN, FP, and FN are true positives, true negatives, false positives, and false negatives. The precision and recall are then evaluated, as shown in Eq. 3 and 4, respectively. Precision = Recall = TP TP + FP TP TP + FP (3) (4) The next evaluation is the F-score, which is a combination of accuracy between recall and precision. The F-score formula is shown in Eq. 5. F1score = 2(precision)(recall) recall + precision (5) In measuring the evaluation, eight scenarios will be used, as shown in Table 3. For inter-subject classification, it used leave one out subject","['person. Recall quantifies the proportion of correct classifi-\ncations compared to the total number required for specific\ndata within the dataset. F1-score was used to validate the\nbalance between precision and recall of the classification\nresults. The intention was to ensure the classifier model was\naccurate and consistent in identifying a person based on gait\nfeatures.\nThe focus of the evaluation was mainly on JSAE features\nclassified using CNN, LeNet, AlexNet, and VGG classifier', '20 features are generated while using two statistical parame-\nter methods, and so on.\n221704\nAdulteration in Beef for Halal Authentication Using an Optimized Electronic Nose System\n3) DIMENSIONAL REDUCTION\nThe features generated can be spread across multiple dimen-\ns i o ns ; f or th i s r e as o n , d im e n si o n re du c ti o n i s u s e d t o\ne l im i na te va ri a bl e s t h at d o n o t h a ve a s ig n i fic a nt r o l e i n\ndetecting pork adulteration. Principal component analy-', 'which decreased to 0.69 and increased gradually to 0.82 from\nsize 50 to 130. The trend showed that the proposed classifica-\ntion method performed better when a large amount of feature\ndata was used.\nThe proposed classifier model was initially trained on data\nfrom 124 subjects. It was later tested and validated using\ndata from 20 subjects which were part of the training. The\nresults obtained from the performance evaluation conducted\nusing confusion matrices based on the test data from subjects', 'contents, which can be used for halal authentication in\nfood.\n2. In the existing studies, e-nose systems have been devel-\noped for halal authentication. They show the poten-\ntial of e-nose for halal authentication, even though\ntheir experiments were quietly limited without per-\nforming classification or regression tasks. For exam-\nple, e-nose with PCA was used to differentiate pure\nlard, pure chicken fats, beef fats, mutton fats, and\nadulterated samples [18]. Moreover, e-nose with PCA', 'Received November 4, 2020, accepted November 24, 2020, date of publication\ndate of current version December 22, 2020.\nDigital Object Identifier 10.1109/ACCESS.2020.3043394\nDetecting Pork Adulteration in\nAuthentication Using an Optimized\nElectronic Nose System\nRIYANARTO SARNO 1, (Fellow, IEEE), KUWAT TRIYANA2,\nSHOFFI IZZA SABILLA1, DEDY RAHMAN WIJAYA 3, (Member,\nDWI SUNARYONO1, AND CHASTINE FATICHAH1, (Member,\n1Department of Informatics, Faculty of Intelligent Electrical and Informatics Technology, Institut']",The F1-score was utilized to assess the balance between precision and recall in the classification results (Skeleton-Based Gait Recognition Using Modified Deep Convolutional Neural Networks and Long Short-Term Memory for Person Recognition).,"measured the ratio of correct recognition results to the entire dataset. Accuracy = TP + TN TP + FN + TN + FP (11) 2) Precision (12) estimated how many of the positive pre- dictions were correct. Precision = TP TP + FP (12) 3) Recall can also be called Sensitivity (13) calculated how many positive cases the classifier correctly pre- dicted over all the positive instances in the data. Recall = TP TP + FN (13) 4) F1-measure (14) assessed the predictive skill of a model by elaborating on its class-wise performance. F1 − measure = 2 × Precision × Recall Precision + Recall (14) 97240 VOLUME 12, 2024 M. Rivai, D. Aulia: Use of Electronic Nose to Identify",0.5,0.9539014033326744
"82.45% in the valence and arousal classes, respectively. In the ReliefF method (R-HOLO-FM), it is 83.26% and 83.85% in the valence and arousal classes. This is different when using the proposed architecture, which results in increased performance accuracy on the NCA: 10.32% and 9.85% in the valence and arousal and ReliefF method classes, respectively, with a performance increase of 7.64% and 8.85% in the valence and arousal classes. The proposed channel selection method outperforms the other selection methods in the valence and arousal classes . The input for selecting the best channel for the proposed method uses EEG data to be classified, namely spectrogram data. The accuracy and loss plot results in Table 5 are shown in Figures 6, 7,","['CNN and spectrogram with 32 channels that achieve 98.3%\nand 96.7% valence and arousal class accuracy, respectively.\nThese papers collectively contribute diverse approaches to\nEEG-based emotion recognition, each demonstrating promis-\ning results in addressing various challenges. A summary of\nthe articles making use of deep learning methods on all\n32 channels has been presented in Table 2.\nIII. MATERIALS AND METHOD\nThe methodology adopted in this study comprises a multi-', 'sulates a multifaceted exploration of research pertaining to\nEEG-based emotion recognition. This review encompasses\ntwo distinct categories of articles, each contributing unique\ninsights to the field. First, this study into studies focused\non channel selection methods within EEG signals using the\nDEAP dataset, encompassing a diverse array of techniques\naimed at isolating the most informative channels for emotion\nanalysis. Second, this study explores articles that make use', 'Received 19 September 2023, accepted 28 September 2023, date of publication 5\ndate of current version 11 October 2023.\nDigital Object Identifier 10.1109/ACCESS.2023.3322294\nCross-Subject Channel Selection\nRelief and Simplified CNN-Based\nfor EEG-Based Emotion Recognition\nLIA FAROKHAH1,2, RIYANARTO SARNO 1, (Senior Member,\nAND CHASTINE FATICHAH 1, (Member, IEEE)\n1Department of Informatics, Faculty of Intelligent Electrical and Informatics Technology, Institut', 'high and low for valence and arousal classes. The architec-\ntural framework suggested in this study was assessed for its\nefficacy by employing the publicly accessible DEAP dataset.\nThe emotional validation experiment utilizing EEG is divided\ninto two distinct segments: the dependent subject validation\nand the cross-subject validation. Four sample images are\ndepicted in Fig. 2.\nC. PROPOSED CHANNEL SELECTION\nThe EEG pre-processing involves the application of', 'the sequence of the proposed channel selection method. The\nselection of the validation rule involves the use of a random\nsplit in the ratios 70:10:20 for training, validation, and testing.\nVOLUME 11, 2023\nL. Farokhah et al.: Cross-Subject Channel Selection\nAlgorithm 1 Power Ratio Relief Method for the Channel\nSelection\nInput: EEG Data X, Trials T, Bands α, β, γ, θ\nOutput: Selected Channels S\nProcess Starts:\n1. D ← X{T}\n2. D ← Bandpower D (θ) , D (α) , D (β) , D (γ ) ,\nB']","The proposed architecture achieves improved performance accuracy with a CNN and spectrogram approach, resulting in 98.3% and 96.7% accuracy for valence and arousal classes, respectively (Farokhah et al., 2023).","an accuracy between 69.56% and 83.50%, respec- tively . The NMI selection approach with input PSD and SVM classifiers yielded 74.41% valence (8 channels) and arousal (10 channels) accuracy of 73.64% . Goshvar- pour and Goshvarpour employing the sLORETA selection method and input lagged Poincare indicator and SVM clas- sifier deliver valence (5 channels) and arousal (5 channels) performance of 74.41% and 74.71%, respectively . Topic et al. used ReliefF and NCA approach for selection chan- nels with accuracy on valence and arousal around 80% . Javidan et al. validate cross-subject performance in the valence class (2 channels) utilizing the RReliefF selection strategy with input MSCE and SVR classifiers, yielding an accuracy of 67.45% . Msonda et al. reconstruct features",0.8,0.9598321801010419
predictions to the total test data. Models with high accuracy can predict new data correctly. Precision = TP TP + FP (5) Precision (5) is the ability to identify relevant data. High precision and accuracy can represent a better model. Recall = TP TP + FN (6) Recall (6) is the ability to find all relevant cases in a dataset. Recall can be explained by the success of the model in retrieving information. F1 − Score = 2 × Precision × Recall Precision + Recall (7) F1-Score (7) is an evaluation metric to determine the perfor- mance of the model accuracy against the dataset. F1-score is a calculation that involves a combination of precision and recall values. E. GENETIC ALGORITHM,"['learning, to improve its performance in classification and\nregression problems [37]. This algorithm is done in parallel,\nknown as the bagging model, where all decision trees give one\noutput, which is then evaluated by a majority voting technique\nVOLUME 12, 2024\nto produce one final result [38], [39]. The final result of each\ndecision tree is obtained by the split method, which recur-\nsively separates the entire population into sub-populations\nbased on their attributes or features [40]. The Gini is the', 'manual approach by 37%.\nRegarding solution variability, the standard deviation\n(SD) values suggest that ILS-TA produced more consistent\nresults compared to HC and the manual method. Figure 2’s\nboxplot illustrates this consistency, where ILS-TA’s\nnarrower interquartile range (IQR) and shorter whiskers\nindicate stability in generating low-penalty solutions.\nAlthough HC matched or slightly outperformed ILS-TA on\nDataset 3, its wider range of penalty values overall shows', 'tionary search; it is an approach used in the paper to detect\ncode smells, where two populations undergo simultaneous\nevolution, where the objective of one population is contingent\nupon the existing population of the other. The individual\nasserted that their precision and recall scores surpassed 80%\non a pre-established criterion. Similar to the method, [42] the\nterm ‘‘multi-objective’’ is used in this paper to describe the\napproach of simultaneously considering multiple objectives', 'performance. A comprehensive discussion of the model’s\nefficacy in these evaluation metrics is presented. This is\nfollowed by a comparative analysis, juxtaposing the current\nmodel’s performance with that of baseline models and models\ndelineated in prior research.\nA. HYPERPARAMETER SETTINGS\nThe hyperparameters of the proposed model have been\nmeticulously calibrated to enhance its performance. Hyper-\nparameters were chosen based on the results of a literature', 'problem,’’ Ann. Oper. Res., vol. 194, no. 1, pp. 203–221, Apr. 2012.\n[Online]. Available: http://link.springer.com/10.1007/s10479-010-\n0712-3\n[59] N. R. Sabar and G. Kendall, ‘‘Population based Monte Carlo tree\nsearch hyper-heuristic for combinatorial optimization problems,’’ Inf. Sci.,\nvol. 314, pp. 225–239, Sep. 2015.\n[60] N. R. Sabar, M. Ayob, G. Kendall, and R. Qu, ‘‘A dynamic\nmultiarmed bandit-gene expression programming hyper-heuristic\nfor combinatorial optimization problems,’’ IEEE Trans. Cybern.,']",The individual asserted that their precision and recall scores surpassed 80% on a pre-established criterion (Research Trends- Detection Methods- Practices- and Challenges in Code Smell SLR).,"with the following formula: TP + TN TP + TN + FP + FN Accuracy = Precision = Recall/True Positive Rate(TPR) TP TP + FP TP TP + FN F1 = 2 × precision × recall precision + recall FP TN + TP (cid:90) 1 TPRd(FPR) False Positive Rate(FPR) = AUC = (4) (5) (6) (7) (8) (9) where TP is the number of correctly predicted positive labels, TN is the number of correctly predicted negative labels, FP is the number of incorrectly predicted positive labels, and FN is the number of incorrectly predicted negative labels. Accuracy is the ratio of true predictions to the overall data. Precision is the ratio between TP to the total number of positive predic-",0.6666666666666666,0.8802998021674037
"highly relevant to various incident cases, as shown in Fig 3. Not only is it highly relevant, but it is also highly prioritised evidence in diverse investigation cases. 2) Flight log messages cover events from the drone’s sensors, features, and components, making it one piece of evidence to perform analysis related to different drone software and hardware components. Therefore, analysing the log messages means analysing the whole device for various possible incident scenarios. 3) Flight log messages contain contextual information about the occurring event as a description that involves multiple parts of the drone simultaneously. For example, a certain circumstance fails a feature or an operation, as shown in message group number 4 in Table 1. TABLE 1. Groups of","['VOLUME 12, 2024\nS. Silalahi et al.: Severity-Oriented Multiclass Drone Flight Logs Anomaly Detection\nTABLE 1. Summary of related works in log-based anomaly detection.\nto perform anomaly detection [9]. In a point setting, the\ndetection is performed against individual log records. The\nmodel depends solely on the features from a single log entry.\nOn the contrary, contextual and collective settings utilise a\ngroup of log events to detect the presence of abnormalities.', 'with more log message patterns, producing a dataset with\nincident scenarios to perform case studies to verify the\nperformance of the proposed method, and making it publicly\navailable.\nVOLUME 12, 2024\nS. Silalahi et al.: Severity-Oriented Multiclass Drone Flight Logs Anomaly Detection\nDATA AVAILABILITY\nThe dataset used in the experiment is available on a\nreasonable request. The code for the experiment, the resulting\nperformance evaluation, the scripts for data analysis, and the', 'predictions on unseen data [5].\nThis paper proposes the Transformer method for classifying\ndrone malfunctions based on telemetry data. By leveraging\ntheir ability to handle sequential data and capture complex\nrelationships, Transformer model can provide accurate and\nDownloaded on July 14,2025 at 08:24:14 UTC from IEEE Xplore. Restrictions apply.\nrobust predictions, enabling drone operators to detect and\ndiagnose malfunctions quickly and take corrective actions.', 'is under 85%, the model needs further improvement so that\nthe detection validity can be enhanced and that the detection\nresults of the model can be convincing and accountable\nenough to the investigator to be included in the investigation\nreport.\nVII. CONCLUSION AND FUTURE WORK\nIn this paper, we demonstrate how to train a log-based\nanomaly detection model that can prioritise the prediction\nof higher severity anomalies on drone flight logs while\nincreasing the prediction confidence score at the same', '2https://www.phantomhelp.com/logviewer/upload\nVOLUME 12, 2024\nS. Silalahi et al.: Severity-Oriented Multiclass Drone Flight Logs Anomaly Detection\nTABLE 2. Summary of the distribution of the class in the dataset.\ndataset used in this study is also used in [18], where the log\nmessages are collected from two sources: VTO Labs [45]\nand Drone Wiki [46]. Instead of taking the average over\n5 folds, one of the folds (5th fold) is directly used since the\nstandard deviation signified the performance evaluation on']","The analysis of drone flight logs can be enhanced by utilizing contextual and collective settings that leverage groups of log events to detect anomalies, rather than relying solely on individual log entries (Silalahi et al., 2024).","as runtime logs that are constantly generated during the operational period of the device. The information recorded in log data is highly valuable for many purposes, including running system monitoring, running process conformance checks, and overall system evaluation . The use of log data is critical when incident cases occur, as the empirical events and incident scenarios can be discovered by analysing the log artefacts. Assuming that 64252 2024 The Authors. This work is licensed under a Creative Commons Attribution-NonCommercial-NoDerivatives 4.0 License. For more information, see VOLUME 12, 2024 S. Silalahi et al.: Severity-Oriented Multiclass Drone Flight Logs Anomaly Detection the integrity of the log is guaranteed, log data is one of the artefacts with the highest priority for investigating",1.0,0.9339361371916285
"To do so, several artefacts such as flight logs, images, videos, firmware logs, and controller applications can be analysed, as illustrated in Fig 1. For instance, GPS records can be utilised to reconstruct and analyse the path taken by the drone during a flight . The deviation between the empirical flight and reconstructed paths can happen if the drone encounters a GPS spoofing . Among the published drone forensics studies, popular works include case studies, evidence analysis, tools develop- ment, and forensic framework development . The widely investigated source of evidence is sensor data, such as GPS , which provides a concise diagnosis of a flight to the investigator when performing anomaly detection . In fact, a flight log not","['challenges encountered during the study are disclosed, along\nwith limitations and threats to validity. As drone forensics\nis an emerging topic, there are very limited public datasets\navailable. The log messages used in this study are mainly\nacquired from DJI-made devices. There is yet to come\na publicly available dataset of log messages from other\ndrone manufacturers. Several publicly available datasets are\n64264\nSilalahi et al.: Severity-Oriented Multiclass Drone Flight Logs Anomaly Detection', 'Furthermore, Jain et al. [10] proposed a framework for\nsensor data identification and verification. An analysis of a\ndrone’s architecture and a forensic model with generic features\nare proposed here in order to enhance the digital investigation\nprocess. Also, Barton et al. [11] conducted the research to\nreconstruct the actions taken by these drones, identify their\nowners or operators, and extract data from associated mobile\ndevices.\nIn other research in drone forensics, this paper also analyze', 'some information to prove that the device was used to commit\na crime [5].\nWhile the drone is flying, any event that happens to the\ndrone is recorded in a log file, including the component’s\nstate, such as sensors, motors, GPS, and links. These data are\nstored in telemetry and dataflash logs located in the persistent\nstorage attached to the device [6]. Mantas and Patsakis [6]\nhave attempted to utilize telemetry and dataflash logs to\nperform drone forensic investigation by performing UAV', 'an anomaly, an investigator can adjust the analysis objectives\ntargeting a certain level only, depending on the needs and\ncases.\nAs shown in Fig. 1, the drone experiences several events\nduring a flight. When analysing the flight logs from a\nforensic perspective, distinguishing the severity levels can\nhelp the investigator pinpoint critical anomalies to less severe\nVOLUME 12, 2024\nFIGURE 1. An illustration of a flight scenario where several anomalous\nevents with different severity levels happen.', 'and monitoring. However, drones can also be involved in\nsecneicS\nincidents such as accidents, violations, or even crimes, making\nit necessary to investigate drone logs as part of forensic\nlacirtcelE investigations.\nIn a forensic investigation, drone logs are essential sources\nof information that can help investigators reconstruct the\nni\nevents leading up to an incident. Drone logs typically include\nsnoitacilppa\ninformation such as flight paths, altitude, speed, battery life,']","Analyzing flight logs from a forensic perspective allows investigators to distinguish severity levels, aiding in the identification of critical anomalies (Silalahi et al.).","I. INTRODUCTION I. INTRODUCTION The use of drones has become increasingly common in various applications, including aerial photography, surveying, and monitoring. However, drones can also be involved in incidents such as accidents, violations, or even crimes, making it necessary to investigate drone logs as part of forensic investigations. In a forensic investigation, drone logs are essential sources of information that can help investigators reconstruct the events leading up to an incident. Drone logs typically include information such as flight paths, altitude, speed, battery life, sensor data, and other telemetry information . Important analysis of drone logs involves the identification of the most critical pieces of information in the log data and the analysis of how they relate to the incident",0.6666666666666666,0.9313148390982999
"and forensic framework development . The widely investigated source of evidence is sensor data, such as GPS , which provides a concise diagnosis of a flight to the investigator when performing anomaly detection . In fact, a flight log not only contains sensor data and component status, as illustrated in Fig 2, but also human- readable messages describing the occurring events during the operation of a drone. This file stores all information during a flight, such as flight timestamps, flight parameters, sensor data, components’ status, and flight mode. The last three columns contain human-readable messages: APP.message, APP.tip, and APP.warning, which is the source of the evidence used in this paper. Sample messages can be seen in Table 1. From the","['VOLUME 12, 2024\nS. Silalahi et al.: Severity-Oriented Multiclass Drone Flight Logs Anomaly Detection\nTABLE 1. Summary of related works in log-based anomaly detection.\nto perform anomaly detection [9]. In a point setting, the\ndetection is performed against individual log records. The\nmodel depends solely on the features from a single log entry.\nOn the contrary, contextual and collective settings utilise a\ngroup of log events to detect the presence of abnormalities.', 'is under 85%, the model needs further improvement so that\nthe detection validity can be enhanced and that the detection\nresults of the model can be convincing and accountable\nenough to the investigator to be included in the investigation\nreport.\nVII. CONCLUSION AND FUTURE WORK\nIn this paper, we demonstrate how to train a log-based\nanomaly detection model that can prioritise the prediction\nof higher severity anomalies on drone flight logs while\nincreasing the prediction confidence score at the same', 'an anomaly, an investigator can adjust the analysis objectives\ntargeting a certain level only, depending on the needs and\ncases.\nAs shown in Fig. 1, the drone experiences several events\nduring a flight. When analysing the flight logs from a\nforensic perspective, distinguishing the severity levels can\nhelp the investigator pinpoint critical anomalies to less severe\nVOLUME 12, 2024\nFIGURE 1. An illustration of a flight scenario where several anomalous\nevents with different severity levels happen.', 'S. Silalahi et al.: Severity-Oriented Multiclass Drone Flight Logs Anomaly Detection\nthe integrity of the log is guaranteed, log data is one of the\nartefacts with the highest priority for investigating various\ntypes of incidents, such as collision, crash landing, cyber-\nattack, payload delivery issue, and weather-related incidents\n[2]. It is exemplified by the research effort that has been made\nby the community on log-based anomaly detection using\nvarious approaches, including machine learning- [3], [4],', 'challenges encountered during the study are disclosed, along\nwith limitations and threats to validity. As drone forensics\nis an emerging topic, there are very limited public datasets\navailable. The log messages used in this study are mainly\nacquired from DJI-made devices. There is yet to come\na publicly available dataset of log messages from other\ndrone manufacturers. Several publicly available datasets are\n64264\nSilalahi et al.: Severity-Oriented Multiclass Drone Flight Logs Anomaly Detection']","Log data is a critical artifact for investigating incidents such as collisions and crash landings, highlighting its importance in forensic analysis (Silalahi et al., 2024).","the performance of the proposed framework has been discussed and analysed. In this section, challenges encountered during the study are disclosed, along with limitations and threats to validity. As drone forensics is an emerging topic, there are very limited public datasets available. The log messages used in this study are mainly acquired from DJI-made devices. There is yet to come a publicly available dataset of log messages from other drone manufacturers. Several publicly available datasets are mainly about sensor data and multimedia artefacts . While in this study, we solely depend on the human-readable messages generated by the drone during a flight. Given the condition where a small number of unique messages and most of them are acquired from DJI",1.0,0.9143225527091224
"LLMs to detect anomalous log entries in a point-based approach . However, existing studies only detect whether an event or subsequent event is an anomaly. In a forensic setting, analysing a large number of log entries resulting from binary anomaly detection is considered inefficient and labour-intensive as the detection is performed on the acquired evidence at one time . Therefore, too many detected anomalies need to be detailed into a more fine- grained detection to help the investigator better prioritise the analysis objective. As a result, this study extends the binary anomaly detection to multi-class anomaly detection, as exemplified by another domain application such as plane flight data , image data , and internet of vehicle . As a consequence,","['64266\nS. Silalahi et al.: Severity-Oriented Multiclass Drone Flight Logs Anomaly Detection\nHUDAN STUDIAWAN (Member, IEEE) received\nthe bachelor’s and master’s degrees from the Insti-\ntut Teknologi Sepuluh Nopember, Indonesia, in\n2009 and 2011, respectively, and the Ph.D. degree\nfromMurdochUniversity,Australia,in2021.Heis\ncurrently a Lecturer with the Institut Teknologi\nSepuluh Nopember. His current research interests\ninclude digital forensics and natural language\nprocessing.\n1,', 'challenges encountered during the study are disclosed, along\nwith limitations and threats to validity. As drone forensics\nis an emerging topic, there are very limited public datasets\navailable. The log messages used in this study are mainly\nacquired from DJI-made devices. There is yet to come\na publicly available dataset of log messages from other\ndrone manufacturers. Several publicly available datasets are\n64264\nSilalahi et al.: Severity-Oriented Multiclass Drone Flight Logs Anomaly Detection', 'referred to as log-based anomaly detection. Recently, with the\nadvancements in Machine Learning (ML) and Deep Learning\n(DL) models, many studies proposed ML-based [3], [4],\nDL-based [4], [5], [6], and graph neural network (GNN)-\nbased [7] solutions for detecting abnormalities in log data.\nAmong the published studies, various modelling techniques\nwere used, including point, contextual, and collective. These\nmodelling methods refer to the input needed by the model\nVOLUME 12, 2024', 'events from all aspects of the drone, including sensors,\ncomponents and features [2].\nTypically, existing log-based anomaly detection stud-\nies classify log events into two categories: normal and\nanomaly [3]. This is helpful in an online setting, where the\nnumber of detected abnormalities in a certain period of time\nis considerably small. However, in a digital forensic setting,\nwhere the detection is performed on all collected artefacts\nwhich might be large in size, the number of the abnormalities', 'with the Institut Teknologi Sepuluh Nopember\n(ITS), Indonesia. His research interests include\ndigital forensics, log mining, natural language\nprocessing, and deep learning.\nTOHARI AHMAD (Member, IEEE) received\nthe bachelor’s degree in computer science from\nInstitut Teknologi Sepuluh Nopember (ITS),\nIndonesia, the master’s degree in information\ntechnology from Monash University, Australia,\nand the Ph.D. degree in computer science from\nRMIT University, Australia, in 2012.']","In a digital forensic setting, the detection of anomalies is performed on all collected artefacts, which may result in a large number of detected abnormalities (Silalahi et al., 2024).","particular system log may need different techniques from one type to another. Generally, log-based anomaly detection can be performed using either point, collective, or contextual approaches. In the log-based anomaly detection literature, most of the existing studies propose either a contextual or collective approach, where the decision is taken by examining a sequence of log events. However, detecting abnormalities in log data can be performed using a point-based approach, where one single log record is the only feature needed. Therefore, several studies explored utilising a point-based approach to detect anomalous events on logs data, such as in operating systems , , drone devices , and distribution systems , . In the drone context, a log message contains a description of",1.0,0.9573970881982198
"Existing anomaly detection modelling techniques can be conducted either in a point, contextual, or collective setting. Point anomaly detection characterises each log entry, whether an event is an abnormality or a normal event. For instance, if a user types the wrong password when trying to gain access to an operating system prompt, the generated log message can be considered as an anomaly , , . As for contextual anomaly, the detection involves analysing some contextually related attributes to determine whether a log entry is an anomaly. As an example, the flight path taken by a drone during a flight is recorded in longitude and latitude coordinates. These data can be used to detect an anomaly by finding a peculiar value","['VOLUME 12, 2024\nS. Silalahi et al.: Severity-Oriented Multiclass Drone Flight Logs Anomaly Detection\nTABLE 1. Summary of related works in log-based anomaly detection.\nto perform anomaly detection [9]. In a point setting, the\ndetection is performed against individual log records. The\nmodel depends solely on the features from a single log entry.\nOn the contrary, contextual and collective settings utilise a\ngroup of log events to detect the presence of abnormalities.', 'is legitimate or malicious. However, one single log record\nmalicious at the same time. Thus, several studies explored\nthe only feature needed. Dividing the anomalies into two\nlogs generated by a system is large. At the same time, it can\nless severe ones. Therefore, this study proposes DroLoVe,\napproach for drone flight log data. In accordance with the\ndifferent severity levels share common features, this paper\nto train deep neural network models. After an extensive', 'challenges encountered during the study are disclosed, along\nwith limitations and threats to validity. As drone forensics\nis an emerging topic, there are very limited public datasets\navailable. The log messages used in this study are mainly\nacquired from DJI-made devices. There is yet to come\na publicly available dataset of log messages from other\ndrone manufacturers. Several publicly available datasets are\n64264\nSilalahi et al.: Severity-Oriented Multiclass Drone Flight Logs Anomaly Detection', 'is under 85%, the model needs further improvement so that\nthe detection validity can be enhanced and that the detection\nresults of the model can be convincing and accountable\nenough to the investigator to be included in the investigation\nreport.\nVII. CONCLUSION AND FUTURE WORK\nIn this paper, we demonstrate how to train a log-based\nanomaly detection model that can prioritise the prediction\nof higher severity anomalies on drone flight logs while\nincreasing the prediction confidence score at the same', 'S. Silalahi et al.: Severity-Oriented Multiclass Drone Flight Logs Anomaly Detection\nthe integrity of the log is guaranteed, log data is one of the\nartefacts with the highest priority for investigating various\ntypes of incidents, such as collision, crash landing, cyber-\nattack, payload delivery issue, and weather-related incidents\n[2]. It is exemplified by the research effort that has been made\nby the community on log-based anomaly detection using\nvarious approaches, including machine learning- [3], [4],']","In a point setting, anomaly detection is performed against individual log records, while contextual and collective settings utilize a group of log events to identify abnormalities (Silalahi et al., 2024).","particular system log may need different techniques from one type to another. Generally, log-based anomaly detection can be performed using either point, collective, or contextual approaches. In the log-based anomaly detection literature, most of the existing studies propose either a contextual or collective approach, where the decision is taken by examining a sequence of log events. However, detecting abnormalities in log data can be performed using a point-based approach, where one single log record is the only feature needed. Therefore, several studies explored utilising a point-based approach to detect anomalous events on logs data, such as in operating systems , , drone devices , and distribution systems , . In the drone context, a log message contains a description of",0.6666666666666666,0.9291028335375519
"a log entry is an anomaly. As an example, the flight path taken by a drone during a flight is recorded in longitude and latitude coordinates. These data can be used to detect an anomaly by finding a peculiar value within the log records by contrasting the normal values to abnormal values using a certain threshold . Unique to the previous two approaches, collective anomaly establishes anomaly criteria based on a set of instances associated with each other, distinct from the overall data. Statistical anomaly detection is one of the common cases for this type of anomaly detection. Another case scenario in log-based anomaly detection is a sequence-based approach, where an abnormality is determined by analysing a group of events","['VOLUME 12, 2024\nS. Silalahi et al.: Severity-Oriented Multiclass Drone Flight Logs Anomaly Detection\nTABLE 1. Summary of related works in log-based anomaly detection.\nto perform anomaly detection [9]. In a point setting, the\ndetection is performed against individual log records. The\nmodel depends solely on the features from a single log entry.\nOn the contrary, contextual and collective settings utilise a\ngroup of log events to detect the presence of abnormalities.', 'is under 85%, the model needs further improvement so that\nthe detection validity can be enhanced and that the detection\nresults of the model can be convincing and accountable\nenough to the investigator to be included in the investigation\nreport.\nVII. CONCLUSION AND FUTURE WORK\nIn this paper, we demonstrate how to train a log-based\nanomaly detection model that can prioritise the prediction\nof higher severity anomalies on drone flight logs while\nincreasing the prediction confidence score at the same', 'S. Silalahi et al.: Severity-Oriented Multiclass Drone Flight Logs Anomaly Detection\nthe integrity of the log is guaranteed, log data is one of the\nartefacts with the highest priority for investigating various\ntypes of incidents, such as collision, crash landing, cyber-\nattack, payload delivery issue, and weather-related incidents\n[2]. It is exemplified by the research effort that has been made\nby the community on log-based anomaly detection using\nvarious approaches, including machine learning- [3], [4],', 'drone flight log data. The overall flow of the proposed\nframework is depicted in Fig 4. The following section\ndescribes the approach in more detail.\nA. OVERVIEW\nPerforming point log-based anomaly detection that takes\nhuman-readable log messages as input is similar to conduct-\ning sequence or text classification. As mentioned in Section I,\nthis task may be interpreted as a sentiment analysis task\nthat aims to detect negative sentiments within log messages.', 'with more log message patterns, producing a dataset with\nincident scenarios to perform case studies to verify the\nperformance of the proposed method, and making it publicly\navailable.\nVOLUME 12, 2024\nS. Silalahi et al.: Severity-Oriented Multiclass Drone Flight Logs Anomaly Detection\nDATA AVAILABILITY\nThe dataset used in the experiment is available on a\nreasonable request. The code for the experiment, the resulting\nperformance evaluation, the scripts for data analysis, and the']","In contrast to point settings that analyze individual log records, contextual and collective anomaly detection methods utilize groups of log events to identify abnormalities (Silalahi et al., 2024).","particular system log may need different techniques from one type to another. Generally, log-based anomaly detection can be performed using either point, collective, or contextual approaches. In the log-based anomaly detection literature, most of the existing studies propose either a contextual or collective approach, where the decision is taken by examining a sequence of log events. However, detecting abnormalities in log data can be performed using a point-based approach, where one single log record is the only feature needed. Therefore, several studies explored utilising a point-based approach to detect anomalous events on logs data, such as in operating systems , , drone devices , and distribution systems , . In the drone context, a log message contains a description of",1.0,0.9392800223351409
"severity level can provide better detection results for the investigator to pinpoint the event of interest. Interpretability makes training and testing more transparent, the model trustworthy, and human-friendly. 2) We propose DroneSBERT,1 a domain-specific embed- ding to extract semantic features that are well-aligned to the human perception of the log message samples. Supervised contrastive learning is employed to learn distinct representations for each anomaly severity level. 3) We explore two target label representations to augment a multitask learning paradigm for training multiclass classification models. Aligning to the dataset character- istics where the log messages from different anomaly severity levels share common words and phrases, multitask learning can help the model make use of the shared low-level features in the log","['based anomaly detection optimised using multitask label\nrepresentation to help the model learn from the overlapped\nfeatures shared by the samples from different severity levels.\nA domain-specific decoding procedure is also proposed to\ninfer the prediction result. In-depth analyses are performed\nto evaluate the proposed framework thoroughly. The main\ncontributions of this paper are summarised as follows:\n1) Propose Drone Log Severity (DroLoVe), a severity-\noriented multiclass anomaly detection approach on', 'errors during take-off, flight range issues, and\nanomaly detection to check whether an event during\nevents and includes deciding if the following event\ncan have no relationship to other log events and be\npoint anomaly detection, where one log record is\ncategories can be overwhelming as the number of\nbe helpful to separate critical anomalies from the\na severity-oriented multiclass anomaly detection\ndataset characteristics, where the samples from\nemploys a multitask-based label vector representation', 'severity levels share common words and phrases.\nThe remainder of the paper is structured as follows:\nSection II discusses relevant previous studies related to\nlog-based anomaly detection and how to deal with class\nimbalance problems in log-based anomaly detection task, the\nproposed framework is explained in detail in Section III,\nSection IV provides the experimental setup, followed by\nSection V where the experimental results along with compre-\nhensive analyses and discussions are presented. Section VI', 'of log parsing in log analysis and anomaly detection has been\ncritical to perform both online and offline detection [27].\nPerforming log parsing aims to extract the core features of\nlogs and reduce the noise. However, employing parsing can\nremove valuable information within the log messages [25].\nTo prevent parsing errors from being propagated to the next\ndetection phase, utilising a contextual embedding, such as\nBERT, to extract the semantic features of logs data without', 'P.Han,‘‘LayerLog:Logsequenceanomalydetectionbasedonhierarchical\nsemantics,’’ Appl. Soft Comput., vol. 132, Jan. 2023, Art. no. 109860.\n[22] J. Qi, Z. Luan, S. Huang, C. Fung, H. Yang, H. Li, D. Zhu, and\nD. Qian, ‘‘LogEncoder: Log-based contrastive representation learning for\nanomaly detection,’’ IEEE Trans. Netw. Service Manage., vol. 20, no. 2,\npp. 1378–1391, Jul. 2023.\n[23] X. Li, P. Chen, L. Jing, Z. He, and G. Yu, ‘‘SwissLog: Robust anomaly']",The proposed anomaly detection framework optimizes learning through a multitask label representation that leverages shared features among samples from different severity levels (Severity-Oriented Multiclass Drone Flight Logs Anomaly Detection).,"the model can be convincing and accountable enough to the investigator to be included in the investigation report. VII. CONCLUSION AND FUTURE WORK VII. CONCLUSION AND FUTURE WORK In this paper, we demonstrate how to train a log-based anomaly detection model that can prioritise the prediction of higher severity anomalies on drone flight logs while increasing the prediction confidence score at the same time. Considering the nature of the dataset, where samples that belong to different severity levels share common features, a multitask vector label representation along with severity-oriented decoding is proposed. An extensive experiment proved that the proposed approach is better than the previous work baselines while being inferior to our baseline scenario based on the accuracy and F1",0.6666666666666666,0.9012351324191835
"detection on the test data, which is then analysed further. In this paper, M = (cid:2)m1, m2, . . . , m|M| (cid:3) is defined as the collection of log messages in the dataset. Given a log record m = [w1, w2, . . . , wn] containing n number of words as input, with m ∈ M, BERTbase is used to tokenize and obtain the input vector representation. In the implementation, computation is undertaken using matrix multiplication. Thus, a term maximum sequence length, m, is introduced to pack the input messages that vary in length into a matrix with a consistent size throughout all the samples in the dataset. Therefore, for each single input message, the input matrix becomes","['of log parsing in log analysis and anomaly detection has been\ncritical to perform both online and offline detection [27].\nPerforming log parsing aims to extract the core features of\nlogs and reduce the noise. However, employing parsing can\nremove valuable information within the log messages [25].\nTo prevent parsing errors from being propagated to the next\ndetection phase, utilising a contextual embedding, such as\nBERT, to extract the semantic features of logs data without', 'samples. Instead of removing the parameter values in a log\nmessage when performing log parsing, the information can\nbe used as an additional feature along with the metadata of\nthe logs to improve the performance of the models [19].\nLog-based anomaly detection has been applied widely\nto various systems, such as operating systems [9], [10],\nparallel file systems [26], drones [11], [18], [20], internet\nof things [28], and industrial control systems [29]. Among', 'messages [9]. Thus, analysing a particular system log may\nneed different techniques from one type to another.\nGenerally, log-based anomaly detection can be performed\nusing either point, collective, or contextual approaches.\nIn the log-based anomaly detection literature, most of the\nexisting studies propose either a contextual or collective\napproach, where the decision is taken by examining a\nsequence of log events. However, detecting abnormalities in\nlog data can be performed using a point-based approach,', 'referred to as log-based anomaly detection. Recently, with the\nadvancements in Machine Learning (ML) and Deep Learning\n(DL) models, many studies proposed ML-based [3], [4],\nDL-based [4], [5], [6], and graph neural network (GNN)-\nbased [7] solutions for detecting abnormalities in log data.\nAmong the published studies, various modelling techniques\nwere used, including point, contextual, and collective. These\nmodelling methods refer to the input needed by the model\nVOLUME 12, 2024', 'VOLUME 12, 2024\nS. Silalahi et al.: Severity-Oriented Multiclass Drone Flight Logs Anomaly Detection\nTABLE 1. Summary of related works in log-based anomaly detection.\nto perform anomaly detection [9]. In a point setting, the\ndetection is performed against individual log records. The\nmodel depends solely on the features from a single log entry.\nOn the contrary, contextual and collective settings utilise a\ngroup of log events to detect the presence of abnormalities.']",Utilizing a contextual embedding like BERT allows for the extraction of semantic features from log data without discarding valuable information contained in the log messages.,"log message m = [w1, w2, . . . , wn] from the dataset D = {(mi, ci)}|D| i=1 as the input, where c is the label class name, BERT is used to tokenise the input into a fixed length sequence with m maximum length and retrieve the contextual embeddings, resulting in an input matrix X ∈ Rm×dBERT which is then paired with the encoded label y. Thus, the numerical input becomes (X, y). This study aims to train a neural network model Mθ to classify the message m into one of the predefined classes c ∈ C = {high, medium, low, normal}, or can be written as Mθ : m → c. Based on past literature discussed in Section",0.5,0.9199246015473399
"final unnormalized logits vector using the following equation: α = zW⊤ + b, ∈ R|C| (3) where W ∈ R|C|×768, and b ∈ R|C| are the typical trainable weight and bias parameters in a linear layer. Knowing that the number of classes is more than two, the task belongs to multiclass classification. Typically, the target label is represented in a one-hot encoded vector, as depicted in Fig. 8a. Therefore, the training objective is to minimise the cross-entropy loss, which is computed using the following equation: LCE(y, ˆy) = − |C| yi · log(ˆyi) i=1 ˆy = softmax(α) (4) (5) where y and ˆy are the truth and the predicted label probability distribution respectively. The normalized logits in Eq. 5 is","['exclusive label only. Therefore, in case of misclassification,\nthe prediction is expected to fall one level under the true label.\nAligning to the nature of the label representation, the\nloss function used in the training is log loss for multiclass\nclassification, which can be computed using Eq 8, as written\nin the following:\n|C|\nX\nLLog = − α · [y log(yˆ ) + (1 − y ) log(1 − yˆ )] (8)\ni i i i i\ni=1\nwhere α is the same term as in Eq 4. With this loss function,\ni', 'function for binary-class classification and the Softmax acti-\nvation function for multi-class classification. Utilizing multi-\nple layers in a neural network is advantageous for generaliza-\ntion because it can learn the intermediate features between the\ninput data and the high-level categorization. Selecting fewer\nneurons can result in underfitting and a substantial statistical\nbias. On the other hand, choosing an excessive number of\nneurons can result in overfitting, increased variance, and', 'apt for binary classification tasks, as corroborated by exist-\ning literature [45]. This function is prevalently utilized in\nbinary classification scenarios to ascertain the likelihood of\ndata points belonging to one of two categories, producing\nan output value ranging between 0 and 1, which is con-\nducive to probability interpretation. Conversely, the softmax\nfunction is tailored for multiclass classification contexts, gen-\nerating a probability distribution across numerous classes.', 'z ∈ R|C|, where |C| denotes the number of target class in\nthe dataset. During the training phase, these vectors are used\nto compute the loss and update the parameter of the model\nafter passing through a normalisation function. For the typical\none-hot encoding representation of the label, the standard\ncross-entropy is used to compute the loss, as defined in the\nfollowing equation:\n|C|\nX\nLCE = − y · log(yˆ ) (1)\ni i\ni=1\nyˆ = softmax(z) (2)\nexp(z )\nyˆ = i\n(3)\ni Pdim(z)\nexp(z )\nj j', 'interpreting it as a probability. The sigmoid function’s dis-\ntinctive ‘S’ shape allows for a smooth and gradual transition\nbetween the two extremes of probability. This transition is\nparticularly important in cases where the decision boundary\nbetween two classes is unclear. Finally, the model utilizes\nthe binary cross-entropy loss function, deemed appropri-\nate for binary classification tasks. The binary cross-entropy\nloss, a conventional loss function for binary classification,']","The standard cross-entropy loss function is utilized for one-hot encoded labels in multiclass classification tasks, as indicated in the literature (Severity-Oriented Multiclass Drone Flight Logs Anomaly Detection).","logits z ∈ R|C|, where |C| denotes the number of target class in the dataset. During the training phase, these vectors are used to compute the loss and update the parameter of the model after passing through a normalisation function. For the typical one-hot encoding representation of the label, the standard cross-entropy is used to compute the loss, as defined in the following equation: |C| LCE = − yi · log(ˆyi) i=1 ˆy = softmax(z) exp(zi) ˆyi = Pdim(z) exp(zj) (1) (2) (3) where y and ˆy are the true label vector and the prediction probability distribution, respectively. The prediction proba- bility ˆy is obtained from Eq 2, where each of the element in ˆy is computed using Eq 3.",0.3333333333333333,0.9610850187704196
