citation_id,source_paragraph,retrieved_paper,retrieved_chunk,retrieved_contexts,relevant,citation_text,reasoning
105,"this study was validated on the DEAP, public dataset. The results of the emotional val- idation experiment using EEG are divided into two parts, namely intra-subject and inter-subject validation. The pro- posed method involves the processing of the raw data with fewer preprocessing steps. The Python development environ- ment has been used to downsample data to 128 Hz, remove EOG artifacts, and perform bandpass frequency filtering from 4–45 Hz. The raw EEG data is transformed into a spectrogram image using the STFT method and stored as RGB images. This is done using the MATLAB (octave and oc2py) library in Python. After the spectrogram is generated, the next step is to classify emotions using a deep learning network. The archi- tecture",Cross-Subject Channel Selection Using Modified Relief and Simplified CNN-Based Deep Learning for EEG-Based Emotion Recognition,The architecture proposed in this research was validated using the publicly available DEAP dataset.,"["". ABSTRACT Emotion recognition based on EEG has been implemented in numerous studies. In most of them, there are two observations made: first, extensive implementation is negatively associated with the performed validation. Cross-subject validation is more difficult than subject-dependent validation due to thehighvariabilitybetweenEEGrecordingscausedbydomainshifts.Second,alargenumberofchannels requires extensive computation"", "". 10.3390/s20123491. [28] P.PandeyandK.R.Seeja,‘‘Subjectindependentemotionrecognitionsys- [46] H. Donmez and N. Ozkurt, ‘‘Classification of emotional states from temforpeoplewithfacialdeformity:AnEEGbasedapproach,’’J.Ambient multi-channel EEG signals by convolutional neural networks,’’ in Intell.HumanizedComput.,vol.12,no.2,pp.2311–2320,Feb.2021,doi: Proc. Innov. Intell. Syst. Appl. Conf. (ASYU), 2022, pp.1–6, doi: 10.1007/s12652-020-02338-8. 10.1109/ASYU56188.2022.9925308. [29] Y. Cimtay and E"", "". These selected channels are then subjected to the EEG-based emotion recognition model (AP-CapsNet) with Morlettransform,transformingthedatainto2Dimagesthat subject-dependent and cross-subject experiments, achiev- effectivelyencapsulateintricatetemporalandspectralinforing high accuracies of 62.7% and 63.51% in valence and mation.Subsequently,employingasimplifieddeeplearning arousal class"", "". Reference [31] introduces a subject-independent sis,themodelemploystwoadditionalvalidationtechniques, or cross-subject approach with Inception-V3 CNN achiev- namely random split, and leave-one-out subject. The archiing accuracies of average 90.7%. Reference [60] presents tecture proposed in this research was validated using the BiSMSM for EEG-based emotion recognition, achieving publiclyavailableDEAPdataset.Thedependentsubjectand 63.10% to 61.89% accuracy"", "". DigitalObjectIdentifier10.1109/ACCESS.2023.3322294 Cross-Subject Channel Selection Using Modified Relief and Simplified CNN-Based Deep Learning for EEG-Based Emotion Recognition LIAFAROKHAH1,2,RIYANARTOSARNO 1,(SeniorMember,IEEE), ANDCHASTINEFATICHAH 1,(Member,IEEE) 1DepartmentofInformatics,FacultyofIntelligentElectricalandInformaticsTechnology,InstitutTeknologiSepuluhNopember(ITS),Surabaya60111,Indonesia""]",True,"The architecture proposed in this research was validated using the publicly available DEAP dataset (Farokhah et al., 2023).","The retrieved reference directly mentions the validation of the proposed architecture using the DEAP dataset, which aligns with the claim in the source paragraph."
106,"DATASET The DEAP dataset has 32 participants with a composition of 50% male and 50% female samples . The stimulus used is a video with a duration of 60 seconds. The results of the EEG recording have a duration of 63 seconds, of which 3 seconds are the baseline. One participant has 40 recordings of the EEG trials. The results of the EEG trial recordings have been mea- sured using the Self-Assessment Manikin (SAM). SAM has four emotional dimensions, namely valence, arousal, domi- nance, and liking, with ratings 0-9. For valence and arousal classes, emotion labels are divided into two categories: low and high. In this study, the low class has a rating below 4.5 and the high class is",Cross-Subject Channel Selection Using Modified Relief and Simplified CNN-Based Deep Learning for EEG-Based Emotion Recognition,"First, this study into studies focused racy in the valence class and 85% accuracy in the arousal on channel selection methods within EEG signals using the DEAP dataset, encompassing a diverse array of techniques aimed at isolating the most informative channels for emotion analysis.","["". First, this study into studies focused racy in the valence class and 85% accuracy in the arousal on channel selection methods within EEG signals using the class. Pandey and Seeja conducted research using CNN DEAP dataset, encompassing a diverse array of techniques architecture, achieving 59% and 59% accuracy for valence aimedatisolatingthemostinformativechannelsforemotion and arousal, respectively [28]. Using Inception Resnet-V2, analysis"", "". Thirdly, and 96.7% valence and arousal class accuracy, respectively. they combined DCERNET and SVM to achieve 88.10% These papers collectively contribute diverse approaches to valence class performance. Farokhah et al. [26] integrated EEG-basedemotionrecognition,eachdemonstratingpromisthe development of a simplified CNN architecture, the best ing results in addressing various challenges"", "". reflect the ongoing advancements and interdisciplinary collaboration in the field of EEG-based research, aiming to Emotion recognition is another key area explored. The enhance user experiences, improve health outcomes, and study in [20] examines the impact of HDR videos on emotion develop innovative assistive technologies. recognition, achieving an accuracy of 80.55% for arousal and 70.37% for valence. Similarly, [33] develops a hybrid control TABLE I"", "". 10.3390/s20123491. [28] P.PandeyandK.R.Seeja,‘‘Subjectindependentemotionrecognitionsys- [46] H. Donmez and N. Ozkurt, ‘‘Classification of emotional states from temforpeoplewithfacialdeformity:AnEEGbasedapproach,’’J.Ambient multi-channel EEG signals by convolutional neural networks,’’ in Intell.HumanizedComput.,vol.12,no.2,pp.2311–2320,Feb.2021,doi: Proc. Innov. Intell. Syst. Appl. Conf. (ASYU), 2022, pp.1–6, doi: 10.1007/s12652-020-02338-8. 10.1109/ASYU56188.2022.9925308. [29] Y. Cimtay and E"", "". ABSTRACT Emotion recognition based on EEG has been implemented in numerous studies. In most of them, there are two observations made: first, extensive implementation is negatively associated with the performed validation. Cross-subject validation is more difficult than subject-dependent validation due to thehighvariabilitybetweenEEGrecordingscausedbydomainshifts.Second,alargenumberofchannels requires extensive computation""]",True,"The DEAP dataset has been utilized in studies focusing on channel selection methods for EEG signals, achieving 85% accuracy in the arousal class and demonstrating the effectiveness of various techniques in emotion recognition (Pandey & Seeja, 2022).","The retrieved reference discusses the use of the DEAP dataset and provides specific accuracy results for emotion recognition, which directly supports the claims made in the source paragraph regarding the dataset and its application in EEG studies."
107,"find the accuracy is shown in Eq. 2. Accuracy = TP + TN TP + TN + FP + FN (2) where TP, TN, FP, and FN are true positives, true negatives, false positives, and false negatives. The precision and recall are then evaluated, as shown in Eq. 3 and 4, respectively. Precision = Recall = TP TP + FP TP TP + FP (3) (4) The next evaluation is the F-score, which is a combination of accuracy between recall and precision. The F-score formula is shown in Eq. 5. F1score = 2(precision)(recall) recall + precision (5) In measuring the evaluation, eight scenarios will be used, as shown in Table 3. For inter-subject classification, it used leave one out subject",Multi-class Oil Palm Trees Condition Detection from UAV Images using Faster R-CNN with EfficientNetV2,Precision detects the truly correct prediction out of all predictions. Recall detects the truly correct prediction out of all actual classes. F1 scores are harmonic mean between these two that measure overall model performance,"["". These metrics can be calculated by (1) – (3). This study's calculation of True Positive, False Positive, and False Negative differs from other classifications or detections [20]-[23]. These are chosen and calculated following previous studies [1]. Precision detects the truly correct prediction out of all predictions. Recall detects the truly correct prediction out of all actual classes. F1 scores are harmonic mean between these two that measure overall model performance"", ""classification validation have helped develop the motivation for this work which is [34],[35],[36]"", "". performance evaluation score, where the highest accuracy Following the definition in the previous paragraph, we plot is under 85%, the model needs further improvement so that the frequency of each misclassification type in Fig 13 and thedetectionvaliditycanbeenhancedandthatthedetection Fig 14"", "". F1 SCORE OF UNDERSAMPLING RESULT undersampling was decreased than before, from 0.8474 to F1 Score Classifier 0.6207. SMOTE-ENN is worked better than SMOTETomek. Tomek Mean Model RUS ENN Links Overall, the highest mean recall score was achieved by the 1 Bagging 0.5858 0.6210 0.6393 0.6154 SMOTE-ENN method with the AdaBoost model, which is 2 XGBoost 0.6141 0.6187 0.6691 0.6340 0.7330 as shown in Table 6"", "". After conducting when λ = 0.65, the accuracy reaches 97%, exceeding the an experiment on a certain dataset and task, verifying and best model’s accuracy when λ = 0.5. This happens when checking which component in the model contributes posi- thepredictionconfidencescoresurpassesthethresholdwhile tively to the performance is crucial. Therefore, we perform the true label’s severity is lower than the prediction label’s""]",True,"The precision and recall metrics are defined as the true correct predictions out of all predictions and actual classes, respectively, with the F1 score serving as the harmonic mean of these two metrics (Referensi 1).","This reference directly discusses precision, recall, and F1 score, which are the specific metrics mentioned in the source paragraph, making it relevant."
108,"82.45% in the valence and arousal classes, respectively. In the ReliefF method (R-HOLO-FM), it is 83.26% and 83.85% in the valence and arousal classes. This is different when using the proposed architecture, which results in increased performance accuracy on the NCA: 10.32% and 9.85% in the valence and arousal and ReliefF method classes, respectively, with a performance increase of 7.64% and 8.85% in the valence and arousal classes. The proposed channel selection method outperforms the other selection methods in the valence and arousal classes . The input for selecting the best channel for the proposed method uses EEG data to be classified, namely spectrogram data. The accuracy and loss plot results in Table 5 are shown in Figures 6, 7,",Cross-Subject Channel Selection Using Modified Relief and Simplified CNN-Based Deep Learning for EEG-Based Emotion Recognition,"This study into studies focused on channel selection methods within EEG signals using the class, achieving 85% accuracy in the arousal class.","["". DigitalObjectIdentifier10.1109/ACCESS.2023.3322294 Cross-Subject Channel Selection Using Modified Relief and Simplified CNN-Based Deep Learning for EEG-Based Emotion Recognition LIAFAROKHAH1,2,RIYANARTOSARNO 1,(SeniorMember,IEEE), ANDCHASTINEFATICHAH 1,(Member,IEEE) 1DepartmentofInformatics,FacultyofIntelligentElectricalandInformaticsTechnology,InstitutTeknologiSepuluhNopember(ITS),Surabaya60111,Indonesia"", "". First, this study into studies focused racy in the valence class and 85% accuracy in the arousal on channel selection methods within EEG signals using the class. Pandey and Seeja conducted research using CNN DEAP dataset, encompassing a diverse array of techniques architecture, achieving 59% and 59% accuracy for valence aimedatisolatingthemostinformativechannelsforemotion and arousal, respectively [28]. Using Inception Resnet-V2, analysis"", ""L.Farokhahetal.:Cross-SubjectChannelSelection preponderanceofthepowerbandratioviathereliefmethod. [8] M.N.Munawar,R.Sarno,D.A.Asfani,T.Igasaki,andB.T.Nugraha, Third, collaboration of scalogram, PR-Relief for channel ‘‘Significant preprocessing method in EEG-based emotions classification,’’ J. Theor. Appl. Inf. Technol., vol. 87, no. 2, pp.176–190, selection, and simplified CNN for classification have pro2016. posed. In the proposed channel selection, the number of [9] Y. Wu, M. Xia, L. Nie, Y. Zhang, and A"", "". These selected channels are then subjected to the EEG-based emotion recognition model (AP-CapsNet) with Morlettransform,transformingthedatainto2Dimagesthat subject-dependent and cross-subject experiments, achiev- effectivelyencapsulateintricatetemporalandspectralinforing high accuracies of 62.7% and 63.51% in valence and mation.Subsequently,employingasimplifieddeeplearning arousal class"", "". A summary of single collaboration for channel selection, and a spectro- the articles making use of deep learning methods on all gram with the greatest accuracy in the valence and arousal 32channelshasbeenpresentedinTable2. classes,achieving98.3%and96.7%accuracywith32channels, respectively. Tangetal.[32] used the spatial-temporal III""]",True,"The proposed method achieves an accuracy of 85% in the arousal class, highlighting its effectiveness in channel selection for EEG-based emotion recognition (Farokhah et al., 2023).","The retrieved reference directly discusses the accuracy achieved in the arousal class, which supports the claims made in the source paragraph regarding performance metrics in EEG-based emotion recognition."
109,predictions to the total test data. Models with high accuracy can predict new data correctly. Precision = TP TP + FP (5) Precision (5) is the ability to identify relevant data. High precision and accuracy can represent a better model. Recall = TP TP + FN (6) Recall (6) is the ability to find all relevant cases in a dataset. Recall can be explained by the success of the model in retrieving information. F1 − Score = 2 × Precision × Recall Precision + Recall (7) F1-Score (7) is an evaluation metric to determine the perfor- mance of the model accuracy against the dataset. F1-score is a calculation that involves a combination of precision and recall values. E. GENETIC ALGORITHM,Optimizing IT Governance and Project Management in Software Development through AI Integration and COBIT 2019 Framework,"We applied various machine learning models, accurate predictions, as machine learning models learn from including Random Forest and XGBoost, to improve the the input data, following the principle of 'garbage-in-garbage-out'.","["". We applied various machine learning models, accurate predictions, as machine learning models learn from including Random Forest and XGBoost, to improve the the input data, following the principle of 'garbage-ingarbage-out' [29]. Once they complete the preprocessing steps, the data will be ready for the machine learning model. TABLE II. RESULTS TABLE OF THE FOUR KEY METRICS Metrics ID Description Value D"", "". Percentage of deviations or issues successfully BAI11.06 0.00 Feature engineering is a crucial step in the machine learning addressed Percentage of projects successfully completed process, as it involves creating new features from the existing BAI11.07 on time, with low user resistance, and within 16.67 ones to improve the model's predictive performance. Identify budget Authorized licensed use limited to: Institut Teknologi Sepuluh Nopember. Downloaded on July 14,2025 at 08:18:27 UTC from IEEE Xplore"", "". The research aims to provide practitioners with how modern technology evolved. Machine learning-based tools and workflow allowing efficient machine learning approaches have been adopted throughout science, development and deployment. They highlighted the technology, and industry, allowing a more evidence-based importance of sharing and reusing machine learning decision-making on different aspects of life [1]. Examples models"", "". R. Sungkono, E. O. Putri, H. Azkiyah, and R. Sarno, “Checking is also necessary to develop predictive models using machine Wrong Decision and Wrong Pattern by Using A Graph-based Method,” learning to anticipate cases that will not comply with the SOP in 2021 13th International Conference on Information & Authorized licensed use limited to: Institut Teknologi Sepuluh Nopember. Downloaded on July 14,2025 at 08:18:28 UTC from IEEE Xplore. Restrictions apply."", "". (Konstanz Information Miner) [23], an application for big data analytics, to ensure that the model is scalable and can be The second step is predictive analytics with machine implemented for big data. The model is calculated through learning, which is the main stage of the research methodology""]",True,"Various machine learning models, such as Random Forest and XGBoost, are utilized to enhance predictive accuracy by learning from input data, adhering to the principle of 'garbage-in-garbage-out'.","The retrieved reference discusses the application of machine learning models to improve prediction accuracy, which directly supports the claims made in the source paragraph regarding model accuracy and prediction capabilities."
110,"highly relevant to various incident cases, as shown in Fig 3. Not only is it highly relevant, but it is also highly prioritised evidence in diverse investigation cases. 2) Flight log messages cover events from the drone’s sensors, features, and components, making it one piece of evidence to perform analysis related to different drone software and hardware components. Therefore, analysing the log messages means analysing the whole device for various possible incident scenarios. 3) Flight log messages contain contextual information about the occurring event as a description that involves multiple parts of the drone simultaneously. For example, a certain circumstance fails a feature or an operation, as shown in message group number 4 in Table 1. TABLE 1. Groups of",Severity-Oriented Multiclass Drone Flight Logs Anomaly Detection,"The main contributions of this paper are summarised as follows: 1) Propose Drone Log Severity (DroLoVe), a severity-oriented multiclass anomaly detection approach on drone flight log data.","["". DigitalObjectIdentifier10.1109/ACCESS.2024.3396926 Severity-Oriented Multiclass Drone Flight Logs Anomaly Detection SWARDIANTARASILALAHI 1,(GraduateStudentMember,IEEE), TOHARIAHMAD 1,(Member,IEEE),HUDANSTUDIAWAN 1,(Member,IEEE), EIRINIANTHI 2,ANDLOWRIWILLIAMS 2 1DepartmentofInformatics,InstitutTeknologiSepuluhNopember,Surabaya60111,Indonesia 2SchoolofComputerScienceandInformatics,CardiffUniversity,CF244AGCardiff,U.K"", ""robust predictions, enabling drone operators to detect and Furthermore, Jain et al. [10] proposed a framework for diagnose malfunctions quickly and take corrective actions. sensor data identification and verification. An analysis of a Thestructureofthispaperisasfollows.SectionIIpresents drone’sarchitectureandaforensicmodelwithgenericfeatures previous research relating to the drone log analysis and drone are proposed here in order to enhance the digital investigation forensics"", "". incident. This information could help investigators determine ThispaperproposestheTransformermethodforclassifying whether the crash was due to a malfunction, operator error, drone malfunctions based on telemetry data. By leveraging or external factors such as weather conditions or interference their ability to handle sequential data and capture complex from other sources"", "". There is yet to come incident scenarios to perform case studies to verify the a publicly available dataset of log messages from other performanceoftheproposedmethod,andmakingitpublicly dronemanufacturers.Severalpubliclyavailabledatasetsare available. 64264 VOLUME12,2024"", "". The main ananomaly,aninvestigatorcanadjusttheanalysisobjectives contributionsofthispaperaresummarisedasfollows: targeting a certain level only, depending on the needs and cases. 1) Propose Drone Log Severity (DroLoVe), a severityAs shown in Fig. 1, the drone experiences several events oriented multiclass anomaly detection approach on during a flight. When analysing the flight logs from a droneflightlogdata""]",True,"The proposed Drone Log Severity (DroLoVe) approach provides a severity-oriented multiclass anomaly detection method for analyzing drone flight log data (SWARDIANTARASILALAHI et al., 2024).","The reference discusses a specific method for analyzing drone flight logs, which directly supports the claim about the importance of analyzing flight log messages for understanding incident scenarios."
111,"To do so, several artefacts such as flight logs, images, videos, firmware logs, and controller applications can be analysed, as illustrated in Fig 1. For instance, GPS records can be utilised to reconstruct and analyse the path taken by the drone during a flight . The deviation between the empirical flight and reconstructed paths can happen if the drone encounters a GPS spoofing . Among the published drone forensics studies, popular works include case studies, evidence analysis, tools develop- ment, and forensic framework development . The widely investigated source of evidence is sensor data, such as GPS , which provides a concise diagnosis of a flight to the investigator when performing anomaly detection . In fact, a flight log not",Forensic Investigation of Drone Malfunctions with Transformer,"Barton et al. [11] conducted the research to reconstruct the actions taken by these drones, identify their owners or operators, and extract data from associated mobile devices.","[""robust predictions, enabling drone operators to detect and Furthermore, Jain et al. [10] proposed a framework for diagnose malfunctions quickly and take corrective actions. sensor data identification and verification. An analysis of a Thestructureofthispaperisasfollows.SectionIIpresents drone’sarchitectureandaforensicmodelwithgenericfeatures previous research relating to the drone log analysis and drone are proposed here in order to enhance the digital investigation forensics"", "". with limitations and threats to validity. As drone forensics Furtherfuturestudiesmayincludeexploringthepossibility is an emerging topic, there are very limited public datasets of doing high-level oversampling to introduce the models available. The log messages used in this study are mainly with more log message patterns, producing a dataset with acquired from DJI-made devices"", "". system(UAS)forensics:Dataextraction&analysis,’’ForensicSci.Int., [28] S.ViswanathanandZ.Baig,‘‘Digitalforensicsfordrones:Astudyoftools Digit.Invest.,vol.41,Jun.2022,Art.no.301379. andtechniques,’’inApplicationsandTechniquesinInformationSecurity, [6] E. Mantas and C. Patsakis, ‘‘GRYPHON: Drone forensics in dataflash L.BatinaandG.Li,Eds.Singapore:Springer,2020,pp.29–41. andtelemetrylogs,’’inAdvancesinInformationandComputerSecurity, [29] M. Debinski, F. Breitinger, and P. Mohan, ‘‘Timeline2GUI: N"", "". Section III explains the proposed method, applying process. Also, Barton et al. [11] conducted the research to the Transformer technique to forensics of drone malfunctions. reconstruct the actions taken by these drones, identify their InSectionIV,thediscussionofperformancemethod,followed owners or operators, and extract data from associated mobile by conclusions and future works in Section V. devices. In other research in drone forensics, this paper also analyze II"", "". theexperimentalresults,theTransformerobtainsthehighestF1 In the context of classifying drone malfunctions, the Transscore value of 93.04%. former model can be trained on a dataset of labeled drone Index Terms—drone forensics, forensic investigation, malfunctelemetry data to learn patterns and relationships between the tions, infrastructure, Transformer, Informer, FEDformer drone’s behavior and the root cause of a malfunction. The dataset can include features such as altitude, velocity, battery I""]",True,"Barton et al. conducted research to reconstruct the actions taken by drones and extract data from associated mobile devices, which supports the analysis of flight logs and GPS records in drone forensics.","This reference directly discusses the reconstruction of drone actions and data extraction, which aligns with the source paragraph's focus on analyzing flight logs and GPS records for forensic purposes."
