user_input,retrieved_contexts,response,reference,faithfulness,answer_relevancy
"in improved validation results. Using the previous method, Res U-Net produced the best loss value in the validation set generated from the training dataset in 142 epochs. However, by using our proposed approach, the architecture achieves almost identical results, with a loss value of 0.6838005 over 125 epochs. Thereafter, it continues to improve and displays the best results at 152 epochs. The Dense U-Net result shows the most significant results. Since Dense U-Net requires higher computational power due to the dense block used, the training time of this architecture is generally slower than two other architectures. Using our proposed method, the network training time can be significantly faster. However, our method produces better segmentation results and requires a shorter training","['. First, the direction of 1) U-Net change needed to lower the loss is indicated by the gradient of U-Net is an architecture of CNN used for image segmentation that was first introduced by [7] and has become a pop- the loss function at the tth iteration, or g. Adam calculated t ular choice CNN architecture. Generally, CNNs have layers the first weighted average (m) and the second weighted aversuch as convolutional layers, pooling layers, and fully con- t age (v ) in order to handle this gradient', '. andperformtraining,whichtakestimeandalotofcomputationaleffort.Moredatasetswereneededifwewouldliketo haveabetterresult. U-Net is an convolution network for semantic segmentation. The structure of the U-Net architecture consist of VOLUME10,2022 110329', '. The stability of Link-Net is evident in the smaller standard deviation values for both accuracy and F1-Score loss, along with a higher average F1-Score. It is also more efModel ficient because it reduces the training time by 13% compared Min Max Average to U-Net. In addition, it delivers visually better segmentation U-Net 0.7994 0.9629 0.9027 results. These factors highlight the superior segmentation perLink- formance of Link-Net over U-Net', '. The results of the training indicate that LinkNet has a 13% faster training time when compared to U-Net. designs are inappropriate for medical image processing. AdThe highest training and validation accuracies achieved by vances in medical image processing architecture combined Link-Net are 0.9973 and 0.9941. Link-Net is also superior by ob- with the development of deep learning technology have led to taining the highest F1 Score of 0.9636 throughout the testing a paradigm shift in image segmentation', '. Fig. 3. Segmentation evaluation metrics IV. EXPERIMENTAL RESULT In this section, the dataset used and how it was prepared will be described. Furthermore, the results achieved in the ... ꦏꦃꦺ ꦲ|ꦠꦤ꧀|ꦺ ꦧꦭꦤ꧀|ꦒꦸꦒꦸꦫꦸ|ꦲꦉꦧꦸꦠ˛|ꦏꦤ¸ ꦭ꧀|ꦏꦫꦶꦪꦶꦤ꧀|ꦒꦸꦱ˛ ꦶ|ꦥꦶ experiment will be explained']","Link-Net demonstrates a 13% reduction in training time compared to U-Net, which supports the claim of improved training efficiency in segmentation architectures.","num- ber of parameters is directly proportional to the results of the average loss and average accuracy in training and validation. The U-Net design performs better than Link-Net on average, with smaller training and validation loss values and higher training and validation accuracy values. Table 1 show that the average loss in U-Net is 21% greater than Link-Net, but with the sacrifice of longer training time. So that the Link-Net ar- chitecture provides more stable and parsimonious results. TABLE I. PERFORMANCE SUMMARY OF U-NET AND LINK-NET ARCHITECTURES Training Validation Model U-Net Link- Net Average Loss (St. Dev.) 0.0101 (0.0065) 0.0123 (0.0076) Average Accuracy (St. Dev.) 0.9956 (0.0027) 0.9948 (0.0027) Average Loss (St. Dev.) 0.0188 (0.0194) 0.0216 (0.0057) Average Accuracy (St.",1.0,0.9399257623057964
"company goals by proposing a novel recommendation system for internal business processes, grounded in the COBIT 2019 framework. The system employs graph algorithms to map relationships, semantic similarity measure- ments to align enterprise goals with management objectives, and LSTM combined with TF-IDF methods to analyze and recommend specific activities. Experimental results show that this system optimizes IT management practices, enhances operational efficiency, and ensures regulatory compliance. Additionally, a user-friendly graphical representation of internal business pro- cesses using Neo4j enables stakeholders to visualize complex relationships within the COBIT framework, facilitating informed decision-making. This research advances IT governance practices by providing organizations with a valuable tool to automate and improve IT strategies, effectively achieving business objectives. Index Terms—COBIT 2019, graph algorithms, IT","['. They identified areas for improvement and which uses a weighted graph approach to measure similarprovided recommendations to enhance IT governance, emities in parallel business process models by considering the phasizing effectiveness of COBIT 2019 in managing IT risks. frequency of activity relationships. This method outperforms Thesestudieshighlightthebenefitsofframeworkinimproving traditional approaches like GMA, WGED, WNARS, TPED, IT governance in educational institutions. and Cosine-TDP', '. It is like building a map of knowledge, case study from 3 different companies as input, followed by a preprocessing step, then compares it to Enterprise Goals using whereeachpieceofinformationisapointconnectedtoothers TF-IDF and cosine similarity. Goals with high similarity scores by lines that show how they are linked [2]. trigger a graph query to reveal connected activities', '. III. METHODOLOGY Fig.1showsthemainflowchartfordevelopingthisapplicatfidf(t,d,D)=tf(t,d)×idf(t,D) (1) tion.TheresearchbeginswithmappingelementsfromCOBIT 2019,followedbysubsequentprocesses,ultimatelyproducing Indicates the term frequency of term t in document d, an output in the form of a list of activities that the company and idf(t, D) represents the inverse document frequency of can undertake. term t across the entire document collection D. This formula A', '. Among these frameworks, COBIT is globally recognized Frequency-Inverse Document Frequency (TF-IDF) calculation for overseeing Enterprise Information and Technology (I&T) and measuring similarity between strategy nodes to identify comprehensively, covering all systems regardless of their lo- relevanceandinfluenceamongstrategycomponents.Themain cation within the organization', '. and Cosine-TDP. [12] presents W-LTLDAG, a method that Researchby[4]assessedtheeffectivenessofITgovernance combinesWeighted-LinearTemporalLogic(W-LTL)Treeand at Mandiri University using the COBIT 2019 framework. Weighted Directed Acyclic Graph (wDAG) to enhance the The findings highlighted the critical role of IT governance accuracy of comparing graph-based business process models']","The proposed recommendation system enhances IT governance by identifying areas for improvement and providing recommendations based on a weighted graph approach, which aligns with the COBIT 2019 framework (Referensi 1).","research introduces a novel Activity Recom- mendation System built on the COBIT 2019 framework tailored for Financial Balance Scorecard. The motivation stems from the challenges faced by auditors when identifying essential activities aligned with strategy of a company, often hindered by manual COBIT 2019 guideline navigation. To address this, a system was developed, where inputting the company strategy, triggers the display of recommended activities automatically. The methodology involved creating interconnected nodes from COBIT 2019 Element in Neo4J. This research uses a real strategy plan case study from 3 different companies as input, followed by a preprocessing step, then compares it to Enterprise Goals using TF-IDF and cosine similarity. Goals with high similarity scores trigger a graph query to reveal connected",0.4,0.909017321875111
"assist organizations in managing and optimizing their use of information technology (IT) . landscape, effective IT In today’s rapidly evolving digital governance is essential for organizations to ensure that their IT investments align with business objectives, comply with regulations, and mitigate risks . COBIT 2019 provides a structured approach for organiza- tions to establish, implement, and maintain effective gover- nance over IT. It defines the components necessary to create and sustain a governance system, as well as guidelines for building the most suitable governance system for an enterprise . By utilizing COBIT 2019, organizations can enhance the efficiency, effectiveness, and reliability of their IT usage, while also ensuring compliance with relevant regulations, policies, and standards . One of the key","['. The organizations can prioritize processes, set target capability methodology of this research consists of several main steps, levels, and design effective governance systems for IT which are illustrated in Fig. 1. The following is a detailed projects [17], [18]. Implementing COBIT 2019 in software description of each step: development projects allows for mapping IT resources, prioritization of governance objectives, and alignment of A', '. 2020, pp. Information System Governance using Framework COBIT 2019,” 61–70. doi: 10.1145/3416508.3417119. International Journal of Computer Applications, vol. 174, no. 31, pp. [25] A. E. Karrar, “The Effect of Using Data Pre-Processing by Imputations 23–30, Apr. 2021, doi: 10.5120/ijca2021921253. in Handling Missing Values,” Indonesian Journal of Electrical [7] A. A. Aibinu and E. Papadonikolaki, “Conceptualizing And Engineering and Informatics (IJEEI), vol. 10, no. 2, Apr', '. I. Fianty and M. Brian, “Leveraging COBIT 2019 Framework to 10.1080/00949655.2012.658804. Implement IT Governance in Business Process Outsourcing [35] T. M. Oshiro, P. S. Perez, and J. A. Baranauskas, “How Many Trees in Company,” Journal of Information Systems and Informatics, vol. 5, no. a Random Forest?”, In Machine Learning and Data Mining in Pattern 2, pp. 568–579, May 2023, doi: 10.51519/journalisi.v5i2.492. Recognition: 8th International Conference, MLDM 2012, Berlin, [18] S. Dhir, D. Kumar, and V', 'Optimizing IT Governance and Project Management in Software Development through AI Integration and COBIT 2019 Framework Joko Slamet Hartono Saputro Andy Teguh Department of Informatics Department of Informatics Department of Informatics Institut Teknologi Sepuluh Nopember Institut Teknologi Sepuluh Nopember Institut Teknologi Sepuluh Nopember Surabaya, Indonesia Surabaya, Indonesia Surabaya, Indonesia 6025231063@student.its.ac.id 60252310@student.its.ac.id 6025231047@student.its.ac.id Riyanarto Sarno Kelly', '. Using COBIT metrics, organizations XGBoost 4.29 6.34 0.69 40.45 can evaluate and improve the quality of IT Governance, LightGBM 4.74 7.53 0.56 45.14 ensure compliance with regulatory provisions, and improve CatBoost 4.25 6.53 0.67 36.26 operational efficiency. As a result, these initiatives not only are presented in Table IV using MAE, RMSE, R², and MAPE improve the efficiency of project planning and execution but me trics']","Implementing COBIT 2019 in software development projects enables organizations to map IT resources and prioritize governance objectives, thereby aligning their governance systems with business needs (Saputro et al., 2020).","process, an audit involves acquiring and objectively evaluating evidence related to allegations of economic activities and other operations. The aim is to assess the level of conformity between the reports and predefined criteria, and to communicate the results to relevant users, in this case, the organization responsible for establishing information system gover nan nance. One of the proven frameworks for information system auditing is the Control Objectives for Information and Related Technology (COBIT) 2019, which is utilized as the reference framework in this research . COBIT 2019 offers an effective methodology for evaluating the capability of information technology processes, specifically focusing on Deliver, Service and Support - Operation Management. This framework guarantees that the data (DSS01) is received, managed fully,",0.5,0.8929257951843539
"technology, thus helping them achieve their business objectives more effectively . Several previous papers still rely on manual approaches to COBIT 2019, which have limitations in providing automated recommendations for audit activities based on company goals. Thus, this research contributes significantly by addressing this gap and overcoming the challenges associated with manual COBIT utilization. The primary objective of this paper is to develop a rec- ommendation system that aligns with the internal business process strategy governed by COBIT 2019. This system aims to help organizations manage risk, ensure compliance, and enhance performance in the context of information technology. To achieve this, the research will utilize graph algorithms to build a recommendation system based on the internal business processes outlined in","['. Recommendations based on COBIT 2019 best practices, such as performance measurements and knowledge repository access, further enhance IT governance processes and contribute to the success of software development projects. The integration of AI and machine learning techniques with the COBIT 2019 framework holds promise in further enhancing IT governance practices [19]', '. Previous Research of Audit using COBIT 2019 based on semantic similarities, preprocessing data to calculate PreviousresearchonauditingwithCOBIT2019hasinvestithese similarities and effectively merging nodes and relationgated multiple facets of IT governance and auditing, applying ships. the framework across diverse domains and industries', '. They identified areas for improvement and which uses a weighted graph approach to measure similarprovided recommendations to enhance IT governance, emities in parallel business process models by considering the phasizing effectiveness of COBIT 2019 in managing IT risks. frequency of activity relationships. This method outperforms Thesestudieshighlightthebenefitsofframeworkinimproving traditional approaches like GMA, WGED, WNARS, TPED, IT governance in educational institutions. and Cosine-TDP', '. Survey audits enhance participation still relatively low due to the high variation of trace noise, which and engagement, allowing stakeholders to contribute to affects the outcomes of the process mining models. improving effectiveness and efficiency. Consequently, survey Keywords—COBIT 2019, Event Log, Graph, Process Mining. audits add a qualitative dimension to audit evaluations, facilitating better decision-making and more effective I. INTRODUCTION implementation of improvements', '. After executing the Graph Query utility and influence in enterprise governance and audit manSearch process, 1131 activities related to EG01 and 278 agement. Future upgrades could focus on enhancing the user activities related to EG02 were identified']","The research identifies areas for improvement and provides recommendations to enhance IT governance, emphasizing the effectiveness of COBIT 2019 in managing IT risks (Novel Activity Recommendation System of Financial Balance Scorecard for COBIT 2019 Based on Company Strategy).","process, an audit involves acquiring and objectively evaluating evidence related to allegations of economic activities and other operations. The aim is to assess the level of conformity between the reports and predefined criteria, and to communicate the results to relevant users, in this case, the organization responsible for establishing information system gover nan nance. One of the proven frameworks for information system auditing is the Control Objectives for Information and Related Technology (COBIT) 2019, which is utilized as the reference framework in this research . COBIT 2019 offers an effective methodology for evaluating the capability of information technology processes, specifically focusing on Deliver, Service and Support - Operation Management. This framework guarantees that the data (DSS01) is received, managed fully,",0.75,0.912135821365784
"is linked to the appropriate business objec- tives and control needs, thus enhancing overall governance effectiveness . One effective way to perform this mapping is by utilizing a graph database such as Neo4j . Neo4j is a graph database specifically designed to store and manage data with complex relationships . In the context of COBIT 2019, Neo4j can be utilized to build dynamic graphical representations of various COBIT elements . By using Neo4j, organizations can create dynamic and interactive graphical models to better understand and manage the complex relationships between different COBIT 2019 elements . This allows for deeper analysis, real-time monitoring, and better decision-making in IT management, ultimately aiding in the achievement of business goals . In summary, this","['. They identified areas for improvement and which uses a weighted graph approach to measure similarprovided recommendations to enhance IT governance, emities in parallel business process models by considering the phasizing effectiveness of COBIT 2019 in managing IT risks. frequency of activity relationships. This method outperforms Thesestudieshighlightthebenefitsofframeworkinimproving traditional approaches like GMA, WGED, WNARS, TPED, IT governance in educational institutions. and Cosine-TDP', '. in achieving organizational objectives and emphasized the W-LTLDAG effectively distinguishes between graphs with importance of implementing IT governance practices', '. Recommendations based on COBIT 2019 best practices, such as performance measurements and knowledge repository access, further enhance IT governance processes and contribute to the success of software development projects. The integration of AI and machine learning techniques with the COBIT 2019 framework holds promise in further enhancing IT governance practices [19]', '. Using COBIT metrics, organizations XGBoost 4.29 6.34 0.69 40.45 can evaluate and improve the quality of IT Governance, LightGBM 4.74 7.53 0.56 45.14 ensure compliance with regulatory provisions, and improve CatBoost 4.25 6.53 0.67 36.26 operational efficiency. As a result, these initiatives not only are presented in Table IV using MAE, RMSE, R², and MAPE improve the efficiency of project planning and execution but me trics', '. 2020, pp. Information System Governance using Framework COBIT 2019,” 61–70. doi: 10.1145/3416508.3417119. International Journal of Computer Applications, vol. 174, no. 31, pp. [25] A. E. Karrar, “The Effect of Using Data Pre-Processing by Imputations 23–30, Apr. 2021, doi: 10.5120/ijca2021921253. in Handling Missing Values,” Indonesian Journal of Electrical [7] A. A. Aibinu and E. Papadonikolaki, “Conceptualizing And Engineering and Informatics (IJEEI), vol. 10, no. 2, Apr']","Utilizing COBIT 2019 best practices, including performance measurements, can enhance IT governance processes and support effective decision-making in organizations (Karrar, 2020).","COBIT Core Model and Capability Scores, it is necessary to undergo a mapping process according to the instructions in the COBIT 2019 manual. This can be time-consuming, especially when auditor should auditing multiple companies simultaneously. This research aim to simplify the process to get Activities of COBIT 2019 automatically from Input Text Company Strategy that aligned with the description of related Enterprise Goals. This research adopts Neo4j, a graph database platform, to manage KG and process data related to these objectives, to gain deeper and more applicable insights into the relationships between strategic and operational objectives in a company . Furthermore, this research also involves the function of preprocessing the input text in the form of Company Strat- egy using",0.5,0.9281998533469622
"tool for processing sequential data and learning long-term dependencies, making it a crucial component in many applications of artificial intelligence and machine learn- ing. Choose Suitable Enterprise Goal based on Company Goal by using Similarity LSTM-TF IDF. III. METHODOLOGY III. METHODOLOGY This section outlines the methodology for developing a recommendation system based on COBIT 2019’s internal business processes. The approach integrates data collection, preprocessing, graph database modeling with Neo4j, and rec- ommendation generation using graph algorithms and similarity methods. The complete process shown in figure 1 A. Input Dataset The input dataset comprises information from the COBIT 2019 framework, including internal business processes, control objectives, IT processes, and related elements. Additionally, company-specific goals are incorporated to ensure that the recommendations","['. They identified areas for improvement and which uses a weighted graph approach to measure similarprovided recommendations to enhance IT governance, emities in parallel business process models by considering the phasizing effectiveness of COBIT 2019 in managing IT risks. frequency of activity relationships. This method outperforms Thesestudieshighlightthebenefitsofframeworkinimproving traditional approaches like GMA, WGED, WNARS, TPED, IT governance in educational institutions. and Cosine-TDP', 'Technology Informatics Technology Informatics Technology Institut Teknologi Sepuluh Nopember Institut Teknologi Sepuluh Nopember Institut Teknologi Sepuluh Nopember Surabaya, Indonesia Surabaya, Indonesia Surabaya, Indonesia haznaatthoriqoh@gmail.com siti@if.its.ac.id chastine@if.its.ac.id Muhamma d Alfian Department of Informatics Faculty of Intelligent Electrical and Informatics Technology Institut Teknologi Sepuluh Nopember Surabaya, Indonesia ini.muhalfian@gmail.com Abstract— A recommendation model is', '. It is like building a map of knowledge, case study from 3 different companies as input, followed by a preprocessing step, then compares it to Enterprise Goals using whereeachpieceofinformationisapointconnectedtoothers TF-IDF and cosine similarity. Goals with high similarity scores by lines that show how they are linked [2]. trigger a graph query to reveal connected activities', '. Fig.2. FlowchartofActivityRecommendationSystem The user inputs and the descriptions of the enterprise goals will be compared to determine their similarity percentage. the form of selected enterprise goals based on the similarity The initial process begins with calculating TF-IDF. Then, measurement process. The results of this query are then the process continues with the calculation using the Cosine displayed to the application user. Similarity method', '. This formula A. Mapping COBIT 2019 Element combinesthelocalimportanceofaterminaspecificdocument (term frequency) with its global importance across the entire The research began by identifying Enterprise Goals corredocument collection (inverse document frequency) [21]. latedwiththeBalancedScorecardFinancial.Then,Alignment 5) Cosine Similarity: This process quantifies the similarity Goals related to these Enterprise Goals were mapped. Subsebetween two vectors in a high-dimensional space']","The study identifies areas for improvement and provides recommendations to enhance IT governance, emphasizing the effectiveness of COBIT 2019 in managing IT risks (Novel Activity Recommendation System of Financial Balance Scorecard for COBIT 2019 Based on Company Strategy).","IX, it can serve as an internal reference for the company to assess its capability to meet these criteria and can also serve as a reference for formulating policies to prioritize the implementation of these activities in the future. V. CONCLUSION V. CONCLUSION In conclusion, the developed Activity Recommendation System based on COBIT 2019 framework offers a practical solution to the challenges faced by auditors in identifying and aligning activities with company strategy. By leveraging NLP techniques and graph queries, the system efficiently matches user input of company strategy with relevant activities automatically, eliminating the need for manual navigation through COBIT 2019 guidelines. The effectiveness of the system was demonstrated by in- putting company strategies from three companies in different",0.75,0.8588445553663403
"used as references for the next graph query execution to obtain the required activities. The output matches the mapping results, displaying only activities that correlate with Enterprise Goal EG02, which describes ”Optimization of business process functionality.” Using Algorithm 3, a graphical representation is created, as Fig. 3. Mapping Alignment Goals (AG) Fig. 4. Mapping Objectives illustrated in Figure 5. This graphical representation allows users to easily visualize the need for additional activity recommendations without documentation such as spreadsheets, thereby reducing the need for extra work. V. CONCLUSION V. CONCLUSION This paper propose a novel recommendation system for internal business processes based on the COBIT 2019 frame- work. By integrating graph algorithms and similarity methods, our approach provides tailored activity recommendations","['. They identified areas for improvement and which uses a weighted graph approach to measure similarprovided recommendations to enhance IT governance, emities in parallel business process models by considering the phasizing effectiveness of COBIT 2019 in managing IT risks. frequency of activity relationships. This method outperforms Thesestudieshighlightthebenefitsofframeworkinimproving traditional approaches like GMA, WGED, WNARS, TPED, IT governance in educational institutions. and Cosine-TDP', '. The system provided a list of recommended activities objective.Mostofthegoals(EG03,EG04)shownoalignment that can be undertaken to achieve strategic objectives of each (similarity score of 0), suggesting that these goals do not companies. contribute to or are unrelated to risk reduction', '. It is like building a map of knowledge, case study from 3 different companies as input, followed by a preprocessing step, then compares it to Enterprise Goals using whereeachpieceofinformationisapointconnectedtoothers TF-IDF and cosine similarity. Goals with high similarity scores by lines that show how they are linked [2]. trigger a graph query to reveal connected activities', '. The results show a list of recommended activities based on the company In previous research, as found in the paper [3], [4], [5] strategy, this can simplify the company audit process. and [6] to obtain Activities from the COBIT Core Model Keywords—Audit Management, COBIT 2019, Cosine Similar- and Capability Scores, it is necessary to undergo a mapping ity, Financial, Knowledge Graph, Neo4J process according to the instructions in the COBIT 2019 manual. This can be time-consuming, especially when auditor I', '. An example of the interface to accommodate users with less technical expertise outputisshowninTABLEIX.Asanadditionalnote,thisstudy and improving the integration of the proposed system with was conducted on a company that has not yet implemented existing IT governance frameworks and audit tools used in an IT Governance framework, and therefore lacks integration organizations. Authorized licensed use limited to: Institut Teknologi Sepuluh Nopember. Downloaded on July 14,2025 at 08:18:28 UTC from IEEE Xplore']","The recommendation system identifies activities that correlate with specific enterprise goals, indicating that some goals may not align with risk reduction efforts (Referensi 2).","research introduces a novel Activity Recom- mendation System built on the COBIT 2019 framework tailored for Financial Balance Scorecard. The motivation stems from the challenges faced by auditors when identifying essential activities aligned with strategy of a company, often hindered by manual COBIT 2019 guideline navigation. To address this, a system was developed, where inputting the company strategy, triggers the display of recommended activities automatically. The methodology involved creating interconnected nodes from COBIT 2019 Element in Neo4J. This research uses a real strategy plan case study from 3 different companies as input, followed by a preprocessing step, then compares it to Enterprise Goals using TF-IDF and cosine similarity. Goals with high similarity scores trigger a graph query to reveal connected",0.6666666666666666,0.884557668013754
"the need for extra work. V. CONCLUSION V. CONCLUSION This paper propose a novel recommendation system for internal business processes based on the COBIT 2019 frame- work. By integrating graph algorithms and similarity methods, our approach provides tailored activity recommendations that align with an organization’s strategic goals. We mapped enter- prise goals to management objectives, identified relevant ac- tivities, and used graph queries to retrieve actionable insights. Utilizing Cypher Query Language (CQL) and Neo4j’s graph database, we created an interactive graphical representation of COBIT 2019-governed processes. This allows organizations to visualize relationships between COBIT elements, facilitating deeper analysis, real-time monitoring, and informed IT man- agement decisions. Our results demonstrated the system’s effectiveness in sug- gesting activities tailored to enterprise goals,","['. They identified areas for improvement and which uses a weighted graph approach to measure similarprovided recommendations to enhance IT governance, emities in parallel business process models by considering the phasizing effectiveness of COBIT 2019 in managing IT risks. frequency of activity relationships. This method outperforms Thesestudieshighlightthebenefitsofframeworkinimproving traditional approaches like GMA, WGED, WNARS, TPED, IT governance in educational institutions. and Cosine-TDP', '. It is like building a map of knowledge, case study from 3 different companies as input, followed by a preprocessing step, then compares it to Enterprise Goals using whereeachpieceofinformationisapointconnectedtoothers TF-IDF and cosine similarity. Goals with high similarity scores by lines that show how they are linked [2]. trigger a graph query to reveal connected activities', '. The results show a list of recommended activities based on the company In previous research, as found in the paper [3], [4], [5] strategy, this can simplify the company audit process. and [6] to obtain Activities from the COBIT Core Model Keywords—Audit Management, COBIT 2019, Cosine Similar- and Capability Scores, it is necessary to undergo a mapping ity, Financial, Knowledge Graph, Neo4J process according to the instructions in the COBIT 2019 manual. This can be time-consuming, especially when auditor I', '. The system provided a list of recommended activities objective.Mostofthegoals(EG03,EG04)shownoalignment that can be undertaken to achieve strategic objectives of each (similarity score of 0), suggesting that these goals do not companies. contribute to or are unrelated to risk reduction', '. Recommendations based on COBIT 2019 best practices, such as performance measurements and knowledge repository access, further enhance IT governance processes and contribute to the success of software development projects. The integration of AI and machine learning techniques with the COBIT 2019 framework holds promise in further enhancing IT governance practices [19]']",The proposed recommendation system enhances IT governance by utilizing a weighted graph approach to identify areas for improvement and provide tailored recommendations based on COBIT 2019 effectiveness (Referensi 1).,"research introduces a novel Activity Recom- mendation System built on the COBIT 2019 framework tailored for Financial Balance Scorecard. The motivation stems from the challenges faced by auditors when identifying essential activities aligned with strategy of a company, often hindered by manual COBIT 2019 guideline navigation. To address this, a system was developed, where inputting the company strategy, triggers the display of recommended activities automatically. The methodology involved creating interconnected nodes from COBIT 2019 Element in Neo4J. This research uses a real strategy plan case study from 3 different companies as input, followed by a preprocessing step, then compares it to Enterprise Goals using TF-IDF and cosine similarity. Goals with high similarity scores trigger a graph query to reveal connected",0.4,0.9140794733788931
"graphical representation of COBIT 2019-governed processes. This allows organizations to visualize relationships between COBIT elements, facilitating deeper analysis, real-time monitoring, and informed IT man- agement decisions. Our results demonstrated the system’s effectiveness in sug- gesting activities tailored to enterprise goals, enhancing IT management practices and operational efficiency. The Neo4j visualization tool offers a user-friendly interface for explor- ing COBIT framework relationships, enabling stakeholders to make data-driven decisions. TABLE III SIMILARITY SCORE Enterprise Goal (EG) Optimization of business process functionality Optimization of business process costs Staff skills, motivation and productivity Compliance with internal policies Similarity 0.5701785 0.29179826 0.02301607 0.029643951 M. M. Jawad, M. H. Ali, A. A. Khaleel, and M. F. Hasan, “Evaluating the performance of it management under the implementation","['. They identified areas for improvement and which uses a weighted graph approach to measure similarprovided recommendations to enhance IT governance, emities in parallel business process models by considering the phasizing effectiveness of COBIT 2019 in managing IT risks. frequency of activity relationships. This method outperforms Thesestudieshighlightthebenefitsofframeworkinimproving traditional approaches like GMA, WGED, WNARS, TPED, IT governance in educational institutions. and Cosine-TDP', '. COBIT 2019 offers an COBIT 2019 for DSS01 Objective, particularly as a method effective methodology for evaluating the capability of of collecting and validating data within the process assessment information technology processes, specifically focusing on program. Experiments are conducted by analyzing Deliver, Service and Support (DSS01) - Operation performance and identifying bottlenecks in event logs related Management', '. The results show a list of recommended activities based on the company In previous research, as found in the paper [3], [4], [5] strategy, this can simplify the company audit process. and [6] to obtain Activities from the COBIT Core Model Keywords—Audit Management, COBIT 2019, Cosine Similar- and Capability Scores, it is necessary to undergo a mapping ity, Financial, Knowledge Graph, Neo4J process according to the instructions in the COBIT 2019 manual. This can be time-consuming, especially when auditor I', '. Using COBIT metrics, organizations XGBoost 4.29 6.34 0.69 40.45 can evaluate and improve the quality of IT Governance, LightGBM 4.74 7.53 0.56 45.14 ensure compliance with regulatory provisions, and improve CatBoost 4.25 6.53 0.67 36.26 operational efficiency. As a result, these initiatives not only are presented in Table IV using MAE, RMSE, R², and MAPE improve the efficiency of project planning and execution but me trics', '. Create Graph Database ACT01 ternal and external environmental factors (legal, regula- After the completion of the Mapping process, the next step tory and contractual obligais to create nodes and their relationships using Neo4J Graph tions) and trends in the businessenvironmentthatmayin- DatabaseTools,inordertoconstructaKnowledgeGraphfrom fluencegovernancedesign the mapped results']","The study identified areas for improvement and provided recommendations to enhance IT governance, emphasizing the effectiveness of COBIT 2019 in managing IT risks (Jawad et al., 2023).","COBIT Core Model and Capability Scores, it is necessary to undergo a mapping process according to the instructions in the COBIT 2019 manual. This can be time-consuming, especially when auditor should auditing multiple companies simultaneously. This research aim to simplify the process to get Activities of COBIT 2019 automatically from Input Text Company Strategy that aligned with the description of related Enterprise Goals. This research adopts Neo4j, a graph database platform, to manage KG and process data related to these objectives, to gain deeper and more applicable insights into the relationships between strategic and operational objectives in a company . Furthermore, this research also involves the function of preprocessing the input text in the form of Company Strat- egy using",0.75,0.8939494489532266
"(TP+FP). To determine how well a positive value is found, recall is employed. It applies true positives (TP) to all ground truth values, which include both true positives and false negatives (FN). The F1 score is an evaluation metric that combines a model’s precision and recall scores, as illustrated in the equation that calculates accuracy. The accuracy statistic computes the number of times the iYOLOV7-TPE-SS model predicted accurately throughout the entire dataset , : F1score = 2 · (P · R) (P + R) (13) The system performance of the iYOLOV7-TPE-SS model has been evaluated using a metric known as mean average accuracy (mAP), which takes into account the average recall (AR), F1-score, and inference time. The inference time has","['. This study chose to adopt EfficientNetV2-S, the baseline architecture from this family, due to computational resource reasons to construct a smaller model while still maintaining model performance. The EfficientNetV1 family is the backbone of the EfficientDet family, which has achieved state-of-the-art results on object detection challenges. C. Model Evaluation Evaluation Metrics used in this study to evaluate model performance are precision, recall, and F1 Score', '. PRECISION, RECALL, AND F1 SCORE (IOU @ 50) FOR EACH CLASS Backbone Metrics Healthy Mismngd Smallish Yellowish Dead Average Precision 0.970 0.635 0.871 0.498 0.376 0.670 MobileNetV3-Large Recall 0.987 0.695 0.924 0.886 0.770 0.852 F1 Score 0.978 0.663 0.897 0.637 0.505 0.736 Precision 0.985 0.865 0.929 0.894 0.662 0.867 EfficientNetV2-S Recall 0.968 0.474 0.781 0.859 0.770 0.770 F1 Score 0.977 0.612 0.849 0.876 0.712 0.805 various confidence thresholds and object classes', '. 𝐼𝑜𝑈= 𝐴𝑟𝑒𝑎 𝑜𝑓 𝑂𝑣𝑒𝑟𝑙𝑎𝑝 (4) MobileNetV3 and EfficientNetV2 prioritize efficiency and 𝐴𝑟𝑒𝑎 𝑜𝑓 𝑈𝑛𝑖𝑜𝑛 accuracy, but they achieve this through different The metric mean Average Precision (mAP) is architectural choices. MobileNetV3 enhances the previous introduced in COCO dataset evaluation metrics and is version with squeeze-and-excitation layers and h-swish widely used in object detection studies as a benchmark for non-linearity [18], while EfficientNetV2 focuses on evaluating and comparing model performance', '. The mAP efficient scaling [19]. provides a comprehensive evaluation of the object detection model. mAP considers precision and recall values across Authorized licensed use limited to: Institut Teknologi Sepuluh Nopember. Downloaded on July 14,2025 at 08:18:27 UTC from IEEE Xplore. Restrictions apply.', '. accuracy. This study used two architectures that suit that The TIDE toolbox [24] is used to compute the detection objective in its development, which are MobileNetV3 and error in object detection model performance for in-depth EfficientNetV2. The EfficientNetV2, especially the TABLE IV']","The evaluation metrics employed in the study include precision, recall, and F1 Score, which are essential for assessing model performance (Referensi 1).","with the following formula: TP + TN TP + TN + FP + FN Accuracy = Precision = Recall/True Positive Rate(TPR) TP TP + FP TP TP + FN F1 = 2 × precision × recall precision + recall FP TN + TP (cid:90) 1 TPRd(FPR) False Positive Rate(FPR) = AUC = (4) (5) (6) (7) (8) (9) where TP is the number of correctly predicted positive labels, TN is the number of correctly predicted negative labels, FP is the number of incorrectly predicted positive labels, and FN is the number of incorrectly predicted negative labels. Accuracy is the ratio of true predictions to the overall data. Precision is the ratio between TP to the total number of positive predic-",0.8,0.8898843031684105
"The interesting aspect of the stock transaction dataset is that the standard deviation from TPIA and BRPT is larger than the mean, which means that two stock issuers have high volatility. 2) DATASET OF NEWS HEADLINES The news portal kontan.co.id in the Indonesian language is used as a source of the news dataset with news published dates between 1 January 2017 and 31 May 2024. The news dataset contains the title, description, published date, and category gathered using scraping technique under sections investment, industry, and finance. This research uses the news section in the news portal as an aspect category. The rule of collecting the dataset is the stock issuer ticker is shown explicitly in the news title to distinguish","['. stock market data has a skewed pattern and the usual MSAR Regular tests conducted to gain deeper insights into each 979-8-3315-0510-3/24/$31.00 ©2024 IEEE 274 59832801.4202.21936EEVCI/9011.01 :IOD | EEEI 4202© 00.13$/42/3-0150-5133-8-979 | )EEVCI( gnireenignE lacirtcelE dna noitacudE lanoitacoV no ecnerefnoC lanoitanretnI htneveS 4202 Authorized licensed use limited to: Institut Teknologi Sepuluh Nopember. Downloaded on July 14,2025 at 08:17:35 UTC from IEEE Xplore. Restrictions apply.', '. DigitalObjectIdentifier10.1109/ACCESS.2023.3298445 Transformer-Gated Recurrent Unit Method for Predicting Stock Price Based on News Sentiments and Technical Indicators AGUSTRIHARYONO 1,2,RIYANARTOSARNO 1,(SeniorMember,IEEE), ANDKELLYROSSASUNGKONO 1,(Member,IEEE) 1DepartmentofInformatics,InstitutTeknologiSepuluhNopember,Surabaya60111,Indonesia 2DepartmentofInformatics,UniversitasMulawarman,Samarinda75119,Indonesia Correspondingauthor:RiyanartoSarno(riyanarto@if.its.ac.id)', '. Zhou, Z. Ma, Q. Wen, X. Wang, L. Sun, and R. Jin, ‘‘FEDformer: layer to determine stock price. The TEGRU used various Frequencyenhanceddecomposedtransformerforlong-termseriesforeparameters to produce the best model performance, and casting,’’2022,arXiv:2201.12740. multi-aspect sentiment indicators affected the performance [16] J. Chen, T. Chen, M. Shen, Y. Shi, D. Wang, and X. Zhang, ‘‘Gated three-tower transformer for text-driven stock market prediction,’’ Mulforecasting model top gains issuers', '. The similarity of issuerswithlargemarketcapitalizationisthatthestockprice chart has increased since the IPO date, and the stock price tendstobestablewithinayear.Inthisresearch,inaddition topgain,areused.INDX,SMMT,andHITSaretheissuers to issuers with large market capitalization, issuers with the withthehighestgainsinMarch2022.Stockpriceforecasting highest percentage increase in stock price or also known as uses a combination of extensive market capitalization and 77136 VOLUME11,2023', '. Industry, international, imbalancedtimeseriesforecasting,’’NeuralComput.Appl.,vol.34,no.9, investment, finance, and national sentiment can influence pp.6953–6972,May2022,doi:10.1007/s00521-021-06837-3. [9] P.-F.PaiandC.-S.Lin,‘‘AhybridARIMAandsupportvectormachines stock issuers. The positive and negative sentiment with modelinstockpriceforecasting,’’Omega,vol.33,no.6,pp.497–505, a mostly minimum daily score is selected to increase Dec.2005,doi:10.1016/j.omega.2004.07.024. performancestockforecasting']","The stock price chart for issuers with large market capitalization tends to show stability over time, indicating potential volatility in stock prices (Agustriharyono et al., 2023).","DATASET A. DATASET This sub-section explains the collection, labeling, and prepa- ration of the dataset used in this research. The dataset consists of time series and text; each is prepared independently. 1) DATASET OF NEWS HEADLINES The text dataset used in this work was gathered from the Indonesian news portal at kontan.co.id under the categories investment, finance, industry, national, and international. The scraping technique collects data between 1 January 2017 to 31 March 2022 and produces a title, URL, description, postdate, category, and subcategory. Statistics from collected data are shown in Table 1. To evaluate performance prediction, task classification in text requires ground truth. The dataset already has ground truth for aspect categorization, but sentiment classification does not have the",0.3333333333333333,0.9083566562583046
"titles on each stock issuer based on aspect category. available in English. The trained model siebert/sentiment- roberta-large-english is a binary sentiment classification with an accuracy of 93.2% and is used to determine sentiment polarity, negative and positive. The news dataset contains news published date, aspect category, sentiment polarity, stock ticker, and news title. FIGURE 3. Framework of labeling aspect-sentiment quadruplet. The pair aspect category-sentiment polarity with news trained using various pre-trained models titles was such as indobert-large-p2 , mxbai-embed-large-v1 , multilingual-e5-large , distiluse-base-multilingual- to develop cased-v2 , and bge-base-en-v1.5 VOLUME 12, 2024 178677 A. T. Haryono et al.: pTKANs for Stock Price Forecasting Using Generative ABSA aspect categorization and sentiment classification models. The indobert-large-p2 model is specifically designed for Indonesians,","['. [5] A. T. Haryono, R. Sarno, and R. Abdullah, ‘‘Aspect-based sentiment FIGURE10. ThefeatureforecastingcorrelationofTLKMstockissuer. analysisoffinancialheadlinesandmicroblogsusingsemanticsimilarity and bidirectional long short-term memory,’’ Int. J. Intell. Eng. Syst., vol.15,no.3,pp.233–241,2022.[Online].Available:https://inass.org/wpcontent/uploads/2021/12/2022063020-2.pdf failed stock trend prediction caused a financial loss in the [6] S. Budd, E. C. Robinson, and B. Kainz, ‘‘A survey on active MAEscore', '. Sentiment classifica- resolve stock forecasting tasks. The hybrid model, which tion has been used to accomplish dataset political [21], uses CNN to extract sentiment polarity and combines review[22],hatespeech[23],andfinancial[24].Inpolitical technical indicators to build an LSTM forecasting model, datasets,sentimentclassificationisresolvedusingalexicon producedgoodresultswhenforecastingtheShanghaiStock list sentiment. The appearance of the word lexicon in the Exchange[29]', '. The fourth feature scenario MAPE= 100X n | A t −P t| (12) uses a combination of close stock price and daily aspect n i=1 A t sentimentscoretotestinfluencingaspectsentimentonstock The combined accuracy error score and MAPE equation priceforecastingperformance.Thefifthfeaturescenariouses produced the accuracy mean absolute percentage error a variety of expanded technical indicators and daily aspect (AcMAPE), as shown in Eq. (13)', '. Zhou, Z. Ma, Q. Wen, X. Wang, L. Sun, and R. Jin, ‘‘FEDformer: layer to determine stock price. The TEGRU used various Frequencyenhanceddecomposedtransformerforlong-termseriesforeparameters to produce the best model performance, and casting,’’2022,arXiv:2201.12740. multi-aspect sentiment indicators affected the performance [16] J. Chen, T. Chen, M. Shen, Y. Shi, D. Wang, and X. Zhang, ‘‘Gated three-tower transformer for text-driven stock market prediction,’’ Mulforecasting model top gains issuers', '. aspects, such as corporate, stock, market, and economy The sentiment analysis results in qualitative data cannot be news [5]. The multi-aspect sentiment news represents stock combined with technical indicators in quantitative data to market conditions better and analyzes aspects significantly forecaststockprices.Theprocessingofconvertingqualitative influencingstockpriceforecasting']","The sentiment analysis results in qualitative data cannot be combined with technical indicators in quantitative data to forecast stock prices (Haryono et al., 2022).","learning with VOLUME 11, 2023 77135 A. T. Haryono et al.: Transformer-Gated Recurrent Unit Method for Predicting Stock Price TABLE 1. Statistic dataset of headline news. TABLE 2. Example headlines news on each category and sentiment. FIGURE 2. The method of Indonesian headline news dataset sentiment labeling. an English language-trained model. The labeling method is shown in Fig. 2. The cleaned news title will be translated from Indonesian to English using a translator application. The resulting translated news title will be passed into the sentiment label- ing using a trained model siebert/sentiment-roberta-large- english. The label sentiment complements the ground truth of the headline news dataset. A trained model siebert/sentiment- roberta-large-english has an accuracy of 93.2% in a binary sentiment classification",0.5,0.9207371562332538
"using the mean sentiment score on each day trading, if not found, filled with zero value. The daily stock issuer sentiment score can be combined with stock transaction history. The illustration of the final dataset in the form of panel data is shown in Table. 2. D. FORECASTING MODELS D. FORECASTING MODELS This sub-section presents modified Transformer architec- ture, which are Transformer GRU (FormerGRU), Trans- former LSTM (FormerLSTM), Transformer Encoder GRU (TEGRU), and Transformer Encoder LSTM (TELSTM). Modified Transformer was chosen because TEGRU outper- formed other Transformer variants, such as vanilla Trans- former, Informer, FEDformer, and Transformer Encoder in stock price forecasting . This research proposes permuted Temporal Kolmogorov-Arnold Networks (pTKAN) architec- ture to develop a unified stock forecasting model","['. In previous research, the CNN-BiLSTM combined withgoodperformance.Fine-tunedfromtheRoBERTa-large layerwasusedtobuildastockpriceforecastingmodel,with model [30], siebert/sentiment-roberta-large-english had an the CNN layer processing raw input through an extraction outstanding performance on text classification after being feature,whichwasthenpassedtotheBiLSTMlayertolearn tested on 15 data sets [31]. IndoBERT is an Indonesian predicted stock prices [26]', '. ding, and one Transformer to learn daily social text with 4) TheimpactoftheTEGRUfeatureparameteronstock Bidirectional Encoder Representations from Transformers priceforecastingisanalyzedtoproducealowfinancial (BERT) sentence embedding [16]. The Recurrent Neural riskmodelforeachstockissuer. Network (RNN) architecture has an excellent reputation for The rest of the article is organized as follows: Section II stock forecasting [17], [18]', 'by stock price forecasting using the proposed Transformer Encoder Gated Recurrent Unit (TEGRU)architecture.TheTEGRUconsistsofatransformerencodertolearnpatterntimeseriesdatawith multi-headattentionandpassitintotheGRUlayertodeterminestockprice.Theaccuracymeanabsolute percentageerror(AcMAPE)usestoevaluateforecastingmodelssensitivetothemisclassificationofstock pricetrends.Ourexperimentshowedthatthesentimentindicatorcouldinfluencestockissuersbasedonthe', '. A brief LSTM,andTransformerlayer[19].Ourresearchproposesa review of the literature on predicting stock prices based on combinationofTransformerandGRUarchitecture,inwhich featuresispresentedinthissection,followedbysomerelated theTransformerisalearnerofinputfeatures,andGRUisa worksontheactivelearningmethodandassociatedissuesof learnerofsequencedatatopredictstockprices.Theinputdata transformerarchitectureimplementedwithdatatimeseries', '. DigitalObjectIdentifier10.1109/ACCESS.2023.3298445 Transformer-Gated Recurrent Unit Method for Predicting Stock Price Based on News Sentiments and Technical Indicators AGUSTRIHARYONO 1,2,RIYANARTOSARNO 1,(SeniorMember,IEEE), ANDKELLYROSSASUNGKONO 1,(Member,IEEE) 1DepartmentofInformatics,InstitutTeknologiSepuluhNopember,Surabaya60111,Indonesia 2DepartmentofInformatics,UniversitasMulawarman,Samarinda75119,Indonesia Correspondingauthor:RiyanartoSarno(riyanarto@if.its.ac.id)']","The proposed Transformer Encoder Gated Recurrent Unit (TEGRU) architecture utilizes a transformer encoder to learn patterns in time series data, which is then processed by a GRU layer to forecast stock prices.","forecasting using Transformer Encoder Gated Recurrent Unit (TEGRU). The TEGRU can extract information with a multi-head attention layer and recognize pattern sequence data. The evaluation performance of the forecasting model uses Accuracy Mean Absolute Percentage Error (AcMAPE), which have sensitive to the misclassification of stock price trends. The significant contributions of this paper are summarized as follows. 1) The feature extraction method uses an active learning model to produce a multi-aspect sentiment indicator with time sequence data consideration to describe detailed stock market conditions. 2) The Transformer Encoder Gated Recurrent Unit (TEGRU) architecture, which consists of a Trans- former Encoder as extraction information and GRU as a recognized sequence data pattern, is used in stock price forecasting. 3) The Accuracy",1.0,0.93422421154657
"and radial velocity detection of targets is not discussed yet. The contribution of this paper is in the receiver processing of CC-OFDM-MIMO radar, which is different from those in other types of OFDM MIMO radars or other multi-TRM radars due to the nature of the orthogonal multi-beam generation with Golay-coded OFDM waveforms and subbands. There are previous research on radar waveform for ISAC purposes , which discussed about cyclic prefix (CP) based OFDM waveform and how the CP is very much defining the maximum unambiguous range of the radar system. CC-OFDM MIMO radar waveform design which is discussed in this paper is not a CP based radar, the transmitters are transmitting multiple orthogonal symbols in series without any guard time","['. The latter indicates that the CC OFDM MIMO radar can achieve a high resolution in angle, range, and velocity,withbeamisolationof−30dBforneighboringbeamsandco-channelbeams. INDEX TERMS Array signal processing, circulating-codes, Golay-codes, MIMO-radar, multi-beam, OFDM,software-defined-radar,sub-band,space-timecodes,surveillance. I', '. In the works on the PMIMO radar in [22]–[29], The evaluation on the detection performance in terms of the improvement in radar performance factors such as theprobabilityofdetectionandtheprobabilityoffalsealarm spatial resolution, parameter identifiability, transmit-receive reportedhereinisanextensionofstudyby[32].Theseparam(T-R)gain,andsignal-to-interference-plus-noisepowerratio etersareevaluatedbasedonseveralaspectssuchastheeffect (SINR)hasbeenreported.Theresultsofinvestigationsin[29]', '. By taking as an example the design of long-rangesurveillanceradar,thepaperdiscussesfurtherissuespertinenttotheimplementationoftheCC OFDM MIMO radar, including the beam squinting problem and its remedy, arrangement of the multiple beams, the radar system structure, use of Golay codes for orthogonalization and PAPR mitigation, use of software-definedradarthateliminatestheneedofamplitudeandphasecontrolineachtransmitter,transmit', '. DigitalObjectIdentifier10.1109/ACCESS.2022.3175883 A Transmitter Design for the Multi-beam CC-OFDM Azimuth Scanning MIMO Radar DEVYKUSWIDIASTUTI 1,(StudentMember,IEEE),L.P.LIGTHART 2,(LifeFellow,IEEE), ANDGAMANTYOHENDRANTORO 1,(SeniorMember,IEEE) 1DepartmentofElectricalEngineering,InstitutTeknologiSepuluhNopember,Surabaya60111,Indonesia 2IRCTR,DelftUniversityofTechnology,2628CDDelft,TheNetherlands(Retired) Correspondingauthor:GamantyoHendrantoro(gamantyo@ee.its.ac.id)', '. [30] G. Hakobyan, M. Ulrich, and B. Yang, ‘‘OFDM-MIMO radar with L.P.LIGTHART(LifeFellow,IEEE)wasbornin optimized nonequidistant subcarrier interleaving,’’ IEEE Trans. TheNetherlands,inSeptember1946.Hereceived Aerosp. Electron. Syst., vol. 56, no. 1, pp.572–584, Feb. 2020, doi: 10.1109/TAES.2019.2920044. the degree (cum laude) in engineering and the [31] C.Knill,F.Embacher,B.Schweizer,S.Stephany,andC.Waldschmidt, Ph.D.degreefromtheDelftUniversityofTech‘‘Coded OFDM waveforms for MIMO radars,’’ IEEE Trans']","The CC OFDM MIMO radar can achieve high resolution in angle, range, and velocity, with significant beam isolation, which supports the unique waveform design discussed in this paper.","MIMO radar, intended to produce correlated waveforms with the purpose of acquiring better control over the beampattern. CC have been proposed for application in MIMO radars, originally for optimizing low sidelobes in MIMO radars employing LFM waveforms , but only recently the CC has gained attention in terms of in-depth analysis of LFM waveform optimization . Later in this paper, it can be seen that CC ﬁnd a different role as a consequence of their combination with OFDM waveforms. In this paper, a novel concept of CC-OFDM MIMO† radar is proposed as a solution for the wide-scanning multi-beam radar, which is based on the following principles. Firstly, a train of OFDM pulses are transmitted on an array of transmit antennas",0.8,0.9489026872015527
"much defining the maximum unambiguous range of the radar system. CC-OFDM MIMO radar waveform design which is discussed in this paper is not a CP based radar, the transmitters are transmitting multiple orthogonal symbols in series without any guard time interval between the symbols. to each other, hence The symbol series are orthogonal VOLUME 13, 2025 109895 D. Kuswidiastuti et al.: Receiver Processing of the Multibeam Azimuth Scanning CC-OFDM-MIMO Radar receivers know how to distinguish the symbols received, and this could extend the maximum unambiguous range of the radar. The contributions of this paper are described as follow: 1) This paper describes the receiver processing of multi- beam CC-OFDM MIMO Radar which is designed for long-range radar surveillance application. The","['. The latter indicates that the CC OFDM MIMO radar can achieve a high resolution in angle, range, and velocity,withbeamisolationof−30dBforneighboringbeamsandco-channelbeams. INDEX TERMS Array signal processing, circulating-codes, Golay-codes, MIMO-radar, multi-beam, OFDM,software-defined-radar,sub-band,space-timecodes,surveillance. I', '. DigitalObjectIdentifier10.1109/ACCESS.2022.3175883 A Transmitter Design for the Multi-beam CC-OFDM Azimuth Scanning MIMO Radar DEVYKUSWIDIASTUTI 1,(StudentMember,IEEE),L.P.LIGTHART 2,(LifeFellow,IEEE), ANDGAMANTYOHENDRANTORO 1,(SeniorMember,IEEE) 1DepartmentofElectricalEngineering,InstitutTeknologiSepuluhNopember,Surabaya60111,Indonesia 2IRCTR,DelftUniversityofTechnology,2628CDDelft,TheNetherlands(Retired) Correspondingauthor:GamantyoHendrantoro(gamantyo@ee.its.ac.id)', '(13) herein as the subarrayed MIMO (SMIMO) radars, such as theFPMIMOradar,rangesbetweentwoextremeconfiguraNotation ⊗ denotes the Kronecker product operator, tions, namely the PA and the MIMO radar', '. Hassanien and S. A. Vorobyov, ‘‘Phased-MIMO radar: A tradeoff theAcademicianoftheRussianAcademyofTransport.HeisalsoaFounding betweenphased-arrayandMIMOradars,’’IEEETrans.SignalProcess., vol.58,no.6,pp.3137–3151,Jun.2010,doi:10.1109/TSP.2010.2043976', '. By taking as an example the design of long-rangesurveillanceradar,thepaperdiscussesfurtherissuespertinenttotheimplementationoftheCC OFDM MIMO radar, including the beam squinting problem and its remedy, arrangement of the multiple beams, the radar system structure, use of Golay codes for orthogonalization and PAPR mitigation, use of software-definedradarthateliminatestheneedofamplitudeandphasecontrolineachtransmitter,transmit']","The implementation of CC OFDM MIMO radar involves addressing challenges such as beam squinting, arrangement of multiple beams, and utilizing Golay codes for orthogonalization (Kuswidiastuti et al., 2022).","to realize high gain, which makes the production cost higher. In addition, when operating in beam- scanning mode, the time-on-target achieved by electronically scanning radars is limited. Multi-beam radars, in which multiple beams are formed simultaneously and continuously at both the transmitter and the receiver at different angular directions, can eliminate 53682 This work is licensed under a Creative Commons Attribution 4.0 License. For more information, see VOLUME 10, 2022 D. Kuswidiastuti et al.: Transmitter Design for Multibeam CC-OFDM Azimuth Scanning MIMO Radar the aforesaid problem of limited time-on-target. Multi-beam radar technology is beneﬁcial to various radar applications, such as surveillance , , automotive radar , , radar imaging , , joint multiuser communication and radar , , etc. In",1.0,0.9457389225744827
"the transmitters transmit a frame consisting of 12 consecutive symbols in series. The frame period is 1.2 ms, when the symbols are orthogonal, then the maximum unambiguous range is not only 15 km but 12 times longer (i.e. 180 km). CC-OFDM transmitter and receiver block diagram incor- porates simple transmit and receive modules. Fig. 1 depicts the block diagram of a transmit/receive (T/R) module, which is one out of 101 that constitute the MIMO transmitter system 109896 VOLUME 13, 2025 D. Kuswidiastuti et al.: Receiver Processing of the Multibeam Azimuth Scanning CC-OFDM-MIMO Radar FIGURE 1. Block diagram of a transmit receive module of CC-OFDM MIMO radar. TABLE 1. CC-OFDM MIMO radar system specifications for surveillance applications. of the surveillance radar.","['. The latter indicates that the CC OFDM MIMO radar can achieve a high resolution in angle, range, and velocity,withbeamisolationof−30dBforneighboringbeamsandco-channelbeams. INDEX TERMS Array signal processing, circulating-codes, Golay-codes, MIMO-radar, multi-beam, OFDM,software-defined-radar,sub-band,space-timecodes,surveillance. I', '. DigitalObjectIdentifier10.1109/ACCESS.2022.3175883 A Transmitter Design for the Multi-beam CC-OFDM Azimuth Scanning MIMO Radar DEVYKUSWIDIASTUTI 1,(StudentMember,IEEE),L.P.LIGTHART 2,(LifeFellow,IEEE), ANDGAMANTYOHENDRANTORO 1,(SeniorMember,IEEE) 1DepartmentofElectricalEngineering,InstitutTeknologiSepuluhNopember,Surabaya60111,Indonesia 2IRCTR,DelftUniversityofTechnology,2628CDDelft,TheNetherlands(Retired) Correspondingauthor:GamantyoHendrantoro(gamantyo@ee.its.ac.id)', 'requirement for minimum RCS of 100 m2 at the maximum symbolsandframesofsymbols.Consequently,theadoption rangeof180km.Inordertohaveahighersensitivityatthe of the concept of software-defined radar (SDR) platform maximum range, it is possible to make the radar to operate is advantageous and instrumental in the CC-OFDM MIMO inlowpowermodeforshortrangedetectionandhigh-power radar, promotes the flexibility of the radar and opens up modeforthelong-rangeradar.Thelow-powermodewiththe', '. However, one could extend the surveillance radar has been described to clarify the con- maximum unambiguous range of the radar by sendceptanddemonstratethepotentialissuesandadvantagesof ingmultiplesuccessiveorthogonalCC-OFDMsymbols the CC-OFDM MIMO radar', '. As will be demonstrated in this paper, it is ditional phased array radar results in limited time on target, possible to sparse the total OFDM bandwidth into multiple CC-OFDM MIMO radar could give a much longer time on carrier sets, i.e., sub-bands, responsible for beamforming to target because multiple beams in CC-OFDM radar can be the specified direction. Orthogonality between the OFDM transmittedsimultaneouslyovermuchlongertimeintervals']","The CC-OFDM MIMO radar can achieve a maximum unambiguous range of 180 km by transmitting multiple successive orthogonal symbols (Kuswidiastuti et al., 2022).","symbols and frame transmission and reception schedul- ing, including the low/high-power modes, beam processing at the receiver by parallel processing, range and Doppler processing involving OFDM symbols and frames. VOLUME 10, 2022 53683 D. Kuswidiastuti et al.: Transmitter Design for Multibeam CC-OFDM Azimuth Scanning MIMO Radar beamforming applications, SDR technology is preferred for its ﬂexibility and low cost , . In our case, the SDR implements all baseband processing at the transmitter and the receiver, including generating inter-element delay required for the application of CC at the transmitter. Beamforming design that meets the required maximum beamwidth in the azimuth is achieved by determining the suitable number of elements employed on the horizontal axis. A good beam pattern can be obtained",0.3333333333333333,0.9576992178314822
"for the n-th subcarrier for symbol a in beam b is given by gn,a,b, with the sampling period of Ts. The maximum unambiguous range, Rmax, will depend on the OFDM symbol period of T0. However, by transmitting Ns orthogonal symbols in series can extend the maximum range up to Ns times further. According to the waveform specification in Table 1, the 12 symbols are transmitted in series over 12T0 to extend the maximum range from 15 up to 180 km. The beams and the CC-OFDM symbols are Golay VOLUME 13, 2025 109897 D. Kuswidiastuti et al.: Receiver Processing of the Multibeam Azimuth Scanning CC-OFDM-MIMO Radar coded and transmitted using the allocated sub-band following a specific schedule that is well known","['. The latter indicates that the CC OFDM MIMO radar can achieve a high resolution in angle, range, and velocity,withbeamisolationof−30dBforneighboringbeamsandco-channelbeams. INDEX TERMS Array signal processing, circulating-codes, Golay-codes, MIMO-radar, multi-beam, OFDM,software-defined-radar,sub-band,space-timecodes,surveillance. I', '. DigitalObjectIdentifier10.1109/ACCESS.2022.3175883 A Transmitter Design for the Multi-beam CC-OFDM Azimuth Scanning MIMO Radar DEVYKUSWIDIASTUTI 1,(StudentMember,IEEE),L.P.LIGTHART 2,(LifeFellow,IEEE), ANDGAMANTYOHENDRANTORO 1,(SeniorMember,IEEE) 1DepartmentofElectricalEngineering,InstitutTeknologiSepuluhNopember,Surabaya60111,Indonesia 2IRCTR,DelftUniversityofTechnology,2628CDDelft,TheNetherlands(Retired) Correspondingauthor:GamantyoHendrantoro(gamantyo@ee.its.ac.id)', '. isillustratedashavingaradarbeamthatcoversaspanofthe In this manner, the FPMIMO radar can achieve a desired azimuthangle', 'requirement for minimum RCS of 100 m2 at the maximum symbolsandframesofsymbols.Consequently,theadoption rangeof180km.Inordertohaveahighersensitivityatthe of the concept of software-defined radar (SDR) platform maximum range, it is possible to make the radar to operate is advantageous and instrumental in the CC-OFDM MIMO inlowpowermodeforshortrangedetectionandhigh-power radar, promotes the flexibility of the radar and opens up modeforthelong-rangeradar.Thelow-powermodewiththe', '. SNR for target [11] G. Krieger, ‘‘MIMO-SAR: Opportunities and pitfalls,’’ IEEE Trans. range detection can be optimized by varying the number of Geosci. Remote Sens., vol. 52, no. 5, pp.2628–2645, May 2014, doi: orthogonalsymbolsperframe. 10.1109/TGRS.2013.2263934. Sincemostprocessesmainlydependonthearrangementof [12] D.-S.JangandH.-L.Choi,‘‘Interleavedradarpulseschedulingformultitargettrackingwithmultiplesimultaneousreceivebeams,’’IEEETrans. thetransmittedwaveformsandtheprocessingofthereceived Aerosp']","The maximum unambiguous range of the CC-OFDM MIMO radar can be extended up to 180 km by transmitting multiple orthogonal symbols in series (Kuswidiastuti et al., 2022).","the high PAPR of the OFDM signal. If orthogonal codes are given to successive OFDM symbols, it could also provide orthogonality between 53684 VOLUME 10, 2022 D. Kuswidiastuti et al.: Transmitter Design for Multibeam CC-OFDM Azimuth Scanning MIMO Radar the OFDM symbols, which in turn can extend the maxi- mum unambiguous range of the radar. The orthogonalities between OFDM subcarriers and between OFDM symbols allow OFDM radar to produce a range and Doppler proﬁle independent from each other . This is one of the advan- tages of using OFDM instead of LFM as radar waveform. The above considerations motivate the development of digitally generated beam steering without phase shifter, by providing phase control of the signal directly from waveform generation",0.3333333333333333,0.9448525955261964
"The beams and the CC-OFDM symbols are Golay VOLUME 13, 2025 109897 D. Kuswidiastuti et al.: Receiver Processing of the Multibeam Azimuth Scanning CC-OFDM-MIMO Radar coded and transmitted using the allocated sub-band following a specific schedule that is well known by the transmitter and receiver. The neighboring beam must use different sub-band and sub-band reuse is allowed for beams that are at least 10◦ in separation. In order to generate CC-OFDM waveform, additional phase steering β(fn,a,b, (cid:49)tb) is given to the specified OFDM sub-band frequencies of beam b to provide phase difference between the transmit elements for creating the beam b. Circulating code in LFM MIMO radar which is discussed in , obtain this phase difference by transmitting coherent signals","['. The latter indicates that the CC OFDM MIMO radar can achieve a high resolution in angle, range, and velocity,withbeamisolationof−30dBforneighboringbeamsandco-channelbeams. INDEX TERMS Array signal processing, circulating-codes, Golay-codes, MIMO-radar, multi-beam, OFDM,software-defined-radar,sub-band,space-timecodes,surveillance. I', '. DigitalObjectIdentifier10.1109/ACCESS.2022.3175883 A Transmitter Design for the Multi-beam CC-OFDM Azimuth Scanning MIMO Radar DEVYKUSWIDIASTUTI 1,(StudentMember,IEEE),L.P.LIGTHART 2,(LifeFellow,IEEE), ANDGAMANTYOHENDRANTORO 1,(SeniorMember,IEEE) 1DepartmentofElectricalEngineering,InstitutTeknologiSepuluhNopember,Surabaya60111,Indonesia 2IRCTR,DelftUniversityofTechnology,2628CDDelft,TheNetherlands(Retired) Correspondingauthor:GamantyoHendrantoro(gamantyo@ee.its.ac.id)', '. isillustratedashavingaradarbeamthatcoversaspanofthe In this manner, the FPMIMO radar can achieve a desired azimuthangle', '(13) herein as the subarrayed MIMO (SMIMO) radars, such as theFPMIMOradar,rangesbetweentwoextremeconfiguraNotation ⊗ denotes the Kronecker product operator, tions, namely the PA and the MIMO radar', 'D.Kuswidiastutietal.:TransmitterDesignforMultibeamCC-OFDMAzimuthScanningMIMORadar theaforesaidproblemoflimitedtime-on-target.Multi-beam OFDM MIMO waveform [31]. A set of orthogonal waveradar technology is beneficial to various radar applications, formscanbesimplyacquiredbyarrangingtheallocationof suchassurveillance[3],[4],automotiveradar[5],[6],radar orthogonal subcarriers into different antennas of the MIMO imaging[7],[8],jointmultiusercommunicationandradar[9], radar system']","The CC OFDM MIMO radar can achieve high resolution in angle, range, and velocity, with beam isolation of −30 dB for neighboring beams (Kuswidiastuti et al., 2022).","beams pointing at increasing scan angles. In a previous patent , simultaneous multiple beams are generated using OFDM multiple antennas being fed at different points along a trans- mission line providing delay or phase differences between successive antennas, but the use of such a physical delay source limits its capability and ﬂexibility. On the other hand, OFDM signals with various delays can be produced with CC by ﬂexibly exploiting a programmable waveform gener- ator (WG). In the CC-OFDM MIMO radar, a novel technique can be used further to mitigate beam broadening for large scanning angles. In a way, the strategy of CC-OFDM MIMO radar can be viewed as a realization of hybrid between phased array and MIMO techniques , .",1.0,0.947699870740595
"the specified OFDM sub-band frequencies of beam b to provide phase difference between the transmit elements for creating the beam b. Circulating code in LFM MIMO radar which is discussed in , obtain this phase difference by transmitting coherent signals with a small time delay difference ((cid:49)tb) between the antenna element. However, using an OFDM signal, this phase steering can be provided by giving a phase difference to the OFDM subcarrier phase in the frequency domain of the OFDM signal generation stage. The phase steering given to the CC-OFDM waveform can be defined as follow: β(fn,a,b, (cid:49)tb) = 2πfn,a,b(cid:49)tb Hence, the array factor of CC-OFDM will be: AF(θ, fn,a,b, (cid:49)tb) = Nt −1 2X Ipejp(α(θ)+β(fn,a,b,(cid:49)tb) where α(θ) = p=− Nt","['. Hassanien and S. A. Vorobyov, ‘‘Phased-MIMO radar: A tradeoff theAcademicianoftheRussianAcademyofTransport.HeisalsoaFounding betweenphased-arrayandMIMOradars,’’IEEETrans.SignalProcess., vol.58,no.6,pp.3137–3151,Jun.2010,doi:10.1109/TSP.2010.2043976', '. ified delay between successive antennas of a MIMO radar, Multiple simultaneous beams can be generated by employ- intended to produce correlated waveforms with the purpose ing a number of transceivers operating individually, each of acquiring better control over the beampattern. CC have attached to an antenna with a beam pointing at a specified been proposed for application in MIMO radars, originally direction, in total covering a specified angular range', '. DigitalObjectIdentifier10.1109/ACCESS.2020.2965192 FPMIMO: A General MIMO Structure With Overlapping Subarrays for Various Radar Applications SYAHFRIZALTAHCFULLOH 1,2,(StudentMember,IEEE),AND GAMANTYOHENDRANTORO 1,(SeniorMember,IEEE) 1DepartmentofElectricalEngineering,InstitutTeknologiSepuluhNopember,Surabaya60111,Indonesia 2DepartmentofElectricalEngineering,UniversitasBorneoTarakan,Tarakan77123,Indonesia Correspondingauthor:SyahfrizalTahcfulloh(syahfrizal15@mhs.ee.its.ac.id)', '. INDEX TERMS MIMO radar, parameter estimation, phased array radar, probability of detection, target detection. I. INTRODUCTION for biomedical engineering, macro-scale radars on radioMulti-antenna radar systems have been known and used in astronomy, and so on [4], [5]', '. With this advantage, PA radars ject [6]–[18]. Unlike the PA radar, the MIMO radar utilizes have been used for such applications as micro-scale radars manyantennasthattransmitorthogonalsignalstoobtainthe signal reflected from the target at the receiver, a scheme The associate editor coordinating the review of this manuscript and known as waveform diversity [9]. Consequently, MIMO approvingitforpublicationwasDimitrisE.Anagnostou']","Multiple simultaneous beams can be generated by employing a number of transceivers operating individually to produce correlated waveforms for better control over the beampattern (Hassanien and Vorobyov, 2010).","signal is circulated from one antenna element to another with a relatively small time-delay differ- ence ((cid:49)t), made possible by circulating codes (CC) , , . Hence the transmit signal from the p-th element for a transmit antenna array with an odd number of elements, Nt , can be written as: xp(t) = x(t − p(cid:49)t), Nt − 1 , . . . , Nt − 1 (1) The time delay difference of the circulating signal corre- sponds to a phase difference between the antenna elements at a given frequency: (cid:49)ϕ = 2πf (cid:49)t (2) It means that the phase steering that is usually provided by a phase shifter at each antenna element now can be realized directly in the",0.5,0.8896739051590166
"together with transmit scheduling to avoid transmit receive coupling. The receive scheduling is also related to the time scheduling of the correlation between symbols, which is an important stage in the beam and range processing. The transmit and receive time schedule of CC-OFDM radar is described in Fig. 4. The receive scheduling is very important, especially in a multiple target scheme. The echo signals caused by two or more targets at different ranges (i.e., one target is near to the radar, and the other is far) could cause range ambiguity. The clock synchronization between the multiple transmitters and the multiple receivers of CC-OFDM radars are very crucial to guarantee that the receiver can give the accurate detection. It can be","['. −∞ However, the ambiguity function of CC-OFDM radar ii. χ fu θ n 0 , c a t (cid:48) i = o a n = a 1 s ,b a (cid:48)= fu b ( n τ c , ti f o D n = of 0 ti , m θ e ,(cid:49) de t l b a ) y is va th ri e ab ra le d , a τ r , a a m nd bi a g n u g i u ty is a multi-dimensional function', '. The latter indicates that the CC OFDM MIMO radar can achieve a high resolution in angle, range, and velocity,withbeamisolationof−30dBforneighboringbeamsandco-channelbeams. INDEX TERMS Array signal processing, circulating-codes, Golay-codes, MIMO-radar, multi-beam, OFDM,software-defined-radar,sub-band,space-timecodes,surveillance. I', '. However, one could extend the surveillance radar has been described to clarify the con- maximum unambiguous range of the radar by sendceptanddemonstratethepotentialissuesandadvantagesof ingmultiplesuccessiveorthogonalCC-OFDMsymbols the CC-OFDM MIMO radar', '. atall-time.Thismeansalongertimeontargetincomparison Thiswilllimitthemaximumpowerthattheradarcould totheconventionalphasedarrayradar,allowingforimproved transmit to avoid saturation problems due to coupling. accuracy in target position [22], [42], [43]. Multiple beams Inacontinuouswave(CW)radarsystem,thetransmitter of CC-OFDM radar will further allow the application of a and receiver are always active', '. followingcertaincriteria.Advantagesofthisschemefollow IntheCC-OFDMMIMOradar,anoveltechniquecanbe from those of LFM radars, but the range-Doppler coupling usedfurthertomitigatebeambroadeningforlargescanning remainsaproblem.Inthelatter,theFDAradarsapplyasmall angles.Inaway,thestrategyofCC-OFDMMIMOradarcan frequency increment on consecutive elements across the be viewed as a realization of hybrid between phased array transmit array, which induces range-time-dependent phase and MIMO techniques [35], [36]']","The CC OFDM MIMO radar can achieve high resolution in angle, range, and velocity, which is crucial for accurate detection in multiple target scenarios (A Transmitter Design for the Multi-beam CC-OFDM Azimuth Scanning MIMO Radar).","In our case, quasi-continuous transmission is used through proper scheduling of OFDM transmission and echoes reception to prevent the coupling. • The receiver that continuously receives signal echoes coming from multiple targets must be able to distinguish which targets are very near or very far from the radar. This is the reason in this paper that orthogonal codes are given to successive CC-OFDM symbols. These unique codes are given and known by the receiver, so that the receiver could properly detect and distinguish targets nearby and far away from the radar. In this paper we describe the waveform design of a CC-OFDM quasi-continuous wave for MIMO long the range radar. Quasi-CW transmission could limit leakage/coupling problem by time-isolation of the",0.6,0.926873191615772
"correlation function between the received signals with the reference signal can be derived as follow: χyx(θ, θ ′, τ, τ0, fD) = σ ejϑ R4 2NsT0X (cid:26) (Nt −1) 2X (Nt −1) 2X k=0 p=− (Nt −1) q=− (Nt −1) {IpIqejpα(θ)e−jqα(θ ′) Nc−1 Nc−1 n=0 m=0 (cid:26) Cn,p,a,bC ∗ m,q,a′,b′gn,a,bgm,a′,b′ × ej2πkTs(fIF +fn,a,b+fD) × e−j2πkTs(fIF +fm,a′,b′ ) × ej2πfn,a,b[p(cid:49)tb−(a−1)T0] × e−j2πfm,a′,b′ [q(cid:49)tb−(a′−1)T0]ej2π(τ −τ0)(fIF +fn,a,b) (cid:27)(cid:27) (14) PNc−1 Because the subcarrier frequency of the OFDM signal and the Golay codes are orthogonal, then the term PNc−1 m=0 gn,a,bgm,a′,b′ = 0 for n ̸= m, a ̸= a′, n=0 or b ̸= b′, hence the cross correlation, χyx(θ, θ ′, τ, τ0, fD) will be zero. The correlation function value will be","['transmission is used through proper orthogonalitybetweentheCC-OFDMsymbolsisbeneficial schedulingofOFDMtransmissionandechoesreception in obtaining an optimum SNR for increasing the maximum topreventthecoupling', '. The Golay code is bined.ThenthereceivedRFsignalgoesthroughtheanalog applied in the frequency domain of the OFDM signal and receiverchain,whichconsistofLNAandtheRFtoIFdown- then the signal is phase shifted by pβ(f n,a,b ,(cid:49)t b ), with p = converters', '. [30] G. Hakobyan, M. Ulrich, and B. Yang, ‘‘OFDM-MIMO radar with L.P.LIGTHART(LifeFellow,IEEE)wasbornin optimized nonequidistant subcarrier interleaving,’’ IEEE Trans. TheNetherlands,inSeptember1946.Hereceived Aerosp. Electron. Syst., vol. 56, no. 1, pp.572–584, Feb. 2020, doi: 10.1109/TAES.2019.2920044. the degree (cum laude) in engineering and the [31] C.Knill,F.Embacher,B.Schweizer,S.Stephany,andC.Waldschmidt, Ph.D.degreefromtheDelftUniversityofTech‘‘Coded OFDM waveforms for MIMO radars,’’ IEEE Trans', '. coupled with the use of Golay codes to reduce PAPR and [7] T.X.H.Luo,W.W.L.Lai,R.K.W.Chang,andD.Goodman,‘‘GPR to improve orthogonality between symbols. Orthogonalities imagingcriteria,’’J.Appl.Geophysics,vol.165,pp.37–48,Jun.2019,doi: amongsymbolsandbeamsresultfromthecombinedeffects 10.1016/j.jappgeo.2019.04.008', '. Since the number of Golay codes are limited x p R , F a,b (t)=x p IF ,a 2 ,b (t)ej2πfRFt ∗h RF (t) (24) (there are in total 256 available Golay codes that can where f = 3GHz − f − f , while h (t) and h (t) RF IF2 IF IF2 RF beusedfor256-subcarrierOFDMsymbols),codereuse denote the impulse responses of the filters used to suppress becomes inevitable']","The use of Golay codes is essential for improving the orthogonality between symbols in OFDM systems, which is crucial for reducing cross-correlation effects (A Transmitter Design for the Multi-beam CC-OFDM Azimuth Scanning MIMO Radar).","frequency fa,n,b of the b-th beam, and C (cid:48)∗ m,q,a(cid:48),b(cid:48) denotes the complex conjugate of the correction phase of the received CC-OFDM symbols, given to the m-th carrier frequency of b(cid:48)-th beam, which use subcarrier fa(cid:48),m,b(cid:48). For the surveillance In the following, various ambiguity functions, each a func- tion of beam, of delay and of Doppler frequency, are pre- sented with transmitter time, sub band and codes scheduling for symbol-1 as visually described in Table 2. Based on the ambiguity function formulation in (32), the analyses are described as follows: i. χa(cid:48)=a=1,b(cid:48)=b(τ = 0, fD = 0, θ0, θ, (cid:49)tb) is the radar ambiguity function analyzed by taking a variable value of θ0 as a function of angular variable, θ.",0.3333333333333333,0.9046609841532537
"B. DOPPLER PROCESSING SIMULATION AND ANALYSIS B. DOPPLER PROCESSING SIMULATION AND ANALYSIS In this subsection, the Doppler processing of a moving target is analyzed. For the Doppler processing in this paper, we set VOLUME 13, 2025 109903 D. Kuswidiastuti et al.: Receiver Processing of the Multibeam Azimuth Scanning CC-OFDM-MIMO Radar echoes received from targets. Beams that receive echoes by targets in their respective directions can be identified correctly by correlating the sum of signals containing echoes from all receive modules with individual signals transmitted individual beams. Correlations are done per symbol, and after delay compensation, coherence processing is done for all the 12 symbols. The simulation results based on the detection of 2 targets at 3 different scenarios show that","['. The latter indicates that the CC OFDM MIMO radar can achieve a high resolution in angle, range, and velocity,withbeamisolationof−30dBforneighboringbeamsandco-channelbeams. INDEX TERMS Array signal processing, circulating-codes, Golay-codes, MIMO-radar, multi-beam, OFDM,software-defined-radar,sub-band,space-timecodes,surveillance. I', '. ified delay between successive antennas of a MIMO radar, Multiple simultaneous beams can be generated by employ- intended to produce correlated waveforms with the purpose ing a number of transceivers operating individually, each of acquiring better control over the beampattern. CC have attached to an antenna with a beam pointing at a specified been proposed for application in MIMO radars, originally direction, in total covering a specified angular range', '. DigitalObjectIdentifier10.1109/ACCESS.2022.3175883 A Transmitter Design for the Multi-beam CC-OFDM Azimuth Scanning MIMO Radar DEVYKUSWIDIASTUTI 1,(StudentMember,IEEE),L.P.LIGTHART 2,(LifeFellow,IEEE), ANDGAMANTYOHENDRANTORO 1,(SeniorMember,IEEE) 1DepartmentofElectricalEngineering,InstitutTeknologiSepuluhNopember,Surabaya60111,Indonesia 2IRCTR,DelftUniversityofTechnology,2628CDDelft,TheNetherlands(Retired) Correspondingauthor:GamantyoHendrantoro(gamantyo@ee.its.ac.id)', 'D.Kuswidiastutietal.:TransmitterDesignforMultibeamCC-OFDMAzimuthScanningMIMORadar theaforesaidproblemoflimitedtime-on-target.Multi-beam OFDM MIMO waveform [31]. A set of orthogonal waveradar technology is beneficial to various radar applications, formscanbesimplyacquiredbyarrangingtheallocationof suchassurveillance[3],[4],automotiveradar[5],[6],radar orthogonal subcarriers into different antennas of the MIMO imaging[7],[8],jointmultiusercommunicationandradar[9], radar system', '. INDEX TERMS MIMO radar, parameter estimation, phased array radar, probability of detection, target detection. I. INTRODUCTION for biomedical engineering, macro-scale radars on radioMulti-antenna radar systems have been known and used in astronomy, and so on [4], [5]']","The CC OFDM MIMO radar can achieve high resolution in angle, range, and velocity, with beam isolation of −30 dB for neighboring beams and co-channel beams (Kuswidiastuti et al., 2022).","symbols and frame transmission and reception schedul- ing, including the low/high-power modes, beam processing at the receiver by parallel processing, range and Doppler processing involving OFDM symbols and frames. VOLUME 10, 2022 53683 D. Kuswidiastuti et al.: Transmitter Design for Multibeam CC-OFDM Azimuth Scanning MIMO Radar beamforming applications, SDR technology is preferred for its ﬂexibility and low cost , . In our case, the SDR implements all baseband processing at the transmitter and the receiver, including generating inter-element delay required for the application of CC at the transmitter. Beamforming design that meets the required maximum beamwidth in the azimuth is achieved by determining the suitable number of elements employed on the horizontal axis. A good beam pattern can be obtained",1.0,0.9497119041638677
"and at the same beam direction, in this case around the range resolution of the radar, which is 60 meter are also can be distinguished with PSLL of −45 dB. The simulation results show that the coupling between beams and symbols are very low as the result of codes and sub-band scheduling at the transmitter. These results are valid for the three scenarios whether the targets are in the same beam, at the nearest neighboring beams and at the nearest co-channel beams. It shows that with the concept proposed in CC-OFDM MIMO Radar, it is possible to design a long-range radar with low power transmission by transmitting multi-orthogonal CC-OFDM symbols in series, to improve the Signal-to-Noise of the radar system.","['. The latter indicates that the CC OFDM MIMO radar can achieve a high resolution in angle, range, and velocity,withbeamisolationof−30dBforneighboringbeamsandco-channelbeams. INDEX TERMS Array signal processing, circulating-codes, Golay-codes, MIMO-radar, multi-beam, OFDM,software-defined-radar,sub-band,space-timecodes,surveillance. I', '. DigitalObjectIdentifier10.1109/ACCESS.2022.3175883 A Transmitter Design for the Multi-beam CC-OFDM Azimuth Scanning MIMO Radar DEVYKUSWIDIASTUTI 1,(StudentMember,IEEE),L.P.LIGTHART 2,(LifeFellow,IEEE), ANDGAMANTYOHENDRANTORO 1,(SeniorMember,IEEE) 1DepartmentofElectricalEngineering,InstitutTeknologiSepuluhNopember,Surabaya60111,Indonesia 2IRCTR,DelftUniversityofTechnology,2628CDDelft,TheNetherlands(Retired) Correspondingauthor:GamantyoHendrantoro(gamantyo@ee.its.ac.id)', '(13) herein as the subarrayed MIMO (SMIMO) radars, such as theFPMIMOradar,rangesbetweentwoextremeconfiguraNotation ⊗ denotes the Kronecker product operator, tions, namely the PA and the MIMO radar', '. ified delay between successive antennas of a MIMO radar, Multiple simultaneous beams can be generated by employ- intended to produce correlated waveforms with the purpose ing a number of transceivers operating individually, each of acquiring better control over the beampattern. CC have attached to an antenna with a beam pointing at a specified been proposed for application in MIMO radars, originally direction, in total covering a specified angular range', '. By taking as an example the design of long-rangesurveillanceradar,thepaperdiscussesfurtherissuespertinenttotheimplementationoftheCC OFDM MIMO radar, including the beam squinting problem and its remedy, arrangement of the multiple beams, the radar system structure, use of Golay codes for orthogonalization and PAPR mitigation, use of software-definedradarthateliminatestheneedofamplitudeandphasecontrolineachtransmitter,transmit']","The CC OFDM MIMO radar can achieve high resolution in angle, range, and velocity, with beam isolation of −30 dB for neighboring and co-channel beams (Kuswidiastuti et al., 2022).","the transmitter design for long-range surveillance radar has been described to clarify the concept and demonstrate the potential advan- tages of the CC-OFDM MIMO radar. By using the proposed design, a range resolution of 52 meter and an azimuth resolu- tion of 1.7◦ can be achieved. For the multi-beam scheme, the beam isolation of −30 dB can be achieved for both between the co-channel beams and between the neighboring beams. The receiver design of CC-OFDM radar, including the beam, range and Doppler processing of the received signal will be discussed in a separate paper.",1.0,0.940809183894559
"with the following formula: TP + TN TP + TN + FP + FN Accuracy = Precision = Recall/True Positive Rate(TPR) TP TP + FP TP TP + FN F1 = 2 × precision × recall precision + recall FP TN + TP (cid:90) 1 TPRd(FPR) False Positive Rate(FPR) = AUC = (4) (5) (6) (7) (8) (9) where TP is the number of correctly predicted positive labels, TN is the number of correctly predicted negative labels, FP is the number of incorrectly predicted positive labels, and FN is the number of incorrectly predicted negative labels. Accuracy is the ratio of true predictions to the overall data. Precision is the ratio between TP to the total number of positive predic-","["". These metrics can be calculated by (1) – (3). This study's calculation of True Positive, False Positive, and False Negative differs from other classifications or detections [20]-[23]. These are chosen and calculated following previous studies [1]. Precision detects the truly correct prediction out of all predictions. Recall detects the truly correct prediction out of all actual classes. F1 scores are harmonic mean between these two that measure overall model performance"", '. performance evaluation score, where the highest accuracy Following the definition in the previous paragraph, we plot is under 85%, the model needs further improvement so that the frequency of each misclassification type in Fig 13 and thedetectionvaliditycanbeenhancedandthatthedetection Fig 14', '. This function is prevalently utilized in binary classification scenarios to ascertain the likelihood of data points belonging to one of two categories, producing an output value ranging between 0 and 1, which is conducivetoprobabilityinterpretation.Conversely,thesoftmax FIGURE12. AccuracyandF1-scoreofMHA-CovBimodelcorrespondingto functionistailoredformulticlassclassificationcontexts,gendifferentoptimizationalgorithms. erating a probability distribution across numerous classes', 'that could be vital for accurate classification [40]', '. Accuracy = (15) Based on the sampling result on 659 data, the dataset TP+TN +FP+FN used in this study is arranged as shown in detail in Table 3. TP Recall(Sensitivity) = (16) In the dataset, there are 11 initial features, since not all TP+FN initial features are used to create the model. They had to TP Precision(P) = (17) go through the feature extraction process first to obtain the TP+FP features used to create the model detection']","The metrics of precision and recall, which measure the accuracy of predictions and actual classes respectively, along with the F1 score as a harmonic mean of these two, are essential for evaluating model performance (Referensi 1).","(TP+FP). To determine how well a positive value is found, recall is employed. It applies true positives (TP) to all ground truth values, which include both true positives and false negatives (FN). The F1 score is an evaluation metric that combines a model’s precision and recall scores, as illustrated in the equation that calculates accuracy. The accuracy statistic computes the number of times the iYOLOV7-TPE-SS model predicted accurately throughout the entire dataset , : F1score = 2 · (P · R) (P + R) (13) The system performance of the iYOLOV7-TPE-SS model has been evaluated using a metric known as mean average accuracy (mAP), which takes into account the average recall (AR), F1-score, and inference time. The inference time has",0.8,0.9244369417095422
"exhib- ited better performance than the MobileNet model, in which the models achieved an accuracy of 85% and 84.52%, respectively. Furthermore, the ResNet-101 model achieved a higher recognition performance of 88.37%, while the MobileNetV2 achieved the performance with an accuracy of 85.46% and a precision, recall, and F1 of 91%, 84%, and 85%, respectively. Furthermore, we performed more experi- ments using several different architectures i.e., DenseNet169, InceptionResNetV2, Xception, and EfﬁcientNetB4 that yielded accuracy of 88.76%, 87.16%, 89.31%, and 88.21%, respectively. The highest accuracy achieved by the benchmark models was only 89.31%. Our previous study proposed a data aug- mentation technique based on neural style transfer and geo- metric transformation to address the scantiness of Balinese carving data , which increased","['. 9. The comparison of VGG19 style transfer images with different Nitik style. The used layers from left to right are ""conv1_1"", weighting factor compositions ""conv2_1"", ""conv3_1"", ""conv4_1"", and ""conv5_1"". C. Survey Results Fig. 9 displays a comparison of a few generated images The survey managed to garner 216 responses. There are using the VGG19 model with different weighting factor six sections in this survey. The first section of the settings each', '. [6] and Ihsan [7]. The VGG19 study. architecture was regarded as the best neural network model to perform style transfer on batik-style images. Among its layers, II. RELATED WORKS the layer ""conv3_1"" performs better than other layers in the Simonyan and Zisserman [1] introduced the convolutional same network. The study concluded that batik-style transfer neural network architecture named VGG. This architecture images can be regarded as a form of batik art', '. However, the study of Wang et al. [3] I. INTRODUCTION and Ihsan [7] pointed out that architectures with better accuracy struggle to properly migrate over the features of style One of the computer vision applications involves image images. Although the former study introduced a novel recognition. In 2015, Simonyan and Zisserman [1] presented stylization to improve other architectures, literature about their work regarding large-scale image recognition', '. They neural style transfer and batik image are only a few. introduced the convolutional neural network (CNN) VGG16 and VGG19. The latter neural network architecture was then The goal of this study is to perform a thorough study of implemented by Gatys et al. [2] to produce high-quality transferring features of batik-style images using the VGG artistic images. The result of their work introduced the architectures', '. The D. Data Collection and Analysis convolutional layer “conv5_1” of both neural networks was used to represent content image features. As for the style Several data were collected in this study. When style image, the experiment used the layers “conv1_1”, “conv2_1”, transfer was performed, the information about its time “conv3_1”, “conv4_1”, and “conv5_1” to store the style computation and loss values were recorded aside from representation similar to Gatys et al. [2]. The models were producing new images']",,"Results from the performance evaluation for CNN, BiLSTM, BiGRU, CNN-BiGRU, HWE-CBiGRU without attention, and HWE-CBiGRU with soft attention, with respect to accu- racy, recall, precision, and F1 score, are presented in Table 4. The conventional CNN architecture produced good per- formance with an accuracy, recall, precision, and F1 score of 84.35%, 86.24%, 84.26%, and 85.24%, respectively. The BiLSTM model obtained a lower accuracy and F1 score of 81.24% and 84.84%, respectively, compared to CNN despite having a relatively high recall rate. Mean- while, the BiGRU model obtained the highest accuracy, recall, precision, and F1 score among the baseline mod- els, with a value of 85.46%, 87.80%, 86.85%, and 86.31%, respectively. The CNN-BiGRU model exhibited enhanced accuracy and F1 score in",0.0,0.0
"process, an audit involves acquiring and objectively evaluating evidence related to allegations of economic activities and other operations. The aim is to assess the level of conformity between the reports and predefined criteria, and to communicate the results to relevant users, in this case, the organization responsible for establishing information system gover nan nance. One of the proven frameworks for information system auditing is the Control Objectives for Information and Related Technology (COBIT) 2019, which is utilized as the reference framework in this research . COBIT 2019 offers an effective methodology for evaluating the capability of information technology processes, specifically focusing on Deliver, Service and Support - Operation Management. This framework guarantees that the data (DSS01) is received, managed fully,","["". INTRODUCTION implementation of improvements. Audit system with Control Objectives for Information and Audit with COBIT 2019 and process mining from event Related Technologies (COBIT) is a process that refers to a logs represents a holistic approach to evaluating and framework designed to assist organizations in managing and enhancing the effectiveness of an organization's information controlling information technology more effectively [1], [2]. systems [12]"", '. Previous Research of Audit using COBIT 2019 based on semantic similarities, preprocessing data to calculate PreviousresearchonauditingwithCOBIT2019hasinvestithese similarities and effectively merging nodes and relationgated multiple facets of IT governance and auditing, applying ships. the framework across diverse domains and industries', '. systems [12]. Through the use of the COBIT 2019 framework, COBIT provides comprehensive guidance for identifying, auditors can pinpoint key controls necessary to achieve establishing, and monitoring the necessary controls within the predefined business objectives. Meanwhile, event log process IT environment to achieve defined business objectives [3], [4]', '. 2020, pp. Information System Governance using Framework COBIT 2019,” 61–70. doi: 10.1145/3416508.3417119. International Journal of Computer Applications, vol. 174, no. 31, pp. [25] A. E. Karrar, “The Effect of Using Data Pre-Processing by Imputations 23–30, Apr. 2021, doi: 10.5120/ijca2021921253. in Handling Missing Values,” Indonesian Journal of Electrical [7] A. A. Aibinu and E. Papadonikolaki, “Conceptualizing And Engineering and Informatics (IJEEI), vol. 10, no. 2, Apr', '. This system aims COBIT 2019, which stands for Control Objectives for to help organizations manage risk, ensure compliance, and Information and Related Technologies, is a comprehensive enhanceperformanceinthecontextofinformationtechnology']",The COBIT 2019 framework provides comprehensive guidance for identifying and monitoring necessary controls within the IT environment to achieve defined business objectives (Referensi 3).,"assist organizations in managing and optimizing their use of information technology (IT) . landscape, effective IT In today’s rapidly evolving digital governance is essential for organizations to ensure that their IT investments align with business objectives, comply with regulations, and mitigate risks . COBIT 2019 provides a structured approach for organiza- tions to establish, implement, and maintain effective gover- nance over IT. It defines the components necessary to create and sustain a governance system, as well as guidelines for building the most suitable governance system for an enterprise . By utilizing COBIT 2019, organizations can enhance the efficiency, effectiveness, and reliability of their IT usage, while also ensuring compliance with relevant regulations, policies, and standards . One of the key",0.75,0.8817753498300056
"the Deliver, Service, and Support (DSS) domain to assess the performance of the system and the standards the governance capabilities at the Customer Care unit using the COBIT framework, specifically within the Deliver, Service, and Support (DSS) domain. The primary focus is on assessing process controls related to Information Technology (IT) services and technical support. Data collection is conducted through surveys to support this evaluation. This study adopts a novel approach in identifying COBIT processes, specifically DSS01, through process mining techniques rather than traditional surveys. Process mining utilizes event logs recorded from daily operations. This technique enables real-time process analysis by applying various analytical methods to process these logs. This approach provides deeper and more accurate insights into the effectiveness","['. Business process governance and potential bottleneck activities. control were evaluated using the COBIT 2019 methodology. The findings indicated that out of 30,000 case IDs, the majority Audit with surveys is an effective method for gathering activity sequence pattern that conformed to the SOP was found essential information to evaluate a process or system [11]. in 97.55% of cases', "". insights into the performance of the organization's information Thus, the system audit with COBIT helps organizations systems, along with recommendations for more effective IT improve the reliability, security, and operational efficiency in management. Thus, audit with COBIT and process mining managing their information technology"", '. 3) EG10: Staff Skills: This process focuses on improving This allows for deeper analysis, real-time monitoring, and the skills of IT staff to enhance the organization’s better decision-making in IT management, ultimately aiding abilitytomanageITeffectivelyandincreaseoperational in the achievement of business goals [11]. efficiency', '. An analysis of the method\'s Manage Service Levels,"" addresses the management and performance using an event log from a bank\'s credit establishment of service levels within the scope of an application process revealed that it was 100% accurate in organization\'s IT [22]. Within DSS01, organizations are identifying incorrect patterns and judgments', '. Using COBIT metrics, organizations XGBoost 4.29 6.34 0.69 40.45 can evaluate and improve the quality of IT Governance, LightGBM 4.74 7.53 0.56 45.14 ensure compliance with regulatory provisions, and improve CatBoost 4.25 6.53 0.67 36.26 operational efficiency. As a result, these initiatives not only are presented in Table IV using MAE, RMSE, R², and MAPE improve the efficiency of project planning and execution but me trics']","The study demonstrates that utilizing surveys is an effective method for gathering essential information to evaluate process controls, as indicated by findings from a COBIT 2019 analysis of 30,000 case IDs.","guidance for understanding, planning, and implementing effective and efficient IT management principles . By adopting COBIT 2019, organizations can improve their IT performance, reduce risks, and ensure that IT is used to support the achievement of business objectives optimally. Domain DSS01 in COBIT 2019, titled ""Define and Manage Service Levels,"" addresses the management and establishment of service levels within the scope of an organization's IT . Within DSS01, organizations are required to identify specific service requirements, including performance and reliability criteria, and manage user expectations regarding IT services. Additionally, this domain also covers the measurement and monitoring of service performance, as well as the adjustment processes necessary to ensure that the services provided remain in line with established standards. III.",1.0,0.893959881074687
"workflow progress and delivering important insights . A major benefit of this method is its ability to use existing database logs, which can decrease the time and cost needed for data collection. Furthermore, using recorded data can reduce the likelihood of information distortion. Given its capability to analyze log data across different systems, process mining has become popular among companies aiming to examine their processe Thus, process mining not only plays a role in improving operational efficiency but also in enhancing the overall quality of healthcare services. This study discusses how process mining can be implemented to support information system audits based on COBIT 2019 for DSS01 Objective, particularly as a method of collecting and validating data within the process","["". INTRODUCTION implementation of improvements. Audit system with Control Objectives for Information and Audit with COBIT 2019 and process mining from event Related Technologies (COBIT) is a process that refers to a logs represents a holistic approach to evaluating and framework designed to assist organizations in managing and enhancing the effectiveness of an organization's information controlling information technology more effectively [1], [2]. systems [12]"", '. Survey audits enhance participation still relatively low due to the high variation of trace noise, which and engagement, allowing stakeholders to contribute to affects the outcomes of the process mining models. improving effectiveness and efficiency. Consequently, survey Keywords—COBIT 2019, Event Log, Graph, Process Mining. audits add a qualitative dimension to audit evaluations, facilitating better decision-making and more effective I. INTRODUCTION implementation of improvements', "". mining enables auditors to delve into the event log data In auditing systems with COBIT, auditors use COBIT generated by information systems to visually map process standards and principles to evaluate the maturity and flows. By combining these two approaches, auditors can effectiveness of internal controls within an organization's IT conduct in-depth analyses of system compliance with COBIT system [5]"", '. Previous Research of Audit using COBIT 2019 based on semantic similarities, preprocessing data to calculate PreviousresearchonauditingwithCOBIT2019hasinvestithese similarities and effectively merging nodes and relationgated multiple facets of IT governance and auditing, applying ships. the framework across diverse domains and industries', "". In this study, data claim process paths that are not in accordance with the SOP from the finance module of the hospital's ERP system was using process mining techniques and the COBIT 2019 explored to determine bottleneck activities in the invoice framework. The research method used involves analyzing procedure. Using anonymised event logs, this study aims to insurance claim log data using the DISCO application to map find causality in the hospital's billing process and identify the sequence of activities""]","Auditors utilize COBIT standards to assess the maturity and effectiveness of internal controls in information systems, which aligns with the implementation of process mining for data validation in audits (Identifying Non-Conforming Process in Automobile Insurance Claims Using Process Mining and COBIT 2019).","audits enhance participation and engagement, allowing stakeholders to contribute to improving effectiveness and efficiency. Consequently, survey audits add a qualitative dimension to audit evaluations, facilitating better decision-making and more effective implementation of improvements. Audit with COBIT 2019 and process mining from event logs represents a holistic approach to evaluating and enhancing the effectiveness of an organization's information systems . Through the use of the COBIT 2019 framework, auditors can pinpoint key controls necessary to achieve predefined business objectives. Meanwhile, event log process mining enables auditors to delve into the event log data generated by information systems to visually map process flows. By combining these two approaches, auditors can conduct in-depth analyses of system compliance with COBIT standards and identify noises",0.6666666666666666,0.9086482830301794
"stage is performance analysis, where the effectiveness and efficiency of the billing processes are reviewed to identify potential areas for improvement. Overall, these stages are crucial to ensure that the billing practices at the hospital are conducted efficiently and transparently. A. Dataset The ""Hospital Billing"" event log was obtained from the financial module of the ERP system used by a regional hospital , This log records various incidents related to the billing of medical services provided by the hospital. Over a three-year period, from 2013 to 2016, a random sample of 100,000 traces was collected, each representing a recorded example of the process in the system. Within this event log, there are 18 different activities, each depicting distinct stages in","[""Institut Teknologi Sepuluh Nopember Institut Teknologi Sepuluh Nopember Surabaya 60111, Indonesia Surabaya 60111, Indonesia riyanarto@its.ac.id kelly@its.ac.id Abstract -- The background of this research is facing Prema et al [10] use process mining techniques to examine challenges in identifying process paths that are not in a regional hospital's billing procedure"", '. This is Machado, “Discovery of Hospital Billing Process in a Regional due to the high variation in trace noise, which affects the Hospital Using Process Mining,” in 2023 International Conference on outcomes of the process mining models. Third, analysis of Advancement in Data Science, E-learning and Information System case duration showed significant differences in the time (ICADEIS), IEEE, Aug. 2023, pp. 1–5. doi: required to complete a case', '. I. INTRODUCTION Automaticdiscoveryoftheprocessmodelsfromtheevent Automatic discovery of process models from event logs logssignificantlycontributestoorganizations,fromfinance, makesasignificantcontributiontomanyorganizations,from health, industry, government, and many others, in capturing finance,health,industry,government,andmanyotherfields, amodeldescriptionoftheexecutionofbusinessprocessesin incapturingdescriptionsofbusinessprocessexecutionmod- the field [1]']","The analysis of the hospital billing process highlights the impact of trace noise on the outcomes of process mining models (Machado, 2023).","organizations improve the reliability, security, and operational efficiency in managing their information technology. , Prema et al use process mining techniques to examine a regional hospital's billing procedure. This study emphasizes how crucial it is to increase the billing process' effectiveness in order to give patients higher-quality care. In this study, data from the finance module of the hospital's ERP system was explored to determine bottleneck activities in the invoice procedure. Using anonymised event logs, this study aims to find causality in the hospital's billing process and identify potential bottleneck activities. Audit with surveys is an effective method for gathering essential information to evaluate a process or system . Using carefully crafted questionnaires, auditors directly collect data from individuals or",1.0,0.937428679619642
"Long Short-Term Memory (LSTM) , is a variation of Recurrent Neural Networks (RNN) that has been successfully applied to various Natural Language Processing (NLP) tasks. LSTM has the ability to capture long-range dependencies with sequences making it suitable for solving sequence labeling problems , , , such as Named Entity Recognition tagging (POS-Tag) and Neural (NER), Part-of-Speech combining (NMT). Study Machine Translation Bidirectional LSTM (BiLSTM) model with Conditional Random Field (CRF) to solve NER and POS-Tag Task. BiLSTM encodes word or character vectors into features, while CRF is a classifier to predict the target labels. Previous research has explored enhancing the feature extractor by integrating serves attention mechanisms with existing models or introducing alternative extractors such as Convolutional Neural Networks","['. Softmaxbehavioronvectorsindifferentscales. NERproblem.Combiningthepreviousstate-of-the-artNER model, BiLSTM, with CRF has proven to improve performance [56]. In this paper, CRF is used as the decoder for allencodercombinationsinourexperiment.Foranobserved sequence x = (cid:104)x x ... x (cid:105) with the corresponding tar1 2 n get label y = (cid:104)y y ..', '. Therefore, this research aims to propose the use of log message data to discover and extract some incident-related information using a deep learning-based NLP technique,i.e.,namedentityrecognitionusingtheTransformer.Cosinesimilarityisproposedasasubstitute fordot-productintheself-attentionmechanismoftheTransformerencoderlayer.Additionally,wepropose NER architecture built from a mix of several existing methods and report the performance evaluation', '. D. CONDITIONALRANDOMFIELDLAYER In sequence labeling tasks, such as NER, CRF is a commonmethodused.Accordingtostudies,theHiddenMarkov ModelandtheMaximumEntropyMarkovModel(MEMM) are ineffective at analyzing sentence-level sequences comparedtotheCRFapproach[15].ThemainCRFfeaturesthat can compute cross-position label combination probability grab the researchers’ attention to apply this method to the FIGURE4. Softmaxbehavioronvectorsindifferentscales', '. For the pre-trained word embedding, either attentionmechanism. GloVe or BERT is used to obtain the words’ vector repre- The presence of contextual pre-trained word embedding sentation.Unscaledattentionisreportedtobebetterusedin has positively impacted NLP research recently. The main NER since mentioned entities commonly consist of a few advantageofcontextualoverstaticpre-trainedwordembedwords only [37]', '. Conversely, machine learning methods, especially deep the capacities of Bidirectional Long Short-Term Memory learning, learn from large datasets to identify word patterns (BiLSTM) networks, enhancing the processing of sequential and boundaries, proving more effective for languages with data by capturing contextual information from both preceding intricate structures [18], [23], [28], [29]. and subsequent text elements']",The combination of the BiLSTM model with Conditional Random Fields (CRF) has been shown to enhance performance in Named Entity Recognition tasks.,"concept of concatenating the word’s vector representation with the Bidirectional Long Short-Term Memory (LSTM) layer output. The Conditional Random Field (CRF) layer is 3260 VOLUME 11, 2023 S. Silalahi et al.: Transformer-Based NER on Drone Flight Logs to Support Forensic Investigation used to decode the concatenated output since it can determine how the sequence labels relate to one another. Most of the work involved in implementing deep learning models is predominantly spent on ﬁguring out how to prepare adequate input representations. Most often, word embedding techniques like GloVe , Word2vec , BERT , and ELMo are used to learn the input representation. Pre- trained language models, such as BERT and ELMo, can generate contextualized representational vectors after going through a",1.0,0.9063784551587273
"as runtime logs that are constantly generated during the operational period of the device. The information recorded in log data is highly valuable for many purposes, including running system monitoring, running process conformance checks, and overall system evaluation . The use of log data is critical when incident cases occur, as the empirical events and incident scenarios can be discovered by analysing the log artefacts. Assuming that 64252 2024 The Authors. This work is licensed under a Creative Commons Attribution-NonCommercial-NoDerivatives 4.0 License. For more information, see VOLUME 12, 2024 S. Silalahi et al.: Severity-Oriented Multiclass Drone Flight Logs Anomaly Detection the integrity of the log is guaranteed, log data is one of the artefacts with the highest priority for investigating","['. Inspired by the study, anomalous events on drone objective[33].Anotheralternativetoleveragethepre-trained flight logs can be detected by analysing log messages and model is fine-tuning the models using prompts [34]. With identifying suspect key phrases closely related to drone onlyafewtrainingdata,themodelcancapturethesemantics incident scenarios. Therefore, the region of interest in this of the input logs and detect anomalous log sequences well', '. DigitalObjectIdentifier10.1109/ACCESS.2025.3580056 Interpretable Ordinal-Aware With Contrastive-Enhanced Anomaly Severity Detection on UAV Flight Log Messages SWARDIANTARASILALAHI 1,(GraduateStudentMember,IEEE), TOHARIAHMAD 1,(Member,IEEE),HUDANSTUDIAWAN 1,(Member,IEEE), EIRINIANTHI 2,ANDLOWRIWILLIAMS 2 1DepartmentofInformatics,InstitutTeknologiSepuluhNopember,Surabaya60111,Indonesia 2SchoolofComputerScienceandInformatics,CardiffUniversity,CF244AGCardiff,U.K', '. [8] S. Silalahi, T. Ahmad, and H. Studiawan, ‘‘Drone flight log anomaly severityclassificationviasentenceembedding,’’inProc.Int.Conf.Artif. [30] S. Han, Q. Wu, H. Zhang, B. Qin, J. Hu, X. Shi, L. Liu, and X. Yin, Intell.,Blockchain,CloudComput.,DataAnal.(ICoABCD),Nov.2023, ‘‘Log-basedanomalydetectionwithrobustfeatureextractionandonline pp.100–105. learning,’’IEEETrans.Inf.ForensicsSecurity,vol.16,pp.2300–2311, 2021', '. encoder for anomaly detection. A similar study exploits Performing anomaly detection using a sequence-based theabundanceofpre-trainedtransformermodelstoperform approach is commonly conducted by training RNN-based anomalydetectionbyusingsentimentanalysisondroneflight models using a dataset containing a collection of a series log messages [6], which then expanded to multiclass in [9]. of events', '. [13] M. Memarzadeh, B. Matthews, and T. Templin, ‘‘Multiclass anomaly [35] C.Duan,T.Jia,Y.Li,andG.Huang,‘‘AcLog:Anapproachtodetecting detectioninflightdatausingsemi-supervisedexplainabledeeplearning anomaliesfromsystemlogswithactivelearning,’’inProc.IEEEInt.Conf. model,’’J.Aerosp.Inf.Syst.,vol.19,no.2,pp.83–97,Feb.2022. WebServices(ICWS),Jul.2023,pp.436–443. [14] Z.You,L.Cui,Y.Shen,K.Yang,X.Lu,Y.Zheng,andX.Le,‘‘Aunified [36] T.-A. Pham and J.-H']","Anomalous events on drone flight logs can be detected by analysing log messages, highlighting the importance of log data in incident investigation (Silalahi et al., 2024).","highly relevant to various incident cases, as shown in Fig 3. Not only is it highly relevant, but it is also highly prioritised evidence in diverse investigation cases. 2) Flight log messages cover events from the drone’s sensors, features, and components, making it one piece of evidence to perform analysis related to different drone software and hardware components. Therefore, analysing the log messages means analysing the whole device for various possible incident scenarios. 3) Flight log messages contain contextual information about the occurring event as a description that involves multiple parts of the drone simultaneously. For example, a certain circumstance fails a feature or an operation, as shown in message group number 4 in Table 1. TABLE 1. Groups of",0.3333333333333333,0.9570223949406362
"particular system log may need different techniques from one type to another. Generally, log-based anomaly detection can be performed using either point, collective, or contextual approaches. In the log-based anomaly detection literature, most of the existing studies propose either a contextual or collective approach, where the decision is taken by examining a sequence of log events. However, detecting abnormalities in log data can be performed using a point-based approach, where one single log record is the only feature needed. Therefore, several studies explored utilising a point-based approach to detect anomalous events on logs data, such as in operating systems , , drone devices , and distribution systems , . In the drone context, a log message contains a description of","['. Existing anomaly detection modelling techniques can be conducted either in a point, contextual, or collective setting. Point anomaly FIGURE4. Anillustrationofanomaliesthatoccurduringadrone’sflight. detectioncharacteriseseachlogentry,whetheraneventisan abnormalityoranormalevent.Forinstance,ifausertypesthe wrong password when trying to gain access to an operating inclusive', 'S.Silalahietal.:InterpretableOrdinal-AwareWithContrastive-EnhancedAnomalySeverityDetection approach is presented in Section III. The experimental settingsandprocedurearedescribedinSectionIV,whilethe results,findings,anddiscussionsareelaboratedinSectionV. Finally,weconcludethepaperinSectionVI. II. RELATEDWORKS A. LOG-BASEDANOMALYDETECTION Log-based anomaly detection is relatively well-studied, includingincorporatingML[1]anddeeplearning-based[18], [19] to facilitate log anomaly detection', '. system remains a topic of interest for the cybersecurity A common approach is the log-based anomaly detecresearch and practitioner communities, such as those in tion approach, which involves the analysis of log entries recorded by systems either in sequence-based or pointThe associate editor coordinating the review of this manuscript and based modelling techniques, considering the case and data characteristics[1]. approvingitforpublicationwasYangTang', '. Therefore, this paper proposes a multitask-based systemprompt,thegeneratedlogmessagecanbeconsidered multiclass drone anomaly detection to assist in a forensic as an anomaly [7], [20], [21]. As for contextual anomaly, investigation. The main contributions of this paper are the detection involves analysing some contextually related summarizedasfollows: attributes to determine whether a log entry is an anomaly', '. e thatundergoesadoublenegation.Therefore,considering 5 Another closely related study fine-tuned several pre-trained the context when performing sentiment analysis to detect LLMs to detect anomalous log entries in a point-based anomaliesindronelogmessagesiscrucial,especiallywhen approach[6].However,existingstudiesonlydetectwhether thelogmessagesfromdifferentclassessharecommonwords an event or subsequent event is an anomaly. In a forensic orphrases']","Existing anomaly detection modelling techniques can be conducted either in a point, contextual, or collective setting, with point anomaly detection characterizing each log entry as either an abnormality or a normal event (Silahi et al.).","Existing anomaly detection modelling techniques can be conducted either in a point, contextual, or collective setting. Point anomaly detection characterises each log entry, whether an event is an abnormality or a normal event. For instance, if a user types the wrong password when trying to gain access to an operating system prompt, the generated log message can be considered as an anomaly , , . As for contextual anomaly, the detection involves analysing some contextually related attributes to determine whether a log entry is an anomaly. As an example, the flight path taken by a drone during a flight is recorded in longitude and latitude coordinates. These data can be used to detect an anomaly by finding a peculiar value",0.8,0.9510314509991452
"several studies explored utilising a point-based approach to detect anomalous events on logs data, such as in operating systems , , drone devices , and distribution systems , . In the drone context, a log message contains a description of occurring events which are triggered by various components such as sensors, peripherals, and firmware. Analysing the log message means analysing events from all aspects of the drone, including sensors, components and features . Typically, existing log-based anomaly detection stud- ies classify log events into two categories: normal and anomaly . This is helpful in an online setting, where the number of detected abnormalities in a certain period of time is considerably small. However, in a digital forensic setting, where the","['robust predictions, enabling drone operators to detect and Furthermore, Jain et al. [10] proposed a framework for diagnose malfunctions quickly and take corrective actions. sensor data identification and verification. An analysis of a Thestructureofthispaperisasfollows.SectionIIpresents drone’sarchitectureandaforensicmodelwithgenericfeatures previous research relating to the drone log analysis and drone are proposed here in order to enhance the digital investigation forensics', '. challenges for drone digital forensics investigations,’’ Array, vol. 14, Jul.2022,Art.no.100135. [27] J. Qi, Z. Luan, S. Huang, C. Fung, H. Yang, H. Li, D. Zhu, and D.Qian,‘‘LogEncoder:Log-basedcontrastiverepresentationlearningfor [5] H.Studiawan,G.Grispos,andK.-K.-R.Choo,‘‘Unmannedaerialvehicle anomalydetection,’’IEEETrans.Netw.ServiceManage.,vol.20,no.2, (UAV)forensics:Thegood,thebad,andtheunaddressed,’’Comput.Secur., pp.1378–1391,Jun.2023. vol.132,Sep.2023,Art.no.103340. [28] J. Li, H. He, S. Chen, D', '. [8] S. Silalahi, T. Ahmad, and H. Studiawan, ‘‘Drone flight log anomaly severityclassificationviasentenceembedding,’’inProc.Int.Conf.Artif. [30] S. Han, Q. Wu, H. Zhang, B. Qin, J. Hu, X. Shi, L. Liu, and X. Yin, Intell.,Blockchain,CloudComput.,DataAnal.(ICoABCD),Nov.2023, ‘‘Log-basedanomalydetectionwithrobustfeatureextractionandonline pp.100–105. learning,’’IEEETrans.Inf.ForensicsSecurity,vol.16,pp.2300–2311, 2021', '. Therefore, this paper proposes a multitask-based systemprompt,thegeneratedlogmessagecanbeconsidered multiclass drone anomaly detection to assist in a forensic as an anomaly [7], [20], [21]. As for contextual anomaly, investigation. The main contributions of this paper are the detection involves analysing some contextually related summarizedasfollows: attributes to determine whether a log entry is an anomaly', '. For example, in drone forensics, existing studiesgenerallyconsideranomaliesascontradictorytonormalevents.Inotherwords,alltypesofanomalies are considered equally important. However, the peculiar events experienced by a drone during a flight might contain distinct features indicating the anomalies’ importance or level of urgency. For instance, the message ‘‘Critically low power']","Jain et al. proposed a framework for analyzing a drone's architecture and a forensic model to enhance digital investigations, which supports the exploration of log-based anomaly detection in drone systems.","highly relevant to various incident cases, as shown in Fig 3. Not only is it highly relevant, but it is also highly prioritised evidence in diverse investigation cases. 2) Flight log messages cover events from the drone’s sensors, features, and components, making it one piece of evidence to perform analysis related to different drone software and hardware components. Therefore, analysing the log messages means analysing the whole device for various possible incident scenarios. 3) Flight log messages contain contextual information about the occurring event as a description that involves multiple parts of the drone simultaneously. For example, a certain circumstance fails a feature or an operation, as shown in message group number 4 in Table 1. TABLE 1. Groups of",0.3333333333333333,0.9259082960334194
"classify log events into two categories: normal and anomaly . This is helpful in an online setting, where the number of detected abnormalities in a certain period of time is considerably small. However, in a digital forensic setting, where the detection is performed on all collected artefacts which might be large in size, the number of the abnormalities is likely to be large . Thus, analysing the detection result in a binary setting is impractical for the investigator. Moreover, out of all detected peculiarities, there might be several negligible ones with less severe impacts on the system or less likely to be related to an incident. Extending binary to multiclass anomaly detection can provide more detailed and contextual detection results","['. In a forensic orphrases. setting, analysing a large number of log entries resulting from binary anomaly detection is considered inefficient and labour-intensive as the detection is performed on the C. SCOPEANDCONTRIBUTIONS acquired evidence at one time [12]', '. As depicted in Fig 18, the highlighted to multiclass anomaly detection while exploiting the shared words align more with the attribution label, supported by high- and low-level features within the log messages that seven out of eight examples belonging to the High severity belong to different severity levels. Therefore, the forensic having positive attribution scores', 'S.Silalahietal.:InterpretableOrdinal-AwareWithContrastive-EnhancedAnomalySeverityDetection approach is presented in Section III. The experimental settingsandprocedurearedescribedinSectionIV,whilethe results,findings,anddiscussionsareelaboratedinSectionV. Finally,weconcludethepaperinSectionVI. II. RELATEDWORKS A. LOG-BASEDANOMALYDETECTION Log-based anomaly detection is relatively well-studied, includingincorporatingML[1]anddeeplearning-based[18], [19] to facilitate log anomaly detection', '. e thatundergoesadoublenegation.Therefore,considering 5 Another closely related study fine-tuned several pre-trained the context when performing sentiment analysis to detect LLMs to detect anomalous log entries in a point-based anomaliesindronelogmessagesiscrucial,especiallywhen approach[6].However,existingstudiesonlydetectwhether thelogmessagesfromdifferentclassessharecommonwords an event or subsequent event is an anomaly. In a forensic orphrases', '. Another case scenario in log-based anomaly detection Supervised contrastive learning is employed to learn is a sequence-based approach, where an abnormality is distinctrepresentationsforeachanomalyseveritylevel. determined by analysing a group of events that occur 3) Weexploretwotargetlabelrepresentationstoaugment sequentially within a certain window size [22]']","In a forensic setting, analyzing a large number of log entries from binary anomaly detection is inefficient and labor-intensive (S. Silahietal., 2023).","LLMs to detect anomalous log entries in a point-based approach . However, existing studies only detect whether an event or subsequent event is an anomaly. In a forensic setting, analysing a large number of log entries resulting from binary anomaly detection is considered inefficient and labour-intensive as the detection is performed on the acquired evidence at one time . Therefore, too many detected anomalies need to be detailed into a more fine- grained detection to help the investigator better prioritise the analysis objective. As a result, this study extends the binary anomaly detection to multi-class anomaly detection, as exemplified by another domain application such as plane flight data , image data , and internet of vehicle . As a consequence,",0.6666666666666666,0.9419923616860367
"comparison of the proposed framework, several baselines are constructed, including those that are proposed in published works. This paper proposes a transformer encoder-based log- based anomaly detection optimised using multitask label representation to help the model learn from the overlapped features shared by the samples from different severity levels. A domain-specific decoding procedure is also proposed to infer the prediction result. In-depth analyses are performed to evaluate the proposed framework thoroughly. The main contributions of this paper are summarised as follows: 1) Propose Drone Log Severity (DroLoVe), a severity- oriented multiclass anomaly detection approach on drone flight log data. 2) Propose a data-driven vector representation of the label and a severity-oriented decoding procedure of the VOLUME 12, 2024 64253 S.","['. encoder for anomaly detection. A similar study exploits Performing anomaly detection using a sequence-based theabundanceofpre-trainedtransformermodelstoperform approach is commonly conducted by training RNN-based anomalydetectionbyusingsentimentanalysisondroneflight models using a dataset containing a collection of a series log messages [6], which then expanded to multiclass in [9]. of events', '. CONCLUSION remains untested as the training dataset contains only log This paper investigates utilising a multitask learning messages acquired from 82 drone models, mostly from paradigmtoperformmulticlassanomalydetectionondrone DJI. This is one of the main challenges in drone forensics flight log messages. Aligning to the nature of multitask research, where human-readable flight log datasets from learning,weproposetwotargetlabelrepresentations,namely other drone models are unavailable', '. It demonstrates are listed in Table 6. Since we are using t-SNE to visualize the advantages of incorporating multitask label schema to the datasets’ vector embeddings, default parameters by train multiclass anomaly severity detection models with sklearn.manifold are used for all t-SNE parameters a customised label decoding procedure. An interesting witharandomstateof42', '. [8] S. Silalahi, T. Ahmad, and H. Studiawan, ‘‘Drone flight log anomaly severityclassificationviasentenceembedding,’’inProc.Int.Conf.Artif. [30] S. Han, Q. Wu, H. Zhang, B. Qin, J. Hu, X. Shi, L. Liu, and X. Yin, Intell.,Blockchain,CloudComput.,DataAnal.(ICoABCD),Nov.2023, ‘‘Log-basedanomalydetectionwithrobustfeatureextractionandonline pp.100–105. learning,’’IEEETrans.Inf.ForensicsSecurity,vol.16,pp.2300–2311, 2021', '. Pham and J.-H. Lee, ‘‘TransSentLog: Interpretable anomaly modelformulti-classanomalydetection,’’inProc.NeurIPS,Jan.2022, detection using transformer and sentiment analysis on individual log pp.4571–4584. event,’’IEEEAccess,vol.11,pp.96272–96282,2023. [15] G. O. Anyanwu, C. I. Nwakanma, J. M. Lee, and D.-S']",This study employs a multitask learning approach for multiclass anomaly detection on drone flight log messages (Interpretable Ordinal-Aware With Contrastive-Enhanced Anomaly Severity Detection on UAV Flight Log Messages).,"depicted in Fig 18, the highlighted words align more with the attribution label, supported by seven out of eight examples belonging to the High severity having positive attribution scores. The model perceives the log messages better than the previous BERT-based model. The complete report of attributions toward each severity label can be accessed on the repo. VI. CONCLUSION VI. CONCLUSION This paper investigates utilising a multitask learning paradigm to perform multiclass anomaly detection on drone flight log messages. Aligning to the nature of multitask learning, we propose two target label representations, namely Multitask-101 and Multitask-111. The integrated gradient is employed to interpret the model’s behavior. During the interpretability analysis, we found that the embedding vectors from BERT do not align",0.5,0.9535461302442997
"follows: 1) Propose Drone Log Severity (DroLoVe), a severity- oriented multiclass anomaly detection approach on drone flight log data. 2) Propose a data-driven vector representation of the label and a severity-oriented decoding procedure of the VOLUME 12, 2024 64253 S. Silalahi et al.: Severity-Oriented Multiclass Drone Flight Logs Anomaly Detection FIGURE 2. A word cloud visualisation to see that the samples from different severity levels share common words and phrases. The remainder of the paper is structured as follows: Section II discusses relevant previous studies related to log-based anomaly detection and how to deal with class imbalance problems in log-based anomaly detection task, the proposed framework is explained in detail in Section III, Section IV provides the experimental setup, followed","['. DigitalObjectIdentifier10.1109/ACCESS.2025.3580056 Interpretable Ordinal-Aware With Contrastive-Enhanced Anomaly Severity Detection on UAV Flight Log Messages SWARDIANTARASILALAHI 1,(GraduateStudentMember,IEEE), TOHARIAHMAD 1,(Member,IEEE),HUDANSTUDIAWAN 1,(Member,IEEE), EIRINIANTHI 2,ANDLOWRIWILLIAMS 2 1DepartmentofInformatics,InstitutTeknologiSepuluhNopember,Surabaya60111,Indonesia 2SchoolofComputerScienceandInformatics,CardiffUniversity,CF244AGCardiff,U.K', '. 1) We propose DroneLog, an interpretable sentimentAs an example, the flight path taken by a drone during a based multiclass drone flight log anomaly detection flightisrecordedinlongitudeandlatitudecoordinates.These frameworkthatincludesthreeanomalyseveritylevels: datacanbeusedtodetectananomalybyfindingapeculiar low,medium,andhigh.Providingtheseveritylevelcan valuewithinthelogrecordsbycontrastingthenormalvalues provide better detection results for the investigator to', '. Inspired by the study, anomalous events on drone objective[33].Anotheralternativetoleveragethepre-trained flight logs can be detected by analysing log messages and model is fine-tuning the models using prompts [34]. With identifying suspect key phrases closely related to drone onlyafewtrainingdata,themodelcancapturethesemantics incident scenarios. Therefore, the region of interest in this of the input logs and detect anomalous log sequences well', '. [8] S. Silalahi, T. Ahmad, and H. Studiawan, ‘‘Drone flight log anomaly severityclassificationviasentenceembedding,’’inProc.Int.Conf.Artif. [30] S. Han, Q. Wu, H. Zhang, B. Qin, J. Hu, X. Shi, L. Liu, and X. Yin, Intell.,Blockchain,CloudComput.,DataAnal.(ICoABCD),Nov.2023, ‘‘Log-basedanomalydetectionwithrobustfeatureextractionandonline pp.100–105. learning,’’IEEETrans.Inf.ForensicsSecurity,vol.16,pp.2300–2311, 2021', '. Thisstudyproposestoextendthebinaryanomalydetection into a multiclass anomaly detection involving four classes: Normal,Low,Medium,andHigh.Thethreeanomalyclasses representingtheseverityoftheabnormalityaredistinguished byseveralcharacteristicsdescribedinSectionIV-A.AsillustratedbyFig.4,adroneexperiencesvariouseventsfromthe takeoff(e )tothelanding(e ).Eacheventisrepresentedby 1 6 a log message that contains a description of the occurring phenomenon.Amongtheeventsthathappenduringaflight, there might be low,']","The proposed framework extends binary anomaly detection into a multiclass system involving four severity levels: Normal, Low, Medium, and High (Silalahi et al., 2025).","be employed to force the model to learn a distinctive representation of the positive FIGURE 4. An illustration of anomalies that occur during a drone’s flight. inclusive. Therefore, this paper proposes a multitask-based multiclass drone anomaly detection to assist in a forensic investigation. The main contributions of this paper are summarized as follows: 1) We propose DroneLog, an interpretable sentiment- based multiclass drone flight log anomaly detection framework that includes three anomaly severity levels: low, medium, and high. Providing the severity level can provide better detection results for the investigator to pinpoint the event of interest. Interpretability makes training and testing more transparent, the model trustworthy, and human-friendly. 2) We propose DroneSBERT,1 a domain-specific embed- ding to extract semantic features",0.5,0.9108105650573463
"anomaly detection approach is adopted in this paper. Table 1 presents the summary of the previous related works. B. CLASS IMBALANCE PROBLEM (CIP) IN LOG-BASED ANOMALY DETECTION It is assured that in log-based anomaly detection, the number of anomalous samples is significantly less than the normal ones. Employing a supervised-based technique is prone to bias, as the model tends to learn from the majority samples. To overcome CIP, several studies proposed data-level and algorithm-level solutions . Moreover, in a certain case, there are no anomalous samples available. In this particular situation, a one-class approach can be used to construct a normal baseline model. During the detection, an anomaly score is used to decide if an input event is anomalous based","['S.Silalahietal.:InterpretableOrdinal-AwareWithContrastive-EnhancedAnomalySeverityDetection approach is presented in Section III. The experimental settingsandprocedurearedescribedinSectionIV,whilethe results,findings,anddiscussionsareelaboratedinSectionV. Finally,weconcludethepaperinSectionVI. II. RELATEDWORKS A. LOG-BASEDANOMALYDETECTION Log-based anomaly detection is relatively well-studied, includingincorporatingML[1]anddeeplearning-based[18], [19] to facilitate log anomaly detection', '. Another case scenario in log-based anomaly detection Supervised contrastive learning is employed to learn is a sequence-based approach, where an abnormality is distinctrepresentationsforeachanomalyseveritylevel. determined by analysing a group of events that occur 3) Weexploretwotargetlabelrepresentationstoaugment sequentially within a certain window size [22]', '. Thisstudyproposestoextendthebinaryanomalydetection into a multiclass anomaly detection involving four classes: Normal,Low,Medium,andHigh.Thethreeanomalyclasses representingtheseverityoftheabnormalityaredistinguished byseveralcharacteristicsdescribedinSectionIV-A.AsillustratedbyFig.4,adroneexperiencesvariouseventsfromthe takeoff(e )tothelanding(e ).Eacheventisrepresentedby 1 6 a log message that contains a description of the occurring phenomenon.Amongtheeventsthathappenduringaflight, there might be low,', '. As mentioned in the previous section, this theindirectlysubsequentevents.Moreover,thecomputation paperexplorestheadvantageofmultitasklearningtoperform processisnon-parallelizable.Therefore,severaleffortshave sentimentanalysisondroneflightlogdatasetsasananomaly been made to employ the Transformer model for anomaly detectionapproach. detection [32]. Instead of training a model using a dataset, [33] proposed HilBERT, a BERT-based model pre-trained III. PROPOSEDFRAMEWORK using a number of public log datasets', '. An interesting witharandomstateof42. pattern is shown in Table 8 regarding the hyperparameter Four encoder types are selected to be combined with the values on each encoder type. The GRU works well with baseline and proposed scenarios, i.e., Transformer, LSTM, more layers, average pooling, and uniform class weighting. GRU, and Linear, since these encoders are standard in log- Differently, the Linear model has benefited from the [CLS] based anomaly detection as discussed in Section II']","Log-based anomaly detection has been extensively studied, incorporating machine learning and deep learning techniques to enhance detection capabilities (Silahietal., 2023).","sequence-based approach in the log-based anomaly detection research, as shown in Table 2. In contrast, this paper uses a point-based approach based on the characteristics of the problem and the dataset. Therefore, there are limited references that can be used as baselines for comparison, as described in the following: 1) Pylogsentiment . Using a point-based approach, a sentiment analysis model is trained using a one-layer VOLUME 13, 2025 105369 S. Silalahi et al.: Interpretable Ordinal-Aware With Contrastive-Enhanced Anomaly Severity Detection TABLE 6. Hyperparameter search space for all scenarios. neighbouring classes share common features. GRU, LSTM, and Transformer are explored to find the best- performing encoder. To provide a fair comparison, the GloVe embedding used in pylogsentiment, SentiLog, and TransSentLog are",0.75,0.955288775684214
"detection approach for drone flight log data. The overall flow of the proposed framework is depicted in Fig 4. The following section describes the approach in more detail. A. OVERVIEW A. OVERVIEW Performing point log-based anomaly detection that takes human-readable log messages as input is similar to conduct- ing sequence or text classification. As mentioned in Section I, this task may be interpreted as a sentiment analysis task that aims to detect negative sentiments within log messages. Taking an n-length log message m = [w1, w2, . . . , wn] from the dataset D = {(mi, ci)}|D| i=1 as the input, where c is the label class name, BERT is used to tokenise the input into a fixed length","['. 1) We propose DroneLog, an interpretable sentimentAs an example, the flight path taken by a drone during a based multiclass drone flight log anomaly detection flightisrecordedinlongitudeandlatitudecoordinates.These frameworkthatincludesthreeanomalyseveritylevels: datacanbeusedtodetectananomalybyfindingapeculiar low,medium,andhigh.Providingtheseveritylevelcan valuewithinthelogrecordsbycontrastingthenormalvalues provide better detection results for the investigator to', '. Inspired by the study, anomalous events on drone objective[33].Anotheralternativetoleveragethepre-trained flight logs can be detected by analysing log messages and model is fine-tuning the models using prompts [34]. With identifying suspect key phrases closely related to drone onlyafewtrainingdata,themodelcancapturethesemantics incident scenarios. Therefore, the region of interest in this of the input logs and detect anomalous log sequences well', '. Sentiment analysis-based log anomaly readablemessagesdescribingtheoccurringeventsduringthe detection was firstly introduced in [7], which rely on an operation of a drone. This file stores all information during assumptionthat,logmessagesthatcontainwordsorphrases aflight,suchasflighttimestamps,flightparameters,sensor with negative connotations considered anomalies. Another data, components’ status, and flight mode', '. B. PROBLEMSTATEMENT For instance, at the e , the drone exceeds the maximum In the event that there is only benign data (i.e., no sample 3 flight distance. Several sentiment-baring words or phrases of abnormal data), anomaly detection can be conducted by from the illustration include ‘‘out of range’’, ‘‘overheated’’, training a recurrent neural network (RNN)–based model and ‘‘failed’’', '. DigitalObjectIdentifier10.1109/ACCESS.2025.3580056 Interpretable Ordinal-Aware With Contrastive-Enhanced Anomaly Severity Detection on UAV Flight Log Messages SWARDIANTARASILALAHI 1,(GraduateStudentMember,IEEE), TOHARIAHMAD 1,(Member,IEEE),HUDANSTUDIAWAN 1,(Member,IEEE), EIRINIANTHI 2,ANDLOWRIWILLIAMS 2 1DepartmentofInformatics,InstitutTeknologiSepuluhNopember,Surabaya60111,Indonesia 2SchoolofComputerScienceandInformatics,CardiffUniversity,CF244AGCardiff,U.K']","Sentiment analysis-based log anomaly detection relies on the assumption that log messages containing negative connotations are considered anomalies (Swardiantara et al., 2025).","be employed to force the model to learn a distinctive representation of the positive FIGURE 4. An illustration of anomalies that occur during a drone’s flight. inclusive. Therefore, this paper proposes a multitask-based multiclass drone anomaly detection to assist in a forensic investigation. The main contributions of this paper are summarized as follows: 1) We propose DroneLog, an interpretable sentiment- based multiclass drone flight log anomaly detection framework that includes three anomaly severity levels: low, medium, and high. Providing the severity level can provide better detection results for the investigator to pinpoint the event of interest. Interpretability makes training and testing more transparent, the model trustworthy, and human-friendly. 2) We propose DroneSBERT,1 a domain-specific embed- ding to extract semantic features",0.6666666666666666,0.93645173869265
"log message m = [w1, w2, . . . , wn] from the dataset D = {(mi, ci)}|D| i=1 as the input, where c is the label class name, BERT is used to tokenise the input into a fixed length sequence with m maximum length and retrieve the contextual embeddings, resulting in an input matrix X ∈ Rm×dBERT which is then paired with the encoded label y. Thus, the numerical input becomes (X, y). This study aims to train a neural network model Mθ to classify the message m into one of the predefined classes c ∈ C = {high, medium, low, normal}, or can be written as Mθ : m → c. Based on past literature discussed in Section","['vector,yieldingastaticlookupdictionaryafterbeingtrained as the log message is generated and triggered by certain on a relatively large corpus', '. weight and bias parameters in a linear layer. Knowing that In this paper, M = (cid:2) m 1 ,m 2 ,...,m|M| (cid:3) is defined as the number of classes is more than two, the task belongs the collection of log messages in the dataset. Given a log to multiclass classification. Typically, the target label is recordm = [w 1 ,w 2 ,...,w n ]containingnnumberofwords represented in a one-hot encoded vector, as depicted in as input, with m ∈ M, BERT base is used to tokenize and Fig. 8a', '. The last three recent study employs sentence embedding to extract the columns contain human-readable messages: APP.message, semantic features from log messages, and utilize various APP.tip, and APP.warning, which is the source of the machine learning (ML) models to classify anomaly severevidence used in this paper. Sample messages can be seen ity[8].Themostrecentstudyemploysamultitasklearningin Table 1. From the table, it can be seen that samples in based solution to solve a mutually inclusive dataset [9]', '. Note of the messages when making predictions. The model is that pooling only applies to the Transformer and Linear expected to associate the contextual dependency among encoders.Thisfinalhiddenstatevectoristhenmappedinto wordsandphraseswithintheinputmessagetotheanomaly four target classes using a linear layer, resulting in the final severity label', '. capture the semantics of the log messages [26]. However, The remaining part of this paper is structured as follows: the resulting representational vectors can be closer to one SectionIIdiscussesrecentrelatedapproaches.Theproposed another since log records commonly share the same words']",The classification of log messages into multiple classes is facilitated by using BERT to tokenize the input message represented as a one-hot encoded vector (Interpretable Ordinal-Aware With Contrastive-Enhanced Anomaly Severity Detection on UAV Flight Log Messages).,"detection on the test data, which is then analysed further. In this paper, M = (cid:2)m1, m2, . . . , m|M| (cid:3) is defined as the collection of log messages in the dataset. Given a log record m = [w1, w2, . . . , wn] containing n number of words as input, with m ∈ M, BERTbase is used to tokenize and obtain the input vector representation. In the implementation, computation is undertaken using matrix multiplication. Thus, a term maximum sequence length, m, is introduced to pack the input messages that vary in length into a matrix with a consistent size throughout all the samples in the dataset. Therefore, for each single input message, the input matrix becomes",0.3333333333333333,0.9118153834772976
"logits z ∈ R|C|, where |C| denotes the number of target class in the dataset. During the training phase, these vectors are used to compute the loss and update the parameter of the model after passing through a normalisation function. For the typical one-hot encoding representation of the label, the standard cross-entropy is used to compute the loss, as defined in the following equation: |C| LCE = − yi · log(ˆyi) i=1 ˆy = softmax(z) exp(zi) ˆyi = Pdim(z) exp(zj) (1) (2) (3) where y and ˆy are the true label vector and the prediction probability distribution, respectively. The prediction proba- bility ˆy is obtained from Eq 2, where each of the element in ˆy is computed using Eq 3.","['. Thedistributionofthebestepochfromeachlossfunction. model on the filtered dataset. The confusion matrix in this Loglosstendstorequiremoreepochscomparedtocross-entropyand focalloss. paperisredefinedtoalignwiththeanomalyseveritycontext, wherethedistancebetweentrueandpredictedlabelsmatters. If the predicted label is lower than the true label, we define it False Positive (FP). Conversely, if the true label is lower than the predicted label, we define it False Negative (FN)', '. 1 Aligning to the multitask learning paradigm, the target yˆ = (13) label representation is no longer one-hot encoding. Instead, i 1+exp(−α i ) 105368 VOLUME13,2025', '. MACHINE LEARNING PARAMETERS Evaluatioin metrics ML models Parameters Models MSE RMSE MAE max_depth: 10, min_samples_split: 2, RF SARIMAX 639714.51 799.82 650.35 n_estimator: 50 RF 1384875.01 1176.80 958.96 learning_rate: 0.05, max_depth: 3, XGBoost XGBoost 1389609.34 1178.81 961.11 n_estimators: 100 GBM 1406810.24 1186.09 971.82 learning_rate: 0.2, max_depth: 3, n_estimators: LightGBM LSTM 16816.55 129.67 103.94 100 Authorized licensed use limited to: Institut Teknologi Sepuluh Nopember', '. probabilities between 0 and 1. During training, we applied the Specifically, the distillation loss function was designed to binary cross-entropy loss across all labels to supervise minimize the discrepancy between the feature representations abnormality detection of the student and the teacher models', '. This result highlights the advantage of decreasing values of training loss (t-lss) and validation Indo-BiEnt in providing more consistent and balanced loss (v-lss), indicating better generalization and reduced classificationacrossallinferencecategories. overfittingasthetrainingdatavolumeincreases']",The training process for models using cross-entropy loss typically requires more epochs compared to other loss functions (Interpretable Ordinal-Aware With Contrastive-Enhanced Anomaly Severity Detection on UAV Flight Log Messages).,"final unnormalized logits vector using the following equation: α = zW⊤ + b, ∈ R|C| (3) where W ∈ R|C|×768, and b ∈ R|C| are the typical trainable weight and bias parameters in a linear layer. Knowing that the number of classes is more than two, the task belongs to multiclass classification. Typically, the target label is represented in a one-hot encoded vector, as depicted in Fig. 8a. Therefore, the training objective is to minimise the cross-entropy loss, which is computed using the following equation: LCE(y, ˆy) = − |C| yi · log(ˆyi) i=1 ˆy = softmax(α) (4) (5) where y and ˆy are the truth and the predicted label probability distribution respectively. The normalized logits in Eq. 5 is",0.0,0.9351085001746818
"study, one of the artefacts of drone devices, the flight log message, is used as the source of the evidence to perform multiclass anomaly severity detection. These human-readable messages, such as ‘‘Aircraft Core Board Overheated’’ and ‘‘Compass error, calibration required’’, can be found in most DJI-make flight logs in three columns: warning, tip, and message. Originally, the flight log was in encrypted.CSV files . Thus, the drone phantom help2 is needed to decrypt the flight log files and then extract the contents. The 2 FIGURE 6. Proposed vector representation of the label based on the dataset characteristics. is computed based on the frequency distribution of the class in the dataset. In this study, three class weights are explored and used","['. Inspired by the study, anomalous events on drone objective[33].Anotheralternativetoleveragethepre-trained flight logs can be detected by analysing log messages and model is fine-tuning the models using prompts [34]. With identifying suspect key phrases closely related to drone onlyafewtrainingdata,themodelcancapturethesemantics incident scenarios. Therefore, the region of interest in this of the input logs and detect anomalous log sequences well', '. 1) We propose DroneLog, an interpretable sentimentAs an example, the flight path taken by a drone during a based multiclass drone flight log anomaly detection flightisrecordedinlongitudeandlatitudecoordinates.These frameworkthatincludesthreeanomalyseveritylevels: datacanbeusedtodetectananomalybyfindingapeculiar low,medium,andhigh.Providingtheseveritylevelcan valuewithinthelogrecordsbycontrastingthenormalvalues provide better detection results for the investigator to', '. B. PROBLEMSTATEMENT For instance, at the e , the drone exceeds the maximum In the event that there is only benign data (i.e., no sample 3 flight distance. Several sentiment-baring words or phrases of abnormal data), anomaly detection can be conducted by from the illustration include ‘‘out of range’’, ‘‘overheated’’, training a recurrent neural network (RNN)–based model and ‘‘failed’’', '. combinedfromtwopublicdroneflightlogdatasets,i.e.,from 5) DroLoVe[9].ThestudyproposedamultitasklearningMendeley[51]andadronewiki[52].Therearetwodatasets: based anomaly severity detection on drone flight unfiltered and filtered. The unfiltered dataset is a collection logs with an assumption that, samples belonging to of log messages in its original condition gathered from the twosourceswithoutperforminguniquefiltering.Therefore, thereareseveralduplicatelogmessagesbothintrainingand TABLE4', '. DigitalObjectIdentifier10.1109/ACCESS.2025.3580056 Interpretable Ordinal-Aware With Contrastive-Enhanced Anomaly Severity Detection on UAV Flight Log Messages SWARDIANTARASILALAHI 1,(GraduateStudentMember,IEEE), TOHARIAHMAD 1,(Member,IEEE),HUDANSTUDIAWAN 1,(Member,IEEE), EIRINIANTHI 2,ANDLOWRIWILLIAMS 2 1DepartmentofInformatics,InstitutTeknologiSepuluhNopember,Surabaya60111,Indonesia 2SchoolofComputerScienceandInformatics,CardiffUniversity,CF244AGCardiff,U.K']","The proposed DroneLog framework includes three levels of anomaly severity detection for drone flight log messages, enhancing the identification of anomalous events (Antarasilahi et al., 2025).","the data is the DJI. After collecting the ﬂight log ﬁles, we use DJI Phantom Help tools to decrypt the ﬁles and get the plain data, which then is parsed to get the log message data. The number of messages from every drone image is shown in Table 1. The next step is identifying the entity type mentioned in the drone log messages. Before reading the log messages, we ﬁltered the duplicate message and got the unique message to read. After carefully reading the unique log message and comprehensively studying what every log message indicates, we categorized the entity types mentioned in the ﬂight log message into six groups, i.e., Component, Action, Parameter, Function, State, and Issue. These entity types",0.4,0.943553449899867
"the unfiltered is the actual collection of drone flight log messages gathered from the two sources mentioned previously. The dataset is split into training and testing with an 80:20 ratio. The summary of the per-class distribution in the dataset is presented in Table 2. B. BASELINES B. BASELINES In this study, an extensive experiment with various types of encoders is conducted to construct strong baselines for performance comparison. Ensuring the objectivity of the comparison, the hyperparameters of these baselines are fine-tuned using grid search on a finite search space, as shown in Table 3. The details of the baseline construction are described in the following subsections. 1) BASELINE FROM DIVERSE SUITABLE ENCODERS The distinction between the baseline and the proposed","['. 11. that every model has its own features and functionalities, Three char-level embeddings, such as LSTM, CNN, and which vary among them, then the generated log messages AdaTrans,werecombinedwithtwoword-levelembeddings, will be different as well. However, since all the drones are GloVe and BERT, to provide input for the encoder layer', '. CONCLUSION remains untested as the training dataset contains only log This paper investigates utilising a multitask learning messages acquired from 82 drone models, mostly from paradigmtoperformmulticlassanomalydetectionondrone DJI. This is one of the main challenges in drone forensics flight log messages. Aligning to the nature of multitask research, where human-readable flight log datasets from learning,weproposetwotargetlabelrepresentations,namely other drone models are unavailable', '. For instance, the message ‘‘Critically low power. Aircraft is landing’’ is more important than ‘‘Forward Obstacle Sensing notWorking’’.ThisstudyproposesDroneLog,aninterpretableframeworkfordetectinganomaliesandthe severity levels on drone flight logs, using a multitask learning approach in a unified pipeline', '. Inspired by the study, anomalous events on drone objective[33].Anotheralternativetoleveragethepre-trained flight logs can be detected by analysing log messages and model is fine-tuning the models using prompts [34]. With identifying suspect key phrases closely related to drone onlyafewtrainingdata,themodelcancapturethesemantics incident scenarios. Therefore, the region of interest in this of the input logs and detect anomalous log sequences well', '. The proposedmethodoutperformsthepreviousbaselinemodelwitha91.348%F1score.Finally,weconclude theexperimentandmentionseveralfuturedirections. INDEX TERMS Digitalforensics,droneflightlog,droneforensics,logmining,namedentityrecognition, transformerencoder,conditionalrandomfields,infrastructure. I']","The proposed method in the study achieves a performance improvement over previous baselines, attaining a 91.348% F1 score (Referensi 5).",". There are two datasets: unfiltered and filtered. The unfiltered dataset is a collection of log messages in its original condition gathered from the two sources without performing unique filtering. Therefore, there are several duplicate log messages both in training and testing sets. This is aligned with the real case scenario, where a drone tends to generate the same log message when the event is still happening. It indicates that the current event has yet to be changed or solved (if it is an issue). On the other hand, the filtered dataset is a collection of log messages after a unique filtering process. This is aligned with the norm in supervised learning, where the train and test set must not",0.6666666666666666,0.886819467696446
"PREVIOUS WORKS Among the relevant published studies in the log-based anomaly detection space, sequence-based is one of the most commonly used approaches. Therefore, there are limited relevant references as this study employs a point-based approach. Below are the relevant baselines from previous research: 1) Pylogsentiment is the first study which employs sentiment analysis-based anomaly detection on operat- ing system logs using GRU and GloVe embedding. 2) SentiLog , similar to , use a two-layered BiLSTM and GloVe embedding model to perform anomaly detection on parallel file system logs. 3) TransSentLog is a further development of and uses a two-layered transformer encoder which used two attention heads and GloVe embedding along with integrated gradients to add explainability to the trained model.","['. Existing anomaly detection modelling techniques can be conducted either in a point, contextual, or collective setting. Point anomaly FIGURE4. Anillustrationofanomaliesthatoccurduringadrone’sflight. detectioncharacteriseseachlogentry,whetheraneventisan abnormalityoranormalevent.Forinstance,ifausertypesthe wrong password when trying to gain access to an operating inclusive', 'S.Silalahietal.:InterpretableOrdinal-AwareWithContrastive-EnhancedAnomalySeverityDetection approach is presented in Section III. The experimental settingsandprocedurearedescribedinSectionIV,whilethe results,findings,anddiscussionsareelaboratedinSectionV. Finally,weconcludethepaperinSectionVI. II. RELATEDWORKS A. LOG-BASEDANOMALYDETECTION Log-based anomaly detection is relatively well-studied, includingincorporatingML[1]anddeeplearning-based[18], [19] to facilitate log anomaly detection', '. encoder for anomaly detection. A similar study exploits Performing anomaly detection using a sequence-based theabundanceofpre-trainedtransformermodelstoperform approach is commonly conducted by training RNN-based anomalydetectionbyusingsentimentanalysisondroneflight models using a dataset containing a collection of a series log messages [6], which then expanded to multiclass in [9]. of events', '. An interesting witharandomstateof42. pattern is shown in Table 8 regarding the hyperparameter Four encoder types are selected to be combined with the values on each encoder type. The GRU works well with baseline and proposed scenarios, i.e., Transformer, LSTM, more layers, average pooling, and uniform class weighting. GRU, and Linear, since these encoders are standard in log- Differently, the Linear model has benefited from the [CLS] based anomaly detection as discussed in Section II', '. Thisstudyproposestoextendthebinaryanomalydetection into a multiclass anomaly detection involving four classes: Normal,Low,Medium,andHigh.Thethreeanomalyclasses representingtheseverityoftheabnormalityaredistinguished byseveralcharacteristicsdescribedinSectionIV-A.AsillustratedbyFig.4,adroneexperiencesvariouseventsfromthe takeoff(e )tothelanding(e ).Eacheventisrepresentedby 1 6 a log message that contains a description of the occurring phenomenon.Amongtheeventsthathappenduringaflight, there might be low,']",Sequence-based approaches for anomaly detection are commonly implemented by training RNN-based models on datasets that consist of a series of events (Silahi et al.).,"analysing sentiment contained within a log message to detect anomalous events. More specifically, we can distinguish between normal and abnormal events and also detail the severity of the detected abnormalities. Therefore, VOLUME 13, 2025 105365 S. Silalahi et al.: Interpretable Ordinal-Aware With Contrastive-Enhanced Anomaly Severity Detection TABLE 2. Related works in log-based anomaly detection. the investigator can prioritise the analysis objective to focus only on severe abnormalities. Therefore, we propose an interpretable log anomaly detection framework based on sentiment analysis, as depicted in Fig. 5. During the training phase, we investigate the model’s perception of the semantics of the messages when making predictions. The model is expected to associate the contextual dependency among words and phrases within the input message",0.6666666666666666,0.9307071024224763
"this section reports the experimental results along with in-depth discussions and analyses. A. BEST PERFORMING SCENARIO A. BEST PERFORMING SCENARIO 1) EVALUATION METRIC After experimenting with all the designed scenarios, the models’ performance is evaluated on the test dataset. The best-performing model from each pair of encoder type and loss function is reported in Table 4 and Table 5 for unfiltered and filtered datasets. Based on the evaluation metrics shown in both tables, the proposed scenario outperforms all baseline scenarios on all encoder types tested on the unfiltered dataset, with an accuracy of 96.875 and an F1 score of 96.851. As for the filtered dataset, the transformer encoder trained on the baseline scenario outperforms the other scenarios on all encoder","['. Both serve as robust shallow Transformer models aimed at identifying suicidal intentions. representations for image retrieval and classification tasks. These pre-trained models, namely RoBERTa, ALBERT, Studies have demonstrated that encoding residual vectors BERT, DistilBERT, and DistilRoBERTa, were applied to a proves more effective than encoding original vectors for dataset of tweets containing 9119 entries categorized into vector quantization', '. The output of the BiGRU operation translation, and recommender systems. Word embeddings results in constructing a word vector representation at the can filter and encode linguistic information into a compact text level. Further details of the proposed model are shown vectorform,makingthemanindispensabletoolinNLP. in Algorithm 2. Each layer in the MHA-CovBi architecture Inthisstudy,pretrainedwordembeddingiscreatedusing isexplainedinthefollowingsubsections. a combination of FastText and GloVe embeddings', '. Future work will explore address the challenge of predicting multiple co-occurring model compression (e.g., pruning, quantization, low-rank abnormalities. Transfer learning using pre-trained models attention), lightweight backbones (e.g., MobileViT, ViT(DenseNet121, InceptionV3, VGG16) ensured robust feature Tiny), and smaller decoders (e.g., distilled GPT). Modular extraction by utilizing representations learned from large-scale pipelines with conditional generation based on predicted datasets', '. ||u||||v|| (cid:113) (cid:80)d u2 (cid:113) (cid:80)d v2 Transformerarchitectureisdividedintotwomajorparts:the i=1 i i=1 i EncoderandtheDecoder.Inthisstudy,theonlypartusedwas Therearetwotypesofwordembedding,staticandcontex- theEncoder.Ingeneral,theelementsthatbuildtheEncoder tualembedding.Word2vec[40],fasttext[46]andGloVe[39] blockincludeInputEmbedding,PositionalEncoding,Multiare the common static embedding. While ELMo [41] and headAttention,andFeed-forwardNetworks[42]', '. COMPARISONWITHOTHERBASELINEMODELS fromthestaticembeddingisundergoingarefinementprocess Toverifythesuperiorityofourproposedmethods,wecomintheencoderlayer.Eventually,thewords’vectorsfromthe pare the proposed models with several baseline models, embeddinglayerwentthroughacontextuallearningpipeline, asshowninFig10.Thedetailedarchitectureforeachencoder justlikewhatthecontextualpre-trainedwordembeddinghas is as follows: CNN-BERT-Scaled Transformer, AdaTransdone']","The proposed model outperforms baseline models, demonstrating its effectiveness in comparison studies (Transformer-Based Named Entity Recognition on Drone Flight Logs to Support Forensic Investigation).","there are 1,584 resulting model configurations in total, 729 for each dataset. Considering the extensive number of hyperparameter search spaces, not all the results are presented in this paper. Therefore, for each encoder type and scenario, only the best- performing one is presented for comparison and explained in the following subsection. Several metrics are used to evaluate the overall models’ performance, i.e., accuracy, precision, recall, and F1. Note that the weighted average is used to compute the average score of precision, recall, F1, and prediction confidence. We investigate the confusion matrix, learned representation, and the interpretability of the model’s prediction to increase understanding of the model. Captum, a tool developed by version 0.7.0 is used for model’s interpretability analysis. V.",0.3333333333333333,0.9020968474107297
"on all encoder types tested on the unfiltered dataset, with an accuracy of 96.875 and an F1 score of 96.851. As for the filtered dataset, the transformer encoder trained on the baseline scenario outperforms the other scenarios on all encoder types with an accuracy of 83.761 and an F1 score of 82.967. The proposed scenario only performs better on the GRU and LSTM encoders than the baseline scenarios. 2) PREDICTION CONFIDENCE Evaluating the performance of a neural model strongly depends on the task and domain problem. In a particular task, accuracy can be the only important metric. However, in some other domains, having a high accuracy does not suffice. For example, in this study, the model needs to be sure","['. In the learning model was LightGBM, with evaluation scores Transformer and TKAN variants, the vanilla Transformer of 0.99843 R2, 96.76132 MAE, 56,754.18872 MSE, has the best performance in 4 of 5 evaluation metrics 0.00833 sMAPE, 0.32185 F1-score, and 0.51070 with evaluation scores of 0.99992 R2, 42.54592 MAE, MWRE@0.75. CEM and REM outperformed LightGBM. 3,075.38631 MSE, 0.00644 sMAPE, 0.46445 F1-score, AmongMLP,LSTM,GRU,andCNN-LSTM,GRUdelivered and 0.40327 MWRE@0.75', '. Modified Transformer ture, which are Transformer GRU (FormerGRU), Transarchitectureisconductedtofindtheeffectoftheencoderand former LSTM (FormerLSTM), Transformer Encoder GRU decodersection,whichisnotbuiltnativelyforsequencetasks (TEGRU), and Transformer Encoder LSTM (TELSTM). becauseitneedspositionalencodingfortherepresentationof Modified Transformer was chosen because TEGRU outpersequence,combinedwithLSTMandGRU,whicharenative formed other Transformer variants, such as vanilla Transtosequencetasks', '. The CNN-LSTM has the best evaluation score 19,016.86043 MSE, 0.00744 sMAPE, 0.33052 F1-score, in sMAPE, F1-score, and MWRE@0.75. The GRU and and 0.50397 MWRE@0.75. The best-performing machine CNN-LSTM perform better than CEM and REM', '. Dropout ratio: 0.5, applied to both the BiLSTM layer in which the number of data used varies, with 100k, 150k, andtheMLPintheclassifierlayer.Learningrate:0.1.MLP 200k, 300k, and 540k instances used as input for training. hiddenlayers:Configuredwithatieredstructurecontaining Meanwhile, the model validation and testing process uses 512,64,and32hiddenstates. different pairs of sentences with training data as input In addition, The categorical cross-entropy loss function accordingtothenumbersinTable1', '. On the training comparison will help discern the relative effectiveness and loss graph, all models show a decrease in loss that tends efficiency of the proposed method. By doing so, the aim is to to flatten as the epoch increases. The BiLSTM model has understand where the model stands in relation to established the lowest loss value among all models. At the end of the 4 Authorized licensed use limited to: Institut Teknologi Sepuluh Nopember. Downloaded on July 14,2025 at 08:18:27 UTC from IEEE Xplore']","The GRU encoder demonstrated superior performance in certain scenarios, aligning with findings that the proposed scenario outperforms baseline scenarios on GRU encoders.","precision, recall, F1, and prediction confidence. We investigate the confusion matrix, learned representation, and the interpretability of the model’s prediction to increase understanding of the model. Captum, a tool developed by version 0.7.0 is used for model’s interpretability analysis. V. EVALUATION AND DISCUSSION V. EVALUATION AND DISCUSSION A. PERFORMANCE EVALUATION A. PERFORMANCE EVALUATION After conducting an extensive experiment on a vast amount of hyperparameter search space, the best-performing models for each encoder-scenario pair tested on the unfiltered and filtered dataset are reported on Table 7 and Table 8, respectively. From both tables, it can be seen that the highest score is achieved by the proposed scenario. It demonstrates the advantages of incorporating multitask label schema to train multiclass anomaly severity",0.3333333333333333,0.9229883053352568
"which hyperparameter the accuracy depends on. The dependency can be either increasing or decreasing the accuracy. Nevertheless, it can help choose which hyperparameter to modify in the next experiments. C. COMPARISON WITH STATE-OF-THE-ART MODELS C. COMPARISON WITH STATE-OF-THE-ART MODELS In this study, several baselines from previous studies are reproduced on the dataset to perform performance compar- isons. The reproduced performance from an experimental procedure explained in subsection IV-B2 is presented in Table 6. On both datasets, the proposed scenario outper- forms all the baselines with an improvement of 0.423 and 0.665 in the F1 score on the filtered and unfiltered datasets, respectively. Considering that Pylogsentiment used a GRU-based encoder and SentiLog used an LSTM-based the proposed scenarios on these two","['. Numerous researchers and high efficiency. The parameter system performance have explored hyperparameter optimization (HPO) techdeploymentmodelCNNondevicesperformswellintermsof niques.Forinstance,systematicreviewshavebeenconducted precision,recall,F1-score,andaswellasefficiencyoftime on HPO methods for CNN models [60], while others have inference', '. Faster R-CNN Resnet101, and Faster R-CNN Inception- Hyperparameter optimization is one of the strategies Resnet v2 models reached precision 75%, and their CNN for improving system performance. Some research uses modeldeployedthepotholedetectorontheNvidiaDrivePX2 hyperparameter optimization techniques such as Random platform running at 5–6 frames per second', '. The CNN-LSTM has the best evaluation score 19,016.86043 MSE, 0.00744 sMAPE, 0.33052 F1-score, in sMAPE, F1-score, and MWRE@0.75. The GRU and and 0.50397 MWRE@0.75. The best-performing machine CNN-LSTM perform better than CEM and REM', '. Stacking the encoder in layers is one of the common hyperparameter tuning techniques when using RNN-based and Transformer models[56].Therefore,wevarythenumberoflayers’values with one, two, or three, as the BERT’s parameters are also updated during the training [25]. Choosing the number of attentionheadsintheTransformerencoderisdeterminedby neighbouring classes share common features', '. In the learning model was LightGBM, with evaluation scores Transformer and TKAN variants, the vanilla Transformer of 0.99843 R2, 96.76132 MAE, 56,754.18872 MSE, has the best performance in 4 of 5 evaluation metrics 0.00833 sMAPE, 0.32185 F1-score, and 0.51070 with evaluation scores of 0.99992 R2, 42.54592 MAE, MWRE@0.75. CEM and REM outperformed LightGBM. 3,075.38631 MSE, 0.00644 sMAPE, 0.46445 F1-score, AmongMLP,LSTM,GRU,andCNN-LSTM,GRUdelivered and 0.40327 MWRE@0.75']",Hyperparameter optimization is a key strategy for enhancing system performance (iYOLOV7-TPE-SS Leveraging Improved YOLO Model With Multilevel Hyperparameter Optimization for Road Damage Detection on Edge Devices).,"sequence-based approach in the log-based anomaly detection research, as shown in Table 2. In contrast, this paper uses a point-based approach based on the characteristics of the problem and the dataset. Therefore, there are limited references that can be used as baselines for comparison, as described in the following: 1) Pylogsentiment . Using a point-based approach, a sentiment analysis model is trained using a one-layer VOLUME 13, 2025 105369 S. Silalahi et al.: Interpretable Ordinal-Aware With Contrastive-Enhanced Anomaly Severity Detection TABLE 6. Hyperparameter search space for all scenarios. neighbouring classes share common features. GRU, LSTM, and Transformer are explored to find the best- performing encoder. To provide a fair comparison, the GloVe embedding used in pylogsentiment, SentiLog, and TransSentLog are",0.5,0.805820329243839
"proposed scenario can improve the detection performance of the model. D. ABLATION STUDY D. ABLATION STUDY Following the rapid advancement in neural network research, more complex and sophisticated architectures are emerging. A model can consist of layers of components that have a specific role in the learning process. After conducting an experiment on a certain dataset and task, verifying and checking which component in the model contributes posi- tively to the performance is crucial. Therefore, we perform an ablation study to explain which part of the proposed approach has a significant impact on the performance. Note that only the best-performing scenario on each dataset is explored. First, we investigate the significance of the CLS token from the BERT embedding. Secondly,","['. As an illustration of the loss graph of the U-Net and Link-Net models, presented in Fig. 3c and Fig. 3d. TABLE II. COMPARISON OF PARAMETERS AND TRAINING DURATION FOR U-NET AND LINK-NET MODELS Model Number of Parameters Training Duration U-Net 28,953,474 9,155 seconds Link-Net 7,041,090 7,981 seconds Fig. 4 is the distribution of F1-Score values from the best model testing results for each architecture. Both U-Net and Link-Net have asymmetric distributions', '. Additionally, we add interpretability to the (CNN)andlongshort-termmemory(LSTM)toimprovethe modelsothatitsdevelopmentandresultsaretransparentand detection accuracy for binary and multi-class settings [16]. trustworthy. AsdescribedinSectionIV-A,thedatasetusedinthispaperis imbalanced.Inthiscase,SectionIII-Bdiscussestheapproach tohandlethisimbalance', '. TABLE II. SUMMARY COMPARISON OF MODEL EVALUATION Model Backbone Ap FPS Faster R-CNN ConvNext v1 Tiny 0.818 7 Faster R-CNN Mobilenet v3 Large 0.303 18 Fig. 9. Example of incorrect predictions in Mobilenet v3 large. TABLE III. COMPARISON OF AVERAGE PRECISION IN MODEL Model Backbone Ap Ap50 Ap75 Faster R-CNN ConvNext v1 Tiny 0.818 0.984 0.958 Faster R-CNN Mobilenet v3 Large 0.303 0.460 0.364 Fig. 10. Example of missed predictions in Mobilenet v3 large. V', '. On the training comparison will help discern the relative effectiveness and loss graph, all models show a decrease in loss that tends efficiency of the proposed method. By doing so, the aim is to to flatten as the epoch increases. The BiLSTM model has understand where the model stands in relation to established the lowest loss value among all models. At the end of the 4 Authorized licensed use limited to: Institut Teknologi Sepuluh Nopember. Downloaded on July 14,2025 at 08:18:27 UTC from IEEE Xplore', '. The and CatBoost deputize the ML architecture. MLP, LSTM, bestmodelwaschosenbasedontheevaluationofF1-score, GRU, CNN-LSTM, Transformer, and TKAN represent DL precision,accuracy,andrecall,anditwillbeutilizedtoextract architecture.ThisresearchconductedmodifiedTransformer aspectandopiniontermsacrossalldatasets']",,"model plays a significant role in performing the task is crucial to developing a high-performing model. To this end, in this paper, an ablation study is performed. First, we investigate the effect of employing multitask learning on the model’s performance. Secondly, we investigate the effect of using all zeroes for the Normal class label’s representation. Thirdly, the importance of the [CLS] token’s embedding vector and the BERT’s parameters are investigated. Lastly, we com- prehensively study the effect of the proposed DroneSBERT embedding on the model’s performance, interpretability, and learned representations. Overall, the multitask label can improve the detection performance, where the best-performing models on both datasets are achieved by the proposed Multitas-111 label. Using all zeroes to represent the Normal",0.0,0.0
"to explain which part of the proposed approach has a significant impact on the performance. Note that only the best-performing scenario on each dataset is explored. First, we investigate the significance of the CLS token from the BERT embedding. Secondly, we analyse the impact of freezing the BERT’s parameter during training. Thirdly, we vary the batch size during the training. Finally, FIGURE 11. Analysis of the effect of different batch sizes on the evaluation scores of the best-performing models. we examine the effect of increasing the prediction threshold used in our proposed approach on the accuracy and F1 scores. As shown in Table 6, excluding the CLS token embedding before feeding the input matrix to the encoder significantly decreases performance.","['. to guide the training process. To assess the final model’s Circular padding was employed as the padding techgeneralizationability,wemeasuredprecision(P),recall(R), nique. The multi-head attention mechanism incorporated F1score(F1),andaccuracy(te−acc)onaseparatetesting four attention heads and the BiLSTM layer was configured dataset. with 100 hidden units. We used pre-trained GloVe with 50 dimensions [36] and fastText embeddings [37] for word IV. EXPERIMENTS embeddings', '. trained large language models (PLMs), BERT is commonly Therefore,foreachencodertypeandscenario,onlythebestusedinlog-basedanomalydetectionresearch,asdiscussedin performingoneispresentedforcomparisonandexplainedin SectionII.Therefore,allthemodelsinthispaperuseBERTas thefollowingsubsection.Severalmetricsareusedtoevaluate thewordembeddingmodel.Otherthanthesefourbaselines, the overall models’ performance, i.e., accuracy, precision, we construct our own baseline by performing a grid search recall, and F1', '. 14), and learns better representation space combination results as discussed in the previous (see Fig. 15). As shown in Table 9, excluding the [CLS] subsection,severalstate-of-the-artlog-basedanomalydetec- token’svectorandfreezingBERT’sparameterduringtraining tion methods proposed in published studies mentioned in deteriorate the model’s performance', '. Thirdly, Thisisshownbytheattributionscores,wherefiveoutofeight the importance of the [CLS] token’s embedding vector and examples belonging to the High class have negative overall the BERT’s parameters are investigated. Lastly, we comattribution scores', '. Therefore, including Subsection IV-B are also used as baselines to verify the [CLS] token’s feature and tuning BERT’s parameter have a superiority of the proposed method in this paper. After positiveimpactonthemodel’sperformance.Basedonthese implementing the baselines and testing them on the filtered findings, embedding plays a significant role in performing and unfiltered datasets, the results are reported in Table 9. the prediction']",Excluding the [CLS] token’s vector and freezing BERT’s parameters during training significantly deteriorates model performance (Referensi 3).,"CRF is used as the decoder. In terms of convergence speed, as depicted in Fig. 11, the proposed method converges as fast as Transformer and AdaTrans. Moreover, cosine atten- tion outperforms the BiLSTM model. From the F1 score, our proposed method achieves the second-best performance FIGURE 10. Comparison between different encoders with the best performance on the test set of the contextual dataset. results reported in Table 7 to 9, the involvement of either con- textual or static embedding signiﬁcantly affects the model’s performance evaluation score. This can be seen from the dot-product attention performance, with a 3.782% difference between the best dot-product attention that uses BERT and GloVe. This signiﬁcant difference is also happening to the cosine attention, with",0.6666666666666666,0.9501510072435694
"effect of increasing the threshold on the accuracy and F1 scores of the best-performing model tested on both datasets. An interesting case is shown in Fig 12a when λ = 0.65, the accuracy reaches 97%, exceeding the best model’s accuracy when λ = 0.5. This happens when the prediction confidence score surpasses the threshold while the true label’s severity is lower than the prediction label’s. Thus, following the decoding procedure in section III-C, the predicted label is incorrect. This phenomenon also happens on the filtered dataset when λ > 0.94. Overall, the decrement in the accuracy and F1 scores is insignificant until λ = 0.9 and λ = 0.8 on the unfiltered and filtered datasets, respectively. Thus, it confirms the","["". These metrics can be calculated by (1) – (3). This study's calculation of True Positive, False Positive, and False Negative differs from other classifications or detections [20]-[23]. These are chosen and calculated following previous studies [1]. Precision detects the truly correct prediction out of all predictions. Recall detects the truly correct prediction out of all actual classes. F1 scores are harmonic mean between these two that measure overall model performance"", 'improved system performance (mAP, AR, F1mAP,recall,F1-score,andsystemefficiency,whichincludes score) compared to the baseline models [33], [34], [39], inferencetime,FPS,andmodelsize', '. TP pre = (22) TP+FP + ε tagging procedure. The model with the best performance is TP rec = (23) highlighted a bold font. The presented scores in the tables TP+FN + ε containboth proposedandbaselinemodels', '. Even though the recall results still value, which is smaller than the precision value, where the have values below 50%, which means there are still many recall value is related to the ratio of the number of correct missing values from the prediction results, the F1 score predictions with all ground-truth data. However, for other results show promising results with a score reaching 80%', 'that could be vital for accurate classification [40]']","The calculation of True Positive, False Positive, and False Negative metrics is crucial for determining model performance, including accuracy and F1 scores, as highlighted in the study on oil palm tree condition detection (Referensi 1).","we further analyse the effect of increasing the prediction threshold upon inferring the label. As the threshold value is closer to 1, a notable decrease can be seen in Fig. 13b, starting from 0.94. Conversely, the unfiltered dataset in Fig 13a shows a negligible decrease. C. ERROR ANALYSIS C. ERROR ANALYSIS This section discusses the confusion matrix, learned rep- resentation, and the interpretability of the best-performing model on the filtered dataset. The confusion matrix in this paper is redefined to align with the anomaly severity context, where the distance between true and predicted labels matters. If the predicted label is lower than the true label, we define it False Positive (FP). Conversely, if the true label is lower than the",0.5,0.9028799694897011
"each scenario. FIGURE 14. The number of misclassified samples from the best-performing model on each loss function tested on the unfiltered dataset. In a binary setting, let the Normal class be positive and the Anomaly is negative. Then, False Positive (FP) refers to samples with a true label negative but predicted as positive. At the same time, a False Negative (FN) is a case when a sample belongs to a positive class but is predicted as negative. However, in this study, we define the misclassification cases differently: • False Positive refers to a case when the true class is higher than the predicted class. • False Negative is a misclassification case where the true class is lower than the predicted","['. In this context, having less FP is more important than having less FN, as the task objective is anomaly severity detection, where we aim to detect all abnormalities along withtheseveritylevel.Therefore,undetectedabnormalities, or detecting higher severity as lower ones, indicate that the model fails to meet the task’s objectives', '. Thisstudyproposestoextendthebinaryanomalydetection into a multiclass anomaly detection involving four classes: Normal,Low,Medium,andHigh.Thethreeanomalyclasses representingtheseverityoftheabnormalityaredistinguished byseveralcharacteristicsdescribedinSectionIV-A.AsillustratedbyFig.4,adroneexperiencesvariouseventsfromthe takeoff(e )tothelanding(e ).Eacheventisrepresentedby 1 6 a log message that contains a description of the occurring phenomenon.Amongtheeventsthathappenduringaflight, there might be low,', '. An interesting witharandomstateof42. pattern is shown in Table 8 regarding the hyperparameter Four encoder types are selected to be combined with the values on each encoder type. The GRU works well with baseline and proposed scenarios, i.e., Transformer, LSTM, more layers, average pooling, and uniform class weighting. GRU, and Linear, since these encoders are standard in log- Differently, the Linear model has benefited from the [CLS] based anomaly detection as discussed in Section II', '. [13] M. Memarzadeh, B. Matthews, and T. Templin, ‘‘Multiclass anomaly [35] C.Duan,T.Jia,Y.Li,andG.Huang,‘‘AcLog:Anapproachtodetecting detectioninflightdatausingsemi-supervisedexplainabledeeplearning anomaliesfromsystemlogswithactivelearning,’’inProc.IEEEInt.Conf. model,’’J.Aerosp.Inf.Syst.,vol.19,no.2,pp.83–97,Feb.2022. WebServices(ICWS),Jul.2023,pp.436–443. [14] Z.You,L.Cui,Y.Shen,K.Yang,X.Lu,Y.Zheng,andX.Le,‘‘Aunified [36] T.-A. Pham and J.-H', '. Another case scenario in log-based anomaly detection Supervised contrastive learning is employed to learn is a sequence-based approach, where an abnormality is distinctrepresentationsforeachanomalyseveritylevel. determined by analysing a group of events that occur 3) Weexploretwotargetlabelrepresentationstoaugment sequentially within a certain window size [22]']","In anomaly severity detection, prioritizing a reduction in false positives (FP) over false negatives (FN) is crucial to effectively identify all abnormalities and their severity levels (Interpretable Ordinal-Aware With Contrastive-Enhanced Anomaly Severity Detection on UAV Flight Log Messages).","we further analyse the effect of increasing the prediction threshold upon inferring the label. As the threshold value is closer to 1, a notable decrease can be seen in Fig. 13b, starting from 0.94. Conversely, the unfiltered dataset in Fig 13a shows a negligible decrease. C. ERROR ANALYSIS C. ERROR ANALYSIS This section discusses the confusion matrix, learned rep- resentation, and the interpretability of the best-performing model on the filtered dataset. The confusion matrix in this paper is redefined to align with the anomaly severity context, where the distance between true and predicted labels matters. If the predicted label is lower than the true label, we define it False Positive (FP). Conversely, if the true label is lower than the",0.25,0.9255496140385099
"study, we define the misclassification cases differently: • False Positive refers to a case when the true class is higher than the predicted class. • False Negative is a misclassification case where the true class is lower than the predicted class. Table 7 shows the position of FP and FN based on the above definition in a multiclass confusion matrix. VOLUME 12, 2024 64263 S. Silalahi et al.: Severity-Oriented Multiclass Drone Flight Logs Anomaly Detection FIGURE 15. A 2D visualisation of the filtered dataset representation obtained from the best model from each loss function tested on the filtered dataset. t-SNE is used to reduce the dimension of the embeddings. In an anomaly detection setting, FP is more important than FN","['. [8] S. Silalahi, T. Ahmad, and H. Studiawan, ‘‘Drone flight log anomaly severityclassificationviasentenceembedding,’’inProc.Int.Conf.Artif. [30] S. Han, Q. Wu, H. Zhang, B. Qin, J. Hu, X. Shi, L. Liu, and X. Yin, Intell.,Blockchain,CloudComput.,DataAnal.(ICoABCD),Nov.2023, ‘‘Log-basedanomalydetectionwithrobustfeatureextractionandonline pp.100–105. learning,’’IEEETrans.Inf.ForensicsSecurity,vol.16,pp.2300–2311, 2021', '. Inspired by the study, anomalous events on drone objective[33].Anotheralternativetoleveragethepre-trained flight logs can be detected by analysing log messages and model is fine-tuning the models using prompts [34]. With identifying suspect key phrases closely related to drone onlyafewtrainingdata,themodelcancapturethesemantics incident scenarios. Therefore, the region of interest in this of the input logs and detect anomalous log sequences well', '. B. PROBLEMSTATEMENT For instance, at the e , the drone exceeds the maximum In the event that there is only benign data (i.e., no sample 3 flight distance. Several sentiment-baring words or phrases of abnormal data), anomaly detection can be conducted by from the illustration include ‘‘out of range’’, ‘‘overheated’’, training a recurrent neural network (RNN)–based model and ‘‘failed’’', '. 1) We propose DroneLog, an interpretable sentimentAs an example, the flight path taken by a drone during a based multiclass drone flight log anomaly detection flightisrecordedinlongitudeandlatitudecoordinates.These frameworkthatincludesthreeanomalyseveritylevels: datacanbeusedtodetectananomalybyfindingapeculiar low,medium,andhigh.Providingtheseveritylevelcan valuewithinthelogrecordsbycontrastingthenormalvalues provide better detection results for the investigator to', '. [13] M. Memarzadeh, B. Matthews, and T. Templin, ‘‘Multiclass anomaly [35] C.Duan,T.Jia,Y.Li,andG.Huang,‘‘AcLog:Anapproachtodetecting detectioninflightdatausingsemi-supervisedexplainabledeeplearning anomaliesfromsystemlogswithactivelearning,’’inProc.IEEEInt.Conf. model,’’J.Aerosp.Inf.Syst.,vol.19,no.2,pp.83–97,Feb.2022. WebServices(ICWS),Jul.2023,pp.436–443. [14] Z.You,L.Cui,Y.Shen,K.Yang,X.Lu,Y.Zheng,andX.Le,‘‘Aunified [36] T.-A. Pham and J.-H']","The proposed DroneLog framework categorizes anomalies in drone flight logs into three severity levels: low, medium, and high, enhancing detection capabilities (Silalahi et al., 2024).","be employed to force the model to learn a distinctive representation of the positive FIGURE 4. An illustration of anomalies that occur during a drone’s flight. inclusive. Therefore, this paper proposes a multitask-based multiclass drone anomaly detection to assist in a forensic investigation. The main contributions of this paper are summarized as follows: 1) We propose DroneLog, an interpretable sentiment- based multiclass drone flight log anomaly detection framework that includes three anomaly severity levels: low, medium, and high. Providing the severity level can provide better detection results for the investigator to pinpoint the event of interest. Interpretability makes training and testing more transparent, the model trustworthy, and human-friendly. 2) We propose DroneSBERT,1 a domain-specific embed- ding to extract semantic features",0.75,0.9360723075268389
"the performance of the proposed framework has been discussed and analysed. In this section, challenges encountered during the study are disclosed, along with limitations and threats to validity. As drone forensics is an emerging topic, there are very limited public datasets available. The log messages used in this study are mainly acquired from DJI-made devices. There is yet to come a publicly available dataset of log messages from other drone manufacturers. Several publicly available datasets are mainly about sensor data and multimedia artefacts . While in this study, we solely depend on the human-readable messages generated by the drone during a flight. Given the condition where a small number of unique messages and most of them are acquired from DJI","['. challenges for drone digital forensics investigations,’’ Array, vol. 14, Jul.2022,Art.no.100135. [27] J. Qi, Z. Luan, S. Huang, C. Fung, H. Yang, H. Li, D. Zhu, and D.Qian,‘‘LogEncoder:Log-basedcontrastiverepresentationlearningfor [5] H.Studiawan,G.Grispos,andK.-K.-R.Choo,‘‘Unmannedaerialvehicle anomalydetection,’’IEEETrans.Netw.ServiceManage.,vol.20,no.2, (UAV)forensics:Thegood,thebad,andtheunaddressed,’’Comput.Secur., pp.1378–1391,Jun.2023. vol.132,Sep.2023,Art.no.103340. [28] J. Li, H. He, S. Chen, D', '. system(UAS)forensics:Dataextraction&analysis,’’ForensicSci.Int., [28] S.ViswanathanandZ.Baig,‘‘Digitalforensicsfordrones:Astudyoftools Digit.Invest.,vol.41,Jun.2022,Art.no.301379. andtechniques,’’inApplicationsandTechniquesinInformationSecurity, [6] E. Mantas and C. Patsakis, ‘‘GRYPHON: Drone forensics in dataflash L.BatinaandG.Li,Eds.Singapore:Springer,2020,pp.29–41. andtelemetrylogs,’’inAdvancesinInformationandComputerSecurity, [29] M. Debinski, F. Breitinger, and P. Mohan, ‘‘Timeline2GUI: N', '. For instance, GPS records can be utilisedtoreconstructandanalysethepathtakenbythedrone duringaflight[2].Thedeviationbetweentheempiricalflight andreconstructedpathscanhappenifthedroneencountersa GPSspoofing[3]. Among the published drone forensics studies, popular worksincludecasestudies,evidenceanalysis,toolsdevelopment, and forensic framework development [5]', '. 1 illustrates a forensic timeline conWhile the drone is flying, any event that happens to the structed from the flight log message along with mentioned drone is recorded in a log file, including the component’s entitieswithin.Awell-constructedforensictimelineexposes state,suchassensors,motors,GPS,andlinks.Thesedataare sequentialeventsexperiencedbyasystemregardingaparticstoredintelemetryanddataflashlogslocatedinthepersistent ularsecurityincident[21].Inthisresearch,weuseflightlog storage attached to the', '. Section III explains the proposed method, applying process. Also, Barton et al. [11] conducted the research to the Transformer technique to forensics of drone malfunctions. reconstruct the actions taken by these drones, identify their InSectionIV,thediscussionofperformancemethod,followed owners or operators, and extract data from associated mobile by conclusions and future works in Section V. devices. In other research in drone forensics, this paper also analyze II']","The challenges encountered in drone digital forensics investigations are highlighted, particularly the limited availability of public datasets and the reliance on log messages from specific manufacturers like DJI (Studiawan, Grispos, & Choo, 2023).","a scenario design, data generation and acquisi- tion, data analysis, and ﬁnally, reporting. Several references are using DJI , , , Cheerson , Parrot , and Yuneec model as experimental devices. However, there is no attempt to utilize speciﬁc data, in this case, the log message, to perform a drone forensic investigation. For this reason, we propose a deep learning-based Natural Language Processing (NLP) technique to perform information extrac- tion from the log message to assist the forensic investigation process. Information Extraction (IE) is one of the sub-topic in the NLP research domain, which aims to infer knowledge from a lake of text data. There are several steps in performing information extraction; after data source collection and pre- processing, Named",0.25,0.9547007621004259
"the model can be convincing and accountable enough to the investigator to be included in the investigation report. VII. CONCLUSION AND FUTURE WORK VII. CONCLUSION AND FUTURE WORK In this paper, we demonstrate how to train a log-based anomaly detection model that can prioritise the prediction of higher severity anomalies on drone flight logs while increasing the prediction confidence score at the same time. Considering the nature of the dataset, where samples that belong to different severity levels share common features, a multitask vector label representation along with severity-oriented decoding is proposed. An extensive experiment proved that the proposed approach is better than the previous work baselines while being inferior to our baseline scenario based on the accuracy and F1","['. Inspired by the study, anomalous events on drone objective[33].Anotheralternativetoleveragethepre-trained flight logs can be detected by analysing log messages and model is fine-tuning the models using prompts [34]. With identifying suspect key phrases closely related to drone onlyafewtrainingdata,themodelcancapturethesemantics incident scenarios. Therefore, the region of interest in this of the input logs and detect anomalous log sequences well', '. DigitalObjectIdentifier10.1109/ACCESS.2025.3580056 Interpretable Ordinal-Aware With Contrastive-Enhanced Anomaly Severity Detection on UAV Flight Log Messages SWARDIANTARASILALAHI 1,(GraduateStudentMember,IEEE), TOHARIAHMAD 1,(Member,IEEE),HUDANSTUDIAWAN 1,(Member,IEEE), EIRINIANTHI 2,ANDLOWRIWILLIAMS 2 1DepartmentofInformatics,InstitutTeknologiSepuluhNopember,Surabaya60111,Indonesia 2SchoolofComputerScienceandInformatics,CardiffUniversity,CF244AGCardiff,U.K', '. For instance, the message ‘‘Critically low power. Aircraft is landing’’ is more important than ‘‘Forward Obstacle Sensing notWorking’’.ThisstudyproposesDroneLog,aninterpretableframeworkfordetectinganomaliesandthe severity levels on drone flight logs, using a multitask learning approach in a unified pipeline', '. 1) We propose DroneLog, an interpretable sentimentAs an example, the flight path taken by a drone during a based multiclass drone flight log anomaly detection flightisrecordedinlongitudeandlatitudecoordinates.These frameworkthatincludesthreeanomalyseveritylevels: datacanbeusedtodetectananomalybyfindingapeculiar low,medium,andhigh.Providingtheseveritylevelcan valuewithinthelogrecordsbycontrastingthenormalvalues provide better detection results for the investigator to', '. CONCLUSION remains untested as the training dataset contains only log This paper investigates utilising a multitask learning messages acquired from 82 drone models, mostly from paradigmtoperformmulticlassanomalydetectionondrone DJI. This is one of the main challenges in drone forensics flight log messages. Aligning to the nature of multitask research, where human-readable flight log datasets from learning,weproposetwotargetlabelrepresentations,namely other drone models are unavailable']","The proposed DroneLog framework utilizes a multitask learning approach to detect anomalies and their severity levels in drone flight logs (SWARDIANTARASILALAHI et al., 2025).","severity level can provide better detection results for the investigator to pinpoint the event of interest. Interpretability makes training and testing more transparent, the model trustworthy, and human-friendly. 2) We propose DroneSBERT,1 a domain-specific embed- ding to extract semantic features that are well-aligned to the human perception of the log message samples. Supervised contrastive learning is employed to learn distinct representations for each anomaly severity level. 3) We explore two target label representations to augment a multitask learning paradigm for training multiclass classification models. Aligning to the dataset character- istics where the log messages from different anomaly severity levels share common words and phrases, multitask learning can help the model make use of the shared low-level features in the log",1.0,0.9416781713436141
"ANALYSIS We conducted a controlled experiment to evaluate the influence of various word embedding methods on our model’s performance. We used different word embedding techniques, explicitly using fastText as an alternative method to provide comparative performance data for the architecture with different word embedding inputs. This experiment used 540k sentence pairs and maintained the same settings as the previous experiments. This experi- ment compared the results obtained in a previous experiment using the Glove word embedding technique. The performance comparison of the model using different word embedding techniques is shown in Table 4. As seen in 4, our model performs better with Glove word embedding than FastText. Glove’s advantages align with the findings of , which state that the Glove","['. The GloVe word embedding model. In addition, this selection strategy model, trained on an English language corpus, was elected reducestheoccurrenceofout-of-vocabulary(OV)words.The to generate a vector representation of English words. This flowofthewordembeddingselectionprocessisillustratedin decisionisinformedbyfindingsfromaprecedingstudy[14]. Figure3.Theresultsofeachwordembeddingarecombined VOLUME12,2024 137069', '. Therefore, four, used in pylogsentiment, SentiLog, and TransSentLog are six,andeightareexploredintheexperiment.Astwodatasets replaced by BERT embedding as it is better used for text are used in the experiment, there are 1,584 resulting model classification than a static embedding such as GloVe [53]. configurationsintotal,729foreachdataset. Moreover, hyperparameter tuning is also performed on the Considering the extensive number of hyperparameter four aforementioned baselines', '. [13] to explore the impact of text normaliza- semanticsimilaritiesbetweenlanguages.Mostexistingstudtion on specific text processing tasks. However, the lexical ies rely on multiple types of word embedding, which may 137064 VOLUME12,2024', '. text. Ontheotherhand,ifthewordisidentifiedasIndonesian, On the other hand, the GloVe model constructs vector the pretrained Indonesian FastText word embedding will be representations of words within a corpus predicated upon used', '. This layer can utilize vast extractionfromtextbutcouldbemoreeffectiveatencoding real-worldtextcorporatocapturenuancedsemanticrelationsequentialinformation.Furthermore,BiGRUisimplemented ships among words, where aligned vectors often represent for sequential modeling and effectively captures contextual words with similar meanings. Applying word embeddings information from the sequence of features obtained from extendstovariousfields,suchastextclassification,machine the convolution layer']","The GloVe word embedding model, trained on an English language corpus, generates vector representations of words, which supports the findings that GloVe outperforms FastText in certain contexts.","6 show the models’ architecture where LSTM and CNN were used as the character embedding, respectively. From the evaluation score presented in Table 4 to 6, the best performance was achieved by GloVe – Scaled AdaTrans combination with an 87.771% F1 score. AdaTrans atten- tion consistently achieves the highest score for all character embedding and word embedding options. GloVe outperforms the BERT embedding evaluated on the non-contextual dataset for all scenarios. This is because the ﬁrst dataset has con- sistent tagging, meaning that a word has a consistent tag for all different contexts in the dataset. It complies with the GloVe behavior, where each word has exactly one representa- tional vector. BERT – Scaled Transformer achieved the best overall performance",0.6666666666666666,0.9675398015242135
"research introduces a novel Activity Recom- mendation System built on the COBIT 2019 framework tailored for Financial Balance Scorecard. The motivation stems from the challenges faced by auditors when identifying essential activities aligned with strategy of a company, often hindered by manual COBIT 2019 guideline navigation. To address this, a system was developed, where inputting the company strategy, triggers the display of recommended activities automatically. The methodology involved creating interconnected nodes from COBIT 2019 Element in Neo4J. This research uses a real strategy plan case study from 3 different companies as input, followed by a preprocessing step, then compares it to Enterprise Goals using TF-IDF and cosine similarity. Goals with high similarity scores trigger a graph query to reveal connected","['A Recommendation System for Internal Business Processes of COBIT 2019 Using Graph Algorithm and Similarity Methods 1st I Gusti Lanang Agung Oka Cahyadi Pradipta 2nd Rizky Damara Ardy Informatics Departments Informatics Departments Institut Teknologi Sepuluh Nopember Institut Teknologi Sepuluh Nopember Surabaya, Indonesia Surabaya, Indonesia 6025232017@student.its.ac.id 6025231004@student.its.ac.id 3th Riyanarto Sarno 4th Kelly Sungkono Informatics Departments Informatics Departments Institut Teknologi', '. V. CONCLUSION This paper propose a novel recommendation system for internal business processes based on the COBIT 2019 framework.Byintegratinggraphalgorithmsandsimilaritymethods, Fig.2', '. nodesandrelationshipsbasedonCOBIT2019elements. E. Activity Recommendation 2) ImportthepreprocesseddataintoNeo4j,mappingnodes to entities such as internal business processes, control Based on the similarity measurements, the system recomobjectives, and IT processes. mends activities aligned with enterprise goals. The steps are: Authorized licensed use limited to: Institut Teknologi Sepuluh Nopember. Downloaded on July 14,2025 at 08:22:06 UTC from IEEE Xplore. Restrictions apply.', '. It provides activity recommendations for in a table format for easy reference and analysis. The table users based on their specific requirements and objectives, will include detailed information about each recommended tailored to help organizations optimize their internal business activity, including its name, description, associated processes, processes according to COBIT 2019 guidelines', '. The Neo4j activities that correlate with Enterprise Goal EG02, which visualization tool offers a user-friendly interface for explordescribes ”Optimization of business process functionality.” ing COBIT framework relationships, enabling stakeholders to Using Algorithm 3, a graphical representation is created, as make data-driven decisions. Authorized licensed use limited to: Institut Teknologi Sepuluh Nopember. Downloaded on July 14,2025 at 08:22:06 UTC from IEEE Xplore. Restrictions apply.']",The developed system recommends activities aligned with enterprise goals based on similarity measurements derived from COBIT 2019 elements.,"company goals by proposing a novel recommendation system for internal business processes, grounded in the COBIT 2019 framework. The system employs graph algorithms to map relationships, semantic similarity measure- ments to align enterprise goals with management objectives, and LSTM combined with TF-IDF methods to analyze and recommend specific activities. Experimental results show that this system optimizes IT management practices, enhances operational efficiency, and ensures regulatory compliance. Additionally, a user-friendly graphical representation of internal business pro- cesses using Neo4j enables stakeholders to visualize complex relationships within the COBIT framework, facilitating informed decision-making. This research advances IT governance practices by providing organizations with a valuable tool to automate and improve IT strategies, effectively achieving business objectives. Index Terms—COBIT 2019, graph algorithms, IT",0.75,0.910814517235849
"management are vital for businesses in rapidly evolving landscape nowadays. Imple- menting an IT governance framework is crucial for several reasons. Firstly, it enables effective risk management against cyber threats, data breaches, and regulatory requirements, enhancing resilience and protecting sensitive data. Secondly, it ensures alignment between IT strategies and business ob- jectives, driving efficiency, innovation, and competitiveness. Lastly, it facilitates compliance with data privacy regulations and industry standards, ensuring transparency and accountabil- ity. Among these frameworks, COBIT is globally recognized for overseeing Enterprise Information and Technology (I&T) comprehensively, covering all systems regardless of their lo- cation within the organization. In essence, Enterprise I&T extends beyond the confines of the IT department and encompasses all facets of technology and information processing","['performance in the realm of critical role of risk management in IT governance', '. This system aims COBIT 2019, which stands for Control Objectives for to help organizations manage risk, ensure compliance, and Information and Related Technologies, is a comprehensive enhanceperformanceinthecontextofinformationtechnology', '. systems [12]. Through the use of the COBIT 2019 framework, COBIT provides comprehensive guidance for identifying, auditors can pinpoint key controls necessary to achieve establishing, and monitoring the necessary controls within the predefined business objectives. Meanwhile, event log process IT environment to achieve defined business objectives [3], [4]', '. Using COBIT metrics, organizations XGBoost 4.29 6.34 0.69 40.45 can evaluate and improve the quality of IT Governance, LightGBM 4.74 7.53 0.56 45.14 ensure compliance with regulatory provisions, and improve CatBoost 4.25 6.53 0.67 36.26 operational efficiency. As a result, these initiatives not only are presented in Table IV using MAE, RMSE, R², and MAPE improve the efficiency of project planning and execution but me trics', 'security, and operational efficiency of their information specific areas of IT management. COBIT 2019 provides systems. comprehensive guidance for understanding, planning, and implementing effective and efficient IT management Sungkono K et al., [13] explores the use of graphs to principles [21]. By adopting COBIT 2019, organizations can identify incorrect judgments and patterns in corporate improve their IT performance, reduce risks, and ensure that IT operations']","COBIT 2019 provides a comprehensive framework that enhances performance in the context of information technology, facilitating risk management and compliance (A Recommendation System for Internal Business Processes of COBIT 2019 Using Graph Algorithm and Similarity Methods).","assist organizations in managing and optimizing their use of information technology (IT) . landscape, effective IT In today’s rapidly evolving digital governance is essential for organizations to ensure that their IT investments align with business objectives, comply with regulations, and mitigate risks . COBIT 2019 provides a structured approach for organiza- tions to establish, implement, and maintain effective gover- nance over IT. It defines the components necessary to create and sustain a governance system, as well as guidelines for building the most suitable governance system for an enterprise . By utilizing COBIT 2019, organizations can enhance the efficiency, effectiveness, and reliability of their IT usage, while also ensuring compliance with relevant regulations, policies, and standards . One of the key",0.8,0.8644815884113833
"COBIT Core Model and Capability Scores, it is necessary to undergo a mapping process according to the instructions in the COBIT 2019 manual. This can be time-consuming, especially when auditor should auditing multiple companies simultaneously. This research aim to simplify the process to get Activities of COBIT 2019 automatically from Input Text Company Strategy that aligned with the description of related Enterprise Goals. This research adopts Neo4j, a graph database platform, to manage KG and process data related to these objectives, to gain deeper and more applicable insights into the relationships between strategic and operational objectives in a company . Furthermore, this research also involves the function of preprocessing the input text in the form of Company Strat- egy using","['Neo4jisagraphdatabasespecificallydesignedtostoreand functions by enhancing the organization’s ability to manage data with complex relationships [8]. In the context manage IT effectively. of COBIT 2019, Neo4j can be utilized to build dynamic 2) EG09: Internal Business Process Cost Optimization: graphical representations of various COBIT elements [9]', '. The Neo4j activities that correlate with Enterprise Goal EG02, which visualization tool offers a user-friendly interface for explordescribes ”Optimization of business process functionality.” ing COBIT framework relationships, enabling stakeholders to Using Algorithm 3, a graphical representation is created, as make data-driven decisions. Authorized licensed use limited to: Institut Teknologi Sepuluh Nopember. Downloaded on July 14,2025 at 08:22:06 UTC from IEEE Xplore. Restrictions apply.', '. information technology [12]. COBIT 2019 provides specific guidance on how organizations can improve the efficiency and effectiveness of their II. LITERATURESTUDY internal business processes, as well as enhance the skills of A. Neo4j as Graph Database their IT staff. By following the recommendations outlined in Neo4jisapopulargraphdatabasewidelyusedformanaging COBIT 2019, organizations can better manage IT, increase and querying complex relational data', '. deeper analysis, real-time monitoring, and informed IT manAfter identifying company goals with a similarity value agement decisions. greater than 50, these nodes are used as references for the Our results demonstrated the system’s effectiveness in sugnext graph query execution to obtain the required activities. gesting activities tailored to enterprise goals, enhancing IT The output matches the mapping results, displaying only management practices and operational efficiency', '. The approach integrates data collection, graphstructuresintheNeo4jdatabase,aswellastoqueryand preprocessing, graph database modeling with Neo4j, and recanalyze data related to those structures [14]. ommendationgenerationusinggraphalgorithmsandsimilarity methods. The complete process shown in figure 1 B. COBIT 2019 Internal Business Process A']",This research integrates data collection and graph structures in the Neo4j database to query and analyze data related to COBIT 2019 activities.,"company goals by proposing a novel recommendation system for internal business processes, grounded in the COBIT 2019 framework. The system employs graph algorithms to map relationships, semantic similarity measure- ments to align enterprise goals with management objectives, and LSTM combined with TF-IDF methods to analyze and recommend specific activities. Experimental results show that this system optimizes IT management practices, enhances operational efficiency, and ensures regulatory compliance. Additionally, a user-friendly graphical representation of internal business pro- cesses using Neo4j enables stakeholders to visualize complex relationships within the COBIT framework, facilitating informed decision-making. This research advances IT governance practices by providing organizations with a valuable tool to automate and improve IT strategies, effectively achieving business objectives. Index Terms—COBIT 2019, graph algorithms, IT",0.5,0.8410332720062619
"in business process modeling. Using real- life data and public datasets, the research compared GPD++ to traditional methods like Inductive Miner (IM) and Split Miner (SM). Results showed that GPD++ effectively addressed ICRs and detected hierarchical blocks. The paper introduces the Invisible-Task Prime and Non-Prime ITPNP algorithm for mining invisible tasks in process models, focusing on XOR and AND/OR relationships. It detects invisible non-prime tasks in hybrid parallel rela- tionships. Tested on seven models, it outperformed traditional methods, achieving high fitness and precision, especially in complex scenarios. Research by introduces an improved method for detect- ing parallel process models in graph-based process discovery. By establishing relationship frequencies and using specific algorithms, the method accurately distinguishes XOR, AND, and OR relationships.","['. DigitalObjectIdentifier10.1109/ACCESS.2023.3324742 Extending Graph-Based Process Discovery for Hierarchical Block Detection and Incomplete Concurrent Relationship Handling INDRAWASPADA 1,3,RIYANARTOSARNO 1,(SeniorMember,IEEE),ENDANGSITIASTUTI2, HANUNGNINDITOPRASETYO1,4,ANDRADENBUDIRAHARJO1,5 1DepartmentofInformatics,FacultyofIntelligentElectricalandInformaticsTechnology,InstitutTeknologiSepuluhNopember,Surabaya60111,Indonesia 2DepartmentofBusinessAdministration,BrawijayaUniversity,Malang65145,Indonesia', '. structure and can handle complex behaviors such as parallelism and choices effectively. Heuristic Miner is an By using the DISCO application, a log event map was algorithm that uses a heuristic approach to extract process obtained as shown in Fig. 1. the log event map is a visual models from event log. Heuristic Miner is more robust and representation of all activities and events that occur within a capable of handling noisy logs and more complex business process over a certain period', '. Inductive Miner (IM) and Split Miner (SM) able to detect invisible tasks, and requiring concurrent exit alsocannotdetectICR,soitwillbedetectedasanadditional nodestobeabletorecognizetheblockstructure.Tocorrect splitorjoin,reducingthequalityoftheresultingmodel', '. Based A. REAL-LIFECASEWITHSPLIT-JOINBLOCKHIERARCHY on the identified block, the position of the joint gate can be PATTERNANDCONTAININGICR determined.However,theAND-joingateandXOR-joingate Most process model discovery algorithms depart from the atthisstagehavenotbeeninstalledinthemodel,butonlythe directlyfollowsgraph(DFG)representation.Anoverviewof gatenameandlocationarerecorded(connectedtoanynode). 123386 VOLUME11,2023', '. I. INTRODUCTION Automaticdiscoveryoftheprocessmodelsfromtheevent Automatic discovery of process models from event logs logssignificantlycontributestoorganizations,fromfinance, makesasignificantcontributiontomanyorganizations,from health, industry, government, and many others, in capturing finance,health,industry,government,andmanyotherfields, amodeldescriptionoftheexecutionofbusinessprocessesin incapturingdescriptionsofbusinessprocessexecutionmod- the field [1]']","The research indicates that traditional methods like Inductive Miner and Split Miner are unable to detect incomplete concurrent relationships (ICRs), which can be addressed by the proposed GPD++ method.","more reliable in detecting and handling ICR patterns. B. GRAPH-BASED PROCESS DISCOVERY PLUS B. GRAPH-BASED PROCESS DISCOVERY PLUS PLUS (GPD++) GPD++ consists of the main algorithm for detecting split and join blocks presented in Algorithm 1 and the algorithm for finding the block hierarchy and its types (XOR or AND) in Algorithm 2 and Algorithm 3. GPD++ utilizes the detected block structure to identify ICR in blocks parallel (long). As an illustration of how Algorithm 1 works in finding split-join blocks, an example of a DFG model with one split node (|T| = 1) and one join node is given in figure 4. The input for Algorithm 1 is the DFG model with split-node and join-node information. The results of",0.5,0.9332002690562444
"by identifying Enterprise Goals corre- lated with the Balanced Scorecard Financial. Then, Alignment Goals related to these Enterprise Goals were mapped. Subse- quently, Management Objectives from the COBIT Core Model associated with Alignment Goals were identified. Examples of these mappings are shown in TABLE I. Following this, Activ- ities and their descriptions were compiled for each Manage- ment Objective, based on COBIT guidelines, as demonstrated in TABLE II. A total of 1202 activities were found to correlate with the Balanced Scorecard Financial perspective during the mapping process. B. Create Graph Database After the completion of the Mapping process, the next step is to create nodes and their relationships using Neo4J Graph Database Tools, in order to construct a Knowledge Graph","['. 24: SETOBJECTIVE.description=row.OBJECTIVE DESC 2) MappingfromBalancedScorecardtoActivity:Estab- 25: MERGE(AG TO)-[:HAS OBJECTIVE]->(OBJECTIVE) 26: endfor lish relationships between Enterprise Goals, Alignment 27: Goals, Management Objectives, and Activities. This 28: foreachignoreINCASEWHENrow.OBJECTIVE TOISNOTNULL mapping follows these steps: THEN[1]ELSE[]ENDdo 29: MERGE (OBJECTIVE TO:OBJECTIVE {name: a) Identify Enterprise Goals (EG) from the Balanced row.OBJECTIVE TO}) Scorecard (BSC)', '. An example 1: MATCH (BSC:BSC)-[:HAS EG]->(EG:EG)-[:HAS AG]>(AG:AG)-[:HAS OBJECTIVE]->(OBJECTIVE:OBJECTIVE)- of this mapping process is shown in Table I, which maps [:HAS ACTIVITY]->(ACTIVITY:ACTIVITY) the Balanced Scorecard (BSC), Enterprise Goals (EG), and 2: WHERE EG.description IN [”Optimization of business process costs”, Alignment Goals (AG)', '. [9] A. Ghezzi, “How Entrepreneurs make sense of Lean the Balanced Scorecard, IPMS, and Performance Prism Startup Approaches: Business Models as cognitive lenses because these three models provide more intuitive and userto generate fast and frugal Heuristics,” Technological friendly frameworks. The research also highlights that in Forecasting and Social Change, vol. 161, no. June, p. determining performance indicators, there are variations due 120324, 2020, doi: 10.1016/j.techfore.2020.120324', '. The Neo4j activities that correlate with Enterprise Goal EG02, which visualization tool offers a user-friendly interface for explordescribes ”Optimization of business process functionality.” ing COBIT framework relationships, enabling stakeholders to Using Algorithm 3, a graphical representation is created, as make data-driven decisions. Authorized licensed use limited to: Institut Teknologi Sepuluh Nopember. Downloaded on July 14,2025 at 08:22:06 UTC from IEEE Xplore. Restrictions apply.', '. Using COBIT metrics, organizations XGBoost 4.29 6.34 0.69 40.45 can evaluate and improve the quality of IT Governance, LightGBM 4.74 7.53 0.56 45.14 ensure compliance with regulatory provisions, and improve CatBoost 4.25 6.53 0.67 36.26 operational efficiency. As a result, these initiatives not only are presented in Table IV using MAE, RMSE, R², and MAPE improve the efficiency of project planning and execution but me trics']","The mapping process identifies Enterprise Goals from the Balanced Scorecard, which correlates with Management Objectives and Activities (A Recommendation System for Internal Business Processes of COBIT 2019 Using Graph Algorithm and Similarity Methods).","is linked to the appropriate business objec- tives and control needs, thus enhancing overall governance effectiveness . One effective way to perform this mapping is by utilizing a graph database such as Neo4j . Neo4j is a graph database specifically designed to store and manage data with complex relationships . In the context of COBIT 2019, Neo4j can be utilized to build dynamic graphical representations of various COBIT elements . By using Neo4j, organizations can create dynamic and interactive graphical models to better understand and manage the complex relationships between different COBIT 2019 elements . This allows for deeper analysis, real-time monitoring, and better decision-making in IT management, ultimately aiding in the achievement of business goals . In summary, this",0.6666666666666666,0.9505967875181217
"IX, it can serve as an internal reference for the company to assess its capability to meet these criteria and can also serve as a reference for formulating policies to prioritize the implementation of these activities in the future. V. CONCLUSION V. CONCLUSION In conclusion, the developed Activity Recommendation System based on COBIT 2019 framework offers a practical solution to the challenges faced by auditors in identifying and aligning activities with company strategy. By leveraging NLP techniques and graph queries, the system efficiently matches user input of company strategy with relevant activities automatically, eliminating the need for manual navigation through COBIT 2019 guidelines. The effectiveness of the system was demonstrated by in- putting company strategies from three companies in different","['. It provides activity recommendations for in a table format for easy reference and analysis. The table users based on their specific requirements and objectives, will include detailed information about each recommended tailored to help organizations optimize their internal business activity, including its name, description, associated processes, processes according to COBIT 2019 guidelines', 'A Recommendation System for Internal Business Processes of COBIT 2019 Using Graph Algorithm and Similarity Methods 1st I Gusti Lanang Agung Oka Cahyadi Pradipta 2nd Rizky Damara Ardy Informatics Departments Informatics Departments Institut Teknologi Sepuluh Nopember Institut Teknologi Sepuluh Nopember Surabaya, Indonesia Surabaya, Indonesia 6025232017@student.its.ac.id 6025231004@student.its.ac.id 3th Riyanarto Sarno 4th Kelly Sungkono Informatics Departments Informatics Departments Institut Teknologi', '. The Neo4j activities that correlate with Enterprise Goal EG02, which visualization tool offers a user-friendly interface for explordescribes ”Optimization of business process functionality.” ing COBIT framework relationships, enabling stakeholders to Using Algorithm 3, a graphical representation is created, as make data-driven decisions. Authorized licensed use limited to: Institut Teknologi Sepuluh Nopember. Downloaded on July 14,2025 at 08:22:06 UTC from IEEE Xplore. Restrictions apply.', '. deeper analysis, real-time monitoring, and informed IT manAfter identifying company goals with a similarity value agement decisions. greater than 50, these nodes are used as references for the Our results demonstrated the system’s effectiveness in sugnext graph query execution to obtain the required activities. gesting activities tailored to enterprise goals, enhancing IT The output matches the mapping results, displaying only management practices and operational efficiency', '. Recommendations based on COBIT 2019 best practices, such as performance measurements and knowledge repository access, further enhance IT governance processes and contribute to the success of software development projects. The integration of AI and machine learning techniques with the COBIT 2019 framework holds promise in further enhancing IT governance practices [19]']","The developed Activity Recommendation System effectively suggests activities tailored to enterprise goals, enhancing management practices and operational efficiency (Oka Cahyadi Pradipta et al., 2023).","company goals by proposing a novel recommendation system for internal business processes, grounded in the COBIT 2019 framework. The system employs graph algorithms to map relationships, semantic similarity measure- ments to align enterprise goals with management objectives, and LSTM combined with TF-IDF methods to analyze and recommend specific activities. Experimental results show that this system optimizes IT management practices, enhances operational efficiency, and ensures regulatory compliance. Additionally, a user-friendly graphical representation of internal business pro- cesses using Neo4j enables stakeholders to visualize complex relationships within the COBIT framework, facilitating informed decision-making. This research advances IT governance practices by providing organizations with a valuable tool to automate and improve IT strategies, effectively achieving business objectives. Index Terms—COBIT 2019, graph algorithms, IT",0.75,0.9098616773219367
"the system efficiently matches user input of company strategy with relevant activities automatically, eliminating the need for manual navigation through COBIT 2019 guidelines. The effectiveness of the system was demonstrated by in- putting company strategies from three companies in different sectors. The system provided a list of recommended activities that can be undertaken to achieve strategic objectives of each companies. Moving forward, there are opportunities to enhance and refine the system to improve both the accuracy of the rec- ommendations and the user experience, ensuring its continued utility and influence in enterprise governance and audit man- agement. Future upgrades could focus on enhancing the user interface to accommodate users with less technical expertise and improving the integration of the proposed","['. It provides activity recommendations for in a table format for easy reference and analysis. The table users based on their specific requirements and objectives, will include detailed information about each recommended tailored to help organizations optimize their internal business activity, including its name, description, associated processes, processes according to COBIT 2019 guidelines', 'A Recommendation System for Internal Business Processes of COBIT 2019 Using Graph Algorithm and Similarity Methods 1st I Gusti Lanang Agung Oka Cahyadi Pradipta 2nd Rizky Damara Ardy Informatics Departments Informatics Departments Institut Teknologi Sepuluh Nopember Institut Teknologi Sepuluh Nopember Surabaya, Indonesia Surabaya, Indonesia 6025232017@student.its.ac.id 6025231004@student.its.ac.id 3th Riyanarto Sarno 4th Kelly Sungkono Informatics Departments Informatics Departments Institut Teknologi', '. Recommendations based on COBIT 2019 best practices, such as performance measurements and knowledge repository access, further enhance IT governance processes and contribute to the success of software development projects. The integration of AI and machine learning techniques with the COBIT 2019 framework holds promise in further enhancing IT governance practices [19]', '. By leveraging COBIT recommendspecificactivities.Experimentalresultsshowthatthis 2019, organizations can minimize risks and increase the value systemoptimizesITmanagementpractices,enhancesoperational efficiency, and ensures regulatory compliance. Additionally, a of their investments in information technology, thus helping user-friendly graphical representation of internal business pro- them achieve their business objectives more effectively [1]', '. V. CONCLUSION This paper propose a novel recommendation system for internal business processes based on the COBIT 2019 framework.Byintegratinggraphalgorithmsandsimilaritymethods, Fig.2']","The recommendation system offers tailored activity recommendations in a table format, designed to assist organizations in optimizing their internal business activities according to COBIT 2019 guidelines (Oka Cahyadi Pradipta et al., 2023).","technology, thus helping them achieve their business objectives more effectively . Several previous papers still rely on manual approaches to COBIT 2019, which have limitations in providing automated recommendations for audit activities based on company goals. Thus, this research contributes significantly by addressing this gap and overcoming the challenges associated with manual COBIT utilization. The primary objective of this paper is to develop a rec- ommendation system that aligns with the internal business process strategy governed by COBIT 2019. This system aims to help organizations manage risk, ensure compliance, and enhance performance in the context of information technology. To achieve this, the research will utilize graph algorithms to build a recommendation system based on the internal business processes outlined in",0.6666666666666666,0.8990952513929258
"whereas 27 chops had quality defects. B. Volatile Organic Compounds Identification Through Chromatography-Mass Spectrometry (GC-MS), it was found that there were 143 VOCs in the good-quality sample and 118 VOCs in the quality-defect sample. Then it also obtained that there were 102 similar compounds present Fig. 4. Number of Compounds in Each Classes Fig. 5. Percentage of Area of Compounds in Each Classes in both sample 1 and sample 2, which are detailed in TABLE II. The results of grouping chemical substances into several groups, including nitrogenous compounds, alcohols, esters, hydrocarbons, hetero- oxygenates, and others. Substance content in each class of compounds means that different concentrations are shown as Area as shown in TABLE II. aldehydes, phenols, ketones, In GC-MS,","['. instrument is around USD 120,000 in 2017 [17], while the cost of testing a sample is about USD 50. In addition, the II. RELATEDWORKS testing process of one sample can take about 1 to 2 days, E-nosecanbeusedforfoodauthenticationandadulteration depending on the complexity of the gases. Another consid- assessment,assummarizedinTABLE1.Researchtodetect erationistheassistanceofapersonwhohasexperiencewith meatadulterationusinganelectronicnosehasdevelopedand operatingtheGC-MSinstruments. is being studied', '. ABSTRACT Recently,theissueoffoodauthenticationhasgainedattention,especiallyhalalauthentication, becauseofcasesofporkadulterationinbeef.Manystudieshavedevelopedrapiddetectionforadulterated meat. However, these studies are not yet practical and economical methods and instruments and a faster analysis process. In this context, this paper proposes the Optimized Electronic Nose System (OENS) for more accurately detecting pork adulteration in beef', 'R.Sarnoetal.:DetectingPorkAdulterationinBeefforHalalAuthenticationUsinganOptimizedElectronicNoseSystem FIGURE1. Schematicofthee-noseexperimentforOENS. withwater;and(iii)replacingwithcheaperwine.Therefore, Forinterestedreaders,recentdevelopmentandchallengesfor the combination between e-nose and multivariate statistical e-nosesignalprocessingaresummarizedhere[42]. methods improved the traceability and the classification of grapes and wine (especially the varieties and the geograph- III', '. de Gennaro, P. Barbieri, S. Briguglio, M. Amodio, [14] Y.Wang,J.Zhao,F.Xu,X.Wu,W.Hu,Y.Chang,L.Zhang,J.Chen, L.deGennaro, and F. Lasigna, ‘‘Improving recognition of odors in andC.Liu,‘‘GC-MS,GC-OandOAVanalysesofkeyaromacompounds a waste management plant by using electronic noses with different injiaozisteamedbread,’’GrainOilSci.Technol.,vol.3,no.1,pp.9–17, technologies, gas chromatography–mass spectrometry/olfactometry and Mar.2020. dynamic olfactometry,’’ J. Cleaner Prod., vol', '. Applicationofelectronicnosesforfoodassessmentinthelast sensor analysis. The e-nose features offer five main cate- fiveyears. goriesoffoodanalysisthatcanbeused:monitoring,expiry checking,freshnessevaluation,puritytesting,andotherfood qualitycontrolinvestigations.Hence,themotivationforthis studycanbeformulatedasfollows: 1. Severaltypesofresearchhaveusedane-nosetoidentify pork adulteration in beef for food quality control']",,"baked goods’ quality can be determined by the gas or vapor content. Gas chromatography is the standard instrument for quantitatively and qualitatively analyzing volatile organic compounds (VOCs). This method separates compounds in a mixture by injecting a gas sample into the mobile phase, usually called the carrier gas, and passing the gas through the stationary phase , , . Volatile compounds identified in aldehydes, alcohols, acids, alkanes, and ketones are the main components that contribute VOLUME 12, 2024 2024 The Authors. This work is licensed under a Creative Commons Attribution-NonCommercial-NoDerivatives 4.0 License. For more information, see 97235 TABLE 1. The ingredients of the cookie. to the cookie flavor . Chemical compounds grouped as hydrocarbons are also released while making and",0.0,0.0
"Recall or sensitivity is the number of true positive predictions compared to all true positive data. Precision is the number of positive results compared to all positive predicted data. F-Score is the average precision and recall compared to weighting. Speciﬁcity is the number of true negative predictions compared to all negative data. Equations 15 to 19 are used to calculate these metrics. In addition to these metrics, the measurement of model performance evaluation also uses Receiver Operating Characteristics (ROC) and Area Under Curve (AUC). ROC is a probability curve and AUC is an area that shows the level of accuracy of the model empirically. The classiﬁcation results show poor performance if the ROC Curve is close to the baseline and","["". These metrics can be calculated by (1) – (3). This study's calculation of True Positive, False Positive, and False Negative differs from other classifications or detections [20]-[23]. These are chosen and calculated following previous studies [1]. Precision detects the truly correct prediction out of all predictions. Recall detects the truly correct prediction out of all actual classes. F1 scores are harmonic mean between these two that measure overall model performance"", '. performance evaluation score, where the highest accuracy Following the definition in the previous paragraph, we plot is under 85%, the model needs further improvement so that the frequency of each misclassification type in Fig 13 and thedetectionvaliditycanbeenhancedandthatthedetection Fig 14', '. The dataset Both consistently performs Fig.6focusoncomparingaveragemetricsperstageandper best,achievingthehighestAccuracy(94.56%)andPrecision anatomicaltract.Fig.5comparesStage1andStage2,reveal- (97.90%) in Stage 1, as well as strong Recall (96.90%) in ing that Stage 1 generally outperforms Stage 2 in Precision Stage 2. In contrast, data availability for the Public dataset (85.72%), Accuracy (93.06%), and Specificity (92.66%)', 'that could be vital for accurate classification [40]', 'TABLE IV. COMPARISON PERFORMANCE OF EACH MODEL Performance Model Accuracy Precision Recall F1 Score Random Forest 0.989 0.989 0.989 0.989 Decision Tree 0.979 0.979 0.979 0.979 Logistic 0.700 0.688 0.700 0.663 Registrion SVM 0.695 0.779 0.695 0.607 D. Performance Comparison of Predictive Analysis The prediction analysis used in this research compares the Fig. 10']","Precision and recall are defined as the true positive predictions out of all predictions and actual classes, respectively, with F1 scores serving as a harmonic mean of these two metrics to assess overall model performance (Referensi 1).","with the following formula: TP + TN TP + TN + FP + FN Accuracy = Precision = Recall/True Positive Rate(TPR) TP TP + FP TP TP + FN F1 = 2 × precision × recall precision + recall FP TN + TP (cid:90) 1 TPRd(FPR) False Positive Rate(FPR) = AUC = (4) (5) (6) (7) (8) (9) where TP is the number of correctly predicted positive labels, TN is the number of correctly predicted negative labels, FP is the number of incorrectly predicted positive labels, and FN is the number of incorrectly predicted negative labels. Accuracy is the ratio of true predictions to the overall data. Precision is the ratio between TP to the total number of positive predic-",0.8,0.9501431911906126
"forming non-overlapping sub- arrays within the array , naturally limiting the achievable beamwidth of each beam and making inefﬁcient use of the available aperture. A third option can be taken by arranging the array into partially or fully overlapping subarrays coupled with the use of orthogonal waveforms, each associated to a generated beam, a solution belonging to the class of the multi- input multi-output (MIMO) radars discussed below. MIMO radars have developed into a strong contender for multi-antenna radar systems, applying the concept of virtual sensors with orthogonal waveform diversity –. Our interest in MIMO radars in relevance to the problem at hand arises due to their capability to produce multiple orthog- onal beams by selecting an appropriate set of","['. With this advantage, PA radars ject [6]–[18]. Unlike the PA radar, the MIMO radar utilizes have been used for such applications as micro-scale radars manyantennasthattransmitorthogonalsignalstoobtainthe signal reflected from the target at the receiver, a scheme The associate editor coordinating the review of this manuscript and known as waveform diversity [9]. Consequently, MIMO approvingitforpublicationwasDimitrisE.Anagnostou', '. DigitalObjectIdentifier10.1109/ACCESS.2020.2965192 FPMIMO: A General MIMO Structure With Overlapping Subarrays for Various Radar Applications SYAHFRIZALTAHCFULLOH 1,2,(StudentMember,IEEE),AND GAMANTYOHENDRANTORO 1,(SeniorMember,IEEE) 1DepartmentofElectricalEngineering,InstitutTeknologiSepuluhNopember,Surabaya60111,Indonesia 2DepartmentofElectricalEngineering,UniversitasBorneoTarakan,Tarakan77123,Indonesia Correspondingauthor:SyahfrizalTahcfulloh(syahfrizal15@mhs.ee.its.ac.id)', '. The summation of outputs from 1) Thispaperdescribesthereceiverprocessingofmulti- individual receive modules across the array provides beam CC-OFDM MIMO Radar which is designed the array gain and serves to increase the receive SNR for long-range radar surveillance application. The for each beam', '(13) herein as the subarrayed MIMO (SMIMO) radars, such as theFPMIMOradar,rangesbetweentwoextremeconfiguraNotation ⊗ denotes the Kronecker product operator, tions, namely the PA and the MIMO radar', '. REVIEWONMAXIMUMNUMBEROFDETECTED has been described by [13]. In a MIMO radar, in which TARGETSFORMIMORADAR K elements in the Tx array transmit orthogonal waveforms For clarity in discussions that follow, herein we provide a andLelementsintheRxarrayreceiveechosignalsfromtar- shortreviewoftheperformanceofMIMOradarsinthemaxgetsoperatingindependently,theVAdimensionisexpressed imum number of detected targets, mostly taken from [13]']","MIMO radars utilize multiple antennas that transmit orthogonal signals to capture reflected target signals, a method referred to as waveform diversity (Tahcfulloh & Hendrantoro, 2020).","biomedical engineering, macro-scale radars on radio- astronomy, and so on , . However, in PA radars the number of detected targets is limited by the angular and range resolution. More recently, the multi-input multi-output (MIMO) radar has become an interesting research sub- ject –. Unlike the PA radar, the MIMO radar utilizes many antennas that transmit orthogonal signals to obtain the signal reﬂected from the target at the receiver, a scheme known as waveform diversity . Consequently, MIMO radars have been successfully applied for radar imaging, 11248 This work is licensed under a Creative Commons Attribution 4.0 License. For more information, see VOLUME 8, 2020 S. Tahcfulloh, G. Hendrantoro: FPMIMO: General MIMO Structure With Overlapping Subarrays for Various Radar Applications",0.8,0.936845633669492
"of the Golay codes to orthogonalization of different symbols in a frame in the same beam. Doppler detection can further be accomplished by transmitting a frame of symbols repeatedly for several times, thus allowing the receiver to detect the changes in phase along different frames. The realization of such multi-beam radars that adopts the CC-OFDM MIMO concept also allows for application of further signal process- ing, such as monopulse processing to determine the angular direction of the target more accurately, but this is beyond the scope of our paper. The CC-OFDM MIMO concept presents a breakthrough in the realization of multi-beam radar in a way that has not been tried before, combining different strategies in a novel way to obtain","['. However, all of the above thereceiverprocessingofCC-OFDM-MIMOradar,whichis mentioned methods have problems in beam limitation and differentfromthoseinothertypesofOFDMMIMOradarsor cost. other multi-TRM radars due to the nature of the orthogonal Current trends regarding dual functional radar communi- multi-beamgenerationwithGolay-codedOFDMwaveforms cation (DFRC) systems which lead to an integrated sensing andsubbands', '. INDEX TERMS Circulating-codes, Golay-codes, interference, MIMO-radar, multibeam, OFDM-radar, sub-band,surveillance. I. INTRODUCTION Manyradarapplicationsdemandscanningcapabilitytoallow The associate editor coordinating the review of this manuscript and coverage over a range of angular direction, such as those approvingitforpublicationwasXueboZhang . forsurveillance,vehicular,weathermonitoring,imaging,and 2025TheAuthors.ThisworkislicensedunderaCreativeCommonsAttribution4.0License', '. CC-OFDM MIMO radar waveform design which the degree of orthogonality can be further improved by is discussed in this paper is not a CP based radar, the assigningdifferentsubbands,fortheneighboringbeams,and transmittersaretransmittingmultipleorthogonalsymbolsin thesamesubbandcanbereusedforthenon-adjacentbeams. serieswithoutanyguardtimeintervalbetweenthesymbols. The interference among these co-channel beams can be The symbol series are orthogonal to each other, hence VOLUME13,2025 109895', '. This means that the with the Golay codes which corresponds to a specific rangeresolutionwillbe60meter.TheCC-OFDMindividual beamsymbolasstatedintheschedule.Thebeautyof symbol duration is 0.1 ms, and the transmitters transmit a the receiver processing of CC-OFDM MIMO radar is frame consisting of 12 consecutive symbols in series', '. [21] Z. Xu and A. Petropulu, ‘‘A bandwidth efficient dual-function radar communication system based on a MIMO radar using OFDM waveforms,’’ IEEE Trans. Signal Process., vol. 71, pp.401–416, 2023, doi: 10.1109/TSP.2023.3241779. [22] U.B.SaracandG.M.Guvensen,‘‘Knowledge-aidedandadaptivebeamsquintawareMIMO-OFDMradardetectorsforISAC,’’IEEETrans.Commun.,earlyaccess,May8,2025,doi:10.1109/TCOMM.2025.3568219. [23] M. Schurwanz, J. Mietzner, and P. A']","The symbol series in CC-OFDM MIMO radar are orthogonal to each other, enhancing the effectiveness of multi-beam radar systems (Receiver Processing of the Multibeam Azimuth Scanning CC-OFDM-MIMO Radar).","and radial velocity detection of targets is not discussed yet. The contribution of this paper is in the receiver processing of CC-OFDM-MIMO radar, which is different from those in other types of OFDM MIMO radars or other multi-TRM radars due to the nature of the orthogonal multi-beam generation with Golay-coded OFDM waveforms and subbands. There are previous research on radar waveform for ISAC purposes , which discussed about cyclic prefix (CP) based OFDM waveform and how the CP is very much defining the maximum unambiguous range of the radar system. CC-OFDM MIMO radar waveform design which is discussed in this paper is not a CP based radar, the transmitters are transmitting multiple orthogonal symbols in series without any guard time",0.3333333333333333,0.9365368280035685
"signal is circulated from one antenna element to another with a relatively small time-delay differ- ence ((cid:49)t), made possible by circulating codes (CC) , , . Hence the transmit signal from the p-th element for a transmit antenna array with an odd number of elements, Nt , can be written as: xp(t) = x(t − p(cid:49)t), Nt − 1 , . . . , Nt − 1 (1) The time delay difference of the circulating signal corre- sponds to a phase difference between the antenna elements at a given frequency: (cid:49)ϕ = 2πf (cid:49)t (2) It means that the phase steering that is usually provided by a phase shifter at each antenna element now can be realized directly in the","['ASYARIetal.:NOVELAPPROACHTOREMOTEDETECTIONINMEDICALRADARAPPLICATIONSUSINGFLEXIBLETRANSMITARRAYLENSES 37 core functionality revolves around a delay line frequency demodulator', '. J. Antennas leavefromworktopursuethePh.D.degreewith Propag.,vol.2017,Jul.2017,Art.no.7241281. the Institut Teknologi Sepuluh Nopember, since [17] M.Davis,G.Showman,andA.Lanterman,‘‘CoherentMIMOradar:The phasedarrayandorthogonalwaveforms,’’IEEEAerosp.Electron.Syst. 2015. His research interests include array signal processing and MIMO Mag.,vol.29,no.8,pp.76–91,Aug.2014. radars', '. It identifies the direction of an echo by antennaelement.Whilein[20]anewconceptofmultibeam meansofthescanningbeam,whereastherangedetectionis radarsisreported,whichcombinestheversatilityofOFDM done by observing the delay or by applying the correlation waveform, the orthogonal Golay codes and the CC-MIMO process. However, the beam scanning limits the time on architecture', '. Circulating code (CC) in LFM-MIMO radar has been Existing scanning radar techniques, whether they use discussed in [19], where the phase difference for beam mechanicalrotatororelectronicscanningwithaphasedarray, steering is provided by transmitting coherent signals with detect the angular direction and range of a target in two a small time delay difference ((cid:49)t ) between the array b different processes', '. [28] A. Alieldin, Y. Huang, and W. M. Saad, ‘‘Optimum partitioning of a [3] S.J.WijnholdsandW.A.VanCappellen,‘‘Insituantennaperformance phased-MIMO radar array antenna,’’ IEEE Antennas Wireless Propag. evaluation of the LOFAR phased array radio telescope,’’ IEEE Trans. Lett.,vol.16,pp.2287–2290,2017. AntennasPropag.,vol.59,no.6,pp.1981–1989,Jun.2011']",The phase difference for beam steering in LFM-MIMO radar is achieved by transmitting coherent signals with a small time delay difference between the array elements (Receiver Processing of the Multibeam Azimuth Scanning CC-OFDM-MIMO Radar).,"the specified OFDM sub-band frequencies of beam b to provide phase difference between the transmit elements for creating the beam b. Circulating code in LFM MIMO radar which is discussed in , obtain this phase difference by transmitting coherent signals with a small time delay difference ((cid:49)tb) between the antenna element. However, using an OFDM signal, this phase steering can be provided by giving a phase difference to the OFDM subcarrier phase in the frequency domain of the OFDM signal generation stage. The phase steering given to the CC-OFDM waveform can be defined as follow: β(fn,a,b, (cid:49)tb) = 2πfn,a,b(cid:49)tb Hence, the array factor of CC-OFDM will be: AF(θ, fn,a,b, (cid:49)tb) = Nt −1 2X Ipejp(α(θ)+β(fn,a,b,(cid:49)tb) where α(θ) = p=− Nt",0.6666666666666666,0.8878181849739697
"the high PAPR of the OFDM signal. If orthogonal codes are given to successive OFDM symbols, it could also provide orthogonality between 53684 VOLUME 10, 2022 D. Kuswidiastuti et al.: Transmitter Design for Multibeam CC-OFDM Azimuth Scanning MIMO Radar the OFDM symbols, which in turn can extend the maxi- mum unambiguous range of the radar. The orthogonalities between OFDM subcarriers and between OFDM symbols allow OFDM radar to produce a range and Doppler proﬁle independent from each other . This is one of the advan- tages of using OFDM instead of LFM as radar waveform. The above considerations motivate the development of digitally generated beam steering without phase shifter, by providing phase control of the signal directly from waveform generation","['. [21] Z. Xu and A. Petropulu, ‘‘A bandwidth efficient dual-function radar communication system based on a MIMO radar using OFDM waveforms,’’ IEEE Trans. Signal Process., vol. 71, pp.401–416, 2023, doi: 10.1109/TSP.2023.3241779. [22] U.B.SaracandG.M.Guvensen,‘‘Knowledge-aidedandadaptivebeamsquintawareMIMO-OFDMradardetectorsforISAC,’’IEEETrans.Commun.,earlyaccess,May8,2025,doi:10.1109/TCOMM.2025.3568219. [23] M. Schurwanz, J. Mietzner, and P. A', '. needed. Multibeam radars that continuously transmit concurrent The principles of CC-OFDM MIMO radars have been multiple beams are able to simultaneously look at different discussed in [20] by way of an exemplary radar design for directions, for instance to cover a wide angular swath a long-range surveillance mission. The design includes the with a faceted view', '. However, all of the above thereceiverprocessingofCC-OFDM-MIMOradar,whichis mentioned methods have problems in beam limitation and differentfromthoseinothertypesofOFDMMIMOradarsor cost. other multi-TRM radars due to the nature of the orthogonal Current trends regarding dual functional radar communi- multi-beamgenerationwithGolay-codedOFDMwaveforms cation (DFRC) systems which lead to an integrated sensing andsubbands', '. CC-OFDM MIMO radar waveform design which the degree of orthogonality can be further improved by is discussed in this paper is not a CP based radar, the assigningdifferentsubbands,fortheneighboringbeams,and transmittersaretransmittingmultipleorthogonalsymbolsin thesamesubbandcanbereusedforthenon-adjacentbeams. serieswithoutanyguardtimeintervalbetweenthesymbols. The interference among these co-channel beams can be The symbol series are orthogonal to each other, hence VOLUME13,2025 109895', '. DigitalObjectIdentifier10.1109/ACCESS.2025.3581842 Receiver Processing of the Multibeam Azimuth Scanning CC-OFDM-MIMO Radar DEVYKUSWIDIASTUTI 1,(Member,IEEE),L.P.LIGTHART 2,(LifeFellow,IEEE), GAMANTYOHENDRANTORO1,(SeniorMember,IEEE),TITIEKSURYANI 1,(Member,IEEE), PRASETIYONOHARIMUKTI 1,(Member,IEEE),ANDYUYUWAHYU 3,(Member,IEEE) 1DepartmentofElectricalEngineering,InstitutTeknologiSepuluhNopember,Surabaya60111,Indonesia 2IRCTR,DelftUniversityofTechnology(TUDelft),2628CDDelft,TheNetherlands(Retired)']","The design of CC-OFDM MIMO radar waveforms allows for improved orthogonality by assigning different subbands to neighboring beams, enabling the reuse of multiple orthogonal symbols in the same subband for non-adjacent beams (Kuswidiastuti et al., 2025).","for the n-th subcarrier for symbol a in beam b is given by gn,a,b, with the sampling period of Ts. The maximum unambiguous range, Rmax, will depend on the OFDM symbol period of T0. However, by transmitting Ns orthogonal symbols in series can extend the maximum range up to Ns times further. According to the waveform specification in Table 1, the 12 symbols are transmitted in series over 12T0 to extend the maximum range from 15 up to 180 km. The beams and the CC-OFDM symbols are Golay VOLUME 13, 2025 109897 D. Kuswidiastuti et al.: Receiver Processing of the Multibeam Azimuth Scanning CC-OFDM-MIMO Radar coded and transmitted using the allocated sub-band following a specific schedule that is well known",0.75,0.9455174485796336
"a speciﬁed time delay difference of (cid:49)t, each (cid:49)t value produces a beam pattern equivalent to a phased array having inter-element phase difference that depends on the corresponding subcarrier frequencies. Multiple beams can be formed simultaneously, by assigning multiple subcarrier sets which are transmit- ted using different value of (cid:49)t. This idea is the primary contribution of this paper, which will be elaborated in the sequel. A second contribution in this paper concerns the improvement of time on target in a MIMO radar adopting CC-OFDM waveforms. While multiple beamscanning in tra- ditional phased array radar results in limited time on target, CC-OFDM MIMO radar could give a much longer time on target because multiple beams in CC-OFDM radar can be","['. With this advantage, PA radars ject [6]–[18]. Unlike the PA radar, the MIMO radar utilizes have been used for such applications as micro-scale radars manyantennasthattransmitorthogonalsignalstoobtainthe signal reflected from the target at the receiver, a scheme The associate editor coordinating the review of this manuscript and known as waveform diversity [9]. Consequently, MIMO approvingitforpublicationwasDimitrisE.Anagnostou', '. INDEX TERMS MIMO radar, parameter estimation, phased array radar, probability of detection, target detection. I. INTRODUCTION for biomedical engineering, macro-scale radars on radioMulti-antenna radar systems have been known and used in astronomy, and so on [4], [5]', '. However, all of the above thereceiverprocessingofCC-OFDM-MIMOradar,whichis mentioned methods have problems in beam limitation and differentfromthoseinothertypesofOFDMMIMOradarsor cost. other multi-TRM radars due to the nature of the orthogonal Current trends regarding dual functional radar communi- multi-beamgenerationwithGolay-codedOFDMwaveforms cation (DFRC) systems which lead to an integrated sensing andsubbands', '(13) herein as the subarrayed MIMO (SMIMO) radars, such as theFPMIMOradar,rangesbetweentwoextremeconfiguraNotation ⊗ denotes the Kronecker product operator, tions, namely the PA and the MIMO radar', '. The summation of outputs from 1) Thispaperdescribesthereceiverprocessingofmulti- individual receive modules across the array provides beam CC-OFDM MIMO Radar which is designed the array gain and serves to increase the receive SNR for long-range radar surveillance application. The for each beam']",The receiver processing of multi-CC-OFDM MIMO Radar is designed to enhance the signal-to-noise ratio for long-range surveillance applications (Receiver Processing of the Multibeam Azimuth Scanning CC-OFDM-MIMO Radar).,"the specified OFDM sub-band frequencies of beam b to provide phase difference between the transmit elements for creating the beam b. Circulating code in LFM MIMO radar which is discussed in , obtain this phase difference by transmitting coherent signals with a small time delay difference ((cid:49)tb) between the antenna element. However, using an OFDM signal, this phase steering can be provided by giving a phase difference to the OFDM subcarrier phase in the frequency domain of the OFDM signal generation stage. The phase steering given to the CC-OFDM waveform can be defined as follow: β(fn,a,b, (cid:49)tb) = 2πfn,a,b(cid:49)tb Hence, the array factor of CC-OFDM will be: AF(θ, fn,a,b, (cid:49)tb) = Nt −1 2X Ipejp(α(θ)+β(fn,a,b,(cid:49)tb) where α(θ) = p=− Nt",0.5,0.9410322459744974
"In our case, quasi-continuous transmission is used through proper scheduling of OFDM transmission and echoes reception to prevent the coupling. • The receiver that continuously receives signal echoes coming from multiple targets must be able to distinguish which targets are very near or very far from the radar. This is the reason in this paper that orthogonal codes are given to successive CC-OFDM symbols. These unique codes are given and known by the receiver, so that the receiver could properly detect and distinguish targets nearby and far away from the radar. In this paper we describe the waveform design of a CC-OFDM quasi-continuous wave for MIMO long the range radar. Quasi-CW transmission could limit leakage/coupling problem by time-isolation of the","['. [21] Z. Xu and A. Petropulu, ‘‘A bandwidth efficient dual-function radar communication system based on a MIMO radar using OFDM waveforms,’’ IEEE Trans. Signal Process., vol. 71, pp.401–416, 2023, doi: 10.1109/TSP.2023.3241779. [22] U.B.SaracandG.M.Guvensen,‘‘Knowledge-aidedandadaptivebeamsquintawareMIMO-OFDMradardetectorsforISAC,’’IEEETrans.Commun.,earlyaccess,May8,2025,doi:10.1109/TCOMM.2025.3568219. [23] M. Schurwanz, J. Mietzner, and P. A', '. CC-OFDM MIMO radar waveform design which the degree of orthogonality can be further improved by is discussed in this paper is not a CP based radar, the assigningdifferentsubbands,fortheneighboringbeams,and transmittersaretransmittingmultipleorthogonalsymbolsin thesamesubbandcanbereusedforthenon-adjacentbeams. serieswithoutanyguardtimeintervalbetweenthesymbols. The interference among these co-channel beams can be The symbol series are orthogonal to each other, hence VOLUME13,2025 109895', '. INDEX TERMS Circulating-codes, Golay-codes, interference, MIMO-radar, multibeam, OFDM-radar, sub-band,surveillance. I. INTRODUCTION Manyradarapplicationsdemandscanningcapabilitytoallow The associate editor coordinating the review of this manuscript and coverage over a range of angular direction, such as those approvingitforpublicationwasXueboZhang . forsurveillance,vehicular,weathermonitoring,imaging,and 2025TheAuthors.ThisworkislicensedunderaCreativeCommonsAttribution4.0License', '. The design includes the with a faceted view. Such radars may find applications in system architecture and parameters, the waveform design surveillance[9],[10],[11],[12],automotive[13],[14],[15], and the scheduling of Golay codes and subbands. The imaging[16],[17],etc.Generationofmultiplesimultaneous transmitter architecture that adopts software-defined radar orthogonal beams can be done in several ways', '. However, all of the above thereceiverprocessingofCC-OFDM-MIMOradar,whichis mentioned methods have problems in beam limitation and differentfromthoseinothertypesofOFDMMIMOradarsor cost. other multi-TRM radars due to the nature of the orthogonal Current trends regarding dual functional radar communi- multi-beamgenerationwithGolay-codedOFDMwaveforms cation (DFRC) systems which lead to an integrated sensing andsubbands']","The CC-OFDM MIMO radar waveform design discussed allows for improved orthogonality by assigning different subbands to neighboring beams, enabling the reuse of multiple orthogonal symbols in the same subband for non-adjacent beams (Receiver Processing of the Multibeam Azimuth Scanning CC-OFDM-MIMO Radar).","much defining the maximum unambiguous range of the radar system. CC-OFDM MIMO radar waveform design which is discussed in this paper is not a CP based radar, the transmitters are transmitting multiple orthogonal symbols in series without any guard time interval between the symbols. to each other, hence The symbol series are orthogonal VOLUME 13, 2025 109895 D. Kuswidiastuti et al.: Receiver Processing of the Multibeam Azimuth Scanning CC-OFDM-MIMO Radar receivers know how to distinguish the symbols received, and this could extend the maximum unambiguous range of the radar. The contributions of this paper are described as follow: 1) This paper describes the receiver processing of multi- beam CC-OFDM MIMO Radar which is designed for long-range radar surveillance application. The",0.75,0.9315595513742498
"attention is paid to utilizing this multi-dimensional orthogonality. The orthogonality between the CC-OFDM symbols is beneﬁcial in obtaining an optimum SNR for increasing the maximum unambiguous range of the radar. Another main contribution of this paper is the design of a radar waveform which could extend its maximum unambiguous range by transmitting quasi-continuously multiple orthogonal CC-OFDM symbols in series. It means that the radar will have a longer pulse rep- etition interval (PRI) which leads to a longer-range detection. The additional requirement is that there must be orthogonal- ities between the symbol series. The orthogonality is pro- vided by using orthogonal codes for coding the CC-OFDM symbols, which can be realized using the Golay codes pre- viously chosen to mitigate","['. INDEX TERMS Circulating-codes, Golay-codes, interference, MIMO-radar, multibeam, OFDM-radar, sub-band,surveillance. I. INTRODUCTION Manyradarapplicationsdemandscanningcapabilitytoallow The associate editor coordinating the review of this manuscript and coverage over a range of angular direction, such as those approvingitforpublicationwasXueboZhang . forsurveillance,vehicular,weathermonitoring,imaging,and 2025TheAuthors.ThisworkislicensedunderaCreativeCommonsAttribution4.0License', '. [21] Z. Xu and A. Petropulu, ‘‘A bandwidth efficient dual-function radar communication system based on a MIMO radar using OFDM waveforms,’’ IEEE Trans. Signal Process., vol. 71, pp.401–416, 2023, doi: 10.1109/TSP.2023.3241779. [22] U.B.SaracandG.M.Guvensen,‘‘Knowledge-aidedandadaptivebeamsquintawareMIMO-OFDMradardetectorsforISAC,’’IEEETrans.Commun.,earlyaccess,May8,2025,doi:10.1109/TCOMM.2025.3568219. [23] M. Schurwanz, J. Mietzner, and P. A', '. CC-OFDM MIMO radar waveform design which the degree of orthogonality can be further improved by is discussed in this paper is not a CP based radar, the assigningdifferentsubbands,fortheneighboringbeams,and transmittersaretransmittingmultipleorthogonalsymbolsin thesamesubbandcanbereusedforthenon-adjacentbeams. serieswithoutanyguardtimeintervalbetweenthesymbols. The interference among these co-channel beams can be The symbol series are orthogonal to each other, hence VOLUME13,2025 109895', '. The design includes the with a faceted view. Such radars may find applications in system architecture and parameters, the waveform design surveillance[9],[10],[11],[12],automotive[13],[14],[15], and the scheduling of Golay codes and subbands. The imaging[16],[17],etc.Generationofmultiplesimultaneous transmitter architecture that adopts software-defined radar orthogonal beams can be done in several ways', '. andcommunication(ISAC)systemsmotivatefurthermorethe There are previous research on radar waveform for ISAC use of OFDM for radar waveform. Research on finding the purposes[25],[26]whichdiscussedaboutcyclicprefix(CP) perfect waveform that can serve for both function is still an based OFDM waveform and how the CP is very much ongoingresearchuntilnowadays[20],[21],[22],[23].When defining the maximum unambiguous range of the radar theavailablebandwidthcanbedividedintoseveralsubbands, system']","The radar waveform design incorporates Golay codes for scheduling subbands, enhancing the orthogonality of CC-OFDM symbols, which is crucial for extending the maximum unambiguous range of the radar.","and radial velocity detection of targets is not discussed yet. The contribution of this paper is in the receiver processing of CC-OFDM-MIMO radar, which is different from those in other types of OFDM MIMO radars or other multi-TRM radars due to the nature of the orthogonal multi-beam generation with Golay-coded OFDM waveforms and subbands. There are previous research on radar waveform for ISAC purposes , which discussed about cyclic prefix (CP) based OFDM waveform and how the CP is very much defining the maximum unambiguous range of the radar system. CC-OFDM MIMO radar waveform design which is discussed in this paper is not a CP based radar, the transmitters are transmitting multiple orthogonal symbols in series without any guard time",0.6666666666666666,0.9386168083218464
"also be eliminated because it is possible to design a wave- form to produce an array pattern with a low sidelobe-level characteristic directly from the waveform generation stage. This paper describes a novel design of software deﬁned radar (SDR) using CC OFDM waveforms by giving the phase difference for beam steering and the amplitude tapering coef- ﬁcient at digital waveform generation stage. Hence, when the CC OFDM waveforms are transmitted simultaneously from multiple array antennas, as illustrated in Fig. 1 (a), they will create beams heading to a certain θb direction and exhibiting low side lobe levels. Assume for now that the system is a uniform linear array (ULA) with equal spacing d as depicted in Fig. 1(b). By taking","['. The design includes the with a faceted view. Such radars may find applications in system architecture and parameters, the waveform design surveillance[9],[10],[11],[12],automotive[13],[14],[15], and the scheduling of Golay codes and subbands. The imaging[16],[17],etc.Generationofmultiplesimultaneous transmitter architecture that adopts software-defined radar orthogonal beams can be done in several ways', '. With this advantage, PA radars ject [6]–[18]. Unlike the PA radar, the MIMO radar utilizes have been used for such applications as micro-scale radars manyantennasthattransmitorthogonalsignalstoobtainthe signal reflected from the target at the receiver, a scheme The associate editor coordinating the review of this manuscript and known as waveform diversity [9]. Consequently, MIMO approvingitforpublicationwasDimitrisE.Anagnostou', '. In the works on the PMIMO radar in [22]–[29], The evaluation on the detection performance in terms of the improvement in radar performance factors such as theprobabilityofdetectionandtheprobabilityoffalsealarm spatial resolution, parameter identifiability, transmit-receive reportedhereinisanextensionofstudyby[32].Theseparam(T-R)gain,andsignal-to-interference-plus-noisepowerratio etersareevaluatedbasedonseveralaspectssuchastheeffect (SINR)hasbeenreported.Theresultsofinvestigationsin[29]', '. isillustratedashavingaradarbeamthatcoversaspanofthe In this manner, the FPMIMO radar can achieve a desired azimuthangle', '. INDEX TERMS MIMO radar, parameter estimation, phased array radar, probability of detection, target detection. I. INTRODUCTION for biomedical engineering, macro-scale radars on radioMulti-antenna radar systems have been known and used in astronomy, and so on [4], [5]']",The architecture for generating multiple simultaneous orthogonal beams in software-defined radar can be implemented in various ways (Receiver Processing of the Multibeam Azimuth Scanning CC-OFDM-MIMO Radar).,"the specified OFDM sub-band frequencies of beam b to provide phase difference between the transmit elements for creating the beam b. Circulating code in LFM MIMO radar which is discussed in , obtain this phase difference by transmitting coherent signals with a small time delay difference ((cid:49)tb) between the antenna element. However, using an OFDM signal, this phase steering can be provided by giving a phase difference to the OFDM subcarrier phase in the frequency domain of the OFDM signal generation stage. The phase steering given to the CC-OFDM waveform can be defined as follow: β(fn,a,b, (cid:49)tb) = 2πfn,a,b(cid:49)tb Hence, the array factor of CC-OFDM will be: AF(θ, fn,a,b, (cid:49)tb) = Nt −1 2X Ipejp(α(θ)+β(fn,a,b,(cid:49)tb) where α(θ) = p=− Nt",0.5,0.9356687131948324
"of the beampattern, p = Ipejp2πfnc,b(cid:49)tb. so that we can deﬁne I (cid:48) The array factor (AF) of the CC-OFDM waveform as a function of angle θ, center frequency of the allocated sub band for the b-th beam, fnc,b, and time delay (cid:49)tb for phase steering of the b-th beam is given by: AF(θ, fnc,b, (cid:49)tb) = Nt −1 2(cid:88) pejpα(θ) I (cid:48) p=− Nt −1 Nt −1 2(cid:88) p=− Nt −1 Ipejp2πfnc,b(cid:49)tb (cid:125) (cid:123)(cid:122) (cid:124) the waveform effect ejpα(θ) (cid:124) (cid:123)(cid:122) (cid:125) the array radiation effect (7) The rightmost form consists of the sum of product of two factors. The ﬁrst represents the waveform effect, which is the Taylor amplitude distribution of the array elements and the phase factor","['. DigitalObjectIdentifier10.1109/ACCESS.2020.2965192 FPMIMO: A General MIMO Structure With Overlapping Subarrays for Various Radar Applications SYAHFRIZALTAHCFULLOH 1,2,(StudentMember,IEEE),AND GAMANTYOHENDRANTORO 1,(SeniorMember,IEEE) 1DepartmentofElectricalEngineering,InstitutTeknologiSepuluhNopember,Surabaya60111,Indonesia 2DepartmentofElectricalEngineering,UniversitasBorneoTarakan,Tarakan77123,Indonesia Correspondingauthor:SyahfrizalTahcfulloh(syahfrizal15@mhs.ee.its.ac.id)', '. It identifies the direction of an echo by antennaelement.Whilein[20]anewconceptofmultibeam meansofthescanningbeam,whereastherangedetectionis radarsisreported,whichcombinestheversatilityofOFDM done by observing the delay or by applying the correlation waveform, the orthogonal Golay codes and the CC-MIMO process. However, the beam scanning limits the time on architecture', 'S.Tahcfulloh,G.Hendrantoro:FPMIMO:GeneralMIMOStructureWithOverlappingSubarraysforVariousRadarApplications programmed subarrays. Hence, our paper can also be seen as a review of multi-antenna radar techniques that combine the PA and MIMO structures by making use of overlapped subarrays', '(13) herein as the subarrayed MIMO (SMIMO) radars, such as theFPMIMOradar,rangesbetweentwoextremeconfiguraNotation ⊗ denotes the Kronecker product operator, tions, namely the PA and the MIMO radar', '. INDEX TERMS Circulating-codes, Golay-codes, interference, MIMO-radar, multibeam, OFDM-radar, sub-band,surveillance. I. INTRODUCTION Manyradarapplicationsdemandscanningcapabilitytoallow The associate editor coordinating the review of this manuscript and coverage over a range of angular direction, such as those approvingitforpublicationwasXueboZhang . forsurveillance,vehicular,weathermonitoring,imaging,and 2025TheAuthors.ThisworkislicensedunderaCreativeCommonsAttribution4.0License']",The array factor of the CC-OFDM waveform can be influenced by the correlation waveform and the orthogonal Golay codes as discussed in the context of multibeam scanning radar (Receiver Processing of the Multibeam Azimuth Scanning CC-OFDM-MIMO Radar).,"the specified OFDM sub-band frequencies of beam b to provide phase difference between the transmit elements for creating the beam b. Circulating code in LFM MIMO radar which is discussed in , obtain this phase difference by transmitting coherent signals with a small time delay difference ((cid:49)tb) between the antenna element. However, using an OFDM signal, this phase steering can be provided by giving a phase difference to the OFDM subcarrier phase in the frequency domain of the OFDM signal generation stage. The phase steering given to the CC-OFDM waveform can be defined as follow: β(fn,a,b, (cid:49)tb) = 2πfn,a,b(cid:49)tb Hence, the array factor of CC-OFDM will be: AF(θ, fn,a,b, (cid:49)tb) = Nt −1 2X Ipejp(α(θ)+β(fn,a,b,(cid:49)tb) where α(θ) = p=− Nt",0.25,0.948251876968428
"beamforming at transmit is produced by divid- ing the total OFDM bandwidth B, consisting of Nc subcarriers into Nsb sub bands with smaller bandwidth of Bb, consisting of Ncb subcarriers. The bandwidth per sub-band Bb will deter- mine the range resolution of the CC-OFDM radar as follows: (cid:49)R = 2Bb (8) VOLUME 10, 2022 D. Kuswidiastuti et al.: Transmitter Design for Multibeam CC-OFDM Azimuth Scanning MIMO Radar FIGURE 1. Circulating code in OFDM MIMO radar transmitters with Nt elements transmitting coherence signals, delay difference of (cid:49)t and array factor is defined in the xy plane: (a) time domain and (b) space domain. where (cid:49)R is the range resolution in each beam. If the fre- quency spacing between the OFDM subcarriers","['. DigitalObjectIdentifier10.1109/ACCESS.2025.3581842 Receiver Processing of the Multibeam Azimuth Scanning CC-OFDM-MIMO Radar DEVYKUSWIDIASTUTI 1,(Member,IEEE),L.P.LIGTHART 2,(LifeFellow,IEEE), GAMANTYOHENDRANTORO1,(SeniorMember,IEEE),TITIEKSURYANI 1,(Member,IEEE), PRASETIYONOHARIMUKTI 1,(Member,IEEE),ANDYUYUWAHYU 3,(Member,IEEE) 1DepartmentofElectricalEngineering,InstitutTeknologiSepuluhNopember,Surabaya60111,Indonesia 2IRCTR,DelftUniversityofTechnology(TUDelft),2628CDDelft,TheNetherlands(Retired)', '(13) herein as the subarrayed MIMO (SMIMO) radars, such as theFPMIMOradar,rangesbetweentwoextremeconfiguraNotation ⊗ denotes the Kronecker product operator, tions, namely the PA and the MIMO radar', '. needed. Multibeam radars that continuously transmit concurrent The principles of CC-OFDM MIMO radars have been multiple beams are able to simultaneously look at different discussed in [20] by way of an exemplary radar design for directions, for instance to cover a wide angular swath a long-range surveillance mission. The design includes the with a faceted view', '. isillustratedashavingaradarbeamthatcoversaspanofthe In this manner, the FPMIMO radar can achieve a desired azimuthangle', '. [12] A.S.Kumar,N.Unnikrishnan,R.Raghu,andR.Rajesh,‘‘FPGAbased OFDMMIMOtransmitbeamformerformulti-functionalsoftwaredefined radars,’’inProc.IEEESpace,Aerosp.DefenceConf.(SPACE),Bangalore, India,Jul.2024,pp.527–531,doi:10.1109/space63117.2024.10668277. [13] J.MoghaddasiandK.Wu,‘‘Multifunctionaltransceiverforfutureradar sensing and radio communicating data-fusion platform,’’ IEEE Access, L.P.LIGTHART(LifeFellow,IEEE)wasbornin vol.4,pp.818–838,2016,doi:10.1109/ACCESS.2016.2530979']","The principles of CC-OFDM MIMO radars, which include the design and functionality relevant to range resolution, have been discussed in detail (Kuswidiastuti et al., 2025).","for the n-th subcarrier for symbol a in beam b is given by gn,a,b, with the sampling period of Ts. The maximum unambiguous range, Rmax, will depend on the OFDM symbol period of T0. However, by transmitting Ns orthogonal symbols in series can extend the maximum range up to Ns times further. According to the waveform specification in Table 1, the 12 symbols are transmitted in series over 12T0 to extend the maximum range from 15 up to 180 km. The beams and the CC-OFDM symbols are Golay VOLUME 13, 2025 109897 D. Kuswidiastuti et al.: Receiver Processing of the Multibeam Azimuth Scanning CC-OFDM-MIMO Radar coded and transmitted using the allocated sub-band following a specific schedule that is well known",0.0,0.9416507770858739
"Multibeam CC-OFDM Azimuth Scanning MIMO Radar The phase steering is deﬁned as: β(fn,a,b, (cid:49)tb) = 2π fn,a,b(cid:49)tb (13) hence, at any transmitter p, the WG generates Nb beams simultaneously during the Nsym symbol periods with ampli- tude control Ip. The CC-OFDM complex signal of symbol a in beam b at the p-th transmitter is: xp,a,b(t) = Ip −1 Ncb (cid:88) n=0 Cn,pga,b,nejpβ(fn,a,b,(cid:49)tb) × ej2π(n+(za,b−1)Ncb )(cid:49)f (t−(a−1)T0) for 0 ≤ t − (a − 1)T0 + p(cid:49)tb ≤ T0. (14) The complex discrete-time signal of the baseband CC-OFDM signal in (14) is: xp,a,b(t) = Ip −1 Ncb (cid:88) n=0 Cn,pga,b,nejpβ(fn,a,b,(cid:49)tb) × ej2π(n+(za,b−1)Ncb )(cid:49)f (kTs−(a−1)T0) for 0 ≤ kTs − (a − 1)T0 + p(cid:49)tb ≤ T0. (15) The time delay (cid:49)tb","['. DigitalObjectIdentifier10.1109/ACCESS.2025.3581842 Receiver Processing of the Multibeam Azimuth Scanning CC-OFDM-MIMO Radar DEVYKUSWIDIASTUTI 1,(Member,IEEE),L.P.LIGTHART 2,(LifeFellow,IEEE), GAMANTYOHENDRANTORO1,(SeniorMember,IEEE),TITIEKSURYANI 1,(Member,IEEE), PRASETIYONOHARIMUKTI 1,(Member,IEEE),ANDYUYUWAHYU 3,(Member,IEEE) 1DepartmentofElectricalEngineering,InstitutTeknologiSepuluhNopember,Surabaya60111,Indonesia 2IRCTR,DelftUniversityofTechnology(TUDelft),2628CDDelft,TheNetherlands(Retired)', '. isillustratedashavingaradarbeamthatcoversaspanofthe In this manner, the FPMIMO radar can achieve a desired azimuthangle', '. needed. Multibeam radars that continuously transmit concurrent The principles of CC-OFDM MIMO radars have been multiple beams are able to simultaneously look at different discussed in [20] by way of an exemplary radar design for directions, for instance to cover a wide angular swath a long-range surveillance mission. The design includes the with a faceted view', '. INDEX TERMS MIMO radar, parameter estimation, phased array radar, probability of detection, target detection. I. INTRODUCTION for biomedical engineering, macro-scale radars on radioMulti-antenna radar systems have been known and used in astronomy, and so on [4], [5]', '(13) herein as the subarrayed MIMO (SMIMO) radars, such as theFPMIMOradar,rangesbetweentwoextremeconfiguraNotation ⊗ denotes the Kronecker product operator, tions, namely the PA and the MIMO radar']","Multibeam radars that continuously transmit concurrent beams can simultaneously observe different directions, enabling coverage of a wide angular swath (Kuswidiastuti et al., 2025).","the specified OFDM sub-band frequencies of beam b to provide phase difference between the transmit elements for creating the beam b. Circulating code in LFM MIMO radar which is discussed in , obtain this phase difference by transmitting coherent signals with a small time delay difference ((cid:49)tb) between the antenna element. However, using an OFDM signal, this phase steering can be provided by giving a phase difference to the OFDM subcarrier phase in the frequency domain of the OFDM signal generation stage. The phase steering given to the CC-OFDM waveform can be defined as follow: β(fn,a,b, (cid:49)tb) = 2πfn,a,b(cid:49)tb Hence, the array factor of CC-OFDM will be: AF(θ, fn,a,b, (cid:49)tb) = Nt −1 2X Ipejp(α(θ)+β(fn,a,b,(cid:49)tb) where α(θ) = p=− Nt",1.0,0.9421245958979684
"the n-th subcarrier for symbol a in beam b is given by ga,b,n. In order to generate CC-OFDM waveform, additional phase steering β(fn,a,b, (cid:49)tb) is given to the speciﬁed OFDM sub-band frequencies of beam b for generating a required time delay between the transmit elements for beam b. 53688 VOLUME 10, 2022 D. Kuswidiastuti et al.: Transmitter Design for Multibeam CC-OFDM Azimuth Scanning MIMO Radar TABLE 1. Surveillance radar system and waveform specifications. strict requirement for the time and frequency accuracy of the oscillator clocks at transmitters and receivers. For instance, with an IF of 20 MHz and a carrier frequency offset of 10 kHz the error in beam direction becomes 0.1◦ and the estimated range error equals 0.27 meter","['. DigitalObjectIdentifier10.1109/ACCESS.2025.3581842 Receiver Processing of the Multibeam Azimuth Scanning CC-OFDM-MIMO Radar DEVYKUSWIDIASTUTI 1,(Member,IEEE),L.P.LIGTHART 2,(LifeFellow,IEEE), GAMANTYOHENDRANTORO1,(SeniorMember,IEEE),TITIEKSURYANI 1,(Member,IEEE), PRASETIYONOHARIMUKTI 1,(Member,IEEE),ANDYUYUWAHYU 3,(Member,IEEE) 1DepartmentofElectricalEngineering,InstitutTeknologiSepuluhNopember,Surabaya60111,Indonesia 2IRCTR,DelftUniversityofTechnology(TUDelft),2628CDDelft,TheNetherlands(Retired)', '. needed. Multibeam radars that continuously transmit concurrent The principles of CC-OFDM MIMO radars have been multiple beams are able to simultaneously look at different discussed in [20] by way of an exemplary radar design for directions, for instance to cover a wide angular swath a long-range surveillance mission. The design includes the with a faceted view', 'processed transmit and receive time schedule of CC-OFDM radar is further to obtain the beam information', '. isillustratedashavingaradarbeamthatcoversaspanofthe In this manner, the FPMIMO radar can achieve a desired azimuthangle', '. The design includes the with a faceted view. Such radars may find applications in system architecture and parameters, the waveform design surveillance[9],[10],[11],[12],automotive[13],[14],[15], and the scheduling of Golay codes and subbands. The imaging[16],[17],etc.Generationofmultiplesimultaneous transmitter architecture that adopts software-defined radar orthogonal beams can be done in several ways']","The design of multibeam CC-OFDM radar systems incorporates specific waveform design parameters and scheduling techniques to achieve accurate beam direction and range estimation (Kuswidiastuti et al., 2025).","The beams and the CC-OFDM symbols are Golay VOLUME 13, 2025 109897 D. Kuswidiastuti et al.: Receiver Processing of the Multibeam Azimuth Scanning CC-OFDM-MIMO Radar coded and transmitted using the allocated sub-band following a specific schedule that is well known by the transmitter and receiver. The neighboring beam must use different sub-band and sub-band reuse is allowed for beams that are at least 10◦ in separation. In order to generate CC-OFDM waveform, additional phase steering β(fn,a,b, (cid:49)tb) is given to the specified OFDM sub-band frequencies of beam b to provide phase difference between the transmit elements for creating the beam b. Circulating code in LFM MIMO radar which is discussed in , obtain this phase difference by transmitting coherent signals",0.6,0.9627475609435779
"FOR LONG-RANGE SURVEILLANCE A. REQUIREMENTS A. REQUIREMENTS To elucidate the novel concept and detailed implementation of the CC-OFDM MIMO radar, we will take a surveillance radar design as an example for analyses in the subsequent sections. The CC-OFDM MIMO radar waveform designed herein is based on the requirement of surveillance radars used in coastal areas, where the target of interest are ships and small aircrafts in the area within 180 km from the radar site. OFDM signals with subcarrier spacing of 10 KHz will give a maximum unambiguous range of 15 km. In order to extend the maximum unambiguous range of the radar up to 180 km, 12 orthogonal OFDM symbols with symbol time of 0.1 ms are transmitted in","['. DigitalObjectIdentifier10.1109/ACCESS.2025.3581842 Receiver Processing of the Multibeam Azimuth Scanning CC-OFDM-MIMO Radar DEVYKUSWIDIASTUTI 1,(Member,IEEE),L.P.LIGTHART 2,(LifeFellow,IEEE), GAMANTYOHENDRANTORO1,(SeniorMember,IEEE),TITIEKSURYANI 1,(Member,IEEE), PRASETIYONOHARIMUKTI 1,(Member,IEEE),ANDYUYUWAHYU 3,(Member,IEEE) 1DepartmentofElectricalEngineering,InstitutTeknologiSepuluhNopember,Surabaya60111,Indonesia 2IRCTR,DelftUniversityofTechnology(TUDelft),2628CDDelft,TheNetherlands(Retired)', '. INDEX TERMS Circulating-codes, Golay-codes, interference, MIMO-radar, multibeam, OFDM-radar, sub-band,surveillance. I. INTRODUCTION Manyradarapplicationsdemandscanningcapabilitytoallow The associate editor coordinating the review of this manuscript and coverage over a range of angular direction, such as those approvingitforpublicationwasXueboZhang . forsurveillance,vehicular,weathermonitoring,imaging,and 2025TheAuthors.ThisworkislicensedunderaCreativeCommonsAttribution4.0License', '. needed. Multibeam radars that continuously transmit concurrent The principles of CC-OFDM MIMO radars have been multiple beams are able to simultaneously look at different discussed in [20] by way of an exemplary radar design for directions, for instance to cover a wide angular swath a long-range surveillance mission. The design includes the with a faceted view', '. surveillanceradarspecificationinTable1asanexample.The 2) AtthereceiverofaCC-OFDMMIMOradar,process- discussionstartswithabriefintroductiononthesurveillance ing in the digital signal processor is performed later, radarspecificationsinSectionII,followedbydescriptionof afterallechoesarrivefromvariousdirectionsoneach the receiver processing concept of the CC-OFDM MIMO array element and the corresponding RF chain', '. However, all of the above thereceiverprocessingofCC-OFDM-MIMOradar,whichis mentioned methods have problems in beam limitation and differentfromthoseinothertypesofOFDMMIMOradarsor cost. other multi-TRM radars due to the nature of the orthogonal Current trends regarding dual functional radar communi- multi-beamgenerationwithGolay-codedOFDMwaveforms cation (DFRC) systems which lead to an integrated sensing andsubbands']","The design of the CC-OFDM MIMO radar includes specifications for surveillance radars, which serve as an example for long-range surveillance applications (Devykuswidia et al., 2025).","much defining the maximum unambiguous range of the radar system. CC-OFDM MIMO radar waveform design which is discussed in this paper is not a CP based radar, the transmitters are transmitting multiple orthogonal symbols in series without any guard time interval between the symbols. to each other, hence The symbol series are orthogonal VOLUME 13, 2025 109895 D. Kuswidiastuti et al.: Receiver Processing of the Multibeam Azimuth Scanning CC-OFDM-MIMO Radar receivers know how to distinguish the symbols received, and this could extend the maximum unambiguous range of the radar. The contributions of this paper are described as follow: 1) This paper describes the receiver processing of multi- beam CC-OFDM MIMO Radar which is designed for long-range radar surveillance application. The",1.0,0.9439750452494553
"of 10 KHz will give a maximum unambiguous range of 15 km. In order to extend the maximum unambiguous range of the radar up to 180 km, 12 orthogonal OFDM symbols with symbol time of 0.1 ms are transmitted in series. The 12 OFDM signals are transmitted in quasi-continuous way, since the transmitter is idle during the reception period within one repetition time interval. The CC-OFDM MIMO radar system and waveform speciﬁcations are described in Table 1 In this case, each sub band which consists of 256 subcarriers are used for beam- forming; that leads to 2.56 MHz bandwidth and results in a range resolution of 60 meters in each beam. The OFDM signal period is 0.1 ms and the","['. DigitalObjectIdentifier10.1109/ACCESS.2025.3581842 Receiver Processing of the Multibeam Azimuth Scanning CC-OFDM-MIMO Radar DEVYKUSWIDIASTUTI 1,(Member,IEEE),L.P.LIGTHART 2,(LifeFellow,IEEE), GAMANTYOHENDRANTORO1,(SeniorMember,IEEE),TITIEKSURYANI 1,(Member,IEEE), PRASETIYONOHARIMUKTI 1,(Member,IEEE),ANDYUYUWAHYU 3,(Member,IEEE) 1DepartmentofElectricalEngineering,InstitutTeknologiSepuluhNopember,Surabaya60111,Indonesia 2IRCTR,DelftUniversityofTechnology(TUDelft),2628CDDelft,TheNetherlands(Retired)', '. needed. Multibeam radars that continuously transmit concurrent The principles of CC-OFDM MIMO radars have been multiple beams are able to simultaneously look at different discussed in [20] by way of an exemplary radar design for directions, for instance to cover a wide angular swath a long-range surveillance mission. The design includes the with a faceted view', '. [21] Z. Xu and A. Petropulu, ‘‘A bandwidth efficient dual-function radar communication system based on a MIMO radar using OFDM waveforms,’’ IEEE Trans. Signal Process., vol. 71, pp.401–416, 2023, doi: 10.1109/TSP.2023.3241779. [22] U.B.SaracandG.M.Guvensen,‘‘Knowledge-aidedandadaptivebeamsquintawareMIMO-OFDMradardetectorsforISAC,’’IEEETrans.Commun.,earlyaccess,May8,2025,doi:10.1109/TCOMM.2025.3568219. [23] M. Schurwanz, J. Mietzner, and P. A', '. CC-OFDM MIMO radar waveform design which the degree of orthogonality can be further improved by is discussed in this paper is not a CP based radar, the assigningdifferentsubbands,fortheneighboringbeams,and transmittersaretransmittingmultipleorthogonalsymbolsin thesamesubbandcanbereusedforthenon-adjacentbeams. serieswithoutanyguardtimeintervalbetweenthesymbols. The interference among these co-channel beams can be The symbol series are orthogonal to each other, hence VOLUME13,2025 109895', '. [26] Y. Liu, G. Liao, Z. Yang, and J. Xu, ‘‘Design of integrated radar includinginvestigationintomillimeter-wavepropagation,channelmodeling and communication system based on MIMO-OFDM waveform,’’ J. andwirelesssystemsfortropicalareas,studiesonHFskywavechannelsand Syst. Eng. Electron., vol. 28, no. 4, pp.669–680, Aug. 2017, doi: communicationsinequatorialregions,andthedevelopmentofradararray 10.21629/JSEE.2017.04.06. andsignalprocessing. VOLUME13,2025 109905']","The CC-OFDM MIMO radar system utilizes multiple orthogonal symbols transmitted in series, enhancing the degree of orthogonality by assigning different subbands for neighboring beams (Devykuswidiasuti et al., 2025).","much defining the maximum unambiguous range of the radar system. CC-OFDM MIMO radar waveform design which is discussed in this paper is not a CP based radar, the transmitters are transmitting multiple orthogonal symbols in series without any guard time interval between the symbols. to each other, hence The symbol series are orthogonal VOLUME 13, 2025 109895 D. Kuswidiastuti et al.: Receiver Processing of the Multibeam Azimuth Scanning CC-OFDM-MIMO Radar receivers know how to distinguish the symbols received, and this could extend the maximum unambiguous range of the radar. The contributions of this paper are described as follow: 1) This paper describes the receiver processing of multi- beam CC-OFDM MIMO Radar which is designed for long-range radar surveillance application. The",0.6666666666666666,0.9288302273453202
"it can be seen from (11) that the phase correction, Cn,p,a,b is given to the n-th subcarrier frequency of the OFDM waveform generated for the p-th transmitter for beamforming to θb of symbol a. The Taylor coefﬁcient for sidelobe suppression Ip in (7) is also digitally generated directly from the WG. It is for these two reasons that the CC-OFDM waveforms must be generated simultane- ously per row of the azimuth antenna elements. It is therefore necessary to implement a digital WG at each transmitter with programmability feature, since different radar applications might require different parameters for the beams, waveforms, symbols and frames of symbols. Consequently, the adoption of the concept of software-deﬁned radar (SDR) platform is advantageous and instrumental","['. The design includes the with a faceted view. Such radars may find applications in system architecture and parameters, the waveform design surveillance[9],[10],[11],[12],automotive[13],[14],[15], and the scheduling of Golay codes and subbands. The imaging[16],[17],etc.Generationofmultiplesimultaneous transmitter architecture that adopts software-defined radar orthogonal beams can be done in several ways', '. [26] Y. Liu, G. Liao, Z. Yang, and J. Xu, ‘‘Design of integrated radar includinginvestigationintomillimeter-wavepropagation,channelmodeling and communication system based on MIMO-OFDM waveform,’’ J. andwirelesssystemsfortropicalareas,studiesonHFskywavechannelsand Syst. Eng. Electron., vol. 28, no. 4, pp.669–680, Aug. 2017, doi: communicationsinequatorialregions,andthedevelopmentofradararray 10.21629/JSEE.2017.04.06. andsignalprocessing. VOLUME13,2025 109905', '. isillustratedashavingaradarbeamthatcoversaspanofthe In this manner, the FPMIMO radar can achieve a desired azimuthangle', '. DigitalObjectIdentifier10.1109/ACCESS.2025.3581842 Receiver Processing of the Multibeam Azimuth Scanning CC-OFDM-MIMO Radar DEVYKUSWIDIASTUTI 1,(Member,IEEE),L.P.LIGTHART 2,(LifeFellow,IEEE), GAMANTYOHENDRANTORO1,(SeniorMember,IEEE),TITIEKSURYANI 1,(Member,IEEE), PRASETIYONOHARIMUKTI 1,(Member,IEEE),ANDYUYUWAHYU 3,(Member,IEEE) 1DepartmentofElectricalEngineering,InstitutTeknologiSepuluhNopember,Surabaya60111,Indonesia 2IRCTR,DelftUniversityofTechnology(TUDelft),2628CDDelft,TheNetherlands(Retired)', '. However, all of the above thereceiverprocessingofCC-OFDM-MIMOradar,whichis mentioned methods have problems in beam limitation and differentfromthoseinothertypesofOFDMMIMOradarsor cost. other multi-TRM radars due to the nature of the orthogonal Current trends regarding dual functional radar communi- multi-beamgenerationwithGolay-codedOFDMwaveforms cation (DFRC) systems which lead to an integrated sensing andsubbands']","The receiver processing of CC-OFDM-MIMO radar is distinct from other OFDM MIMO radars due to its orthogonal multi-beam generation using Golay-coded OFDM waveforms (Kuswidiastuti et al., 2025).","waveform will be transmitted through. Hence, instead of just have one DWG at the transmitter side like a common conventional phased array radar, CC-OFDM Radar will need DWGs as many as the number of the transmit array elements needed for digital beamforming purposes . The digital baseband OFDM signal of symbol a in beam b is coded with Golay codes can be defined as: sa,b(k) = Nc−1 n=0 ga,b,nej2πfn,a,b(kTs−(a−1)T0) for [0 ≤ kTs − (a − 1)T0 ≤ T0) (1) where a = [1, 2, . . . , Ns], b = [−(Nb − 1)/2, . . . , 0, . . . , (Nb − 1)/2], n = 0, 1, . . . , Nc − 1, and k",1.0,0.9278091839429927
"xIF p,a,b, will be converted to analog signals through a DAC device of the p-th transmitter. Using the same procedure, the 63 beam signals are generated simultaneously by the digital WG at each transmit element. For a good operational performance of CC OFDM MIMO radar an important and crucial note should be made now, that is: Transmitting multiple symbols in series and in parallel contributing simultaneously to multiple beams effective in various range intervals, the quasi - CW transmission neces- sitates that the CC OFDM symbols should be orthogonal in time, frequency and code. In the following the orthogonality aspects are detailed. • Single CC OFDM symbol In this example, one symbol of CC-OFDM waveform contributes to 63 beam signals.","['processed transmit and receive time schedule of CC-OFDM radar is further to obtain the beam information', '. The summation of outputs from 1) Thispaperdescribesthereceiverprocessingofmulti- individual receive modules across the array provides beam CC-OFDM MIMO Radar which is designed the array gain and serves to increase the receive SNR for long-range radar surveillance application. The for each beam', '. CC-OFDM MIMO radar waveform design which the degree of orthogonality can be further improved by is discussed in this paper is not a CP based radar, the assigningdifferentsubbands,fortheneighboringbeams,and transmittersaretransmittingmultipleorthogonalsymbolsin thesamesubbandcanbereusedforthenon-adjacentbeams. serieswithoutanyguardtimeintervalbetweenthesymbols. The interference among these co-channel beams can be The symbol series are orthogonal to each other, hence VOLUME13,2025 109895', '. The design includes the with a faceted view. Such radars may find applications in system architecture and parameters, the waveform design surveillance[9],[10],[11],[12],automotive[13],[14],[15], and the scheduling of Golay codes and subbands. The imaging[16],[17],etc.Generationofmultiplesimultaneous transmitter architecture that adopts software-defined radar orthogonal beams can be done in several ways', '(13) herein as the subarrayed MIMO (SMIMO) radars, such as theFPMIMOradar,rangesbetweentwoextremeconfiguraNotation ⊗ denotes the Kronecker product operator, tions, namely the PA and the MIMO radar']","The CC-OFDM symbols used in the radar system are orthogonal to each other, allowing for the simultaneous transmission of multiple symbols without interference (Receiver Processing of the Multibeam Azimuth Scanning CC-OFDM-MIMO Radar).","much defining the maximum unambiguous range of the radar system. CC-OFDM MIMO radar waveform design which is discussed in this paper is not a CP based radar, the transmitters are transmitting multiple orthogonal symbols in series without any guard time interval between the symbols. to each other, hence The symbol series are orthogonal VOLUME 13, 2025 109895 D. Kuswidiastuti et al.: Receiver Processing of the Multibeam Azimuth Scanning CC-OFDM-MIMO Radar receivers know how to distinguish the symbols received, and this could extend the maximum unambiguous range of the radar. The contributions of this paper are described as follow: 1) This paper describes the receiver processing of multi- beam CC-OFDM MIMO Radar which is designed for long-range radar surveillance application. The",0.6666666666666666,0.9258105740360096
"VII. THE COUPLING BETWEEN CC-OFDM MULTI-BEAMS VII. THE COUPLING BETWEEN CC-OFDM MULTI-BEAMS A. THE COUPLING BETWEEN NEIGHBORING BEAMS A. THE COUPLING BETWEEN NEIGHBORING BEAMS This section analyzes the coupling between beams which are transmitted simultaneously over the same period of sym- bol duration. Analysis is done to the beams transmitted on the ﬁrst symbol period, with the scheduling as described in Table 2. It is necessary to make sure that the coupling between the multi-beam CC-OFDM which are transmitted simultaneously using limited bandwidth are low to avoid the probability of false alarm on radar receiver. In this paper, coupling analysis are done for near broadside and near edge beams (i.e., beams that spatially close to each other) and for co-channel","['processed transmit and receive time schedule of CC-OFDM radar is further to obtain the beam information', '. The summation of outputs from 1) Thispaperdescribesthereceiverprocessingofmulti- individual receive modules across the array provides beam CC-OFDM MIMO Radar which is designed the array gain and serves to increase the receive SNR for long-range radar surveillance application. The for each beam', '. These results are valid for the three scenarios whether the targetsareinthesamebeam,atthenearestneighboringbeams and at the nearest co-channel beams. It shows that with the conceptproposedinCC-OFDMMIMORadar,itispossible todesignalong-rangeradarwithlowpowertransmissionby transmittingmulti-orthogonalCC-OFDMsymbolsinseries, to improve the Signal-to-Noise of the radar system. It is possibletohaveasoftwaredefinedradar,withmultiplePRFs, without any RF phase shifter for creating multiple beam', '. INDEX TERMS Circulating-codes, Golay-codes, interference, MIMO-radar, multibeam, OFDM-radar, sub-band,surveillance. I. INTRODUCTION Manyradarapplicationsdemandscanningcapabilitytoallow The associate editor coordinating the review of this manuscript and coverage over a range of angular direction, such as those approvingitforpublicationwasXueboZhang . forsurveillance,vehicular,weathermonitoring,imaging,and 2025TheAuthors.ThisworkislicensedunderaCreativeCommonsAttribution4.0License', '. However, all of the above thereceiverprocessingofCC-OFDM-MIMOradar,whichis mentioned methods have problems in beam limitation and differentfromthoseinothertypesofOFDMMIMOradarsor cost. other multi-TRM radars due to the nature of the orthogonal Current trends regarding dual functional radar communi- multi-beamgenerationwithGolay-codedOFDMwaveforms cation (DFRC) systems which lead to an integrated sensing andsubbands']","The analysis of coupling between beams in CC-OFDM radar indicates that the results are applicable for scenarios involving targets in the same beam, neighboring beams, and co-channel beams (Receiver Processing of the Multibeam Azimuth Scanning CC-OFDM-MIMO Radar).","together with transmit scheduling to avoid transmit receive coupling. The receive scheduling is also related to the time scheduling of the correlation between symbols, which is an important stage in the beam and range processing. The transmit and receive time schedule of CC-OFDM radar is described in Fig. 4. The receive scheduling is very important, especially in a multiple target scheme. The echo signals caused by two or more targets at different ranges (i.e., one target is near to the radar, and the other is far) could cause range ambiguity. The clock synchronization between the multiple transmitters and the multiple receivers of CC-OFDM radars are very crucial to guarantee that the receiver can give the accurate detection. It can be",0.75,0.9699066791842508
"beam isolation, the range resolution, the Doppler resolution, those parameters can be modiﬁed and optimized based on the characteristic of the target of interest. Some of the radar speciﬁcations that can be achieved by modifying some of the CC-OFDM waveform parameters are as follows: • The maximum unambiguous range for conventional OFDM radar is mainly limited by the spacing between the OFDM subcarriers. However, one could extend the maximum unambiguous range of the radar by send- ing multiple successive orthogonal CC-OFDM symbols containing orthogonal Golay codes. How many symbols that must be sent will depend on how far the maximum unambiguous range is that the application requires. • The maximum velocity depends on the frequency spac- ing between the OFDM","['. [21] Z. Xu and A. Petropulu, ‘‘A bandwidth efficient dual-function radar communication system based on a MIMO radar using OFDM waveforms,’’ IEEE Trans. Signal Process., vol. 71, pp.401–416, 2023, doi: 10.1109/TSP.2023.3241779. [22] U.B.SaracandG.M.Guvensen,‘‘Knowledge-aidedandadaptivebeamsquintawareMIMO-OFDMradardetectorsforISAC,’’IEEETrans.Commun.,earlyaccess,May8,2025,doi:10.1109/TCOMM.2025.3568219. [23] M. Schurwanz, J. Mietzner, and P. A', '. INDEX TERMS Circulating-codes, Golay-codes, interference, MIMO-radar, multibeam, OFDM-radar, sub-band,surveillance. I. INTRODUCTION Manyradarapplicationsdemandscanningcapabilitytoallow The associate editor coordinating the review of this manuscript and coverage over a range of angular direction, such as those approvingitforpublicationwasXueboZhang . forsurveillance,vehicular,weathermonitoring,imaging,and 2025TheAuthors.ThisworkislicensedunderaCreativeCommonsAttribution4.0License', '. The design includes the with a faceted view. Such radars may find applications in system architecture and parameters, the waveform design surveillance[9],[10],[11],[12],automotive[13],[14],[15], and the scheduling of Golay codes and subbands. The imaging[16],[17],etc.Generationofmultiplesimultaneous transmitter architecture that adopts software-defined radar orthogonal beams can be done in several ways', '. In the works on the PMIMO radar in [22]–[29], The evaluation on the detection performance in terms of the improvement in radar performance factors such as theprobabilityofdetectionandtheprobabilityoffalsealarm spatial resolution, parameter identifiability, transmit-receive reportedhereinisanextensionofstudyby[32].Theseparam(T-R)gain,andsignal-to-interference-plus-noisepowerratio etersareevaluatedbasedonseveralaspectssuchastheeffect (SINR)hasbeenreported.Theresultsofinvestigationsin[29]', '. andcommunication(ISAC)systemsmotivatefurthermorethe There are previous research on radar waveform for ISAC use of OFDM for radar waveform. Research on finding the purposes[25],[26]whichdiscussedaboutcyclicprefix(CP) perfect waveform that can serve for both function is still an based OFDM waveform and how the CP is very much ongoingresearchuntilnowadays[20],[21],[22],[23].When defining the maximum unambiguous range of the radar theavailablebandwidthcanbedividedintoseveralsubbands, system']","The maximum unambiguous range of the radar can be extended by sending multiple successive orthogonal CC-OFDM symbols containing orthogonal Golay codes (Xu and Petropulu, 2023).","and radial velocity detection of targets is not discussed yet. The contribution of this paper is in the receiver processing of CC-OFDM-MIMO radar, which is different from those in other types of OFDM MIMO radars or other multi-TRM radars due to the nature of the orthogonal multi-beam generation with Golay-coded OFDM waveforms and subbands. There are previous research on radar waveform for ISAC purposes , which discussed about cyclic prefix (CP) based OFDM waveform and how the CP is very much defining the maximum unambiguous range of the radar system. CC-OFDM MIMO radar waveform design which is discussed in this paper is not a CP based radar, the transmitters are transmitting multiple orthogonal symbols in series without any guard time",0.0,0.9435396763250598
"our knowledge, there is no publicly available NER dataset for drone forensic problems yet. We identify and propose six entity types as the tagset in the annotation process. The proposed model achieves a competitive score compared to the state-of-the-art methods, with a 91.146% F1 score. Yet, one of the scenarios achieves high perfor- mance, with a 91.348% F1 score. 2) This work showcases how to utilize speciﬁc evidence data to perform forensic information extraction to assist a forensic investigation, including a simple framework for data extraction and annotation. 3) We propose and investigate cosine similarity as a sub- stitutive of dot-product in the self-attention sub-layer of the Transformer encoder to model contextual depen- dency in a sequence. We also propose","['100 80 60 40 20 0 0 10 20 30 40 50 60 70 Epoch )%( ycaruccA [3] S. Silalahi, T. Ahmad, and H. Studiawan, “Named entity recognition for drone forensic using bert and distilbert,” in 2022 International Conference on Data Science and Its Applications (ICoDSA), pp. 53– 58,2022. [4] J. Jeon and J. Kim, “A survey on transformers for long sentences and its application to medical notes,” in 2023 International Conference on Electronics,Information,andCommunication(ICEIC),pp.1–4,2023. [5] A. M. P. Bras¸oveanu and R', '. Learn., vol. 107, nos. 8–10, include digital forensics and natural language pp.1477–1494,Sep.2018. processing. [44] X. Zhou, Y. Gao, C. Li, and Z. Huang, ‘‘A multiple gradient descent design for multi-task learning on edge computing: Multi-objective machinelearningapproach,’’IEEETrans.Netw.Sci.Eng.,vol.9,no.1, pp.121–133,Jan.2022. [45] S.Silalahi,T.Ahmad,andH.Studiawan,‘‘DroNER:Datasetfordrone namedentityrecognition,’’DataBrief,vol.48,Jun.2023,Art.no.109179', '. 91.35% compared with another Transformer model. The dataset used in this work is from ALFA [13] which Other research proposed a method in forensic event reprovideslogdataofdronemalfunctions.Thisdatasetcontains construction using directed graphs to identify and reconstruct some drone failures, like a system crash, a malfunctioning events in a drone or its control station device [7]. The study motor, and a drone losing control', '. The proposed representation of the label improves the prediction confidence score on variousencodertypeswith8.6%and1.8%fromfocalandcross-entropyscenariosonaverage,respectively. INDEX TERMS Anomaly detection, digital forensics, drone forensics, multitask learning, transformer encoder,informationsecurity. I', '. 207–212. doi: 9 safe to walk the i fiets do be syour a 45 0.4898 10.18653/v1/P16-2034. streets in the evening hese [8] Z. Huang, W. Xu, and K. Yu, “Bidirectional LSTM-CRF Models 10 i am allergic to bees what o kay o 37 0.4995 for Sequence Tagging,” Aug. 2015. and peanuts sthogsediates [9] Y. Zhu and G. Wang, “CAN-NER: Convolutional Attention Network for Chinese Named Entity Recognition,” in Proceedings V']","Silalahi et al. (2022) propose a named entity recognition model for drone forensics that achieves competitive performance metrics, including an F1 score of 91.35%.","perform information extraction from drone flight log data. The result of the research is that BERT and DistilBERT have F1 scores of 98.63% and 95.9%, respectively. Furthermore, Silalahi et al. developed the Transformer using cosine similiarity to discover and extract some incident- related information. Cosine similiarity is used to substitute dot- product in the self-attention mechanism of the Transformer encoder layer. The datasets that were used are drone logs from the DJI Phantom. The purposeful method has an F1 score 91.35% compared with another Transformer model. Other research proposed a method in forensic event re- construction using directed graphs to identify and reconstruct events in a drone or its control station device . The study allows the investigator to find",0.6666666666666666,0.898217242625542
". According to those case studies, the drone’s controller devices stored valuable data that can be compared to the other artifacts enabling a correlation study between the UAV and the mobile application used to control the drone. Some studies also suggest a technical procedure for drone forensic inquiry. In order to perform an end-to-end analysis from the preparation to the reporting of the ﬁndings, ten procedures proposed by Salamh et al. must be followed. Analyzing the encrypted ﬁles is one of the obstacles in the data collection phase. For the DJI models, encrypted evidentiary data is a certainty. However, sometimes we have no access to the DJI proprietary tools. Therefore, the data must be decrypted without using DJI’s proprietary tool,","['. Section III explains the proposed method, applying process. Also, Barton et al. [11] conducted the research to the Transformer technique to forensics of drone malfunctions. reconstruct the actions taken by these drones, identify their InSectionIV,thediscussionofperformancemethod,followed owners or operators, and extract data from associated mobile by conclusions and future works in Section V. devices. In other research in drone forensics, this paper also analyze II', '. challenges for drone digital forensics investigations,’’ Array, vol. 14, Jul.2022,Art.no.100135. [27] J. Qi, Z. Luan, S. Huang, C. Fung, H. Yang, H. Li, D. Zhu, and D.Qian,‘‘LogEncoder:Log-basedcontrastiverepresentationlearningfor [5] H.Studiawan,G.Grispos,andK.-K.-R.Choo,‘‘Unmannedaerialvehicle anomalydetection,’’IEEETrans.Netw.ServiceManage.,vol.20,no.2, (UAV)forensics:Thegood,thebad,andtheunaddressed,’’Comput.Secur., pp.1378–1391,Jun.2023. vol.132,Sep.2023,Art.no.103340. [28] J. Li, H. He, S. Chen, D', '. For instance, GPS records can be utilisedtoreconstructandanalysethepathtakenbythedrone duringaflight[2].Thedeviationbetweentheempiricalflight andreconstructedpathscanhappenifthedroneencountersa GPSspoofing[3]. Among the published drone forensics studies, popular worksincludecasestudies,evidenceanalysis,toolsdevelopment, and forensic framework development [5]', '. flies.Thedetailofthemethodcanbedescribedinthefollowin subsections. B. Drone Forensics Drone forensics is a technique to get, collect, and analyze A. Data Preprocessing the data stored in drones to determine the cause of drone The dataset for the experiment and its preprocessing stage incidents. Research has been done to solve various problems to satisfy the needs in drone forensics can be explained as arising and improve the performance. Al-Dahqm et al. [9] follows', '. with limitations and threats to validity. As drone forensics Furtherfuturestudiesmayincludeexploringthepossibility is an emerging topic, there are very limited public datasets of doing high-level oversampling to introduce the models available. The log messages used in this study are mainly with more log message patterns, producing a dataset with acquired from DJI-made devices']","Drone forensics is a technique to get, collect, and analyze the data stored in drones to determine the cause of drone incidents (Forensic Investigation of Drone Malfunctions with Transformer).","the performance of the proposed framework has been discussed and analysed. In this section, challenges encountered during the study are disclosed, along with limitations and threats to validity. As drone forensics is an emerging topic, there are very limited public datasets available. The log messages used in this study are mainly acquired from DJI-made devices. There is yet to come a publicly available dataset of log messages from other drone manufacturers. Several publicly available datasets are mainly about sensor data and multimedia artefacts . While in this study, we solely depend on the human-readable messages generated by the drone during a flight. Given the condition where a small number of unique messages and most of them are acquired from DJI",0.6666666666666666,0.9468909823552403
"concept of concatenating the word’s vector representation with the Bidirectional Long Short-Term Memory (LSTM) layer output. The Conditional Random Field (CRF) layer is 3260 VOLUME 11, 2023 S. Silalahi et al.: Transformer-Based NER on Drone Flight Logs to Support Forensic Investigation used to decode the concatenated output since it can determine how the sequence labels relate to one another. Most of the work involved in implementing deep learning models is predominantly spent on ﬁguring out how to prepare adequate input representations. Most often, word embedding techniques like GloVe , Word2vec , BERT , and ELMo are used to learn the input representation. Pre- trained language models, such as BERT and ELMo, can generate contextualized representational vectors after going through a","['. 207–212. doi: 9 safe to walk the i fiets do be syour a 45 0.4898 10.18653/v1/P16-2034. streets in the evening hese [8] Z. Huang, W. Xu, and K. Yu, “Bidirectional LSTM-CRF Models 10 i am allergic to bees what o kay o 37 0.4995 for Sequence Tagging,” Aug. 2015. and peanuts sthogsediates [9] Y. Zhu and G. Wang, “CAN-NER: Convolutional Attention Network for Chinese Named Entity Recognition,” in Proceedings V', '. Subramanian, K. Kawakami, and C. 2 dormitory doors are ned any ouang thogh 45 0.2710 Dyer, “Neural Architectures for Named Entity Recognition,” in locked at midnight Proceedings of the 2016 Conference of the North American Chapter 3 this equation is too the sedratic arde 37 0.3573 of the Association for Computational Linguistics: Human Language complicated Technologies, Stroudsburg, PA, USA: Association for 4 fish are jumping he inng othe an the oik 21 0.3913 Computational Linguistics, 2016, pp. 260–270', '. For this reason, theotherbaselinesonbothdatasets.However,ourproposed we train a sentence embedding [59] model named DroneSapproachoutperformsallthebaselinessignificantlytestedon BERT with the help of contrastive learning to learn distinct thefiltereddataset,witha2.564%improvementinaccuracy representationsofsamplesfromdifferentclasses[60].Itcan than Neurallog', '100 80 60 40 20 0 0 10 20 30 40 50 60 70 Epoch )%( ycaruccA [3] S. Silalahi, T. Ahmad, and H. Studiawan, “Named entity recognition for drone forensic using bert and distilbert,” in 2022 International Conference on Data Science and Its Applications (ICoDSA), pp. 53– 58,2022. [4] J. Jeon and J. Kim, “A survey on transformers for long sentences and its application to medical notes,” in 2023 International Conference on Electronics,Information,andCommunication(ICEIC),pp.1–4,2023. [5] A. M. P. Bras¸oveanu and R', '. ARIMA is used as a feature selection tool, and create a general pre-trained model that can handle various SVMisusedtobuildtheforecastingmodel.Inaddition,deep NLP tasks [13]. The BERT model has a large variant, learningisusedtogainbetterresults,suchaswithCNNand siebert/sentiment-roberta-large-english variant in English, LSTM']","Huang et al. (2015) describe the use of Bidirectional LSTM-CRF models for sequence tagging, which is relevant to the decoding of concatenated outputs in named entity recognition tasks.","Long Short-Term Memory (LSTM) , is a variation of Recurrent Neural Networks (RNN) that has been successfully applied to various Natural Language Processing (NLP) tasks. LSTM has the ability to capture long-range dependencies with sequences making it suitable for solving sequence labeling problems , , , such as Named Entity Recognition tagging (POS-Tag) and Neural (NER), Part-of-Speech combining (NMT). Study Machine Translation Bidirectional LSTM (BiLSTM) model with Conditional Random Field (CRF) to solve NER and POS-Tag Task. BiLSTM encodes word or character vectors into features, while CRF is a classifier to predict the target labels. Previous research has explored enhancing the feature extractor by integrating serves attention mechanisms with existing models or introducing alternative extractors such as Convolutional Neural Networks",0.5,0.9051133830188237
"I. INTRODUCTION I. INTRODUCTION The use of drones has become increasingly common in various applications, including aerial photography, surveying, and monitoring. However, drones can also be involved in incidents such as accidents, violations, or even crimes, making it necessary to investigate drone logs as part of forensic investigations. In a forensic investigation, drone logs are essential sources of information that can help investigators reconstruct the events leading up to an incident. Drone logs typically include information such as flight paths, altitude, speed, battery life, sensor data, and other telemetry information . Important analysis of drone logs involves the identification of the most critical pieces of information in the log data and the analysis of how they relate to the incident","['. For instance, GPS records can be utilisedtoreconstructandanalysethepathtakenbythedrone duringaflight[2].Thedeviationbetweentheempiricalflight andreconstructedpathscanhappenifthedroneencountersa GPSspoofing[3]. Among the published drone forensics studies, popular worksincludecasestudies,evidenceanalysis,toolsdevelopment, and forensic framework development [5]', '. challenges for drone digital forensics investigations,’’ Array, vol. 14, Jul.2022,Art.no.100135. [27] J. Qi, Z. Luan, S. Huang, C. Fung, H. Yang, H. Li, D. Zhu, and D.Qian,‘‘LogEncoder:Log-basedcontrastiverepresentationlearningfor [5] H.Studiawan,G.Grispos,andK.-K.-R.Choo,‘‘Unmannedaerialvehicle anomalydetection,’’IEEETrans.Netw.ServiceManage.,vol.20,no.2, (UAV)forensics:Thegood,thebad,andtheunaddressed,’’Comput.Secur., pp.1378–1391,Jun.2023. vol.132,Sep.2023,Art.no.103340. [28] J. Li, H. He, S. Chen, D', '. system(UAS)forensics:Dataextraction&analysis,’’ForensicSci.Int., [28] S.ViswanathanandZ.Baig,‘‘Digitalforensicsfordrones:Astudyoftools Digit.Invest.,vol.41,Jun.2022,Art.no.301379. andtechniques,’’inApplicationsandTechniquesinInformationSecurity, [6] E. Mantas and C. Patsakis, ‘‘GRYPHON: Drone forensics in dataflash L.BatinaandG.Li,Eds.Singapore:Springer,2020,pp.29–41. andtelemetrylogs,’’inAdvancesinInformationandComputerSecurity, [29] M. Debinski, F. Breitinger, and P. Mohan, ‘‘Timeline2GUI: N', '. Inspired by the study, anomalous events on drone objective[33].Anotheralternativetoleveragethepre-trained flight logs can be detected by analysing log messages and model is fine-tuning the models using prompts [34]. With identifying suspect key phrases closely related to drone onlyafewtrainingdata,themodelcancapturethesemantics incident scenarios. Therefore, the region of interest in this of the input logs and detect anomalous log sequences well', '. DigitalObjectIdentifier10.1109/ACCESS.2023.3234605 Transformer-Based Named Entity Recognition on Drone Flight Logs to Support Forensic Investigation SWARDIANTARASILALAHI ,(Member,IEEE),TOHARIAHMAD ,(Member,IEEE), ANDHUDANSTUDIAWAN,(Member,IEEE) DepartmentofInformatics,InstitutTeknologiSepuluhNopember,Surabaya60111,Indonesia Correspondingauthor:TohariAhmad(tohari@if.its.ac.id) ThisworkwassupportedinpartbytheInstitutTeknologiSepuluhNopember(ITS);andinpartbythePendidikanMagisterMenuju']","The analysis of drone logs is crucial in forensic investigations, as it encompasses various aspects such as evidence analysis and the development of forensic frameworks (Studiawan, Grispos, & Choo, 2023).","highly relevant to various incident cases, as shown in Fig 3. Not only is it highly relevant, but it is also highly prioritised evidence in diverse investigation cases. 2) Flight log messages cover events from the drone’s sensors, features, and components, making it one piece of evidence to perform analysis related to different drone software and hardware components. Therefore, analysing the log messages means analysing the whole device for various possible incident scenarios. 3) Flight log messages contain contextual information about the occurring event as a description that involves multiple parts of the drone simultaneously. For example, a certain circumstance fails a feature or an operation, as shown in message group number 4 in Table 1. TABLE 1. Groups of",0.75,0.9528782283456961
"perform information extraction from drone flight log data. The result of the research is that BERT and DistilBERT have F1 scores of 98.63% and 95.9%, respectively. Furthermore, Silalahi et al. developed the Transformer using cosine similiarity to discover and extract some incident- related information. Cosine similiarity is used to substitute dot- product in the self-attention mechanism of the Transformer encoder layer. The datasets that were used are drone logs from the DJI Phantom. The purposeful method has an F1 score 91.35% compared with another Transformer model. Other research proposed a method in forensic event re- construction using directed graphs to identify and reconstruct events in a drone or its control station device . The study allows the investigator to find","['. DigitalObjectIdentifier10.1109/ACCESS.2023.3234605 Transformer-Based Named Entity Recognition on Drone Flight Logs to Support Forensic Investigation SWARDIANTARASILALAHI ,(Member,IEEE),TOHARIAHMAD ,(Member,IEEE), ANDHUDANSTUDIAWAN,(Member,IEEE) DepartmentofInformatics,InstitutTeknologiSepuluhNopember,Surabaya60111,Indonesia Correspondingauthor:TohariAhmad(tohari@if.its.ac.id) ThisworkwassupportedinpartbytheInstitutTeknologiSepuluhNopember(ITS);andinpartbythePendidikanMagisterMenuju', '. Several forensic problems yet. We identify and propose six similarstudiesweredoneonotherdronemodels,suchasthe entitytypesasthetagsetintheannotationprocess.The Yuneec Typhoon model [12], DJI Spark [26], and the DJI proposedmodelachievesacompetitivescorecompared Phantom [27]. According to those case studies, the drone’s to the state-of-the-art methods, with a 91.146% F1 controllerdevicesstoredvaluabledatathatcanbecompared score', 'S.Silalahietal.:Transformer-BasedNERonDroneFlightLogstoSupportForensicInvestigation FIGURE1. Anillustrationofentitytypesinaforensictimelineconstructedfromdroneflightlogdata. In the digital forensic research area, drone forensics is a is no attempt to utilize specific data, in this case, the log quite new research topic. Generally, it is categorized into message, to perform a drone forensic investigation', '. CONCLUSION remains untested as the training dataset contains only log This paper investigates utilising a multitask learning messages acquired from 82 drone models, mostly from paradigmtoperformmulticlassanomalydetectionondrone DJI. This is one of the main challenges in drone forensics flight log messages. Aligning to the nature of multitask research, where human-readable flight log datasets from learning,weproposetwotargetlabelrepresentations,namely other drone models are unavailable', '. Iqbal [10] proposed a series of guidelines to help forensic investigators conduct forensic investigations using the DJI 1) This research constructs a new NER dataset in the MavicAirdronemodel.Inordertogathertheevidenceand droneforensicdomain.Tothebestofourknowledge, explain the successfully collected data, various techniques there is no publicly available NER dataset for drone are used, which may aid the investigation process. Several forensic problems yet']","Silalahi et al. constructed a new Named Entity Recognition dataset specifically for the drone forensic domain, noting the absence of publicly available datasets in this area.","availability of a public dataset is one of the considerations for this research to be veriﬁable and reproducible. V. CONCLUSION AND FUTURE WORKS V. CONCLUSION AND FUTURE WORKS In this research, we have experimented with the employ- ment of cosine similarity as a substitute for dot-product self-attention in the encoder sub-layer of Transformer archi- tecture. To evaluate our proposed approach, we construct our own NER dataset by manually extracting several drone forensic image datasets that are publicly available from the VTO Labs. For a relatively small dataset, we obtain a good result indicated by the F1 score of 91.348% achieved by the dot-product attention supported by CNN character embed- ding and BERT word embedding. Our proposed approach outperforms the RNN-based",1.0,0.9351434815765876
"devices at the ground station are merged into a drone super timeline. By using the tool, the investigator will be able to easily analyze the drone accident. B. Drone Forensics Drone forensics is a technique to get, collect, and analyze the data stored in drones to determine the cause of drone incidents. Research has been done to solve various problems arising and improve the performance. Al-Dahqm et al. proposed a forensic framework for drone. The method supports the majority of drone types on the market. The developed framework has three phases. In the preparatory phase, the investigator may analyze all components of the drone and conclude which components were used. Second is the data acquisition phase; the data from the","['. For instance, GPS records can be utilisedtoreconstructandanalysethepathtakenbythedrone duringaflight[2].Thedeviationbetweentheempiricalflight andreconstructedpathscanhappenifthedroneencountersa GPSspoofing[3]. Among the published drone forensics studies, popular worksincludecasestudies,evidenceanalysis,toolsdevelopment, and forensic framework development [5]', '. ABSTRACT The increase in drone usage by the public brings the number of drone incident and attack up.Sophisticatedpreventivemechanisms,aswellaspost-incidentproceduresandframeworks,areneeded. Forensicinvestigationisperformeduponadroneincident,aimingtouncovertheincidentscenario,mitigate the risk and report the examination results. Generally, standard drone forensic procedure consistsof three stages, i.e., evidence acquisition, evidence analysis, and reporting', '. equipped with sophisticated visualization features to highlight critical information and assist the forensic investigator A. DRONEFORENSICINVESTIGATION inanalyzing,interpreting,anddrawingconclusions[29]. The field of drone forensics is a relatively recent research Understanding the drone device and its parts is a crutopic. The growth and development of Unmanned Aerial cial step before beginning a forensic investigation [30]. VOLUME11,2023 3259', '. system(UAS)forensics:Dataextraction&analysis,’’ForensicSci.Int., [28] S.ViswanathanandZ.Baig,‘‘Digitalforensicsfordrones:Astudyoftools Digit.Invest.,vol.41,Jun.2022,Art.no.301379. andtechniques,’’inApplicationsandTechniquesinInformationSecurity, [6] E. Mantas and C. Patsakis, ‘‘GRYPHON: Drone forensics in dataflash L.BatinaandG.Li,Eds.Singapore:Springer,2020,pp.29–41. andtelemetrylogs,’’inAdvancesinInformationandComputerSecurity, [29] M. Debinski, F. Breitinger, and P. Mohan, ‘‘Timeline2GUI: N', '. Yet, one of the scenarios achieves high perfortotheotherartifactsenablingacorrelationstudybetweenthe mance,witha91.348%F1score. UAV and the mobile application used to control the drone. 2) This work showcases how to utilize specific evidence Some studies also suggest a technical procedure for drone datatoperformforensicinformationextractiontoassist forensic inquiry']","Standard drone forensic procedures typically involve three stages: evidence acquisition, evidence analysis, and reporting (Transformer-Based Named Entity Recognition on Drone Flight Logs to Support Forensic Investigation).",". According to those case studies, the drone’s controller devices stored valuable data that can be compared to the other artifacts enabling a correlation study between the UAV and the mobile application used to control the drone. Some studies also suggest a technical procedure for drone forensic inquiry. In order to perform an end-to-end analysis from the preparation to the reporting of the ﬁndings, ten procedures proposed by Salamh et al. must be followed. Analyzing the encrypted ﬁles is one of the obstacles in the data collection phase. For the DJI models, encrypted evidentiary data is a certainty. However, sometimes we have no access to the DJI proprietary tools. Therefore, the data must be decrypted without using DJI’s proprietary tool,",0.6666666666666666,0.945948960677294
"drone types on the market. The developed framework has three phases. In the preparatory phase, the investigator may analyze all components of the drone and conclude which components were used. Second is the data acquisition phase; the data from the drone component will be downloaded and stored on the computer. The last phase is the data analysis phase. In this phase, the data is analyzed using different methods to extract and draw conclusions about the causes of drone engine failure . in this phase, Furthermore, Jain et al. proposed a framework for sensor data identification and verification. An analysis of a drone’s architecture and a forensic model with generic features are proposed here in order to enhance the digital investigation","['. For example, in drone forensics, existing studiesgenerallyconsideranomaliesascontradictorytonormalevents.Inotherwords,alltypesofanomalies are considered equally important. However, the peculiar events experienced by a drone during a flight might contain distinct features indicating the anomalies’ importance or level of urgency. For instance, the message ‘‘Critically low power', '. For instance, GPS records can be utilisedtoreconstructandanalysethepathtakenbythedrone duringaflight[2].Thedeviationbetweentheempiricalflight andreconstructedpathscanhappenifthedroneencountersa GPSspoofing[3]. Among the published drone forensics studies, popular worksincludecasestudies,evidenceanalysis,toolsdevelopment, and forensic framework development [5]', '. challenges for drone digital forensics investigations,’’ Array, vol. 14, Jul.2022,Art.no.100135. [27] J. Qi, Z. Luan, S. Huang, C. Fung, H. Yang, H. Li, D. Zhu, and D.Qian,‘‘LogEncoder:Log-basedcontrastiverepresentationlearningfor [5] H.Studiawan,G.Grispos,andK.-K.-R.Choo,‘‘Unmannedaerialvehicle anomalydetection,’’IEEETrans.Netw.ServiceManage.,vol.20,no.2, (UAV)forensics:Thegood,thebad,andtheunaddressed,’’Comput.Secur., pp.1378–1391,Jun.2023. vol.132,Sep.2023,Art.no.103340. [28] J. Li, H. He, S. Chen, D', '. system(UAS)forensics:Dataextraction&analysis,’’ForensicSci.Int., [28] S.ViswanathanandZ.Baig,‘‘Digitalforensicsfordrones:Astudyoftools Digit.Invest.,vol.41,Jun.2022,Art.no.301379. andtechniques,’’inApplicationsandTechniquesinInformationSecurity, [6] E. Mantas and C. Patsakis, ‘‘GRYPHON: Drone forensics in dataflash L.BatinaandG.Li,Eds.Singapore:Springer,2020,pp.29–41. andtelemetrylogs,’’inAdvancesinInformationandComputerSecurity, [29] M. Debinski, F. Breitinger, and P. Mohan, ‘‘Timeline2GUI: N', '. Any failure, error, or malfunction the shipments of drone consumers reached approximately is not tolerated for these types of drones, as in consumer 5millionunitsin2020globally.Thisnumberisexpectedto drones.Therefore,itiscriticaltoguaranteethesecurityofthe device.Tothisend,moresophisticatedsecurityandforensic The associate editor coordinating the review of this manuscript and proceduresareneededtodeveloptodiminishtheriskcaused approvingitforpublicationwasAlbaAmato . byanyattackorincident[3]']","The development of forensic frameworks for drone investigations has been highlighted in various studies, which include case studies, evidence analysis, and tools development (Studiawan et al., 2023).","Transformer-Based NER on Drone Flight Logs to Support Forensic Investigation Accordingly, Jain et al. proposed a framework com- prising 12 phases. The ﬁrst ﬁve phases were used to locate and validate the drone’s sensors and data. The other seven steps were used to analyze physical evidence like ﬁngerprints and digital evidence from several sources, such as memory cards, ﬂight logs, and network logs. However, the proposed framework has not explained the preparation phase in detail. Therefore, another framework consisting of four investigative phases with a more comprehensive analysis is proposed by Al-Dhaqm et al. . One of the primary distinctions of this framework is a more extensive preparation phase consisting of pre- and post-incident preparation. Pre-incident prepara- tion is an",0.6666666666666666,0.9573853734580148
"organizations improve the reliability, security, and operational efficiency in managing their information technology. , Prema et al use process mining techniques to examine a regional hospital's billing procedure. This study emphasizes how crucial it is to increase the billing process' effectiveness in order to give patients higher-quality care. In this study, data from the finance module of the hospital's ERP system was explored to determine bottleneck activities in the invoice procedure. Using anonymised event logs, this study aims to find causality in the hospital's billing process and identify potential bottleneck activities. Audit with surveys is an effective method for gathering essential information to evaluate a process or system . Using carefully crafted questionnaires, auditors directly collect data from individuals or","['. TABLE III presents the top 10 most TABLE IV highlights the bottleneck process activities, frequent process patterns observed in the hospital billing showcasing throughput times and distribution for various system, detailing their activity traces, frequencies, and case billing stages, emphasizing the critical points where efficiency ratios, which highlight the prevalent pathways and potential can be improved. This study discovered significant variations inefficiencies within the process', "". PROPOSED METHOD the log files associated with a company's business operations, This section discussed the research workflow illustrated in aimed at better understanding and optimizing each activity Fig. 1. The research stages encompass four critical steps more effectively[8] . From the data obtained, specific patterns involved in managing and analyzing the event log dataset will be identified to provide deeper insights into process within the hospital billing system. These steps are designed to behavior"", '. reliability of various billing activities, as well as identifying B. Pre-processing bottlenecks, which is one of the primary objectives of this analysis. By pinpointing bottlenecks, the team can target and The raw data from the event logs undergoes cleansing and address the area’s most affecting workflow, thereby enabling preparation for detailed analysis. The preprocessing step significant operational improvements', '. Bahari et al. [1] valuate the hospital billing system to demonstrate how process mining can governance capabilities at the Customer Care unit using the identify bottlenecks in processes in the system for providing COBIT framework, specifically within the Deliver, Service, insight for process improvement. Our findings highlight and Support (DSS) domain', '. The final stage is performance analysis, C. Event Logs where the effectiveness and efficiency of the billing processes are reviewed to identify potential areas for improvement. An event log is historical documentation within an Overall, these stages are crucial to ensure that the billing information system, serving as proof of ongoing transactions practices at the hospital are conducted efficiently and [11]. It sequentially and concurrently records activities, transparently']","Bahari et al. (2023) highlight and identify bottlenecks in the hospital billing system, providing insights for process improvement.","stage is performance analysis, where the effectiveness and efficiency of the billing processes are reviewed to identify potential areas for improvement. Overall, these stages are crucial to ensure that the billing practices at the hospital are conducted efficiently and transparently. A. Dataset The ""Hospital Billing"" event log was obtained from the financial module of the ERP system used by a regional hospital , This log records various incidents related to the billing of medical services provided by the hospital. Over a three-year period, from 2013 to 2016, a random sample of 100,000 traces was collected, each representing a recorded example of the process in the system. Within this event log, there are 18 different activities, each depicting distinct stages in",1.0,0.9183762926259411
"baked goods’ quality can be determined by the gas or vapor content. Gas chromatography is the standard instrument for quantitatively and qualitatively analyzing volatile organic compounds (VOCs). This method separates compounds in a mixture by injecting a gas sample into the mobile phase, usually called the carrier gas, and passing the gas through the stationary phase , , . Volatile compounds identified in aldehydes, alcohols, acids, alkanes, and ketones are the main components that contribute VOLUME 12, 2024 2024 The Authors. This work is licensed under a Creative Commons Attribution-NonCommercial-NoDerivatives 4.0 License. For more information, see 97235 TABLE 1. The ingredients of the cookie. to the cookie flavor . Chemical compounds grouped as hydrocarbons are also released while making and","['. instrument is around USD 120,000 in 2017 [17], while the cost of testing a sample is about USD 50. In addition, the II. RELATEDWORKS testing process of one sample can take about 1 to 2 days, E-nosecanbeusedforfoodauthenticationandadulteration depending on the complexity of the gases. Another consid- assessment,assummarizedinTABLE1.Researchtodetect erationistheassistanceofapersonwhohasexperiencewith meatadulterationusinganelectronicnosehasdevelopedand operatingtheGC-MSinstruments. is being studied', '. Researchers find this method highly delightful flavor and pleasant aroma but also for its numerous beneficial in establishing a reliable ground truth, enabling the health benefits[1]. One of the most notable factors impacting precise identification of volatile organic compounds. the character of tea is its aroma', '. exhibit a diverse array of volatile compounds, such as 27 hydrocarbons, 2 furans, 9 alcohols, 11 ketones, 7 esters, 17 B. Volatile Organic Compounds Identification aldehydes, and 9 nitrogen compounds[22]. Through Chromatography-Mass Spectrometry (GC-MS), On the contrary, Gambung green tea is distinguished by it was found that there were 143 VOCs in the good-quality many higher concentrations of volatile compounds, sample and 118 VOCs in the quality-defect sample', '. ABSTRACT Recently,theissueoffoodauthenticationhasgainedattention,especiallyhalalauthentication, becauseofcasesofporkadulterationinbeef.Manystudieshavedevelopedrapiddetectionforadulterated meat. However, these studies are not yet practical and economical methods and instruments and a faster analysis process. In this context, this paper proposes the Optimized Electronic Nose System (OENS) for more accurately detecting pork adulteration in beef', 'Experimental Specimens and Olfactory Analysis Gambung Green Organoleptic Tea Samples Results Compounds Classification Volatile Compound HS-SPME GC-MS Identification Data Acquiring and Predicting Analysis ELECTRONIC Sensor Array NOSE Determination Pre-Processing Predicting Model Data Analytics Performance Model Validation Fig. 3. Research Methods III. MATERIALS AND METHODS In order to construct the electronic nose equipment, an initial assessment of the volatile organic compound (VOC) Fig. 1']","The analysis of volatile organic compounds in baked goods can be supported by findings that indicate a diverse array of volatile compounds, including hydrocarbons, alcohols, aldehydes, and ketones, which contribute to flavor profiles (Utilization of GC-MS in Determination of Electronic Nose Sensor Array for Classification of Gambung Green Tea Quality).","whereas 27 chops had quality defects. B. Volatile Organic Compounds Identification Through Chromatography-Mass Spectrometry (GC-MS), it was found that there were 143 VOCs in the good-quality sample and 118 VOCs in the quality-defect sample. Then it also obtained that there were 102 similar compounds present Fig. 4. Number of Compounds in Each Classes Fig. 5. Percentage of Area of Compounds in Each Classes in both sample 1 and sample 2, which are detailed in TABLE II. The results of grouping chemical substances into several groups, including nitrogenous compounds, alcohols, esters, hydrocarbons, hetero- oxygenates, and others. Substance content in each class of compounds means that different concentrations are shown as Area as shown in TABLE II. aldehydes, phenols, ketones, In GC-MS,",0.4,0.9521870357504432
"measured the ratio of correct recognition results to the entire dataset. Accuracy = TP + TN TP + FN + TN + FP (11) 2) Precision (12) estimated how many of the positive pre- dictions were correct. Precision = TP TP + FP (12) 3) Recall can also be called Sensitivity (13) calculated how many positive cases the classifier correctly pre- dicted over all the positive instances in the data. Recall = TP TP + FN (13) 4) F1-measure (14) assessed the predictive skill of a model by elaborating on its class-wise performance. F1 − measure = 2 × Precision × Recall Precision + Recall (14) 97240 VOLUME 12, 2024 M. Rivai, D. Aulia: Use of Electronic Nose to Identify","['. E-nose is designed from several thestacked deeplearning methodcanincrease theaccuracy metal-oxide semiconductor gas sensors that are highly ofcyberattacksdetection.Hence,themotivationforthisstudy sensitivetocertaingases.Thenittakesasamplefromsweat canbeformulatedasfollows: in the human axilla and stores the VOCs contained in the 1. Several types of research have used an E-nose to sweat. This device became safer by taking samples through detectdiseases.However,noresearchusedsweatfrom theaxilla[10]', '. The electronic nose has been without reducing the system’s performance in predicting widely applied in various fields, such as the classification healthypeopleandasthmasuspects.Thispaperisorganized of perfume [6], food quality [7], and diseases in the human as follows. Section I covers the background of this study. body[8],[9]. Section II provides the proposed method and experimenThe volatile compounds in exhaled breath require a dif- tal setup', '. [12] M.A. Hasan, R. Sarno, and S.I. Sabilla, ‘Optimizing Machine Learning Parameters for Classifying the Sweetness of Pineapple Aroma Using Compared to the previous e-nose, this system, even though Electronic Nose’, Int. J. Intell. Eng. Syst., vol. 13, no. 5, pp. 122–132, it used 6 metal oxide semiconductor sensors, can produce a Oct. 2020, doi: 10.22266/ijies2020.1031.12. performance above 0.98. Despite that, it is not certain that this [13] S. M. T. Gharibzahedi, F. J. Barba, J. Zhou, M. Wang, and Z', '. This study proposes a new approach for detecting infectious respiratory diseases using an electronic nose (E-nose) through sweatsamplesfromthehumanaxilla.E-nosebecamesaferbytakingsamplesthroughtheaxillarybecause infectious respiratory diseases are not transmitted through sweat. This study proposes two new feature extractiontechniquescalledstablevalueandhighestslope.ThisstudyalsoproposesastackedDeepNeural Network (DNN) for effective infectious respiratory disease detection', '. The number of MOS in the E-nose was five,thenthenumberoffeaturesgeneratedfromthefeature Each error represents a loss function, so the weights extraction process by all MOS was 40 features, hence the and biases must be readjusted']",This study proposes a new approach for detecting infectious respiratory diseases using an electronic nose (E-nose) through sweat samples from the human axilla (Referensi 4).,"with the following formula: TP + TN TP + TN + FP + FN Accuracy = Precision = Recall/True Positive Rate(TPR) TP TP + FP TP TP + FN F1 = 2 × precision × recall precision + recall FP TN + TP (cid:90) 1 TPRd(FPR) False Positive Rate(FPR) = AUC = (4) (5) (6) (7) (8) (9) where TP is the number of correctly predicted positive labels, TN is the number of correctly predicted negative labels, FP is the number of incorrectly predicted positive labels, and FN is the number of incorrectly predicted negative labels. Accuracy is the ratio of true predictions to the overall data. Precision is the ratio between TP to the total number of positive predic-",0.8,0.8796515142203918
"presented a novel multi-head attention mechanism that uses various atten- tion functions to capture diverse contextual elements. The multi-head attention approach allows attention to be simul- taneously allocated to information from different subspaces and representational positions. In contrast to soft attention, which focuses attention softly on the entire input to produce a context representation with weights determined based on the relevance of each part of the input, soft attention relies on only one attention mechanism. Kumar et al. developed the multi-head attention- based BiLSTM (MHA-BiLSTM) model. The results are quite promising compared to the use of single-head attention. How- ever, using the BiLSTM model is computationally expensive, especially when dealing with large datasets . BiLSTM is also prone to overfitting,","['. Consequently, functionwiththeself-attentionmethod.2)RemovingMulti- the combination of BiLSTM and multi-head attention Head Attention. We removed the multi-head attention and complements each other. Enhances the model’s ability to employedonlysoftalignmentattentioninthematchinglayer', '. performance. While multi-head attention is effective in capturing long-range dependencies and global contextual C', '. We trained the models using 540k sentence pairs from BiLSTM can accommodate sequence information, which SNLI Indo. Based on our model, we made the following is then used by multi-head attention to learn information adjustments: 1) Replacing Multi-Head Attention with Self- from various dimensions and subspace representations, Attention. We replaced the multi-head attention activation fully capturing long-distance text features', '. werecombinedwiththeBiplets(h-d)fromPandHtoform References [13], [14], and [15] employed the atten- a new sequence. A BiLSTM then learns this sequence of tion mechanism to align words between Premise (P) and Biplets (h-d). These BiLSTM outputs are duplicated three Hypothesis (H), thereby enhancing the performance of timestoaccommodatethemulti-headattentioninput.Multitheir models', '. The individual matching mechaThe total training time for Indo-BiEnt on the full 540k nism, combined with circular padding, further enhances the dataset was 1,558 seconds per epoch, which is significantly performance of the BiLSTM network, while the multi-head faster than IndoBERT and comparable to or faster than attentionmechanismfacilitatesmoretargetedrepresentation ESIM (which required 2,140 seconds per epoch in our learning by assigning greater focus to salient syntactic']","The multi-head attention mechanism is effective in capturing long-range dependencies and global contextual elements (Kumar et al., 2023).","Based on the results presented in Table 3, the multi-head attention module positively impacts the model’s performance. When multi-head attention in our proposed model is replaced with self-attention, the testing accuracy drops from 79% to 71%. Furthermore, if we remove the attention component in the aggregation layer and only use soft alignment attention in the matching layer, the testing accuracy is 72%. In the last experiment, we used only BiLSTM for inference composition, which resulted in a test accuracy of 71%. These results provide evidence that the absence of the multi-head attention module can decrease the model’s performance. While multi-head attention is effective in capturing long-range dependencies and global contextual information, it tends to be less adept at modeling sequential",0.6666666666666666,0.9458002474230357
"rate (FPR) across various clas- sification thresholds. The horizontal axis of an ROC graph represents the FPR, which indicates the proportion of neg- ative instances misclassified as positive. In contrast, the vertical axis represents the TPR, which measures the model’s effectiveness in correctly classifying positive instances. The ROC curves demonstrated that the MHA-CovBi model dis- played exceptional efficacy, achieving an area under the curve (AUC) value of 0.96 for the DS1 dataset and 0.94 for the DS2 dataset, which are both significantly high values that are close to the perfect value of 1.0 and well above the value of 0.5 which indicates random performance. These values indicate that the MHA-CovBi model shows a high discriminatory ability in differentiating between positive","['. previous studies and obtained accuracy rates above 90%, Inter-subject is defined as a classification model trained even up to 99%', "". These metrics can be calculated by (1) – (3). This study's calculation of True Positive, False Positive, and False Negative differs from other classifications or detections [20]-[23]. These are chosen and calculated following previous studies [1]. Precision detects the truly correct prediction out of all predictions. Recall detects the truly correct prediction out of all actual classes. F1 scores are harmonic mean between these two that measure overall model performance"", '. GAIN multi-head attention uses one 0.0654,and0.2779usingalookbackof50.TheGAINmethod multi-head attention layer, one normalization layer, and five withalookbackof50wasbetterthantheothermethodswhen dense layers with a gelu activation function. The training using RMSE evaluation, with a performance of 0.1013. The process uses 1000 epochs, 128 batch sizes, and validation GAIN multi-head attention method performed best on three every 20 epochs', '. Pre-processing 42.87% than The GAIN method using MAE evaluation. The The preprocessing produces a missing value dataset with GAIN multi-head attention method performance increased by various missing rates. Statistics of preprocessing results are 61.86% than The GAIN method using MAE evaluation. The Authorized licensed use limited to: Institut Teknologi Sepuluh Nopember. Downloaded on July 14,2025 at 08:17:35 UTC from IEEE Xplore. Restrictions apply.', '. The extracted Attention Optional add-on Core part of the architecture features were then passed through a fully connected layer, Training Pre-trained on large datasets Trained using soft producing a 180-dimensional vector corresponding to the labels from teacher probability of 180 abnormalities. These output logits were Efficiency High computational cost More efficient due to then forwarded to a sigmoid activation function to generate fewer parameters multi-label predictions formulated as Eq. (2) and Eq']",,"the ROC curve, we could see the ability of the model to separate true positive and true negative cases. In ROC, True Positive Rate (TPR) was compared to False Positive Rate (FPR). The proposed stacked DNN model had the best performance compared to the DNN base-models and produced an AUC score of 0.981. Tested DNN models produced lower AUC than the proposed stacked DNN as shown in Fig. 9. Based on the confusion matrix in Table 8, tested DNN models had a higher number of FN than stacked DNN. Hav- ing a small number of FN was signiﬁcant because incorrectly identifying the positive class (sick) to negative class (healthy) can cause the patient not to obtain the proper treatment and",0.0,0.0
"pre-cancers , gastric cancer lesions , and cervical squamous intraepithelial lesions . The choice between one-stage and two-stage object detec- tion models depends heavily on the specific demands of the task, particularly in medical imaging contexts such as colorectal cancer (CRC), squamous cell carcinoma (SCC), gastric lesions, and polypoid lesions. One-stage detectors, such as YOLO and SSD, excel in speed and computational efficiency, making them ideal for real-time applications. For instance, YOLOv5 demonstrated remarkable performance in CRC detection with nearly perfect metrics—precision (99.071%), recall (98.064%), and mAP (98.8%)—allowing clinicians to analyze colonoscopy videos efficiently during live procedures . SSD also performed well in CRC detection, achieving precision (90.42%) and recall (91.32%), though its mAP (87.5%) was slightly lower than YOLO-","['. PC dataset shows a significant improvement in results Deep learning-based object detection models, such as You compared to models trained without pre-trained weights. Only Look Once (YOLO), have shown significant advancements in various object detection applications, Keywords—peritoneal carcinomatosis, YOLOv8, fine-tuned, including in the medical field', '. Experimental results show that the YOLOv8m enhance detection and diagnostic results. model performs the best, with a mean Average Precision (mAP50) of 0.871, precision of 0.893, recall of 0.785, and an F1 In the era of medical digitization, automated methods for score of 0.84. The use of fine-tuned pre-trained weights on the medical image analysis are becoming increasingly relevant', '. Early Imaging) [5] and many others. detection of this disease is crucial for improving patient Timely detection and diagnosis of PC are crucial for survival chances. This study utilizes the YOLOv8 model to detect PC using a dataset of 4,197 laparoscopy images. planning effective treatment and improving patient survival YOLOv8 was chosen for its capability in fast and accurate chances [6]. However, manual detection of PC from object detection', '. Next, we fine-tuned this model on our research dataset consisting of laparoscopic images to adapt (4) the model to the specific characteristics of peritoneal TP is the number of lesions that are correctly detected carcinomatosis', '. J Radiol, vol. 93, no. 1113, p. 20200401, Sep. 2020, doi: [25] C.-Y. Wang, A. Bochkovskiy, and H.-Y. M. Liao, “YOLOv7: 10.1259/bjr.20200401. Trainable bag-of-freebies sets new state-of-the-art for real-time [5] A. Dohan et al., “Evaluation of the peritoneal carcinomatosis index object detectors,” Jul. 06, 2022, arXiv: arXiv:2207.02696. Accessed: with CT and MRI,” British Journal of Surgery, vol. 104, no. 9, pp. Jun. 03, 2024. [Online]. Available: http://arxiv.org/abs/2207.02696 1244–1249, Jul']","The YOLOv8 model has demonstrated superior performance in medical imaging, achieving a mean Average Precision (mAP50) of 0.871, precision of 0.893, and recall of 0.785 (Wang et al., 2020).","improved speed, accuracy, and effi- ciency . Among these, the YOLO (You Only Look Once) algorithms are frequently preferred due to their bal- ance between accuracy and speed, making them particularly VOLUME 13, 2025 23619 A. D. Sanjaya et al.: RNA-BioLens: A Novel Raspberry Pi-Based Digital Microscope With Image Processing suitable for applications like medical image analysis, where rapid and accurate detection is essential. For example, Fatichah et al. evaluated the performance of three popu- lar detection methods: You Only Look Once v4 (YOLOv4), You Only Look Once v5 (YOLOv5), and Mask Region-based Convolutional Neural Network (Mask R-CNN) in classifying ALL types. Their findings showed that YOLOv4 achieved the highest mean Average Precision (mAP) at 93.2%, followed by YOLOv5 at",0.8,0.9144552965868759
"represents a significant challenge in devel- oping deep learning-based lesion detection models. Various forms of bias, including category imbalance, biases stem- ming from dataset sources, inconsistencies in annotation 1) CATEGORY IMBALANCE IN DATASETS Category imbalance is a recurring issue that can affect a model’s ability to accurately detect minority classes. For instance, the SSPH_WL dataset in highlights an uneven distribution, where adenomas (1048) are significantly more prevalent compared to polyps (381) and cancers (280). This VOLUME 13, 2025 43547 N. Rochmawati et al.: Deep Learning-Based Lesion Detection in Endoscopy: A Systematic Literature Review study mitigated the imbalance by employing LSDA-Loss, which prioritizes minority categories using prior probabili- ties, demonstrating an effective strategy for addressing this challenge. Similarly, the KID dataset",['nan'],,"while false positives were observed for normal cases with overlapping features or imaging artifacts. These errors are likely due to the imbalanced dataset, which predominantly consists of normal or frequently occurring abnormalities, limiting the model's ability to generalize to less common cases. To evaluate the model’s ability to detect rare abnormalities, we analyzed performance on a subset of low- frequency labels as shown in Table V. Results indicate that while overall precision remains high, recall for these classes is lower (e.g., 0.62 for Cardiomegaly vs. 0.81 average), confirming the effect of class imbalance. Incorporating targeted sampling or multi-label loss re-weighting could help address this in future work. TABLE V PERFORMANCE ON RARE ABNORMALITIES Abnormality Cardiomegaly Pneumothorax Pulmonary Edema Aortic Enlargement",0.0,0.0
"a ratio of 70-15-15, this study aims to compare respectively. The splitting process was carefully conducted to ensure a balanced class distribution and to avoid any selective tendencies in each data subset. This balanced distribution helps prevent biases in the model's training process and ensures that it learns effectively from all classes of data. The object detection model was trained using the training data, tested using the testing data, and validated using the validation data. The size of the dataset and the split sizes for each dataset are presented in Table I. This research focuses on leveraging the latest YOLO (You Only Look Once) object detection model, specifically YOLOv8, renowned for its exceptional speed and accuracy. The choice of YOLOv8","['. This study chose to adopt EfficientNetV2-S, the baseline architecture from this family, due to computational resource reasons to construct a smaller model while still maintaining model performance. The EfficientNetV1 family is the backbone of the EfficientDet family, which has achieved state-of-the-art results on object detection challenges. C. Model Evaluation Evaluation Metrics used in this study to evaluate model performance are precision, recall, and F1 Score', '. weights, some predictions are incorrect, leaving some lesions [7] A. Wang et al., “YOLOv10: Real-Time End-to-End Object undetected and not well predicted. For future research, other Detection,” May 23, 2024, arXiv: arXiv:2405.14458. doi: large datasets besides COCO, such as ImageNet or other 10.48550/arXiv.2405.14458. datasets, can be used to obtain pretrained weights that can be [8] “Sensors | Free Full-Text | UAV-YOLOv8: A Small-Objectfine-tuned into our dataset', '. 𝐼𝑜𝑈= 𝐴𝑟𝑒𝑎 𝑜𝑓 𝑂𝑣𝑒𝑟𝑙𝑎𝑝 (4) MobileNetV3 and EfficientNetV2 prioritize efficiency and 𝐴𝑟𝑒𝑎 𝑜𝑓 𝑈𝑛𝑖𝑜𝑛 accuracy, but they achieve this through different The metric mean Average Precision (mAP) is architectural choices. MobileNetV3 enhances the previous introduced in COCO dataset evaluation metrics and is version with squeeze-and-excitation layers and h-swish widely used in object detection studies as a benchmark for non-linearity [18], while EfficientNetV2 focuses on evaluating and comparing model performance', '. If the FPS is too low, NVIDIAAGXOrin(embeddededgedevice2).Thisindicates issues such as blurring or frame loss may occur, reducing that altering the batch size and optimizer hyperparameters detection accuracy. Therefore, a lightweight YOLOv7-tiny canimprovesystemperformance(mAP,recall,andF1score) modelisnecessarytoachieveabalancebetweenaccuracyand whilealsoreducinginferencetime.Inferencetimeforsmaller speed in object detection', '. The paper [18] stated that MobileNetV3_large can achieve 25% faster training in the COCO Object Detection challenge than the previous version with similar accuracy. EfficientNetV2 is a family of CNN architectures offering faster training speed and better parameter efficiency than previous models [19]. EfficientNetV2 extensively uses MBConv (MobileNetV2-style inverted residual blocks) and the newly added layer fused-MBConv in the early layers']","The YOLOv8 model has been noted for its ability to achieve real-time object detection, although it may still leave some objects undetected (Wang et al., 2024).","tracked in each subsequent frame, enhancing processing efficiency and speed. The detection algorithm always begins the search from the start, where the filter response is evaluated, and the maximum value per frame (frames/second) is used to determine the target position. The use of keyframes simplifies the processing and analysis of video by reducing the number of frames, thus saving time and computational complexity. Keyframe extraction minimizes redundancy and improves efficiency, as processing focuses only on essential information. B. Object Detection Object detection using YOLOv8 based on deep learning is chosen in this study due to its efficient one-stage detection approach, which enhances both accuracy and speed. With the anchor-free version, the model can directly predict the center of objects, making",0.0,0.8731212370175541
". This integration can also enable real-time monitoring and detection of potential risks, allowing organizations to proactively address issues and ensure regulation adherence. III. METHODOLOGY III. METHODOLOGY This research uses quantitative methods to investigate the integration of AI in IT governance. It uses COBIT 2019 guidelines as an initial analysis, then extends to further analyze common factors causing delays in software development projects. The analysis identifies variables that cause problems in software development projects and then extends them with machine learning algorithms using feature engineering. This method helps understand the factors influencing project outcomes for better decision-making in IT service delivery. The proposed methodology will utilize machine learning techniques to optimize project completion time. By utilizing machine learning algorithms, the","['. objective of COBIT 2019, which aims to enhance the management of IT delivery and support services. This study adopts a novel approach in identifying COBIT processes, specifically DSS01, through process mining Keywords—Bottlenecks, COBIT 2019, DSS01, Hospital techniques rather than traditional surveys. Process mining Billing, Process Mining utilizes event logs recorded from daily operations. This technique enables real-time process analysis by applying I', '. COBIT 2019 offers an COBIT 2019 for DSS01 Objective, particularly as a method effective methodology for evaluating the capability of of collecting and validating data within the process assessment information technology processes, specifically focusing on program. Experiments are conducted by analyzing Deliver, Service and Support (DSS01) - Operation performance and identifying bottlenecks in event logs related Management', '. systems [12]. Through the use of the COBIT 2019 framework, COBIT provides comprehensive guidance for identifying, auditors can pinpoint key controls necessary to achieve establishing, and monitoring the necessary controls within the predefined business objectives. Meanwhile, event log process IT environment to achieve defined business objectives [3], [4]', '. This system aims COBIT 2019, which stands for Control Objectives for to help organizations manage risk, ensure compliance, and Information and Related Technologies, is a comprehensive enhanceperformanceinthecontextofinformationtechnology', '. H. Thabit and S. H. Abdullah, “Perceived Trust of Stakeholders: Predicting the Use of COBIT 2019 to Reduce Information data to analyze and optimize operational processes in realAsymmetry,” in 2023 3rd International Conference on Emerging time, focusing specifically on the effectiveness of IT delivery Smart Technologies and Applications (eSmarTA), Taiz, Yemen: IEEE, and support services. Our method successfully identified Oct. 2023, pp. 1–5. doi: 10.1109/eSmarTA59349.2023.10293688']","The integration of AI in IT governance can facilitate real-time monitoring and detection of potential risks, as demonstrated by the application of process mining techniques in evaluating IT delivery and support services (Thabit & Abdullah, 2023).","assist organizations in managing and optimizing their use of information technology (IT) . landscape, effective IT In today’s rapidly evolving digital governance is essential for organizations to ensure that their IT investments align with business objectives, comply with regulations, and mitigate risks . COBIT 2019 provides a structured approach for organiza- tions to establish, implement, and maintain effective gover- nance over IT. It defines the components necessary to create and sustain a governance system, as well as guidelines for building the most suitable governance system for an enterprise . By utilizing COBIT 2019, organizations can enhance the efficiency, effectiveness, and reliability of their IT usage, while also ensuring compliance with relevant regulations, policies, and standards . One of the key",0.3333333333333333,0.9489528153099026
"weekly. In addition, use the AcMAPE score as a loss function to create a stock price forecasting model. VI. CONCLUSION AND FUTURE WORKS VI. CONCLUSION AND FUTURE WORKS In this paper, we presented quantifying multi-aspect news sentiment with considered time sequence data and then forecasting stock prices next days using sentiment and technical indicators. In feature extraction, a daily confidence score from the classification model is used to quantify sentiment. The active learning model produced a monthly classification model to represent model knowledge. The Transformer Encoder Gated Recurrent Unit (TEGRU) out- performed another Transformer architecture for stock price forecasting on eight stock issuers. The TEGRU model consists of the transformer encoder to learn time series pattern data with multi-head attention","['. news title, calculate the daily stock issuer sentiment score Vanilla Transformer uses a linear layer to predict stock basedonaspectcategoryandsentimentpolarity.Thenegative price one day ahead using a decoder output projection. The sentiment has a negative value, and the positive sentiment FormerGRU uses a GRU layer and a dropout layer for has a positive value', '. However, the vanilla Transformer and MWRE@0.75 to determine the best architectures and was more effective in reducing significant errors, with an features in stock price forecasting. As shown in Table. 12, MSE of 4,870.30382. Our combined TKAN variant and pTKANwithoutdailyABSAsentimentscoreoutperformed TransformerEncoderarchitecturefailedtolearnthedataset, the other scenario, except in BBRI and BBCA stock showingtheworstMSEandMWRE. issuer', '. UNIFIEDSTOCKPRICEFORECASTING word representation based on aspect category, sentiment The R2, MAE, MSE, sMAPE, F1, and MWRE@0.75 are polarity,andopinionterm. used to evaluate unified stock price forecasting. The The predicted aspect-sentiment quadruplet is evaluated MWRE@0.75 means the MWRE evaluation method using using generative methods, which are BLUE, ROUGE-1, α 0.75 to emphasize movement direction error', '. The daily stock issuer sentiment score decoder output projection, followed by a linear layer for a using the mean sentiment score on each day trading, if not predicted stock price. FormerLSTM utilizes decoder output found,filledwithzerovalue.Thedailystockissuersentiment topredictstockpriceonestepaheadusingconsecutivelayers: score can be combined with stock transaction history. The LSTMlayer,dropoutlayer,andlinearlayer', '. DigitalObjectIdentifier10.1109/ACCESS.2024.3506658 Permuted Temporal Kolmogorov-Arnold Networks for Stock Price Forecasting Using Generative Aspect-Based Sentiment Analysis AGUSTRIHARYONO 1,2,RIYANARTOSARNO1,(SeniorMember,IEEE), RATIHNURESTIANGGRAINI1,(Member,IEEE), ANDKELLYROSSASUNGKONO 1,(Member,IEEE) 1DepartmentofInformatics,InstitutTeknologiSepuluhNopember,Surabaya60111,Indonesia 2DepartmentofInformatics,UniversitasMulawarman,Samarinda75119,Indonesia']","The sentiment analysis in stock price forecasting indicates that negative sentiment correlates with negative price movements, while positive sentiment correlates with positive price movements (Agustriharyono et al., 2024).","using the mean sentiment score on each day trading, if not found, filled with zero value. The daily stock issuer sentiment score can be combined with stock transaction history. The illustration of the final dataset in the form of panel data is shown in Table. 2. D. FORECASTING MODELS D. FORECASTING MODELS This sub-section presents modified Transformer architec- ture, which are Transformer GRU (FormerGRU), Trans- former LSTM (FormerLSTM), Transformer Encoder GRU (TEGRU), and Transformer Encoder LSTM (TELSTM). Modified Transformer was chosen because TEGRU outper- formed other Transformer variants, such as vanilla Trans- former, Informer, FEDformer, and Transformer Encoder in stock price forecasting . This research proposes permuted Temporal Kolmogorov-Arnold Networks (pTKAN) architec- ture to develop a unified stock forecasting model",0.0,0.9265660203466302
"of the dataset, the experimental scenarios, the pro- posed methodology, and the evaluation. Section IV describes the results of experimental research compared to previous studies on both intra-subject and inter-subject validation. Part 5 is the conclusion. II. RELATED WORK II. RELATED WORK Research related to emotion recognition using the DEAP open-source repositories attempts to improve performance accuracy. Intra-subject research has been carried out in many previous studies and obtained accuracy rates above 90%, even up to 99%. According to the existing research, intra- subject accuracy measures are superior to inter-subject accu- racy measures. In inter-subject research, the work is still very rare, resulting in poor performance, using a large number of channels, and often using a very deep architecture for","['. Reference [31] introduces a subject-independent sis,themodelemploystwoadditionalvalidationtechniques, or cross-subject approach with Inception-V3 CNN achiev- namely random split, and leave-one-out subject. The archiing accuracies of average 90.7%. Reference [60] presents tecture proposed in this research was validated using the BiSMSM for EEG-based emotion recognition, achieving publiclyavailableDEAPdataset.Thedependentsubjectand 63.10% to 61.89% accuracy', '. Additionally,DCERNETarchitecturewasincorporated.This architecture was created for cross-subject emotion validation.Thisstudyinvolvedconductingexperimentsutilizinga standardarchitecturalframework.Oneissuethatariseswhen employing a standard architecture with deep layers is the significantconsumptionofRandomAccessMemory(RAM), IV. RESULTANDDISCUSSION especially when handling 32 channels with 32 participants A. PROPOSEDSELECTEDCHANNELSWITHVARIOUS utilizing the DEAP dataset', '. ABSTRACT Emotion recognition based on EEG has been implemented in numerous studies. In most of them, there are two observations made: first, extensive implementation is negatively associated with the performed validation. Cross-subject validation is more difficult than subject-dependent validation due to thehighvariabilitybetweenEEGrecordingscausedbydomainshifts.Second,alargenumberofchannels requires extensive computation', '. These selected channels are then subjected to the EEG-based emotion recognition model (AP-CapsNet) with Morlettransform,transformingthedatainto2Dimagesthat subject-dependent and cross-subject experiments, achiev- effectivelyencapsulateintricatetemporalandspectralinforing high accuracies of 62.7% and 63.51% in valence and mation.Subsequently,employingasimplifieddeeplearning arousal class', '. Luo and B.-L. Lu, ‘‘EEG data augmentation for emotion recogni- neuralnetworkforEEGemotionrecognition,’’Neurocomputing,vol.448, tion using a conditional Wasserstein GAN,’’ in Proc. 40th Annu. Int. pp.140–151,Aug.2021,doi:10.1016/j.neucom.2021.03.105. Conf.IEEEEng.Med.Biol.Soc.(EMBC),Jul.2018,pp.2535–2538,doi: [57] S. Bhosale, R. Chakraborty, and S. K. Kopparapu, ‘‘Calibration free 10.1109/EMBC.2018.8512865']","Cross-subject validation is more challenging than subject-dependent validation due to significant variability in EEG recordings (Luo and Lu, 2018).","Subsequently, employing a simplified deep learning architecture, we conduct a precise classification task, cate- gorizing emotional states into valence and arousal groups. For dependent subject and cross-subject performance analy- sis, the model employs two additional validation techniques, namely random split, and leave-one-out subject. The archi- tecture proposed in this research was validated using the publicly available DEAP dataset. The dependent subject and cross-subject validation portions of the emotional validation VOLUME 11, 2023 110139 TABLE 2. Recent articles on deep learning for EEG classification. L. Farokhah et al.: Cross-Subject Channel Selection TABLE 3. DEAP dataset attributes. FIGURE 1. Proposed research framework. experiment using EEG are separated into two segments. The general proposed research framework order is depicted in Fig. 1. A.",0.6666666666666666,0.9073550226528693
". The 2D frame sequence research that has used training with various subjects is Chao’s research, which pro- duces 68.28% and 66.73% valence and arousal accuracy performances, respectively. Some inter-subject studies based on 2D images have lower performance measures. Pandey and Seeja researched 2D images of scalograms using 32 channels and frontal channels in the valence and arousal classes . The accuracy perfor- mance obtained for valence and arousal is 59% and 58%, respectively, while with the frontal channel, the accuracy performance is 61% for the valence class and 58% for the arousal class. Another study used the Inception Resnet-V2 architecture for positive and negative emotion classes . These emotions, transformed into the DEAP dataset, are called valence classes. The","['. First, this study into studies focused racy in the valence class and 85% accuracy in the arousal on channel selection methods within EEG signals using the class. Pandey and Seeja conducted research using CNN DEAP dataset, encompassing a diverse array of techniques architecture, achieving 59% and 59% accuracy for valence aimedatisolatingthemostinformativechannelsforemotion and arousal, respectively [28]. Using Inception Resnet-V2, analysis', '. These selected channels are then subjected to the EEG-based emotion recognition model (AP-CapsNet) with Morlettransform,transformingthedatainto2Dimagesthat subject-dependent and cross-subject experiments, achiev- effectivelyencapsulateintricatetemporalandspectralinforing high accuracies of 62.7% and 63.51% in valence and mation.Subsequently,employingasimplifieddeeplearning arousal class', '. Thirdly, and 96.7% valence and arousal class accuracy, respectively. they combined DCERNET and SVM to achieve 88.10% These papers collectively contribute diverse approaches to valence class performance. Farokhah et al. [26] integrated EEG-basedemotionrecognition,eachdemonstratingpromisthe development of a simplified CNN architecture, the best ing results in addressing various challenges', '. Reference [31] introduces a subject-independent sis,themodelemploystwoadditionalvalidationtechniques, or cross-subject approach with Inception-V3 CNN achiev- namely random split, and leave-one-out subject. The archiing accuracies of average 90.7%. Reference [60] presents tecture proposed in this research was validated using the BiSMSM for EEG-based emotion recognition, achieving publiclyavailableDEAPdataset.Thedependentsubjectand 63.10% to 61.89% accuracy', '. DigitalObjectIdentifier10.1109/ACCESS.2023.3322294 Cross-Subject Channel Selection Using Modified Relief and Simplified CNN-Based Deep Learning for EEG-Based Emotion Recognition LIAFAROKHAH1,2,RIYANARTOSARNO 1,(SeniorMember,IEEE), ANDCHASTINEFATICHAH 1,(Member,IEEE) 1DepartmentofInformatics,FacultyofIntelligentElectricalandInformaticsTechnology,InstitutTeknologiSepuluhNopember(ITS),Surabaya60111,Indonesia']",Pandey and Seeja achieved 59% accuracy for both valence and arousal classes using CNN architecture in their research on EEG-based emotion recognition.,"81.27% and 82.37% for valence and arousal clas- sifications . Pandey and Seeja used frontal lobe channel to channel selection with accuracy on valence and arousal around 50% until 60% . Reference used best single collaboration with confusion matrix as an indicator for chan- nel selection with accuracy on valence and arousal around 92%. The application of reduction channels for cross-subject classification has not been thoroughly investigated. Addition- ally, the result can be enhanced. A summary of the existing articles on channel selection has been presented in Table 1. Some cross-subject studies are based on 2D or 3D forms with 32 channels. Yin et al. presented a 3D cube ECLGCNN that was based on graphs and had 84% accu- racy",1.0,0.9477476995607006
"accuracy performance is 61% for the valence class and 58% for the arousal class. Another study used the Inception Resnet-V2 architecture for positive and negative emotion classes . These emotions, transformed into the DEAP dataset, are called valence classes. The performance obtained is 72.81%. Furthermore, the highest performance for inter-subjects research currently available is obtained by using a spec- trogram with the DenseNet-121 and DCERNET architec- tures, which only provide performance details on the valence class . The performance of the valence class using Densenet-121 is 85.57%, while the performance of the valence class using DCERNET and softmax is 88.57%, and DCERNET and SVM is 88.10%. In addition, the valida- tion of inter-subject emotions using the 2D frame sequences resulted","['. tion [27]. First, using a spectrogram in conjunction with Reference[54]introducesanautomatedcross-subjectframethe DenseNet-121 architecture yields performance in the work with impressive accuracies of 83.9% to 84.3%. Our 85.57% valence class. In a second experiment, they collab- recent paper Farokhah et al. [26] proposed a simplified orated on DCERNET architectures and Softmax to achieve CNNandspectrogramwith32channelsthatachieve98.3% a valence class performance of 88.57 percent', '. Reference [31] introduces a subject-independent sis,themodelemploystwoadditionalvalidationtechniques, or cross-subject approach with Inception-V3 CNN achiev- namely random split, and leave-one-out subject. The archiing accuracies of average 90.7%. Reference [60] presents tecture proposed in this research was validated using the BiSMSM for EEG-based emotion recognition, achieving publiclyavailableDEAPdataset.Thedependentsubjectand 63.10% to 61.89% accuracy', '. In [59], MTLFuseNet combines VAE and architecture, we conduct a precise classification task, cateGCN/GRUforEEG-basedemotionrecognition,outperform- gorizing emotional states into valence and arousal groups. ing state-of-the-art methods with accuracies of 71.33% to Fordependentsubjectandcross-subjectperformanceanaly73.28%', '. Thirdly, and 96.7% valence and arousal class accuracy, respectively. they combined DCERNET and SVM to achieve 88.10% These papers collectively contribute diverse approaches to valence class performance. Farokhah et al. [26] integrated EEG-basedemotionrecognition,eachdemonstratingpromisthe development of a simplified CNN architecture, the best ing results in addressing various challenges', '. These selected channels are then subjected to the EEG-based emotion recognition model (AP-CapsNet) with Morlettransform,transformingthedatainto2Dimagesthat subject-dependent and cross-subject experiments, achiev- effectivelyencapsulateintricatetemporalandspectralinforing high accuracies of 62.7% and 63.51% in valence and mation.Subsequently,employingasimplifieddeeplearning arousal class']","The combination of DCERNET and SVM achieved a valence class performance of 88.10% (Farokhah et al., 2023).","72.81% . Using 2D frame sequences and BiDCNN, Huang et al. achieved 68% valence accuracy and 63% arousal accu- racy . Another study used a matrix sequence-based 110138 VOLUME 11, 2023 L. Farokhah et al.: Cross-Subject Channel Selection TABLE 1. Summary of the channel selection approaches. meta-learner with a class performance of 69.92% for valence and 68.89% for arousal . Pusarla et al. conducted three experiments simultaneously on cross-subject valida- tion . First, using a spectrogram in conjunction with the DenseNet-121 architecture yields performance in the 85.57% valence class. In a second experiment, they collab- orated on DCERNET architectures and Softmax to achieve a valence class performance of 88.57 percent. Thirdly, they combined DCERNET and SVM to achieve 88.10% valence",0.5,0.9264759874868501
"the valence class using Densenet-121 is 85.57%, while the performance of the valence class using DCERNET and softmax is 88.57%, and DCERNET and SVM is 88.10%. In addition, the valida- tion of inter-subject emotions using the 2D frame sequences resulted in 68% and 63% accuracy on valence and arousal, respectively . Non-2D research, such as the use of 3D meta-learners, yields valence and arousal performance of 69.92% and 68.89%, respectively . Research on 3D cubes with inter-subjects has been carried out with valence and arousal performances of 84% and 85% . Based on pre- vious studies, it is concluded that the highest accuracy per- formance in the valence class is 88.57% and the arousal class is 85%. Previous inter-subject research","['. In [59], MTLFuseNet combines VAE and architecture, we conduct a precise classification task, cateGCN/GRUforEEG-basedemotionrecognition,outperform- gorizing emotional states into valence and arousal groups. ing state-of-the-art methods with accuracies of 71.33% to Fordependentsubjectandcross-subjectperformanceanaly73.28%', '. These selected channels are then subjected to the EEG-based emotion recognition model (AP-CapsNet) with Morlettransform,transformingthedatainto2Dimagesthat subject-dependent and cross-subject experiments, achiev- effectivelyencapsulateintricatetemporalandspectralinforing high accuracies of 62.7% and 63.51% in valence and mation.Subsequently,employingasimplifieddeeplearning arousal class', '. Reference [31] introduces a subject-independent sis,themodelemploystwoadditionalvalidationtechniques, or cross-subject approach with Inception-V3 CNN achiev- namely random split, and leave-one-out subject. The archiing accuracies of average 90.7%. Reference [60] presents tecture proposed in this research was validated using the BiSMSM for EEG-based emotion recognition, achieving publiclyavailableDEAPdataset.Thedependentsubjectand 63.10% to 61.89% accuracy', '. Thirdly, and 96.7% valence and arousal class accuracy, respectively. they combined DCERNET and SVM to achieve 88.10% These papers collectively contribute diverse approaches to valence class performance. Farokhah et al. [26] integrated EEG-basedemotionrecognition,eachdemonstratingpromisthe development of a simplified CNN architecture, the best ing results in addressing various challenges', '. Additionally,DCERNETarchitecturewasincorporated.This architecture was created for cross-subject emotion validation.Thisstudyinvolvedconductingexperimentsutilizinga standardarchitecturalframework.Oneissuethatariseswhen employing a standard architecture with deep layers is the significantconsumptionofRandomAccessMemory(RAM), IV. RESULTANDDISCUSSION especially when handling 32 channels with 32 participants A. PROPOSEDSELECTEDCHANNELSWITHVARIOUS utilizing the DEAP dataset']","The combination of DCERNET and SVM achieved a valence class performance of 88.10% (Farokhah et al., 2023).","72.81% . Using 2D frame sequences and BiDCNN, Huang et al. achieved 68% valence accuracy and 63% arousal accu- racy . Another study used a matrix sequence-based 110138 VOLUME 11, 2023 L. Farokhah et al.: Cross-Subject Channel Selection TABLE 1. Summary of the channel selection approaches. meta-learner with a class performance of 69.92% for valence and 68.89% for arousal . Pusarla et al. conducted three experiments simultaneously on cross-subject valida- tion . First, using a spectrogram in conjunction with the DenseNet-121 architecture yields performance in the 85.57% valence class. In a second experiment, they collab- orated on DCERNET architectures and Softmax to achieve a valence class performance of 88.57 percent. Thirdly, they combined DCERNET and SVM to achieve 88.10% valence",0.5,0.9201966385702787
"uses the old method, which is based on the brain area. Yin et al. conduct channel selection for inter-subject classification by developing locally-robust feature selection (LRFS) with approximately 60% accuracy performance for valence and arousal classes . Arjun et al. used the attention channel for inter-subject classification, collaborating LSTM and autoencoder, and achieved accuracy rates of 65.9% and 69.5% for valence and arousal classes, 46332 VOLUME 11, 2023 L. Farokhah et al.: Simplified 2D CNN Architecture With Channel Selection for Emotion Recognition respectively . Yang et al. used ReliefF and random forest to select the best 10 channels and 11 channels for intra-subject and inter-subject classification, with inter-subject perfor- mance results of 81.27% and 82.36% in valence and arousal classes","['. DigitalObjectIdentifier10.1109/ACCESS.2023.3322294 Cross-Subject Channel Selection Using Modified Relief and Simplified CNN-Based Deep Learning for EEG-Based Emotion Recognition LIAFAROKHAH1,2,RIYANARTOSARNO 1,(SeniorMember,IEEE), ANDCHASTINEFATICHAH 1,(Member,IEEE) 1DepartmentofInformatics,FacultyofIntelligentElectricalandInformaticsTechnology,InstitutTeknologiSepuluhNopember(ITS),Surabaya60111,Indonesia', '. These selected channels are then subjected to the EEG-based emotion recognition model (AP-CapsNet) with Morlettransform,transformingthedatainto2Dimagesthat subject-dependent and cross-subject experiments, achiev- effectivelyencapsulateintricatetemporalandspectralinforing high accuracies of 62.7% and 63.51% in valence and mation.Subsequently,employingasimplifieddeeplearning arousal class', '. Reference [31] introduces a subject-independent sis,themodelemploystwoadditionalvalidationtechniques, or cross-subject approach with Inception-V3 CNN achiev- namely random split, and leave-one-out subject. The archiing accuracies of average 90.7%. Reference [60] presents tecture proposed in this research was validated using the BiSMSM for EEG-based emotion recognition, achieving publiclyavailableDEAPdataset.Thedependentsubjectand 63.10% to 61.89% accuracy', '. Additionally,DCERNETarchitecturewasincorporated.This architecture was created for cross-subject emotion validation.Thisstudyinvolvedconductingexperimentsutilizinga standardarchitecturalframework.Oneissuethatariseswhen employing a standard architecture with deep layers is the significantconsumptionofRandomAccessMemory(RAM), IV. RESULTANDDISCUSSION especially when handling 32 channels with 32 participants A. PROPOSEDSELECTEDCHANNELSWITHVARIOUS utilizing the DEAP dataset', '. First, this study into studies focused racy in the valence class and 85% accuracy in the arousal on channel selection methods within EEG signals using the class. Pandey and Seeja conducted research using CNN DEAP dataset, encompassing a diverse array of techniques architecture, achieving 59% and 59% accuracy for valence aimedatisolatingthemostinformativechannelsforemotion and arousal, respectively [28]. Using Inception Resnet-V2, analysis']",Farokhah et al. achieved accuracies of 62.7% and 63.51% for valence and arousal classes using a modified approach to channel selection and a simplified deep learning model (AP-CapsNet) for EEG-based emotion recognition.,"valence and arousal around 80% . Javidan et al. validate cross-subject performance in the valence class (2 channels) utilizing the RReliefF selection strategy with input MSCE and SVR classifiers, yielding an accuracy of 67.45% . Msonda et al. reconstruct features (using 2, 3, 4, 5, 6, 7, and 8 channels) and search for the minimal errors using Adaboost, LR, Linear SVC, Polynomial SVC, and RF, with average performance results between 50 and 60%. Using locally robust feature selection (LRFS), Yin et al. execute channel selection for cross-subject classification with an estimated accuracy of 60% for valence and arousal classes . Arjun et al. employed the attention channel when combined with the LSTM and autoen- coder for cross-subject classification and obtained",1.0,0.9487123620705566
"accuracy performance when using 32 channels either intra-subject or inter-subject. Second, it is desired that the research should lead to the use of minimal channels but well-performing. Third, the architecture com- plexity is seen as a trade-off with the performance measures. Therefore, the proposed research targets all these gaps and investigates inter-subject performance using minimal chan- nels and a simplified architecture, without the need for con- tinuous re-trainings. III. MATERIALS AND METHOD III. MATERIALS AND METHOD The architecture proposed in this study was validated on the DEAP, public dataset. The results of the emotional val- idation experiment using EEG are divided into two parts, namely intra-subject and inter-subject validation. The pro- posed method involves the processing of the raw data","['. Reference [31] introduces a subject-independent sis,themodelemploystwoadditionalvalidationtechniques, or cross-subject approach with Inception-V3 CNN achiev- namely random split, and leave-one-out subject. The archiing accuracies of average 90.7%. Reference [60] presents tecture proposed in this research was validated using the BiSMSM for EEG-based emotion recognition, achieving publiclyavailableDEAPdataset.Thedependentsubjectand 63.10% to 61.89% accuracy', '. These selected channels are then subjected to the EEG-based emotion recognition model (AP-CapsNet) with Morlettransform,transformingthedatainto2Dimagesthat subject-dependent and cross-subject experiments, achiev- effectivelyencapsulateintricatetemporalandspectralinforing high accuracies of 62.7% and 63.51% in valence and mation.Subsequently,employingasimplifieddeeplearning arousal class', '. Additionally,DCERNETarchitecturewasincorporated.This architecture was created for cross-subject emotion validation.Thisstudyinvolvedconductingexperimentsutilizinga standardarchitecturalframework.Oneissuethatariseswhen employing a standard architecture with deep layers is the significantconsumptionofRandomAccessMemory(RAM), IV. RESULTANDDISCUSSION especially when handling 32 channels with 32 participants A. PROPOSEDSELECTEDCHANNELSWITHVARIOUS utilizing the DEAP dataset', '. ABSTRACT Emotion recognition based on EEG has been implemented in numerous studies. In most of them, there are two observations made: first, extensive implementation is negatively associated with the performed validation. Cross-subject validation is more difficult than subject-dependent validation due to thehighvariabilitybetweenEEGrecordingscausedbydomainshifts.Second,alargenumberofchannels requires extensive computation', '. Thirdly, and 96.7% valence and arousal class accuracy, respectively. they combined DCERNET and SVM to achieve 88.10% These papers collectively contribute diverse approaches to valence class performance. Farokhah et al. [26] integrated EEG-basedemotionrecognition,eachdemonstratingpromisthe development of a simplified CNN architecture, the best ing results in addressing various challenges']",The architecture proposed in this research was validated using the publicly available DEAP dataset (Cross-Subject Channel Selection Using Modified Relief and Simplified CNN-Based Deep Learning for EEG-Based Emotion Recognition).,"added in our recent publi- cation also yet tailored for spectrogram images. Instead of relying on resource-intensive transfer learning models, our approach optimizes model efficiency, making it more com- putationally friendly or resource-constrained applications. This contribution aims to streamline the implementation of emotion recognition systems without compromising perfor- mance. The proposed research is based on a simplified deep learn- ing architecture and channel selection approach that leads towards closer and resource-constrained real-time implemen- tation. In addition, research for cross-subject validation is more likely to be implemented widely than dependent subject validation. Cross-subject validation has a better generaliza- tion model than dependent-subject validation. This makes this research applicable across a wide range of industries where emotion recognition enables the development of",0.5,0.8620147364174596
"this study was validated on the DEAP, public dataset. The results of the emotional val- idation experiment using EEG are divided into two parts, namely intra-subject and inter-subject validation. The pro- posed method involves the processing of the raw data with fewer preprocessing steps. The Python development environ- ment has been used to downsample data to 128 Hz, remove EOG artifacts, and perform bandpass frequency filtering from 4–45 Hz. The raw EEG data is transformed into a spectrogram image using the STFT method and stored as RGB images. This is done using the MATLAB (octave and oc2py) library in Python. After the spectrogram is generated, the next step is to classify emotions using a deep learning network. The archi- tecture","['. ABSTRACT Emotion recognition based on EEG has been implemented in numerous studies. In most of them, there are two observations made: first, extensive implementation is negatively associated with the performed validation. Cross-subject validation is more difficult than subject-dependent validation due to thehighvariabilitybetweenEEGrecordingscausedbydomainshifts.Second,alargenumberofchannels requires extensive computation', '. 10.3390/s20123491. [28] P.PandeyandK.R.Seeja,‘‘Subjectindependentemotionrecognitionsys- [46] H. Donmez and N. Ozkurt, ‘‘Classification of emotional states from temforpeoplewithfacialdeformity:AnEEGbasedapproach,’’J.Ambient multi-channel EEG signals by convolutional neural networks,’’ in Intell.HumanizedComput.,vol.12,no.2,pp.2311–2320,Feb.2021,doi: Proc. Innov. Intell. Syst. Appl. Conf. (ASYU), 2022, pp.1–6, doi: 10.1007/s12652-020-02338-8. 10.1109/ASYU56188.2022.9925308. [29] Y. Cimtay and E', '. Reference [31] introduces a subject-independent sis,themodelemploystwoadditionalvalidationtechniques, or cross-subject approach with Inception-V3 CNN achiev- namely random split, and leave-one-out subject. The archiing accuracies of average 90.7%. Reference [60] presents tecture proposed in this research was validated using the BiSMSM for EEG-based emotion recognition, achieving publiclyavailableDEAPdataset.Thedependentsubjectand 63.10% to 61.89% accuracy', '. These selected channels are then subjected to the EEG-based emotion recognition model (AP-CapsNet) with Morlettransform,transformingthedatainto2Dimagesthat subject-dependent and cross-subject experiments, achiev- effectivelyencapsulateintricatetemporalandspectralinforing high accuracies of 62.7% and 63.51% in valence and mation.Subsequently,employingasimplifieddeeplearning arousal class', '. DigitalObjectIdentifier10.1109/ACCESS.2023.3322294 Cross-Subject Channel Selection Using Modified Relief and Simplified CNN-Based Deep Learning for EEG-Based Emotion Recognition LIAFAROKHAH1,2,RIYANARTOSARNO 1,(SeniorMember,IEEE), ANDCHASTINEFATICHAH 1,(Member,IEEE) 1DepartmentofInformatics,FacultyofIntelligentElectricalandInformaticsTechnology,InstitutTeknologiSepuluhNopember(ITS),Surabaya60111,Indonesia']","The architecture proposed in this research was validated using the publicly available DEAP dataset (Farokhah et al., 2023).","experimentation which can aid in gathering a diverse set of information under the con- trolled environment as they experience a variety of emotional stimuli. Primarily, DEAP offers access to numerous kinds of physiological signals including EEG, ECG, GSR, and others, yet in this study, EEG data available for 32 subjects has been employed. Each of the subjects has been exposed to numer- ous types of 40 video clips (1 minute each) associated with content related to different emotional states. The associated EEG responses are recorded at a high sampling rate utiliz- ing BioSemi ActiveTwo EEG instruments with 32 principal channels. The data is later passed on through pre-processing stages that involve data downsampling to 128 Hz, removal of the EOG",1.0,0.8522576271139735
"DATASET The DEAP dataset has 32 participants with a composition of 50% male and 50% female samples . The stimulus used is a video with a duration of 60 seconds. The results of the EEG recording have a duration of 63 seconds, of which 3 seconds are the baseline. One participant has 40 recordings of the EEG trials. The results of the EEG trial recordings have been mea- sured using the Self-Assessment Manikin (SAM). SAM has four emotional dimensions, namely valence, arousal, domi- nance, and liking, with ratings 0-9. For valence and arousal classes, emotion labels are divided into two categories: low and high. In this study, the low class has a rating below 4.5 and the high class is","['. First, this study into studies focused racy in the valence class and 85% accuracy in the arousal on channel selection methods within EEG signals using the class. Pandey and Seeja conducted research using CNN DEAP dataset, encompassing a diverse array of techniques architecture, achieving 59% and 59% accuracy for valence aimedatisolatingthemostinformativechannelsforemotion and arousal, respectively [28]. Using Inception Resnet-V2, analysis', '. reflect the ongoing advancements and interdisciplinary collaboration in the field of EEG-based research, aiming to Emotion recognition is another key area explored. The enhance user experiences, improve health outcomes, and study in [20] examines the impact of HDR videos on emotion develop innovative assistive technologies. recognition, achieving an accuracy of 80.55% for arousal and 70.37% for valence. Similarly, [33] develops a hybrid control TABLE I', '. This study demonstrates the potential of involving the Emotiv Insight? the EMOTIV Insight headset in affective computing and its applications in fields such as marketing, mental health, and education. • Methodologies and Limitations: The methodology used in [12] study involved recording EEG data while Fig. 2. SLR Methodology participants were exposed to various stimuli', '. The widespread use of the EMOTIV Insight computer interfaces (BCIs), emotional analysis, and headset is evident, demonstrating its accessibility and neurofeedback training. The studies span from 2016 to 2024, suitability for various EEG applications. For instance, [26] showcasing a wide range of applications and methodologies', '. ABSTRACT Emotion recognition based on EEG has been implemented in numerous studies. In most of them, there are two observations made: first, extensive implementation is negatively associated with the performed validation. Cross-subject validation is more difficult than subject-dependent validation due to thehighvariabilitybetweenEEGrecordingscausedbydomainshifts.Second,alargenumberofchannels requires extensive computation']",The DEAP dataset has been utilized in studies achieving 59% accuracy for both valence and arousal classifications in EEG-based emotion recognition (Pandey and Seeja).,"for EEG classification. L. Farokhah et al.: Cross-Subject Channel Selection TABLE 3. DEAP dataset attributes. FIGURE 1. Proposed research framework. experiment using EEG are separated into two segments. The general proposed research framework order is depicted in Fig. 1. A. DEAP DATASET A. DEAP DATASET DEAP is an open-source database that is known to offer EEG, physiological, and audiovisual signals that can be widely used in the domain of computing and emotion recognition. Numer- ous subjects are involved in the experimentation which can aid in gathering a diverse set of information under the con- trolled environment as they experience a variety of emotional stimuli. Primarily, DEAP offers access to numerous kinds of physiological signals including EEG, ECG, GSR, and others,",1.0,0.9566516971814883
"find the accuracy is shown in Eq. 2. Accuracy = TP + TN TP + TN + FP + FN (2) where TP, TN, FP, and FN are true positives, true negatives, false positives, and false negatives. The precision and recall are then evaluated, as shown in Eq. 3 and 4, respectively. Precision = Recall = TP TP + FP TP TP + FP (3) (4) The next evaluation is the F-score, which is a combination of accuracy between recall and precision. The F-score formula is shown in Eq. 5. F1score = 2(precision)(recall) recall + precision (5) In measuring the evaluation, eight scenarios will be used, as shown in Table 3. For inter-subject classification, it used leave one out subject","["". These metrics can be calculated by (1) – (3). This study's calculation of True Positive, False Positive, and False Negative differs from other classifications or detections [20]-[23]. These are chosen and calculated following previous studies [1]. Precision detects the truly correct prediction out of all predictions. Recall detects the truly correct prediction out of all actual classes. F1 scores are harmonic mean between these two that measure overall model performance"", 'L.Farokhahetal.:Cross-SubjectChannelSelection FIGURE5. TrainingcurvesforValence.a.trainingandvalidationaccuracy. FIGURE6. Trainingcurvesforarousala.trainingandvalidationaccuracy. b.trainingandvalidationloss. b.trainingandvalidationloss. TABLE9. Cross-subjectperformanceoutcomeswithvaryinginput treatmentorchannelselectionmethod. inter-subject classification performance', '. In [61], an ensemble method cross-subjectvalidationportionsoftheemotionalvalidation VOLUME11,2023 110139', '. Complying withthemultitasklearningnature,twotargetlabelrepresentationsaredesignedtoleveragethesharedlowlevelcommonfeaturesoftheinputmessagesovervariousseveritylevels.Anextensiveexperimentwitha significant hyperparameter search space is performed to find the best-performing model to compare with several baselines and state-of-the-art methods from previous studies. The integrated gradient is employed to investigate the best-performing model’s trustworthiness and interpretability', '. The dataset Both consistently performs Fig.6focusoncomparingaveragemetricsperstageandper best,achievingthehighestAccuracy(94.56%)andPrecision anatomicaltract.Fig.5comparesStage1andStage2,reveal- (97.90%) in Stage 1, as well as strong Recall (96.90%) in ing that Stage 1 generally outperforms Stage 2 in Precision Stage 2. In contrast, data availability for the Public dataset (85.72%), Accuracy (93.06%), and Specificity (92.66%)']","The calculation of True Positive, False Positive, and False Negative metrics is essential for evaluating model performance, as these metrics can be derived from the formulas presented in the study (Referensi 1).","measured the ratio of correct recognition results to the entire dataset. Accuracy = TP + TN TP + FN + TN + FP (11) 2) Precision (12) estimated how many of the positive pre- dictions were correct. Precision = TP TP + FP (12) 3) Recall can also be called Sensitivity (13) calculated how many positive cases the classifier correctly pre- dicted over all the positive instances in the data. Recall = TP TP + FN (13) 4) F1-measure (14) assessed the predictive skill of a model by elaborating on its class-wise performance. F1 − measure = 2 × Precision × Recall Precision + Recall (14) 97240 VOLUME 12, 2024 M. Rivai, D. Aulia: Use of Electronic Nose to Identify",0.75,0.9439440489869754
"82.45% in the valence and arousal classes, respectively. In the ReliefF method (R-HOLO-FM), it is 83.26% and 83.85% in the valence and arousal classes. This is different when using the proposed architecture, which results in increased performance accuracy on the NCA: 10.32% and 9.85% in the valence and arousal and ReliefF method classes, respectively, with a performance increase of 7.64% and 8.85% in the valence and arousal classes. The proposed channel selection method outperforms the other selection methods in the valence and arousal classes . The input for selecting the best channel for the proposed method uses EEG data to be classified, namely spectrogram data. The accuracy and loss plot results in Table 5 are shown in Figures 6, 7,","['. DigitalObjectIdentifier10.1109/ACCESS.2023.3322294 Cross-Subject Channel Selection Using Modified Relief and Simplified CNN-Based Deep Learning for EEG-Based Emotion Recognition LIAFAROKHAH1,2,RIYANARTOSARNO 1,(SeniorMember,IEEE), ANDCHASTINEFATICHAH 1,(Member,IEEE) 1DepartmentofInformatics,FacultyofIntelligentElectricalandInformaticsTechnology,InstitutTeknologiSepuluhNopember(ITS),Surabaya60111,Indonesia', '. First, this study into studies focused racy in the valence class and 85% accuracy in the arousal on channel selection methods within EEG signals using the class. Pandey and Seeja conducted research using CNN DEAP dataset, encompassing a diverse array of techniques architecture, achieving 59% and 59% accuracy for valence aimedatisolatingthemostinformativechannelsforemotion and arousal, respectively [28]. Using Inception Resnet-V2, analysis', 'L.Farokhahetal.:Cross-SubjectChannelSelection preponderanceofthepowerbandratioviathereliefmethod. [8] M.N.Munawar,R.Sarno,D.A.Asfani,T.Igasaki,andB.T.Nugraha, Third, collaboration of scalogram, PR-Relief for channel ‘‘Significant preprocessing method in EEG-based emotions classification,’’ J. Theor. Appl. Inf. Technol., vol. 87, no. 2, pp.176–190, selection, and simplified CNN for classification have pro2016. posed. In the proposed channel selection, the number of [9] Y. Wu, M. Xia, L. Nie, Y. Zhang, and A', '. Thirdly, and 96.7% valence and arousal class accuracy, respectively. they combined DCERNET and SVM to achieve 88.10% These papers collectively contribute diverse approaches to valence class performance. Farokhah et al. [26] integrated EEG-basedemotionrecognition,eachdemonstratingpromisthe development of a simplified CNN architecture, the best ing results in addressing various challenges', '. A summary of single collaboration for channel selection, and a spectro- the articles making use of deep learning methods on all gram with the greatest accuracy in the valence and arousal 32channelshasbeenpresentedinTable2. classes,achieving98.3%and96.7%accuracywith32channels, respectively. Tangetal.[32] used the spatial-temporal III']","The proposed channel selection method achieves 85% accuracy in the arousal class and focuses on channel selection methods within EEG signals (Farokhah et al., 2023).","an accuracy between 69.56% and 83.50%, respec- tively . The NMI selection approach with input PSD and SVM classifiers yielded 74.41% valence (8 channels) and arousal (10 channels) accuracy of 73.64% . Goshvar- pour and Goshvarpour employing the sLORETA selection method and input lagged Poincare indicator and SVM clas- sifier deliver valence (5 channels) and arousal (5 channels) performance of 74.41% and 74.71%, respectively . Topic et al. used ReliefF and NCA approach for selection chan- nels with accuracy on valence and arousal around 80% . Javidan et al. validate cross-subject performance in the valence class (2 channels) utilizing the RReliefF selection strategy with input MSCE and SVR classifiers, yielding an accuracy of 67.45% . Msonda et al. reconstruct features",0.6666666666666666,0.9490848325866748
predictions to the total test data. Models with high accuracy can predict new data correctly. Precision = TP TP + FP (5) Precision (5) is the ability to identify relevant data. High precision and accuracy can represent a better model. Recall = TP TP + FN (6) Recall (6) is the ability to find all relevant cases in a dataset. Recall can be explained by the success of the model in retrieving information. F1 − Score = 2 × Precision × Recall Precision + Recall (7) F1-Score (7) is an evaluation metric to determine the perfor- mance of the model accuracy against the dataset. F1-score is a calculation that involves a combination of precision and recall values. E. GENETIC ALGORITHM,"['. In stage 1, theperformanceevaluationanalysisonsystemperformance has the form of average system performance (mAP, recall, andF1score)ontheobjectivefunctionaswellasthelowest lossvalue.Then,identifymultiplehyperparametercandidates thatperformwellonobjectivefunctionswithlowlossvalues and good system performance. Furthermore, stage 2 data processing in the Search-Space model has better system performanceandthelowestloss', "". These metrics can be calculated by (1) – (3). This study's calculation of True Positive, False Positive, and False Negative differs from other classifications or detections [20]-[23]. These are chosen and calculated following previous studies [1]. Precision detects the truly correct prediction out of all predictions. Recall detects the truly correct prediction out of all actual classes. F1 scores are harmonic mean between these two that measure overall model performance"", '. AR, F1-score, and accuracy. The average value of TPE optimization yields system performance metrics systemperformanceiscalculatedandthebestaverage such as mAP, recall, F1-score, and accuracy, which valueofthecandidateisselected. are then averaged to obtain the global minimum The iYOLOV7-TPE-SS model processes the input data in the form of the least loss', "". We applied various machine learning models, accurate predictions, as machine learning models learn from including Random Forest and XGBoost, to improve the the input data, following the principle of 'garbage-ingarbage-out' [29]. Once they complete the preprocessing steps, the data will be ready for the machine learning model. TABLE II. RESULTS TABLE OF THE FOUR KEY METRICS Metrics ID Description Value D"", '. EVALUATION METRIC SUMMARY. MAXIMUM SCORE IS THE BEST FOR DSC,MDSC, TPR AND PRECISION. SMALLEST SCORE WILL BE BETTER FOR DISTANCE METRIC (HD, ASSD), BEST SCORES ARE MARKED IN BOLD']","Precision measures the accuracy of positive predictions, recall assesses the ability to identify all relevant cases, and the F1 score serves as a harmonic mean of precision and recall to evaluate overall model performance (Multi-class Oil Palm Trees Condition Detection from UAV Images using Faster R-CNN with EfficientNetV2).","with the following formula: TP + TN TP + TN + FP + FN Accuracy = Precision = Recall/True Positive Rate(TPR) TP TP + FP TP TP + FN F1 = 2 × precision × recall precision + recall FP TN + TP (cid:90) 1 TPRd(FPR) False Positive Rate(FPR) = AUC = (4) (5) (6) (7) (8) (9) where TP is the number of correctly predicted positive labels, TN is the number of correctly predicted negative labels, FP is the number of incorrectly predicted positive labels, and FN is the number of incorrectly predicted negative labels. Accuracy is the ratio of true predictions to the overall data. Precision is the ratio between TP to the total number of positive predic-",0.8,0.9152525814958409
"highly relevant to various incident cases, as shown in Fig 3. Not only is it highly relevant, but it is also highly prioritised evidence in diverse investigation cases. 2) Flight log messages cover events from the drone’s sensors, features, and components, making it one piece of evidence to perform analysis related to different drone software and hardware components. Therefore, analysing the log messages means analysing the whole device for various possible incident scenarios. 3) Flight log messages contain contextual information about the occurring event as a description that involves multiple parts of the drone simultaneously. For example, a certain circumstance fails a feature or an operation, as shown in message group number 4 in Table 1. TABLE 1. Groups of","['robust predictions, enabling drone operators to detect and Furthermore, Jain et al. [10] proposed a framework for diagnose malfunctions quickly and take corrective actions. sensor data identification and verification. An analysis of a Thestructureofthispaperisasfollows.SectionIIpresents drone’sarchitectureandaforensicmodelwithgenericfeatures previous research relating to the drone log analysis and drone are proposed here in order to enhance the digital investigation forensics', '. DigitalObjectIdentifier10.1109/ACCESS.2024.3396926 Severity-Oriented Multiclass Drone Flight Logs Anomaly Detection SWARDIANTARASILALAHI 1,(GraduateStudentMember,IEEE), TOHARIAHMAD 1,(Member,IEEE),HUDANSTUDIAWAN 1,(Member,IEEE), EIRINIANTHI 2,ANDLOWRIWILLIAMS 2 1DepartmentofInformatics,InstitutTeknologiSepuluhNopember,Surabaya60111,Indonesia 2SchoolofComputerScienceandInformatics,CardiffUniversity,CF244AGCardiff,U.K', '. incident. This information could help investigators determine ThispaperproposestheTransformermethodforclassifying whether the crash was due to a malfunction, operator error, drone malfunctions based on telemetry data. By leveraging or external factors such as weather conditions or interference their ability to handle sequential data and capture complex from other sources', '. Most drone incidents are caused analysis of drone logs can also provide evidence that can be by bird attacks, collide with other drones, and malfunctioning used in legal proceedings. This evidence can be particularly systems.Sometimesthedronemayhaveamalfunctioningsystem valuable in cases where there are disputes over liability, such caused by sensor failure, a broken motor, or CPU failure. This cancauseanaccident.Therefore,aforensicinvestigationsupports as in cases of property damage or personal injury', '. There is yet to come incident scenarios to perform case studies to verify the a publicly available dataset of log messages from other performanceoftheproposedmethod,andmakingitpublicly dronemanufacturers.Severalpubliclyavailabledatasetsare available. 64264 VOLUME12,2024']","The analysis of drone logs can provide evidence useful in legal proceedings, particularly in liability disputes related to property damage or personal injury (Jain et al.).","as runtime logs that are constantly generated during the operational period of the device. The information recorded in log data is highly valuable for many purposes, including running system monitoring, running process conformance checks, and overall system evaluation . The use of log data is critical when incident cases occur, as the empirical events and incident scenarios can be discovered by analysing the log artefacts. Assuming that 64252 2024 The Authors. This work is licensed under a Creative Commons Attribution-NonCommercial-NoDerivatives 4.0 License. For more information, see VOLUME 12, 2024 S. Silalahi et al.: Severity-Oriented Multiclass Drone Flight Logs Anomaly Detection the integrity of the log is guaranteed, log data is one of the artefacts with the highest priority for investigating",0.6666666666666666,0.9200355522479092
"To do so, several artefacts such as flight logs, images, videos, firmware logs, and controller applications can be analysed, as illustrated in Fig 1. For instance, GPS records can be utilised to reconstruct and analyse the path taken by the drone during a flight . The deviation between the empirical flight and reconstructed paths can happen if the drone encounters a GPS spoofing . Among the published drone forensics studies, popular works include case studies, evidence analysis, tools develop- ment, and forensic framework development . The widely investigated source of evidence is sensor data, such as GPS , which provides a concise diagnosis of a flight to the investigator when performing anomaly detection . In fact, a flight log not","['robust predictions, enabling drone operators to detect and Furthermore, Jain et al. [10] proposed a framework for diagnose malfunctions quickly and take corrective actions. sensor data identification and verification. An analysis of a Thestructureofthispaperisasfollows.SectionIIpresents drone’sarchitectureandaforensicmodelwithgenericfeatures previous research relating to the drone log analysis and drone are proposed here in order to enhance the digital investigation forensics', '. system(UAS)forensics:Dataextraction&analysis,’’ForensicSci.Int., [28] S.ViswanathanandZ.Baig,‘‘Digitalforensicsfordrones:Astudyoftools Digit.Invest.,vol.41,Jun.2022,Art.no.301379. andtechniques,’’inApplicationsandTechniquesinInformationSecurity, [6] E. Mantas and C. Patsakis, ‘‘GRYPHON: Drone forensics in dataflash L.BatinaandG.Li,Eds.Singapore:Springer,2020,pp.29–41. andtelemetrylogs,’’inAdvancesinInformationandComputerSecurity, [29] M. Debinski, F. Breitinger, and P. Mohan, ‘‘Timeline2GUI: N', '. with limitations and threats to validity. As drone forensics Furtherfuturestudiesmayincludeexploringthepossibility is an emerging topic, there are very limited public datasets of doing high-level oversampling to introduce the models available. The log messages used in this study are mainly with more log message patterns, producing a dataset with acquired from DJI-made devices', '. Section III explains the proposed method, applying process. Also, Barton et al. [11] conducted the research to the Transformer technique to forensics of drone malfunctions. reconstruct the actions taken by these drones, identify their InSectionIV,thediscussionofperformancemethod,followed owners or operators, and extract data from associated mobile by conclusions and future works in Section V. devices. In other research in drone forensics, this paper also analyze II', '. theexperimentalresults,theTransformerobtainsthehighestF1 In the context of classifying drone malfunctions, the Transscore value of 93.04%. former model can be trained on a dataset of labeled drone Index Terms—drone forensics, forensic investigation, malfunctelemetry data to learn patterns and relationships between the tions, infrastructure, Transformer, Informer, FEDformer drone’s behavior and the root cause of a malfunction. The dataset can include features such as altitude, velocity, battery I']","Barton et al. conducted research to reconstruct drone actions and extract data from associated devices, which supports the analysis of flight logs and GPS records in drone forensics.","I. INTRODUCTION I. INTRODUCTION The use of drones has become increasingly common in various applications, including aerial photography, surveying, and monitoring. However, drones can also be involved in incidents such as accidents, violations, or even crimes, making it necessary to investigate drone logs as part of forensic investigations. In a forensic investigation, drone logs are essential sources of information that can help investigators reconstruct the events leading up to an incident. Drone logs typically include information such as flight paths, altitude, speed, battery life, sensor data, and other telemetry information . Important analysis of drone logs involves the identification of the most critical pieces of information in the log data and the analysis of how they relate to the incident",0.5,0.959426443566621
"and forensic framework development . The widely investigated source of evidence is sensor data, such as GPS , which provides a concise diagnosis of a flight to the investigator when performing anomaly detection . In fact, a flight log not only contains sensor data and component status, as illustrated in Fig 2, but also human- readable messages describing the occurring events during the operation of a drone. This file stores all information during a flight, such as flight timestamps, flight parameters, sensor data, components’ status, and flight mode. The last three columns contain human-readable messages: APP.message, APP.tip, and APP.warning, which is the source of the evidence used in this paper. Sample messages can be seen in Table 1. From the","['robust predictions, enabling drone operators to detect and Furthermore, Jain et al. [10] proposed a framework for diagnose malfunctions quickly and take corrective actions. sensor data identification and verification. An analysis of a Thestructureofthispaperisasfollows.SectionIIpresents drone’sarchitectureandaforensicmodelwithgenericfeatures previous research relating to the drone log analysis and drone are proposed here in order to enhance the digital investigation forensics', '. DigitalObjectIdentifier10.1109/ACCESS.2024.3396926 Severity-Oriented Multiclass Drone Flight Logs Anomaly Detection SWARDIANTARASILALAHI 1,(GraduateStudentMember,IEEE), TOHARIAHMAD 1,(Member,IEEE),HUDANSTUDIAWAN 1,(Member,IEEE), EIRINIANTHI 2,ANDLOWRIWILLIAMS 2 1DepartmentofInformatics,InstitutTeknologiSepuluhNopember,Surabaya60111,Indonesia 2SchoolofComputerScienceandInformatics,CardiffUniversity,CF244AGCardiff,U.K', '. Most drone incidents are caused analysis of drone logs can also provide evidence that can be by bird attacks, collide with other drones, and malfunctioning used in legal proceedings. This evidence can be particularly systems.Sometimesthedronemayhaveamalfunctioningsystem valuable in cases where there are disputes over liability, such caused by sensor failure, a broken motor, or CPU failure. This cancauseanaccident.Therefore,aforensicinvestigationsupports as in cases of property damage or personal injury', '. theexperimentalresults,theTransformerobtainsthehighestF1 In the context of classifying drone malfunctions, the Transscore value of 93.04%. former model can be trained on a dataset of labeled drone Index Terms—drone forensics, forensic investigation, malfunctelemetry data to learn patterns and relationships between the tions, infrastructure, Transformer, Informer, FEDformer drone’s behavior and the root cause of a malfunction. The dataset can include features such as altitude, velocity, battery I', 'S.Silalahietal.:Severity-OrientedMulticlassDroneFlightLogsAnomalyDetection the integrity of the log is guaranteed, log data is one of the artefacts with the highest priority for investigating various types of incidents, such as collision, crash landing, cyberattack,payloaddeliveryissue,andweather-relatedincidents [2].Itisexemplifiedbytheresearcheffortthathasbeenmade by the community on log-based anomaly detection using various approaches, including machine learning- [3], [4],']","An analysis of drone logs can provide evidence that is valuable in legal proceedings, particularly in cases of disputes over liability (Jain et al.).","the performance of the proposed framework has been discussed and analysed. In this section, challenges encountered during the study are disclosed, along with limitations and threats to validity. As drone forensics is an emerging topic, there are very limited public datasets available. The log messages used in this study are mainly acquired from DJI-made devices. There is yet to come a publicly available dataset of log messages from other drone manufacturers. Several publicly available datasets are mainly about sensor data and multimedia artefacts . While in this study, we solely depend on the human-readable messages generated by the drone during a flight. Given the condition where a small number of unique messages and most of them are acquired from DJI",0.75,0.9290167338576444
"LLMs to detect anomalous log entries in a point-based approach . However, existing studies only detect whether an event or subsequent event is an anomaly. In a forensic setting, analysing a large number of log entries resulting from binary anomaly detection is considered inefficient and labour-intensive as the detection is performed on the acquired evidence at one time . Therefore, too many detected anomalies need to be detailed into a more fine- grained detection to help the investigator better prioritise the analysis objective. As a result, this study extends the binary anomaly detection to multi-class anomaly detection, as exemplified by another domain application such as plane flight data , image data , and internet of vehicle . As a consequence,","['. Section VI discloses the challenges, limitations, and threats to the validity of the study. The conclusion and future works are elaboratedinSectionVII. II. RELATEDWORK This section discusses closely relevant prior studies on log-based anomaly detection and different approaches to FIGURE3. A2DvisualisationofthedatasetusingBERT[16]and handleclassimbalanceproblems. t-SNE[17].Itshowsthatthesamplesarenotlinearlyseparated;samples belongtodifferentclassesareclosetooneanother. A', 'S.Silalahietal.:Severity-OrientedMulticlassDroneFlightLogsAnomalyDetection the integrity of the log is guaranteed, log data is one of the artefacts with the highest priority for investigating various types of incidents, such as collision, crash landing, cyberattack,payloaddeliveryissue,andweather-relatedincidents [2].Itisexemplifiedbytheresearcheffortthathasbeenmade by the community on log-based anomaly detection using various approaches, including machine learning- [3], [4],', '. The proposed representation of the label improves the prediction confidence score on variousencodertypeswith8.6%and1.8%fromfocalandcross-entropyscenariosonaverage,respectively. INDEX TERMS Anomaly detection, digital forensics, drone forensics, multitask learning, transformer encoder,informationsecurity. I', '. DigitalObjectIdentifier10.1109/ACCESS.2024.3396926 Severity-Oriented Multiclass Drone Flight Logs Anomaly Detection SWARDIANTARASILALAHI 1,(GraduateStudentMember,IEEE), TOHARIAHMAD 1,(Member,IEEE),HUDANSTUDIAWAN 1,(Member,IEEE), EIRINIANTHI 2,ANDLOWRIWILLIAMS 2 1DepartmentofInformatics,InstitutTeknologiSepuluhNopember,Surabaya60111,Indonesia 2SchoolofComputerScienceandInformatics,CardiffUniversity,CF244AGCardiff,U.K', '. However, drones can also be involved in the model is trained on labeled data to predict the type of incidentssuchasaccidents,violations,orevencrimes,making malfunctiongivenasetoftelemetrydata.Theoutputcanbea it necessary to investigate drone logs as part of forensic binaryclassification(e.g.,malfunctionvs.nomalfunction)ora investigations. multi-classclassification(e.g.,batterymalfunction,propulsion In a forensic investigation, drone logs are essential sources malfunction, etc.)']","Log data is prioritized in forensic investigations for various incidents, including collisions and cyberattacks, highlighting the importance of detailed anomaly detection (Silahietal., 2024).","particular system log may need different techniques from one type to another. Generally, log-based anomaly detection can be performed using either point, collective, or contextual approaches. In the log-based anomaly detection literature, most of the existing studies propose either a contextual or collective approach, where the decision is taken by examining a sequence of log events. However, detecting abnormalities in log data can be performed using a point-based approach, where one single log record is the only feature needed. Therefore, several studies explored utilising a point-based approach to detect anomalous events on logs data, such as in operating systems , , drone devices , and distribution systems , . In the drone context, a log message contains a description of",0.75,0.9525359279141655
"Existing anomaly detection modelling techniques can be conducted either in a point, contextual, or collective setting. Point anomaly detection characterises each log entry, whether an event is an abnormality or a normal event. For instance, if a user types the wrong password when trying to gain access to an operating system prompt, the generated log message can be considered as an anomaly , , . As for contextual anomaly, the detection involves analysing some contextually related attributes to determine whether a log entry is an anomaly. As an example, the flight path taken by a drone during a flight is recorded in longitude and latitude coordinates. These data can be used to detect an anomaly by finding a peculiar value","['. van der Maaten and G. Hinton, ‘‘Visualizing data using t-SNE,’’ ‘‘Insider threat detection model using anomaly-based isolation forest J.Mach.Learn.Res.,vol.9,pp.2579–2605,Nov.2008. algorithm,’’IEEEAccess,vol.11,pp.118170–118185,2023. [18] S. Silalahi, T. Ahmad, and H. Studiawan, ‘‘Drone flight log anomaly [39] P.Chand,M.Moh,andT.-S.Moh,‘‘Anapproachtoimprovinganomaly severityclassificationviasentenceembedding,’’inProc.Int.Conf.Artif. detectionusingmultipledetectors,’’inProc.16thInt.Conf.UbiquitousInf', 'S.Silalahietal.:Severity-OrientedMulticlassDroneFlightLogsAnomalyDetection the integrity of the log is guaranteed, log data is one of the artefacts with the highest priority for investigating various types of incidents, such as collision, crash landing, cyberattack,payloaddeliveryissue,andweather-relatedincidents [2].Itisexemplifiedbytheresearcheffortthathasbeenmade by the community on log-based anomaly detection using various approaches, including machine learning- [3], [4],', '. DigitalObjectIdentifier10.1109/ACCESS.2024.3396926 Severity-Oriented Multiclass Drone Flight Logs Anomaly Detection SWARDIANTARASILALAHI 1,(GraduateStudentMember,IEEE), TOHARIAHMAD 1,(Member,IEEE),HUDANSTUDIAWAN 1,(Member,IEEE), EIRINIANTHI 2,ANDLOWRIWILLIAMS 2 1DepartmentofInformatics,InstitutTeknologiSepuluhNopember,Surabaya60111,Indonesia 2SchoolofComputerScienceandInformatics,CardiffUniversity,CF244AGCardiff,U.K', '. Section VI discloses the challenges, limitations, and threats to the validity of the study. The conclusion and future works are elaboratedinSectionVII. II. RELATEDWORK This section discusses closely relevant prior studies on log-based anomaly detection and different approaches to FIGURE3. A2DvisualisationofthedatasetusingBERT[16]and handleclassimbalanceproblems. t-SNE[17].Itshowsthatthesamplesarenotlinearlyseparated;samples belongtodifferentclassesareclosetooneanother. A', '. 2. It makes it challenging to existing studies propose either a contextual or collective build a point anomaly detection model that depends only approach, where the decision is taken by examining a on the semantics of the log message. Fig']","Log data is critical for investigating various incidents, including collisions and cyberattacks, highlighting the importance of anomaly detection in log entries (Silalahi et al., 2023).","particular system log may need different techniques from one type to another. Generally, log-based anomaly detection can be performed using either point, collective, or contextual approaches. In the log-based anomaly detection literature, most of the existing studies propose either a contextual or collective approach, where the decision is taken by examining a sequence of log events. However, detecting abnormalities in log data can be performed using a point-based approach, where one single log record is the only feature needed. Therefore, several studies explored utilising a point-based approach to detect anomalous events on logs data, such as in operating systems , , drone devices , and distribution systems , . In the drone context, a log message contains a description of",0.6666666666666666,0.9161777165634889
"a log entry is an anomaly. As an example, the flight path taken by a drone during a flight is recorded in longitude and latitude coordinates. These data can be used to detect an anomaly by finding a peculiar value within the log records by contrasting the normal values to abnormal values using a certain threshold . Unique to the previous two approaches, collective anomaly establishes anomaly criteria based on a set of instances associated with each other, distinct from the overall data. Statistical anomaly detection is one of the common cases for this type of anomaly detection. Another case scenario in log-based anomaly detection is a sequence-based approach, where an abnormality is determined by analysing a group of events","['. DigitalObjectIdentifier10.1109/ACCESS.2024.3396926 Severity-Oriented Multiclass Drone Flight Logs Anomaly Detection SWARDIANTARASILALAHI 1,(GraduateStudentMember,IEEE), TOHARIAHMAD 1,(Member,IEEE),HUDANSTUDIAWAN 1,(Member,IEEE), EIRINIANTHI 2,ANDLOWRIWILLIAMS 2 1DepartmentofInformatics,InstitutTeknologiSepuluhNopember,Surabaya60111,Indonesia 2SchoolofComputerScienceandInformatics,CardiffUniversity,CF244AGCardiff,U.K', '. The main ananomaly,aninvestigatorcanadjusttheanalysisobjectives contributionsofthispaperaresummarisedasfollows: targeting a certain level only, depending on the needs and cases. 1) Propose Drone Log Severity (DroLoVe), a severityAs shown in Fig. 1, the drone experiences several events oriented multiclass anomaly detection approach on during a flight. When analysing the flight logs from a droneflightlogdata', '. CONCLUSIONANDFUTUREWORK ofFP(1),FN(1),andFN(2). In this paper, we demonstrate how to train a log-based Other than analysing the misclassified samples, we also anomaly detection model that can prioritise the prediction analyse the learned representation of the dataset by each of of higher severity anomalies on drone flight logs while the best-performing models. The filtered dataset is used to increasing the prediction confidence score at the same investigatethelearnedrepresentationplottedinto2Dgraphs, time', 'robust predictions, enabling drone operators to detect and Furthermore, Jain et al. [10] proposed a framework for diagnose malfunctions quickly and take corrective actions. sensor data identification and verification. An analysis of a Thestructureofthispaperisasfollows.SectionIIpresents drone’sarchitectureandaforensicmodelwithgenericfeatures previous research relating to the drone log analysis and drone are proposed here in order to enhance the digital investigation forensics', '. In this work, the distinctive feature events from all aspects of the drone, including sensors, lies within the employment of a sequence classification componentsandfeatures[2]. model with a multitask label to train a detection model for Typically, existing log-based anomaly detection studbetter performance. An extensive experiment is conducted ies classify log events into two categories: normal and on several different encoders commonly used in log-based anomaly [3]']","The proposed model prioritizes the detection of higher severity anomalies in drone flight logs, enhancing prediction confidence (SWARDIANTARASILALAHI et al., 2024).","particular system log may need different techniques from one type to another. Generally, log-based anomaly detection can be performed using either point, collective, or contextual approaches. In the log-based anomaly detection literature, most of the existing studies propose either a contextual or collective approach, where the decision is taken by examining a sequence of log events. However, detecting abnormalities in log data can be performed using a point-based approach, where one single log record is the only feature needed. Therefore, several studies explored utilising a point-based approach to detect anomalous events on logs data, such as in operating systems , , drone devices , and distribution systems , . In the drone context, a log message contains a description of",1.0,0.9125631829723312
"severity level can provide better detection results for the investigator to pinpoint the event of interest. Interpretability makes training and testing more transparent, the model trustworthy, and human-friendly. 2) We propose DroneSBERT,1 a domain-specific embed- ding to extract semantic features that are well-aligned to the human perception of the log message samples. Supervised contrastive learning is employed to learn distinct representations for each anomaly severity level. 3) We explore two target label representations to augment a multitask learning paradigm for training multiclass classification models. Aligning to the dataset character- istics where the log messages from different anomaly severity levels share common words and phrases, multitask learning can help the model make use of the shared low-level features in the log","['. Thus, analysing the detection works. result in a binary setting is impractical for the investigator. This paper proposes a transformer encoder-based logMoreover, out of all detected peculiarities, there might be based anomaly detection optimised using multitask label severalnegligibleoneswithlesssevereimpactsonthesystem representation to help the model learn from the overlapped orlesslikelytoberelatedtoanincident.Extendingbinaryto featuressharedbythesamplesfromdifferentseveritylevels', '. OVERVIEW networktoobtainthereconstructionlossanddiscrimination Performing point log-based anomaly detection that takes loss as the features for an n-stacked ensemble classifier to human-readablelogmessagesasinputissimilartoconductperform anomaly detection., which resulted in an increase ingsequenceortextclassification.AsmentionedinSectionI, in recall', '. Even though all scenarios result in a well- approach is better than the previous work baselines while separated representation, none of the scenarios reflects the beinginferiortoourbaselinescenariobasedontheaccuracy ordinalnatureofthelabel.OnewouldexpecttheHighclassto and F1 scores. From the anomaly detection perspective, befarfromtheLowclass,representingthedistancebetween the proposed method achieves higher prediction confidence theseverityoftheanomalies', '. of anomalous samples is significantly less than the normal Topreventparsingerrorsfrombeingpropagatedtothenext ones. Employing a supervised-based technique is prone to detection phase, utilising a contextual embedding, such as bias,asthemodeltendstolearnfromthemajoritysamples. BERT, to extract the semantic features of logs data without To overcome CIP, several studies proposed data-level and performingparsingcanbeasolution[21].Therefore,allthe algorithm-level solutions [30]', '. Section VI discloses the challenges, limitations, and threats to the validity of the study. The conclusion and future works are elaboratedinSectionVII. II. RELATEDWORK This section discusses closely relevant prior studies on log-based anomaly detection and different approaches to FIGURE3. A2DvisualisationofthedatasetusingBERT[16]and handleclassimbalanceproblems. t-SNE[17].Itshowsthatthesamplesarenotlinearlyseparated;samples belongtodifferentclassesareclosetooneanother. A']",The proposed method extends binary to multiclass representation to assist the model in learning from the overlapping features shared by samples from different severity levels.,"the model can be convincing and accountable enough to the investigator to be included in the investigation report. VII. CONCLUSION AND FUTURE WORK VII. CONCLUSION AND FUTURE WORK In this paper, we demonstrate how to train a log-based anomaly detection model that can prioritise the prediction of higher severity anomalies on drone flight logs while increasing the prediction confidence score at the same time. Considering the nature of the dataset, where samples that belong to different severity levels share common features, a multitask vector label representation along with severity-oriented decoding is proposed. An extensive experiment proved that the proposed approach is better than the previous work baselines while being inferior to our baseline scenario based on the accuracy and F1",0.6666666666666666,0.8932001442601588
"detection on the test data, which is then analysed further. In this paper, M = (cid:2)m1, m2, . . . , m|M| (cid:3) is defined as the collection of log messages in the dataset. Given a log record m = [w1, w2, . . . , wn] containing n number of words as input, with m ∈ M, BERTbase is used to tokenize and obtain the input vector representation. In the implementation, computation is undertaken using matrix multiplication. Thus, a term maximum sequence length, m, is introduced to pack the input messages that vary in length into a matrix with a consistent size throughout all the samples in the dataset. Therefore, for each single input message, the input matrix becomes","['type are presented in the from a total of 1850 log messages', '. Since part of the log record contains detection include the unstructured nature of log messages, a human-readable message, the transformer model can be each system having its own log characteristics, being less utilised to extract the semantic information between the human-readable, and containing many special or technical words and parameters within a log record to perform point terms [22], [23]', '. oflogparsinginloganalysisandanomalydetectionhasbeen critical to perform both online and offline detection [27]. B. CLASSIMBALANCEPROBLEM(CIP)INLOG-BASED Performing log parsing aims to extract the core features of ANOMALYDETECTION logs and reduce the noise. However, employing parsing can Itisassuredthatinlog-basedanomalydetection,thenumber remove valuable information within the log messages [25]', '. Section VI discloses the challenges, limitations, and threats to the validity of the study. The conclusion and future works are elaboratedinSectionVII. II. RELATEDWORK This section discusses closely relevant prior studies on log-based anomaly detection and different approaches to FIGURE3. A2DvisualisationofthedatasetusingBERT[16]and handleclassimbalanceproblems. t-SNE[17].Itshowsthatthesamplesarenotlinearlyseparated;samples belongtodifferentclassesareclosetooneanother. A', '. handle various data formats in dynamic, high-volume, and xednI 979-8-3315-2035-9/24/$31.00 ©2024 IEEE 216 16838801.4202.88736FBIS/9011.01 :IOD | EEEI 4202© 00.13$/42/9-5302-5133-8-979 | )FBIS( ecnaniF dna ssenisuB cimalsI elbaniatsuS no ecnerefnoC lanoitanretnI 4202 Authorized licensed use limited to: Institut Teknologi Sepuluh Nopember. Downloaded on July 14,2025 at 08:22:54 UTC from IEEE Xplore. Restrictions apply.']","The transformer model can be utilized to extract semantic information from the unstructured nature of log messages, which often contain technical words and parameters (Severity-Oriented Multiclass Drone Flight Logs Anomaly Detection).","log message m = [w1, w2, . . . , wn] from the dataset D = {(mi, ci)}|D| i=1 as the input, where c is the label class name, BERT is used to tokenise the input into a fixed length sequence with m maximum length and retrieve the contextual embeddings, resulting in an input matrix X ∈ Rm×dBERT which is then paired with the encoded label y. Thus, the numerical input becomes (X, y). This study aims to train a neural network model Mθ to classify the message m into one of the predefined classes c ∈ C = {high, medium, low, normal}, or can be written as Mθ : m → c. Based on past literature discussed in Section",0.6666666666666666,0.9069462421554552
"final unnormalized logits vector using the following equation: α = zW⊤ + b, ∈ R|C| (3) where W ∈ R|C|×768, and b ∈ R|C| are the typical trainable weight and bias parameters in a linear layer. Knowing that the number of classes is more than two, the task belongs to multiclass classification. Typically, the target label is represented in a one-hot encoded vector, as depicted in Fig. 8a. Therefore, the training objective is to minimise the cross-entropy loss, which is computed using the following equation: LCE(y, ˆy) = − |C| yi · log(ˆyi) i=1 ˆy = softmax(α) (4) (5) where y and ˆy are the truth and the predicted label probability distribution respectively. The normalized logits in Eq. 5 is","['. cross-entropy loss as defined in Eq 1 where weighting the The next step after performing pooling is to feed the persamplelossiswrittenasthefollowingEq4: ¯ vectorhtothelinearlayer,yieldingtheunnormalisedlogits z ∈ R|C|, where |C| denotes the number of target class in LCE∗ =− X |C| α ·y ·log(yˆ ) (4) thedataset.Duringthetrainingphase,thesevectorsareused i i i to compute the loss and update the parameter of the model i=1 afterpassingthroughanormalisationfunction.Forthetypical where α denotes the weight for', '. Another i one-hot encoding representation of the label, the standard way of performing weighting to loss function is to penalise cross-entropy is used to compute the loss, as defined in the the prediction with a low confidence score, called Focal followingequation: loss [42]. This is achieved by transforming the ratio of the loss value between high-confidence and low-confidence |C| LCE =− X y ·log(yˆ ) (1) prediction probabilities', '. After training the model, testing will be carried out on the best model for each architecture. The best model is selected based on the lowest loss validation for each fold. The lowest validation loss in the U-Net architecture is located on the 3rd fold with a value of 0.0132, while the Link-Net architecture is located on the 5th fold with a value of 0.0148. The best model on each architecture will then be tested on 237 test data', '. probabilities between 0 and 1. During training, we applied the Specifically, the distillation loss function was designed to binary cross-entropy loss across all labels to supervise minimize the discrepancy between the feature representations abnormality detection of the student and the teacher models', '. In contrast, the The combination of CNN and LSTM or BiLSTM can neurons in the output layer utilize the Sigmoid activation improve performance in making predictions and processing functionforbinary-classclassificationandtheSoftmaxactihigh-dimensionaldata[49].Thisissupportedbyaconvoluvationfunctionformulti-classclassification.Utilizingmultition layer as feature extraction and a hidden layer that can plelayersinaneuralnetworkisadvantageousforgeneralizarememberinformationdataandoptimizevaluabledata[44]']","The cross-entropy loss is computed using the unnormalized logits vector, which is derived from the linear layer's output (Severity-Oriented Multiclass Drone Flight Logs Anomaly Detection).","logits z ∈ R|C|, where |C| denotes the number of target class in the dataset. During the training phase, these vectors are used to compute the loss and update the parameter of the model after passing through a normalisation function. For the typical one-hot encoding representation of the label, the standard cross-entropy is used to compute the loss, as defined in the following equation: |C| LCE = − yi · log(ˆyi) i=1 ˆy = softmax(z) exp(zi) ˆyi = Pdim(z) exp(zj) (1) (2) (3) where y and ˆy are the true label vector and the prediction probability distribution, respectively. The prediction proba- bility ˆy is obtained from Eq 2, where each of the element in ˆy is computed using Eq 3.",0.3333333333333333,0.9356798617797314
"we further analyse the effect of increasing the prediction threshold upon inferring the label. As the threshold value is closer to 1, a notable decrease can be seen in Fig. 13b, starting from 0.94. Conversely, the unfiltered dataset in Fig 13a shows a negligible decrease. C. ERROR ANALYSIS C. ERROR ANALYSIS This section discusses the confusion matrix, learned rep- resentation, and the interpretability of the best-performing model on the filtered dataset. The confusion matrix in this paper is redefined to align with the anomaly severity context, where the distance between true and predicted labels matters. If the predicted label is lower than the true label, we define it False Positive (FP). Conversely, if the true label is lower than the","['. Section VI discloses the challenges, limitations, and threats to the validity of the study. The conclusion and future works are elaboratedinSectionVII. II. RELATEDWORK This section discusses closely relevant prior studies on log-based anomaly detection and different approaches to FIGURE3. A2DvisualisationofthedatasetusingBERT[16]and handleclassimbalanceproblems. t-SNE[17].Itshowsthatthesamplesarenotlinearlyseparated;samples belongtodifferentclassesareclosetooneanother. A', '. performance evaluation score, where the highest accuracy Following the definition in the previous paragraph, we plot is under 85%, the model needs further improvement so that the frequency of each misclassification type in Fig 13 and thedetectionvaliditycanbeenhancedandthatthedetection Fig 14', '. The remainder of the paper is structured as follows: Section II discusses relevant previous studies related to log-based anomaly detection and how to deal with class imbalanceproblemsinlog-basedanomalydetectiontask,the proposed framework is explained in detail in Section III, Section IV provides the experimental setup, followed by SectionVwheretheexperimentalresultsalongwithcomprehensive analyses and discussions are presented', '. Thus, analysing the detection works. result in a binary setting is impractical for the investigator. This paper proposes a transformer encoder-based logMoreover, out of all detected peculiarities, there might be based anomaly detection optimised using multitask label severalnegligibleoneswithlesssevereimpactsonthesystem representation to help the model learn from the overlapped orlesslikelytoberelatedtoanincident.Extendingbinaryto featuressharedbythesamplesfromdifferentseveritylevels', '. Even though all scenarios result in a well- approach is better than the previous work baselines while separated representation, none of the scenarios reflects the beinginferiortoourbaselinescenariobasedontheaccuracy ordinalnatureofthelabel.OnewouldexpecttheHighclassto and F1 scores. From the anomaly detection perspective, befarfromtheLowclass,representingthedistancebetween the proposed method achieves higher prediction confidence theseverityoftheanomalies']","The model requires further enhancement to improve the frequency of misclassification types, as illustrated in Fig. 13 (Severity-Oriented Multiclass Drone Flight Logs Anomaly Detection).","each scenario. FIGURE 14. The number of misclassified samples from the best-performing model on each loss function tested on the unfiltered dataset. In a binary setting, let the Normal class be positive and the Anomaly is negative. Then, False Positive (FP) refers to samples with a true label negative but predicted as positive. At the same time, a False Negative (FN) is a case when a sample belongs to a positive class but is predicted as negative. However, in this study, we define the misclassification cases differently: • False Positive refers to a case when the true class is higher than the predicted class. • False Negative is a misclassification case where the true class is lower than the predicted",0.5,0.9056548278625755
"align with the anomaly severity context, where the distance between true and predicted labels matters. If the predicted label is lower than the true label, we define it False Positive (FP). Conversely, if the true label is lower than the predicted label, we define it False Negative (FN). In this context, having less FP is more important than having less FN, as the task objective is anomaly severity detection, where we aim to detect all abnormalities along with the severity level. Therefore, undetected abnormalities, or detecting higher severity as lower ones, indicate that the model fails to meet the task’s objectives. Fig 14 shows the comparison of the confusion matrix between experimented scenarios and a baseline from previous work .","['. Section VI discloses the challenges, limitations, and threats to the validity of the study. The conclusion and future works are elaboratedinSectionVII. II. RELATEDWORK This section discusses closely relevant prior studies on log-based anomaly detection and different approaches to FIGURE3. A2DvisualisationofthedatasetusingBERT[16]and handleclassimbalanceproblems. t-SNE[17].Itshowsthatthesamplesarenotlinearlyseparated;samples belongtodifferentclassesareclosetooneanother. A', 'S.Silalahietal.:Severity-OrientedMulticlassDroneFlightLogsAnomalyDetection TABLE1. Summaryofrelatedworksinlog-basedanomalydetection. to perform anomaly detection [9]. In a point setting, the and relationship between the occurrences of the log events. detection is performed against individual log records. The For instance, an LSTM [22] and GRU [9] model is used modeldependssolelyonthefeaturesfromasinglelogentry. to capture the contextual features of the log sequence', '. The remainder of the paper is structured as follows: Section II discusses relevant previous studies related to log-based anomaly detection and how to deal with class imbalanceproblemsinlog-basedanomalydetectiontask,the proposed framework is explained in detail in Section III, Section IV provides the experimental setup, followed by SectionVwheretheexperimentalresultsalongwithcomprehensive analyses and discussions are presented', '. For Log-based anomaly detection has been applied widely instance,generatingmoresamplesofminorityclassesusing to various systems, such as operating systems [9], [10], the Synthetic Minority Oversampling Technique (SMOTE) parallel file systems [26], drones [11], [18], [20], internet canimprovethedetectionperformanceofadeepQnetwork of things [28], and industrial control systems [29]. Among (DQN)-based [33] and deep neural network (DNN)-based these studies, a sequence-based approach is the common [34] models', '. Even though all scenarios result in a well- approach is better than the previous work baselines while separated representation, none of the scenarios reflects the beinginferiortoourbaselinescenariobasedontheaccuracy ordinalnatureofthelabel.OnewouldexpecttheHighclassto and F1 scores. From the anomaly detection perspective, befarfromtheLowclass,representingthedistancebetween the proposed method achieves higher prediction confidence theseverityoftheanomalies']","The proposed method demonstrates improved prediction confidence regarding the severity of anomalies, aligning with the importance of accurately detecting abnormalities in anomaly severity detection.","study, we define the misclassification cases differently: • False Positive refers to a case when the true class is higher than the predicted class. • False Negative is a misclassification case where the true class is lower than the predicted class. Table 7 shows the position of FP and FN based on the above definition in a multiclass confusion matrix. VOLUME 12, 2024 64263 S. Silalahi et al.: Severity-Oriented Multiclass Drone Flight Logs Anomaly Detection FIGURE 15. A 2D visualisation of the filtered dataset representation obtained from the best model from each loss function tested on the filtered dataset. t-SNE is used to reduce the dimension of the embeddings. In an anomaly detection setting, FP is more important than FN",0.5,0.9514486600628099
"model plays a significant role in performing the task is crucial to developing a high-performing model. To this end, in this paper, an ablation study is performed. First, we investigate the effect of employing multitask learning on the model’s performance. Secondly, we investigate the effect of using all zeroes for the Normal class label’s representation. Thirdly, the importance of the [CLS] token’s embedding vector and the BERT’s parameters are investigated. Lastly, we com- prehensively study the effect of the proposed DroneSBERT embedding on the model’s performance, interpretability, and learned representations. Overall, the multitask label can improve the detection performance, where the best-performing models on both datasets are achieved by the proposed Multitas-111 label. Using all zeroes to represent the Normal","['. Contrary to the other three baselines, this hotencodingwithfocalloss.Theproposedscenarioemploys study performed the detection on the sequence of log multitaskencodingwithlogloss.Usingthesethreescenarios, recordsinsteadofpoint-based. asignificantnumberofmodelsusingthefollowingencoders BERT has been demonstrated to be a better embedding aretrained: compared to GloVe [50], as BERT produces a contextual 1) None refers to fine-tuning BERT [16] on the dataset', '. This simplicity often leads 7% gap between its highest and lowest per-class accuracies to more straightforward model architectures and training (seeFigure6B). processes [42]. However, in RTE tasks where the problem The use of GloVe and FastText, despite being non- domainisinherentlymulti-labelandhighlycomplex,multicontextual embeddings, proved to be more compatible label classification provides more accurate and realistic and efficient for our proposed Biplet-based architecture. problemmodeling', '. probabilities between 0 and 1. During training, we applied the Specifically, the distillation loss function was designed to binary cross-entropy loss across all labels to supervise minimize the discrepancy between the feature representations abnormality detection of the student and the teacher models', '. TP pre = (22) TP+FP + ε tagging procedure. The model with the best performance is TP rec = (23) highlighted a bold font. The presented scores in the tables TP+FN + ε containboth proposedandbaselinemodels', "". These improvements contributed to more reliable future iterations. multi-label classification and detailed report generation. Although the ViT-GPT-2-based architecture offers strong The framework's multi-label classification approach performance, its computational cost may limit deployment in leverages transfer learning and knowledge distillation to resource-constrained environments""]","The proposed scenario employs multitask encoding with log loss, demonstrating that BERT is a superior embedding compared to GloVe (Severity-Oriented Multiclass Drone Flight Logs Anomaly Detection).","proposed scenario can improve the detection performance of the model. D. ABLATION STUDY D. ABLATION STUDY Following the rapid advancement in neural network research, more complex and sophisticated architectures are emerging. A model can consist of layers of components that have a specific role in the learning process. After conducting an experiment on a certain dataset and task, verifying and checking which component in the model contributes posi- tively to the performance is crucial. Therefore, we perform an ablation study to explain which part of the proposed approach has a significant impact on the performance. Note that only the best-performing scenario on each dataset is explored. First, we investigate the significance of the CLS token from the BERT embedding. Secondly,",0.6666666666666666,0.8362270111249308
"DroneSBERT embedding on the model’s performance, interpretability, and learned representations. Overall, the multitask label can improve the detection performance, where the best-performing models on both datasets are achieved by the proposed Multitas-111 label. Using all zeroes to represent the Normal class helps the model distinguish the normal and abnormal samples, improves the model’s performance (see Table 9), reduces the false positive (see Fig. 14), and learns better representation (see Fig. 15). As shown in Table 9, excluding the [CLS] token’s vector and freezing BERT’s parameter during training deteriorate the model’s performance. Therefore, including [CLS] token’s feature and tuning BERT’s parameter have a positive impact on the model’s performance. Based on these findings, embedding plays a significant role in performing the","['. In this work, the distinctive feature events from all aspects of the drone, including sensors, lies within the employment of a sequence classification componentsandfeatures[2]. model with a multitask label to train a detection model for Typically, existing log-based anomaly detection studbetter performance. An extensive experiment is conducted ies classify log events into two categories: normal and on several different encoders commonly used in log-based anomaly [3]', '. However, drones can also be involved in the model is trained on labeled data to predict the type of incidentssuchasaccidents,violations,orevencrimes,making malfunctiongivenasetoftelemetrydata.Theoutputcanbea it necessary to investigate drone logs as part of forensic binaryclassification(e.g.,malfunctionvs.nomalfunction)ora investigations. multi-classclassification(e.g.,batterymalfunction,propulsion In a forensic investigation, drone logs are essential sources malfunction, etc.)', '. Contrary to the other three baselines, this hotencodingwithfocalloss.Theproposedscenarioemploys study performed the detection on the sequence of log multitaskencodingwithlogloss.Usingthesethreescenarios, recordsinsteadofpoint-based. asignificantnumberofmodelsusingthefollowingencoders BERT has been demonstrated to be a better embedding aretrained: compared to GloVe [50], as BERT produces a contextual 1) None refers to fine-tuning BERT [16] on the dataset', '. 11. that every model has its own features and functionalities, Three char-level embeddings, such as LSTM, CNN, and which vary among them, then the generated log messages AdaTrans,werecombinedwithtwoword-levelembeddings, will be different as well. However, since all the drones are GloVe and BERT, to provide input for the encoder layer', '. available.Weonlyfoundonedroneimagedataset,theVTO The scaled Transformer model achieved the best perfor- Labs Drone Forensic dataset. Even from 15 different modmance, with a 91.348% F1 score. This scenario consists of els and more than 20 datasets, we only discover less than CNN char embedding, BERT word embedding, scaled dot- 2000 log messages']","The proposed scenario employs multitask encoding with log loss, demonstrating that BERT is a superior embedding compared to GloVe, which supports the findings on model performance improvements through effective embedding techniques.","to explain which part of the proposed approach has a significant impact on the performance. Note that only the best-performing scenario on each dataset is explored. First, we investigate the significance of the CLS token from the BERT embedding. Secondly, we analyse the impact of freezing the BERT’s parameter during training. Thirdly, we vary the batch size during the training. Finally, FIGURE 11. Analysis of the effect of different batch sizes on the evaluation scores of the best-performing models. we examine the effect of increasing the prediction threshold used in our proposed approach on the accuracy and F1 scores. As shown in Table 6, excluding the CLS token embedding before feeding the input matrix to the encoder significantly decreases performance.",0.3333333333333333,0.8391085185914102
"on critical findings. The proposed embedding, DroneSBERT, improved the trustworthiness of the model, as evidenced by the word’s importance report. Despite the promising results, the model’s generality remains untested as the training dataset contains only log messages acquired from 82 drone models, mostly from DJI. This is one of the main challenges in drone forensics research, where human-readable flight log datasets from other drone models are unavailable. In the future, we plan to explore the flight logs of other drone models to train more general anomaly detection models. As for the method, multi- objective learning that employs multiple loss functions to train an anomaly detection model will be explored. DATA AVAILABILITY The dataset used in the experiment is available upon","['. available.Weonlyfoundonedroneimagedataset,theVTO The scaled Transformer model achieved the best perfor- Labs Drone Forensic dataset. Even from 15 different modmance, with a 91.348% F1 score. This scenario consists of els and more than 20 datasets, we only discover less than CNN char embedding, BERT word embedding, scaled dot- 2000 log messages', '. The proposed representation of the label improves the prediction confidence score on variousencodertypeswith8.6%and1.8%fromfocalandcross-entropyscenariosonaverage,respectively. INDEX TERMS Anomaly detection, digital forensics, drone forensics, multitask learning, transformer encoder,informationsecurity. I', '. with limitations and threats to validity. As drone forensics Furtherfuturestudiesmayincludeexploringthepossibility is an emerging topic, there are very limited public datasets of doing high-level oversampling to introduce the models available. The log messages used in this study are mainly with more log message patterns, producing a dataset with acquired from DJI-made devices', '. theexperimentalresults,theTransformerobtainsthehighestF1 In the context of classifying drone malfunctions, the Transscore value of 93.04%. former model can be trained on a dataset of labeled drone Index Terms—drone forensics, forensic investigation, malfunctelemetry data to learn patterns and relationships between the tions, infrastructure, Transformer, Informer, FEDformer drone’s behavior and the root cause of a malfunction. The dataset can include features such as altitude, velocity, battery I', '. However, drones can also be involved in the model is trained on labeled data to predict the type of incidentssuchasaccidents,violations,orevencrimes,making malfunctiongivenasetoftelemetrydata.Theoutputcanbea it necessary to investigate drone logs as part of forensic binaryclassification(e.g.,malfunctionvs.nomalfunction)ora investigations. multi-classclassification(e.g.,batterymalfunction,propulsion In a forensic investigation, drone logs are essential sources malfunction, etc.)']","The log messages utilized in the study primarily originate from DJI-made devices, highlighting the limited availability of diverse datasets in drone forensics research.","the performance of the proposed framework has been discussed and analysed. In this section, challenges encountered during the study are disclosed, along with limitations and threats to validity. As drone forensics is an emerging topic, there are very limited public datasets available. The log messages used in this study are mainly acquired from DJI-made devices. There is yet to come a publicly available dataset of log messages from other drone manufacturers. Several publicly available datasets are mainly about sensor data and multimedia artefacts . While in this study, we solely depend on the human-readable messages generated by the drone during a flight. Given the condition where a small number of unique messages and most of them are acquired from DJI",0.5,0.8642106584658487
"biomedical engineering, macro-scale radars on radio- astronomy, and so on , . However, in PA radars the number of detected targets is limited by the angular and range resolution. More recently, the multi-input multi-output (MIMO) radar has become an interesting research sub- ject –. Unlike the PA radar, the MIMO radar utilizes many antennas that transmit orthogonal signals to obtain the signal reﬂected from the target at the receiver, a scheme known as waveform diversity . Consequently, MIMO radars have been successfully applied for radar imaging, 11248 This work is licensed under a Creative Commons Attribution 4.0 License. For more information, see VOLUME 8, 2020 S. Tahcfulloh, G. Hendrantoro: FPMIMO: General MIMO Structure With Overlapping Subarrays for Various Radar Applications","['. ified delay between successive antennas of a MIMO radar, Multiple simultaneous beams can be generated by employ- intended to produce correlated waveforms with the purpose ing a number of transceivers operating individually, each of acquiring better control over the beampattern. CC have attached to an antenna with a beam pointing at a specified been proposed for application in MIMO radars, originally direction, in total covering a specified angular range', '. SNR for target [11] G. Krieger, ‘‘MIMO-SAR: Opportunities and pitfalls,’’ IEEE Trans. range detection can be optimized by varying the number of Geosci. Remote Sens., vol. 52, no. 5, pp.2628–2645, May 2014, doi: orthogonalsymbolsperframe. 10.1109/TGRS.2013.2263934. Sincemostprocessesmainlydependonthearrangementof [12] D.-S.JangandH.-L.Choi,‘‘Interleavedradarpulseschedulingformultitargettrackingwithmultiplesimultaneousreceivebeams,’’IEEETrans. thetransmittedwaveformsandtheprocessingofthereceived Aerosp', '. 10.1109/RADAR.2015.7131047. [23] L.Kocjancic,A.Balleri,andT.Merlet,‘‘Multibeamradarbasedonlinear frequency modulated waveform diversity,’’ IET Radar, Sonar Navigat., vol.12,no.11,pp.1320–1329,Nov.2018,doi:10.1049/iet-rsn.2018.5029. [24] W.-Q.Wang,‘‘Frequencydiversearrayantenna:Newopportunities,’’IEEE Antennas Propag. Mag., vol. 57, no. 2, pp.145–152, Apr. 2015, doi: DEVY KUSWIDIASTUTI (Student Member, 10.1109/MAP.2015.2414692. IEEE) was born in Indonesia, in September [25] Y. Xu and K.-M', '. Hassanien and S. A. Vorobyov, ‘‘Phased-MIMO radar: A tradeoff theAcademicianoftheRussianAcademyofTransport.HeisalsoaFounding betweenphased-arrayandMIMOradars,’’IEEETrans.SignalProcess., vol.58,no.6,pp.3137–3151,Jun.2010,doi:10.1109/TSP.2010.2043976', '. Firstly, thearrayintopartiallyorfullyoverlappingsubarrayscoupled atrainofOFDMpulsesaretransmittedonanarrayoftransmit with the use of orthogonal waveforms, each associated to a antennasbymeansoftheCCconcept,i.e.,byapplyingsome generatedbeam,asolutionbelongingtotheclassofthemulti- delay difference between successive elements. The use of inputmulti-output(MIMO)radarsdiscussedbelow']","The use of multiple transceivers in MIMO radar allows for the generation of multiple simultaneous beams, enhancing the angular coverage and resolution (Krieger, 2014).","forming non-overlapping sub- arrays within the array , naturally limiting the achievable beamwidth of each beam and making inefﬁcient use of the available aperture. A third option can be taken by arranging the array into partially or fully overlapping subarrays coupled with the use of orthogonal waveforms, each associated to a generated beam, a solution belonging to the class of the multi- input multi-output (MIMO) radars discussed below. MIMO radars have developed into a strong contender for multi-antenna radar systems, applying the concept of virtual sensors with orthogonal waveform diversity –. Our interest in MIMO radars in relevance to the problem at hand arises due to their capability to produce multiple orthog- onal beams by selecting an appropriate set of",0.3333333333333333,0.9467358737904042
"form of array radar systems combining the PA and MIMO concepts has been presented by the authors in by the name of Full Phased MIMO (FPMIMO). The FPMIMO radar also serves as a general architecture for multi- antenna radars that employ overlapped subarrays, which also encompass the class of PMIMO radars . Generally in the FPMIMO system employing K transmit antennas arranged into M overlapped subarrays and L receive antennas with N subarrays, the Tx and Rx may cover either the whole C| K and C| L complex space, respectively, or only some subspace of them, i.e., C| M and C| N , respectively. The subarrays in Rx array are also useful to increase the coherent gain even further relative","['. Hassanien and S. A. Vorobyov, ‘‘Phased-MIMO radar: A tradeoff theAcademicianoftheRussianAcademyofTransport.HeisalsoaFounding betweenphased-arrayandMIMOradars,’’IEEETrans.SignalProcess., vol.58,no.6,pp.3137–3151,Jun.2010,doi:10.1109/TSP.2010.2043976', '. INDEX TERMS Circulating-codes, Golay-codes, interference, MIMO-radar, multibeam, OFDM-radar, sub-band,surveillance. I. INTRODUCTION Manyradarapplicationsdemandscanningcapabilitytoallow The associate editor coordinating the review of this manuscript and coverage over a range of angular direction, such as those approvingitforpublicationwasXueboZhang . forsurveillance,vehicular,weathermonitoring,imaging,and 2025TheAuthors.ThisworkislicensedunderaCreativeCommonsAttribution4.0License', '. By taking as an example the design of long-rangesurveillanceradar,thepaperdiscussesfurtherissuespertinenttotheimplementationoftheCC OFDM MIMO radar, including the beam squinting problem and its remedy, arrangement of the multiple beams, the radar system structure, use of Golay codes for orthogonalization and PAPR mitigation, use of software-definedradarthateliminatestheneedofamplitudeandphasecontrolineachtransmitter,transmit', '. The latter indicates that the CC OFDM MIMO radar can achieve a high resolution in angle, range, and velocity,withbeamisolationof−30dBforneighboringbeamsandco-channelbeams. INDEX TERMS Array signal processing, circulating-codes, Golay-codes, MIMO-radar, multi-beam, OFDM,software-defined-radar,sub-band,space-timecodes,surveillance. I', '. The summation of outputs from 1) Thispaperdescribesthereceiverprocessingofmulti- individual receive modules across the array provides beam CC-OFDM MIMO Radar which is designed the array gain and serves to increase the receive SNR for long-range radar surveillance application. The for each beam']","The array gain achieved through the summation of outputs from individual receive modules enhances the signal-to-noise ratio (SNR) for long-range radar applications (Hassanien and Vorobyov, 2010).","forming non-overlapping sub- arrays within the array , naturally limiting the achievable beamwidth of each beam and making inefﬁcient use of the available aperture. A third option can be taken by arranging the array into partially or fully overlapping subarrays coupled with the use of orthogonal waveforms, each associated to a generated beam, a solution belonging to the class of the multi- input multi-output (MIMO) radars discussed below. MIMO radars have developed into a strong contender for multi-antenna radar systems, applying the concept of virtual sensors with orthogonal waveform diversity –. Our interest in MIMO radars in relevance to the problem at hand arises due to their capability to produce multiple orthog- onal beams by selecting an appropriate set of",0.6666666666666666,0.9063904071606605
"works. The third section defines and explains the concepts that underpin our research. The fourth section describes the fundamentals of the proposed method. The fifth section provides the experimental results and analyses the findings. The last Section gives a conclusion and overview of future works. II. RELATED WORK II. RELATED WORK This section discusses research related to the work carried out including the process discovery method, its quality dimen- sions, and graph-based process mining. A. PROCESS DISCOVERY METHODS A. PROCESS DISCOVERY METHODS A data-driven automated method called Process Discovery can locate, map, and record the activities of current business processes. The received data is then automatically analyzed so that it can be automatically recommended in the process modeling or workflow","['. practical implementation. [12] R. Sarno and K. Sungkono, “A survey of graph-based algorithms for discovering business processes,” InterACKNOWLEDGMENT nationalJournalofAdvancesinIntelligentInformatics, This research was funded by Institut Teknologi Sepuluh vol.5,no.2,pp.137–149,2019,ISSN:2548-3161.DOI: Nopember (ITS) under Penelitian Dana Departemen Pro10.26555/ijain.v5i2.296. gram, Penelitian Keilmuan, Penelitian Flagship, Penelitian [13] A. Green, P. Guagliardo, L. Libkin, T. Lindaaker, V', '. deeper analysis, real-time monitoring, and informed IT manAfter identifying company goals with a similarity value agement decisions. greater than 50, these nodes are used as references for the Our results demonstrated the system’s effectiveness in sugnext graph query execution to obtain the required activities. gesting activities tailored to enterprise goals, enhancing IT The output matches the mapping results, displaying only management practices and operational efficiency', "". 1–5. doi: 10.1109/eSmarTA59349.2023.10293688. significant inefficiencies within the hospital's billing system, [8] C. Stephanie and R. Sarno, “Detecting Business Process Anomaly Using Graph Similarity Based on Dice Coefficient, Vertex Ranking pinpointing several critical bottlenecks that can be targeted and Spearman Method,” in 2018 International Seminar on Application for process improvements"", '. TABLE I provides a detailed not always be clean or well-structured [9]. Moreover, it offers overview of the activities and performance indicators insightful diagnostics about the process flow, helping to associated with the DSS01.01 domain of managed operations. identify bottlenecks and inefficiencies that other algorithms might overlook[16]. B. Process Mining Process mining involves deriving business processes from III', '. process mining, data mining, machine learning, 934 885 [21] I.Waspada,R.Sarno,andD.K.R.Sungkono,‘‘Animprovedmethodof ITgovernance,andothertopicsrelatedtoinforma- 935 886 parallelmodeldetectionforgraph-basedprocessmodeldiscovery,’’Int. tionsystemsandcomputersciencefieldsofstudy. 936 887 J.Intell.Eng.Syst.,vol.13,no.2,pp.127–139,Apr.2020. 937 102752 VOLUME10,2022']","The Process Discovery method is a data-driven automated approach that identifies, maps, and records the activities of existing business processes (Sarno & Sungkono, 2019).","into a process, revealing events in emerging cases. Utilizing event logs generated in information systems makes business model development easier. B. Process Mining Process mining is an analytical method used to study, understand, and improve business processes by leveraging data automatically generated by information systems . This technique involves analyzing event logs or records of events that occur within a system, such as business transactions or user activities. From this data, process mining maps the actual workflow, identifies patterns, trends, and anomalies within the process, and objectively measures process performance. Methods for process data mining(PM), present new opportunities for knowledge discovery. C. DISCO C. DISCO Disco is an innovative process mining tool developed by Fluxicon, aimed at helping organizations visualize,",0.2,0.9499105931943764
"more reliable in detecting and handling ICR patterns. B. GRAPH-BASED PROCESS DISCOVERY PLUS B. GRAPH-BASED PROCESS DISCOVERY PLUS PLUS (GPD++) GPD++ consists of the main algorithm for detecting split and join blocks presented in Algorithm 1 and the algorithm for finding the block hierarchy and its types (XOR or AND) in Algorithm 2 and Algorithm 3. GPD++ utilizes the detected block structure to identify ICR in blocks parallel (long). As an illustration of how Algorithm 1 works in finding split-join blocks, an example of a DFG model with one split node (|T| = 1) and one join node is given in figure 4. The input for Algorithm 1 is the DFG model with split-node and join-node information. The results of","['. S. Astuti, H. N. Prasetyo, and Program 2024. R. Budiraharjo, “Extending graph-based process discovery for hierarchical block detection and incomplete concurrent REFERENCES relationship handling,” IEEE Access, vol. 11, pp. 123382– [1] ISACA, COBIT® 2019 Framework: Introduction & Method- 123391, 2023. DOI: 10.1109/ACCESS.2023.3324742. ology. Illinois, USA: ISACA, 2018. [15] K. Sungkono, R. Sarno, F. Amadea, and A', '. Process Discovery study shown in Fig. 2. The process begins at an initial point After preprocessing, process discovery techniques are and follows a sequence of evaluations and decision-making applied to the cleaned data to identify the underlying stages, including the handling of code errors and status Fig. 2. Process Discovery Results Authorized licensed use limited to: Institut Teknologi Sepuluh Nopember. Downloaded on July 14,2025 at 08:18:28 UTC from IEEE Xplore. Restrictions apply.', 'II. RESEARCHLITERATURE Researchby[16]introducesanimprovedmethodfordetecting parallel process models in graph-based process discovery. A. Previous Research By establishing relationship frequencies and using specific algorithms, the method accurately distinguishes XOR, AND, The research [8] and [9] demonstrates the use of graph and OR relationships', '. DiscoveryresultfromtheprocessmodelwithBPIC13dataset. activities 4 Set its output place WITHdistinctsASs,op TABLE4. Resultsoftheexperimentthatuseanormalcase. and relationship SETs.f=s.f+1,op.token attributes = op.token + 1, op.p = op.p+1 positiononp_8andp_14,thenecessitytoaddamissingtoken 656 isbecauseareplayisrequiredonAcceptedactivitytoenable 657 taujoin_4. The GO-TR and ITBR algorithms that work in 658 ‘‘wrong-placedtoken’’problemisdifferent.Itisinteresting', '. Burattin et al. [16] also methods[7]. 150 204 developed a behavioral patterns technique that can detect In this paper, our work is aligned with the Graph-Based 151 205 deviations more flexibly and reliably to handle processes Process Discovery technique in [7] and [17]']","Astuti et al. (2023) introduced an improved method for detecting parallel process models in graph-based process discovery, which is relevant for identifying ICR patterns in blocks.","in business process modeling. Using real- life data and public datasets, the research compared GPD++ to traditional methods like Inductive Miner (IM) and Split Miner (SM). Results showed that GPD++ effectively addressed ICRs and detected hierarchical blocks. The paper introduces the Invisible-Task Prime and Non-Prime ITPNP algorithm for mining invisible tasks in process models, focusing on XOR and AND/OR relationships. It detects invisible non-prime tasks in hybrid parallel rela- tionships. Tested on seven models, it outperformed traditional methods, achieving high fitness and precision, especially in complex scenarios. Research by introduces an improved method for detect- ing parallel process models in graph-based process discovery. By establishing relationship frequencies and using specific algorithms, the method accurately distinguishes XOR, AND, and OR relationships.",0.0,0.9317477160639506
"Two nodes with Event label and a relationship with DFG type. D. GRAPH DATABASE D. GRAPH DATABASE Graph database models are defined as the data structure in which schema and instances are modeled as graphs and graph-oriented operations are performed on graphs. It has recently received a great deal of attention in both research and industry due to its capacity to manage vast quantities of data and networks. This paper employs Neo4j GDBMS and the graph query language Cypher to implement the graph. Figure 3 illustrates a straightforward graph model. For the cypher syntax (x:Event p_id: 102)-[r:DFG instance, {Flow:’NEXT’}]->(y) declares the variable x for nodes with the label:Event and the variable r for relations with the label:DFG. Additionally, the p_id","['. Future research could address scalability, and exploring graph analytics in a graph database integrationwithotherframeworks,andadaptationfordifferent (neo4j),” Ph.D. dissertation, Dublin Business School, industries, with our approach holding potential for broad 2022. practical implementation. [12] R. Sarno and K', '. One of the commonly the value of their IT investments, and achieve their business used command languages for Neo4j is Cypher Query Lan- objectives more effectively. guage(CQL).CypherprovidesanintuitiveandexpressivesynC. Term Frequency (TF)-Inverse Document Frequency (IDF) tax for interacting with graph data, allowing users to perform and Long Short Term Memory (LSTM) method various operations such as searching, adding, updating, and deleting data within the Neo4j graph database', '. 20: seqs padded all←normalize(seqs padded all) ▷Normalize In this study, we delve into the realm of Graph Databases, inputdata 21: similarities←model.predict(seqs padded all)[1:] ▷Exclude focusingparticularlyonNeo4j,touncoverthehiddenpotential similaritywithmainsentence and possibilities it offers', '. The results of this process are 0 or exhibiting similarity, those Nodes are designated as showninTABLEV.Thereisadiscrepancybetweenthenumreferences for subsequent Graph Query execution to obtain ber of Objective nodes and HAS OBJECTIVE relationships the necessary Activities based on those Enterprise Goals, as it because one AG can have more than one Objective, and outlined in TABLE IV. The code is executed from a Python one Objective can be related to more than one AG', '. [8] J. Guia, V. G. Soares, and J. Bernardino, “Graph databases: Neo4j analysis.,” in ICEIS (1), 2017, pp. 351–356. [9] A. Boulmakoul and Z. Besri, “Enterprise organizationassessmentthroughstructuralanalysisframework,” Conference Maghre´bine sur les Syste`mes De´cisionnels ASD 2013, vol. 1, pp. 381–393, 2013. Fig.5. ThegraphicalrepresentationobtainedinNeo4J [10] P. Dedousis, G. Stergiopoulos, G. Arampatzis, and D']","Cypher Query Language (CQL) is an intuitive and expressive syntax used for interacting with graph data in Neo4j, enabling operations such as searching, adding, updating, and deleting data (Sarno & K, 2022).","example of deﬁning a relationship in Cipher is: ‘‘()–>()’’ i.e., the rela- tionship can never be without source and destination nodes. Similar to nodes, relationship groups can be delimited by 385 specifying labels in square brackets ’’()-[:Label]->()’’ and 386 variables such as ’’()-[variablename:Label]->()’’. Node and 387 relationship variable declarations can be freely combined. 384 383 382 388 A simple graph can be seen in Fig. 3. For example 389 the cipher syntax (x:Event {p_id: 102})-[r:DFG 390 {Flow:’NEXT’}]->(y) will declare the variable x for the node with the label:Event and variable r for relations labeled:DFG. In addition, the p_id attribute is also declared 393 for node x and the Flow attribute for relationship r. 392 394 391 FIGURE 3. Example of",0.75,0.9128741071992891
"added in our recent publi- cation also yet tailored for spectrogram images. Instead of relying on resource-intensive transfer learning models, our approach optimizes model efficiency, making it more com- putationally friendly or resource-constrained applications. This contribution aims to streamline the implementation of emotion recognition systems without compromising perfor- mance. The proposed research is based on a simplified deep learn- ing architecture and channel selection approach that leads towards closer and resource-constrained real-time implemen- tation. In addition, research for cross-subject validation is more likely to be implemented widely than dependent subject validation. Cross-subject validation has a better generaliza- tion model than dependent-subject validation. This makes this research applicable across a wide range of industries where emotion recognition enables the development of","['. INDEXTERMS Classification,emotionrecognition,inter-subject,spectrogram. I', '. DigitalObjectIdentifier10.1109/ACCESS.2023.3275565 Simplified 2D CNN Architecture With Channel Selection for Emotion Recognition Using EEG Spectrogram LIAFAROKHAH 1,2,RIYANARTOSARNO 1,(SeniorMember,IEEE), ANDCHASTINEFATICHAH 1,(Member,IEEE) 1DepartmentofInformatics,FacultyofIntelligentElectricalandInformaticsTechnology,InstitutTeknologiSepuluhNopember(ITS),Sukolilo,Surabaya60111, Indonesia 2DepartmentofInformatics,FacultyofTechnologyandDesign,InstitutTeknologidanBisnisASIA,Malang65142,Indonesia', '. B. EXPERIMENT1:EMOTIONRECOGNITIONFOR INTRA-SUBJECT The results of the emotion recognition experiment on the DEAP dataset, which is used in the proposed architecture, aredividedintotwoparts:intra-subjectvalidationandintersubject validation. The first part is for intra-subject, which is divided into 4 sub-sections: intra-1 (Exp. 1), where validation is carried out using 32 channels, intra-2 (Exp', '. The experimental results show that the performance of the proposed architecture improves the accuracy of the inter-subject emotion recognition using 32 channels by 9.73% and 11.7% on valence and arousal, respectively. While the use of the proposed selected channel method, with only 10 channels, performanceincreasedby3.53%and7.2%onvalenceandarousalclasses,respectively.Thus,bykeepinga lowercomplexitylevel,theproposedarchitectureattainshigherperformancerates', '. [15] D. Shah, G. Gopan K., and N. Sinha, ‘‘An investigation of the multi- [34] O. Bazgir, Z. Mohammadi, and S. A. H. Habibi, ‘‘Emotion recognidimensional(1Dvs.2Dvs.3D)analysesofEEGsignalsusingtraditional tionwithmachinelearningusingEEGsignals,’’inProc.25thNat.and methods and deep learning-based methods,’’ Frontiers Signal Process., 3rdInt.IranianConf.Biomed.Eng.(ICBME),Nov.2018,pp.1–5,doi: vol.2,pp.1–15,Jul.2022,doi:10.3389/frsip.2022.936790. 10.1109/ICBME.2018.8703559. [16] H. Cui, A. Liu, X. Zhang, X']","The proposed architecture enhances inter-subject emotion recognition accuracy by 9.73% and 11.7% for valence and arousal, respectively, demonstrating its effectiveness in resource-constrained applications.","accuracy performance when using 32 channels either intra-subject or inter-subject. Second, it is desired that the research should lead to the use of minimal channels but well-performing. Third, the architecture com- plexity is seen as a trade-off with the performance measures. Therefore, the proposed research targets all these gaps and investigates inter-subject performance using minimal chan- nels and a simplified architecture, without the need for con- tinuous re-trainings. III. MATERIALS AND METHOD III. MATERIALS AND METHOD The architecture proposed in this study was validated on the DEAP, public dataset. The results of the emotional val- idation experiment using EEG are divided into two parts, namely intra-subject and inter-subject validation. The pro- posed method involves the processing of the raw data",1.0,0.948865783157455
"valence and arousal around 80% . Javidan et al. validate cross-subject performance in the valence class (2 channels) utilizing the RReliefF selection strategy with input MSCE and SVR classifiers, yielding an accuracy of 67.45% . Msonda et al. reconstruct features (using 2, 3, 4, 5, 6, 7, and 8 channels) and search for the minimal errors using Adaboost, LR, Linear SVC, Polynomial SVC, and RF, with average performance results between 50 and 60%. Using locally robust feature selection (LRFS), Yin et al. execute channel selection for cross-subject classification with an estimated accuracy of 60% for valence and arousal classes . Arjun et al. employed the attention channel when combined with the LSTM and autoen- coder for cross-subject classification and obtained","['. They perform inter-subject validation with a combination These emotions, transformed into the DEAP dataset, are of several channels that produce a valence accuracy percalledvalenceclasses.Theperformanceobtainedis72.81%. formance of around 50–60%', '. B. EXPERIMENT1:EMOTIONRECOGNITIONFOR INTRA-SUBJECT The results of the emotion recognition experiment on the DEAP dataset, which is used in the proposed architecture, aredividedintotwoparts:intra-subjectvalidationandintersubject validation. The first part is for intra-subject, which is divided into 4 sub-sections: intra-1 (Exp. 1), where validation is carried out using 32 channels, intra-2 (Exp', '. The experimental results show that the performance of the proposed architecture improves the accuracy of the inter-subject emotion recognition using 32 channels by 9.73% and 11.7% on valence and arousal, respectively. While the use of the proposed selected channel method, with only 10 channels, performanceincreasedby3.53%and7.2%onvalenceandarousalclasses,respectively.Thus,bykeepinga lowercomplexitylevel,theproposedarchitectureattainshigherperformancerates', '. orevenuptoabout20%[18],[19]. EmotionalrecognitionthroughEEGcanbevalidatedusing II. RELATEDWORK two methods, namely intra-subject and inter-subject. Intra- Research related to emotion recognition using the DEAP subject refers to a classification model where training, test- open-source repositories attempts to improve performance ing, and validation datasets are generated from the same accuracy.Intra-subjectresearchhasbeencarriedoutinmany individual through a suitable split [18], [20], [21], [22]', '. [32] Y. Cimtay and E. Ekmekcioglu, ‘‘Investigating the use of pretrained [13] M.A.Asghar,‘‘EEG-basedmulti-modalemotionrecognitionusingbagof convolutional neural network on cross-subject and cross-dataset eeg deepfeatures:Anoptimalfeatureselectionapproach,’’Sensors,vol.19, emotion recognition,’’ Sensors, vol. 20, no. 7, pp.1–20, 2020, doi: no.23,pp.1–16,2019,doi:10.3390/s19235218. 10.3390/s20072034']","The proposed architecture improves inter-subject emotion recognition accuracy by 9.73% and 11.7% for valence and arousal, respectively, when using 32 channels (Simplified 2D CNN Architecture With Channel Selection for Emotion Recognition Using EEG Spectrogram).","the valence class using Densenet-121 is 85.57%, while the performance of the valence class using DCERNET and softmax is 88.57%, and DCERNET and SVM is 88.10%. In addition, the valida- tion of inter-subject emotions using the 2D frame sequences resulted in 68% and 63% accuracy on valence and arousal, respectively . Non-2D research, such as the use of 3D meta-learners, yields valence and arousal performance of 69.92% and 68.89%, respectively . Research on 3D cubes with inter-subjects has been carried out with valence and arousal performances of 84% and 85% . Based on pre- vious studies, it is concluded that the highest accuracy per- formance in the valence class is 88.57% and the arousal class is 85%. Previous inter-subject research",0.6666666666666666,0.95393441397966
