user_input,retrieved_contexts,response,reference,faithfulness,answer_relevancy
"in improved validation results. Using the previous method, Res U-Net produced the best loss value in the validation set generated from the training dataset in 142 epochs. However, by using our proposed approach, the architecture achieves almost identical results, with a loss value of 0.6838005 over 125 epochs. Thereafter, it continues to improve and displays the best results at 152 epochs. The Dense U-Net result shows the most significant results. Since Dense U-Net requires higher computational power due to the dense block used, the training time of this architecture is generally slower than two other architectures. Using our proposed method, the network training time can be significantly faster. However, our method produces better segmentation results and requires a shorter training","['. First, the direction of 1) U-Net change needed to lower the loss is indicated by the gradient of U-Net is an architecture of CNN used for image segmentation that was first introduced by [7] and has become a pop- the loss function at the tth iteration, or g. Adam calculated t ular choice CNN architecture. Generally, CNNs have layers the first weighted average (m) and the second weighted aversuch as convolutional layers, pooling layers, and fully con- t age (v ) in order to handle this gradient', '. The stability of Link-Net is evident in the smaller standard deviation values for both accuracy and F1-Score loss, along with a higher average F1-Score. It is also more efModel ficient because it reduces the training time by 13% compared Min Max Average to U-Net. In addition, it delivers visually better segmentation U-Net 0.7994 0.9629 0.9027 results. These factors highlight the superior segmentation perLink- formance of Link-Net over U-Net', '. andperformtraining,whichtakestimeandalotofcomputationaleffort.Moredatasetswereneededifwewouldliketo haveabetterresult. U-Net is an convolution network for semantic segmentation. The structure of the U-Net architecture consist of VOLUME10,2022 110329', '. The results of the training indicate that LinkNet has a 13% faster training time when compared to U-Net. designs are inappropriate for medical image processing. AdThe highest training and validation accuracies achieved by vances in medical image processing architecture combined Link-Net are 0.9973 and 0.9941. Link-Net is also superior by ob- with the development of deep learning technology have led to taining the highest F1 Score of 0.9636 throughout the testing a paradigm shift in image segmentation', '. This integrated approach ensures segmentation further optimizes performance by combining a more robust segmentation by leveraging the strengths of different machine-learning strategies to refine accuracy and both methodologies. In addition, rule-based and deep learning adaptability, as explored in the work by scholars at Brandeis techniques also play significant roles [11], [21], [30], [31]. University [20]–[22]', '. Additionally, after V. CONCLUSION comparing the F1-Score values on 237 testing data, 59.49% of the total data were outperformed by the Link-Net model. Based on the results and analysis, it can be concluded that the Link-Net architecture outperforms U-Net. This is due to Link-Net being more stable, efficient, and producing superior TABLE III. COMPARISON OF F1-SCORE TESTING FOR U-NET AND LINK-NET MODELS segmentation outcomes', '. U-Net architecture (CNN) are supervised learning classification algorithms in and its extension, Link-Net architecture, are employed in this machine learning that are suitable for image data because they study to do this segmentation. Both architectures share the use are commonly used to recognize objects. These algorithms are of skip-connections to enhance spatial information', '. Fig. 3. Segmentation evaluation metrics IV. EXPERIMENTAL RESULT In this section, the dataset used and how it was prepared will be described. Furthermore, the results achieved in the ... ꦏꦃꦺ ꦲ|ꦠꦤ꧀|ꦺ ꦧꦭꦤ꧀|ꦒꦸꦒꦸꦫꦸ|ꦲꦉꦧꦸꦠ˛|ꦏꦤ¸ ꦭ꧀|ꦏꦫꦶꦪꦶꦤ꧀|ꦒꦸꦱ˛ ꦶ|ꦥꦶ experiment will be explained', "". The gradient's exponected layers. However, the U-Net architecture does not use t fully connected layers. Fully connected layers are used to nential average is recorded in the initial estimate (m ), where t transform matrix shapes into vectors for subsequent label β is the coefficient that establishes the relative weight beclassification. In segmentation tasks, however, the output is 1 tween the most recent gradient and the estimate from earlier"", '. Masoud Faramarzi [42] employs Pooling (SPP), modifying the PANet, and utilizing Hard- the DarkFlow-YOLO model, which includes batchsize and Swish activation functions [59]. Similarly, researchers have optimizervariationparametersandyieldsnearlyzeroresults integrated DenseNet blocks into the YOLOv5 backbone to in training and validation accuracy and average precision']","Link-Net demonstrates a 13% reduction in training time compared to U-Net, highlighting the efficiency of the architecture (Left Ventricular Wall Segmentation Using U-Net and Link-Net).","num- ber of parameters is directly proportional to the results of the average loss and average accuracy in training and validation. The U-Net design performs better than Link-Net on average, with smaller training and validation loss values and higher training and validation accuracy values. Table 1 show that the average loss in U-Net is 21% greater than Link-Net, but with the sacrifice of longer training time. So that the Link-Net ar- chitecture provides more stable and parsimonious results. TABLE I. PERFORMANCE SUMMARY OF U-NET AND LINK-NET ARCHITECTURES Training Validation Model U-Net Link- Net Average Loss (St. Dev.) 0.0101 (0.0065) 0.0123 (0.0076) Average Accuracy (St. Dev.) 0.9956 (0.0027) 0.9948 (0.0027) Average Loss (St. Dev.) 0.0188 (0.0194) 0.0216 (0.0057) Average Accuracy (St.",0.6666666666666666,0.9252054732411792
"company goals by proposing a novel recommendation system for internal business processes, grounded in the COBIT 2019 framework. The system employs graph algorithms to map relationships, semantic similarity measure- ments to align enterprise goals with management objectives, and LSTM combined with TF-IDF methods to analyze and recommend specific activities. Experimental results show that this system optimizes IT management practices, enhances operational efficiency, and ensures regulatory compliance. Additionally, a user-friendly graphical representation of internal business pro- cesses using Neo4j enables stakeholders to visualize complex relationships within the COBIT framework, facilitating informed decision-making. This research advances IT governance practices by providing organizations with a valuable tool to automate and improve IT strategies, effectively achieving business objectives. Index Terms—COBIT 2019, graph algorithms, IT","['. They identified areas for improvement and which uses a weighted graph approach to measure similarprovided recommendations to enhance IT governance, emities in parallel business process models by considering the phasizing effectiveness of COBIT 2019 in managing IT risks. frequency of activity relationships. This method outperforms Thesestudieshighlightthebenefitsofframeworkinimproving traditional approaches like GMA, WGED, WNARS, TPED, IT governance in educational institutions. and Cosine-TDP', '. I. Fianty and M. Brian, “Leveraging COBIT 2019 Framework to 10.1080/00949655.2012.658804. Implement IT Governance in Business Process Outsourcing [35] T. M. Oshiro, P. S. Perez, and J. A. Baranauskas, “How Many Trees in Company,” Journal of Information Systems and Informatics, vol. 5, no. a Random Forest?”, In Machine Learning and Data Mining in Pattern 2, pp. 568–579, May 2023, doi: 10.51519/journalisi.v5i2.492. Recognition: 8th International Conference, MLDM 2012, Berlin, [18] S. Dhir, D. Kumar, and V', '. Recommendations based on COBIT 2019 best practices, such as performance measurements and knowledge repository access, further enhance IT governance processes and contribute to the success of software development projects. The integration of AI and machine learning techniques with the COBIT 2019 framework holds promise in further enhancing IT governance practices [19]', '. This formula A. Mapping COBIT 2019 Element combinesthelocalimportanceofaterminaspecificdocument (term frequency) with its global importance across the entire The research began by identifying Enterprise Goals corredocument collection (inverse document frequency) [21]. latedwiththeBalancedScorecardFinancial.Then,Alignment 5) Cosine Similarity: This process quantifies the similarity Goals related to these Enterprise Goals were mapped. Subsebetween two vectors in a high-dimensional space', '. 2020, pp. Information System Governance using Framework COBIT 2019,” 61–70. doi: 10.1145/3416508.3417119. International Journal of Computer Applications, vol. 174, no. 31, pp. [25] A. E. Karrar, “The Effect of Using Data Pre-Processing by Imputations 23–30, Apr. 2021, doi: 10.5120/ijca2021921253. in Handling Missing Values,” Indonesian Journal of Electrical [7] A. A. Aibinu and E. Papadonikolaki, “Conceptualizing And Engineering and Informatics (IJEEI), vol. 10, no. 2, Apr', '. The results show a list of recommended activities based on the company In previous research, as found in the paper [3], [4], [5] strategy, this can simplify the company audit process. and [6] to obtain Activities from the COBIT Core Model Keywords—Audit Management, COBIT 2019, Cosine Similar- and Capability Scores, it is necessary to undergo a mapping ity, Financial, Knowledge Graph, Neo4J process according to the instructions in the COBIT 2019 manual. This can be time-consuming, especially when auditor I', '. It is like building a map of knowledge, case study from 3 different companies as input, followed by a preprocessing step, then compares it to Enterprise Goals using whereeachpieceofinformationisapointconnectedtoothers TF-IDF and cosine similarity. Goals with high similarity scores by lines that show how they are linked [2]. trigger a graph query to reveal connected activities', '. and Cosine-TDP. [12] presents W-LTLDAG, a method that Researchby[4]assessedtheeffectivenessofITgovernance combinesWeighted-LinearTemporalLogic(W-LTL)Treeand at Mandiri University using the COBIT 2019 framework. Weighted Directed Acyclic Graph (wDAG) to enhance the The findings highlighted the critical role of IT governance accuracy of comparing graph-based business process models', '. Previous Research of Audit using COBIT 2019 based on semantic similarities, preprocessing data to calculate PreviousresearchonauditingwithCOBIT2019hasinvestithese similarities and effectively merging nodes and relationgated multiple facets of IT governance and auditing, applying ships. the framework across diverse domains and industries', '. Among these frameworks, COBIT is globally recognized Frequency-Inverse Document Frequency (TF-IDF) calculation for overseeing Enterprise Information and Technology (I&T) and measuring similarity between strategy nodes to identify comprehensively, covering all systems regardless of their lo- relevanceandinfluenceamongstrategycomponents.Themain cation within the organization']","The proposed recommendation system employs a weighted graph approach to enhance IT governance and improve internal business processes, aligning with the effectiveness of COBIT 2019 in managing IT risks.","research introduces a novel Activity Recom- mendation System built on the COBIT 2019 framework tailored for Financial Balance Scorecard. The motivation stems from the challenges faced by auditors when identifying essential activities aligned with strategy of a company, often hindered by manual COBIT 2019 guideline navigation. To address this, a system was developed, where inputting the company strategy, triggers the display of recommended activities automatically. The methodology involved creating interconnected nodes from COBIT 2019 Element in Neo4J. This research uses a real strategy plan case study from 3 different companies as input, followed by a preprocessing step, then compares it to Enterprise Goals using TF-IDF and cosine similarity. Goals with high similarity scores trigger a graph query to reveal connected",0.4,0.9347063752342806
"assist organizations in managing and optimizing their use of information technology (IT) . landscape, effective IT In today’s rapidly evolving digital governance is essential for organizations to ensure that their IT investments align with business objectives, comply with regulations, and mitigate risks . COBIT 2019 provides a structured approach for organiza- tions to establish, implement, and maintain effective gover- nance over IT. It defines the components necessary to create and sustain a governance system, as well as guidelines for building the most suitable governance system for an enterprise . By utilizing COBIT 2019, organizations can enhance the efficiency, effectiveness, and reliability of their IT usage, while also ensuring compliance with relevant regulations, policies, and standards . One of the key","['. The organizations can prioritize processes, set target capability methodology of this research consists of several main steps, levels, and design effective governance systems for IT which are illustrated in Fig. 1. The following is a detailed projects [17], [18]. Implementing COBIT 2019 in software description of each step: development projects allows for mapping IT resources, prioritization of governance objectives, and alignment of A', '. I. Fianty and M. Brian, “Leveraging COBIT 2019 Framework to 10.1080/00949655.2012.658804. Implement IT Governance in Business Process Outsourcing [35] T. M. Oshiro, P. S. Perez, and J. A. Baranauskas, “How Many Trees in Company,” Journal of Information Systems and Informatics, vol. 5, no. a Random Forest?”, In Machine Learning and Data Mining in Pattern 2, pp. 568–579, May 2023, doi: 10.51519/journalisi.v5i2.492. Recognition: 8th International Conference, MLDM 2012, Berlin, [18] S. Dhir, D. Kumar, and V', '. Using COBIT metrics, organizations XGBoost 4.29 6.34 0.69 40.45 can evaluate and improve the quality of IT Governance, LightGBM 4.74 7.53 0.56 45.14 ensure compliance with regulatory provisions, and improve CatBoost 4.25 6.53 0.67 36.26 operational efficiency. As a result, these initiatives not only are presented in Table IV using MAE, RMSE, R², and MAPE improve the efficiency of project planning and execution but me trics', '. 2020, pp. Information System Governance using Framework COBIT 2019,” 61–70. doi: 10.1145/3416508.3417119. International Journal of Computer Applications, vol. 174, no. 31, pp. [25] A. E. Karrar, “The Effect of Using Data Pre-Processing by Imputations 23–30, Apr. 2021, doi: 10.5120/ijca2021921253. in Handling Missing Values,” Indonesian Journal of Electrical [7] A. A. Aibinu and E. Papadonikolaki, “Conceptualizing And Engineering and Informatics (IJEEI), vol. 10, no. 2, Apr', 'Optimizing IT Governance and Project Management in Software Development through AI Integration and COBIT 2019 Framework Joko Slamet Hartono Saputro Andy Teguh Department of Informatics Department of Informatics Department of Informatics Institut Teknologi Sepuluh Nopember Institut Teknologi Sepuluh Nopember Institut Teknologi Sepuluh Nopember Surabaya, Indonesia Surabaya, Indonesia Surabaya, Indonesia 6025231063@student.its.ac.id 60252310@student.its.ac.id 6025231047@student.its.ac.id Riyanarto Sarno Kelly', '. EVALUATION METRICS contract. Models MAE RMSE R2 MAPE In the field of IT governance, the combination of machine Linear Regression 4.32 6.01 0.72 40.20 learning methodologies with COBIT 2019 analytics provides Decision Tree 7.33 10.29 0.18 64.64 a robust framework to ensure that the IT management Random Forest 5.13 8.11 0.49 43.10 Gradient Boosting 4.67 7.11 0.61 41.79 methodology is consistent with global measurements and SVM 5.95 10.29 0.18 38.57 optimum methodology', '. Recommendations based on COBIT 2019 best practices, such as performance measurements and knowledge repository access, further enhance IT governance processes and contribute to the success of software development projects. The integration of AI and machine learning techniques with the COBIT 2019 framework holds promise in further enhancing IT governance practices [19]', '. explicitly on managing projects within the IT organization to Integrating AI with COBIT 2019 enhances project duration ensure the timely delivery of services while effectively estimation accuracy and strengthens IT governance. This combined utilizing resources and capabilities. Additionally, the BAI approach improves project efficiency and aligns IT initiatives with process can help in evaluate the interoperability of different organizational goals', '. H. Thabit and S. H. Abdullah, “Perceived Trust of Stakeholders: Predicting the Use of COBIT 2019 to Reduce Information data to analyze and optimize operational processes in realAsymmetry,” in 2023 3rd International Conference on Emerging time, focusing specifically on the effectiveness of IT delivery Smart Technologies and Applications (eSmarTA), Taiz, Yemen: IEEE, and support services. Our method successfully identified Oct. 2023, pp. 1–5. doi: 10.1109/eSmarTA59349.2023.10293688', '. systems [12]. Through the use of the COBIT 2019 framework, COBIT provides comprehensive guidance for identifying, auditors can pinpoint key controls necessary to achieve establishing, and monitoring the necessary controls within the predefined business objectives. Meanwhile, event log process IT environment to achieve defined business objectives [3], [4]']","Utilizing COBIT 2019 best practices, including performance measurements and knowledge repository access, enhances IT governance processes and supports the success of software development projects (Saputro et al., 2020).","process, an audit involves acquiring and objectively evaluating evidence related to allegations of economic activities and other operations. The aim is to assess the level of conformity between the reports and predefined criteria, and to communicate the results to relevant users, in this case, the organization responsible for establishing information system gover nan nance. One of the proven frameworks for information system auditing is the Control Objectives for Information and Related Technology (COBIT) 2019, which is utilized as the reference framework in this research . COBIT 2019 offers an effective methodology for evaluating the capability of information technology processes, specifically focusing on Deliver, Service and Support - Operation Management. This framework guarantees that the data (DSS01) is received, managed fully,",0.8,0.9487855697848057
"technology, thus helping them achieve their business objectives more effectively . Several previous papers still rely on manual approaches to COBIT 2019, which have limitations in providing automated recommendations for audit activities based on company goals. Thus, this research contributes significantly by addressing this gap and overcoming the challenges associated with manual COBIT utilization. The primary objective of this paper is to develop a rec- ommendation system that aligns with the internal business process strategy governed by COBIT 2019. This system aims to help organizations manage risk, ensure compliance, and enhance performance in the context of information technology. To achieve this, the research will utilize graph algorithms to build a recommendation system based on the internal business processes outlined in","['. Recommendations based on COBIT 2019 best practices, such as performance measurements and knowledge repository access, further enhance IT governance processes and contribute to the success of software development projects. The integration of AI and machine learning techniques with the COBIT 2019 framework holds promise in further enhancing IT governance practices [19]', '. Previous Research of Audit using COBIT 2019 based on semantic similarities, preprocessing data to calculate PreviousresearchonauditingwithCOBIT2019hasinvestithese similarities and effectively merging nodes and relationgated multiple facets of IT governance and auditing, applying ships. the framework across diverse domains and industries', '. The results show a list of recommended activities based on the company In previous research, as found in the paper [3], [4], [5] strategy, this can simplify the company audit process. and [6] to obtain Activities from the COBIT Core Model Keywords—Audit Management, COBIT 2019, Cosine Similar- and Capability Scores, it is necessary to undergo a mapping ity, Financial, Knowledge Graph, Neo4J process according to the instructions in the COBIT 2019 manual. This can be time-consuming, especially when auditor I', "". insights into the performance of the organization's information Thus, the system audit with COBIT helps organizations systems, along with recommendations for more effective IT improve the reliability, security, and operational efficiency in management. Thus, audit with COBIT and process mining managing their information technology"", '. They identified areas for improvement and which uses a weighted graph approach to measure similarprovided recommendations to enhance IT governance, emities in parallel business process models by considering the phasizing effectiveness of COBIT 2019 in managing IT risks. frequency of activity relationships. This method outperforms Thesestudieshighlightthebenefitsofframeworkinimproving traditional approaches like GMA, WGED, WNARS, TPED, IT governance in educational institutions. and Cosine-TDP', "". INTRODUCTION implementation of improvements. Audit system with Control Objectives for Information and Audit with COBIT 2019 and process mining from event Related Technologies (COBIT) is a process that refers to a logs represents a holistic approach to evaluating and framework designed to assist organizations in managing and enhancing the effectiveness of an organization's information controlling information technology more effectively [1], [2]. systems [12]"", '. The example results of the input preprocessing are solution to the challenges faced by auditors in identifying presented in TABLE VII. and aligning activities with company strategy', "". mining enables auditors to delve into the event log data In auditing systems with COBIT, auditors use COBIT generated by information systems to visually map process standards and principles to evaluate the maturity and flows. By combining these two approaches, auditors can effectiveness of internal controls within an organization's IT conduct in-depth analyses of system compliance with COBIT system [5]"", '. Survey audits enhance participation still relatively low due to the high variation of trace noise, which and engagement, allowing stakeholders to contribute to affects the outcomes of the process mining models. improving effectiveness and efficiency. Consequently, survey Keywords—COBIT 2019, Event Log, Graph, Process Mining. audits add a qualitative dimension to audit evaluations, facilitating better decision-making and more effective I. INTRODUCTION implementation of improvements', '. I. Fianty and M. Brian, “Leveraging COBIT 2019 Framework to 10.1080/00949655.2012.658804. Implement IT Governance in Business Process Outsourcing [35] T. M. Oshiro, P. S. Perez, and J. A. Baranauskas, “How Many Trees in Company,” Journal of Information Systems and Informatics, vol. 5, no. a Random Forest?”, In Machine Learning and Data Mining in Pattern 2, pp. 568–579, May 2023, doi: 10.51519/journalisi.v5i2.492. Recognition: 8th International Conference, MLDM 2012, Berlin, [18] S. Dhir, D. Kumar, and V']","The development of a recommendation system based on company strategy can simplify the audit process, as demonstrated in previous research on COBIT 2019 applications.","process, an audit involves acquiring and objectively evaluating evidence related to allegations of economic activities and other operations. The aim is to assess the level of conformity between the reports and predefined criteria, and to communicate the results to relevant users, in this case, the organization responsible for establishing information system gover nan nance. One of the proven frameworks for information system auditing is the Control Objectives for Information and Related Technology (COBIT) 2019, which is utilized as the reference framework in this research . COBIT 2019 offers an effective methodology for evaluating the capability of information technology processes, specifically focusing on Deliver, Service and Support - Operation Management. This framework guarantees that the data (DSS01) is received, managed fully,",0.5,0.9232291606249164
"is linked to the appropriate business objec- tives and control needs, thus enhancing overall governance effectiveness . One effective way to perform this mapping is by utilizing a graph database such as Neo4j . Neo4j is a graph database specifically designed to store and manage data with complex relationships . In the context of COBIT 2019, Neo4j can be utilized to build dynamic graphical representations of various COBIT elements . By using Neo4j, organizations can create dynamic and interactive graphical models to better understand and manage the complex relationships between different COBIT 2019 elements . This allows for deeper analysis, real-time monitoring, and better decision-making in IT management, ultimately aiding in the achievement of business goals . In summary, this","['. They identified areas for improvement and which uses a weighted graph approach to measure similarprovided recommendations to enhance IT governance, emities in parallel business process models by considering the phasizing effectiveness of COBIT 2019 in managing IT risks. frequency of activity relationships. This method outperforms Thesestudieshighlightthebenefitsofframeworkinimproving traditional approaches like GMA, WGED, WNARS, TPED, IT governance in educational institutions. and Cosine-TDP', '. in achieving organizational objectives and emphasized the W-LTLDAG effectively distinguishes between graphs with importance of implementing IT governance practices', 'Optimizing IT Governance and Project Management in Software Development through AI Integration and COBIT 2019 Framework Joko Slamet Hartono Saputro Andy Teguh Department of Informatics Department of Informatics Department of Informatics Institut Teknologi Sepuluh Nopember Institut Teknologi Sepuluh Nopember Institut Teknologi Sepuluh Nopember Surabaya, Indonesia Surabaya, Indonesia Surabaya, Indonesia 6025231063@student.its.ac.id 60252310@student.its.ac.id 6025231047@student.its.ac.id Riyanarto Sarno Kelly', '. Using COBIT metrics, organizations XGBoost 4.29 6.34 0.69 40.45 can evaluate and improve the quality of IT Governance, LightGBM 4.74 7.53 0.56 45.14 ensure compliance with regulatory provisions, and improve CatBoost 4.25 6.53 0.67 36.26 operational efficiency. As a result, these initiatives not only are presented in Table IV using MAE, RMSE, R², and MAPE improve the efficiency of project planning and execution but me trics', '. Recommendations based on COBIT 2019 best practices, such as performance measurements and knowledge repository access, further enhance IT governance processes and contribute to the success of software development projects. The integration of AI and machine learning techniques with the COBIT 2019 framework holds promise in further enhancing IT governance practices [19]', '. EVALUATION METRICS contract. Models MAE RMSE R2 MAPE In the field of IT governance, the combination of machine Linear Regression 4.32 6.01 0.72 40.20 learning methodologies with COBIT 2019 analytics provides Decision Tree 7.33 10.29 0.18 64.64 a robust framework to ensure that the IT management Random Forest 5.13 8.11 0.49 43.10 Gradient Boosting 4.67 7.11 0.61 41.79 methodology is consistent with global measurements and SVM 5.95 10.29 0.18 38.57 optimum methodology', '. 2020, pp. Information System Governance using Framework COBIT 2019,” 61–70. doi: 10.1145/3416508.3417119. International Journal of Computer Applications, vol. 174, no. 31, pp. [25] A. E. Karrar, “The Effect of Using Data Pre-Processing by Imputations 23–30, Apr. 2021, doi: 10.5120/ijca2021921253. in Handling Missing Values,” Indonesian Journal of Electrical [7] A. A. Aibinu and E. Papadonikolaki, “Conceptualizing And Engineering and Informatics (IJEEI), vol. 10, no. 2, Apr', '. The organizations can prioritize processes, set target capability methodology of this research consists of several main steps, levels, and design effective governance systems for IT which are illustrated in Fig. 1. The following is a detailed projects [17], [18]. Implementing COBIT 2019 in software description of each step: development projects allows for mapping IT resources, prioritization of governance objectives, and alignment of A', 'Riyanarto Sarno Kelly Sungkono Department of Informatics Department of Informatics Institut Teknologi Sepuluh Nopember Institut Teknologi Sepuluh Nopember Surabaya, Indonesia Surabaya, Indonesia riyanarto@if.its.ac.id kelly@its.ac.id Abstract— In the modern business environment, efficient time problem-solving rates, boost public satisfaction, and reduce management and robust IT governance are crucial due to rapid governance costs', '. I. Fianty and M. Brian, “Leveraging COBIT 2019 Framework to 10.1080/00949655.2012.658804. Implement IT Governance in Business Process Outsourcing [35] T. M. Oshiro, P. S. Perez, and J. A. Baranauskas, “How Many Trees in Company,” Journal of Information Systems and Informatics, vol. 5, no. a Random Forest?”, In Machine Learning and Data Mining in Pattern 2, pp. 568–579, May 2023, doi: 10.51519/journalisi.v5i2.492. Recognition: 8th International Conference, MLDM 2012, Berlin, [18] S. Dhir, D. Kumar, and V']","The implementation of COBIT 2019 best practices, including performance measurements and knowledge repository access, enhances IT governance processes and supports the success of software development projects (Saputro et al., 2020).","COBIT Core Model and Capability Scores, it is necessary to undergo a mapping process according to the instructions in the COBIT 2019 manual. This can be time-consuming, especially when auditor should auditing multiple companies simultaneously. This research aim to simplify the process to get Activities of COBIT 2019 automatically from Input Text Company Strategy that aligned with the description of related Enterprise Goals. This research adopts Neo4j, a graph database platform, to manage KG and process data related to these objectives, to gain deeper and more applicable insights into the relationships between strategic and operational objectives in a company . Furthermore, this research also involves the function of preprocessing the input text in the form of Company Strat- egy using",0.8,0.9242252954193511
"tool for processing sequential data and learning long-term dependencies, making it a crucial component in many applications of artificial intelligence and machine learn- ing. Choose Suitable Enterprise Goal based on Company Goal by using Similarity LSTM-TF IDF. III. METHODOLOGY III. METHODOLOGY This section outlines the methodology for developing a recommendation system based on COBIT 2019’s internal business processes. The approach integrates data collection, preprocessing, graph database modeling with Neo4j, and rec- ommendation generation using graph algorithms and similarity methods. The complete process shown in figure 1 A. Input Dataset The input dataset comprises information from the COBIT 2019 framework, including internal business processes, control objectives, IT processes, and related elements. Additionally, company-specific goals are incorporated to ensure that the recommendations","['. It is like building a map of knowledge, case study from 3 different companies as input, followed by a preprocessing step, then compares it to Enterprise Goals using whereeachpieceofinformationisapointconnectedtoothers TF-IDF and cosine similarity. Goals with high similarity scores by lines that show how they are linked [2]. trigger a graph query to reveal connected activities', '. Process., 2021, pp.5176–5189. [Online]. Available: tion based on relation type guided graph convolutional network,’’ https://aclanthology.org/2021.emnlp-main.420 Eng. Appl. Artif. Intell., vol. 126, Nov. 2023, Art.no.106948, doi: [12] W. Zhang, Y. Deng, X. Li, Y. Yuan, L. Bing, and W. Lam, ‘‘Aspect 10.1016/j.engappai.2023.106948. sentimentquadpredictionasparaphrasegeneration,’’inProc.Conf.Empir- [32] F. Colasanto, L. Grilli, D. Santoro, and G. Villani, ‘‘AlBERTino for ical Methods Natural Lang', '. these prices. Results indicate that LSTM models capture The LSTM model showcased its strength in long-term dependencies in price data, making them highly understanding long-term data dependencies, achieving effective for direct price forecasting. However, they fall short significantly lower MAE scores compared to other models. of directly analyzing the impact of supply chain factors', '. companies manifest diverse movement patterns within the AddingGRUasadecoderallowstheTransformerEncoderto stockmarketandprovideasufficientdatasetsuitablefordeep learn sequential patterns and outperform other Transformer learningmethodologies,whichnecessitateextensivedatasets', 'Technology Informatics Technology Informatics Technology Institut Teknologi Sepuluh Nopember Institut Teknologi Sepuluh Nopember Institut Teknologi Sepuluh Nopember Surabaya, Indonesia Surabaya, Indonesia Surabaya, Indonesia haznaatthoriqoh@gmail.com siti@if.its.ac.id chastine@if.its.ac.id Muhamma d Alfian Department of Informatics Faculty of Intelligent Electrical and Informatics Technology Institut Teknologi Sepuluh Nopember Surabaya, Indonesia ini.muhalfian@gmail.com Abstract— A recommendation model is', '. EG04 DSS05.03 ACT05 Company [11] Y. Setiawan, K. Sungkono, and R. Sarno, “A new similarity EG04 DSS05.07 ACT03 EG04 MEA01.01 ACT05 methodbasedonweightedgraphmodelsformatchingparallel ITHealthcareCompany EG04 MEA01.02 ACT01 businessprocessmodels,”InternationalJournalofIntelligent EG04 MEA01.03 ACT04 Engineering and Systems, vol. 13, no. 5, pp. 267–276, 2020. DOI: 10.22266/ijies2020.1031.24. [12] K. N. Aisyah, K. R. Sungkono, and R. Sarno, “A new similarity method based on weighted-linear temporal logic VI', '. Sheoraj and R. K. Sungkur, “Using AI to develop a framework to Application in Information and Telecommunication Systems prevent employees from missing project deadlines in software projects (WECONF), IEEE, May 2023, pp. 1–4. doi: - case study of a global human capital management (HCM) software 10.1109/WECONF57201.2023.10148004. company,” Advances in Engineering Software, vol. 170, p. 103143, [29] L. Santos and L. Ferreira, “Atlantic—Automated Data Preprocessing 2022, doi: 10.1016/j.advengsoft.2022.103143', '. Haakman, L. Cruz, H. Huijgens, and A. van Deursen, “AI lifecycle Application,” in 2022 10th International Conference on Information models need to be revised,” Empirical Software Engineering, vol. 26, Systems and Computing Technology (ISCTech), IEEE, Dec. 2022, pp. no. 5, p. 95, 2021, doi: 10.1007/s10664-021-09993-1. 259–263. doi: 10.1109/ISCTech58360.2022.00048. [13] Y. Luo and S. Yu, “AILC: Accelerate On-Chip Incremental Learning [31] S. M. A. Suliman and G', '. They identified areas for improvement and which uses a weighted graph approach to measure similarprovided recommendations to enhance IT governance, emities in parallel business process models by considering the phasizing effectiveness of COBIT 2019 in managing IT risks. frequency of activity relationships. This method outperforms Thesestudieshighlightthebenefitsofframeworkinimproving traditional approaches like GMA, WGED, WNARS, TPED, IT governance in educational institutions. and Cosine-TDP', '. R. Sungkono, E. O. Putri, H. Azkiyah, and R. Sarno, “Checking is also necessary to develop predictive models using machine Wrong Decision and Wrong Pattern by Using A Graph-based Method,” learning to anticipate cases that will not comply with the SOP in 2021 13th International Conference on Information & Authorized licensed use limited to: Institut Teknologi Sepuluh Nopember. Downloaded on July 14,2025 at 08:18:28 UTC from IEEE Xplore. Restrictions apply.']","The methodology for developing a recommendation system integrates data collection and preprocessing, comparing company-specific goals to enterprise goals using TF-IDF and cosine similarity (Setiawan et al., 2020).","IX, it can serve as an internal reference for the company to assess its capability to meet these criteria and can also serve as a reference for formulating policies to prioritize the implementation of these activities in the future. V. CONCLUSION V. CONCLUSION In conclusion, the developed Activity Recommendation System based on COBIT 2019 framework offers a practical solution to the challenges faced by auditors in identifying and aligning activities with company strategy. By leveraging NLP techniques and graph queries, the system efficiently matches user input of company strategy with relevant activities automatically, eliminating the need for manual navigation through COBIT 2019 guidelines. The effectiveness of the system was demonstrated by in- putting company strategies from three companies in different",0.6666666666666666,0.9164073249996029
"used as references for the next graph query execution to obtain the required activities. The output matches the mapping results, displaying only activities that correlate with Enterprise Goal EG02, which describes ”Optimization of business process functionality.” Using Algorithm 3, a graphical representation is created, as Fig. 3. Mapping Alignment Goals (AG) Fig. 4. Mapping Objectives illustrated in Figure 5. This graphical representation allows users to easily visualize the need for additional activity recommendations without documentation such as spreadsheets, thereby reducing the need for extra work. V. CONCLUSION V. CONCLUSION This paper propose a novel recommendation system for internal business processes based on the COBIT 2019 frame- work. By integrating graph algorithms and similarity methods, our approach provides tailored activity recommendations","['. They identified areas for improvement and which uses a weighted graph approach to measure similarprovided recommendations to enhance IT governance, emities in parallel business process models by considering the phasizing effectiveness of COBIT 2019 in managing IT risks. frequency of activity relationships. This method outperforms Thesestudieshighlightthebenefitsofframeworkinimproving traditional approaches like GMA, WGED, WNARS, TPED, IT governance in educational institutions. and Cosine-TDP', '. ACKNOWLEDGEMENT tree and weighted directed acyclic graph for graph-based This research was funded by Institut Teknologi Sepuluh businessprocessmodels,”InternationalJournalofIntelligent Nopember (ITS) under Penelitian Dana Departemen Program, Engineering and Systems, vol. 13, no. 5, pp. 356–367, 2020. Penelitian Keilmuan, Penelitian Flagship, Penelitian Kolab- DOI: 10.22266/ijies2020.1031.32. [13] M', '. The system provided a list of recommended activities objective.Mostofthegoals(EG03,EG04)shownoalignment that can be undertaken to achieve strategic objectives of each (similarity score of 0), suggesting that these goals do not companies. contribute to or are unrelated to risk reduction', '. TABLE I provides a detailed not always be clean or well-structured [9]. Moreover, it offers overview of the activities and performance indicators insightful diagnostics about the process flow, helping to associated with the DSS01.01 domain of managed operations. identify bottlenecks and inefficiencies that other algorithms might overlook[16]. B. Process Mining Process mining involves deriving business processes from III', '. It is like building a map of knowledge, case study from 3 different companies as input, followed by a preprocessing step, then compares it to Enterprise Goals using whereeachpieceofinformationisapointconnectedtoothers TF-IDF and cosine similarity. Goals with high similarity scores by lines that show how they are linked [2]. trigger a graph query to reveal connected activities', "". 1–5. doi: 10.1109/eSmarTA59349.2023.10293688. significant inefficiencies within the hospital's billing system, [8] C. Stephanie and R. Sarno, “Detecting Business Process Anomaly Using Graph Similarity Based on Dice Coefficient, Vertex Ranking pinpointing several critical bottlenecks that can be targeted and Spearman Method,” in 2018 International Seminar on Application for process improvements"", 'but also supports the generation of outputs that meet inefficiencies in the process', '. The results show a list of recommended activities based on the company In previous research, as found in the paper [3], [4], [5] strategy, this can simplify the company audit process. and [6] to obtain Activities from the COBIT Core Model Keywords—Audit Management, COBIT 2019, Cosine Similar- and Capability Scores, it is necessary to undergo a mapping ity, Financial, Knowledge Graph, Neo4J process according to the instructions in the COBIT 2019 manual. This can be time-consuming, especially when auditor I', '. Business process governance and potential bottleneck activities. control were evaluated using the COBIT 2019 methodology. The findings indicated that out of 30,000 case IDs, the majority Audit with surveys is an effective method for gathering activity sequence pattern that conformed to the SOP was found essential information to evaluate a process or system [11]. in 97.55% of cases', "". in the time required to complete specific activities, indicating 3) The Most Common Variants potential areas for process optimization. Specifically, the FIN The process model for the most occurring variant of the → RELEASE activity demonstrates very high efficiency, with cases in the dataset shown in Fig. 4. It starts with a 'NEW' 99% of cases resolved within two days, indicating that the state, progresses through a 'CHANGE DIAGN' stage where transition from completion to release is highly efficient""]","The proposed recommendation system identifies activities that align with specific enterprise goals, demonstrating the effectiveness of tailored recommendations in optimizing business processes (Referensi 5).","research introduces a novel Activity Recom- mendation System built on the COBIT 2019 framework tailored for Financial Balance Scorecard. The motivation stems from the challenges faced by auditors when identifying essential activities aligned with strategy of a company, often hindered by manual COBIT 2019 guideline navigation. To address this, a system was developed, where inputting the company strategy, triggers the display of recommended activities automatically. The methodology involved creating interconnected nodes from COBIT 2019 Element in Neo4J. This research uses a real strategy plan case study from 3 different companies as input, followed by a preprocessing step, then compares it to Enterprise Goals using TF-IDF and cosine similarity. Goals with high similarity scores trigger a graph query to reveal connected",0.3333333333333333,0.8783393425814374
"the need for extra work. V. CONCLUSION V. CONCLUSION This paper propose a novel recommendation system for internal business processes based on the COBIT 2019 frame- work. By integrating graph algorithms and similarity methods, our approach provides tailored activity recommendations that align with an organization’s strategic goals. We mapped enter- prise goals to management objectives, identified relevant ac- tivities, and used graph queries to retrieve actionable insights. Utilizing Cypher Query Language (CQL) and Neo4j’s graph database, we created an interactive graphical representation of COBIT 2019-governed processes. This allows organizations to visualize relationships between COBIT elements, facilitating deeper analysis, real-time monitoring, and informed IT man- agement decisions. Our results demonstrated the system’s effectiveness in sug- gesting activities tailored to enterprise goals,","['. They identified areas for improvement and which uses a weighted graph approach to measure similarprovided recommendations to enhance IT governance, emities in parallel business process models by considering the phasizing effectiveness of COBIT 2019 in managing IT risks. frequency of activity relationships. This method outperforms Thesestudieshighlightthebenefitsofframeworkinimproving traditional approaches like GMA, WGED, WNARS, TPED, IT governance in educational institutions. and Cosine-TDP', '. The results show a list of recommended activities based on the company In previous research, as found in the paper [3], [4], [5] strategy, this can simplify the company audit process. and [6] to obtain Activities from the COBIT Core Model Keywords—Audit Management, COBIT 2019, Cosine Similar- and Capability Scores, it is necessary to undergo a mapping ity, Financial, Knowledge Graph, Neo4J process according to the instructions in the COBIT 2019 manual. This can be time-consuming, especially when auditor I', '. It is like building a map of knowledge, case study from 3 different companies as input, followed by a preprocessing step, then compares it to Enterprise Goals using whereeachpieceofinformationisapointconnectedtoothers TF-IDF and cosine similarity. Goals with high similarity scores by lines that show how they are linked [2]. trigger a graph query to reveal connected activities', '. I. Fianty and M. Brian, “Leveraging COBIT 2019 Framework to 10.1080/00949655.2012.658804. Implement IT Governance in Business Process Outsourcing [35] T. M. Oshiro, P. S. Perez, and J. A. Baranauskas, “How Many Trees in Company,” Journal of Information Systems and Informatics, vol. 5, no. a Random Forest?”, In Machine Learning and Data Mining in Pattern 2, pp. 568–579, May 2023, doi: 10.51519/journalisi.v5i2.492. Recognition: 8th International Conference, MLDM 2012, Berlin, [18] S. Dhir, D. Kumar, and V', '. Recommendations based on COBIT 2019 best practices, such as performance measurements and knowledge repository access, further enhance IT governance processes and contribute to the success of software development projects. The integration of AI and machine learning techniques with the COBIT 2019 framework holds promise in further enhancing IT governance practices [19]', '. COBIT 2019 offers an COBIT 2019 for DSS01 Objective, particularly as a method effective methodology for evaluating the capability of of collecting and validating data within the process assessment information technology processes, specifically focusing on program. Experiments are conducted by analyzing Deliver, Service and Support (DSS01) - Operation performance and identifying bottlenecks in event logs related Management', '. Using COBIT metrics, organizations XGBoost 4.29 6.34 0.69 40.45 can evaluate and improve the quality of IT Governance, LightGBM 4.74 7.53 0.56 45.14 ensure compliance with regulatory provisions, and improve CatBoost 4.25 6.53 0.67 36.26 operational efficiency. As a result, these initiatives not only are presented in Table IV using MAE, RMSE, R², and MAPE improve the efficiency of project planning and execution but me trics', '. TABLE I provides a detailed not always be clean or well-structured [9]. Moreover, it offers overview of the activities and performance indicators insightful diagnostics about the process flow, helping to associated with the DSS01.01 domain of managed operations. identify bottlenecks and inefficiencies that other algorithms might overlook[16]. B. Process Mining Process mining involves deriving business processes from III', '. DOI: 10.15276/aait.06.2023.22. post-erp implementation (enterprise resource planning) at pt [19] D. Munkova´, M. Munk, and M. Voza´r, “Influence of stopxyz,” KEUNIS, vol. 11, no. 2, p. 188, Jul. 2023. DOI: 10. wordsremovalonsequencepatternsidentificationwithincom32497/keunis.v11i2.4358. parable corpora,” in ICT Innovations 2013, 2014, pp. 67–76. [6] S. D. Putra, H. Herman, and A. Yudhana, “Audit tata kelola DOI: 10.1007/978-3-319-01466-1 6. academic information system menggunakan framework co- [20] S', '. The system provided a list of recommended activities objective.Mostofthegoals(EG03,EG04)shownoalignment that can be undertaken to achieve strategic objectives of each (similarity score of 0), suggesting that these goals do not companies. contribute to or are unrelated to risk reduction']","The proposed system enhances IT governance by providing tailored recommendations based on a weighted graph approach that measures similarities in business process models, aligning with COBIT 2019's effectiveness in managing IT risks.","research introduces a novel Activity Recom- mendation System built on the COBIT 2019 framework tailored for Financial Balance Scorecard. The motivation stems from the challenges faced by auditors when identifying essential activities aligned with strategy of a company, often hindered by manual COBIT 2019 guideline navigation. To address this, a system was developed, where inputting the company strategy, triggers the display of recommended activities automatically. The methodology involved creating interconnected nodes from COBIT 2019 Element in Neo4J. This research uses a real strategy plan case study from 3 different companies as input, followed by a preprocessing step, then compares it to Enterprise Goals using TF-IDF and cosine similarity. Goals with high similarity scores trigger a graph query to reveal connected",0.6,0.8923419460702718
"graphical representation of COBIT 2019-governed processes. This allows organizations to visualize relationships between COBIT elements, facilitating deeper analysis, real-time monitoring, and informed IT man- agement decisions. Our results demonstrated the system’s effectiveness in sug- gesting activities tailored to enterprise goals, enhancing IT management practices and operational efficiency. The Neo4j visualization tool offers a user-friendly interface for explor- ing COBIT framework relationships, enabling stakeholders to make data-driven decisions. TABLE III SIMILARITY SCORE Enterprise Goal (EG) Optimization of business process functionality Optimization of business process costs Staff skills, motivation and productivity Compliance with internal policies Similarity 0.5701785 0.29179826 0.02301607 0.029643951 M. M. Jawad, M. H. Ali, A. A. Khaleel, and M. F. Hasan, “Evaluating the performance of it management under the implementation","['. COBIT 2019 offers an COBIT 2019 for DSS01 Objective, particularly as a method effective methodology for evaluating the capability of of collecting and validating data within the process assessment information technology processes, specifically focusing on program. Experiments are conducted by analyzing Deliver, Service and Support (DSS01) - Operation performance and identifying bottlenecks in event logs related Management', '. They identified areas for improvement and which uses a weighted graph approach to measure similarprovided recommendations to enhance IT governance, emities in parallel business process models by considering the phasizing effectiveness of COBIT 2019 in managing IT risks. frequency of activity relationships. This method outperforms Thesestudieshighlightthebenefitsofframeworkinimproving traditional approaches like GMA, WGED, WNARS, TPED, IT governance in educational institutions. and Cosine-TDP', '. Using COBIT metrics, organizations XGBoost 4.29 6.34 0.69 40.45 can evaluate and improve the quality of IT Governance, LightGBM 4.74 7.53 0.56 45.14 ensure compliance with regulatory provisions, and improve CatBoost 4.25 6.53 0.67 36.26 operational efficiency. As a result, these initiatives not only are presented in Table IV using MAE, RMSE, R², and MAPE improve the efficiency of project planning and execution but me trics', '. EVALUATION METRICS contract. Models MAE RMSE R2 MAPE In the field of IT governance, the combination of machine Linear Regression 4.32 6.01 0.72 40.20 learning methodologies with COBIT 2019 analytics provides Decision Tree 7.33 10.29 0.18 64.64 a robust framework to ensure that the IT management Random Forest 5.13 8.11 0.49 43.10 Gradient Boosting 4.67 7.11 0.61 41.79 methodology is consistent with global measurements and SVM 5.95 10.29 0.18 38.57 optimum methodology', '. These procedures ensure that each claim is managed Fluxicon, aimed at helping organizations visualize, analyze, consistently, efficiently, and in compliance with regulatory and improve the efficiency of their business processes [18]. requirements', '. The second cluster in the Niche Themes quadrant is the gray cluster which contains the themes of data mining, big data, business performance, data visualization, decision trees, open datum, business, objectives, current performance, key performance indicator systems, and massive open online courses. There are two clusters in the motor themes quadrant, Fig. 4. Bibliographic coupling analysis namely the blue cluster and the purple cluster', '. Create Graph Database ACT01 ternal and external environmental factors (legal, regula- After the completion of the Mapping process, the next step tory and contractual obligais to create nodes and their relationships using Neo4J Graph tions) and trends in the businessenvironmentthatmayin- DatabaseTools,inordertoconstructaKnowledgeGraphfrom fluencegovernancedesign the mapped results', '. The results show a list of recommended activities based on the company In previous research, as found in the paper [3], [4], [5] strategy, this can simplify the company audit process. and [6] to obtain Activities from the COBIT Core Model Keywords—Audit Management, COBIT 2019, Cosine Similar- and Capability Scores, it is necessary to undergo a mapping ity, Financial, Knowledge Graph, Neo4J process according to the instructions in the COBIT 2019 manual. This can be time-consuming, especially when auditor I', '. 1. Prism flow diagram economics, economic and social effects, internet, marketing, and social media are interconnected, with a business digitalization object theme. The commerce keyword, which appears 14 times and is linked 42 times, has the highest frequency. According to co-occurrence analysis, the article on digital business performance measurement encompasses studies on digital change and related performance measurement discussions and objects', '. Graça and L. M. Camarinha-Matos, “Performance be tailored to the specific needs of the organization, allowing indicators for collaborative business ecosystems — researchers to adjust key performance indicators (KPIs) Literature review and trends,” Technological Forecasting according to their specific goals and strategies. Among the and Social Change, vol. 116, pp. 237–255, 2017, doi: four commonly used models, most previous studies have used 10.1016/j.techfore.2016.10.012. [9] A']",The use of a weighted graph approach to measure similarities in business process models enhances the effectiveness of COBIT 2019 in managing IT governance and risks (Jawad et al.).,"COBIT Core Model and Capability Scores, it is necessary to undergo a mapping process according to the instructions in the COBIT 2019 manual. This can be time-consuming, especially when auditor should auditing multiple companies simultaneously. This research aim to simplify the process to get Activities of COBIT 2019 automatically from Input Text Company Strategy that aligned with the description of related Enterprise Goals. This research adopts Neo4j, a graph database platform, to manage KG and process data related to these objectives, to gain deeper and more applicable insights into the relationships between strategic and operational objectives in a company . Furthermore, this research also involves the function of preprocessing the input text in the form of Company Strat- egy using",0.0,0.9374931823359429
"(TP+FP). To determine how well a positive value is found, recall is employed. It applies true positives (TP) to all ground truth values, which include both true positives and false negatives (FN). The F1 score is an evaluation metric that combines a model’s precision and recall scores, as illustrated in the equation that calculates accuracy. The accuracy statistic computes the number of times the iYOLOV7-TPE-SS model predicted accurately throughout the entire dataset , : F1score = 2 · (P · R) (P + R) (13) The system performance of the iYOLOV7-TPE-SS model has been evaluated using a metric known as mean average accuracy (mAP), which takes into account the average recall (AR), F1-score, and inference time. The inference time has","['. This study chose to adopt EfficientNetV2-S, the baseline architecture from this family, due to computational resource reasons to construct a smaller model while still maintaining model performance. The EfficientNetV1 family is the backbone of the EfficientDet family, which has achieved state-of-the-art results on object detection challenges. C. Model Evaluation Evaluation Metrics used in this study to evaluate model performance are precision, recall, and F1 Score', '. PRECISION, RECALL, AND F1 SCORE (IOU @ 50) FOR EACH CLASS Backbone Metrics Healthy Mismngd Smallish Yellowish Dead Average Precision 0.970 0.635 0.871 0.498 0.376 0.670 MobileNetV3-Large Recall 0.987 0.695 0.924 0.886 0.770 0.852 F1 Score 0.978 0.663 0.897 0.637 0.505 0.736 Precision 0.985 0.865 0.929 0.894 0.662 0.867 EfficientNetV2-S Recall 0.968 0.474 0.781 0.859 0.770 0.770 F1 Score 0.977 0.612 0.849 0.876 0.712 0.805 various confidence thresholds and object classes', '. 𝐼𝑜𝑈= 𝐴𝑟𝑒𝑎 𝑜𝑓 𝑂𝑣𝑒𝑟𝑙𝑎𝑝 (4) MobileNetV3 and EfficientNetV2 prioritize efficiency and 𝐴𝑟𝑒𝑎 𝑜𝑓 𝑈𝑛𝑖𝑜𝑛 accuracy, but they achieve this through different The metric mean Average Precision (mAP) is architectural choices. MobileNetV3 enhances the previous introduced in COCO dataset evaluation metrics and is version with squeeze-and-excitation layers and h-swish widely used in object detection studies as a benchmark for non-linearity [18], while EfficientNetV2 focuses on evaluating and comparing model performance', '. The mAP efficient scaling [19]. provides a comprehensive evaluation of the object detection model. mAP considers precision and recall values across Authorized licensed use limited to: Institut Teknologi Sepuluh Nopember. Downloaded on July 14,2025 at 08:18:27 UTC from IEEE Xplore. Restrictions apply.', '. Each metric serves a distinct purpose, making it essential for researchers to select appropriate metrics for accurate interpretation of model performance. Generally, thesemetricsarebasedonfourbasiccomponents: • True Positives (TP): Refers to the number of correctly identifiedobjectsbythemodel. • TrueNegatives(TN):Referstothenumberofinstances where the model correctly identified the absence of objects. • FalsePositives(FP):Referstothenumberoferroneous detectionsofnon-existentobjectsbythemodel', 'ity, ultimately improving detection results', '. rapid and accurate detection is essential. For example, Fatichahetal.[14]evaluatedtheperformanceofthreepopulardetectionmethods:YouOnlyLookOncev4(YOLOv4), YouOnlyLookOncev5(YOLOv5),andMaskRegion-based ConvolutionalNeuralNetwork(MaskR-CNN)inclassifying ALLtypes.TheirfindingsshowedthatYOLOv4achievedthe highest mean Average Precision (mAP) at 93.2%, followed by YOLOv5 at 92.7% and Mask R-CNN at 81.9%', '. accuracy. This study used two architectures that suit that The TIDE toolbox [24] is used to compute the detection objective in its development, which are MobileNetV3 and error in object detection model performance for in-depth EfficientNetV2. The EfficientNetV2, especially the TABLE IV', '. In addition, wel also calculated F1 score for all object detectors, models in pickup, bus, and truck classes, while RT-DETR and the results are shown in Table 4', '. Table 6 showseachvehicleclassaverageprecisionresultsfromeach described counting results from various combination object best models. Result shows that YOLOv9-e outperforms all detection models and tracking algorithms in addition tothe 121730 VOLUME12,2024']","The evaluation metrics employed in this study include precision, recall, and F1 Score, which are essential for assessing model performance (Multi-class Oil Palm Trees Condition Detection from UAV Images using Faster R-CNN with EfficientNetV2).","with the following formula: TP + TN TP + TN + FP + FN Accuracy = Precision = Recall/True Positive Rate(TPR) TP TP + FP TP TP + FN F1 = 2 × precision × recall precision + recall FP TN + TP (cid:90) 1 TPRd(FPR) False Positive Rate(FPR) = AUC = (4) (5) (6) (7) (8) (9) where TP is the number of correctly predicted positive labels, TN is the number of correctly predicted negative labels, FP is the number of incorrectly predicted positive labels, and FN is the number of incorrectly predicted negative labels. Accuracy is the ratio of true predictions to the overall data. Precision is the ratio between TP to the total number of positive predic-",0.8,0.909241700597935
"The interesting aspect of the stock transaction dataset is that the standard deviation from TPIA and BRPT is larger than the mean, which means that two stock issuers have high volatility. 2) DATASET OF NEWS HEADLINES The news portal kontan.co.id in the Indonesian language is used as a source of the news dataset with news published dates between 1 January 2017 and 31 May 2024. The news dataset contains the title, description, published date, and category gathered using scraping technique under sections investment, industry, and finance. This research uses the news section in the news portal as an aspect category. The rule of collecting the dataset is the stock issuer ticker is shown explicitly in the news title to distinguish","['. stock market data has a skewed pattern and the usual MSAR Regular tests conducted to gain deeper insights into each 979-8-3315-0510-3/24/$31.00 ©2024 IEEE 274 59832801.4202.21936EEVCI/9011.01 :IOD | EEEI 4202© 00.13$/42/3-0150-5133-8-979 | )EEVCI( gnireenignE lacirtcelE dna noitacudE lanoitacoV no ecnerefnoC lanoitanretnI htneveS 4202 Authorized licensed use limited to: Institut Teknologi Sepuluh Nopember. Downloaded on July 14,2025 at 08:17:35 UTC from IEEE Xplore. Restrictions apply.', '. The process of G is shown in Equations contains the transaction date, open, low, high, close price, (1) and (2). and transaction volume (OLHCV) dataset [17]. The dataset uses 100 stock issuers from the IDX, selected randomly with X¯ =G(X˜,M,(1−M)⊙Z) (1) requirements that the minimum amount of data is 200, the Xˆ =M⊙X˜ +X¯ ⊙(1−M) (2) variance is zero and does not have missing values. Table I shows the statistics of the dataset used in this research', '. aspects, such as corporate, stock, market, and economy The sentiment analysis results in qualitative data cannot be news [5]. The multi-aspect sentiment news represents stock combined with technical indicators in quantitative data to market conditions better and analyzes aspects significantly forecaststockprices.Theprocessingofconvertingqualitative influencingstockpriceforecasting', '. DigitalObjectIdentifier10.1109/ACCESS.2023.3298445 Transformer-Gated Recurrent Unit Method for Predicting Stock Price Based on News Sentiments and Technical Indicators AGUSTRIHARYONO 1,2,RIYANARTOSARNO 1,(SeniorMember,IEEE), ANDKELLYROSSASUNGKONO 1,(Member,IEEE) 1DepartmentofInformatics,InstitutTeknologiSepuluhNopember,Surabaya60111,Indonesia 2DepartmentofInformatics,UniversitasMulawarman,Samarinda75119,Indonesia Correspondingauthor:RiyanartoSarno(riyanarto@if.its.ac.id)', '. The parameter used for stock forecasting varies significantly in AcMAPE score comparison confirms that news sentiment theselectedparameterscenario,indicateseachissuerrequires influencesstockpriceforecasting.TheCASfeaturescenario a fitted parameter to produce the best model performance', '. Zhou, Z. Ma, Q. Wen, X. Wang, L. Sun, and R. Jin, ‘‘FEDformer: layer to determine stock price. The TEGRU used various Frequencyenhanceddecomposedtransformerforlong-termseriesforeparameters to produce the best model performance, and casting,’’2022,arXiv:2201.12740. multi-aspect sentiment indicators affected the performance [16] J. Chen, T. Chen, M. Shen, Y. Shi, D. Wang, and X. Zhang, ‘‘Gated three-tower transformer for text-driven stock market prediction,’’ Mulforecasting model top gains issuers', '. ABSTRACT News sentiment can influence stock prices indirectly, in addition to the technical indicators already used to analyze stock prices', '. 5) MULTIVARIATEEXPANDTECHNICALANDASPECT SENTIMENTINDICATOR(ETS) Concatenate expanded technical indicator and news sentiment produced 78 features to forecasting close stock price in one day. Eq. (6) uses to make features with lower multicollinearity. The proposed model TEGRU and FEDformer equally outperformed on 4 of 8 stock issuers, asshowninTable11.TEGRUbestfittedonBBRI,TLKM, BMRI,andASII,whereasFEDformerbestfittedonBBCA, INDX, SMMT, and HITS', '. The evaluation methods are R2, RMSE, or 0. After determining trend classes in the ground truth MSE, and MAPE. The time lag variants are 5, 10, 20, and prediction, accuracy score calculation uses a confusion 100, and 200. The first feature scenario is univariate data: matrixwithvariablesTruePositive(TP),FalsePositive(FP), the close stock price yesterday to predict the close price TrueNegative(TN),andFalseNegative(FN).Eq.(11)isused tomorrow', '. Industry, international, imbalancedtimeseriesforecasting,’’NeuralComput.Appl.,vol.34,no.9, investment, finance, and national sentiment can influence pp.6953–6972,May2022,doi:10.1007/s00521-021-06837-3. [9] P.-F.PaiandC.-S.Lin,‘‘AhybridARIMAandsupportvectormachines stock issuers. The positive and negative sentiment with modelinstockpriceforecasting,’’Omega,vol.33,no.6,pp.497–505, a mostly minimum daily score is selected to increase Dec.2005,doi:10.1016/j.omega.2004.07.024. performancestockforecasting']","News sentiment can influence stock prices indirectly, in addition to the technical indicators already used to analyze stock prices (Agustriharyono et al., 2023).","DATASET A. DATASET This sub-section explains the collection, labeling, and prepa- ration of the dataset used in this research. The dataset consists of time series and text; each is prepared independently. 1) DATASET OF NEWS HEADLINES The text dataset used in this work was gathered from the Indonesian news portal at kontan.co.id under the categories investment, finance, industry, national, and international. The scraping technique collects data between 1 January 2017 to 31 March 2022 and produces a title, URL, description, postdate, category, and subcategory. Statistics from collected data are shown in Table 1. To evaluate performance prediction, task classification in text requires ground truth. The dataset already has ground truth for aspect categorization, but sentiment classification does not have the",0.75,0.9067556377596538
"titles on each stock issuer based on aspect category. available in English. The trained model siebert/sentiment- roberta-large-english is a binary sentiment classification with an accuracy of 93.2% and is used to determine sentiment polarity, negative and positive. The news dataset contains news published date, aspect category, sentiment polarity, stock ticker, and news title. FIGURE 3. Framework of labeling aspect-sentiment quadruplet. The pair aspect category-sentiment polarity with news trained using various pre-trained models titles was such as indobert-large-p2 , mxbai-embed-large-v1 , multilingual-e5-large , distiluse-base-multilingual- to develop cased-v2 , and bge-base-en-v1.5 VOLUME 12, 2024 178677 A. T. Haryono et al.: pTKANs for Stock Price Forecasting Using Generative ABSA aspect categorization and sentiment classification models. The indobert-large-p2 model is specifically designed for Indonesians,","['. Zhou, Z. Ma, Q. Wen, X. Wang, L. Sun, and R. Jin, ‘‘FEDformer: layer to determine stock price. The TEGRU used various Frequencyenhanceddecomposedtransformerforlong-termseriesforeparameters to produce the best model performance, and casting,’’2022,arXiv:2201.12740. multi-aspect sentiment indicators affected the performance [16] J. Chen, T. Chen, M. Shen, Y. Shi, D. Wang, and X. Zhang, ‘‘Gated three-tower transformer for text-driven stock market prediction,’’ Mulforecasting model top gains issuers', '. [5] A. T. Haryono, R. Sarno, and R. Abdullah, ‘‘Aspect-based sentiment FIGURE10. ThefeatureforecastingcorrelationofTLKMstockissuer. analysisoffinancialheadlinesandmicroblogsusingsemanticsimilarity and bidirectional long short-term memory,’’ Int. J. Intell. Eng. Syst., vol.15,no.3,pp.233–241,2022.[Online].Available:https://inass.org/wpcontent/uploads/2021/12/2022063020-2.pdf failed stock trend prediction caused a financial loss in the [6] S. Budd, E. C. Robinson, and B. Kainz, ‘‘A survey on active MAEscore', '. Sentiment classifica- resolve stock forecasting tasks. The hybrid model, which tion has been used to accomplish dataset political [21], uses CNN to extract sentiment polarity and combines review[22],hatespeech[23],andfinancial[24].Inpolitical technical indicators to build an LSTM forecasting model, datasets,sentimentclassificationisresolvedusingalexicon producedgoodresultswhenforecastingtheShanghaiStock list sentiment. The appearance of the word lexicon in the Exchange[29]', '. The fourth feature scenario MAPE= 100X n | A t −P t| (12) uses a combination of close stock price and daily aspect n i=1 A t sentimentscoretotestinfluencingaspectsentimentonstock The combined accuracy error score and MAPE equation priceforecastingperformance.Thefifthfeaturescenariouses produced the accuracy mean absolute percentage error a variety of expanded technical indicators and daily aspect (AcMAPE), as shown in Eq. (13)', '. aspects, such as corporate, stock, market, and economy The sentiment analysis results in qualitative data cannot be news [5]. The multi-aspect sentiment news represents stock combined with technical indicators in quantitative data to market conditions better and analyzes aspects significantly forecaststockprices.Theprocessingofconvertingqualitative influencingstockpriceforecasting', '. 5) MULTIVARIATEEXPANDTECHNICALANDASPECT SENTIMENTINDICATOR(ETS) Concatenate expanded technical indicator and news sentiment produced 78 features to forecasting close stock price in one day. Eq. (6) uses to make features with lower multicollinearity. The proposed model TEGRU and FEDformer equally outperformed on 4 of 8 stock issuers, asshowninTable11.TEGRUbestfittedonBBRI,TLKM, BMRI,andASII,whereasFEDformerbestfittedonBBCA, INDX, SMMT, and HITS', '. In previous research, the CNN-BiLSTM combined withgoodperformance.Fine-tunedfromtheRoBERTa-large layerwasusedtobuildastockpriceforecastingmodel,with model [30], siebert/sentiment-roberta-large-english had an the CNN layer processing raw input through an extraction outstanding performance on text classification after being feature,whichwasthenpassedtotheBiLSTMlayertolearn tested on 15 data sets [31]. IndoBERT is an Indonesian predicted stock prices [26]', '. The Transformer architecture became model to produce a multi-aspect sentiment indicator a breakthrough in the deep learning method because the with time sequence data consideration to describe Transformerhadamulti-headattentionlayertolearnapattern detailedstockmarketconditions. of data input and an encoder-decoder section with different 2) The Transformer Encoder Gated Recurrent Unit input layers to resolve transformation data tasks [12]', '. becausethesplitclassificationmodelfocusesmoreonsmall classes than the aspect-sentiment model, which contains B. STOCKPRICESFORECASTING largerclassesamount. Stock forecasting performance evaluation employed RMSE Activelearningbuildsintoresolvingtwotasks:aspectcatandMAPE.Thecomparisonperformanceoneachforecasting egorizationandsentimentclassificationusingthepre-trained model operates the average score RMSE and MAPE with model indobenchmark/indobert-base-p2', '. DigitalObjectIdentifier10.1109/ACCESS.2023.3298445 Transformer-Gated Recurrent Unit Method for Predicting Stock Price Based on News Sentiments and Technical Indicators AGUSTRIHARYONO 1,2,RIYANARTOSARNO 1,(SeniorMember,IEEE), ANDKELLYROSSASUNGKONO 1,(Member,IEEE) 1DepartmentofInformatics,InstitutTeknologiSepuluhNopember,Surabaya60111,Indonesia 2DepartmentofInformatics,UniversitasMulawarman,Samarinda75119,Indonesia Correspondingauthor:RiyanartoSarno(riyanarto@if.its.ac.id)']","The CNN layer processes raw input through an extraction feature, which is then passed to the BiLSTM layer to learn predicted stock prices (Haryono et al., 2023).","learning with VOLUME 11, 2023 77135 A. T. Haryono et al.: Transformer-Gated Recurrent Unit Method for Predicting Stock Price TABLE 1. Statistic dataset of headline news. TABLE 2. Example headlines news on each category and sentiment. FIGURE 2. The method of Indonesian headline news dataset sentiment labeling. an English language-trained model. The labeling method is shown in Fig. 2. The cleaned news title will be translated from Indonesian to English using a translator application. The resulting translated news title will be passed into the sentiment label- ing using a trained model siebert/sentiment-roberta-large- english. The label sentiment complements the ground truth of the headline news dataset. A trained model siebert/sentiment- roberta-large-english has an accuracy of 93.2% in a binary sentiment classification",0.75,0.8727079819288212
"using the mean sentiment score on each day trading, if not found, filled with zero value. The daily stock issuer sentiment score can be combined with stock transaction history. The illustration of the final dataset in the form of panel data is shown in Table. 2. D. FORECASTING MODELS D. FORECASTING MODELS This sub-section presents modified Transformer architec- ture, which are Transformer GRU (FormerGRU), Trans- former LSTM (FormerLSTM), Transformer Encoder GRU (TEGRU), and Transformer Encoder LSTM (TELSTM). Modified Transformer was chosen because TEGRU outper- formed other Transformer variants, such as vanilla Trans- former, Informer, FEDformer, and Transformer Encoder in stock price forecasting . This research proposes permuted Temporal Kolmogorov-Arnold Networks (pTKAN) architec- ture to develop a unified stock forecasting model","['. DigitalObjectIdentifier10.1109/ACCESS.2023.3298445 Transformer-Gated Recurrent Unit Method for Predicting Stock Price Based on News Sentiments and Technical Indicators AGUSTRIHARYONO 1,2,RIYANARTOSARNO 1,(SeniorMember,IEEE), ANDKELLYROSSASUNGKONO 1,(Member,IEEE) 1DepartmentofInformatics,InstitutTeknologiSepuluhNopember,Surabaya60111,Indonesia 2DepartmentofInformatics,UniversitasMulawarman,Samarinda75119,Indonesia Correspondingauthor:RiyanartoSarno(riyanarto@if.its.ac.id)', '. In previous research, the CNN-BiLSTM combined withgoodperformance.Fine-tunedfromtheRoBERTa-large layerwasusedtobuildastockpriceforecastingmodel,with model [30], siebert/sentiment-roberta-large-english had an the CNN layer processing raw input through an extraction outstanding performance on text classification after being feature,whichwasthenpassedtotheBiLSTMlayertolearn tested on 15 data sets [31]. IndoBERT is an Indonesian predicted stock prices [26]', 'by stock price forecasting using the proposed Transformer Encoder Gated Recurrent Unit (TEGRU)architecture.TheTEGRUconsistsofatransformerencodertolearnpatterntimeseriesdatawith multi-headattentionandpassitintotheGRUlayertodeterminestockprice.Theaccuracymeanabsolute percentageerror(AcMAPE)usestoevaluateforecastingmodelssensitivetothemisclassificationofstock pricetrends.Ourexperimentshowedthatthesentimentindicatorcouldinfluencestockissuersbasedonthe', '. ding, and one Transformer to learn daily social text with 4) TheimpactoftheTEGRUfeatureparameteronstock Bidirectional Encoder Representations from Transformers priceforecastingisanalyzedtoproducealowfinancial (BERT) sentence embedding [16]. The Recurrent Neural riskmodelforeachstockissuer. Network (RNN) architecture has an excellent reputation for The rest of the article is organized as follows: Section II stock forecasting [17], [18]', '. Zhou, Z. Ma, Q. Wen, X. Wang, L. Sun, and R. Jin, ‘‘FEDformer: layer to determine stock price. The TEGRU used various Frequencyenhanceddecomposedtransformerforlong-termseriesforeparameters to produce the best model performance, and casting,’’2022,arXiv:2201.12740. multi-aspect sentiment indicators affected the performance [16] J. Chen, T. Chen, M. Shen, Y. Shi, D. Wang, and X. Zhang, ‘‘Gated three-tower transformer for text-driven stock market prediction,’’ Mulforecasting model top gains issuers', '. Haryono, R. Sarno, and K. Sungkono, “Stock price forecasting in Based on Deep Neural Networks Using LSTM Layer,” Journal of Indonesia stock exchange using deep learning: a comparative study,” Electrical Engineering & Technology, vol. 15, no. 4, pp. 1501–1509, International Journal of Electrical and Computer Engineering 2020, doi: 10.1007/s42835-020-00424-7. (IJECE), vol. 14, pp. 861–869, May 2024, doi: [22] L. Muflikhah, I. Cholissodin, N. Widodo, F. E. Hermanto, T. L. 10.11591/ijece.v14i1.pp861-869', '. Artif. Intell., [18] Z. Jin, Y. Yang, and Y. Liu, ‘‘Stock closing price prediction based on vol. 35, no. 12, May 2021, pp.11106–11115. [Online]. Available: sentimentanalysisandLSTM,’’NeuralComput.Appl.,vol.32,no.13, https://ojs.aaai.org/index.php/AAAI/article/view/17325 pp.9713–9729,Jul.2020,doi:10.1007/s00521-019-04504-2. [37] F. Koto, A. Rahimi, J. H. Lau, and T', '. He is a [29] N. Jing, Z. Wu, and H. Wang, ‘‘A hybrid model integrating deep ProfessorwiththeInformaticsDepartment,Instilearning with investor sentiment analysis for stock price predictut Teknologi Sepuluh Nopember (ITS). He has tion,’’ Exp. Syst. Appl., vol. 178, Sep. 2021, Art.no.115019, doi: 10.1016/j.eswa.2021.115019', '. forecasting. The Gated Three-Tower Transformer (GT3) is a developed 3) The Accuracy Mean Absolute Percentage Error Transformer architecture for stock market prediction using (AcMAPE) is an evaluation performance method on numerical and text input. Two Transformers are used to a forecasting model, which have sensitive to the learn numerical data, channel-wise and time-wise embedmisclassificationofstockpricetrends', '. A brief LSTM,andTransformerlayer[19].Ourresearchproposesa review of the literature on predicting stock prices based on combinationofTransformerandGRUarchitecture,inwhich featuresispresentedinthissection,followedbysomerelated theTransformerisalearnerofinputfeatures,andGRUisa worksontheactivelearningmethodandassociatedissuesof learnerofsequencedatatopredictstockprices.Theinputdata transformerarchitectureimplementedwithdatatimeseries']","The proposed Transformer Encoder Gated Recurrent Unit (TEGRU) architecture utilizes a transformer encoder to learn patterns in time series data and integrates it with a GRU layer for stock price determination (Haryono et al., 2023).","forecasting using Transformer Encoder Gated Recurrent Unit (TEGRU). The TEGRU can extract information with a multi-head attention layer and recognize pattern sequence data. The evaluation performance of the forecasting model uses Accuracy Mean Absolute Percentage Error (AcMAPE), which have sensitive to the misclassification of stock price trends. The significant contributions of this paper are summarized as follows. 1) The feature extraction method uses an active learning model to produce a multi-aspect sentiment indicator with time sequence data consideration to describe detailed stock market conditions. 2) The Transformer Encoder Gated Recurrent Unit (TEGRU) architecture, which consists of a Trans- former Encoder as extraction information and GRU as a recognized sequence data pattern, is used in stock price forecasting. 3) The Accuracy",0.8,0.911376469109217
"and radial velocity detection of targets is not discussed yet. The contribution of this paper is in the receiver processing of CC-OFDM-MIMO radar, which is different from those in other types of OFDM MIMO radars or other multi-TRM radars due to the nature of the orthogonal multi-beam generation with Golay-coded OFDM waveforms and subbands. There are previous research on radar waveform for ISAC purposes , which discussed about cyclic prefix (CP) based OFDM waveform and how the CP is very much defining the maximum unambiguous range of the radar system. CC-OFDM MIMO radar waveform design which is discussed in this paper is not a CP based radar, the transmitters are transmitting multiple orthogonal symbols in series without any guard time","['. The latter indicates that the CC OFDM MIMO radar can achieve a high resolution in angle, range, and velocity,withbeamisolationof−30dBforneighboringbeamsandco-channelbeams. INDEX TERMS Array signal processing, circulating-codes, Golay-codes, MIMO-radar, multi-beam, OFDM,software-defined-radar,sub-band,space-timecodes,surveillance. I', '(13) herein as the subarrayed MIMO (SMIMO) radars, such as theFPMIMOradar,rangesbetweentwoextremeconfiguraNotation ⊗ denotes the Kronecker product operator, tions, namely the PA and the MIMO radar', '. DigitalObjectIdentifier10.1109/ACCESS.2022.3175883 A Transmitter Design for the Multi-beam CC-OFDM Azimuth Scanning MIMO Radar DEVYKUSWIDIASTUTI 1,(StudentMember,IEEE),L.P.LIGTHART 2,(LifeFellow,IEEE), ANDGAMANTYOHENDRANTORO 1,(SeniorMember,IEEE) 1DepartmentofElectricalEngineering,InstitutTeknologiSepuluhNopember,Surabaya60111,Indonesia 2IRCTR,DelftUniversityofTechnology,2628CDDelft,TheNetherlands(Retired) Correspondingauthor:GamantyoHendrantoro(gamantyo@ee.its.ac.id)', '. INDEX TERMS MIMO radar, parameter estimation, phased array radar, probability of detection, target detection. I. INTRODUCTION for biomedical engineering, macro-scale radars on radioMulti-antenna radar systems have been known and used in astronomy, and so on [4], [5]', 'D.Kuswidiastutietal.:TransmitterDesignforMultibeamCC-OFDMAzimuthScanningMIMORadar theaforesaidproblemoflimitedtime-on-target.Multi-beam OFDM MIMO waveform [31]. A set of orthogonal waveradar technology is beneficial to various radar applications, formscanbesimplyacquiredbyarrangingtheallocationof suchassurveillance[3],[4],automotiveradar[5],[6],radar orthogonal subcarriers into different antennas of the MIMO imaging[7],[8],jointmultiusercommunicationandradar[9], radar system', '. By taking as an example the design of long-rangesurveillanceradar,thepaperdiscussesfurtherissuespertinenttotheimplementationoftheCC OFDM MIMO radar, including the beam squinting problem and its remedy, arrangement of the multiple beams, the radar system structure, use of Golay codes for orthogonalization and PAPR mitigation, use of software-definedradarthateliminatestheneedofamplitudeandphasecontrolineachtransmitter,transmit', '. [30] G. Hakobyan, M. Ulrich, and B. Yang, ‘‘OFDM-MIMO radar with L.P.LIGTHART(LifeFellow,IEEE)wasbornin optimized nonequidistant subcarrier interleaving,’’ IEEE Trans. TheNetherlands,inSeptember1946.Hereceived Aerosp. Electron. Syst., vol. 56, no. 1, pp.572–584, Feb. 2020, doi: 10.1109/TAES.2019.2920044. the degree (cum laude) in engineering and the [31] C.Knill,F.Embacher,B.Schweizer,S.Stephany,andC.Waldschmidt, Ph.D.degreefromtheDelftUniversityofTech‘‘Coded OFDM waveforms for MIMO radars,’’ IEEE Trans', '. With this advantage, PA radars ject [6]–[18]. Unlike the PA radar, the MIMO radar utilizes have been used for such applications as micro-scale radars manyantennasthattransmitorthogonalsignalstoobtainthe signal reflected from the target at the receiver, a scheme The associate editor coordinating the review of this manuscript and known as waveform diversity [9]. Consequently, MIMO approvingitforpublicationwasDimitrisE.Anagnostou', '. ified delay between successive antennas of a MIMO radar, Multiple simultaneous beams can be generated by employ- intended to produce correlated waveforms with the purpose ing a number of transceivers operating individually, each of acquiring better control over the beampattern. CC have attached to an antenna with a beam pointing at a specified been proposed for application in MIMO radars, originally direction, in total covering a specified angular range', '. However, one could extend the surveillance radar has been described to clarify the con- maximum unambiguous range of the radar by sendceptanddemonstratethepotentialissuesandadvantagesof ingmultiplesuccessiveorthogonalCC-OFDMsymbols the CC-OFDM MIMO radar']","The CC OFDM MIMO radar can achieve high resolution in angle, range, and velocity, with significant beam isolation, which supports the unique processing methods discussed in this paper.","MIMO radar, intended to produce correlated waveforms with the purpose of acquiring better control over the beampattern. CC have been proposed for application in MIMO radars, originally for optimizing low sidelobes in MIMO radars employing LFM waveforms , but only recently the CC has gained attention in terms of in-depth analysis of LFM waveform optimization . Later in this paper, it can be seen that CC ﬁnd a different role as a consequence of their combination with OFDM waveforms. In this paper, a novel concept of CC-OFDM MIMO† radar is proposed as a solution for the wide-scanning multi-beam radar, which is based on the following principles. Firstly, a train of OFDM pulses are transmitted on an array of transmit antennas",0.8,0.9489026872015527
"much defining the maximum unambiguous range of the radar system. CC-OFDM MIMO radar waveform design which is discussed in this paper is not a CP based radar, the transmitters are transmitting multiple orthogonal symbols in series without any guard time interval between the symbols. to each other, hence The symbol series are orthogonal VOLUME 13, 2025 109895 D. Kuswidiastuti et al.: Receiver Processing of the Multibeam Azimuth Scanning CC-OFDM-MIMO Radar receivers know how to distinguish the symbols received, and this could extend the maximum unambiguous range of the radar. The contributions of this paper are described as follow: 1) This paper describes the receiver processing of multi- beam CC-OFDM MIMO Radar which is designed for long-range radar surveillance application. The","['. The latter indicates that the CC OFDM MIMO radar can achieve a high resolution in angle, range, and velocity,withbeamisolationof−30dBforneighboringbeamsandco-channelbeams. INDEX TERMS Array signal processing, circulating-codes, Golay-codes, MIMO-radar, multi-beam, OFDM,software-defined-radar,sub-band,space-timecodes,surveillance. I', '(13) herein as the subarrayed MIMO (SMIMO) radars, such as theFPMIMOradar,rangesbetweentwoextremeconfiguraNotation ⊗ denotes the Kronecker product operator, tions, namely the PA and the MIMO radar', '. By taking as an example the design of long-rangesurveillanceradar,thepaperdiscussesfurtherissuespertinenttotheimplementationoftheCC OFDM MIMO radar, including the beam squinting problem and its remedy, arrangement of the multiple beams, the radar system structure, use of Golay codes for orthogonalization and PAPR mitigation, use of software-definedradarthateliminatestheneedofamplitudeandphasecontrolineachtransmitter,transmit', '. However, one could extend the surveillance radar has been described to clarify the con- maximum unambiguous range of the radar by sendceptanddemonstratethepotentialissuesandadvantagesof ingmultiplesuccessiveorthogonalCC-OFDMsymbols the CC-OFDM MIMO radar', '. INDEX TERMS MIMO radar, parameter estimation, phased array radar, probability of detection, target detection. I. INTRODUCTION for biomedical engineering, macro-scale radars on radioMulti-antenna radar systems have been known and used in astronomy, and so on [4], [5]', '. This strategy makes it possible for the radar system to have multiple and simultaneous beamformingtoprovideafull-timecoverage.Furthermore,thetransmissionofaseriesoforthogonalOFDM symbols in each beam enables the detection of long-range targets', '. In the works on the PMIMO radar in [22]–[29], The evaluation on the detection performance in terms of the improvement in radar performance factors such as theprobabilityofdetectionandtheprobabilityoffalsealarm spatial resolution, parameter identifiability, transmit-receive reportedhereinisanextensionofstudyby[32].Theseparam(T-R)gain,andsignal-to-interference-plus-noisepowerratio etersareevaluatedbasedonseveralaspectssuchastheeffect (SINR)hasbeenreported.Theresultsofinvestigationsin[29]', '. DigitalObjectIdentifier10.1109/ACCESS.2022.3175883 A Transmitter Design for the Multi-beam CC-OFDM Azimuth Scanning MIMO Radar DEVYKUSWIDIASTUTI 1,(StudentMember,IEEE),L.P.LIGTHART 2,(LifeFellow,IEEE), ANDGAMANTYOHENDRANTORO 1,(SeniorMember,IEEE) 1DepartmentofElectricalEngineering,InstitutTeknologiSepuluhNopember,Surabaya60111,Indonesia 2IRCTR,DelftUniversityofTechnology,2628CDDelft,TheNetherlands(Retired) Correspondingauthor:GamantyoHendrantoro(gamantyo@ee.its.ac.id)', '. [30] G. Hakobyan, M. Ulrich, and B. Yang, ‘‘OFDM-MIMO radar with L.P.LIGTHART(LifeFellow,IEEE)wasbornin optimized nonequidistant subcarrier interleaving,’’ IEEE Trans. TheNetherlands,inSeptember1946.Hereceived Aerosp. Electron. Syst., vol. 56, no. 1, pp.572–584, Feb. 2020, doi: 10.1109/TAES.2019.2920044. the degree (cum laude) in engineering and the [31] C.Knill,F.Embacher,B.Schweizer,S.Stephany,andC.Waldschmidt, Ph.D.degreefromtheDelftUniversityofTech‘‘Coded OFDM waveforms for MIMO radars,’’ IEEE Trans', 'requirement for minimum RCS of 100 m2 at the maximum symbolsandframesofsymbols.Consequently,theadoption rangeof180km.Inordertohaveahighersensitivityatthe of the concept of software-defined radar (SDR) platform maximum range, it is possible to make the radar to operate is advantageous and instrumental in the CC-OFDM MIMO inlowpowermodeforshortrangedetectionandhigh-power radar, promotes the flexibility of the radar and opens up modeforthelong-rangeradar.Thelow-powermodewiththe']","The maximum unambiguous range of the radar can be extended by transmitting multiple successive orthogonal CC-OFDM symbols (Kuswidiastuti et al., 2025).","to realize high gain, which makes the production cost higher. In addition, when operating in beam- scanning mode, the time-on-target achieved by electronically scanning radars is limited. Multi-beam radars, in which multiple beams are formed simultaneously and continuously at both the transmitter and the receiver at different angular directions, can eliminate 53682 This work is licensed under a Creative Commons Attribution 4.0 License. For more information, see VOLUME 10, 2022 D. Kuswidiastuti et al.: Transmitter Design for Multibeam CC-OFDM Azimuth Scanning MIMO Radar the aforesaid problem of limited time-on-target. Multi-beam radar technology is beneﬁcial to various radar applications, such as surveillance , , automotive radar , , radar imaging , , joint multiuser communication and radar , , etc. In",0.6666666666666666,0.9519215188223604
"the transmitters transmit a frame consisting of 12 consecutive symbols in series. The frame period is 1.2 ms, when the symbols are orthogonal, then the maximum unambiguous range is not only 15 km but 12 times longer (i.e. 180 km). CC-OFDM transmitter and receiver block diagram incor- porates simple transmit and receive modules. Fig. 1 depicts the block diagram of a transmit/receive (T/R) module, which is one out of 101 that constitute the MIMO transmitter system 109896 VOLUME 13, 2025 D. Kuswidiastuti et al.: Receiver Processing of the Multibeam Azimuth Scanning CC-OFDM-MIMO Radar FIGURE 1. Block diagram of a transmit receive module of CC-OFDM MIMO radar. TABLE 1. CC-OFDM MIMO radar system specifications for surveillance applications. of the surveillance radar.","['. The latter indicates that the CC OFDM MIMO radar can achieve a high resolution in angle, range, and velocity,withbeamisolationof−30dBforneighboringbeamsandco-channelbeams. INDEX TERMS Array signal processing, circulating-codes, Golay-codes, MIMO-radar, multi-beam, OFDM,software-defined-radar,sub-band,space-timecodes,surveillance. I', '. DigitalObjectIdentifier10.1109/ACCESS.2022.3175883 A Transmitter Design for the Multi-beam CC-OFDM Azimuth Scanning MIMO Radar DEVYKUSWIDIASTUTI 1,(StudentMember,IEEE),L.P.LIGTHART 2,(LifeFellow,IEEE), ANDGAMANTYOHENDRANTORO 1,(SeniorMember,IEEE) 1DepartmentofElectricalEngineering,InstitutTeknologiSepuluhNopember,Surabaya60111,Indonesia 2IRCTR,DelftUniversityofTechnology,2628CDDelft,TheNetherlands(Retired) Correspondingauthor:GamantyoHendrantoro(gamantyo@ee.its.ac.id)', '(13) herein as the subarrayed MIMO (SMIMO) radars, such as theFPMIMOradar,rangesbetweentwoextremeconfiguraNotation ⊗ denotes the Kronecker product operator, tions, namely the PA and the MIMO radar', '. By taking as an example the design of long-rangesurveillanceradar,thepaperdiscussesfurtherissuespertinenttotheimplementationoftheCC OFDM MIMO radar, including the beam squinting problem and its remedy, arrangement of the multiple beams, the radar system structure, use of Golay codes for orthogonalization and PAPR mitigation, use of software-definedradarthateliminatestheneedofamplitudeandphasecontrolineachtransmitter,transmit', '. ified delay between successive antennas of a MIMO radar, Multiple simultaneous beams can be generated by employ- intended to produce correlated waveforms with the purpose ing a number of transceivers operating individually, each of acquiring better control over the beampattern. CC have attached to an antenna with a beam pointing at a specified been proposed for application in MIMO radars, originally direction, in total covering a specified angular range', '. INDEX TERMS MIMO radar, parameter estimation, phased array radar, probability of detection, target detection. I. INTRODUCTION for biomedical engineering, macro-scale radars on radioMulti-antenna radar systems have been known and used in astronomy, and so on [4], [5]', 'requirement for minimum RCS of 100 m2 at the maximum symbolsandframesofsymbols.Consequently,theadoption rangeof180km.Inordertohaveahighersensitivityatthe of the concept of software-defined radar (SDR) platform maximum range, it is possible to make the radar to operate is advantageous and instrumental in the CC-OFDM MIMO inlowpowermodeforshortrangedetectionandhigh-power radar, promotes the flexibility of the radar and opens up modeforthelong-rangeradar.Thelow-powermodewiththe', '. However, one could extend the surveillance radar has been described to clarify the con- maximum unambiguous range of the radar by sendceptanddemonstratethepotentialissuesandadvantagesof ingmultiplesuccessiveorthogonalCC-OFDMsymbols the CC-OFDM MIMO radar', '. isillustratedashavingaradarbeamthatcoversaspanofthe In this manner, the FPMIMO radar can achieve a desired azimuthangle', '. SNR for target [11] G. Krieger, ‘‘MIMO-SAR: Opportunities and pitfalls,’’ IEEE Trans. range detection can be optimized by varying the number of Geosci. Remote Sens., vol. 52, no. 5, pp.2628–2645, May 2014, doi: orthogonalsymbolsperframe. 10.1109/TGRS.2013.2263934. Sincemostprocessesmainlydependonthearrangementof [12] D.-S.JangandH.-L.Choi,‘‘Interleavedradarpulseschedulingformultitargettrackingwithmultiplesimultaneousreceivebeams,’’IEEETrans. thetransmittedwaveformsandtheprocessingofthereceived Aerosp']","The maximum unambiguous range of the radar can be extended by sending multiple successive orthogonal CC-OFDM symbols (Kuswidiastuti et al., 2022).","symbols and frame transmission and reception schedul- ing, including the low/high-power modes, beam processing at the receiver by parallel processing, range and Doppler processing involving OFDM symbols and frames. VOLUME 10, 2022 53683 D. Kuswidiastuti et al.: Transmitter Design for Multibeam CC-OFDM Azimuth Scanning MIMO Radar beamforming applications, SDR technology is preferred for its ﬂexibility and low cost , . In our case, the SDR implements all baseband processing at the transmitter and the receiver, including generating inter-element delay required for the application of CC at the transmitter. Beamforming design that meets the required maximum beamwidth in the azimuth is achieved by determining the suitable number of elements employed on the horizontal axis. A good beam pattern can be obtained",1.0,0.9362252428892077
"for the n-th subcarrier for symbol a in beam b is given by gn,a,b, with the sampling period of Ts. The maximum unambiguous range, Rmax, will depend on the OFDM symbol period of T0. However, by transmitting Ns orthogonal symbols in series can extend the maximum range up to Ns times further. According to the waveform specification in Table 1, the 12 symbols are transmitted in series over 12T0 to extend the maximum range from 15 up to 180 km. The beams and the CC-OFDM symbols are Golay VOLUME 13, 2025 109897 D. Kuswidiastuti et al.: Receiver Processing of the Multibeam Azimuth Scanning CC-OFDM-MIMO Radar coded and transmitted using the allocated sub-band following a specific schedule that is well known","['. The latter indicates that the CC OFDM MIMO radar can achieve a high resolution in angle, range, and velocity,withbeamisolationof−30dBforneighboringbeamsandco-channelbeams. INDEX TERMS Array signal processing, circulating-codes, Golay-codes, MIMO-radar, multi-beam, OFDM,software-defined-radar,sub-band,space-timecodes,surveillance. I', '. DigitalObjectIdentifier10.1109/ACCESS.2022.3175883 A Transmitter Design for the Multi-beam CC-OFDM Azimuth Scanning MIMO Radar DEVYKUSWIDIASTUTI 1,(StudentMember,IEEE),L.P.LIGTHART 2,(LifeFellow,IEEE), ANDGAMANTYOHENDRANTORO 1,(SeniorMember,IEEE) 1DepartmentofElectricalEngineering,InstitutTeknologiSepuluhNopember,Surabaya60111,Indonesia 2IRCTR,DelftUniversityofTechnology,2628CDDelft,TheNetherlands(Retired) Correspondingauthor:GamantyoHendrantoro(gamantyo@ee.its.ac.id)', '. isillustratedashavingaradarbeamthatcoversaspanofthe In this manner, the FPMIMO radar can achieve a desired azimuthangle', '. By taking as an example the design of long-rangesurveillanceradar,thepaperdiscussesfurtherissuespertinenttotheimplementationoftheCC OFDM MIMO radar, including the beam squinting problem and its remedy, arrangement of the multiple beams, the radar system structure, use of Golay codes for orthogonalization and PAPR mitigation, use of software-definedradarthateliminatestheneedofamplitudeandphasecontrolineachtransmitter,transmit', '. However, the for radar coverage from −45◦ to 45◦, these 8 sub bands angular coverage is related to the number of beams mustbereusedby8beamsinaverage.Asaconsequenceof that must be generated simultaneously, which can be reusingeachsubbandfor8beams,thebeamisolationmight definedfromtheCC-OFDMwaveforms.Allocationand worsen for the co-channel beams, which can result in false arrangements of the available bandwidth for creating alarm in the nearest co-channel beam', '. This strategy makes it possible for the radar system to have multiple and simultaneous beamformingtoprovideafull-timecoverage.Furthermore,thetransmissionofaseriesoforthogonalOFDM symbols in each beam enables the detection of long-range targets', '. followingcertaincriteria.Advantagesofthisschemefollow IntheCC-OFDMMIMOradar,anoveltechniquecanbe from those of LFM radars, but the range-Doppler coupling usedfurthertomitigatebeambroadeningforlargescanning remainsaproblem.Inthelatter,theFDAradarsapplyasmall angles.Inaway,thestrategyofCC-OFDMMIMOradarcan frequency increment on consecutive elements across the be viewed as a realization of hybrid between phased array transmit array, which induces range-time-dependent phase and MIMO techniques [35], [36]', 'requirement for minimum RCS of 100 m2 at the maximum symbolsandframesofsymbols.Consequently,theadoption rangeof180km.Inordertohaveahighersensitivityatthe of the concept of software-defined radar (SDR) platform maximum range, it is possible to make the radar to operate is advantageous and instrumental in the CC-OFDM MIMO inlowpowermodeforshortrangedetectionandhigh-power radar, promotes the flexibility of the radar and opens up modeforthelong-rangeradar.Thelow-powermodewiththe', '. A. Valenzuela, ‘‘Spatial diversity in radars—Models and detection beamisolationof−30dBcanbeachievedforbothbetween performance,’’IEEETrans.SignalProcess.,vol.54,no.3,pp.823–838, Mar.2006,doi:10.1109/TSP.2005.862813. theco-channelbeamsandbetweentheneighboringbeams. [19] W.L.MelvinandJ.A.Scheer,PrinciplesofModernRadar:Advanced The receiver design of CC-OFDM radar, including the Techniques,vol.2.Rijeka,Croatia:SciTech,2013. beam, range and Doppler processing of the received signal [20] J. Li and P', '. However, one could extend the surveillance radar has been described to clarify the con- maximum unambiguous range of the radar by sendceptanddemonstratethepotentialissuesandadvantagesof ingmultiplesuccessiveorthogonalCC-OFDMsymbols the CC-OFDM MIMO radar']","The maximum unambiguous range of the radar can be extended by transmitting multiple successive orthogonal CC-OFDM symbols (Kuswidiastuti et al., 2022).","the high PAPR of the OFDM signal. If orthogonal codes are given to successive OFDM symbols, it could also provide orthogonality between 53684 VOLUME 10, 2022 D. Kuswidiastuti et al.: Transmitter Design for Multibeam CC-OFDM Azimuth Scanning MIMO Radar the OFDM symbols, which in turn can extend the maxi- mum unambiguous range of the radar. The orthogonalities between OFDM subcarriers and between OFDM symbols allow OFDM radar to produce a range and Doppler proﬁle independent from each other . This is one of the advan- tages of using OFDM instead of LFM as radar waveform. The above considerations motivate the development of digitally generated beam steering without phase shifter, by providing phase control of the signal directly from waveform generation",0.5,0.9214357252362106
"The beams and the CC-OFDM symbols are Golay VOLUME 13, 2025 109897 D. Kuswidiastuti et al.: Receiver Processing of the Multibeam Azimuth Scanning CC-OFDM-MIMO Radar coded and transmitted using the allocated sub-band following a specific schedule that is well known by the transmitter and receiver. The neighboring beam must use different sub-band and sub-band reuse is allowed for beams that are at least 10◦ in separation. In order to generate CC-OFDM waveform, additional phase steering β(fn,a,b, (cid:49)tb) is given to the specified OFDM sub-band frequencies of beam b to provide phase difference between the transmit elements for creating the beam b. Circulating code in LFM MIMO radar which is discussed in , obtain this phase difference by transmitting coherent signals","['. The latter indicates that the CC OFDM MIMO radar can achieve a high resolution in angle, range, and velocity,withbeamisolationof−30dBforneighboringbeamsandco-channelbeams. INDEX TERMS Array signal processing, circulating-codes, Golay-codes, MIMO-radar, multi-beam, OFDM,software-defined-radar,sub-band,space-timecodes,surveillance. I', '. DigitalObjectIdentifier10.1109/ACCESS.2022.3175883 A Transmitter Design for the Multi-beam CC-OFDM Azimuth Scanning MIMO Radar DEVYKUSWIDIASTUTI 1,(StudentMember,IEEE),L.P.LIGTHART 2,(LifeFellow,IEEE), ANDGAMANTYOHENDRANTORO 1,(SeniorMember,IEEE) 1DepartmentofElectricalEngineering,InstitutTeknologiSepuluhNopember,Surabaya60111,Indonesia 2IRCTR,DelftUniversityofTechnology,2628CDDelft,TheNetherlands(Retired) Correspondingauthor:GamantyoHendrantoro(gamantyo@ee.its.ac.id)', 'D.Kuswidiastutietal.:TransmitterDesignforMultibeamCC-OFDMAzimuthScanningMIMORadar theaforesaidproblemoflimitedtime-on-target.Multi-beam OFDM MIMO waveform [31]. A set of orthogonal waveradar technology is beneficial to various radar applications, formscanbesimplyacquiredbyarrangingtheallocationof suchassurveillance[3],[4],automotiveradar[5],[6],radar orthogonal subcarriers into different antennas of the MIMO imaging[7],[8],jointmultiusercommunicationandradar[9], radar system', '. isillustratedashavingaradarbeamthatcoversaspanofthe In this manner, the FPMIMO radar can achieve a desired azimuthangle', '. ified delay between successive antennas of a MIMO radar, Multiple simultaneous beams can be generated by employ- intended to produce correlated waveforms with the purpose ing a number of transceivers operating individually, each of acquiring better control over the beampattern. CC have attached to an antenna with a beam pointing at a specified been proposed for application in MIMO radars, originally direction, in total covering a specified angular range', '. A. Valenzuela, ‘‘Spatial diversity in radars—Models and detection beamisolationof−30dBcanbeachievedforbothbetween performance,’’IEEETrans.SignalProcess.,vol.54,no.3,pp.823–838, Mar.2006,doi:10.1109/TSP.2005.862813. theco-channelbeamsandbetweentheneighboringbeams. [19] W.L.MelvinandJ.A.Scheer,PrinciplesofModernRadar:Advanced The receiver design of CC-OFDM radar, including the Techniques,vol.2.Rijeka,Croatia:SciTech,2013. beam, range and Doppler processing of the received signal [20] J. Li and P', '(13) herein as the subarrayed MIMO (SMIMO) radars, such as theFPMIMOradar,rangesbetweentwoextremeconfiguraNotation ⊗ denotes the Kronecker product operator, tions, namely the PA and the MIMO radar', '. By taking as an example the design of long-rangesurveillanceradar,thepaperdiscussesfurtherissuespertinenttotheimplementationoftheCC OFDM MIMO radar, including the beam squinting problem and its remedy, arrangement of the multiple beams, the radar system structure, use of Golay codes for orthogonalization and PAPR mitigation, use of software-definedradarthateliminatestheneedofamplitudeandphasecontrolineachtransmitter,transmit', '. With this advantage, PA radars ject [6]–[18]. Unlike the PA radar, the MIMO radar utilizes have been used for such applications as micro-scale radars manyantennasthattransmitorthogonalsignalstoobtainthe signal reflected from the target at the receiver, a scheme The associate editor coordinating the review of this manuscript and known as waveform diversity [9]. Consequently, MIMO approvingitforpublicationwasDimitrisE.Anagnostou', '. Such for optimizing low sidelobes in MIMO radars employing a method offers a limited solution in angular resolution and LFM waveforms [32], but only recently the CC has gained cost[11]–[13].Whenphasedarraysareconsidered,multiple attention in terms of in-depth analysis of LFM waveform beams can be achieved for instance by involving a Butler optimization[33].Laterinthispaper,itcanbeseenthatCC matrix[14]–[16],inwhichthenumberofbeamsremainslim- find a different role as a consequence of their combination']","The CC OFDM MIMO radar can achieve high resolution in angle, range, and velocity, with beam isolation of −30 dB for neighboring beams (Kuswidiastuti et al., 2022).","beams pointing at increasing scan angles. In a previous patent , simultaneous multiple beams are generated using OFDM multiple antennas being fed at different points along a trans- mission line providing delay or phase differences between successive antennas, but the use of such a physical delay source limits its capability and ﬂexibility. On the other hand, OFDM signals with various delays can be produced with CC by ﬂexibly exploiting a programmable waveform gener- ator (WG). In the CC-OFDM MIMO radar, a novel technique can be used further to mitigate beam broadening for large scanning angles. In a way, the strategy of CC-OFDM MIMO radar can be viewed as a realization of hybrid between phased array and MIMO techniques , .",0.8,0.947699870740595
"the specified OFDM sub-band frequencies of beam b to provide phase difference between the transmit elements for creating the beam b. Circulating code in LFM MIMO radar which is discussed in , obtain this phase difference by transmitting coherent signals with a small time delay difference ((cid:49)tb) between the antenna element. However, using an OFDM signal, this phase steering can be provided by giving a phase difference to the OFDM subcarrier phase in the frequency domain of the OFDM signal generation stage. The phase steering given to the CC-OFDM waveform can be defined as follow: β(fn,a,b, (cid:49)tb) = 2πfn,a,b(cid:49)tb Hence, the array factor of CC-OFDM will be: AF(θ, fn,a,b, (cid:49)tb) = Nt −1 2X Ipejp(α(θ)+β(fn,a,b,(cid:49)tb) where α(θ) = p=− Nt","['. The latter indicates that the CC OFDM MIMO radar can achieve a high resolution in angle, range, and velocity,withbeamisolationof−30dBforneighboringbeamsandco-channelbeams. INDEX TERMS Array signal processing, circulating-codes, Golay-codes, MIMO-radar, multi-beam, OFDM,software-defined-radar,sub-band,space-timecodes,surveillance. I', '. Hassanien and S. A. Vorobyov, ‘‘Phased-MIMO radar: A tradeoff theAcademicianoftheRussianAcademyofTransport.HeisalsoaFounding betweenphased-arrayandMIMOradars,’’IEEETrans.SignalProcess., vol.58,no.6,pp.3137–3151,Jun.2010,doi:10.1109/TSP.2010.2043976', '. followingcertaincriteria.Advantagesofthisschemefollow IntheCC-OFDMMIMOradar,anoveltechniquecanbe from those of LFM radars, but the range-Doppler coupling usedfurthertomitigatebeambroadeningforlargescanning remainsaproblem.Inthelatter,theFDAradarsapplyasmall angles.Inaway,thestrategyofCC-OFDMMIMOradarcan frequency increment on consecutive elements across the be viewed as a realization of hybrid between phased array transmit array, which induces range-time-dependent phase and MIMO techniques [35], [36]', '. [30] G. Hakobyan, M. Ulrich, and B. Yang, ‘‘OFDM-MIMO radar with L.P.LIGTHART(LifeFellow,IEEE)wasbornin optimized nonequidistant subcarrier interleaving,’’ IEEE Trans. TheNetherlands,inSeptember1946.Hereceived Aerosp. Electron. Syst., vol. 56, no. 1, pp.572–584, Feb. 2020, doi: 10.1109/TAES.2019.2920044. the degree (cum laude) in engineering and the [31] C.Knill,F.Embacher,B.Schweizer,S.Stephany,andC.Waldschmidt, Ph.D.degreefromtheDelftUniversityofTech‘‘Coded OFDM waveforms for MIMO radars,’’ IEEE Trans', '. ified delay between successive antennas of a MIMO radar, Multiple simultaneous beams can be generated by employ- intended to produce correlated waveforms with the purpose ing a number of transceivers operating individually, each of acquiring better control over the beampattern. CC have attached to an antenna with a beam pointing at a specified been proposed for application in MIMO radars, originally direction, in total covering a specified angular range', '. DigitalObjectIdentifier10.1109/ACCESS.2022.3175883 A Transmitter Design for the Multi-beam CC-OFDM Azimuth Scanning MIMO Radar DEVYKUSWIDIASTUTI 1,(StudentMember,IEEE),L.P.LIGTHART 2,(LifeFellow,IEEE), ANDGAMANTYOHENDRANTORO 1,(SeniorMember,IEEE) 1DepartmentofElectricalEngineering,InstitutTeknologiSepuluhNopember,Surabaya60111,Indonesia 2IRCTR,DelftUniversityofTechnology,2628CDDelft,TheNetherlands(Retired) Correspondingauthor:GamantyoHendrantoro(gamantyo@ee.its.ac.id)', '. By taking as an example the design of long-rangesurveillanceradar,thepaperdiscussesfurtherissuespertinenttotheimplementationoftheCC OFDM MIMO radar, including the beam squinting problem and its remedy, arrangement of the multiple beams, the radar system structure, use of Golay codes for orthogonalization and PAPR mitigation, use of software-definedradarthateliminatestheneedofamplitudeandphasecontrolineachtransmitter,transmit', '. Consequently, it eliminates the requirechanges in phase along different frames. The realization of mentofphaseshifterperelementandlowerstheproduction such multi-beam radars that adopts the CC-OFDM MIMO cost', '. mission line providing delay or phase differences between Several attempts that have been reported involves the use successive antennas, but the use of such a physical delay of linear frequency modulated (LFM) waveforms [21]–[23] sourcelimitsitscapabilityandflexibility.Ontheotherhand, andfrequencydiversearray(FDA)[24],[25].Intheformer, OFDM signals with various delays can be produced with quasi-orthogonal waveforms is realized by producing LFM CCbyflexiblyexploitingaprogrammablewaveformgenerwaveforms with', '. With this advantage, PA radars ject [6]–[18]. Unlike the PA radar, the MIMO radar utilizes have been used for such applications as micro-scale radars manyantennasthattransmitorthogonalsignalstoobtainthe signal reflected from the target at the receiver, a scheme The associate editor coordinating the review of this manuscript and known as waveform diversity [9]. Consequently, MIMO approvingitforpublicationwasDimitrisE.Anagnostou']","The CC-OFDM MIMO radar employs a novel technique to mitigate beam broadening for large scanning angles, which is crucial for achieving precise phase steering in radar applications.","signal is circulated from one antenna element to another with a relatively small time-delay differ- ence ((cid:49)t), made possible by circulating codes (CC) , , . Hence the transmit signal from the p-th element for a transmit antenna array with an odd number of elements, Nt , can be written as: xp(t) = x(t − p(cid:49)t), Nt − 1 , . . . , Nt − 1 (1) The time delay difference of the circulating signal corre- sponds to a phase difference between the antenna elements at a given frequency: (cid:49)ϕ = 2πf (cid:49)t (2) It means that the phase steering that is usually provided by a phase shifter at each antenna element now can be realized directly in the",0.6666666666666666,0.9419348390222567
"together with transmit scheduling to avoid transmit receive coupling. The receive scheduling is also related to the time scheduling of the correlation between symbols, which is an important stage in the beam and range processing. The transmit and receive time schedule of CC-OFDM radar is described in Fig. 4. The receive scheduling is very important, especially in a multiple target scheme. The echo signals caused by two or more targets at different ranges (i.e., one target is near to the radar, and the other is far) could cause range ambiguity. The clock synchronization between the multiple transmitters and the multiple receivers of CC-OFDM radars are very crucial to guarantee that the receiver can give the accurate detection. It can be","['. The latter indicates that the CC OFDM MIMO radar can achieve a high resolution in angle, range, and velocity,withbeamisolationof−30dBforneighboringbeamsandco-channelbeams. INDEX TERMS Array signal processing, circulating-codes, Golay-codes, MIMO-radar, multi-beam, OFDM,software-defined-radar,sub-band,space-timecodes,surveillance. I', '. [30] G. Hakobyan, M. Ulrich, and B. Yang, ‘‘OFDM-MIMO radar with L.P.LIGTHART(LifeFellow,IEEE)wasbornin optimized nonequidistant subcarrier interleaving,’’ IEEE Trans. TheNetherlands,inSeptember1946.Hereceived Aerosp. Electron. Syst., vol. 56, no. 1, pp.572–584, Feb. 2020, doi: 10.1109/TAES.2019.2920044. the degree (cum laude) in engineering and the [31] C.Knill,F.Embacher,B.Schweizer,S.Stephany,andC.Waldschmidt, Ph.D.degreefromtheDelftUniversityofTech‘‘Coded OFDM waveforms for MIMO radars,’’ IEEE Trans', '. INDEX TERMS MIMO radar, parameter estimation, phased array radar, probability of detection, target detection. I. INTRODUCTION for biomedical engineering, macro-scale radars on radioMulti-antenna radar systems have been known and used in astronomy, and so on [4], [5]', '. As will be demonstrated in this paper, it is ditional phased array radar results in limited time on target, possible to sparse the total OFDM bandwidth into multiple CC-OFDM MIMO radar could give a much longer time on carrier sets, i.e., sub-bands, responsible for beamforming to target because multiple beams in CC-OFDM radar can be the specified direction. Orthogonality between the OFDM transmittedsimultaneouslyovermuchlongertimeintervals', '. followingcertaincriteria.Advantagesofthisschemefollow IntheCC-OFDMMIMOradar,anoveltechniquecanbe from those of LFM radars, but the range-Doppler coupling usedfurthertomitigatebeambroadeningforlargescanning remainsaproblem.Inthelatter,theFDAradarsapplyasmall angles.Inaway,thestrategyofCC-OFDMMIMOradarcan frequency increment on consecutive elements across the be viewed as a realization of hybrid between phased array transmit array, which induces range-time-dependent phase and MIMO techniques [35], [36]', '. ified delay between successive antennas of a MIMO radar, Multiple simultaneous beams can be generated by employ- intended to produce correlated waveforms with the purpose ing a number of transceivers operating individually, each of acquiring better control over the beampattern. CC have attached to an antenna with a beam pointing at a specified been proposed for application in MIMO radars, originally direction, in total covering a specified angular range', '. By taking as an example the design of long-rangesurveillanceradar,thepaperdiscussesfurtherissuespertinenttotheimplementationoftheCC OFDM MIMO radar, including the beam squinting problem and its remedy, arrangement of the multiple beams, the radar system structure, use of Golay codes for orthogonalization and PAPR mitigation, use of software-definedradarthateliminatestheneedofamplitudeandphasecontrolineachtransmitter,transmit', '. DigitalObjectIdentifier10.1109/ACCESS.2022.3175883 A Transmitter Design for the Multi-beam CC-OFDM Azimuth Scanning MIMO Radar DEVYKUSWIDIASTUTI 1,(StudentMember,IEEE),L.P.LIGTHART 2,(LifeFellow,IEEE), ANDGAMANTYOHENDRANTORO 1,(SeniorMember,IEEE) 1DepartmentofElectricalEngineering,InstitutTeknologiSepuluhNopember,Surabaya60111,Indonesia 2IRCTR,DelftUniversityofTechnology,2628CDDelft,TheNetherlands(Retired) Correspondingauthor:GamantyoHendrantoro(gamantyo@ee.its.ac.id)', '. In the works on the PMIMO radar in [22]–[29], The evaluation on the detection performance in terms of the improvement in radar performance factors such as theprobabilityofdetectionandtheprobabilityoffalsealarm spatial resolution, parameter identifiability, transmit-receive reportedhereinisanextensionofstudyby[32].Theseparam(T-R)gain,andsignal-to-interference-plus-noisepowerratio etersareevaluatedbasedonseveralaspectssuchastheeffect (SINR)hasbeenreported.Theresultsofinvestigationsin[29]', '. However, one could extend the surveillance radar has been described to clarify the con- maximum unambiguous range of the radar by sendceptanddemonstratethepotentialissuesandadvantagesof ingmultiplesuccessiveorthogonalCC-OFDMsymbols the CC-OFDM MIMO radar']","The CC-OFDM MIMO radar employs a novel technique to mitigate beam broadening, which is crucial for accurate detection in multiple target scenarios (Kuswidastuti et al., 2022).","In our case, quasi-continuous transmission is used through proper scheduling of OFDM transmission and echoes reception to prevent the coupling. • The receiver that continuously receives signal echoes coming from multiple targets must be able to distinguish which targets are very near or very far from the radar. This is the reason in this paper that orthogonal codes are given to successive CC-OFDM symbols. These unique codes are given and known by the receiver, so that the receiver could properly detect and distinguish targets nearby and far away from the radar. In this paper we describe the waveform design of a CC-OFDM quasi-continuous wave for MIMO long the range radar. Quasi-CW transmission could limit leakage/coupling problem by time-isolation of the",0.75,0.9246763042608599
"correlation function between the received signals with the reference signal can be derived as follow: χyx(θ, θ ′, τ, τ0, fD) = σ ejϑ R4 2NsT0X (cid:26) (Nt −1) 2X (Nt −1) 2X k=0 p=− (Nt −1) q=− (Nt −1) {IpIqejpα(θ)e−jqα(θ ′) Nc−1 Nc−1 n=0 m=0 (cid:26) Cn,p,a,bC ∗ m,q,a′,b′gn,a,bgm,a′,b′ × ej2πkTs(fIF +fn,a,b+fD) × e−j2πkTs(fIF +fm,a′,b′ ) × ej2πfn,a,b[p(cid:49)tb−(a−1)T0] × e−j2πfm,a′,b′ [q(cid:49)tb−(a′−1)T0]ej2π(τ −τ0)(fIF +fn,a,b) (cid:27)(cid:27) (14) PNc−1 Because the subcarrier frequency of the OFDM signal and the Golay codes are orthogonal, then the term PNc−1 m=0 gn,a,bgm,a′,b′ = 0 for n ̸= m, a ̸= a′, n=0 or b ̸= b′, hence the cross correlation, χyx(θ, θ ′, τ, τ0, fD) will be zero. The correlation function value will be","['. The Golay code is bined.ThenthereceivedRFsignalgoesthroughtheanalog applied in the frequency domain of the OFDM signal and receiverchain,whichconsistofLNAandtheRFtoIFdown- then the signal is phase shifted by pβ(f n,a,b ,(cid:49)t b ), with p = converters', 'transmission is used through proper orthogonalitybetweentheCC-OFDMsymbolsisbeneficial schedulingofOFDMtransmissionandechoesreception in obtaining an optimum SNR for increasing the maximum topreventthecoupling', '. −∞ However, the ambiguity function of CC-OFDM radar ii. χ fu θ n 0 , c a t (cid:48) i = o a n = a 1 s ,b a (cid:48)= fu b ( n τ c , ti f o D n = of 0 ti , m θ e ,(cid:49) de t l b a ) y is va th ri e ab ra le d , a τ r , a a m nd bi a g n u g i u ty is a multi-dimensional function', '. Since the number of Golay codes are limited x p R , F a,b (t)=x p IF ,a 2 ,b (t)ej2πfRFt ∗h RF (t) (24) (there are in total 256 available Golay codes that can where f = 3GHz − f − f , while h (t) and h (t) RF IF2 IF IF2 RF beusedfor256-subcarrierOFDMsymbols),codereuse denote the impulse responses of the filters used to suppress becomes inevitable', '. The orthogonalities sionandreceptionoftheradarsystemasinapulseradarsysbetween OFDM subcarriers and between OFDM symbols tem,whileitalsohastheadvantageofaCWradarthathasa allow OFDM radar to produce a range and Doppler profile largetimebandwidthproduct.However,thepeak-to-average independentfromeachother[41].Thisisoneoftheadvan- power ratio (PAPR) of OFDM signals becomes an issue tagesofusingOFDMinsteadofLFMasradarwaveform.The becauseitstillmaycausetoohighpower-couplingbetween above considerations motivate', '. [30] G. Hakobyan, M. Ulrich, and B. Yang, ‘‘OFDM-MIMO radar with L.P.LIGTHART(LifeFellow,IEEE)wasbornin optimized nonequidistant subcarrier interleaving,’’ IEEE Trans. TheNetherlands,inSeptember1946.Hereceived Aerosp. Electron. Syst., vol. 56, no. 1, pp.572–584, Feb. 2020, doi: 10.1109/TAES.2019.2920044. the degree (cum laude) in engineering and the [31] C.Knill,F.Embacher,B.Schweizer,S.Stephany,andC.Waldschmidt, Ph.D.degreefromtheDelftUniversityofTech‘‘Coded OFDM waveforms for MIMO radars,’’ IEEE Trans', '. The latter indicates that the CC OFDM MIMO radar can achieve a high resolution in angle, range, and velocity,withbeamisolationof−30dBforneighboringbeamsandco-channelbeams. INDEX TERMS Array signal processing, circulating-codes, Golay-codes, MIMO-radar, multi-beam, OFDM,software-defined-radar,sub-band,space-timecodes,surveillance. I', '. SURVEILLANCECCOFDMRADARSYSTEM codes. A unique Golay code with a code length of 256 bits CCOFDMtransmitterandreceiverblockdiagraminFig.4 isusedbecauseinthispaper,256successivesubcarriersare consistsofsimpletransmitandreceivemodules.Thetransmit groupedintoonesub-bandandtransmittedthroughonebeam', '. However, one could extend the surveillance radar has been described to clarify the con- maximum unambiguous range of the radar by sendceptanddemonstratethepotentialissuesandadvantagesof ingmultiplesuccessiveorthogonalCC-OFDMsymbols the CC-OFDM MIMO radar', '. A. Valenzuela, ‘‘Spatial diversity in radars—Models and detection beamisolationof−30dBcanbeachievedforbothbetween performance,’’IEEETrans.SignalProcess.,vol.54,no.3,pp.823–838, Mar.2006,doi:10.1109/TSP.2005.862813. theco-channelbeamsandbetweentheneighboringbeams. [19] W.L.MelvinandJ.A.Scheer,PrinciplesofModernRadar:Advanced The receiver design of CC-OFDM radar, including the Techniques,vol.2.Rijeka,Croatia:SciTech,2013. beam, range and Doppler processing of the received signal [20] J. Li and P']",The orthogonality between OFDM subcarriers and symbols allows the CC-OFDM radar to produce a range and Doppler profile independent from each other (A Transmitter Design for the Multi-beam CC-OFDM Azimuth Scanning MIMO Radar).,"frequency fa,n,b of the b-th beam, and C (cid:48)∗ m,q,a(cid:48),b(cid:48) denotes the complex conjugate of the correction phase of the received CC-OFDM symbols, given to the m-th carrier frequency of b(cid:48)-th beam, which use subcarrier fa(cid:48),m,b(cid:48). For the surveillance In the following, various ambiguity functions, each a func- tion of beam, of delay and of Doppler frequency, are pre- sented with transmitter time, sub band and codes scheduling for symbol-1 as visually described in Table 2. Based on the ambiguity function formulation in (32), the analyses are described as follows: i. χa(cid:48)=a=1,b(cid:48)=b(τ = 0, fD = 0, θ0, θ, (cid:49)tb) is the radar ambiguity function analyzed by taking a variable value of θ0 as a function of angular variable, θ.",0.75,0.9223016225312067
"B. DOPPLER PROCESSING SIMULATION AND ANALYSIS B. DOPPLER PROCESSING SIMULATION AND ANALYSIS In this subsection, the Doppler processing of a moving target is analyzed. For the Doppler processing in this paper, we set VOLUME 13, 2025 109903 D. Kuswidiastuti et al.: Receiver Processing of the Multibeam Azimuth Scanning CC-OFDM-MIMO Radar echoes received from targets. Beams that receive echoes by targets in their respective directions can be identified correctly by correlating the sum of signals containing echoes from all receive modules with individual signals transmitted individual beams. Correlations are done per symbol, and after delay compensation, coherence processing is done for all the 12 symbols. The simulation results based on the detection of 2 targets at 3 different scenarios show that","['. ified delay between successive antennas of a MIMO radar, Multiple simultaneous beams can be generated by employ- intended to produce correlated waveforms with the purpose ing a number of transceivers operating individually, each of acquiring better control over the beampattern. CC have attached to an antenna with a beam pointing at a specified been proposed for application in MIMO radars, originally direction, in total covering a specified angular range', '. The latter indicates that the CC OFDM MIMO radar can achieve a high resolution in angle, range, and velocity,withbeamisolationof−30dBforneighboringbeamsandco-channelbeams. INDEX TERMS Array signal processing, circulating-codes, Golay-codes, MIMO-radar, multi-beam, OFDM,software-defined-radar,sub-band,space-timecodes,surveillance. I', 'D.Kuswidiastutietal.:TransmitterDesignforMultibeamCC-OFDMAzimuthScanningMIMORadar theaforesaidproblemoflimitedtime-on-target.Multi-beam OFDM MIMO waveform [31]. A set of orthogonal waveradar technology is beneficial to various radar applications, formscanbesimplyacquiredbyarrangingtheallocationof suchassurveillance[3],[4],automotiveradar[5],[6],radar orthogonal subcarriers into different antennas of the MIMO imaging[7],[8],jointmultiusercommunicationandradar[9], radar system', '. DigitalObjectIdentifier10.1109/ACCESS.2022.3175883 A Transmitter Design for the Multi-beam CC-OFDM Azimuth Scanning MIMO Radar DEVYKUSWIDIASTUTI 1,(StudentMember,IEEE),L.P.LIGTHART 2,(LifeFellow,IEEE), ANDGAMANTYOHENDRANTORO 1,(SeniorMember,IEEE) 1DepartmentofElectricalEngineering,InstitutTeknologiSepuluhNopember,Surabaya60111,Indonesia 2IRCTR,DelftUniversityofTechnology,2628CDDelft,TheNetherlands(Retired) Correspondingauthor:GamantyoHendrantoro(gamantyo@ee.its.ac.id)', '. INDEX TERMS MIMO radar, parameter estimation, phased array radar, probability of detection, target detection. I. INTRODUCTION for biomedical engineering, macro-scale radars on radioMulti-antenna radar systems have been known and used in astronomy, and so on [4], [5]', '. With this advantage, PA radars ject [6]–[18]. Unlike the PA radar, the MIMO radar utilizes have been used for such applications as micro-scale radars manyantennasthattransmitorthogonalsignalstoobtainthe signal reflected from the target at the receiver, a scheme The associate editor coordinating the review of this manuscript and known as waveform diversity [9]. Consequently, MIMO approvingitforpublicationwasDimitrisE.Anagnostou', '. REVIEWONMAXIMUMNUMBEROFDETECTED has been described by [13]. In a MIMO radar, in which TARGETSFORMIMORADAR K elements in the Tx array transmit orthogonal waveforms For clarity in discussions that follow, herein we provide a andLelementsintheRxarrayreceiveechosignalsfromtar- shortreviewoftheperformanceofMIMOradarsinthemaxgetsoperatingindependently,theVAdimensionisexpressed imum number of detected targets, mostly taken from [13]', '(13) herein as the subarrayed MIMO (SMIMO) radars, such as theFPMIMOradar,rangesbetweentwoextremeconfiguraNotation ⊗ denotes the Kronecker product operator, tions, namely the PA and the MIMO radar', '. As will be demonstrated in this paper, it is ditional phased array radar results in limited time on target, possible to sparse the total OFDM bandwidth into multiple CC-OFDM MIMO radar could give a much longer time on carrier sets, i.e., sub-bands, responsible for beamforming to target because multiple beams in CC-OFDM radar can be the specified direction. Orthogonality between the OFDM transmittedsimultaneouslyovermuchlongertimeintervals', '. However, one could extend the surveillance radar has been described to clarify the con- maximum unambiguous range of the radar by sendceptanddemonstratethepotentialissuesandadvantagesof ingmultiplesuccessiveorthogonalCC-OFDMsymbols the CC-OFDM MIMO radar']","The CC OFDM MIMO radar can achieve high resolution in angle, range, and velocity, with significant beam isolation, which supports the effectiveness of Doppler processing in radar systems (Kuswidiastuti et al., 2022).","symbols and frame transmission and reception schedul- ing, including the low/high-power modes, beam processing at the receiver by parallel processing, range and Doppler processing involving OFDM symbols and frames. VOLUME 10, 2022 53683 D. Kuswidiastuti et al.: Transmitter Design for Multibeam CC-OFDM Azimuth Scanning MIMO Radar beamforming applications, SDR technology is preferred for its ﬂexibility and low cost , . In our case, the SDR implements all baseband processing at the transmitter and the receiver, including generating inter-element delay required for the application of CC at the transmitter. Beamforming design that meets the required maximum beamwidth in the azimuth is achieved by determining the suitable number of elements employed on the horizontal axis. A good beam pattern can be obtained",0.5,0.9501837593273422
"and at the same beam direction, in this case around the range resolution of the radar, which is 60 meter are also can be distinguished with PSLL of −45 dB. The simulation results show that the coupling between beams and symbols are very low as the result of codes and sub-band scheduling at the transmitter. These results are valid for the three scenarios whether the targets are in the same beam, at the nearest neighboring beams and at the nearest co-channel beams. It shows that with the concept proposed in CC-OFDM MIMO Radar, it is possible to design a long-range radar with low power transmission by transmitting multi-orthogonal CC-OFDM symbols in series, to improve the Signal-to-Noise of the radar system.","['. The latter indicates that the CC OFDM MIMO radar can achieve a high resolution in angle, range, and velocity,withbeamisolationof−30dBforneighboringbeamsandco-channelbeams. INDEX TERMS Array signal processing, circulating-codes, Golay-codes, MIMO-radar, multi-beam, OFDM,software-defined-radar,sub-band,space-timecodes,surveillance. I', '. By taking as an example the design of long-rangesurveillanceradar,thepaperdiscussesfurtherissuespertinenttotheimplementationoftheCC OFDM MIMO radar, including the beam squinting problem and its remedy, arrangement of the multiple beams, the radar system structure, use of Golay codes for orthogonalization and PAPR mitigation, use of software-definedradarthateliminatestheneedofamplitudeandphasecontrolineachtransmitter,transmit', '(13) herein as the subarrayed MIMO (SMIMO) radars, such as theFPMIMOradar,rangesbetweentwoextremeconfiguraNotation ⊗ denotes the Kronecker product operator, tions, namely the PA and the MIMO radar', '. INDEX TERMS MIMO radar, parameter estimation, phased array radar, probability of detection, target detection. I. INTRODUCTION for biomedical engineering, macro-scale radars on radioMulti-antenna radar systems have been known and used in astronomy, and so on [4], [5]', '. DigitalObjectIdentifier10.1109/ACCESS.2022.3175883 A Transmitter Design for the Multi-beam CC-OFDM Azimuth Scanning MIMO Radar DEVYKUSWIDIASTUTI 1,(StudentMember,IEEE),L.P.LIGTHART 2,(LifeFellow,IEEE), ANDGAMANTYOHENDRANTORO 1,(SeniorMember,IEEE) 1DepartmentofElectricalEngineering,InstitutTeknologiSepuluhNopember,Surabaya60111,Indonesia 2IRCTR,DelftUniversityofTechnology,2628CDDelft,TheNetherlands(Retired) Correspondingauthor:GamantyoHendrantoro(gamantyo@ee.its.ac.id)', '. ified delay between successive antennas of a MIMO radar, Multiple simultaneous beams can be generated by employ- intended to produce correlated waveforms with the purpose ing a number of transceivers operating individually, each of acquiring better control over the beampattern. CC have attached to an antenna with a beam pointing at a specified been proposed for application in MIMO radars, originally direction, in total covering a specified angular range', '. This strategy makes it possible for the radar system to have multiple and simultaneous beamformingtoprovideafull-timecoverage.Furthermore,thetransmissionofaseriesoforthogonalOFDM symbols in each beam enables the detection of long-range targets', '. In the works on the PMIMO radar in [22]–[29], The evaluation on the detection performance in terms of the improvement in radar performance factors such as theprobabilityofdetectionandtheprobabilityoffalsealarm spatial resolution, parameter identifiability, transmit-receive reportedhereinisanextensionofstudyby[32].Theseparam(T-R)gain,andsignal-to-interference-plus-noisepowerratio etersareevaluatedbasedonseveralaspectssuchastheeffect (SINR)hasbeenreported.Theresultsofinvestigationsin[29]', '. Hassanien and S. A. Vorobyov, ‘‘Phased-MIMO radar: A tradeoff theAcademicianoftheRussianAcademyofTransport.HeisalsoaFounding betweenphased-arrayandMIMOradars,’’IEEETrans.SignalProcess., vol.58,no.6,pp.3137–3151,Jun.2010,doi:10.1109/TSP.2010.2043976', '. With this advantage, PA radars ject [6]–[18]. Unlike the PA radar, the MIMO radar utilizes have been used for such applications as micro-scale radars manyantennasthattransmitorthogonalsignalstoobtainthe signal reflected from the target at the receiver, a scheme The associate editor coordinating the review of this manuscript and known as waveform diversity [9]. Consequently, MIMO approvingitforpublicationwasDimitrisE.Anagnostou']","The CC OFDM MIMO radar can achieve high resolution in angle, range, and velocity, with a beam isolation of −30 dB for neighboring and co-channel beams (Kuswidiastuti et al., 2022).","the transmitter design for long-range surveillance radar has been described to clarify the concept and demonstrate the potential advan- tages of the CC-OFDM MIMO radar. By using the proposed design, a range resolution of 52 meter and an azimuth resolu- tion of 1.7◦ can be achieved. For the multi-beam scheme, the beam isolation of −30 dB can be achieved for both between the co-channel beams and between the neighboring beams. The receiver design of CC-OFDM radar, including the beam, range and Doppler processing of the received signal will be discussed in a separate paper.",0.8333333333333334,0.940809183894559
"with the following formula: TP + TN TP + TN + FP + FN Accuracy = Precision = Recall/True Positive Rate(TPR) TP TP + FP TP TP + FN F1 = 2 × precision × recall precision + recall FP TN + TP (cid:90) 1 TPRd(FPR) False Positive Rate(FPR) = AUC = (4) (5) (6) (7) (8) (9) where TP is the number of correctly predicted positive labels, TN is the number of correctly predicted negative labels, FP is the number of incorrectly predicted positive labels, and FN is the number of incorrectly predicted negative labels. Accuracy is the ratio of true predictions to the overall data. Precision is the ratio between TP to the total number of positive predic-","["". These metrics can be calculated by (1) – (3). This study's calculation of True Positive, False Positive, and False Negative differs from other classifications or detections [20]-[23]. These are chosen and calculated following previous studies [1]. Precision detects the truly correct prediction out of all predictions. Recall detects the truly correct prediction out of all actual classes. F1 scores are harmonic mean between these two that measure overall model performance"", '. performance evaluation score, where the highest accuracy Following the definition in the previous paragraph, we plot is under 85%, the model needs further improvement so that the frequency of each misclassification type in Fig 13 and thedetectionvaliditycanbeenhancedandthatthedetection Fig 14', 'that could be vital for accurate classification [40]', '. Accuracy = (15) Based on the sampling result on 659 data, the dataset TP+TN +FP+FN used in this study is arranged as shown in detail in Table 3. TP Recall(Sensitivity) = (16) In the dataset, there are 11 initial features, since not all TP+FN initial features are used to create the model. They had to TP Precision(P) = (17) go through the feature extraction process first to obtain the TP+FP features used to create the model detection', '. CLASSIFICATION RESULTS IN EACH ACCEPTED FEATURES Entropy Gini Index Depth Accuracy Sensitivity Specificity Accuracy Sensitivity Specificity 3 0.998682278 0.998137797 0.999314045 0.998658464 0.99810826 0.99929689 4 0.998706092 0.998152616 0.999348339 0.998666337 0.998152476 0.999262572 5 0.998793258 0.998285484 0.999382522 0.998809288 0.9983002 0.999399863 6 0.998927976 0.998521585 0.999399554 0.998927976 0.998521585 0.999399554 7 0.998927976 0.998521585 0.999399554 0.998753491 0.998226492 0.999365243 8', 'classification validation have helped develop the motivation for this work which is [34],[35],[36]', '. THE RESULT OF CLASSIFICATION IN EACH ACCEPTED FEATURES Classification Data Classification Result Accepted Attributes True True False False Accuracy Sensitivity Specificity Positive Negative Positive Negative 32 Accepted 13505 10 11651 29 0.99845207 0.99785725 0.99914244 33 Accepted 13507 8 11650 30 0.99849176 0.99778385 0.99931378 34 Accepted 13508 7 11651 20 0.99892798 0.99852158 0.99939955 35 Accepted 13508 7 11657 23 0.99880929 0.9983002 0.99939986 36 Accepted 13506 9 11652 28 0.99853145 0.99793114', 'TABLE IV. COMPARISON PERFORMANCE OF EACH MODEL Performance Model Accuracy Precision Recall F1 Score Random Forest 0.989 0.989 0.989 0.989 Decision Tree 0.979 0.979 0.979 0.979 Logistic 0.700 0.688 0.700 0.663 Registrion SVM 0.695 0.779 0.695 0.607 D. Performance Comparison of Predictive Analysis The prediction analysis used in this research compares the Fig. 10', '. The accuracy aspect shows how often the lating the classification accuracy and compared with other classifier model can correctly classify the data against the featuresinTable4. input data and a high score represents better performance', "". We applied various machine learning models, accurate predictions, as machine learning models learn from including Random Forest and XGBoost, to improve the the input data, following the principle of 'garbage-ingarbage-out' [29]. Once they complete the preprocessing steps, the data will be ready for the machine learning model. TABLE II. RESULTS TABLE OF THE FOUR KEY METRICS Metrics ID Description Value D""]","Precision measures the ratio of true positive predictions to all predictions, while recall assesses the ratio of true positive predictions to all actual positive cases, with F1 score serving as the harmonic mean of these two metrics (Referensi 1).","(TP+FP). To determine how well a positive value is found, recall is employed. It applies true positives (TP) to all ground truth values, which include both true positives and false negatives (FN). The F1 score is an evaluation metric that combines a model’s precision and recall scores, as illustrated in the equation that calculates accuracy. The accuracy statistic computes the number of times the iYOLOV7-TPE-SS model predicted accurately throughout the entire dataset , : F1score = 2 · (P · R) (P + R) (13) The system performance of the iYOLOV7-TPE-SS model has been evaluated using a metric known as mean average accuracy (mAP), which takes into account the average recall (AR), F1-score, and inference time. The inference time has",1.0,0.9609326819959885
"exhib- ited better performance than the MobileNet model, in which the models achieved an accuracy of 85% and 84.52%, respectively. Furthermore, the ResNet-101 model achieved a higher recognition performance of 88.37%, while the MobileNetV2 achieved the performance with an accuracy of 85.46% and a precision, recall, and F1 of 91%, 84%, and 85%, respectively. Furthermore, we performed more experi- ments using several different architectures i.e., DenseNet169, InceptionResNetV2, Xception, and EfﬁcientNetB4 that yielded accuracy of 88.76%, 87.16%, 89.31%, and 88.21%, respectively. The highest accuracy achieved by the benchmark models was only 89.31%. Our previous study proposed a data aug- mentation technique based on neural style transfer and geo- metric transformation to address the scantiness of Balinese carving data , which increased","['. 9. The comparison of VGG19 style transfer images with different Nitik style. The used layers from left to right are ""conv1_1"", weighting factor compositions ""conv2_1"", ""conv3_1"", ""conv4_1"", and ""conv5_1"". C. Survey Results Fig. 9 displays a comparison of a few generated images The survey managed to garner 216 responses. There are using the VGG19 model with different weighting factor six sections in this survey. The first section of the settings each', '. The D. Data Collection and Analysis convolutional layer “conv5_1” of both neural networks was used to represent content image features. As for the style Several data were collected in this study. When style image, the experiment used the layers “conv1_1”, “conv2_1”, transfer was performed, the information about its time “conv3_1”, “conv4_1”, and “conv5_1” to store the style computation and loss values were recorded aside from representation similar to Gatys et al. [2]. The models were producing new images', '. sometimesneedtoreduceimagesizestolightenthecomputaHavingadatasetdoesn’tmeanitcanbedirectlyfedintothe tionalload.Often,datasetsderivedfromdifferentmodalities deeplearningmodel.Twocriticalstepsthatneedtobecarried also have varying image sizes, making it necessary to stanoutfirstarepreprocessingandaugmentation.Thepurposeof dardizeimagesizesforfurtherprocessing.Severalstudiesin preprocessing and augmentation is to enhance dataset qual- thepaperswereviewedhaveperformedimageresizingduring ity, ultimately', '. Simonyan and A. Zisserman, ""Very deep convolutional networks layer for batik style reconstruction. No significant difference for large-scale image recognition,"" in 3rd International Conference on was found for all compositions of the VGG16 model. Learning Representations (ICLR 2015), San Diego, USA, 2015. However, some significant differences were found for VGG19 [2] L. A. Gatys, A. S. Ecker and M. Bethge, ""A Neural Algorithm of weighting compositions. Fig. 11 displays the difference', '. [6] and Ihsan [7]. The VGG19 study. architecture was regarded as the best neural network model to perform style transfer on batik-style images. Among its layers, II. RELATED WORKS the layer ""conv3_1"" performs better than other layers in the Simonyan and Zisserman [1] introduced the convolutional same network. The study concluded that batik-style transfer neural network architecture named VGG. This architecture images can be regarded as a form of batik art', '. However, the study of Wang et al. [3] I. INTRODUCTION and Ihsan [7] pointed out that architectures with better accuracy struggle to properly migrate over the features of style One of the computer vision applications involves image images. Although the former study introduced a novel recognition. In 2015, Simonyan and Zisserman [1] presented stylization to improve other architectures, literature about their work regarding large-scale image recognition', '. The study of Joseph et al. [6] stated that layers of VGG19 are capable of representing features more accurately than VGG16. This trait was depicted in the loss computation of both architectures. However, the trait was not always translated well in performing style transfer. B. Generated Images Several images were produced from both neural style transfer images. There were four batches of images produced Fig. 6. Content loss comparison in this experiment', '. The model that only utilizes the ""conv2_1"" and ""conv3_1"" layers process yields several results aside from the generated images, of the VGG19 architecture can represent a more accurate style such as records of computation time, records of loss value coloring than the method of Ihsan [7]. changes, and sequences of style transfer iteration. A survey was also conducted to gather opinions regarding the produced The discoveries made from the prior study [8] inspire this images', '. They neural style transfer and batik image are only a few. introduced the convolutional neural network (CNN) VGG16 and VGG19. The latter neural network architecture was then The goal of this study is to perform a thorough study of implemented by Gatys et al. [2] to produce high-quality transferring features of batik-style images using the VGG artistic images. The result of their work introduced the architectures', '. Dataset convolutional processing. The pooling layer also played a 1) Florence3DActions: This research applied the Florence crucial role in extracting significant and dominant features 3DActionsDataset[19],[27],whichincludedvideodatafrom from the images, regardless of their position or rotation. 215 recordings. These videos were recorded in 2012 at the Furthermore, this DCNN model used Max Pooling']","The VGG19 architecture has been identified as an effective model for style transfer tasks, demonstrating superior performance in generating batik-style images.","Results from the performance evaluation for CNN, BiLSTM, BiGRU, CNN-BiGRU, HWE-CBiGRU without attention, and HWE-CBiGRU with soft attention, with respect to accu- racy, recall, precision, and F1 score, are presented in Table 4. The conventional CNN architecture produced good per- formance with an accuracy, recall, precision, and F1 score of 84.35%, 86.24%, 84.26%, and 85.24%, respectively. The BiLSTM model obtained a lower accuracy and F1 score of 81.24% and 84.84%, respectively, compared to CNN despite having a relatively high recall rate. Mean- while, the BiGRU model obtained the highest accuracy, recall, precision, and F1 score among the baseline mod- els, with a value of 85.46%, 87.80%, 86.85%, and 86.31%, respectively. The CNN-BiGRU model exhibited enhanced accuracy and F1 score in",1.0,0.9165821504568378
"process, an audit involves acquiring and objectively evaluating evidence related to allegations of economic activities and other operations. The aim is to assess the level of conformity between the reports and predefined criteria, and to communicate the results to relevant users, in this case, the organization responsible for establishing information system gover nan nance. One of the proven frameworks for information system auditing is the Control Objectives for Information and Related Technology (COBIT) 2019, which is utilized as the reference framework in this research . COBIT 2019 offers an effective methodology for evaluating the capability of information technology processes, specifically focusing on Deliver, Service and Support - Operation Management. This framework guarantees that the data (DSS01) is received, managed fully,","["". INTRODUCTION implementation of improvements. Audit system with Control Objectives for Information and Audit with COBIT 2019 and process mining from event Related Technologies (COBIT) is a process that refers to a logs represents a holistic approach to evaluating and framework designed to assist organizations in managing and enhancing the effectiveness of an organization's information controlling information technology more effectively [1], [2]. systems [12]"", "". insights into the performance of the organization's information Thus, the system audit with COBIT helps organizations systems, along with recommendations for more effective IT improve the reliability, security, and operational efficiency in management. Thus, audit with COBIT and process mining managing their information technology"", '. Previous Research of Audit using COBIT 2019 based on semantic similarities, preprocessing data to calculate PreviousresearchonauditingwithCOBIT2019hasinvestithese similarities and effectively merging nodes and relationgated multiple facets of IT governance and auditing, applying ships. the framework across diverse domains and industries', '. This system aims COBIT 2019, which stands for Control Objectives for to help organizations manage risk, ensure compliance, and Information and Related Technologies, is a comprehensive enhanceperformanceinthecontextofinformationtechnology', '. Recommendations based on COBIT 2019 best practices, such as performance measurements and knowledge repository access, further enhance IT governance processes and contribute to the success of software development projects. The integration of AI and machine learning techniques with the COBIT 2019 framework holds promise in further enhancing IT governance practices [19]', '. systems [12]. Through the use of the COBIT 2019 framework, COBIT provides comprehensive guidance for identifying, auditors can pinpoint key controls necessary to achieve establishing, and monitoring the necessary controls within the predefined business objectives. Meanwhile, event log process IT environment to achieve defined business objectives [3], [4]', '. 2020, pp. Information System Governance using Framework COBIT 2019,” 61–70. doi: 10.1145/3416508.3417119. International Journal of Computer Applications, vol. 174, no. 31, pp. [25] A. E. Karrar, “The Effect of Using Data Pre-Processing by Imputations 23–30, Apr. 2021, doi: 10.5120/ijca2021921253. in Handling Missing Values,” Indonesian Journal of Electrical [7] A. A. Aibinu and E. Papadonikolaki, “Conceptualizing And Engineering and Informatics (IJEEI), vol. 10, no. 2, Apr', '. This audit helps identify weaknesses and potential standards and identify noises from established procedures. risks, as well as providing recommendations for improving This integrated audit approach provides comprehensive and enhancing information technology management [6], [7]', '. Business process governance and potential bottleneck activities. control were evaluated using the COBIT 2019 methodology. The findings indicated that out of 30,000 case IDs, the majority Audit with surveys is an effective method for gathering activity sequence pattern that conformed to the SOP was found essential information to evaluate a process or system [11]. in 97.55% of cases', '. The results show a list of recommended activities based on the company In previous research, as found in the paper [3], [4], [5] strategy, this can simplify the company audit process. and [6] to obtain Activities from the COBIT Core Model Keywords—Audit Management, COBIT 2019, Cosine Similar- and Capability Scores, it is necessary to undergo a mapping ity, Financial, Knowledge Graph, Neo4J process according to the instructions in the COBIT 2019 manual. This can be time-consuming, especially when auditor I']",The COBIT 2019 framework provides comprehensive guidance for identifying and monitoring necessary controls within the IT environment to achieve defined business objectives (Identifying Non-Conforming Process in Automobile Insurance Claims Using Process Mining and COBIT 2019).,"assist organizations in managing and optimizing their use of information technology (IT) . landscape, effective IT In today’s rapidly evolving digital governance is essential for organizations to ensure that their IT investments align with business objectives, comply with regulations, and mitigate risks . COBIT 2019 provides a structured approach for organiza- tions to establish, implement, and maintain effective gover- nance over IT. It defines the components necessary to create and sustain a governance system, as well as guidelines for building the most suitable governance system for an enterprise . By utilizing COBIT 2019, organizations can enhance the efficiency, effectiveness, and reliability of their IT usage, while also ensuring compliance with relevant regulations, policies, and standards . One of the key",0.6666666666666666,0.8817753498300056
"the Deliver, Service, and Support (DSS) domain to assess the performance of the system and the standards the governance capabilities at the Customer Care unit using the COBIT framework, specifically within the Deliver, Service, and Support (DSS) domain. The primary focus is on assessing process controls related to Information Technology (IT) services and technical support. Data collection is conducted through surveys to support this evaluation. This study adopts a novel approach in identifying COBIT processes, specifically DSS01, through process mining techniques rather than traditional surveys. Process mining utilizes event logs recorded from daily operations. This technique enables real-time process analysis by applying various analytical methods to process these logs. This approach provides deeper and more accurate insights into the effectiveness","['. Business process governance and potential bottleneck activities. control were evaluated using the COBIT 2019 methodology. The findings indicated that out of 30,000 case IDs, the majority Audit with surveys is an effective method for gathering activity sequence pattern that conformed to the SOP was found essential information to evaluate a process or system [11]. in 97.55% of cases', 'performance in the realm of critical role of risk management in IT governance', "". insights into the performance of the organization's information Thus, the system audit with COBIT helps organizations systems, along with recommendations for more effective IT improve the reliability, security, and operational efficiency in management. Thus, audit with COBIT and process mining managing their information technology"", '. EVALUATION METRICS contract. Models MAE RMSE R2 MAPE In the field of IT governance, the combination of machine Linear Regression 4.32 6.01 0.72 40.20 learning methodologies with COBIT 2019 analytics provides Decision Tree 7.33 10.29 0.18 64.64 a robust framework to ensure that the IT management Random Forest 5.13 8.11 0.49 43.10 Gradient Boosting 4.67 7.11 0.61 41.79 methodology is consistent with global measurements and SVM 5.95 10.29 0.18 38.57 optimum methodology', '. Using COBIT metrics, organizations XGBoost 4.29 6.34 0.69 40.45 can evaluate and improve the quality of IT Governance, LightGBM 4.74 7.53 0.56 45.14 ensure compliance with regulatory provisions, and improve CatBoost 4.25 6.53 0.67 36.26 operational efficiency. As a result, these initiatives not only are presented in Table IV using MAE, RMSE, R², and MAPE improve the efficiency of project planning and execution but me trics', '. This or system being assessed. These surveys help identify research also implemented two process mining methods, weaknesses, potential risks, and practical insights from those Inductive Miner and Heuristic Miner, to create business process interacting directly with the process or system. The results models. Among these, Heuristic Miner performed better, provide valuable insights into operational dynamics and achieving a fitness score of 0.588. However, this fitness score is stakeholder sentiments', '. 3) EG10: Staff Skills: This process focuses on improving This allows for deeper analysis, real-time monitoring, and the skills of IT staff to enhance the organization’s better decision-making in IT management, ultimately aiding abilitytomanageITeffectivelyandincreaseoperational in the achievement of business goals [11]. efficiency', '. An analysis of the method\'s Manage Service Levels,"" addresses the management and performance using an event log from a bank\'s credit establishment of service levels within the scope of an application process revealed that it was 100% accurate in organization\'s IT [22]. Within DSS01, organizations are identifying incorrect patterns and judgments', '. performance; the analyze phase focuses on identifying the • Root cause validation: Confirm the root cause root cause of the problem; the improve phase measures the using data to ensure it significantly impacts impact of key process variables and modifies processes to performance', 'Optimizing IT Governance and Project Management in Software Development through AI Integration and COBIT 2019 Framework Joko Slamet Hartono Saputro Andy Teguh Department of Informatics Department of Informatics Department of Informatics Institut Teknologi Sepuluh Nopember Institut Teknologi Sepuluh Nopember Institut Teknologi Sepuluh Nopember Surabaya, Indonesia Surabaya, Indonesia Surabaya, Indonesia 6025231063@student.its.ac.id 60252310@student.its.ac.id 6025231047@student.its.ac.id Riyanarto Sarno Kelly']","The study utilized process mining methods, including Inductive Miner and Heuristic Miner, to create business process models, enhancing the evaluation of IT service processes (Identifying Non-Conforming Process in Automobile Insurance Claims Using Process Mining and COBIT 2019).","guidance for understanding, planning, and implementing effective and efficient IT management principles . By adopting COBIT 2019, organizations can improve their IT performance, reduce risks, and ensure that IT is used to support the achievement of business objectives optimally. Domain DSS01 in COBIT 2019, titled ""Define and Manage Service Levels,"" addresses the management and establishment of service levels within the scope of an organization's IT . Within DSS01, organizations are required to identify specific service requirements, including performance and reliability criteria, and manage user expectations regarding IT services. Additionally, this domain also covers the measurement and monitoring of service performance, as well as the adjustment processes necessary to ensure that the services provided remain in line with established standards. III.",0.6,0.9173421608667525
"workflow progress and delivering important insights . A major benefit of this method is its ability to use existing database logs, which can decrease the time and cost needed for data collection. Furthermore, using recorded data can reduce the likelihood of information distortion. Given its capability to analyze log data across different systems, process mining has become popular among companies aiming to examine their processe Thus, process mining not only plays a role in improving operational efficiency but also in enhancing the overall quality of healthcare services. This study discusses how process mining can be implemented to support information system audits based on COBIT 2019 for DSS01 Objective, particularly as a method of collecting and validating data within the process","["". mining enables auditors to delve into the event log data In auditing systems with COBIT, auditors use COBIT generated by information systems to visually map process standards and principles to evaluate the maturity and flows. By combining these two approaches, auditors can effectiveness of internal controls within an organization's IT conduct in-depth analyses of system compliance with COBIT system [5]"", '. visualize and understand the claim process flow, identify This technique involves analyzing event logs or records of noises from established procedures, and find areas needing events that occur within a system, such as business improvement . This analysis provides insights to enhance transactions or user activities. From this data, process mining efficiency and compliance with SOPs in managing automobile maps the actual workflow, identifies patterns, trends, and insurance claims', '. Survey audits enhance participation still relatively low due to the high variation of trace noise, which and engagement, allowing stakeholders to contribute to affects the outcomes of the process mining models. improving effectiveness and efficiency. Consequently, survey Keywords—COBIT 2019, Event Log, Graph, Process Mining. audits add a qualitative dimension to audit evaluations, facilitating better decision-making and more effective I. INTRODUCTION implementation of improvements', ""Institut Teknologi Sepuluh Nopember Institut Teknologi Sepuluh Nopember Surabaya 60111, Indonesia Surabaya 60111, Indonesia riyanarto@its.ac.id kelly@its.ac.id Abstract -- The background of this research is facing Prema et al [10] use process mining techniques to examine challenges in identifying process paths that are not in a regional hospital's billing procedure"", "". INTRODUCTION implementation of improvements. Audit system with Control Objectives for Information and Audit with COBIT 2019 and process mining from event Related Technologies (COBIT) is a process that refers to a logs represents a holistic approach to evaluating and framework designed to assist organizations in managing and enhancing the effectiveness of an organization's information controlling information technology more effectively [1], [2]. systems [12]"", "". insights into the performance of the organization's information Thus, the system audit with COBIT helps organizations systems, along with recommendations for more effective IT improve the reliability, security, and operational efficiency in management. Thus, audit with COBIT and process mining managing their information technology"", '. One The research by [10] introduce method for semantic modmajor area of research is the application of the COBIT 2019 eling of organizational knowledge aimed at enhancing data framework in different contexts, such as the development of governance, particularly for clinical research data. Utilizing internal audit models post-ERP system implementation', '. in 97.55% of cases. However, there were variations in the Using carefully crafted questionnaires, auditors directly activity sequence that indicated the presence of process paths collect data from individuals or groups involved in the process that did not comply with the SOP in 2.45% of the cases. This or system being assessed', '. Business process governance and potential bottleneck activities. control were evaluated using the COBIT 2019 methodology. The findings indicated that out of 30,000 case IDs, the majority Audit with surveys is an effective method for gathering activity sequence pattern that conformed to the SOP was found essential information to evaluate a process or system [11]. in 97.55% of cases', '. Disco is a process mining tool B. Process Mining that can analyze event logs to provide valuable insights. In this Process mining is an analytical method used to study, study, event log data from automobile insurance claims from understand, and improve business processes by leveraging 2020 to 2023 is used. With Disco, this data is analyzed to data automatically generated by information systems [16]']","Process mining allows auditors to analyze event log data and visually map process standards to evaluate compliance with COBIT, enhancing the effectiveness of internal controls within an organization's IT systems.","audits enhance participation and engagement, allowing stakeholders to contribute to improving effectiveness and efficiency. Consequently, survey audits add a qualitative dimension to audit evaluations, facilitating better decision-making and more effective implementation of improvements. Audit with COBIT 2019 and process mining from event logs represents a holistic approach to evaluating and enhancing the effectiveness of an organization's information systems . Through the use of the COBIT 2019 framework, auditors can pinpoint key controls necessary to achieve predefined business objectives. Meanwhile, event log process mining enables auditors to delve into the event log data generated by information systems to visually map process flows. By combining these two approaches, auditors can conduct in-depth analyses of system compliance with COBIT standards and identify noises",0.75,0.8965951503786929
"stage is performance analysis, where the effectiveness and efficiency of the billing processes are reviewed to identify potential areas for improvement. Overall, these stages are crucial to ensure that the billing practices at the hospital are conducted efficiently and transparently. A. Dataset The ""Hospital Billing"" event log was obtained from the financial module of the ERP system used by a regional hospital , This log records various incidents related to the billing of medical services provided by the hospital. Over a three-year period, from 2013 to 2016, a random sample of 100,000 traces was collected, each representing a recorded example of the process in the system. Within this event log, there are 18 different activities, each depicting distinct stages in","[""Institut Teknologi Sepuluh Nopember Institut Teknologi Sepuluh Nopember Surabaya 60111, Indonesia Surabaya 60111, Indonesia riyanarto@its.ac.id kelly@its.ac.id Abstract -- The background of this research is facing Prema et al [10] use process mining techniques to examine challenges in identifying process paths that are not in a regional hospital's billing procedure"", '. This is Machado, “Discovery of Hospital Billing Process in a Regional due to the high variation in trace noise, which affects the Hospital Using Process Mining,” in 2023 International Conference on outcomes of the process mining models. Third, analysis of Advancement in Data Science, E-learning and Information System case duration showed significant differences in the time (ICADEIS), IEEE, Aug. 2023, pp. 1–5. doi: required to complete a case', "". In this study, data claim process paths that are not in accordance with the SOP from the finance module of the hospital's ERP system was using process mining techniques and the COBIT 2019 explored to determine bottleneck activities in the invoice framework. The research method used involves analyzing procedure. Using anonymised event logs, this study aims to insurance claim log data using the DISCO application to map find causality in the hospital's billing process and identify the sequence of activities"", '. I. INTRODUCTION Automaticdiscoveryoftheprocessmodelsfromtheevent Automatic discovery of process models from event logs logssignificantlycontributestoorganizations,fromfinance, makesasignificantcontributiontomanyorganizations,from health, industry, government, and many others, in capturing finance,health,industry,government,andmanyotherfields, amodeldescriptionoftheexecutionofbusinessprocessesin incapturingdescriptionsofbusinessprocessexecutionmod- the field [1]', '. visualize and understand the claim process flow, identify This technique involves analyzing event logs or records of noises from established procedures, and find areas needing events that occur within a system, such as business improvement . This analysis provides insights to enhance transactions or user activities. From this data, process mining efficiency and compliance with SOPs in managing automobile maps the actual workflow, identifies patterns, trends, and insurance claims', '. ARCHITECTURE DEESCRIPTION OF METHODS IN ACCOUNT PAYYABLE MICROSERVICE OF ERP SYSTEM Function Function Method Name Function Name Description Input Output Parameter Parameter responsible for retrieving all invoices related to down payments on find-All-Invoices 0 0 purchases find-Invoice-By-IDE searches for a specific down payment invoice by its unique identifier 1 1 find-Invoices-By- allows for searching invoices based on a set of criteria, such as purchase-Down- 2 1 Criteria purchase code or invoice number', 'Fig. 2. Architecture of healthcare system case study The four services are categorized into two, the machine B. Threshold Adjustments learning services and the functional services. The machine Applying ISO/IEC 25023:2016 requires the adjustments learning services host a convolutional neural network (CNN) of thresholds to denote whether evaluation results are model each, which supports asynchronous processes through acceptable or not. Within this work, we analyze existing workers', '. This is because the event log as the main data input organization will be able to identify the necessary items inprocessminingisacomponentofabusinessprocessthat with the help of this stage in order to enhance current recordsbehavior-relatedactivities.Therelationshipbetween procedures. these activities can be accurately represented by the graph 3. Throughput/bottleneckanalysis.Determinepotentialpromodel. cessbottlenecksbyperforminganactivitytocalculatethe Sarno et al', '. valuable tool for grasping the dynamic relationship between productivity and efficiency within the dataset under analysis. Fig. 2. Productivity-Efficiency Status Figure 2 illustrates that 30% of PLTUs are operating optimally, 14% show inefficiencies in resource management, 12% experience declining performance, 35% require dedicated efforts for improvement, and 9% remain stagnant. Undeniably, the majority falls into the ""priority for Fig. 1', '. average metrics and grouping by tract and phase facilitated a manageable analysis while highlighting key performance 3) BROADERIMPLICATIONSANDCONSEQUENCES patterns. Privacy breaches in medical data can have severe con- While promising, the findings underscore several chalsequences, including workplace discrimination, increased lenges,includingdatasetbiases,computationaldemands,and insurance premiums, and erosion of trust in healthcare limited generalizability, particularly in resource-constrained systems']","The analysis of the hospital's billing process aims to identify the sequence of activities and potential areas for improvement (Machado, 2023).","organizations improve the reliability, security, and operational efficiency in managing their information technology. , Prema et al use process mining techniques to examine a regional hospital's billing procedure. This study emphasizes how crucial it is to increase the billing process' effectiveness in order to give patients higher-quality care. In this study, data from the finance module of the hospital's ERP system was explored to determine bottleneck activities in the invoice procedure. Using anonymised event logs, this study aims to find causality in the hospital's billing process and identify potential bottleneck activities. Audit with surveys is an effective method for gathering essential information to evaluate a process or system . Using carefully crafted questionnaires, auditors directly collect data from individuals or",1.0,0.9430752085764585
"Long Short-Term Memory (LSTM) , is a variation of Recurrent Neural Networks (RNN) that has been successfully applied to various Natural Language Processing (NLP) tasks. LSTM has the ability to capture long-range dependencies with sequences making it suitable for solving sequence labeling problems , , , such as Named Entity Recognition tagging (POS-Tag) and Neural (NER), Part-of-Speech combining (NMT). Study Machine Translation Bidirectional LSTM (BiLSTM) model with Conditional Random Field (CRF) to solve NER and POS-Tag Task. BiLSTM encodes word or character vectors into features, while CRF is a classifier to predict the target labels. Previous research has explored enhancing the feature extractor by integrating serves attention mechanisms with existing models or introducing alternative extractors such as Convolutional Neural Networks","['. D. CONDITIONALRANDOMFIELDLAYER In sequence labeling tasks, such as NER, CRF is a commonmethodused.Accordingtostudies,theHiddenMarkov ModelandtheMaximumEntropyMarkovModel(MEMM) are ineffective at analyzing sentence-level sequences comparedtotheCRFapproach[15].ThemainCRFfeaturesthat can compute cross-position label combination probability grab the researchers’ attention to apply this method to the FIGURE4. Softmaxbehavioronvectorsindifferentscales', '. Softmaxbehavioronvectorsindifferentscales. NERproblem.Combiningthepreviousstate-of-the-artNER model, BiLSTM, with CRF has proven to improve performance [56]. In this paper, CRF is used as the decoder for allencodercombinationsinourexperiment.Foranobserved sequence x = (cid:104)x x ... x (cid:105) with the corresponding tar1 2 n get label y = (cid:104)y y ..', '. dot-product attention as the encoder, and CRF as the Hence,somestudiesdeveloptoolstohelptheresearcherand decoder. investigatortoconductaforensicanalysis.TheDROP(Drone The paper comprises five sections. The remainder of this Open source Parser) tool developed by Clark et al. [7] is a paper is as follows', '. TheseBipletsarederivedfromaword-pair-dependencyprocesstocapturesyntacticrelationshipsbetween words.EachBipletpairundergoesdirectcomparisonwithinthepairsegments.Additionally,weemployed a BiLSTM network augmented with multi-head attention to emphasize critical words more effectively. Through experiments carried out using the SNLI Indo dataset, our approach achieved a test accuracy of 79%, demonstrating its effectiveness in exploiting syntactic dependencies to enhance the performance of RTEinIndonesian', '. Conversely, machine learning methods, especially deep the capacities of Bidirectional Long Short-Term Memory learning, learn from large datasets to identify word patterns (BiLSTM) networks, enhancing the processing of sequential and boundaries, proving more effective for languages with data by capturing contextual information from both preceding intricate structures [18], [23], [28], [29]. and subsequent text elements', '. In this case, the sistent tagging assigns each token the Component, Outside, logmessageisthedatathatwillbeannotated.Todemonstrate andIssuelabels,respectively.Aftercompletingthelabelfor thepowerofcontextuallearningintheTransformerencoder, all unique messages, we do the annotation for all messages two annotation procedures are used to label the data, i.e., contextualtaggingandconsistenttagging.Consistenttagging 6https://tecoholic.github.io/ner-annotator/ VOLUME11,2023 3267', '. Therefore, this research aims to propose the use of log message data to discover and extract some incident-related information using a deep learning-based NLP technique,i.e.,namedentityrecognitionusingtheTransformer.Cosinesimilarityisproposedasasubstitute fordot-productintheself-attentionmechanismoftheTransformerencoderlayer.Additionally,wepropose NER architecture built from a mix of several existing methods and report the performance evaluation', 'dataset[18].Themodel’sperformancewasenhancedbythe dingmodels,suchasWord2vec[34],GloVe[35],ELMo[36], concept of concatenating the word’s vector representation and BERT [13], improved the BiLSTM-CRF architecture', '. We trained the models using 540k sentence pairs from BiLSTM can accommodate sequence information, which SNLI Indo. Based on our model, we made the following is then used by multi-head attention to learn information adjustments: 1) Replacing Multi-Head Attention with Self- from various dimensions and subspace representations, Attention. We replaced the multi-head attention activation fully capturing long-distance text features', '. This model structure has proven effective and is a foundational architectureforfurtherdevelopment. Addressing shortcomings in attention-based models, particularly misalignment issues, [16] proposed a neural network-based RTE model capable of capturing syntactic FIGURE1. TheproposedarchitectureutilizesBiLSTMandmulti-head elementsinsentencepairs,afeatureinadequatelydetectedby attention(Indo-BiEnt)']",The combination of the BiLSTM model with Conditional Random Fields (CRF) has been shown to enhance performance in Named Entity Recognition tasks.,"concept of concatenating the word’s vector representation with the Bidirectional Long Short-Term Memory (LSTM) layer output. The Conditional Random Field (CRF) layer is 3260 VOLUME 11, 2023 S. Silalahi et al.: Transformer-Based NER on Drone Flight Logs to Support Forensic Investigation used to decode the concatenated output since it can determine how the sequence labels relate to one another. Most of the work involved in implementing deep learning models is predominantly spent on ﬁguring out how to prepare adequate input representations. Most often, word embedding techniques like GloVe , Word2vec , BERT , and ELMo are used to learn the input representation. Pre- trained language models, such as BERT and ELMo, can generate contextualized representational vectors after going through a",1.0,0.9063784551587273
"as runtime logs that are constantly generated during the operational period of the device. The information recorded in log data is highly valuable for many purposes, including running system monitoring, running process conformance checks, and overall system evaluation . The use of log data is critical when incident cases occur, as the empirical events and incident scenarios can be discovered by analysing the log artefacts. Assuming that 64252 2024 The Authors. This work is licensed under a Creative Commons Attribution-NonCommercial-NoDerivatives 4.0 License. For more information, see VOLUME 12, 2024 S. Silalahi et al.: Severity-Oriented Multiclass Drone Flight Logs Anomaly Detection the integrity of the log is guaranteed, log data is one of the artefacts with the highest priority for investigating","['. Inspired by the study, anomalous events on drone objective[33].Anotheralternativetoleveragethepre-trained flight logs can be detected by analysing log messages and model is fine-tuning the models using prompts [34]. With identifying suspect key phrases closely related to drone onlyafewtrainingdata,themodelcancapturethesemantics incident scenarios. Therefore, the region of interest in this of the input logs and detect anomalous log sequences well', 'robust predictions, enabling drone operators to detect and Furthermore, Jain et al. [10] proposed a framework for diagnose malfunctions quickly and take corrective actions. sensor data identification and verification. An analysis of a Thestructureofthispaperisasfollows.SectionIIpresents drone’sarchitectureandaforensicmodelwithgenericfeatures previous research relating to the drone log analysis and drone are proposed here in order to enhance the digital investigation forensics', '. DigitalObjectIdentifier10.1109/ACCESS.2025.3580056 Interpretable Ordinal-Aware With Contrastive-Enhanced Anomaly Severity Detection on UAV Flight Log Messages SWARDIANTARASILALAHI 1,(GraduateStudentMember,IEEE), TOHARIAHMAD 1,(Member,IEEE),HUDANSTUDIAWAN 1,(Member,IEEE), EIRINIANTHI 2,ANDLOWRIWILLIAMS 2 1DepartmentofInformatics,InstitutTeknologiSepuluhNopember,Surabaya60111,Indonesia 2SchoolofComputerScienceandInformatics,CardiffUniversity,CF244AGCardiff,U.K', '. incident. This information could help investigators determine ThispaperproposestheTransformermethodforclassifying whether the crash was due to a malfunction, operator error, drone malfunctions based on telemetry data. By leveraging or external factors such as weather conditions or interference their ability to handle sequential data and capture complex from other sources', 'S.Silalahietal.:InterpretableOrdinal-AwareWithContrastive-EnhancedAnomalySeverityDetection 1) Human-readable log messages can be found in the flightlog,whichishighlyrelevanttovariousincident cases,asshowninFig3.Notonlyisithighlyrelevant, but it is also highly prioritised evidence in diverse investigationcases. 2) Flight log messages cover events from the drone’s sensors,features,andcomponents,makingitonepiece of evidence to perform analysis related to different drone software and hardware components', '. use self-attention mechanism to selectively focus on relevant Important analysis of drone logs involves the identification parts of the input sequence, enabling the model to learn of the most critical pieces of information in the log data long-term dependencies effectively [4]. This is particularly and the analysis of how they relate to the incident under useful for drone telemetry data, which is often collected over investigation. This analysis can help investigators identify the extended periods', '. combinedfromtwopublicdroneflightlogdatasets,i.e.,from 5) DroLoVe[9].ThestudyproposedamultitasklearningMendeley[51]andadronewiki[52].Therearetwodatasets: based anomaly severity detection on drone flight unfiltered and filtered. The unfiltered dataset is a collection logs with an assumption that, samples belonging to of log messages in its original condition gathered from the twosourceswithoutperforminguniquefiltering.Therefore, thereareseveralduplicatelogmessagesbothintrainingand TABLE4', '. Most drone incidents are caused analysis of drone logs can also provide evidence that can be by bird attacks, collide with other drones, and malfunctioning used in legal proceedings. This evidence can be particularly systems.Sometimesthedronemayhaveamalfunctioningsystem valuable in cases where there are disputes over liability, such caused by sensor failure, a broken motor, or CPU failure. This cancauseanaccident.Therefore,aforensicinvestigationsupports as in cases of property damage or personal injury', '. Sentiment analysis-based log anomaly readablemessagesdescribingtheoccurringeventsduringthe detection was firstly introduced in [7], which rely on an operation of a drone. This file stores all information during assumptionthat,logmessagesthatcontainwordsorphrases aflight,suchasflighttimestamps,flightparameters,sensor with negative connotations considered anomalies. Another data, components’ status, and flight mode', '. [8] S. Silalahi, T. Ahmad, and H. Studiawan, ‘‘Drone flight log anomaly severityclassificationviasentenceembedding,’’inProc.Int.Conf.Artif. [30] S. Han, Q. Wu, H. Zhang, B. Qin, J. Hu, X. Shi, L. Liu, and X. Yin, Intell.,Blockchain,CloudComput.,DataAnal.(ICoABCD),Nov.2023, ‘‘Log-basedanomalydetectionwithrobustfeatureextractionandonline pp.100–105. learning,’’IEEETrans.Inf.ForensicsSecurity,vol.16,pp.2300–2311, 2021']","Human-readable log messages in flight logs are considered highly relevant and prioritized evidence in various incident investigations (Silalahi et al., 2024).","highly relevant to various incident cases, as shown in Fig 3. Not only is it highly relevant, but it is also highly prioritised evidence in diverse investigation cases. 2) Flight log messages cover events from the drone’s sensors, features, and components, making it one piece of evidence to perform analysis related to different drone software and hardware components. Therefore, analysing the log messages means analysing the whole device for various possible incident scenarios. 3) Flight log messages contain contextual information about the occurring event as a description that involves multiple parts of the drone simultaneously. For example, a certain circumstance fails a feature or an operation, as shown in message group number 4 in Table 1. TABLE 1. Groups of",0.6666666666666666,0.9222475412706449
"particular system log may need different techniques from one type to another. Generally, log-based anomaly detection can be performed using either point, collective, or contextual approaches. In the log-based anomaly detection literature, most of the existing studies propose either a contextual or collective approach, where the decision is taken by examining a sequence of log events. However, detecting abnormalities in log data can be performed using a point-based approach, where one single log record is the only feature needed. Therefore, several studies explored utilising a point-based approach to detect anomalous events on logs data, such as in operating systems , , drone devices , and distribution systems , . In the drone context, a log message contains a description of","['. Existing anomaly detection modelling techniques can be conducted either in a point, contextual, or collective setting. Point anomaly FIGURE4. Anillustrationofanomaliesthatoccurduringadrone’sflight. detectioncharacteriseseachlogentry,whetheraneventisan abnormalityoranormalevent.Forinstance,ifausertypesthe wrong password when trying to gain access to an operating inclusive', '. system remains a topic of interest for the cybersecurity A common approach is the log-based anomaly detecresearch and practitioner communities, such as those in tion approach, which involves the analysis of log entries recorded by systems either in sequence-based or pointThe associate editor coordinating the review of this manuscript and based modelling techniques, considering the case and data characteristics[1]. approvingitforpublicationwasYangTang', 'S.Silalahietal.:InterpretableOrdinal-AwareWithContrastive-EnhancedAnomalySeverityDetection approach is presented in Section III. The experimental settingsandprocedurearedescribedinSectionIV,whilethe results,findings,anddiscussionsareelaboratedinSectionV. Finally,weconcludethepaperinSectionVI. II. RELATEDWORKS A. LOG-BASEDANOMALYDETECTION Log-based anomaly detection is relatively well-studied, includingincorporatingML[1]anddeeplearning-based[18], [19] to facilitate log anomaly detection', '. Another case scenario in log-based anomaly detection Supervised contrastive learning is employed to learn is a sequence-based approach, where an abnormality is distinctrepresentationsforeachanomalyseveritylevel. determined by analysing a group of events that occur 3) Weexploretwotargetlabelrepresentationstoaugment sequentially within a certain window size [22]', '. e thatundergoesadoublenegation.Therefore,considering 5 Another closely related study fine-tuned several pre-trained the context when performing sentiment analysis to detect LLMs to detect anomalous log entries in a point-based anomaliesindronelogmessagesiscrucial,especiallywhen approach[6].However,existingstudiesonlydetectwhether thelogmessagesfromdifferentclassessharecommonwords an event or subsequent event is an anomaly. In a forensic orphrases', '. Therefore, this paper proposes a multitask-based systemprompt,thegeneratedlogmessagecanbeconsidered multiclass drone anomaly detection to assist in a forensic as an anomaly [7], [20], [21]. As for contextual anomaly, investigation. The main contributions of this paper are the detection involves analysing some contextually related summarizedasfollows: attributes to determine whether a log entry is an anomaly', '. Thisstudyproposestoextendthebinaryanomalydetection into a multiclass anomaly detection involving four classes: Normal,Low,Medium,andHigh.Thethreeanomalyclasses representingtheseverityoftheabnormalityaredistinguished byseveralcharacteristicsdescribedinSectionIV-A.AsillustratedbyFig.4,adroneexperiencesvariouseventsfromthe takeoff(e )tothelanding(e ).Eacheventisrepresentedby 1 6 a log message that contains a description of the occurring phenomenon.Amongtheeventsthathappenduringaflight, there might be low,', '. In a forensic orphrases. setting, analysing a large number of log entries resulting from binary anomaly detection is considered inefficient and labour-intensive as the detection is performed on the C. SCOPEANDCONTRIBUTIONS acquired evidence at one time [12]', '. encoder for anomaly detection. A similar study exploits Performing anomaly detection using a sequence-based theabundanceofpre-trainedtransformermodelstoperform approach is commonly conducted by training RNN-based anomalydetectionbyusingsentimentanalysisondroneflight models using a dataset containing a collection of a series log messages [6], which then expanded to multiclass in [9]. of events', '. Noisy data methods, we verify the superiority of our proposed and heterogeneous structures are common problems in logapproach. based anomaly detection. Performing log parsing is one of 5) Provide the experimental code publicly available on the options to reduce the noise. Another approach is to a GitHub repository2 to promote reproducible and employacontextualembedding,suchasBERT[25],thatcan verifiableresearch. capture the semantics of the log messages [26]']","Log-based anomaly detection can be performed using point, contextual, or collective approaches, with point anomaly detection focusing on individual log entries to identify abnormalities (Silahi et al.).","Existing anomaly detection modelling techniques can be conducted either in a point, contextual, or collective setting. Point anomaly detection characterises each log entry, whether an event is an abnormality or a normal event. For instance, if a user types the wrong password when trying to gain access to an operating system prompt, the generated log message can be considered as an anomaly , , . As for contextual anomaly, the detection involves analysing some contextually related attributes to determine whether a log entry is an anomaly. As an example, the flight path taken by a drone during a flight is recorded in longitude and latitude coordinates. These data can be used to detect an anomaly by finding a peculiar value",0.6666666666666666,0.9671940772211712
"several studies explored utilising a point-based approach to detect anomalous events on logs data, such as in operating systems , , drone devices , and distribution systems , . In the drone context, a log message contains a description of occurring events which are triggered by various components such as sensors, peripherals, and firmware. Analysing the log message means analysing events from all aspects of the drone, including sensors, components and features . Typically, existing log-based anomaly detection stud- ies classify log events into two categories: normal and anomaly . This is helpful in an online setting, where the number of detected abnormalities in a certain period of time is considerably small. However, in a digital forensic setting, where the","['. challenges for drone digital forensics investigations,’’ Array, vol. 14, Jul.2022,Art.no.100135. [27] J. Qi, Z. Luan, S. Huang, C. Fung, H. Yang, H. Li, D. Zhu, and D.Qian,‘‘LogEncoder:Log-basedcontrastiverepresentationlearningfor [5] H.Studiawan,G.Grispos,andK.-K.-R.Choo,‘‘Unmannedaerialvehicle anomalydetection,’’IEEETrans.Netw.ServiceManage.,vol.20,no.2, (UAV)forensics:Thegood,thebad,andtheunaddressed,’’Comput.Secur., pp.1378–1391,Jun.2023. vol.132,Sep.2023,Art.no.103340. [28] J. Li, H. He, S. Chen, D', '. [8] S. Silalahi, T. Ahmad, and H. Studiawan, ‘‘Drone flight log anomaly severityclassificationviasentenceembedding,’’inProc.Int.Conf.Artif. [30] S. Han, Q. Wu, H. Zhang, B. Qin, J. Hu, X. Shi, L. Liu, and X. Yin, Intell.,Blockchain,CloudComput.,DataAnal.(ICoABCD),Nov.2023, ‘‘Log-basedanomalydetectionwithrobustfeatureextractionandonline pp.100–105. learning,’’IEEETrans.Inf.ForensicsSecurity,vol.16,pp.2300–2311, 2021', '. Therefore, this paper proposes a multitask-based systemprompt,thegeneratedlogmessagecanbeconsidered multiclass drone anomaly detection to assist in a forensic as an anomaly [7], [20], [21]. As for contextual anomaly, investigation. The main contributions of this paper are the detection involves analysing some contextually related summarizedasfollows: attributes to determine whether a log entry is an anomaly', 'robust predictions, enabling drone operators to detect and Furthermore, Jain et al. [10] proposed a framework for diagnose malfunctions quickly and take corrective actions. sensor data identification and verification. An analysis of a Thestructureofthispaperisasfollows.SectionIIpresents drone’sarchitectureandaforensicmodelwithgenericfeatures previous research relating to the drone log analysis and drone are proposed here in order to enhance the digital investigation forensics', '. In a forensic orphrases. setting, analysing a large number of log entries resulting from binary anomaly detection is considered inefficient and labour-intensive as the detection is performed on the C. SCOPEANDCONTRIBUTIONS acquired evidence at one time [12]', '. For example, in drone forensics, existing studiesgenerallyconsideranomaliesascontradictorytonormalevents.Inotherwords,alltypesofanomalies are considered equally important. However, the peculiar events experienced by a drone during a flight might contain distinct features indicating the anomalies’ importance or level of urgency. For instance, the message ‘‘Critically low power', '. 1 illustrates a forensic timeline conWhile the drone is flying, any event that happens to the structed from the flight log message along with mentioned drone is recorded in a log file, including the component’s entitieswithin.Awell-constructedforensictimelineexposes state,suchassensors,motors,GPS,andlinks.Thesedataare sequentialeventsexperiencedbyasystemregardingaparticstoredintelemetryanddataflashlogslocatedinthepersistent ularsecurityincident[21].Inthisresearch,weuseflightlog storage attached to the', '. theexperimentalresults,theTransformerobtainsthehighestF1 In the context of classifying drone malfunctions, the Transscore value of 93.04%. former model can be trained on a dataset of labeled drone Index Terms—drone forensics, forensic investigation, malfunctelemetry data to learn patterns and relationships between the tions, infrastructure, Transformer, Informer, FEDformer drone’s behavior and the root cause of a malfunction. The dataset can include features such as altitude, velocity, battery I', '. Mantas and Patsakis [6] data to construct a forensic timeline that consists of the log have attempted to utilize telemetry and dataflash logs to messageandthetimestamp. perform drone forensic investigation by performing UAV To perform NER, two common deep learning modintegritychecks,anomalydetectiononthevisualflightpath, els can be used, either RNN-based or Transformer-based command verification, error reporting, and hardware error models. The latest state-of-the-art include BiLSTM-CRF detection', '. As depicted in Fig 18, the highlighted to multiclass anomaly detection while exploiting the shared words align more with the attribution label, supported by high- and low-level features within the log messages that seven out of eight examples belonging to the High severity belong to different severity levels. Therefore, the forensic having positive attribution scores']","In a forensic setting, analyzing a large number of log entries through binary anomaly detection is inefficient and labor-intensive (Studiawan et al., 2023).","highly relevant to various incident cases, as shown in Fig 3. Not only is it highly relevant, but it is also highly prioritised evidence in diverse investigation cases. 2) Flight log messages cover events from the drone’s sensors, features, and components, making it one piece of evidence to perform analysis related to different drone software and hardware components. Therefore, analysing the log messages means analysing the whole device for various possible incident scenarios. 3) Flight log messages contain contextual information about the occurring event as a description that involves multiple parts of the drone simultaneously. For example, a certain circumstance fails a feature or an operation, as shown in message group number 4 in Table 1. TABLE 1. Groups of",0.6666666666666666,0.9067022232388957
"classify log events into two categories: normal and anomaly . This is helpful in an online setting, where the number of detected abnormalities in a certain period of time is considerably small. However, in a digital forensic setting, where the detection is performed on all collected artefacts which might be large in size, the number of the abnormalities is likely to be large . Thus, analysing the detection result in a binary setting is impractical for the investigator. Moreover, out of all detected peculiarities, there might be several negligible ones with less severe impacts on the system or less likely to be related to an incident. Extending binary to multiclass anomaly detection can provide more detailed and contextual detection results","['. As depicted in Fig 18, the highlighted to multiclass anomaly detection while exploiting the shared words align more with the attribution label, supported by high- and low-level features within the log messages that seven out of eight examples belonging to the High severity belong to different severity levels. Therefore, the forensic having positive attribution scores', '. In a forensic orphrases. setting, analysing a large number of log entries resulting from binary anomaly detection is considered inefficient and labour-intensive as the detection is performed on the C. SCOPEANDCONTRIBUTIONS acquired evidence at one time [12]', '. e thatundergoesadoublenegation.Therefore,considering 5 Another closely related study fine-tuned several pre-trained the context when performing sentiment analysis to detect LLMs to detect anomalous log entries in a point-based anomaliesindronelogmessagesiscrucial,especiallywhen approach[6].However,existingstudiesonlydetectwhether thelogmessagesfromdifferentclassessharecommonwords an event or subsequent event is an anomaly. In a forensic orphrases', '. Ou and J. Liu, “Log anomaly detection method based on hybrid transformer-bilstm models,” in 2022 IEEE 22nd International ConferInformerandFedFormermodelsmayoutperformTransformerenceonSoftwareQuality,Reliability,andSecurityCompanion(QRS-C), based models. pp.762–763,2022. [16] S. Pasch and D. Ehnes, “Nlp for responsible finance: Fine-tuning transformer-based models for esg,” in 2022 IEEE International ConV. CONCLUSIONS ferenceonBigData(BigData),pp.3532–3536,2022', '. Working with deep forensic frameworks. This step aims to understand several learning models is primarily a matter of providing decent possibleindicatorsofcompromise,definepotentialforensic input to the neural model', 'S.Silalahietal.:InterpretableOrdinal-AwareWithContrastive-EnhancedAnomalySeverityDetection approach is presented in Section III. The experimental settingsandprocedurearedescribedinSectionIV,whilethe results,findings,anddiscussionsareelaboratedinSectionV. Finally,weconcludethepaperinSectionVI. II. RELATEDWORKS A. LOG-BASEDANOMALYDETECTION Log-based anomaly detection is relatively well-studied, includingincorporatingML[1]anddeeplearning-based[18], [19] to facilitate log anomaly detection', '. challenges for drone digital forensics investigations,’’ Array, vol. 14, Jul.2022,Art.no.100135. [27] J. Qi, Z. Luan, S. Huang, C. Fung, H. Yang, H. Li, D. Zhu, and D.Qian,‘‘LogEncoder:Log-basedcontrastiverepresentationlearningfor [5] H.Studiawan,G.Grispos,andK.-K.-R.Choo,‘‘Unmannedaerialvehicle anomalydetection,’’IEEETrans.Netw.ServiceManage.,vol.20,no.2, (UAV)forensics:Thegood,thebad,andtheunaddressed,’’Comput.Secur., pp.1378–1391,Jun.2023. vol.132,Sep.2023,Art.no.103340. [28] J. Li, H. He, S. Chen, D', '. An interesting witharandomstateof42. pattern is shown in Table 8 regarding the hyperparameter Four encoder types are selected to be combined with the values on each encoder type. The GRU works well with baseline and proposed scenarios, i.e., Transformer, LSTM, more layers, average pooling, and uniform class weighting. GRU, and Linear, since these encoders are standard in log- Differently, the Linear model has benefited from the [CLS] based anomaly detection as discussed in Section II', '. H. Ngo, T. Kechadi, and N.-A. Le-Khac, ‘‘Domain specific entity forensic analysis,’’ in Proc. 16th Austral. Digit. Forensics Conf., 2018, recognitionwithsemantic-baseddeeplearningapproach,’’IEEEAccess, pp.1–10. vol.9,pp.152892–152902,2021. [36] M.AffiandC.Latiri,‘‘BE-BLC:BERT-ELMO-baseddeepneuralnetwork [14] N.Perera,T.T.L.Nguyen,M.Dehmer,andF.Emmert-Streib,‘‘Compar- architectureforEnglishnamedentityrecognitiontask,’’Proc.Comput', '. Another case scenario in log-based anomaly detection Supervised contrastive learning is employed to learn is a sequence-based approach, where an abnormality is distinctrepresentationsforeachanomalyseveritylevel. determined by analysing a group of events that occur 3) Weexploretwotargetlabelrepresentationstoaugment sequentially within a certain window size [22]']","In a forensic setting, analyzing a large number of log entries from binary anomaly detection is inefficient and labor-intensive (Silahi et al., 2022).","LLMs to detect anomalous log entries in a point-based approach . However, existing studies only detect whether an event or subsequent event is an anomaly. In a forensic setting, analysing a large number of log entries resulting from binary anomaly detection is considered inefficient and labour-intensive as the detection is performed on the acquired evidence at one time . Therefore, too many detected anomalies need to be detailed into a more fine- grained detection to help the investigator better prioritise the analysis objective. As a result, this study extends the binary anomaly detection to multi-class anomaly detection, as exemplified by another domain application such as plane flight data , image data , and internet of vehicle . As a consequence,",0.6666666666666666,0.9419923616860367
"comparison of the proposed framework, several baselines are constructed, including those that are proposed in published works. This paper proposes a transformer encoder-based log- based anomaly detection optimised using multitask label representation to help the model learn from the overlapped features shared by the samples from different severity levels. A domain-specific decoding procedure is also proposed to infer the prediction result. In-depth analyses are performed to evaluate the proposed framework thoroughly. The main contributions of this paper are summarised as follows: 1) Propose Drone Log Severity (DroLoVe), a severity- oriented multiclass anomaly detection approach on drone flight log data. 2) Propose a data-driven vector representation of the label and a severity-oriented decoding procedure of the VOLUME 12, 2024 64253 S.","['. Inspired by the study, anomalous events on drone objective[33].Anotheralternativetoleveragethepre-trained flight logs can be detected by analysing log messages and model is fine-tuning the models using prompts [34]. With identifying suspect key phrases closely related to drone onlyafewtrainingdata,themodelcancapturethesemantics incident scenarios. Therefore, the region of interest in this of the input logs and detect anomalous log sequences well', '. encoder for anomaly detection. A similar study exploits Performing anomaly detection using a sequence-based theabundanceofpre-trainedtransformermodelstoperform approach is commonly conducted by training RNN-based anomalydetectionbyusingsentimentanalysisondroneflight models using a dataset containing a collection of a series log messages [6], which then expanded to multiclass in [9]. of events', 'S.Silalahietal.:InterpretableOrdinal-AwareWithContrastive-EnhancedAnomalySeverityDetection approach is presented in Section III. The experimental settingsandprocedurearedescribedinSectionIV,whilethe results,findings,anddiscussionsareelaboratedinSectionV. Finally,weconcludethepaperinSectionVI. II. RELATEDWORKS A. LOG-BASEDANOMALYDETECTION Log-based anomaly detection is relatively well-studied, includingincorporatingML[1]anddeeplearning-based[18], [19] to facilitate log anomaly detection', '. CONCLUSION remains untested as the training dataset contains only log This paper investigates utilising a multitask learning messages acquired from 82 drone models, mostly from paradigmtoperformmulticlassanomalydetectionondrone DJI. This is one of the main challenges in drone forensics flight log messages. Aligning to the nature of multitask research, where human-readable flight log datasets from learning,weproposetwotargetlabelrepresentations,namely other drone models are unavailable', '. DigitalObjectIdentifier10.1109/ACCESS.2025.3580056 Interpretable Ordinal-Aware With Contrastive-Enhanced Anomaly Severity Detection on UAV Flight Log Messages SWARDIANTARASILALAHI 1,(GraduateStudentMember,IEEE), TOHARIAHMAD 1,(Member,IEEE),HUDANSTUDIAWAN 1,(Member,IEEE), EIRINIANTHI 2,ANDLOWRIWILLIAMS 2 1DepartmentofInformatics,InstitutTeknologiSepuluhNopember,Surabaya60111,Indonesia 2SchoolofComputerScienceandInformatics,CardiffUniversity,CF244AGCardiff,U.K', '. [8] S. Silalahi, T. Ahmad, and H. Studiawan, ‘‘Drone flight log anomaly severityclassificationviasentenceembedding,’’inProc.Int.Conf.Artif. [30] S. Han, Q. Wu, H. Zhang, B. Qin, J. Hu, X. Shi, L. Liu, and X. Yin, Intell.,Blockchain,CloudComput.,DataAnal.(ICoABCD),Nov.2023, ‘‘Log-basedanomalydetectionwithrobustfeatureextractionandonline pp.100–105. learning,’’IEEETrans.Inf.ForensicsSecurity,vol.16,pp.2300–2311, 2021', '. Ou and J. Liu, “Log anomaly detection method based on hybrid transformer-bilstm models,” in 2022 IEEE 22nd International ConferInformerandFedFormermodelsmayoutperformTransformerenceonSoftwareQuality,Reliability,andSecurityCompanion(QRS-C), based models. pp.762–763,2022. [16] S. Pasch and D. Ehnes, “Nlp for responsible finance: Fine-tuning transformer-based models for esg,” in 2022 IEEE International ConV. CONCLUSIONS ferenceonBigData(BigData),pp.3532–3536,2022', '. For instance, the message ‘‘Critically low power. Aircraft is landing’’ is more important than ‘‘Forward Obstacle Sensing notWorking’’.ThisstudyproposesDroneLog,aninterpretableframeworkfordetectinganomaliesandthe severity levels on drone flight logs, using a multitask learning approach in a unified pipeline', '. Instead multitask learning can help the model make use of of removing these values completely, they can be used as the shared low-level features in the log messages to an additional feature to the log message feature vector to perform anomaly detection. Moreover, the proposed enrich the log features representation [23]. The relationship targetlabelisdesignedtoincorporatetheordinalnature between the log events is crucial in log-based anomaly ofthelabel. detection', '. Another case scenario in log-based anomaly detection Supervised contrastive learning is employed to learn is a sequence-based approach, where an abnormality is distinctrepresentationsforeachanomalyseveritylevel. determined by analysing a group of events that occur 3) Weexploretwotargetlabelrepresentationstoaugment sequentially within a certain window size [22]']","The proposed framework for detecting anomalies and severity levels in drone flight logs utilizes a multitask learning approach, as described by Silalahi et al. (2024).","depicted in Fig 18, the highlighted words align more with the attribution label, supported by seven out of eight examples belonging to the High severity having positive attribution scores. The model perceives the log messages better than the previous BERT-based model. The complete report of attributions toward each severity label can be accessed on the repo. VI. CONCLUSION VI. CONCLUSION This paper investigates utilising a multitask learning paradigm to perform multiclass anomaly detection on drone flight log messages. Aligning to the nature of multitask learning, we propose two target label representations, namely Multitask-101 and Multitask-111. The integrated gradient is employed to interpret the model’s behavior. During the interpretability analysis, we found that the embedding vectors from BERT do not align",0.5,0.9425317518383289
"follows: 1) Propose Drone Log Severity (DroLoVe), a severity- oriented multiclass anomaly detection approach on drone flight log data. 2) Propose a data-driven vector representation of the label and a severity-oriented decoding procedure of the VOLUME 12, 2024 64253 S. Silalahi et al.: Severity-Oriented Multiclass Drone Flight Logs Anomaly Detection FIGURE 2. A word cloud visualisation to see that the samples from different severity levels share common words and phrases. The remainder of the paper is structured as follows: Section II discusses relevant previous studies related to log-based anomaly detection and how to deal with class imbalance problems in log-based anomaly detection task, the proposed framework is explained in detail in Section III, Section IV provides the experimental setup, followed","['. DigitalObjectIdentifier10.1109/ACCESS.2025.3580056 Interpretable Ordinal-Aware With Contrastive-Enhanced Anomaly Severity Detection on UAV Flight Log Messages SWARDIANTARASILALAHI 1,(GraduateStudentMember,IEEE), TOHARIAHMAD 1,(Member,IEEE),HUDANSTUDIAWAN 1,(Member,IEEE), EIRINIANTHI 2,ANDLOWRIWILLIAMS 2 1DepartmentofInformatics,InstitutTeknologiSepuluhNopember,Surabaya60111,Indonesia 2SchoolofComputerScienceandInformatics,CardiffUniversity,CF244AGCardiff,U.K', '. Inspired by the study, anomalous events on drone objective[33].Anotheralternativetoleveragethepre-trained flight logs can be detected by analysing log messages and model is fine-tuning the models using prompts [34]. With identifying suspect key phrases closely related to drone onlyafewtrainingdata,themodelcancapturethesemantics incident scenarios. Therefore, the region of interest in this of the input logs and detect anomalous log sequences well', '. 1) We propose DroneLog, an interpretable sentimentAs an example, the flight path taken by a drone during a based multiclass drone flight log anomaly detection flightisrecordedinlongitudeandlatitudecoordinates.These frameworkthatincludesthreeanomalyseveritylevels: datacanbeusedtodetectananomalybyfindingapeculiar low,medium,andhigh.Providingtheseveritylevelcan valuewithinthelogrecordsbycontrastingthenormalvalues provide better detection results for the investigator to', '. [8] S. Silalahi, T. Ahmad, and H. Studiawan, ‘‘Drone flight log anomaly severityclassificationviasentenceembedding,’’inProc.Int.Conf.Artif. [30] S. Han, Q. Wu, H. Zhang, B. Qin, J. Hu, X. Shi, L. Liu, and X. Yin, Intell.,Blockchain,CloudComput.,DataAnal.(ICoABCD),Nov.2023, ‘‘Log-basedanomalydetectionwithrobustfeatureextractionandonline pp.100–105. learning,’’IEEETrans.Inf.ForensicsSecurity,vol.16,pp.2300–2311, 2021', '. combinedfromtwopublicdroneflightlogdatasets,i.e.,from 5) DroLoVe[9].ThestudyproposedamultitasklearningMendeley[51]andadronewiki[52].Therearetwodatasets: based anomaly severity detection on drone flight unfiltered and filtered. The unfiltered dataset is a collection logs with an assumption that, samples belonging to of log messages in its original condition gathered from the twosourceswithoutperforminguniquefiltering.Therefore, thereareseveralduplicatelogmessagesbothintrainingand TABLE4', '. B. PROBLEMSTATEMENT For instance, at the e , the drone exceeds the maximum In the event that there is only benign data (i.e., no sample 3 flight distance. Several sentiment-baring words or phrases of abnormal data), anomaly detection can be conducted by from the illustration include ‘‘out of range’’, ‘‘overheated’’, training a recurrent neural network (RNN)–based model and ‘‘failed’’', '. Thisstudyproposestoextendthebinaryanomalydetection into a multiclass anomaly detection involving four classes: Normal,Low,Medium,andHigh.Thethreeanomalyclasses representingtheseverityoftheabnormalityaredistinguished byseveralcharacteristicsdescribedinSectionIV-A.AsillustratedbyFig.4,adroneexperiencesvariouseventsfromthe takeoff(e )tothelanding(e ).Eacheventisrepresentedby 1 6 a log message that contains a description of the occurring phenomenon.Amongtheeventsthathappenduringaflight, there might be low,', 'robust predictions, enabling drone operators to detect and Furthermore, Jain et al. [10] proposed a framework for diagnose malfunctions quickly and take corrective actions. sensor data identification and verification. An analysis of a Thestructureofthispaperisasfollows.SectionIIpresents drone’sarchitectureandaforensicmodelwithgenericfeatures previous research relating to the drone log analysis and drone are proposed here in order to enhance the digital investigation forensics', '. In this context, having less FP is more important than having less FN, as the task objective is anomaly severity detection, where we aim to detect all abnormalities along withtheseveritylevel.Therefore,undetectedabnormalities, or detecting higher severity as lower ones, indicate that the model fails to meet the task’s objectives', '. For instance, the message ‘‘Critically low power. Aircraft is landing’’ is more important than ‘‘Forward Obstacle Sensing notWorking’’.ThisstudyproposesDroneLog,aninterpretableframeworkfordetectinganomaliesandthe severity levels on drone flight logs, using a multitask learning approach in a unified pipeline']","The proposed framework, DroneLog, utilizes a multitask learning approach to detect anomalies and their severity levels in drone flight logs (Silalahi et al., 2025).","be employed to force the model to learn a distinctive representation of the positive FIGURE 4. An illustration of anomalies that occur during a drone’s flight. inclusive. Therefore, this paper proposes a multitask-based multiclass drone anomaly detection to assist in a forensic investigation. The main contributions of this paper are summarized as follows: 1) We propose DroneLog, an interpretable sentiment- based multiclass drone flight log anomaly detection framework that includes three anomaly severity levels: low, medium, and high. Providing the severity level can provide better detection results for the investigator to pinpoint the event of interest. Interpretability makes training and testing more transparent, the model trustworthy, and human-friendly. 2) We propose DroneSBERT,1 a domain-specific embed- ding to extract semantic features",0.8,0.9100882929225571
"anomaly detection approach is adopted in this paper. Table 1 presents the summary of the previous related works. B. CLASS IMBALANCE PROBLEM (CIP) IN LOG-BASED ANOMALY DETECTION It is assured that in log-based anomaly detection, the number of anomalous samples is significantly less than the normal ones. Employing a supervised-based technique is prone to bias, as the model tends to learn from the majority samples. To overcome CIP, several studies proposed data-level and algorithm-level solutions . Moreover, in a certain case, there are no anomalous samples available. In this particular situation, a one-class approach can be used to construct a normal baseline model. During the detection, an anomaly score is used to decide if an input event is anomalous based","['S.Silalahietal.:InterpretableOrdinal-AwareWithContrastive-EnhancedAnomalySeverityDetection approach is presented in Section III. The experimental settingsandprocedurearedescribedinSectionIV,whilethe results,findings,anddiscussionsareelaboratedinSectionV. Finally,weconcludethepaperinSectionVI. II. RELATEDWORKS A. LOG-BASEDANOMALYDETECTION Log-based anomaly detection is relatively well-studied, includingincorporatingML[1]anddeeplearning-based[18], [19] to facilitate log anomaly detection', '. Another case scenario in log-based anomaly detection Supervised contrastive learning is employed to learn is a sequence-based approach, where an abnormality is distinctrepresentationsforeachanomalyseveritylevel. determined by analysing a group of events that occur 3) Weexploretwotargetlabelrepresentationstoaugment sequentially within a certain window size [22]', '. Thisstudyproposestoextendthebinaryanomalydetection into a multiclass anomaly detection involving four classes: Normal,Low,Medium,andHigh.Thethreeanomalyclasses representingtheseverityoftheabnormalityaredistinguished byseveralcharacteristicsdescribedinSectionIV-A.AsillustratedbyFig.4,adroneexperiencesvariouseventsfromthe takeoff(e )tothelanding(e ).Eacheventisrepresentedby 1 6 a log message that contains a description of the occurring phenomenon.Amongtheeventsthathappenduringaflight, there might be low,', '. On the otherhand,thefiltereddatasetisacollectionoflogmessages afterauniquefilteringprocess.Thisisalignedwiththenorm insupervisedlearning,wherethetrainandtestsetmustnot sharecommonsamples.Thedatasetcompositionispresented inTable4.Afterreadingallthemessagescarefully,weinfer TABLE5. Anomalyseveritycharacteristics. the characteristics of each severity level, as summarised in Table5. B. BASELINES Most of the studies use a sequence-based approach in the log-based anomaly detection research, as shown in Table 2', '. In this context, having less FP is more important than having less FN, as the task objective is anomaly severity detection, where we aim to detect all abnormalities along withtheseveritylevel.Therefore,undetectedabnormalities, or detecting higher severity as lower ones, indicate that the model fails to meet the task’s objectives', '. As mentioned in the previous section, this theindirectlysubsequentevents.Moreover,thecomputation paperexplorestheadvantageofmultitasklearningtoperform processisnon-parallelizable.Therefore,severaleffortshave sentimentanalysisondroneflightlogdatasetsasananomaly been made to employ the Transformer model for anomaly detectionapproach. detection [32]. Instead of training a model using a dataset, [33] proposed HilBERT, a BERT-based model pre-trained III. PROPOSEDFRAMEWORK using a number of public log datasets', '. So, to While the combination of undersampling and oversamhandle highly imbalanced datasets, oversampling and pling methods are: undersampling methods are combined, such as SMOTE-ENN • SMOTE-ENN is a combined method between overand SMOTE-Tomek. The used single learning to compare is sampling (SMOTE) and undersampling (ENN) [16]. K-Nearest Neighbors (KNN). Then, it is compared to several ensemble learning, which are Random Forest, Bagging, AdaBoost, and XGBoost. II. RELATED WORKS A', '. As depicted in Fig 18, the highlighted to multiclass anomaly detection while exploiting the shared words align more with the attribution label, supported by high- and low-level features within the log messages that seven out of eight examples belonging to the High severity belong to different severity levels. Therefore, the forensic having positive attribution scores', '. where u is the mean of the training samples or zero, and s is • Bagging Methods build the models from the same the standard deviation of the training samples or one. learning with different instances. This method excels at significantly increasing noisy and unbalanced data [22]. The different technologies used in this research is Based on the related works, the bagging method is better removing the outlier before training the data. Because some than the other ensembles [23]', '. An interesting witharandomstateof42. pattern is shown in Table 8 regarding the hyperparameter Four encoder types are selected to be combined with the values on each encoder type. The GRU works well with baseline and proposed scenarios, i.e., Transformer, LSTM, more layers, average pooling, and uniform class weighting. GRU, and Linear, since these encoders are standard in log- Differently, the Linear model has benefited from the [CLS] based anomaly detection as discussed in Section II']","Log-based anomaly detection has been extensively studied, incorporating machine learning and deep learning techniques to enhance detection capabilities (Silahie et al.).","sequence-based approach in the log-based anomaly detection research, as shown in Table 2. In contrast, this paper uses a point-based approach based on the characteristics of the problem and the dataset. Therefore, there are limited references that can be used as baselines for comparison, as described in the following: 1) Pylogsentiment . Using a point-based approach, a sentiment analysis model is trained using a one-layer VOLUME 13, 2025 105369 S. Silalahi et al.: Interpretable Ordinal-Aware With Contrastive-Enhanced Anomaly Severity Detection TABLE 6. Hyperparameter search space for all scenarios. neighbouring classes share common features. GRU, LSTM, and Transformer are explored to find the best- performing encoder. To provide a fair comparison, the GloVe embedding used in pylogsentiment, SentiLog, and TransSentLog are",0.75,0.955288775684214
"detection approach for drone flight log data. The overall flow of the proposed framework is depicted in Fig 4. The following section describes the approach in more detail. A. OVERVIEW A. OVERVIEW Performing point log-based anomaly detection that takes human-readable log messages as input is similar to conduct- ing sequence or text classification. As mentioned in Section I, this task may be interpreted as a sentiment analysis task that aims to detect negative sentiments within log messages. Taking an n-length log message m = [w1, w2, . . . , wn] from the dataset D = {(mi, ci)}|D| i=1 as the input, where c is the label class name, BERT is used to tokenise the input into a fixed length","['. 1) We propose DroneLog, an interpretable sentimentAs an example, the flight path taken by a drone during a based multiclass drone flight log anomaly detection flightisrecordedinlongitudeandlatitudecoordinates.These frameworkthatincludesthreeanomalyseveritylevels: datacanbeusedtodetectananomalybyfindingapeculiar low,medium,andhigh.Providingtheseveritylevelcan valuewithinthelogrecordsbycontrastingthenormalvalues provide better detection results for the investigator to', '. B. PROBLEMSTATEMENT For instance, at the e , the drone exceeds the maximum In the event that there is only benign data (i.e., no sample 3 flight distance. Several sentiment-baring words or phrases of abnormal data), anomaly detection can be conducted by from the illustration include ‘‘out of range’’, ‘‘overheated’’, training a recurrent neural network (RNN)–based model and ‘‘failed’’', '. Inspired by the study, anomalous events on drone objective[33].Anotheralternativetoleveragethepre-trained flight logs can be detected by analysing log messages and model is fine-tuning the models using prompts [34]. With identifying suspect key phrases closely related to drone onlyafewtrainingdata,themodelcancapturethesemantics incident scenarios. Therefore, the region of interest in this of the input logs and detect anomalous log sequences well', 'S.Silalahietal.:InterpretableOrdinal-AwareWithContrastive-EnhancedAnomalySeverityDetection approach is presented in Section III. The experimental settingsandprocedurearedescribedinSectionIV,whilethe results,findings,anddiscussionsareelaboratedinSectionV. Finally,weconcludethepaperinSectionVI. II. RELATEDWORKS A. LOG-BASEDANOMALYDETECTION Log-based anomaly detection is relatively well-studied, includingincorporatingML[1]anddeeplearning-based[18], [19] to facilitate log anomaly detection', '. e thatundergoesadoublenegation.Therefore,considering 5 Another closely related study fine-tuned several pre-trained the context when performing sentiment analysis to detect LLMs to detect anomalous log entries in a point-based anomaliesindronelogmessagesiscrucial,especiallywhen approach[6].However,existingstudiesonlydetectwhether thelogmessagesfromdifferentclassessharecommonwords an event or subsequent event is an anomaly. In a forensic orphrases', '. Sentiment analysis-based log anomaly readablemessagesdescribingtheoccurringeventsduringthe detection was firstly introduced in [7], which rely on an operation of a drone. This file stores all information during assumptionthat,logmessagesthatcontainwordsorphrases aflight,suchasflighttimestamps,flightparameters,sensor with negative connotations considered anomalies. Another data, components’ status, and flight mode', '. Datasetcompositionbeforeandafteruniquefiltering. testingsets.Thisisalignedwiththerealcasescenario,where a drone tends to generate the same log message when the event is still happening. It indicates that the current event has yet to be changed or solved (if it is an issue)', '. 4. For instance, the event e tells us 4 that the core board of the drone is overheated, which might lead to a malfunction or even loss of the device. Then, FIGURE3. Priorityofartefactstoinvestigatedifferenttypesof the pilot tries to cancel the auto landing triggered by the incidents[4]. drone, but it fails. From the illustration in Fig. 4, it can be seen that the log contains sentiment words or phrases that determine whether an event is an anomaly or not. B', '. 7 in closer detail. [CLS] is a special interpretable log anomaly detection framework based on token used in BERT for the next sentence prediction (NSP) sentimentanalysis,asdepictedinFig.5.Duringthetraining task during pre-training. It can be used as a sentence-level phase,weinvestigatethemodel’sperceptionofthesemantics representation feature in text classification tasks [25]. Note of the messages when making predictions', '. DigitalObjectIdentifier10.1109/ACCESS.2025.3580056 Interpretable Ordinal-Aware With Contrastive-Enhanced Anomaly Severity Detection on UAV Flight Log Messages SWARDIANTARASILALAHI 1,(GraduateStudentMember,IEEE), TOHARIAHMAD 1,(Member,IEEE),HUDANSTUDIAWAN 1,(Member,IEEE), EIRINIANTHI 2,ANDLOWRIWILLIAMS 2 1DepartmentofInformatics,InstitutTeknologiSepuluhNopember,Surabaya60111,Indonesia 2SchoolofComputerScienceandInformatics,CardiffUniversity,CF244AGCardiff,U.K']","Sentiment analysis-based log anomaly detection assumes that log messages containing negative connotations are indicative of anomalies (Silalah et al., 2025).","be employed to force the model to learn a distinctive representation of the positive FIGURE 4. An illustration of anomalies that occur during a drone’s flight. inclusive. Therefore, this paper proposes a multitask-based multiclass drone anomaly detection to assist in a forensic investigation. The main contributions of this paper are summarized as follows: 1) We propose DroneLog, an interpretable sentiment- based multiclass drone flight log anomaly detection framework that includes three anomaly severity levels: low, medium, and high. Providing the severity level can provide better detection results for the investigator to pinpoint the event of interest. Interpretability makes training and testing more transparent, the model trustworthy, and human-friendly. 2) We propose DroneSBERT,1 a domain-specific embed- ding to extract semantic features",0.5,0.9381641294089708
"log message m = [w1, w2, . . . , wn] from the dataset D = {(mi, ci)}|D| i=1 as the input, where c is the label class name, BERT is used to tokenise the input into a fixed length sequence with m maximum length and retrieve the contextual embeddings, resulting in an input matrix X ∈ Rm×dBERT which is then paired with the encoded label y. Thus, the numerical input becomes (X, y). This study aims to train a neural network model Mθ to classify the message m into one of the predefined classes c ∈ C = {high, medium, low, normal}, or can be written as Mθ : m → c. Based on past literature discussed in Section","['vector,yieldingastaticlookupdictionaryafterbeingtrained as the log message is generated and triggered by certain on a relatively large corpus', '. weight and bias parameters in a linear layer. Knowing that In this paper, M = (cid:2) m 1 ,m 2 ,...,m|M| (cid:3) is defined as the number of classes is more than two, the task belongs the collection of log messages in the dataset. Given a log to multiclass classification. Typically, the target label is recordm = [w 1 ,w 2 ,...,w n ]containingnnumberofwords represented in a one-hot encoded vector, as depicted in as input, with m ∈ M, BERT base is used to tokenize and Fig. 8a', '. Note of the messages when making predictions. The model is that pooling only applies to the Transformer and Linear expected to associate the contextual dependency among encoders.Thisfinalhiddenstatevectoristhenmappedinto wordsandphraseswithintheinputmessagetotheanomaly four target classes using a linear layer, resulting in the final severity label', '. The last three recent study employs sentence embedding to extract the columns contain human-readable messages: APP.message, semantic features from log messages, and utilize various APP.tip, and APP.warning, which is the source of the machine learning (ML) models to classify anomaly severevidence used in this paper. Sample messages can be seen ity[8].Themostrecentstudyemploysamultitasklearningin Table 1. From the table, it can be seen that samples in based solution to solve a mutually inclusive dataset [9]', 'upp_count←Tw.count(‘upp_words’) els and frameworks utilize deep learning techniques to EmbeddingMatrix: addresschallengesassociatedwithsarcasmdetection,suchas X ←LanguageIdentification theoccurrenceofcode-mixingandcontextualfeatureextrac- Ge←Glove() tionandhaveshownpromisingresultsintheidentificationof Fa←FastText() sarcasm.Inthisstudy,acontext-basedapproachforsarcasm 4 forword,iinword_index.items()do detectionisproposed.TheproposedapproachcombinesFast- 5 We1←Ge.get(word)', '. This research encoder-based models [8]. These models utilize machine endeavoraimstodevelopaMalayalam-Englishcode-mixed learning algorithms to examine the language and context of text dataset intended to be freely accessible and serve as social media posts to ascertain whether they are sarcastic a valuable asset for further scholarly investigations in this or not. Machine learning models have the disadvantage of domain', '. capture the semantics of the log messages [26]. However, The remaining part of this paper is structured as follows: the resulting representational vectors can be closer to one SectionIIdiscussesrecentrelatedapproaches.Theproposed another since log records commonly share the same words', '. Therefore, including Subsection IV-B are also used as baselines to verify the [CLS] token’s feature and tuning BERT’s parameter have a superiority of the proposed method in this paper. After positiveimpactonthemodel’sperformance.Basedonthese implementing the baselines and testing them on the filtered findings, embedding plays a significant role in performing and unfiltered datasets, the results are reported in Table 9. the prediction', '. Initially, this Toolkit (NLTK). Tokenization breaks down the text layerperformstokenizationonthetweets.Eachtoken(word into words, phrases, and symbols called tokens. The orsymbol)isconvertedintoauniquenumericalvaluebased generatedtokenshelpparseandperformothermining on the index in the word embedding dictionary. Mathemattasks. ically, if a tweet T consists of n tokens, then each token is • Lemmatization to convert all the words to their base represented by its dictionary index, such that T ∈ N1×n. form', '. The objective is level features of the input message, which results in hidden to ensure the model considers contextually relevant words statescomputedusingthefollowingequation: or phrases corresponding to the true labels to make correct predictions']","In the context of multiclass classification, log messages are represented as sequences of words, and BERT is utilized to tokenize these inputs, aligning with the method of classifying messages into predefined categories (Interpretable Ordinal-Aware With Contrastive-Enhanced Anomaly Severity Detection on UAV Flight Log Messages).","detection on the test data, which is then analysed further. In this paper, M = (cid:2)m1, m2, . . . , m|M| (cid:3) is defined as the collection of log messages in the dataset. Given a log record m = [w1, w2, . . . , wn] containing n number of words as input, with m ∈ M, BERTbase is used to tokenize and obtain the input vector representation. In the implementation, computation is undertaken using matrix multiplication. Thus, a term maximum sequence length, m, is introduced to pack the input messages that vary in length into a matrix with a consistent size throughout all the samples in the dataset. Therefore, for each single input message, the input matrix becomes",0.75,0.930023543169882
"logits z ∈ R|C|, where |C| denotes the number of target class in the dataset. During the training phase, these vectors are used to compute the loss and update the parameter of the model after passing through a normalisation function. For the typical one-hot encoding representation of the label, the standard cross-entropy is used to compute the loss, as defined in the following equation: |C| LCE = − yi · log(ˆyi) i=1 ˆy = softmax(z) exp(zi) ˆyi = Pdim(z) exp(zj) (1) (2) (3) where y and ˆy are the true label vector and the prediction probability distribution, respectively. The prediction proba- bility ˆy is obtained from Eq 2, where each of the element in ˆy is computed using Eq 3.","['. This result highlights the advantage of decreasing values of training loss (t-lss) and validation Indo-BiEnt in providing more consistent and balanced loss (v-lss), indicating better generalization and reduced classificationacrossallinferencecategories. overfittingasthetrainingdatavolumeincreases', '. MACHINE LEARNING PARAMETERS Evaluatioin metrics ML models Parameters Models MSE RMSE MAE max_depth: 10, min_samples_split: 2, RF SARIMAX 639714.51 799.82 650.35 n_estimator: 50 RF 1384875.01 1176.80 958.96 learning_rate: 0.05, max_depth: 3, XGBoost XGBoost 1389609.34 1178.81 961.11 n_estimators: 100 GBM 1406810.24 1186.09 971.82 learning_rate: 0.2, max_depth: 3, n_estimators: LightGBM LSTM 16816.55 129.67 103.94 100 Authorized licensed use limited to: Institut Teknologi Sepuluh Nopember', '. After training the model, testing will be carried out on the best model for each architecture. The best model is selected based on the lowest loss validation for each fold. The lowest validation loss in the U-Net architecture is located on the 3rd fold with a value of 0.0132, while the Link-Net architecture is located on the 5th fold with a value of 0.0148. The best model on each architecture will then be tested on 237 test data', '. An overview of The graphs in Fig. 6 and Fig. 8 show the training and the evaluation method is illustrated in Fig. 3. Furthermore, validation loss of the three models during the training process. a comparative analysis of the evaluation metrics obtained A lower loss value indicates better performance in terms of from four pre-existing deep learning models is planned. This predictions on data not seen during training', '. was used to measure the model’s loss during training, AnotherdatasetusedforcomparisonisIndoNLI[35].The whiletheAdamoptimizerwasadoptedforoptimization.All datausedincludesthetotalnumberofentriesineachfile.The componentsoftheproposedarchitectureweretrainedend-to110156 VOLUME13,2025', '. The and CatBoost deputize the ML architecture. MLP, LSTM, bestmodelwaschosenbasedontheevaluationofF1-score, GRU, CNN-LSTM, Transformer, and TKAN represent DL precision,accuracy,andrecall,anditwillbeutilizedtoextract architecture.ThisresearchconductedmodifiedTransformer aspectandopiniontermsacrossalldatasets', '. ABSTRACT Inrecentyears,deeplearninghasfoundwidespreadapplicationsintaskssuchassegmentation and classification. Fine-tuning hyperparameters is crucial to improve performance, with the learning rate being a key parameter. Various methods, including adaptive learning rates, learning rate scheduling, and cyclical learning rates, have been used to optimize learning rates. Cyclical learning rates offer significant benefits with minimal computational cost, as seen in previous research', '. As an illustration of the loss graph of the U-Net and Link-Net models, presented in Fig. 3c and Fig. 3d. TABLE II. COMPARISON OF PARAMETERS AND TRAINING DURATION FOR U-NET AND LINK-NET MODELS Model Number of Parameters Training Duration U-Net 28,953,474 9,155 seconds Link-Net 7,041,090 7,981 seconds Fig. 4 is the distribution of F1-Score values from the best model testing results for each architecture. Both U-Net and Link-Net have asymmetric distributions', '. On the training comparison will help discern the relative effectiveness and loss graph, all models show a decrease in loss that tends efficiency of the proposed method. By doing so, the aim is to to flatten as the epoch increases. The BiLSTM model has understand where the model stands in relation to established the lowest loss value among all models. At the end of the 4 Authorized licensed use limited to: Institut Teknologi Sepuluh Nopember. Downloaded on July 14,2025 at 08:18:27 UTC from IEEE Xplore', '. However, the proposed method produces lower loss ‘‘Review of deep learning: Concepts, CNN architectures, challenges, valueswith0.707,0.657,and0.665comparedtotheprevious applications,futuredirections,’’J.BigData,vol.8,no.1,p.53,Mar.2021, doi:10.1186/s40537-021-00444-8. method with 0.712, 0.685, and 0.725 for U-net, Res U-net, [16] Ö. Çiçek, A. Abdulkadir, S. S. Lienkamp, T. Brox, and O. RonandDenseU-net,respectively']","The model's loss during training was measured using a standard method, indicating the importance of loss computation in model optimization.","final unnormalized logits vector using the following equation: α = zW⊤ + b, ∈ R|C| (3) where W ∈ R|C|×768, and b ∈ R|C| are the typical trainable weight and bias parameters in a linear layer. Knowing that the number of classes is more than two, the task belongs to multiclass classification. Typically, the target label is represented in a one-hot encoded vector, as depicted in Fig. 8a. Therefore, the training objective is to minimise the cross-entropy loss, which is computed using the following equation: LCE(y, ˆy) = − |C| yi · log(ˆyi) i=1 ˆy = softmax(α) (4) (5) where y and ˆy are the truth and the predicted label probability distribution respectively. The normalized logits in Eq. 5 is",0.5,0.869003188233979
"study, one of the artefacts of drone devices, the flight log message, is used as the source of the evidence to perform multiclass anomaly severity detection. These human-readable messages, such as ‘‘Aircraft Core Board Overheated’’ and ‘‘Compass error, calibration required’’, can be found in most DJI-make flight logs in three columns: warning, tip, and message. Originally, the flight log was in encrypted.CSV files . Thus, the drone phantom help2 is needed to decrypt the flight log files and then extract the contents. The 2 FIGURE 6. Proposed vector representation of the label based on the dataset characteristics. is computed based on the frequency distribution of the class in the dataset. In this study, three class weights are explored and used","['. Inspired by the study, anomalous events on drone objective[33].Anotheralternativetoleveragethepre-trained flight logs can be detected by analysing log messages and model is fine-tuning the models using prompts [34]. With identifying suspect key phrases closely related to drone onlyafewtrainingdata,themodelcancapturethesemantics incident scenarios. Therefore, the region of interest in this of the input logs and detect anomalous log sequences well', 'robust predictions, enabling drone operators to detect and Furthermore, Jain et al. [10] proposed a framework for diagnose malfunctions quickly and take corrective actions. sensor data identification and verification. An analysis of a Thestructureofthispaperisasfollows.SectionIIpresents drone’sarchitectureandaforensicmodelwithgenericfeatures previous research relating to the drone log analysis and drone are proposed here in order to enhance the digital investigation forensics', '. combinedfromtwopublicdroneflightlogdatasets,i.e.,from 5) DroLoVe[9].ThestudyproposedamultitasklearningMendeley[51]andadronewiki[52].Therearetwodatasets: based anomaly severity detection on drone flight unfiltered and filtered. The unfiltered dataset is a collection logs with an assumption that, samples belonging to of log messages in its original condition gathered from the twosourceswithoutperforminguniquefiltering.Therefore, thereareseveralduplicatelogmessagesbothintrainingand TABLE4', '. Therefore, this paper proposes a multitask-based systemprompt,thegeneratedlogmessagecanbeconsidered multiclass drone anomaly detection to assist in a forensic as an anomaly [7], [20], [21]. As for contextual anomaly, investigation. The main contributions of this paper are the detection involves analysing some contextually related summarizedasfollows: attributes to determine whether a log entry is an anomaly', '. Most drone incidents are caused analysis of drone logs can also provide evidence that can be by bird attacks, collide with other drones, and malfunctioning used in legal proceedings. This evidence can be particularly systems.Sometimesthedronemayhaveamalfunctioningsystem valuable in cases where there are disputes over liability, such caused by sensor failure, a broken motor, or CPU failure. This cancauseanaccident.Therefore,aforensicinvestigationsupports as in cases of property damage or personal injury', '. 1) We propose DroneLog, an interpretable sentimentAs an example, the flight path taken by a drone during a based multiclass drone flight log anomaly detection flightisrecordedinlongitudeandlatitudecoordinates.These frameworkthatincludesthreeanomalyseveritylevels: datacanbeusedtodetectananomalybyfindingapeculiar low,medium,andhigh.Providingtheseveritylevelcan valuewithinthelogrecordsbycontrastingthenormalvalues provide better detection results for the investigator to', '. CONCLUSION remains untested as the training dataset contains only log This paper investigates utilising a multitask learning messages acquired from 82 drone models, mostly from paradigmtoperformmulticlassanomalydetectionondrone DJI. This is one of the main challenges in drone forensics flight log messages. Aligning to the nature of multitask research, where human-readable flight log datasets from learning,weproposetwotargetlabelrepresentations,namely other drone models are unavailable', '. theexperimentalresults,theTransformerobtainsthehighestF1 In the context of classifying drone malfunctions, the Transscore value of 93.04%. former model can be trained on a dataset of labeled drone Index Terms—drone forensics, forensic investigation, malfunctelemetry data to learn patterns and relationships between the tions, infrastructure, Transformer, Informer, FEDformer drone’s behavior and the root cause of a malfunction. The dataset can include features such as altitude, velocity, battery I', '. DigitalObjectIdentifier10.1109/ACCESS.2025.3580056 Interpretable Ordinal-Aware With Contrastive-Enhanced Anomaly Severity Detection on UAV Flight Log Messages SWARDIANTARASILALAHI 1,(GraduateStudentMember,IEEE), TOHARIAHMAD 1,(Member,IEEE),HUDANSTUDIAWAN 1,(Member,IEEE), EIRINIANTHI 2,ANDLOWRIWILLIAMS 2 1DepartmentofInformatics,InstitutTeknologiSepuluhNopember,Surabaya60111,Indonesia 2SchoolofComputerScienceandInformatics,CardiffUniversity,CF244AGCardiff,U.K', '. B. PROBLEMSTATEMENT For instance, at the e , the drone exceeds the maximum In the event that there is only benign data (i.e., no sample 3 flight distance. Several sentiment-baring words or phrases of abnormal data), anomaly detection can be conducted by from the illustration include ‘‘out of range’’, ‘‘overheated’’, training a recurrent neural network (RNN)–based model and ‘‘failed’’']","The study proposed a multitask learning-based anomaly severity detection on drone flight logs, emphasizing the identification of different classes through the analysis of log messages (SWARDIANTARASILALAHI et al., 2025).","the data is the DJI. After collecting the ﬂight log ﬁles, we use DJI Phantom Help tools to decrypt the ﬁles and get the plain data, which then is parsed to get the log message data. The number of messages from every drone image is shown in Table 1. The next step is identifying the entity type mentioned in the drone log messages. Before reading the log messages, we ﬁltered the duplicate message and got the unique message to read. After carefully reading the unique log message and comprehensively studying what every log message indicates, we categorized the entity types mentioned in the ﬂight log message into six groups, i.e., Component, Action, Parameter, Function, State, and Issue. These entity types",1.0,0.9622074542278329
"the unfiltered is the actual collection of drone flight log messages gathered from the two sources mentioned previously. The dataset is split into training and testing with an 80:20 ratio. The summary of the per-class distribution in the dataset is presented in Table 2. B. BASELINES B. BASELINES In this study, an extensive experiment with various types of encoders is conducted to construct strong baselines for performance comparison. Ensuring the objectivity of the comparison, the hyperparameters of these baselines are fine-tuned using grid search on a finite search space, as shown in Table 3. The details of the baseline construction are described in the following subsections. 1) BASELINE FROM DIVERSE SUITABLE ENCODERS The distinction between the baseline and the proposed","['. 11. that every model has its own features and functionalities, Three char-level embeddings, such as LSTM, CNN, and which vary among them, then the generated log messages AdaTrans,werecombinedwithtwoword-levelembeddings, will be different as well. However, since all the drones are GloVe and BERT, to provide input for the encoder layer', '. CONCLUSION remains untested as the training dataset contains only log This paper investigates utilising a multitask learning messages acquired from 82 drone models, mostly from paradigmtoperformmulticlassanomalydetectionondrone DJI. This is one of the main challenges in drone forensics flight log messages. Aligning to the nature of multitask research, where human-readable flight log datasets from learning,weproposetwotargetlabelrepresentations,namely other drone models are unavailable', '. The proposedmethodoutperformsthepreviousbaselinemodelwitha91.348%F1score.Finally,weconclude theexperimentandmentionseveralfuturedirections. INDEX TERMS Digitalforensics,droneflightlog,droneforensics,logmining,namedentityrecognition, transformerencoder,conditionalrandomfields,infrastructure. I', '. Inspired by the study, anomalous events on drone objective[33].Anotheralternativetoleveragethepre-trained flight logs can be detected by analysing log messages and model is fine-tuning the models using prompts [34]. With identifying suspect key phrases closely related to drone onlyafewtrainingdata,themodelcancapturethesemantics incident scenarios. Therefore, the region of interest in this of the input logs and detect anomalous log sequences well', 'S.Silalahietal.:Transformer-BasedNERonDroneFlightLogstoSupportForensicInvestigation Accordingly, Jain et al. [30] proposed a framework com- manyNLPtasks,includingNER.Sincethepublication,many prising 12 phases. The first five phases were used to locate variantsofpre-trainedTransformer-basedmodelshavebeen and validate the drone’s sensors and data. The other seven available', '. CPU, WiFi, GPS, and Gyro. Informer and FedFormer are [9] A. Al-Dhaqm, R. A. Ikuesan, V. R. Kebande, S. Razak, and F. M. also Transformer-based models that have been developed for Ghabban, “Research challenges and opportunities in drone forensics time-series forecasting tasks. These models attempt to extend models,”Electronics,vol.10,p.1519,June2021. [10] U. Jain, M. Rogers, and E. T', '. position-wisefeedforwardnetwork,theclassificationbasedon [20] S.Wu,C.Du,H.Chen,andN.Jing,“Coarse-to-FineUAVImageGeoLocalization Using Multi-stage Lucas-Kanade Networks,” in 2021 2nd drone log data will be more accurate. InformationCommunicationTechnologiesConference(ICTC),(Nanjing, A future modification to the transformer will improve the China),pp.220–224,IEEE,May2021. capability of detecting drone malfunctions, particularly in the encoder layer and the recurrent layer', '. For instance, the message ‘‘Critically low power. Aircraft is landing’’ is more important than ‘‘Forward Obstacle Sensing notWorking’’.ThisstudyproposesDroneLog,aninterpretableframeworkfordetectinganomaliesandthe severity levels on drone flight logs, using a multitask learning approach in a unified pipeline', '. Mantas and Patsakis [6] data to construct a forensic timeline that consists of the log have attempted to utilize telemetry and dataflash logs to messageandthetimestamp. perform drone forensic investigation by performing UAV To perform NER, two common deep learning modintegritychecks,anomalydetectiononthevisualflightpath, els can be used, either RNN-based or Transformer-based command verification, error reporting, and hardware error models. The latest state-of-the-art include BiLSTM-CRF detection', 'Data Preprocessing Evaluation Transformer Informer FEDformer Drone Log Dataset (ALFA) Fig. 1: The flow of the proposed method Using this script, datasets that have been preprocessed the output of the position-wise feedforward network shown in are classified into normal and malfunction classes. Using (3): Transformer, this dataset is analyzed and used to classify FFN(x)=max(0,xW +b )W +b (3) 1 1 2 2 malfunctions and find out the cause of drone engine failure']","The proposed method achieves a performance improvement over baseline models, demonstrating a 91.348% F1 score (Silahi et al., 2023).",". There are two datasets: unfiltered and filtered. The unfiltered dataset is a collection of log messages in its original condition gathered from the two sources without performing unique filtering. Therefore, there are several duplicate log messages both in training and testing sets. This is aligned with the real case scenario, where a drone tends to generate the same log message when the event is still happening. It indicates that the current event has yet to be changed or solved (if it is an issue). On the other hand, the filtered dataset is a collection of log messages after a unique filtering process. This is aligned with the norm in supervised learning, where the train and test set must not",0.6666666666666666,0.8844391806001831
"PREVIOUS WORKS Among the relevant published studies in the log-based anomaly detection space, sequence-based is one of the most commonly used approaches. Therefore, there are limited relevant references as this study employs a point-based approach. Below are the relevant baselines from previous research: 1) Pylogsentiment is the first study which employs sentiment analysis-based anomaly detection on operat- ing system logs using GRU and GloVe embedding. 2) SentiLog , similar to , use a two-layered BiLSTM and GloVe embedding model to perform anomaly detection on parallel file system logs. 3) TransSentLog is a further development of and uses a two-layered transformer encoder which used two attention heads and GloVe embedding along with integrated gradients to add explainability to the trained model.","['. Existing anomaly detection modelling techniques can be conducted either in a point, contextual, or collective setting. Point anomaly FIGURE4. Anillustrationofanomaliesthatoccurduringadrone’sflight. detectioncharacteriseseachlogentry,whetheraneventisan abnormalityoranormalevent.Forinstance,ifausertypesthe wrong password when trying to gain access to an operating inclusive', '. encoder for anomaly detection. A similar study exploits Performing anomaly detection using a sequence-based theabundanceofpre-trainedtransformermodelstoperform approach is commonly conducted by training RNN-based anomalydetectionbyusingsentimentanalysisondroneflight models using a dataset containing a collection of a series log messages [6], which then expanded to multiclass in [9]. of events', 'S.Silalahietal.:InterpretableOrdinal-AwareWithContrastive-EnhancedAnomalySeverityDetection approach is presented in Section III. The experimental settingsandprocedurearedescribedinSectionIV,whilethe results,findings,anddiscussionsareelaboratedinSectionV. Finally,weconcludethepaperinSectionVI. II. RELATEDWORKS A. LOG-BASEDANOMALYDETECTION Log-based anomaly detection is relatively well-studied, includingincorporatingML[1]anddeeplearning-based[18], [19] to facilitate log anomaly detection', '. An interesting witharandomstateof42. pattern is shown in Table 8 regarding the hyperparameter Four encoder types are selected to be combined with the values on each encoder type. The GRU works well with baseline and proposed scenarios, i.e., Transformer, LSTM, more layers, average pooling, and uniform class weighting. GRU, and Linear, since these encoders are standard in log- Differently, the Linear model has benefited from the [CLS] based anomaly detection as discussed in Section II', '. Ou and J. Liu, “Log anomaly detection method based on hybrid transformer-bilstm models,” in 2022 IEEE 22nd International ConferInformerandFedFormermodelsmayoutperformTransformerenceonSoftwareQuality,Reliability,andSecurityCompanion(QRS-C), based models. pp.762–763,2022. [16] S. Pasch and D. Ehnes, “Nlp for responsible finance: Fine-tuning transformer-based models for esg,” in 2022 IEEE International ConV. CONCLUSIONS ferenceonBigData(BigData),pp.3532–3536,2022', '. e thatundergoesadoublenegation.Therefore,considering 5 Another closely related study fine-tuned several pre-trained the context when performing sentiment analysis to detect LLMs to detect anomalous log entries in a point-based anomaliesindronelogmessagesiscrucial,especiallywhen approach[6].However,existingstudiesonlydetectwhether thelogmessagesfromdifferentclassessharecommonwords an event or subsequent event is an anomaly. In a forensic orphrases', '. Thisstudyproposestoextendthebinaryanomalydetection into a multiclass anomaly detection involving four classes: Normal,Low,Medium,andHigh.Thethreeanomalyclasses representingtheseverityoftheabnormalityaredistinguished byseveralcharacteristicsdescribedinSectionIV-A.AsillustratedbyFig.4,adroneexperiencesvariouseventsfromthe takeoff(e )tothelanding(e ).Eacheventisrepresentedby 1 6 a log message that contains a description of the occurring phenomenon.Amongtheeventsthathappenduringaflight, there might be low,', '. In this context, having less FP is more important than having less FN, as the task objective is anomaly severity detection, where we aim to detect all abnormalities along withtheseveritylevel.Therefore,undetectedabnormalities, or detecting higher severity as lower ones, indicate that the model fails to meet the task’s objectives', '. As depicted in Fig 18, the highlighted to multiclass anomaly detection while exploiting the shared words align more with the attribution label, supported by high- and low-level features within the log messages that seven out of eight examples belonging to the High severity belong to different severity levels. Therefore, the forensic having positive attribution scores', '. Another case scenario in log-based anomaly detection Supervised contrastive learning is employed to learn is a sequence-based approach, where an abnormality is distinctrepresentationsforeachanomalyseveritylevel. determined by analysing a group of events that occur 3) Weexploretwotargetlabelrepresentationstoaugment sequentially within a certain window size [22]']","Anomaly detection using a sequence-based approach is typically performed by training RNN-based models on datasets that consist of a series of events (Silahi et al., 2023).","analysing sentiment contained within a log message to detect anomalous events. More specifically, we can distinguish between normal and abnormal events and also detail the severity of the detected abnormalities. Therefore, VOLUME 13, 2025 105365 S. Silalahi et al.: Interpretable Ordinal-Aware With Contrastive-Enhanced Anomaly Severity Detection TABLE 2. Related works in log-based anomaly detection. the investigator can prioritise the analysis objective to focus only on severe abnormalities. Therefore, we propose an interpretable log anomaly detection framework based on sentiment analysis, as depicted in Fig. 5. During the training phase, we investigate the model’s perception of the semantics of the messages when making predictions. The model is expected to associate the contextual dependency among words and phrases within the input message",0.6666666666666666,0.930030111849759
"this section reports the experimental results along with in-depth discussions and analyses. A. BEST PERFORMING SCENARIO A. BEST PERFORMING SCENARIO 1) EVALUATION METRIC After experimenting with all the designed scenarios, the models’ performance is evaluated on the test dataset. The best-performing model from each pair of encoder type and loss function is reported in Table 4 and Table 5 for unfiltered and filtered datasets. Based on the evaluation metrics shown in both tables, the proposed scenario outperforms all baseline scenarios on all encoder types tested on the unfiltered dataset, with an accuracy of 96.875 and an F1 score of 96.851. As for the filtered dataset, the transformer encoder trained on the baseline scenario outperforms the other scenarios on all encoder","['. Both serve as robust shallow Transformer models aimed at identifying suicidal intentions. representations for image retrieval and classification tasks. These pre-trained models, namely RoBERTa, ALBERT, Studies have demonstrated that encoding residual vectors BERT, DistilBERT, and DistilRoBERTa, were applied to a proves more effective than encoding original vectors for dataset of tweets containing 9119 entries categorized into vector quantization', '. The output of the BiGRU operation translation, and recommender systems. Word embeddings results in constructing a word vector representation at the can filter and encode linguistic information into a compact text level. Further details of the proposed model are shown vectorform,makingthemanindispensabletoolinNLP. in Algorithm 2. Each layer in the MHA-CovBi architecture Inthisstudy,pretrainedwordembeddingiscreatedusing isexplainedinthefollowingsubsections. a combination of FastText and GloVe embeddings', '. Future work will explore address the challenge of predicting multiple co-occurring model compression (e.g., pruning, quantization, low-rank abnormalities. Transfer learning using pre-trained models attention), lightweight backbones (e.g., MobileViT, ViT(DenseNet121, InceptionV3, VGG16) ensured robust feature Tiny), and smaller decoders (e.g., distilled GPT). Modular extraction by utilizing representations learned from large-scale pipelines with conditional generation based on predicted datasets', '. Knowledge distillation has emerged high terminology precision and fluency. as a powerful technique to address this challenge. Initially While these models advance image-text understanding and developed as a method to compress large models into smaller, representation quality, they are often designed for retrieval, VOLUME XX, 2017 7 This work is licensed under a Creative Commons Attribution 4.0 License. For more information, see https://creativecommons.org/licenses/by/4.0/', '. BiGRU layer, dense layer, and output layer. The architecture of the MHA-CovBi model is shown in Figure 2. The 2) WORDEMBEDDINGLAYER convolution layer takes the output of word embedding as The embedding layer serves as a critical component in the input and performs convolution for dimensionality reduc- text processing pipeline, effectively translating words into tion [31]. CNNs are very good at performing local feature dense, low-dimensional vectors', '. word embedding process. The BaliCarv dataset consists of sevensub-motifclasses.Thevectorizationprocessisimple- 1) IMAGEREPRESENTATIONLEARNING mentedforallthesevenmotiflabelsoftheBaliCarvdataset The first module aims to extract features from the images. that consists of 2,364 images which contains 9,326 sub- In our experiment, we used ResNet as the base model. The motifs labels', 'dataset[18].Themodel’sperformancewasenhancedbythe dingmodels,suchasWord2vec[34],GloVe[35],ELMo[36], concept of concatenating the word’s vector representation and BERT [13], improved the BiLSTM-CRF architecture', '. GloVe pretrained word embedding is used for vector representation of English words, while FastText pretrainedword embeddingis usedfor vectorrepresentation ofIndonesian words.Moreover, anauxiliary pragmatic feature illustrating the number of pragmatic markers in tweets was incorporated to enhance detection performance', '. ||u||||v|| (cid:113) (cid:80)d u2 (cid:113) (cid:80)d v2 Transformerarchitectureisdividedintotwomajorparts:the i=1 i i=1 i EncoderandtheDecoder.Inthisstudy,theonlypartusedwas Therearetwotypesofwordembedding,staticandcontex- theEncoder.Ingeneral,theelementsthatbuildtheEncoder tualembedding.Word2vec[40],fasttext[46]andGloVe[39] blockincludeInputEmbedding,PositionalEncoding,Multiare the common static embedding. While ELMo [41] and headAttention,andFeed-forwardNetworks[42]', '. The proposed vector label fine-tune the model with a learning rate of η = 0.00002, underperforms the baseline vector label, one-hot encoding because the proposed DroneSBERT embedding makes the AdamWoptimizer,andbatchsizeof64withfouriterations. dataset become mutually exclusive, as shown in Fig 17. The dimension of the resulting embedding is 768, the same Therefore, one-hot encoding works better compared to astheBERT-baseusedinthepreviousexperiment. multitask-basedvectorlabels']",,"there are 1,584 resulting model configurations in total, 729 for each dataset. Considering the extensive number of hyperparameter search spaces, not all the results are presented in this paper. Therefore, for each encoder type and scenario, only the best- performing one is presented for comparison and explained in the following subsection. Several metrics are used to evaluate the overall models’ performance, i.e., accuracy, precision, recall, and F1. Note that the weighted average is used to compute the average score of precision, recall, F1, and prediction confidence. We investigate the confusion matrix, learned representation, and the interpretability of the model’s prediction to increase understanding of the model. Captum, a tool developed by version 0.7.0 is used for model’s interpretability analysis. V.",,0.0
"on all encoder types tested on the unfiltered dataset, with an accuracy of 96.875 and an F1 score of 96.851. As for the filtered dataset, the transformer encoder trained on the baseline scenario outperforms the other scenarios on all encoder types with an accuracy of 83.761 and an F1 score of 82.967. The proposed scenario only performs better on the GRU and LSTM encoders than the baseline scenarios. 2) PREDICTION CONFIDENCE Evaluating the performance of a neural model strongly depends on the task and domain problem. In a particular task, accuracy can be the only important metric. However, in some other domains, having a high accuracy does not suffice. For example, in this study, the model needs to be sure","['. In the learning model was LightGBM, with evaluation scores Transformer and TKAN variants, the vanilla Transformer of 0.99843 R2, 96.76132 MAE, 56,754.18872 MSE, has the best performance in 4 of 5 evaluation metrics 0.00833 sMAPE, 0.32185 F1-score, and 0.51070 with evaluation scores of 0.99992 R2, 42.54592 MAE, MWRE@0.75. CEM and REM outperformed LightGBM. 3,075.38631 MSE, 0.00644 sMAPE, 0.46445 F1-score, AmongMLP,LSTM,GRU,andCNN-LSTM,GRUdelivered and 0.40327 MWRE@0.75', '. Similar to the Linear model, transformer-based aLinearencoderisequaltonotusinganyencoderlayer.Note best-performing models use [CLS] tokens as the final thatsomehyperparametersapplyonlytoaparticularencoder features, yielding a very competitive score based on the type. For instance, the number of attention heads is only baseline scenario. The only pattern shown by the LSTM relevant to the Transformer encoder. Moreover, the [CLS] encoderisthatitworkswellwithmorelayers', '. without ensemble guidance (ViT + GPT-2). This model yields As shown in Table IV, our full model—integrating a Vision slightly lower BLEU-4 (0.093) and CIDEr (0.285) than the Transformer (ViT), knowledge distillation (KD), GPT-2, and ensemble-based version, likely due to the absence of local a hierarchical attention mechanism—achieved state-of-the-art feature bias and lack of prior knowledge transfer from CNNs. performance across multiple metrics', '. D. Transformer E. Residual LSTM - Transformer One of the most important concepts of the Transformer Residual LSTM overcomes the challenge of gradient loss model is multi-head attention [12]. In multi-head attention, in deep LSTM by providing information through two paths. there are four layers: input, dot-product attention, concate, and One path updates temporal data like a regular LSTM, while output', '. overfittingasthetrainingdatavolumeincreases. The findings underscore Indo-BiEnt’s strengths not only To strengthen the performance evaluation, IndoBERT—a in computational efficiency but also in delivering balanced transformer-based model pretrained on large-scale Indone- predictiveperformance.Althoughtransformer-basedmodels sian corpora—was included as a comparative baseline', '. Input consists of 3 dense layers that receive queries, the other path acts as a shortcut, directly connecting the keys, and values. The output of the dot-product is transformed previous layer to the current layer [16]. This separation allows into linear projection, which produces output as a head. In the LSTM cell to organize its internal flow without interfering machine translation, a causal attention mask is added and used Fig. 6. Flowchart Model ResidualLSTM in Transformer Fig. 4', '. Modified Transformer ture, which are Transformer GRU (FormerGRU), Transarchitectureisconductedtofindtheeffectoftheencoderand former LSTM (FormerLSTM), Transformer Encoder GRU decodersection,whichisnotbuiltnativelyforsequencetasks (TEGRU), and Transformer Encoder LSTM (TELSTM). becauseitneedspositionalencodingfortherepresentationof Modified Transformer was chosen because TEGRU outpersequence,combinedwithLSTMandGRU,whicharenative formed other Transformer variants, such as vanilla Transtosequencetasks', '. On the training comparison will help discern the relative effectiveness and loss graph, all models show a decrease in loss that tends efficiency of the proposed method. By doing so, the aim is to to flatten as the epoch increases. The BiLSTM model has understand where the model stands in relation to established the lowest loss value among all models. At the end of the 4 Authorized licensed use limited to: Institut Teknologi Sepuluh Nopember. Downloaded on July 14,2025 at 08:18:27 UTC from IEEE Xplore', '. The CNN-LSTM has the best evaluation score 19,016.86043 MSE, 0.00744 sMAPE, 0.33052 F1-score, in sMAPE, F1-score, and MWRE@0.75. The GRU and and 0.50397 MWRE@0.75. The best-performing machine CNN-LSTM perform better than CEM and REM', '. transformer-based approaches such as PPKED [45] and This validates that KD allows the ViT to learn richer CMN [46], both at 0.106. Similarly, the model achieved the representations and recover the strengths of CNN-based highest ROUGE-L score of 0.285, outperforming both the ensemble baseline (0.220) and recent models like Normal case: Abnormal case: FIGURE 7']","The modified Transformer architecture, which integrates LSTM and GRU, is designed to enhance performance in sequence tasks (Permuted Temporal Kolmogorov-Arnold Networks for Stock Price Forecasting Using Generative Aspect-Based Sentiment Analysis).","precision, recall, F1, and prediction confidence. We investigate the confusion matrix, learned representation, and the interpretability of the model’s prediction to increase understanding of the model. Captum, a tool developed by version 0.7.0 is used for model’s interpretability analysis. V. EVALUATION AND DISCUSSION V. EVALUATION AND DISCUSSION A. PERFORMANCE EVALUATION A. PERFORMANCE EVALUATION After conducting an extensive experiment on a vast amount of hyperparameter search space, the best-performing models for each encoder-scenario pair tested on the unfiltered and filtered dataset are reported on Table 7 and Table 8, respectively. From both tables, it can be seen that the highest score is achieved by the proposed scenario. It demonstrates the advantages of incorporating multitask label schema to train multiclass anomaly severity",0.6666666666666666,0.9590185614514157
"which hyperparameter the accuracy depends on. The dependency can be either increasing or decreasing the accuracy. Nevertheless, it can help choose which hyperparameter to modify in the next experiments. C. COMPARISON WITH STATE-OF-THE-ART MODELS C. COMPARISON WITH STATE-OF-THE-ART MODELS In this study, several baselines from previous studies are reproduced on the dataset to perform performance compar- isons. The reproduced performance from an experimental procedure explained in subsection IV-B2 is presented in Table 6. On both datasets, the proposed scenario outper- forms all the baselines with an improvement of 0.423 and 0.665 in the F1 score on the filtered and unfiltered datasets, respectively. Considering that Pylogsentiment used a GRU-based encoder and SentiLog used an LSTM-based the proposed scenarios on these two","['. ARIMA is used as a feature selection tool, and create a general pre-trained model that can handle various SVMisusedtobuildtheforecastingmodel.Inaddition,deep NLP tasks [13]. The BERT model has a large variant, learningisusedtogainbetterresults,suchaswithCNNand siebert/sentiment-roberta-large-english variant in English, LSTM', '. As shown in Table. 6 to Table. 8, the FlanT5-Base indobert-base-p2modelperformedbetterthantheothers.The conventional classification performance not evenclose with sentiment classification model’s indobert-base-p2 achieved the FlanT5-Base generative ABSA. The FlanT5-Base con0.94 F1-score, 0.94 accuracy, 0.92 recall, 0.93 precision, ventional classification is only better than the FlanT5-Base VOLUME12,2024 178683', '. The TKAN has a better capture pattern 0.32963 F1-score, and 0.50463 MWRE@0.75. The best of ABSA sentiment score than the pTKAN. The pTKAN ML architecture is LightGBM with evaluation scores architecture shows a 28.40% reduction in MSE compared are 0.99834 R2, 98.23507 MAE, 60,047.07194 MSE, to TKAN, indicating that pTKAN successfully reduced the 0.00834 sMAPE, 0.32235 F1-score, and 0.51032 error by more than one. In the MWRE evaluation, pTKAN MWRE@0.75', '. sentimentquadruplet,whichhascontext[13].Thepredicted Thisresearchcomparesthetraditionalregressionpaneldata, aspect-sentiment quadruplet as qualitative data is processed machine learning, and deep learning architecture to find intoquantitativedatausingquantifying. the best architecture for a unified stock price forecasting The sentiment analysis is already used in stock price model', '. Forecasting ROUGE-L,andWER.AsshowninTable.9,theFlanT5-Base value in the financial domain not only discusses regression is the best model to produce aspect-sentiment quadruplet errors but also movement direction errors, which impact with 0.638 BLEU, 0.836 ROUGE-1, 0.833 ROUGE-L, financial loss. This section compares unified stock price and 0.140 WER. The highest ROUGE-1 and ROUGE-L forecastingresultswithorwithouttheABSAsentimentscore', '. The best model was chosen by aspect-sentiment quadruplet on all datasets and then passed R2, MAE, MSE, sMAPE, F1-score, and MWRE evaluation tothesentimentquantificationprocess. metrics. 178682 VOLUME12,2024', 'A.T.Haryonoetal.:pTKANsforStockPriceForecastingUsingGenerativeABSA TABLE1. Statisticofstockissuer. KAN imitated the LSTM architecture to learn sequence pattern[35]. III. PROPOSEDMETHOD This section elucidates the dataset of news titles and stock transactions, process labeling aspect-sentiment quadruplet, generative ABSA, sentiment quantifying process, the architectureoftheforecastingmodel,evaluations,andexperiment setup. The dataset explains the statistics and the collection method', '. This research proposes representingvaluemovementerrorandregressionerrorwith adding a list of words in the sentiment lexicon to tackle the adaptive weighted, called Movement-Weighted Regression VOLUME12,2024 178673', '. In previous research, the CNN-BiLSTM combined withgoodperformance.Fine-tunedfromtheRoBERTa-large layerwasusedtobuildastockpriceforecastingmodel,with model [30], siebert/sentiment-roberta-large-english had an the CNN layer processing raw input through an extraction outstanding performance on text classification after being feature,whichwasthenpassedtotheBiLSTMlayertolearn tested on 15 data sets [31]. IndoBERT is an Indonesian predicted stock prices [26]', '. D. Pratama, R. Sarno, and R. Abdullah, ‘‘Sentiment analysis user main.66 regardinghotelreviewsbyaspectbasedusinglatentDirichletallocation, [38] D. L. Padial. (2022). Technical Analysis Library in Python. [Online]. semanticsimilarity,andsupportvectormachinemethod,’’Int.J.Intell. Available:https://github.com/bukosabino/ta Eng. Syst., vol. 15, no. 3, pp.514–524, 2022. [Online]']","The FlanT5-Base indobert-base-p2 model outperformed other models in terms of F1 score, as demonstrated in the performance comparisons presented in Table 6 (Haryono et al., 2024).","sequence-based approach in the log-based anomaly detection research, as shown in Table 2. In contrast, this paper uses a point-based approach based on the characteristics of the problem and the dataset. Therefore, there are limited references that can be used as baselines for comparison, as described in the following: 1) Pylogsentiment . Using a point-based approach, a sentiment analysis model is trained using a one-layer VOLUME 13, 2025 105369 S. Silalahi et al.: Interpretable Ordinal-Aware With Contrastive-Enhanced Anomaly Severity Detection TABLE 6. Hyperparameter search space for all scenarios. neighbouring classes share common features. GRU, LSTM, and Transformer are explored to find the best- performing encoder. To provide a fair comparison, the GloVe embedding used in pylogsentiment, SentiLog, and TransSentLog are",0.6666666666666666,0.918265308592961
"proposed scenario can improve the detection performance of the model. D. ABLATION STUDY D. ABLATION STUDY Following the rapid advancement in neural network research, more complex and sophisticated architectures are emerging. A model can consist of layers of components that have a specific role in the learning process. After conducting an experiment on a certain dataset and task, verifying and checking which component in the model contributes posi- tively to the performance is crucial. Therefore, we perform an ablation study to explain which part of the proposed approach has a significant impact on the performance. Note that only the best-performing scenario on each dataset is explored. First, we investigate the significance of the CLS token from the BERT embedding. Secondly,","['. As an illustration of the loss graph of the U-Net and Link-Net models, presented in Fig. 3c and Fig. 3d. TABLE II. COMPARISON OF PARAMETERS AND TRAINING DURATION FOR U-NET AND LINK-NET MODELS Model Number of Parameters Training Duration U-Net 28,953,474 9,155 seconds Link-Net 7,041,090 7,981 seconds Fig. 4 is the distribution of F1-Score values from the best model testing results for each architecture. Both U-Net and Link-Net have asymmetric distributions', '. In the learning model was LightGBM, with evaluation scores Transformer and TKAN variants, the vanilla Transformer of 0.99843 R2, 96.76132 MAE, 56,754.18872 MSE, has the best performance in 4 of 5 evaluation metrics 0.00833 sMAPE, 0.32185 F1-score, and 0.51070 with evaluation scores of 0.99992 R2, 42.54592 MAE, MWRE@0.75. CEM and REM outperformed LightGBM. 3,075.38631 MSE, 0.00644 sMAPE, 0.46445 F1-score, AmongMLP,LSTM,GRU,andCNN-LSTM,GRUdelivered and 0.40327 MWRE@0.75', '. The model’s convolutional layer utilizes 128 filters, probabilities.TherationalebehindselectingtheAdamopti- each with a kernel size of 5, and employs L2 regularization mizer is its proficiency in managing sparse gradients while with a coefficient of 0.01 to further refine its performance. simultaneously adjusting the learning rate throughout the Additionally, the model features a BiGRU layer comprising trainingprocess', '. those without pretrained weights. To ensure consistency and fair comparison, we used a seed of 42 in all experiments. From Tables III and IV, we can see that the model This seed was chosen arbitrarily and can be replaced with complexity, which consists of the number of layers, number another number, such as 30, as long as it is consistently used of parameters, and the number of floating point operations across all experiments', '. The dropout layer is important in preventing overfitting by randomly turning off a small portion of neurons, ensuring that themodeldoesnotrelyheavilyoncertainfeaturesorpatterns. Thedropoutlayerincreasesthemodel’sgeneralizationability, making it more robust and effective in handling unseen data', '. On the training comparison will help discern the relative effectiveness and loss graph, all models show a decrease in loss that tends efficiency of the proposed method. By doing so, the aim is to to flatten as the epoch increases. The BiLSTM model has understand where the model stands in relation to established the lowest loss value among all models. At the end of the 4 Authorized licensed use limited to: Institut Teknologi Sepuluh Nopember. Downloaded on July 14,2025 at 08:18:27 UTC from IEEE Xplore', '. The U-Net design performs better than Link-Net on average, with smaller training and validation loss values and higher training and validation accuracy values. Table 1 show that the average loss in U-Net is 21% greater than Link-Net, but with the sacrifice of longer training time. So that the Link-Net architecture provides more stable and parsimonious results. TABLE I', '. The sec- accessed through the Google Colab version equipped with ond Dense layer with 128 neurons and ReLU activation state-of-the-art GPUs. Access to GPUs including NVIDIA continues to capture higher-level abstractions in the data. V100andNVIDIAT4wasgrantedalongwithRAMaccess Another dropout layer with a rate of 0.5 aids in preventing of up to 54 GBs. This enabled an efficient execution of overfitting, ensuring the model’s generalizability', '. scoreof99.5%.Incontrast,LSTM3hasthehighestpercentXGboost, with the parameters described in Table 5, gave ageof99.2%.GRU3andGRU4providethesameaccuracy thebestperformance(gamma=0.4,learningrate=0.1,min valueof98.6%.Forthisreason,GRU3waschosenbecauseit child weight = 1, estimator = 52). Meanwhile, the perfor- hasfewermemorycellunits.Inaddition,the1DCNN-LSTM manceofthe1D-CNN,LSTM/GRUmodelswasdetermined and1DCNN-GRUmodels,eachconsistingofthreeoptimal VOLUME11,2023 74933', '. 14), and learns better representation space combination results as discussed in the previous (see Fig. 15). As shown in Table 9, excluding the [CLS] subsection,severalstate-of-the-artlog-basedanomalydetec- token’svectorandfreezingBERT’sparameterduringtraining tion methods proposed in published studies mentioned in deteriorate the model’s performance']",Excluding the [CLS] token’s vector and freezing BERT’s parameters during training can negatively impact model performance (Interpretable Ordinal-Aware With Contrastive-Enhanced Anomaly Severity Detection on UAV Flight Log Messages).,"model plays a significant role in performing the task is crucial to developing a high-performing model. To this end, in this paper, an ablation study is performed. First, we investigate the effect of employing multitask learning on the model’s performance. Secondly, we investigate the effect of using all zeroes for the Normal class label’s representation. Thirdly, the importance of the [CLS] token’s embedding vector and the BERT’s parameters are investigated. Lastly, we com- prehensively study the effect of the proposed DroneSBERT embedding on the model’s performance, interpretability, and learned representations. Overall, the multitask label can improve the detection performance, where the best-performing models on both datasets are achieved by the proposed Multitas-111 label. Using all zeroes to represent the Normal",0.6666666666666666,0.908362629820185
"to explain which part of the proposed approach has a significant impact on the performance. Note that only the best-performing scenario on each dataset is explored. First, we investigate the significance of the CLS token from the BERT embedding. Secondly, we analyse the impact of freezing the BERT’s parameter during training. Thirdly, we vary the batch size during the training. Finally, FIGURE 11. Analysis of the effect of different batch sizes on the evaluation scores of the best-performing models. we examine the effect of increasing the prediction threshold used in our proposed approach on the accuracy and F1 scores. As shown in Table 6, excluding the CLS token embedding before feeding the input matrix to the encoder significantly decreases performance.","['. This is substantially lower than the end- for the embedding layer, and our findings show that this to-endfine-tuningcostoftransformer-basedmodels,suchas preprocessingtechniquehasapositiveimpactontheability IndoBERT,whichrequiredover94,520secondsperepochfor of the model to capture sentence structure and syntactic training. relationships effectively', '. to guide the training process. To assess the final model’s Circular padding was employed as the padding techgeneralizationability,wemeasuredprecision(P),recall(R), nique. The multi-head attention mechanism incorporated F1score(F1),andaccuracy(te−acc)onaseparatetesting four attention heads and the BiLSTM layer was configured dataset. with 100 hidden units. We used pre-trained GloVe with 50 dimensions [36] and fastText embeddings [37] for word IV. EXPERIMENTS embeddings', '. Therefore, including Subsection IV-B are also used as baselines to verify the [CLS] token’s feature and tuning BERT’s parameter have a superiority of the proposed method in this paper. After positiveimpactonthemodel’sperformance.Basedonthese implementing the baselines and testing them on the filtered findings, embedding plays a significant role in performing and unfiltered datasets, the results are reported in Table 9. the prediction', '. Therefore, four, used in pylogsentiment, SentiLog, and TransSentLog are six,andeightareexploredintheexperiment.Astwodatasets replaced by BERT embedding as it is better used for text are used in the experiment, there are 1,584 resulting model classification than a static embedding such as GloVe [53]. configurationsintotal,729foreachdataset. Moreover, hyperparameter tuning is also performed on the Considering the extensive number of hyperparameter four aforementioned baselines', '. Thirdly, Thisisshownbytheattributionscores,wherefiveoutofeight the importance of the [CLS] token’s embedding vector and examples belonging to the High class have negative overall the BERT’s parameters are investigated. Lastly, we comattribution scores', '. trained large language models (PLMs), BERT is commonly Therefore,foreachencodertypeandscenario,onlythebestusedinlog-basedanomalydetectionresearch,asdiscussedin performingoneispresentedforcomparisonandexplainedin SectionII.Therefore,allthemodelsinthispaperuseBERTas thefollowingsubsection.Severalmetricsareusedtoevaluate thewordembeddingmodel.Otherthanthesefourbaselines, the overall models’ performance, i.e., accuracy, precision, we construct our own baseline by performing a grid search recall, and F1', '. 14), and learns better representation space combination results as discussed in the previous (see Fig. 15). As shown in Table 9, excluding the [CLS] subsection,severalstate-of-the-artlog-basedanomalydetec- token’svectorandfreezingBERT’sparameterduringtraining tion methods proposed in published studies mentioned in deteriorate the model’s performance', '. Conversely, machine learning methods, especially deep the capacities of Bidirectional Long Short-Term Memory learning, learn from large datasets to identify word patterns (BiLSTM) networks, enhancing the processing of sequential and boundaries, proving more effective for languages with data by capturing contextual information from both preceding intricate structures [18], [23], [28], [29]. and subsequent text elements', '. In this study, bidirectional language representation by jointly training on Euclidean and Manhattan distances are utilized within the the left and right context of a given word across all layers K-MeansandAgglomerativealgorithms.ThisManhattandisof the model. The core of the BERT model architecture is tanceisstatedinEq.1–3. a eac m h u w lti o - r la d y i e n r th b e id t i e re x c t t i i s on tr a a l ns e f n o c r o m d e e d r i t n ra to ns a fo n r u m m e e r', 'dataset[18].Themodel’sperformancewasenhancedbythe dingmodels,suchasWord2vec[34],GloVe[35],ELMo[36], concept of concatenating the word’s vector representation and BERT [13], improved the BiLSTM-CRF architecture']",Excluding the [CLS] token’s vector and freezing BERT’s parameters during training significantly deteriorates model performance (Interpretable Ordinal-Aware With Contrastive-Enhanced Anomaly Severity Detection on UAV Flight Log Messages).,"CRF is used as the decoder. In terms of convergence speed, as depicted in Fig. 11, the proposed method converges as fast as Transformer and AdaTrans. Moreover, cosine atten- tion outperforms the BiLSTM model. From the F1 score, our proposed method achieves the second-best performance FIGURE 10. Comparison between different encoders with the best performance on the test set of the contextual dataset. results reported in Table 7 to 9, the involvement of either con- textual or static embedding signiﬁcantly affects the model’s performance evaluation score. This can be seen from the dot-product attention performance, with a 3.782% difference between the best dot-product attention that uses BERT and GloVe. This signiﬁcant difference is also happening to the cosine attention, with",0.6666666666666666,0.9501510072435694
"effect of increasing the threshold on the accuracy and F1 scores of the best-performing model tested on both datasets. An interesting case is shown in Fig 12a when λ = 0.65, the accuracy reaches 97%, exceeding the best model’s accuracy when λ = 0.5. This happens when the prediction confidence score surpasses the threshold while the true label’s severity is lower than the prediction label’s. Thus, following the decoding procedure in section III-C, the predicted label is incorrect. This phenomenon also happens on the filtered dataset when λ > 0.94. Overall, the decrement in the accuracy and F1 scores is insignificant until λ = 0.9 and λ = 0.8 on the unfiltered and filtered datasets, respectively. Thus, it confirms the","["". These metrics can be calculated by (1) – (3). This study's calculation of True Positive, False Positive, and False Negative differs from other classifications or detections [20]-[23]. These are chosen and calculated following previous studies [1]. Precision detects the truly correct prediction out of all predictions. Recall detects the truly correct prediction out of all actual classes. F1 scores are harmonic mean between these two that measure overall model performance"", 'that could be vital for accurate classification [40]', '. TP pre = (22) TP+FP + ε tagging procedure. The model with the best performance is TP rec = (23) highlighted a bold font. The presented scores in the tables TP+FN + ε containboth proposedandbaselinemodels', '. MACHINE LEARNING PARAMETERS Evaluatioin metrics ML models Parameters Models MSE RMSE MAE max_depth: 10, min_samples_split: 2, RF SARIMAX 639714.51 799.82 650.35 n_estimator: 50 RF 1384875.01 1176.80 958.96 learning_rate: 0.05, max_depth: 3, XGBoost XGBoost 1389609.34 1178.81 961.11 n_estimators: 100 GBM 1406810.24 1186.09 971.82 learning_rate: 0.2, max_depth: 3, n_estimators: LightGBM LSTM 16816.55 129.67 103.94 100 Authorized licensed use limited to: Institut Teknologi Sepuluh Nopember', '. CLASSIFICATION RESULTS IN EACH ACCEPTED FEATURES Entropy Gini Index Depth Accuracy Sensitivity Specificity Accuracy Sensitivity Specificity 3 0.998682278 0.998137797 0.999314045 0.998658464 0.99810826 0.99929689 4 0.998706092 0.998152616 0.999348339 0.998666337 0.998152476 0.999262572 5 0.998793258 0.998285484 0.999382522 0.998809288 0.9983002 0.999399863 6 0.998927976 0.998521585 0.999399554 0.998927976 0.998521585 0.999399554 7 0.998927976 0.998521585 0.999399554 0.998753491 0.998226492 0.999365243 8', '. This function is prevalently utilized in binary classification scenarios to ascertain the likelihood of data points belonging to one of two categories, producing an output value ranging between 0 and 1, which is conducivetoprobabilityinterpretation.Conversely,thesoftmax FIGURE12. AccuracyandF1-scoreofMHA-CovBimodelcorrespondingto functionistailoredformulticlassclassificationcontexts,gendifferentoptimizationalgorithms. erating a probability distribution across numerous classes', '. To this end, the prediction confidence over all samples in thetestdataisaveragedforeachexperimentscenario.Fig.9 showsthedistributionofthemeanofthemodel’sprediction score grouped by the scenario. The proposed Multitask-111 demonstrates better prediction confidence on both datasets than the other three scenarios. It can be seen from the distribution graph and the minimum score. Conversely, the Focal scenario shows less confident prediction on both datasets', '. Accuracy = (15) Based on the sampling result on 659 data, the dataset TP+TN +FP+FN used in this study is arranged as shown in detail in Table 3. TP Recall(Sensitivity) = (16) In the dataset, there are 11 initial features, since not all TP+FN initial features are used to create the model. They had to TP Precision(P) = (17) go through the feature extraction process first to obtain the TP+FP features used to create the model detection', '. As discussed in Section V-A, the best-performing models on both datasets are achieved by our proposed method; we further analyse the effect of increasing the prediction thresholdupon inferringthelabel.As thethresholdvalueis closerto1,anotabledecreasecanbeseeninFig.13b,starting from0.94.Conversely,theunfiltereddatasetinFig13ashows anegligibledecrease. C. ERRORANALYSIS This section discusses the confusion matrix, learned representation, and the interpretability of the best-performing FIGURE10', 'TABLE IV. COMPARISON PERFORMANCE OF EACH MODEL Performance Model Accuracy Precision Recall F1 Score Random Forest 0.989 0.989 0.989 0.989 Decision Tree 0.979 0.979 0.979 0.979 Logistic 0.700 0.688 0.700 0.663 Registrion SVM 0.695 0.779 0.695 0.607 D. Performance Comparison of Predictive Analysis The prediction analysis used in this research compares the Fig. 10']","The analysis of the effect of increasing the prediction threshold on model performance indicates that as the threshold approaches 1, a notable decrease in accuracy can be observed, particularly starting from a threshold of 0.94 (Interpretable Ordinal-Aware With Contrastive-Enhanced Anomaly Severity Detection on UAV Flight Log Messages).","we further analyse the effect of increasing the prediction threshold upon inferring the label. As the threshold value is closer to 1, a notable decrease can be seen in Fig. 13b, starting from 0.94. Conversely, the unfiltered dataset in Fig 13a shows a negligible decrease. C. ERROR ANALYSIS C. ERROR ANALYSIS This section discusses the confusion matrix, learned rep- resentation, and the interpretability of the best-performing model on the filtered dataset. The confusion matrix in this paper is redefined to align with the anomaly severity context, where the distance between true and predicted labels matters. If the predicted label is lower than the true label, we define it False Positive (FP). Conversely, if the true label is lower than the",0.75,0.9394061896309784
"each scenario. FIGURE 14. The number of misclassified samples from the best-performing model on each loss function tested on the unfiltered dataset. In a binary setting, let the Normal class be positive and the Anomaly is negative. Then, False Positive (FP) refers to samples with a true label negative but predicted as positive. At the same time, a False Negative (FN) is a case when a sample belongs to a positive class but is predicted as negative. However, in this study, we define the misclassification cases differently: • False Positive refers to a case when the true class is higher than the predicted class. • False Negative is a misclassification case where the true class is lower than the predicted","['. In this context, having less FP is more important than having less FN, as the task objective is anomaly severity detection, where we aim to detect all abnormalities along withtheseveritylevel.Therefore,undetectedabnormalities, or detecting higher severity as lower ones, indicate that the model fails to meet the task’s objectives', "". These metrics can be calculated by (1) – (3). This study's calculation of True Positive, False Positive, and False Negative differs from other classifications or detections [20]-[23]. These are chosen and calculated following previous studies [1]. Precision detects the truly correct prediction out of all predictions. Recall detects the truly correct prediction out of all actual classes. F1 scores are harmonic mean between these two that measure overall model performance"", '. [13] M. Memarzadeh, B. Matthews, and T. Templin, ‘‘Multiclass anomaly [35] C.Duan,T.Jia,Y.Li,andG.Huang,‘‘AcLog:Anapproachtodetecting detectioninflightdatausingsemi-supervisedexplainabledeeplearning anomaliesfromsystemlogswithactivelearning,’’inProc.IEEEInt.Conf. model,’’J.Aerosp.Inf.Syst.,vol.19,no.2,pp.83–97,Feb.2022. WebServices(ICWS),Jul.2023,pp.436–443. [14] Z.You,L.Cui,Y.Shen,K.Yang,X.Lu,Y.Zheng,andX.Le,‘‘Aunified [36] T.-A. Pham and J.-H', '. Thisstudyproposestoextendthebinaryanomalydetection into a multiclass anomaly detection involving four classes: Normal,Low,Medium,andHigh.Thethreeanomalyclasses representingtheseverityoftheabnormalityaredistinguished byseveralcharacteristicsdescribedinSectionIV-A.AsillustratedbyFig.4,adroneexperiencesvariouseventsfromthe takeoff(e )tothelanding(e ).Eacheventisrepresentedby 1 6 a log message that contains a description of the occurring phenomenon.Amongtheeventsthathappenduringaflight, there might be low,', '. An interesting witharandomstateof42. pattern is shown in Table 8 regarding the hyperparameter Four encoder types are selected to be combined with the values on each encoder type. The GRU works well with baseline and proposed scenarios, i.e., Transformer, LSTM, more layers, average pooling, and uniform class weighting. GRU, and Linear, since these encoders are standard in log- Differently, the Linear model has benefited from the [CLS] based anomaly detection as discussed in Section II', 'S.Silalahietal.:InterpretableOrdinal-AwareWithContrastive-EnhancedAnomalySeverityDetection FIGURE15. Learnedrepresentationofthefiltereddatasetfromthebest-performingmodelsoneachscenario.Toreducetheembeddingvector dimension,t-SNEby[58]isused. FIGURE16. Integratedgradientsoverseveralsamplestointerpretthemodel’sbehaviourinpredictingtheanomalyseverity. Reading the report can help develop a more transparent investigating the model’s interpretability by reading the and trustworthy anomaly detection model', '. • False Negatives (FN): Refers to the number of actual objectsthatthemodelfailedtodetect. Fromthereviewedpapers,wecompiledalistofcommonly used metrics for detection, classification, and segmentation correlation between predictions and actual classes, particutasks, as summarized in Table 4. The metrics considered larly when dealing with unbalanced data [24]', '. Therefore, too many Performing multiclass classification typically encodes the detected anomalies need to be detailed into a more fine- labelrepresentationinaone-hotencodingvector,whereeach grained detection to help the investigator better prioritise vector element represents a certain class. One-hot encoding the analysis objective', '. CLASSIFICATION RESULTS IN EACH ACCEPTED FEATURES Entropy Gini Index Depth Accuracy Sensitivity Specificity Accuracy Sensitivity Specificity 3 0.998682278 0.998137797 0.999314045 0.998658464 0.99810826 0.99929689 4 0.998706092 0.998152616 0.999348339 0.998666337 0.998152476 0.999262572 5 0.998793258 0.998285484 0.999382522 0.998809288 0.9983002 0.999399863 6 0.998927976 0.998521585 0.999399554 0.998927976 0.998521585 0.999399554 7 0.998927976 0.998521585 0.999399554 0.998753491 0.998226492 0.999365243 8', 'that could be vital for accurate classification [40]']","In anomaly severity detection, prioritizing a lower number of false positives (FP) over false negatives (FN) is crucial to effectively identify all abnormalities and their severity levels (Memarzadeh et al., 2022).","we further analyse the effect of increasing the prediction threshold upon inferring the label. As the threshold value is closer to 1, a notable decrease can be seen in Fig. 13b, starting from 0.94. Conversely, the unfiltered dataset in Fig 13a shows a negligible decrease. C. ERROR ANALYSIS C. ERROR ANALYSIS This section discusses the confusion matrix, learned rep- resentation, and the interpretability of the best-performing model on the filtered dataset. The confusion matrix in this paper is redefined to align with the anomaly severity context, where the distance between true and predicted labels matters. If the predicted label is lower than the true label, we define it False Positive (FP). Conversely, if the true label is lower than the",0.5,0.9287668520739308
"study, we define the misclassification cases differently: • False Positive refers to a case when the true class is higher than the predicted class. • False Negative is a misclassification case where the true class is lower than the predicted class. Table 7 shows the position of FP and FN based on the above definition in a multiclass confusion matrix. VOLUME 12, 2024 64263 S. Silalahi et al.: Severity-Oriented Multiclass Drone Flight Logs Anomaly Detection FIGURE 15. A 2D visualisation of the filtered dataset representation obtained from the best model from each loss function tested on the filtered dataset. t-SNE is used to reduce the dimension of the embeddings. In an anomaly detection setting, FP is more important than FN","['. Inspired by the study, anomalous events on drone objective[33].Anotheralternativetoleveragethepre-trained flight logs can be detected by analysing log messages and model is fine-tuning the models using prompts [34]. With identifying suspect key phrases closely related to drone onlyafewtrainingdata,themodelcancapturethesemantics incident scenarios. Therefore, the region of interest in this of the input logs and detect anomalous log sequences well', '. DigitalObjectIdentifier10.1109/ACCESS.2025.3580056 Interpretable Ordinal-Aware With Contrastive-Enhanced Anomaly Severity Detection on UAV Flight Log Messages SWARDIANTARASILALAHI 1,(GraduateStudentMember,IEEE), TOHARIAHMAD 1,(Member,IEEE),HUDANSTUDIAWAN 1,(Member,IEEE), EIRINIANTHI 2,ANDLOWRIWILLIAMS 2 1DepartmentofInformatics,InstitutTeknologiSepuluhNopember,Surabaya60111,Indonesia 2SchoolofComputerScienceandInformatics,CardiffUniversity,CF244AGCardiff,U.K', '. [8] S. Silalahi, T. Ahmad, and H. Studiawan, ‘‘Drone flight log anomaly severityclassificationviasentenceembedding,’’inProc.Int.Conf.Artif. [30] S. Han, Q. Wu, H. Zhang, B. Qin, J. Hu, X. Shi, L. Liu, and X. Yin, Intell.,Blockchain,CloudComput.,DataAnal.(ICoABCD),Nov.2023, ‘‘Log-basedanomalydetectionwithrobustfeatureextractionandonline pp.100–105. learning,’’IEEETrans.Inf.ForensicsSecurity,vol.16,pp.2300–2311, 2021', '. 1) We propose DroneLog, an interpretable sentimentAs an example, the flight path taken by a drone during a based multiclass drone flight log anomaly detection flightisrecordedinlongitudeandlatitudecoordinates.These frameworkthatincludesthreeanomalyseveritylevels: datacanbeusedtodetectananomalybyfindingapeculiar low,medium,andhigh.Providingtheseveritylevelcan valuewithinthelogrecordsbycontrastingthenormalvalues provide better detection results for the investigator to', '. B. PROBLEMSTATEMENT For instance, at the e , the drone exceeds the maximum In the event that there is only benign data (i.e., no sample 3 flight distance. Several sentiment-baring words or phrases of abnormal data), anomaly detection can be conducted by from the illustration include ‘‘out of range’’, ‘‘overheated’’, training a recurrent neural network (RNN)–based model and ‘‘failed’’', 'robust predictions, enabling drone operators to detect and Furthermore, Jain et al. [10] proposed a framework for diagnose malfunctions quickly and take corrective actions. sensor data identification and verification. An analysis of a Thestructureofthispaperisasfollows.SectionIIpresents drone’sarchitectureandaforensicmodelwithgenericfeatures previous research relating to the drone log analysis and drone are proposed here in order to enhance the digital investigation forensics', '. [13] M. Memarzadeh, B. Matthews, and T. Templin, ‘‘Multiclass anomaly [35] C.Duan,T.Jia,Y.Li,andG.Huang,‘‘AcLog:Anapproachtodetecting detectioninflightdatausingsemi-supervisedexplainabledeeplearning anomaliesfromsystemlogswithactivelearning,’’inProc.IEEEInt.Conf. model,’’J.Aerosp.Inf.Syst.,vol.19,no.2,pp.83–97,Feb.2022. WebServices(ICWS),Jul.2023,pp.436–443. [14] Z.You,L.Cui,Y.Shen,K.Yang,X.Lu,Y.Zheng,andX.Le,‘‘Aunified [36] T.-A. Pham and J.-H', '. combinedfromtwopublicdroneflightlogdatasets,i.e.,from 5) DroLoVe[9].ThestudyproposedamultitasklearningMendeley[51]andadronewiki[52].Therearetwodatasets: based anomaly severity detection on drone flight unfiltered and filtered. The unfiltered dataset is a collection logs with an assumption that, samples belonging to of log messages in its original condition gathered from the twosourceswithoutperforminguniquefiltering.Therefore, thereareseveralduplicatelogmessagesbothintrainingand TABLE4', 'S.Silalahietal.:InterpretableOrdinal-AwareWithContrastive-EnhancedAnomalySeverityDetection 1) Human-readable log messages can be found in the flightlog,whichishighlyrelevanttovariousincident cases,asshowninFig3.Notonlyisithighlyrelevant, but it is also highly prioritised evidence in diverse investigationcases. 2) Flight log messages cover events from the drone’s sensors,features,andcomponents,makingitonepiece of evidence to perform analysis related to different drone software and hardware components', '. Thisstudyproposestoextendthebinaryanomalydetection into a multiclass anomaly detection involving four classes: Normal,Low,Medium,andHigh.Thethreeanomalyclasses representingtheseverityoftheabnormalityaredistinguished byseveralcharacteristicsdescribedinSectionIV-A.AsillustratedbyFig.4,adroneexperiencesvariouseventsfromthe takeoff(e )tothelanding(e ).Eacheventisrepresentedby 1 6 a log message that contains a description of the occurring phenomenon.Amongtheeventsthathappenduringaflight, there might be low,']","The study extends binary anomaly detection to a multiclass framework, categorizing anomalies into four classes: Normal, Low, Medium, and High, based on distinct characteristics (Silalahi et al., 2024).","be employed to force the model to learn a distinctive representation of the positive FIGURE 4. An illustration of anomalies that occur during a drone’s flight. inclusive. Therefore, this paper proposes a multitask-based multiclass drone anomaly detection to assist in a forensic investigation. The main contributions of this paper are summarized as follows: 1) We propose DroneLog, an interpretable sentiment- based multiclass drone flight log anomaly detection framework that includes three anomaly severity levels: low, medium, and high. Providing the severity level can provide better detection results for the investigator to pinpoint the event of interest. Interpretability makes training and testing more transparent, the model trustworthy, and human-friendly. 2) We propose DroneSBERT,1 a domain-specific embed- ding to extract semantic features",0.8,0.9139880944612578
"the performance of the proposed framework has been discussed and analysed. In this section, challenges encountered during the study are disclosed, along with limitations and threats to validity. As drone forensics is an emerging topic, there are very limited public datasets available. The log messages used in this study are mainly acquired from DJI-made devices. There is yet to come a publicly available dataset of log messages from other drone manufacturers. Several publicly available datasets are mainly about sensor data and multimedia artefacts . While in this study, we solely depend on the human-readable messages generated by the drone during a flight. Given the condition where a small number of unique messages and most of them are acquired from DJI","['. challenges for drone digital forensics investigations,’’ Array, vol. 14, Jul.2022,Art.no.100135. [27] J. Qi, Z. Luan, S. Huang, C. Fung, H. Yang, H. Li, D. Zhu, and D.Qian,‘‘LogEncoder:Log-basedcontrastiverepresentationlearningfor [5] H.Studiawan,G.Grispos,andK.-K.-R.Choo,‘‘Unmannedaerialvehicle anomalydetection,’’IEEETrans.Netw.ServiceManage.,vol.20,no.2, (UAV)forensics:Thegood,thebad,andtheunaddressed,’’Comput.Secur., pp.1378–1391,Jun.2023. vol.132,Sep.2023,Art.no.103340. [28] J. Li, H. He, S. Chen, D', '. 1 illustrates a forensic timeline conWhile the drone is flying, any event that happens to the structed from the flight log message along with mentioned drone is recorded in a log file, including the component’s entitieswithin.Awell-constructedforensictimelineexposes state,suchassensors,motors,GPS,andlinks.Thesedataare sequentialeventsexperiencedbyasystemregardingaparticstoredintelemetryanddataflashlogslocatedinthepersistent ularsecurityincident[21].Inthisresearch,weuseflightlog storage attached to the', '. For instance, GPS records can be utilisedtoreconstructandanalysethepathtakenbythedrone duringaflight[2].Thedeviationbetweentheempiricalflight andreconstructedpathscanhappenifthedroneencountersa GPSspoofing[3]. Among the published drone forensics studies, popular worksincludecasestudies,evidenceanalysis,toolsdevelopment, and forensic framework development [5]', '. system(UAS)forensics:Dataextraction&analysis,’’ForensicSci.Int., [28] S.ViswanathanandZ.Baig,‘‘Digitalforensicsfordrones:Astudyoftools Digit.Invest.,vol.41,Jun.2022,Art.no.301379. andtechniques,’’inApplicationsandTechniquesinInformationSecurity, [6] E. Mantas and C. Patsakis, ‘‘GRYPHON: Drone forensics in dataflash L.BatinaandG.Li,Eds.Singapore:Springer,2020,pp.29–41. andtelemetrylogs,’’inAdvancesinInformationandComputerSecurity, [29] M. Debinski, F. Breitinger, and P. Mohan, ‘‘Timeline2GUI: N', '. Section III explains the proposed method, applying process. Also, Barton et al. [11] conducted the research to the Transformer technique to forensics of drone malfunctions. reconstruct the actions taken by these drones, identify their InSectionIV,thediscussionofperformancemethod,followed owners or operators, and extract data from associated mobile by conclusions and future works in Section V. devices. In other research in drone forensics, this paper also analyze II', '. For example, in drone forensics, existing studiesgenerallyconsideranomaliesascontradictorytonormalevents.Inotherwords,alltypesofanomalies are considered equally important. However, the peculiar events experienced by a drone during a flight might contain distinct features indicating the anomalies’ importance or level of urgency. For instance, the message ‘‘Critically low power', '. Several forensic problems yet. We identify and propose six similarstudiesweredoneonotherdronemodels,suchasthe entitytypesasthetagsetintheannotationprocess.The Yuneec Typhoon model [12], DJI Spark [26], and the DJI proposedmodelachievesacompetitivescorecompared Phantom [27]. According to those case studies, the drone’s to the state-of-the-art methods, with a 91.146% F1 controllerdevicesstoredvaluabledatathatcanbecompared score', 'robust predictions, enabling drone operators to detect and Furthermore, Jain et al. [10] proposed a framework for diagnose malfunctions quickly and take corrective actions. sensor data identification and verification. An analysis of a Thestructureofthispaperisasfollows.SectionIIpresents drone’sarchitectureandaforensicmodelwithgenericfeatures previous research relating to the drone log analysis and drone are proposed here in order to enhance the digital investigation forensics', '. These files contain not only empiricalprocessesbutalsorecordthesensordataforevery certaintimeperiod,makingthedroneforensic-readyincaseit encountersanaccidentorincident.Assumingthatthelogdata are admissible, a forensic investigation can be conducted to understandtheincidentscenarioanduncovertherootcause. Todoso,severalartefactssuchasflightlogs,images,videos, firmware logs, and controller applications can be analysed, as illustrated in Fig 1', '. theexperimentalresults,theTransformerobtainsthehighestF1 In the context of classifying drone malfunctions, the Transscore value of 93.04%. former model can be trained on a dataset of labeled drone Index Terms—drone forensics, forensic investigation, malfunctelemetry data to learn patterns and relationships between the tions, infrastructure, Transformer, Informer, FEDformer drone’s behavior and the root cause of a malfunction. The dataset can include features such as altitude, velocity, battery I']","The log files generated by drones contain empirical processes and sensor data, which are crucial for forensic investigations in the event of accidents or incidents (Qi et al., 2022).","a scenario design, data generation and acquisi- tion, data analysis, and ﬁnally, reporting. Several references are using DJI , , , Cheerson , Parrot , and Yuneec model as experimental devices. However, there is no attempt to utilize speciﬁc data, in this case, the log message, to perform a drone forensic investigation. For this reason, we propose a deep learning-based Natural Language Processing (NLP) technique to perform information extrac- tion from the log message to assist the forensic investigation process. Information Extraction (IE) is one of the sub-topic in the NLP research domain, which aims to infer knowledge from a lake of text data. There are several steps in performing information extraction; after data source collection and pre- processing, Named",0.75,0.9411699459409647
"the model can be convincing and accountable enough to the investigator to be included in the investigation report. VII. CONCLUSION AND FUTURE WORK VII. CONCLUSION AND FUTURE WORK In this paper, we demonstrate how to train a log-based anomaly detection model that can prioritise the prediction of higher severity anomalies on drone flight logs while increasing the prediction confidence score at the same time. Considering the nature of the dataset, where samples that belong to different severity levels share common features, a multitask vector label representation along with severity-oriented decoding is proposed. An extensive experiment proved that the proposed approach is better than the previous work baselines while being inferior to our baseline scenario based on the accuracy and F1","['. Inspired by the study, anomalous events on drone objective[33].Anotheralternativetoleveragethepre-trained flight logs can be detected by analysing log messages and model is fine-tuning the models using prompts [34]. With identifying suspect key phrases closely related to drone onlyafewtrainingdata,themodelcancapturethesemantics incident scenarios. Therefore, the region of interest in this of the input logs and detect anomalous log sequences well', '. DigitalObjectIdentifier10.1109/ACCESS.2025.3580056 Interpretable Ordinal-Aware With Contrastive-Enhanced Anomaly Severity Detection on UAV Flight Log Messages SWARDIANTARASILALAHI 1,(GraduateStudentMember,IEEE), TOHARIAHMAD 1,(Member,IEEE),HUDANSTUDIAWAN 1,(Member,IEEE), EIRINIANTHI 2,ANDLOWRIWILLIAMS 2 1DepartmentofInformatics,InstitutTeknologiSepuluhNopember,Surabaya60111,Indonesia 2SchoolofComputerScienceandInformatics,CardiffUniversity,CF244AGCardiff,U.K', '. For instance, the message ‘‘Critically low power. Aircraft is landing’’ is more important than ‘‘Forward Obstacle Sensing notWorking’’.ThisstudyproposesDroneLog,aninterpretableframeworkfordetectinganomaliesandthe severity levels on drone flight logs, using a multitask learning approach in a unified pipeline', '. 1) We propose DroneLog, an interpretable sentimentAs an example, the flight path taken by a drone during a based multiclass drone flight log anomaly detection flightisrecordedinlongitudeandlatitudecoordinates.These frameworkthatincludesthreeanomalyseveritylevels: datacanbeusedtodetectananomalybyfindingapeculiar low,medium,andhigh.Providingtheseveritylevelcan valuewithinthelogrecordsbycontrastingthenormalvalues provide better detection results for the investigator to', '. CONCLUSION remains untested as the training dataset contains only log This paper investigates utilising a multitask learning messages acquired from 82 drone models, mostly from paradigmtoperformmulticlassanomalydetectionondrone DJI. This is one of the main challenges in drone forensics flight log messages. Aligning to the nature of multitask research, where human-readable flight log datasets from learning,weproposetwotargetlabelrepresentations,namely other drone models are unavailable', 'S.Silalahietal.:InterpretableOrdinal-AwareWithContrastive-EnhancedAnomalySeverityDetection approach is presented in Section III. The experimental settingsandprocedurearedescribedinSectionIV,whilethe results,findings,anddiscussionsareelaboratedinSectionV. Finally,weconcludethepaperinSectionVI. II. RELATEDWORKS A. LOG-BASEDANOMALYDETECTION Log-based anomaly detection is relatively well-studied, includingincorporatingML[1]anddeeplearning-based[18], [19] to facilitate log anomaly detection', '. [8] S. Silalahi, T. Ahmad, and H. Studiawan, ‘‘Drone flight log anomaly severityclassificationviasentenceembedding,’’inProc.Int.Conf.Artif. [30] S. Han, Q. Wu, H. Zhang, B. Qin, J. Hu, X. Shi, L. Liu, and X. Yin, Intell.,Blockchain,CloudComput.,DataAnal.(ICoABCD),Nov.2023, ‘‘Log-basedanomalydetectionwithrobustfeatureextractionandonline pp.100–105. learning,’’IEEETrans.Inf.ForensicsSecurity,vol.16,pp.2300–2311, 2021', '. combinedfromtwopublicdroneflightlogdatasets,i.e.,from 5) DroLoVe[9].ThestudyproposedamultitasklearningMendeley[51]andadronewiki[52].Therearetwodatasets: based anomaly severity detection on drone flight unfiltered and filtered. The unfiltered dataset is a collection logs with an assumption that, samples belonging to of log messages in its original condition gathered from the twosourceswithoutperforminguniquefiltering.Therefore, thereareseveralduplicatelogmessagesbothintrainingand TABLE4', '. From α the table, it can be seen that the samples from different wheref(·)isasoftmaxfunctiontonormalisethelogitsintoa severity levels share common words or phrases. Therefore, probabilitydistribution.Forthetwoproposedlabelschemas, this study investigates the use of multitask learning to the logits vector element is normalised using the sigmoid perform multiclass classification for detecting anomaly functionasinthefollowingequation: severitywithindroneflightlogmessages', '. In this context, having less FP is more important than having less FN, as the task objective is anomaly severity detection, where we aim to detect all abnormalities along withtheseveritylevel.Therefore,undetectedabnormalities, or detecting higher severity as lower ones, indicate that the model fails to meet the task’s objectives']","The proposed DroneLog framework utilizes a multitask learning approach to detect anomalies and their severity levels in drone flight logs (Silalahi et al., 2025).","severity level can provide better detection results for the investigator to pinpoint the event of interest. Interpretability makes training and testing more transparent, the model trustworthy, and human-friendly. 2) We propose DroneSBERT,1 a domain-specific embed- ding to extract semantic features that are well-aligned to the human perception of the log message samples. Supervised contrastive learning is employed to learn distinct representations for each anomaly severity level. 3) We explore two target label representations to augment a multitask learning paradigm for training multiclass classification models. Aligning to the dataset character- istics where the log messages from different anomaly severity levels share common words and phrases, multitask learning can help the model make use of the shared low-level features in the log",1.0,0.9416781713436141
"ANALYSIS We conducted a controlled experiment to evaluate the influence of various word embedding methods on our model’s performance. We used different word embedding techniques, explicitly using fastText as an alternative method to provide comparative performance data for the architecture with different word embedding inputs. This experiment used 540k sentence pairs and maintained the same settings as the previous experiments. This experi- ment compared the results obtained in a previous experiment using the Glove word embedding technique. The performance comparison of the model using different word embedding techniques is shown in Table 4. As seen in 4, our model performs better with Glove word embedding than FastText. Glove’s advantages align with the findings of , which state that the Glove","['. For the pre-trained word embedding, either attentionmechanism. GloVe or BERT is used to obtain the words’ vector repre- The presence of contextual pre-trained word embedding sentation.Unscaledattentionisreportedtobebetterusedin has positively impacted NLP research recently. The main NER since mentioned entities commonly consist of a few advantageofcontextualoverstaticpre-trainedwordembedwords only [37]', '. [13] to explore the impact of text normaliza- semanticsimilaritiesbetweenlanguages.Mostexistingstudtion on specific text processing tasks. However, the lexical ies rely on multiple types of word embedding, which may 137064 VOLUME12,2024', '. The GloVe word embedding model. In addition, this selection strategy model, trained on an English language corpus, was elected reducestheoccurrenceofout-of-vocabulary(OV)words.The to generate a vector representation of English words. This flowofthewordembeddingselectionprocessisillustratedin decisionisinformedbyfindingsfromaprecedingstudy[14]. Figure3.Theresultsofeachwordembeddingarecombined VOLUME12,2024 137069', '. The resulting word embedding is E[index]←We1+We2 intended to help learn the relationship between words in 6 end sentences written in a mix of Indonesian and English. Furthermore, a hybrid model based on CNN and BiGRU was built and enriched with pragmatic auxiliary features. CNN the data collection. A Python-based Twitter crawler was is very effective in extracting local features from text data', '. Hybrid pretrained thismodel. word embeddings, with FastText for Indonesian and GloVe for English, significantly improve the model’s understanding of coded mixed text. FastText can handle Indonesian V. DISCUSSION word morphology better, while GloVe provides a powerful TheempiricalfindingsindicatethattheMHA-CovBimodel word representation for English. This combination allows demonstrated superior performance relative to baseline and VOLUME12,2024 137075', '. trained large language models (PLMs), BERT is commonly Therefore,foreachencodertypeandscenario,onlythebestusedinlog-basedanomalydetectionresearch,asdiscussedin performingoneispresentedforcomparisonandexplainedin SectionII.Therefore,allthemodelsinthispaperuseBERTas thefollowingsubsection.Severalmetricsareusedtoevaluate thewordembeddingmodel.Otherthanthesefourbaselines, the overall models’ performance, i.e., accuracy, precision, we construct our own baseline by performing a grid search recall, and F1', '. Other than that, most of the BERT and GPT [25], types of pre-trained language model drone forensic research is a type of study showcase, which thatemploysonlythedecoderpartofTransformerarchitecstarts from a scenario design, data generation and acquisi- ture are significantly impacted the NLP research landscape, tion,dataanalysis,andfinally,reporting.Severalreferences including NER', '. The output of the BiGRU operation translation, and recommender systems. Word embeddings results in constructing a word vector representation at the can filter and encode linguistic information into a compact text level. Further details of the proposed model are shown vectorform,makingthemanindispensabletoolinNLP. in Algorithm 2. Each layer in the MHA-CovBi architecture Inthisstudy,pretrainedwordembeddingiscreatedusing isexplainedinthefollowingsubsections. a combination of FastText and GloVe embeddings', '. Bahdanau, F. Bougares, H.Schwenk, and Y. Bengio, ‘‘Learning phrase representations using RNN encoder–decoder for statistical machine translation,’’ in Proc. Conf. Empirical Methods Natural Lang. Process. (EMNLP), 2014, pp.1724–1734. [50] C. Wang, P. Nulty, and D. Lillis, ‘‘A comparative study on word EIRINI ANTHI iscurrentlyaLecturerincyberembeddingsindeeplearningfortextclassification,’’inProc.4thInt.Conf. security with the School of Computer Science NaturalLang.Process.Inf.Retr.,Dec.2020,pp.37–46', '. This layer can utilize vast extractionfromtextbutcouldbemoreeffectiveatencoding real-worldtextcorporatocapturenuancedsemanticrelationsequentialinformation.Furthermore,BiGRUisimplemented ships among words, where aligned vectors often represent for sequential modeling and effectively captures contextual words with similar meanings. Applying word embeddings information from the sequence of features obtained from extendstovariousfields,suchastextclassification,machine the convolution layer']","The use of hybrid pretrained word embeddings, combining FastText for Indonesian and GloVe for English, has been shown to significantly enhance model performance in understanding mixed language text (Sarcasm Detection in Indonesian-English Code-Mixed Text Using Multihead Attention-Based Convolutional and Bi-Directional GRU).","6 show the models’ architecture where LSTM and CNN were used as the character embedding, respectively. From the evaluation score presented in Table 4 to 6, the best performance was achieved by GloVe – Scaled AdaTrans combination with an 87.771% F1 score. AdaTrans atten- tion consistently achieves the highest score for all character embedding and word embedding options. GloVe outperforms the BERT embedding evaluated on the non-contextual dataset for all scenarios. This is because the ﬁrst dataset has con- sistent tagging, meaning that a word has a consistent tag for all different contexts in the dataset. It complies with the GloVe behavior, where each word has exactly one representa- tional vector. BERT – Scaled Transformer achieved the best overall performance",0.75,0.8983022643516706
"research introduces a novel Activity Recom- mendation System built on the COBIT 2019 framework tailored for Financial Balance Scorecard. The motivation stems from the challenges faced by auditors when identifying essential activities aligned with strategy of a company, often hindered by manual COBIT 2019 guideline navigation. To address this, a system was developed, where inputting the company strategy, triggers the display of recommended activities automatically. The methodology involved creating interconnected nodes from COBIT 2019 Element in Neo4J. This research uses a real strategy plan case study from 3 different companies as input, followed by a preprocessing step, then compares it to Enterprise Goals using TF-IDF and cosine similarity. Goals with high similarity scores trigger a graph query to reveal connected","['A Recommendation System for Internal Business Processes of COBIT 2019 Using Graph Algorithm and Similarity Methods 1st I Gusti Lanang Agung Oka Cahyadi Pradipta 2nd Rizky Damara Ardy Informatics Departments Informatics Departments Institut Teknologi Sepuluh Nopember Institut Teknologi Sepuluh Nopember Surabaya, Indonesia Surabaya, Indonesia 6025232017@student.its.ac.id 6025231004@student.its.ac.id 3th Riyanarto Sarno 4th Kelly Sungkono Informatics Departments Informatics Departments Institut Teknologi', '. It provides activity recommendations for in a table format for easy reference and analysis. The table users based on their specific requirements and objectives, will include detailed information about each recommended tailored to help organizations optimize their internal business activity, including its name, description, associated processes, processes according to COBIT 2019 guidelines', '. nodesandrelationshipsbasedonCOBIT2019elements. E. Activity Recommendation 2) ImportthepreprocesseddataintoNeo4j,mappingnodes to entities such as internal business processes, control Based on the similarity measurements, the system recomobjectives, and IT processes. mends activities aligned with enterprise goals. The steps are: Authorized licensed use limited to: Institut Teknologi Sepuluh Nopember. Downloaded on July 14,2025 at 08:22:06 UTC from IEEE Xplore. Restrictions apply.', '. V. CONCLUSION This paper propose a novel recommendation system for internal business processes based on the COBIT 2019 framework.Byintegratinggraphalgorithmsandsimilaritymethods, Fig.2', '. The Neo4j activities that correlate with Enterprise Goal EG02, which visualization tool offers a user-friendly interface for explordescribes ”Optimization of business process functionality.” ing COBIT framework relationships, enabling stakeholders to Using Algorithm 3, a graphical representation is created, as make data-driven decisions. Authorized licensed use limited to: Institut Teknologi Sepuluh Nopember. Downloaded on July 14,2025 at 08:22:06 UTC from IEEE Xplore. Restrictions apply.', '. Recommendations based on COBIT 2019 best practices, such as performance measurements and knowledge repository access, further enhance IT governance processes and contribute to the success of software development projects. The integration of AI and machine learning techniques with the COBIT 2019 framework holds promise in further enhancing IT governance practices [19]', '. deeper analysis, real-time monitoring, and informed IT manAfter identifying company goals with a similarity value agement decisions. greater than 50, these nodes are used as references for the Our results demonstrated the system’s effectiveness in sugnext graph query execution to obtain the required activities. gesting activities tailored to enterprise goals, enhancing IT The output matches the mapping results, displaying only management practices and operational efficiency', 'Neo4jisagraphdatabasespecificallydesignedtostoreand functions by enhancing the organization’s ability to manage data with complex relationships [8]. In the context manage IT effectively. of COBIT 2019, Neo4j can be utilized to build dynamic 2) EG09: Internal Business Process Cost Optimization: graphical representations of various COBIT elements [9]', "". insights into the performance of the organization's information Thus, the system audit with COBIT helps organizations systems, along with recommendations for more effective IT improve the reliability, security, and operational efficiency in management. Thus, audit with COBIT and process mining managing their information technology"", '. Dataset and Preprocessing 26: print(”Similarityscorefor”,sentence,”:”,similarity[0]) The experimental process involves collecting datasets from 27: endfor COBIT2019,specificallyfocusingontheBalancedScorecard for internal business processes. Process mapping is then conAlgorithm 3 Activity Graph Generation ducted as the basis for forming nodes later on']","The experimental process involves collecting datasets from COBIT 2019, specifically focusing on the Balanced Scorecard for internal business processes, which aligns with the development of a recommendation system based on the COBIT 2019 framework tailored for Financial Balance Scorecard.","company goals by proposing a novel recommendation system for internal business processes, grounded in the COBIT 2019 framework. The system employs graph algorithms to map relationships, semantic similarity measure- ments to align enterprise goals with management objectives, and LSTM combined with TF-IDF methods to analyze and recommend specific activities. Experimental results show that this system optimizes IT management practices, enhances operational efficiency, and ensures regulatory compliance. Additionally, a user-friendly graphical representation of internal business pro- cesses using Neo4j enables stakeholders to visualize complex relationships within the COBIT framework, facilitating informed decision-making. This research advances IT governance practices by providing organizations with a valuable tool to automate and improve IT strategies, effectively achieving business objectives. Index Terms—COBIT 2019, graph algorithms, IT",0.6,0.8251829355985
"management are vital for businesses in rapidly evolving landscape nowadays. Imple- menting an IT governance framework is crucial for several reasons. Firstly, it enables effective risk management against cyber threats, data breaches, and regulatory requirements, enhancing resilience and protecting sensitive data. Secondly, it ensures alignment between IT strategies and business ob- jectives, driving efficiency, innovation, and competitiveness. Lastly, it facilitates compliance with data privacy regulations and industry standards, ensuring transparency and accountabil- ity. Among these frameworks, COBIT is globally recognized for overseeing Enterprise Information and Technology (I&T) comprehensively, covering all systems regardless of their lo- cation within the organization. In essence, Enterprise I&T extends beyond the confines of the IT department and encompasses all facets of technology and information processing","['performance in the realm of critical role of risk management in IT governance', '. This system aims COBIT 2019, which stands for Control Objectives for to help organizations manage risk, ensure compliance, and Information and Related Technologies, is a comprehensive enhanceperformanceinthecontextofinformationtechnology', '. Using COBIT metrics, organizations XGBoost 4.29 6.34 0.69 40.45 can evaluate and improve the quality of IT Governance, LightGBM 4.74 7.53 0.56 45.14 ensure compliance with regulatory provisions, and improve CatBoost 4.25 6.53 0.67 36.26 operational efficiency. As a result, these initiatives not only are presented in Table IV using MAE, RMSE, R², and MAPE improve the efficiency of project planning and execution but me trics', '. EVALUATION METRICS contract. Models MAE RMSE R2 MAPE In the field of IT governance, the combination of machine Linear Regression 4.32 6.01 0.72 40.20 learning methodologies with COBIT 2019 analytics provides Decision Tree 7.33 10.29 0.18 64.64 a robust framework to ensure that the IT management Random Forest 5.13 8.11 0.49 43.10 Gradient Boosting 4.67 7.11 0.61 41.79 methodology is consistent with global measurements and SVM 5.95 10.29 0.18 38.57 optimum methodology', '. I. Fianty and M. Brian, “Leveraging COBIT 2019 Framework to 10.1080/00949655.2012.658804. Implement IT Governance in Business Process Outsourcing [35] T. M. Oshiro, P. S. Perez, and J. A. Baranauskas, “How Many Trees in Company,” Journal of Information Systems and Informatics, vol. 5, no. a Random Forest?”, In Machine Learning and Data Mining in Pattern 2, pp. 568–579, May 2023, doi: 10.51519/journalisi.v5i2.492. Recognition: 8th International Conference, MLDM 2012, Berlin, [18] S. Dhir, D. Kumar, and V', '. By utilizing COBIT 2019, organizations can enhance the igation. This study addresses the challenge of automating IT efficiency,effectiveness,andreliabilityoftheirITusage,while management based on company goals by proposing a novel also ensuring compliance with relevant regulations, policies, recommendationsystemforinternalbusinessprocesses,grounded in the COBIT 2019 framework. The system employs graph and standards [4]', '. In summary, this paper proposes the development of a 4) EG11: Risk Management Implementation: This prorecommendation system based on COBIT 2019’s internal cess emphasizes the importance of risk management in business processes, utilizing graph algorithms and similarity thecontextofinformationtechnology.Itisoneofseveral method to provide organizations with a dynamic tool for tasks and components within COBIT that highlight the managing risk, compliance, and performance in the realm of critical role of risk', '. P.-J. Wu, D. W. Straub, and T.-P. Liang, “How infornal RESTI (Rekayasa Sistem dan Teknologi Informasi), mation technology governance mechanisms and stratevol. 4, pp. 764–774, Aug. 2020. DOI: 10.29207/resti. gic alignment influence organizational performance,” v4i4.2265. MIS quarterly, vol. 39, no. 2, pp. 497–518, 2015. [3] R. Sarno, STRATEGI SUKSES BISNIS DENGAN TI Berbasis Balanced Scorecard dan COBIT. ITS Press, 2009, ISBN: 978-979-8897-39-9', 'Optimizing IT Governance and Project Management in Software Development through AI Integration and COBIT 2019 Framework Joko Slamet Hartono Saputro Andy Teguh Department of Informatics Department of Informatics Department of Informatics Institut Teknologi Sepuluh Nopember Institut Teknologi Sepuluh Nopember Institut Teknologi Sepuluh Nopember Surabaya, Indonesia Surabaya, Indonesia Surabaya, Indonesia 6025231063@student.its.ac.id 60252310@student.its.ac.id 6025231047@student.its.ac.id Riyanarto Sarno Kelly', '. In this study case, we only had access to the IMARA model is supposed to be able to conduct any theoperationaldataofJanuary2022.Inotherorganizations’ multi-layer and multi-dimensional risk evaluation activities implementations, the levels of this proposed method could by applying levels of processes risks assessments as long be more than Level 2 or could be less depending on the asanyorganizationtoimplementtheproposedmethoduses complexityandtheneedoftheirbusinessprocesses.Table2']","The COBIT 2019 framework is recognized for its comprehensive approach to managing risk and ensuring compliance in information technology, which is essential for effective IT governance (A Recommendation System for Internal Business Processes of COBIT 2019 Using Graph Algorithm and Similarity Methods).","assist organizations in managing and optimizing their use of information technology (IT) . landscape, effective IT In today’s rapidly evolving digital governance is essential for organizations to ensure that their IT investments align with business objectives, comply with regulations, and mitigate risks . COBIT 2019 provides a structured approach for organiza- tions to establish, implement, and maintain effective gover- nance over IT. It defines the components necessary to create and sustain a governance system, as well as guidelines for building the most suitable governance system for an enterprise . By utilizing COBIT 2019, organizations can enhance the efficiency, effectiveness, and reliability of their IT usage, while also ensuring compliance with relevant regulations, policies, and standards . One of the key",0.75,0.8794071153384012
"COBIT Core Model and Capability Scores, it is necessary to undergo a mapping process according to the instructions in the COBIT 2019 manual. This can be time-consuming, especially when auditor should auditing multiple companies simultaneously. This research aim to simplify the process to get Activities of COBIT 2019 automatically from Input Text Company Strategy that aligned with the description of related Enterprise Goals. This research adopts Neo4j, a graph database platform, to manage KG and process data related to these objectives, to gain deeper and more applicable insights into the relationships between strategic and operational objectives in a company . Furthermore, this research also involves the function of preprocessing the input text in the form of Company Strat- egy using","['. The Neo4j activities that correlate with Enterprise Goal EG02, which visualization tool offers a user-friendly interface for explordescribes ”Optimization of business process functionality.” ing COBIT framework relationships, enabling stakeholders to Using Algorithm 3, a graphical representation is created, as make data-driven decisions. Authorized licensed use limited to: Institut Teknologi Sepuluh Nopember. Downloaded on July 14,2025 at 08:22:06 UTC from IEEE Xplore. Restrictions apply.', '. ”Compliancewithinternalpolicies”] 3: RETURNBSC,EG,AG,OBJECTIVE,ACTIVITY Following this mapping process, a comprehensive list of Activities and Activity Descriptions was compiled for each Management Objective (COBIT Core Model), as shown in 1) Graph Visualization: Visualize the recommended ac- Table II. tivities using graph visualization techniques in Neo4j. After completing the mapping, the data is saved in CSV This involves creating node-link diagrams to represent format for loading into Neo4j', 'Neo4jisagraphdatabasespecificallydesignedtostoreand functions by enhancing the organization’s ability to manage data with complex relationships [8]. In the context manage IT effectively. of COBIT 2019, Neo4j can be utilized to build dynamic 2) EG09: Internal Business Process Cost Optimization: graphical representations of various COBIT elements [9]', '. cesses using Neo4j enables stakeholders to visualize complex Several previous papers still rely on manual approaches to relationshipswithintheCOBITframework,facilitatinginformed COBIT 2019, which have limitations in providing automated decision-making.ThisresearchadvancesITgovernancepractices recommendationsforauditactivitiesbasedoncompanygoals. byprovidingorganizationswithavaluabletooltoautomateand improve IT strategies, effectively achieving business objectives', '. deeper analysis, real-time monitoring, and informed IT manAfter identifying company goals with a similarity value agement decisions. greater than 50, these nodes are used as references for the Our results demonstrated the system’s effectiveness in sugnext graph query execution to obtain the required activities. gesting activities tailored to enterprise goals, enhancing IT The output matches the mapping results, displaying only management practices and operational efficiency', '. One effective way to perform this mapping and sustain a governance system, as well as guidelines for is by utilizing a graph database such as Neo4j [7]. 979-8-3503-5161-3/24/$31.00©2024IEEE 26516701.4202.72816AIITCI/9011.01 :IOD | EEEI 4202© 00.13$/42/3-1615-3053-8-979 | )AIITCI( snoitacilppA stI dna noitavonnI ygolonhceT no ecnerefnoC lanoitanretnI dn2 4202 Authorized licensed use limited to: Institut Teknologi Sepuluh Nopember. Downloaded on July 14,2025 at 08:22:06 UTC from IEEE Xplore', '. By utilizing COBIT 2019, organizations can enhance the igation. This study addresses the challenge of automating IT efficiency,effectiveness,andreliabilityoftheirITusage,while management based on company goals by proposing a novel also ensuring compliance with relevant regulations, policies, recommendationsystemforinternalbusinessprocesses,grounded in the COBIT 2019 framework. The system employs graph and standards [4]', '. This system aims COBIT 2019, which stands for Control Objectives for to help organizations manage risk, ensure compliance, and Information and Related Technologies, is a comprehensive enhanceperformanceinthecontextofinformationtechnology', '. It provides activity recommendations for in a table format for easy reference and analysis. The table users based on their specific requirements and objectives, will include detailed information about each recommended tailored to help organizations optimize their internal business activity, including its name, description, associated processes, processes according to COBIT 2019 guidelines', '. information technology [12]. COBIT 2019 provides specific guidance on how organizations can improve the efficiency and effectiveness of their II. LITERATURESTUDY internal business processes, as well as enhance the skills of A. Neo4j as Graph Database their IT staff. By following the recommendations outlined in Neo4jisapopulargraphdatabasewidelyusedformanaging COBIT 2019, organizations can better manage IT, increase and querying complex relational data']","This research advances IT governance practices by providing organizations with a valuable tool to automate and improve IT strategies, effectively achieving business objectives.","company goals by proposing a novel recommendation system for internal business processes, grounded in the COBIT 2019 framework. The system employs graph algorithms to map relationships, semantic similarity measure- ments to align enterprise goals with management objectives, and LSTM combined with TF-IDF methods to analyze and recommend specific activities. Experimental results show that this system optimizes IT management practices, enhances operational efficiency, and ensures regulatory compliance. Additionally, a user-friendly graphical representation of internal business pro- cesses using Neo4j enables stakeholders to visualize complex relationships within the COBIT framework, facilitating informed decision-making. This research advances IT governance practices by providing organizations with a valuable tool to automate and improve IT strategies, effectively achieving business objectives. Index Terms—COBIT 2019, graph algorithms, IT",1.0,0.8516059288531899
"in business process modeling. Using real- life data and public datasets, the research compared GPD++ to traditional methods like Inductive Miner (IM) and Split Miner (SM). Results showed that GPD++ effectively addressed ICRs and detected hierarchical blocks. The paper introduces the Invisible-Task Prime and Non-Prime ITPNP algorithm for mining invisible tasks in process models, focusing on XOR and AND/OR relationships. It detects invisible non-prime tasks in hybrid parallel rela- tionships. Tested on seven models, it outperformed traditional methods, achieving high fitness and precision, especially in complex scenarios. Research by introduces an improved method for detect- ing parallel process models in graph-based process discovery. By establishing relationship frequencies and using specific algorithms, the method accurately distinguishes XOR, AND, and OR relationships.","['. DigitalObjectIdentifier10.1109/ACCESS.2023.3324742 Extending Graph-Based Process Discovery for Hierarchical Block Detection and Incomplete Concurrent Relationship Handling INDRAWASPADA 1,3,RIYANARTOSARNO 1,(SeniorMember,IEEE),ENDANGSITIASTUTI2, HANUNGNINDITOPRASETYO1,4,ANDRADENBUDIRAHARJO1,5 1DepartmentofInformatics,FacultyofIntelligentElectricalandInformaticsTechnology,InstitutTeknologiSepuluhNopember,Surabaya60111,Indonesia 2DepartmentofBusinessAdministration,BrawijayaUniversity,Malang65145,Indonesia', '. practical implementation. [12] R. Sarno and K. Sungkono, “A survey of graph-based algorithms for discovering business processes,” InterACKNOWLEDGMENT nationalJournalofAdvancesinIntelligentInformatics, This research was funded by Institut Teknologi Sepuluh vol.5,no.2,pp.137–149,2019,ISSN:2548-3161.DOI: Nopember (ITS) under Penelitian Dana Departemen Pro10.26555/ijain.v5i2.296. gram, Penelitian Keilmuan, Penelitian Flagship, Penelitian [13] A. Green, P. Guagliardo, L. Libkin, T. Lindaaker, V', '. include process mining, data mining, machine [16] J.C.A.M.Buijs,B.F.vanDongen,andW.M.P.vanderAalst,‘‘Quality learning,ITgovernance,andothertopicsrelatedto dimensions in process discovery: The importance of fitness, precision, informationsystemsandcomputersciencefields generalizationandsimplicity,’’Int.J.Cooperat.Inf.Syst.,vol.23,no.1, ofstudy. Mar.2014,Art.no.1440001. VOLUME11,2023 123391', '. The specifics of process discovery tasks include prosupportfrommultiplevendorsandhasbeenstandardizedby cessdiscovery,modeling,monitoring,andoptimization[20]. OMG.PetriNetsupportssimulationandiscompatiblewith The benefits of engaging in the process mining include the manyanalyticaltechniques[15]. following[21]: Definition5(PetriNet): A Petri net is a tuple N = 1', '. Based A. REAL-LIFECASEWITHSPLIT-JOINBLOCKHIERARCHY on the identified block, the position of the joint gate can be PATTERNANDCONTAININGICR determined.However,theAND-joingateandXOR-joingate Most process model discovery algorithms depart from the atthisstagehavenotbeeninstalledinthemodel,butonlythe directlyfollowsgraph(DFG)representation.Anoverviewof gatenameandlocationarerecorded(connectedtoanynode). 123386 VOLUME11,2023', '. process mining, data mining, machine learning, 934 885 [21] I.Waspada,R.Sarno,andD.K.R.Sungkono,‘‘Animprovedmethodof ITgovernance,andothertopicsrelatedtoinforma- 935 886 parallelmodeldetectionforgraph-basedprocessmodeldiscovery,’’Int. tionsystemsandcomputersciencefieldsofstudy. 936 887 J.Intell.Eng.Syst.,vol.13,no.2,pp.127–139,Apr.2020. 937 102752 VOLUME10,2022', '. structure and can handle complex behaviors such as parallelism and choices effectively. Heuristic Miner is an By using the DISCO application, a log event map was algorithm that uses a heuristic approach to extract process obtained as shown in Fig. 1. the log event map is a visual models from event log. Heuristic Miner is more robust and representation of all activities and events that occur within a capable of handling noisy logs and more complex business process over a certain period', '. TABLE I provides a detailed not always be clean or well-structured [9]. Moreover, it offers overview of the activities and performance indicators insightful diagnostics about the process flow, helping to associated with the DSS01.01 domain of managed operations. identify bottlenecks and inefficiencies that other algorithms might overlook[16]. B. Process Mining Process mining involves deriving business processes from III', '. The Trace 3 180 0.60% – SR - CC evaluation results for each model will be presented in TABLE FNOL – AC – SR – CD - III. Based on TABLE III, it was found that the model Trace 4 175 0.58% PS - CC generated by Heuristic Miner has the highest fitness value. FNOL – AC – CD – SR This means that the model produced by Heuristic Miner is the Trace 5 173 0.58% – CC - PS most accurate in representing the actual business process FNOL – AC – PS – CD compared to the models produced by the other algorithms', '. However, these state- A data-driven automated method called Process Discovery of-the-artprocessdiscoveryalgorithmshavenotbeenableto canlocate,map,andrecordtheactivitiesofcurrentbusiness detect process flows that represent incomplete concurrency, processes. The received data is then automatically analyzed whichwillreducethequalityoftheresultingmodel']","Waspada et al. (2023) introduced an algorithm for mining invisible tasks in process models, effectively addressing incomplete concurrency relationships and detecting hierarchical blocks.","more reliable in detecting and handling ICR patterns. B. GRAPH-BASED PROCESS DISCOVERY PLUS B. GRAPH-BASED PROCESS DISCOVERY PLUS PLUS (GPD++) GPD++ consists of the main algorithm for detecting split and join blocks presented in Algorithm 1 and the algorithm for finding the block hierarchy and its types (XOR or AND) in Algorithm 2 and Algorithm 3. GPD++ utilizes the detected block structure to identify ICR in blocks parallel (long). As an illustration of how Algorithm 1 works in finding split-join blocks, an example of a DFG model with one split node (|T| = 1) and one join node is given in figure 4. The input for Algorithm 1 is the DFG model with split-node and join-node information. The results of",0.0,0.9514642927823037
"by identifying Enterprise Goals corre- lated with the Balanced Scorecard Financial. Then, Alignment Goals related to these Enterprise Goals were mapped. Subse- quently, Management Objectives from the COBIT Core Model associated with Alignment Goals were identified. Examples of these mappings are shown in TABLE I. Following this, Activ- ities and their descriptions were compiled for each Manage- ment Objective, based on COBIT guidelines, as demonstrated in TABLE II. A total of 1202 activities were found to correlate with the Balanced Scorecard Financial perspective during the mapping process. B. Create Graph Database After the completion of the Mapping process, the next step is to create nodes and their relationships using Neo4J Graph Database Tools, in order to construct a Knowledge Graph","['. 24: SETOBJECTIVE.description=row.OBJECTIVE DESC 2) MappingfromBalancedScorecardtoActivity:Estab- 25: MERGE(AG TO)-[:HAS OBJECTIVE]->(OBJECTIVE) 26: endfor lish relationships between Enterprise Goals, Alignment 27: Goals, Management Objectives, and Activities. This 28: foreachignoreINCASEWHENrow.OBJECTIVE TOISNOTNULL mapping follows these steps: THEN[1]ELSE[]ENDdo 29: MERGE (OBJECTIVE TO:OBJECTIVE {name: a) Identify Enterprise Goals (EG) from the Balanced row.OBJECTIVE TO}) Scorecard (BSC)', '. An example 1: MATCH (BSC:BSC)-[:HAS EG]->(EG:EG)-[:HAS AG]>(AG:AG)-[:HAS OBJECTIVE]->(OBJECTIVE:OBJECTIVE)- of this mapping process is shown in Table I, which maps [:HAS ACTIVITY]->(ACTIVITY:ACTIVITY) the Balanced Scorecard (BSC), Enterprise Goals (EG), and 2: WHERE EG.description IN [”Optimization of business process costs”, Alignment Goals (AG)', '. because the four performance measurement models are the four most common performance measurement models • Purple Cluster balanced scorecard, IPMS, Performance Prism, and also DEA', '. Using COBIT metrics, organizations XGBoost 4.29 6.34 0.69 40.45 can evaluate and improve the quality of IT Governance, LightGBM 4.74 7.53 0.56 45.14 ensure compliance with regulatory provisions, and improve CatBoost 4.25 6.53 0.67 36.26 operational efficiency. As a result, these initiatives not only are presented in Table IV using MAE, RMSE, R², and MAPE improve the efficiency of project planning and execution but me trics', '. 30: MERGE(ACTIVITY:ACTIVITY{name:row.ACTIVITY}) 31: SETACTIVITY.description=row.ACTIVITY DESC b) Map Alignment Goals (AG) to corresponding En32: MERGE(OBJECTIVE TO)-[:HAS ACTIVITY]->(ACTIVITY) terprise Goals. 33: endfor c) Determine Management Objectives (COBIT Core Model) related to the identified Alignment Goals. d) Compile a list of Activities and Activity Descrip- 3) Establish edges to represent the relationships between tions for each Management Objective, as per CO- these entities', '. The Neo4j activities that correlate with Enterprise Goal EG02, which visualization tool offers a user-friendly interface for explordescribes ”Optimization of business process functionality.” ing COBIT framework relationships, enabling stakeholders to Using Algorithm 3, a graphical representation is created, as make data-driven decisions. Authorized licensed use limited to: Institut Teknologi Sepuluh Nopember. Downloaded on July 14,2025 at 08:22:06 UTC from IEEE Xplore. Restrictions apply.', 'a significant performance indicators through the collection, analysis, phenomenon driving innovation and change across various reporting, interpretation, and review of existing data [4]', '. deeper analysis, real-time monitoring, and informed IT manAfter identifying company goals with a similarity value agement decisions. greater than 50, these nodes are used as references for the Our results demonstrated the system’s effectiveness in sugnext graph query execution to obtain the required activities. gesting activities tailored to enterprise goals, enhancing IT The output matches the mapping results, displaying only management practices and operational efficiency', '. [9] A. Ghezzi, “How Entrepreneurs make sense of Lean the Balanced Scorecard, IPMS, and Performance Prism Startup Approaches: Business Models as cognitive lenses because these three models provide more intuitive and userto generate fast and frugal Heuristics,” Technological friendly frameworks. The research also highlights that in Forecasting and Social Change, vol. 161, no. June, p. determining performance indicators, there are variations due 120324, 2020, doi: 10.1016/j.techfore.2020.120324', '. Bibliographic coupling and comanagement and accounting in the Scopus database has citation analyses indicate significant relationships between existed since 1978 to 2019. This indicates that despite studies, particularly around themes such as social media, numerous studies on performance measurement across business models, and big data']","The mapping process establishes relationships between Enterprise Goals, Alignment Goals, Management Objectives, and Activities as part of the COBIT framework (A Recommendation System for Internal Business Processes of COBIT 2019 Using Graph Algorithm and Similarity Methods).","is linked to the appropriate business objec- tives and control needs, thus enhancing overall governance effectiveness . One effective way to perform this mapping is by utilizing a graph database such as Neo4j . Neo4j is a graph database specifically designed to store and manage data with complex relationships . In the context of COBIT 2019, Neo4j can be utilized to build dynamic graphical representations of various COBIT elements . By using Neo4j, organizations can create dynamic and interactive graphical models to better understand and manage the complex relationships between different COBIT 2019 elements . This allows for deeper analysis, real-time monitoring, and better decision-making in IT management, ultimately aiding in the achievement of business goals . In summary, this",0.6666666666666666,0.9245267518902904
"IX, it can serve as an internal reference for the company to assess its capability to meet these criteria and can also serve as a reference for formulating policies to prioritize the implementation of these activities in the future. V. CONCLUSION V. CONCLUSION In conclusion, the developed Activity Recommendation System based on COBIT 2019 framework offers a practical solution to the challenges faced by auditors in identifying and aligning activities with company strategy. By leveraging NLP techniques and graph queries, the system efficiently matches user input of company strategy with relevant activities automatically, eliminating the need for manual navigation through COBIT 2019 guidelines. The effectiveness of the system was demonstrated by in- putting company strategies from three companies in different","['A Recommendation System for Internal Business Processes of COBIT 2019 Using Graph Algorithm and Similarity Methods 1st I Gusti Lanang Agung Oka Cahyadi Pradipta 2nd Rizky Damara Ardy Informatics Departments Informatics Departments Institut Teknologi Sepuluh Nopember Institut Teknologi Sepuluh Nopember Surabaya, Indonesia Surabaya, Indonesia 6025232017@student.its.ac.id 6025231004@student.its.ac.id 3th Riyanarto Sarno 4th Kelly Sungkono Informatics Departments Informatics Departments Institut Teknologi', '. It provides activity recommendations for in a table format for easy reference and analysis. The table users based on their specific requirements and objectives, will include detailed information about each recommended tailored to help organizations optimize their internal business activity, including its name, description, associated processes, processes according to COBIT 2019 guidelines', '. deeper analysis, real-time monitoring, and informed IT manAfter identifying company goals with a similarity value agement decisions. greater than 50, these nodes are used as references for the Our results demonstrated the system’s effectiveness in sugnext graph query execution to obtain the required activities. gesting activities tailored to enterprise goals, enhancing IT The output matches the mapping results, displaying only management practices and operational efficiency', '. The Neo4j activities that correlate with Enterprise Goal EG02, which visualization tool offers a user-friendly interface for explordescribes ”Optimization of business process functionality.” ing COBIT framework relationships, enabling stakeholders to Using Algorithm 3, a graphical representation is created, as make data-driven decisions. Authorized licensed use limited to: Institut Teknologi Sepuluh Nopember. Downloaded on July 14,2025 at 08:22:06 UTC from IEEE Xplore. Restrictions apply.', '. ”Compliancewithinternalpolicies”] 3: RETURNBSC,EG,AG,OBJECTIVE,ACTIVITY Following this mapping process, a comprehensive list of Activities and Activity Descriptions was compiled for each Management Objective (COBIT Core Model), as shown in 1) Graph Visualization: Visualize the recommended ac- Table II. tivities using graph visualization techniques in Neo4j. After completing the mapping, the data is saved in CSV This involves creating node-link diagrams to represent format for loading into Neo4j', '. nodesandrelationshipsbasedonCOBIT2019elements. E. Activity Recommendation 2) ImportthepreprocesseddataintoNeo4j,mappingnodes to entities such as internal business processes, control Based on the similarity measurements, the system recomobjectives, and IT processes. mends activities aligned with enterprise goals. The steps are: Authorized licensed use limited to: Institut Teknologi Sepuluh Nopember. Downloaded on July 14,2025 at 08:22:06 UTC from IEEE Xplore. Restrictions apply.', '. 30: MERGE(ACTIVITY:ACTIVITY{name:row.ACTIVITY}) 31: SETACTIVITY.description=row.ACTIVITY DESC b) Map Alignment Goals (AG) to corresponding En32: MERGE(OBJECTIVE TO)-[:HAS ACTIVITY]->(ACTIVITY) terprise Goals. 33: endfor c) Determine Management Objectives (COBIT Core Model) related to the identified Alignment Goals. d) Compile a list of Activities and Activity Descrip- 3) Establish edges to represent the relationships between tions for each Management Objective, as per CO- these entities', '. By leveraging COBIT recommendspecificactivities.Experimentalresultsshowthatthis 2019, organizations can minimize risks and increase the value systemoptimizesITmanagementpractices,enhancesoperational efficiency, and ensures regulatory compliance. Additionally, a of their investments in information technology, thus helping user-friendly graphical representation of internal business pro- them achieve their business objectives more effectively [1]', '. One effective way to perform this mapping and sustain a governance system, as well as guidelines for is by utilizing a graph database such as Neo4j [7]. 979-8-3503-5161-3/24/$31.00©2024IEEE 26516701.4202.72816AIITCI/9011.01 :IOD | EEEI 4202© 00.13$/42/3-1615-3053-8-979 | )AIITCI( snoitacilppA stI dna noitavonnI ygolonhceT no ecnerefnoC lanoitanretnI dn2 4202 Authorized licensed use limited to: Institut Teknologi Sepuluh Nopember. Downloaded on July 14,2025 at 08:22:06 UTC from IEEE Xplore', '. By utilizing COBIT 2019, organizations can enhance the igation. This study addresses the challenge of automating IT efficiency,effectiveness,andreliabilityoftheirITusage,while management based on company goals by proposing a novel also ensuring compliance with relevant regulations, policies, recommendationsystemforinternalbusinessprocesses,grounded in the COBIT 2019 framework. The system employs graph and standards [4]']","The developed Activity Recommendation System based on the COBIT 2019 framework enhances the efficiency and effectiveness of IT usage while ensuring compliance with relevant regulations (I Gusti Lanang Agung Oka Cahyadi Pradipta et al., 2024).","company goals by proposing a novel recommendation system for internal business processes, grounded in the COBIT 2019 framework. The system employs graph algorithms to map relationships, semantic similarity measure- ments to align enterprise goals with management objectives, and LSTM combined with TF-IDF methods to analyze and recommend specific activities. Experimental results show that this system optimizes IT management practices, enhances operational efficiency, and ensures regulatory compliance. Additionally, a user-friendly graphical representation of internal business pro- cesses using Neo4j enables stakeholders to visualize complex relationships within the COBIT framework, facilitating informed decision-making. This research advances IT governance practices by providing organizations with a valuable tool to automate and improve IT strategies, effectively achieving business objectives. Index Terms—COBIT 2019, graph algorithms, IT",1.0,0.9329550125485219
"the system efficiently matches user input of company strategy with relevant activities automatically, eliminating the need for manual navigation through COBIT 2019 guidelines. The effectiveness of the system was demonstrated by in- putting company strategies from three companies in different sectors. The system provided a list of recommended activities that can be undertaken to achieve strategic objectives of each companies. Moving forward, there are opportunities to enhance and refine the system to improve both the accuracy of the rec- ommendations and the user experience, ensuring its continued utility and influence in enterprise governance and audit man- agement. Future upgrades could focus on enhancing the user interface to accommodate users with less technical expertise and improving the integration of the proposed","['A Recommendation System for Internal Business Processes of COBIT 2019 Using Graph Algorithm and Similarity Methods 1st I Gusti Lanang Agung Oka Cahyadi Pradipta 2nd Rizky Damara Ardy Informatics Departments Informatics Departments Institut Teknologi Sepuluh Nopember Institut Teknologi Sepuluh Nopember Surabaya, Indonesia Surabaya, Indonesia 6025232017@student.its.ac.id 6025231004@student.its.ac.id 3th Riyanarto Sarno 4th Kelly Sungkono Informatics Departments Informatics Departments Institut Teknologi', '. Recommendations based on COBIT 2019 best practices, such as performance measurements and knowledge repository access, further enhance IT governance processes and contribute to the success of software development projects. The integration of AI and machine learning techniques with the COBIT 2019 framework holds promise in further enhancing IT governance practices [19]', '. Dataset and Preprocessing 26: print(”Similarityscorefor”,sentence,”:”,similarity[0]) The experimental process involves collecting datasets from 27: endfor COBIT2019,specificallyfocusingontheBalancedScorecard for internal business processes. Process mapping is then conAlgorithm 3 Activity Graph Generation ducted as the basis for forming nodes later on', '. Thus,thisresearchcontributessignificantlybyaddressingthis IndexTerms—COBIT2019,graphalgorithms,ITgovernance, gap and overcoming the challenges associated with manual LSTM, Neo4j, recommendation system, regulatory compliance, COBIT utilization. semantic similarity, TF-IDF The primary objective of this paper is to develop a recommendation system that aligns with the internal business I. INTRODUCTION process strategy governed by COBIT 2019', '. Functions: This process focuses on improving the ef- 1) Data Collection: Gather data from COBIT 2019 docficiency and effectiveness of internal business process umentation and relevant enterprise sources, focusing Authorized licensed use limited to: Institut Teknologi Sepuluh Nopember. Downloaded on July 14,2025 at 08:22:06 UTC from IEEE Xplore. Restrictions apply.', '. The Neo4j activities that correlate with Enterprise Goal EG02, which visualization tool offers a user-friendly interface for explordescribes ”Optimization of business process functionality.” ing COBIT framework relationships, enabling stakeholders to Using Algorithm 3, a graphical representation is created, as make data-driven decisions. Authorized licensed use limited to: Institut Teknologi Sepuluh Nopember. Downloaded on July 14,2025 at 08:22:06 UTC from IEEE Xplore. Restrictions apply.', '. By leveraging COBIT recommendspecificactivities.Experimentalresultsshowthatthis 2019, organizations can minimize risks and increase the value systemoptimizesITmanagementpractices,enhancesoperational efficiency, and ensures regulatory compliance. Additionally, a of their investments in information technology, thus helping user-friendly graphical representation of internal business pro- them achieve their business objectives more effectively [1]', '. The combination of AI and machine learning with the COBIT 2019 framework shows potential for further improving IT governance practices and optimizing software development processes [20]. The BAI (Build, Acquire, Implement) approach of COBIT 2019 can enhance project planning by integrating with machine learning techniques. By leveraging machine learning in project planning, especially in the construction industry, uncertainties can be better modeled, and alternative options Fig. 2', '. P.-J. Wu, D. W. Straub, and T.-P. Liang, “How infornal RESTI (Rekayasa Sistem dan Teknologi Informasi), mation technology governance mechanisms and stratevol. 4, pp. 764–774, Aug. 2020. DOI: 10.29207/resti. gic alignment influence organizational performance,” v4i4.2265. MIS quarterly, vol. 39, no. 2, pp. 497–518, 2015. [3] R. Sarno, STRATEGI SUKSES BISNIS DENGAN TI Berbasis Balanced Scorecard dan COBIT. ITS Press, 2009, ISBN: 978-979-8897-39-9', '. nodesandrelationshipsbasedonCOBIT2019elements. E. Activity Recommendation 2) ImportthepreprocesseddataintoNeo4j,mappingnodes to entities such as internal business processes, control Based on the similarity measurements, the system recomobjectives, and IT processes. mends activities aligned with enterprise goals. The steps are: Authorized licensed use limited to: Institut Teknologi Sepuluh Nopember. Downloaded on July 14,2025 at 08:22:06 UTC from IEEE Xplore. Restrictions apply.']","The system optimizes IT management practices and enhances operational efficiency by leveraging COBIT 2019, thereby minimizing risks and increasing the value of investments in information technology (Cahyadi Pradipta et al., 2020).","technology, thus helping them achieve their business objectives more effectively . Several previous papers still rely on manual approaches to COBIT 2019, which have limitations in providing automated recommendations for audit activities based on company goals. Thus, this research contributes significantly by addressing this gap and overcoming the challenges associated with manual COBIT utilization. The primary objective of this paper is to develop a rec- ommendation system that aligns with the internal business process strategy governed by COBIT 2019. This system aims to help organizations manage risk, ensure compliance, and enhance performance in the context of information technology. To achieve this, the research will utilize graph algorithms to build a recommendation system based on the internal business processes outlined in",0.8,0.876877069447723
"whereas 27 chops had quality defects. B. Volatile Organic Compounds Identification Through Chromatography-Mass Spectrometry (GC-MS), it was found that there were 143 VOCs in the good-quality sample and 118 VOCs in the quality-defect sample. Then it also obtained that there were 102 similar compounds present Fig. 4. Number of Compounds in Each Classes Fig. 5. Percentage of Area of Compounds in Each Classes in both sample 1 and sample 2, which are detailed in TABLE II. The results of grouping chemical substances into several groups, including nitrogenous compounds, alcohols, esters, hydrocarbons, hetero- oxygenates, and others. Substance content in each class of compounds means that different concentrations are shown as Area as shown in TABLE II. aldehydes, phenols, ketones, In GC-MS,","['. instrument is around USD 120,000 in 2017 [17], while the cost of testing a sample is about USD 50. In addition, the II. RELATEDWORKS testing process of one sample can take about 1 to 2 days, E-nosecanbeusedforfoodauthenticationandadulteration depending on the complexity of the gases. Another consid- assessment,assummarizedinTABLE1.Researchtodetect erationistheassistanceofapersonwhohasexperiencewith meatadulterationusinganelectronicnosehasdevelopedand operatingtheGC-MSinstruments. is being studied', '. ABSTRACT Recently,theissueoffoodauthenticationhasgainedattention,especiallyhalalauthentication, becauseofcasesofporkadulterationinbeef.Manystudieshavedevelopedrapiddetectionforadulterated meat. However, these studies are not yet practical and economical methods and instruments and a faster analysis process. In this context, this paper proposes the Optimized Electronic Nose System (OENS) for more accurately detecting pork adulteration in beef', '. [21] X. Hong, J. Wang, and G. Qi, ‘‘Comparison of spectral clustering, K- Available: https://ieee-dataport.org/documents/dataset-pork-adulterationclusteringandhierarchicalclusteringone-nosedatasets:Applicationto electronic-nose-system therecognitionofmaterialfreshness,adulterationlevelsandpretreatment [44] R. Sarno, S. I. Sabilla, D. R. Wijaya, D. Sunaryono, and C', '. . 7 6 0 0 … From Storage 1 5 7.20 ⎢ ⎢ F(cid:12)(cid:21)](cid:16) (cid:12)(cid:2)(cid:21) ⎥ ⎥ ⎢ ⎢ F(cid:12)(cid:21)] (cid:12) (cid:16) (cid:2) (cid:12) (cid:21) 67 ⎥ ⎥ F F r r o o m m S S t t o o r r a a g g e e 2 3 1 1 4 3 1 1 . . 4 8 0 0 ⎢ (cid:10)(cid:11)H (cid:12)(cid:2)(cid:21) ⎥ ⎢ (cid:10)(cid:11)H ⎥ Norwegian Gas 8 33.00 ⎢ … ⎥ ⎢ … (cid:12)67 ⎥ Total 72.70 ⎢ (cid:10)(cid:11)(cid:21) (cid:12)(cid:2)(cid:21) ⎥ ⎢ (cid:10)(cid:11)(cid:21) ⎥ ⎢ 0 ⎥ ⎢ 1 ⎥ TABLE IV', '. sweat, VOCs are also produced from several other sources; ThisworkislicensedunderaCreativeCommonsAttribution-NonCommercial-NoDerivatives4.0License. VOLUME10,2022 Formoreinformation,seehttps://creativecommons.org/licenses/by-nc-nd/4.0/ 51285', 'R.Sarnoetal.:DetectingPorkAdulterationinBeefforHalalAuthenticationUsinganOptimizedElectronicNoseSystem FIGURE1. Schematicofthee-noseexperimentforOENS. withwater;and(iii)replacingwithcheaperwine.Therefore, Forinterestedreaders,recentdevelopmentandchallengesfor the combination between e-nose and multivariate statistical e-nosesignalprocessingaresummarizedhere[42]. methods improved the traceability and the classification of grapes and wine (especially the varieties and the geograph- III', '. Applicationofelectronicnosesforfoodassessmentinthelast sensor analysis. The e-nose features offer five main cate- fiveyears. goriesoffoodanalysisthatcanbeused:monitoring,expiry checking,freshnessevaluation,puritytesting,andotherfood qualitycontrolinvestigations.Hence,themotivationforthis studycanbeformulatedasfollows: 1. Severaltypesofresearchhaveusedane-nosetoidentify pork adulteration in beef for food quality control', '. MATERIALSANDMETHOD ical origin of grape) [23]. E-nose was also succeeded in A. MATERIALS detecting adulteration of mutton, which led into developing In this study, an e-nose was built using nine MQ series a model capable of detecting and estimating the adulter- gassensorsfromZhengzhouWinsenElectronicsTechnology ation of minced mutton with pork [24]. The volatile com- Co., Ltd', '. Equipment failures in these vessels can lead to production inefficiencies Refrence Risk Category Evaluation Risk Management Strategy Evaluation PM Task Details Revised Risk Ranking and potentially release chemical waste into the environment, HP1HP2HP3 negatively impacting the plant area', '. de Gennaro, P. Barbieri, S. Briguglio, M. Amodio, [14] Y.Wang,J.Zhao,F.Xu,X.Wu,W.Hu,Y.Chang,L.Zhang,J.Chen, L.deGennaro, and F. Lasigna, ‘‘Improving recognition of odors in andC.Liu,‘‘GC-MS,GC-OandOAVanalysesofkeyaromacompounds a waste management plant by using electronic noses with different injiaozisteamedbread,’’GrainOilSci.Technol.,vol.3,no.1,pp.9–17, technologies, gas chromatography–mass spectrometry/olfactometry and Mar.2020. dynamic olfactometry,’’ J. Cleaner Prod., vol']","The electronic nose (e-nose) has been successfully used to detect adulteration in meat products, demonstrating its capability in identifying and estimating the adulteration levels of various meats (Sarno et al., 2023).","baked goods’ quality can be determined by the gas or vapor content. Gas chromatography is the standard instrument for quantitatively and qualitatively analyzing volatile organic compounds (VOCs). This method separates compounds in a mixture by injecting a gas sample into the mobile phase, usually called the carrier gas, and passing the gas through the stationary phase , , . Volatile compounds identified in aldehydes, alcohols, acids, alkanes, and ketones are the main components that contribute VOLUME 12, 2024 2024 The Authors. This work is licensed under a Creative Commons Attribution-NonCommercial-NoDerivatives 4.0 License. For more information, see 97235 TABLE 1. The ingredients of the cookie. to the cookie flavor . Chemical compounds grouped as hydrocarbons are also released while making and",0.6666666666666666,0.891437709936314
"Recall or sensitivity is the number of true positive predictions compared to all true positive data. Precision is the number of positive results compared to all positive predicted data. F-Score is the average precision and recall compared to weighting. Speciﬁcity is the number of true negative predictions compared to all negative data. Equations 15 to 19 are used to calculate these metrics. In addition to these metrics, the measurement of model performance evaluation also uses Receiver Operating Characteristics (ROC) and Area Under Curve (AUC). ROC is a probability curve and AUC is an area that shows the level of accuracy of the model empirically. The classiﬁcation results show poor performance if the ROC Curve is close to the baseline and","["". These metrics can be calculated by (1) – (3). This study's calculation of True Positive, False Positive, and False Negative differs from other classifications or detections [20]-[23]. These are chosen and calculated following previous studies [1]. Precision detects the truly correct prediction out of all predictions. Recall detects the truly correct prediction out of all actual classes. F1 scores are harmonic mean between these two that measure overall model performance"", '. performance evaluation score, where the highest accuracy Following the definition in the previous paragraph, we plot is under 85%, the model needs further improvement so that the frequency of each misclassification type in Fig 13 and thedetectionvaliditycanbeenhancedandthatthedetection Fig 14', 'that could be vital for accurate classification [40]', '. Among the various models considered, the random forest demonstrates superior Fig. 9. Number of Trees on Performance of Random Forest performance in terms of accuracy, precision, recall, and F1 Authorized licensed use limited to: Institut Teknologi Sepuluh Nopember. Downloaded on July 14,2025 at 08:22:06 UTC from IEEE Xplore. Restrictions apply.', '. CLASSIFICATION RESULTS IN EACH ACCEPTED FEATURES Entropy Gini Index Depth Accuracy Sensitivity Specificity Accuracy Sensitivity Specificity 3 0.998682278 0.998137797 0.999314045 0.998658464 0.99810826 0.99929689 4 0.998706092 0.998152616 0.999348339 0.998666337 0.998152476 0.999262572 5 0.998793258 0.998285484 0.999382522 0.998809288 0.9983002 0.999399863 6 0.998927976 0.998521585 0.999399554 0.998927976 0.998521585 0.999399554 7 0.998927976 0.998521585 0.999399554 0.998753491 0.998226492 0.999365243 8', "". We applied various machine learning models, accurate predictions, as machine learning models learn from including Random Forest and XGBoost, to improve the the input data, following the principle of 'garbage-ingarbage-out' [29]. Once they complete the preprocessing steps, the data will be ready for the machine learning model. TABLE II. RESULTS TABLE OF THE FOUR KEY METRICS Metrics ID Description Value D"", 'TABLE IV. COMPARISON PERFORMANCE OF EACH MODEL Performance Model Accuracy Precision Recall F1 Score Random Forest 0.989 0.989 0.989 0.989 Decision Tree 0.979 0.979 0.979 0.979 Logistic 0.700 0.688 0.700 0.663 Registrion SVM 0.695 0.779 0.695 0.607 D. Performance Comparison of Predictive Analysis The prediction analysis used in this research compares the Fig. 10', 'classification validation have helped develop the motivation for this work which is [34],[35],[36]', '. MACHINE LEARNING PARAMETERS Evaluatioin metrics ML models Parameters Models MSE RMSE MAE max_depth: 10, min_samples_split: 2, RF SARIMAX 639714.51 799.82 650.35 n_estimator: 50 RF 1384875.01 1176.80 958.96 learning_rate: 0.05, max_depth: 3, XGBoost XGBoost 1389609.34 1178.81 961.11 n_estimators: 100 GBM 1406810.24 1186.09 971.82 learning_rate: 0.2, max_depth: 3, n_estimators: LightGBM LSTM 16816.55 129.67 103.94 100 Authorized licensed use limited to: Institut Teknologi Sepuluh Nopember', '. This function is prevalently utilized in binary classification scenarios to ascertain the likelihood of data points belonging to one of two categories, producing an output value ranging between 0 and 1, which is conducivetoprobabilityinterpretation.Conversely,thesoftmax FIGURE12. AccuracyandF1-scoreofMHA-CovBimodelcorrespondingto functionistailoredformulticlassclassificationcontexts,gendifferentoptimizationalgorithms. erating a probability distribution across numerous classes']","Precision and recall are defined as the true positive predictions out of all predictions and actual classes, respectively, with F1 scores serving as the harmonic mean of these two metrics to evaluate overall model performance (Referensi 1).","with the following formula: TP + TN TP + TN + FP + FN Accuracy = Precision = Recall/True Positive Rate(TPR) TP TP + FP TP TP + FN F1 = 2 × precision × recall precision + recall FP TN + TP (cid:90) 1 TPRd(FPR) False Positive Rate(FPR) = AUC = (4) (5) (6) (7) (8) (9) where TP is the number of correctly predicted positive labels, TN is the number of correctly predicted negative labels, FP is the number of incorrectly predicted positive labels, and FN is the number of incorrectly predicted negative labels. Accuracy is the ratio of true predictions to the overall data. Precision is the ratio between TP to the total number of positive predic-",0.8,0.9471062771715474
"forming non-overlapping sub- arrays within the array , naturally limiting the achievable beamwidth of each beam and making inefﬁcient use of the available aperture. A third option can be taken by arranging the array into partially or fully overlapping subarrays coupled with the use of orthogonal waveforms, each associated to a generated beam, a solution belonging to the class of the multi- input multi-output (MIMO) radars discussed below. MIMO radars have developed into a strong contender for multi-antenna radar systems, applying the concept of virtual sensors with orthogonal waveform diversity –. Our interest in MIMO radars in relevance to the problem at hand arises due to their capability to produce multiple orthog- onal beams by selecting an appropriate set of","['. INDEX TERMS MIMO radar, parameter estimation, phased array radar, probability of detection, target detection. I. INTRODUCTION for biomedical engineering, macro-scale radars on radioMulti-antenna radar systems have been known and used in astronomy, and so on [4], [5]', '. With this advantage, PA radars ject [6]–[18]. Unlike the PA radar, the MIMO radar utilizes have been used for such applications as micro-scale radars manyantennasthattransmitorthogonalsignalstoobtainthe signal reflected from the target at the receiver, a scheme The associate editor coordinating the review of this manuscript and known as waveform diversity [9]. Consequently, MIMO approvingitforpublicationwasDimitrisE.Anagnostou', '. DigitalObjectIdentifier10.1109/ACCESS.2020.2965192 FPMIMO: A General MIMO Structure With Overlapping Subarrays for Various Radar Applications SYAHFRIZALTAHCFULLOH 1,2,(StudentMember,IEEE),AND GAMANTYOHENDRANTORO 1,(SeniorMember,IEEE) 1DepartmentofElectricalEngineering,InstitutTeknologiSepuluhNopember,Surabaya60111,Indonesia 2DepartmentofElectricalEngineering,UniversitasBorneoTarakan,Tarakan77123,Indonesia Correspondingauthor:SyahfrizalTahcfulloh(syahfrizal15@mhs.ee.its.ac.id)', '. array(NC)atthereceive(Rx)array,therebyformingaMIMO WhiletheconceptandperformanceofFPMIMOradarshave structure with the overlapping subarrays replacing single been reported by the authors in [31], this paper sets the elements at the transmitter [22]–[28]. The purpose of the focusontheradarparameteridentifiabilityandthedetection subarray as an element in the PMIMO radar is to overcome performance. the weakness of the element beam in the MIMO radar that This paper also expands the study reported in [13], i.e', '. ABSTRACT Unlike the phased array (PA) radar that achieves array gain in proportion to the number of elements, the MIMO radar provides improvement to parameter estimation, target detection, and so on. Recently, the combination of the PA and MIMO concepts into the Phased MIMO (PMIMO) radar was proposed with overlapping non-coherent subarrays at the transmitter and an array with non-coherent elements at the receiver that proved to outperform the more conventional radars', '(13) herein as the subarrayed MIMO (SMIMO) radars, such as theFPMIMOradar,rangesbetweentwoextremeconfiguraNotation ⊗ denotes the Kronecker product operator, tions, namely the PA and the MIMO radar', '. Accordingly, the radar can take the benefit of of the subarrayed multi-antenna radar structure', '. REVIEWONMAXIMUMNUMBEROFDETECTED has been described by [13]. In a MIMO radar, in which TARGETSFORMIMORADAR K elements in the Tx array transmit orthogonal waveforms For clarity in discussions that follow, herein we provide a andLelementsintheRxarrayreceiveechosignalsfromtar- shortreviewoftheperformanceofMIMOradarsinthemaxgetsoperatingindependently,theVAdimensionisexpressed imum number of detected targets, mostly taken from [13]', '. has low directivity, the latter resulting in smaller maximum the maximum number of detectable targets especially for target range, larger minimum reflection coefficient and sus- MIMO radars, and the investigation in [15] especially for ceptibility against interference effects. Hence, the PMIMO MIMO radars with non-overlapping subarrays', '. isillustratedashavingaradarbeamthatcoversaspanofthe In this manner, the FPMIMO radar can achieve a desired azimuthangle']","MIMO radars improve parameter estimation and target detection compared to phased array radars, which achieve array gain proportional to the number of elements (Tahcfulloh & Hendrantoro, 2020).","biomedical engineering, macro-scale radars on radio- astronomy, and so on , . However, in PA radars the number of detected targets is limited by the angular and range resolution. More recently, the multi-input multi-output (MIMO) radar has become an interesting research sub- ject –. Unlike the PA radar, the MIMO radar utilizes many antennas that transmit orthogonal signals to obtain the signal reﬂected from the target at the receiver, a scheme known as waveform diversity . Consequently, MIMO radars have been successfully applied for radar imaging, 11248 This work is licensed under a Creative Commons Attribution 4.0 License. For more information, see VOLUME 8, 2020 S. Tahcfulloh, G. Hendrantoro: FPMIMO: General MIMO Structure With Overlapping Subarrays for Various Radar Applications",1.0,0.9226456245787532
"of the Golay codes to orthogonalization of different symbols in a frame in the same beam. Doppler detection can further be accomplished by transmitting a frame of symbols repeatedly for several times, thus allowing the receiver to detect the changes in phase along different frames. The realization of such multi-beam radars that adopts the CC-OFDM MIMO concept also allows for application of further signal process- ing, such as monopulse processing to determine the angular direction of the target more accurately, but this is beyond the scope of our paper. The CC-OFDM MIMO concept presents a breakthrough in the realization of multi-beam radar in a way that has not been tried before, combining different strategies in a novel way to obtain","['. INDEX TERMS MIMO radar, parameter estimation, phased array radar, probability of detection, target detection. I. INTRODUCTION for biomedical engineering, macro-scale radars on radioMulti-antenna radar systems have been known and used in astronomy, and so on [4], [5]', '. INDEX TERMS Circulating-codes, Golay-codes, interference, MIMO-radar, multibeam, OFDM-radar, sub-band,surveillance. I. INTRODUCTION Manyradarapplicationsdemandscanningcapabilitytoallow The associate editor coordinating the review of this manuscript and coverage over a range of angular direction, such as those approvingitforpublicationwasXueboZhang . forsurveillance,vehicular,weathermonitoring,imaging,and 2025TheAuthors.ThisworkislicensedunderaCreativeCommonsAttribution4.0License', '. With this advantage, PA radars ject [6]–[18]. Unlike the PA radar, the MIMO radar utilizes have been used for such applications as micro-scale radars manyantennasthattransmitorthogonalsignalstoobtainthe signal reflected from the target at the receiver, a scheme The associate editor coordinating the review of this manuscript and known as waveform diversity [9]. Consequently, MIMO approvingitforpublicationwasDimitrisE.Anagnostou', '. However, all of the above thereceiverprocessingofCC-OFDM-MIMOradar,whichis mentioned methods have problems in beam limitation and differentfromthoseinothertypesofOFDMMIMOradarsor cost. other multi-TRM radars due to the nature of the orthogonal Current trends regarding dual functional radar communi- multi-beamgenerationwithGolay-codedOFDMwaveforms cation (DFRC) systems which lead to an integrated sensing andsubbands', '. needed. Multibeam radars that continuously transmit concurrent The principles of CC-OFDM MIMO radars have been multiple beams are able to simultaneously look at different discussed in [20] by way of an exemplary radar design for directions, for instance to cover a wide angular swath a long-range surveillance mission. The design includes the with a faceted view', '. This means that the with the Golay codes which corresponds to a specific rangeresolutionwillbe60meter.TheCC-OFDMindividual beamsymbolasstatedintheschedule.Thebeautyof symbol duration is 0.1 ms, and the transmitters transmit a the receiver processing of CC-OFDM MIMO radar is frame consisting of 12 consecutive symbols in series', '. DigitalObjectIdentifier10.1109/ACCESS.2025.3581842 Receiver Processing of the Multibeam Azimuth Scanning CC-OFDM-MIMO Radar DEVYKUSWIDIASTUTI 1,(Member,IEEE),L.P.LIGTHART 2,(LifeFellow,IEEE), GAMANTYOHENDRANTORO1,(SeniorMember,IEEE),TITIEKSURYANI 1,(Member,IEEE), PRASETIYONOHARIMUKTI 1,(Member,IEEE),ANDYUYUWAHYU 3,(Member,IEEE) 1DepartmentofElectricalEngineering,InstitutTeknologiSepuluhNopember,Surabaya60111,Indonesia 2IRCTR,DelftUniversityofTechnology(TUDelft),2628CDDelft,TheNetherlands(Retired)', '(13) herein as the subarrayed MIMO (SMIMO) radars, such as theFPMIMOradar,rangesbetweentwoextremeconfiguraNotation ⊗ denotes the Kronecker product operator, tions, namely the PA and the MIMO radar', '. [21] Z. Xu and A. Petropulu, ‘‘A bandwidth efficient dual-function radar communication system based on a MIMO radar using OFDM waveforms,’’ IEEE Trans. Signal Process., vol. 71, pp.401–416, 2023, doi: 10.1109/TSP.2023.3241779. [22] U.B.SaracandG.M.Guvensen,‘‘Knowledge-aidedandadaptivebeamsquintawareMIMO-OFDMradardetectorsforISAC,’’IEEETrans.Commun.,earlyaccess,May8,2025,doi:10.1109/TCOMM.2025.3568219. [23] M. Schurwanz, J. Mietzner, and P. A', '. In the works on the PMIMO radar in [22]–[29], The evaluation on the detection performance in terms of the improvement in radar performance factors such as theprobabilityofdetectionandtheprobabilityoffalsealarm spatial resolution, parameter identifiability, transmit-receive reportedhereinisanextensionofstudyby[32].Theseparam(T-R)gain,andsignal-to-interference-plus-noisepowerratio etersareevaluatedbasedonseveralaspectssuchastheeffect (SINR)hasbeenreported.Theresultsofinvestigationsin[29]']","The CC-OFDM MIMO radar system enables coverage over a range of angular directions through the use of Golay-coded OFDM waveforms, facilitating applications in surveillance and other radar functionalities.","and radial velocity detection of targets is not discussed yet. The contribution of this paper is in the receiver processing of CC-OFDM-MIMO radar, which is different from those in other types of OFDM MIMO radars or other multi-TRM radars due to the nature of the orthogonal multi-beam generation with Golay-coded OFDM waveforms and subbands. There are previous research on radar waveform for ISAC purposes , which discussed about cyclic prefix (CP) based OFDM waveform and how the CP is very much defining the maximum unambiguous range of the radar system. CC-OFDM MIMO radar waveform design which is discussed in this paper is not a CP based radar, the transmitters are transmitting multiple orthogonal symbols in series without any guard time",0.75,0.9420091213348011
"signal is circulated from one antenna element to another with a relatively small time-delay differ- ence ((cid:49)t), made possible by circulating codes (CC) , , . Hence the transmit signal from the p-th element for a transmit antenna array with an odd number of elements, Nt , can be written as: xp(t) = x(t − p(cid:49)t), Nt − 1 , . . . , Nt − 1 (1) The time delay difference of the circulating signal corre- sponds to a phase difference between the antenna elements at a given frequency: (cid:49)ϕ = 2πf (cid:49)t (2) It means that the phase steering that is usually provided by a phase shifter at each antenna element now can be realized directly in the","['. In order to generate CC-OFDM waveform, additional phasesteeringβ(f n,a,b ,(cid:49)t b )isgiventothespecifiedOFDM sub-bandfrequenciesofbeambtoprovidephasedifference between the transmit elements for creating the beam b. Circulating code in LFM MIMO radar which is discussed in[19],obtainthisphasedifferencebytransmittingcoherent FIGURE2. TheGolaycodesandsub-bandscheduleforbeam−8to8. signals with a small time delay difference ((cid:49)t ) between b the antenna element', '. Circulating code (CC) in LFM-MIMO radar has been Existing scanning radar techniques, whether they use discussed in [19], where the phase difference for beam mechanicalrotatororelectronicscanningwithaphasedarray, steering is provided by transmitting coherent signals with detect the angular direction and range of a target in two a small time delay difference ((cid:49)t ) between the array b different processes', '. It identifies the direction of an echo by antennaelement.Whilein[20]anewconceptofmultibeam meansofthescanningbeam,whereastherangedetectionis radarsisreported,whichcombinestheversatilityofOFDM done by observing the delay or by applying the correlation waveform, the orthogonal Golay codes and the CC-MIMO process. However, the beam scanning limits the time on architecture', '. the transmit element has already have phase difference for However, the use of a single beam complicates the design steering the beam to the intended direction. By doing so, of radar resource management (RRM), especially in beam the phase-shifter components which are usually required in scheduling and makes the radar suffer from a limited time a phase array or in a coherent MIMO radars are no longer ontarget[7],[8]. needed', '. J. Antennas leavefromworktopursuethePh.D.degreewith Propag.,vol.2017,Jul.2017,Art.no.7241281. the Institut Teknologi Sepuluh Nopember, since [17] M.Davis,G.Showman,andA.Lanterman,‘‘CoherentMIMOradar:The phasedarrayandorthogonalwaveforms,’’IEEEAerosp.Electron.Syst. 2015. His research interests include array signal processing and MIMO Mag.,vol.29,no.8,pp.76–91,Aug.2014. radars', '. The phase applications. difference value for beamforming to a specific beam, the phase correction for mitigating beam squinting caused by the multicarrier OFDM signal, and the amplitude tapering for SLL reduction are all depend on which transmit array elements that the waveform will be transmitted through. Hence,insteadofjusthaveoneDWGatthetransmitterside likeacommonconventionalphasedarrayradar,CC-OFDM RadarwillneedDWGsasmanyasthenumberofthetransmit arrayelementsneededfordigitalbeamformingpurposes[20]', '. However, using an OFDM signal, this phasesteeringcanbeprovidedbygivingaphasedifference totheOFDMsubcarrierphaseinthefrequencydomainofthe OFDM signal generation stage. The phase steering given to theCC-OFDMwaveformcanbedefinedasfollow: β(f n,a,b ,(cid:49)t b )=2πf n,a,b (cid:49)t b (2) Hence,thearrayfactorofCC-OFDMwillbe: Nt−1 AF(θ,f n,a,b ,(cid:49)t b )= X2 I p ejp(α(θ)+β(fn,a,b ,(cid:49)tb) p=−Nt−1 2 2π whereα(θ)= dsinθ, (3) λ withd denotesthespacingbetweenthearrays', '. DigitalObjectIdentifier10.1109/ACCESS.2020.2965192 FPMIMO: A General MIMO Structure With Overlapping Subarrays for Various Radar Applications SYAHFRIZALTAHCFULLOH 1,2,(StudentMember,IEEE),AND GAMANTYOHENDRANTORO 1,(SeniorMember,IEEE) 1DepartmentofElectricalEngineering,InstitutTeknologiSepuluhNopember,Surabaya60111,Indonesia 2DepartmentofElectricalEngineering,UniversitasBorneoTarakan,Tarakan77123,Indonesia Correspondingauthor:SyahfrizalTahcfulloh(syahfrizal15@mhs.ee.its.ac.id)', '. [28] A. Alieldin, Y. Huang, and W. M. Saad, ‘‘Optimum partitioning of a [3] S.J.WijnholdsandW.A.VanCappellen,‘‘Insituantennaperformance phased-MIMO radar array antenna,’’ IEEE Antennas Wireless Propag. evaluation of the LOFAR phased array radio telescope,’’ IEEE Trans. Lett.,vol.16,pp.2287–2290,2017. AntennasPropag.,vol.59,no.6,pp.1981–1989,Jun.2011', '(13) herein as the subarrayed MIMO (SMIMO) radars, such as theFPMIMOradar,rangesbetweentwoextremeconfiguraNotation ⊗ denotes the Kronecker product operator, tions, namely the PA and the MIMO radar']",The phase difference for beam steering in LFM-MIMO radar is achieved by transmitting coherent signals with a small time delay difference between the array elements (Receiver Processing of the Multibeam Azimuth Scanning CC-OFDM-MIMO Radar).,"the specified OFDM sub-band frequencies of beam b to provide phase difference between the transmit elements for creating the beam b. Circulating code in LFM MIMO radar which is discussed in , obtain this phase difference by transmitting coherent signals with a small time delay difference ((cid:49)tb) between the antenna element. However, using an OFDM signal, this phase steering can be provided by giving a phase difference to the OFDM subcarrier phase in the frequency domain of the OFDM signal generation stage. The phase steering given to the CC-OFDM waveform can be defined as follow: β(fn,a,b, (cid:49)tb) = 2πfn,a,b(cid:49)tb Hence, the array factor of CC-OFDM will be: AF(θ, fn,a,b, (cid:49)tb) = Nt −1 2X Ipejp(α(θ)+β(fn,a,b,(cid:49)tb) where α(θ) = p=− Nt",0.6666666666666666,0.8878181849739697
"the high PAPR of the OFDM signal. If orthogonal codes are given to successive OFDM symbols, it could also provide orthogonality between 53684 VOLUME 10, 2022 D. Kuswidiastuti et al.: Transmitter Design for Multibeam CC-OFDM Azimuth Scanning MIMO Radar the OFDM symbols, which in turn can extend the maxi- mum unambiguous range of the radar. The orthogonalities between OFDM subcarriers and between OFDM symbols allow OFDM radar to produce a range and Doppler proﬁle independent from each other . This is one of the advan- tages of using OFDM instead of LFM as radar waveform. The above considerations motivate the development of digitally generated beam steering without phase shifter, by providing phase control of the signal directly from waveform generation","['. [21] Z. Xu and A. Petropulu, ‘‘A bandwidth efficient dual-function radar communication system based on a MIMO radar using OFDM waveforms,’’ IEEE Trans. Signal Process., vol. 71, pp.401–416, 2023, doi: 10.1109/TSP.2023.3241779. [22] U.B.SaracandG.M.Guvensen,‘‘Knowledge-aidedandadaptivebeamsquintawareMIMO-OFDMradardetectorsforISAC,’’IEEETrans.Commun.,earlyaccess,May8,2025,doi:10.1109/TCOMM.2025.3568219. [23] M. Schurwanz, J. Mietzner, and P. A', '. DigitalObjectIdentifier10.1109/ACCESS.2025.3581842 Receiver Processing of the Multibeam Azimuth Scanning CC-OFDM-MIMO Radar DEVYKUSWIDIASTUTI 1,(Member,IEEE),L.P.LIGTHART 2,(LifeFellow,IEEE), GAMANTYOHENDRANTORO1,(SeniorMember,IEEE),TITIEKSURYANI 1,(Member,IEEE), PRASETIYONOHARIMUKTI 1,(Member,IEEE),ANDYUYUWAHYU 3,(Member,IEEE) 1DepartmentofElectricalEngineering,InstitutTeknologiSepuluhNopember,Surabaya60111,Indonesia 2IRCTR,DelftUniversityofTechnology(TUDelft),2628CDDelft,TheNetherlands(Retired)', '. However, all of the above thereceiverprocessingofCC-OFDM-MIMOradar,whichis mentioned methods have problems in beam limitation and differentfromthoseinothertypesofOFDMMIMOradarsor cost. other multi-TRM radars due to the nature of the orthogonal Current trends regarding dual functional radar communi- multi-beamgenerationwithGolay-codedOFDMwaveforms cation (DFRC) systems which lead to an integrated sensing andsubbands', '. CC-OFDM MIMO radar waveform design which the degree of orthogonality can be further improved by is discussed in this paper is not a CP based radar, the assigningdifferentsubbands,fortheneighboringbeams,and transmittersaretransmittingmultipleorthogonalsymbolsin thesamesubbandcanbereusedforthenon-adjacentbeams. serieswithoutanyguardtimeintervalbetweenthesymbols. The interference among these co-channel beams can be The symbol series are orthogonal to each other, hence VOLUME13,2025 109895', '. With this advantage, PA radars ject [6]–[18]. Unlike the PA radar, the MIMO radar utilizes have been used for such applications as micro-scale radars manyantennasthattransmitorthogonalsignalstoobtainthe signal reflected from the target at the receiver, a scheme The associate editor coordinating the review of this manuscript and known as waveform diversity [9]. Consequently, MIMO approvingitforpublicationwasDimitrisE.Anagnostou', '. needed. Multibeam radars that continuously transmit concurrent The principles of CC-OFDM MIMO radars have been multiple beams are able to simultaneously look at different discussed in [20] by way of an exemplary radar design for directions, for instance to cover a wide angular swath a long-range surveillance mission. The design includes the with a faceted view', '. INDEX TERMS Circulating-codes, Golay-codes, interference, MIMO-radar, multibeam, OFDM-radar, sub-band,surveillance. I. INTRODUCTION Manyradarapplicationsdemandscanningcapabilitytoallow The associate editor coordinating the review of this manuscript and coverage over a range of angular direction, such as those approvingitforpublicationwasXueboZhang . forsurveillance,vehicular,weathermonitoring,imaging,and 2025TheAuthors.ThisworkislicensedunderaCreativeCommonsAttribution4.0License', '. The design includes the with a faceted view. Such radars may find applications in system architecture and parameters, the waveform design surveillance[9],[10],[11],[12],automotive[13],[14],[15], and the scheduling of Golay codes and subbands. The imaging[16],[17],etc.Generationofmultiplesimultaneous transmitter architecture that adopts software-defined radar orthogonal beams can be done in several ways', '(13) herein as the subarrayed MIMO (SMIMO) radars, such as theFPMIMOradar,rangesbetweentwoextremeconfiguraNotation ⊗ denotes the Kronecker product operator, tions, namely the PA and the MIMO radar', '. [26] Y. Liu, G. Liao, Z. Yang, and J. Xu, ‘‘Design of integrated radar includinginvestigationintomillimeter-wavepropagation,channelmodeling and communication system based on MIMO-OFDM waveform,’’ J. andwirelesssystemsfortropicalareas,studiesonHFskywavechannelsand Syst. Eng. Electron., vol. 28, no. 4, pp.669–680, Aug. 2017, doi: communicationsinequatorialregions,andthedevelopmentofradararray 10.21629/JSEE.2017.04.06. andsignalprocessing. VOLUME13,2025 109905']","The scheduling of Golay codes and subbands in CC-OFDM MIMO radar enhances the orthogonality between symbols, which is crucial for maximizing radar performance (Kuswidiastuti et al., 2025).","for the n-th subcarrier for symbol a in beam b is given by gn,a,b, with the sampling period of Ts. The maximum unambiguous range, Rmax, will depend on the OFDM symbol period of T0. However, by transmitting Ns orthogonal symbols in series can extend the maximum range up to Ns times further. According to the waveform specification in Table 1, the 12 symbols are transmitted in series over 12T0 to extend the maximum range from 15 up to 180 km. The beams and the CC-OFDM symbols are Golay VOLUME 13, 2025 109897 D. Kuswidiastuti et al.: Receiver Processing of the Multibeam Azimuth Scanning CC-OFDM-MIMO Radar coded and transmitted using the allocated sub-band following a specific schedule that is well known",0.0,0.9371878147043047
"a speciﬁed time delay difference of (cid:49)t, each (cid:49)t value produces a beam pattern equivalent to a phased array having inter-element phase difference that depends on the corresponding subcarrier frequencies. Multiple beams can be formed simultaneously, by assigning multiple subcarrier sets which are transmit- ted using different value of (cid:49)t. This idea is the primary contribution of this paper, which will be elaborated in the sequel. A second contribution in this paper concerns the improvement of time on target in a MIMO radar adopting CC-OFDM waveforms. While multiple beamscanning in tra- ditional phased array radar results in limited time on target, CC-OFDM MIMO radar could give a much longer time on target because multiple beams in CC-OFDM radar can be","['. needed. Multibeam radars that continuously transmit concurrent The principles of CC-OFDM MIMO radars have been multiple beams are able to simultaneously look at different discussed in [20] by way of an exemplary radar design for directions, for instance to cover a wide angular swath a long-range surveillance mission. The design includes the with a faceted view', '. However, all of the above thereceiverprocessingofCC-OFDM-MIMOradar,whichis mentioned methods have problems in beam limitation and differentfromthoseinothertypesofOFDMMIMOradarsor cost. other multi-TRM radars due to the nature of the orthogonal Current trends regarding dual functional radar communi- multi-beamgenerationwithGolay-codedOFDMwaveforms cation (DFRC) systems which lead to an integrated sensing andsubbands', 'processed transmit and receive time schedule of CC-OFDM radar is further to obtain the beam information', '. The summation of outputs from 1) Thispaperdescribesthereceiverprocessingofmulti- individual receive modules across the array provides beam CC-OFDM MIMO Radar which is designed the array gain and serves to increase the receive SNR for long-range radar surveillance application. The for each beam', '. [21] Z. Xu and A. Petropulu, ‘‘A bandwidth efficient dual-function radar communication system based on a MIMO radar using OFDM waveforms,’’ IEEE Trans. Signal Process., vol. 71, pp.401–416, 2023, doi: 10.1109/TSP.2023.3241779. [22] U.B.SaracandG.M.Guvensen,‘‘Knowledge-aidedandadaptivebeamsquintawareMIMO-OFDMradardetectorsforISAC,’’IEEETrans.Commun.,earlyaccess,May8,2025,doi:10.1109/TCOMM.2025.3568219. [23] M. Schurwanz, J. Mietzner, and P. A', '. With this advantage, PA radars ject [6]–[18]. Unlike the PA radar, the MIMO radar utilizes have been used for such applications as micro-scale radars manyantennasthattransmitorthogonalsignalstoobtainthe signal reflected from the target at the receiver, a scheme The associate editor coordinating the review of this manuscript and known as waveform diversity [9]. Consequently, MIMO approvingitforpublicationwasDimitrisE.Anagnostou', '. DigitalObjectIdentifier10.1109/ACCESS.2025.3581842 Receiver Processing of the Multibeam Azimuth Scanning CC-OFDM-MIMO Radar DEVYKUSWIDIASTUTI 1,(Member,IEEE),L.P.LIGTHART 2,(LifeFellow,IEEE), GAMANTYOHENDRANTORO1,(SeniorMember,IEEE),TITIEKSURYANI 1,(Member,IEEE), PRASETIYONOHARIMUKTI 1,(Member,IEEE),ANDYUYUWAHYU 3,(Member,IEEE) 1DepartmentofElectricalEngineering,InstitutTeknologiSepuluhNopember,Surabaya60111,Indonesia 2IRCTR,DelftUniversityofTechnology(TUDelft),2628CDDelft,TheNetherlands(Retired)', '. CC-OFDM MIMO radar waveform design which the degree of orthogonality can be further improved by is discussed in this paper is not a CP based radar, the assigningdifferentsubbands,fortheneighboringbeams,and transmittersaretransmittingmultipleorthogonalsymbolsin thesamesubbandcanbereusedforthenon-adjacentbeams. serieswithoutanyguardtimeintervalbetweenthesymbols. The interference among these co-channel beams can be The symbol series are orthogonal to each other, hence VOLUME13,2025 109895', '(13) herein as the subarrayed MIMO (SMIMO) radars, such as theFPMIMOradar,rangesbetweentwoextremeconfiguraNotation ⊗ denotes the Kronecker product operator, tions, namely the PA and the MIMO radar', '. [26] Y. Liu, G. Liao, Z. Yang, and J. Xu, ‘‘Design of integrated radar includinginvestigationintomillimeter-wavepropagation,channelmodeling and communication system based on MIMO-OFDM waveform,’’ J. andwirelesssystemsfortropicalareas,studiesonHFskywavechannelsand Syst. Eng. Electron., vol. 28, no. 4, pp.669–680, Aug. 2017, doi: communicationsinequatorialregions,andthedevelopmentofradararray 10.21629/JSEE.2017.04.06. andsignalprocessing. VOLUME13,2025 109905']","The principles of multibeam radars, which can simultaneously transmit multiple beams to cover a wide angular swath, are discussed in the context of CC-OFDM MIMO radar systems (Kuswidiastuti et al., 2025).","the specified OFDM sub-band frequencies of beam b to provide phase difference between the transmit elements for creating the beam b. Circulating code in LFM MIMO radar which is discussed in , obtain this phase difference by transmitting coherent signals with a small time delay difference ((cid:49)tb) between the antenna element. However, using an OFDM signal, this phase steering can be provided by giving a phase difference to the OFDM subcarrier phase in the frequency domain of the OFDM signal generation stage. The phase steering given to the CC-OFDM waveform can be defined as follow: β(fn,a,b, (cid:49)tb) = 2πfn,a,b(cid:49)tb Hence, the array factor of CC-OFDM will be: AF(θ, fn,a,b, (cid:49)tb) = Nt −1 2X Ipejp(α(θ)+β(fn,a,b,(cid:49)tb) where α(θ) = p=− Nt",1.0,0.9494795013369121
"In our case, quasi-continuous transmission is used through proper scheduling of OFDM transmission and echoes reception to prevent the coupling. • The receiver that continuously receives signal echoes coming from multiple targets must be able to distinguish which targets are very near or very far from the radar. This is the reason in this paper that orthogonal codes are given to successive CC-OFDM symbols. These unique codes are given and known by the receiver, so that the receiver could properly detect and distinguish targets nearby and far away from the radar. In this paper we describe the waveform design of a CC-OFDM quasi-continuous wave for MIMO long the range radar. Quasi-CW transmission could limit leakage/coupling problem by time-isolation of the","['. [21] Z. Xu and A. Petropulu, ‘‘A bandwidth efficient dual-function radar communication system based on a MIMO radar using OFDM waveforms,’’ IEEE Trans. Signal Process., vol. 71, pp.401–416, 2023, doi: 10.1109/TSP.2023.3241779. [22] U.B.SaracandG.M.Guvensen,‘‘Knowledge-aidedandadaptivebeamsquintawareMIMO-OFDMradardetectorsforISAC,’’IEEETrans.Commun.,earlyaccess,May8,2025,doi:10.1109/TCOMM.2025.3568219. [23] M. Schurwanz, J. Mietzner, and P. A', '. CC-OFDM MIMO radar waveform design which the degree of orthogonality can be further improved by is discussed in this paper is not a CP based radar, the assigningdifferentsubbands,fortheneighboringbeams,and transmittersaretransmittingmultipleorthogonalsymbolsin thesamesubbandcanbereusedforthenon-adjacentbeams. serieswithoutanyguardtimeintervalbetweenthesymbols. The interference among these co-channel beams can be The symbol series are orthogonal to each other, hence VOLUME13,2025 109895', '. INDEX TERMS Circulating-codes, Golay-codes, interference, MIMO-radar, multibeam, OFDM-radar, sub-band,surveillance. I. INTRODUCTION Manyradarapplicationsdemandscanningcapabilitytoallow The associate editor coordinating the review of this manuscript and coverage over a range of angular direction, such as those approvingitforpublicationwasXueboZhang . forsurveillance,vehicular,weathermonitoring,imaging,and 2025TheAuthors.ThisworkislicensedunderaCreativeCommonsAttribution4.0License', '. However, all of the above thereceiverprocessingofCC-OFDM-MIMOradar,whichis mentioned methods have problems in beam limitation and differentfromthoseinothertypesofOFDMMIMOradarsor cost. other multi-TRM radars due to the nature of the orthogonal Current trends regarding dual functional radar communi- multi-beamgenerationwithGolay-codedOFDMwaveforms cation (DFRC) systems which lead to an integrated sensing andsubbands', '. DigitalObjectIdentifier10.1109/ACCESS.2025.3581842 Receiver Processing of the Multibeam Azimuth Scanning CC-OFDM-MIMO Radar DEVYKUSWIDIASTUTI 1,(Member,IEEE),L.P.LIGTHART 2,(LifeFellow,IEEE), GAMANTYOHENDRANTORO1,(SeniorMember,IEEE),TITIEKSURYANI 1,(Member,IEEE), PRASETIYONOHARIMUKTI 1,(Member,IEEE),ANDYUYUWAHYU 3,(Member,IEEE) 1DepartmentofElectricalEngineering,InstitutTeknologiSepuluhNopember,Surabaya60111,Indonesia 2IRCTR,DelftUniversityofTechnology(TUDelft),2628CDDelft,TheNetherlands(Retired)', '. INDEX TERMS MIMO radar, parameter estimation, phased array radar, probability of detection, target detection. I. INTRODUCTION for biomedical engineering, macro-scale radars on radioMulti-antenna radar systems have been known and used in astronomy, and so on [4], [5]', '(13) herein as the subarrayed MIMO (SMIMO) radars, such as theFPMIMOradar,rangesbetweentwoextremeconfiguraNotation ⊗ denotes the Kronecker product operator, tions, namely the PA and the MIMO radar', '. [26] Y. Liu, G. Liao, Z. Yang, and J. Xu, ‘‘Design of integrated radar includinginvestigationintomillimeter-wavepropagation,channelmodeling and communication system based on MIMO-OFDM waveform,’’ J. andwirelesssystemsfortropicalareas,studiesonHFskywavechannelsand Syst. Eng. Electron., vol. 28, no. 4, pp.669–680, Aug. 2017, doi: communicationsinequatorialregions,andthedevelopmentofradararray 10.21629/JSEE.2017.04.06. andsignalprocessing. VOLUME13,2025 109905', '. The design includes the with a faceted view. Such radars may find applications in system architecture and parameters, the waveform design surveillance[9],[10],[11],[12],automotive[13],[14],[15], and the scheduling of Golay codes and subbands. The imaging[16],[17],etc.Generationofmultiplesimultaneous transmitter architecture that adopts software-defined radar orthogonal beams can be done in several ways', '. REVIEWONMAXIMUMNUMBEROFDETECTED has been described by [13]. In a MIMO radar, in which TARGETSFORMIMORADAR K elements in the Tx array transmit orthogonal waveforms For clarity in discussions that follow, herein we provide a andLelementsintheRxarrayreceiveechosignalsfromtar- shortreviewoftheperformanceofMIMOradarsinthemaxgetsoperatingindependently,theVAdimensionisexpressed imum number of detected targets, mostly taken from [13]']","The design of CC-OFDM MIMO radar waveforms can enhance orthogonality by assigning different subbands to neighboring beams, allowing for the reuse of orthogonal symbols in the same subband for non-adjacent beams (Receiver Processing of the Multibeam Azimuth Scanning CC-OFDM-MIMO Radar).","much defining the maximum unambiguous range of the radar system. CC-OFDM MIMO radar waveform design which is discussed in this paper is not a CP based radar, the transmitters are transmitting multiple orthogonal symbols in series without any guard time interval between the symbols. to each other, hence The symbol series are orthogonal VOLUME 13, 2025 109895 D. Kuswidiastuti et al.: Receiver Processing of the Multibeam Azimuth Scanning CC-OFDM-MIMO Radar receivers know how to distinguish the symbols received, and this could extend the maximum unambiguous range of the radar. The contributions of this paper are described as follow: 1) This paper describes the receiver processing of multi- beam CC-OFDM MIMO Radar which is designed for long-range radar surveillance application. The",1.0,0.933849645558653
"attention is paid to utilizing this multi-dimensional orthogonality. The orthogonality between the CC-OFDM symbols is beneﬁcial in obtaining an optimum SNR for increasing the maximum unambiguous range of the radar. Another main contribution of this paper is the design of a radar waveform which could extend its maximum unambiguous range by transmitting quasi-continuously multiple orthogonal CC-OFDM symbols in series. It means that the radar will have a longer pulse rep- etition interval (PRI) which leads to a longer-range detection. The additional requirement is that there must be orthogonal- ities between the symbol series. The orthogonality is pro- vided by using orthogonal codes for coding the CC-OFDM symbols, which can be realized using the Golay codes pre- viously chosen to mitigate","['. INDEX TERMS Circulating-codes, Golay-codes, interference, MIMO-radar, multibeam, OFDM-radar, sub-band,surveillance. I. INTRODUCTION Manyradarapplicationsdemandscanningcapabilitytoallow The associate editor coordinating the review of this manuscript and coverage over a range of angular direction, such as those approvingitforpublicationwasXueboZhang . forsurveillance,vehicular,weathermonitoring,imaging,and 2025TheAuthors.ThisworkislicensedunderaCreativeCommonsAttribution4.0License', '. [21] Z. Xu and A. Petropulu, ‘‘A bandwidth efficient dual-function radar communication system based on a MIMO radar using OFDM waveforms,’’ IEEE Trans. Signal Process., vol. 71, pp.401–416, 2023, doi: 10.1109/TSP.2023.3241779. [22] U.B.SaracandG.M.Guvensen,‘‘Knowledge-aidedandadaptivebeamsquintawareMIMO-OFDMradardetectorsforISAC,’’IEEETrans.Commun.,earlyaccess,May8,2025,doi:10.1109/TCOMM.2025.3568219. [23] M. Schurwanz, J. Mietzner, and P. A', '. CC-OFDM MIMO radar waveform design which the degree of orthogonality can be further improved by is discussed in this paper is not a CP based radar, the assigningdifferentsubbands,fortheneighboringbeams,and transmittersaretransmittingmultipleorthogonalsymbolsin thesamesubbandcanbereusedforthenon-adjacentbeams. serieswithoutanyguardtimeintervalbetweenthesymbols. The interference among these co-channel beams can be The symbol series are orthogonal to each other, hence VOLUME13,2025 109895', '. DigitalObjectIdentifier10.1109/ACCESS.2025.3581842 Receiver Processing of the Multibeam Azimuth Scanning CC-OFDM-MIMO Radar DEVYKUSWIDIASTUTI 1,(Member,IEEE),L.P.LIGTHART 2,(LifeFellow,IEEE), GAMANTYOHENDRANTORO1,(SeniorMember,IEEE),TITIEKSURYANI 1,(Member,IEEE), PRASETIYONOHARIMUKTI 1,(Member,IEEE),ANDYUYUWAHYU 3,(Member,IEEE) 1DepartmentofElectricalEngineering,InstitutTeknologiSepuluhNopember,Surabaya60111,Indonesia 2IRCTR,DelftUniversityofTechnology(TUDelft),2628CDDelft,TheNetherlands(Retired)', '. andcommunication(ISAC)systemsmotivatefurthermorethe There are previous research on radar waveform for ISAC use of OFDM for radar waveform. Research on finding the purposes[25],[26]whichdiscussedaboutcyclicprefix(CP) perfect waveform that can serve for both function is still an based OFDM waveform and how the CP is very much ongoingresearchuntilnowadays[20],[21],[22],[23].When defining the maximum unambiguous range of the radar theavailablebandwidthcanbedividedintoseveralsubbands, system', '. This means that the with the Golay codes which corresponds to a specific rangeresolutionwillbe60meter.TheCC-OFDMindividual beamsymbolasstatedintheschedule.Thebeautyof symbol duration is 0.1 ms, and the transmitters transmit a the receiver processing of CC-OFDM MIMO radar is frame consisting of 12 consecutive symbols in series', '. [26] Y. Liu, G. Liao, Z. Yang, and J. Xu, ‘‘Design of integrated radar includinginvestigationintomillimeter-wavepropagation,channelmodeling and communication system based on MIMO-OFDM waveform,’’ J. andwirelesssystemsfortropicalareas,studiesonHFskywavechannelsand Syst. Eng. Electron., vol. 28, no. 4, pp.669–680, Aug. 2017, doi: communicationsinequatorialregions,andthedevelopmentofradararray 10.21629/JSEE.2017.04.06. andsignalprocessing. VOLUME13,2025 109905', '. In the works on the PMIMO radar in [22]–[29], The evaluation on the detection performance in terms of the improvement in radar performance factors such as theprobabilityofdetectionandtheprobabilityoffalsealarm spatial resolution, parameter identifiability, transmit-receive reportedhereinisanextensionofstudyby[32].Theseparam(T-R)gain,andsignal-to-interference-plus-noisepowerratio etersareevaluatedbasedonseveralaspectssuchastheeffect (SINR)hasbeenreported.Theresultsofinvestigationsin[29]', 'processed transmit and receive time schedule of CC-OFDM radar is further to obtain the beam information', '. The design includes the with a faceted view. Such radars may find applications in system architecture and parameters, the waveform design surveillance[9],[10],[11],[12],automotive[13],[14],[15], and the scheduling of Golay codes and subbands. The imaging[16],[17],etc.Generationofmultiplesimultaneous transmitter architecture that adopts software-defined radar orthogonal beams can be done in several ways']","The design of the CC-OFDM MIMO radar waveform can enhance orthogonality by assigning different subbands for neighboring beams, allowing multiple orthogonal symbols to be transmitted in series without guard time intervals (Kuswidiastuti et al., 2025).","and radial velocity detection of targets is not discussed yet. The contribution of this paper is in the receiver processing of CC-OFDM-MIMO radar, which is different from those in other types of OFDM MIMO radars or other multi-TRM radars due to the nature of the orthogonal multi-beam generation with Golay-coded OFDM waveforms and subbands. There are previous research on radar waveform for ISAC purposes , which discussed about cyclic prefix (CP) based OFDM waveform and how the CP is very much defining the maximum unambiguous range of the radar system. CC-OFDM MIMO radar waveform design which is discussed in this paper is not a CP based radar, the transmitters are transmitting multiple orthogonal symbols in series without any guard time",0.8,0.9557874905341173
"also be eliminated because it is possible to design a wave- form to produce an array pattern with a low sidelobe-level characteristic directly from the waveform generation stage. This paper describes a novel design of software deﬁned radar (SDR) using CC OFDM waveforms by giving the phase difference for beam steering and the amplitude tapering coef- ﬁcient at digital waveform generation stage. Hence, when the CC OFDM waveforms are transmitted simultaneously from multiple array antennas, as illustrated in Fig. 1 (a), they will create beams heading to a certain θb direction and exhibiting low side lobe levels. Assume for now that the system is a uniform linear array (ULA) with equal spacing d as depicted in Fig. 1(b). By taking","['. The design includes the with a faceted view. Such radars may find applications in system architecture and parameters, the waveform design surveillance[9],[10],[11],[12],automotive[13],[14],[15], and the scheduling of Golay codes and subbands. The imaging[16],[17],etc.Generationofmultiplesimultaneous transmitter architecture that adopts software-defined radar orthogonal beams can be done in several ways', '. With this advantage, PA radars ject [6]–[18]. Unlike the PA radar, the MIMO radar utilizes have been used for such applications as micro-scale radars manyantennasthattransmitorthogonalsignalstoobtainthe signal reflected from the target at the receiver, a scheme The associate editor coordinating the review of this manuscript and known as waveform diversity [9]. Consequently, MIMO approvingitforpublicationwasDimitrisE.Anagnostou', '. isillustratedashavingaradarbeamthatcoversaspanofthe In this manner, the FPMIMO radar can achieve a desired azimuthangle', '. In the works on the PMIMO radar in [22]–[29], The evaluation on the detection performance in terms of the improvement in radar performance factors such as theprobabilityofdetectionandtheprobabilityoffalsealarm spatial resolution, parameter identifiability, transmit-receive reportedhereinisanextensionofstudyby[32].Theseparam(T-R)gain,andsignal-to-interference-plus-noisepowerratio etersareevaluatedbasedonseveralaspectssuchastheeffect (SINR)hasbeenreported.Theresultsofinvestigationsin[29]', '. INDEX TERMS MIMO radar, parameter estimation, phased array radar, probability of detection, target detection. I. INTRODUCTION for biomedical engineering, macro-scale radars on radioMulti-antenna radar systems have been known and used in astronomy, and so on [4], [5]', '. [21] Z. Xu and A. Petropulu, ‘‘A bandwidth efficient dual-function radar communication system based on a MIMO radar using OFDM waveforms,’’ IEEE Trans. Signal Process., vol. 71, pp.401–416, 2023, doi: 10.1109/TSP.2023.3241779. [22] U.B.SaracandG.M.Guvensen,‘‘Knowledge-aidedandadaptivebeamsquintawareMIMO-OFDMradardetectorsforISAC,’’IEEETrans.Commun.,earlyaccess,May8,2025,doi:10.1109/TCOMM.2025.3568219. [23] M. Schurwanz, J. Mietzner, and P. A', '(13) herein as the subarrayed MIMO (SMIMO) radars, such as theFPMIMOradar,rangesbetweentwoextremeconfiguraNotation ⊗ denotes the Kronecker product operator, tions, namely the PA and the MIMO radar', '. DigitalObjectIdentifier10.1109/ACCESS.2025.3581842 Receiver Processing of the Multibeam Azimuth Scanning CC-OFDM-MIMO Radar DEVYKUSWIDIASTUTI 1,(Member,IEEE),L.P.LIGTHART 2,(LifeFellow,IEEE), GAMANTYOHENDRANTORO1,(SeniorMember,IEEE),TITIEKSURYANI 1,(Member,IEEE), PRASETIYONOHARIMUKTI 1,(Member,IEEE),ANDYUYUWAHYU 3,(Member,IEEE) 1DepartmentofElectricalEngineering,InstitutTeknologiSepuluhNopember,Surabaya60111,Indonesia 2IRCTR,DelftUniversityofTechnology(TUDelft),2628CDDelft,TheNetherlands(Retired)', '. INDEX TERMS Circulating-codes, Golay-codes, interference, MIMO-radar, multibeam, OFDM-radar, sub-band,surveillance. I. INTRODUCTION Manyradarapplicationsdemandscanningcapabilitytoallow The associate editor coordinating the review of this manuscript and coverage over a range of angular direction, such as those approvingitforpublicationwasXueboZhang . forsurveillance,vehicular,weathermonitoring,imaging,and 2025TheAuthors.ThisworkislicensedunderaCreativeCommonsAttribution4.0License', '. However, all of the above thereceiverprocessingofCC-OFDM-MIMOradar,whichis mentioned methods have problems in beam limitation and differentfromthoseinothertypesofOFDMMIMOradarsor cost. other multi-TRM radars due to the nature of the orthogonal Current trends regarding dual functional radar communi- multi-beamgenerationwithGolay-codedOFDMwaveforms cation (DFRC) systems which lead to an integrated sensing andsubbands']","The generation of multiple simultaneous orthogonal beams in radar systems can be achieved through various methods, which supports the design of software-defined radar using CC OFDM waveforms (Kuswidiastuti et al., 2025).","the specified OFDM sub-band frequencies of beam b to provide phase difference between the transmit elements for creating the beam b. Circulating code in LFM MIMO radar which is discussed in , obtain this phase difference by transmitting coherent signals with a small time delay difference ((cid:49)tb) between the antenna element. However, using an OFDM signal, this phase steering can be provided by giving a phase difference to the OFDM subcarrier phase in the frequency domain of the OFDM signal generation stage. The phase steering given to the CC-OFDM waveform can be defined as follow: β(fn,a,b, (cid:49)tb) = 2πfn,a,b(cid:49)tb Hence, the array factor of CC-OFDM will be: AF(θ, fn,a,b, (cid:49)tb) = Nt −1 2X Ipejp(α(θ)+β(fn,a,b,(cid:49)tb) where α(θ) = p=− Nt",0.3333333333333333,0.9297380742261954
"of the beampattern, p = Ipejp2πfnc,b(cid:49)tb. so that we can deﬁne I (cid:48) The array factor (AF) of the CC-OFDM waveform as a function of angle θ, center frequency of the allocated sub band for the b-th beam, fnc,b, and time delay (cid:49)tb for phase steering of the b-th beam is given by: AF(θ, fnc,b, (cid:49)tb) = Nt −1 2(cid:88) pejpα(θ) I (cid:48) p=− Nt −1 Nt −1 2(cid:88) p=− Nt −1 Ipejp2πfnc,b(cid:49)tb (cid:125) (cid:123)(cid:122) (cid:124) the waveform effect ejpα(θ) (cid:124) (cid:123)(cid:122) (cid:125) the array radiation effect (7) The rightmost form consists of the sum of product of two factors. The ﬁrst represents the waveform effect, which is the Taylor amplitude distribution of the array elements and the phase factor","['. DigitalObjectIdentifier10.1109/ACCESS.2020.2965192 FPMIMO: A General MIMO Structure With Overlapping Subarrays for Various Radar Applications SYAHFRIZALTAHCFULLOH 1,2,(StudentMember,IEEE),AND GAMANTYOHENDRANTORO 1,(SeniorMember,IEEE) 1DepartmentofElectricalEngineering,InstitutTeknologiSepuluhNopember,Surabaya60111,Indonesia 2DepartmentofElectricalEngineering,UniversitasBorneoTarakan,Tarakan77123,Indonesia Correspondingauthor:SyahfrizalTahcfulloh(syahfrizal15@mhs.ee.its.ac.id)', '(13) herein as the subarrayed MIMO (SMIMO) radars, such as theFPMIMOradar,rangesbetweentwoextremeconfiguraNotation ⊗ denotes the Kronecker product operator, tions, namely the PA and the MIMO radar', '. DigitalObjectIdentifier10.1109/ACCESS.2025.3581842 Receiver Processing of the Multibeam Azimuth Scanning CC-OFDM-MIMO Radar DEVYKUSWIDIASTUTI 1,(Member,IEEE),L.P.LIGTHART 2,(LifeFellow,IEEE), GAMANTYOHENDRANTORO1,(SeniorMember,IEEE),TITIEKSURYANI 1,(Member,IEEE), PRASETIYONOHARIMUKTI 1,(Member,IEEE),ANDYUYUWAHYU 3,(Member,IEEE) 1DepartmentofElectricalEngineering,InstitutTeknologiSepuluhNopember,Surabaya60111,Indonesia 2IRCTR,DelftUniversityofTechnology(TUDelft),2628CDDelft,TheNetherlands(Retired)', '. The assumption is that the M transmitted of the FPMIMO radar that have been carried out show that waveformsarelinearlyindependentfromoneanother,sothat such use of T-R subarrays has the advantage of being able thefollowingissatisfied: tobalancetheMCAbetweentwotargets,asrequiredbythe rank (cid:8)(cid:2)ψ(1) ψ(2) ... ψ(Q) (cid:3)(cid:9)=M, Q≥M (23) givenapplication[31]', '. isillustratedashavingaradarbeamthatcoversaspanofthe In this manner, the FPMIMO radar can achieve a desired azimuthangle', 'D.Kuswidiastutietal.:ReceiverProcessingoftheMultibeamAzimuthScanningCC-OFDM-MIMORadar FIGURE1. BlockdiagramofatransmitreceivemoduleofCC-OFDMMIMOradar. TABLE1. CC-OFDMMIMOradarsystemspecificationsforsurveillance module that goes to the azimuth array element. The phase applications', '. The Rx array on the PMIMO radar does Simplificationofthedenominatorfrom(37)using(5),(6), not use subarrays, which means a non-coherent array (NC), (10),and(11)canbeachievedasfollows sothatitmaximizesthewaveformdiversitygaintoanextent limitedbythenumberofTxsubarraysandRxantennas.The (cid:107)g(θ)◦h(θ)(cid:107)2 = (g(θ)◦h(θ))H(g(θ)◦h(θ)) waveform diversity gain has an impact on the decrease of = N(cid:107)g(θ)(cid:107)2 (38) theMCAbutalsoimpliesanincreasingnumberofdetectable', '. (22)]. If there are K antennas on cases, in [31]. Specifically, the SINR gain on the FPMIMO the Tx array that form M overlapping subarrays to transmit radar depending on the number N of Rx subarrays is linearindependentwaveformsandLantennasontheRxarray (N/L)(L − N+1) times the SINR obtained by the PMIMO that forms N overlapping subarrays with their respective radar,inwhichN =L', '. [1] J. A. Scheer, ‘‘Radar search and overview of detection in interference, TheIFspectrumofthereceivedechosignalcomingfrom ‘‘Radarsearchandoverviewofdetectionininterference,’’inPrinciples ModernRadar,vol.1.SciTechPublishing,2010,pp.87–113. a moving target at beam 0 with a speed of 5m/s is shown [2] C.A.Balanis,AntennaTheory:AnalysisandDesign,4thed.Wiley,2016. in Fig. 14', 'S.Tahcfulloh,G.Hendrantoro:FPMIMO:GeneralMIMOStructureWithOverlappingSubarraysforVariousRadarApplications programmed subarrays. Hence, our paper can also be seen as a review of multi-antenna radar techniques that combine the PA and MIMO structures by making use of overlapped subarrays']","The array factor of the CC-OFDM waveform is influenced by phase steering as described in the context of multibeam azimuth scanning radar systems (Kuswidiastuti et al., 2025).","the specified OFDM sub-band frequencies of beam b to provide phase difference between the transmit elements for creating the beam b. Circulating code in LFM MIMO radar which is discussed in , obtain this phase difference by transmitting coherent signals with a small time delay difference ((cid:49)tb) between the antenna element. However, using an OFDM signal, this phase steering can be provided by giving a phase difference to the OFDM subcarrier phase in the frequency domain of the OFDM signal generation stage. The phase steering given to the CC-OFDM waveform can be defined as follow: β(fn,a,b, (cid:49)tb) = 2πfn,a,b(cid:49)tb Hence, the array factor of CC-OFDM will be: AF(θ, fn,a,b, (cid:49)tb) = Nt −1 2X Ipejp(α(θ)+β(fn,a,b,(cid:49)tb) where α(θ) = p=− Nt",1.0,0.9509735230921227
"beamforming at transmit is produced by divid- ing the total OFDM bandwidth B, consisting of Nc subcarriers into Nsb sub bands with smaller bandwidth of Bb, consisting of Ncb subcarriers. The bandwidth per sub-band Bb will deter- mine the range resolution of the CC-OFDM radar as follows: (cid:49)R = 2Bb (8) VOLUME 10, 2022 D. Kuswidiastuti et al.: Transmitter Design for Multibeam CC-OFDM Azimuth Scanning MIMO Radar FIGURE 1. Circulating code in OFDM MIMO radar transmitters with Nt elements transmitting coherence signals, delay difference of (cid:49)t and array factor is defined in the xy plane: (a) time domain and (b) space domain. where (cid:49)R is the range resolution in each beam. If the fre- quency spacing between the OFDM subcarriers","['. DigitalObjectIdentifier10.1109/ACCESS.2025.3581842 Receiver Processing of the Multibeam Azimuth Scanning CC-OFDM-MIMO Radar DEVYKUSWIDIASTUTI 1,(Member,IEEE),L.P.LIGTHART 2,(LifeFellow,IEEE), GAMANTYOHENDRANTORO1,(SeniorMember,IEEE),TITIEKSURYANI 1,(Member,IEEE), PRASETIYONOHARIMUKTI 1,(Member,IEEE),ANDYUYUWAHYU 3,(Member,IEEE) 1DepartmentofElectricalEngineering,InstitutTeknologiSepuluhNopember,Surabaya60111,Indonesia 2IRCTR,DelftUniversityofTechnology(TUDelft),2628CDDelft,TheNetherlands(Retired)', '. needed. Multibeam radars that continuously transmit concurrent The principles of CC-OFDM MIMO radars have been multiple beams are able to simultaneously look at different discussed in [20] by way of an exemplary radar design for directions, for instance to cover a wide angular swath a long-range surveillance mission. The design includes the with a faceted view', '. isillustratedashavingaradarbeamthatcoversaspanofthe In this manner, the FPMIMO radar can achieve a desired azimuthangle', '. However, all of the above thereceiverprocessingofCC-OFDM-MIMOradar,whichis mentioned methods have problems in beam limitation and differentfromthoseinothertypesofOFDMMIMOradarsor cost. other multi-TRM radars due to the nature of the orthogonal Current trends regarding dual functional radar communi- multi-beamgenerationwithGolay-codedOFDMwaveforms cation (DFRC) systems which lead to an integrated sensing andsubbands', '(13) herein as the subarrayed MIMO (SMIMO) radars, such as theFPMIMOradar,rangesbetweentwoextremeconfiguraNotation ⊗ denotes the Kronecker product operator, tions, namely the PA and the MIMO radar', '. INDEX TERMS Circulating-codes, Golay-codes, interference, MIMO-radar, multibeam, OFDM-radar, sub-band,surveillance. I. INTRODUCTION Manyradarapplicationsdemandscanningcapabilitytoallow The associate editor coordinating the review of this manuscript and coverage over a range of angular direction, such as those approvingitforpublicationwasXueboZhang . forsurveillance,vehicular,weathermonitoring,imaging,and 2025TheAuthors.ThisworkislicensedunderaCreativeCommonsAttribution4.0License', '. [21] Z. Xu and A. Petropulu, ‘‘A bandwidth efficient dual-function radar communication system based on a MIMO radar using OFDM waveforms,’’ IEEE Trans. Signal Process., vol. 71, pp.401–416, 2023, doi: 10.1109/TSP.2023.3241779. [22] U.B.SaracandG.M.Guvensen,‘‘Knowledge-aidedandadaptivebeamsquintawareMIMO-OFDMradardetectorsforISAC,’’IEEETrans.Commun.,earlyaccess,May8,2025,doi:10.1109/TCOMM.2025.3568219. [23] M. Schurwanz, J. Mietzner, and P. A', '. Hassanien and S. A. Vorobyov, ‘‘Phased-MIMO radar: A tradeoff on HF skywave channels and communications in equatorial regions, and betweenphased-arrayandMIMOradars,’’IEEETrans.SignalProcess., the development of radar array and signal processing. He is currently a vol.58,no.6,pp.3137–3151,Jun.2010. ProfessorwiththeDepartmentofElectricalEngineering,ITS.Hisresearch [23] A.RoshanzamirandM.Bastani,‘‘Hybridorthogonal-phasedarrayMIMO RADAR,’’inProc.IETInt.RadarConf.,2013,pp.1–5', '. However, in PA radars the variousapplicationssince1930s.Themostcommontypeis number of detected targets is limited by the angular and one with phased array (PA), in which multiple elements are rangeresolution.Morerecently,themulti-inputmulti-output fed with different phases to obtain a high coherent gain at (MIMO) radar has become an interesting research suba certain direction [1]–[3]. With this advantage, PA radars ject [6]–[18]', '. [26] Y. Liu, G. Liao, Z. Yang, and J. Xu, ‘‘Design of integrated radar includinginvestigationintomillimeter-wavepropagation,channelmodeling and communication system based on MIMO-OFDM waveform,’’ J. andwirelesssystemsfortropicalareas,studiesonHFskywavechannelsand Syst. Eng. Electron., vol. 28, no. 4, pp.669–680, Aug. 2017, doi: communicationsinequatorialregions,andthedevelopmentofradararray 10.21629/JSEE.2017.04.06. andsignalprocessing. VOLUME13,2025 109905']","The principles of CC-OFDM MIMO radars, which include the division of total bandwidth into sub-bands that determine range resolution, have been discussed in detail (Kuswidiastuti et al., 2025).","for the n-th subcarrier for symbol a in beam b is given by gn,a,b, with the sampling period of Ts. The maximum unambiguous range, Rmax, will depend on the OFDM symbol period of T0. However, by transmitting Ns orthogonal symbols in series can extend the maximum range up to Ns times further. According to the waveform specification in Table 1, the 12 symbols are transmitted in series over 12T0 to extend the maximum range from 15 up to 180 km. The beams and the CC-OFDM symbols are Golay VOLUME 13, 2025 109897 D. Kuswidiastuti et al.: Receiver Processing of the Multibeam Azimuth Scanning CC-OFDM-MIMO Radar coded and transmitted using the allocated sub-band following a specific schedule that is well known",0.25,0.9435510491085606
"Multibeam CC-OFDM Azimuth Scanning MIMO Radar The phase steering is deﬁned as: β(fn,a,b, (cid:49)tb) = 2π fn,a,b(cid:49)tb (13) hence, at any transmitter p, the WG generates Nb beams simultaneously during the Nsym symbol periods with ampli- tude control Ip. The CC-OFDM complex signal of symbol a in beam b at the p-th transmitter is: xp,a,b(t) = Ip −1 Ncb (cid:88) n=0 Cn,pga,b,nejpβ(fn,a,b,(cid:49)tb) × ej2π(n+(za,b−1)Ncb )(cid:49)f (t−(a−1)T0) for 0 ≤ t − (a − 1)T0 + p(cid:49)tb ≤ T0. (14) The complex discrete-time signal of the baseband CC-OFDM signal in (14) is: xp,a,b(t) = Ip −1 Ncb (cid:88) n=0 Cn,pga,b,nejpβ(fn,a,b,(cid:49)tb) × ej2π(n+(za,b−1)Ncb )(cid:49)f (kTs−(a−1)T0) for 0 ≤ kTs − (a − 1)T0 + p(cid:49)tb ≤ T0. (15) The time delay (cid:49)tb","['. DigitalObjectIdentifier10.1109/ACCESS.2025.3581842 Receiver Processing of the Multibeam Azimuth Scanning CC-OFDM-MIMO Radar DEVYKUSWIDIASTUTI 1,(Member,IEEE),L.P.LIGTHART 2,(LifeFellow,IEEE), GAMANTYOHENDRANTORO1,(SeniorMember,IEEE),TITIEKSURYANI 1,(Member,IEEE), PRASETIYONOHARIMUKTI 1,(Member,IEEE),ANDYUYUWAHYU 3,(Member,IEEE) 1DepartmentofElectricalEngineering,InstitutTeknologiSepuluhNopember,Surabaya60111,Indonesia 2IRCTR,DelftUniversityofTechnology(TUDelft),2628CDDelft,TheNetherlands(Retired)', '. needed. Multibeam radars that continuously transmit concurrent The principles of CC-OFDM MIMO radars have been multiple beams are able to simultaneously look at different discussed in [20] by way of an exemplary radar design for directions, for instance to cover a wide angular swath a long-range surveillance mission. The design includes the with a faceted view', '. isillustratedashavingaradarbeamthatcoversaspanofthe In this manner, the FPMIMO radar can achieve a desired azimuthangle', '. However, all of the above thereceiverprocessingofCC-OFDM-MIMOradar,whichis mentioned methods have problems in beam limitation and differentfromthoseinothertypesofOFDMMIMOradarsor cost. other multi-TRM radars due to the nature of the orthogonal Current trends regarding dual functional radar communi- multi-beamgenerationwithGolay-codedOFDMwaveforms cation (DFRC) systems which lead to an integrated sensing andsubbands', '. The summation of outputs from 1) Thispaperdescribesthereceiverprocessingofmulti- individual receive modules across the array provides beam CC-OFDM MIMO Radar which is designed the array gain and serves to increase the receive SNR for long-range radar surveillance application. The for each beam', '(13) herein as the subarrayed MIMO (SMIMO) radars, such as theFPMIMOradar,rangesbetweentwoextremeconfiguraNotation ⊗ denotes the Kronecker product operator, tions, namely the PA and the MIMO radar', '. [21] Z. Xu and A. Petropulu, ‘‘A bandwidth efficient dual-function radar communication system based on a MIMO radar using OFDM waveforms,’’ IEEE Trans. Signal Process., vol. 71, pp.401–416, 2023, doi: 10.1109/TSP.2023.3241779. [22] U.B.SaracandG.M.Guvensen,‘‘Knowledge-aidedandadaptivebeamsquintawareMIMO-OFDMradardetectorsforISAC,’’IEEETrans.Commun.,earlyaccess,May8,2025,doi:10.1109/TCOMM.2025.3568219. [23] M. Schurwanz, J. Mietzner, and P. A', '. INDEX TERMS MIMO radar, parameter estimation, phased array radar, probability of detection, target detection. I. INTRODUCTION for biomedical engineering, macro-scale radars on radioMulti-antenna radar systems have been known and used in astronomy, and so on [4], [5]', '. INDEX TERMS Circulating-codes, Golay-codes, interference, MIMO-radar, multibeam, OFDM-radar, sub-band,surveillance. I. INTRODUCTION Manyradarapplicationsdemandscanningcapabilitytoallow The associate editor coordinating the review of this manuscript and coverage over a range of angular direction, such as those approvingitforpublicationwasXueboZhang . forsurveillance,vehicular,weathermonitoring,imaging,and 2025TheAuthors.ThisworkislicensedunderaCreativeCommonsAttribution4.0License', '. CC-OFDM MIMO radar waveform design which the degree of orthogonality can be further improved by is discussed in this paper is not a CP based radar, the assigningdifferentsubbands,fortheneighboringbeams,and transmittersaretransmittingmultipleorthogonalsymbolsin thesamesubbandcanbereusedforthenon-adjacentbeams. serieswithoutanyguardtimeintervalbetweenthesymbols. The interference among these co-channel beams can be The symbol series are orthogonal to each other, hence VOLUME13,2025 109895']","The receiver processing of multi-beam CC-OFDM MIMO Radar is designed to enhance the signal-to-noise ratio for long-range surveillance applications (Kuswidiastuti et al., 2025).","the specified OFDM sub-band frequencies of beam b to provide phase difference between the transmit elements for creating the beam b. Circulating code in LFM MIMO radar which is discussed in , obtain this phase difference by transmitting coherent signals with a small time delay difference ((cid:49)tb) between the antenna element. However, using an OFDM signal, this phase steering can be provided by giving a phase difference to the OFDM subcarrier phase in the frequency domain of the OFDM signal generation stage. The phase steering given to the CC-OFDM waveform can be defined as follow: β(fn,a,b, (cid:49)tb) = 2πfn,a,b(cid:49)tb Hence, the array factor of CC-OFDM will be: AF(θ, fn,a,b, (cid:49)tb) = Nt −1 2X Ipejp(α(θ)+β(fn,a,b,(cid:49)tb) where α(θ) = p=− Nt",1.0,0.9491091852101493
"the n-th subcarrier for symbol a in beam b is given by ga,b,n. In order to generate CC-OFDM waveform, additional phase steering β(fn,a,b, (cid:49)tb) is given to the speciﬁed OFDM sub-band frequencies of beam b for generating a required time delay between the transmit elements for beam b. 53688 VOLUME 10, 2022 D. Kuswidiastuti et al.: Transmitter Design for Multibeam CC-OFDM Azimuth Scanning MIMO Radar TABLE 1. Surveillance radar system and waveform specifications. strict requirement for the time and frequency accuracy of the oscillator clocks at transmitters and receivers. For instance, with an IF of 20 MHz and a carrier frequency offset of 10 kHz the error in beam direction becomes 0.1◦ and the estimated range error equals 0.27 meter","['. DigitalObjectIdentifier10.1109/ACCESS.2025.3581842 Receiver Processing of the Multibeam Azimuth Scanning CC-OFDM-MIMO Radar DEVYKUSWIDIASTUTI 1,(Member,IEEE),L.P.LIGTHART 2,(LifeFellow,IEEE), GAMANTYOHENDRANTORO1,(SeniorMember,IEEE),TITIEKSURYANI 1,(Member,IEEE), PRASETIYONOHARIMUKTI 1,(Member,IEEE),ANDYUYUWAHYU 3,(Member,IEEE) 1DepartmentofElectricalEngineering,InstitutTeknologiSepuluhNopember,Surabaya60111,Indonesia 2IRCTR,DelftUniversityofTechnology(TUDelft),2628CDDelft,TheNetherlands(Retired)', '. needed. Multibeam radars that continuously transmit concurrent The principles of CC-OFDM MIMO radars have been multiple beams are able to simultaneously look at different discussed in [20] by way of an exemplary radar design for directions, for instance to cover a wide angular swath a long-range surveillance mission. The design includes the with a faceted view', '. isillustratedashavingaradarbeamthatcoversaspanofthe In this manner, the FPMIMO radar can achieve a desired azimuthangle', '. However, all of the above thereceiverprocessingofCC-OFDM-MIMOradar,whichis mentioned methods have problems in beam limitation and differentfromthoseinothertypesofOFDMMIMOradarsor cost. other multi-TRM radars due to the nature of the orthogonal Current trends regarding dual functional radar communi- multi-beamgenerationwithGolay-codedOFDMwaveforms cation (DFRC) systems which lead to an integrated sensing andsubbands', '(13) herein as the subarrayed MIMO (SMIMO) radars, such as theFPMIMOradar,rangesbetweentwoextremeconfiguraNotation ⊗ denotes the Kronecker product operator, tions, namely the PA and the MIMO radar', '. [21] Z. Xu and A. Petropulu, ‘‘A bandwidth efficient dual-function radar communication system based on a MIMO radar using OFDM waveforms,’’ IEEE Trans. Signal Process., vol. 71, pp.401–416, 2023, doi: 10.1109/TSP.2023.3241779. [22] U.B.SaracandG.M.Guvensen,‘‘Knowledge-aidedandadaptivebeamsquintawareMIMO-OFDMradardetectorsforISAC,’’IEEETrans.Commun.,earlyaccess,May8,2025,doi:10.1109/TCOMM.2025.3568219. [23] M. Schurwanz, J. Mietzner, and P. A', '. It identifies the direction of an echo by antennaelement.Whilein[20]anewconceptofmultibeam meansofthescanningbeam,whereastherangedetectionis radarsisreported,whichcombinestheversatilityofOFDM done by observing the delay or by applying the correlation waveform, the orthogonal Golay codes and the CC-MIMO process. However, the beam scanning limits the time on architecture', '. CC-OFDM MIMO radar waveform design which the degree of orthogonality can be further improved by is discussed in this paper is not a CP based radar, the assigningdifferentsubbands,fortheneighboringbeams,and transmittersaretransmittingmultipleorthogonalsymbolsin thesamesubbandcanbereusedforthenon-adjacentbeams. serieswithoutanyguardtimeintervalbetweenthesymbols. The interference among these co-channel beams can be The symbol series are orthogonal to each other, hence VOLUME13,2025 109895', '. The design includes the with a faceted view. Such radars may find applications in system architecture and parameters, the waveform design surveillance[9],[10],[11],[12],automotive[13],[14],[15], and the scheduling of Golay codes and subbands. The imaging[16],[17],etc.Generationofmultiplesimultaneous transmitter architecture that adopts software-defined radar orthogonal beams can be done in several ways', '. INDEX TERMS Circulating-codes, Golay-codes, interference, MIMO-radar, multibeam, OFDM-radar, sub-band,surveillance. I. INTRODUCTION Manyradarapplicationsdemandscanningcapabilitytoallow The associate editor coordinating the review of this manuscript and coverage over a range of angular direction, such as those approvingitforpublicationwasXueboZhang . forsurveillance,vehicular,weathermonitoring,imaging,and 2025TheAuthors.ThisworkislicensedunderaCreativeCommonsAttribution4.0License']","The design of multibeam radars includes specific waveform design parameters that are crucial for applications in surveillance systems (Kuswidiastuti et al., 2025).","The beams and the CC-OFDM symbols are Golay VOLUME 13, 2025 109897 D. Kuswidiastuti et al.: Receiver Processing of the Multibeam Azimuth Scanning CC-OFDM-MIMO Radar coded and transmitted using the allocated sub-band following a specific schedule that is well known by the transmitter and receiver. The neighboring beam must use different sub-band and sub-band reuse is allowed for beams that are at least 10◦ in separation. In order to generate CC-OFDM waveform, additional phase steering β(fn,a,b, (cid:49)tb) is given to the specified OFDM sub-band frequencies of beam b to provide phase difference between the transmit elements for creating the beam b. Circulating code in LFM MIMO radar which is discussed in , obtain this phase difference by transmitting coherent signals",0.6666666666666666,0.9327011117320064
"FOR LONG-RANGE SURVEILLANCE A. REQUIREMENTS A. REQUIREMENTS To elucidate the novel concept and detailed implementation of the CC-OFDM MIMO radar, we will take a surveillance radar design as an example for analyses in the subsequent sections. The CC-OFDM MIMO radar waveform designed herein is based on the requirement of surveillance radars used in coastal areas, where the target of interest are ships and small aircrafts in the area within 180 km from the radar site. OFDM signals with subcarrier spacing of 10 KHz will give a maximum unambiguous range of 15 km. In order to extend the maximum unambiguous range of the radar up to 180 km, 12 orthogonal OFDM symbols with symbol time of 0.1 ms are transmitted in","['. INDEX TERMS Circulating-codes, Golay-codes, interference, MIMO-radar, multibeam, OFDM-radar, sub-band,surveillance. I. INTRODUCTION Manyradarapplicationsdemandscanningcapabilitytoallow The associate editor coordinating the review of this manuscript and coverage over a range of angular direction, such as those approvingitforpublicationwasXueboZhang . forsurveillance,vehicular,weathermonitoring,imaging,and 2025TheAuthors.ThisworkislicensedunderaCreativeCommonsAttribution4.0License', '. DigitalObjectIdentifier10.1109/ACCESS.2025.3581842 Receiver Processing of the Multibeam Azimuth Scanning CC-OFDM-MIMO Radar DEVYKUSWIDIASTUTI 1,(Member,IEEE),L.P.LIGTHART 2,(LifeFellow,IEEE), GAMANTYOHENDRANTORO1,(SeniorMember,IEEE),TITIEKSURYANI 1,(Member,IEEE), PRASETIYONOHARIMUKTI 1,(Member,IEEE),ANDYUYUWAHYU 3,(Member,IEEE) 1DepartmentofElectricalEngineering,InstitutTeknologiSepuluhNopember,Surabaya60111,Indonesia 2IRCTR,DelftUniversityofTechnology(TUDelft),2628CDDelft,TheNetherlands(Retired)', '. [21] Z. Xu and A. Petropulu, ‘‘A bandwidth efficient dual-function radar communication system based on a MIMO radar using OFDM waveforms,’’ IEEE Trans. Signal Process., vol. 71, pp.401–416, 2023, doi: 10.1109/TSP.2023.3241779. [22] U.B.SaracandG.M.Guvensen,‘‘Knowledge-aidedandadaptivebeamsquintawareMIMO-OFDMradardetectorsforISAC,’’IEEETrans.Commun.,earlyaccess,May8,2025,doi:10.1109/TCOMM.2025.3568219. [23] M. Schurwanz, J. Mietzner, and P. A', '. CC-OFDM MIMO radar waveform design which the degree of orthogonality can be further improved by is discussed in this paper is not a CP based radar, the assigningdifferentsubbands,fortheneighboringbeams,and transmittersaretransmittingmultipleorthogonalsymbolsin thesamesubbandcanbereusedforthenon-adjacentbeams. serieswithoutanyguardtimeintervalbetweenthesymbols. The interference among these co-channel beams can be The symbol series are orthogonal to each other, hence VOLUME13,2025 109895', '. [26] Y. Liu, G. Liao, Z. Yang, and J. Xu, ‘‘Design of integrated radar includinginvestigationintomillimeter-wavepropagation,channelmodeling and communication system based on MIMO-OFDM waveform,’’ J. andwirelesssystemsfortropicalareas,studiesonHFskywavechannelsand Syst. Eng. Electron., vol. 28, no. 4, pp.669–680, Aug. 2017, doi: communicationsinequatorialregions,andthedevelopmentofradararray 10.21629/JSEE.2017.04.06. andsignalprocessing. VOLUME13,2025 109905', '. needed. Multibeam radars that continuously transmit concurrent The principles of CC-OFDM MIMO radars have been multiple beams are able to simultaneously look at different discussed in [20] by way of an exemplary radar design for directions, for instance to cover a wide angular swath a long-range surveillance mission. The design includes the with a faceted view', '(13) herein as the subarrayed MIMO (SMIMO) radars, such as theFPMIMOradar,rangesbetweentwoextremeconfiguraNotation ⊗ denotes the Kronecker product operator, tions, namely the PA and the MIMO radar', '. INDEX TERMS MIMO radar, parameter estimation, phased array radar, probability of detection, target detection. I. INTRODUCTION for biomedical engineering, macro-scale radars on radioMulti-antenna radar systems have been known and used in astronomy, and so on [4], [5]', '. Zhang, Y. Huang, J. Heredia-Juesas, and J. A. Martinez-Lorenzo, Teknologi Sepuluh Nopember (ITS), Surabaya, ‘‘Software-defined millimeter-wave multistatic radar with space-time- Indonesia, in 1992, and the M.Eng. and Ph.D. coded orthogonal frequency-division multiplexing,’’ IEEE Trans. degrees in electrical engineering from Carleton Microw.TheoryTechn.,vol.70,no.3,pp.1620–1629,Mar.2022,doi: University, Ottawa, ON, Canada, in 1997 and 10.1109/TMTT.2021.3134182', '. REVIEWONMAXIMUMNUMBEROFDETECTED has been described by [13]. In a MIMO radar, in which TARGETSFORMIMORADAR K elements in the Tx array transmit orthogonal waveforms For clarity in discussions that follow, herein we provide a andLelementsintheRxarrayreceiveechosignalsfromtar- shortreviewoftheperformanceofMIMOradarsinthemaxgetsoperatingindependently,theVAdimensionisexpressed imum number of detected targets, mostly taken from [13]']","The principles of CC-OFDM MIMO radars are exemplified in a design for long-range surveillance applications, highlighting their capability to cover extensive areas effectively.","much defining the maximum unambiguous range of the radar system. CC-OFDM MIMO radar waveform design which is discussed in this paper is not a CP based radar, the transmitters are transmitting multiple orthogonal symbols in series without any guard time interval between the symbols. to each other, hence The symbol series are orthogonal VOLUME 13, 2025 109895 D. Kuswidiastuti et al.: Receiver Processing of the Multibeam Azimuth Scanning CC-OFDM-MIMO Radar receivers know how to distinguish the symbols received, and this could extend the maximum unambiguous range of the radar. The contributions of this paper are described as follow: 1) This paper describes the receiver processing of multi- beam CC-OFDM MIMO Radar which is designed for long-range radar surveillance application. The",0.5,0.9415465164652627
"of 10 KHz will give a maximum unambiguous range of 15 km. In order to extend the maximum unambiguous range of the radar up to 180 km, 12 orthogonal OFDM symbols with symbol time of 0.1 ms are transmitted in series. The 12 OFDM signals are transmitted in quasi-continuous way, since the transmitter is idle during the reception period within one repetition time interval. The CC-OFDM MIMO radar system and waveform speciﬁcations are described in Table 1 In this case, each sub band which consists of 256 subcarriers are used for beam- forming; that leads to 2.56 MHz bandwidth and results in a range resolution of 60 meters in each beam. The OFDM signal period is 0.1 ms and the","['. DigitalObjectIdentifier10.1109/ACCESS.2025.3581842 Receiver Processing of the Multibeam Azimuth Scanning CC-OFDM-MIMO Radar DEVYKUSWIDIASTUTI 1,(Member,IEEE),L.P.LIGTHART 2,(LifeFellow,IEEE), GAMANTYOHENDRANTORO1,(SeniorMember,IEEE),TITIEKSURYANI 1,(Member,IEEE), PRASETIYONOHARIMUKTI 1,(Member,IEEE),ANDYUYUWAHYU 3,(Member,IEEE) 1DepartmentofElectricalEngineering,InstitutTeknologiSepuluhNopember,Surabaya60111,Indonesia 2IRCTR,DelftUniversityofTechnology(TUDelft),2628CDDelft,TheNetherlands(Retired)', '. [21] Z. Xu and A. Petropulu, ‘‘A bandwidth efficient dual-function radar communication system based on a MIMO radar using OFDM waveforms,’’ IEEE Trans. Signal Process., vol. 71, pp.401–416, 2023, doi: 10.1109/TSP.2023.3241779. [22] U.B.SaracandG.M.Guvensen,‘‘Knowledge-aidedandadaptivebeamsquintawareMIMO-OFDMradardetectorsforISAC,’’IEEETrans.Commun.,earlyaccess,May8,2025,doi:10.1109/TCOMM.2025.3568219. [23] M. Schurwanz, J. Mietzner, and P. A', '. needed. Multibeam radars that continuously transmit concurrent The principles of CC-OFDM MIMO radars have been multiple beams are able to simultaneously look at different discussed in [20] by way of an exemplary radar design for directions, for instance to cover a wide angular swath a long-range surveillance mission. The design includes the with a faceted view', '. CC-OFDM MIMO radar waveform design which the degree of orthogonality can be further improved by is discussed in this paper is not a CP based radar, the assigningdifferentsubbands,fortheneighboringbeams,and transmittersaretransmittingmultipleorthogonalsymbolsin thesamesubbandcanbereusedforthenon-adjacentbeams. serieswithoutanyguardtimeintervalbetweenthesymbols. The interference among these co-channel beams can be The symbol series are orthogonal to each other, hence VOLUME13,2025 109895', '. [26] Y. Liu, G. Liao, Z. Yang, and J. Xu, ‘‘Design of integrated radar includinginvestigationintomillimeter-wavepropagation,channelmodeling and communication system based on MIMO-OFDM waveform,’’ J. andwirelesssystemsfortropicalareas,studiesonHFskywavechannelsand Syst. Eng. Electron., vol. 28, no. 4, pp.669–680, Aug. 2017, doi: communicationsinequatorialregions,andthedevelopmentofradararray 10.21629/JSEE.2017.04.06. andsignalprocessing. VOLUME13,2025 109905', '. INDEX TERMS Circulating-codes, Golay-codes, interference, MIMO-radar, multibeam, OFDM-radar, sub-band,surveillance. I. INTRODUCTION Manyradarapplicationsdemandscanningcapabilitytoallow The associate editor coordinating the review of this manuscript and coverage over a range of angular direction, such as those approvingitforpublicationwasXueboZhang . forsurveillance,vehicular,weathermonitoring,imaging,and 2025TheAuthors.ThisworkislicensedunderaCreativeCommonsAttribution4.0License', '(13) herein as the subarrayed MIMO (SMIMO) radars, such as theFPMIMOradar,rangesbetweentwoextremeconfiguraNotation ⊗ denotes the Kronecker product operator, tions, namely the PA and the MIMO radar', '. surveillanceradarspecificationinTable1asanexample.The 2) AtthereceiverofaCC-OFDMMIMOradar,process- discussionstartswithabriefintroductiononthesurveillance ing in the digital signal processor is performed later, radarspecificationsinSectionII,followedbydescriptionof afterallechoesarrivefromvariousdirectionsoneach the receiver processing concept of the CC-OFDM MIMO array element and the corresponding RF chain', '. However, all of the above thereceiverprocessingofCC-OFDM-MIMOradar,whichis mentioned methods have problems in beam limitation and differentfromthoseinothertypesofOFDMMIMOradarsor cost. other multi-TRM radars due to the nature of the orthogonal Current trends regarding dual functional radar communi- multi-beamgenerationwithGolay-codedOFDMwaveforms cation (DFRC) systems which lead to an integrated sensing andsubbands', '. Zhang, Y. Huang, J. Heredia-Juesas, and J. A. Martinez-Lorenzo, Teknologi Sepuluh Nopember (ITS), Surabaya, ‘‘Software-defined millimeter-wave multistatic radar with space-time- Indonesia, in 1992, and the M.Eng. and Ph.D. coded orthogonal frequency-division multiplexing,’’ IEEE Trans. degrees in electrical engineering from Carleton Microw.TheoryTechn.,vol.70,no.3,pp.1620–1629,Mar.2022,doi: University, Ottawa, ON, Canada, in 1997 and 10.1109/TMTT.2021.3134182']","The CC-OFDM MIMO radar system utilizes multiple orthogonal symbols transmitted in series, enhancing the degree of orthogonality by assigning different subbands for neighboring beams (Devykuswidiasuti et al., 2025).","much defining the maximum unambiguous range of the radar system. CC-OFDM MIMO radar waveform design which is discussed in this paper is not a CP based radar, the transmitters are transmitting multiple orthogonal symbols in series without any guard time interval between the symbols. to each other, hence The symbol series are orthogonal VOLUME 13, 2025 109895 D. Kuswidiastuti et al.: Receiver Processing of the Multibeam Azimuth Scanning CC-OFDM-MIMO Radar receivers know how to distinguish the symbols received, and this could extend the maximum unambiguous range of the radar. The contributions of this paper are described as follow: 1) This paper describes the receiver processing of multi- beam CC-OFDM MIMO Radar which is designed for long-range radar surveillance application. The",0.6666666666666666,0.9288302273453202
"it can be seen from (11) that the phase correction, Cn,p,a,b is given to the n-th subcarrier frequency of the OFDM waveform generated for the p-th transmitter for beamforming to θb of symbol a. The Taylor coefﬁcient for sidelobe suppression Ip in (7) is also digitally generated directly from the WG. It is for these two reasons that the CC-OFDM waveforms must be generated simultane- ously per row of the azimuth antenna elements. It is therefore necessary to implement a digital WG at each transmitter with programmability feature, since different radar applications might require different parameters for the beams, waveforms, symbols and frames of symbols. Consequently, the adoption of the concept of software-deﬁned radar (SDR) platform is advantageous and instrumental","['. The design includes the with a faceted view. Such radars may find applications in system architecture and parameters, the waveform design surveillance[9],[10],[11],[12],automotive[13],[14],[15], and the scheduling of Golay codes and subbands. The imaging[16],[17],etc.Generationofmultiplesimultaneous transmitter architecture that adopts software-defined radar orthogonal beams can be done in several ways', '. [26] Y. Liu, G. Liao, Z. Yang, and J. Xu, ‘‘Design of integrated radar includinginvestigationintomillimeter-wavepropagation,channelmodeling and communication system based on MIMO-OFDM waveform,’’ J. andwirelesssystemsfortropicalareas,studiesonHFskywavechannelsand Syst. Eng. Electron., vol. 28, no. 4, pp.669–680, Aug. 2017, doi: communicationsinequatorialregions,andthedevelopmentofradararray 10.21629/JSEE.2017.04.06. andsignalprocessing. VOLUME13,2025 109905', '. isillustratedashavingaradarbeamthatcoversaspanofthe In this manner, the FPMIMO radar can achieve a desired azimuthangle', '. [21] Z. Xu and A. Petropulu, ‘‘A bandwidth efficient dual-function radar communication system based on a MIMO radar using OFDM waveforms,’’ IEEE Trans. Signal Process., vol. 71, pp.401–416, 2023, doi: 10.1109/TSP.2023.3241779. [22] U.B.SaracandG.M.Guvensen,‘‘Knowledge-aidedandadaptivebeamsquintawareMIMO-OFDMradardetectorsforISAC,’’IEEETrans.Commun.,earlyaccess,May8,2025,doi:10.1109/TCOMM.2025.3568219. [23] M. Schurwanz, J. Mietzner, and P. A', '. DigitalObjectIdentifier10.1109/ACCESS.2025.3581842 Receiver Processing of the Multibeam Azimuth Scanning CC-OFDM-MIMO Radar DEVYKUSWIDIASTUTI 1,(Member,IEEE),L.P.LIGTHART 2,(LifeFellow,IEEE), GAMANTYOHENDRANTORO1,(SeniorMember,IEEE),TITIEKSURYANI 1,(Member,IEEE), PRASETIYONOHARIMUKTI 1,(Member,IEEE),ANDYUYUWAHYU 3,(Member,IEEE) 1DepartmentofElectricalEngineering,InstitutTeknologiSepuluhNopember,Surabaya60111,Indonesia 2IRCTR,DelftUniversityofTechnology(TUDelft),2628CDDelft,TheNetherlands(Retired)', '. This was a programmable software-defined-radio (SDR) platform to achieved by the ability of the FPMIMO radar to exploit the meetspecificrequirementsforvariousradarapplicationsby number of overlapped subarrays on each of the Tx and Rx exploitingthecapabilityofSDRinperformingthefunctions arrays, i.e., M and N, so that orthogonal waveforms can be of devices used in conventional Tx and Rx, such as mixers, transmittedby1≤ M ≤ K subarraysandechosignalsfrom filters,andothers,inthedigitaldomain', '. [12] A.S.Kumar,N.Unnikrishnan,R.Raghu,andR.Rajesh,‘‘FPGAbased OFDMMIMOtransmitbeamformerformulti-functionalsoftwaredefined radars,’’inProc.IEEESpace,Aerosp.DefenceConf.(SPACE),Bangalore, India,Jul.2024,pp.527–531,doi:10.1109/space63117.2024.10668277. [13] J.MoghaddasiandK.Wu,‘‘Multifunctionaltransceiverforfutureradar sensing and radio communicating data-fusion platform,’’ IEEE Access, L.P.LIGTHART(LifeFellow,IEEE)wasbornin vol.4,pp.818–838,2016,doi:10.1109/ACCESS.2016.2530979', '. However, all of the above thereceiverprocessingofCC-OFDM-MIMOradar,whichis mentioned methods have problems in beam limitation and differentfromthoseinothertypesofOFDMMIMOradarsor cost. other multi-TRM radars due to the nature of the orthogonal Current trends regarding dual functional radar communi- multi-beamgenerationwithGolay-codedOFDMwaveforms cation (DFRC) systems which lead to an integrated sensing andsubbands', '. In the works on the PMIMO radar in [22]–[29], The evaluation on the detection performance in terms of the improvement in radar performance factors such as theprobabilityofdetectionandtheprobabilityoffalsealarm spatial resolution, parameter identifiability, transmit-receive reportedhereinisanextensionofstudyby[32].Theseparam(T-R)gain,andsignal-to-interference-plus-noisepowerratio etersareevaluatedbasedonseveralaspectssuchastheeffect (SINR)hasbeenreported.Theresultsofinvestigationsin[29]', '. III. RADARANTENNA The SIL Doppler radar antenna is specifically designed for a 3−8 GHz bandwidth, featuring a smaller beamwidth of less ◦ than17 .Thisdesignincorporateshighgain,narrowbeamwidth, sensitivity,andexcellentefficiencytooptimizethepowerofthe radarsystem.Byfocusingthetransmittedandreceivedelectro- accuratelyregulatetheradiationpatternofeachelement,andthe magneticwavesinaspecificdirection,itmaximizesthesystem’s overallmatrixcontributestosuperioroverallperformance[37]. capabilities']","The simultaneous generation of CC-OFDM waveforms is essential for effective beamforming and waveform design in multibeam radar systems (Liu et al., 2023).","waveform will be transmitted through. Hence, instead of just have one DWG at the transmitter side like a common conventional phased array radar, CC-OFDM Radar will need DWGs as many as the number of the transmit array elements needed for digital beamforming purposes . The digital baseband OFDM signal of symbol a in beam b is coded with Golay codes can be defined as: sa,b(k) = Nc−1 n=0 ga,b,nej2πfn,a,b(kTs−(a−1)T0) for [0 ≤ kTs − (a − 1)T0 ≤ T0) (1) where a = [1, 2, . . . , Ns], b = [−(Nb − 1)/2, . . . , 0, . . . , (Nb − 1)/2], n = 0, 1, . . . , Nc − 1, and k",0.0,0.9421608761531989
"xIF p,a,b, will be converted to analog signals through a DAC device of the p-th transmitter. Using the same procedure, the 63 beam signals are generated simultaneously by the digital WG at each transmit element. For a good operational performance of CC OFDM MIMO radar an important and crucial note should be made now, that is: Transmitting multiple symbols in series and in parallel contributing simultaneously to multiple beams effective in various range intervals, the quasi - CW transmission neces- sitates that the CC OFDM symbols should be orthogonal in time, frequency and code. In the following the orthogonality aspects are detailed. • Single CC OFDM symbol In this example, one symbol of CC-OFDM waveform contributes to 63 beam signals.","['. DigitalObjectIdentifier10.1109/ACCESS.2025.3581842 Receiver Processing of the Multibeam Azimuth Scanning CC-OFDM-MIMO Radar DEVYKUSWIDIASTUTI 1,(Member,IEEE),L.P.LIGTHART 2,(LifeFellow,IEEE), GAMANTYOHENDRANTORO1,(SeniorMember,IEEE),TITIEKSURYANI 1,(Member,IEEE), PRASETIYONOHARIMUKTI 1,(Member,IEEE),ANDYUYUWAHYU 3,(Member,IEEE) 1DepartmentofElectricalEngineering,InstitutTeknologiSepuluhNopember,Surabaya60111,Indonesia 2IRCTR,DelftUniversityofTechnology(TUDelft),2628CDDelft,TheNetherlands(Retired)', '(13) herein as the subarrayed MIMO (SMIMO) radars, such as theFPMIMOradar,rangesbetweentwoextremeconfiguraNotation ⊗ denotes the Kronecker product operator, tions, namely the PA and the MIMO radar', '. The summation of outputs from 1) Thispaperdescribesthereceiverprocessingofmulti- individual receive modules across the array provides beam CC-OFDM MIMO Radar which is designed the array gain and serves to increase the receive SNR for long-range radar surveillance application. The for each beam', '. [21] Z. Xu and A. Petropulu, ‘‘A bandwidth efficient dual-function radar communication system based on a MIMO radar using OFDM waveforms,’’ IEEE Trans. Signal Process., vol. 71, pp.401–416, 2023, doi: 10.1109/TSP.2023.3241779. [22] U.B.SaracandG.M.Guvensen,‘‘Knowledge-aidedandadaptivebeamsquintawareMIMO-OFDMradardetectorsforISAC,’’IEEETrans.Commun.,earlyaccess,May8,2025,doi:10.1109/TCOMM.2025.3568219. [23] M. Schurwanz, J. Mietzner, and P. A', '. CC-OFDM MIMO radar waveform design which the degree of orthogonality can be further improved by is discussed in this paper is not a CP based radar, the assigningdifferentsubbands,fortheneighboringbeams,and transmittersaretransmittingmultipleorthogonalsymbolsin thesamesubbandcanbereusedforthenon-adjacentbeams. serieswithoutanyguardtimeintervalbetweenthesymbols. The interference among these co-channel beams can be The symbol series are orthogonal to each other, hence VOLUME13,2025 109895', '. INDEX TERMS Circulating-codes, Golay-codes, interference, MIMO-radar, multibeam, OFDM-radar, sub-band,surveillance. I. INTRODUCTION Manyradarapplicationsdemandscanningcapabilitytoallow The associate editor coordinating the review of this manuscript and coverage over a range of angular direction, such as those approvingitforpublicationwasXueboZhang . forsurveillance,vehicular,weathermonitoring,imaging,and 2025TheAuthors.ThisworkislicensedunderaCreativeCommonsAttribution4.0License', '. However, all of the above thereceiverprocessingofCC-OFDM-MIMOradar,whichis mentioned methods have problems in beam limitation and differentfromthoseinothertypesofOFDMMIMOradarsor cost. other multi-TRM radars due to the nature of the orthogonal Current trends regarding dual functional radar communi- multi-beamgenerationwithGolay-codedOFDMwaveforms cation (DFRC) systems which lead to an integrated sensing andsubbands', '. needed. Multibeam radars that continuously transmit concurrent The principles of CC-OFDM MIMO radars have been multiple beams are able to simultaneously look at different discussed in [20] by way of an exemplary radar design for directions, for instance to cover a wide angular swath a long-range surveillance mission. The design includes the with a faceted view', '. In the works on the PMIMO radar in [22]–[29], The evaluation on the detection performance in terms of the improvement in radar performance factors such as theprobabilityofdetectionandtheprobabilityoffalsealarm spatial resolution, parameter identifiability, transmit-receive reportedhereinisanextensionofstudyby[32].Theseparam(T-R)gain,andsignal-to-interference-plus-noisepowerratio etersareevaluatedbasedonseveralaspectssuchastheeffect (SINR)hasbeenreported.Theresultsofinvestigationsin[29]', '. [26] Y. Liu, G. Liao, Z. Yang, and J. Xu, ‘‘Design of integrated radar includinginvestigationintomillimeter-wavepropagation,channelmodeling and communication system based on MIMO-OFDM waveform,’’ J. andwirelesssystemsfortropicalareas,studiesonHFskywavechannelsand Syst. Eng. Electron., vol. 28, no. 4, pp.669–680, Aug. 2017, doi: communicationsinequatorialregions,andthedevelopmentofradararray 10.21629/JSEE.2017.04.06. andsignalprocessing. VOLUME13,2025 109905']","The CC-OFDM MIMO radar waveform design allows for the transmission of multiple orthogonal symbols in series without guard time, enhancing the degree of orthogonality among beams (Devykuswidiastuti et al., 2025).","much defining the maximum unambiguous range of the radar system. CC-OFDM MIMO radar waveform design which is discussed in this paper is not a CP based radar, the transmitters are transmitting multiple orthogonal symbols in series without any guard time interval between the symbols. to each other, hence The symbol series are orthogonal VOLUME 13, 2025 109895 D. Kuswidiastuti et al.: Receiver Processing of the Multibeam Azimuth Scanning CC-OFDM-MIMO Radar receivers know how to distinguish the symbols received, and this could extend the maximum unambiguous range of the radar. The contributions of this paper are described as follow: 1) This paper describes the receiver processing of multi- beam CC-OFDM MIMO Radar which is designed for long-range radar surveillance application. The",1.0,0.9280631359980259
"VII. THE COUPLING BETWEEN CC-OFDM MULTI-BEAMS VII. THE COUPLING BETWEEN CC-OFDM MULTI-BEAMS A. THE COUPLING BETWEEN NEIGHBORING BEAMS A. THE COUPLING BETWEEN NEIGHBORING BEAMS This section analyzes the coupling between beams which are transmitted simultaneously over the same period of sym- bol duration. Analysis is done to the beams transmitted on the ﬁrst symbol period, with the scheduling as described in Table 2. It is necessary to make sure that the coupling between the multi-beam CC-OFDM which are transmitted simultaneously using limited bandwidth are low to avoid the probability of false alarm on radar receiver. In this paper, coupling analysis are done for near broadside and near edge beams (i.e., beams that spatially close to each other) and for co-channel","['. INDEX TERMS Circulating-codes, Golay-codes, interference, MIMO-radar, multibeam, OFDM-radar, sub-band,surveillance. I. INTRODUCTION Manyradarapplicationsdemandscanningcapabilitytoallow The associate editor coordinating the review of this manuscript and coverage over a range of angular direction, such as those approvingitforpublicationwasXueboZhang . forsurveillance,vehicular,weathermonitoring,imaging,and 2025TheAuthors.ThisworkislicensedunderaCreativeCommonsAttribution4.0License', '. In the works on the PMIMO radar in [22]–[29], The evaluation on the detection performance in terms of the improvement in radar performance factors such as theprobabilityofdetectionandtheprobabilityoffalsealarm spatial resolution, parameter identifiability, transmit-receive reportedhereinisanextensionofstudyby[32].Theseparam(T-R)gain,andsignal-to-interference-plus-noisepowerratio etersareevaluatedbasedonseveralaspectssuchastheeffect (SINR)hasbeenreported.Theresultsofinvestigationsin[29]', '. DigitalObjectIdentifier10.1109/ACCESS.2025.3581842 Receiver Processing of the Multibeam Azimuth Scanning CC-OFDM-MIMO Radar DEVYKUSWIDIASTUTI 1,(Member,IEEE),L.P.LIGTHART 2,(LifeFellow,IEEE), GAMANTYOHENDRANTORO1,(SeniorMember,IEEE),TITIEKSURYANI 1,(Member,IEEE), PRASETIYONOHARIMUKTI 1,(Member,IEEE),ANDYUYUWAHYU 3,(Member,IEEE) 1DepartmentofElectricalEngineering,InstitutTeknologiSepuluhNopember,Surabaya60111,Indonesia 2IRCTR,DelftUniversityofTechnology(TUDelft),2628CDDelft,TheNetherlands(Retired)', '(13) herein as the subarrayed MIMO (SMIMO) radars, such as theFPMIMOradar,rangesbetweentwoextremeconfiguraNotation ⊗ denotes the Kronecker product operator, tions, namely the PA and the MIMO radar', '. The summation of outputs from 1) Thispaperdescribesthereceiverprocessingofmulti- individual receive modules across the array provides beam CC-OFDM MIMO Radar which is designed the array gain and serves to increase the receive SNR for long-range radar surveillance application. The for each beam', 'processed transmit and receive time schedule of CC-OFDM radar is further to obtain the beam information', '. CC-OFDM MIMO radar waveform design which the degree of orthogonality can be further improved by is discussed in this paper is not a CP based radar, the assigningdifferentsubbands,fortheneighboringbeams,and transmittersaretransmittingmultipleorthogonalsymbolsin thesamesubbandcanbereusedforthenon-adjacentbeams. serieswithoutanyguardtimeintervalbetweenthesymbols. The interference among these co-channel beams can be The symbol series are orthogonal to each other, hence VOLUME13,2025 109895', '. [21] Z. Xu and A. Petropulu, ‘‘A bandwidth efficient dual-function radar communication system based on a MIMO radar using OFDM waveforms,’’ IEEE Trans. Signal Process., vol. 71, pp.401–416, 2023, doi: 10.1109/TSP.2023.3241779. [22] U.B.SaracandG.M.Guvensen,‘‘Knowledge-aidedandadaptivebeamsquintawareMIMO-OFDMradardetectorsforISAC,’’IEEETrans.Commun.,earlyaccess,May8,2025,doi:10.1109/TCOMM.2025.3568219. [23] M. Schurwanz, J. Mietzner, and P. A', '. However, all of the above thereceiverprocessingofCC-OFDM-MIMOradar,whichis mentioned methods have problems in beam limitation and differentfromthoseinothertypesofOFDMMIMOradarsor cost. other multi-TRM radars due to the nature of the orthogonal Current trends regarding dual functional radar communi- multi-beamgenerationwithGolay-codedOFDMwaveforms cation (DFRC) systems which lead to an integrated sensing andsubbands', '. needed. Multibeam radars that continuously transmit concurrent The principles of CC-OFDM MIMO radars have been multiple beams are able to simultaneously look at different discussed in [20] by way of an exemplary radar design for directions, for instance to cover a wide angular swath a long-range surveillance mission. The design includes the with a faceted view']","The interference among co-channel beams can be mitigated by assigning different subbands to neighboring beams, allowing for simultaneous transmission of multiple orthogonal symbols in the same subband (Kuswidiastuti et al., 2025).","together with transmit scheduling to avoid transmit receive coupling. The receive scheduling is also related to the time scheduling of the correlation between symbols, which is an important stage in the beam and range processing. The transmit and receive time schedule of CC-OFDM radar is described in Fig. 4. The receive scheduling is very important, especially in a multiple target scheme. The echo signals caused by two or more targets at different ranges (i.e., one target is near to the radar, and the other is far) could cause range ambiguity. The clock synchronization between the multiple transmitters and the multiple receivers of CC-OFDM radars are very crucial to guarantee that the receiver can give the accurate detection. It can be",0.6666666666666666,0.9399524469331031
"beam isolation, the range resolution, the Doppler resolution, those parameters can be modiﬁed and optimized based on the characteristic of the target of interest. Some of the radar speciﬁcations that can be achieved by modifying some of the CC-OFDM waveform parameters are as follows: • The maximum unambiguous range for conventional OFDM radar is mainly limited by the spacing between the OFDM subcarriers. However, one could extend the maximum unambiguous range of the radar by send- ing multiple successive orthogonal CC-OFDM symbols containing orthogonal Golay codes. How many symbols that must be sent will depend on how far the maximum unambiguous range is that the application requires. • The maximum velocity depends on the frequency spac- ing between the OFDM","['. [21] Z. Xu and A. Petropulu, ‘‘A bandwidth efficient dual-function radar communication system based on a MIMO radar using OFDM waveforms,’’ IEEE Trans. Signal Process., vol. 71, pp.401–416, 2023, doi: 10.1109/TSP.2023.3241779. [22] U.B.SaracandG.M.Guvensen,‘‘Knowledge-aidedandadaptivebeamsquintawareMIMO-OFDMradardetectorsforISAC,’’IEEETrans.Commun.,earlyaccess,May8,2025,doi:10.1109/TCOMM.2025.3568219. [23] M. Schurwanz, J. Mietzner, and P. A', '. INDEX TERMS Circulating-codes, Golay-codes, interference, MIMO-radar, multibeam, OFDM-radar, sub-band,surveillance. I. INTRODUCTION Manyradarapplicationsdemandscanningcapabilitytoallow The associate editor coordinating the review of this manuscript and coverage over a range of angular direction, such as those approvingitforpublicationwasXueboZhang . forsurveillance,vehicular,weathermonitoring,imaging,and 2025TheAuthors.ThisworkislicensedunderaCreativeCommonsAttribution4.0License', '. andcommunication(ISAC)systemsmotivatefurthermorethe There are previous research on radar waveform for ISAC use of OFDM for radar waveform. Research on finding the purposes[25],[26]whichdiscussedaboutcyclicprefix(CP) perfect waveform that can serve for both function is still an based OFDM waveform and how the CP is very much ongoingresearchuntilnowadays[20],[21],[22],[23].When defining the maximum unambiguous range of the radar theavailablebandwidthcanbedividedintoseveralsubbands, system', '. This means that the with the Golay codes which corresponds to a specific rangeresolutionwillbe60meter.TheCC-OFDMindividual beamsymbolasstatedintheschedule.Thebeautyof symbol duration is 0.1 ms, and the transmitters transmit a the receiver processing of CC-OFDM MIMO radar is frame consisting of 12 consecutive symbols in series', '. In the works on the PMIMO radar in [22]–[29], The evaluation on the detection performance in terms of the improvement in radar performance factors such as theprobabilityofdetectionandtheprobabilityoffalsealarm spatial resolution, parameter identifiability, transmit-receive reportedhereinisanextensionofstudyby[32].Theseparam(T-R)gain,andsignal-to-interference-plus-noisepowerratio etersareevaluatedbasedonseveralaspectssuchastheeffect (SINR)hasbeenreported.Theresultsofinvestigationsin[29]', '. [26] Y. Liu, G. Liao, Z. Yang, and J. Xu, ‘‘Design of integrated radar includinginvestigationintomillimeter-wavepropagation,channelmodeling and communication system based on MIMO-OFDM waveform,’’ J. andwirelesssystemsfortropicalareas,studiesonHFskywavechannelsand Syst. Eng. Electron., vol. 28, no. 4, pp.669–680, Aug. 2017, doi: communicationsinequatorialregions,andthedevelopmentofradararray 10.21629/JSEE.2017.04.06. andsignalprocessing. VOLUME13,2025 109905', '. CC-OFDM MIMO radar waveform design which the degree of orthogonality can be further improved by is discussed in this paper is not a CP based radar, the assigningdifferentsubbands,fortheneighboringbeams,and transmittersaretransmittingmultipleorthogonalsymbolsin thesamesubbandcanbereusedforthenon-adjacentbeams. serieswithoutanyguardtimeintervalbetweenthesymbols. The interference among these co-channel beams can be The symbol series are orthogonal to each other, hence VOLUME13,2025 109895', '. DigitalObjectIdentifier10.1109/ACCESS.2025.3581842 Receiver Processing of the Multibeam Azimuth Scanning CC-OFDM-MIMO Radar DEVYKUSWIDIASTUTI 1,(Member,IEEE),L.P.LIGTHART 2,(LifeFellow,IEEE), GAMANTYOHENDRANTORO1,(SeniorMember,IEEE),TITIEKSURYANI 1,(Member,IEEE), PRASETIYONOHARIMUKTI 1,(Member,IEEE),ANDYUYUWAHYU 3,(Member,IEEE) 1DepartmentofElectricalEngineering,InstitutTeknologiSepuluhNopember,Surabaya60111,Indonesia 2IRCTR,DelftUniversityofTechnology(TUDelft),2628CDDelft,TheNetherlands(Retired)', '. The design includes the with a faceted view. Such radars may find applications in system architecture and parameters, the waveform design surveillance[9],[10],[11],[12],automotive[13],[14],[15], and the scheduling of Golay codes and subbands. The imaging[16],[17],etc.Generationofmultiplesimultaneous transmitter architecture that adopts software-defined radar orthogonal beams can be done in several ways', '. needed. Multibeam radars that continuously transmit concurrent The principles of CC-OFDM MIMO radars have been multiple beams are able to simultaneously look at different discussed in [20] by way of an exemplary radar design for directions, for instance to cover a wide angular swath a long-range surveillance mission. The design includes the with a faceted view']","The maximum unambiguous range of the radar can be extended by sending multiple successive orthogonal CC-OFDM symbols containing orthogonal Golay codes (Kuswidiastuti et al., 2025).","and radial velocity detection of targets is not discussed yet. The contribution of this paper is in the receiver processing of CC-OFDM-MIMO radar, which is different from those in other types of OFDM MIMO radars or other multi-TRM radars due to the nature of the orthogonal multi-beam generation with Golay-coded OFDM waveforms and subbands. There are previous research on radar waveform for ISAC purposes , which discussed about cyclic prefix (CP) based OFDM waveform and how the CP is very much defining the maximum unambiguous range of the radar system. CC-OFDM MIMO radar waveform design which is discussed in this paper is not a CP based radar, the transmitters are transmitting multiple orthogonal symbols in series without any guard time",0.0,0.9435396763250598
"our knowledge, there is no publicly available NER dataset for drone forensic problems yet. We identify and propose six entity types as the tagset in the annotation process. The proposed model achieves a competitive score compared to the state-of-the-art methods, with a 91.146% F1 score. Yet, one of the scenarios achieves high perfor- mance, with a 91.348% F1 score. 2) This work showcases how to utilize speciﬁc evidence data to perform forensic information extraction to assist a forensic investigation, including a simple framework for data extraction and annotation. 3) We propose and investigate cosine similarity as a sub- stitutive of dot-product in the self-attention sub-layer of the Transformer encoder to model contextual depen- dency in a sequence. We also propose","['100 80 60 40 20 0 0 10 20 30 40 50 60 70 Epoch )%( ycaruccA [3] S. Silalahi, T. Ahmad, and H. Studiawan, “Named entity recognition for drone forensic using bert and distilbert,” in 2022 International Conference on Data Science and Its Applications (ICoDSA), pp. 53– 58,2022. [4] J. Jeon and J. Kim, “A survey on transformers for long sentences and its application to medical notes,” in 2023 International Conference on Electronics,Information,andCommunication(ICEIC),pp.1–4,2023. [5] A. M. P. Bras¸oveanu and R', '. Learn., vol. 107, nos. 8–10, include digital forensics and natural language pp.1477–1494,Sep.2018. processing. [44] X. Zhou, Y. Gao, C. Li, and Z. Huang, ‘‘A multiple gradient descent design for multi-task learning on edge computing: Multi-objective machinelearningapproach,’’IEEETrans.Netw.Sci.Eng.,vol.9,no.1, pp.121–133,Jan.2022. [45] S.Silalahi,T.Ahmad,andH.Studiawan,‘‘DroNER:Datasetfordrone namedentityrecognition,’’DataBrief,vol.48,Jun.2023,Art.no.109179', '. The proposed representation of the label improves the prediction confidence score on variousencodertypeswith8.6%and1.8%fromfocalandcross-entropyscenariosonaverage,respectively. INDEX TERMS Anomaly detection, digital forensics, drone forensics, multitask learning, transformer encoder,informationsecurity. I', '. CONCLUSION remains untested as the training dataset contains only log This paper investigates utilising a multitask learning messages acquired from 82 drone models, mostly from paradigmtoperformmulticlassanomalydetectionondrone DJI. This is one of the main challenges in drone forensics flight log messages. Aligning to the nature of multitask research, where human-readable flight log datasets from learning,weproposetwotargetlabelrepresentations,namely other drone models are unavailable', '. 91.35% compared with another Transformer model. The dataset used in this work is from ALFA [13] which Other research proposed a method in forensic event reprovideslogdataofdronemalfunctions.Thisdatasetcontains construction using directed graphs to identify and reconstruct some drone failures, like a system crash, a malfunctioning events in a drone or its control station device [7]. The study motor, and a drone losing control', '. theexperimentalresults,theTransformerobtainsthehighestF1 In the context of classifying drone malfunctions, the Transscore value of 93.04%. former model can be trained on a dataset of labeled drone Index Terms—drone forensics, forensic investigation, malfunctelemetry data to learn patterns and relationships between the tions, infrastructure, Transformer, Informer, FEDformer drone’s behavior and the root cause of a malfunction. The dataset can include features such as altitude, velocity, battery I', '. However, drones can also be involved in the model is trained on labeled data to predict the type of incidentssuchasaccidents,violations,orevencrimes,making malfunctiongivenasetoftelemetrydata.Theoutputcanbea it necessary to investigate drone logs as part of forensic binaryclassification(e.g.,malfunctionvs.nomalfunction)ora investigations. multi-classclassification(e.g.,batterymalfunction,propulsion In a forensic investigation, drone logs are essential sources malfunction, etc.)', '. 207–212. doi: 9 safe to walk the i fiets do be syour a 45 0.4898 10.18653/v1/P16-2034. streets in the evening hese [8] Z. Huang, W. Xu, and K. Yu, “Bidirectional LSTM-CRF Models 10 i am allergic to bees what o kay o 37 0.4995 for Sequence Tagging,” Aug. 2015. and peanuts sthogsediates [9] Y. Zhu and G. Wang, “CAN-NER: Convolutional Attention Network for Chinese Named Entity Recognition,” in Proceedings V', '. Subramanian, K. Kawakami, and C. 2 dormitory doors are ned any ouang thogh 45 0.2710 Dyer, “Neural Architectures for Named Entity Recognition,” in locked at midnight Proceedings of the 2016 Conference of the North American Chapter 3 this equation is too the sedratic arde 37 0.3573 of the Association for Computational Linguistics: Human Language complicated Technologies, Stroudsburg, PA, USA: Association for 4 fish are jumping he inng othe an the oik 21 0.3913 Computational Linguistics, 2016, pp. 260–270', '. challenges for drone digital forensics investigations,’’ Array, vol. 14, Jul.2022,Art.no.100135. [27] J. Qi, Z. Luan, S. Huang, C. Fung, H. Yang, H. Li, D. Zhu, and D.Qian,‘‘LogEncoder:Log-basedcontrastiverepresentationlearningfor [5] H.Studiawan,G.Grispos,andK.-K.-R.Choo,‘‘Unmannedaerialvehicle anomalydetection,’’IEEETrans.Netw.ServiceManage.,vol.20,no.2, (UAV)forensics:Thegood,thebad,andtheunaddressed,’’Comput.Secur., pp.1378–1391,Jun.2023. vol.132,Sep.2023,Art.no.103340. [28] J. Li, H. He, S. Chen, D']","Silalahi et al. (2023) introduced the DroNER dataset specifically designed for named entity recognition in drone forensics, highlighting its relevance for forensic investigations.","perform information extraction from drone flight log data. The result of the research is that BERT and DistilBERT have F1 scores of 98.63% and 95.9%, respectively. Furthermore, Silalahi et al. developed the Transformer using cosine similiarity to discover and extract some incident- related information. Cosine similiarity is used to substitute dot- product in the self-attention mechanism of the Transformer encoder layer. The datasets that were used are drone logs from the DJI Phantom. The purposeful method has an F1 score 91.35% compared with another Transformer model. Other research proposed a method in forensic event re- construction using directed graphs to identify and reconstruct events in a drone or its control station device . The study allows the investigator to find",0.6666666666666666,0.9437790480353743
". According to those case studies, the drone’s controller devices stored valuable data that can be compared to the other artifacts enabling a correlation study between the UAV and the mobile application used to control the drone. Some studies also suggest a technical procedure for drone forensic inquiry. In order to perform an end-to-end analysis from the preparation to the reporting of the ﬁndings, ten procedures proposed by Salamh et al. must be followed. Analyzing the encrypted ﬁles is one of the obstacles in the data collection phase. For the DJI models, encrypted evidentiary data is a certainty. However, sometimes we have no access to the DJI proprietary tools. Therefore, the data must be decrypted without using DJI’s proprietary tool,","['. Section III explains the proposed method, applying process. Also, Barton et al. [11] conducted the research to the Transformer technique to forensics of drone malfunctions. reconstruct the actions taken by these drones, identify their InSectionIV,thediscussionofperformancemethod,followed owners or operators, and extract data from associated mobile by conclusions and future works in Section V. devices. In other research in drone forensics, this paper also analyze II', '. For instance, GPS records can be utilisedtoreconstructandanalysethepathtakenbythedrone duringaflight[2].Thedeviationbetweentheempiricalflight andreconstructedpathscanhappenifthedroneencountersa GPSspoofing[3]. Among the published drone forensics studies, popular worksincludecasestudies,evidenceanalysis,toolsdevelopment, and forensic framework development [5]', '. flies.Thedetailofthemethodcanbedescribedinthefollowin subsections. B. Drone Forensics Drone forensics is a technique to get, collect, and analyze A. Data Preprocessing the data stored in drones to determine the cause of drone The dataset for the experiment and its preprocessing stage incidents. Research has been done to solve various problems to satisfy the needs in drone forensics can be explained as arising and improve the performance. Al-Dahqm et al. [9] follows', '. challenges for drone digital forensics investigations,’’ Array, vol. 14, Jul.2022,Art.no.100135. [27] J. Qi, Z. Luan, S. Huang, C. Fung, H. Yang, H. Li, D. Zhu, and D.Qian,‘‘LogEncoder:Log-basedcontrastiverepresentationlearningfor [5] H.Studiawan,G.Grispos,andK.-K.-R.Choo,‘‘Unmannedaerialvehicle anomalydetection,’’IEEETrans.Netw.ServiceManage.,vol.20,no.2, (UAV)forensics:Thegood,thebad,andtheunaddressed,’’Comput.Secur., pp.1378–1391,Jun.2023. vol.132,Sep.2023,Art.no.103340. [28] J. Li, H. He, S. Chen, D', '. with limitations and threats to validity. As drone forensics Furtherfuturestudiesmayincludeexploringthepossibility is an emerging topic, there are very limited public datasets of doing high-level oversampling to introduce the models available. The log messages used in this study are mainly with more log message patterns, producing a dataset with acquired from DJI-made devices', '. For example, in drone forensics, existing studiesgenerallyconsideranomaliesascontradictorytonormalevents.Inotherwords,alltypesofanomalies are considered equally important. However, the peculiar events experienced by a drone during a flight might contain distinct features indicating the anomalies’ importance or level of urgency. For instance, the message ‘‘Critically low power', '. ApplicationsSymposium(SAS),pp.1–6,2017. While Transformer models have been extensively studied [11] T.E.A.BartonandM.HannanBinAzhar,“Forensicanalysisofpopular uav systems,” in 2017 Seventh International Conference on Emerging and optimized for NLP tasks, the same level of research and SecurityTechnologies(EST),pp.91–96,2017. optimization may not have been conducted for Informer and [12] E.MantasandC.Patsakis,“Gryphon:Droneforensicsindataflashand FedFormer models for time-series forecasting', '. Most drone incidents are caused analysis of drone logs can also provide evidence that can be by bird attacks, collide with other drones, and malfunctioning used in legal proceedings. This evidence can be particularly systems.Sometimesthedronemayhaveamalfunctioningsystem valuable in cases where there are disputes over liability, such caused by sensor failure, a broken motor, or CPU failure. This cancauseanaccident.Therefore,aforensicinvestigationsupports as in cases of property damage or personal injury', '. theexperimentalresults,theTransformerobtainsthehighestF1 In the context of classifying drone malfunctions, the Transscore value of 93.04%. former model can be trained on a dataset of labeled drone Index Terms—drone forensics, forensic investigation, malfunctelemetry data to learn patterns and relationships between the tions, infrastructure, Transformer, Informer, FEDformer drone’s behavior and the root cause of a malfunction. The dataset can include features such as altitude, velocity, battery I', '. CPU, WiFi, GPS, and Gyro. Informer and FedFormer are [9] A. Al-Dhaqm, R. A. Ikuesan, V. R. Kebande, S. Razak, and F. M. also Transformer-based models that have been developed for Ghabban, “Research challenges and opportunities in drone forensics time-series forecasting tasks. These models attempt to extend models,”Electronics,vol.10,p.1519,June2021. [10] U. Jain, M. Rogers, and E. T']","Drone forensics is a technique to get, collect, and analyze the data stored in drones to determine the cause of drone incidents (Barton et al., 2017).","the performance of the proposed framework has been discussed and analysed. In this section, challenges encountered during the study are disclosed, along with limitations and threats to validity. As drone forensics is an emerging topic, there are very limited public datasets available. The log messages used in this study are mainly acquired from DJI-made devices. There is yet to come a publicly available dataset of log messages from other drone manufacturers. Several publicly available datasets are mainly about sensor data and multimedia artefacts . While in this study, we solely depend on the human-readable messages generated by the drone during a flight. Given the condition where a small number of unique messages and most of them are acquired from DJI",0.8333333333333334,0.9468909823552403
