user_input,retrieved_contexts,response,reference,faithfulness,answer_relevancy
"in improved validation results. Using the previous method, Res U-Net produced the best loss value in the validation set generated from the training dataset in 142 epochs. However, by using our proposed approach, the architecture achieves almost identical results, with a loss value of 0.6838005 over 125 epochs. Thereafter, it continues to improve and displays the best results at 152 epochs. The Dense U-Net result shows the most significant results. Since Dense U-Net requires higher computational power due to the dense block used, the training time of this architecture is generally slower than two other architectures. Using our proposed method, the network training time can be significantly faster. However, our method produces better segmentation results and requires a shorter training","['. The results of the training indicate that LinkNet has a 13% faster training time when compared to U-Net. designs are inappropriate for medical image processing. AdThe highest training and validation accuracies achieved by vances in medical image processing architecture combined Link-Net are 0.9973 and 0.9941. Link-Net is also superior by ob- with the development of deep learning technology have led to taining the highest F1 Score of 0.9636 throughout the testing a paradigm shift in image segmentation', '. The recent advances in medical image segmentation also involve deep learning techniques, such as the U-Net architecture, a convolution neural network (CNN) architecture designedformedicalimagesegmentation[15]', '. First, the direction of 1) U-Net change needed to lower the loss is indicated by the gradient of U-Net is an architecture of CNN used for image segmentation that was first introduced by [7] and has become a pop- the loss function at the tth iteration, or g. Adam calculated t ular choice CNN architecture. Generally, CNNs have layers the first weighted average (m) and the second weighted aversuch as convolutional layers, pooling layers, and fully con- t age (v ) in order to handle this gradient', '. This integrated approach ensures segmentation further optimizes performance by combining a more robust segmentation by leveraging the strengths of different machine-learning strategies to refine accuracy and both methodologies. In addition, rule-based and deep learning adaptability, as explored in the work by scholars at Brandeis techniques also play significant roles [11], [21], [30], [31]. University [20]–[22]', '. Comput., vol. 16, no. 3, pp. 1141–1160, 2024, Learning,” J. Am. Coll. Radiol., vol. 17, no. 5, pp. 637–638, 2020, doi: doi: 10.1007/s12559-024-10257-5. 10.1016/j.jacr.2020.02.005. [20] D. P. Kingma and J. L. Ba, “Adam: A method for stochastic [7] O. Ronneberger, P. Fischer, and T. Brox, “U-Net: Convolutional optimization,” 3rd Int. Conf. Learn. Represent. ICLR 2015 - Conf. Networks for Biomedical Image Segmentation,” Lect. Notes Comput. Track Proc., pp. 1–15, 2015. Sci. (including Subser. Lect']","LinkNet demonstrates a 13% faster training time compared to U-Net, highlighting the efficiency of different architectures in medical image segmentation.","num- ber of parameters is directly proportional to the results of the average loss and average accuracy in training and validation. The U-Net design performs better than Link-Net on average, with smaller training and validation loss values and higher training and validation accuracy values. Table 1 show that the average loss in U-Net is 21% greater than Link-Net, but with the sacrifice of longer training time. So that the Link-Net ar- chitecture provides more stable and parsimonious results. TABLE I. PERFORMANCE SUMMARY OF U-NET AND LINK-NET ARCHITECTURES Training Validation Model U-Net Link- Net Average Loss (St. Dev.) 0.0101 (0.0065) 0.0123 (0.0076) Average Accuracy (St. Dev.) 0.9956 (0.0027) 0.9948 (0.0027) Average Loss (St. Dev.) 0.0188 (0.0194) 0.0216 (0.0057) Average Accuracy (St.",0.5,0.9116016585974388
"company goals by proposing a novel recommendation system for internal business processes, grounded in the COBIT 2019 framework. The system employs graph algorithms to map relationships, semantic similarity measure- ments to align enterprise goals with management objectives, and LSTM combined with TF-IDF methods to analyze and recommend specific activities. Experimental results show that this system optimizes IT management practices, enhances operational efficiency, and ensures regulatory compliance. Additionally, a user-friendly graphical representation of internal business pro- cesses using Neo4j enables stakeholders to visualize complex relationships within the COBIT framework, facilitating informed decision-making. This research advances IT governance practices by providing organizations with a valuable tool to automate and improve IT strategies, effectively achieving business objectives. Index Terms—COBIT 2019, graph algorithms, IT","['. They identified areas for improvement and which uses a weighted graph approach to measure similarprovided recommendations to enhance IT governance, emities in parallel business process models by considering the phasizing effectiveness of COBIT 2019 in managing IT risks. frequency of activity relationships. This method outperforms Thesestudieshighlightthebenefitsofframeworkinimproving traditional approaches like GMA, WGED, WNARS, TPED, IT governance in educational institutions. and Cosine-TDP', '. I. Fianty and M. Brian, “Leveraging COBIT 2019 Framework to 10.1080/00949655.2012.658804. Implement IT Governance in Business Process Outsourcing [35] T. M. Oshiro, P. S. Perez, and J. A. Baranauskas, “How Many Trees in Company,” Journal of Information Systems and Informatics, vol. 5, no. a Random Forest?”, In Machine Learning and Data Mining in Pattern 2, pp. 568–579, May 2023, doi: 10.51519/journalisi.v5i2.492. Recognition: 8th International Conference, MLDM 2012, Berlin, [18] S. Dhir, D. Kumar, and V', '. Recommendations based on COBIT 2019 best practices, such as performance measurements and knowledge repository access, further enhance IT governance processes and contribute to the success of software development projects. The integration of AI and machine learning techniques with the COBIT 2019 framework holds promise in further enhancing IT governance practices [19]', '. implementation within the scope of IT governance and resource allocation. Various machine learning techniques, such as XGBoost and CatBoost, have demonstrated their REFERENCES effectiveness in improving the accuracy of project duration [1] A. Parkitna, A. Sulich, and M. Wilk, “Effective Time Management in estimates by companies by analyzing and determining IT Projects,” in Education Excellence and Innovation Management: a variables that affect latency', '. Among these frameworks, COBIT is globally recognized Frequency-Inverse Document Frequency (TF-IDF) calculation for overseeing Enterprise Information and Technology (I&T) and measuring similarity between strategy nodes to identify comprehensively, covering all systems regardless of their lo- relevanceandinfluenceamongstrategycomponents.Themain cation within the organization']","The proposed recommendation system enhances IT governance by utilizing a weighted graph approach to identify areas for improvement, thereby emphasizing the effectiveness of COBIT 2019 in managing IT risks.","research introduces a novel Activity Recom- mendation System built on the COBIT 2019 framework tailored for Financial Balance Scorecard. The motivation stems from the challenges faced by auditors when identifying essential activities aligned with strategy of a company, often hindered by manual COBIT 2019 guideline navigation. To address this, a system was developed, where inputting the company strategy, triggers the display of recommended activities automatically. The methodology involved creating interconnected nodes from COBIT 2019 Element in Neo4J. This research uses a real strategy plan case study from 3 different companies as input, followed by a preprocessing step, then compares it to Enterprise Goals using TF-IDF and cosine similarity. Goals with high similarity scores trigger a graph query to reveal connected",0.0,0.909017321875111
"assist organizations in managing and optimizing their use of information technology (IT) . landscape, effective IT In today’s rapidly evolving digital governance is essential for organizations to ensure that their IT investments align with business objectives, comply with regulations, and mitigate risks . COBIT 2019 provides a structured approach for organiza- tions to establish, implement, and maintain effective gover- nance over IT. It defines the components necessary to create and sustain a governance system, as well as guidelines for building the most suitable governance system for an enterprise . By utilizing COBIT 2019, organizations can enhance the efficiency, effectiveness, and reliability of their IT usage, while also ensuring compliance with relevant regulations, policies, and standards . One of the key","['. I. Fianty and M. Brian, “Leveraging COBIT 2019 Framework to 10.1080/00949655.2012.658804. Implement IT Governance in Business Process Outsourcing [35] T. M. Oshiro, P. S. Perez, and J. A. Baranauskas, “How Many Trees in Company,” Journal of Information Systems and Informatics, vol. 5, no. a Random Forest?”, In Machine Learning and Data Mining in Pattern 2, pp. 568–579, May 2023, doi: 10.51519/journalisi.v5i2.492. Recognition: 8th International Conference, MLDM 2012, Berlin, [18] S. Dhir, D. Kumar, and V', '. The organizations can prioritize processes, set target capability methodology of this research consists of several main steps, levels, and design effective governance systems for IT which are illustrated in Fig. 1. The following is a detailed projects [17], [18]. Implementing COBIT 2019 in software description of each step: development projects allows for mapping IT resources, prioritization of governance objectives, and alignment of A', '. 2020, pp. Information System Governance using Framework COBIT 2019,” 61–70. doi: 10.1145/3416508.3417119. International Journal of Computer Applications, vol. 174, no. 31, pp. [25] A. E. Karrar, “The Effect of Using Data Pre-Processing by Imputations 23–30, Apr. 2021, doi: 10.5120/ijca2021921253. in Handling Missing Values,” Indonesian Journal of Electrical [7] A. A. Aibinu and E. Papadonikolaki, “Conceptualizing And Engineering and Informatics (IJEEI), vol. 10, no. 2, Apr', 'Optimizing IT Governance and Project Management in Software Development through AI Integration and COBIT 2019 Framework Joko Slamet Hartono Saputro Andy Teguh Department of Informatics Department of Informatics Department of Informatics Institut Teknologi Sepuluh Nopember Institut Teknologi Sepuluh Nopember Institut Teknologi Sepuluh Nopember Surabaya, Indonesia Surabaya, Indonesia Surabaya, Indonesia 6025231063@student.its.ac.id 60252310@student.its.ac.id 6025231047@student.its.ac.id Riyanarto Sarno Kelly', '. systems [12]. Through the use of the COBIT 2019 framework, COBIT provides comprehensive guidance for identifying, auditors can pinpoint key controls necessary to achieve establishing, and monitoring the necessary controls within the predefined business objectives. Meanwhile, event log process IT environment to achieve defined business objectives [3], [4]']","Implementing COBIT 2019 in software development projects facilitates the mapping of IT resources and the prioritization of governance objectives (Saputro et al., 2023).","process, an audit involves acquiring and objectively evaluating evidence related to allegations of economic activities and other operations. The aim is to assess the level of conformity between the reports and predefined criteria, and to communicate the results to relevant users, in this case, the organization responsible for establishing information system gover nan nance. One of the proven frameworks for information system auditing is the Control Objectives for Information and Related Technology (COBIT) 2019, which is utilized as the reference framework in this research . COBIT 2019 offers an effective methodology for evaluating the capability of information technology processes, specifically focusing on Deliver, Service and Support - Operation Management. This framework guarantees that the data (DSS01) is received, managed fully,",0.6666666666666666,0.8908676412946149
"technology, thus helping them achieve their business objectives more effectively . Several previous papers still rely on manual approaches to COBIT 2019, which have limitations in providing automated recommendations for audit activities based on company goals. Thus, this research contributes significantly by addressing this gap and overcoming the challenges associated with manual COBIT utilization. The primary objective of this paper is to develop a rec- ommendation system that aligns with the internal business process strategy governed by COBIT 2019. This system aims to help organizations manage risk, ensure compliance, and enhance performance in the context of information technology. To achieve this, the research will utilize graph algorithms to build a recommendation system based on the internal business processes outlined in","['. Recommendations based on COBIT 2019 best practices, such as performance measurements and knowledge repository access, further enhance IT governance processes and contribute to the success of software development projects. The integration of AI and machine learning techniques with the COBIT 2019 framework holds promise in further enhancing IT governance practices [19]', '. Previous Research of Audit using COBIT 2019 based on semantic similarities, preprocessing data to calculate PreviousresearchonauditingwithCOBIT2019hasinvestithese similarities and effectively merging nodes and relationgated multiple facets of IT governance and auditing, applying ships. the framework across diverse domains and industries', '. They identified areas for improvement and which uses a weighted graph approach to measure similarprovided recommendations to enhance IT governance, emities in parallel business process models by considering the phasizing effectiveness of COBIT 2019 in managing IT risks. frequency of activity relationships. This method outperforms Thesestudieshighlightthebenefitsofframeworkinimproving traditional approaches like GMA, WGED, WNARS, TPED, IT governance in educational institutions. and Cosine-TDP', "". mining enables auditors to delve into the event log data In auditing systems with COBIT, auditors use COBIT generated by information systems to visually map process standards and principles to evaluate the maturity and flows. By combining these two approaches, auditors can effectiveness of internal controls within an organization's IT conduct in-depth analyses of system compliance with COBIT system [5]"", '. Survey audits enhance participation still relatively low due to the high variation of trace noise, which and engagement, allowing stakeholders to contribute to affects the outcomes of the process mining models. improving effectiveness and efficiency. Consequently, survey Keywords—COBIT 2019, Event Log, Graph, Process Mining. audits add a qualitative dimension to audit evaluations, facilitating better decision-making and more effective I. INTRODUCTION implementation of improvements']",The development of a recommendation system based on COBIT 2019 can enhance IT governance by identifying areas for improvement and providing targeted recommendations to manage IT risks effectively (Novel Activity Recommendation System of Financial Balance Scorecard for COBIT 2019 Based on Company Strategy).,"process, an audit involves acquiring and objectively evaluating evidence related to allegations of economic activities and other operations. The aim is to assess the level of conformity between the reports and predefined criteria, and to communicate the results to relevant users, in this case, the organization responsible for establishing information system gover nan nance. One of the proven frameworks for information system auditing is the Control Objectives for Information and Related Technology (COBIT) 2019, which is utilized as the reference framework in this research . COBIT 2019 offers an effective methodology for evaluating the capability of information technology processes, specifically focusing on Deliver, Service and Support - Operation Management. This framework guarantees that the data (DSS01) is received, managed fully,",0.25,0.9313399205280145
"is linked to the appropriate business objec- tives and control needs, thus enhancing overall governance effectiveness . One effective way to perform this mapping is by utilizing a graph database such as Neo4j . Neo4j is a graph database specifically designed to store and manage data with complex relationships . In the context of COBIT 2019, Neo4j can be utilized to build dynamic graphical representations of various COBIT elements . By using Neo4j, organizations can create dynamic and interactive graphical models to better understand and manage the complex relationships between different COBIT 2019 elements . This allows for deeper analysis, real-time monitoring, and better decision-making in IT management, ultimately aiding in the achievement of business goals . In summary, this","['. They identified areas for improvement and which uses a weighted graph approach to measure similarprovided recommendations to enhance IT governance, emities in parallel business process models by considering the phasizing effectiveness of COBIT 2019 in managing IT risks. frequency of activity relationships. This method outperforms Thesestudieshighlightthebenefitsofframeworkinimproving traditional approaches like GMA, WGED, WNARS, TPED, IT governance in educational institutions. and Cosine-TDP', '. in achieving organizational objectives and emphasized the W-LTLDAG effectively distinguishes between graphs with importance of implementing IT governance practices', '. 2020, pp. Information System Governance using Framework COBIT 2019,” 61–70. doi: 10.1145/3416508.3417119. International Journal of Computer Applications, vol. 174, no. 31, pp. [25] A. E. Karrar, “The Effect of Using Data Pre-Processing by Imputations 23–30, Apr. 2021, doi: 10.5120/ijca2021921253. in Handling Missing Values,” Indonesian Journal of Electrical [7] A. A. Aibinu and E. Papadonikolaki, “Conceptualizing And Engineering and Informatics (IJEEI), vol. 10, no. 2, Apr', '. Recommendations based on COBIT 2019 best practices, such as performance measurements and knowledge repository access, further enhance IT governance processes and contribute to the success of software development projects. The integration of AI and machine learning techniques with the COBIT 2019 framework holds promise in further enhancing IT governance practices [19]', '. Using COBIT metrics, organizations XGBoost 4.29 6.34 0.69 40.45 can evaluate and improve the quality of IT Governance, LightGBM 4.74 7.53 0.56 45.14 ensure compliance with regulatory provisions, and improve CatBoost 4.25 6.53 0.67 36.26 operational efficiency. As a result, these initiatives not only are presented in Table IV using MAE, RMSE, R², and MAPE improve the efficiency of project planning and execution but me trics']","The implementation of COBIT 2019 best practices, including performance measurements, enhances IT governance processes and supports effective management of complex relationships in organizational objectives (Optimizing IT Governance and Project Management in Software Development through AI Integration and COBIT 2019 Framework).","COBIT Core Model and Capability Scores, it is necessary to undergo a mapping process according to the instructions in the COBIT 2019 manual. This can be time-consuming, especially when auditor should auditing multiple companies simultaneously. This research aim to simplify the process to get Activities of COBIT 2019 automatically from Input Text Company Strategy that aligned with the description of related Enterprise Goals. This research adopts Neo4j, a graph database platform, to manage KG and process data related to these objectives, to gain deeper and more applicable insights into the relationships between strategic and operational objectives in a company . Furthermore, this research also involves the function of preprocessing the input text in the form of Company Strat- egy using",0.5,0.9200562710994421
"tool for processing sequential data and learning long-term dependencies, making it a crucial component in many applications of artificial intelligence and machine learn- ing. Choose Suitable Enterprise Goal based on Company Goal by using Similarity LSTM-TF IDF. III. METHODOLOGY III. METHODOLOGY This section outlines the methodology for developing a recommendation system based on COBIT 2019’s internal business processes. The approach integrates data collection, preprocessing, graph database modeling with Neo4j, and rec- ommendation generation using graph algorithms and similarity methods. The complete process shown in figure 1 A. Input Dataset The input dataset comprises information from the COBIT 2019 framework, including internal business processes, control objectives, IT processes, and related elements. Additionally, company-specific goals are incorporated to ensure that the recommendations","['Technology Informatics Technology Informatics Technology Institut Teknologi Sepuluh Nopember Institut Teknologi Sepuluh Nopember Institut Teknologi Sepuluh Nopember Surabaya, Indonesia Surabaya, Indonesia Surabaya, Indonesia haznaatthoriqoh@gmail.com siti@if.its.ac.id chastine@if.its.ac.id Muhamma d Alfian Department of Informatics Faculty of Intelligent Electrical and Informatics Technology Institut Teknologi Sepuluh Nopember Surabaya, Indonesia ini.muhalfian@gmail.com Abstract— A recommendation model is', '. It is like building a map of knowledge, case study from 3 different companies as input, followed by a preprocessing step, then compares it to Enterprise Goals using whereeachpieceofinformationisapointconnectedtoothers TF-IDF and cosine similarity. Goals with high similarity scores by lines that show how they are linked [2]. trigger a graph query to reveal connected activities', '. They identified areas for improvement and which uses a weighted graph approach to measure similarprovided recommendations to enhance IT governance, emities in parallel business process models by considering the phasizing effectiveness of COBIT 2019 in managing IT risks. frequency of activity relationships. This method outperforms Thesestudieshighlightthebenefitsofframeworkinimproving traditional approaches like GMA, WGED, WNARS, TPED, IT governance in educational institutions. and Cosine-TDP', '. Fig.2. FlowchartofActivityRecommendationSystem The user inputs and the descriptions of the enterprise goals will be compared to determine their similarity percentage. the form of selected enterprise goals based on the similarity The initial process begins with calculating TF-IDF. Then, measurement process. The results of this query are then the process continues with the calculation using the Cosine displayed to the application user. Similarity method', '. This formula A. Mapping COBIT 2019 Element combinesthelocalimportanceofaterminaspecificdocument (term frequency) with its global importance across the entire The research began by identifying Enterprise Goals corredocument collection (inverse document frequency) [21]. latedwiththeBalancedScorecardFinancial.Then,Alignment 5) Cosine Similarity: This process quantifies the similarity Goals related to these Enterprise Goals were mapped. Subsebetween two vectors in a high-dimensional space']","The methodology for developing a recommendation system includes comparing user inputs and enterprise goals to determine similarity percentages, utilizing TF-IDF and Cosine Similarity calculations (Novel Activity Recommendation System of Financial Balance Scorecard for COBIT 2019 Based on Company Strategy).","IX, it can serve as an internal reference for the company to assess its capability to meet these criteria and can also serve as a reference for formulating policies to prioritize the implementation of these activities in the future. V. CONCLUSION V. CONCLUSION In conclusion, the developed Activity Recommendation System based on COBIT 2019 framework offers a practical solution to the challenges faced by auditors in identifying and aligning activities with company strategy. By leveraging NLP techniques and graph queries, the system efficiently matches user input of company strategy with relevant activities automatically, eliminating the need for manual navigation through COBIT 2019 guidelines. The effectiveness of the system was demonstrated by in- putting company strategies from three companies in different",0.8,0.9164073249996029
"used as references for the next graph query execution to obtain the required activities. The output matches the mapping results, displaying only activities that correlate with Enterprise Goal EG02, which describes ”Optimization of business process functionality.” Using Algorithm 3, a graphical representation is created, as Fig. 3. Mapping Alignment Goals (AG) Fig. 4. Mapping Objectives illustrated in Figure 5. This graphical representation allows users to easily visualize the need for additional activity recommendations without documentation such as spreadsheets, thereby reducing the need for extra work. V. CONCLUSION V. CONCLUSION This paper propose a novel recommendation system for internal business processes based on the COBIT 2019 frame- work. By integrating graph algorithms and similarity methods, our approach provides tailored activity recommendations","['. They identified areas for improvement and which uses a weighted graph approach to measure similarprovided recommendations to enhance IT governance, emities in parallel business process models by considering the phasizing effectiveness of COBIT 2019 in managing IT risks. frequency of activity relationships. This method outperforms Thesestudieshighlightthebenefitsofframeworkinimproving traditional approaches like GMA, WGED, WNARS, TPED, IT governance in educational institutions. and Cosine-TDP', '. It is like building a map of knowledge, case study from 3 different companies as input, followed by a preprocessing step, then compares it to Enterprise Goals using whereeachpieceofinformationisapointconnectedtoothers TF-IDF and cosine similarity. Goals with high similarity scores by lines that show how they are linked [2]. trigger a graph query to reveal connected activities', "". 1–5. doi: 10.1109/eSmarTA59349.2023.10293688. significant inefficiencies within the hospital's billing system, [8] C. Stephanie and R. Sarno, “Detecting Business Process Anomaly Using Graph Similarity Based on Dice Coefficient, Vertex Ranking pinpointing several critical bottlenecks that can be targeted and Spearman Method,” in 2018 International Seminar on Application for process improvements"", '. The system provided a list of recommended activities objective.Mostofthegoals(EG03,EG04)shownoalignment that can be undertaken to achieve strategic objectives of each (similarity score of 0), suggesting that these goals do not companies. contribute to or are unrelated to risk reduction', '. TABLE I provides a detailed not always be clean or well-structured [9]. Moreover, it offers overview of the activities and performance indicators insightful diagnostics about the process flow, helping to associated with the DSS01.01 domain of managed operations. identify bottlenecks and inefficiencies that other algorithms might overlook[16]. B. Process Mining Process mining involves deriving business processes from III']",The proposed recommendation system utilizes a weighted graph approach to identify areas for improvement in business processes by measuring similarities in activity relationships.,"research introduces a novel Activity Recom- mendation System built on the COBIT 2019 framework tailored for Financial Balance Scorecard. The motivation stems from the challenges faced by auditors when identifying essential activities aligned with strategy of a company, often hindered by manual COBIT 2019 guideline navigation. To address this, a system was developed, where inputting the company strategy, triggers the display of recommended activities automatically. The methodology involved creating interconnected nodes from COBIT 2019 Element in Neo4J. This research uses a real strategy plan case study from 3 different companies as input, followed by a preprocessing step, then compares it to Enterprise Goals using TF-IDF and cosine similarity. Goals with high similarity scores trigger a graph query to reveal connected",0.6666666666666666,0.9190653527692918
"the need for extra work. V. CONCLUSION V. CONCLUSION This paper propose a novel recommendation system for internal business processes based on the COBIT 2019 frame- work. By integrating graph algorithms and similarity methods, our approach provides tailored activity recommendations that align with an organization’s strategic goals. We mapped enter- prise goals to management objectives, identified relevant ac- tivities, and used graph queries to retrieve actionable insights. Utilizing Cypher Query Language (CQL) and Neo4j’s graph database, we created an interactive graphical representation of COBIT 2019-governed processes. This allows organizations to visualize relationships between COBIT elements, facilitating deeper analysis, real-time monitoring, and informed IT man- agement decisions. Our results demonstrated the system’s effectiveness in sug- gesting activities tailored to enterprise goals,","['. They identified areas for improvement and which uses a weighted graph approach to measure similarprovided recommendations to enhance IT governance, emities in parallel business process models by considering the phasizing effectiveness of COBIT 2019 in managing IT risks. frequency of activity relationships. This method outperforms Thesestudieshighlightthebenefitsofframeworkinimproving traditional approaches like GMA, WGED, WNARS, TPED, IT governance in educational institutions. and Cosine-TDP', '. It is like building a map of knowledge, case study from 3 different companies as input, followed by a preprocessing step, then compares it to Enterprise Goals using whereeachpieceofinformationisapointconnectedtoothers TF-IDF and cosine similarity. Goals with high similarity scores by lines that show how they are linked [2]. trigger a graph query to reveal connected activities', '. TABLE I provides a detailed not always be clean or well-structured [9]. Moreover, it offers overview of the activities and performance indicators insightful diagnostics about the process flow, helping to associated with the DSS01.01 domain of managed operations. identify bottlenecks and inefficiencies that other algorithms might overlook[16]. B. Process Mining Process mining involves deriving business processes from III', '. The results show a list of recommended activities based on the company In previous research, as found in the paper [3], [4], [5] strategy, this can simplify the company audit process. and [6] to obtain Activities from the COBIT Core Model Keywords—Audit Management, COBIT 2019, Cosine Similar- and Capability Scores, it is necessary to undergo a mapping ity, Financial, Knowledge Graph, Neo4J process according to the instructions in the COBIT 2019 manual. This can be time-consuming, especially when auditor I', 'Novel Activity Recommendation System of Financial Balance Scorecard for COBIT 2019 Based on Company Strategy 1st Lukman Arif Sanjani 2nd Ulima Inas Shabrina 3rd William Phedra Department of Informatics Department of Informatics Department of Informatics Institut Teknologi Sepuluh Nopember Institut Teknologi Sepuluh Nopember Institut Teknologi Sepuluh Nopember Surabaya, Indonesia Surabaya, Indonesia Surabaya, Indonesia 6025232027@student.its.ac.id 6025231046@student.its.ac.id 6025231067@student.its.ac.id 4th']","The proposed recommendation system enhances IT governance by identifying areas for improvement and utilizing a weighted graph approach to measure similarities in business processes, thereby emphasizing the effectiveness of COBIT 2019 in managing IT risks.","research introduces a novel Activity Recom- mendation System built on the COBIT 2019 framework tailored for Financial Balance Scorecard. The motivation stems from the challenges faced by auditors when identifying essential activities aligned with strategy of a company, often hindered by manual COBIT 2019 guideline navigation. To address this, a system was developed, where inputting the company strategy, triggers the display of recommended activities automatically. The methodology involved creating interconnected nodes from COBIT 2019 Element in Neo4J. This research uses a real strategy plan case study from 3 different companies as input, followed by a preprocessing step, then compares it to Enterprise Goals using TF-IDF and cosine similarity. Goals with high similarity scores trigger a graph query to reveal connected",0.0,0.9140794733788931
"graphical representation of COBIT 2019-governed processes. This allows organizations to visualize relationships between COBIT elements, facilitating deeper analysis, real-time monitoring, and informed IT man- agement decisions. Our results demonstrated the system’s effectiveness in sug- gesting activities tailored to enterprise goals, enhancing IT management practices and operational efficiency. The Neo4j visualization tool offers a user-friendly interface for explor- ing COBIT framework relationships, enabling stakeholders to make data-driven decisions. TABLE III SIMILARITY SCORE Enterprise Goal (EG) Optimization of business process functionality Optimization of business process costs Staff skills, motivation and productivity Compliance with internal policies Similarity 0.5701785 0.29179826 0.02301607 0.029643951 M. M. Jawad, M. H. Ali, A. A. Khaleel, and M. F. Hasan, “Evaluating the performance of it management under the implementation","['. They identified areas for improvement and which uses a weighted graph approach to measure similarprovided recommendations to enhance IT governance, emities in parallel business process models by considering the phasizing effectiveness of COBIT 2019 in managing IT risks. frequency of activity relationships. This method outperforms Thesestudieshighlightthebenefitsofframeworkinimproving traditional approaches like GMA, WGED, WNARS, TPED, IT governance in educational institutions. and Cosine-TDP', '. in achieving organizational objectives and emphasized the W-LTLDAG effectively distinguishes between graphs with importance of implementing IT governance practices', '. Using COBIT metrics, organizations XGBoost 4.29 6.34 0.69 40.45 can evaluate and improve the quality of IT Governance, LightGBM 4.74 7.53 0.56 45.14 ensure compliance with regulatory provisions, and improve CatBoost 4.25 6.53 0.67 36.26 operational efficiency. As a result, these initiatives not only are presented in Table IV using MAE, RMSE, R², and MAPE improve the efficiency of project planning and execution but me trics', '. These procedures ensure that each claim is managed Fluxicon, aimed at helping organizations visualize, analyze, consistently, efficiently, and in compliance with regulatory and improve the efficiency of their business processes [18]. requirements', '. COBIT 2019 offers an COBIT 2019 for DSS01 Objective, particularly as a method effective methodology for evaluating the capability of of collecting and validating data within the process assessment information technology processes, specifically focusing on program. Experiments are conducted by analyzing Deliver, Service and Support (DSS01) - Operation performance and identifying bottlenecks in event logs related Management']",The study highlights the effectiveness of COBIT 2019 in managing IT risks and improving IT governance practices (Novel Activity Recommendation System of Financial Balance Scorecard for COBIT 2019 Based on Company Strategy).,"COBIT Core Model and Capability Scores, it is necessary to undergo a mapping process according to the instructions in the COBIT 2019 manual. This can be time-consuming, especially when auditor should auditing multiple companies simultaneously. This research aim to simplify the process to get Activities of COBIT 2019 automatically from Input Text Company Strategy that aligned with the description of related Enterprise Goals. This research adopts Neo4j, a graph database platform, to manage KG and process data related to these objectives, to gain deeper and more applicable insights into the relationships between strategic and operational objectives in a company . Furthermore, this research also involves the function of preprocessing the input text in the form of Company Strat- egy using",0.6666666666666666,0.9192718216629777
"(TP+FP). To determine how well a positive value is found, recall is employed. It applies true positives (TP) to all ground truth values, which include both true positives and false negatives (FN). The F1 score is an evaluation metric that combines a model’s precision and recall scores, as illustrated in the equation that calculates accuracy. The accuracy statistic computes the number of times the iYOLOV7-TPE-SS model predicted accurately throughout the entire dataset , : F1score = 2 · (P · R) (P + R) (13) The system performance of the iYOLOV7-TPE-SS model has been evaluated using a metric known as mean average accuracy (mAP), which takes into account the average recall (AR), F1-score, and inference time. The inference time has","['. This study chose to adopt EfficientNetV2-S, the baseline architecture from this family, due to computational resource reasons to construct a smaller model while still maintaining model performance. The EfficientNetV1 family is the backbone of the EfficientDet family, which has achieved state-of-the-art results on object detection challenges. C. Model Evaluation Evaluation Metrics used in this study to evaluate model performance are precision, recall, and F1 Score', '. PRECISION, RECALL, AND F1 SCORE (IOU @ 50) FOR EACH CLASS Backbone Metrics Healthy Mismngd Smallish Yellowish Dead Average Precision 0.970 0.635 0.871 0.498 0.376 0.670 MobileNetV3-Large Recall 0.987 0.695 0.924 0.886 0.770 0.852 F1 Score 0.978 0.663 0.897 0.637 0.505 0.736 Precision 0.985 0.865 0.929 0.894 0.662 0.867 EfficientNetV2-S Recall 0.968 0.474 0.781 0.859 0.770 0.770 F1 Score 0.977 0.612 0.849 0.876 0.712 0.805 various confidence thresholds and object classes', '. 𝐼𝑜𝑈= 𝐴𝑟𝑒𝑎 𝑜𝑓 𝑂𝑣𝑒𝑟𝑙𝑎𝑝 (4) MobileNetV3 and EfficientNetV2 prioritize efficiency and 𝐴𝑟𝑒𝑎 𝑜𝑓 𝑈𝑛𝑖𝑜𝑛 accuracy, but they achieve this through different The metric mean Average Precision (mAP) is architectural choices. MobileNetV3 enhances the previous introduced in COCO dataset evaluation metrics and is version with squeeze-and-excitation layers and h-swish widely used in object detection studies as a benchmark for non-linearity [18], while EfficientNetV2 focuses on evaluating and comparing model performance', '. accuracy. This study used two architectures that suit that The TIDE toolbox [24] is used to compute the detection objective in its development, which are MobileNetV3 and error in object detection model performance for in-depth EfficientNetV2. The EfficientNetV2, especially the TABLE IV', '. rapid and accurate detection is essential. For example, Fatichahetal.[14]evaluatedtheperformanceofthreepopulardetectionmethods:YouOnlyLookOncev4(YOLOv4), YouOnlyLookOncev5(YOLOv5),andMaskRegion-based ConvolutionalNeuralNetwork(MaskR-CNN)inclassifying ALLtypes.TheirfindingsshowedthatYOLOv4achievedthe highest mean Average Precision (mAP) at 93.2%, followed by YOLOv5 at 92.7% and Mask R-CNN at 81.9%']","The evaluation metrics utilized in the study include precision, recall, and F1 Score, which are essential for assessing model performance (Multi-class Oil Palm Trees Condition Detection from UAV Images using Faster R-CNN with EfficientNetV2).","with the following formula: TP + TN TP + TN + FP + FN Accuracy = Precision = Recall/True Positive Rate(TPR) TP TP + FP TP TP + FN F1 = 2 × precision × recall precision + recall FP TN + TP (cid:90) 1 TPRd(FPR) False Positive Rate(FPR) = AUC = (4) (5) (6) (7) (8) (9) where TP is the number of correctly predicted positive labels, TN is the number of correctly predicted negative labels, FP is the number of incorrectly predicted positive labels, and FN is the number of incorrectly predicted negative labels. Accuracy is the ratio of true predictions to the overall data. Precision is the ratio between TP to the total number of positive predic-",0.8,0.8853153328374304
"The interesting aspect of the stock transaction dataset is that the standard deviation from TPIA and BRPT is larger than the mean, which means that two stock issuers have high volatility. 2) DATASET OF NEWS HEADLINES The news portal kontan.co.id in the Indonesian language is used as a source of the news dataset with news published dates between 1 January 2017 and 31 May 2024. The news dataset contains the title, description, published date, and category gathered using scraping technique under sections investment, industry, and finance. This research uses the news section in the news portal as an aspect category. The rule of collecting the dataset is the stock issuer ticker is shown explicitly in the news title to distinguish","['. ABSTRACT News sentiment can influence stock prices indirectly, in addition to the technical indicators already used to analyze stock prices', '. aspects, such as corporate, stock, market, and economy The sentiment analysis results in qualitative data cannot be news [5]. The multi-aspect sentiment news represents stock combined with technical indicators in quantitative data to market conditions better and analyzes aspects significantly forecaststockprices.Theprocessingofconvertingqualitative influencingstockpriceforecasting', '. Zhou, Z. Ma, Q. Wen, X. Wang, L. Sun, and R. Jin, ‘‘FEDformer: layer to determine stock price. The TEGRU used various Frequencyenhanceddecomposedtransformerforlong-termseriesforeparameters to produce the best model performance, and casting,’’2022,arXiv:2201.12740. multi-aspect sentiment indicators affected the performance [16] J. Chen, T. Chen, M. Shen, Y. Shi, D. Wang, and X. Zhang, ‘‘Gated three-tower transformer for text-driven stock market prediction,’’ Mulforecasting model top gains issuers', '. 5) MULTIVARIATEEXPANDTECHNICALANDASPECT SENTIMENTINDICATOR(ETS) Concatenate expanded technical indicator and news sentiment produced 78 features to forecasting close stock price in one day. Eq. (6) uses to make features with lower multicollinearity. The proposed model TEGRU and FEDformer equally outperformed on 4 of 8 stock issuers, asshowninTable11.TEGRUbestfittedonBBRI,TLKM, BMRI,andASII,whereasFEDformerbestfittedonBBCA, INDX, SMMT, and HITS', '. DigitalObjectIdentifier10.1109/ACCESS.2023.3298445 Transformer-Gated Recurrent Unit Method for Predicting Stock Price Based on News Sentiments and Technical Indicators AGUSTRIHARYONO 1,2,RIYANARTOSARNO 1,(SeniorMember,IEEE), ANDKELLYROSSASUNGKONO 1,(Member,IEEE) 1DepartmentofInformatics,InstitutTeknologiSepuluhNopember,Surabaya60111,Indonesia 2DepartmentofInformatics,UniversitasMulawarman,Samarinda75119,Indonesia Correspondingauthor:RiyanartoSarno(riyanarto@if.its.ac.id)']","The proposed model TEGRU demonstrated high performance in predicting stock prices for several issuers, indicating significant volatility in stock transactions (Agustriharyono et al., 2023).","DATASET A. DATASET This sub-section explains the collection, labeling, and prepa- ration of the dataset used in this research. The dataset consists of time series and text; each is prepared independently. 1) DATASET OF NEWS HEADLINES The text dataset used in this work was gathered from the Indonesian news portal at kontan.co.id under the categories investment, finance, industry, national, and international. The scraping technique collects data between 1 January 2017 to 31 March 2022 and produces a title, URL, description, postdate, category, and subcategory. Statistics from collected data are shown in Table 1. To evaluate performance prediction, task classification in text requires ground truth. The dataset already has ground truth for aspect categorization, but sentiment classification does not have the",0.3333333333333333,0.9306891189400307
"titles on each stock issuer based on aspect category. available in English. The trained model siebert/sentiment- roberta-large-english is a binary sentiment classification with an accuracy of 93.2% and is used to determine sentiment polarity, negative and positive. The news dataset contains news published date, aspect category, sentiment polarity, stock ticker, and news title. FIGURE 3. Framework of labeling aspect-sentiment quadruplet. The pair aspect category-sentiment polarity with news trained using various pre-trained models titles was such as indobert-large-p2 , mxbai-embed-large-v1 , multilingual-e5-large , distiluse-base-multilingual- to develop cased-v2 , and bge-base-en-v1.5 VOLUME 12, 2024 178677 A. T. Haryono et al.: pTKANs for Stock Price Forecasting Using Generative ABSA aspect categorization and sentiment classification models. The indobert-large-p2 model is specifically designed for Indonesians,","['. [5] A. T. Haryono, R. Sarno, and R. Abdullah, ‘‘Aspect-based sentiment FIGURE10. ThefeatureforecastingcorrelationofTLKMstockissuer. analysisoffinancialheadlinesandmicroblogsusingsemanticsimilarity and bidirectional long short-term memory,’’ Int. J. Intell. Eng. Syst., vol.15,no.3,pp.233–241,2022.[Online].Available:https://inass.org/wpcontent/uploads/2021/12/2022063020-2.pdf failed stock trend prediction caused a financial loss in the [6] S. Budd, E. C. Robinson, and B. Kainz, ‘‘A survey on active MAEscore', '. The Transformer architecture became model to produce a multi-aspect sentiment indicator a breakthrough in the deep learning method because the with time sequence data consideration to describe Transformerhadamulti-headattentionlayertolearnapattern detailedstockmarketconditions. of data input and an encoder-decoder section with different 2) The Transformer Encoder Gated Recurrent Unit input layers to resolve transformation data tasks [12]', '. Sentiment classifica- resolve stock forecasting tasks. The hybrid model, which tion has been used to accomplish dataset political [21], uses CNN to extract sentiment polarity and combines review[22],hatespeech[23],andfinancial[24].Inpolitical technical indicators to build an LSTM forecasting model, datasets,sentimentclassificationisresolvedusingalexicon producedgoodresultswhenforecastingtheShanghaiStock list sentiment. The appearance of the word lexicon in the Exchange[29]', '. Therefore, the canbeprovidedbysometechniques.TextBlobandVADER aspect categorization is determined by the model that has lexicon libraries can determine the polarity value of text beentrained. with a range of -1 to 1. RNN and BERT methods provide A sentiment is an opinion that contains feelings for an polarity sentiment with a scale of 0 to 1 [1]. Combined object in the text, and adjectives are commonly used as technical indicators and news sentiment are already used to sentiment expressions in sentences', '. The Vanilla Transformer, Informer, more representative of daily sentiment than two features and FEDformer are built using the official FEDformer without aspect, such as the average sentiment positive and repository. The FEDformer repository was chosen because the average sentiment negative']","The hybrid model, which uses CNN to extract sentiment polarity and combines technical indicators to build an LSTM forecasting model, produced good results when forecasting the Shanghai Stock Exchange (Haryono et al., 2022).","learning with VOLUME 11, 2023 77135 A. T. Haryono et al.: Transformer-Gated Recurrent Unit Method for Predicting Stock Price TABLE 1. Statistic dataset of headline news. TABLE 2. Example headlines news on each category and sentiment. FIGURE 2. The method of Indonesian headline news dataset sentiment labeling. an English language-trained model. The labeling method is shown in Fig. 2. The cleaned news title will be translated from Indonesian to English using a translator application. The resulting translated news title will be passed into the sentiment label- ing using a trained model siebert/sentiment-roberta-large- english. The label sentiment complements the ground truth of the headline news dataset. A trained model siebert/sentiment- roberta-large-english has an accuracy of 93.2% in a binary sentiment classification",0.75,0.9187083468955359
"using the mean sentiment score on each day trading, if not found, filled with zero value. The daily stock issuer sentiment score can be combined with stock transaction history. The illustration of the final dataset in the form of panel data is shown in Table. 2. D. FORECASTING MODELS D. FORECASTING MODELS This sub-section presents modified Transformer architec- ture, which are Transformer GRU (FormerGRU), Trans- former LSTM (FormerLSTM), Transformer Encoder GRU (TEGRU), and Transformer Encoder LSTM (TELSTM). Modified Transformer was chosen because TEGRU outper- formed other Transformer variants, such as vanilla Trans- former, Informer, FEDformer, and Transformer Encoder in stock price forecasting . This research proposes permuted Temporal Kolmogorov-Arnold Networks (pTKAN) architec- ture to develop a unified stock forecasting model","['. DigitalObjectIdentifier10.1109/ACCESS.2023.3298445 Transformer-Gated Recurrent Unit Method for Predicting Stock Price Based on News Sentiments and Technical Indicators AGUSTRIHARYONO 1,2,RIYANARTOSARNO 1,(SeniorMember,IEEE), ANDKELLYROSSASUNGKONO 1,(Member,IEEE) 1DepartmentofInformatics,InstitutTeknologiSepuluhNopember,Surabaya60111,Indonesia 2DepartmentofInformatics,UniversitasMulawarman,Samarinda75119,Indonesia Correspondingauthor:RiyanartoSarno(riyanarto@if.its.ac.id)', '. ding, and one Transformer to learn daily social text with 4) TheimpactoftheTEGRUfeatureparameteronstock Bidirectional Encoder Representations from Transformers priceforecastingisanalyzedtoproducealowfinancial (BERT) sentence embedding [16]. The Recurrent Neural riskmodelforeachstockissuer. Network (RNN) architecture has an excellent reputation for The rest of the article is organized as follows: Section II stock forecasting [17], [18]', 'by stock price forecasting using the proposed Transformer Encoder Gated Recurrent Unit (TEGRU)architecture.TheTEGRUconsistsofatransformerencodertolearnpatterntimeseriesdatawith multi-headattentionandpassitintotheGRUlayertodeterminestockprice.Theaccuracymeanabsolute percentageerror(AcMAPE)usestoevaluateforecastingmodelssensitivetothemisclassificationofstock pricetrends.Ourexperimentshowedthatthesentimentindicatorcouldinfluencestockissuersbasedonthe', '. In previous research, the CNN-BiLSTM combined withgoodperformance.Fine-tunedfromtheRoBERTa-large layerwasusedtobuildastockpriceforecastingmodel,with model [30], siebert/sentiment-roberta-large-english had an the CNN layer processing raw input through an extraction outstanding performance on text classification after being feature,whichwasthenpassedtotheBiLSTMlayertolearn tested on 15 data sets [31]. IndoBERT is an Indonesian predicted stock prices [26]', '. Zhou, Z. Ma, Q. Wen, X. Wang, L. Sun, and R. Jin, ‘‘FEDformer: layer to determine stock price. The TEGRU used various Frequencyenhanceddecomposedtransformerforlong-termseriesforeparameters to produce the best model performance, and casting,’’2022,arXiv:2201.12740. multi-aspect sentiment indicators affected the performance [16] J. Chen, T. Chen, M. Shen, Y. Shi, D. Wang, and X. Zhang, ‘‘Gated three-tower transformer for text-driven stock market prediction,’’ Mulforecasting model top gains issuers']","The TEGRU architecture utilized various parameters to enhance model performance, demonstrating the influence of multi-aspect sentiment indicators on stock price forecasting (Agustriharyono et al., 2023).","forecasting using Transformer Encoder Gated Recurrent Unit (TEGRU). The TEGRU can extract information with a multi-head attention layer and recognize pattern sequence data. The evaluation performance of the forecasting model uses Accuracy Mean Absolute Percentage Error (AcMAPE), which have sensitive to the misclassification of stock price trends. The significant contributions of this paper are summarized as follows. 1) The feature extraction method uses an active learning model to produce a multi-aspect sentiment indicator with time sequence data consideration to describe detailed stock market conditions. 2) The Transformer Encoder Gated Recurrent Unit (TEGRU) architecture, which consists of a Trans- former Encoder as extraction information and GRU as a recognized sequence data pattern, is used in stock price forecasting. 3) The Accuracy",1.0,0.9321876321456597
"and radial velocity detection of targets is not discussed yet. The contribution of this paper is in the receiver processing of CC-OFDM-MIMO radar, which is different from those in other types of OFDM MIMO radars or other multi-TRM radars due to the nature of the orthogonal multi-beam generation with Golay-coded OFDM waveforms and subbands. There are previous research on radar waveform for ISAC purposes , which discussed about cyclic prefix (CP) based OFDM waveform and how the CP is very much defining the maximum unambiguous range of the radar system. CC-OFDM MIMO radar waveform design which is discussed in this paper is not a CP based radar, the transmitters are transmitting multiple orthogonal symbols in series without any guard time","['. The latter indicates that the CC OFDM MIMO radar can achieve a high resolution in angle, range, and velocity,withbeamisolationof−30dBforneighboringbeamsandco-channelbeams. INDEX TERMS Array signal processing, circulating-codes, Golay-codes, MIMO-radar, multi-beam, OFDM,software-defined-radar,sub-band,space-timecodes,surveillance. I', 'D.Kuswidiastutietal.:TransmitterDesignforMultibeamCC-OFDMAzimuthScanningMIMORadar theaforesaidproblemoflimitedtime-on-target.Multi-beam OFDM MIMO waveform [31]. A set of orthogonal waveradar technology is beneficial to various radar applications, formscanbesimplyacquiredbyarrangingtheallocationof suchassurveillance[3],[4],automotiveradar[5],[6],radar orthogonal subcarriers into different antennas of the MIMO imaging[7],[8],jointmultiusercommunicationandradar[9], radar system', '. DigitalObjectIdentifier10.1109/ACCESS.2022.3175883 A Transmitter Design for the Multi-beam CC-OFDM Azimuth Scanning MIMO Radar DEVYKUSWIDIASTUTI 1,(StudentMember,IEEE),L.P.LIGTHART 2,(LifeFellow,IEEE), ANDGAMANTYOHENDRANTORO 1,(SeniorMember,IEEE) 1DepartmentofElectricalEngineering,InstitutTeknologiSepuluhNopember,Surabaya60111,Indonesia 2IRCTR,DelftUniversityofTechnology,2628CDDelft,TheNetherlands(Retired) Correspondingauthor:GamantyoHendrantoro(gamantyo@ee.its.ac.id)', '(13) herein as the subarrayed MIMO (SMIMO) radars, such as theFPMIMOradar,rangesbetweentwoextremeconfiguraNotation ⊗ denotes the Kronecker product operator, tions, namely the PA and the MIMO radar', '. INDEX TERMS MIMO radar, parameter estimation, phased array radar, probability of detection, target detection. I. INTRODUCTION for biomedical engineering, macro-scale radars on radioMulti-antenna radar systems have been known and used in astronomy, and so on [4], [5]']","The CC OFDM MIMO radar can achieve high resolution in angle, range, and velocity, with significant beam isolation, which supports the unique processing methods discussed in this paper.","MIMO radar, intended to produce correlated waveforms with the purpose of acquiring better control over the beampattern. CC have been proposed for application in MIMO radars, originally for optimizing low sidelobes in MIMO radars employing LFM waveforms , but only recently the CC has gained attention in terms of in-depth analysis of LFM waveform optimization . Later in this paper, it can be seen that CC ﬁnd a different role as a consequence of their combination with OFDM waveforms. In this paper, a novel concept of CC-OFDM MIMO† radar is proposed as a solution for the wide-scanning multi-beam radar, which is based on the following principles. Firstly, a train of OFDM pulses are transmitted on an array of transmit antennas",0.8,0.9489026872015527
"much defining the maximum unambiguous range of the radar system. CC-OFDM MIMO radar waveform design which is discussed in this paper is not a CP based radar, the transmitters are transmitting multiple orthogonal symbols in series without any guard time interval between the symbols. to each other, hence The symbol series are orthogonal VOLUME 13, 2025 109895 D. Kuswidiastuti et al.: Receiver Processing of the Multibeam Azimuth Scanning CC-OFDM-MIMO Radar receivers know how to distinguish the symbols received, and this could extend the maximum unambiguous range of the radar. The contributions of this paper are described as follow: 1) This paper describes the receiver processing of multi- beam CC-OFDM MIMO Radar which is designed for long-range radar surveillance application. The","['. The latter indicates that the CC OFDM MIMO radar can achieve a high resolution in angle, range, and velocity,withbeamisolationof−30dBforneighboringbeamsandco-channelbeams. INDEX TERMS Array signal processing, circulating-codes, Golay-codes, MIMO-radar, multi-beam, OFDM,software-defined-radar,sub-band,space-timecodes,surveillance. I', '. INDEX TERMS MIMO radar, parameter estimation, phased array radar, probability of detection, target detection. I. INTRODUCTION for biomedical engineering, macro-scale radars on radioMulti-antenna radar systems have been known and used in astronomy, and so on [4], [5]', '(13) herein as the subarrayed MIMO (SMIMO) radars, such as theFPMIMOradar,rangesbetweentwoextremeconfiguraNotation ⊗ denotes the Kronecker product operator, tions, namely the PA and the MIMO radar', '. By taking as an example the design of long-rangesurveillanceradar,thepaperdiscussesfurtherissuespertinenttotheimplementationoftheCC OFDM MIMO radar, including the beam squinting problem and its remedy, arrangement of the multiple beams, the radar system structure, use of Golay codes for orthogonalization and PAPR mitigation, use of software-definedradarthateliminatestheneedofamplitudeandphasecontrolineachtransmitter,transmit', '. DigitalObjectIdentifier10.1109/ACCESS.2022.3175883 A Transmitter Design for the Multi-beam CC-OFDM Azimuth Scanning MIMO Radar DEVYKUSWIDIASTUTI 1,(StudentMember,IEEE),L.P.LIGTHART 2,(LifeFellow,IEEE), ANDGAMANTYOHENDRANTORO 1,(SeniorMember,IEEE) 1DepartmentofElectricalEngineering,InstitutTeknologiSepuluhNopember,Surabaya60111,Indonesia 2IRCTR,DelftUniversityofTechnology,2628CDDelft,TheNetherlands(Retired) Correspondingauthor:GamantyoHendrantoro(gamantyo@ee.its.ac.id)']","The implementation of the CC OFDM MIMO radar includes addressing the beam squinting problem, arranging multiple beams, and utilizing Golay codes for orthogonalization (Kuswidiastuti et al., 2022).","to realize high gain, which makes the production cost higher. In addition, when operating in beam- scanning mode, the time-on-target achieved by electronically scanning radars is limited. Multi-beam radars, in which multiple beams are formed simultaneously and continuously at both the transmitter and the receiver at different angular directions, can eliminate 53682 This work is licensed under a Creative Commons Attribution 4.0 License. For more information, see VOLUME 10, 2022 D. Kuswidiastuti et al.: Transmitter Design for Multibeam CC-OFDM Azimuth Scanning MIMO Radar the aforesaid problem of limited time-on-target. Multi-beam radar technology is beneﬁcial to various radar applications, such as surveillance , , automotive radar , , radar imaging , , joint multiuser communication and radar , , etc. In",1.0,0.9388452255177422
"the transmitters transmit a frame consisting of 12 consecutive symbols in series. The frame period is 1.2 ms, when the symbols are orthogonal, then the maximum unambiguous range is not only 15 km but 12 times longer (i.e. 180 km). CC-OFDM transmitter and receiver block diagram incor- porates simple transmit and receive modules. Fig. 1 depicts the block diagram of a transmit/receive (T/R) module, which is one out of 101 that constitute the MIMO transmitter system 109896 VOLUME 13, 2025 D. Kuswidiastuti et al.: Receiver Processing of the Multibeam Azimuth Scanning CC-OFDM-MIMO Radar FIGURE 1. Block diagram of a transmit receive module of CC-OFDM MIMO radar. TABLE 1. CC-OFDM MIMO radar system specifications for surveillance applications. of the surveillance radar.","['. The latter indicates that the CC OFDM MIMO radar can achieve a high resolution in angle, range, and velocity,withbeamisolationof−30dBforneighboringbeamsandco-channelbeams. INDEX TERMS Array signal processing, circulating-codes, Golay-codes, MIMO-radar, multi-beam, OFDM,software-defined-radar,sub-band,space-timecodes,surveillance. I', '. INDEX TERMS MIMO radar, parameter estimation, phased array radar, probability of detection, target detection. I. INTRODUCTION for biomedical engineering, macro-scale radars on radioMulti-antenna radar systems have been known and used in astronomy, and so on [4], [5]', '(13) herein as the subarrayed MIMO (SMIMO) radars, such as theFPMIMOradar,rangesbetweentwoextremeconfiguraNotation ⊗ denotes the Kronecker product operator, tions, namely the PA and the MIMO radar', '. By taking as an example the design of long-rangesurveillanceradar,thepaperdiscussesfurtherissuespertinenttotheimplementationoftheCC OFDM MIMO radar, including the beam squinting problem and its remedy, arrangement of the multiple beams, the radar system structure, use of Golay codes for orthogonalization and PAPR mitigation, use of software-definedradarthateliminatestheneedofamplitudeandphasecontrolineachtransmitter,transmit', '. DigitalObjectIdentifier10.1109/ACCESS.2022.3175883 A Transmitter Design for the Multi-beam CC-OFDM Azimuth Scanning MIMO Radar DEVYKUSWIDIASTUTI 1,(StudentMember,IEEE),L.P.LIGTHART 2,(LifeFellow,IEEE), ANDGAMANTYOHENDRANTORO 1,(SeniorMember,IEEE) 1DepartmentofElectricalEngineering,InstitutTeknologiSepuluhNopember,Surabaya60111,Indonesia 2IRCTR,DelftUniversityofTechnology,2628CDDelft,TheNetherlands(Retired) Correspondingauthor:GamantyoHendrantoro(gamantyo@ee.its.ac.id)']","The CC OFDM MIMO radar can achieve high resolution in angle, range, and velocity, with beam isolation of −30 dB for neighboring and co-channel beams (Kuswidiastuti et al., 2022).","symbols and frame transmission and reception schedul- ing, including the low/high-power modes, beam processing at the receiver by parallel processing, range and Doppler processing involving OFDM symbols and frames. VOLUME 10, 2022 53683 D. Kuswidiastuti et al.: Transmitter Design for Multibeam CC-OFDM Azimuth Scanning MIMO Radar beamforming applications, SDR technology is preferred for its ﬂexibility and low cost , . In our case, the SDR implements all baseband processing at the transmitter and the receiver, including generating inter-element delay required for the application of CC at the transmitter. Beamforming design that meets the required maximum beamwidth in the azimuth is achieved by determining the suitable number of elements employed on the horizontal axis. A good beam pattern can be obtained",0.8333333333333334,0.9432362782689742
"for the n-th subcarrier for symbol a in beam b is given by gn,a,b, with the sampling period of Ts. The maximum unambiguous range, Rmax, will depend on the OFDM symbol period of T0. However, by transmitting Ns orthogonal symbols in series can extend the maximum range up to Ns times further. According to the waveform specification in Table 1, the 12 symbols are transmitted in series over 12T0 to extend the maximum range from 15 up to 180 km. The beams and the CC-OFDM symbols are Golay VOLUME 13, 2025 109897 D. Kuswidiastuti et al.: Receiver Processing of the Multibeam Azimuth Scanning CC-OFDM-MIMO Radar coded and transmitted using the allocated sub-band following a specific schedule that is well known","['. The latter indicates that the CC OFDM MIMO radar can achieve a high resolution in angle, range, and velocity,withbeamisolationof−30dBforneighboringbeamsandco-channelbeams. INDEX TERMS Array signal processing, circulating-codes, Golay-codes, MIMO-radar, multi-beam, OFDM,software-defined-radar,sub-band,space-timecodes,surveillance. I', '. DigitalObjectIdentifier10.1109/ACCESS.2022.3175883 A Transmitter Design for the Multi-beam CC-OFDM Azimuth Scanning MIMO Radar DEVYKUSWIDIASTUTI 1,(StudentMember,IEEE),L.P.LIGTHART 2,(LifeFellow,IEEE), ANDGAMANTYOHENDRANTORO 1,(SeniorMember,IEEE) 1DepartmentofElectricalEngineering,InstitutTeknologiSepuluhNopember,Surabaya60111,Indonesia 2IRCTR,DelftUniversityofTechnology,2628CDDelft,TheNetherlands(Retired) Correspondingauthor:GamantyoHendrantoro(gamantyo@ee.its.ac.id)', '. isillustratedashavingaradarbeamthatcoversaspanofthe In this manner, the FPMIMO radar can achieve a desired azimuthangle', '(13) herein as the subarrayed MIMO (SMIMO) radars, such as theFPMIMOradar,rangesbetweentwoextremeconfiguraNotation ⊗ denotes the Kronecker product operator, tions, namely the PA and the MIMO radar', '. SNR for target [11] G. Krieger, ‘‘MIMO-SAR: Opportunities and pitfalls,’’ IEEE Trans. range detection can be optimized by varying the number of Geosci. Remote Sens., vol. 52, no. 5, pp.2628–2645, May 2014, doi: orthogonalsymbolsperframe. 10.1109/TGRS.2013.2263934. Sincemostprocessesmainlydependonthearrangementof [12] D.-S.JangandH.-L.Choi,‘‘Interleavedradarpulseschedulingformultitargettrackingwithmultiplesimultaneousreceivebeams,’’IEEETrans. thetransmittedwaveformsandtheprocessingofthereceived Aerosp']","The CC OFDM MIMO radar can achieve a high resolution in angle, range, and velocity, with beam isolation of −30 dB for neighboring beams and co-channel beams (Kuswidiastuti et al., 2022).","the high PAPR of the OFDM signal. If orthogonal codes are given to successive OFDM symbols, it could also provide orthogonality between 53684 VOLUME 10, 2022 D. Kuswidiastuti et al.: Transmitter Design for Multibeam CC-OFDM Azimuth Scanning MIMO Radar the OFDM symbols, which in turn can extend the maxi- mum unambiguous range of the radar. The orthogonalities between OFDM subcarriers and between OFDM symbols allow OFDM radar to produce a range and Doppler proﬁle independent from each other . This is one of the advan- tages of using OFDM instead of LFM as radar waveform. The above considerations motivate the development of digitally generated beam steering without phase shifter, by providing phase control of the signal directly from waveform generation",1.0,0.9266953744726006
"The beams and the CC-OFDM symbols are Golay VOLUME 13, 2025 109897 D. Kuswidiastuti et al.: Receiver Processing of the Multibeam Azimuth Scanning CC-OFDM-MIMO Radar coded and transmitted using the allocated sub-band following a specific schedule that is well known by the transmitter and receiver. The neighboring beam must use different sub-band and sub-band reuse is allowed for beams that are at least 10◦ in separation. In order to generate CC-OFDM waveform, additional phase steering β(fn,a,b, (cid:49)tb) is given to the specified OFDM sub-band frequencies of beam b to provide phase difference between the transmit elements for creating the beam b. Circulating code in LFM MIMO radar which is discussed in , obtain this phase difference by transmitting coherent signals","['. The latter indicates that the CC OFDM MIMO radar can achieve a high resolution in angle, range, and velocity,withbeamisolationof−30dBforneighboringbeamsandco-channelbeams. INDEX TERMS Array signal processing, circulating-codes, Golay-codes, MIMO-radar, multi-beam, OFDM,software-defined-radar,sub-band,space-timecodes,surveillance. I', '. DigitalObjectIdentifier10.1109/ACCESS.2022.3175883 A Transmitter Design for the Multi-beam CC-OFDM Azimuth Scanning MIMO Radar DEVYKUSWIDIASTUTI 1,(StudentMember,IEEE),L.P.LIGTHART 2,(LifeFellow,IEEE), ANDGAMANTYOHENDRANTORO 1,(SeniorMember,IEEE) 1DepartmentofElectricalEngineering,InstitutTeknologiSepuluhNopember,Surabaya60111,Indonesia 2IRCTR,DelftUniversityofTechnology,2628CDDelft,TheNetherlands(Retired) Correspondingauthor:GamantyoHendrantoro(gamantyo@ee.its.ac.id)', '. By taking as an example the design of long-rangesurveillanceradar,thepaperdiscussesfurtherissuespertinenttotheimplementationoftheCC OFDM MIMO radar, including the beam squinting problem and its remedy, arrangement of the multiple beams, the radar system structure, use of Golay codes for orthogonalization and PAPR mitigation, use of software-definedradarthateliminatestheneedofamplitudeandphasecontrolineachtransmitter,transmit', '. isillustratedashavingaradarbeamthatcoversaspanofthe In this manner, the FPMIMO radar can achieve a desired azimuthangle', 'D.Kuswidiastutietal.:TransmitterDesignforMultibeamCC-OFDMAzimuthScanningMIMORadar theaforesaidproblemoflimitedtime-on-target.Multi-beam OFDM MIMO waveform [31]. A set of orthogonal waveradar technology is beneficial to various radar applications, formscanbesimplyacquiredbyarrangingtheallocationof suchassurveillance[3],[4],automotiveradar[5],[6],radar orthogonal subcarriers into different antennas of the MIMO imaging[7],[8],jointmultiusercommunicationandradar[9], radar system']","The CC OFDM MIMO radar can achieve high resolution in angle, range, and velocity, with beam isolation of −30dB for neighboring beams (Kuswidiastuti et al., 2022).","beams pointing at increasing scan angles. In a previous patent , simultaneous multiple beams are generated using OFDM multiple antennas being fed at different points along a trans- mission line providing delay or phase differences between successive antennas, but the use of such a physical delay source limits its capability and ﬂexibility. On the other hand, OFDM signals with various delays can be produced with CC by ﬂexibly exploiting a programmable waveform gener- ator (WG). In the CC-OFDM MIMO radar, a novel technique can be used further to mitigate beam broadening for large scanning angles. In a way, the strategy of CC-OFDM MIMO radar can be viewed as a realization of hybrid between phased array and MIMO techniques , .",1.0,0.947699870740595
"the specified OFDM sub-band frequencies of beam b to provide phase difference between the transmit elements for creating the beam b. Circulating code in LFM MIMO radar which is discussed in , obtain this phase difference by transmitting coherent signals with a small time delay difference ((cid:49)tb) between the antenna element. However, using an OFDM signal, this phase steering can be provided by giving a phase difference to the OFDM subcarrier phase in the frequency domain of the OFDM signal generation stage. The phase steering given to the CC-OFDM waveform can be defined as follow: β(fn,a,b, (cid:49)tb) = 2πfn,a,b(cid:49)tb Hence, the array factor of CC-OFDM will be: AF(θ, fn,a,b, (cid:49)tb) = Nt −1 2X Ipejp(α(θ)+β(fn,a,b,(cid:49)tb) where α(θ) = p=− Nt","['. Hassanien and S. A. Vorobyov, ‘‘Phased-MIMO radar: A tradeoff theAcademicianoftheRussianAcademyofTransport.HeisalsoaFounding betweenphased-arrayandMIMOradars,’’IEEETrans.SignalProcess., vol.58,no.6,pp.3137–3151,Jun.2010,doi:10.1109/TSP.2010.2043976', '(13) herein as the subarrayed MIMO (SMIMO) radars, such as theFPMIMOradar,rangesbetweentwoextremeconfiguraNotation ⊗ denotes the Kronecker product operator, tions, namely the PA and the MIMO radar', '. INDEX TERMS MIMO radar, parameter estimation, phased array radar, probability of detection, target detection. I. INTRODUCTION for biomedical engineering, macro-scale radars on radioMulti-antenna radar systems have been known and used in astronomy, and so on [4], [5]', '. With this advantage, PA radars ject [6]–[18]. Unlike the PA radar, the MIMO radar utilizes have been used for such applications as micro-scale radars manyantennasthattransmitorthogonalsignalstoobtainthe signal reflected from the target at the receiver, a scheme The associate editor coordinating the review of this manuscript and known as waveform diversity [9]. Consequently, MIMO approvingitforpublicationwasDimitrisE.Anagnostou', '. ified delay between successive antennas of a MIMO radar, Multiple simultaneous beams can be generated by employ- intended to produce correlated waveforms with the purpose ing a number of transceivers operating individually, each of acquiring better control over the beampattern. CC have attached to an antenna with a beam pointing at a specified been proposed for application in MIMO radars, originally direction, in total covering a specified angular range']","The generation of multiple simultaneous beams in MIMO radar can be achieved by using several transceivers, each connected to an antenna directed at a specific angle, thereby covering a designated angular range (Hassanien and Vorobyov, 2010).","signal is circulated from one antenna element to another with a relatively small time-delay differ- ence ((cid:49)t), made possible by circulating codes (CC) , , . Hence the transmit signal from the p-th element for a transmit antenna array with an odd number of elements, Nt , can be written as: xp(t) = x(t − p(cid:49)t), Nt − 1 , . . . , Nt − 1 (1) The time delay difference of the circulating signal corre- sponds to a phase difference between the antenna elements at a given frequency: (cid:49)ϕ = 2πf (cid:49)t (2) It means that the phase steering that is usually provided by a phase shifter at each antenna element now can be realized directly in the",0.75,0.9438616205917301
"together with transmit scheduling to avoid transmit receive coupling. The receive scheduling is also related to the time scheduling of the correlation between symbols, which is an important stage in the beam and range processing. The transmit and receive time schedule of CC-OFDM radar is described in Fig. 4. The receive scheduling is very important, especially in a multiple target scheme. The echo signals caused by two or more targets at different ranges (i.e., one target is near to the radar, and the other is far) could cause range ambiguity. The clock synchronization between the multiple transmitters and the multiple receivers of CC-OFDM radars are very crucial to guarantee that the receiver can give the accurate detection. It can be","['. The latter indicates that the CC OFDM MIMO radar can achieve a high resolution in angle, range, and velocity,withbeamisolationof−30dBforneighboringbeamsandco-channelbeams. INDEX TERMS Array signal processing, circulating-codes, Golay-codes, MIMO-radar, multi-beam, OFDM,software-defined-radar,sub-band,space-timecodes,surveillance. I', '. INDEX TERMS MIMO radar, parameter estimation, phased array radar, probability of detection, target detection. I. INTRODUCTION for biomedical engineering, macro-scale radars on radioMulti-antenna radar systems have been known and used in astronomy, and so on [4], [5]', '. [30] G. Hakobyan, M. Ulrich, and B. Yang, ‘‘OFDM-MIMO radar with L.P.LIGTHART(LifeFellow,IEEE)wasbornin optimized nonequidistant subcarrier interleaving,’’ IEEE Trans. TheNetherlands,inSeptember1946.Hereceived Aerosp. Electron. Syst., vol. 56, no. 1, pp.572–584, Feb. 2020, doi: 10.1109/TAES.2019.2920044. the degree (cum laude) in engineering and the [31] C.Knill,F.Embacher,B.Schweizer,S.Stephany,andC.Waldschmidt, Ph.D.degreefromtheDelftUniversityofTech‘‘Coded OFDM waveforms for MIMO radars,’’ IEEE Trans', '. In the works on the PMIMO radar in [22]–[29], The evaluation on the detection performance in terms of the improvement in radar performance factors such as theprobabilityofdetectionandtheprobabilityoffalsealarm spatial resolution, parameter identifiability, transmit-receive reportedhereinisanextensionofstudyby[32].Theseparam(T-R)gain,andsignal-to-interference-plus-noisepowerratio etersareevaluatedbasedonseveralaspectssuchastheeffect (SINR)hasbeenreported.Theresultsofinvestigationsin[29]', '. However, one could extend the surveillance radar has been described to clarify the con- maximum unambiguous range of the radar by sendceptanddemonstratethepotentialissuesandadvantagesof ingmultiplesuccessiveorthogonalCC-OFDMsymbols the CC-OFDM MIMO radar']","The CC OFDM MIMO radar can achieve high resolution in angle, range, and velocity, which is crucial for accurate detection in multiple target scenarios (Hakobyan et al., 2020).","In our case, quasi-continuous transmission is used through proper scheduling of OFDM transmission and echoes reception to prevent the coupling. • The receiver that continuously receives signal echoes coming from multiple targets must be able to distinguish which targets are very near or very far from the radar. This is the reason in this paper that orthogonal codes are given to successive CC-OFDM symbols. These unique codes are given and known by the receiver, so that the receiver could properly detect and distinguish targets nearby and far away from the radar. In this paper we describe the waveform design of a CC-OFDM quasi-continuous wave for MIMO long the range radar. Quasi-CW transmission could limit leakage/coupling problem by time-isolation of the",0.6,0.926873191615772
"correlation function between the received signals with the reference signal can be derived as follow: χyx(θ, θ ′, τ, τ0, fD) = σ ejϑ R4 2NsT0X (cid:26) (Nt −1) 2X (Nt −1) 2X k=0 p=− (Nt −1) q=− (Nt −1) {IpIqejpα(θ)e−jqα(θ ′) Nc−1 Nc−1 n=0 m=0 (cid:26) Cn,p,a,bC ∗ m,q,a′,b′gn,a,bgm,a′,b′ × ej2πkTs(fIF +fn,a,b+fD) × e−j2πkTs(fIF +fm,a′,b′ ) × ej2πfn,a,b[p(cid:49)tb−(a−1)T0] × e−j2πfm,a′,b′ [q(cid:49)tb−(a′−1)T0]ej2π(τ −τ0)(fIF +fn,a,b) (cid:27)(cid:27) (14) PNc−1 Because the subcarrier frequency of the OFDM signal and the Golay codes are orthogonal, then the term PNc−1 m=0 gn,a,bgm,a′,b′ = 0 for n ̸= m, a ̸= a′, n=0 or b ̸= b′, hence the cross correlation, χyx(θ, θ ′, τ, τ0, fD) will be zero. The correlation function value will be","['transmission is used through proper orthogonalitybetweentheCC-OFDMsymbolsisbeneficial schedulingofOFDMtransmissionandechoesreception in obtaining an optimum SNR for increasing the maximum topreventthecoupling', '. The Golay code is bined.ThenthereceivedRFsignalgoesthroughtheanalog applied in the frequency domain of the OFDM signal and receiverchain,whichconsistofLNAandtheRFtoIFdown- then the signal is phase shifted by pβ(f n,a,b ,(cid:49)t b ), with p = converters', '. −∞ However, the ambiguity function of CC-OFDM radar ii. χ fu θ n 0 , c a t (cid:48) i = o a n = a 1 s ,b a (cid:48)= fu b ( n τ c , ti f o D n = of 0 ti , m θ e ,(cid:49) de t l b a ) y is va th ri e ab ra le d , a τ r , a a m nd bi a g n u g i u ty is a multi-dimensional function', '. Since the number of Golay codes are limited x p R , F a,b (t)=x p IF ,a 2 ,b (t)ej2πfRFt ∗h RF (t) (24) (there are in total 256 available Golay codes that can where f = 3GHz − f − f , while h (t) and h (t) RF IF2 IF IF2 RF beusedfor256-subcarrierOFDMsymbols),codereuse denote the impulse responses of the filters used to suppress becomes inevitable', '. The orthogonalities sionandreceptionoftheradarsystemasinapulseradarsysbetween OFDM subcarriers and between OFDM symbols tem,whileitalsohastheadvantageofaCWradarthathasa allow OFDM radar to produce a range and Doppler profile largetimebandwidthproduct.However,thepeak-to-average independentfromeachother[41].Thisisoneoftheadvan- power ratio (PAPR) of OFDM signals becomes an issue tagesofusingOFDMinsteadofLFMasradarwaveform.The becauseitstillmaycausetoohighpower-couplingbetween above considerations motivate']",The orthogonality between OFDM subcarriers and symbols allows the CC-OFDM radar to produce a range and Doppler profile independent from each other (A Transmitter Design for the Multi-beam CC-OFDM Azimuth Scanning MIMO Radar).,"frequency fa,n,b of the b-th beam, and C (cid:48)∗ m,q,a(cid:48),b(cid:48) denotes the complex conjugate of the correction phase of the received CC-OFDM symbols, given to the m-th carrier frequency of b(cid:48)-th beam, which use subcarrier fa(cid:48),m,b(cid:48). For the surveillance In the following, various ambiguity functions, each a func- tion of beam, of delay and of Doppler frequency, are pre- sented with transmitter time, sub band and codes scheduling for symbol-1 as visually described in Table 2. Based on the ambiguity function formulation in (32), the analyses are described as follows: i. χa(cid:48)=a=1,b(cid:48)=b(τ = 0, fD = 0, θ0, θ, (cid:49)tb) is the radar ambiguity function analyzed by taking a variable value of θ0 as a function of angular variable, θ.",0.75,0.9223016225312067
"B. DOPPLER PROCESSING SIMULATION AND ANALYSIS B. DOPPLER PROCESSING SIMULATION AND ANALYSIS In this subsection, the Doppler processing of a moving target is analyzed. For the Doppler processing in this paper, we set VOLUME 13, 2025 109903 D. Kuswidiastuti et al.: Receiver Processing of the Multibeam Azimuth Scanning CC-OFDM-MIMO Radar echoes received from targets. Beams that receive echoes by targets in their respective directions can be identified correctly by correlating the sum of signals containing echoes from all receive modules with individual signals transmitted individual beams. Correlations are done per symbol, and after delay compensation, coherence processing is done for all the 12 symbols. The simulation results based on the detection of 2 targets at 3 different scenarios show that","['. The latter indicates that the CC OFDM MIMO radar can achieve a high resolution in angle, range, and velocity,withbeamisolationof−30dBforneighboringbeamsandco-channelbeams. INDEX TERMS Array signal processing, circulating-codes, Golay-codes, MIMO-radar, multi-beam, OFDM,software-defined-radar,sub-band,space-timecodes,surveillance. I', '. ified delay between successive antennas of a MIMO radar, Multiple simultaneous beams can be generated by employ- intended to produce correlated waveforms with the purpose ing a number of transceivers operating individually, each of acquiring better control over the beampattern. CC have attached to an antenna with a beam pointing at a specified been proposed for application in MIMO radars, originally direction, in total covering a specified angular range', '. INDEX TERMS MIMO radar, parameter estimation, phased array radar, probability of detection, target detection. I. INTRODUCTION for biomedical engineering, macro-scale radars on radioMulti-antenna radar systems have been known and used in astronomy, and so on [4], [5]', '(13) herein as the subarrayed MIMO (SMIMO) radars, such as theFPMIMOradar,rangesbetweentwoextremeconfiguraNotation ⊗ denotes the Kronecker product operator, tions, namely the PA and the MIMO radar', '. DigitalObjectIdentifier10.1109/ACCESS.2022.3175883 A Transmitter Design for the Multi-beam CC-OFDM Azimuth Scanning MIMO Radar DEVYKUSWIDIASTUTI 1,(StudentMember,IEEE),L.P.LIGTHART 2,(LifeFellow,IEEE), ANDGAMANTYOHENDRANTORO 1,(SeniorMember,IEEE) 1DepartmentofElectricalEngineering,InstitutTeknologiSepuluhNopember,Surabaya60111,Indonesia 2IRCTR,DelftUniversityofTechnology,2628CDDelft,TheNetherlands(Retired) Correspondingauthor:GamantyoHendrantoro(gamantyo@ee.its.ac.id)']","The CC OFDM MIMO radar can achieve high resolution in angle, range, and velocity, with beam isolation of −30 dB for neighboring beams and co-channel beams (Kuswidiastuti et al., 2022).","symbols and frame transmission and reception schedul- ing, including the low/high-power modes, beam processing at the receiver by parallel processing, range and Doppler processing involving OFDM symbols and frames. VOLUME 10, 2022 53683 D. Kuswidiastuti et al.: Transmitter Design for Multibeam CC-OFDM Azimuth Scanning MIMO Radar beamforming applications, SDR technology is preferred for its ﬂexibility and low cost , . In our case, the SDR implements all baseband processing at the transmitter and the receiver, including generating inter-element delay required for the application of CC at the transmitter. Beamforming design that meets the required maximum beamwidth in the azimuth is achieved by determining the suitable number of elements employed on the horizontal axis. A good beam pattern can be obtained",0.8333333333333334,0.9497119041638677
"and at the same beam direction, in this case around the range resolution of the radar, which is 60 meter are also can be distinguished with PSLL of −45 dB. The simulation results show that the coupling between beams and symbols are very low as the result of codes and sub-band scheduling at the transmitter. These results are valid for the three scenarios whether the targets are in the same beam, at the nearest neighboring beams and at the nearest co-channel beams. It shows that with the concept proposed in CC-OFDM MIMO Radar, it is possible to design a long-range radar with low power transmission by transmitting multi-orthogonal CC-OFDM symbols in series, to improve the Signal-to-Noise of the radar system.","['. The latter indicates that the CC OFDM MIMO radar can achieve a high resolution in angle, range, and velocity,withbeamisolationof−30dBforneighboringbeamsandco-channelbeams. INDEX TERMS Array signal processing, circulating-codes, Golay-codes, MIMO-radar, multi-beam, OFDM,software-defined-radar,sub-band,space-timecodes,surveillance. I', '(13) herein as the subarrayed MIMO (SMIMO) radars, such as theFPMIMOradar,rangesbetweentwoextremeconfiguraNotation ⊗ denotes the Kronecker product operator, tions, namely the PA and the MIMO radar', '. DigitalObjectIdentifier10.1109/ACCESS.2022.3175883 A Transmitter Design for the Multi-beam CC-OFDM Azimuth Scanning MIMO Radar DEVYKUSWIDIASTUTI 1,(StudentMember,IEEE),L.P.LIGTHART 2,(LifeFellow,IEEE), ANDGAMANTYOHENDRANTORO 1,(SeniorMember,IEEE) 1DepartmentofElectricalEngineering,InstitutTeknologiSepuluhNopember,Surabaya60111,Indonesia 2IRCTR,DelftUniversityofTechnology,2628CDDelft,TheNetherlands(Retired) Correspondingauthor:GamantyoHendrantoro(gamantyo@ee.its.ac.id)', '. By taking as an example the design of long-rangesurveillanceradar,thepaperdiscussesfurtherissuespertinenttotheimplementationoftheCC OFDM MIMO radar, including the beam squinting problem and its remedy, arrangement of the multiple beams, the radar system structure, use of Golay codes for orthogonalization and PAPR mitigation, use of software-definedradarthateliminatestheneedofamplitudeandphasecontrolineachtransmitter,transmit', '. INDEX TERMS MIMO radar, parameter estimation, phased array radar, probability of detection, target detection. I. INTRODUCTION for biomedical engineering, macro-scale radars on radioMulti-antenna radar systems have been known and used in astronomy, and so on [4], [5]']","The CC OFDM MIMO radar can achieve high resolution in angle, range, and velocity, with beam isolation of −30 dB for neighboring and co-channel beams (Kuswidiastuti et al., 2022).","the transmitter design for long-range surveillance radar has been described to clarify the concept and demonstrate the potential advan- tages of the CC-OFDM MIMO radar. By using the proposed design, a range resolution of 52 meter and an azimuth resolu- tion of 1.7◦ can be achieved. For the multi-beam scheme, the beam isolation of −30 dB can be achieved for both between the co-channel beams and between the neighboring beams. The receiver design of CC-OFDM radar, including the beam, range and Doppler processing of the received signal will be discussed in a separate paper.",0.8333333333333334,0.940809183894559
"with the following formula: TP + TN TP + TN + FP + FN Accuracy = Precision = Recall/True Positive Rate(TPR) TP TP + FP TP TP + FN F1 = 2 × precision × recall precision + recall FP TN + TP (cid:90) 1 TPRd(FPR) False Positive Rate(FPR) = AUC = (4) (5) (6) (7) (8) (9) where TP is the number of correctly predicted positive labels, TN is the number of correctly predicted negative labels, FP is the number of incorrectly predicted positive labels, and FN is the number of incorrectly predicted negative labels. Accuracy is the ratio of true predictions to the overall data. Precision is the ratio between TP to the total number of positive predic-","["". These metrics can be calculated by (1) – (3). This study's calculation of True Positive, False Positive, and False Negative differs from other classifications or detections [20]-[23]. These are chosen and calculated following previous studies [1]. Precision detects the truly correct prediction out of all predictions. Recall detects the truly correct prediction out of all actual classes. F1 scores are harmonic mean between these two that measure overall model performance"", '. performance evaluation score, where the highest accuracy Following the definition in the previous paragraph, we plot is under 85%, the model needs further improvement so that the frequency of each misclassification type in Fig 13 and thedetectionvaliditycanbeenhancedandthatthedetection Fig 14', 'that could be vital for accurate classification [40]', '. Accuracy = (15) Based on the sampling result on 659 data, the dataset TP+TN +FP+FN used in this study is arranged as shown in detail in Table 3. TP Recall(Sensitivity) = (16) In the dataset, there are 11 initial features, since not all TP+FN initial features are used to create the model. They had to TP Precision(P) = (17) go through the feature extraction process first to obtain the TP+FP features used to create the model detection', '. CLASSIFICATION RESULTS IN EACH ACCEPTED FEATURES Entropy Gini Index Depth Accuracy Sensitivity Specificity Accuracy Sensitivity Specificity 3 0.998682278 0.998137797 0.999314045 0.998658464 0.99810826 0.99929689 4 0.998706092 0.998152616 0.999348339 0.998666337 0.998152476 0.999262572 5 0.998793258 0.998285484 0.999382522 0.998809288 0.9983002 0.999399863 6 0.998927976 0.998521585 0.999399554 0.998927976 0.998521585 0.999399554 7 0.998927976 0.998521585 0.999399554 0.998753491 0.998226492 0.999365243 8']","Precision and recall are defined as the ratio of true positive predictions to total predictions and true positive predictions to actual classes, respectively, with F1 scores serving as the harmonic mean of these two metrics (Referensi 1).","(TP+FP). To determine how well a positive value is found, recall is employed. It applies true positives (TP) to all ground truth values, which include both true positives and false negatives (FN). The F1 score is an evaluation metric that combines a model’s precision and recall scores, as illustrated in the equation that calculates accuracy. The accuracy statistic computes the number of times the iYOLOV7-TPE-SS model predicted accurately throughout the entire dataset , : F1score = 2 · (P · R) (P + R) (13) The system performance of the iYOLOV7-TPE-SS model has been evaluated using a metric known as mean average accuracy (mAP), which takes into account the average recall (AR), F1-score, and inference time. The inference time has",1.0,0.9611018818704904
"exhib- ited better performance than the MobileNet model, in which the models achieved an accuracy of 85% and 84.52%, respectively. Furthermore, the ResNet-101 model achieved a higher recognition performance of 88.37%, while the MobileNetV2 achieved the performance with an accuracy of 85.46% and a precision, recall, and F1 of 91%, 84%, and 85%, respectively. Furthermore, we performed more experi- ments using several different architectures i.e., DenseNet169, InceptionResNetV2, Xception, and EfﬁcientNetB4 that yielded accuracy of 88.76%, 87.16%, 89.31%, and 88.21%, respectively. The highest accuracy achieved by the benchmark models was only 89.31%. Our previous study proposed a data aug- mentation technique based on neural style transfer and geo- metric transformation to address the scantiness of Balinese carving data , which increased","['. sometimesneedtoreduceimagesizestolightenthecomputaHavingadatasetdoesn’tmeanitcanbedirectlyfedintothe tionalload.Often,datasetsderivedfromdifferentmodalities deeplearningmodel.Twocriticalstepsthatneedtobecarried also have varying image sizes, making it necessary to stanoutfirstarepreprocessingandaugmentation.Thepurposeof dardizeimagesizesforfurtherprocessing.Severalstudiesin preprocessing and augmentation is to enhance dataset qual- thepaperswereviewedhaveperformedimageresizingduring ity, ultimately', '. 9. The comparison of VGG19 style transfer images with different Nitik style. The used layers from left to right are ""conv1_1"", weighting factor compositions ""conv2_1"", ""conv3_1"", ""conv4_1"", and ""conv5_1"". C. Survey Results Fig. 9 displays a comparison of a few generated images The survey managed to garner 216 responses. There are using the VGG19 model with different weighting factor six sections in this survey. The first section of the settings each', '. However, the study of Wang et al. [3] I. INTRODUCTION and Ihsan [7] pointed out that architectures with better accuracy struggle to properly migrate over the features of style One of the computer vision applications involves image images. Although the former study introduced a novel recognition. In 2015, Simonyan and Zisserman [1] presented stylization to improve other architectures, literature about their work regarding large-scale image recognition', '. [6] and Ihsan [7]. The VGG19 study. architecture was regarded as the best neural network model to perform style transfer on batik-style images. Among its layers, II. RELATED WORKS the layer ""conv3_1"" performs better than other layers in the Simonyan and Zisserman [1] introduced the convolutional same network. The study concluded that batik-style transfer neural network architecture named VGG. This architecture images can be regarded as a form of batik art', '. The D. Data Collection and Analysis convolutional layer “conv5_1” of both neural networks was used to represent content image features. As for the style Several data were collected in this study. When style image, the experiment used the layers “conv1_1”, “conv2_1”, transfer was performed, the information about its time “conv3_1”, “conv4_1”, and “conv5_1” to store the style computation and loss values were recorded aside from representation similar to Gatys et al. [2]. The models were producing new images']",,"Results from the performance evaluation for CNN, BiLSTM, BiGRU, CNN-BiGRU, HWE-CBiGRU without attention, and HWE-CBiGRU with soft attention, with respect to accu- racy, recall, precision, and F1 score, are presented in Table 4. The conventional CNN architecture produced good per- formance with an accuracy, recall, precision, and F1 score of 84.35%, 86.24%, 84.26%, and 85.24%, respectively. The BiLSTM model obtained a lower accuracy and F1 score of 81.24% and 84.84%, respectively, compared to CNN despite having a relatively high recall rate. Mean- while, the BiGRU model obtained the highest accuracy, recall, precision, and F1 score among the baseline mod- els, with a value of 85.46%, 87.80%, 86.85%, and 86.31%, respectively. The CNN-BiGRU model exhibited enhanced accuracy and F1 score in",0.0,0.0
"process, an audit involves acquiring and objectively evaluating evidence related to allegations of economic activities and other operations. The aim is to assess the level of conformity between the reports and predefined criteria, and to communicate the results to relevant users, in this case, the organization responsible for establishing information system gover nan nance. One of the proven frameworks for information system auditing is the Control Objectives for Information and Related Technology (COBIT) 2019, which is utilized as the reference framework in this research . COBIT 2019 offers an effective methodology for evaluating the capability of information technology processes, specifically focusing on Deliver, Service and Support - Operation Management. This framework guarantees that the data (DSS01) is received, managed fully,","["". INTRODUCTION implementation of improvements. Audit system with Control Objectives for Information and Audit with COBIT 2019 and process mining from event Related Technologies (COBIT) is a process that refers to a logs represents a holistic approach to evaluating and framework designed to assist organizations in managing and enhancing the effectiveness of an organization's information controlling information technology more effectively [1], [2]. systems [12]"", '. Previous Research of Audit using COBIT 2019 based on semantic similarities, preprocessing data to calculate PreviousresearchonauditingwithCOBIT2019hasinvestithese similarities and effectively merging nodes and relationgated multiple facets of IT governance and auditing, applying ships. the framework across diverse domains and industries', '. Recommendations based on COBIT 2019 best practices, such as performance measurements and knowledge repository access, further enhance IT governance processes and contribute to the success of software development projects. The integration of AI and machine learning techniques with the COBIT 2019 framework holds promise in further enhancing IT governance practices [19]', "". insights into the performance of the organization's information Thus, the system audit with COBIT helps organizations systems, along with recommendations for more effective IT improve the reliability, security, and operational efficiency in management. Thus, audit with COBIT and process mining managing their information technology"", '. The results show a list of recommended activities based on the company In previous research, as found in the paper [3], [4], [5] strategy, this can simplify the company audit process. and [6] to obtain Activities from the COBIT Core Model Keywords—Audit Management, COBIT 2019, Cosine Similar- and Capability Scores, it is necessary to undergo a mapping ity, Financial, Knowledge Graph, Neo4J process according to the instructions in the COBIT 2019 manual. This can be time-consuming, especially when auditor I']","The audit process utilizing COBIT enhances the reliability, security, and operational efficiency of information technology management within organizations.","assist organizations in managing and optimizing their use of information technology (IT) . landscape, effective IT In today’s rapidly evolving digital governance is essential for organizations to ensure that their IT investments align with business objectives, comply with regulations, and mitigate risks . COBIT 2019 provides a structured approach for organiza- tions to establish, implement, and maintain effective gover- nance over IT. It defines the components necessary to create and sustain a governance system, as well as guidelines for building the most suitable governance system for an enterprise . By utilizing COBIT 2019, organizations can enhance the efficiency, effectiveness, and reliability of their IT usage, while also ensuring compliance with relevant regulations, policies, and standards . One of the key",1.0,0.9156385110348609
"the Deliver, Service, and Support (DSS) domain to assess the performance of the system and the standards the governance capabilities at the Customer Care unit using the COBIT framework, specifically within the Deliver, Service, and Support (DSS) domain. The primary focus is on assessing process controls related to Information Technology (IT) services and technical support. Data collection is conducted through surveys to support this evaluation. This study adopts a novel approach in identifying COBIT processes, specifically DSS01, through process mining techniques rather than traditional surveys. Process mining utilizes event logs recorded from daily operations. This technique enables real-time process analysis by applying various analytical methods to process these logs. This approach provides deeper and more accurate insights into the effectiveness","["". insights into the performance of the organization's information Thus, the system audit with COBIT helps organizations systems, along with recommendations for more effective IT improve the reliability, security, and operational efficiency in management. Thus, audit with COBIT and process mining managing their information technology"", '. An analysis of the method\'s Manage Service Levels,"" addresses the management and performance using an event log from a bank\'s credit establishment of service levels within the scope of an application process revealed that it was 100% accurate in organization\'s IT [22]. Within DSS01, organizations are identifying incorrect patterns and judgments', '. Business process governance and potential bottleneck activities. control were evaluated using the COBIT 2019 methodology. The findings indicated that out of 30,000 case IDs, the majority Audit with surveys is an effective method for gathering activity sequence pattern that conformed to the SOP was found essential information to evaluate a process or system [11]. in 97.55% of cases', '. 3) EG10: Staff Skills: This process focuses on improving This allows for deeper analysis, real-time monitoring, and the skills of IT staff to enhance the organization’s better decision-making in IT management, ultimately aiding abilitytomanageITeffectivelyandincreaseoperational in the achievement of business goals [11]. efficiency', '. Using COBIT metrics, organizations XGBoost 4.29 6.34 0.69 40.45 can evaluate and improve the quality of IT Governance, LightGBM 4.74 7.53 0.56 45.14 ensure compliance with regulatory provisions, and improve CatBoost 4.25 6.53 0.67 36.26 operational efficiency. As a result, these initiatives not only are presented in Table IV using MAE, RMSE, R², and MAPE improve the efficiency of project planning and execution but me trics']",The use of surveys is an effective method for gathering essential information to evaluate processes or systems (Identifying Non-Conforming Process in Automobile Insurance Claims Using Process Mining and COBIT 2019).,"guidance for understanding, planning, and implementing effective and efficient IT management principles . By adopting COBIT 2019, organizations can improve their IT performance, reduce risks, and ensure that IT is used to support the achievement of business objectives optimally. Domain DSS01 in COBIT 2019, titled ""Define and Manage Service Levels,"" addresses the management and establishment of service levels within the scope of an organization's IT . Within DSS01, organizations are required to identify specific service requirements, including performance and reliability criteria, and manage user expectations regarding IT services. Additionally, this domain also covers the measurement and monitoring of service performance, as well as the adjustment processes necessary to ensure that the services provided remain in line with established standards. III.",0.6666666666666666,0.9211064831895157
"workflow progress and delivering important insights . A major benefit of this method is its ability to use existing database logs, which can decrease the time and cost needed for data collection. Furthermore, using recorded data can reduce the likelihood of information distortion. Given its capability to analyze log data across different systems, process mining has become popular among companies aiming to examine their processe Thus, process mining not only plays a role in improving operational efficiency but also in enhancing the overall quality of healthcare services. This study discusses how process mining can be implemented to support information system audits based on COBIT 2019 for DSS01 Objective, particularly as a method of collecting and validating data within the process","[""Institut Teknologi Sepuluh Nopember Institut Teknologi Sepuluh Nopember Surabaya 60111, Indonesia Surabaya 60111, Indonesia riyanarto@its.ac.id kelly@its.ac.id Abstract -- The background of this research is facing Prema et al [10] use process mining techniques to examine challenges in identifying process paths that are not in a regional hospital's billing procedure"", '. Survey audits enhance participation still relatively low due to the high variation of trace noise, which and engagement, allowing stakeholders to contribute to affects the outcomes of the process mining models. improving effectiveness and efficiency. Consequently, survey Keywords—COBIT 2019, Event Log, Graph, Process Mining. audits add a qualitative dimension to audit evaluations, facilitating better decision-making and more effective I. INTRODUCTION implementation of improvements', '. visualize and understand the claim process flow, identify This technique involves analyzing event logs or records of noises from established procedures, and find areas needing events that occur within a system, such as business improvement . This analysis provides insights to enhance transactions or user activities. From this data, process mining efficiency and compliance with SOPs in managing automobile maps the actual workflow, identifies patterns, trends, and insurance claims', "". insights into the performance of the organization's information Thus, the system audit with COBIT helps organizations systems, along with recommendations for more effective IT improve the reliability, security, and operational efficiency in management. Thus, audit with COBIT and process mining managing their information technology"", "". mining enables auditors to delve into the event log data In auditing systems with COBIT, auditors use COBIT generated by information systems to visually map process standards and principles to evaluate the maturity and flows. By combining these two approaches, auditors can effectiveness of internal controls within an organization's IT conduct in-depth analyses of system compliance with COBIT system [5]""]",Process mining techniques involve analyzing event logs or records of events within a system to enhance operational efficiency and compliance (Identifying Non-Conforming Process in Automobile Insurance Claims Using Process Mining and COBIT 2019).,"audits enhance participation and engagement, allowing stakeholders to contribute to improving effectiveness and efficiency. Consequently, survey audits add a qualitative dimension to audit evaluations, facilitating better decision-making and more effective implementation of improvements. Audit with COBIT 2019 and process mining from event logs represents a holistic approach to evaluating and enhancing the effectiveness of an organization's information systems . Through the use of the COBIT 2019 framework, auditors can pinpoint key controls necessary to achieve predefined business objectives. Meanwhile, event log process mining enables auditors to delve into the event log data generated by information systems to visually map process flows. By combining these two approaches, auditors can conduct in-depth analyses of system compliance with COBIT standards and identify noises",0.6666666666666666,0.9287517790126879
"stage is performance analysis, where the effectiveness and efficiency of the billing processes are reviewed to identify potential areas for improvement. Overall, these stages are crucial to ensure that the billing practices at the hospital are conducted efficiently and transparently. A. Dataset The ""Hospital Billing"" event log was obtained from the financial module of the ERP system used by a regional hospital , This log records various incidents related to the billing of medical services provided by the hospital. Over a three-year period, from 2013 to 2016, a random sample of 100,000 traces was collected, each representing a recorded example of the process in the system. Within this event log, there are 18 different activities, each depicting distinct stages in","[""Institut Teknologi Sepuluh Nopember Institut Teknologi Sepuluh Nopember Surabaya 60111, Indonesia Surabaya 60111, Indonesia riyanarto@its.ac.id kelly@its.ac.id Abstract -- The background of this research is facing Prema et al [10] use process mining techniques to examine challenges in identifying process paths that are not in a regional hospital's billing procedure"", '. This is Machado, “Discovery of Hospital Billing Process in a Regional due to the high variation in trace noise, which affects the Hospital Using Process Mining,” in 2023 International Conference on outcomes of the process mining models. Third, analysis of Advancement in Data Science, E-learning and Information System case duration showed significant differences in the time (ICADEIS), IEEE, Aug. 2023, pp. 1–5. doi: required to complete a case', "". In this study, data claim process paths that are not in accordance with the SOP from the finance module of the hospital's ERP system was using process mining techniques and the COBIT 2019 explored to determine bottleneck activities in the invoice framework. The research method used involves analyzing procedure. Using anonymised event logs, this study aims to insurance claim log data using the DISCO application to map find causality in the hospital's billing process and identify the sequence of activities""]","The analysis of the hospital's billing process using process mining techniques revealed bottleneck activities that are not in accordance with the standard operating procedures from the finance module of the ERP system (Machado, 2023).","organizations improve the reliability, security, and operational efficiency in managing their information technology. , Prema et al use process mining techniques to examine a regional hospital's billing procedure. This study emphasizes how crucial it is to increase the billing process' effectiveness in order to give patients higher-quality care. In this study, data from the finance module of the hospital's ERP system was explored to determine bottleneck activities in the invoice procedure. Using anonymised event logs, this study aims to find causality in the hospital's billing process and identify potential bottleneck activities. Audit with surveys is an effective method for gathering essential information to evaluate a process or system . Using carefully crafted questionnaires, auditors directly collect data from individuals or",0.2,0.9505636087593385
"Long Short-Term Memory (LSTM) , is a variation of Recurrent Neural Networks (RNN) that has been successfully applied to various Natural Language Processing (NLP) tasks. LSTM has the ability to capture long-range dependencies with sequences making it suitable for solving sequence labeling problems , , , such as Named Entity Recognition tagging (POS-Tag) and Neural (NER), Part-of-Speech combining (NMT). Study Machine Translation Bidirectional LSTM (BiLSTM) model with Conditional Random Field (CRF) to solve NER and POS-Tag Task. BiLSTM encodes word or character vectors into features, while CRF is a classifier to predict the target labels. Previous research has explored enhancing the feature extractor by integrating serves attention mechanisms with existing models or introducing alternative extractors such as Convolutional Neural Networks","['. Softmaxbehavioronvectorsindifferentscales. NERproblem.Combiningthepreviousstate-of-the-artNER model, BiLSTM, with CRF has proven to improve performance [56]. In this paper, CRF is used as the decoder for allencodercombinationsinourexperiment.Foranobserved sequence x = (cid:104)x x ... x (cid:105) with the corresponding tar1 2 n get label y = (cid:104)y y ..', '. D. CONDITIONALRANDOMFIELDLAYER In sequence labeling tasks, such as NER, CRF is a commonmethodused.Accordingtostudies,theHiddenMarkov ModelandtheMaximumEntropyMarkovModel(MEMM) are ineffective at analyzing sentence-level sequences comparedtotheCRFapproach[15].ThemainCRFfeaturesthat can compute cross-position label combination probability grab the researchers’ attention to apply this method to the FIGURE4. Softmaxbehavioronvectorsindifferentscales', '. In this case, the sistent tagging assigns each token the Component, Outside, logmessageisthedatathatwillbeannotated.Todemonstrate andIssuelabels,respectively.Aftercompletingthelabelfor thepowerofcontextuallearningintheTransformerencoder, all unique messages, we do the annotation for all messages two annotation procedures are used to label the data, i.e., contextualtaggingandconsistenttagging.Consistenttagging 6https://tecoholic.github.io/ner-annotator/ VOLUME11,2023 3267', '. TheseBipletsarederivedfromaword-pair-dependencyprocesstocapturesyntacticrelationshipsbetween words.EachBipletpairundergoesdirectcomparisonwithinthepairsegments.Additionally,weemployed a BiLSTM network augmented with multi-head attention to emphasize critical words more effectively. Through experiments carried out using the SNLI Indo dataset, our approach achieved a test accuracy of 79%, demonstrating its effectiveness in exploiting syntactic dependencies to enhance the performance of RTEinIndonesian', '. Conversely, machine learning methods, especially deep the capacities of Bidirectional Long Short-Term Memory learning, learn from large datasets to identify word patterns (BiLSTM) networks, enhancing the processing of sequential and boundaries, proving more effective for languages with data by capturing contextual information from both preceding intricate structures [18], [23], [28], [29]. and subsequent text elements']",The combination of the BiLSTM model with Conditional Random Field (CRF) has been shown to enhance performance in Named Entity Recognition tasks.,"concept of concatenating the word’s vector representation with the Bidirectional Long Short-Term Memory (LSTM) layer output. The Conditional Random Field (CRF) layer is 3260 VOLUME 11, 2023 S. Silalahi et al.: Transformer-Based NER on Drone Flight Logs to Support Forensic Investigation used to decode the concatenated output since it can determine how the sequence labels relate to one another. Most of the work involved in implementing deep learning models is predominantly spent on ﬁguring out how to prepare adequate input representations. Most often, word embedding techniques like GloVe , Word2vec , BERT , and ELMo are used to learn the input representation. Pre- trained language models, such as BERT and ELMo, can generate contextualized representational vectors after going through a",1.0,0.9063784551587273
"as runtime logs that are constantly generated during the operational period of the device. The information recorded in log data is highly valuable for many purposes, including running system monitoring, running process conformance checks, and overall system evaluation . The use of log data is critical when incident cases occur, as the empirical events and incident scenarios can be discovered by analysing the log artefacts. Assuming that 64252 2024 The Authors. This work is licensed under a Creative Commons Attribution-NonCommercial-NoDerivatives 4.0 License. For more information, see VOLUME 12, 2024 S. Silalahi et al.: Severity-Oriented Multiclass Drone Flight Logs Anomaly Detection the integrity of the log is guaranteed, log data is one of the artefacts with the highest priority for investigating","['. Inspired by the study, anomalous events on drone objective[33].Anotheralternativetoleveragethepre-trained flight logs can be detected by analysing log messages and model is fine-tuning the models using prompts [34]. With identifying suspect key phrases closely related to drone onlyafewtrainingdata,themodelcancapturethesemantics incident scenarios. Therefore, the region of interest in this of the input logs and detect anomalous log sequences well', '. DigitalObjectIdentifier10.1109/ACCESS.2025.3580056 Interpretable Ordinal-Aware With Contrastive-Enhanced Anomaly Severity Detection on UAV Flight Log Messages SWARDIANTARASILALAHI 1,(GraduateStudentMember,IEEE), TOHARIAHMAD 1,(Member,IEEE),HUDANSTUDIAWAN 1,(Member,IEEE), EIRINIANTHI 2,ANDLOWRIWILLIAMS 2 1DepartmentofInformatics,InstitutTeknologiSepuluhNopember,Surabaya60111,Indonesia 2SchoolofComputerScienceandInformatics,CardiffUniversity,CF244AGCardiff,U.K', 'robust predictions, enabling drone operators to detect and Furthermore, Jain et al. [10] proposed a framework for diagnose malfunctions quickly and take corrective actions. sensor data identification and verification. An analysis of a Thestructureofthispaperisasfollows.SectionIIpresents drone’sarchitectureandaforensicmodelwithgenericfeatures previous research relating to the drone log analysis and drone are proposed here in order to enhance the digital investigation forensics', 'S.Silalahietal.:InterpretableOrdinal-AwareWithContrastive-EnhancedAnomalySeverityDetection 1) Human-readable log messages can be found in the flightlog,whichishighlyrelevanttovariousincident cases,asshowninFig3.Notonlyisithighlyrelevant, but it is also highly prioritised evidence in diverse investigationcases. 2) Flight log messages cover events from the drone’s sensors,features,andcomponents,makingitonepiece of evidence to perform analysis related to different drone software and hardware components', '. [8] S. Silalahi, T. Ahmad, and H. Studiawan, ‘‘Drone flight log anomaly severityclassificationviasentenceembedding,’’inProc.Int.Conf.Artif. [30] S. Han, Q. Wu, H. Zhang, B. Qin, J. Hu, X. Shi, L. Liu, and X. Yin, Intell.,Blockchain,CloudComput.,DataAnal.(ICoABCD),Nov.2023, ‘‘Log-basedanomalydetectionwithrobustfeatureextractionandonline pp.100–105. learning,’’IEEETrans.Inf.ForensicsSecurity,vol.16,pp.2300–2311, 2021']","Human-readable log messages in flight logs are highly relevant and prioritized as evidence in various incident investigations (Silalahi et al., 2024).","highly relevant to various incident cases, as shown in Fig 3. Not only is it highly relevant, but it is also highly prioritised evidence in diverse investigation cases. 2) Flight log messages cover events from the drone’s sensors, features, and components, making it one piece of evidence to perform analysis related to different drone software and hardware components. Therefore, analysing the log messages means analysing the whole device for various possible incident scenarios. 3) Flight log messages contain contextual information about the occurring event as a description that involves multiple parts of the drone simultaneously. For example, a certain circumstance fails a feature or an operation, as shown in message group number 4 in Table 1. TABLE 1. Groups of",0.6666666666666666,0.9157771892246233
"particular system log may need different techniques from one type to another. Generally, log-based anomaly detection can be performed using either point, collective, or contextual approaches. In the log-based anomaly detection literature, most of the existing studies propose either a contextual or collective approach, where the decision is taken by examining a sequence of log events. However, detecting abnormalities in log data can be performed using a point-based approach, where one single log record is the only feature needed. Therefore, several studies explored utilising a point-based approach to detect anomalous events on logs data, such as in operating systems , , drone devices , and distribution systems , . In the drone context, a log message contains a description of","['. Existing anomaly detection modelling techniques can be conducted either in a point, contextual, or collective setting. Point anomaly FIGURE4. Anillustrationofanomaliesthatoccurduringadrone’sflight. detectioncharacteriseseachlogentry,whetheraneventisan abnormalityoranormalevent.Forinstance,ifausertypesthe wrong password when trying to gain access to an operating inclusive', 'S.Silalahietal.:InterpretableOrdinal-AwareWithContrastive-EnhancedAnomalySeverityDetection approach is presented in Section III. The experimental settingsandprocedurearedescribedinSectionIV,whilethe results,findings,anddiscussionsareelaboratedinSectionV. Finally,weconcludethepaperinSectionVI. II. RELATEDWORKS A. LOG-BASEDANOMALYDETECTION Log-based anomaly detection is relatively well-studied, includingincorporatingML[1]anddeeplearning-based[18], [19] to facilitate log anomaly detection', '. system remains a topic of interest for the cybersecurity A common approach is the log-based anomaly detecresearch and practitioner communities, such as those in tion approach, which involves the analysis of log entries recorded by systems either in sequence-based or pointThe associate editor coordinating the review of this manuscript and based modelling techniques, considering the case and data characteristics[1]. approvingitforpublicationwasYangTang', '. Thisstudyproposestoextendthebinaryanomalydetection into a multiclass anomaly detection involving four classes: Normal,Low,Medium,andHigh.Thethreeanomalyclasses representingtheseverityoftheabnormalityaredistinguished byseveralcharacteristicsdescribedinSectionIV-A.AsillustratedbyFig.4,adroneexperiencesvariouseventsfromthe takeoff(e )tothelanding(e ).Eacheventisrepresentedby 1 6 a log message that contains a description of the occurring phenomenon.Amongtheeventsthathappenduringaflight, there might be low,', '. DigitalObjectIdentifier10.1109/ACCESS.2025.3580056 Interpretable Ordinal-Aware With Contrastive-Enhanced Anomaly Severity Detection on UAV Flight Log Messages SWARDIANTARASILALAHI 1,(GraduateStudentMember,IEEE), TOHARIAHMAD 1,(Member,IEEE),HUDANSTUDIAWAN 1,(Member,IEEE), EIRINIANTHI 2,ANDLOWRIWILLIAMS 2 1DepartmentofInformatics,InstitutTeknologiSepuluhNopember,Surabaya60111,Indonesia 2SchoolofComputerScienceandInformatics,CardiffUniversity,CF244AGCardiff,U.K']","Anomaly detection modeling techniques can be categorized into point, contextual, or collective settings, with point anomaly detection focusing on individual log entries to identify abnormalities (Silalah et al., 2025).","Existing anomaly detection modelling techniques can be conducted either in a point, contextual, or collective setting. Point anomaly detection characterises each log entry, whether an event is an abnormality or a normal event. For instance, if a user types the wrong password when trying to gain access to an operating system prompt, the generated log message can be considered as an anomaly , , . As for contextual anomaly, the detection involves analysing some contextually related attributes to determine whether a log entry is an anomaly. As an example, the flight path taken by a drone during a flight is recorded in longitude and latitude coordinates. These data can be used to detect an anomaly by finding a peculiar value",0.6666666666666666,0.9430579165364642
"several studies explored utilising a point-based approach to detect anomalous events on logs data, such as in operating systems , , drone devices , and distribution systems , . In the drone context, a log message contains a description of occurring events which are triggered by various components such as sensors, peripherals, and firmware. Analysing the log message means analysing events from all aspects of the drone, including sensors, components and features . Typically, existing log-based anomaly detection stud- ies classify log events into two categories: normal and anomaly . This is helpful in an online setting, where the number of detected abnormalities in a certain period of time is considerably small. However, in a digital forensic setting, where the","['robust predictions, enabling drone operators to detect and Furthermore, Jain et al. [10] proposed a framework for diagnose malfunctions quickly and take corrective actions. sensor data identification and verification. An analysis of a Thestructureofthispaperisasfollows.SectionIIpresents drone’sarchitectureandaforensicmodelwithgenericfeatures previous research relating to the drone log analysis and drone are proposed here in order to enhance the digital investigation forensics', '. challenges for drone digital forensics investigations,’’ Array, vol. 14, Jul.2022,Art.no.100135. [27] J. Qi, Z. Luan, S. Huang, C. Fung, H. Yang, H. Li, D. Zhu, and D.Qian,‘‘LogEncoder:Log-basedcontrastiverepresentationlearningfor [5] H.Studiawan,G.Grispos,andK.-K.-R.Choo,‘‘Unmannedaerialvehicle anomalydetection,’’IEEETrans.Netw.ServiceManage.,vol.20,no.2, (UAV)forensics:Thegood,thebad,andtheunaddressed,’’Comput.Secur., pp.1378–1391,Jun.2023. vol.132,Sep.2023,Art.no.103340. [28] J. Li, H. He, S. Chen, D', '. Therefore, this paper proposes a multitask-based systemprompt,thegeneratedlogmessagecanbeconsidered multiclass drone anomaly detection to assist in a forensic as an anomaly [7], [20], [21]. As for contextual anomaly, investigation. The main contributions of this paper are the detection involves analysing some contextually related summarizedasfollows: attributes to determine whether a log entry is an anomaly', '. Inspired by the study, anomalous events on drone objective[33].Anotheralternativetoleveragethepre-trained flight logs can be detected by analysing log messages and model is fine-tuning the models using prompts [34]. With identifying suspect key phrases closely related to drone onlyafewtrainingdata,themodelcancapturethesemantics incident scenarios. Therefore, the region of interest in this of the input logs and detect anomalous log sequences well', '. [8] S. Silalahi, T. Ahmad, and H. Studiawan, ‘‘Drone flight log anomaly severityclassificationviasentenceembedding,’’inProc.Int.Conf.Artif. [30] S. Han, Q. Wu, H. Zhang, B. Qin, J. Hu, X. Shi, L. Liu, and X. Yin, Intell.,Blockchain,CloudComput.,DataAnal.(ICoABCD),Nov.2023, ‘‘Log-basedanomalydetectionwithrobustfeatureextractionandonline pp.100–105. learning,’’IEEETrans.Inf.ForensicsSecurity,vol.16,pp.2300–2311, 2021']",Jain et al. proposed a forensic model that enhances digital investigations by analyzing a drone's architecture and log data.,"highly relevant to various incident cases, as shown in Fig 3. Not only is it highly relevant, but it is also highly prioritised evidence in diverse investigation cases. 2) Flight log messages cover events from the drone’s sensors, features, and components, making it one piece of evidence to perform analysis related to different drone software and hardware components. Therefore, analysing the log messages means analysing the whole device for various possible incident scenarios. 3) Flight log messages contain contextual information about the occurring event as a description that involves multiple parts of the drone simultaneously. For example, a certain circumstance fails a feature or an operation, as shown in message group number 4 in Table 1. TABLE 1. Groups of",0.25,0.9476823979524405
"classify log events into two categories: normal and anomaly . This is helpful in an online setting, where the number of detected abnormalities in a certain period of time is considerably small. However, in a digital forensic setting, where the detection is performed on all collected artefacts which might be large in size, the number of the abnormalities is likely to be large . Thus, analysing the detection result in a binary setting is impractical for the investigator. Moreover, out of all detected peculiarities, there might be several negligible ones with less severe impacts on the system or less likely to be related to an incident. Extending binary to multiclass anomaly detection can provide more detailed and contextual detection results","['. In a forensic orphrases. setting, analysing a large number of log entries resulting from binary anomaly detection is considered inefficient and labour-intensive as the detection is performed on the C. SCOPEANDCONTRIBUTIONS acquired evidence at one time [12]', '. As depicted in Fig 18, the highlighted to multiclass anomaly detection while exploiting the shared words align more with the attribution label, supported by high- and low-level features within the log messages that seven out of eight examples belonging to the High severity belong to different severity levels. Therefore, the forensic having positive attribution scores', '. challenges for drone digital forensics investigations,’’ Array, vol. 14, Jul.2022,Art.no.100135. [27] J. Qi, Z. Luan, S. Huang, C. Fung, H. Yang, H. Li, D. Zhu, and D.Qian,‘‘LogEncoder:Log-basedcontrastiverepresentationlearningfor [5] H.Studiawan,G.Grispos,andK.-K.-R.Choo,‘‘Unmannedaerialvehicle anomalydetection,’’IEEETrans.Netw.ServiceManage.,vol.20,no.2, (UAV)forensics:Thegood,thebad,andtheunaddressed,’’Comput.Secur., pp.1378–1391,Jun.2023. vol.132,Sep.2023,Art.no.103340. [28] J. Li, H. He, S. Chen, D', 'S.Silalahietal.:InterpretableOrdinal-AwareWithContrastive-EnhancedAnomalySeverityDetection approach is presented in Section III. The experimental settingsandprocedurearedescribedinSectionIV,whilethe results,findings,anddiscussionsareelaboratedinSectionV. Finally,weconcludethepaperinSectionVI. II. RELATEDWORKS A. LOG-BASEDANOMALYDETECTION Log-based anomaly detection is relatively well-studied, includingincorporatingML[1]anddeeplearning-based[18], [19] to facilitate log anomaly detection', '. e thatundergoesadoublenegation.Therefore,considering 5 Another closely related study fine-tuned several pre-trained the context when performing sentiment analysis to detect LLMs to detect anomalous log entries in a point-based anomaliesindronelogmessagesiscrucial,especiallywhen approach[6].However,existingstudiesonlydetectwhether thelogmessagesfromdifferentclassessharecommonwords an event or subsequent event is an anomaly. In a forensic orphrases']","Analyzing a large number of log entries resulting from binary anomaly detection is considered inefficient and labor-intensive in forensic settings (Qi et al., 2022).","LLMs to detect anomalous log entries in a point-based approach . However, existing studies only detect whether an event or subsequent event is an anomaly. In a forensic setting, analysing a large number of log entries resulting from binary anomaly detection is considered inefficient and labour-intensive as the detection is performed on the acquired evidence at one time . Therefore, too many detected anomalies need to be detailed into a more fine- grained detection to help the investigator better prioritise the analysis objective. As a result, this study extends the binary anomaly detection to multi-class anomaly detection, as exemplified by another domain application such as plane flight data , image data , and internet of vehicle . As a consequence,",0.6666666666666666,0.8720809566761211
"comparison of the proposed framework, several baselines are constructed, including those that are proposed in published works. This paper proposes a transformer encoder-based log- based anomaly detection optimised using multitask label representation to help the model learn from the overlapped features shared by the samples from different severity levels. A domain-specific decoding procedure is also proposed to infer the prediction result. In-depth analyses are performed to evaluate the proposed framework thoroughly. The main contributions of this paper are summarised as follows: 1) Propose Drone Log Severity (DroLoVe), a severity- oriented multiclass anomaly detection approach on drone flight log data. 2) Propose a data-driven vector representation of the label and a severity-oriented decoding procedure of the VOLUME 12, 2024 64253 S.","['. Inspired by the study, anomalous events on drone objective[33].Anotheralternativetoleveragethepre-trained flight logs can be detected by analysing log messages and model is fine-tuning the models using prompts [34]. With identifying suspect key phrases closely related to drone onlyafewtrainingdata,themodelcancapturethesemantics incident scenarios. Therefore, the region of interest in this of the input logs and detect anomalous log sequences well', '. DigitalObjectIdentifier10.1109/ACCESS.2025.3580056 Interpretable Ordinal-Aware With Contrastive-Enhanced Anomaly Severity Detection on UAV Flight Log Messages SWARDIANTARASILALAHI 1,(GraduateStudentMember,IEEE), TOHARIAHMAD 1,(Member,IEEE),HUDANSTUDIAWAN 1,(Member,IEEE), EIRINIANTHI 2,ANDLOWRIWILLIAMS 2 1DepartmentofInformatics,InstitutTeknologiSepuluhNopember,Surabaya60111,Indonesia 2SchoolofComputerScienceandInformatics,CardiffUniversity,CF244AGCardiff,U.K', '. CONCLUSION remains untested as the training dataset contains only log This paper investigates utilising a multitask learning messages acquired from 82 drone models, mostly from paradigmtoperformmulticlassanomalydetectionondrone DJI. This is one of the main challenges in drone forensics flight log messages. Aligning to the nature of multitask research, where human-readable flight log datasets from learning,weproposetwotargetlabelrepresentations,namely other drone models are unavailable', '. For instance, the message ‘‘Critically low power. Aircraft is landing’’ is more important than ‘‘Forward Obstacle Sensing notWorking’’.ThisstudyproposesDroneLog,aninterpretableframeworkfordetectinganomaliesandthe severity levels on drone flight logs, using a multitask learning approach in a unified pipeline', '. [8] S. Silalahi, T. Ahmad, and H. Studiawan, ‘‘Drone flight log anomaly severityclassificationviasentenceembedding,’’inProc.Int.Conf.Artif. [30] S. Han, Q. Wu, H. Zhang, B. Qin, J. Hu, X. Shi, L. Liu, and X. Yin, Intell.,Blockchain,CloudComput.,DataAnal.(ICoABCD),Nov.2023, ‘‘Log-basedanomalydetectionwithrobustfeatureextractionandonline pp.100–105. learning,’’IEEETrans.Inf.ForensicsSecurity,vol.16,pp.2300–2311, 2021']","The proposed framework for detecting anomalies and severity levels in drone flight logs utilizes a multitask learning approach, as outlined in the study by Silalahi et al. (2025).","depicted in Fig 18, the highlighted words align more with the attribution label, supported by seven out of eight examples belonging to the High severity having positive attribution scores. The model perceives the log messages better than the previous BERT-based model. The complete report of attributions toward each severity label can be accessed on the repo. VI. CONCLUSION VI. CONCLUSION This paper investigates utilising a multitask learning paradigm to perform multiclass anomaly detection on drone flight log messages. Aligning to the nature of multitask learning, we propose two target label representations, namely Multitask-101 and Multitask-111. The integrated gradient is employed to interpret the model’s behavior. During the interpretability analysis, we found that the embedding vectors from BERT do not align",1.0,0.9425317518383289
"follows: 1) Propose Drone Log Severity (DroLoVe), a severity- oriented multiclass anomaly detection approach on drone flight log data. 2) Propose a data-driven vector representation of the label and a severity-oriented decoding procedure of the VOLUME 12, 2024 64253 S. Silalahi et al.: Severity-Oriented Multiclass Drone Flight Logs Anomaly Detection FIGURE 2. A word cloud visualisation to see that the samples from different severity levels share common words and phrases. The remainder of the paper is structured as follows: Section II discusses relevant previous studies related to log-based anomaly detection and how to deal with class imbalance problems in log-based anomaly detection task, the proposed framework is explained in detail in Section III, Section IV provides the experimental setup, followed","['. DigitalObjectIdentifier10.1109/ACCESS.2025.3580056 Interpretable Ordinal-Aware With Contrastive-Enhanced Anomaly Severity Detection on UAV Flight Log Messages SWARDIANTARASILALAHI 1,(GraduateStudentMember,IEEE), TOHARIAHMAD 1,(Member,IEEE),HUDANSTUDIAWAN 1,(Member,IEEE), EIRINIANTHI 2,ANDLOWRIWILLIAMS 2 1DepartmentofInformatics,InstitutTeknologiSepuluhNopember,Surabaya60111,Indonesia 2SchoolofComputerScienceandInformatics,CardiffUniversity,CF244AGCardiff,U.K', '. Inspired by the study, anomalous events on drone objective[33].Anotheralternativetoleveragethepre-trained flight logs can be detected by analysing log messages and model is fine-tuning the models using prompts [34]. With identifying suspect key phrases closely related to drone onlyafewtrainingdata,themodelcancapturethesemantics incident scenarios. Therefore, the region of interest in this of the input logs and detect anomalous log sequences well', '. [8] S. Silalahi, T. Ahmad, and H. Studiawan, ‘‘Drone flight log anomaly severityclassificationviasentenceembedding,’’inProc.Int.Conf.Artif. [30] S. Han, Q. Wu, H. Zhang, B. Qin, J. Hu, X. Shi, L. Liu, and X. Yin, Intell.,Blockchain,CloudComput.,DataAnal.(ICoABCD),Nov.2023, ‘‘Log-basedanomalydetectionwithrobustfeatureextractionandonline pp.100–105. learning,’’IEEETrans.Inf.ForensicsSecurity,vol.16,pp.2300–2311, 2021', '. 1) We propose DroneLog, an interpretable sentimentAs an example, the flight path taken by a drone during a based multiclass drone flight log anomaly detection flightisrecordedinlongitudeandlatitudecoordinates.These frameworkthatincludesthreeanomalyseveritylevels: datacanbeusedtodetectananomalybyfindingapeculiar low,medium,andhigh.Providingtheseveritylevelcan valuewithinthelogrecordsbycontrastingthenormalvalues provide better detection results for the investigator to', '. B. PROBLEMSTATEMENT For instance, at the e , the drone exceeds the maximum In the event that there is only benign data (i.e., no sample 3 flight distance. Several sentiment-baring words or phrases of abnormal data), anomaly detection can be conducted by from the illustration include ‘‘out of range’’, ‘‘overheated’’, training a recurrent neural network (RNN)–based model and ‘‘failed’’']","The proposed DroneLog framework includes three anomaly severity levels: low, medium, and high, enhancing detection capabilities in drone flight log analysis.","be employed to force the model to learn a distinctive representation of the positive FIGURE 4. An illustration of anomalies that occur during a drone’s flight. inclusive. Therefore, this paper proposes a multitask-based multiclass drone anomaly detection to assist in a forensic investigation. The main contributions of this paper are summarized as follows: 1) We propose DroneLog, an interpretable sentiment- based multiclass drone flight log anomaly detection framework that includes three anomaly severity levels: low, medium, and high. Providing the severity level can provide better detection results for the investigator to pinpoint the event of interest. Interpretability makes training and testing more transparent, the model trustworthy, and human-friendly. 2) We propose DroneSBERT,1 a domain-specific embed- ding to extract semantic features",1.0,0.9344287621373658
"anomaly detection approach is adopted in this paper. Table 1 presents the summary of the previous related works. B. CLASS IMBALANCE PROBLEM (CIP) IN LOG-BASED ANOMALY DETECTION It is assured that in log-based anomaly detection, the number of anomalous samples is significantly less than the normal ones. Employing a supervised-based technique is prone to bias, as the model tends to learn from the majority samples. To overcome CIP, several studies proposed data-level and algorithm-level solutions . Moreover, in a certain case, there are no anomalous samples available. In this particular situation, a one-class approach can be used to construct a normal baseline model. During the detection, an anomaly score is used to decide if an input event is anomalous based","['S.Silalahietal.:InterpretableOrdinal-AwareWithContrastive-EnhancedAnomalySeverityDetection approach is presented in Section III. The experimental settingsandprocedurearedescribedinSectionIV,whilethe results,findings,anddiscussionsareelaboratedinSectionV. Finally,weconcludethepaperinSectionVI. II. RELATEDWORKS A. LOG-BASEDANOMALYDETECTION Log-based anomaly detection is relatively well-studied, includingincorporatingML[1]anddeeplearning-based[18], [19] to facilitate log anomaly detection', '. Another case scenario in log-based anomaly detection Supervised contrastive learning is employed to learn is a sequence-based approach, where an abnormality is distinctrepresentationsforeachanomalyseveritylevel. determined by analysing a group of events that occur 3) Weexploretwotargetlabelrepresentationstoaugment sequentially within a certain window size [22]', '. Thisstudyproposestoextendthebinaryanomalydetection into a multiclass anomaly detection involving four classes: Normal,Low,Medium,andHigh.Thethreeanomalyclasses representingtheseverityoftheabnormalityaredistinguished byseveralcharacteristicsdescribedinSectionIV-A.AsillustratedbyFig.4,adroneexperiencesvariouseventsfromthe takeoff(e )tothelanding(e ).Eacheventisrepresentedby 1 6 a log message that contains a description of the occurring phenomenon.Amongtheeventsthathappenduringaflight, there might be low,', '. As depicted in Fig 18, the highlighted to multiclass anomaly detection while exploiting the shared words align more with the attribution label, supported by high- and low-level features within the log messages that seven out of eight examples belonging to the High severity belong to different severity levels. Therefore, the forensic having positive attribution scores', '. In this context, having less FP is more important than having less FN, as the task objective is anomaly severity detection, where we aim to detect all abnormalities along withtheseveritylevel.Therefore,undetectedabnormalities, or detecting higher severity as lower ones, indicate that the model fails to meet the task’s objectives']","Log-based anomaly detection has been extensively studied, incorporating machine learning and deep learning techniques to enhance detection capabilities (Silahietal.)","sequence-based approach in the log-based anomaly detection research, as shown in Table 2. In contrast, this paper uses a point-based approach based on the characteristics of the problem and the dataset. Therefore, there are limited references that can be used as baselines for comparison, as described in the following: 1) Pylogsentiment . Using a point-based approach, a sentiment analysis model is trained using a one-layer VOLUME 13, 2025 105369 S. Silalahi et al.: Interpretable Ordinal-Aware With Contrastive-Enhanced Anomaly Severity Detection TABLE 6. Hyperparameter search space for all scenarios. neighbouring classes share common features. GRU, LSTM, and Transformer are explored to find the best- performing encoder. To provide a fair comparison, the GloVe embedding used in pylogsentiment, SentiLog, and TransSentLog are",0.75,0.9581174584565957
"detection approach for drone flight log data. The overall flow of the proposed framework is depicted in Fig 4. The following section describes the approach in more detail. A. OVERVIEW A. OVERVIEW Performing point log-based anomaly detection that takes human-readable log messages as input is similar to conduct- ing sequence or text classification. As mentioned in Section I, this task may be interpreted as a sentiment analysis task that aims to detect negative sentiments within log messages. Taking an n-length log message m = [w1, w2, . . . , wn] from the dataset D = {(mi, ci)}|D| i=1 as the input, where c is the label class name, BERT is used to tokenise the input into a fixed length","['. Inspired by the study, anomalous events on drone objective[33].Anotheralternativetoleveragethepre-trained flight logs can be detected by analysing log messages and model is fine-tuning the models using prompts [34]. With identifying suspect key phrases closely related to drone onlyafewtrainingdata,themodelcancapturethesemantics incident scenarios. Therefore, the region of interest in this of the input logs and detect anomalous log sequences well', '. 1) We propose DroneLog, an interpretable sentimentAs an example, the flight path taken by a drone during a based multiclass drone flight log anomaly detection flightisrecordedinlongitudeandlatitudecoordinates.These frameworkthatincludesthreeanomalyseveritylevels: datacanbeusedtodetectananomalybyfindingapeculiar low,medium,andhigh.Providingtheseveritylevelcan valuewithinthelogrecordsbycontrastingthenormalvalues provide better detection results for the investigator to', '. B. PROBLEMSTATEMENT For instance, at the e , the drone exceeds the maximum In the event that there is only benign data (i.e., no sample 3 flight distance. Several sentiment-baring words or phrases of abnormal data), anomaly detection can be conducted by from the illustration include ‘‘out of range’’, ‘‘overheated’’, training a recurrent neural network (RNN)–based model and ‘‘failed’’', 'S.Silalahietal.:InterpretableOrdinal-AwareWithContrastive-EnhancedAnomalySeverityDetection approach is presented in Section III. The experimental settingsandprocedurearedescribedinSectionIV,whilethe results,findings,anddiscussionsareelaboratedinSectionV. Finally,weconcludethepaperinSectionVI. II. RELATEDWORKS A. LOG-BASEDANOMALYDETECTION Log-based anomaly detection is relatively well-studied, includingincorporatingML[1]anddeeplearning-based[18], [19] to facilitate log anomaly detection', '. encoder for anomaly detection. A similar study exploits Performing anomaly detection using a sequence-based theabundanceofpre-trainedtransformermodelstoperform approach is commonly conducted by training RNN-based anomalydetectionbyusingsentimentanalysisondroneflight models using a dataset containing a collection of a series log messages [6], which then expanded to multiclass in [9]. of events']","Anomaly detection in drone flight logs can be effectively performed using sequence-based approaches, such as training RNN-based models on datasets of event sequences (Silahi et al., 2023).","be employed to force the model to learn a distinctive representation of the positive FIGURE 4. An illustration of anomalies that occur during a drone’s flight. inclusive. Therefore, this paper proposes a multitask-based multiclass drone anomaly detection to assist in a forensic investigation. The main contributions of this paper are summarized as follows: 1) We propose DroneLog, an interpretable sentiment- based multiclass drone flight log anomaly detection framework that includes three anomaly severity levels: low, medium, and high. Providing the severity level can provide better detection results for the investigator to pinpoint the event of interest. Interpretability makes training and testing more transparent, the model trustworthy, and human-friendly. 2) We propose DroneSBERT,1 a domain-specific embed- ding to extract semantic features",0.6666666666666666,0.9622627989641956
"log message m = [w1, w2, . . . , wn] from the dataset D = {(mi, ci)}|D| i=1 as the input, where c is the label class name, BERT is used to tokenise the input into a fixed length sequence with m maximum length and retrieve the contextual embeddings, resulting in an input matrix X ∈ Rm×dBERT which is then paired with the encoded label y. Thus, the numerical input becomes (X, y). This study aims to train a neural network model Mθ to classify the message m into one of the predefined classes c ∈ C = {high, medium, low, normal}, or can be written as Mθ : m → c. Based on past literature discussed in Section","['S.Silalahietal.:InterpretableOrdinal-AwareWithContrastive-EnhancedAnomalySeverityDetection approach is presented in Section III. The experimental settingsandprocedurearedescribedinSectionIV,whilethe results,findings,anddiscussionsareelaboratedinSectionV. Finally,weconcludethepaperinSectionVI. II. RELATEDWORKS A. LOG-BASEDANOMALYDETECTION Log-based anomaly detection is relatively well-studied, includingincorporatingML[1]anddeeplearning-based[18], [19] to facilitate log anomaly detection', '. encoder for anomaly detection. A similar study exploits Performing anomaly detection using a sequence-based theabundanceofpre-trainedtransformermodelstoperform approach is commonly conducted by training RNN-based anomalydetectionbyusingsentimentanalysisondroneflight models using a dataset containing a collection of a series log messages [6], which then expanded to multiclass in [9]. of events', '. Noisy data methods, we verify the superiority of our proposed and heterogeneous structures are common problems in logapproach. based anomaly detection. Performing log parsing is one of 5) Provide the experimental code publicly available on the options to reduce the noise. Another approach is to a GitHub repository2 to promote reproducible and employacontextualembedding,suchasBERT[25],thatcan verifiableresearch. capture the semantics of the log messages [26]', '. As mentioned in the previous section, this theindirectlysubsequentevents.Moreover,thecomputation paperexplorestheadvantageofmultitasklearningtoperform processisnon-parallelizable.Therefore,severaleffortshave sentimentanalysisondroneflightlogdatasetsasananomaly been made to employ the Transformer model for anomaly detectionapproach. detection [32]. Instead of training a model using a dataset, [33] proposed HilBERT, a BERT-based model pre-trained III. PROPOSEDFRAMEWORK using a number of public log datasets', '. Therefore, 3) NeuralLog [21]. The study proposed a log-based it is called a soft label representation since the predicted anomaly detection without parsing to preprocess the vectorlabeldoesnotnecessarilyneedtobepreciselythesame logs. BERT is used as the embedding and one-layer as the training label. This decoding procedure helps reduce Transformerencoderwith12attentionheadstrainedon the number of false positives as the higher severity class is severalpubliclogdatasetsinasequence-basedsetting. prioritised']","BERT is utilized as a contextual embedding to capture the semantics of log messages in anomaly detection tasks (Silahietal., 2023).","detection on the test data, which is then analysed further. In this paper, M = (cid:2)m1, m2, . . . , m|M| (cid:3) is defined as the collection of log messages in the dataset. Given a log record m = [w1, w2, . . . , wn] containing n number of words as input, with m ∈ M, BERTbase is used to tokenize and obtain the input vector representation. In the implementation, computation is undertaken using matrix multiplication. Thus, a term maximum sequence length, m, is introduced to pack the input messages that vary in length into a matrix with a consistent size throughout all the samples in the dataset. Therefore, for each single input message, the input matrix becomes",0.75,0.8965483650406567
"logits z ∈ R|C|, where |C| denotes the number of target class in the dataset. During the training phase, these vectors are used to compute the loss and update the parameter of the model after passing through a normalisation function. For the typical one-hot encoding representation of the label, the standard cross-entropy is used to compute the loss, as defined in the following equation: |C| LCE = − yi · log(ˆyi) i=1 ˆy = softmax(z) exp(zi) ˆyi = Pdim(z) exp(zj) (1) (2) (3) where y and ˆy are the true label vector and the prediction probability distribution, respectively. The prediction proba- bility ˆy is obtained from Eq 2, where each of the element in ˆy is computed using Eq 3.","['. |M| λbal = (8) c |C|·|M | c (cid:18)|M |(cid:19)−1 λinv = c (9) c |M| where |M| is number of samples in the dataset, |C| is the number of target class, and |M | is the number of samples c belongingtoclasscwithM ∈M. In the Multitask-101 schema, the first vector element c Asanalternativewaytodealwiththeimbalanceproblem, functions the same as in the Multitask-101 schema. The we replace the cross-entropy with the focal loss to force main difference lies in the second to the fourth elements', '. Thedistributionofthebestepochfromeachlossfunction. model on the filtered dataset. The confusion matrix in this Loglosstendstorequiremoreepochscomparedtocross-entropyand focalloss. paperisredefinedtoalignwiththeanomalyseveritycontext, wherethedistancebetweentrueandpredictedlabelsmatters. If the predicted label is lower than the true label, we define it False Positive (FP). Conversely, if the true label is lower than the predicted label, we define it False Negative (FN)', '. 1 Aligning to the multitask learning paradigm, the target yˆ = (13) label representation is no longer one-hot encoding. Instead, i 1+exp(−α i ) 105368 VOLUME13,2025', '. The proposed vector label fine-tune the model with a learning rate of η = 0.00002, underperforms the baseline vector label, one-hot encoding because the proposed DroneSBERT embedding makes the AdamWoptimizer,andbatchsizeof64withfouriterations. dataset become mutually exclusive, as shown in Fig 17. The dimension of the resulting embedding is 768, the same Therefore, one-hot encoding works better compared to astheBERT-baseusedinthepreviousexperiment. multitask-basedvectorlabels', '. probabilities between 0 and 1. During training, we applied the Specifically, the distillation loss function was designed to binary cross-entropy loss across all labels to supervise minimize the discrepancy between the feature representations abnormality detection of the student and the teacher models']","The target label representation in the proposed method is no longer one-hot encoding, which contrasts with the standard cross-entropy loss computation used in traditional methods.","final unnormalized logits vector using the following equation: α = zW⊤ + b, ∈ R|C| (3) where W ∈ R|C|×768, and b ∈ R|C| are the typical trainable weight and bias parameters in a linear layer. Knowing that the number of classes is more than two, the task belongs to multiclass classification. Typically, the target label is represented in a one-hot encoded vector, as depicted in Fig. 8a. Therefore, the training objective is to minimise the cross-entropy loss, which is computed using the following equation: LCE(y, ˆy) = − |C| yi · log(ˆyi) i=1 ˆy = softmax(α) (4) (5) where y and ˆy are the truth and the predicted label probability distribution respectively. The normalized logits in Eq. 5 is",0.5,0.9250104591468016
"study, one of the artefacts of drone devices, the flight log message, is used as the source of the evidence to perform multiclass anomaly severity detection. These human-readable messages, such as ‘‘Aircraft Core Board Overheated’’ and ‘‘Compass error, calibration required’’, can be found in most DJI-make flight logs in three columns: warning, tip, and message. Originally, the flight log was in encrypted.CSV files . Thus, the drone phantom help2 is needed to decrypt the flight log files and then extract the contents. The 2 FIGURE 6. Proposed vector representation of the label based on the dataset characteristics. is computed based on the frequency distribution of the class in the dataset. In this study, three class weights are explored and used","['robust predictions, enabling drone operators to detect and Furthermore, Jain et al. [10] proposed a framework for diagnose malfunctions quickly and take corrective actions. sensor data identification and verification. An analysis of a Thestructureofthispaperisasfollows.SectionIIpresents drone’sarchitectureandaforensicmodelwithgenericfeatures previous research relating to the drone log analysis and drone are proposed here in order to enhance the digital investigation forensics', '. DigitalObjectIdentifier10.1109/ACCESS.2025.3580056 Interpretable Ordinal-Aware With Contrastive-Enhanced Anomaly Severity Detection on UAV Flight Log Messages SWARDIANTARASILALAHI 1,(GraduateStudentMember,IEEE), TOHARIAHMAD 1,(Member,IEEE),HUDANSTUDIAWAN 1,(Member,IEEE), EIRINIANTHI 2,ANDLOWRIWILLIAMS 2 1DepartmentofInformatics,InstitutTeknologiSepuluhNopember,Surabaya60111,Indonesia 2SchoolofComputerScienceandInformatics,CardiffUniversity,CF244AGCardiff,U.K', '. Inspired by the study, anomalous events on drone objective[33].Anotheralternativetoleveragethepre-trained flight logs can be detected by analysing log messages and model is fine-tuning the models using prompts [34]. With identifying suspect key phrases closely related to drone onlyafewtrainingdata,themodelcancapturethesemantics incident scenarios. Therefore, the region of interest in this of the input logs and detect anomalous log sequences well', '. Most drone incidents are caused analysis of drone logs can also provide evidence that can be by bird attacks, collide with other drones, and malfunctioning used in legal proceedings. This evidence can be particularly systems.Sometimesthedronemayhaveamalfunctioningsystem valuable in cases where there are disputes over liability, such caused by sensor failure, a broken motor, or CPU failure. This cancauseanaccident.Therefore,aforensicinvestigationsupports as in cases of property damage or personal injury', '. theexperimentalresults,theTransformerobtainsthehighestF1 In the context of classifying drone malfunctions, the Transscore value of 93.04%. former model can be trained on a dataset of labeled drone Index Terms—drone forensics, forensic investigation, malfunctelemetry data to learn patterns and relationships between the tions, infrastructure, Transformer, Informer, FEDformer drone’s behavior and the root cause of a malfunction. The dataset can include features such as altitude, velocity, battery I']","Anomalous events on drone flight logs can be detected by analyzing log messages and identifying suspect key phrases closely related to drone incident scenarios (SWARDIANTARASILALAHI et al., 2025).","the data is the DJI. After collecting the ﬂight log ﬁles, we use DJI Phantom Help tools to decrypt the ﬁles and get the plain data, which then is parsed to get the log message data. The number of messages from every drone image is shown in Table 1. The next step is identifying the entity type mentioned in the drone log messages. Before reading the log messages, we ﬁltered the duplicate message and got the unique message to read. After carefully reading the unique log message and comprehensively studying what every log message indicates, we categorized the entity types mentioned in the ﬂight log message into six groups, i.e., Component, Action, Parameter, Function, State, and Issue. These entity types",1.0,0.9565653712312476
"the unfiltered is the actual collection of drone flight log messages gathered from the two sources mentioned previously. The dataset is split into training and testing with an 80:20 ratio. The summary of the per-class distribution in the dataset is presented in Table 2. B. BASELINES B. BASELINES In this study, an extensive experiment with various types of encoders is conducted to construct strong baselines for performance comparison. Ensuring the objectivity of the comparison, the hyperparameters of these baselines are fine-tuned using grid search on a finite search space, as shown in Table 3. The details of the baseline construction are described in the following subsections. 1) BASELINE FROM DIVERSE SUITABLE ENCODERS The distinction between the baseline and the proposed","['. CONCLUSION remains untested as the training dataset contains only log This paper investigates utilising a multitask learning messages acquired from 82 drone models, mostly from paradigmtoperformmulticlassanomalydetectionondrone DJI. This is one of the main challenges in drone forensics flight log messages. Aligning to the nature of multitask research, where human-readable flight log datasets from learning,weproposetwotargetlabelrepresentations,namely other drone models are unavailable', '. Mantas and Patsakis [6] data to construct a forensic timeline that consists of the log have attempted to utilize telemetry and dataflash logs to messageandthetimestamp. perform drone forensic investigation by performing UAV To perform NER, two common deep learning modintegritychecks,anomalydetectiononthevisualflightpath, els can be used, either RNN-based or Transformer-based command verification, error reporting, and hardware error models. The latest state-of-the-art include BiLSTM-CRF detection', '. Inspired by the study, anomalous events on drone objective[33].Anotheralternativetoleveragethepre-trained flight logs can be detected by analysing log messages and model is fine-tuning the models using prompts [34]. With identifying suspect key phrases closely related to drone onlyafewtrainingdata,themodelcancapturethesemantics incident scenarios. Therefore, the region of interest in this of the input logs and detect anomalous log sequences well', '. [17] H.Zhou,S.Zhang,J.Peng,S.Zhang,J.Li,H.Xiong,andW.Zhang, Forensics of drones can be carried out using Transformer “Informer: Beyond efficient transformer for long sequence time-series variants such as Transformer, Informer, and FEDformer in forecasting,”CoRR,vol.abs/2012.07436,2020. [18] Z.Cheng,X.Fan,L.Guo,andY.Cui,“Auuvtargetdetectionmethod this study', '. position-wisefeedforwardnetwork,theclassificationbasedon [20] S.Wu,C.Du,H.Chen,andN.Jing,“Coarse-to-FineUAVImageGeoLocalization Using Multi-stage Lucas-Kanade Networks,” in 2021 2nd drone log data will be more accurate. InformationCommunicationTechnologiesConference(ICTC),(Nanjing, A future modification to the transformer will improve the China),pp.220–224,IEEE,May2021. capability of detecting drone malfunctions, particularly in the encoder layer and the recurrent layer']","The study employs a multitask learning approach to detect anomalies in drone flight log messages, which aligns with the methodology described in this research.",". There are two datasets: unfiltered and filtered. The unfiltered dataset is a collection of log messages in its original condition gathered from the two sources without performing unique filtering. Therefore, there are several duplicate log messages both in training and testing sets. This is aligned with the real case scenario, where a drone tends to generate the same log message when the event is still happening. It indicates that the current event has yet to be changed or solved (if it is an issue). On the other hand, the filtered dataset is a collection of log messages after a unique filtering process. This is aligned with the norm in supervised learning, where the train and test set must not",1.0,0.9018359934013539
"PREVIOUS WORKS Among the relevant published studies in the log-based anomaly detection space, sequence-based is one of the most commonly used approaches. Therefore, there are limited relevant references as this study employs a point-based approach. Below are the relevant baselines from previous research: 1) Pylogsentiment is the first study which employs sentiment analysis-based anomaly detection on operat- ing system logs using GRU and GloVe embedding. 2) SentiLog , similar to , use a two-layered BiLSTM and GloVe embedding model to perform anomaly detection on parallel file system logs. 3) TransSentLog is a further development of and uses a two-layered transformer encoder which used two attention heads and GloVe embedding along with integrated gradients to add explainability to the trained model.","['. An interesting witharandomstateof42. pattern is shown in Table 8 regarding the hyperparameter Four encoder types are selected to be combined with the values on each encoder type. The GRU works well with baseline and proposed scenarios, i.e., Transformer, LSTM, more layers, average pooling, and uniform class weighting. GRU, and Linear, since these encoders are standard in log- Differently, the Linear model has benefited from the [CLS] based anomaly detection as discussed in Section II', '. encoder for anomaly detection. A similar study exploits Performing anomaly detection using a sequence-based theabundanceofpre-trainedtransformermodelstoperform approach is commonly conducted by training RNN-based anomalydetectionbyusingsentimentanalysisondroneflight models using a dataset containing a collection of a series log messages [6], which then expanded to multiclass in [9]. of events', 'S.Silalahietal.:InterpretableOrdinal-AwareWithContrastive-EnhancedAnomalySeverityDetection approach is presented in Section III. The experimental settingsandprocedurearedescribedinSectionIV,whilethe results,findings,anddiscussionsareelaboratedinSectionV. Finally,weconcludethepaperinSectionVI. II. RELATEDWORKS A. LOG-BASEDANOMALYDETECTION Log-based anomaly detection is relatively well-studied, includingincorporatingML[1]anddeeplearning-based[18], [19] to facilitate log anomaly detection', '. Existing anomaly detection modelling techniques can be conducted either in a point, contextual, or collective setting. Point anomaly FIGURE4. Anillustrationofanomaliesthatoccurduringadrone’sflight. detectioncharacteriseseachlogentry,whetheraneventisan abnormalityoranormalevent.Forinstance,ifausertypesthe wrong password when trying to gain access to an operating inclusive', '. Ou and J. Liu, “Log anomaly detection method based on hybrid transformer-bilstm models,” in 2022 IEEE 22nd International ConferInformerandFedFormermodelsmayoutperformTransformerenceonSoftwareQuality,Reliability,andSecurityCompanion(QRS-C), based models. pp.762–763,2022. [16] S. Pasch and D. Ehnes, “Nlp for responsible finance: Fine-tuning transformer-based models for esg,” in 2022 IEEE International ConV. CONCLUSIONS ferenceonBigData(BigData),pp.3532–3536,2022']","Existing anomaly detection modelling techniques can be conducted in a point setting, which characterizes each log entry as either an abnormality or a normal event.","analysing sentiment contained within a log message to detect anomalous events. More specifically, we can distinguish between normal and abnormal events and also detail the severity of the detected abnormalities. Therefore, VOLUME 13, 2025 105365 S. Silalahi et al.: Interpretable Ordinal-Aware With Contrastive-Enhanced Anomaly Severity Detection TABLE 2. Related works in log-based anomaly detection. the investigator can prioritise the analysis objective to focus only on severe abnormalities. Therefore, we propose an interpretable log anomaly detection framework based on sentiment analysis, as depicted in Fig. 5. During the training phase, we investigate the model’s perception of the semantics of the messages when making predictions. The model is expected to associate the contextual dependency among words and phrases within the input message",1.0,0.9156483598732589
"this section reports the experimental results along with in-depth discussions and analyses. A. BEST PERFORMING SCENARIO A. BEST PERFORMING SCENARIO 1) EVALUATION METRIC After experimenting with all the designed scenarios, the models’ performance is evaluated on the test dataset. The best-performing model from each pair of encoder type and loss function is reported in Table 4 and Table 5 for unfiltered and filtered datasets. Based on the evaluation metrics shown in both tables, the proposed scenario outperforms all baseline scenarios on all encoder types tested on the unfiltered dataset, with an accuracy of 96.875 and an F1 score of 96.851. As for the filtered dataset, the transformer encoder trained on the baseline scenario outperforms the other scenarios on all encoder","['. Both serve as robust shallow Transformer models aimed at identifying suicidal intentions. representations for image retrieval and classification tasks. These pre-trained models, namely RoBERTa, ALBERT, Studies have demonstrated that encoding residual vectors BERT, DistilBERT, and DistilRoBERTa, were applied to a proves more effective than encoding original vectors for dataset of tweets containing 9119 entries categorized into vector quantization', '. Knowledge distillation has emerged high terminology precision and fluency. as a powerful technique to address this challenge. Initially While these models advance image-text understanding and developed as a method to compress large models into smaller, representation quality, they are often designed for retrieval, VOLUME XX, 2017 7 This work is licensed under a Creative Commons Attribution 4.0 License. For more information, see https://creativecommons.org/licenses/by/4.0/', '. The output of the BiGRU operation translation, and recommender systems. Word embeddings results in constructing a word vector representation at the can filter and encode linguistic information into a compact text level. Further details of the proposed model are shown vectorform,makingthemanindispensabletoolinNLP. in Algorithm 2. Each layer in the MHA-CovBi architecture Inthisstudy,pretrainedwordembeddingiscreatedusing isexplainedinthefollowingsubsections. a combination of FastText and GloVe embeddings', '. Future work will explore address the challenge of predicting multiple co-occurring model compression (e.g., pruning, quantization, low-rank abnormalities. Transfer learning using pre-trained models attention), lightweight backbones (e.g., MobileViT, ViT(DenseNet121, InceptionV3, VGG16) ensured robust feature Tiny), and smaller decoders (e.g., distilled GPT). Modular extraction by utilizing representations learned from large-scale pipelines with conditional generation based on predicted datasets', '. However, the proposed method produces lower loss ‘‘Review of deep learning: Concepts, CNN architectures, challenges, valueswith0.707,0.657,and0.665comparedtotheprevious applications,futuredirections,’’J.BigData,vol.8,no.1,p.53,Mar.2021, doi:10.1186/s40537-021-00444-8. method with 0.712, 0.685, and 0.725 for U-net, Res U-net, [16] Ö. Çiçek, A. Abdulkadir, S. S. Lienkamp, T. Brox, and O. RonandDenseU-net,respectively']",,"there are 1,584 resulting model configurations in total, 729 for each dataset. Considering the extensive number of hyperparameter search spaces, not all the results are presented in this paper. Therefore, for each encoder type and scenario, only the best- performing one is presented for comparison and explained in the following subsection. Several metrics are used to evaluate the overall models’ performance, i.e., accuracy, precision, recall, and F1. Note that the weighted average is used to compute the average score of precision, recall, F1, and prediction confidence. We investigate the confusion matrix, learned representation, and the interpretability of the model’s prediction to increase understanding of the model. Captum, a tool developed by version 0.7.0 is used for model’s interpretability analysis. V.",,0.0
"on all encoder types tested on the unfiltered dataset, with an accuracy of 96.875 and an F1 score of 96.851. As for the filtered dataset, the transformer encoder trained on the baseline scenario outperforms the other scenarios on all encoder types with an accuracy of 83.761 and an F1 score of 82.967. The proposed scenario only performs better on the GRU and LSTM encoders than the baseline scenarios. 2) PREDICTION CONFIDENCE Evaluating the performance of a neural model strongly depends on the task and domain problem. In a particular task, accuracy can be the only important metric. However, in some other domains, having a high accuracy does not suffice. For example, in this study, the model needs to be sure","['. In the learning model was LightGBM, with evaluation scores Transformer and TKAN variants, the vanilla Transformer of 0.99843 R2, 96.76132 MAE, 56,754.18872 MSE, has the best performance in 4 of 5 evaluation metrics 0.00833 sMAPE, 0.32185 F1-score, and 0.51070 with evaluation scores of 0.99992 R2, 42.54592 MAE, MWRE@0.75. CEM and REM outperformed LightGBM. 3,075.38631 MSE, 0.00644 sMAPE, 0.46445 F1-score, AmongMLP,LSTM,GRU,andCNN-LSTM,GRUdelivered and 0.40327 MWRE@0.75', '. The CNN-LSTM has the best evaluation score 19,016.86043 MSE, 0.00744 sMAPE, 0.33052 F1-score, in sMAPE, F1-score, and MWRE@0.75. The GRU and and 0.50397 MWRE@0.75. The best-performing machine CNN-LSTM perform better than CEM and REM', 'model accuracy model loss model accuracy model loss BiLSTM RNN GRU CNN BiLSTM RNN GRU CNN BiLSTM RNN GRU CNN BiLSTM RNN GRU CNN 100 25 100 20 yc g a n r i u n c ) ia % c r a ( t 9 9 9 9 9 8 6 4 2 0 gnin s ) i s % a o r ( t l 2 1 1 0 5 0 5 0 n y o c i a ta ru d c i ) l % a ca v ( 9 9 9 9 8 6 4 2 noitad s i ) l s % a o v ( l 1 1 5 0 5 0 1 2 3 4 5 1 2 3 4 5 1 2 3 4 5 1 2 3 4 5 epoch epoch epoch epoch Fig. 5. Model training accuracy Fig. 6. Model training loss Fig. 7. Model validation accuracy Fig. 8', '. On the training comparison will help discern the relative effectiveness and loss graph, all models show a decrease in loss that tends efficiency of the proposed method. By doing so, the aim is to to flatten as the epoch increases. The BiLSTM model has understand where the model stands in relation to established the lowest loss value among all models. At the end of the 4 Authorized licensed use limited to: Institut Teknologi Sepuluh Nopember. Downloaded on July 14,2025 at 08:18:27 UTC from IEEE Xplore', '. The and CatBoost deputize the ML architecture. MLP, LSTM, bestmodelwaschosenbasedontheevaluationofF1-score, GRU, CNN-LSTM, Transformer, and TKAN represent DL precision,accuracy,andrecall,anditwillbeutilizedtoextract architecture.ThisresearchconductedmodifiedTransformer aspectandopiniontermsacrossalldatasets']","In a comparative evaluation of encoder types, the GRU encoder was noted to deliver competitive performance metrics, similar to findings in the current study.","precision, recall, F1, and prediction confidence. We investigate the confusion matrix, learned representation, and the interpretability of the model’s prediction to increase understanding of the model. Captum, a tool developed by version 0.7.0 is used for model’s interpretability analysis. V. EVALUATION AND DISCUSSION V. EVALUATION AND DISCUSSION A. PERFORMANCE EVALUATION A. PERFORMANCE EVALUATION After conducting an extensive experiment on a vast amount of hyperparameter search space, the best-performing models for each encoder-scenario pair tested on the unfiltered and filtered dataset are reported on Table 7 and Table 8, respectively. From both tables, it can be seen that the highest score is achieved by the proposed scenario. It demonstrates the advantages of incorporating multitask label schema to train multiclass anomaly severity",0.5,0.921243044350521
"which hyperparameter the accuracy depends on. The dependency can be either increasing or decreasing the accuracy. Nevertheless, it can help choose which hyperparameter to modify in the next experiments. C. COMPARISON WITH STATE-OF-THE-ART MODELS C. COMPARISON WITH STATE-OF-THE-ART MODELS In this study, several baselines from previous studies are reproduced on the dataset to perform performance compar- isons. The reproduced performance from an experimental procedure explained in subsection IV-B2 is presented in Table 6. On both datasets, the proposed scenario outper- forms all the baselines with an improvement of 0.423 and 0.665 in the F1 score on the filtered and unfiltered datasets, respectively. Considering that Pylogsentiment used a GRU-based encoder and SentiLog used an LSTM-based the proposed scenarios on these two","['. ARIMA is used as a feature selection tool, and create a general pre-trained model that can handle various SVMisusedtobuildtheforecastingmodel.Inaddition,deep NLP tasks [13]. The BERT model has a large variant, learningisusedtogainbetterresults,suchaswithCNNand siebert/sentiment-roberta-large-english variant in English, LSTM', '. Numerous researchers and high efficiency. The parameter system performance have explored hyperparameter optimization (HPO) techdeploymentmodelCNNondevicesperformswellintermsof niques.Forinstance,systematicreviewshavebeenconducted precision,recall,F1-score,andaswellasefficiencyoftime on HPO methods for CNN models [60], while others have inference', '. Stacking the encoder in layers is one of the common hyperparameter tuning techniques when using RNN-based and Transformer models[56].Therefore,wevarythenumberoflayers’values with one, two, or three, as the BERT’s parameters are also updated during the training [25]. Choosing the number of attentionheadsintheTransformerencoderisdeterminedby neighbouring classes share common features', '. The TKAN has a better capture pattern 0.32963 F1-score, and 0.50463 MWRE@0.75. The best of ABSA sentiment score than the pTKAN. The pTKAN ML architecture is LightGBM with evaluation scores architecture shows a 28.40% reduction in MSE compared are 0.99834 R2, 98.23507 MAE, 60,047.07194 MSE, to TKAN, indicating that pTKAN successfully reduced the 0.00834 sMAPE, 0.32235 F1-score, and 0.51032 error by more than one. In the MWRE evaluation, pTKAN MWRE@0.75', '. Forecasting ROUGE-L,andWER.AsshowninTable.9,theFlanT5-Base value in the financial domain not only discusses regression is the best model to produce aspect-sentiment quadruplet errors but also movement direction errors, which impact with 0.638 BLEU, 0.836 ROUGE-1, 0.833 ROUGE-L, financial loss. This section compares unified stock price and 0.140 WER. The highest ROUGE-1 and ROUGE-L forecastingresultswithorwithouttheABSAsentimentscore']","Systematic reviews have been conducted on hyperparameter optimization methods for CNN models, focusing on metrics such as precision, recall, and F1-score (iYOLOV7-TPE-SS).","sequence-based approach in the log-based anomaly detection research, as shown in Table 2. In contrast, this paper uses a point-based approach based on the characteristics of the problem and the dataset. Therefore, there are limited references that can be used as baselines for comparison, as described in the following: 1) Pylogsentiment . Using a point-based approach, a sentiment analysis model is trained using a one-layer VOLUME 13, 2025 105369 S. Silalahi et al.: Interpretable Ordinal-Aware With Contrastive-Enhanced Anomaly Severity Detection TABLE 6. Hyperparameter search space for all scenarios. neighbouring classes share common features. GRU, LSTM, and Transformer are explored to find the best- performing encoder. To provide a fair comparison, the GloVe embedding used in pylogsentiment, SentiLog, and TransSentLog are",0.3333333333333333,0.9110455406388234
"proposed scenario can improve the detection performance of the model. D. ABLATION STUDY D. ABLATION STUDY Following the rapid advancement in neural network research, more complex and sophisticated architectures are emerging. A model can consist of layers of components that have a specific role in the learning process. After conducting an experiment on a certain dataset and task, verifying and checking which component in the model contributes posi- tively to the performance is crucial. Therefore, we perform an ablation study to explain which part of the proposed approach has a significant impact on the performance. Note that only the best-performing scenario on each dataset is explored. First, we investigate the significance of the CLS token from the BERT embedding. Secondly,","['. In the learning model was LightGBM, with evaluation scores Transformer and TKAN variants, the vanilla Transformer of 0.99843 R2, 96.76132 MAE, 56,754.18872 MSE, has the best performance in 4 of 5 evaluation metrics 0.00833 sMAPE, 0.32185 F1-score, and 0.51070 with evaluation scores of 0.99992 R2, 42.54592 MAE, MWRE@0.75. CEM and REM outperformed LightGBM. 3,075.38631 MSE, 0.00644 sMAPE, 0.46445 F1-score, AmongMLP,LSTM,GRU,andCNN-LSTM,GRUdelivered and 0.40327 MWRE@0.75', '. Similar to the Linear model, transformer-based aLinearencoderisequaltonotusinganyencoderlayer.Note best-performing models use [CLS] tokens as the final thatsomehyperparametersapplyonlytoaparticularencoder features, yielding a very competitive score based on the type. For instance, the number of attention heads is only baseline scenario. The only pattern shown by the LSTM relevant to the Transformer encoder. Moreover, the [CLS] encoderisthatitworkswellwithmorelayers', '. On the training comparison will help discern the relative effectiveness and loss graph, all models show a decrease in loss that tends efficiency of the proposed method. By doing so, the aim is to to flatten as the epoch increases. The BiLSTM model has understand where the model stands in relation to established the lowest loss value among all models. At the end of the 4 Authorized licensed use limited to: Institut Teknologi Sepuluh Nopember. Downloaded on July 14,2025 at 08:18:27 UTC from IEEE Xplore', '. With an accuracy To tackle these challenges, the specialized subfield of artifiof 98.62% and superior scores in f1-score, precision, and recall, cial intelligence, Natural Language Processing (NLP), assumes the BiLSTM model demonstrates robustness in capturing the a pivotal role. NLP harnesses computational techniques to intricate linguistic patterns and textual structures inherent in interpret human language, encompassing tasks such as lanJavanese manuscripts', '. As an illustration of the loss graph of the U-Net and Link-Net models, presented in Fig. 3c and Fig. 3d. TABLE II. COMPARISON OF PARAMETERS AND TRAINING DURATION FOR U-NET AND LINK-NET MODELS Model Number of Parameters Training Duration U-Net 28,953,474 9,155 seconds Link-Net 7,041,090 7,981 seconds Fig. 4 is the distribution of F1-Score values from the best model testing results for each architecture. Both U-Net and Link-Net have asymmetric distributions']","The best-performing models utilize [CLS] tokens as final features, contributing significantly to their performance (Interpretable Ordinal-Aware With Contrastive-Enhanced Anomaly Severity Detection on UAV Flight Log Messages).","model plays a significant role in performing the task is crucial to developing a high-performing model. To this end, in this paper, an ablation study is performed. First, we investigate the effect of employing multitask learning on the model’s performance. Secondly, we investigate the effect of using all zeroes for the Normal class label’s representation. Thirdly, the importance of the [CLS] token’s embedding vector and the BERT’s parameters are investigated. Lastly, we com- prehensively study the effect of the proposed DroneSBERT embedding on the model’s performance, interpretability, and learned representations. Overall, the multitask label can improve the detection performance, where the best-performing models on both datasets are achieved by the proposed Multitas-111 label. Using all zeroes to represent the Normal",0.3333333333333333,0.9163950662560676
"to explain which part of the proposed approach has a significant impact on the performance. Note that only the best-performing scenario on each dataset is explored. First, we investigate the significance of the CLS token from the BERT embedding. Secondly, we analyse the impact of freezing the BERT’s parameter during training. Thirdly, we vary the batch size during the training. Finally, FIGURE 11. Analysis of the effect of different batch sizes on the evaluation scores of the best-performing models. we examine the effect of increasing the prediction threshold used in our proposed approach on the accuracy and F1 scores. As shown in Table 6, excluding the CLS token embedding before feeding the input matrix to the encoder significantly decreases performance.","['. trained large language models (PLMs), BERT is commonly Therefore,foreachencodertypeandscenario,onlythebestusedinlog-basedanomalydetectionresearch,asdiscussedin performingoneispresentedforcomparisonandexplainedin SectionII.Therefore,allthemodelsinthispaperuseBERTas thefollowingsubsection.Severalmetricsareusedtoevaluate thewordembeddingmodel.Otherthanthesefourbaselines, the overall models’ performance, i.e., accuracy, precision, we construct our own baseline by performing a grid search recall, and F1', '. Thirdly, Thisisshownbytheattributionscores,wherefiveoutofeight the importance of the [CLS] token’s embedding vector and examples belonging to the High class have negative overall the BERT’s parameters are investigated. Lastly, we comattribution scores', '. multitask-basedvectorlabels. Afterconductinganotherexperimentusingtheprocedure TheimpactoftheDroneSBERTembeddingisnotonlyan explained in Section IV, there is a noticeable improvement improvementintheperformancebutalsoabetterperception in the model’s performance, as shown in Table 9. The of the log messages. As a follow-up action from the 3https://www.sbert.net/docs/sentence_transformer/training_overview', '. to guide the training process. To assess the final model’s Circular padding was employed as the padding techgeneralizationability,wemeasuredprecision(P),recall(R), nique. The multi-head attention mechanism incorporated F1score(F1),andaccuracy(te−acc)onaseparatetesting four attention heads and the BiLSTM layer was configured dataset. with 100 hidden units. We used pre-trained GloVe with 50 dimensions [36] and fastText embeddings [37] for word IV. EXPERIMENTS embeddings', '. This research modified the separator token and sequence-to-sequence (seq2seq) pretrained model. We added a new seq2seq pre-trained model, FlanT5-Small, FlanT5-Base, and Bart-Base, then compared itwithT5-SmallandT5-Base[8],[56],[57].TheSCLlossin thetrainingprocessusesaspectcategory,sentimentpolarity, and opinion term as anchors to distinguish word vector representation on each label']","The significance of the [CLS] token's embedding vector in BERT is highlighted, indicating its importance in model performance (Interpretable Ordinal-Aware With Contrastive-Enhanced Anomaly Severity Detection on UAV Flight Log Messages).","CRF is used as the decoder. In terms of convergence speed, as depicted in Fig. 11, the proposed method converges as fast as Transformer and AdaTrans. Moreover, cosine atten- tion outperforms the BiLSTM model. From the F1 score, our proposed method achieves the second-best performance FIGURE 10. Comparison between different encoders with the best performance on the test set of the contextual dataset. results reported in Table 7 to 9, the involvement of either con- textual or static embedding signiﬁcantly affects the model’s performance evaluation score. This can be seen from the dot-product attention performance, with a 3.782% difference between the best dot-product attention that uses BERT and GloVe. This signiﬁcant difference is also happening to the cosine attention, with",0.3333333333333333,0.9327842483797696
"effect of increasing the threshold on the accuracy and F1 scores of the best-performing model tested on both datasets. An interesting case is shown in Fig 12a when λ = 0.65, the accuracy reaches 97%, exceeding the best model’s accuracy when λ = 0.5. This happens when the prediction confidence score surpasses the threshold while the true label’s severity is lower than the prediction label’s. Thus, following the decoding procedure in section III-C, the predicted label is incorrect. This phenomenon also happens on the filtered dataset when λ > 0.94. Overall, the decrement in the accuracy and F1 scores is insignificant until λ = 0.9 and λ = 0.8 on the unfiltered and filtered datasets, respectively. Thus, it confirms the","["". These metrics can be calculated by (1) – (3). This study's calculation of True Positive, False Positive, and False Negative differs from other classifications or detections [20]-[23]. These are chosen and calculated following previous studies [1]. Precision detects the truly correct prediction out of all predictions. Recall detects the truly correct prediction out of all actual classes. F1 scores are harmonic mean between these two that measure overall model performance"", 'that could be vital for accurate classification [40]', '. TP pre = (22) TP+FP + ε tagging procedure. The model with the best performance is TP rec = (23) highlighted a bold font. The presented scores in the tables TP+FN + ε containboth proposedandbaselinemodels', '. • False Negatives (FN): Refers to the number of actual objectsthatthemodelfailedtodetect. Fromthereviewedpapers,wecompiledalistofcommonly used metrics for detection, classification, and segmentation correlation between predictions and actual classes, particutasks, as summarized in Table 4. The metrics considered larly when dealing with unbalanced data [24]', '. Even though the recall results still value, which is smaller than the precision value, where the have values below 50%, which means there are still many recall value is related to the ratio of the number of correct missing values from the prediction results, the F1 score predictions with all ground-truth data. However, for other results show promising results with a score reaching 80%']","The accuracy and F1 scores are calculated based on True Positive, False Positive, and False Negative metrics, which are essential for evaluating model performance in classification tasks.","we further analyse the effect of increasing the prediction threshold upon inferring the label. As the threshold value is closer to 1, a notable decrease can be seen in Fig. 13b, starting from 0.94. Conversely, the unfiltered dataset in Fig 13a shows a negligible decrease. C. ERROR ANALYSIS C. ERROR ANALYSIS This section discusses the confusion matrix, learned rep- resentation, and the interpretability of the best-performing model on the filtered dataset. The confusion matrix in this paper is redefined to align with the anomaly severity context, where the distance between true and predicted labels matters. If the predicted label is lower than the true label, we define it False Positive (FP). Conversely, if the true label is lower than the",0.5,0.9405341305915165
"each scenario. FIGURE 14. The number of misclassified samples from the best-performing model on each loss function tested on the unfiltered dataset. In a binary setting, let the Normal class be positive and the Anomaly is negative. Then, False Positive (FP) refers to samples with a true label negative but predicted as positive. At the same time, a False Negative (FN) is a case when a sample belongs to a positive class but is predicted as negative. However, in this study, we define the misclassification cases differently: • False Positive refers to a case when the true class is higher than the predicted class. • False Negative is a misclassification case where the true class is lower than the predicted","['. In this context, having less FP is more important than having less FN, as the task objective is anomaly severity detection, where we aim to detect all abnormalities along withtheseveritylevel.Therefore,undetectedabnormalities, or detecting higher severity as lower ones, indicate that the model fails to meet the task’s objectives', '. An interesting witharandomstateof42. pattern is shown in Table 8 regarding the hyperparameter Four encoder types are selected to be combined with the values on each encoder type. The GRU works well with baseline and proposed scenarios, i.e., Transformer, LSTM, more layers, average pooling, and uniform class weighting. GRU, and Linear, since these encoders are standard in log- Differently, the Linear model has benefited from the [CLS] based anomaly detection as discussed in Section II', '. Ou and J. Liu, “Log anomaly detection method based on hybrid transformer-bilstm models,” in 2022 IEEE 22nd International ConferInformerandFedFormermodelsmayoutperformTransformerenceonSoftwareQuality,Reliability,andSecurityCompanion(QRS-C), based models. pp.762–763,2022. [16] S. Pasch and D. Ehnes, “Nlp for responsible finance: Fine-tuning transformer-based models for esg,” in 2022 IEEE International ConV. CONCLUSIONS ferenceonBigData(BigData),pp.3532–3536,2022', '. As depicted in Fig 18, the highlighted to multiclass anomaly detection while exploiting the shared words align more with the attribution label, supported by high- and low-level features within the log messages that seven out of eight examples belonging to the High severity belong to different severity levels. Therefore, the forensic having positive attribution scores', '. [13] M. Memarzadeh, B. Matthews, and T. Templin, ‘‘Multiclass anomaly [35] C.Duan,T.Jia,Y.Li,andG.Huang,‘‘AcLog:Anapproachtodetecting detectioninflightdatausingsemi-supervisedexplainabledeeplearning anomaliesfromsystemlogswithactivelearning,’’inProc.IEEEInt.Conf. model,’’J.Aerosp.Inf.Syst.,vol.19,no.2,pp.83–97,Feb.2022. WebServices(ICWS),Jul.2023,pp.436–443. [14] Z.You,L.Cui,Y.Shen,K.Yang,X.Lu,Y.Zheng,andX.Le,‘‘Aunified [36] T.-A. Pham and J.-H']","In anomaly severity detection, minimizing false positives (FP) is prioritized over reducing false negatives (FN) to effectively identify all abnormalities and their severity levels (Interpretable Ordinal-Aware With Contrastive-Enhanced Anomaly Severity Detection on UAV Flight Log Messages).","we further analyse the effect of increasing the prediction threshold upon inferring the label. As the threshold value is closer to 1, a notable decrease can be seen in Fig. 13b, starting from 0.94. Conversely, the unfiltered dataset in Fig 13a shows a negligible decrease. C. ERROR ANALYSIS C. ERROR ANALYSIS This section discusses the confusion matrix, learned rep- resentation, and the interpretability of the best-performing model on the filtered dataset. The confusion matrix in this paper is redefined to align with the anomaly severity context, where the distance between true and predicted labels matters. If the predicted label is lower than the true label, we define it False Positive (FP). Conversely, if the true label is lower than the",0.25,0.9226585129344821
"study, we define the misclassification cases differently: • False Positive refers to a case when the true class is higher than the predicted class. • False Negative is a misclassification case where the true class is lower than the predicted class. Table 7 shows the position of FP and FN based on the above definition in a multiclass confusion matrix. VOLUME 12, 2024 64263 S. Silalahi et al.: Severity-Oriented Multiclass Drone Flight Logs Anomaly Detection FIGURE 15. A 2D visualisation of the filtered dataset representation obtained from the best model from each loss function tested on the filtered dataset. t-SNE is used to reduce the dimension of the embeddings. In an anomaly detection setting, FP is more important than FN","['. Inspired by the study, anomalous events on drone objective[33].Anotheralternativetoleveragethepre-trained flight logs can be detected by analysing log messages and model is fine-tuning the models using prompts [34]. With identifying suspect key phrases closely related to drone onlyafewtrainingdata,themodelcancapturethesemantics incident scenarios. Therefore, the region of interest in this of the input logs and detect anomalous log sequences well', 'robust predictions, enabling drone operators to detect and Furthermore, Jain et al. [10] proposed a framework for diagnose malfunctions quickly and take corrective actions. sensor data identification and verification. An analysis of a Thestructureofthispaperisasfollows.SectionIIpresents drone’sarchitectureandaforensicmodelwithgenericfeatures previous research relating to the drone log analysis and drone are proposed here in order to enhance the digital investigation forensics', '. combinedfromtwopublicdroneflightlogdatasets,i.e.,from 5) DroLoVe[9].ThestudyproposedamultitasklearningMendeley[51]andadronewiki[52].Therearetwodatasets: based anomaly severity detection on drone flight unfiltered and filtered. The unfiltered dataset is a collection logs with an assumption that, samples belonging to of log messages in its original condition gathered from the twosourceswithoutperforminguniquefiltering.Therefore, thereareseveralduplicatelogmessagesbothintrainingand TABLE4', '. DigitalObjectIdentifier10.1109/ACCESS.2025.3580056 Interpretable Ordinal-Aware With Contrastive-Enhanced Anomaly Severity Detection on UAV Flight Log Messages SWARDIANTARASILALAHI 1,(GraduateStudentMember,IEEE), TOHARIAHMAD 1,(Member,IEEE),HUDANSTUDIAWAN 1,(Member,IEEE), EIRINIANTHI 2,ANDLOWRIWILLIAMS 2 1DepartmentofInformatics,InstitutTeknologiSepuluhNopember,Surabaya60111,Indonesia 2SchoolofComputerScienceandInformatics,CardiffUniversity,CF244AGCardiff,U.K', '. [8] S. Silalahi, T. Ahmad, and H. Studiawan, ‘‘Drone flight log anomaly severityclassificationviasentenceembedding,’’inProc.Int.Conf.Artif. [30] S. Han, Q. Wu, H. Zhang, B. Qin, J. Hu, X. Shi, L. Liu, and X. Yin, Intell.,Blockchain,CloudComput.,DataAnal.(ICoABCD),Nov.2023, ‘‘Log-basedanomalydetectionwithrobustfeatureextractionandonline pp.100–105. learning,’’IEEETrans.Inf.ForensicsSecurity,vol.16,pp.2300–2311, 2021']","The study proposed a multitask learning based anomaly severity detection on drone flight logs, assuming that samples from two sources were used without unique filtering (Silalahi et al., 2024).","be employed to force the model to learn a distinctive representation of the positive FIGURE 4. An illustration of anomalies that occur during a drone’s flight. inclusive. Therefore, this paper proposes a multitask-based multiclass drone anomaly detection to assist in a forensic investigation. The main contributions of this paper are summarized as follows: 1) We propose DroneLog, an interpretable sentiment- based multiclass drone flight log anomaly detection framework that includes three anomaly severity levels: low, medium, and high. Providing the severity level can provide better detection results for the investigator to pinpoint the event of interest. Interpretability makes training and testing more transparent, the model trustworthy, and human-friendly. 2) We propose DroneSBERT,1 a domain-specific embed- ding to extract semantic features",0.6666666666666666,0.9639829837207223
"the performance of the proposed framework has been discussed and analysed. In this section, challenges encountered during the study are disclosed, along with limitations and threats to validity. As drone forensics is an emerging topic, there are very limited public datasets available. The log messages used in this study are mainly acquired from DJI-made devices. There is yet to come a publicly available dataset of log messages from other drone manufacturers. Several publicly available datasets are mainly about sensor data and multimedia artefacts . While in this study, we solely depend on the human-readable messages generated by the drone during a flight. Given the condition where a small number of unique messages and most of them are acquired from DJI","['. For instance, GPS records can be utilisedtoreconstructandanalysethepathtakenbythedrone duringaflight[2].Thedeviationbetweentheempiricalflight andreconstructedpathscanhappenifthedroneencountersa GPSspoofing[3]. Among the published drone forensics studies, popular worksincludecasestudies,evidenceanalysis,toolsdevelopment, and forensic framework development [5]', '. Section III explains the proposed method, applying process. Also, Barton et al. [11] conducted the research to the Transformer technique to forensics of drone malfunctions. reconstruct the actions taken by these drones, identify their InSectionIV,thediscussionofperformancemethod,followed owners or operators, and extract data from associated mobile by conclusions and future works in Section V. devices. In other research in drone forensics, this paper also analyze II', 'robust predictions, enabling drone operators to detect and Furthermore, Jain et al. [10] proposed a framework for diagnose malfunctions quickly and take corrective actions. sensor data identification and verification. An analysis of a Thestructureofthispaperisasfollows.SectionIIpresents drone’sarchitectureandaforensicmodelwithgenericfeatures previous research relating to the drone log analysis and drone are proposed here in order to enhance the digital investigation forensics', '. Most drone incidents are caused analysis of drone logs can also provide evidence that can be by bird attacks, collide with other drones, and malfunctioning used in legal proceedings. This evidence can be particularly systems.Sometimesthedronemayhaveamalfunctioningsystem valuable in cases where there are disputes over liability, such caused by sensor failure, a broken motor, or CPU failure. This cancauseanaccident.Therefore,aforensicinvestigationsupports as in cases of property damage or personal injury', '. challenges for drone digital forensics investigations,’’ Array, vol. 14, Jul.2022,Art.no.100135. [27] J. Qi, Z. Luan, S. Huang, C. Fung, H. Yang, H. Li, D. Zhu, and D.Qian,‘‘LogEncoder:Log-basedcontrastiverepresentationlearningfor [5] H.Studiawan,G.Grispos,andK.-K.-R.Choo,‘‘Unmannedaerialvehicle anomalydetection,’’IEEETrans.Netw.ServiceManage.,vol.20,no.2, (UAV)forensics:Thegood,thebad,andtheunaddressed,’’Comput.Secur., pp.1378–1391,Jun.2023. vol.132,Sep.2023,Art.no.103340. [28] J. Li, H. He, S. Chen, D']","The limited availability of public datasets for drone forensics poses significant challenges for digital investigations (Studiawan, Grispos, & Choo, 2023).","a scenario design, data generation and acquisi- tion, data analysis, and ﬁnally, reporting. Several references are using DJI , , , Cheerson , Parrot , and Yuneec model as experimental devices. However, there is no attempt to utilize speciﬁc data, in this case, the log message, to perform a drone forensic investigation. For this reason, we propose a deep learning-based Natural Language Processing (NLP) technique to perform information extrac- tion from the log message to assist the forensic investigation process. Information Extraction (IE) is one of the sub-topic in the NLP research domain, which aims to infer knowledge from a lake of text data. There are several steps in performing information extraction; after data source collection and pre- processing, Named",0.5,0.9558219217195774
"the model can be convincing and accountable enough to the investigator to be included in the investigation report. VII. CONCLUSION AND FUTURE WORK VII. CONCLUSION AND FUTURE WORK In this paper, we demonstrate how to train a log-based anomaly detection model that can prioritise the prediction of higher severity anomalies on drone flight logs while increasing the prediction confidence score at the same time. Considering the nature of the dataset, where samples that belong to different severity levels share common features, a multitask vector label representation along with severity-oriented decoding is proposed. An extensive experiment proved that the proposed approach is better than the previous work baselines while being inferior to our baseline scenario based on the accuracy and F1","['. Inspired by the study, anomalous events on drone objective[33].Anotheralternativetoleveragethepre-trained flight logs can be detected by analysing log messages and model is fine-tuning the models using prompts [34]. With identifying suspect key phrases closely related to drone onlyafewtrainingdata,themodelcancapturethesemantics incident scenarios. Therefore, the region of interest in this of the input logs and detect anomalous log sequences well', '. DigitalObjectIdentifier10.1109/ACCESS.2025.3580056 Interpretable Ordinal-Aware With Contrastive-Enhanced Anomaly Severity Detection on UAV Flight Log Messages SWARDIANTARASILALAHI 1,(GraduateStudentMember,IEEE), TOHARIAHMAD 1,(Member,IEEE),HUDANSTUDIAWAN 1,(Member,IEEE), EIRINIANTHI 2,ANDLOWRIWILLIAMS 2 1DepartmentofInformatics,InstitutTeknologiSepuluhNopember,Surabaya60111,Indonesia 2SchoolofComputerScienceandInformatics,CardiffUniversity,CF244AGCardiff,U.K', '. For instance, the message ‘‘Critically low power. Aircraft is landing’’ is more important than ‘‘Forward Obstacle Sensing notWorking’’.ThisstudyproposesDroneLog,aninterpretableframeworkfordetectinganomaliesandthe severity levels on drone flight logs, using a multitask learning approach in a unified pipeline', '. 1) We propose DroneLog, an interpretable sentimentAs an example, the flight path taken by a drone during a based multiclass drone flight log anomaly detection flightisrecordedinlongitudeandlatitudecoordinates.These frameworkthatincludesthreeanomalyseveritylevels: datacanbeusedtodetectananomalybyfindingapeculiar low,medium,andhigh.Providingtheseveritylevelcan valuewithinthelogrecordsbycontrastingthenormalvalues provide better detection results for the investigator to', '. [8] S. Silalahi, T. Ahmad, and H. Studiawan, ‘‘Drone flight log anomaly severityclassificationviasentenceembedding,’’inProc.Int.Conf.Artif. [30] S. Han, Q. Wu, H. Zhang, B. Qin, J. Hu, X. Shi, L. Liu, and X. Yin, Intell.,Blockchain,CloudComput.,DataAnal.(ICoABCD),Nov.2023, ‘‘Log-basedanomalydetectionwithrobustfeatureextractionandonline pp.100–105. learning,’’IEEETrans.Inf.ForensicsSecurity,vol.16,pp.2300–2311, 2021']","The proposed DroneLog framework utilizes a multitask learning approach to detect anomalies and their severity levels in drone flight logs (Silalahi et al., 2023).","severity level can provide better detection results for the investigator to pinpoint the event of interest. Interpretability makes training and testing more transparent, the model trustworthy, and human-friendly. 2) We propose DroneSBERT,1 a domain-specific embed- ding to extract semantic features that are well-aligned to the human perception of the log message samples. Supervised contrastive learning is employed to learn distinct representations for each anomaly severity level. 3) We explore two target label representations to augment a multitask learning paradigm for training multiclass classification models. Aligning to the dataset character- istics where the log messages from different anomaly severity levels share common words and phrases, multitask learning can help the model make use of the shared low-level features in the log",0.75,0.9416781713436141
"ANALYSIS We conducted a controlled experiment to evaluate the influence of various word embedding methods on our model’s performance. We used different word embedding techniques, explicitly using fastText as an alternative method to provide comparative performance data for the architecture with different word embedding inputs. This experiment used 540k sentence pairs and maintained the same settings as the previous experiments. This experi- ment compared the results obtained in a previous experiment using the Glove word embedding technique. The performance comparison of the model using different word embedding techniques is shown in Table 4. As seen in 4, our model performs better with Glove word embedding than FastText. Glove’s advantages align with the findings of , which state that the Glove","['. The GloVe word embedding model. In addition, this selection strategy model, trained on an English language corpus, was elected reducestheoccurrenceofout-of-vocabulary(OV)words.The to generate a vector representation of English words. This flowofthewordembeddingselectionprocessisillustratedin decisionisinformedbyfindingsfromaprecedingstudy[14]. Figure3.Theresultsofeachwordembeddingarecombined VOLUME12,2024 137069', '. Hybrid pretrained thismodel. word embeddings, with FastText for Indonesian and GloVe for English, significantly improve the model’s understanding of coded mixed text. FastText can handle Indonesian V. DISCUSSION word morphology better, while GloVe provides a powerful TheempiricalfindingsindicatethattheMHA-CovBimodel word representation for English. This combination allows demonstrated superior performance relative to baseline and VOLUME12,2024 137075', '. [13] to explore the impact of text normaliza- semanticsimilaritiesbetweenlanguages.Mostexistingstudtion on specific text processing tasks. However, the lexical ies rely on multiple types of word embedding, which may 137064 VOLUME12,2024', '. text. Ontheotherhand,ifthewordisidentifiedasIndonesian, On the other hand, the GloVe model constructs vector the pretrained Indonesian FastText word embedding will be representations of words within a corpus predicated upon used', '. The resulting word embedding is E[index]←We1+We2 intended to help learn the relationship between words in 6 end sentences written in a mix of Indonesian and English. Furthermore, a hybrid model based on CNN and BiGRU was built and enriched with pragmatic auxiliary features. CNN the data collection. A Python-based Twitter crawler was is very effective in extracting local features from text data']","The use of hybrid pretrained word embeddings, specifically FastText for Indonesian and GloVe for English, significantly enhances model performance in understanding code-mixed text (Sarcasm Detection in Indonesian-English Code-Mixed Text Using Multihead Attention-Based Convolutional and Bi-Directional GRU).","6 show the models’ architecture where LSTM and CNN were used as the character embedding, respectively. From the evaluation score presented in Table 4 to 6, the best performance was achieved by GloVe – Scaled AdaTrans combination with an 87.771% F1 score. AdaTrans atten- tion consistently achieves the highest score for all character embedding and word embedding options. GloVe outperforms the BERT embedding evaluated on the non-contextual dataset for all scenarios. This is because the ﬁrst dataset has con- sistent tagging, meaning that a word has a consistent tag for all different contexts in the dataset. It complies with the GloVe behavior, where each word has exactly one representa- tional vector. BERT – Scaled Transformer achieved the best overall performance",0.5,0.8939302823918351
"research introduces a novel Activity Recom- mendation System built on the COBIT 2019 framework tailored for Financial Balance Scorecard. The motivation stems from the challenges faced by auditors when identifying essential activities aligned with strategy of a company, often hindered by manual COBIT 2019 guideline navigation. To address this, a system was developed, where inputting the company strategy, triggers the display of recommended activities automatically. The methodology involved creating interconnected nodes from COBIT 2019 Element in Neo4J. This research uses a real strategy plan case study from 3 different companies as input, followed by a preprocessing step, then compares it to Enterprise Goals using TF-IDF and cosine similarity. Goals with high similarity scores trigger a graph query to reveal connected","['. It provides activity recommendations for in a table format for easy reference and analysis. The table users based on their specific requirements and objectives, will include detailed information about each recommended tailored to help organizations optimize their internal business activity, including its name, description, associated processes, processes according to COBIT 2019 guidelines', '. The Neo4j activities that correlate with Enterprise Goal EG02, which visualization tool offers a user-friendly interface for explordescribes ”Optimization of business process functionality.” ing COBIT framework relationships, enabling stakeholders to Using Algorithm 3, a graphical representation is created, as make data-driven decisions. Authorized licensed use limited to: Institut Teknologi Sepuluh Nopember. Downloaded on July 14,2025 at 08:22:06 UTC from IEEE Xplore. Restrictions apply.', 'A Recommendation System for Internal Business Processes of COBIT 2019 Using Graph Algorithm and Similarity Methods 1st I Gusti Lanang Agung Oka Cahyadi Pradipta 2nd Rizky Damara Ardy Informatics Departments Informatics Departments Institut Teknologi Sepuluh Nopember Institut Teknologi Sepuluh Nopember Surabaya, Indonesia Surabaya, Indonesia 6025232017@student.its.ac.id 6025231004@student.its.ac.id 3th Riyanarto Sarno 4th Kelly Sungkono Informatics Departments Informatics Departments Institut Teknologi', '. deeper analysis, real-time monitoring, and informed IT manAfter identifying company goals with a similarity value agement decisions. greater than 50, these nodes are used as references for the Our results demonstrated the system’s effectiveness in sugnext graph query execution to obtain the required activities. gesting activities tailored to enterprise goals, enhancing IT The output matches the mapping results, displaying only management practices and operational efficiency', '. ”Compliancewithinternalpolicies”] 3: RETURNBSC,EG,AG,OBJECTIVE,ACTIVITY Following this mapping process, a comprehensive list of Activities and Activity Descriptions was compiled for each Management Objective (COBIT Core Model), as shown in 1) Graph Visualization: Visualize the recommended ac- Table II. tivities using graph visualization techniques in Neo4j. After completing the mapping, the data is saved in CSV This involves creating node-link diagrams to represent format for loading into Neo4j']","The developed system effectively suggests activities aligned with enterprise goals, thereby enhancing IT management practices and operational efficiency (Oka Cahyadi Pradipta et al., 2023).","company goals by proposing a novel recommendation system for internal business processes, grounded in the COBIT 2019 framework. The system employs graph algorithms to map relationships, semantic similarity measure- ments to align enterprise goals with management objectives, and LSTM combined with TF-IDF methods to analyze and recommend specific activities. Experimental results show that this system optimizes IT management practices, enhances operational efficiency, and ensures regulatory compliance. Additionally, a user-friendly graphical representation of internal business pro- cesses using Neo4j enables stakeholders to visualize complex relationships within the COBIT framework, facilitating informed decision-making. This research advances IT governance practices by providing organizations with a valuable tool to automate and improve IT strategies, effectively achieving business objectives. Index Terms—COBIT 2019, graph algorithms, IT",0.75,0.8908563652498582
"management are vital for businesses in rapidly evolving landscape nowadays. Imple- menting an IT governance framework is crucial for several reasons. Firstly, it enables effective risk management against cyber threats, data breaches, and regulatory requirements, enhancing resilience and protecting sensitive data. Secondly, it ensures alignment between IT strategies and business ob- jectives, driving efficiency, innovation, and competitiveness. Lastly, it facilitates compliance with data privacy regulations and industry standards, ensuring transparency and accountabil- ity. Among these frameworks, COBIT is globally recognized for overseeing Enterprise Information and Technology (I&T) comprehensively, covering all systems regardless of their lo- cation within the organization. In essence, Enterprise I&T extends beyond the confines of the IT department and encompasses all facets of technology and information processing","['performance in the realm of critical role of risk management in IT governance', '. This system aims COBIT 2019, which stands for Control Objectives for to help organizations manage risk, ensure compliance, and Information and Related Technologies, is a comprehensive enhanceperformanceinthecontextofinformationtechnology', 'security, and operational efficiency of their information specific areas of IT management. COBIT 2019 provides systems. comprehensive guidance for understanding, planning, and implementing effective and efficient IT management Sungkono K et al., [13] explores the use of graphs to principles [21]. By adopting COBIT 2019, organizations can identify incorrect judgments and patterns in corporate improve their IT performance, reduce risks, and ensure that IT operations', '. Using COBIT metrics, organizations XGBoost 4.29 6.34 0.69 40.45 can evaluate and improve the quality of IT Governance, LightGBM 4.74 7.53 0.56 45.14 ensure compliance with regulatory provisions, and improve CatBoost 4.25 6.53 0.67 36.26 operational efficiency. As a result, these initiatives not only are presented in Table IV using MAE, RMSE, R², and MAPE improve the efficiency of project planning and execution but me trics', '. systems [12]. Through the use of the COBIT 2019 framework, COBIT provides comprehensive guidance for identifying, auditors can pinpoint key controls necessary to achieve establishing, and monitoring the necessary controls within the predefined business objectives. Meanwhile, event log process IT environment to achieve defined business objectives [3], [4]']",COBIT 2019 provides a comprehensive framework that enhances performance in managing risk and ensuring compliance within information technology environments.,"assist organizations in managing and optimizing their use of information technology (IT) . landscape, effective IT In today’s rapidly evolving digital governance is essential for organizations to ensure that their IT investments align with business objectives, comply with regulations, and mitigate risks . COBIT 2019 provides a structured approach for organiza- tions to establish, implement, and maintain effective gover- nance over IT. It defines the components necessary to create and sustain a governance system, as well as guidelines for building the most suitable governance system for an enterprise . By utilizing COBIT 2019, organizations can enhance the efficiency, effectiveness, and reliability of their IT usage, while also ensuring compliance with relevant regulations, policies, and standards . One of the key",1.0,0.8999537455060695
"COBIT Core Model and Capability Scores, it is necessary to undergo a mapping process according to the instructions in the COBIT 2019 manual. This can be time-consuming, especially when auditor should auditing multiple companies simultaneously. This research aim to simplify the process to get Activities of COBIT 2019 automatically from Input Text Company Strategy that aligned with the description of related Enterprise Goals. This research adopts Neo4j, a graph database platform, to manage KG and process data related to these objectives, to gain deeper and more applicable insights into the relationships between strategic and operational objectives in a company . Furthermore, this research also involves the function of preprocessing the input text in the form of Company Strat- egy using","['. The Neo4j activities that correlate with Enterprise Goal EG02, which visualization tool offers a user-friendly interface for explordescribes ”Optimization of business process functionality.” ing COBIT framework relationships, enabling stakeholders to Using Algorithm 3, a graphical representation is created, as make data-driven decisions. Authorized licensed use limited to: Institut Teknologi Sepuluh Nopember. Downloaded on July 14,2025 at 08:22:06 UTC from IEEE Xplore. Restrictions apply.', 'Neo4jisagraphdatabasespecificallydesignedtostoreand functions by enhancing the organization’s ability to manage data with complex relationships [8]. In the context manage IT effectively. of COBIT 2019, Neo4j can be utilized to build dynamic 2) EG09: Internal Business Process Cost Optimization: graphical representations of various COBIT elements [9]', '. deeper analysis, real-time monitoring, and informed IT manAfter identifying company goals with a similarity value agement decisions. greater than 50, these nodes are used as references for the Our results demonstrated the system’s effectiveness in sugnext graph query execution to obtain the required activities. gesting activities tailored to enterprise goals, enhancing IT The output matches the mapping results, displaying only management practices and operational efficiency', '. cesses using Neo4j enables stakeholders to visualize complex Several previous papers still rely on manual approaches to relationshipswithintheCOBITframework,facilitatinginformed COBIT 2019, which have limitations in providing automated decision-making.ThisresearchadvancesITgovernancepractices recommendationsforauditactivitiesbasedoncompanygoals. byprovidingorganizationswithavaluabletooltoautomateand improve IT strategies, effectively achieving business objectives', '. ”Compliancewithinternalpolicies”] 3: RETURNBSC,EG,AG,OBJECTIVE,ACTIVITY Following this mapping process, a comprehensive list of Activities and Activity Descriptions was compiled for each Management Objective (COBIT Core Model), as shown in 1) Graph Visualization: Visualize the recommended ac- Table II. tivities using graph visualization techniques in Neo4j. After completing the mapping, the data is saved in CSV This involves creating node-link diagrams to represent format for loading into Neo4j']","This research advances IT governance practices by providing organizations with a valuable tool to automate and improve IT strategies, effectively achieving business objectives.","company goals by proposing a novel recommendation system for internal business processes, grounded in the COBIT 2019 framework. The system employs graph algorithms to map relationships, semantic similarity measure- ments to align enterprise goals with management objectives, and LSTM combined with TF-IDF methods to analyze and recommend specific activities. Experimental results show that this system optimizes IT management practices, enhances operational efficiency, and ensures regulatory compliance. Additionally, a user-friendly graphical representation of internal business pro- cesses using Neo4j enables stakeholders to visualize complex relationships within the COBIT framework, facilitating informed decision-making. This research advances IT governance practices by providing organizations with a valuable tool to automate and improve IT strategies, effectively achieving business objectives. Index Terms—COBIT 2019, graph algorithms, IT",1.0,0.8516059288531899
"in business process modeling. Using real- life data and public datasets, the research compared GPD++ to traditional methods like Inductive Miner (IM) and Split Miner (SM). Results showed that GPD++ effectively addressed ICRs and detected hierarchical blocks. The paper introduces the Invisible-Task Prime and Non-Prime ITPNP algorithm for mining invisible tasks in process models, focusing on XOR and AND/OR relationships. It detects invisible non-prime tasks in hybrid parallel rela- tionships. Tested on seven models, it outperformed traditional methods, achieving high fitness and precision, especially in complex scenarios. Research by introduces an improved method for detect- ing parallel process models in graph-based process discovery. By establishing relationship frequencies and using specific algorithms, the method accurately distinguishes XOR, AND, and OR relationships.","['. include process mining, data mining, machine [16] J.C.A.M.Buijs,B.F.vanDongen,andW.M.P.vanderAalst,‘‘Quality learning,ITgovernance,andothertopicsrelatedto dimensions in process discovery: The importance of fitness, precision, informationsystemsandcomputersciencefields generalizationandsimplicity,’’Int.J.Cooperat.Inf.Syst.,vol.23,no.1, ofstudy. Mar.2014,Art.no.1440001. VOLUME11,2023 123391', '. DigitalObjectIdentifier10.1109/ACCESS.2023.3324742 Extending Graph-Based Process Discovery for Hierarchical Block Detection and Incomplete Concurrent Relationship Handling INDRAWASPADA 1,3,RIYANARTOSARNO 1,(SeniorMember,IEEE),ENDANGSITIASTUTI2, HANUNGNINDITOPRASETYO1,4,ANDRADENBUDIRAHARJO1,5 1DepartmentofInformatics,FacultyofIntelligentElectricalandInformaticsTechnology,InstitutTeknologiSepuluhNopember,Surabaya60111,Indonesia 2DepartmentofBusinessAdministration,BrawijayaUniversity,Malang65145,Indonesia', '. The specifics of process discovery tasks include prosupportfrommultiplevendorsandhasbeenstandardizedby cessdiscovery,modeling,monitoring,andoptimization[20]. OMG.PetriNetsupportssimulationandiscompatiblewith The benefits of engaging in the process mining include the manyanalyticaltechniques[15]. following[21]: Definition5(PetriNet): A Petri net is a tuple N = 1', '. practical implementation. [12] R. Sarno and K. Sungkono, “A survey of graph-based algorithms for discovering business processes,” InterACKNOWLEDGMENT nationalJournalofAdvancesinIntelligentInformatics, This research was funded by Institut Teknologi Sepuluh vol.5,no.2,pp.137–149,2019,ISSN:2548-3161.DOI: Nopember (ITS) under Penelitian Dana Departemen Pro10.26555/ijain.v5i2.296. gram, Penelitian Keilmuan, Penelitian Flagship, Penelitian [13] A. Green, P. Guagliardo, L. Libkin, T. Lindaaker, V', '. process mining, data mining, machine learning, 934 885 [21] I.Waspada,R.Sarno,andD.K.R.Sungkono,‘‘Animprovedmethodof ITgovernance,andothertopicsrelatedtoinforma- 935 886 parallelmodeldetectionforgraph-basedprocessmodeldiscovery,’’Int. tionsystemsandcomputersciencefieldsofstudy. 936 887 J.Intell.Eng.Syst.,vol.13,no.2,pp.127–139,Apr.2020. 937 102752 VOLUME10,2022']","The research introduces an improved method for detecting hierarchical blocks and handling incomplete concurrent relationships in process models, demonstrating effectiveness in distinguishing XOR and AND/OR relationships.","more reliable in detecting and handling ICR patterns. B. GRAPH-BASED PROCESS DISCOVERY PLUS B. GRAPH-BASED PROCESS DISCOVERY PLUS PLUS (GPD++) GPD++ consists of the main algorithm for detecting split and join blocks presented in Algorithm 1 and the algorithm for finding the block hierarchy and its types (XOR or AND) in Algorithm 2 and Algorithm 3. GPD++ utilizes the detected block structure to identify ICR in blocks parallel (long). As an illustration of how Algorithm 1 works in finding split-join blocks, an example of a DFG model with one split node (|T| = 1) and one join node is given in figure 4. The input for Algorithm 1 is the DFG model with split-node and join-node information. The results of",0.5,0.8766238802106996
"by identifying Enterprise Goals corre- lated with the Balanced Scorecard Financial. Then, Alignment Goals related to these Enterprise Goals were mapped. Subse- quently, Management Objectives from the COBIT Core Model associated with Alignment Goals were identified. Examples of these mappings are shown in TABLE I. Following this, Activ- ities and their descriptions were compiled for each Manage- ment Objective, based on COBIT guidelines, as demonstrated in TABLE II. A total of 1202 activities were found to correlate with the Balanced Scorecard Financial perspective during the mapping process. B. Create Graph Database After the completion of the Mapping process, the next step is to create nodes and their relationships using Neo4J Graph Database Tools, in order to construct a Knowledge Graph","['. 24: SETOBJECTIVE.description=row.OBJECTIVE DESC 2) MappingfromBalancedScorecardtoActivity:Estab- 25: MERGE(AG TO)-[:HAS OBJECTIVE]->(OBJECTIVE) 26: endfor lish relationships between Enterprise Goals, Alignment 27: Goals, Management Objectives, and Activities. This 28: foreachignoreINCASEWHENrow.OBJECTIVE TOISNOTNULL mapping follows these steps: THEN[1]ELSE[]ENDdo 29: MERGE (OBJECTIVE TO:OBJECTIVE {name: a) Identify Enterprise Goals (EG) from the Balanced row.OBJECTIVE TO}) Scorecard (BSC)', '. An example 1: MATCH (BSC:BSC)-[:HAS EG]->(EG:EG)-[:HAS AG]>(AG:AG)-[:HAS OBJECTIVE]->(OBJECTIVE:OBJECTIVE)- of this mapping process is shown in Table I, which maps [:HAS ACTIVITY]->(ACTIVITY:ACTIVITY) the Balanced Scorecard (BSC), Enterprise Goals (EG), and 2: WHERE EG.description IN [”Optimization of business process costs”, Alignment Goals (AG)', '. The Neo4j activities that correlate with Enterprise Goal EG02, which visualization tool offers a user-friendly interface for explordescribes ”Optimization of business process functionality.” ing COBIT framework relationships, enabling stakeholders to Using Algorithm 3, a graphical representation is created, as make data-driven decisions. Authorized licensed use limited to: Institut Teknologi Sepuluh Nopember. Downloaded on July 14,2025 at 08:22:06 UTC from IEEE Xplore. Restrictions apply.', '. 30: MERGE(ACTIVITY:ACTIVITY{name:row.ACTIVITY}) 31: SETACTIVITY.description=row.ACTIVITY DESC b) Map Alignment Goals (AG) to corresponding En32: MERGE(OBJECTIVE TO)-[:HAS ACTIVITY]->(ACTIVITY) terprise Goals. 33: endfor c) Determine Management Objectives (COBIT Core Model) related to the identified Alignment Goals. d) Compile a list of Activities and Activity Descrip- 3) Establish edges to represent the relationships between tions for each Management Objective, as per CO- these entities', '. [9] A. Ghezzi, “How Entrepreneurs make sense of Lean the Balanced Scorecard, IPMS, and Performance Prism Startup Approaches: Business Models as cognitive lenses because these three models provide more intuitive and userto generate fast and frugal Heuristics,” Technological friendly frameworks. The research also highlights that in Forecasting and Social Change, vol. 161, no. June, p. determining performance indicators, there are variations due 120324, 2020, doi: 10.1016/j.techfore.2020.120324']","The mapping process establishes relationships between Enterprise Goals, Alignment Goals, Management Objectives, and Activities as outlined in the COBIT framework (A Recommendation System for Internal Business Processes of COBIT 2019 Using Graph Algorithm and Similarity Methods).","is linked to the appropriate business objec- tives and control needs, thus enhancing overall governance effectiveness . One effective way to perform this mapping is by utilizing a graph database such as Neo4j . Neo4j is a graph database specifically designed to store and manage data with complex relationships . In the context of COBIT 2019, Neo4j can be utilized to build dynamic graphical representations of various COBIT elements . By using Neo4j, organizations can create dynamic and interactive graphical models to better understand and manage the complex relationships between different COBIT 2019 elements . This allows for deeper analysis, real-time monitoring, and better decision-making in IT management, ultimately aiding in the achievement of business goals . In summary, this",0.3333333333333333,0.9295828822425168
"IX, it can serve as an internal reference for the company to assess its capability to meet these criteria and can also serve as a reference for formulating policies to prioritize the implementation of these activities in the future. V. CONCLUSION V. CONCLUSION In conclusion, the developed Activity Recommendation System based on COBIT 2019 framework offers a practical solution to the challenges faced by auditors in identifying and aligning activities with company strategy. By leveraging NLP techniques and graph queries, the system efficiently matches user input of company strategy with relevant activities automatically, eliminating the need for manual navigation through COBIT 2019 guidelines. The effectiveness of the system was demonstrated by in- putting company strategies from three companies in different","['. It provides activity recommendations for in a table format for easy reference and analysis. The table users based on their specific requirements and objectives, will include detailed information about each recommended tailored to help organizations optimize their internal business activity, including its name, description, associated processes, processes according to COBIT 2019 guidelines', 'A Recommendation System for Internal Business Processes of COBIT 2019 Using Graph Algorithm and Similarity Methods 1st I Gusti Lanang Agung Oka Cahyadi Pradipta 2nd Rizky Damara Ardy Informatics Departments Informatics Departments Institut Teknologi Sepuluh Nopember Institut Teknologi Sepuluh Nopember Surabaya, Indonesia Surabaya, Indonesia 6025232017@student.its.ac.id 6025231004@student.its.ac.id 3th Riyanarto Sarno 4th Kelly Sungkono Informatics Departments Informatics Departments Institut Teknologi', '. deeper analysis, real-time monitoring, and informed IT manAfter identifying company goals with a similarity value agement decisions. greater than 50, these nodes are used as references for the Our results demonstrated the system’s effectiveness in sugnext graph query execution to obtain the required activities. gesting activities tailored to enterprise goals, enhancing IT The output matches the mapping results, displaying only management practices and operational efficiency', '. nodesandrelationshipsbasedonCOBIT2019elements. E. Activity Recommendation 2) ImportthepreprocesseddataintoNeo4j,mappingnodes to entities such as internal business processes, control Based on the similarity measurements, the system recomobjectives, and IT processes. mends activities aligned with enterprise goals. The steps are: Authorized licensed use limited to: Institut Teknologi Sepuluh Nopember. Downloaded on July 14,2025 at 08:22:06 UTC from IEEE Xplore. Restrictions apply.', '. The Neo4j activities that correlate with Enterprise Goal EG02, which visualization tool offers a user-friendly interface for explordescribes ”Optimization of business process functionality.” ing COBIT framework relationships, enabling stakeholders to Using Algorithm 3, a graphical representation is created, as make data-driven decisions. Authorized licensed use limited to: Institut Teknologi Sepuluh Nopember. Downloaded on July 14,2025 at 08:22:06 UTC from IEEE Xplore. Restrictions apply.']","The developed Activity Recommendation System effectively recommends activities aligned with enterprise goals based on similarity measurements (Oka Cahyadi Pradipta et al., 2023).","company goals by proposing a novel recommendation system for internal business processes, grounded in the COBIT 2019 framework. The system employs graph algorithms to map relationships, semantic similarity measure- ments to align enterprise goals with management objectives, and LSTM combined with TF-IDF methods to analyze and recommend specific activities. Experimental results show that this system optimizes IT management practices, enhances operational efficiency, and ensures regulatory compliance. Additionally, a user-friendly graphical representation of internal business pro- cesses using Neo4j enables stakeholders to visualize complex relationships within the COBIT framework, facilitating informed decision-making. This research advances IT governance practices by providing organizations with a valuable tool to automate and improve IT strategies, effectively achieving business objectives. Index Terms—COBIT 2019, graph algorithms, IT",0.75,0.9015989044346835
"the system efficiently matches user input of company strategy with relevant activities automatically, eliminating the need for manual navigation through COBIT 2019 guidelines. The effectiveness of the system was demonstrated by in- putting company strategies from three companies in different sectors. The system provided a list of recommended activities that can be undertaken to achieve strategic objectives of each companies. Moving forward, there are opportunities to enhance and refine the system to improve both the accuracy of the rec- ommendations and the user experience, ensuring its continued utility and influence in enterprise governance and audit man- agement. Future upgrades could focus on enhancing the user interface to accommodate users with less technical expertise and improving the integration of the proposed","['. It provides activity recommendations for in a table format for easy reference and analysis. The table users based on their specific requirements and objectives, will include detailed information about each recommended tailored to help organizations optimize their internal business activity, including its name, description, associated processes, processes according to COBIT 2019 guidelines', '. Dataset and Preprocessing 26: print(”Similarityscorefor”,sentence,”:”,similarity[0]) The experimental process involves collecting datasets from 27: endfor COBIT2019,specificallyfocusingontheBalancedScorecard for internal business processes. Process mapping is then conAlgorithm 3 Activity Graph Generation ducted as the basis for forming nodes later on', '. Recommendations based on COBIT 2019 best practices, such as performance measurements and knowledge repository access, further enhance IT governance processes and contribute to the success of software development projects. The integration of AI and machine learning techniques with the COBIT 2019 framework holds promise in further enhancing IT governance practices [19]', 'A Recommendation System for Internal Business Processes of COBIT 2019 Using Graph Algorithm and Similarity Methods 1st I Gusti Lanang Agung Oka Cahyadi Pradipta 2nd Rizky Damara Ardy Informatics Departments Informatics Departments Institut Teknologi Sepuluh Nopember Institut Teknologi Sepuluh Nopember Surabaya, Indonesia Surabaya, Indonesia 6025232017@student.its.ac.id 6025231004@student.its.ac.id 3th Riyanarto Sarno 4th Kelly Sungkono Informatics Departments Informatics Departments Institut Teknologi', '. deeper analysis, real-time monitoring, and informed IT manAfter identifying company goals with a similarity value agement decisions. greater than 50, these nodes are used as references for the Our results demonstrated the system’s effectiveness in sugnext graph query execution to obtain the required activities. gesting activities tailored to enterprise goals, enhancing IT The output matches the mapping results, displaying only management practices and operational efficiency']","The system effectively suggests activities tailored to enterprise goals, enhancing IT management practices and operational efficiency (Oka Cahyadi Pradipta et al., 2023).","technology, thus helping them achieve their business objectives more effectively . Several previous papers still rely on manual approaches to COBIT 2019, which have limitations in providing automated recommendations for audit activities based on company goals. Thus, this research contributes significantly by addressing this gap and overcoming the challenges associated with manual COBIT utilization. The primary objective of this paper is to develop a rec- ommendation system that aligns with the internal business process strategy governed by COBIT 2019. This system aims to help organizations manage risk, ensure compliance, and enhance performance in the context of information technology. To achieve this, the research will utilize graph algorithms to build a recommendation system based on the internal business processes outlined in",0.6666666666666666,0.889256248938998
"whereas 27 chops had quality defects. B. Volatile Organic Compounds Identification Through Chromatography-Mass Spectrometry (GC-MS), it was found that there were 143 VOCs in the good-quality sample and 118 VOCs in the quality-defect sample. Then it also obtained that there were 102 similar compounds present Fig. 4. Number of Compounds in Each Classes Fig. 5. Percentage of Area of Compounds in Each Classes in both sample 1 and sample 2, which are detailed in TABLE II. The results of grouping chemical substances into several groups, including nitrogenous compounds, alcohols, esters, hydrocarbons, hetero- oxygenates, and others. Substance content in each class of compounds means that different concentrations are shown as Area as shown in TABLE II. aldehydes, phenols, ketones, In GC-MS,","['. instrument is around USD 120,000 in 2017 [17], while the cost of testing a sample is about USD 50. In addition, the II. RELATEDWORKS testing process of one sample can take about 1 to 2 days, E-nosecanbeusedforfoodauthenticationandadulteration depending on the complexity of the gases. Another consid- assessment,assummarizedinTABLE1.Researchtodetect erationistheassistanceofapersonwhohasexperiencewith meatadulterationusinganelectronicnosehasdevelopedand operatingtheGC-MSinstruments. is being studied', '. ABSTRACT Recently,theissueoffoodauthenticationhasgainedattention,especiallyhalalauthentication, becauseofcasesofporkadulterationinbeef.Manystudieshavedevelopedrapiddetectionforadulterated meat. However, these studies are not yet practical and economical methods and instruments and a faster analysis process. In this context, this paper proposes the Optimized Electronic Nose System (OENS) for more accurately detecting pork adulteration in beef', '. Applicationofelectronicnosesforfoodassessmentinthelast sensor analysis. The e-nose features offer five main cate- fiveyears. goriesoffoodanalysisthatcanbeused:monitoring,expiry checking,freshnessevaluation,puritytesting,andotherfood qualitycontrolinvestigations.Hence,themotivationforthis studycanbeformulatedasfollows: 1. Severaltypesofresearchhaveusedane-nosetoidentify pork adulteration in beef for food quality control', '. MATERIALSANDMETHOD ical origin of grape) [23]. E-nose was also succeeded in A. MATERIALS detecting adulteration of mutton, which led into developing In this study, an e-nose was built using nine MQ series a model capable of detecting and estimating the adulter- gassensorsfromZhengzhouWinsenElectronicsTechnology ation of minced mutton with pork [24]. The volatile com- Co., Ltd', 'R.Sarnoetal.:DetectingPorkAdulterationinBeefforHalalAuthenticationUsinganOptimizedElectronicNoseSystem FIGURE1. Schematicofthee-noseexperimentforOENS. withwater;and(iii)replacingwithcheaperwine.Therefore, Forinterestedreaders,recentdevelopmentandchallengesfor the combination between e-nose and multivariate statistical e-nosesignalprocessingaresummarizedhere[42]. methods improved the traceability and the classification of grapes and wine (especially the varieties and the geograph- III']",,"baked goods’ quality can be determined by the gas or vapor content. Gas chromatography is the standard instrument for quantitatively and qualitatively analyzing volatile organic compounds (VOCs). This method separates compounds in a mixture by injecting a gas sample into the mobile phase, usually called the carrier gas, and passing the gas through the stationary phase , , . Volatile compounds identified in aldehydes, alcohols, acids, alkanes, and ketones are the main components that contribute VOLUME 12, 2024 2024 The Authors. This work is licensed under a Creative Commons Attribution-NonCommercial-NoDerivatives 4.0 License. For more information, see 97235 TABLE 1. The ingredients of the cookie. to the cookie flavor . Chemical compounds grouped as hydrocarbons are also released while making and",,0.0
"Recall or sensitivity is the number of true positive predictions compared to all true positive data. Precision is the number of positive results compared to all positive predicted data. F-Score is the average precision and recall compared to weighting. Speciﬁcity is the number of true negative predictions compared to all negative data. Equations 15 to 19 are used to calculate these metrics. In addition to these metrics, the measurement of model performance evaluation also uses Receiver Operating Characteristics (ROC) and Area Under Curve (AUC). ROC is a probability curve and AUC is an area that shows the level of accuracy of the model empirically. The classiﬁcation results show poor performance if the ROC Curve is close to the baseline and","["". These metrics can be calculated by (1) – (3). This study's calculation of True Positive, False Positive, and False Negative differs from other classifications or detections [20]-[23]. These are chosen and calculated following previous studies [1]. Precision detects the truly correct prediction out of all predictions. Recall detects the truly correct prediction out of all actual classes. F1 scores are harmonic mean between these two that measure overall model performance"", '. performance evaluation score, where the highest accuracy Following the definition in the previous paragraph, we plot is under 85%, the model needs further improvement so that the frequency of each misclassification type in Fig 13 and thedetectionvaliditycanbeenhancedandthatthedetection Fig 14', 'classification validation have helped develop the motivation for this work which is [34],[35],[36]', "". We applied various machine learning models, accurate predictions, as machine learning models learn from including Random Forest and XGBoost, to improve the the input data, following the principle of 'garbage-ingarbage-out' [29]. Once they complete the preprocessing steps, the data will be ready for the machine learning model. TABLE II. RESULTS TABLE OF THE FOUR KEY METRICS Metrics ID Description Value D"", 'that could be vital for accurate classification [40]']","Precision and recall are defined as the true positive predictions out of all predicted positives and the true positive predictions out of all actual classes, respectively, with F1 scores representing the harmonic mean of these two metrics (Referensi 1).","with the following formula: TP + TN TP + TN + FP + FN Accuracy = Precision = Recall/True Positive Rate(TPR) TP TP + FP TP TP + FN F1 = 2 × precision × recall precision + recall FP TN + TP (cid:90) 1 TPRd(FPR) False Positive Rate(FPR) = AUC = (4) (5) (6) (7) (8) (9) where TP is the number of correctly predicted positive labels, TN is the number of correctly predicted negative labels, FP is the number of incorrectly predicted positive labels, and FN is the number of incorrectly predicted negative labels. Accuracy is the ratio of true predictions to the overall data. Precision is the ratio between TP to the total number of positive predic-",0.6,0.9451123623869598
"forming non-overlapping sub- arrays within the array , naturally limiting the achievable beamwidth of each beam and making inefﬁcient use of the available aperture. A third option can be taken by arranging the array into partially or fully overlapping subarrays coupled with the use of orthogonal waveforms, each associated to a generated beam, a solution belonging to the class of the multi- input multi-output (MIMO) radars discussed below. MIMO radars have developed into a strong contender for multi-antenna radar systems, applying the concept of virtual sensors with orthogonal waveform diversity –. Our interest in MIMO radars in relevance to the problem at hand arises due to their capability to produce multiple orthog- onal beams by selecting an appropriate set of","['. array(NC)atthereceive(Rx)array,therebyformingaMIMO WhiletheconceptandperformanceofFPMIMOradarshave structure with the overlapping subarrays replacing single been reported by the authors in [31], this paper sets the elements at the transmitter [22]–[28]. The purpose of the focusontheradarparameteridentifiabilityandthedetection subarray as an element in the PMIMO radar is to overcome performance. the weakness of the element beam in the MIMO radar that This paper also expands the study reported in [13], i.e', '. REVIEWONMAXIMUMNUMBEROFDETECTED has been described by [13]. In a MIMO radar, in which TARGETSFORMIMORADAR K elements in the Tx array transmit orthogonal waveforms For clarity in discussions that follow, herein we provide a andLelementsintheRxarrayreceiveechosignalsfromtar- shortreviewoftheperformanceofMIMOradarsinthemaxgetsoperatingindependently,theVAdimensionisexpressed imum number of detected targets, mostly taken from [13]', '(13) herein as the subarrayed MIMO (SMIMO) radars, such as theFPMIMOradar,rangesbetweentwoextremeconfiguraNotation ⊗ denotes the Kronecker product operator, tions, namely the PA and the MIMO radar', '. DigitalObjectIdentifier10.1109/ACCESS.2020.2965192 FPMIMO: A General MIMO Structure With Overlapping Subarrays for Various Radar Applications SYAHFRIZALTAHCFULLOH 1,2,(StudentMember,IEEE),AND GAMANTYOHENDRANTORO 1,(SeniorMember,IEEE) 1DepartmentofElectricalEngineering,InstitutTeknologiSepuluhNopember,Surabaya60111,Indonesia 2DepartmentofElectricalEngineering,UniversitasBorneoTarakan,Tarakan77123,Indonesia Correspondingauthor:SyahfrizalTahcfulloh(syahfrizal15@mhs.ee.its.ac.id)', '. With this advantage, PA radars ject [6]–[18]. Unlike the PA radar, the MIMO radar utilizes have been used for such applications as micro-scale radars manyantennasthattransmitorthogonalsignalstoobtainthe signal reflected from the target at the receiver, a scheme The associate editor coordinating the review of this manuscript and known as waveform diversity [9]. Consequently, MIMO approvingitforpublicationwasDimitrisE.Anagnostou']","The subarray in PMIMO radar is designed to address the limitations of the element beam in MIMO radar systems (Tahcfulloh & Hendrantoro, 2020).","biomedical engineering, macro-scale radars on radio- astronomy, and so on , . However, in PA radars the number of detected targets is limited by the angular and range resolution. More recently, the multi-input multi-output (MIMO) radar has become an interesting research sub- ject –. Unlike the PA radar, the MIMO radar utilizes many antennas that transmit orthogonal signals to obtain the signal reﬂected from the target at the receiver, a scheme known as waveform diversity . Consequently, MIMO radars have been successfully applied for radar imaging, 11248 This work is licensed under a Creative Commons Attribution 4.0 License. For more information, see VOLUME 8, 2020 S. Tahcfulloh, G. Hendrantoro: FPMIMO: General MIMO Structure With Overlapping Subarrays for Various Radar Applications",1.0,0.9189182508192039
"of the Golay codes to orthogonalization of different symbols in a frame in the same beam. Doppler detection can further be accomplished by transmitting a frame of symbols repeatedly for several times, thus allowing the receiver to detect the changes in phase along different frames. The realization of such multi-beam radars that adopts the CC-OFDM MIMO concept also allows for application of further signal process- ing, such as monopulse processing to determine the angular direction of the target more accurately, but this is beyond the scope of our paper. The CC-OFDM MIMO concept presents a breakthrough in the realization of multi-beam radar in a way that has not been tried before, combining different strategies in a novel way to obtain","['. INDEX TERMS Circulating-codes, Golay-codes, interference, MIMO-radar, multibeam, OFDM-radar, sub-band,surveillance. I. INTRODUCTION Manyradarapplicationsdemandscanningcapabilitytoallow The associate editor coordinating the review of this manuscript and coverage over a range of angular direction, such as those approvingitforpublicationwasXueboZhang . forsurveillance,vehicular,weathermonitoring,imaging,and 2025TheAuthors.ThisworkislicensedunderaCreativeCommonsAttribution4.0License', '. INDEX TERMS MIMO radar, parameter estimation, phased array radar, probability of detection, target detection. I. INTRODUCTION for biomedical engineering, macro-scale radars on radioMulti-antenna radar systems have been known and used in astronomy, and so on [4], [5]', '(13) herein as the subarrayed MIMO (SMIMO) radars, such as theFPMIMOradar,rangesbetweentwoextremeconfiguraNotation ⊗ denotes the Kronecker product operator, tions, namely the PA and the MIMO radar', '. [21] Z. Xu and A. Petropulu, ‘‘A bandwidth efficient dual-function radar communication system based on a MIMO radar using OFDM waveforms,’’ IEEE Trans. Signal Process., vol. 71, pp.401–416, 2023, doi: 10.1109/TSP.2023.3241779. [22] U.B.SaracandG.M.Guvensen,‘‘Knowledge-aidedandadaptivebeamsquintawareMIMO-OFDMradardetectorsforISAC,’’IEEETrans.Commun.,earlyaccess,May8,2025,doi:10.1109/TCOMM.2025.3568219. [23] M. Schurwanz, J. Mietzner, and P. A', '. With this advantage, PA radars ject [6]–[18]. Unlike the PA radar, the MIMO radar utilizes have been used for such applications as micro-scale radars manyantennasthattransmitorthogonalsignalstoobtainthe signal reflected from the target at the receiver, a scheme The associate editor coordinating the review of this manuscript and known as waveform diversity [9]. Consequently, MIMO approvingitforpublicationwasDimitrisE.Anagnostou']","The utilization of Golay codes in multibeam radar systems enhances the orthogonalization of different symbols, facilitating improved Doppler detection capabilities (Z. Xu and A. Petropulu, 2023).","and radial velocity detection of targets is not discussed yet. The contribution of this paper is in the receiver processing of CC-OFDM-MIMO radar, which is different from those in other types of OFDM MIMO radars or other multi-TRM radars due to the nature of the orthogonal multi-beam generation with Golay-coded OFDM waveforms and subbands. There are previous research on radar waveform for ISAC purposes , which discussed about cyclic prefix (CP) based OFDM waveform and how the CP is very much defining the maximum unambiguous range of the radar system. CC-OFDM MIMO radar waveform design which is discussed in this paper is not a CP based radar, the transmitters are transmitting multiple orthogonal symbols in series without any guard time",0.0,0.9170883210366945
"signal is circulated from one antenna element to another with a relatively small time-delay differ- ence ((cid:49)t), made possible by circulating codes (CC) , , . Hence the transmit signal from the p-th element for a transmit antenna array with an odd number of elements, Nt , can be written as: xp(t) = x(t − p(cid:49)t), Nt − 1 , . . . , Nt − 1 (1) The time delay difference of the circulating signal corre- sponds to a phase difference between the antenna elements at a given frequency: (cid:49)ϕ = 2πf (cid:49)t (2) It means that the phase steering that is usually provided by a phase shifter at each antenna element now can be realized directly in the","['. J. Antennas leavefromworktopursuethePh.D.degreewith Propag.,vol.2017,Jul.2017,Art.no.7241281. the Institut Teknologi Sepuluh Nopember, since [17] M.Davis,G.Showman,andA.Lanterman,‘‘CoherentMIMOradar:The phasedarrayandorthogonalwaveforms,’’IEEEAerosp.Electron.Syst. 2015. His research interests include array signal processing and MIMO Mag.,vol.29,no.8,pp.76–91,Aug.2014. radars', '. It identifies the direction of an echo by antennaelement.Whilein[20]anewconceptofmultibeam meansofthescanningbeam,whereastherangedetectionis radarsisreported,whichcombinestheversatilityofOFDM done by observing the delay or by applying the correlation waveform, the orthogonal Golay codes and the CC-MIMO process. However, the beam scanning limits the time on architecture', '. However, using an OFDM signal, this phasesteeringcanbeprovidedbygivingaphasedifference totheOFDMsubcarrierphaseinthefrequencydomainofthe OFDM signal generation stage. The phase steering given to theCC-OFDMwaveformcanbedefinedasfollow: β(f n,a,b ,(cid:49)t b )=2πf n,a,b (cid:49)t b (2) Hence,thearrayfactorofCC-OFDMwillbe: Nt−1 AF(θ,f n,a,b ,(cid:49)t b )= X2 I p ejp(α(θ)+β(fn,a,b ,(cid:49)tb) p=−Nt−1 2 2π whereα(θ)= dsinθ, (3) λ withd denotesthespacingbetweenthearrays', '. theHonoraryDoctoratesatMSTUCA,Moscow;TomskStateUniversity; [19] G.Babur,P.Aubry,andF.LeChevalier,‘‘Space-timeradarwaveforms: andMTARomania. Circulatingcodes,’’J.Electr.Comput.Eng.,vol.2013,pp.1–8,Jan.2013, doi:10.1155/2013/809691. [20] D.Kuswidiastuti,L.P.Ligthart,andG.Hendrantoro,‘‘Atransmitterdesign for the multi-beam CC-OFDM azimuth scanning MIMO radar,’’ IEEE Access,vol.10,pp.53682–53702,2022. [21] Z. Xu and A', '. The phase applications. difference value for beamforming to a specific beam, the phase correction for mitigating beam squinting caused by the multicarrier OFDM signal, and the amplitude tapering for SLL reduction are all depend on which transmit array elements that the waveform will be transmitted through. Hence,insteadofjusthaveoneDWGatthetransmitterside likeacommonconventionalphasedarrayradar,CC-OFDM RadarwillneedDWGsasmanyasthenumberofthetransmit arrayelementsneededfordigitalbeamformingpurposes[20]']","The phase steering for the CC-OFDM waveform can be expressed as a function of the frequency and time delay, indicating a direct relationship between phase difference and time delay in antenna arrays (Receiver Processing of the Multibeam Azimuth Scanning CC-OFDM-MIMO Radar).","the specified OFDM sub-band frequencies of beam b to provide phase difference between the transmit elements for creating the beam b. Circulating code in LFM MIMO radar which is discussed in , obtain this phase difference by transmitting coherent signals with a small time delay difference ((cid:49)tb) between the antenna element. However, using an OFDM signal, this phase steering can be provided by giving a phase difference to the OFDM subcarrier phase in the frequency domain of the OFDM signal generation stage. The phase steering given to the CC-OFDM waveform can be defined as follow: β(fn,a,b, (cid:49)tb) = 2πfn,a,b(cid:49)tb Hence, the array factor of CC-OFDM will be: AF(θ, fn,a,b, (cid:49)tb) = Nt −1 2X Ipejp(α(θ)+β(fn,a,b,(cid:49)tb) where α(θ) = p=− Nt",0.6666666666666666,0.9054049912233809
"the high PAPR of the OFDM signal. If orthogonal codes are given to successive OFDM symbols, it could also provide orthogonality between 53684 VOLUME 10, 2022 D. Kuswidiastuti et al.: Transmitter Design for Multibeam CC-OFDM Azimuth Scanning MIMO Radar the OFDM symbols, which in turn can extend the maxi- mum unambiguous range of the radar. The orthogonalities between OFDM subcarriers and between OFDM symbols allow OFDM radar to produce a range and Doppler proﬁle independent from each other . This is one of the advan- tages of using OFDM instead of LFM as radar waveform. The above considerations motivate the development of digitally generated beam steering without phase shifter, by providing phase control of the signal directly from waveform generation","['. [21] Z. Xu and A. Petropulu, ‘‘A bandwidth efficient dual-function radar communication system based on a MIMO radar using OFDM waveforms,’’ IEEE Trans. Signal Process., vol. 71, pp.401–416, 2023, doi: 10.1109/TSP.2023.3241779. [22] U.B.SaracandG.M.Guvensen,‘‘Knowledge-aidedandadaptivebeamsquintawareMIMO-OFDMradardetectorsforISAC,’’IEEETrans.Commun.,earlyaccess,May8,2025,doi:10.1109/TCOMM.2025.3568219. [23] M. Schurwanz, J. Mietzner, and P. A', '. With this advantage, PA radars ject [6]–[18]. Unlike the PA radar, the MIMO radar utilizes have been used for such applications as micro-scale radars manyantennasthattransmitorthogonalsignalstoobtainthe signal reflected from the target at the receiver, a scheme The associate editor coordinating the review of this manuscript and known as waveform diversity [9]. Consequently, MIMO approvingitforpublicationwasDimitrisE.Anagnostou', '. DigitalObjectIdentifier10.1109/ACCESS.2025.3581842 Receiver Processing of the Multibeam Azimuth Scanning CC-OFDM-MIMO Radar DEVYKUSWIDIASTUTI 1,(Member,IEEE),L.P.LIGTHART 2,(LifeFellow,IEEE), GAMANTYOHENDRANTORO1,(SeniorMember,IEEE),TITIEKSURYANI 1,(Member,IEEE), PRASETIYONOHARIMUKTI 1,(Member,IEEE),ANDYUYUWAHYU 3,(Member,IEEE) 1DepartmentofElectricalEngineering,InstitutTeknologiSepuluhNopember,Surabaya60111,Indonesia 2IRCTR,DelftUniversityofTechnology(TUDelft),2628CDDelft,TheNetherlands(Retired)', '(13) herein as the subarrayed MIMO (SMIMO) radars, such as theFPMIMOradar,rangesbetweentwoextremeconfiguraNotation ⊗ denotes the Kronecker product operator, tions, namely the PA and the MIMO radar', '. INDEX TERMS MIMO radar, parameter estimation, phased array radar, probability of detection, target detection. I. INTRODUCTION for biomedical engineering, macro-scale radars on radioMulti-antenna radar systems have been known and used in astronomy, and so on [4], [5]']","Kuswidiastuti et al. (2025) discuss how orthogonal codes assigned to successive OFDM symbols can enhance the orthogonality between OFDM symbols, thereby extending the maximum unambiguous range of radar systems.","for the n-th subcarrier for symbol a in beam b is given by gn,a,b, with the sampling period of Ts. The maximum unambiguous range, Rmax, will depend on the OFDM symbol period of T0. However, by transmitting Ns orthogonal symbols in series can extend the maximum range up to Ns times further. According to the waveform specification in Table 1, the 12 symbols are transmitted in series over 12T0 to extend the maximum range from 15 up to 180 km. The beams and the CC-OFDM symbols are Golay VOLUME 13, 2025 109897 D. Kuswidiastuti et al.: Receiver Processing of the Multibeam Azimuth Scanning CC-OFDM-MIMO Radar coded and transmitted using the allocated sub-band following a specific schedule that is well known",0.0,0.9374711270285387
"a speciﬁed time delay difference of (cid:49)t, each (cid:49)t value produces a beam pattern equivalent to a phased array having inter-element phase difference that depends on the corresponding subcarrier frequencies. Multiple beams can be formed simultaneously, by assigning multiple subcarrier sets which are transmit- ted using different value of (cid:49)t. This idea is the primary contribution of this paper, which will be elaborated in the sequel. A second contribution in this paper concerns the improvement of time on target in a MIMO radar adopting CC-OFDM waveforms. While multiple beamscanning in tra- ditional phased array radar results in limited time on target, CC-OFDM MIMO radar could give a much longer time on target because multiple beams in CC-OFDM radar can be","['. However, all of the above thereceiverprocessingofCC-OFDM-MIMOradar,whichis mentioned methods have problems in beam limitation and differentfromthoseinothertypesofOFDMMIMOradarsor cost. other multi-TRM radars due to the nature of the orthogonal Current trends regarding dual functional radar communi- multi-beamgenerationwithGolay-codedOFDMwaveforms cation (DFRC) systems which lead to an integrated sensing andsubbands', '. With this advantage, PA radars ject [6]–[18]. Unlike the PA radar, the MIMO radar utilizes have been used for such applications as micro-scale radars manyantennasthattransmitorthogonalsignalstoobtainthe signal reflected from the target at the receiver, a scheme The associate editor coordinating the review of this manuscript and known as waveform diversity [9]. Consequently, MIMO approvingitforpublicationwasDimitrisE.Anagnostou', 'processed transmit and receive time schedule of CC-OFDM radar is further to obtain the beam information', '. [21] Z. Xu and A. Petropulu, ‘‘A bandwidth efficient dual-function radar communication system based on a MIMO radar using OFDM waveforms,’’ IEEE Trans. Signal Process., vol. 71, pp.401–416, 2023, doi: 10.1109/TSP.2023.3241779. [22] U.B.SaracandG.M.Guvensen,‘‘Knowledge-aidedandadaptivebeamsquintawareMIMO-OFDMradardetectorsforISAC,’’IEEETrans.Commun.,earlyaccess,May8,2025,doi:10.1109/TCOMM.2025.3568219. [23] M. Schurwanz, J. Mietzner, and P. A', '. INDEX TERMS MIMO radar, parameter estimation, phased array radar, probability of detection, target detection. I. INTRODUCTION for biomedical engineering, macro-scale radars on radioMulti-antenna radar systems have been known and used in astronomy, and so on [4], [5]']","The processed transmit and receive time schedule of CC-OFDM radar is essential for obtaining beam information, which supports the improvement of time on target in MIMO radar systems.","the specified OFDM sub-band frequencies of beam b to provide phase difference between the transmit elements for creating the beam b. Circulating code in LFM MIMO radar which is discussed in , obtain this phase difference by transmitting coherent signals with a small time delay difference ((cid:49)tb) between the antenna element. However, using an OFDM signal, this phase steering can be provided by giving a phase difference to the OFDM subcarrier phase in the frequency domain of the OFDM signal generation stage. The phase steering given to the CC-OFDM waveform can be defined as follow: β(fn,a,b, (cid:49)tb) = 2πfn,a,b(cid:49)tb Hence, the array factor of CC-OFDM will be: AF(θ, fn,a,b, (cid:49)tb) = Nt −1 2X Ipejp(α(θ)+β(fn,a,b,(cid:49)tb) where α(θ) = p=− Nt",0.6666666666666666,0.9523708452131084
"In our case, quasi-continuous transmission is used through proper scheduling of OFDM transmission and echoes reception to prevent the coupling. • The receiver that continuously receives signal echoes coming from multiple targets must be able to distinguish which targets are very near or very far from the radar. This is the reason in this paper that orthogonal codes are given to successive CC-OFDM symbols. These unique codes are given and known by the receiver, so that the receiver could properly detect and distinguish targets nearby and far away from the radar. In this paper we describe the waveform design of a CC-OFDM quasi-continuous wave for MIMO long the range radar. Quasi-CW transmission could limit leakage/coupling problem by time-isolation of the","['. [21] Z. Xu and A. Petropulu, ‘‘A bandwidth efficient dual-function radar communication system based on a MIMO radar using OFDM waveforms,’’ IEEE Trans. Signal Process., vol. 71, pp.401–416, 2023, doi: 10.1109/TSP.2023.3241779. [22] U.B.SaracandG.M.Guvensen,‘‘Knowledge-aidedandadaptivebeamsquintawareMIMO-OFDMradardetectorsforISAC,’’IEEETrans.Commun.,earlyaccess,May8,2025,doi:10.1109/TCOMM.2025.3568219. [23] M. Schurwanz, J. Mietzner, and P. A', '. INDEX TERMS Circulating-codes, Golay-codes, interference, MIMO-radar, multibeam, OFDM-radar, sub-band,surveillance. I. INTRODUCTION Manyradarapplicationsdemandscanningcapabilitytoallow The associate editor coordinating the review of this manuscript and coverage over a range of angular direction, such as those approvingitforpublicationwasXueboZhang . forsurveillance,vehicular,weathermonitoring,imaging,and 2025TheAuthors.ThisworkislicensedunderaCreativeCommonsAttribution4.0License', '. With this advantage, PA radars ject [6]–[18]. Unlike the PA radar, the MIMO radar utilizes have been used for such applications as micro-scale radars manyantennasthattransmitorthogonalsignalstoobtainthe signal reflected from the target at the receiver, a scheme The associate editor coordinating the review of this manuscript and known as waveform diversity [9]. Consequently, MIMO approvingitforpublicationwasDimitrisE.Anagnostou', '. CC-OFDM MIMO radar waveform design which the degree of orthogonality can be further improved by is discussed in this paper is not a CP based radar, the assigningdifferentsubbands,fortheneighboringbeams,and transmittersaretransmittingmultipleorthogonalsymbolsin thesamesubbandcanbereusedforthenon-adjacentbeams. serieswithoutanyguardtimeintervalbetweenthesymbols. The interference among these co-channel beams can be The symbol series are orthogonal to each other, hence VOLUME13,2025 109895', '. Zhang, Y. Huang, J. Heredia-Juesas, and J. A. Martinez-Lorenzo, Teknologi Sepuluh Nopember (ITS), Surabaya, ‘‘Software-defined millimeter-wave multistatic radar with space-time- Indonesia, in 1992, and the M.Eng. and Ph.D. coded orthogonal frequency-division multiplexing,’’ IEEE Trans. degrees in electrical engineering from Carleton Microw.TheoryTechn.,vol.70,no.3,pp.1620–1629,Mar.2022,doi: University, Ottawa, ON, Canada, in 1997 and 10.1109/TMTT.2021.3134182']","The design of CC-OFDM MIMO radar waveforms can enhance orthogonality by assigning different subbands to neighboring beams while transmitting multiple orthogonal symbols in the same subband (Zhang et al., 2025).","much defining the maximum unambiguous range of the radar system. CC-OFDM MIMO radar waveform design which is discussed in this paper is not a CP based radar, the transmitters are transmitting multiple orthogonal symbols in series without any guard time interval between the symbols. to each other, hence The symbol series are orthogonal VOLUME 13, 2025 109895 D. Kuswidiastuti et al.: Receiver Processing of the Multibeam Azimuth Scanning CC-OFDM-MIMO Radar receivers know how to distinguish the symbols received, and this could extend the maximum unambiguous range of the radar. The contributions of this paper are described as follow: 1) This paper describes the receiver processing of multi- beam CC-OFDM MIMO Radar which is designed for long-range radar surveillance application. The",0.5,0.933849645558653
"attention is paid to utilizing this multi-dimensional orthogonality. The orthogonality between the CC-OFDM symbols is beneﬁcial in obtaining an optimum SNR for increasing the maximum unambiguous range of the radar. Another main contribution of this paper is the design of a radar waveform which could extend its maximum unambiguous range by transmitting quasi-continuously multiple orthogonal CC-OFDM symbols in series. It means that the radar will have a longer pulse rep- etition interval (PRI) which leads to a longer-range detection. The additional requirement is that there must be orthogonal- ities between the symbol series. The orthogonality is pro- vided by using orthogonal codes for coding the CC-OFDM symbols, which can be realized using the Golay codes pre- viously chosen to mitigate","['. [21] Z. Xu and A. Petropulu, ‘‘A bandwidth efficient dual-function radar communication system based on a MIMO radar using OFDM waveforms,’’ IEEE Trans. Signal Process., vol. 71, pp.401–416, 2023, doi: 10.1109/TSP.2023.3241779. [22] U.B.SaracandG.M.Guvensen,‘‘Knowledge-aidedandadaptivebeamsquintawareMIMO-OFDMradardetectorsforISAC,’’IEEETrans.Commun.,earlyaccess,May8,2025,doi:10.1109/TCOMM.2025.3568219. [23] M. Schurwanz, J. Mietzner, and P. A', '. INDEX TERMS Circulating-codes, Golay-codes, interference, MIMO-radar, multibeam, OFDM-radar, sub-band,surveillance. I. INTRODUCTION Manyradarapplicationsdemandscanningcapabilitytoallow The associate editor coordinating the review of this manuscript and coverage over a range of angular direction, such as those approvingitforpublicationwasXueboZhang . forsurveillance,vehicular,weathermonitoring,imaging,and 2025TheAuthors.ThisworkislicensedunderaCreativeCommonsAttribution4.0License', '. andcommunication(ISAC)systemsmotivatefurthermorethe There are previous research on radar waveform for ISAC use of OFDM for radar waveform. Research on finding the purposes[25],[26]whichdiscussedaboutcyclicprefix(CP) perfect waveform that can serve for both function is still an based OFDM waveform and how the CP is very much ongoingresearchuntilnowadays[20],[21],[22],[23].When defining the maximum unambiguous range of the radar theavailablebandwidthcanbedividedintoseveralsubbands, system', '. CC-OFDM MIMO radar waveform design which the degree of orthogonality can be further improved by is discussed in this paper is not a CP based radar, the assigningdifferentsubbands,fortheneighboringbeams,and transmittersaretransmittingmultipleorthogonalsymbolsin thesamesubbandcanbereusedforthenon-adjacentbeams. serieswithoutanyguardtimeintervalbetweenthesymbols. The interference among these co-channel beams can be The symbol series are orthogonal to each other, hence VOLUME13,2025 109895', '. DigitalObjectIdentifier10.1109/ACCESS.2025.3581842 Receiver Processing of the Multibeam Azimuth Scanning CC-OFDM-MIMO Radar DEVYKUSWIDIASTUTI 1,(Member,IEEE),L.P.LIGTHART 2,(LifeFellow,IEEE), GAMANTYOHENDRANTORO1,(SeniorMember,IEEE),TITIEKSURYANI 1,(Member,IEEE), PRASETIYONOHARIMUKTI 1,(Member,IEEE),ANDYUYUWAHYU 3,(Member,IEEE) 1DepartmentofElectricalEngineering,InstitutTeknologiSepuluhNopember,Surabaya60111,Indonesia 2IRCTR,DelftUniversityofTechnology(TUDelft),2628CDDelft,TheNetherlands(Retired)']","The design of the CC-OFDM MIMO radar waveform allows for the transmission of multiple orthogonal symbols in series, enhancing the degree of orthogonality and enabling longer-range detection capabilities (Kuswidiastuti et al., 2025).","and radial velocity detection of targets is not discussed yet. The contribution of this paper is in the receiver processing of CC-OFDM-MIMO radar, which is different from those in other types of OFDM MIMO radars or other multi-TRM radars due to the nature of the orthogonal multi-beam generation with Golay-coded OFDM waveforms and subbands. There are previous research on radar waveform for ISAC purposes , which discussed about cyclic prefix (CP) based OFDM waveform and how the CP is very much defining the maximum unambiguous range of the radar system. CC-OFDM MIMO radar waveform design which is discussed in this paper is not a CP based radar, the transmitters are transmitting multiple orthogonal symbols in series without any guard time",0.5,0.9513584590489488
"also be eliminated because it is possible to design a wave- form to produce an array pattern with a low sidelobe-level characteristic directly from the waveform generation stage. This paper describes a novel design of software deﬁned radar (SDR) using CC OFDM waveforms by giving the phase difference for beam steering and the amplitude tapering coef- ﬁcient at digital waveform generation stage. Hence, when the CC OFDM waveforms are transmitted simultaneously from multiple array antennas, as illustrated in Fig. 1 (a), they will create beams heading to a certain θb direction and exhibiting low side lobe levels. Assume for now that the system is a uniform linear array (ULA) with equal spacing d as depicted in Fig. 1(b). By taking","['. The design includes the with a faceted view. Such radars may find applications in system architecture and parameters, the waveform design surveillance[9],[10],[11],[12],automotive[13],[14],[15], and the scheduling of Golay codes and subbands. The imaging[16],[17],etc.Generationofmultiplesimultaneous transmitter architecture that adopts software-defined radar orthogonal beams can be done in several ways', '. INDEX TERMS MIMO radar, parameter estimation, phased array radar, probability of detection, target detection. I. INTRODUCTION for biomedical engineering, macro-scale radars on radioMulti-antenna radar systems have been known and used in astronomy, and so on [4], [5]', '. With this advantage, PA radars ject [6]–[18]. Unlike the PA radar, the MIMO radar utilizes have been used for such applications as micro-scale radars manyantennasthattransmitorthogonalsignalstoobtainthe signal reflected from the target at the receiver, a scheme The associate editor coordinating the review of this manuscript and known as waveform diversity [9]. Consequently, MIMO approvingitforpublicationwasDimitrisE.Anagnostou', '. In the works on the PMIMO radar in [22]–[29], The evaluation on the detection performance in terms of the improvement in radar performance factors such as theprobabilityofdetectionandtheprobabilityoffalsealarm spatial resolution, parameter identifiability, transmit-receive reportedhereinisanextensionofstudyby[32].Theseparam(T-R)gain,andsignal-to-interference-plus-noisepowerratio etersareevaluatedbasedonseveralaspectssuchastheeffect (SINR)hasbeenreported.Theresultsofinvestigationsin[29]', '. INDEX TERMS Circulating-codes, Golay-codes, interference, MIMO-radar, multibeam, OFDM-radar, sub-band,surveillance. I. INTRODUCTION Manyradarapplicationsdemandscanningcapabilitytoallow The associate editor coordinating the review of this manuscript and coverage over a range of angular direction, such as those approvingitforpublicationwasXueboZhang . forsurveillance,vehicular,weathermonitoring,imaging,and 2025TheAuthors.ThisworkislicensedunderaCreativeCommonsAttribution4.0License']","The design of software-defined radar (SDR) using CC OFDM waveforms can enhance scanning capabilities for various applications, including surveillance and imaging, as it allows for coverage over a range of angular directions (Xuebo Zhang, 2025).","the specified OFDM sub-band frequencies of beam b to provide phase difference between the transmit elements for creating the beam b. Circulating code in LFM MIMO radar which is discussed in , obtain this phase difference by transmitting coherent signals with a small time delay difference ((cid:49)tb) between the antenna element. However, using an OFDM signal, this phase steering can be provided by giving a phase difference to the OFDM subcarrier phase in the frequency domain of the OFDM signal generation stage. The phase steering given to the CC-OFDM waveform can be defined as follow: β(fn,a,b, (cid:49)tb) = 2πfn,a,b(cid:49)tb Hence, the array factor of CC-OFDM will be: AF(θ, fn,a,b, (cid:49)tb) = Nt −1 2X Ipejp(α(θ)+β(fn,a,b,(cid:49)tb) where α(θ) = p=− Nt",0.5,0.9340993207861795
"of the beampattern, p = Ipejp2πfnc,b(cid:49)tb. so that we can deﬁne I (cid:48) The array factor (AF) of the CC-OFDM waveform as a function of angle θ, center frequency of the allocated sub band for the b-th beam, fnc,b, and time delay (cid:49)tb for phase steering of the b-th beam is given by: AF(θ, fnc,b, (cid:49)tb) = Nt −1 2(cid:88) pejpα(θ) I (cid:48) p=− Nt −1 Nt −1 2(cid:88) p=− Nt −1 Ipejp2πfnc,b(cid:49)tb (cid:125) (cid:123)(cid:122) (cid:124) the waveform effect ejpα(θ) (cid:124) (cid:123)(cid:122) (cid:125) the array radiation effect (7) The rightmost form consists of the sum of product of two factors. The ﬁrst represents the waveform effect, which is the Taylor amplitude distribution of the array elements and the phase factor","['. DigitalObjectIdentifier10.1109/ACCESS.2020.2965192 FPMIMO: A General MIMO Structure With Overlapping Subarrays for Various Radar Applications SYAHFRIZALTAHCFULLOH 1,2,(StudentMember,IEEE),AND GAMANTYOHENDRANTORO 1,(SeniorMember,IEEE) 1DepartmentofElectricalEngineering,InstitutTeknologiSepuluhNopember,Surabaya60111,Indonesia 2DepartmentofElectricalEngineering,UniversitasBorneoTarakan,Tarakan77123,Indonesia Correspondingauthor:SyahfrizalTahcfulloh(syahfrizal15@mhs.ee.its.ac.id)', '. DigitalObjectIdentifier10.1109/ACCESS.2025.3581842 Receiver Processing of the Multibeam Azimuth Scanning CC-OFDM-MIMO Radar DEVYKUSWIDIASTUTI 1,(Member,IEEE),L.P.LIGTHART 2,(LifeFellow,IEEE), GAMANTYOHENDRANTORO1,(SeniorMember,IEEE),TITIEKSURYANI 1,(Member,IEEE), PRASETIYONOHARIMUKTI 1,(Member,IEEE),ANDYUYUWAHYU 3,(Member,IEEE) 1DepartmentofElectricalEngineering,InstitutTeknologiSepuluhNopember,Surabaya60111,Indonesia 2IRCTR,DelftUniversityofTechnology(TUDelft),2628CDDelft,TheNetherlands(Retired)', '(13) herein as the subarrayed MIMO (SMIMO) radars, such as theFPMIMOradar,rangesbetweentwoextremeconfiguraNotation ⊗ denotes the Kronecker product operator, tions, namely the PA and the MIMO radar', '. [21] Z. Xu and A. Petropulu, ‘‘A bandwidth efficient dual-function radar communication system based on a MIMO radar using OFDM waveforms,’’ IEEE Trans. Signal Process., vol. 71, pp.401–416, 2023, doi: 10.1109/TSP.2023.3241779. [22] U.B.SaracandG.M.Guvensen,‘‘Knowledge-aidedandadaptivebeamsquintawareMIMO-OFDMradardetectorsforISAC,’’IEEETrans.Commun.,earlyaccess,May8,2025,doi:10.1109/TCOMM.2025.3568219. [23] M. Schurwanz, J. Mietzner, and P. A', '. However, using an OFDM signal, this phasesteeringcanbeprovidedbygivingaphasedifference totheOFDMsubcarrierphaseinthefrequencydomainofthe OFDM signal generation stage. The phase steering given to theCC-OFDMwaveformcanbedefinedasfollow: β(f n,a,b ,(cid:49)t b )=2πf n,a,b (cid:49)t b (2) Hence,thearrayfactorofCC-OFDMwillbe: Nt−1 AF(θ,f n,a,b ,(cid:49)t b )= X2 I p ejp(α(θ)+β(fn,a,b ,(cid:49)tb) p=−Nt−1 2 2π whereα(θ)= dsinθ, (3) λ withd denotesthespacingbetweenthearrays']","The phase steering for the CC-OFDM waveform can be defined in terms of the subcarrier frequency and time delay, which is essential for the array factor calculation (Kuswidiastuti et al., 2025).","the specified OFDM sub-band frequencies of beam b to provide phase difference between the transmit elements for creating the beam b. Circulating code in LFM MIMO radar which is discussed in , obtain this phase difference by transmitting coherent signals with a small time delay difference ((cid:49)tb) between the antenna element. However, using an OFDM signal, this phase steering can be provided by giving a phase difference to the OFDM subcarrier phase in the frequency domain of the OFDM signal generation stage. The phase steering given to the CC-OFDM waveform can be defined as follow: β(fn,a,b, (cid:49)tb) = 2πfn,a,b(cid:49)tb Hence, the array factor of CC-OFDM will be: AF(θ, fn,a,b, (cid:49)tb) = Nt −1 2X Ipejp(α(θ)+β(fn,a,b,(cid:49)tb) where α(θ) = p=− Nt",0.3333333333333333,0.9364752844282627
"beamforming at transmit is produced by divid- ing the total OFDM bandwidth B, consisting of Nc subcarriers into Nsb sub bands with smaller bandwidth of Bb, consisting of Ncb subcarriers. The bandwidth per sub-band Bb will deter- mine the range resolution of the CC-OFDM radar as follows: (cid:49)R = 2Bb (8) VOLUME 10, 2022 D. Kuswidiastuti et al.: Transmitter Design for Multibeam CC-OFDM Azimuth Scanning MIMO Radar FIGURE 1. Circulating code in OFDM MIMO radar transmitters with Nt elements transmitting coherence signals, delay difference of (cid:49)t and array factor is defined in the xy plane: (a) time domain and (b) space domain. where (cid:49)R is the range resolution in each beam. If the fre- quency spacing between the OFDM subcarriers","['(13) herein as the subarrayed MIMO (SMIMO) radars, such as theFPMIMOradar,rangesbetweentwoextremeconfiguraNotation ⊗ denotes the Kronecker product operator, tions, namely the PA and the MIMO radar', '. DigitalObjectIdentifier10.1109/ACCESS.2025.3581842 Receiver Processing of the Multibeam Azimuth Scanning CC-OFDM-MIMO Radar DEVYKUSWIDIASTUTI 1,(Member,IEEE),L.P.LIGTHART 2,(LifeFellow,IEEE), GAMANTYOHENDRANTORO1,(SeniorMember,IEEE),TITIEKSURYANI 1,(Member,IEEE), PRASETIYONOHARIMUKTI 1,(Member,IEEE),ANDYUYUWAHYU 3,(Member,IEEE) 1DepartmentofElectricalEngineering,InstitutTeknologiSepuluhNopember,Surabaya60111,Indonesia 2IRCTR,DelftUniversityofTechnology(TUDelft),2628CDDelft,TheNetherlands(Retired)', '. needed. Multibeam radars that continuously transmit concurrent The principles of CC-OFDM MIMO radars have been multiple beams are able to simultaneously look at different discussed in [20] by way of an exemplary radar design for directions, for instance to cover a wide angular swath a long-range surveillance mission. The design includes the with a faceted view', '. isillustratedashavingaradarbeamthatcoversaspanofthe In this manner, the FPMIMO radar can achieve a desired azimuthangle', '. INDEX TERMS MIMO radar, parameter estimation, phased array radar, probability of detection, target detection. I. INTRODUCTION for biomedical engineering, macro-scale radars on radioMulti-antenna radar systems have been known and used in astronomy, and so on [4], [5]']","Multibeam radars can transmit multiple beams concurrently, allowing them to observe different directions simultaneously, which is essential for applications such as long-range surveillance (Kuswidiastuti et al., 2025).","for the n-th subcarrier for symbol a in beam b is given by gn,a,b, with the sampling period of Ts. The maximum unambiguous range, Rmax, will depend on the OFDM symbol period of T0. However, by transmitting Ns orthogonal symbols in series can extend the maximum range up to Ns times further. According to the waveform specification in Table 1, the 12 symbols are transmitted in series over 12T0 to extend the maximum range from 15 up to 180 km. The beams and the CC-OFDM symbols are Golay VOLUME 13, 2025 109897 D. Kuswidiastuti et al.: Receiver Processing of the Multibeam Azimuth Scanning CC-OFDM-MIMO Radar coded and transmitted using the allocated sub-band following a specific schedule that is well known",0.75,0.9164491585610925
"Multibeam CC-OFDM Azimuth Scanning MIMO Radar The phase steering is deﬁned as: β(fn,a,b, (cid:49)tb) = 2π fn,a,b(cid:49)tb (13) hence, at any transmitter p, the WG generates Nb beams simultaneously during the Nsym symbol periods with ampli- tude control Ip. The CC-OFDM complex signal of symbol a in beam b at the p-th transmitter is: xp,a,b(t) = Ip −1 Ncb (cid:88) n=0 Cn,pga,b,nejpβ(fn,a,b,(cid:49)tb) × ej2π(n+(za,b−1)Ncb )(cid:49)f (t−(a−1)T0) for 0 ≤ t − (a − 1)T0 + p(cid:49)tb ≤ T0. (14) The complex discrete-time signal of the baseband CC-OFDM signal in (14) is: xp,a,b(t) = Ip −1 Ncb (cid:88) n=0 Cn,pga,b,nejpβ(fn,a,b,(cid:49)tb) × ej2π(n+(za,b−1)Ncb )(cid:49)f (kTs−(a−1)T0) for 0 ≤ kTs − (a − 1)T0 + p(cid:49)tb ≤ T0. (15) The time delay (cid:49)tb","['. DigitalObjectIdentifier10.1109/ACCESS.2025.3581842 Receiver Processing of the Multibeam Azimuth Scanning CC-OFDM-MIMO Radar DEVYKUSWIDIASTUTI 1,(Member,IEEE),L.P.LIGTHART 2,(LifeFellow,IEEE), GAMANTYOHENDRANTORO1,(SeniorMember,IEEE),TITIEKSURYANI 1,(Member,IEEE), PRASETIYONOHARIMUKTI 1,(Member,IEEE),ANDYUYUWAHYU 3,(Member,IEEE) 1DepartmentofElectricalEngineering,InstitutTeknologiSepuluhNopember,Surabaya60111,Indonesia 2IRCTR,DelftUniversityofTechnology(TUDelft),2628CDDelft,TheNetherlands(Retired)', '. needed. Multibeam radars that continuously transmit concurrent The principles of CC-OFDM MIMO radars have been multiple beams are able to simultaneously look at different discussed in [20] by way of an exemplary radar design for directions, for instance to cover a wide angular swath a long-range surveillance mission. The design includes the with a faceted view', '. isillustratedashavingaradarbeamthatcoversaspanofthe In this manner, the FPMIMO radar can achieve a desired azimuthangle', '. INDEX TERMS MIMO radar, parameter estimation, phased array radar, probability of detection, target detection. I. INTRODUCTION for biomedical engineering, macro-scale radars on radioMulti-antenna radar systems have been known and used in astronomy, and so on [4], [5]', '(13) herein as the subarrayed MIMO (SMIMO) radars, such as theFPMIMOradar,rangesbetweentwoextremeconfiguraNotation ⊗ denotes the Kronecker product operator, tions, namely the PA and the MIMO radar']","The multibeam radar system can transmit multiple beams simultaneously, allowing it to observe different directions and cover a wide angular swath (Kuswidiastuti et al., 2025).","the specified OFDM sub-band frequencies of beam b to provide phase difference between the transmit elements for creating the beam b. Circulating code in LFM MIMO radar which is discussed in , obtain this phase difference by transmitting coherent signals with a small time delay difference ((cid:49)tb) between the antenna element. However, using an OFDM signal, this phase steering can be provided by giving a phase difference to the OFDM subcarrier phase in the frequency domain of the OFDM signal generation stage. The phase steering given to the CC-OFDM waveform can be defined as follow: β(fn,a,b, (cid:49)tb) = 2πfn,a,b(cid:49)tb Hence, the array factor of CC-OFDM will be: AF(θ, fn,a,b, (cid:49)tb) = Nt −1 2X Ipejp(α(θ)+β(fn,a,b,(cid:49)tb) where α(θ) = p=− Nt",1.0,0.9354862642704992
"the n-th subcarrier for symbol a in beam b is given by ga,b,n. In order to generate CC-OFDM waveform, additional phase steering β(fn,a,b, (cid:49)tb) is given to the speciﬁed OFDM sub-band frequencies of beam b for generating a required time delay between the transmit elements for beam b. 53688 VOLUME 10, 2022 D. Kuswidiastuti et al.: Transmitter Design for Multibeam CC-OFDM Azimuth Scanning MIMO Radar TABLE 1. Surveillance radar system and waveform specifications. strict requirement for the time and frequency accuracy of the oscillator clocks at transmitters and receivers. For instance, with an IF of 20 MHz and a carrier frequency offset of 10 kHz the error in beam direction becomes 0.1◦ and the estimated range error equals 0.27 meter","['. DigitalObjectIdentifier10.1109/ACCESS.2025.3581842 Receiver Processing of the Multibeam Azimuth Scanning CC-OFDM-MIMO Radar DEVYKUSWIDIASTUTI 1,(Member,IEEE),L.P.LIGTHART 2,(LifeFellow,IEEE), GAMANTYOHENDRANTORO1,(SeniorMember,IEEE),TITIEKSURYANI 1,(Member,IEEE), PRASETIYONOHARIMUKTI 1,(Member,IEEE),ANDYUYUWAHYU 3,(Member,IEEE) 1DepartmentofElectricalEngineering,InstitutTeknologiSepuluhNopember,Surabaya60111,Indonesia 2IRCTR,DelftUniversityofTechnology(TUDelft),2628CDDelft,TheNetherlands(Retired)', '. isillustratedashavingaradarbeamthatcoversaspanofthe In this manner, the FPMIMO radar can achieve a desired azimuthangle', '(13) herein as the subarrayed MIMO (SMIMO) radars, such as theFPMIMOradar,rangesbetweentwoextremeconfiguraNotation ⊗ denotes the Kronecker product operator, tions, namely the PA and the MIMO radar', '. needed. Multibeam radars that continuously transmit concurrent The principles of CC-OFDM MIMO radars have been multiple beams are able to simultaneously look at different discussed in [20] by way of an exemplary radar design for directions, for instance to cover a wide angular swath a long-range surveillance mission. The design includes the with a faceted view', '. [21] Z. Xu and A. Petropulu, ‘‘A bandwidth efficient dual-function radar communication system based on a MIMO radar using OFDM waveforms,’’ IEEE Trans. Signal Process., vol. 71, pp.401–416, 2023, doi: 10.1109/TSP.2023.3241779. [22] U.B.SaracandG.M.Guvensen,‘‘Knowledge-aidedandadaptivebeamsquintawareMIMO-OFDMradardetectorsforISAC,’’IEEETrans.Commun.,earlyaccess,May8,2025,doi:10.1109/TCOMM.2025.3568219. [23] M. Schurwanz, J. Mietzner, and P. A']","Multibeam radars can simultaneously observe multiple directions, which is essential for applications such as long-range surveillance (Kuswidiastuti et al., 2025).","The beams and the CC-OFDM symbols are Golay VOLUME 13, 2025 109897 D. Kuswidiastuti et al.: Receiver Processing of the Multibeam Azimuth Scanning CC-OFDM-MIMO Radar coded and transmitted using the allocated sub-band following a specific schedule that is well known by the transmitter and receiver. The neighboring beam must use different sub-band and sub-band reuse is allowed for beams that are at least 10◦ in separation. In order to generate CC-OFDM waveform, additional phase steering β(fn,a,b, (cid:49)tb) is given to the specified OFDM sub-band frequencies of beam b to provide phase difference between the transmit elements for creating the beam b. Circulating code in LFM MIMO radar which is discussed in , obtain this phase difference by transmitting coherent signals",0.6666666666666666,0.9186427605935706
"FOR LONG-RANGE SURVEILLANCE A. REQUIREMENTS A. REQUIREMENTS To elucidate the novel concept and detailed implementation of the CC-OFDM MIMO radar, we will take a surveillance radar design as an example for analyses in the subsequent sections. The CC-OFDM MIMO radar waveform designed herein is based on the requirement of surveillance radars used in coastal areas, where the target of interest are ships and small aircrafts in the area within 180 km from the radar site. OFDM signals with subcarrier spacing of 10 KHz will give a maximum unambiguous range of 15 km. In order to extend the maximum unambiguous range of the radar up to 180 km, 12 orthogonal OFDM symbols with symbol time of 0.1 ms are transmitted in","['. INDEX TERMS Circulating-codes, Golay-codes, interference, MIMO-radar, multibeam, OFDM-radar, sub-band,surveillance. I. INTRODUCTION Manyradarapplicationsdemandscanningcapabilitytoallow The associate editor coordinating the review of this manuscript and coverage over a range of angular direction, such as those approvingitforpublicationwasXueboZhang . forsurveillance,vehicular,weathermonitoring,imaging,and 2025TheAuthors.ThisworkislicensedunderaCreativeCommonsAttribution4.0License', '. DigitalObjectIdentifier10.1109/ACCESS.2025.3581842 Receiver Processing of the Multibeam Azimuth Scanning CC-OFDM-MIMO Radar DEVYKUSWIDIASTUTI 1,(Member,IEEE),L.P.LIGTHART 2,(LifeFellow,IEEE), GAMANTYOHENDRANTORO1,(SeniorMember,IEEE),TITIEKSURYANI 1,(Member,IEEE), PRASETIYONOHARIMUKTI 1,(Member,IEEE),ANDYUYUWAHYU 3,(Member,IEEE) 1DepartmentofElectricalEngineering,InstitutTeknologiSepuluhNopember,Surabaya60111,Indonesia 2IRCTR,DelftUniversityofTechnology(TUDelft),2628CDDelft,TheNetherlands(Retired)', '. [21] Z. Xu and A. Petropulu, ‘‘A bandwidth efficient dual-function radar communication system based on a MIMO radar using OFDM waveforms,’’ IEEE Trans. Signal Process., vol. 71, pp.401–416, 2023, doi: 10.1109/TSP.2023.3241779. [22] U.B.SaracandG.M.Guvensen,‘‘Knowledge-aidedandadaptivebeamsquintawareMIMO-OFDMradardetectorsforISAC,’’IEEETrans.Commun.,earlyaccess,May8,2025,doi:10.1109/TCOMM.2025.3568219. [23] M. Schurwanz, J. Mietzner, and P. A', '. needed. Multibeam radars that continuously transmit concurrent The principles of CC-OFDM MIMO radars have been multiple beams are able to simultaneously look at different discussed in [20] by way of an exemplary radar design for directions, for instance to cover a wide angular swath a long-range surveillance mission. The design includes the with a faceted view', '. CC-OFDM MIMO radar waveform design which the degree of orthogonality can be further improved by is discussed in this paper is not a CP based radar, the assigningdifferentsubbands,fortheneighboringbeams,and transmittersaretransmittingmultipleorthogonalsymbolsin thesamesubbandcanbereusedforthenon-adjacentbeams. serieswithoutanyguardtimeintervalbetweenthesymbols. The interference among these co-channel beams can be The symbol series are orthogonal to each other, hence VOLUME13,2025 109895']","Multibeam radars can simultaneously observe various directions, which is essential for long-range surveillance applications (Kuswidiastuti et al., 2025).","much defining the maximum unambiguous range of the radar system. CC-OFDM MIMO radar waveform design which is discussed in this paper is not a CP based radar, the transmitters are transmitting multiple orthogonal symbols in series without any guard time interval between the symbols. to each other, hence The symbol series are orthogonal VOLUME 13, 2025 109895 D. Kuswidiastuti et al.: Receiver Processing of the Multibeam Azimuth Scanning CC-OFDM-MIMO Radar receivers know how to distinguish the symbols received, and this could extend the maximum unambiguous range of the radar. The contributions of this paper are described as follow: 1) This paper describes the receiver processing of multi- beam CC-OFDM MIMO Radar which is designed for long-range radar surveillance application. The",0.6666666666666666,0.9318939517388307
"of 10 KHz will give a maximum unambiguous range of 15 km. In order to extend the maximum unambiguous range of the radar up to 180 km, 12 orthogonal OFDM symbols with symbol time of 0.1 ms are transmitted in series. The 12 OFDM signals are transmitted in quasi-continuous way, since the transmitter is idle during the reception period within one repetition time interval. The CC-OFDM MIMO radar system and waveform speciﬁcations are described in Table 1 In this case, each sub band which consists of 256 subcarriers are used for beam- forming; that leads to 2.56 MHz bandwidth and results in a range resolution of 60 meters in each beam. The OFDM signal period is 0.1 ms and the","['. [21] Z. Xu and A. Petropulu, ‘‘A bandwidth efficient dual-function radar communication system based on a MIMO radar using OFDM waveforms,’’ IEEE Trans. Signal Process., vol. 71, pp.401–416, 2023, doi: 10.1109/TSP.2023.3241779. [22] U.B.SaracandG.M.Guvensen,‘‘Knowledge-aidedandadaptivebeamsquintawareMIMO-OFDMradardetectorsforISAC,’’IEEETrans.Commun.,earlyaccess,May8,2025,doi:10.1109/TCOMM.2025.3568219. [23] M. Schurwanz, J. Mietzner, and P. A', '. DigitalObjectIdentifier10.1109/ACCESS.2025.3581842 Receiver Processing of the Multibeam Azimuth Scanning CC-OFDM-MIMO Radar DEVYKUSWIDIASTUTI 1,(Member,IEEE),L.P.LIGTHART 2,(LifeFellow,IEEE), GAMANTYOHENDRANTORO1,(SeniorMember,IEEE),TITIEKSURYANI 1,(Member,IEEE), PRASETIYONOHARIMUKTI 1,(Member,IEEE),ANDYUYUWAHYU 3,(Member,IEEE) 1DepartmentofElectricalEngineering,InstitutTeknologiSepuluhNopember,Surabaya60111,Indonesia 2IRCTR,DelftUniversityofTechnology(TUDelft),2628CDDelft,TheNetherlands(Retired)', '. INDEX TERMS Circulating-codes, Golay-codes, interference, MIMO-radar, multibeam, OFDM-radar, sub-band,surveillance. I. INTRODUCTION Manyradarapplicationsdemandscanningcapabilitytoallow The associate editor coordinating the review of this manuscript and coverage over a range of angular direction, such as those approvingitforpublicationwasXueboZhang . forsurveillance,vehicular,weathermonitoring,imaging,and 2025TheAuthors.ThisworkislicensedunderaCreativeCommonsAttribution4.0License', '. [26] Y. Liu, G. Liao, Z. Yang, and J. Xu, ‘‘Design of integrated radar includinginvestigationintomillimeter-wavepropagation,channelmodeling and communication system based on MIMO-OFDM waveform,’’ J. andwirelesssystemsfortropicalareas,studiesonHFskywavechannelsand Syst. Eng. Electron., vol. 28, no. 4, pp.669–680, Aug. 2017, doi: communicationsinequatorialregions,andthedevelopmentofradararray 10.21629/JSEE.2017.04.06. andsignalprocessing. VOLUME13,2025 109905', '. CC-OFDM MIMO radar waveform design which the degree of orthogonality can be further improved by is discussed in this paper is not a CP based radar, the assigningdifferentsubbands,fortheneighboringbeams,and transmittersaretransmittingmultipleorthogonalsymbolsin thesamesubbandcanbereusedforthenon-adjacentbeams. serieswithoutanyguardtimeintervalbetweenthesymbols. The interference among these co-channel beams can be The symbol series are orthogonal to each other, hence VOLUME13,2025 109895']","The CC-OFDM MIMO radar system transmits multiple orthogonal symbols in series without guard time intervals, enhancing the degree of orthogonality among the signals (Kuswidiastuti et al., 2025).","much defining the maximum unambiguous range of the radar system. CC-OFDM MIMO radar waveform design which is discussed in this paper is not a CP based radar, the transmitters are transmitting multiple orthogonal symbols in series without any guard time interval between the symbols. to each other, hence The symbol series are orthogonal VOLUME 13, 2025 109895 D. Kuswidiastuti et al.: Receiver Processing of the Multibeam Azimuth Scanning CC-OFDM-MIMO Radar receivers know how to distinguish the symbols received, and this could extend the maximum unambiguous range of the radar. The contributions of this paper are described as follow: 1) This paper describes the receiver processing of multi- beam CC-OFDM MIMO Radar which is designed for long-range radar surveillance application. The",0.5,0.927993574675906
"it can be seen from (11) that the phase correction, Cn,p,a,b is given to the n-th subcarrier frequency of the OFDM waveform generated for the p-th transmitter for beamforming to θb of symbol a. The Taylor coefﬁcient for sidelobe suppression Ip in (7) is also digitally generated directly from the WG. It is for these two reasons that the CC-OFDM waveforms must be generated simultane- ously per row of the azimuth antenna elements. It is therefore necessary to implement a digital WG at each transmitter with programmability feature, since different radar applications might require different parameters for the beams, waveforms, symbols and frames of symbols. Consequently, the adoption of the concept of software-deﬁned radar (SDR) platform is advantageous and instrumental","['. The design includes the with a faceted view. Such radars may find applications in system architecture and parameters, the waveform design surveillance[9],[10],[11],[12],automotive[13],[14],[15], and the scheduling of Golay codes and subbands. The imaging[16],[17],etc.Generationofmultiplesimultaneous transmitter architecture that adopts software-defined radar orthogonal beams can be done in several ways', '. DigitalObjectIdentifier10.1109/ACCESS.2025.3581842 Receiver Processing of the Multibeam Azimuth Scanning CC-OFDM-MIMO Radar DEVYKUSWIDIASTUTI 1,(Member,IEEE),L.P.LIGTHART 2,(LifeFellow,IEEE), GAMANTYOHENDRANTORO1,(SeniorMember,IEEE),TITIEKSURYANI 1,(Member,IEEE), PRASETIYONOHARIMUKTI 1,(Member,IEEE),ANDYUYUWAHYU 3,(Member,IEEE) 1DepartmentofElectricalEngineering,InstitutTeknologiSepuluhNopember,Surabaya60111,Indonesia 2IRCTR,DelftUniversityofTechnology(TUDelft),2628CDDelft,TheNetherlands(Retired)', '. INDEX TERMS Circulating-codes, Golay-codes, interference, MIMO-radar, multibeam, OFDM-radar, sub-band,surveillance. I. INTRODUCTION Manyradarapplicationsdemandscanningcapabilitytoallow The associate editor coordinating the review of this manuscript and coverage over a range of angular direction, such as those approvingitforpublicationwasXueboZhang . forsurveillance,vehicular,weathermonitoring,imaging,and 2025TheAuthors.ThisworkislicensedunderaCreativeCommonsAttribution4.0License', '. [26] Y. Liu, G. Liao, Z. Yang, and J. Xu, ‘‘Design of integrated radar includinginvestigationintomillimeter-wavepropagation,channelmodeling and communication system based on MIMO-OFDM waveform,’’ J. andwirelesssystemsfortropicalareas,studiesonHFskywavechannelsand Syst. Eng. Electron., vol. 28, no. 4, pp.669–680, Aug. 2017, doi: communicationsinequatorialregions,andthedevelopmentofradararray 10.21629/JSEE.2017.04.06. andsignalprocessing. VOLUME13,2025 109905', '. III. RADARANTENNA The SIL Doppler radar antenna is specifically designed for a 3−8 GHz bandwidth, featuring a smaller beamwidth of less ◦ than17 .Thisdesignincorporateshighgain,narrowbeamwidth, sensitivity,andexcellentefficiencytooptimizethepowerofthe radarsystem.Byfocusingthetransmittedandreceivedelectro- accuratelyregulatetheradiationpatternofeachelement,andthe magneticwavesinaspecificdirection,itmaximizesthesystem’s overallmatrixcontributestosuperioroverallperformance[37]. capabilities']","The simultaneous generation of multiple orthogonal beams in a software-defined radar architecture is essential for various radar applications, as it allows for flexibility in waveform design and parameter adjustment (Devykuswidia et al., 2025).","waveform will be transmitted through. Hence, instead of just have one DWG at the transmitter side like a common conventional phased array radar, CC-OFDM Radar will need DWGs as many as the number of the transmit array elements needed for digital beamforming purposes . The digital baseband OFDM signal of symbol a in beam b is coded with Golay codes can be defined as: sa,b(k) = Nc−1 n=0 ga,b,nej2πfn,a,b(kTs−(a−1)T0) for [0 ≤ kTs − (a − 1)T0 ≤ T0) (1) where a = [1, 2, . . . , Ns], b = [−(Nb − 1)/2, . . . , 0, . . . , (Nb − 1)/2], n = 0, 1, . . . , Nc − 1, and k",0.6666666666666666,0.9273678737306932
"xIF p,a,b, will be converted to analog signals through a DAC device of the p-th transmitter. Using the same procedure, the 63 beam signals are generated simultaneously by the digital WG at each transmit element. For a good operational performance of CC OFDM MIMO radar an important and crucial note should be made now, that is: Transmitting multiple symbols in series and in parallel contributing simultaneously to multiple beams effective in various range intervals, the quasi - CW transmission neces- sitates that the CC OFDM symbols should be orthogonal in time, frequency and code. In the following the orthogonality aspects are detailed. • Single CC OFDM symbol In this example, one symbol of CC-OFDM waveform contributes to 63 beam signals.","['. [21] Z. Xu and A. Petropulu, ‘‘A bandwidth efficient dual-function radar communication system based on a MIMO radar using OFDM waveforms,’’ IEEE Trans. Signal Process., vol. 71, pp.401–416, 2023, doi: 10.1109/TSP.2023.3241779. [22] U.B.SaracandG.M.Guvensen,‘‘Knowledge-aidedandadaptivebeamsquintawareMIMO-OFDMradardetectorsforISAC,’’IEEETrans.Commun.,earlyaccess,May8,2025,doi:10.1109/TCOMM.2025.3568219. [23] M. Schurwanz, J. Mietzner, and P. A', '. DigitalObjectIdentifier10.1109/ACCESS.2025.3581842 Receiver Processing of the Multibeam Azimuth Scanning CC-OFDM-MIMO Radar DEVYKUSWIDIASTUTI 1,(Member,IEEE),L.P.LIGTHART 2,(LifeFellow,IEEE), GAMANTYOHENDRANTORO1,(SeniorMember,IEEE),TITIEKSURYANI 1,(Member,IEEE), PRASETIYONOHARIMUKTI 1,(Member,IEEE),ANDYUYUWAHYU 3,(Member,IEEE) 1DepartmentofElectricalEngineering,InstitutTeknologiSepuluhNopember,Surabaya60111,Indonesia 2IRCTR,DelftUniversityofTechnology(TUDelft),2628CDDelft,TheNetherlands(Retired)', '(13) herein as the subarrayed MIMO (SMIMO) radars, such as theFPMIMOradar,rangesbetweentwoextremeconfiguraNotation ⊗ denotes the Kronecker product operator, tions, namely the PA and the MIMO radar', '. [26] Y. Liu, G. Liao, Z. Yang, and J. Xu, ‘‘Design of integrated radar includinginvestigationintomillimeter-wavepropagation,channelmodeling and communication system based on MIMO-OFDM waveform,’’ J. andwirelesssystemsfortropicalareas,studiesonHFskywavechannelsand Syst. Eng. Electron., vol. 28, no. 4, pp.669–680, Aug. 2017, doi: communicationsinequatorialregions,andthedevelopmentofradararray 10.21629/JSEE.2017.04.06. andsignalprocessing. VOLUME13,2025 109905', '. CC-OFDM MIMO radar waveform design which the degree of orthogonality can be further improved by is discussed in this paper is not a CP based radar, the assigningdifferentsubbands,fortheneighboringbeams,and transmittersaretransmittingmultipleorthogonalsymbolsin thesamesubbandcanbereusedforthenon-adjacentbeams. serieswithoutanyguardtimeintervalbetweenthesymbols. The interference among these co-channel beams can be The symbol series are orthogonal to each other, hence VOLUME13,2025 109895']","The CC OFDM MIMO radar waveform design allows for the transmission of multiple orthogonal symbols in the same subband, enhancing the degree of orthogonality among the beams (Kuswidiastuti et al., 2025).","much defining the maximum unambiguous range of the radar system. CC-OFDM MIMO radar waveform design which is discussed in this paper is not a CP based radar, the transmitters are transmitting multiple orthogonal symbols in series without any guard time interval between the symbols. to each other, hence The symbol series are orthogonal VOLUME 13, 2025 109895 D. Kuswidiastuti et al.: Receiver Processing of the Multibeam Azimuth Scanning CC-OFDM-MIMO Radar receivers know how to distinguish the symbols received, and this could extend the maximum unambiguous range of the radar. The contributions of this paper are described as follow: 1) This paper describes the receiver processing of multi- beam CC-OFDM MIMO Radar which is designed for long-range radar surveillance application. The",0.3333333333333333,0.9341366265453318
"VII. THE COUPLING BETWEEN CC-OFDM MULTI-BEAMS VII. THE COUPLING BETWEEN CC-OFDM MULTI-BEAMS A. THE COUPLING BETWEEN NEIGHBORING BEAMS A. THE COUPLING BETWEEN NEIGHBORING BEAMS This section analyzes the coupling between beams which are transmitted simultaneously over the same period of sym- bol duration. Analysis is done to the beams transmitted on the ﬁrst symbol period, with the scheduling as described in Table 2. It is necessary to make sure that the coupling between the multi-beam CC-OFDM which are transmitted simultaneously using limited bandwidth are low to avoid the probability of false alarm on radar receiver. In this paper, coupling analysis are done for near broadside and near edge beams (i.e., beams that spatially close to each other) and for co-channel","['processed transmit and receive time schedule of CC-OFDM radar is further to obtain the beam information', '. The summation of outputs from 1) Thispaperdescribesthereceiverprocessingofmulti- individual receive modules across the array provides beam CC-OFDM MIMO Radar which is designed the array gain and serves to increase the receive SNR for long-range radar surveillance application. The for each beam', '. INDEX TERMS Circulating-codes, Golay-codes, interference, MIMO-radar, multibeam, OFDM-radar, sub-band,surveillance. I. INTRODUCTION Manyradarapplicationsdemandscanningcapabilitytoallow The associate editor coordinating the review of this manuscript and coverage over a range of angular direction, such as those approvingitforpublicationwasXueboZhang . forsurveillance,vehicular,weathermonitoring,imaging,and 2025TheAuthors.ThisworkislicensedunderaCreativeCommonsAttribution4.0License', '. [1] J. A. Scheer, ‘‘Radar search and overview of detection in interference, TheIFspectrumofthereceivedechosignalcomingfrom ‘‘Radarsearchandoverviewofdetectionininterference,’’inPrinciples ModernRadar,vol.1.SciTechPublishing,2010,pp.87–113. a moving target at beam 0 with a speed of 5m/s is shown [2] C.A.Balanis,AntennaTheory:AnalysisandDesign,4thed.Wiley,2016. in Fig. 14', '. [21] Z. Xu and A. Petropulu, ‘‘A bandwidth efficient dual-function radar communication system based on a MIMO radar using OFDM waveforms,’’ IEEE Trans. Signal Process., vol. 71, pp.401–416, 2023, doi: 10.1109/TSP.2023.3241779. [22] U.B.SaracandG.M.Guvensen,‘‘Knowledge-aidedandadaptivebeamsquintawareMIMO-OFDMradardetectorsforISAC,’’IEEETrans.Commun.,earlyaccess,May8,2025,doi:10.1109/TCOMM.2025.3568219. [23] M. Schurwanz, J. Mietzner, and P. A']","The processed transmit and receive time schedule of CC-OFDM radar is essential for obtaining accurate beam information, which is critical for minimizing coupling between simultaneously transmitted beams (Receiver Processing of the Multibeam Azimuth Scanning CC-OFDM-MIMO Radar).","together with transmit scheduling to avoid transmit receive coupling. The receive scheduling is also related to the time scheduling of the correlation between symbols, which is an important stage in the beam and range processing. The transmit and receive time schedule of CC-OFDM radar is described in Fig. 4. The receive scheduling is very important, especially in a multiple target scheme. The echo signals caused by two or more targets at different ranges (i.e., one target is near to the radar, and the other is far) could cause range ambiguity. The clock synchronization between the multiple transmitters and the multiple receivers of CC-OFDM radars are very crucial to guarantee that the receiver can give the accurate detection. It can be",0.3333333333333333,0.9446324671299056
"beam isolation, the range resolution, the Doppler resolution, those parameters can be modiﬁed and optimized based on the characteristic of the target of interest. Some of the radar speciﬁcations that can be achieved by modifying some of the CC-OFDM waveform parameters are as follows: • The maximum unambiguous range for conventional OFDM radar is mainly limited by the spacing between the OFDM subcarriers. However, one could extend the maximum unambiguous range of the radar by send- ing multiple successive orthogonal CC-OFDM symbols containing orthogonal Golay codes. How many symbols that must be sent will depend on how far the maximum unambiguous range is that the application requires. • The maximum velocity depends on the frequency spac- ing between the OFDM","['. INDEX TERMS Circulating-codes, Golay-codes, interference, MIMO-radar, multibeam, OFDM-radar, sub-band,surveillance. I. INTRODUCTION Manyradarapplicationsdemandscanningcapabilitytoallow The associate editor coordinating the review of this manuscript and coverage over a range of angular direction, such as those approvingitforpublicationwasXueboZhang . forsurveillance,vehicular,weathermonitoring,imaging,and 2025TheAuthors.ThisworkislicensedunderaCreativeCommonsAttribution4.0License', '. [21] Z. Xu and A. Petropulu, ‘‘A bandwidth efficient dual-function radar communication system based on a MIMO radar using OFDM waveforms,’’ IEEE Trans. Signal Process., vol. 71, pp.401–416, 2023, doi: 10.1109/TSP.2023.3241779. [22] U.B.SaracandG.M.Guvensen,‘‘Knowledge-aidedandadaptivebeamsquintawareMIMO-OFDMradardetectorsforISAC,’’IEEETrans.Commun.,earlyaccess,May8,2025,doi:10.1109/TCOMM.2025.3568219. [23] M. Schurwanz, J. Mietzner, and P. A', '. andcommunication(ISAC)systemsmotivatefurthermorethe There are previous research on radar waveform for ISAC use of OFDM for radar waveform. Research on finding the purposes[25],[26]whichdiscussedaboutcyclicprefix(CP) perfect waveform that can serve for both function is still an based OFDM waveform and how the CP is very much ongoingresearchuntilnowadays[20],[21],[22],[23].When defining the maximum unambiguous range of the radar theavailablebandwidthcanbedividedintoseveralsubbands, system', '. This means that the with the Golay codes which corresponds to a specific rangeresolutionwillbe60meter.TheCC-OFDMindividual beamsymbolasstatedintheschedule.Thebeautyof symbol duration is 0.1 ms, and the transmitters transmit a the receiver processing of CC-OFDM MIMO radar is frame consisting of 12 consecutive symbols in series', '. In the works on the PMIMO radar in [22]–[29], The evaluation on the detection performance in terms of the improvement in radar performance factors such as theprobabilityofdetectionandtheprobabilityoffalsealarm spatial resolution, parameter identifiability, transmit-receive reportedhereinisanextensionofstudyby[32].Theseparam(T-R)gain,andsignal-to-interference-plus-noisepowerratio etersareevaluatedbasedonseveralaspectssuchastheeffect (SINR)hasbeenreported.Theresultsofinvestigationsin[29]']","The maximum unambiguous range of the radar can be extended by sending multiple successive orthogonal CC-OFDM symbols, with each symbol having a duration of 0.1 ms and forming a frame of 12 consecutive symbols (Receiver Processing of the Multibeam Azimuth Scanning CC-OFDM-MIMO Radar).","and radial velocity detection of targets is not discussed yet. The contribution of this paper is in the receiver processing of CC-OFDM-MIMO radar, which is different from those in other types of OFDM MIMO radars or other multi-TRM radars due to the nature of the orthogonal multi-beam generation with Golay-coded OFDM waveforms and subbands. There are previous research on radar waveform for ISAC purposes , which discussed about cyclic prefix (CP) based OFDM waveform and how the CP is very much defining the maximum unambiguous range of the radar system. CC-OFDM MIMO radar waveform design which is discussed in this paper is not a CP based radar, the transmitters are transmitting multiple orthogonal symbols in series without any guard time",0.5,0.9435396763250598
"our knowledge, there is no publicly available NER dataset for drone forensic problems yet. We identify and propose six entity types as the tagset in the annotation process. The proposed model achieves a competitive score compared to the state-of-the-art methods, with a 91.146% F1 score. Yet, one of the scenarios achieves high perfor- mance, with a 91.348% F1 score. 2) This work showcases how to utilize speciﬁc evidence data to perform forensic information extraction to assist a forensic investigation, including a simple framework for data extraction and annotation. 3) We propose and investigate cosine similarity as a sub- stitutive of dot-product in the self-attention sub-layer of the Transformer encoder to model contextual depen- dency in a sequence. We also propose","['100 80 60 40 20 0 0 10 20 30 40 50 60 70 Epoch )%( ycaruccA [3] S. Silalahi, T. Ahmad, and H. Studiawan, “Named entity recognition for drone forensic using bert and distilbert,” in 2022 International Conference on Data Science and Its Applications (ICoDSA), pp. 53– 58,2022. [4] J. Jeon and J. Kim, “A survey on transformers for long sentences and its application to medical notes,” in 2023 International Conference on Electronics,Information,andCommunication(ICEIC),pp.1–4,2023. [5] A. M. P. Bras¸oveanu and R', '. Learn., vol. 107, nos. 8–10, include digital forensics and natural language pp.1477–1494,Sep.2018. processing. [44] X. Zhou, Y. Gao, C. Li, and Z. Huang, ‘‘A multiple gradient descent design for multi-task learning on edge computing: Multi-objective machinelearningapproach,’’IEEETrans.Netw.Sci.Eng.,vol.9,no.1, pp.121–133,Jan.2022. [45] S.Silalahi,T.Ahmad,andH.Studiawan,‘‘DroNER:Datasetfordrone namedentityrecognition,’’DataBrief,vol.48,Jun.2023,Art.no.109179', '. The proposed representation of the label improves the prediction confidence score on variousencodertypeswith8.6%and1.8%fromfocalandcross-entropyscenariosonaverage,respectively. INDEX TERMS Anomaly detection, digital forensics, drone forensics, multitask learning, transformer encoder,informationsecurity. I', '. 91.35% compared with another Transformer model. The dataset used in this work is from ALFA [13] which Other research proposed a method in forensic event reprovideslogdataofdronemalfunctions.Thisdatasetcontains construction using directed graphs to identify and reconstruct some drone failures, like a system crash, a malfunctioning events in a drone or its control station device [7]. The study motor, and a drone losing control', '. theexperimentalresults,theTransformerobtainsthehighestF1 In the context of classifying drone malfunctions, the Transscore value of 93.04%. former model can be trained on a dataset of labeled drone Index Terms—drone forensics, forensic investigation, malfunctelemetry data to learn patterns and relationships between the tions, infrastructure, Transformer, Informer, FEDformer drone’s behavior and the root cause of a malfunction. The dataset can include features such as altitude, velocity, battery I']","The proposed model for named entity recognition in drone forensics achieves a competitive F1 score of 91.146%, demonstrating its effectiveness compared to state-of-the-art methods (Silalahi, Ahmad, & Studiawan, 2022).","perform information extraction from drone flight log data. The result of the research is that BERT and DistilBERT have F1 scores of 98.63% and 95.9%, respectively. Furthermore, Silalahi et al. developed the Transformer using cosine similiarity to discover and extract some incident- related information. Cosine similiarity is used to substitute dot- product in the self-attention mechanism of the Transformer encoder layer. The datasets that were used are drone logs from the DJI Phantom. The purposeful method has an F1 score 91.35% compared with another Transformer model. Other research proposed a method in forensic event re- construction using directed graphs to identify and reconstruct events in a drone or its control station device . The study allows the investigator to find",0.3333333333333333,0.9434075680880769
". According to those case studies, the drone’s controller devices stored valuable data that can be compared to the other artifacts enabling a correlation study between the UAV and the mobile application used to control the drone. Some studies also suggest a technical procedure for drone forensic inquiry. In order to perform an end-to-end analysis from the preparation to the reporting of the ﬁndings, ten procedures proposed by Salamh et al. must be followed. Analyzing the encrypted ﬁles is one of the obstacles in the data collection phase. For the DJI models, encrypted evidentiary data is a certainty. However, sometimes we have no access to the DJI proprietary tools. Therefore, the data must be decrypted without using DJI’s proprietary tool,","['. Section III explains the proposed method, applying process. Also, Barton et al. [11] conducted the research to the Transformer technique to forensics of drone malfunctions. reconstruct the actions taken by these drones, identify their InSectionIV,thediscussionofperformancemethod,followed owners or operators, and extract data from associated mobile by conclusions and future works in Section V. devices. In other research in drone forensics, this paper also analyze II', '. flies.Thedetailofthemethodcanbedescribedinthefollowin subsections. B. Drone Forensics Drone forensics is a technique to get, collect, and analyze A. Data Preprocessing the data stored in drones to determine the cause of drone The dataset for the experiment and its preprocessing stage incidents. Research has been done to solve various problems to satisfy the needs in drone forensics can be explained as arising and improve the performance. Al-Dahqm et al. [9] follows', '. For instance, GPS records can be utilisedtoreconstructandanalysethepathtakenbythedrone duringaflight[2].Thedeviationbetweentheempiricalflight andreconstructedpathscanhappenifthedroneencountersa GPSspoofing[3]. Among the published drone forensics studies, popular worksincludecasestudies,evidenceanalysis,toolsdevelopment, and forensic framework development [5]', '. with limitations and threats to validity. As drone forensics Furtherfuturestudiesmayincludeexploringthepossibility is an emerging topic, there are very limited public datasets of doing high-level oversampling to introduce the models available. The log messages used in this study are mainly with more log message patterns, producing a dataset with acquired from DJI-made devices', '. challenges for drone digital forensics investigations,’’ Array, vol. 14, Jul.2022,Art.no.100135. [27] J. Qi, Z. Luan, S. Huang, C. Fung, H. Yang, H. Li, D. Zhu, and D.Qian,‘‘LogEncoder:Log-basedcontrastiverepresentationlearningfor [5] H.Studiawan,G.Grispos,andK.-K.-R.Choo,‘‘Unmannedaerialvehicle anomalydetection,’’IEEETrans.Netw.ServiceManage.,vol.20,no.2, (UAV)forensics:Thegood,thebad,andtheunaddressed,’’Comput.Secur., pp.1378–1391,Jun.2023. vol.132,Sep.2023,Art.no.103340. [28] J. Li, H. He, S. Chen, D']","Drone forensics involves techniques to collect and analyze data stored in drones to ascertain the causes of incidents (Al-Dahqm et al., 2023).","the performance of the proposed framework has been discussed and analysed. In this section, challenges encountered during the study are disclosed, along with limitations and threats to validity. As drone forensics is an emerging topic, there are very limited public datasets available. The log messages used in this study are mainly acquired from DJI-made devices. There is yet to come a publicly available dataset of log messages from other drone manufacturers. Several publicly available datasets are mainly about sensor data and multimedia artefacts . While in this study, we solely depend on the human-readable messages generated by the drone during a flight. Given the condition where a small number of unique messages and most of them are acquired from DJI",0.6666666666666666,0.9475377510484513
"concept of concatenating the word’s vector representation with the Bidirectional Long Short-Term Memory (LSTM) layer output. The Conditional Random Field (CRF) layer is 3260 VOLUME 11, 2023 S. Silalahi et al.: Transformer-Based NER on Drone Flight Logs to Support Forensic Investigation used to decode the concatenated output since it can determine how the sequence labels relate to one another. Most of the work involved in implementing deep learning models is predominantly spent on ﬁguring out how to prepare adequate input representations. Most often, word embedding techniques like GloVe , Word2vec , BERT , and ELMo are used to learn the input representation. Pre- trained language models, such as BERT and ELMo, can generate contextualized representational vectors after going through a","['. 207–212. doi: 9 safe to walk the i fiets do be syour a 45 0.4898 10.18653/v1/P16-2034. streets in the evening hese [8] Z. Huang, W. Xu, and K. Yu, “Bidirectional LSTM-CRF Models 10 i am allergic to bees what o kay o 37 0.4995 for Sequence Tagging,” Aug. 2015. and peanuts sthogsediates [9] Y. Zhu and G. Wang, “CAN-NER: Convolutional Attention Network for Chinese Named Entity Recognition,” in Proceedings V', '100 80 60 40 20 0 0 10 20 30 40 50 60 70 Epoch )%( ycaruccA [3] S. Silalahi, T. Ahmad, and H. Studiawan, “Named entity recognition for drone forensic using bert and distilbert,” in 2022 International Conference on Data Science and Its Applications (ICoDSA), pp. 53– 58,2022. [4] J. Jeon and J. Kim, “A survey on transformers for long sentences and its application to medical notes,” in 2023 International Conference on Electronics,Information,andCommunication(ICEIC),pp.1–4,2023. [5] A. M. P. Bras¸oveanu and R', '. CONCLUSION remains untested as the training dataset contains only log This paper investigates utilising a multitask learning messages acquired from 82 drone models, mostly from paradigmtoperformmulticlassanomalydetectionondrone DJI. This is one of the main challenges in drone forensics flight log messages. Aligning to the nature of multitask research, where human-readable flight log datasets from learning,weproposetwotargetlabelrepresentations,namely other drone models are unavailable', '. Subramanian, K. Kawakami, and C. 2 dormitory doors are ned any ouang thogh 45 0.2710 Dyer, “Neural Architectures for Named Entity Recognition,” in locked at midnight Proceedings of the 2016 Conference of the North American Chapter 3 this equation is too the sedratic arde 37 0.3573 of the Association for Computational Linguistics: Human Language complicated Technologies, Stroudsburg, PA, USA: Association for 4 fish are jumping he inng othe an the oik 21 0.3913 Computational Linguistics, 2016, pp. 260–270', '. For this reason, theotherbaselinesonbothdatasets.However,ourproposed we train a sentence embedding [59] model named DroneSapproachoutperformsallthebaselinessignificantlytestedon BERT with the help of contrastive learning to learn distinct thefiltereddataset,witha2.564%improvementinaccuracy representationsofsamplesfromdifferentclasses[60].Itcan than Neurallog']","Silalahi et al. (2022) discuss the application of BERT and DistilBERT for named entity recognition in drone forensics, highlighting the importance of contextualized word representations in this domain.","Long Short-Term Memory (LSTM) , is a variation of Recurrent Neural Networks (RNN) that has been successfully applied to various Natural Language Processing (NLP) tasks. LSTM has the ability to capture long-range dependencies with sequences making it suitable for solving sequence labeling problems , , , such as Named Entity Recognition tagging (POS-Tag) and Neural (NER), Part-of-Speech combining (NMT). Study Machine Translation Bidirectional LSTM (BiLSTM) model with Conditional Random Field (CRF) to solve NER and POS-Tag Task. BiLSTM encodes word or character vectors into features, while CRF is a classifier to predict the target labels. Previous research has explored enhancing the feature extractor by integrating serves attention mechanisms with existing models or introducing alternative extractors such as Convolutional Neural Networks",0.5,0.8990179119699178
"I. INTRODUCTION I. INTRODUCTION The use of drones has become increasingly common in various applications, including aerial photography, surveying, and monitoring. However, drones can also be involved in incidents such as accidents, violations, or even crimes, making it necessary to investigate drone logs as part of forensic investigations. In a forensic investigation, drone logs are essential sources of information that can help investigators reconstruct the events leading up to an incident. Drone logs typically include information such as flight paths, altitude, speed, battery life, sensor data, and other telemetry information . Important analysis of drone logs involves the identification of the most critical pieces of information in the log data and the analysis of how they relate to the incident","['. Inspired by the study, anomalous events on drone objective[33].Anotheralternativetoleveragethepre-trained flight logs can be detected by analysing log messages and model is fine-tuning the models using prompts [34]. With identifying suspect key phrases closely related to drone onlyafewtrainingdata,themodelcancapturethesemantics incident scenarios. Therefore, the region of interest in this of the input logs and detect anomalous log sequences well', '. challenges for drone digital forensics investigations,’’ Array, vol. 14, Jul.2022,Art.no.100135. [27] J. Qi, Z. Luan, S. Huang, C. Fung, H. Yang, H. Li, D. Zhu, and D.Qian,‘‘LogEncoder:Log-basedcontrastiverepresentationlearningfor [5] H.Studiawan,G.Grispos,andK.-K.-R.Choo,‘‘Unmannedaerialvehicle anomalydetection,’’IEEETrans.Netw.ServiceManage.,vol.20,no.2, (UAV)forensics:Thegood,thebad,andtheunaddressed,’’Comput.Secur., pp.1378–1391,Jun.2023. vol.132,Sep.2023,Art.no.103340. [28] J. Li, H. He, S. Chen, D', '. CONCLUSION remains untested as the training dataset contains only log This paper investigates utilising a multitask learning messages acquired from 82 drone models, mostly from paradigmtoperformmulticlassanomalydetectionondrone DJI. This is one of the main challenges in drone forensics flight log messages. Aligning to the nature of multitask research, where human-readable flight log datasets from learning,weproposetwotargetlabelrepresentations,namely other drone models are unavailable', '. Mantas and Patsakis [6] data to construct a forensic timeline that consists of the log have attempted to utilize telemetry and dataflash logs to messageandthetimestamp. perform drone forensic investigation by performing UAV To perform NER, two common deep learning modintegritychecks,anomalydetectiononthevisualflightpath, els can be used, either RNN-based or Transformer-based command verification, error reporting, and hardware error models. The latest state-of-the-art include BiLSTM-CRF detection', '. For example, in drone forensics, existing studiesgenerallyconsideranomaliesascontradictorytonormalevents.Inotherwords,alltypesofanomalies are considered equally important. However, the peculiar events experienced by a drone during a flight might contain distinct features indicating the anomalies’ importance or level of urgency. For instance, the message ‘‘Critically low power']","Existing studies in drone forensics suggest that anomalies are often treated uniformly, yet specific flight events may reveal distinct features that indicate varying levels of urgency or importance (Interpretable Ordinal-Aware With Contrastive-Enhanced Anomaly Severity Detection on UAV Flight Log Messages).","highly relevant to various incident cases, as shown in Fig 3. Not only is it highly relevant, but it is also highly prioritised evidence in diverse investigation cases. 2) Flight log messages cover events from the drone’s sensors, features, and components, making it one piece of evidence to perform analysis related to different drone software and hardware components. Therefore, analysing the log messages means analysing the whole device for various possible incident scenarios. 3) Flight log messages contain contextual information about the occurring event as a description that involves multiple parts of the drone simultaneously. For example, a certain circumstance fails a feature or an operation, as shown in message group number 4 in Table 1. TABLE 1. Groups of",0.6666666666666666,0.9236614029060137
"perform information extraction from drone flight log data. The result of the research is that BERT and DistilBERT have F1 scores of 98.63% and 95.9%, respectively. Furthermore, Silalahi et al. developed the Transformer using cosine similiarity to discover and extract some incident- related information. Cosine similiarity is used to substitute dot- product in the self-attention mechanism of the Transformer encoder layer. The datasets that were used are drone logs from the DJI Phantom. The purposeful method has an F1 score 91.35% compared with another Transformer model. Other research proposed a method in forensic event re- construction using directed graphs to identify and reconstruct events in a drone or its control station device . The study allows the investigator to find","['. DigitalObjectIdentifier10.1109/ACCESS.2023.3234605 Transformer-Based Named Entity Recognition on Drone Flight Logs to Support Forensic Investigation SWARDIANTARASILALAHI ,(Member,IEEE),TOHARIAHMAD ,(Member,IEEE), ANDHUDANSTUDIAWAN,(Member,IEEE) DepartmentofInformatics,InstitutTeknologiSepuluhNopember,Surabaya60111,Indonesia Correspondingauthor:TohariAhmad(tohari@if.its.ac.id) ThisworkwassupportedinpartbytheInstitutTeknologiSepuluhNopember(ITS);andinpartbythePendidikanMagisterMenuju', '. CONCLUSION remains untested as the training dataset contains only log This paper investigates utilising a multitask learning messages acquired from 82 drone models, mostly from paradigmtoperformmulticlassanomalydetectionondrone DJI. This is one of the main challenges in drone forensics flight log messages. Aligning to the nature of multitask research, where human-readable flight log datasets from learning,weproposetwotargetlabelrepresentations,namely other drone models are unavailable', '. Several forensic problems yet. We identify and propose six similarstudiesweredoneonotherdronemodels,suchasthe entitytypesasthetagsetintheannotationprocess.The Yuneec Typhoon model [12], DJI Spark [26], and the DJI proposedmodelachievesacompetitivescorecompared Phantom [27]. According to those case studies, the drone’s to the state-of-the-art methods, with a 91.146% F1 controllerdevicesstoredvaluabledatathatcanbecompared score', 'S.Silalahietal.:InterpretableOrdinal-AwareWithContrastive-EnhancedAnomalySeverityDetection 1) Human-readable log messages can be found in the flightlog,whichishighlyrelevanttovariousincident cases,asshowninFig3.Notonlyisithighlyrelevant, but it is also highly prioritised evidence in diverse investigationcases. 2) Flight log messages cover events from the drone’s sensors,features,andcomponents,makingitonepiece of evidence to perform analysis related to different drone software and hardware components', 'S.Silalahietal.:Transformer-BasedNERonDroneFlightLogstoSupportForensicInvestigation FIGURE1. Anillustrationofentitytypesinaforensictimelineconstructedfromdroneflightlogdata. In the digital forensic research area, drone forensics is a is no attempt to utilize specific data, in this case, the log quite new research topic. Generally, it is categorized into message, to perform a drone forensic investigation']",Silalahi et al. achieved a competitive F1 score of 91.146% using their Transformer-based model for named entity recognition on drone flight logs.,"availability of a public dataset is one of the considerations for this research to be veriﬁable and reproducible. V. CONCLUSION AND FUTURE WORKS V. CONCLUSION AND FUTURE WORKS In this research, we have experimented with the employ- ment of cosine similarity as a substitute for dot-product self-attention in the encoder sub-layer of Transformer archi- tecture. To evaluate our proposed approach, we construct our own NER dataset by manually extracting several drone forensic image datasets that are publicly available from the VTO Labs. For a relatively small dataset, we obtain a good result indicated by the F1 score of 91.348% achieved by the dot-product attention supported by CNN character embed- ding and BERT word embedding. Our proposed approach outperforms the RNN-based",1.0,0.9152287434529301
"devices at the ground station are merged into a drone super timeline. By using the tool, the investigator will be able to easily analyze the drone accident. B. Drone Forensics Drone forensics is a technique to get, collect, and analyze the data stored in drones to determine the cause of drone incidents. Research has been done to solve various problems arising and improve the performance. Al-Dahqm et al. proposed a forensic framework for drone. The method supports the majority of drone types on the market. The developed framework has three phases. In the preparatory phase, the investigator may analyze all components of the drone and conclude which components were used. Second is the data acquisition phase; the data from the","['. For instance, GPS records can be utilisedtoreconstructandanalysethepathtakenbythedrone duringaflight[2].Thedeviationbetweentheempiricalflight andreconstructedpathscanhappenifthedroneencountersa GPSspoofing[3]. Among the published drone forensics studies, popular worksincludecasestudies,evidenceanalysis,toolsdevelopment, and forensic framework development [5]', '. ABSTRACT The increase in drone usage by the public brings the number of drone incident and attack up.Sophisticatedpreventivemechanisms,aswellaspost-incidentproceduresandframeworks,areneeded. Forensicinvestigationisperformeduponadroneincident,aimingtouncovertheincidentscenario,mitigate the risk and report the examination results. Generally, standard drone forensic procedure consistsof three stages, i.e., evidence acquisition, evidence analysis, and reporting', '. system(UAS)forensics:Dataextraction&analysis,’’ForensicSci.Int., [28] S.ViswanathanandZ.Baig,‘‘Digitalforensicsfordrones:Astudyoftools Digit.Invest.,vol.41,Jun.2022,Art.no.301379. andtechniques,’’inApplicationsandTechniquesinInformationSecurity, [6] E. Mantas and C. Patsakis, ‘‘GRYPHON: Drone forensics in dataflash L.BatinaandG.Li,Eds.Singapore:Springer,2020,pp.29–41. andtelemetrylogs,’’inAdvancesinInformationandComputerSecurity, [29] M. Debinski, F. Breitinger, and P. Mohan, ‘‘Timeline2GUI: N', '. For example, in drone forensics, existing studiesgenerallyconsideranomaliesascontradictorytonormalevents.Inotherwords,alltypesofanomalies are considered equally important. However, the peculiar events experienced by a drone during a flight might contain distinct features indicating the anomalies’ importance or level of urgency. For instance, the message ‘‘Critically low power', '. challenges for drone digital forensics investigations,’’ Array, vol. 14, Jul.2022,Art.no.100135. [27] J. Qi, Z. Luan, S. Huang, C. Fung, H. Yang, H. Li, D. Zhu, and D.Qian,‘‘LogEncoder:Log-basedcontrastiverepresentationlearningfor [5] H.Studiawan,G.Grispos,andK.-K.-R.Choo,‘‘Unmannedaerialvehicle anomalydetection,’’IEEETrans.Netw.ServiceManage.,vol.20,no.2, (UAV)forensics:Thegood,thebad,andtheunaddressed,’’Comput.Secur., pp.1378–1391,Jun.2023. vol.132,Sep.2023,Art.no.103340. [28] J. Li, H. He, S. Chen, D']","Standard drone forensic procedures typically involve three stages: evidence acquisition, evidence analysis, and reporting (Transformer-Based Named Entity Recognition on Drone Flight Logs to Support Forensic Investigation).",". According to those case studies, the drone’s controller devices stored valuable data that can be compared to the other artifacts enabling a correlation study between the UAV and the mobile application used to control the drone. Some studies also suggest a technical procedure for drone forensic inquiry. In order to perform an end-to-end analysis from the preparation to the reporting of the ﬁndings, ten procedures proposed by Salamh et al. must be followed. Analyzing the encrypted ﬁles is one of the obstacles in the data collection phase. For the DJI models, encrypted evidentiary data is a certainty. However, sometimes we have no access to the DJI proprietary tools. Therefore, the data must be decrypted without using DJI’s proprietary tool,",0.6666666666666666,0.9493260555735078
"drone types on the market. The developed framework has three phases. In the preparatory phase, the investigator may analyze all components of the drone and conclude which components were used. Second is the data acquisition phase; the data from the drone component will be downloaded and stored on the computer. The last phase is the data analysis phase. In this phase, the data is analyzed using different methods to extract and draw conclusions about the causes of drone engine failure . in this phase, Furthermore, Jain et al. proposed a framework for sensor data identification and verification. An analysis of a drone’s architecture and a forensic model with generic features are proposed here in order to enhance the digital investigation","['. For instance, GPS records can be utilisedtoreconstructandanalysethepathtakenbythedrone duringaflight[2].Thedeviationbetweentheempiricalflight andreconstructedpathscanhappenifthedroneencountersa GPSspoofing[3]. Among the published drone forensics studies, popular worksincludecasestudies,evidenceanalysis,toolsdevelopment, and forensic framework development [5]', '. ABSTRACT The increase in drone usage by the public brings the number of drone incident and attack up.Sophisticatedpreventivemechanisms,aswellaspost-incidentproceduresandframeworks,areneeded. Forensicinvestigationisperformeduponadroneincident,aimingtouncovertheincidentscenario,mitigate the risk and report the examination results. Generally, standard drone forensic procedure consistsof three stages, i.e., evidence acquisition, evidence analysis, and reporting', '. system(UAS)forensics:Dataextraction&analysis,’’ForensicSci.Int., [28] S.ViswanathanandZ.Baig,‘‘Digitalforensicsfordrones:Astudyoftools Digit.Invest.,vol.41,Jun.2022,Art.no.301379. andtechniques,’’inApplicationsandTechniquesinInformationSecurity, [6] E. Mantas and C. Patsakis, ‘‘GRYPHON: Drone forensics in dataflash L.BatinaandG.Li,Eds.Singapore:Springer,2020,pp.29–41. andtelemetrylogs,’’inAdvancesinInformationandComputerSecurity, [29] M. Debinski, F. Breitinger, and P. Mohan, ‘‘Timeline2GUI: N', '. For example, in drone forensics, existing studiesgenerallyconsideranomaliesascontradictorytonormalevents.Inotherwords,alltypesofanomalies are considered equally important. However, the peculiar events experienced by a drone during a flight might contain distinct features indicating the anomalies’ importance or level of urgency. For instance, the message ‘‘Critically low power', '. challenges for drone digital forensics investigations,’’ Array, vol. 14, Jul.2022,Art.no.100135. [27] J. Qi, Z. Luan, S. Huang, C. Fung, H. Yang, H. Li, D. Zhu, and D.Qian,‘‘LogEncoder:Log-basedcontrastiverepresentationlearningfor [5] H.Studiawan,G.Grispos,andK.-K.-R.Choo,‘‘Unmannedaerialvehicle anomalydetection,’’IEEETrans.Netw.ServiceManage.,vol.20,no.2, (UAV)forensics:Thegood,thebad,andtheunaddressed,’’Comput.Secur., pp.1378–1391,Jun.2023. vol.132,Sep.2023,Art.no.103340. [28] J. Li, H. He, S. Chen, D']","The standard drone forensic procedure consists of three stages: evidence acquisition, evidence analysis, and reporting (Jain et al., 2023).","Transformer-Based NER on Drone Flight Logs to Support Forensic Investigation Accordingly, Jain et al. proposed a framework com- prising 12 phases. The ﬁrst ﬁve phases were used to locate and validate the drone’s sensors and data. The other seven steps were used to analyze physical evidence like ﬁngerprints and digital evidence from several sources, such as memory cards, ﬂight logs, and network logs. However, the proposed framework has not explained the preparation phase in detail. Therefore, another framework consisting of four investigative phases with a more comprehensive analysis is proposed by Al-Dhaqm et al. . One of the primary distinctions of this framework is a more extensive preparation phase consisting of pre- and post-incident preparation. Pre-incident prepara- tion is an",0.6666666666666666,0.9545412662063605
"organizations improve the reliability, security, and operational efficiency in managing their information technology. , Prema et al use process mining techniques to examine a regional hospital's billing procedure. This study emphasizes how crucial it is to increase the billing process' effectiveness in order to give patients higher-quality care. In this study, data from the finance module of the hospital's ERP system was explored to determine bottleneck activities in the invoice procedure. Using anonymised event logs, this study aims to find causality in the hospital's billing process and identify potential bottleneck activities. Audit with surveys is an effective method for gathering essential information to evaluate a process or system . Using carefully crafted questionnaires, auditors directly collect data from individuals or","['to hospital billing cases. Through this approach, auditors can record, describing the events of specific cases. Utilizing these update their methods for obtaining, analyzing, and validating logs in an information system facilitates the creation of an data based on event logs stored in the information system, accurate business model [13]. thereby generating more effective processes overall. D. Heuristic Miner II. LITERATURE REVIEW Heuristic Miner, a process mining algorithm, is reliable A', "". PROPOSED METHOD the log files associated with a company's business operations, This section discussed the research workflow illustrated in aimed at better understanding and optimizing each activity Fig. 1. The research stages encompass four critical steps more effectively[8] . From the data obtained, specific patterns involved in managing and analyzing the event log dataset will be identified to provide deeper insights into process within the hospital billing system. These steps are designed to behavior"", '. TABLE III presents the top 10 most TABLE IV highlights the bottleneck process activities, frequent process patterns observed in the hospital billing showcasing throughput times and distribution for various system, detailing their activity traces, frequencies, and case billing stages, emphasizing the critical points where efficiency ratios, which highlight the prevalent pathways and potential can be improved. This study discovered significant variations inefficiencies within the process', "". The analysis also aims includes eliminating any incomplete or irrelevant records, to evaluate the overall effectiveness of the hospital's billing rectifying errors, and normalizing the data formats. This practices. Insights gained from this analysis can help optimize phase is essential for securing the integrity and dependability processes to enhance overall operational performance. of the data prior to conducting deeper analytical procedures"", '. The final stage is performance analysis, C. Event Logs where the effectiveness and efficiency of the billing processes are reviewed to identify potential areas for improvement. An event log is historical documentation within an Overall, these stages are crucial to ensure that the billing information system, serving as proof of ongoing transactions practices at the hospital are conducted efficiently and [11]. It sequentially and concurrently records activities, transparently']",The effectiveness and efficiency of the hospital's billing processes are reviewed to identify potential areas for improvement (Process Mining for Evaluating Hospital Billing System Based on DSS01 Domain COBIT 2019 Framework).,"stage is performance analysis, where the effectiveness and efficiency of the billing processes are reviewed to identify potential areas for improvement. Overall, these stages are crucial to ensure that the billing practices at the hospital are conducted efficiently and transparently. A. Dataset The ""Hospital Billing"" event log was obtained from the financial module of the ERP system used by a regional hospital , This log records various incidents related to the billing of medical services provided by the hospital. Over a three-year period, from 2013 to 2016, a random sample of 100,000 traces was collected, each representing a recorded example of the process in the system. Within this event log, there are 18 different activities, each depicting distinct stages in",0.75,0.9323733107470922
"baked goods’ quality can be determined by the gas or vapor content. Gas chromatography is the standard instrument for quantitatively and qualitatively analyzing volatile organic compounds (VOCs). This method separates compounds in a mixture by injecting a gas sample into the mobile phase, usually called the carrier gas, and passing the gas through the stationary phase , , . Volatile compounds identified in aldehydes, alcohols, acids, alkanes, and ketones are the main components that contribute VOLUME 12, 2024 2024 The Authors. This work is licensed under a Creative Commons Attribution-NonCommercial-NoDerivatives 4.0 License. For more information, see 97235 TABLE 1. The ingredients of the cookie. to the cookie flavor . Chemical compounds grouped as hydrocarbons are also released while making and","['. exhibit a diverse array of volatile compounds, such as 27 hydrocarbons, 2 furans, 9 alcohols, 11 ketones, 7 esters, 17 B. Volatile Organic Compounds Identification aldehydes, and 9 nitrogen compounds[22]. Through Chromatography-Mass Spectrometry (GC-MS), On the contrary, Gambung green tea is distinguished by it was found that there were 143 VOCs in the good-quality many higher concentrations of volatile compounds, sample and 118 VOCs in the quality-defect sample', '. Researchers find this method highly delightful flavor and pleasant aroma but also for its numerous beneficial in establishing a reliable ground truth, enabling the health benefits[1]. One of the most notable factors impacting precise identification of volatile organic compounds. the character of tea is its aroma', '. instrument is around USD 120,000 in 2017 [17], while the cost of testing a sample is about USD 50. In addition, the II. RELATEDWORKS testing process of one sample can take about 1 to 2 days, E-nosecanbeusedforfoodauthenticationandadulteration depending on the complexity of the gases. Another consid- assessment,assummarizedinTABLE1.Researchtodetect erationistheassistanceofapersonwhohasexperiencewith meatadulterationusinganelectronicnosehasdevelopedand operatingtheGC-MSinstruments. is being studied', '. ABSTRACT Recently,theissueoffoodauthenticationhasgainedattention,especiallyhalalauthentication, becauseofcasesofporkadulterationinbeef.Manystudieshavedevelopedrapiddetectionforadulterated meat. However, these studies are not yet practical and economical methods and instruments and a faster analysis process. In this context, this paper proposes the Optimized Electronic Nose System (OENS) for more accurately detecting pork adulteration in beef', 'TABLE I. ORGANOLEPTIC SCORE FOR AROMA Gambung Tea Research Center SNI 3945-2016 Representation A = normal typical green tea; B = normal typical green tea; 1 5 C = normal typical green tea; Quality Defect 2.8 Good Quality D = less typical green tea; E = abnormal. The volatile compounds were determined through a comparison of the acquired mass spectra with established standards from the NIST Mass Spectral library and by the computation of linear retention indices (LRI) for individual Fig. 5']","The analysis of volatile organic compounds (VOCs) in baked goods can be supported by findings that demonstrate a diverse array of volatile compounds, including hydrocarbons, alcohols, ketones, and aldehydes, identified through gas chromatography-mass spectrometry (GC-MS) (Referensi 1).","whereas 27 chops had quality defects. B. Volatile Organic Compounds Identification Through Chromatography-Mass Spectrometry (GC-MS), it was found that there were 143 VOCs in the good-quality sample and 118 VOCs in the quality-defect sample. Then it also obtained that there were 102 similar compounds present Fig. 4. Number of Compounds in Each Classes Fig. 5. Percentage of Area of Compounds in Each Classes in both sample 1 and sample 2, which are detailed in TABLE II. The results of grouping chemical substances into several groups, including nitrogenous compounds, alcohols, esters, hydrocarbons, hetero- oxygenates, and others. Substance content in each class of compounds means that different concentrations are shown as Area as shown in TABLE II. aldehydes, phenols, ketones, In GC-MS,",0.6,0.957838064012763
"measured the ratio of correct recognition results to the entire dataset. Accuracy = TP + TN TP + FN + TN + FP (11) 2) Precision (12) estimated how many of the positive pre- dictions were correct. Precision = TP TP + FP (12) 3) Recall can also be called Sensitivity (13) calculated how many positive cases the classifier correctly pre- dicted over all the positive instances in the data. Recall = TP TP + FN (13) 4) F1-measure (14) assessed the predictive skill of a model by elaborating on its class-wise performance. F1 − measure = 2 × Precision × Recall Precision + Recall (14) 97240 VOLUME 12, 2024 M. Rivai, D. Aulia: Use of Electronic Nose to Identify","['. The electronic nose has been without reducing the system’s performance in predicting widely applied in various fields, such as the classification healthypeopleandasthmasuspects.Thispaperisorganized of perfume [6], food quality [7], and diseases in the human as follows. Section I covers the background of this study. body[8],[9]. Section II provides the proposed method and experimenThe volatile compounds in exhaled breath require a dif- tal setup', '. E-nose is designed from several thestacked deeplearning methodcanincrease theaccuracy metal-oxide semiconductor gas sensors that are highly ofcyberattacksdetection.Hence,themotivationforthisstudy sensitivetocertaingases.Thenittakesasamplefromsweat canbeformulatedasfollows: in the human axilla and stores the VOCs contained in the 1. Several types of research have used an E-nose to sweat. This device became safer by taking samples through detectdiseases.However,noresearchusedsweatfrom theaxilla[10]', '. Lagod, J. Ramos, J. Lozano, M. Kaveh, and Y. Darvishi, All of green tea sample was provided by Research Institute ‘Environmental Engineering Applications of Electronic Nose Systems of Tea and Cinchona, Gambung, West Java. This research was Based on MOX Gas Sensors’, Sensors, vol. 23, no. 12, p. 5716, Jun. 2023, doi: 10.3390/s23125716. funded by Institut Teknologi Sepuluh Nopember (ITS) under [16] C. Zhu, C. U. Idemudia, and W', '. This data manifested as digital signals, oxygenates necessitating extraction for statistical parameter derivation. others Subsequently, the dataset was inputted into various classification algorithms for predictive outcomes. Assessment of the classification outcomes ensued to ascertain the efficacy the observed samples. To improve the electronic nose system and performance of the employed methodologies and monitoring of selected samples, the selection of proper gas parameters[24]', '. I. Sabilla, D. R. Wijaya, D. Sunaryono, and C. Fatichah, approachesfortomatojuices,’’ChemometricIntell.Lab.Syst.,vol.133, ‘‘Electronicnosedatasetforporkadulterationinbeef,’’DataBrief,vol.32, pp.17–24,Apr.2014. Oct.2020,Art.no.106139. [22] S.D.Rodríguez,D.A.Barletta,T.F.Wilderjans,andD.L.Bernik,‘‘Fast [45] F.Pedregosa,G.Varoquaux,A.Gramfort,V.Michel,B.Thirion,O.Grisel, and efficient food quality control using electronic noses: Adulteration M. Blondel, P. Prettenhofer, R. Weiss, V. Dubourg, and J']","The electronic nose has been widely applied in various fields, including the classification of health conditions such as asthma (Referensi 1).","with the following formula: TP + TN TP + TN + FP + FN Accuracy = Precision = Recall/True Positive Rate(TPR) TP TP + FP TP TP + FN F1 = 2 × precision × recall precision + recall FP TN + TP (cid:90) 1 TPRd(FPR) False Positive Rate(FPR) = AUC = (4) (5) (6) (7) (8) (9) where TP is the number of correctly predicted positive labels, TN is the number of correctly predicted negative labels, FP is the number of incorrectly predicted positive labels, and FN is the number of incorrectly predicted negative labels. Accuracy is the ratio of true predictions to the overall data. Precision is the ratio between TP to the total number of positive predic-",0.6666666666666666,0.9053902277752153
"presented a novel multi-head attention mechanism that uses various atten- tion functions to capture diverse contextual elements. The multi-head attention approach allows attention to be simul- taneously allocated to information from different subspaces and representational positions. In contrast to soft attention, which focuses attention softly on the entire input to produce a context representation with weights determined based on the relevance of each part of the input, soft attention relies on only one attention mechanism. Kumar et al. developed the multi-head attention- based BiLSTM (MHA-BiLSTM) model. The results are quite promising compared to the use of single-head attention. How- ever, using the BiLSTM model is computationally expensive, especially when dealing with large datasets . BiLSTM is also prone to overfitting,","['. We trained the models using 540k sentence pairs from BiLSTM can accommodate sequence information, which SNLI Indo. Based on our model, we made the following is then used by multi-head attention to learn information adjustments: 1) Replacing Multi-Head Attention with Self- from various dimensions and subspace representations, Attention. We replaced the multi-head attention activation fully capturing long-distance text features', '. performance. While multi-head attention is effective in capturing long-range dependencies and global contextual C', '. Consequently, functionwiththeself-attentionmethod.2)RemovingMulti- the combination of BiLSTM and multi-head attention Head Attention. We removed the multi-head attention and complements each other. Enhances the model’s ability to employedonlysoftalignmentattentioninthematchinglayer', '. The individual matching mechaThe total training time for Indo-BiEnt on the full 540k nism, combined with circular padding, further enhances the dataset was 1,558 seconds per epoch, which is significantly performance of the BiLSTM network, while the multi-head faster than IndoBERT and comparable to or faster than attentionmechanismfacilitatesmoretargetedrepresentation ESIM (which required 2,140 seconds per epoch in our learning by assigning greater focus to salient syntactic', '. attention heads with 96 as the dimension for each head and Precision,Recall,andF1scoreareusedastheevaluation 7https://fastnlp.readthedocs.io/ metrics after counting the true positive (TP), false positive 3268 VOLUME11,2023']","The multi-head attention mechanism is effective in capturing long-range dependencies and global contextual information (Kumar et al., 2023).","Based on the results presented in Table 3, the multi-head attention module positively impacts the model’s performance. When multi-head attention in our proposed model is replaced with self-attention, the testing accuracy drops from 79% to 71%. Furthermore, if we remove the attention component in the aggregation layer and only use soft alignment attention in the matching layer, the testing accuracy is 72%. In the last experiment, we used only BiLSTM for inference composition, which resulted in a test accuracy of 71%. These results provide evidence that the absence of the multi-head attention module can decrease the model’s performance. While multi-head attention is effective in capturing long-range dependencies and global contextual information, it tends to be less adept at modeling sequential",0.6666666666666666,0.9152803490292754
"rate (FPR) across various clas- sification thresholds. The horizontal axis of an ROC graph represents the FPR, which indicates the proportion of neg- ative instances misclassified as positive. In contrast, the vertical axis represents the TPR, which measures the model’s effectiveness in correctly classifying positive instances. The ROC curves demonstrated that the MHA-CovBi model dis- played exceptional efficacy, achieving an area under the curve (AUC) value of 0.96 for the DS1 dataset and 0.94 for the DS2 dataset, which are both significantly high values that are close to the perfect value of 1.0 and well above the value of 0.5 which indicates random performance. These values indicate that the MHA-CovBi model shows a high discriminatory ability in differentiating between positive","['. Additionally, we add interpretability to the (CNN)andlongshort-termmemory(LSTM)toimprovethe modelsothatitsdevelopmentandresultsaretransparentand detection accuracy for binary and multi-class settings [16]. trustworthy. AsdescribedinSectionIV-A,thedatasetusedinthispaperis imbalanced.Inthiscase,SectionIII-Bdiscussestheapproach tohandlethisimbalance', '. Classificationnetworkstackedarchitecture. TP+TN Accuracy= (2) TP+TN +FP+FN connected layers. The layers are stacked together, formu- whereTP,TN,FP,andFNaretruepositives,truenegatives, lating a sequential model as a combination of convolution, falsepositives,andfalsenegatives.Theprecisionandrecall max-pooling, and dropout layers several times to infer the arethenevaluated,asshowninEq.3and4,respectively', '. We used transformer- balanced classification performance, with a gap of approxibased methods to demonstrate performance both in terms mately2%betweenthehighestandlowestclassaccuracies. ofaccuracyandprocessingtime,comparedtoourproposed Notably,theneutralclasswhichisoftenthemostchallenging method', '. andcomputernetworks. [50] S.Das,S.S.Mullick,andI.Zelinka,‘‘Onsupervisedclass-imbalanced Prof.AhmadisamemberofACM.Hisawardsandhonorsincludethe learning:Anupdatedperspectiveandsomekeychallenges,’’IEEETrans. Artif.Intell.,vol.3,no.6,pp.973–993,Dec.2022. Hitachi Research Fellowship and the JICA Research Program to conduct [51] S.Silalahi,T.Ahmad,andH.Studiawan,‘‘DroNER:Datasetfordrone researchinJapan.Heisareviewerofanumberofjournals. namedentityrecognition,’’DataBrief,vol.48,Jun.2023,Art.no.109179. [52] I', '. As an alternative to the figures in this paper are made publicly available on handle class imbalance, Focal loss consistently improved GitHub to promote transparent, reproducible, and verifiable the baseline models’ performance. This paper exposes that research. VOLUME13,2025 105377']",,"the ROC curve, we could see the ability of the model to separate true positive and true negative cases. In ROC, True Positive Rate (TPR) was compared to False Positive Rate (FPR). The proposed stacked DNN model had the best performance compared to the DNN base-models and produced an AUC score of 0.981. Tested DNN models produced lower AUC than the proposed stacked DNN as shown in Fig. 9. Based on the confusion matrix in Table 8, tested DNN models had a higher number of FN than stacked DNN. Hav- ing a small number of FN was signiﬁcant because incorrectly identifying the positive class (sick) to negative class (healthy) can cause the patient not to obtain the proper treatment and",0.0,0.0
"pre-cancers , gastric cancer lesions , and cervical squamous intraepithelial lesions . The choice between one-stage and two-stage object detec- tion models depends heavily on the specific demands of the task, particularly in medical imaging contexts such as colorectal cancer (CRC), squamous cell carcinoma (SCC), gastric lesions, and polypoid lesions. One-stage detectors, such as YOLO and SSD, excel in speed and computational efficiency, making them ideal for real-time applications. For instance, YOLOv5 demonstrated remarkable performance in CRC detection with nearly perfect metrics—precision (99.071%), recall (98.064%), and mAP (98.8%)—allowing clinicians to analyze colonoscopy videos efficiently during live procedures . SSD also performed well in CRC detection, achieving precision (90.42%) and recall (91.32%), though its mAP (87.5%) was slightly lower than YOLO-","['. PC dataset shows a significant improvement in results Deep learning-based object detection models, such as You compared to models trained without pre-trained weights. Only Look Once (YOLO), have shown significant advancements in various object detection applications, Keywords—peritoneal carcinomatosis, YOLOv8, fine-tuned, including in the medical field', '. Next, we fine-tuned this model on our research dataset consisting of laparoscopic images to adapt (4) the model to the specific characteristics of peritoneal TP is the number of lesions that are correctly detected carcinomatosis', '. J Radiol, vol. 93, no. 1113, p. 20200401, Sep. 2020, doi: [25] C.-Y. Wang, A. Bochkovskiy, and H.-Y. M. Liao, “YOLOv7: 10.1259/bjr.20200401. Trainable bag-of-freebies sets new state-of-the-art for real-time [5] A. Dohan et al., “Evaluation of the peritoneal carcinomatosis index object detectors,” Jul. 06, 2022, arXiv: arXiv:2207.02696. Accessed: with CT and MRI,” British Journal of Surgery, vol. 104, no. 9, pp. Jun. 03, 2024. [Online]. Available: http://arxiv.org/abs/2207.02696 1244–1249, Jul', '. Experimental results show that the YOLOv8m enhance detection and diagnostic results. model performs the best, with a mean Average Precision (mAP50) of 0.871, precision of 0.893, recall of 0.785, and an F1 In the era of medical digitization, automated methods for score of 0.84. The use of fine-tuned pre-trained weights on the medical image analysis are becoming increasingly relevant', '. Early Imaging) [5] and many others. detection of this disease is crucial for improving patient Timely detection and diagnosis of PC are crucial for survival chances. This study utilizes the YOLOv8 model to detect PC using a dataset of 4,197 laparoscopy images. planning effective treatment and improving patient survival YOLOv8 was chosen for its capability in fast and accurate chances [6]. However, manual detection of PC from object detection']","The YOLOv8m model achieved a mean Average Precision (mAP50) of 0.871, precision of 0.893, and recall of 0.785 in detecting peritoneal carcinomatosis, demonstrating its effectiveness in medical imaging contexts (Wang et al., 2020).","improved speed, accuracy, and effi- ciency . Among these, the YOLO (You Only Look Once) algorithms are frequently preferred due to their bal- ance between accuracy and speed, making them particularly VOLUME 13, 2025 23619 A. D. Sanjaya et al.: RNA-BioLens: A Novel Raspberry Pi-Based Digital Microscope With Image Processing suitable for applications like medical image analysis, where rapid and accurate detection is essential. For example, Fatichah et al. evaluated the performance of three popu- lar detection methods: You Only Look Once v4 (YOLOv4), You Only Look Once v5 (YOLOv5), and Mask Region-based Convolutional Neural Network (Mask R-CNN) in classifying ALL types. Their findings showed that YOLOv4 achieved the highest mean Average Precision (mAP) at 93.2%, followed by YOLOv5 at",0.8,0.9253836631092732
"represents a significant challenge in devel- oping deep learning-based lesion detection models. Various forms of bias, including category imbalance, biases stem- ming from dataset sources, inconsistencies in annotation 1) CATEGORY IMBALANCE IN DATASETS Category imbalance is a recurring issue that can affect a model’s ability to accurately detect minority classes. For instance, the SSPH_WL dataset in highlights an uneven distribution, where adenomas (1048) are significantly more prevalent compared to polyps (381) and cancers (280). This VOLUME 13, 2025 43547 N. Rochmawati et al.: Deep Learning-Based Lesion Detection in Endoscopy: A Systematic Literature Review study mitigated the imbalance by employing LSDA-Loss, which prioritizes minority categories using prior probabili- ties, demonstrating an effective strategy for addressing this challenge. Similarly, the KID dataset",['nan'],,"while false positives were observed for normal cases with overlapping features or imaging artifacts. These errors are likely due to the imbalanced dataset, which predominantly consists of normal or frequently occurring abnormalities, limiting the model's ability to generalize to less common cases. To evaluate the model’s ability to detect rare abnormalities, we analyzed performance on a subset of low- frequency labels as shown in Table V. Results indicate that while overall precision remains high, recall for these classes is lower (e.g., 0.62 for Cardiomegaly vs. 0.81 average), confirming the effect of class imbalance. Incorporating targeted sampling or multi-label loss re-weighting could help address this in future work. TABLE V PERFORMANCE ON RARE ABNORMALITIES Abnormality Cardiomegaly Pneumothorax Pulmonary Edema Aortic Enlargement",0.0,0.0
"a ratio of 70-15-15, this study aims to compare respectively. The splitting process was carefully conducted to ensure a balanced class distribution and to avoid any selective tendencies in each data subset. This balanced distribution helps prevent biases in the model's training process and ensures that it learns effectively from all classes of data. The object detection model was trained using the training data, tested using the testing data, and validated using the validation data. The size of the dataset and the split sizes for each dataset are presented in Table I. This research focuses on leveraging the latest YOLO (You Only Look Once) object detection model, specifically YOLOv8, renowned for its exceptional speed and accuracy. The choice of YOLOv8","['. This study chose to adopt EfficientNetV2-S, the baseline architecture from this family, due to computational resource reasons to construct a smaller model while still maintaining model performance. The EfficientNetV1 family is the backbone of the EfficientDet family, which has achieved state-of-the-art results on object detection challenges. C. Model Evaluation Evaluation Metrics used in this study to evaluate model performance are precision, recall, and F1 Score', '. If the FPS is too low, NVIDIAAGXOrin(embeddededgedevice2).Thisindicates issues such as blurring or frame loss may occur, reducing that altering the batch size and optimizer hyperparameters detection accuracy. Therefore, a lightweight YOLOv7-tiny canimprovesystemperformance(mAP,recall,andF1score) modelisnecessarytoachieveabalancebetweenaccuracyand whilealsoreducinginferencetime.Inferencetimeforsmaller speed in object detection', '. 𝐼𝑜𝑈= 𝐴𝑟𝑒𝑎 𝑜𝑓 𝑂𝑣𝑒𝑟𝑙𝑎𝑝 (4) MobileNetV3 and EfficientNetV2 prioritize efficiency and 𝐴𝑟𝑒𝑎 𝑜𝑓 𝑈𝑛𝑖𝑜𝑛 accuracy, but they achieve this through different The metric mean Average Precision (mAP) is architectural choices. MobileNetV3 enhances the previous introduced in COCO dataset evaluation metrics and is version with squeeze-and-excitation layers and h-swish widely used in object detection studies as a benchmark for non-linearity [18], while EfficientNetV2 focuses on evaluating and comparing model performance', '. weights, some predictions are incorrect, leaving some lesions [7] A. Wang et al., “YOLOv10: Real-Time End-to-End Object undetected and not well predicted. For future research, other Detection,” May 23, 2024, arXiv: arXiv:2405.14458. doi: large datasets besides COCO, such as ImageNet or other 10.48550/arXiv.2405.14458. datasets, can be used to obtain pretrained weights that can be [8] “Sensors | Free Full-Text | UAV-YOLOv8: A Small-Objectfine-tuned into our dataset', '. 10.1016/j.sbsr.2022.100492 [6] R. Girshick, J. Donahue, T. Darrell, and J. Malik, ""Rich Feature [24] D. Bolya, S. Foley, J. Hays, and J. Hoffman, ""TIDE: A General Hierarchies for Accurate Object Detection and Semantic Toolbox for Identifying Object Detection Errors."" arXiv, Aug. 31, Segmentation"", doi: 10.1109/CVPR.2014.81. 2020. Accessed: May 12, 2024. [Online]. Available: [7] R. Girshick, ""Fast R-CNN."" arXiv, Sep. 27, 2015. doi: http://arxiv.org/abs/2008.08115 10.48550/arXiv.1504.08083. [8] S. Ren, K']","The YOLOv8 model's performance can be affected by the quality of the pretrained weights, which may result in some predictions being incorrect and leaving certain objects undetected (Wang et al., 2024).","tracked in each subsequent frame, enhancing processing efficiency and speed. The detection algorithm always begins the search from the start, where the filter response is evaluated, and the maximum value per frame (frames/second) is used to determine the target position. The use of keyframes simplifies the processing and analysis of video by reducing the number of frames, thus saving time and computational complexity. Keyframe extraction minimizes redundancy and improves efficiency, as processing focuses only on essential information. B. Object Detection Object detection using YOLOv8 based on deep learning is chosen in this study due to its efficient one-stage detection approach, which enhances both accuracy and speed. With the anchor-free version, the model can directly predict the center of objects, making",0.5,0.8955421066805173
". This integration can also enable real-time monitoring and detection of potential risks, allowing organizations to proactively address issues and ensure regulation adherence. III. METHODOLOGY III. METHODOLOGY This research uses quantitative methods to investigate the integration of AI in IT governance. It uses COBIT 2019 guidelines as an initial analysis, then extends to further analyze common factors causing delays in software development projects. The analysis identifies variables that cause problems in software development projects and then extends them with machine learning algorithms using feature engineering. This method helps understand the factors influencing project outcomes for better decision-making in IT service delivery. The proposed methodology will utilize machine learning techniques to optimize project completion time. By utilizing machine learning algorithms, the",['nan'],,"assist organizations in managing and optimizing their use of information technology (IT) . landscape, effective IT In today’s rapidly evolving digital governance is essential for organizations to ensure that their IT investments align with business objectives, comply with regulations, and mitigate risks . COBIT 2019 provides a structured approach for organiza- tions to establish, implement, and maintain effective gover- nance over IT. It defines the components necessary to create and sustain a governance system, as well as guidelines for building the most suitable governance system for an enterprise . By utilizing COBIT 2019, organizations can enhance the efficiency, effectiveness, and reliability of their IT usage, while also ensuring compliance with relevant regulations, policies, and standards . One of the key",,0.0
"weekly. In addition, use the AcMAPE score as a loss function to create a stock price forecasting model. VI. CONCLUSION AND FUTURE WORKS VI. CONCLUSION AND FUTURE WORKS In this paper, we presented quantifying multi-aspect news sentiment with considered time sequence data and then forecasting stock prices next days using sentiment and technical indicators. In feature extraction, a daily confidence score from the classification model is used to quantify sentiment. The active learning model produced a monthly classification model to represent model knowledge. The Transformer Encoder Gated Recurrent Unit (TEGRU) out- performed another Transformer architecture for stock price forecasting on eight stock issuers. The TEGRU model consists of the transformer encoder to learn time series pattern data with multi-head attention","['. The daily stock issuer sentiment score decoder output projection, followed by a linear layer for a using the mean sentiment score on each day trading, if not predicted stock price. FormerLSTM utilizes decoder output found,filledwithzerovalue.Thedailystockissuersentiment topredictstockpriceonestepaheadusingconsecutivelayers: score can be combined with stock transaction history. The LSTMlayer,dropoutlayer,andlinearlayer', '. news title, calculate the daily stock issuer sentiment score Vanilla Transformer uses a linear layer to predict stock basedonaspectcategoryandsentimentpolarity.Thenegative price one day ahead using a decoder output projection. The sentiment has a negative value, and the positive sentiment FormerGRU uses a GRU layer and a dropout layer for has a positive value', '. However, the vanilla Transformer and MWRE@0.75 to determine the best architectures and was more effective in reducing significant errors, with an features in stock price forecasting. As shown in Table. 12, MSE of 4,870.30382. Our combined TKAN variant and pTKANwithoutdailyABSAsentimentscoreoutperformed TransformerEncoderarchitecturefailedtolearnthedataset, the other scenario, except in BBRI and BBCA stock showingtheworstMSEandMWRE. issuer', '. UNIFIEDSTOCKPRICEFORECASTING word representation based on aspect category, sentiment The R2, MAE, MSE, sMAPE, F1, and MWRE@0.75 are polarity,andopinionterm. used to evaluate unified stock price forecasting. The The predicted aspect-sentiment quadruplet is evaluated MWRE@0.75 means the MWRE evaluation method using using generative methods, which are BLUE, ROUGE-1, α 0.75 to emphasize movement direction error', '. DigitalObjectIdentifier10.1109/ACCESS.2024.3506658 Permuted Temporal Kolmogorov-Arnold Networks for Stock Price Forecasting Using Generative Aspect-Based Sentiment Analysis AGUSTRIHARYONO 1,2,RIYANARTOSARNO1,(SeniorMember,IEEE), RATIHNURESTIANGGRAINI1,(Member,IEEE), ANDKELLYROSSASUNGKONO 1,(Member,IEEE) 1DepartmentofInformatics,InstitutTeknologiSepuluhNopember,Surabaya60111,Indonesia 2DepartmentofInformatics,UniversitasMulawarman,Samarinda75119,Indonesia']","The daily stock issuer sentiment score can be combined with stock transaction history to enhance stock price forecasting models (Agustriharyono et al., 2024).","using the mean sentiment score on each day trading, if not found, filled with zero value. The daily stock issuer sentiment score can be combined with stock transaction history. The illustration of the final dataset in the form of panel data is shown in Table. 2. D. FORECASTING MODELS D. FORECASTING MODELS This sub-section presents modified Transformer architec- ture, which are Transformer GRU (FormerGRU), Trans- former LSTM (FormerLSTM), Transformer Encoder GRU (TEGRU), and Transformer Encoder LSTM (TELSTM). Modified Transformer was chosen because TEGRU outper- formed other Transformer variants, such as vanilla Trans- former, Informer, FEDformer, and Transformer Encoder in stock price forecasting . This research proposes permuted Temporal Kolmogorov-Arnold Networks (pTKAN) architec- ture to develop a unified stock forecasting model",0.3333333333333333,0.9350364647694875
"of the dataset, the experimental scenarios, the pro- posed methodology, and the evaluation. Section IV describes the results of experimental research compared to previous studies on both intra-subject and inter-subject validation. Part 5 is the conclusion. II. RELATED WORK II. RELATED WORK Research related to emotion recognition using the DEAP open-source repositories attempts to improve performance accuracy. Intra-subject research has been carried out in many previous studies and obtained accuracy rates above 90%, even up to 99%. According to the existing research, intra- subject accuracy measures are superior to inter-subject accu- racy measures. In inter-subject research, the work is still very rare, resulting in poor performance, using a large number of channels, and often using a very deep architecture for","['. Reference [31] introduces a subject-independent sis,themodelemploystwoadditionalvalidationtechniques, or cross-subject approach with Inception-V3 CNN achiev- namely random split, and leave-one-out subject. The archiing accuracies of average 90.7%. Reference [60] presents tecture proposed in this research was validated using the BiSMSM for EEG-based emotion recognition, achieving publiclyavailableDEAPdataset.Thedependentsubjectand 63.10% to 61.89% accuracy', '. ABSTRACT Emotion recognition based on EEG has been implemented in numerous studies. In most of them, there are two observations made: first, extensive implementation is negatively associated with the performed validation. Cross-subject validation is more difficult than subject-dependent validation due to thehighvariabilitybetweenEEGrecordingscausedbydomainshifts.Second,alargenumberofchannels requires extensive computation', '. Luo and B.-L. Lu, ‘‘EEG data augmentation for emotion recogni- neuralnetworkforEEGemotionrecognition,’’Neurocomputing,vol.448, tion using a conditional Wasserstein GAN,’’ in Proc. 40th Annu. Int. pp.140–151,Aug.2021,doi:10.1016/j.neucom.2021.03.105. Conf.IEEEEng.Med.Biol.Soc.(EMBC),Jul.2018,pp.2535–2538,doi: [57] S. Bhosale, R. Chakraborty, and S. K. Kopparapu, ‘‘Calibration free 10.1109/EMBC.2018.8512865', '. DigitalObjectIdentifier10.1109/ACCESS.2023.3322294 Cross-Subject Channel Selection Using Modified Relief and Simplified CNN-Based Deep Learning for EEG-Based Emotion Recognition LIAFAROKHAH1,2,RIYANARTOSARNO 1,(SeniorMember,IEEE), ANDCHASTINEFATICHAH 1,(Member,IEEE) 1DepartmentofInformatics,FacultyofIntelligentElectricalandInformaticsTechnology,InstitutTeknologiSepuluhNopember(ITS),Surabaya60111,Indonesia', '. These selected channels are then subjected to the EEG-based emotion recognition model (AP-CapsNet) with Morlettransform,transformingthedatainto2Dimagesthat subject-dependent and cross-subject experiments, achiev- effectivelyencapsulateintricatetemporalandspectralinforing high accuracies of 62.7% and 63.51% in valence and mation.Subsequently,employingasimplifieddeeplearning arousal class']","The proposed model utilizes additional validation techniques and was validated using the DEAP dataset, achieving accuracies of average 90.7% in cross-subject emotion recognition (Farokhah et al., 2023).","Subsequently, employing a simplified deep learning architecture, we conduct a precise classification task, cate- gorizing emotional states into valence and arousal groups. For dependent subject and cross-subject performance analy- sis, the model employs two additional validation techniques, namely random split, and leave-one-out subject. The archi- tecture proposed in this research was validated using the publicly available DEAP dataset. The dependent subject and cross-subject validation portions of the emotional validation VOLUME 11, 2023 110139 TABLE 2. Recent articles on deep learning for EEG classification. L. Farokhah et al.: Cross-Subject Channel Selection TABLE 3. DEAP dataset attributes. FIGURE 1. Proposed research framework. experiment using EEG are separated into two segments. The general proposed research framework order is depicted in Fig. 1. A.",0.75,0.9638597452575175
". The 2D frame sequence research that has used training with various subjects is Chao’s research, which pro- duces 68.28% and 66.73% valence and arousal accuracy performances, respectively. Some inter-subject studies based on 2D images have lower performance measures. Pandey and Seeja researched 2D images of scalograms using 32 channels and frontal channels in the valence and arousal classes . The accuracy perfor- mance obtained for valence and arousal is 59% and 58%, respectively, while with the frontal channel, the accuracy performance is 61% for the valence class and 58% for the arousal class. Another study used the Inception Resnet-V2 architecture for positive and negative emotion classes . These emotions, transformed into the DEAP dataset, are called valence classes. The","['. In [59], MTLFuseNet combines VAE and architecture, we conduct a precise classification task, cateGCN/GRUforEEG-basedemotionrecognition,outperform- gorizing emotional states into valence and arousal groups. ing state-of-the-art methods with accuracies of 71.33% to Fordependentsubjectandcross-subjectperformanceanaly73.28%', '. These selected channels are then subjected to the EEG-based emotion recognition model (AP-CapsNet) with Morlettransform,transformingthedatainto2Dimagesthat subject-dependent and cross-subject experiments, achiev- effectivelyencapsulateintricatetemporalandspectralinforing high accuracies of 62.7% and 63.51% in valence and mation.Subsequently,employingasimplifieddeeplearning arousal class', '. 10.1016/j.patrec.2022.08.018. [26] L. Farokhah, R. Sarno, and C. Fatichah, ‘‘Simplified 2D CNN archi[7] A.J.Bidgoly,H.J.Bidgoly,andZ.Arezoumand,‘‘Asurveyonmethods tecture with channel selection for emotion recognition using EEG andchallengesinEEGbasedauthentication,’’Comput.Secur.,vol.93, spectrogram,’’ IEEE Access, vol. 11, pp.46330–46343, 2023, doi: Jun.2020,Art.no.101788,doi:10.1016/j.cose.2020.101788. 10.1109/ACCESS.2023.3275565. 110148 VOLUME11,2023', '. Thirdly, and 96.7% valence and arousal class accuracy, respectively. they combined DCERNET and SVM to achieve 88.10% These papers collectively contribute diverse approaches to valence class performance. Farokhah et al. [26] integrated EEG-basedemotionrecognition,eachdemonstratingpromisthe development of a simplified CNN architecture, the best ing results in addressing various challenges', '. Reference [31] introduces a subject-independent sis,themodelemploystwoadditionalvalidationtechniques, or cross-subject approach with Inception-V3 CNN achiev- namely random split, and leave-one-out subject. The archiing accuracies of average 90.7%. Reference [60] presents tecture proposed in this research was validated using the BiSMSM for EEG-based emotion recognition, achieving publiclyavailableDEAPdataset.Thedependentsubjectand 63.10% to 61.89% accuracy']","The EEG-based emotion recognition model (AP-CapsNet) utilizes selected channels and transforms the data into 2D images, achieving high accuracies of 62.7% and 63.51% in valence and arousal classes, respectively.","81.27% and 82.37% for valence and arousal clas- sifications . Pandey and Seeja used frontal lobe channel to channel selection with accuracy on valence and arousal around 50% until 60% . Reference used best single collaboration with confusion matrix as an indicator for chan- nel selection with accuracy on valence and arousal around 92%. The application of reduction channels for cross-subject classification has not been thoroughly investigated. Addition- ally, the result can be enhanced. A summary of the existing articles on channel selection has been presented in Table 1. Some cross-subject studies are based on 2D or 3D forms with 32 channels. Yin et al. presented a 3D cube ECLGCNN that was based on graphs and had 84% accu- racy",1.0,0.9357133986412751
"accuracy performance is 61% for the valence class and 58% for the arousal class. Another study used the Inception Resnet-V2 architecture for positive and negative emotion classes . These emotions, transformed into the DEAP dataset, are called valence classes. The performance obtained is 72.81%. Furthermore, the highest performance for inter-subjects research currently available is obtained by using a spec- trogram with the DenseNet-121 and DCERNET architec- tures, which only provide performance details on the valence class . The performance of the valence class using Densenet-121 is 85.57%, while the performance of the valence class using DCERNET and softmax is 88.57%, and DCERNET and SVM is 88.10%. In addition, the valida- tion of inter-subject emotions using the 2D frame sequences resulted","['. tion [27]. First, using a spectrogram in conjunction with Reference[54]introducesanautomatedcross-subjectframethe DenseNet-121 architecture yields performance in the work with impressive accuracies of 83.9% to 84.3%. Our 85.57% valence class. In a second experiment, they collab- recent paper Farokhah et al. [26] proposed a simplified orated on DCERNET architectures and Softmax to achieve CNNandspectrogramwith32channelsthatachieve98.3% a valence class performance of 88.57 percent', '. These selected channels are then subjected to the EEG-based emotion recognition model (AP-CapsNet) with Morlettransform,transformingthedatainto2Dimagesthat subject-dependent and cross-subject experiments, achiev- effectivelyencapsulateintricatetemporalandspectralinforing high accuracies of 62.7% and 63.51% in valence and mation.Subsequently,employingasimplifieddeeplearning arousal class', '. Thirdly, and 96.7% valence and arousal class accuracy, respectively. they combined DCERNET and SVM to achieve 88.10% These papers collectively contribute diverse approaches to valence class performance. Farokhah et al. [26] integrated EEG-basedemotionrecognition,eachdemonstratingpromisthe development of a simplified CNN architecture, the best ing results in addressing various challenges', '. In [59], MTLFuseNet combines VAE and architecture, we conduct a precise classification task, cateGCN/GRUforEEG-basedemotionrecognition,outperform- gorizing emotional states into valence and arousal groups. ing state-of-the-art methods with accuracies of 71.33% to Fordependentsubjectandcross-subjectperformanceanaly73.28%', '. Reference [31] introduces a subject-independent sis,themodelemploystwoadditionalvalidationtechniques, or cross-subject approach with Inception-V3 CNN achiev- namely random split, and leave-one-out subject. The archiing accuracies of average 90.7%. Reference [60] presents tecture proposed in this research was validated using the BiSMSM for EEG-based emotion recognition, achieving publiclyavailableDEAPdataset.Thedependentsubjectand 63.10% to 61.89% accuracy']","The performance of the valence class using DCERNET and SVM is reported to be 88.10% (Farokhah et al., 2023).","72.81% . Using 2D frame sequences and BiDCNN, Huang et al. achieved 68% valence accuracy and 63% arousal accu- racy . Another study used a matrix sequence-based 110138 VOLUME 11, 2023 L. Farokhah et al.: Cross-Subject Channel Selection TABLE 1. Summary of the channel selection approaches. meta-learner with a class performance of 69.92% for valence and 68.89% for arousal . Pusarla et al. conducted three experiments simultaneously on cross-subject valida- tion . First, using a spectrogram in conjunction with the DenseNet-121 architecture yields performance in the 85.57% valence class. In a second experiment, they collab- orated on DCERNET architectures and Softmax to achieve a valence class performance of 88.57 percent. Thirdly, they combined DCERNET and SVM to achieve 88.10% valence",0.5,0.9475962183870125
"the valence class using Densenet-121 is 85.57%, while the performance of the valence class using DCERNET and softmax is 88.57%, and DCERNET and SVM is 88.10%. In addition, the valida- tion of inter-subject emotions using the 2D frame sequences resulted in 68% and 63% accuracy on valence and arousal, respectively . Non-2D research, such as the use of 3D meta-learners, yields valence and arousal performance of 69.92% and 68.89%, respectively . Research on 3D cubes with inter-subjects has been carried out with valence and arousal performances of 84% and 85% . Based on pre- vious studies, it is concluded that the highest accuracy per- formance in the valence class is 88.57% and the arousal class is 85%. Previous inter-subject research","['. In [59], MTLFuseNet combines VAE and architecture, we conduct a precise classification task, cateGCN/GRUforEEG-basedemotionrecognition,outperform- gorizing emotional states into valence and arousal groups. ing state-of-the-art methods with accuracies of 71.33% to Fordependentsubjectandcross-subjectperformanceanaly73.28%', '. Thirdly, and 96.7% valence and arousal class accuracy, respectively. they combined DCERNET and SVM to achieve 88.10% These papers collectively contribute diverse approaches to valence class performance. Farokhah et al. [26] integrated EEG-basedemotionrecognition,eachdemonstratingpromisthe development of a simplified CNN architecture, the best ing results in addressing various challenges', '. These selected channels are then subjected to the EEG-based emotion recognition model (AP-CapsNet) with Morlettransform,transformingthedatainto2Dimagesthat subject-dependent and cross-subject experiments, achiev- effectivelyencapsulateintricatetemporalandspectralinforing high accuracies of 62.7% and 63.51% in valence and mation.Subsequently,employingasimplifieddeeplearning arousal class', '. Reference [31] introduces a subject-independent sis,themodelemploystwoadditionalvalidationtechniques, or cross-subject approach with Inception-V3 CNN achiev- namely random split, and leave-one-out subject. The archiing accuracies of average 90.7%. Reference [60] presents tecture proposed in this research was validated using the BiSMSM for EEG-based emotion recognition, achieving publiclyavailableDEAPdataset.Thedependentsubjectand 63.10% to 61.89% accuracy', '. S(i)←max_index(R) 7. discard(max_index(R)) 8. End The outcomes are rendered as high-valence, low-valence, orhigh-arousal,low-arousal. The following simulation parameters have been adopted D. ARCHITECTUREFORCLASSIFICATION for carrying out the training and evaluation of the model as Afterthe1Dto2DEEGtransformationgeneratesa2DEEG presentedinTable5. scalogram, the scalogram will be used as input for classification using deep learning. This study applies streamlined E']","The combination of DCERNET and SVM achieved an accuracy of 88.10% in the valence class (Farokhah et al., 2023).","72.81% . Using 2D frame sequences and BiDCNN, Huang et al. achieved 68% valence accuracy and 63% arousal accu- racy . Another study used a matrix sequence-based 110138 VOLUME 11, 2023 L. Farokhah et al.: Cross-Subject Channel Selection TABLE 1. Summary of the channel selection approaches. meta-learner with a class performance of 69.92% for valence and 68.89% for arousal . Pusarla et al. conducted three experiments simultaneously on cross-subject valida- tion . First, using a spectrogram in conjunction with the DenseNet-121 architecture yields performance in the 85.57% valence class. In a second experiment, they collab- orated on DCERNET architectures and Softmax to achieve a valence class performance of 88.57 percent. Thirdly, they combined DCERNET and SVM to achieve 88.10% valence",0.5,0.9168155343788128
"uses the old method, which is based on the brain area. Yin et al. conduct channel selection for inter-subject classification by developing locally-robust feature selection (LRFS) with approximately 60% accuracy performance for valence and arousal classes . Arjun et al. used the attention channel for inter-subject classification, collaborating LSTM and autoencoder, and achieved accuracy rates of 65.9% and 69.5% for valence and arousal classes, 46332 VOLUME 11, 2023 L. Farokhah et al.: Simplified 2D CNN Architecture With Channel Selection for Emotion Recognition respectively . Yang et al. used ReliefF and random forest to select the best 10 channels and 11 channels for intra-subject and inter-subject classification, with inter-subject perfor- mance results of 81.27% and 82.36% in valence and arousal classes","['. DigitalObjectIdentifier10.1109/ACCESS.2023.3322294 Cross-Subject Channel Selection Using Modified Relief and Simplified CNN-Based Deep Learning for EEG-Based Emotion Recognition LIAFAROKHAH1,2,RIYANARTOSARNO 1,(SeniorMember,IEEE), ANDCHASTINEFATICHAH 1,(Member,IEEE) 1DepartmentofInformatics,FacultyofIntelligentElectricalandInformaticsTechnology,InstitutTeknologiSepuluhNopember(ITS),Surabaya60111,Indonesia', '. First, this study into studies focused racy in the valence class and 85% accuracy in the arousal on channel selection methods within EEG signals using the class. Pandey and Seeja conducted research using CNN DEAP dataset, encompassing a diverse array of techniques architecture, achieving 59% and 59% accuracy for valence aimedatisolatingthemostinformativechannelsforemotion and arousal, respectively [28]. Using Inception Resnet-V2, analysis', 'L.Farokhahetal.:Cross-SubjectChannelSelection preponderanceofthepowerbandratioviathereliefmethod. [8] M.N.Munawar,R.Sarno,D.A.Asfani,T.Igasaki,andB.T.Nugraha, Third, collaboration of scalogram, PR-Relief for channel ‘‘Significant preprocessing method in EEG-based emotions classification,’’ J. Theor. Appl. Inf. Technol., vol. 87, no. 2, pp.176–190, selection, and simplified CNN for classification have pro2016. posed. In the proposed channel selection, the number of [9] Y. Wu, M. Xia, L. Nie, Y. Zhang, and A', '. These selected channels are then subjected to the EEG-based emotion recognition model (AP-CapsNet) with Morlettransform,transformingthedatainto2Dimagesthat subject-dependent and cross-subject experiments, achiev- effectivelyencapsulateintricatetemporalandspectralinforing high accuracies of 62.7% and 63.51% in valence and mation.Subsequently,employingasimplifieddeeplearning arousal class', '. 10.1016/j.patrec.2022.08.018. [26] L. Farokhah, R. Sarno, and C. Fatichah, ‘‘Simplified 2D CNN archi[7] A.J.Bidgoly,H.J.Bidgoly,andZ.Arezoumand,‘‘Asurveyonmethods tecture with channel selection for emotion recognition using EEG andchallengesinEEGbasedauthentication,’’Comput.Secur.,vol.93, spectrogram,’’ IEEE Access, vol. 11, pp.46330–46343, 2023, doi: Jun.2020,Art.no.101788,doi:10.1016/j.cose.2020.101788. 10.1109/ACCESS.2023.3275565. 110148 VOLUME11,2023']",Farokhah et al. achieved accuracies of 62.7% and 63.51% for valence and arousal classes in their study on EEG-based emotion recognition using a simplified CNN architecture.,"valence and arousal around 80% . Javidan et al. validate cross-subject performance in the valence class (2 channels) utilizing the RReliefF selection strategy with input MSCE and SVR classifiers, yielding an accuracy of 67.45% . Msonda et al. reconstruct features (using 2, 3, 4, 5, 6, 7, and 8 channels) and search for the minimal errors using Adaboost, LR, Linear SVC, Polynomial SVC, and RF, with average performance results between 50 and 60%. Using locally robust feature selection (LRFS), Yin et al. execute channel selection for cross-subject classification with an estimated accuracy of 60% for valence and arousal classes . Arjun et al. employed the attention channel when combined with the LSTM and autoen- coder for cross-subject classification and obtained",1.0,0.9487123620705566
"accuracy performance when using 32 channels either intra-subject or inter-subject. Second, it is desired that the research should lead to the use of minimal channels but well-performing. Third, the architecture com- plexity is seen as a trade-off with the performance measures. Therefore, the proposed research targets all these gaps and investigates inter-subject performance using minimal chan- nels and a simplified architecture, without the need for con- tinuous re-trainings. III. MATERIALS AND METHOD III. MATERIALS AND METHOD The architecture proposed in this study was validated on the DEAP, public dataset. The results of the emotional val- idation experiment using EEG are divided into two parts, namely intra-subject and inter-subject validation. The pro- posed method involves the processing of the raw data","['. Reference [31] introduces a subject-independent sis,themodelemploystwoadditionalvalidationtechniques, or cross-subject approach with Inception-V3 CNN achiev- namely random split, and leave-one-out subject. The archiing accuracies of average 90.7%. Reference [60] presents tecture proposed in this research was validated using the BiSMSM for EEG-based emotion recognition, achieving publiclyavailableDEAPdataset.Thedependentsubjectand 63.10% to 61.89% accuracy', '. Luo and B.-L. Lu, ‘‘EEG data augmentation for emotion recogni- neuralnetworkforEEGemotionrecognition,’’Neurocomputing,vol.448, tion using a conditional Wasserstein GAN,’’ in Proc. 40th Annu. Int. pp.140–151,Aug.2021,doi:10.1016/j.neucom.2021.03.105. Conf.IEEEEng.Med.Biol.Soc.(EMBC),Jul.2018,pp.2535–2538,doi: [57] S. Bhosale, R. Chakraborty, and S. K. Kopparapu, ‘‘Calibration free 10.1109/EMBC.2018.8512865', '. Additionally,DCERNETarchitecturewasincorporated.This architecture was created for cross-subject emotion validation.Thisstudyinvolvedconductingexperimentsutilizinga standardarchitecturalframework.Oneissuethatariseswhen employing a standard architecture with deep layers is the significantconsumptionofRandomAccessMemory(RAM), IV. RESULTANDDISCUSSION especially when handling 32 channels with 32 participants A. PROPOSEDSELECTEDCHANNELSWITHVARIOUS utilizing the DEAP dataset', '. ABSTRACT Emotion recognition based on EEG has been implemented in numerous studies. In most of them, there are two observations made: first, extensive implementation is negatively associated with the performed validation. Cross-subject validation is more difficult than subject-dependent validation due to thehighvariabilitybetweenEEGrecordingscausedbydomainshifts.Second,alargenumberofchannels requires extensive computation', '. DigitalObjectIdentifier10.1109/ACCESS.2023.3322294 Cross-Subject Channel Selection Using Modified Relief and Simplified CNN-Based Deep Learning for EEG-Based Emotion Recognition LIAFAROKHAH1,2,RIYANARTOSARNO 1,(SeniorMember,IEEE), ANDCHASTINEFATICHAH 1,(Member,IEEE) 1DepartmentofInformatics,FacultyofIntelligentElectricalandInformaticsTechnology,InstitutTeknologiSepuluhNopember(ITS),Surabaya60111,Indonesia']","The architecture proposed in this research was validated using the publicly available DEAP dataset (Farokhah et al., 2023).","added in our recent publi- cation also yet tailored for spectrogram images. Instead of relying on resource-intensive transfer learning models, our approach optimizes model efficiency, making it more com- putationally friendly or resource-constrained applications. This contribution aims to streamline the implementation of emotion recognition systems without compromising perfor- mance. The proposed research is based on a simplified deep learn- ing architecture and channel selection approach that leads towards closer and resource-constrained real-time implemen- tation. In addition, research for cross-subject validation is more likely to be implemented widely than dependent subject validation. Cross-subject validation has a better generaliza- tion model than dependent-subject validation. This makes this research applicable across a wide range of industries where emotion recognition enables the development of",1.0,0.8620147364174596
"this study was validated on the DEAP, public dataset. The results of the emotional val- idation experiment using EEG are divided into two parts, namely intra-subject and inter-subject validation. The pro- posed method involves the processing of the raw data with fewer preprocessing steps. The Python development environ- ment has been used to downsample data to 128 Hz, remove EOG artifacts, and perform bandpass frequency filtering from 4–45 Hz. The raw EEG data is transformed into a spectrogram image using the STFT method and stored as RGB images. This is done using the MATLAB (octave and oc2py) library in Python. After the spectrogram is generated, the next step is to classify emotions using a deep learning network. The archi- tecture","['. ABSTRACT Emotion recognition based on EEG has been implemented in numerous studies. In most of them, there are two observations made: first, extensive implementation is negatively associated with the performed validation. Cross-subject validation is more difficult than subject-dependent validation due to thehighvariabilitybetweenEEGrecordingscausedbydomainshifts.Second,alargenumberofchannels requires extensive computation', '. 10.3390/s20123491. [28] P.PandeyandK.R.Seeja,‘‘Subjectindependentemotionrecognitionsys- [46] H. Donmez and N. Ozkurt, ‘‘Classification of emotional states from temforpeoplewithfacialdeformity:AnEEGbasedapproach,’’J.Ambient multi-channel EEG signals by convolutional neural networks,’’ in Intell.HumanizedComput.,vol.12,no.2,pp.2311–2320,Feb.2021,doi: Proc. Innov. Intell. Syst. Appl. Conf. (ASYU), 2022, pp.1–6, doi: 10.1007/s12652-020-02338-8. 10.1109/ASYU56188.2022.9925308. [29] Y. Cimtay and E', '. These selected channels are then subjected to the EEG-based emotion recognition model (AP-CapsNet) with Morlettransform,transformingthedatainto2Dimagesthat subject-dependent and cross-subject experiments, achiev- effectivelyencapsulateintricatetemporalandspectralinforing high accuracies of 62.7% and 63.51% in valence and mation.Subsequently,employingasimplifieddeeplearning arousal class', '. Reference [31] introduces a subject-independent sis,themodelemploystwoadditionalvalidationtechniques, or cross-subject approach with Inception-V3 CNN achiev- namely random split, and leave-one-out subject. The archiing accuracies of average 90.7%. Reference [60] presents tecture proposed in this research was validated using the BiSMSM for EEG-based emotion recognition, achieving publiclyavailableDEAPdataset.Thedependentsubjectand 63.10% to 61.89% accuracy', '. DigitalObjectIdentifier10.1109/ACCESS.2023.3322294 Cross-Subject Channel Selection Using Modified Relief and Simplified CNN-Based Deep Learning for EEG-Based Emotion Recognition LIAFAROKHAH1,2,RIYANARTOSARNO 1,(SeniorMember,IEEE), ANDCHASTINEFATICHAH 1,(Member,IEEE) 1DepartmentofInformatics,FacultyofIntelligentElectricalandInformaticsTechnology,InstitutTeknologiSepuluhNopember(ITS),Surabaya60111,Indonesia']","The architecture proposed in this research was validated using the publicly available DEAP dataset (Farokhah et al., 2023).","experimentation which can aid in gathering a diverse set of information under the con- trolled environment as they experience a variety of emotional stimuli. Primarily, DEAP offers access to numerous kinds of physiological signals including EEG, ECG, GSR, and others, yet in this study, EEG data available for 32 subjects has been employed. Each of the subjects has been exposed to numer- ous types of 40 video clips (1 minute each) associated with content related to different emotional states. The associated EEG responses are recorded at a high sampling rate utiliz- ing BioSemi ActiveTwo EEG instruments with 32 principal channels. The data is later passed on through pre-processing stages that involve data downsampling to 128 Hz, removal of the EOG",1.0,0.8522576271139735
"DATASET The DEAP dataset has 32 participants with a composition of 50% male and 50% female samples . The stimulus used is a video with a duration of 60 seconds. The results of the EEG recording have a duration of 63 seconds, of which 3 seconds are the baseline. One participant has 40 recordings of the EEG trials. The results of the EEG trial recordings have been mea- sured using the Self-Assessment Manikin (SAM). SAM has four emotional dimensions, namely valence, arousal, domi- nance, and liking, with ratings 0-9. For valence and arousal classes, emotion labels are divided into two categories: low and high. In this study, the low class has a rating below 4.5 and the high class is","['. reflect the ongoing advancements and interdisciplinary collaboration in the field of EEG-based research, aiming to Emotion recognition is another key area explored. The enhance user experiences, improve health outcomes, and study in [20] examines the impact of HDR videos on emotion develop innovative assistive technologies. recognition, achieving an accuracy of 80.55% for arousal and 70.37% for valence. Similarly, [33] develops a hybrid control TABLE I', '. First, this study into studies focused racy in the valence class and 85% accuracy in the arousal on channel selection methods within EEG signals using the class. Pandey and Seeja conducted research using CNN DEAP dataset, encompassing a diverse array of techniques architecture, achieving 59% and 59% accuracy for valence aimedatisolatingthemostinformativechannelsforemotion and arousal, respectively [28]. Using Inception Resnet-V2, analysis', '. Thirdly, and 96.7% valence and arousal class accuracy, respectively. they combined DCERNET and SVM to achieve 88.10% These papers collectively contribute diverse approaches to valence class performance. Farokhah et al. [26] integrated EEG-basedemotionrecognition,eachdemonstratingpromisthe development of a simplified CNN architecture, the best ing results in addressing various challenges', '. 10.3390/s20123491. [28] P.PandeyandK.R.Seeja,‘‘Subjectindependentemotionrecognitionsys- [46] H. Donmez and N. Ozkurt, ‘‘Classification of emotional states from temforpeoplewithfacialdeformity:AnEEGbasedapproach,’’J.Ambient multi-channel EEG signals by convolutional neural networks,’’ in Intell.HumanizedComput.,vol.12,no.2,pp.2311–2320,Feb.2021,doi: Proc. Innov. Intell. Syst. Appl. Conf. (ASYU), 2022, pp.1–6, doi: 10.1007/s12652-020-02338-8. 10.1109/ASYU56188.2022.9925308. [29] Y. Cimtay and E', '. ABSTRACT Emotion recognition based on EEG has been implemented in numerous studies. In most of them, there are two observations made: first, extensive implementation is negatively associated with the performed validation. Cross-subject validation is more difficult than subject-dependent validation due to thehighvariabilitybetweenEEGrecordingscausedbydomainshifts.Second,alargenumberofchannels requires extensive computation']","The DEAP dataset has been utilized in studies focusing on channel selection methods within EEG signals to enhance emotion recognition accuracy (Pandey & Seeja, 2021).","for EEG classification. L. Farokhah et al.: Cross-Subject Channel Selection TABLE 3. DEAP dataset attributes. FIGURE 1. Proposed research framework. experiment using EEG are separated into two segments. The general proposed research framework order is depicted in Fig. 1. A. DEAP DATASET A. DEAP DATASET DEAP is an open-source database that is known to offer EEG, physiological, and audiovisual signals that can be widely used in the domain of computing and emotion recognition. Numer- ous subjects are involved in the experimentation which can aid in gathering a diverse set of information under the con- trolled environment as they experience a variety of emotional stimuli. Primarily, DEAP offers access to numerous kinds of physiological signals including EEG, ECG, GSR, and others,",0.6666666666666666,0.9398092125075006
"find the accuracy is shown in Eq. 2. Accuracy = TP + TN TP + TN + FP + FN (2) where TP, TN, FP, and FN are true positives, true negatives, false positives, and false negatives. The precision and recall are then evaluated, as shown in Eq. 3 and 4, respectively. Precision = Recall = TP TP + FP TP TP + FP (3) (4) The next evaluation is the F-score, which is a combination of accuracy between recall and precision. The F-score formula is shown in Eq. 5. F1score = 2(precision)(recall) recall + precision (5) In measuring the evaluation, eight scenarios will be used, as shown in Table 3. For inter-subject classification, it used leave one out subject","["". These metrics can be calculated by (1) – (3). This study's calculation of True Positive, False Positive, and False Negative differs from other classifications or detections [20]-[23]. These are chosen and calculated following previous studies [1]. Precision detects the truly correct prediction out of all predictions. Recall detects the truly correct prediction out of all actual classes. F1 scores are harmonic mean between these two that measure overall model performance"", 'L.Farokhahetal.:Cross-SubjectChannelSelection FIGURE5. TrainingcurvesforValence.a.trainingandvalidationaccuracy. FIGURE6. Trainingcurvesforarousala.trainingandvalidationaccuracy. b.trainingandvalidationloss. b.trainingandvalidationloss. TABLE9. Cross-subjectperformanceoutcomeswithvaryinginput treatmentorchannelselectionmethod. inter-subject classification performance', '. Specifically, in the context Therefore, we include three class weights as a search space ofmulticlassclassification,iftheclassdistributionishighly in the experiment, i.e., uniform, balanced, and inverse [50]. imbalanced,themodeltendstolearnfromthemajorityclass Uniform refers to equal weight, while balanced and inverse VOLUME13,2025 105367', 'classification validation have helped develop the motivation for this work which is [34],[35],[36]', '. In addition, research for cross-subject validation is performanceof74.41%and74.71%,respectively[48].Topic morelikelytobeimplementedwidelythandependentsubject et al. used ReliefF and NCA approach for selection chanvalidation. Cross-subject validation has a better generaliza- nels with accuracy on valence and arousal around 80% tion model than dependent-subject validation']","The calculation of True Positives, False Positives, and False Negatives is essential for evaluating model performance metrics such as accuracy, precision, and recall (Referensi 1).","measured the ratio of correct recognition results to the entire dataset. Accuracy = TP + TN TP + FN + TN + FP (11) 2) Precision (12) estimated how many of the positive pre- dictions were correct. Precision = TP TP + FP (12) 3) Recall can also be called Sensitivity (13) calculated how many positive cases the classifier correctly pre- dicted over all the positive instances in the data. Recall = TP TP + FN (13) 4) F1-measure (14) assessed the predictive skill of a model by elaborating on its class-wise performance. F1 − measure = 2 × Precision × Recall Precision + Recall (14) 97240 VOLUME 12, 2024 M. Rivai, D. Aulia: Use of Electronic Nose to Identify",0.25,0.9362558651709609
"82.45% in the valence and arousal classes, respectively. In the ReliefF method (R-HOLO-FM), it is 83.26% and 83.85% in the valence and arousal classes. This is different when using the proposed architecture, which results in increased performance accuracy on the NCA: 10.32% and 9.85% in the valence and arousal and ReliefF method classes, respectively, with a performance increase of 7.64% and 8.85% in the valence and arousal classes. The proposed channel selection method outperforms the other selection methods in the valence and arousal classes . The input for selecting the best channel for the proposed method uses EEG data to be classified, namely spectrogram data. The accuracy and loss plot results in Table 5 are shown in Figures 6, 7,","['. DigitalObjectIdentifier10.1109/ACCESS.2023.3322294 Cross-Subject Channel Selection Using Modified Relief and Simplified CNN-Based Deep Learning for EEG-Based Emotion Recognition LIAFAROKHAH1,2,RIYANARTOSARNO 1,(SeniorMember,IEEE), ANDCHASTINEFATICHAH 1,(Member,IEEE) 1DepartmentofInformatics,FacultyofIntelligentElectricalandInformaticsTechnology,InstitutTeknologiSepuluhNopember(ITS),Surabaya60111,Indonesia', '. First, this study into studies focused racy in the valence class and 85% accuracy in the arousal on channel selection methods within EEG signals using the class. Pandey and Seeja conducted research using CNN DEAP dataset, encompassing a diverse array of techniques architecture, achieving 59% and 59% accuracy for valence aimedatisolatingthemostinformativechannelsforemotion and arousal, respectively [28]. Using Inception Resnet-V2, analysis', '. Thirdly, and 96.7% valence and arousal class accuracy, respectively. they combined DCERNET and SVM to achieve 88.10% These papers collectively contribute diverse approaches to valence class performance. Farokhah et al. [26] integrated EEG-basedemotionrecognition,eachdemonstratingpromisthe development of a simplified CNN architecture, the best ing results in addressing various challenges', 'L.Farokhahetal.:Cross-SubjectChannelSelection preponderanceofthepowerbandratioviathereliefmethod. [8] M.N.Munawar,R.Sarno,D.A.Asfani,T.Igasaki,andB.T.Nugraha, Third, collaboration of scalogram, PR-Relief for channel ‘‘Significant preprocessing method in EEG-based emotions classification,’’ J. Theor. Appl. Inf. Technol., vol. 87, no. 2, pp.176–190, selection, and simplified CNN for classification have pro2016. posed. In the proposed channel selection, the number of [9] Y. Wu, M. Xia, L. Nie, Y. Zhang, and A', '. These selected channels are then subjected to the EEG-based emotion recognition model (AP-CapsNet) with Morlettransform,transformingthedatainto2Dimagesthat subject-dependent and cross-subject experiments, achiev- effectivelyencapsulateintricatetemporalandspectralinforing high accuracies of 62.7% and 63.51% in valence and mation.Subsequently,employingasimplifieddeeplearning arousal class']","The proposed method achieves 85% accuracy in the arousal class and focuses on channel selection methods for EEG signals (Farokhah et al., 2023).","an accuracy between 69.56% and 83.50%, respec- tively . The NMI selection approach with input PSD and SVM classifiers yielded 74.41% valence (8 channels) and arousal (10 channels) accuracy of 73.64% . Goshvar- pour and Goshvarpour employing the sLORETA selection method and input lagged Poincare indicator and SVM clas- sifier deliver valence (5 channels) and arousal (5 channels) performance of 74.41% and 74.71%, respectively . Topic et al. used ReliefF and NCA approach for selection chan- nels with accuracy on valence and arousal around 80% . Javidan et al. validate cross-subject performance in the valence class (2 channels) utilizing the RReliefF selection strategy with input MSCE and SVR classifiers, yielding an accuracy of 67.45% . Msonda et al. reconstruct features",0.6666666666666666,0.9530139782915744
predictions to the total test data. Models with high accuracy can predict new data correctly. Precision = TP TP + FP (5) Precision (5) is the ability to identify relevant data. High precision and accuracy can represent a better model. Recall = TP TP + FN (6) Recall (6) is the ability to find all relevant cases in a dataset. Recall can be explained by the success of the model in retrieving information. F1 − Score = 2 × Precision × Recall Precision + Recall (7) F1-Score (7) is an evaluation metric to determine the perfor- mance of the model accuracy against the dataset. F1-score is a calculation that involves a combination of precision and recall values. E. GENETIC ALGORITHM,"['. Anextensivehyperparametertuningisperformedtofindthe bestconfigurationforeachencodertype.Afterexperimenting DATAAVAILABILITY with all the resulting model configurations, the proposed The dataset used in the experiment is available upon a label schemas achieved the highest accuracy and improved reasonablerequest.Thecodefortheexperiment,theresulting thebaselinesandstate-of-the-artmodels’performancetested performance evaluation, the scripts for data analysis, and on filtered and unfiltered datasets', '. Note that the weighted average is used to over a significant number of hyperparameters to verify the compute the average score of precision, recall, F1, and robustnessofDroneLog. prediction confidence. We investigate the confusion matrix, learnedrepresentation,andtheinterpretabilityofthemodel’s C. IMPLEMENTATIONDETAILS prediction to increase understanding of the model', "". We applied various machine learning models, accurate predictions, as machine learning models learn from including Random Forest and XGBoost, to improve the the input data, following the principle of 'garbage-ingarbage-out' [29]. Once they complete the preprocessing steps, the data will be ready for the machine learning model. TABLE II. RESULTS TABLE OF THE FOUR KEY METRICS Metrics ID Description Value D"", '. In stage 1, theperformanceevaluationanalysisonsystemperformance has the form of average system performance (mAP, recall, andF1score)ontheobjectivefunctionaswellasthelowest lossvalue.Then,identifymultiplehyperparametercandidates thatperformwellonobjectivefunctionswithlowlossvalues and good system performance. Furthermore, stage 2 data processing in the Search-Space model has better system performanceandthelowestloss', "". These metrics can be calculated by (1) – (3). This study's calculation of True Positive, False Positive, and False Negative differs from other classifications or detections [20]-[23]. These are chosen and calculated following previous studies [1]. Precision detects the truly correct prediction out of all predictions. Recall detects the truly correct prediction out of all actual classes. F1 scores are harmonic mean between these two that measure overall model performance""]","Precision identifies the correct predictions from all predictions, while recall measures the correct predictions from all actual classes, and F1 score serves as the harmonic mean of these two metrics to evaluate overall model performance.","with the following formula: TP + TN TP + TN + FP + FN Accuracy = Precision = Recall/True Positive Rate(TPR) TP TP + FP TP TP + FN F1 = 2 × precision × recall precision + recall FP TN + TP (cid:90) 1 TPRd(FPR) False Positive Rate(FPR) = AUC = (4) (5) (6) (7) (8) (9) where TP is the number of correctly predicted positive labels, TN is the number of correctly predicted negative labels, FP is the number of incorrectly predicted positive labels, and FN is the number of incorrectly predicted negative labels. Accuracy is the ratio of true predictions to the overall data. Precision is the ratio between TP to the total number of positive predic-",1.0,0.9040283137112968
"highly relevant to various incident cases, as shown in Fig 3. Not only is it highly relevant, but it is also highly prioritised evidence in diverse investigation cases. 2) Flight log messages cover events from the drone’s sensors, features, and components, making it one piece of evidence to perform analysis related to different drone software and hardware components. Therefore, analysing the log messages means analysing the whole device for various possible incident scenarios. 3) Flight log messages contain contextual information about the occurring event as a description that involves multiple parts of the drone simultaneously. For example, a certain circumstance fails a feature or an operation, as shown in message group number 4 in Table 1. TABLE 1. Groups of","['robust predictions, enabling drone operators to detect and Furthermore, Jain et al. [10] proposed a framework for diagnose malfunctions quickly and take corrective actions. sensor data identification and verification. An analysis of a Thestructureofthispaperisasfollows.SectionIIpresents drone’sarchitectureandaforensicmodelwithgenericfeatures previous research relating to the drone log analysis and drone are proposed here in order to enhance the digital investigation forensics', '. DigitalObjectIdentifier10.1109/ACCESS.2024.3396926 Severity-Oriented Multiclass Drone Flight Logs Anomaly Detection SWARDIANTARASILALAHI 1,(GraduateStudentMember,IEEE), TOHARIAHMAD 1,(Member,IEEE),HUDANSTUDIAWAN 1,(Member,IEEE), EIRINIANTHI 2,ANDLOWRIWILLIAMS 2 1DepartmentofInformatics,InstitutTeknologiSepuluhNopember,Surabaya60111,Indonesia 2SchoolofComputerScienceandInformatics,CardiffUniversity,CF244AGCardiff,U.K', '. There is yet to come incident scenarios to perform case studies to verify the a publicly available dataset of log messages from other performanceoftheproposedmethod,andmakingitpublicly dronemanufacturers.Severalpubliclyavailabledatasetsare available. 64264 VOLUME12,2024', '. Most drone incidents are caused analysis of drone logs can also provide evidence that can be by bird attacks, collide with other drones, and malfunctioning used in legal proceedings. This evidence can be particularly systems.Sometimesthedronemayhaveamalfunctioningsystem valuable in cases where there are disputes over liability, such caused by sensor failure, a broken motor, or CPU failure. This cancauseanaccident.Therefore,aforensicinvestigationsupports as in cases of property damage or personal injury', '. In this work, the distinctive feature events from all aspects of the drone, including sensors, lies within the employment of a sequence classification componentsandfeatures[2]. model with a multitask label to train a detection model for Typically, existing log-based anomaly detection studbetter performance. An extensive experiment is conducted ies classify log events into two categories: normal and on several different encoders commonly used in log-based anomaly [3]']","The analysis of drone logs can provide crucial evidence for legal proceedings, especially in cases involving disputes over liability due to sensor failures or other malfunctions (Jain et al.).","as runtime logs that are constantly generated during the operational period of the device. The information recorded in log data is highly valuable for many purposes, including running system monitoring, running process conformance checks, and overall system evaluation . The use of log data is critical when incident cases occur, as the empirical events and incident scenarios can be discovered by analysing the log artefacts. Assuming that 64252 2024 The Authors. This work is licensed under a Creative Commons Attribution-NonCommercial-NoDerivatives 4.0 License. For more information, see VOLUME 12, 2024 S. Silalahi et al.: Severity-Oriented Multiclass Drone Flight Logs Anomaly Detection the integrity of the log is guaranteed, log data is one of the artefacts with the highest priority for investigating",0.5,0.9147560135627752
"To do so, several artefacts such as flight logs, images, videos, firmware logs, and controller applications can be analysed, as illustrated in Fig 1. For instance, GPS records can be utilised to reconstruct and analyse the path taken by the drone during a flight . The deviation between the empirical flight and reconstructed paths can happen if the drone encounters a GPS spoofing . Among the published drone forensics studies, popular works include case studies, evidence analysis, tools develop- ment, and forensic framework development . The widely investigated source of evidence is sensor data, such as GPS , which provides a concise diagnosis of a flight to the investigator when performing anomaly detection . In fact, a flight log not","['. system(UAS)forensics:Dataextraction&analysis,’’ForensicSci.Int., [28] S.ViswanathanandZ.Baig,‘‘Digitalforensicsfordrones:Astudyoftools Digit.Invest.,vol.41,Jun.2022,Art.no.301379. andtechniques,’’inApplicationsandTechniquesinInformationSecurity, [6] E. Mantas and C. Patsakis, ‘‘GRYPHON: Drone forensics in dataflash L.BatinaandG.Li,Eds.Singapore:Springer,2020,pp.29–41. andtelemetrylogs,’’inAdvancesinInformationandComputerSecurity, [29] M. Debinski, F. Breitinger, and P. Mohan, ‘‘Timeline2GUI: N', 'robust predictions, enabling drone operators to detect and Furthermore, Jain et al. [10] proposed a framework for diagnose malfunctions quickly and take corrective actions. sensor data identification and verification. An analysis of a Thestructureofthispaperisasfollows.SectionIIpresents drone’sarchitectureandaforensicmodelwithgenericfeatures previous research relating to the drone log analysis and drone are proposed here in order to enhance the digital investigation forensics', '. with limitations and threats to validity. As drone forensics Furtherfuturestudiesmayincludeexploringthepossibility is an emerging topic, there are very limited public datasets of doing high-level oversampling to introduce the models available. The log messages used in this study are mainly with more log message patterns, producing a dataset with acquired from DJI-made devices', '. Section III explains the proposed method, applying process. Also, Barton et al. [11] conducted the research to the Transformer technique to forensics of drone malfunctions. reconstruct the actions taken by these drones, identify their InSectionIV,thediscussionofperformancemethod,followed owners or operators, and extract data from associated mobile by conclusions and future works in Section V. devices. In other research in drone forensics, this paper also analyze II', '. theexperimentalresults,theTransformerobtainsthehighestF1 In the context of classifying drone malfunctions, the Transscore value of 93.04%. former model can be trained on a dataset of labeled drone Index Terms—drone forensics, forensic investigation, malfunctelemetry data to learn patterns and relationships between the tions, infrastructure, Transformer, Informer, FEDformer drone’s behavior and the root cause of a malfunction. The dataset can include features such as altitude, velocity, battery I']","Jain et al. proposed a framework for sensor data identification and verification, enhancing the digital investigation of drone log analysis (Jain et al., 2022).","I. INTRODUCTION I. INTRODUCTION The use of drones has become increasingly common in various applications, including aerial photography, surveying, and monitoring. However, drones can also be involved in incidents such as accidents, violations, or even crimes, making it necessary to investigate drone logs as part of forensic investigations. In a forensic investigation, drone logs are essential sources of information that can help investigators reconstruct the events leading up to an incident. Drone logs typically include information such as flight paths, altitude, speed, battery life, sensor data, and other telemetry information . Important analysis of drone logs involves the identification of the most critical pieces of information in the log data and the analysis of how they relate to the incident",0.3333333333333333,0.9421532333304594
"and forensic framework development . The widely investigated source of evidence is sensor data, such as GPS , which provides a concise diagnosis of a flight to the investigator when performing anomaly detection . In fact, a flight log not only contains sensor data and component status, as illustrated in Fig 2, but also human- readable messages describing the occurring events during the operation of a drone. This file stores all information during a flight, such as flight timestamps, flight parameters, sensor data, components’ status, and flight mode. The last three columns contain human-readable messages: APP.message, APP.tip, and APP.warning, which is the source of the evidence used in this paper. Sample messages can be seen in Table 1. From the","['robust predictions, enabling drone operators to detect and Furthermore, Jain et al. [10] proposed a framework for diagnose malfunctions quickly and take corrective actions. sensor data identification and verification. An analysis of a Thestructureofthispaperisasfollows.SectionIIpresents drone’sarchitectureandaforensicmodelwithgenericfeatures previous research relating to the drone log analysis and drone are proposed here in order to enhance the digital investigation forensics', '. DigitalObjectIdentifier10.1109/ACCESS.2024.3396926 Severity-Oriented Multiclass Drone Flight Logs Anomaly Detection SWARDIANTARASILALAHI 1,(GraduateStudentMember,IEEE), TOHARIAHMAD 1,(Member,IEEE),HUDANSTUDIAWAN 1,(Member,IEEE), EIRINIANTHI 2,ANDLOWRIWILLIAMS 2 1DepartmentofInformatics,InstitutTeknologiSepuluhNopember,Surabaya60111,Indonesia 2SchoolofComputerScienceandInformatics,CardiffUniversity,CF244AGCardiff,U.K', '. Most drone incidents are caused analysis of drone logs can also provide evidence that can be by bird attacks, collide with other drones, and malfunctioning used in legal proceedings. This evidence can be particularly systems.Sometimesthedronemayhaveamalfunctioningsystem valuable in cases where there are disputes over liability, such caused by sensor failure, a broken motor, or CPU failure. This cancauseanaccident.Therefore,aforensicinvestigationsupports as in cases of property damage or personal injury', '. theexperimentalresults,theTransformerobtainsthehighestF1 In the context of classifying drone malfunctions, the Transscore value of 93.04%. former model can be trained on a dataset of labeled drone Index Terms—drone forensics, forensic investigation, malfunctelemetry data to learn patterns and relationships between the tions, infrastructure, Transformer, Informer, FEDformer drone’s behavior and the root cause of a malfunction. The dataset can include features such as altitude, velocity, battery I', '. The main ananomaly,aninvestigatorcanadjusttheanalysisobjectives contributionsofthispaperaresummarisedasfollows: targeting a certain level only, depending on the needs and cases. 1) Propose Drone Log Severity (DroLoVe), a severityAs shown in Fig. 1, the drone experiences several events oriented multiclass anomaly detection approach on during a flight. When analysing the flight logs from a droneflightlogdata']","An analysis of drone logs can provide evidence that may be utilized in legal proceedings (Jain et al., 2024).","the performance of the proposed framework has been discussed and analysed. In this section, challenges encountered during the study are disclosed, along with limitations and threats to validity. As drone forensics is an emerging topic, there are very limited public datasets available. The log messages used in this study are mainly acquired from DJI-made devices. There is yet to come a publicly available dataset of log messages from other drone manufacturers. Several publicly available datasets are mainly about sensor data and multimedia artefacts . While in this study, we solely depend on the human-readable messages generated by the drone during a flight. Given the condition where a small number of unique messages and most of them are acquired from DJI",0.6666666666666666,0.9322306018461904
"LLMs to detect anomalous log entries in a point-based approach . However, existing studies only detect whether an event or subsequent event is an anomaly. In a forensic setting, analysing a large number of log entries resulting from binary anomaly detection is considered inefficient and labour-intensive as the detection is performed on the acquired evidence at one time . Therefore, too many detected anomalies need to be detailed into a more fine- grained detection to help the investigator better prioritise the analysis objective. As a result, this study extends the binary anomaly detection to multi-class anomaly detection, as exemplified by another domain application such as plane flight data , image data , and internet of vehicle . As a consequence,","['. Section VI discloses the challenges, limitations, and threats to the validity of the study. The conclusion and future works are elaboratedinSectionVII. II. RELATEDWORK This section discusses closely relevant prior studies on log-based anomaly detection and different approaches to FIGURE3. A2DvisualisationofthedatasetusingBERT[16]and handleclassimbalanceproblems. t-SNE[17].Itshowsthatthesamplesarenotlinearlyseparated;samples belongtodifferentclassesareclosetooneanother. A', '. The proposed representation of the label improves the prediction confidence score on variousencodertypeswith8.6%and1.8%fromfocalandcross-entropyscenariosonaverage,respectively. INDEX TERMS Anomaly detection, digital forensics, drone forensics, multitask learning, transformer encoder,informationsecurity. I', 'S.Silalahietal.:Severity-OrientedMulticlassDroneFlightLogsAnomalyDetection the integrity of the log is guaranteed, log data is one of the artefacts with the highest priority for investigating various types of incidents, such as collision, crash landing, cyberattack,payloaddeliveryissue,andweather-relatedincidents [2].Itisexemplifiedbytheresearcheffortthathasbeenmade by the community on log-based anomaly detection using various approaches, including machine learning- [3], [4],', '. For Log-based anomaly detection has been applied widely instance,generatingmoresamplesofminorityclassesusing to various systems, such as operating systems [9], [10], the Synthetic Minority Oversampling Technique (SMOTE) parallel file systems [26], drones [11], [18], [20], internet canimprovethedetectionperformanceofadeepQnetwork of things [28], and industrial control systems [29]. Among (DQN)-based [33] and deep neural network (DNN)-based these studies, a sequence-based approach is the common [34] models', '. oflogparsinginloganalysisandanomalydetectionhasbeen critical to perform both online and offline detection [27]. B. CLASSIMBALANCEPROBLEM(CIP)INLOG-BASED Performing log parsing aims to extract the core features of ANOMALYDETECTION logs and reduce the noise. However, employing parsing can Itisassuredthatinlog-basedanomalydetection,thenumber remove valuable information within the log messages [25]']","The proposed representation of the label enhances prediction confidence scores in multiclass anomaly detection, achieving improvements of 8.6% and 1.8% in focal and cross-entropy scenarios, respectively.","particular system log may need different techniques from one type to another. Generally, log-based anomaly detection can be performed using either point, collective, or contextual approaches. In the log-based anomaly detection literature, most of the existing studies propose either a contextual or collective approach, where the decision is taken by examining a sequence of log events. However, detecting abnormalities in log data can be performed using a point-based approach, where one single log record is the only feature needed. Therefore, several studies explored utilising a point-based approach to detect anomalous events on logs data, such as in operating systems , , drone devices , and distribution systems , . In the drone context, a log message contains a description of",0.6666666666666666,0.8949484926379699
"Existing anomaly detection modelling techniques can be conducted either in a point, contextual, or collective setting. Point anomaly detection characterises each log entry, whether an event is an abnormality or a normal event. For instance, if a user types the wrong password when trying to gain access to an operating system prompt, the generated log message can be considered as an anomaly , , . As for contextual anomaly, the detection involves analysing some contextually related attributes to determine whether a log entry is an anomaly. As an example, the flight path taken by a drone during a flight is recorded in longitude and latitude coordinates. These data can be used to detect an anomaly by finding a peculiar value","['. messages [9]. Thus, analysing a particular system log may needdifferenttechniquesfromonetypetoanother. Generally,log-basedanomalydetectioncanbeperformed ones. The challenge is that even though the severity level using either point, collective, or contextual approaches. is different, the samples share a common word or even In the log-based anomaly detection literature, most of the phrase, as depicted in Fig. 2', '. Section VI discloses the challenges, limitations, and threats to the validity of the study. The conclusion and future works are elaboratedinSectionVII. II. RELATEDWORK This section discusses closely relevant prior studies on log-based anomaly detection and different approaches to FIGURE3. A2DvisualisationofthedatasetusingBERT[16]and handleclassimbalanceproblems. t-SNE[17].Itshowsthatthesamplesarenotlinearlyseparated;samples belongtodifferentclassesareclosetooneanother. A', '. 2. It makes it challenging to existing studies propose either a contextual or collective build a point anomaly detection model that depends only approach, where the decision is taken by examining a on the semantics of the log message. Fig', 'S.Silalahietal.:Severity-OrientedMulticlassDroneFlightLogsAnomalyDetection TABLE1. Summaryofrelatedworksinlog-basedanomalydetection. to perform anomaly detection [9]. In a point setting, the and relationship between the occurrences of the log events. detection is performed against individual log records. The For instance, an LSTM [22] and GRU [9] model is used modeldependssolelyonthefeaturesfromasinglelogentry. to capture the contextual features of the log sequence', 'S.Silalahietal.:Severity-OrientedMulticlassDroneFlightLogsAnomalyDetection the integrity of the log is guaranteed, log data is one of the artefacts with the highest priority for investigating various types of incidents, such as collision, crash landing, cyberattack,payloaddeliveryissue,andweather-relatedincidents [2].Itisexemplifiedbytheresearcheffortthathasbeenmade by the community on log-based anomaly detection using various approaches, including machine learning- [3], [4],']","In point anomaly detection, the model relies exclusively on the characteristics of individual log entries (Silahi et al.).","particular system log may need different techniques from one type to another. Generally, log-based anomaly detection can be performed using either point, collective, or contextual approaches. In the log-based anomaly detection literature, most of the existing studies propose either a contextual or collective approach, where the decision is taken by examining a sequence of log events. However, detecting abnormalities in log data can be performed using a point-based approach, where one single log record is the only feature needed. Therefore, several studies explored utilising a point-based approach to detect anomalous events on logs data, such as in operating systems , , drone devices , and distribution systems , . In the drone context, a log message contains a description of",0.5,0.9153939993850482
"a log entry is an anomaly. As an example, the flight path taken by a drone during a flight is recorded in longitude and latitude coordinates. These data can be used to detect an anomaly by finding a peculiar value within the log records by contrasting the normal values to abnormal values using a certain threshold . Unique to the previous two approaches, collective anomaly establishes anomaly criteria based on a set of instances associated with each other, distinct from the overall data. Statistical anomaly detection is one of the common cases for this type of anomaly detection. Another case scenario in log-based anomaly detection is a sequence-based approach, where an abnormality is determined by analysing a group of events","['. The main ananomaly,aninvestigatorcanadjusttheanalysisobjectives contributionsofthispaperaresummarisedasfollows: targeting a certain level only, depending on the needs and cases. 1) Propose Drone Log Severity (DroLoVe), a severityAs shown in Fig. 1, the drone experiences several events oriented multiclass anomaly detection approach on during a flight. When analysing the flight logs from a droneflightlogdata', '. DigitalObjectIdentifier10.1109/ACCESS.2024.3396926 Severity-Oriented Multiclass Drone Flight Logs Anomaly Detection SWARDIANTARASILALAHI 1,(GraduateStudentMember,IEEE), TOHARIAHMAD 1,(Member,IEEE),HUDANSTUDIAWAN 1,(Member,IEEE), EIRINIANTHI 2,ANDLOWRIWILLIAMS 2 1DepartmentofInformatics,InstitutTeknologiSepuluhNopember,Surabaya60111,Indonesia 2SchoolofComputerScienceandInformatics,CardiffUniversity,CF244AGCardiff,U.K', '. CONCLUSIONANDFUTUREWORK ofFP(1),FN(1),andFN(2). In this paper, we demonstrate how to train a log-based Other than analysing the misclassified samples, we also anomaly detection model that can prioritise the prediction analyse the learned representation of the dataset by each of of higher severity anomalies on drone flight logs while the best-performing models. The filtered dataset is used to increasing the prediction confidence score at the same investigatethelearnedrepresentationplottedinto2Dgraphs, time', 'S.Silalahietal.:Severity-OrientedMulticlassDroneFlightLogsAnomalyDetection TABLE1. Summaryofrelatedworksinlog-basedanomalydetection. to perform anomaly detection [9]. In a point setting, the and relationship between the occurrences of the log events. detection is performed against individual log records. The For instance, an LSTM [22] and GRU [9] model is used modeldependssolelyonthefeaturesfromasinglelogentry. to capture the contextual features of the log sequence', '. In this work, the distinctive feature events from all aspects of the drone, including sensors, lies within the employment of a sequence classification componentsandfeatures[2]. model with a multitask label to train a detection model for Typically, existing log-based anomaly detection studbetter performance. An extensive experiment is conducted ies classify log events into two categories: normal and on several different encoders commonly used in log-based anomaly [3]']","The employment of a sequence classification model with a multitask label enhances the performance of anomaly detection in drone flight logs by analyzing distinctive feature events from various drone aspects (Silahi et al., 2024).","particular system log may need different techniques from one type to another. Generally, log-based anomaly detection can be performed using either point, collective, or contextual approaches. In the log-based anomaly detection literature, most of the existing studies propose either a contextual or collective approach, where the decision is taken by examining a sequence of log events. However, detecting abnormalities in log data can be performed using a point-based approach, where one single log record is the only feature needed. Therefore, several studies explored utilising a point-based approach to detect anomalous events on logs data, such as in operating systems , , drone devices , and distribution systems , . In the drone context, a log message contains a description of",0.75,0.9252454179534741
"severity level can provide better detection results for the investigator to pinpoint the event of interest. Interpretability makes training and testing more transparent, the model trustworthy, and human-friendly. 2) We propose DroneSBERT,1 a domain-specific embed- ding to extract semantic features that are well-aligned to the human perception of the log message samples. Supervised contrastive learning is employed to learn distinct representations for each anomaly severity level. 3) We explore two target label representations to augment a multitask learning paradigm for training multiclass classification models. Aligning to the dataset character- istics where the log messages from different anomaly severity levels share common words and phrases, multitask learning can help the model make use of the shared low-level features in the log","['S.Silalahietal.:Severity-OrientedMulticlassDroneFlightLogsAnomalyDetection the integrity of the log is guaranteed, log data is one of the artefacts with the highest priority for investigating various types of incidents, such as collision, crash landing, cyberattack,payloaddeliveryissue,andweather-relatedincidents [2].Itisexemplifiedbytheresearcheffortthathasbeenmade by the community on log-based anomaly detection using various approaches, including machine learning- [3], [4],', '. The proposed representation of the label improves the prediction confidence score on variousencodertypeswith8.6%and1.8%fromfocalandcross-entropyscenariosonaverage,respectively. INDEX TERMS Anomaly detection, digital forensics, drone forensics, multitask learning, transformer encoder,informationsecurity. I', '. Section VI discloses the challenges, limitations, and threats to the validity of the study. The conclusion and future works are elaboratedinSectionVII. II. RELATEDWORK This section discusses closely relevant prior studies on log-based anomaly detection and different approaches to FIGURE3. A2DvisualisationofthedatasetusingBERT[16]and handleclassimbalanceproblems. t-SNE[17].Itshowsthatthesamplesarenotlinearlyseparated;samples belongtodifferentclassesareclosetooneanother. A', '. of anomalous samples is significantly less than the normal Topreventparsingerrorsfrombeingpropagatedtothenext ones. Employing a supervised-based technique is prone to detection phase, utilising a contextual embedding, such as bias,asthemodeltendstolearnfromthemajoritysamples. BERT, to extract the semantic features of logs data without To overcome CIP, several studies proposed data-level and performingparsingcanbeasolution[21].Therefore,allthe algorithm-level solutions [30]', '. Even though all scenarios result in a well- approach is better than the previous work baselines while separated representation, none of the scenarios reflects the beinginferiortoourbaselinescenariobasedontheaccuracy ordinalnatureofthelabel.OnewouldexpecttheHighclassto and F1 scores. From the anomaly detection perspective, befarfromtheLowclass,representingthedistancebetween the proposed method achieves higher prediction confidence theseverityoftheanomalies']","The proposed label representation enhances prediction confidence scores by an average of 8.6% and 1.8% in focal and cross-entropy scenarios, respectively (Severity-Oriented Multiclass Drone Flight Logs Anomaly Detection).","the model can be convincing and accountable enough to the investigator to be included in the investigation report. VII. CONCLUSION AND FUTURE WORK VII. CONCLUSION AND FUTURE WORK In this paper, we demonstrate how to train a log-based anomaly detection model that can prioritise the prediction of higher severity anomalies on drone flight logs while increasing the prediction confidence score at the same time. Considering the nature of the dataset, where samples that belong to different severity levels share common features, a multitask vector label representation along with severity-oriented decoding is proposed. An extensive experiment proved that the proposed approach is better than the previous work baselines while being inferior to our baseline scenario based on the accuracy and F1",1.0,0.8858668960090169
"detection on the test data, which is then analysed further. In this paper, M = (cid:2)m1, m2, . . . , m|M| (cid:3) is defined as the collection of log messages in the dataset. Given a log record m = [w1, w2, . . . , wn] containing n number of words as input, with m ∈ M, BERTbase is used to tokenize and obtain the input vector representation. In the implementation, computation is undertaken using matrix multiplication. Thus, a term maximum sequence length, m, is introduced to pack the input messages that vary in length into a matrix with a consistent size throughout all the samples in the dataset. Therefore, for each single input message, the input matrix becomes","['vector,yieldingastaticlookupdictionaryafterbeingtrained as the log message is generated and triggered by certain on a relatively large corpus', '. Contrary to the other three baselines, this hotencodingwithfocalloss.Theproposedscenarioemploys study performed the detection on the sequence of log multitaskencodingwithlogloss.Usingthesethreescenarios, recordsinsteadofpoint-based. asignificantnumberofmodelsusingthefollowingencoders BERT has been demonstrated to be a better embedding aretrained: compared to GloVe [50], as BERT produces a contextual 1) None refers to fine-tuning BERT [16] on the dataset', '. GloVe pretrained word embedding is used for vector representation of English words, while FastText pretrainedword embeddingis usedfor vectorrepresentation ofIndonesian words.Moreover, anauxiliary pragmatic feature illustrating the number of pragmatic markers in tweets was incorporated to enhance detection performance', '. Section VI discloses the challenges, limitations, and threats to the validity of the study. The conclusion and future works are elaboratedinSectionVII. II. RELATEDWORK This section discusses closely relevant prior studies on log-based anomaly detection and different approaches to FIGURE3. A2DvisualisationofthedatasetusingBERT[16]and handleclassimbalanceproblems. t-SNE[17].Itshowsthatthesamplesarenotlinearlyseparated;samples belongtodifferentclassesareclosetooneanother. A', '. Bidirectional Encoder Representations from Transformers Therefore, several studies explored utilising a point-based (BERT)[16]afterundergoingadimensionalreductionusing approach to detect anomalous events on logs data, such thet-SNE[17]. as in operating systems [9], [10], drone devices [11], and This paper is a further experiment of the previous initial distribution systems [9], [10]']",BERT has been shown to provide superior contextual embeddings for log message representation compared to traditional methods like GloVe.,"log message m = [w1, w2, . . . , wn] from the dataset D = {(mi, ci)}|D| i=1 as the input, where c is the label class name, BERT is used to tokenise the input into a fixed length sequence with m maximum length and retrieve the contextual embeddings, resulting in an input matrix X ∈ Rm×dBERT which is then paired with the encoded label y. Thus, the numerical input becomes (X, y). This study aims to train a neural network model Mθ to classify the message m into one of the predefined classes c ∈ C = {high, medium, low, normal}, or can be written as Mθ : m → c. Based on past literature discussed in Section",1.0,0.935132085927796
"final unnormalized logits vector using the following equation: α = zW⊤ + b, ∈ R|C| (3) where W ∈ R|C|×768, and b ∈ R|C| are the typical trainable weight and bias parameters in a linear layer. Knowing that the number of classes is more than two, the task belongs to multiclass classification. Typically, the target label is represented in a one-hot encoded vector, as depicted in Fig. 8a. Therefore, the training objective is to minimise the cross-entropy loss, which is computed using the following equation: LCE(y, ˆy) = − |C| yi · log(ˆyi) i=1 ˆy = softmax(α) (4) (5) where y and ˆy are the truth and the predicted label probability distribution respectively. The normalized logits in Eq. 5 is","['. cross-entropy loss as defined in Eq 1 where weighting the The next step after performing pooling is to feed the persamplelossiswrittenasthefollowingEq4: ¯ vectorhtothelinearlayer,yieldingtheunnormalisedlogits z ∈ R|C|, where |C| denotes the number of target class in LCE∗ =− X |C| α ·y ·log(yˆ ) (4) thedataset.Duringthetrainingphase,thesevectorsareused i i i to compute the loss and update the parameter of the model i=1 afterpassingthroughanormalisationfunction.Forthetypical where α denotes the weight for', '. Another i one-hot encoding representation of the label, the standard way of performing weighting to loss function is to penalise cross-entropy is used to compute the loss, as defined in the the prediction with a low confidence score, called Focal followingequation: loss [42]. This is achieved by transforming the ratio of the loss value between high-confidence and low-confidence |C| LCE =− X y ·log(yˆ ) (1) prediction probabilities', '. This result highlights the advantage of decreasing values of training loss (t-lss) and validation Indo-BiEnt in providing more consistent and balanced loss (v-lss), indicating better generalization and reduced classificationacrossallinferencecategories. overfittingasthetrainingdatavolumeincreases', '. MACHINE LEARNING PARAMETERS Evaluatioin metrics ML models Parameters Models MSE RMSE MAE max_depth: 10, min_samples_split: 2, RF SARIMAX 639714.51 799.82 650.35 n_estimator: 50 RF 1384875.01 1176.80 958.96 learning_rate: 0.05, max_depth: 3, XGBoost XGBoost 1389609.34 1178.81 961.11 n_estimators: 100 GBM 1406810.24 1186.09 971.82 learning_rate: 0.2, max_depth: 3, n_estimators: LightGBM LSTM 16816.55 129.67 103.94 100 Authorized licensed use limited to: Institut Teknologi Sepuluh Nopember', '. probabilities between 0 and 1. During training, we applied the Specifically, the distillation loss function was designed to binary cross-entropy loss across all labels to supervise minimize the discrepancy between the feature representations abnormality detection of the student and the teacher models']","The cross-entropy loss is computed using the unnormalized logits vector, where the loss function is defined as LCE = − ∑ |C| α · y · log(ŷ) (4), indicating the relationship between logits and loss in multiclass classification (Severity-Oriented Multiclass Drone Flight Logs Anomaly Detection).","logits z ∈ R|C|, where |C| denotes the number of target class in the dataset. During the training phase, these vectors are used to compute the loss and update the parameter of the model after passing through a normalisation function. For the typical one-hot encoding representation of the label, the standard cross-entropy is used to compute the loss, as defined in the following equation: |C| LCE = − yi · log(ˆyi) i=1 ˆy = softmax(z) exp(zi) ˆyi = Pdim(z) exp(zj) (1) (2) (3) where y and ˆy are the true label vector and the prediction probability distribution, respectively. The prediction proba- bility ˆy is obtained from Eq 2, where each of the element in ˆy is computed using Eq 3.",0.25,0.9487532377701042
"we further analyse the effect of increasing the prediction threshold upon inferring the label. As the threshold value is closer to 1, a notable decrease can be seen in Fig. 13b, starting from 0.94. Conversely, the unfiltered dataset in Fig 13a shows a negligible decrease. C. ERROR ANALYSIS C. ERROR ANALYSIS This section discusses the confusion matrix, learned rep- resentation, and the interpretability of the best-performing model on the filtered dataset. The confusion matrix in this paper is redefined to align with the anomaly severity context, where the distance between true and predicted labels matters. If the predicted label is lower than the true label, we define it False Positive (FP). Conversely, if the true label is lower than the","['. performance evaluation score, where the highest accuracy Following the definition in the previous paragraph, we plot is under 85%, the model needs further improvement so that the frequency of each misclassification type in Fig 13 and thedetectionvaliditycanbeenhancedandthatthedetection Fig 14', 'that could be vital for accurate classification [40]', "". These metrics can be calculated by (1) – (3). This study's calculation of True Positive, False Positive, and False Negative differs from other classifications or detections [20]-[23]. These are chosen and calculated following previous studies [1]. Precision detects the truly correct prediction out of all predictions. Recall detects the truly correct prediction out of all actual classes. F1 scores are harmonic mean between these two that measure overall model performance"", '. After conducting when λ = 0.65, the accuracy reaches 97%, exceeding the an experiment on a certain dataset and task, verifying and best model’s accuracy when λ = 0.5. This happens when checking which component in the model contributes posi- thepredictionconfidencescoresurpassesthethresholdwhile tively to the performance is crucial. Therefore, we perform the true label’s severity is lower than the prediction label’s', '. Section VI discloses the challenges, limitations, and threats to the validity of the study. The conclusion and future works are elaboratedinSectionVII. II. RELATEDWORK This section discusses closely relevant prior studies on log-based anomaly detection and different approaches to FIGURE3. A2DvisualisationofthedatasetusingBERT[16]and handleclassimbalanceproblems. t-SNE[17].Itshowsthatthesamplesarenotlinearlyseparated;samples belongtodifferentclassesareclosetooneanother. A']",The prediction confidence scores surpass the threshold while the true label’s severity is lower than the prediction label’s (Severity-Oriented Multiclass Drone Flight Logs Anomaly Detection).,"each scenario. FIGURE 14. The number of misclassified samples from the best-performing model on each loss function tested on the unfiltered dataset. In a binary setting, let the Normal class be positive and the Anomaly is negative. Then, False Positive (FP) refers to samples with a true label negative but predicted as positive. At the same time, a False Negative (FN) is a case when a sample belongs to a positive class but is predicted as negative. However, in this study, we define the misclassification cases differently: • False Positive refers to a case when the true class is higher than the predicted class. • False Negative is a misclassification case where the true class is lower than the predicted",0.6666666666666666,0.9444998563853239
"align with the anomaly severity context, where the distance between true and predicted labels matters. If the predicted label is lower than the true label, we define it False Positive (FP). Conversely, if the true label is lower than the predicted label, we define it False Negative (FN). In this context, having less FP is more important than having less FN, as the task objective is anomaly severity detection, where we aim to detect all abnormalities along with the severity level. Therefore, undetected abnormalities, or detecting higher severity as lower ones, indicate that the model fails to meet the task’s objectives. Fig 14 shows the comparison of the confusion matrix between experimented scenarios and a baseline from previous work .","['. Section VI discloses the challenges, limitations, and threats to the validity of the study. The conclusion and future works are elaboratedinSectionVII. II. RELATEDWORK This section discusses closely relevant prior studies on log-based anomaly detection and different approaches to FIGURE3. A2DvisualisationofthedatasetusingBERT[16]and handleclassimbalanceproblems. t-SNE[17].Itshowsthatthesamplesarenotlinearlyseparated;samples belongtodifferentclassesareclosetooneanother. A', '. Even though all scenarios result in a well- approach is better than the previous work baselines while separated representation, none of the scenarios reflects the beinginferiortoourbaselinescenariobasedontheaccuracy ordinalnatureofthelabel.OnewouldexpecttheHighclassto and F1 scores. From the anomaly detection perspective, befarfromtheLowclass,representingthedistancebetween the proposed method achieves higher prediction confidence theseverityoftheanomalies', '. For Log-based anomaly detection has been applied widely instance,generatingmoresamplesofminorityclassesusing to various systems, such as operating systems [9], [10], the Synthetic Minority Oversampling Technique (SMOTE) parallel file systems [26], drones [11], [18], [20], internet canimprovethedetectionperformanceofadeepQnetwork of things [28], and industrial control systems [29]. Among (DQN)-based [33] and deep neural network (DNN)-based these studies, a sequence-based approach is the common [34] models', '. The remainder of the paper is structured as follows: Section II discusses relevant previous studies related to log-based anomaly detection and how to deal with class imbalanceproblemsinlog-basedanomalydetectiontask,the proposed framework is explained in detail in Section III, Section IV provides the experimental setup, followed by SectionVwheretheexperimentalresultsalongwithcomprehensive analyses and discussions are presented', '. proposed an isolation forest (IF)-based method to perform Taking an n-length log message m = [w ,w ,...,w ] 1 2 n anomalydetectionwithvariouscontaminationratios.Similar from the dataset D = {(m,c)}|D| as the input, where c i i i=1 totheensemble,trainingtwodetectionmodelsfordetecting is the label class name, BERT is used to tokenise the input the normal and anomalous events separately can reduce into a fixed length sequence with m maximum length and false positive cases [39]']",The proposed method can reduce false positive cases by training two detection models for normal and anomalous events separately.,"study, we define the misclassification cases differently: • False Positive refers to a case when the true class is higher than the predicted class. • False Negative is a misclassification case where the true class is lower than the predicted class. Table 7 shows the position of FP and FN based on the above definition in a multiclass confusion matrix. VOLUME 12, 2024 64263 S. Silalahi et al.: Severity-Oriented Multiclass Drone Flight Logs Anomaly Detection FIGURE 15. A 2D visualisation of the filtered dataset representation obtained from the best model from each loss function tested on the filtered dataset. t-SNE is used to reduce the dimension of the embeddings. In an anomaly detection setting, FP is more important than FN",0.3333333333333333,0.9031640161834878
"model plays a significant role in performing the task is crucial to developing a high-performing model. To this end, in this paper, an ablation study is performed. First, we investigate the effect of employing multitask learning on the model’s performance. Secondly, we investigate the effect of using all zeroes for the Normal class label’s representation. Thirdly, the importance of the [CLS] token’s embedding vector and the BERT’s parameters are investigated. Lastly, we com- prehensively study the effect of the proposed DroneSBERT embedding on the model’s performance, interpretability, and learned representations. Overall, the multitask label can improve the detection performance, where the best-performing models on both datasets are achieved by the proposed Multitas-111 label. Using all zeroes to represent the Normal","['. Contrary to the other three baselines, this hotencodingwithfocalloss.Theproposedscenarioemploys study performed the detection on the sequence of log multitaskencodingwithlogloss.Usingthesethreescenarios, recordsinsteadofpoint-based. asignificantnumberofmodelsusingthefollowingencoders BERT has been demonstrated to be a better embedding aretrained: compared to GloVe [50], as BERT produces a contextual 1) None refers to fine-tuning BERT [16] on the dataset', '. This simplicity often leads 7% gap between its highest and lowest per-class accuracies to more straightforward model architectures and training (seeFigure6B). processes [42]. However, in RTE tasks where the problem The use of GloVe and FastText, despite being non- domainisinherentlymulti-labelandhighlycomplex,multicontextual embeddings, proved to be more compatible label classification provides more accurate and realistic and efficient for our proposed Biplet-based architecture. problemmodeling', '. (1) • We trained the model using pretrained weights obtained from training on a larger dataset, COCO. (2) By using these pretrained weights, we could leverage feature representations learned from a rich and (3) diverse dataset, thereby speeding up convergence and improving detection accuracy on our dataset', 'ity, ultimately improving detection results', '. We additionally evaluated IndoBERT [3], which is to classify in RTE tasks [16], shows a comparable accuracy a transformer-based language model trained on Indonesian totheothertwolabels,highlightingthemodel’seffectiveness text. inhandlingsemanticallyambiguouscases. In contrast, the IndoBERT model (Figure 6(b)), despite achieving higher overall accuracy, exhibits label imbalance, B']",,"proposed scenario can improve the detection performance of the model. D. ABLATION STUDY D. ABLATION STUDY Following the rapid advancement in neural network research, more complex and sophisticated architectures are emerging. A model can consist of layers of components that have a specific role in the learning process. After conducting an experiment on a certain dataset and task, verifying and checking which component in the model contributes posi- tively to the performance is crucial. Therefore, we perform an ablation study to explain which part of the proposed approach has a significant impact on the performance. Note that only the best-performing scenario on each dataset is explored. First, we investigate the significance of the CLS token from the BERT embedding. Secondly,",,0.0
"DroneSBERT embedding on the model’s performance, interpretability, and learned representations. Overall, the multitask label can improve the detection performance, where the best-performing models on both datasets are achieved by the proposed Multitas-111 label. Using all zeroes to represent the Normal class helps the model distinguish the normal and abnormal samples, improves the model’s performance (see Table 9), reduces the false positive (see Fig. 14), and learns better representation (see Fig. 15). As shown in Table 9, excluding the [CLS] token’s vector and freezing BERT’s parameter during training deteriorate the model’s performance. Therefore, including [CLS] token’s feature and tuning BERT’s parameter have a positive impact on the model’s performance. Based on these findings, embedding plays a significant role in performing the","['. In this work, the distinctive feature events from all aspects of the drone, including sensors, lies within the employment of a sequence classification componentsandfeatures[2]. model with a multitask label to train a detection model for Typically, existing log-based anomaly detection studbetter performance. An extensive experiment is conducted ies classify log events into two categories: normal and on several different encoders commonly used in log-based anomaly [3]', '. CONCLUSIONANDFUTUREWORK ofFP(1),FN(1),andFN(2). In this paper, we demonstrate how to train a log-based Other than analysing the misclassified samples, we also anomaly detection model that can prioritise the prediction analyse the learned representation of the dataset by each of of higher severity anomalies on drone flight logs while the best-performing models. The filtered dataset is used to increasing the prediction confidence score at the same investigatethelearnedrepresentationplottedinto2Dgraphs, time', '. The proposed representation of the label improves the prediction confidence score on variousencodertypeswith8.6%and1.8%fromfocalandcross-entropyscenariosonaverage,respectively. INDEX TERMS Anomaly detection, digital forensics, drone forensics, multitask learning, transformer encoder,informationsecurity. I', '. Even though all scenarios result in a well- approach is better than the previous work baselines while separated representation, none of the scenarios reflects the beinginferiortoourbaselinescenariobasedontheaccuracy ordinalnatureofthelabel.OnewouldexpecttheHighclassto and F1 scores. From the anomaly detection perspective, befarfromtheLowclass,representingthedistancebetween the proposed method achieves higher prediction confidence theseverityoftheanomalies', '. Contrary to the other three baselines, this hotencodingwithfocalloss.Theproposedscenarioemploys study performed the detection on the sequence of log multitaskencodingwithlogloss.Usingthesethreescenarios, recordsinsteadofpoint-based. asignificantnumberofmodelsusingthefollowingencoders BERT has been demonstrated to be a better embedding aretrained: compared to GloVe [50], as BERT produces a contextual 1) None refers to fine-tuning BERT [16] on the dataset']","The proposed representation of the label enhances prediction confidence scores by an average of 8.6% and 1.8% across different encoder types, indicating its effectiveness in improving model performance (Severity-Oriented Multiclass Drone Flight Logs Anomaly Detection).","to explain which part of the proposed approach has a significant impact on the performance. Note that only the best-performing scenario on each dataset is explored. First, we investigate the significance of the CLS token from the BERT embedding. Secondly, we analyse the impact of freezing the BERT’s parameter during training. Thirdly, we vary the batch size during the training. Finally, FIGURE 11. Analysis of the effect of different batch sizes on the evaluation scores of the best-performing models. we examine the effect of increasing the prediction threshold used in our proposed approach on the accuracy and F1 scores. As shown in Table 6, excluding the CLS token embedding before feeding the input matrix to the encoder significantly decreases performance.",0.3333333333333333,0.9133670620265715
"on critical findings. The proposed embedding, DroneSBERT, improved the trustworthiness of the model, as evidenced by the word’s importance report. Despite the promising results, the model’s generality remains untested as the training dataset contains only log messages acquired from 82 drone models, mostly from DJI. This is one of the main challenges in drone forensics research, where human-readable flight log datasets from other drone models are unavailable. In the future, we plan to explore the flight logs of other drone models to train more general anomaly detection models. As for the method, multi- objective learning that employs multiple loss functions to train an anomaly detection model will be explored. DATA AVAILABILITY The dataset used in the experiment is available upon","['. The proposed representation of the label improves the prediction confidence score on variousencodertypeswith8.6%and1.8%fromfocalandcross-entropyscenariosonaverage,respectively. INDEX TERMS Anomaly detection, digital forensics, drone forensics, multitask learning, transformer encoder,informationsecurity. I', '. with limitations and threats to validity. As drone forensics Furtherfuturestudiesmayincludeexploringthepossibility is an emerging topic, there are very limited public datasets of doing high-level oversampling to introduce the models available. The log messages used in this study are mainly with more log message patterns, producing a dataset with acquired from DJI-made devices', '. theexperimentalresults,theTransformerobtainsthehighestF1 In the context of classifying drone malfunctions, the Transscore value of 93.04%. former model can be trained on a dataset of labeled drone Index Terms—drone forensics, forensic investigation, malfunctelemetry data to learn patterns and relationships between the tions, infrastructure, Transformer, Informer, FEDformer drone’s behavior and the root cause of a malfunction. The dataset can include features such as altitude, velocity, battery I', 'robust predictions, enabling drone operators to detect and Furthermore, Jain et al. [10] proposed a framework for diagnose malfunctions quickly and take corrective actions. sensor data identification and verification. An analysis of a Thestructureofthispaperisasfollows.SectionIIpresents drone’sarchitectureandaforensicmodelwithgenericfeatures previous research relating to the drone log analysis and drone are proposed here in order to enhance the digital investigation forensics', '. However, drones can also be involved in the model is trained on labeled data to predict the type of incidentssuchasaccidents,violations,orevencrimes,making malfunctiongivenasetoftelemetrydata.Theoutputcanbea it necessary to investigate drone logs as part of forensic binaryclassification(e.g.,malfunctionvs.nomalfunction)ora investigations. multi-classclassification(e.g.,batterymalfunction,propulsion In a forensic investigation, drone logs are essential sources malfunction, etc.)']","The log messages utilized in the study predominantly originate from DJI-made devices, highlighting the limitations in available datasets for drone forensics research (Severity-Oriented Multiclass Drone Flight Logs Anomaly Detection).","the performance of the proposed framework has been discussed and analysed. In this section, challenges encountered during the study are disclosed, along with limitations and threats to validity. As drone forensics is an emerging topic, there are very limited public datasets available. The log messages used in this study are mainly acquired from DJI-made devices. There is yet to come a publicly available dataset of log messages from other drone manufacturers. Several publicly available datasets are mainly about sensor data and multimedia artefacts . While in this study, we solely depend on the human-readable messages generated by the drone during a flight. Given the condition where a small number of unique messages and most of them are acquired from DJI",0.6666666666666666,0.8674745323273969
"biomedical engineering, macro-scale radars on radio- astronomy, and so on , . However, in PA radars the number of detected targets is limited by the angular and range resolution. More recently, the multi-input multi-output (MIMO) radar has become an interesting research sub- ject –. Unlike the PA radar, the MIMO radar utilizes many antennas that transmit orthogonal signals to obtain the signal reﬂected from the target at the receiver, a scheme known as waveform diversity . Consequently, MIMO radars have been successfully applied for radar imaging, 11248 This work is licensed under a Creative Commons Attribution 4.0 License. For more information, see VOLUME 8, 2020 S. Tahcfulloh, G. Hendrantoro: FPMIMO: General MIMO Structure With Overlapping Subarrays for Various Radar Applications","['. ified delay between successive antennas of a MIMO radar, Multiple simultaneous beams can be generated by employ- intended to produce correlated waveforms with the purpose ing a number of transceivers operating individually, each of acquiring better control over the beampattern. CC have attached to an antenna with a beam pointing at a specified been proposed for application in MIMO radars, originally direction, in total covering a specified angular range', '. Hassanien and S. A. Vorobyov, ‘‘Phased-MIMO radar: A tradeoff theAcademicianoftheRussianAcademyofTransport.HeisalsoaFounding betweenphased-arrayandMIMOradars,’’IEEETrans.SignalProcess., vol.58,no.6,pp.3137–3151,Jun.2010,doi:10.1109/TSP.2010.2043976', '. INDEX TERMS Circulating-codes, Golay-codes, interference, MIMO-radar, multibeam, OFDM-radar, sub-band,surveillance. I. INTRODUCTION Manyradarapplicationsdemandscanningcapabilitytoallow The associate editor coordinating the review of this manuscript and coverage over a range of angular direction, such as those approvingitforpublicationwasXueboZhang . forsurveillance,vehicular,weathermonitoring,imaging,and 2025TheAuthors.ThisworkislicensedunderaCreativeCommonsAttribution4.0License', '. SNR for target [11] G. Krieger, ‘‘MIMO-SAR: Opportunities and pitfalls,’’ IEEE Trans. range detection can be optimized by varying the number of Geosci. Remote Sens., vol. 52, no. 5, pp.2628–2645, May 2014, doi: orthogonalsymbolsperframe. 10.1109/TGRS.2013.2263934. Sincemostprocessesmainlydependonthearrangementof [12] D.-S.JangandH.-L.Choi,‘‘Interleavedradarpulseschedulingformultitargettrackingwithmultiplesimultaneousreceivebeams,’’IEEETrans. thetransmittedwaveformsandtheprocessingofthereceived Aerosp', '. [21] Z. Xu and A. Petropulu, ‘‘A bandwidth efficient dual-function radar communication system based on a MIMO radar using OFDM waveforms,’’ IEEE Trans. Signal Process., vol. 71, pp.401–416, 2023, doi: 10.1109/TSP.2023.3241779. [22] U.B.SaracandG.M.Guvensen,‘‘Knowledge-aidedandadaptivebeamsquintawareMIMO-OFDMradardetectorsforISAC,’’IEEETrans.Commun.,earlyaccess,May8,2025,doi:10.1109/TCOMM.2025.3568219. [23] M. Schurwanz, J. Mietzner, and P. A']","The MIMO radar can generate multiple simultaneous beams by utilizing several transceivers, each connected to an antenna directed at a specific angle, thereby covering a designated angular range (Hassanien & Vorobyov, 2010).","forming non-overlapping sub- arrays within the array , naturally limiting the achievable beamwidth of each beam and making inefﬁcient use of the available aperture. A third option can be taken by arranging the array into partially or fully overlapping subarrays coupled with the use of orthogonal waveforms, each associated to a generated beam, a solution belonging to the class of the multi- input multi-output (MIMO) radars discussed below. MIMO radars have developed into a strong contender for multi-antenna radar systems, applying the concept of virtual sensors with orthogonal waveform diversity –. Our interest in MIMO radars in relevance to the problem at hand arises due to their capability to produce multiple orthog- onal beams by selecting an appropriate set of",0.8333333333333334,0.9411297855804772
"form of array radar systems combining the PA and MIMO concepts has been presented by the authors in by the name of Full Phased MIMO (FPMIMO). The FPMIMO radar also serves as a general architecture for multi- antenna radars that employ overlapped subarrays, which also encompass the class of PMIMO radars . Generally in the FPMIMO system employing K transmit antennas arranged into M overlapped subarrays and L receive antennas with N subarrays, the Tx and Rx may cover either the whole C| K and C| L complex space, respectively, or only some subspace of them, i.e., C| M and C| N , respectively. The subarrays in Rx array are also useful to increase the coherent gain even further relative","['. Hassanien and S. A. Vorobyov, ‘‘Phased-MIMO radar: A tradeoff theAcademicianoftheRussianAcademyofTransport.HeisalsoaFounding betweenphased-arrayandMIMOradars,’’IEEETrans.SignalProcess., vol.58,no.6,pp.3137–3151,Jun.2010,doi:10.1109/TSP.2010.2043976', '. By taking as an example the design of long-rangesurveillanceradar,thepaperdiscussesfurtherissuespertinenttotheimplementationoftheCC OFDM MIMO radar, including the beam squinting problem and its remedy, arrangement of the multiple beams, the radar system structure, use of Golay codes for orthogonalization and PAPR mitigation, use of software-definedradarthateliminatestheneedofamplitudeandphasecontrolineachtransmitter,transmit', '. INDEX TERMS Circulating-codes, Golay-codes, interference, MIMO-radar, multibeam, OFDM-radar, sub-band,surveillance. I. INTRODUCTION Manyradarapplicationsdemandscanningcapabilitytoallow The associate editor coordinating the review of this manuscript and coverage over a range of angular direction, such as those approvingitforpublicationwasXueboZhang . forsurveillance,vehicular,weathermonitoring,imaging,and 2025TheAuthors.ThisworkislicensedunderaCreativeCommonsAttribution4.0License', '. The summation of outputs from 1) Thispaperdescribesthereceiverprocessingofmulti- individual receive modules across the array provides beam CC-OFDM MIMO Radar which is designed the array gain and serves to increase the receive SNR for long-range radar surveillance application. The for each beam']","The implementation of CC OFDM MIMO radar involves addressing issues such as beam squinting and the arrangement of multiple beams, which are relevant to the architecture of multi-antenna radars (Hassanien and Vorobyov, 2010).","forming non-overlapping sub- arrays within the array , naturally limiting the achievable beamwidth of each beam and making inefﬁcient use of the available aperture. A third option can be taken by arranging the array into partially or fully overlapping subarrays coupled with the use of orthogonal waveforms, each associated to a generated beam, a solution belonging to the class of the multi- input multi-output (MIMO) radars discussed below. MIMO radars have developed into a strong contender for multi-antenna radar systems, applying the concept of virtual sensors with orthogonal waveform diversity –. Our interest in MIMO radars in relevance to the problem at hand arises due to their capability to produce multiple orthog- onal beams by selecting an appropriate set of",0.5,0.9247216602987198
"works. The third section defines and explains the concepts that underpin our research. The fourth section describes the fundamentals of the proposed method. The fifth section provides the experimental results and analyses the findings. The last Section gives a conclusion and overview of future works. II. RELATED WORK II. RELATED WORK This section discusses research related to the work carried out including the process discovery method, its quality dimen- sions, and graph-based process mining. A. PROCESS DISCOVERY METHODS A. PROCESS DISCOVERY METHODS A data-driven automated method called Process Discovery can locate, map, and record the activities of current business processes. The received data is then automatically analyzed so that it can be automatically recommended in the process modeling or workflow","['. TABLE I provides a detailed not always be clean or well-structured [9]. Moreover, it offers overview of the activities and performance indicators insightful diagnostics about the process flow, helping to associated with the DSS01.01 domain of managed operations. identify bottlenecks and inefficiencies that other algorithms might overlook[16]. B. Process Mining Process mining involves deriving business processes from III', '. practical implementation. [12] R. Sarno and K. Sungkono, “A survey of graph-based algorithms for discovering business processes,” InterACKNOWLEDGMENT nationalJournalofAdvancesinIntelligentInformatics, This research was funded by Institut Teknologi Sepuluh vol.5,no.2,pp.137–149,2019,ISSN:2548-3161.DOI: Nopember (ITS) under Penelitian Dana Departemen Pro10.26555/ijain.v5i2.296. gram, Penelitian Keilmuan, Penelitian Flagship, Penelitian [13] A. Green, P. Guagliardo, L. Libkin, T. Lindaaker, V', '. process mining, data mining, machine learning, 934 885 [21] I.Waspada,R.Sarno,andD.K.R.Sungkono,‘‘Animprovedmethodof ITgovernance,andothertopicsrelatedtoinforma- 935 886 parallelmodeldetectionforgraph-basedprocessmodeldiscovery,’’Int. tionsystemsandcomputersciencefieldsofstudy. 936 887 J.Intell.Eng.Syst.,vol.13,no.2,pp.127–139,Apr.2020. 937 102752 VOLUME10,2022', '. Given its aim is to assess the level of conformity between the reports capability to analyze log data across different systems, process and predefined criteria, and to communicate the results to mining has become popular among companies aiming to relevant users, in this case, the organization responsible for examine their processe Thus, process mining not only plays a establishing information system governance', 'Fig. 1 Log Event Map Inductive Miner is a process mining algorithm used to IV. RESULT AND ANALYSIS construct process models from event logs. Inductive Miner focuses on creating a model that is both simple and This research utilizes a public dataset from Kaggle on comprehensible while accurately representing the behavior automobile insurance claims. The dataset consists of 30,000 cases, 180,000 rows of data, and 15 columns. There are six observed in the event log']","Process mining has become popular among companies aiming to examine their processes, which aligns with the data-driven automated method of Process Discovery discussed in the source paragraph.","into a process, revealing events in emerging cases. Utilizing event logs generated in information systems makes business model development easier. B. Process Mining Process mining is an analytical method used to study, understand, and improve business processes by leveraging data automatically generated by information systems . This technique involves analyzing event logs or records of events that occur within a system, such as business transactions or user activities. From this data, process mining maps the actual workflow, identifies patterns, trends, and anomalies within the process, and objectively measures process performance. Methods for process data mining(PM), present new opportunities for knowledge discovery. C. DISCO C. DISCO Disco is an innovative process mining tool developed by Fluxicon, aimed at helping organizations visualize,",0.5,0.9494185359319439
"more reliable in detecting and handling ICR patterns. B. GRAPH-BASED PROCESS DISCOVERY PLUS B. GRAPH-BASED PROCESS DISCOVERY PLUS PLUS (GPD++) GPD++ consists of the main algorithm for detecting split and join blocks presented in Algorithm 1 and the algorithm for finding the block hierarchy and its types (XOR or AND) in Algorithm 2 and Algorithm 3. GPD++ utilizes the detected block structure to identify ICR in blocks parallel (long). As an illustration of how Algorithm 1 works in finding split-join blocks, an example of a DFG model with one split node (|T| = 1) and one join node is given in figure 4. The input for Algorithm 1 is the DFG model with split-node and join-node information. The results of","["". in the time required to complete specific activities, indicating 3) The Most Common Variants potential areas for process optimization. Specifically, the FIN The process model for the most occurring variant of the → RELEASE activity demonstrates very high efficiency, with cases in the dataset shown in Fig. 4. It starts with a 'NEW' 99% of cases resolved within two days, indicating that the state, progresses through a 'CHANGE DIAGN' stage where transition from completion to release is highly efficient"", 'II. RESEARCHLITERATURE Researchby[16]introducesanimprovedmethodfordetecting parallel process models in graph-based process discovery. A. Previous Research By establishing relationship frequencies and using specific algorithms, the method accurately distinguishes XOR, AND, The research [8] and [9] demonstrates the use of graph and OR relationships', '. Process Discovery study shown in Fig. 2. The process begins at an initial point After preprocessing, process discovery techniques are and follows a sequence of evaluations and decision-making applied to the cleaned data to identify the underlying stages, including the handling of code errors and status Fig. 2. Process Discovery Results Authorized licensed use limited to: Institut Teknologi Sepuluh Nopember. Downloaded on July 14,2025 at 08:18:28 UTC from IEEE Xplore. Restrictions apply.', 'adjustments. There are also paths indicating manual TABLE III. TOP 10 MOST FREQUENT PROCESS PATTERNS interventions and options to modify, bill, or delete data entries. This process model is strategically designed to ensure that Case Activity Traces (Variants) Frequency each case is handled effectively and accurately, considering Ratio specific conditions that arise during the recovery process', '. practical implementation. [12] R. Sarno and K. Sungkono, “A survey of graph-based algorithms for discovering business processes,” InterACKNOWLEDGMENT nationalJournalofAdvancesinIntelligentInformatics, This research was funded by Institut Teknologi Sepuluh vol.5,no.2,pp.137–149,2019,ISSN:2548-3161.DOI: Nopember (ITS) under Penelitian Dana Departemen Pro10.26555/ijain.v5i2.296. gram, Penelitian Keilmuan, Penelitian Flagship, Penelitian [13] A. Green, P. Guagliardo, L. Libkin, T. Lindaaker, V']","An improved method for detecting parallel process models in graph-based process discovery has been introduced, which accurately distinguishes between XOR and AND relationships.","in business process modeling. Using real- life data and public datasets, the research compared GPD++ to traditional methods like Inductive Miner (IM) and Split Miner (SM). Results showed that GPD++ effectively addressed ICRs and detected hierarchical blocks. The paper introduces the Invisible-Task Prime and Non-Prime ITPNP algorithm for mining invisible tasks in process models, focusing on XOR and AND/OR relationships. It detects invisible non-prime tasks in hybrid parallel rela- tionships. Tested on seven models, it outperformed traditional methods, achieving high fitness and precision, especially in complex scenarios. Research by introduces an improved method for detect- ing parallel process models in graph-based process discovery. By establishing relationship frequencies and using specific algorithms, the method accurately distinguishes XOR, AND, and OR relationships.",1.0,0.9319041042422023
"Two nodes with Event label and a relationship with DFG type. D. GRAPH DATABASE D. GRAPH DATABASE Graph database models are defined as the data structure in which schema and instances are modeled as graphs and graph-oriented operations are performed on graphs. It has recently received a great deal of attention in both research and industry due to its capacity to manage vast quantities of data and networks. This paper employs Neo4j GDBMS and the graph query language Cypher to implement the graph. Figure 3 illustrates a straightforward graph model. For the cypher syntax (x:Event p_id: 102)-[r:DFG instance, {Flow:’NEXT’}]->(y) declares the variable x for nodes with the label:Event and the variable r for relations with the label:DFG. Additionally, the p_id","['. Future research could address scalability, and exploring graph analytics in a graph database integrationwithotherframeworks,andadaptationfordifferent (neo4j),” Ph.D. dissertation, Dublin Business School, industries, with our approach holding potential for broad 2022. practical implementation. [12] R. Sarno and K', '. One of the commonly the value of their IT investments, and achieve their business used command languages for Neo4j is Cypher Query Lan- objectives more effectively. guage(CQL).CypherprovidesanintuitiveandexpressivesynC. Term Frequency (TF)-Inverse Document Frequency (IDF) tax for interacting with graph data, allowing users to perform and Long Short Term Memory (LSTM) method various operations such as searching, adding, updating, and deleting data within the Neo4j graph database', '. 20: seqs padded all←normalize(seqs padded all) ▷Normalize In this study, we delve into the realm of Graph Databases, inputdata 21: similarities←model.predict(seqs padded all)[1:] ▷Exclude focusingparticularlyonNeo4j,touncoverthehiddenpotential similaritywithmainsentence and possibilities it offers', '. Our aim is to harness the latent 22: returnsimilarities capabilitiesofGraphDatabases,especiallyNeo4j,inproviding 23: endfunction 24: similarities←predict sim(main sentence,sentences to compare)effective solutions to complex problems. 25: forsentence,similarityinzip(sentences to compare,similarities) do A', '. The results of this process are 0 or exhibiting similarity, those Nodes are designated as showninTABLEV.Thereisadiscrepancybetweenthenumreferences for subsequent Graph Query execution to obtain ber of Objective nodes and HAS OBJECTIVE relationships the necessary Activities based on those Enterprise Goals, as it because one AG can have more than one Objective, and outlined in TABLE IV. The code is executed from a Python one Objective can be related to more than one AG']","Cypher Query Language (CQL) is commonly used with Neo4j, providing an intuitive syntax for interacting with graph data, which includes operations such as searching, adding, updating, and deleting data (Sarno & K, 2022).","example of deﬁning a relationship in Cipher is: ‘‘()–>()’’ i.e., the rela- tionship can never be without source and destination nodes. Similar to nodes, relationship groups can be delimited by 385 specifying labels in square brackets ’’()-[:Label]->()’’ and 386 variables such as ’’()-[variablename:Label]->()’’. Node and 387 relationship variable declarations can be freely combined. 384 383 382 388 A simple graph can be seen in Fig. 3. For example 389 the cipher syntax (x:Event {p_id: 102})-[r:DFG 390 {Flow:’NEXT’}]->(y) will declare the variable x for the node with the label:Event and variable r for relations labeled:DFG. In addition, the p_id attribute is also declared 393 for node x and the Flow attribute for relationship r. 392 394 391 FIGURE 3. Example of",0.75,0.904986610600387
"added in our recent publi- cation also yet tailored for spectrogram images. Instead of relying on resource-intensive transfer learning models, our approach optimizes model efficiency, making it more com- putationally friendly or resource-constrained applications. This contribution aims to streamline the implementation of emotion recognition systems without compromising perfor- mance. The proposed research is based on a simplified deep learn- ing architecture and channel selection approach that leads towards closer and resource-constrained real-time implemen- tation. In addition, research for cross-subject validation is more likely to be implemented widely than dependent subject validation. Cross-subject validation has a better generaliza- tion model than dependent-subject validation. This makes this research applicable across a wide range of industries where emotion recognition enables the development of","['. INDEXTERMS Classification,emotionrecognition,inter-subject,spectrogram. I', '. B. EXPERIMENT1:EMOTIONRECOGNITIONFOR INTRA-SUBJECT The results of the emotion recognition experiment on the DEAP dataset, which is used in the proposed architecture, aredividedintotwoparts:intra-subjectvalidationandintersubject validation. The first part is for intra-subject, which is divided into 4 sub-sections: intra-1 (Exp. 1), where validation is carried out using 32 channels, intra-2 (Exp', '. DigitalObjectIdentifier10.1109/ACCESS.2023.3275565 Simplified 2D CNN Architecture With Channel Selection for Emotion Recognition Using EEG Spectrogram LIAFAROKHAH 1,2,RIYANARTOSARNO 1,(SeniorMember,IEEE), ANDCHASTINEFATICHAH 1,(Member,IEEE) 1DepartmentofInformatics,FacultyofIntelligentElectricalandInformaticsTechnology,InstitutTeknologiSepuluhNopember(ITS),Sukolilo,Surabaya60111, Indonesia 2DepartmentofInformatics,FacultyofTechnologyandDesign,InstitutTeknologidanBisnisASIA,Malang65142,Indonesia', '. [15] D. Shah, G. Gopan K., and N. Sinha, ‘‘An investigation of the multi- [34] O. Bazgir, Z. Mohammadi, and S. A. H. Habibi, ‘‘Emotion recognidimensional(1Dvs.2Dvs.3D)analysesofEEGsignalsusingtraditional tionwithmachinelearningusingEEGsignals,’’inProc.25thNat.and methods and deep learning-based methods,’’ Frontiers Signal Process., 3rdInt.IranianConf.Biomed.Eng.(ICBME),Nov.2018,pp.1–5,doi: vol.2,pp.1–15,Jul.2022,doi:10.3389/frsip.2022.936790. 10.1109/ICBME.2018.8703559. [16] H. Cui, A. Liu, X. Zhang, X', '. [32] Y. Cimtay and E. Ekmekcioglu, ‘‘Investigating the use of pretrained [13] M.A.Asghar,‘‘EEG-basedmulti-modalemotionrecognitionusingbagof convolutional neural network on cross-subject and cross-dataset eeg deepfeatures:Anoptimalfeatureselectionapproach,’’Sensors,vol.19, emotion recognition,’’ Sensors, vol. 20, no. 7, pp.1–20, 2020, doi: no.23,pp.1–16,2019,doi:10.3390/s19235218. 10.3390/s20072034']","The proposed research utilizes a simplified deep learning architecture and emphasizes the importance of inter-subject validation for better generalization in emotion recognition systems (Farokhah et al., 2023).","accuracy performance when using 32 channels either intra-subject or inter-subject. Second, it is desired that the research should lead to the use of minimal channels but well-performing. Third, the architecture com- plexity is seen as a trade-off with the performance measures. Therefore, the proposed research targets all these gaps and investigates inter-subject performance using minimal chan- nels and a simplified architecture, without the need for con- tinuous re-trainings. III. MATERIALS AND METHOD III. MATERIALS AND METHOD The architecture proposed in this study was validated on the DEAP, public dataset. The results of the emotional val- idation experiment using EEG are divided into two parts, namely intra-subject and inter-subject validation. The pro- posed method involves the processing of the raw data",0.5,0.9425357137558298
"valence and arousal around 80% . Javidan et al. validate cross-subject performance in the valence class (2 channels) utilizing the RReliefF selection strategy with input MSCE and SVR classifiers, yielding an accuracy of 67.45% . Msonda et al. reconstruct features (using 2, 3, 4, 5, 6, 7, and 8 channels) and search for the minimal errors using Adaboost, LR, Linear SVC, Polynomial SVC, and RF, with average performance results between 50 and 60%. Using locally robust feature selection (LRFS), Yin et al. execute channel selection for cross-subject classification with an estimated accuracy of 60% for valence and arousal classes . Arjun et al. employed the attention channel when combined with the LSTM and autoen- coder for cross-subject classification and obtained","['. They perform inter-subject validation with a combination These emotions, transformed into the DEAP dataset, are of several channels that produce a valence accuracy percalledvalenceclasses.Theperformanceobtainedis72.81%. formance of around 50–60%', '. The experimental results show that the performance of the proposed architecture improves the accuracy of the inter-subject emotion recognition using 32 channels by 9.73% and 11.7% on valence and arousal, respectively. While the use of the proposed selected channel method, with only 10 channels, performanceincreasedby3.53%and7.2%onvalenceandarousalclasses,respectively.Thus,bykeepinga lowercomplexitylevel,theproposedarchitectureattainshigherperformancerates', '. With the use of 32 channels, the proposed architecture improves valence and arousal class accuracy from another study by 46340 VOLUME11,2023', '. Msonda et al. performance is 61% for the valence class and 58% for the propose a method based on searching for channel subsets arousal class. Another study used the Inception Resnet-V2 withminimalerrorsbyutilizingthefrequencysub-band[35]. architecture for positive and negative emotion classes [32]', '. B. EXPERIMENT1:EMOTIONRECOGNITIONFOR INTRA-SUBJECT The results of the emotion recognition experiment on the DEAP dataset, which is used in the proposed architecture, aredividedintotwoparts:intra-subjectvalidationandintersubject validation. The first part is for intra-subject, which is divided into 4 sub-sections: intra-1 (Exp. 1), where validation is carried out using 32 channels, intra-2 (Exp']",Msonda et al. achieved an accuracy of 61% for the valence class and 58% for the arousal class in their emotion recognition study.,"the valence class using Densenet-121 is 85.57%, while the performance of the valence class using DCERNET and softmax is 88.57%, and DCERNET and SVM is 88.10%. In addition, the valida- tion of inter-subject emotions using the 2D frame sequences resulted in 68% and 63% accuracy on valence and arousal, respectively . Non-2D research, such as the use of 3D meta-learners, yields valence and arousal performance of 69.92% and 68.89%, respectively . Research on 3D cubes with inter-subjects has been carried out with valence and arousal performances of 84% and 85% . Based on pre- vious studies, it is concluded that the highest accuracy per- formance in the valence class is 88.57% and the arousal class is 85%. Previous inter-subject research",1.0,0.9488513196238468
