question,answer,contexts,ground_truth,faithfulness,answer_relevancy,context_precision,context_recall
"in improved validation results. Using the previous method, Res U-Net produced the best loss value in the validation set generated from the training dataset in 142 epochs. However, by using our proposed approach, the architecture achieves almost identical results, with a loss value of 0.6838005 over 125 epochs. Thereafter, it continues to improve and displays the best results at 152 epochs. The Dense U-Net result shows the most significant results. Since Dense U-Net requires higher computational power due to the dense block used, the training time of this architecture is generally slower than two other architectures. Using our proposed method, the network training time can be significantly faster. However, our method produces better segmentation results and requires a shorter training","The Dense U-Net result shows the most significant results, while Link-Net has demonstrated superior training and validation accuracies, achieving a F1 Score of 0.9636, indicating its effectiveness in segmentation tasks (Left Ventricular Wall Segmentation Using U-Net and Link-Net).","['training and validation accuracies achieved by vances in medical image processing architecture combined Link-Net are 0.9973 and 0.9941. Link-Net is also superior by ob- with the development of deep learning technology have led to taining the highest F1 Score of 0.9636 throughout the testing a paradigm shift in image segmentation. Image segmentation phase. Both architectures have proven effective segmenting the will categorize each pixel in an image to identify and locate left ventricular wall. The findings of this study have been shown structures or Regions of Interest (ROI). In the 2010s, the to facilitate and improve the accuracy of medical practitioners emergence of CNN architecture’s dedicated to the in diagnosing MI. segmentation of medical images revolutionized the development of medical imaging. An architecture designed Keywords—left ventricular wall, Link-Net, segmentation, U- for medical image segmentation is U-Net and Link-Net [7, 8]. Net. In various studies, the U-Net and Link-Net architectures I.'
 'do this segmentation. Both architectures share the use are commonly used to recognize objects. These algorithms are of skip-connections to enhance spatial information. The publicly often used for clsassification tasks, where the output of an available data from Tampere University, Qatar University, and image is a single-class label. However, since the aim of Hamad Medical Corporation (HMC-QU) is chosen to demonmedical image classification is to classify each pixel in the strate the work of these two architectures in segmenting the left image, a medical image architecture is required, and all CNN ventricular wall. The results of the training indicate that LinkNet has a 13% faster training time when compared to U-Net. designs are inappropriate for medical image processing. AdThe highest training and validation accuracies achieved by vances in medical image processing architecture combined Link-Net are 0.9973 and 0.9941. Link-Net is also superior by ob- with the development of deep learning'
 '2020, doi: doi: 10.1007/s12559-024-10257-5. 10.1016/j.jacr.2020.02.005. [20] D. P. Kingma and J. L. Ba, “Adam: A method for stochastic [7] O. Ronneberger, P. Fischer, and T. Brox, “U-Net: Convolutional optimization,” 3rd Int. Conf. Learn. Represent. ICLR 2015 - Conf. Networks for Biomedical Image Segmentation,” Lect. Notes Comput. Track Proc., pp. 1–15, 2015. Sci. (including Subser. Lect. Notes Artif. Intell. Lect. Notes [21] A. C. Ian Goodfellow, Yoshua Bengio, “Deep Learning,” Prmu, pp. 1– Bioinformatics), vol. 9351, no. Cvd, pp. 12–20, 2015, doi: 10, 2016, [Online]. Available: www.deeplearningbook.org 10.1007/978-3-319-24574-4. [8] A. Chaurasia and E. Culurciello, “LinkNet: Exploiting encoder 215 Authorized licensed use limited to: Institut Teknologi Sepuluh Nopember. Downloaded on July 14,2025 at 08:17:34 UTC from IEEE Xplore. Restrictions apply.'
 ""0.9636 0.9109 Net architecture's reputation for being more reliable, effective, and (a) (b) Fig. 4. (a) Histogram F1-Score Testing U-Net and (b) Link-Net 214 Authorized licensed use limited to: Institut Teknologi Sepuluh Nopember. Downloaded on July 14,2025 at 08:17:34 UTC from IEEE Xplore. Restrictions apply. 2024 7th International Conference on Vocational Education and Electrical Engineering (ICVEE) producing superior segmentation outcomes. This confirms the representations for efficient semantic segmentation,” 2017 IEEE Vis. superior segmentation performance of the Link-Net design Commun. Image Process. VCIP 2017, vol. 2018-Janua, no. June, pp. 1–4, 2017, doi: 10.1109/VCIP.2017.8305148. over U-Net. [9] D. B. Unggul, N. Iriawan, and H. Kuswanto, “Dense-UNet with This paper presents a comparison of the performance be- Network-Based Transfer Learning for Left Ventricular Wall tween two segmentation methods in medical imaging. How- Segmentation,” ICITDA 2023 - Proc. 2023 8th Int. Conf. Inf. Technol. Digit. Appl., pp. 1–6, 2023, doi: 10.1109/ICITDA60835.2023. ever, the implementation""
 'Atrial Segmentation,” Appl. Sci., vol. 12, no. 8, 2022, doi: 10.3390/app12083764. [18] Y. Zhang et al., “Brain Tumor Segmentation From Multi-Modal MR Images via Ensembling UNets,” Front. Radiol., vol. 1, no. October, pp. 1–11, 2021, doi: 10.3389/fradi.2021.704888. [19] H. Mzoughi et al., “Deep Multi-Scale 3D Convolutional Neural Network (CNN) for MRI Gliomas Brain Tumor Classification,” J. Digit. Imaging, vol. 33, no. 4, pp. 903–915, Aug. 2020, doi: 10.1007/s10278-020-003479. [20] P. Coupeau, J. B. Fasquel, E. Mazerand, P. Menei, C. N. MonteroMenei, and M. Dinomais, “Patch-based 3D U-Net and transfer learning for longitudinal piglet brain segmentation on MRI,” Comput. Methods Programs Biomed., vol. 214, p. 106563, 2022, doi: 10.1016/j.cmpb.2021.106563. [21] M. Lee et al., “Split-attention u-net: A fully convolutional network for robust multi-label segmentation from brain mri,” Brain Sci., vol. 10, no. 12, pp. 1–22, 2020, doi: 10.3390/brainsci10120974. [22] F. Khodadadi Shoushtari, S. Sina, and A. N. V. Dehkordi, “Automatic segmentation']","num- ber of parameters is directly proportional to the results of the average loss and average accuracy in training and validation. The U-Net design performs better than Link-Net on average, with smaller training and validation loss values and higher training and validation accuracy values. Table 1 show that the average loss in U-Net is 21% greater than Link-Net, but with the sacrifice of longer training time. So that the Link-Net ar- chitecture provides more stable and parsimonious results. TABLE I. PERFORMANCE SUMMARY OF U-NET AND LINK-NET ARCHITECTURES Training Validation Model U-Net Link- Net Average Loss (St. Dev.) 0.0101 (0.0065) 0.0123 (0.0076) Average Accuracy (St. Dev.) 0.9956 (0.0027) 0.9948 (0.0027) Average Loss (St. Dev.) 0.0188 (0.0194) 0.0216 (0.0057) Average Accuracy (St.",0.8,0.7662178395935392,0.0,0.0
"company goals by proposing a novel recommendation system for internal business processes, grounded in the COBIT 2019 framework. The system employs graph algorithms to map relationships, semantic similarity measure- ments to align enterprise goals with management objectives, and LSTM combined with TF-IDF methods to analyze and recommend specific activities. Experimental results show that this system optimizes IT management practices, enhances operational efficiency, and ensures regulatory compliance. Additionally, a user-friendly graphical representation of internal business pro- cesses using Neo4j enables stakeholders to visualize complex relationships within the COBIT framework, facilitating informed decision-making. This research advances IT governance practices by providing organizations with a valuable tool to automate and improve IT strategies, effectively achieving business objectives. Index Terms—COBIT 2019, graph algorithms, IT","This research aims to simplify the process of obtaining COBIT 2019 activities automatically from company strategy input, aligning with enterprise goals (Novel Activity Recommendation System of Financial Balance Scorecard for COBIT 2019 Based on Company Strategy).","['14,2025 at 08:18:28 UTC from IEEE Xplore. Restrictions apply. II. RESEARCHLITERATURE Researchby[16]introducesanimprovedmethodfordetecting parallel process models in graph-based process discovery. A. Previous Research By establishing relationship frequencies and using specific algorithms, the method accurately distinguishes XOR, AND, The research [8] and [9] demonstrates the use of graph and OR relationships. Testing in four scenarios achieved a databasesandKnowledgeGraphs(KGs)combinedwithNatu100% fitness rating, significantly improving accuracy over ralLanguageProcessing(NLP)techniquestoenhancevarious existing methods. applications. [8] integrates graph databases with TF-IDF and Sentence-BERT (SBERT) to merge business process models B. Previous Research of Audit using COBIT 2019 based on semantic similarities, preprocessing data to calculate PreviousresearchonauditingwithCOBIT2019hasinvestithese similarities and effectively merging nodes and relationgated multiple facets of IT governance and auditing, applying ships. the framework across diverse domains and industries. One The research by [10] introduce method for semantic modmajor area of research is the application of the COBIT 2019 eling of organizational knowledge aimed at enhancing data framework in'
 'using whereeachpieceofinformationisapointconnectedtoothers TF-IDF and cosine similarity. Goals with high similarity scores by lines that show how they are linked [2]. trigger a graph query to reveal connected activities. The results show a list of recommended activities based on the company In previous research, as found in the paper [3], [4], [5] strategy, this can simplify the company audit process. and [6] to obtain Activities from the COBIT Core Model Keywords—Audit Management, COBIT 2019, Cosine Similar- and Capability Scores, it is necessary to undergo a mapping ity, Financial, Knowledge Graph, Neo4J process according to the instructions in the COBIT 2019 manual. This can be time-consuming, especially when auditor I. INTRODUCTION should auditing multiple companies simultaneously. Effective data and information management are vital for ThisresearchaimtosimplifytheprocesstogetActivitiesof businesses in rapidly evolving landscape nowadays. Imple- COBIT2019automaticallyfromInputTextCompanyStrategy menting an IT governance framework is crucial for several that aligned with the description of related Enterprise Goals. reasons.'
 'Scorecard. The motivation stems from Scorecard (BSC), Enterprise Goals (EG), Alignment Goals the challenges faced by auditors when identifying essential (AG), and Objectives (COBIT Core Model) that have interactivities aligned with strategy of a company, often hindered by manual COBIT 2019 guideline navigation. To address this, related relationships that can be easier to read the relationship a system was developed, where inputting the company strategy, inaformofKnowledgeGraph(KG).AKnowledgeGraphisa triggersthedisplayofrecommendedactivitiesautomatically.The wayoforganizingreal-worldfactsandconnectionsbyusinga methodologyinvolvedcreatinginterconnectednodesfromCOBIT graph structure, where nodes represent things and edges show 2019 Element in Neo4J. This research uses a real strategy plan how they are related. It is like building a map of knowledge, case study from 3 different companies as input, followed by a preprocessing step, then compares it to Enterprise Goals using whereeachpieceofinformationisapointconnectedtoothers TF-IDF and cosine similarity. Goals with high similarity scores by lines that show how they are linked [2]. trigger a graph query to reveal connected activities. The results'
 'collection (inverse document frequency) [21]. latedwiththeBalancedScorecardFinancial.Then,Alignment 5) Cosine Similarity: This process quantifies the similarity Goals related to these Enterprise Goals were mapped. Subsebetween two vectors in a high-dimensional space. It is com- quently,ManagementObjectivesfromtheCOBITCoreModel puted as the cosine of the angle between the vectors, derived associatedwithAlignmentGoalswereidentified.Examplesof from their dot product divided by their magnitudes [22]. thesemappingsareshowninTABLEI.Followingthis,Activities and their descriptions were compiled for each Management Objective, based on COBIT guidelines, as demonstrated inTABLEII.Atotalof1202activitieswerefoundtocorrelate TABLEII EXAMPLEOFMAPPINGOBJECTIVETOACTIVITY with the Balanced Scorecard Financial perspective during the mapping process. Objective Activity ActivityDescription Capability EDM01 EDM01.01 Analyze and identify the in- 2 B. Create Graph Database ACT01 ternal and external environmental factors (legal, regula- After the completion of the Mapping process, the next step tory and contractual obligais to create nodes and their relationships using Neo4J Graph tions) and trends in the businessenvironmentthatmayin- DatabaseTools,inordertoconstructaKnowledgeGraphfrom fluencegovernancedesign the mapped results. The procedure for accomplishing this can EDM01 EDM01.01 Determine'
 '14,2025 at 08:18:28 UTC from IEEE Xplore. Restrictions apply. START Input Enterprise Strategy Mapping COBIT 2019 Create Graph Similarity Element Database Preprocessing Measurement Mapping Balance Mapping Tokenizer E S nt c e o r r p e r i C se a r G d o T a o ls Ali t g o n O m b e j n ec t t G iv o e als C R re e a la t t e i o G n r s a h p i h p a fo n r d Calculate TF-IDF Gra S p e h a r Q ch u ery BSC to Objective Stop Word Mapping Removal Enterprise Goals Mapping Objective Create Graph and Calculate Cosine Activity List to Alignment To Activity Relationship for Similarity Goals Activities Lemmatization END Fig.1. FlowchartofActivityRecommendationSystem 2) Stopwords: Stopwordsremovalaresimplyremovingthe words that occur commonly across all the documents']","research introduces a novel Activity Recom- mendation System built on the COBIT 2019 framework tailored for Financial Balance Scorecard. The motivation stems from the challenges faced by auditors when identifying essential activities aligned with strategy of a company, often hindered by manual COBIT 2019 guideline navigation. To address this, a system was developed, where inputting the company strategy, triggers the display of recommended activities automatically. The methodology involved creating interconnected nodes from COBIT 2019 Element in Neo4J. This research uses a real strategy plan case study from 3 different companies as input, followed by a preprocessing step, then compares it to Enterprise Goals using TF-IDF and cosine similarity. Goals with high similarity scores trigger a graph query to reveal connected",0.6666666666666666,0.6831382284212241,0.6791666666496875,1.0
"assist organizations in managing and optimizing their use of information technology (IT) . landscape, effective IT In today’s rapidly evolving digital governance is essential for organizations to ensure that their IT investments align with business objectives, comply with regulations, and mitigate risks . COBIT 2019 provides a structured approach for organiza- tions to establish, implement, and maintain effective gover- nance over IT. It defines the components necessary to create and sustain a governance system, as well as guidelines for building the most suitable governance system for an enterprise . By utilizing COBIT 2019, organizations can enhance the efficiency, effectiveness, and reliability of their IT usage, while also ensuring compliance with relevant regulations, policies, and standards . One of the key","By utilizing the COBIT 2019 framework, organizations can enhance their IT governance and ensure alignment with business objectives (Anjelina & Wella, 2023).","['July 14,2025 at 08:22:06 UTC from IEEE Xplore. Restrictions apply. , vol. 70, pp. 168–176, 2017, doi: [35] S. Mantok, H. Sekhon, GK Sahi, and P. Jones, “EO and 10.1016/j.jbusres.2016.08.022. the mediating role of organizational learning among [23] H. Bouwman, S. Nikou, F.J. Molina-Castillo, and M. De Indian S-SMEs,” J. Small Bus. Enterp. Dev. , vol. 26, Reuver, “The impact of digitalization on business no. 5, pp. 641–660, 2019, doi: 10.1108/JSBED-07models,” Digit. Regulatory Policy. Gov., vol. 20, no. 2, 2018-0215. pp. 105–124, March. 2018, doi: 10.1108/DPRG-07- [36] I. Kurniawan, U. Salim, M. Setiawan, and M. Rahayu, 2017-0039. ""The mediating role of strategy flexibility at the effects [24] R. Kozielski, “Determinants of SMEs business success of EO and market orientation on business performance – emerging market perspective,” Int. J. Organs. Anal. , of small, medium enterprise craft sector in Indonesia,"" vol. 27, no. 2, pp. 322–336, Apr. 2019, doi: Int. J.'
 'research aims to carry out structural calculations is a summary of the results of the bibliographic coupling of Information and Communication Technology (ICT) on the analysis in this study. economy in the Greek case study with a quantitative approach. Authorized licensed use limited to: Institut Teknologi Sepuluh Nopember. Downloaded on July 14,2025 at 08:22:06 UTC from IEEE Xplore. Restrictions apply. Performance Prism is an approach model that describes designed to be flexible and easily adaptable to various company performance in five areas, namely stakeholder organizational contexts. Performance Prism is a model that satisfaction, strategies, processes, and capabilities, there are illustrates corporate performance in five areas: stakeholder 68 research data that use the Performance Prism approach satisfaction, strategy, processes, and capabilities. model. One example of a research method is a study entitled Furthermore, these three methods can be readily customized A Resilience Framework for Digital Transformation in the to meet the'
 ""model. One example of a research method is a study entitled Furthermore, these three methods can be readily customized A Resilience Framework for Digital Transformation in the to meet the specific needs of organizations, enabling Banking Sector: A Systems Thinking Approach by Manzini researchers to tailor performance indicators (KPIs) to align D., (2022). The research discusses how to compile effective with their unique goals and strategies. performance during digital transformation in the bank sector, Previous research explains that several challenges faced in this research, the preparation of performance measurements by researchers in measuring performance using DEA include based on Performance Prism theory is carried out. complex mathematical techniques that require an in-depth Another study is research conducted by Japan's digital understanding of quantitative data analysis and mathematical advance policy towards Performance in multilateral ASEAN's modeling [21]. Researchers must possess strong technical innovation business. When viewed from the distribution of skills""
 ""data related to the to the topics discussed, so they cannot be classified into four performance indicator model can be seen in Fig. 6. other measurement models (BSC, IPMS, DEA, and Performance Prism), here are some research data using Timeliness Need for performance measurement models with 'other' subcategories. Cost 2% Supervision Research the title Japan's Digital Advance Policy Towards Effectiveness 1% Performance in Multilateral ASEAN's Innovation Business by 13% Aujirapongpan S., (2020), the study discusses performance measurement with indicators formulated in accordance with Interpersonal impact6% the research topic, namely Japanese digital foreign direct investment, these indicators are the basis of the performance measurement model. Another research that belongs to the other sub-category category is research conducted by Saheed Quality18% O. (2017) with the title Policy Imperatives for Diverting Quantity Construction Waste from Landfill: Experts' 60% Recommendations for UK Policy Expansion, the study used the Six Sigma Performance Approach Model, the""
 'free from the way for improved operational practices and sustainability stagnation. in the sector. \uf0a7 NOx Reduction Priority: Notably, the variable NOx has the highest average improvement percentage at 78%. This REFERENCES underscores its substantial impact on productivity and efficiency. Managers should prioritize NOx reduction Athanassopoulos, A D, N Lambroukos, and L Seiford. 1999. efforts to improve overall PLTU performance. “Data Envelopment Scenario Analysis for Setting Incorporating these insights, PLTU management can Targets to Electricity Generating Plants.” European develop tailored strategies to enhance performance, minimize Journal of Operational Research 115(3): 413–28. resource waste, and drive improvements in their operations. Bajpai, Vijay Kumar, and Sudhir Kumar Singh. 2014. Moreover, the results from Appendix 2 can serve as a detailed “Meau.” 8(12): 3979–88. guide for the specific areas of improvement within individual Bourne, Mike, Steven Melnyk, and Umit S. Bititci. 2018. PLTUs. “Performance Measurement and Management: Theory and Practice.” International Journal of']","process, an audit involves acquiring and objectively evaluating evidence related to allegations of economic activities and other operations. The aim is to assess the level of conformity between the reports and predefined criteria, and to communicate the results to relevant users, in this case, the organization responsible for establishing information system gover nan nance. One of the proven frameworks for information system auditing is the Control Objectives for Information and Related Technology (COBIT) 2019, which is utilized as the reference framework in this research . COBIT 2019 offers an effective methodology for evaluating the capability of information technology processes, specifically focusing on Deliver, Service and Support - Operation Management. This framework guarantees that the data (DSS01) is received, managed fully,",0.0,0.8081081207823205,0.0,0.2
"technology, thus helping them achieve their business objectives more effectively . Several previous papers still rely on manual approaches to COBIT 2019, which have limitations in providing automated recommendations for audit activities based on company goals. Thus, this research contributes significantly by addressing this gap and overcoming the challenges associated with manual COBIT utilization. The primary objective of this paper is to develop a rec- ommendation system that aligns with the internal business process strategy governed by COBIT 2019. This system aims to help organizations manage risk, ensure compliance, and enhance performance in the context of information technology. To achieve this, the research will utilize graph algorithms to build a recommendation system based on the internal business processes outlined in","This research aims to develop a recommendation system that aligns with internal business processes governed by COBIT 2019, which simplifies the process of obtaining activities aligned with company strategies (Author et al., 2025).","['ygolonhceT no ecnerefnoC lanoitanretnI dn2 4202 Authorized licensed use limited to: Institut Teknologi Sepuluh Nopember. Downloaded on July 14,2025 at 08:18:28 UTC from IEEE Xplore. Restrictions apply. security, and operational efficiency of their information specific areas of IT management. COBIT 2019 provides systems. comprehensive guidance for understanding, planning, and implementing effective and efficient IT management Sungkono K et al., [13] explores the use of graphs to principles [21]. By adopting COBIT 2019, organizations can identify incorrect judgments and patterns in corporate improve their IT performance, reduce risks, and ensure that IT operations. This research aims to assist companies in is used to support the achievement of business objectives preventing fraud by identifying anomalies in their business optimally. processes. The proposed graph-based method provides a unique approach in identifying these anomalies and improving Domain DSS01 in COBIT 2019, titled ""Define and operational efficiency. An analysis of the method\'s Manage Service Levels,""'
 '14,2025 at 08:18:28 UTC from IEEE Xplore. Restrictions apply. II. RESEARCHLITERATURE Researchby[16]introducesanimprovedmethodfordetecting parallel process models in graph-based process discovery. A. Previous Research By establishing relationship frequencies and using specific algorithms, the method accurately distinguishes XOR, AND, The research [8] and [9] demonstrates the use of graph and OR relationships. Testing in four scenarios achieved a databasesandKnowledgeGraphs(KGs)combinedwithNatu100% fitness rating, significantly improving accuracy over ralLanguageProcessing(NLP)techniquestoenhancevarious existing methods. applications. [8] integrates graph databases with TF-IDF and Sentence-BERT (SBERT) to merge business process models B. Previous Research of Audit using COBIT 2019 based on semantic similarities, preprocessing data to calculate PreviousresearchonauditingwithCOBIT2019hasinvestithese similarities and effectively merging nodes and relationgated multiple facets of IT governance and auditing, applying ships. the framework across diverse domains and industries. One The research by [10] introduce method for semantic modmajor area of research is the application of the COBIT 2019 eling of organizational knowledge aimed at enhancing data framework in'
 'framework, focusing on the based Parallel Process Model Matching (WGPPM) method, APO12 domain. They identified areas for improvement and which uses a weighted graph approach to measure similarprovided recommendations to enhance IT governance, emities in parallel business process models by considering the phasizing effectiveness of COBIT 2019 in managing IT risks. frequency of activity relationships. This method outperforms Thesestudieshighlightthebenefitsofframeworkinimproving traditional approaches like GMA, WGED, WNARS, TPED, IT governance in educational institutions. and Cosine-TDP. [12] presents W-LTLDAG, a method that Researchby[4]assessedtheeffectivenessofITgovernance combinesWeighted-LinearTemporalLogic(W-LTL)Treeand at Mandiri University using the COBIT 2019 framework. Weighted Directed Acyclic Graph (wDAG) to enhance the The findings highlighted the critical role of IT governance accuracy of comparing graph-based business process models. in achieving organizational objectives and emphasized the W-LTLDAG effectively distinguishes between graphs with importance of implementing IT governance practices. varying branch weights, providing high similarity scores for The current manual audit process for COBIT 2019 is timeminordifferencesandlowerscoresforsubstantialdifferences,'
 'vital for ThisresearchaimtosimplifytheprocesstogetActivitiesof businesses in rapidly evolving landscape nowadays. Imple- COBIT2019automaticallyfromInputTextCompanyStrategy menting an IT governance framework is crucial for several that aligned with the description of related Enterprise Goals. reasons. Firstly, it enables effective risk management against This research adopts Neo4j, a graph database platform, to cyber threats, data breaches, and regulatory requirements, manage KG and process data related to these objectives, to enhancing resilience and protecting sensitive data. Secondly, gaindeeperandmoreapplicableinsightsintotherelationships it ensures alignment between IT strategies and business ob- between strategic and operational objectives in a company jectives, driving efficiency, innovation, and competitiveness. [7]. Furthermore, this research also involves the function of Lastly, it facilitates compliance with data privacy regulations preprocessing the input text in the form of Company Stratandindustrystandards,ensuringtransparencyandaccountabil- egy using techniques like tokenization, lemmatization, Term ity. Among these frameworks, COBIT is globally recognized Frequency-Inverse Document Frequency (TF-IDF) calculation for overseeing Enterprise Information and Technology (I&T) and measuring'
 'One The research by [10] introduce method for semantic modmajor area of research is the application of the COBIT 2019 eling of organizational knowledge aimed at enhancing data framework in different contexts, such as the development of governance, particularly for clinical research data. Utilizing internal audit models post-ERP system implementation. Semantic Web technologies, they create a metadata-driven, Researchby[5]comparedtheauditprocessconductedafter agile, and semi-automated framework called Data GoverERPimplementationwithanauditmodelutilizingtheCOBIT nance4.0.Thisapproachconsolidatesknowledgefromvarious 2019frameworkintheMonitor,Evaluate,andAssessdomain. sources into a unified clinical data model, ensuring data is ThefindingsdemonstratedthemodelinachievingauditobjecFAIR (Findable, Accessible, Interoperable, Reusable). tiveswithinERPsystems,highlightingtheframework’sutility The research by [11] and Aisyah [12] focus on process in ensuring comprehensive audit coverage and control. model comparison and detection using graph-based similarity Research by [6] and [17] audited academic information measurementtechniques.[11]introducestheWeightedGraphsystems using the COBIT 2019 framework, focusing on the based Parallel Process Model Matching (WGPPM) method, APO12 domain. They identified areas for improvement and which uses a weighted graph approach to measure similarprovided recommendations to']","process, an audit involves acquiring and objectively evaluating evidence related to allegations of economic activities and other operations. The aim is to assess the level of conformity between the reports and predefined criteria, and to communicate the results to relevant users, in this case, the organization responsible for establishing information system gover nan nance. One of the proven frameworks for information system auditing is the Control Objectives for Information and Related Technology (COBIT) 2019, which is utilized as the reference framework in this research . COBIT 2019 offers an effective methodology for evaluating the capability of information technology processes, specifically focusing on Deliver, Service and Support - Operation Management. This framework guarantees that the data (DSS01) is received, managed fully,",0.0,0.7185769467558191,0.49999999995,0.2
"is linked to the appropriate business objec- tives and control needs, thus enhancing overall governance effectiveness . One effective way to perform this mapping is by utilizing a graph database such as Neo4j . Neo4j is a graph database specifically designed to store and manage data with complex relationships . In the context of COBIT 2019, Neo4j can be utilized to build dynamic graphical representations of various COBIT elements . By using Neo4j, organizations can create dynamic and interactive graphical models to better understand and manage the complex relationships between different COBIT 2019 elements . This allows for deeper analysis, real-time monitoring, and better decision-making in IT management, ultimately aiding in the achievement of business goals . In summary, this","As noted in the research, Neo4j serves as a graph database platform that facilitates the management of complex relationships within COBIT 2019, enhancing the understanding of strategic and operational objectives (Sungkono et al., 2023).","['ygolonhceT no ecnerefnoC lanoitanretnI dn2 4202 Authorized licensed use limited to: Institut Teknologi Sepuluh Nopember. Downloaded on July 14,2025 at 08:18:28 UTC from IEEE Xplore. Restrictions apply. security, and operational efficiency of their information specific areas of IT management. COBIT 2019 provides systems. comprehensive guidance for understanding, planning, and implementing effective and efficient IT management Sungkono K et al., [13] explores the use of graphs to principles [21]. By adopting COBIT 2019, organizations can identify incorrect judgments and patterns in corporate improve their IT performance, reduce risks, and ensure that IT operations. This research aims to assist companies in is used to support the achievement of business objectives preventing fraud by identifying anomalies in their business optimally. processes. The proposed graph-based method provides a unique approach in identifying these anomalies and improving Domain DSS01 in COBIT 2019, titled ""Define and operational efficiency. An analysis of the method\'s Manage Service Levels,""'
 'obligais to create nodes and their relationships using Neo4J Graph tions) and trends in the businessenvironmentthatmayin- DatabaseTools,inordertoconstructaKnowledgeGraphfrom fluencegovernancedesign the mapped results. The procedure for accomplishing this can EDM01 EDM01.01 Determine the significance of 2 beobservedinTABLEIII.Thepseudocodeprocessincludesa ACT02 I&T and its role with respect tothebusiness. query load operation for a CSV file, used to import mapping EDM01 EDM01.01 Consider external regulations, 2 datafromthepreviousstep.Thisisfollowedbyaquery merge ACT03 laws and contractual obligaoperation, where in Neo4J, the merge process first checks tions and determine how they should be applied within the whether the node already exists. If the node does not exist, governanceofEnterpriseI&T it will be created. Each node can also have its attribute data Authorized licensed use limited to: Institut Teknologi Sepuluh Nopember. Downloaded on July 14,2025 at 08:18:28 UTC from IEEE Xplore. Restrictions apply. filled in as details. Additionally, the query merge process can be followed by creating relationships between nodes. C. Preprocessing After'
 'the Graph Database. The results of this process are 0 or exhibiting similarity, those Nodes are designated as showninTABLEV.Thereisadiscrepancybetweenthenumreferences for subsequent Graph Query execution to obtain ber of Objective nodes and HAS OBJECTIVE relationships the necessary Activities based on those Enterprise Goals, as it because one AG can have more than one Objective, and outlined in TABLE IV. The code is executed from a Python one Objective can be related to more than one AG. The result application, allowing the Graph Query to receive inputs in of this process can be visualized as a Graph Database. An example visualization of the Knowledge Graph is shown in Fig.2.Thisvisualizationexamplewasobtainedbyperforming TABLEIII GRAPHBASEPSEUDOCODE a Graph Query with the EG name EG02 and displaying only nodes that have a relationship with Objective EDM03. 1.CreateNodeAndRelationshipforBSC,EG,AG&Objective: query_merge bscNode {name: line.bsc} After that, the experiment continued by inputting the comquery_merge egNode pany strategy. This research gain real case'
 '14,2025 at 08:18:28 UTC from IEEE Xplore. Restrictions apply. II. RESEARCHLITERATURE Researchby[16]introducesanimprovedmethodfordetecting parallel process models in graph-based process discovery. A. Previous Research By establishing relationship frequencies and using specific algorithms, the method accurately distinguishes XOR, AND, The research [8] and [9] demonstrates the use of graph and OR relationships. Testing in four scenarios achieved a databasesandKnowledgeGraphs(KGs)combinedwithNatu100% fitness rating, significantly improving accuracy over ralLanguageProcessing(NLP)techniquestoenhancevarious existing methods. applications. [8] integrates graph databases with TF-IDF and Sentence-BERT (SBERT) to merge business process models B. Previous Research of Audit using COBIT 2019 based on semantic similarities, preprocessing data to calculate PreviousresearchonauditingwithCOBIT2019hasinvestithese similarities and effectively merging nodes and relationgated multiple facets of IT governance and auditing, applying ships. the framework across diverse domains and industries. One The research by [10] introduce method for semantic modmajor area of research is the application of the COBIT 2019 eling of organizational knowledge aimed at enhancing data framework in'
 'graph-based method provides a unique approach in identifying these anomalies and improving Domain DSS01 in COBIT 2019, titled ""Define and operational efficiency. An analysis of the method\'s Manage Service Levels,"" addresses the management and performance using an event log from a bank\'s credit establishment of service levels within the scope of an application process revealed that it was 100% accurate in organization\'s IT [22]. Within DSS01, organizations are identifying incorrect patterns and judgments. required to identify specific service requirements, including performance and reliability criteria, and manage user In this research, we will be doing an audit with the COBIT expectations regarding IT services. Additionally, this domain 2019 framework (domain DSS01) and process mining to also covers the measurement and monitoring of service detect processes that do not comply with Standard Operating performance, as well as the adjustment processes necessary to Procedures (SOP). The dataset used consists of automobile ensure that']","COBIT Core Model and Capability Scores, it is necessary to undergo a mapping process according to the instructions in the COBIT 2019 manual. This can be time-consuming, especially when auditor should auditing multiple companies simultaneously. This research aim to simplify the process to get Activities of COBIT 2019 automatically from Input Text Company Strategy that aligned with the description of related Enterprise Goals. This research adopts Neo4j, a graph database platform, to manage KG and process data related to these objectives, to gain deeper and more applicable insights into the relationships between strategic and operational objectives in a company . Furthermore, this research also involves the function of preprocessing the input text in the form of Company Strat- egy using",0.25,0.7211814211195379,0.36666666664833336,0.2
"tool for processing sequential data and learning long-term dependencies, making it a crucial component in many applications of artificial intelligence and machine learn- ing. Choose Suitable Enterprise Goal based on Company Goal by using Similarity LSTM-TF IDF. III. METHODOLOGY III. METHODOLOGY This section outlines the methodology for developing a recommendation system based on COBIT 2019’s internal business processes. The approach integrates data collection, preprocessing, graph database modeling with Neo4j, and rec- ommendation generation using graph algorithms and similarity methods. The complete process shown in figure 1 A. Input Dataset The input dataset comprises information from the COBIT 2019 framework, including internal business processes, control objectives, IT processes, and related elements. Additionally, company-specific goals are incorporated to ensure that the recommendations",The methodology for developing a recommendation system based on COBIT 2019’s internal business processes aims to simplify the process of aligning company strategies with enterprise goals (Novel Activity Recommendation System of Financial Balance Scorecard for COBIT 2019 Based on Company Strategy).,"['using whereeachpieceofinformationisapointconnectedtoothers TF-IDF and cosine similarity. Goals with high similarity scores by lines that show how they are linked [2]. trigger a graph query to reveal connected activities. The results show a list of recommended activities based on the company In previous research, as found in the paper [3], [4], [5] strategy, this can simplify the company audit process. and [6] to obtain Activities from the COBIT Core Model Keywords—Audit Management, COBIT 2019, Cosine Similar- and Capability Scores, it is necessary to undergo a mapping ity, Financial, Knowledge Graph, Neo4J process according to the instructions in the COBIT 2019 manual. This can be time-consuming, especially when auditor I. INTRODUCTION should auditing multiple companies simultaneously. Effective data and information management are vital for ThisresearchaimtosimplifytheprocesstogetActivitiesof businesses in rapidly evolving landscape nowadays. Imple- COBIT2019automaticallyfromInputTextCompanyStrategy menting an IT governance framework is crucial for several that aligned with the description of related Enterprise Goals. reasons.'
 '14,2025 at 08:18:28 UTC from IEEE Xplore. Restrictions apply. START Input Enterprise Strategy Mapping COBIT 2019 Create Graph Similarity Element Database Preprocessing Measurement Mapping Balance Mapping Tokenizer E S nt c e o r r p e r i C se a r G d o T a o ls Ali t g o n O m b e j n ec t t G iv o e als C R re e a la t t e i o G n r s a h p i h p a fo n r d Calculate TF-IDF Gra S p e h a r Q ch u ery BSC to Objective Stop Word Mapping Removal Enterprise Goals Mapping Objective Create Graph and Calculate Cosine Activity List to Alignment To Activity Relationship for Similarity Goals Activities Lemmatization END Fig.1. FlowchartofActivityRecommendationSystem 2) Stopwords: Stopwordsremovalaresimplyremovingthe words that occur commonly across all the documents'
 'collection (inverse document frequency) [21]. latedwiththeBalancedScorecardFinancial.Then,Alignment 5) Cosine Similarity: This process quantifies the similarity Goals related to these Enterprise Goals were mapped. Subsebetween two vectors in a high-dimensional space. It is com- quently,ManagementObjectivesfromtheCOBITCoreModel puted as the cosine of the angle between the vectors, derived associatedwithAlignmentGoalswereidentified.Examplesof from their dot product divided by their magnitudes [22]. thesemappingsareshowninTABLEI.Followingthis,Activities and their descriptions were compiled for each Management Objective, based on COBIT guidelines, as demonstrated inTABLEII.Atotalof1202activitieswerefoundtocorrelate TABLEII EXAMPLEOFMAPPINGOBJECTIVETOACTIVITY with the Balanced Scorecard Financial perspective during the mapping process. Objective Activity ActivityDescription Capability EDM01 EDM01.01 Analyze and identify the in- 2 B. Create Graph Database ACT01 ternal and external environmental factors (legal, regula- After the completion of the Mapping process, the next step tory and contractual obligais to create nodes and their relationships using Neo4J Graph tions) and trends in the businessenvironmentthatmayin- DatabaseTools,inordertoconstructaKnowledgeGraphfrom fluencegovernancedesign the mapped results. The procedure for accomplishing this can EDM01 EDM01.01 Determine'
 'Scorecard. The motivation stems from Scorecard (BSC), Enterprise Goals (EG), Alignment Goals the challenges faced by auditors when identifying essential (AG), and Objectives (COBIT Core Model) that have interactivities aligned with strategy of a company, often hindered by manual COBIT 2019 guideline navigation. To address this, related relationships that can be easier to read the relationship a system was developed, where inputting the company strategy, inaformofKnowledgeGraph(KG).AKnowledgeGraphisa triggersthedisplayofrecommendedactivitiesautomatically.The wayoforganizingreal-worldfactsandconnectionsbyusinga methodologyinvolvedcreatinginterconnectednodesfromCOBIT graph structure, where nodes represent things and edges show 2019 Element in Neo4J. This research uses a real strategy plan how they are related. It is like building a map of knowledge, case study from 3 different companies as input, followed by a preprocessing step, then compares it to Enterprise Goals using whereeachpieceofinformationisapointconnectedtoothers TF-IDF and cosine similarity. Goals with high similarity scores by lines that show how they are linked [2]. trigger a graph query to reveal connected activities. The results'
 '14,2025 at 08:18:28 UTC from IEEE Xplore. Restrictions apply. II. RESEARCHLITERATURE Researchby[16]introducesanimprovedmethodfordetecting parallel process models in graph-based process discovery. A. Previous Research By establishing relationship frequencies and using specific algorithms, the method accurately distinguishes XOR, AND, The research [8] and [9] demonstrates the use of graph and OR relationships. Testing in four scenarios achieved a databasesandKnowledgeGraphs(KGs)combinedwithNatu100% fitness rating, significantly improving accuracy over ralLanguageProcessing(NLP)techniquestoenhancevarious existing methods. applications. [8] integrates graph databases with TF-IDF and Sentence-BERT (SBERT) to merge business process models B. Previous Research of Audit using COBIT 2019 based on semantic similarities, preprocessing data to calculate PreviousresearchonauditingwithCOBIT2019hasinvestithese similarities and effectively merging nodes and relationgated multiple facets of IT governance and auditing, applying ships. the framework across diverse domains and industries. One The research by [10] introduce method for semantic modmajor area of research is the application of the COBIT 2019 eling of organizational knowledge aimed at enhancing data framework in']","IX, it can serve as an internal reference for the company to assess its capability to meet these criteria and can also serve as a reference for formulating policies to prioritize the implementation of these activities in the future. V. CONCLUSION V. CONCLUSION In conclusion, the developed Activity Recommendation System based on COBIT 2019 framework offers a practical solution to the challenges faced by auditors in identifying and aligning activities with company strategy. By leveraging NLP techniques and graph queries, the system efficiently matches user input of company strategy with relevant activities automatically, eliminating the need for manual navigation through COBIT 2019 guidelines. The effectiveness of the system was demonstrated by in- putting company strategies from three companies in different",0.3333333333333333,0.7663947822418434,0.249999999975,0.25
"used as references for the next graph query execution to obtain the required activities. The output matches the mapping results, displaying only activities that correlate with Enterprise Goal EG02, which describes ”Optimization of business process functionality.” Using Algorithm 3, a graphical representation is created, as Fig. 3. Mapping Alignment Goals (AG) Fig. 4. Mapping Objectives illustrated in Figure 5. This graphical representation allows users to easily visualize the need for additional activity recommendations without documentation such as spreadsheets, thereby reducing the need for extra work. V. CONCLUSION V. CONCLUSION This paper propose a novel recommendation system for internal business processes based on the COBIT 2019 frame- work. By integrating graph algorithms and similarity methods, our approach provides tailored activity recommendations","This approach simplifies the company audit process by providing a list of recommended activities based on the company strategy, as demonstrated in the novel activity recommendation system developed for COBIT 2019 (Referensi 1).","['Scorecard. The motivation stems from Scorecard (BSC), Enterprise Goals (EG), Alignment Goals the challenges faced by auditors when identifying essential (AG), and Objectives (COBIT Core Model) that have interactivities aligned with strategy of a company, often hindered by manual COBIT 2019 guideline navigation. To address this, related relationships that can be easier to read the relationship a system was developed, where inputting the company strategy, inaformofKnowledgeGraph(KG).AKnowledgeGraphisa triggersthedisplayofrecommendedactivitiesautomatically.The wayoforganizingreal-worldfactsandconnectionsbyusinga methodologyinvolvedcreatinginterconnectednodesfromCOBIT graph structure, where nodes represent things and edges show 2019 Element in Neo4J. This research uses a real strategy plan how they are related. It is like building a map of knowledge, case study from 3 different companies as input, followed by a preprocessing step, then compares it to Enterprise Goals using whereeachpieceofinformationisapointconnectedtoothers TF-IDF and cosine similarity. Goals with high similarity scores by lines that show how they are linked [2]. trigger a graph query to reveal connected activities. The results'
 'using whereeachpieceofinformationisapointconnectedtoothers TF-IDF and cosine similarity. Goals with high similarity scores by lines that show how they are linked [2]. trigger a graph query to reveal connected activities. The results show a list of recommended activities based on the company In previous research, as found in the paper [3], [4], [5] strategy, this can simplify the company audit process. and [6] to obtain Activities from the COBIT Core Model Keywords—Audit Management, COBIT 2019, Cosine Similar- and Capability Scores, it is necessary to undergo a mapping ity, Financial, Knowledge Graph, Neo4J process according to the instructions in the COBIT 2019 manual. This can be time-consuming, especially when auditor I. INTRODUCTION should auditing multiple companies simultaneously. Effective data and information management are vital for ThisresearchaimtosimplifytheprocesstogetActivitiesof businesses in rapidly evolving landscape nowadays. Imple- COBIT2019automaticallyfromInputTextCompanyStrategy menting an IT governance framework is crucial for several that aligned with the description of related Enterprise Goals. reasons.'
 'ygolonhceT no ecnerefnoC lanoitanretnI dn2 4202 Authorized licensed use limited to: Institut Teknologi Sepuluh Nopember. Downloaded on July 14,2025 at 08:18:28 UTC from IEEE Xplore. Restrictions apply. security, and operational efficiency of their information specific areas of IT management. COBIT 2019 provides systems. comprehensive guidance for understanding, planning, and implementing effective and efficient IT management Sungkono K et al., [13] explores the use of graphs to principles [21]. By adopting COBIT 2019, organizations can identify incorrect judgments and patterns in corporate improve their IT performance, reduce risks, and ensure that IT operations. This research aims to assist companies in is used to support the achievement of business objectives preventing fraud by identifying anomalies in their business optimally. processes. The proposed graph-based method provides a unique approach in identifying these anomalies and improving Domain DSS01 in COBIT 2019, titled ""Define and operational efficiency. An analysis of the method\'s Manage Service Levels,""'
 'example ”Reducing the The effectiveness of the system was demonstrated by inrisk of service failure”. The similarity results indicate how putting company strategies from three companies in different closely each enterprise goal aligns with the risk reduction sectors. The system provided a list of recommended activities objective.Mostofthegoals(EG03,EG04)shownoalignment that can be undertaken to achieve strategic objectives of each (similarity score of 0), suggesting that these goals do not companies. contribute to or are unrelated to risk reduction. However, Moving forward, there are opportunities to enhance and two goals—EG01 & EG02, show nonzero similarity scores refine the system to improve both the accuracy of the rec(0.14and0.17),indicatingadegreeofrelevanceto”Reducing ommendationsandtheuserexperience,ensuringitscontinued the risk of service failure”. After executing the Graph Query utility and influence in enterprise governance and audit manSearch process, 1131 activities related to EG01 and 278 agement. Future upgrades could focus on enhancing the user activities related to EG02 were identified. An example of'
 '14,2025 at 08:18:28 UTC from IEEE Xplore. Restrictions apply. II. RESEARCHLITERATURE Researchby[16]introducesanimprovedmethodfordetecting parallel process models in graph-based process discovery. A. Previous Research By establishing relationship frequencies and using specific algorithms, the method accurately distinguishes XOR, AND, The research [8] and [9] demonstrates the use of graph and OR relationships. Testing in four scenarios achieved a databasesandKnowledgeGraphs(KGs)combinedwithNatu100% fitness rating, significantly improving accuracy over ralLanguageProcessing(NLP)techniquestoenhancevarious existing methods. applications. [8] integrates graph databases with TF-IDF and Sentence-BERT (SBERT) to merge business process models B. Previous Research of Audit using COBIT 2019 based on semantic similarities, preprocessing data to calculate PreviousresearchonauditingwithCOBIT2019hasinvestithese similarities and effectively merging nodes and relationgated multiple facets of IT governance and auditing, applying ships. the framework across diverse domains and industries. One The research by [10] introduce method for semantic modmajor area of research is the application of the COBIT 2019 eling of organizational knowledge aimed at enhancing data framework in']","research introduces a novel Activity Recom- mendation System built on the COBIT 2019 framework tailored for Financial Balance Scorecard. The motivation stems from the challenges faced by auditors when identifying essential activities aligned with strategy of a company, often hindered by manual COBIT 2019 guideline navigation. To address this, a system was developed, where inputting the company strategy, triggers the display of recommended activities automatically. The methodology involved creating interconnected nodes from COBIT 2019 Element in Neo4J. This research uses a real strategy plan case study from 3 different companies as input, followed by a preprocessing step, then compares it to Enterprise Goals using TF-IDF and cosine similarity. Goals with high similarity scores trigger a graph query to reveal connected",0.6666666666666666,0.6979484786248857,0.9166666666361111,0.8333333333333334
"the need for extra work. V. CONCLUSION V. CONCLUSION This paper propose a novel recommendation system for internal business processes based on the COBIT 2019 frame- work. By integrating graph algorithms and similarity methods, our approach provides tailored activity recommendations that align with an organization’s strategic goals. We mapped enter- prise goals to management objectives, identified relevant ac- tivities, and used graph queries to retrieve actionable insights. Utilizing Cypher Query Language (CQL) and Neo4j’s graph database, we created an interactive graphical representation of COBIT 2019-governed processes. This allows organizations to visualize relationships between COBIT elements, facilitating deeper analysis, real-time monitoring, and informed IT man- agement decisions. Our results demonstrated the system’s effectiveness in sug- gesting activities tailored to enterprise goals,","This approach provides tailored activity recommendations that align with an organization’s strategic goals, as demonstrated in the development of a novel activity recommendation system based on the COBIT 2019 framework (Novel Activity Recommendation System of Financial Balance Scorecard for COBIT 2019 Based on Company Strategy).","['Scorecard. The motivation stems from Scorecard (BSC), Enterprise Goals (EG), Alignment Goals the challenges faced by auditors when identifying essential (AG), and Objectives (COBIT Core Model) that have interactivities aligned with strategy of a company, often hindered by manual COBIT 2019 guideline navigation. To address this, related relationships that can be easier to read the relationship a system was developed, where inputting the company strategy, inaformofKnowledgeGraph(KG).AKnowledgeGraphisa triggersthedisplayofrecommendedactivitiesautomatically.The wayoforganizingreal-worldfactsandconnectionsbyusinga methodologyinvolvedcreatinginterconnectednodesfromCOBIT graph structure, where nodes represent things and edges show 2019 Element in Neo4J. This research uses a real strategy plan how they are related. It is like building a map of knowledge, case study from 3 different companies as input, followed by a preprocessing step, then compares it to Enterprise Goals using whereeachpieceofinformationisapointconnectedtoothers TF-IDF and cosine similarity. Goals with high similarity scores by lines that show how they are linked [2]. trigger a graph query to reveal connected activities. The results'
 'using whereeachpieceofinformationisapointconnectedtoothers TF-IDF and cosine similarity. Goals with high similarity scores by lines that show how they are linked [2]. trigger a graph query to reveal connected activities. The results show a list of recommended activities based on the company In previous research, as found in the paper [3], [4], [5] strategy, this can simplify the company audit process. and [6] to obtain Activities from the COBIT Core Model Keywords—Audit Management, COBIT 2019, Cosine Similar- and Capability Scores, it is necessary to undergo a mapping ity, Financial, Knowledge Graph, Neo4J process according to the instructions in the COBIT 2019 manual. This can be time-consuming, especially when auditor I. INTRODUCTION should auditing multiple companies simultaneously. Effective data and information management are vital for ThisresearchaimtosimplifytheprocesstogetActivitiesof businesses in rapidly evolving landscape nowadays. Imple- COBIT2019automaticallyfromInputTextCompanyStrategy menting an IT governance framework is crucial for several that aligned with the description of related Enterprise Goals. reasons.'
 '14,2025 at 08:18:28 UTC from IEEE Xplore. Restrictions apply. II. RESEARCHLITERATURE Researchby[16]introducesanimprovedmethodfordetecting parallel process models in graph-based process discovery. A. Previous Research By establishing relationship frequencies and using specific algorithms, the method accurately distinguishes XOR, AND, The research [8] and [9] demonstrates the use of graph and OR relationships. Testing in four scenarios achieved a databasesandKnowledgeGraphs(KGs)combinedwithNatu100% fitness rating, significantly improving accuracy over ralLanguageProcessing(NLP)techniquestoenhancevarious existing methods. applications. [8] integrates graph databases with TF-IDF and Sentence-BERT (SBERT) to merge business process models B. Previous Research of Audit using COBIT 2019 based on semantic similarities, preprocessing data to calculate PreviousresearchonauditingwithCOBIT2019hasinvestithese similarities and effectively merging nodes and relationgated multiple facets of IT governance and auditing, applying ships. the framework across diverse domains and industries. One The research by [10] introduce method for semantic modmajor area of research is the application of the COBIT 2019 eling of organizational knowledge aimed at enhancing data framework in'
 'ygolonhceT no ecnerefnoC lanoitanretnI dn2 4202 Authorized licensed use limited to: Institut Teknologi Sepuluh Nopember. Downloaded on July 14,2025 at 08:18:28 UTC from IEEE Xplore. Restrictions apply. security, and operational efficiency of their information specific areas of IT management. COBIT 2019 provides systems. comprehensive guidance for understanding, planning, and implementing effective and efficient IT management Sungkono K et al., [13] explores the use of graphs to principles [21]. By adopting COBIT 2019, organizations can identify incorrect judgments and patterns in corporate improve their IT performance, reduce risks, and ensure that IT operations. This research aims to assist companies in is used to support the achievement of business objectives preventing fraud by identifying anomalies in their business optimally. processes. The proposed graph-based method provides a unique approach in identifying these anomalies and improving Domain DSS01 in COBIT 2019, titled ""Define and operational efficiency. An analysis of the method\'s Manage Service Levels,""'
 '14,2025 at 08:18:28 UTC from IEEE Xplore. Restrictions apply. START Input Enterprise Strategy Mapping COBIT 2019 Create Graph Similarity Element Database Preprocessing Measurement Mapping Balance Mapping Tokenizer E S nt c e o r r p e r i C se a r G d o T a o ls Ali t g o n O m b e j n ec t t G iv o e als C R re e a la t t e i o G n r s a h p i h p a fo n r d Calculate TF-IDF Gra S p e h a r Q ch u ery BSC to Objective Stop Word Mapping Removal Enterprise Goals Mapping Objective Create Graph and Calculate Cosine Activity List to Alignment To Activity Relationship for Similarity Goals Activities Lemmatization END Fig.1. FlowchartofActivityRecommendationSystem 2) Stopwords: Stopwordsremovalaresimplyremovingthe words that occur commonly across all the documents']","research introduces a novel Activity Recom- mendation System built on the COBIT 2019 framework tailored for Financial Balance Scorecard. The motivation stems from the challenges faced by auditors when identifying essential activities aligned with strategy of a company, often hindered by manual COBIT 2019 guideline navigation. To address this, a system was developed, where inputting the company strategy, triggers the display of recommended activities automatically. The methodology involved creating interconnected nodes from COBIT 2019 Element in Neo4J. This research uses a real strategy plan case study from 3 different companies as input, followed by a preprocessing step, then compares it to Enterprise Goals using TF-IDF and cosine similarity. Goals with high similarity scores trigger a graph query to reveal connected",0.6,0.7539903281677575,0.8666666666377778,0.8333333333333334
"graphical representation of COBIT 2019-governed processes. This allows organizations to visualize relationships between COBIT elements, facilitating deeper analysis, real-time monitoring, and informed IT man- agement decisions. Our results demonstrated the system’s effectiveness in sug- gesting activities tailored to enterprise goals, enhancing IT management practices and operational efficiency. The Neo4j visualization tool offers a user-friendly interface for explor- ing COBIT framework relationships, enabling stakeholders to make data-driven decisions. TABLE III SIMILARITY SCORE Enterprise Goal (EG) Optimization of business process functionality Optimization of business process costs Staff skills, motivation and productivity Compliance with internal policies Similarity 0.5701785 0.29179826 0.02301607 0.029643951 M. M. Jawad, M. H. Ali, A. A. Khaleel, and M. F. Hasan, “Evaluating the performance of it management under the implementation","As noted by Sungkono et al. (2022), adopting COBIT 2019 allows organizations to identify incorrect judgments and patterns in corporate processes, thereby enhancing IT management practices and operational efficiency.","['ygolonhceT no ecnerefnoC lanoitanretnI dn2 4202 Authorized licensed use limited to: Institut Teknologi Sepuluh Nopember. Downloaded on July 14,2025 at 08:18:28 UTC from IEEE Xplore. Restrictions apply. security, and operational efficiency of their information specific areas of IT management. COBIT 2019 provides systems. comprehensive guidance for understanding, planning, and implementing effective and efficient IT management Sungkono K et al., [13] explores the use of graphs to principles [21]. By adopting COBIT 2019, organizations can identify incorrect judgments and patterns in corporate improve their IT performance, reduce risks, and ensure that IT operations. This research aims to assist companies in is used to support the achievement of business objectives preventing fraud by identifying anomalies in their business optimally. processes. The proposed graph-based method provides a unique approach in identifying these anomalies and improving Domain DSS01 in COBIT 2019, titled ""Define and operational efficiency. An analysis of the method\'s Manage Service Levels,""'
 'graph-based method provides a unique approach in identifying these anomalies and improving Domain DSS01 in COBIT 2019, titled ""Define and operational efficiency. An analysis of the method\'s Manage Service Levels,"" addresses the management and performance using an event log from a bank\'s credit establishment of service levels within the scope of an application process revealed that it was 100% accurate in organization\'s IT [22]. Within DSS01, organizations are identifying incorrect patterns and judgments. required to identify specific service requirements, including performance and reliability criteria, and manage user In this research, we will be doing an audit with the COBIT expectations regarding IT services. Additionally, this domain 2019 framework (domain DSS01) and process mining to also covers the measurement and monitoring of service detect processes that do not comply with Standard Operating performance, as well as the adjustment processes necessary to Procedures (SOP). The dataset used consists of automobile ensure that'
 'obligais to create nodes and their relationships using Neo4J Graph tions) and trends in the businessenvironmentthatmayin- DatabaseTools,inordertoconstructaKnowledgeGraphfrom fluencegovernancedesign the mapped results. The procedure for accomplishing this can EDM01 EDM01.01 Determine the significance of 2 beobservedinTABLEIII.Thepseudocodeprocessincludesa ACT02 I&T and its role with respect tothebusiness. query load operation for a CSV file, used to import mapping EDM01 EDM01.01 Consider external regulations, 2 datafromthepreviousstep.Thisisfollowedbyaquery merge ACT03 laws and contractual obligaoperation, where in Neo4J, the merge process first checks tions and determine how they should be applied within the whether the node already exists. If the node does not exist, governanceofEnterpriseI&T it will be created. Each node can also have its attribute data Authorized licensed use limited to: Institut Teknologi Sepuluh Nopember. Downloaded on July 14,2025 at 08:18:28 UTC from IEEE Xplore. Restrictions apply. filled in as details. Additionally, the query merge process can be followed by creating relationships between nodes. C. Preprocessing After'
 'framework, focusing on the based Parallel Process Model Matching (WGPPM) method, APO12 domain. They identified areas for improvement and which uses a weighted graph approach to measure similarprovided recommendations to enhance IT governance, emities in parallel business process models by considering the phasizing effectiveness of COBIT 2019 in managing IT risks. frequency of activity relationships. This method outperforms Thesestudieshighlightthebenefitsofframeworkinimproving traditional approaches like GMA, WGED, WNARS, TPED, IT governance in educational institutions. and Cosine-TDP. [12] presents W-LTLDAG, a method that Researchby[4]assessedtheeffectivenessofITgovernance combinesWeighted-LinearTemporalLogic(W-LTL)Treeand at Mandiri University using the COBIT 2019 framework. Weighted Directed Acyclic Graph (wDAG) to enhance the The findings highlighted the critical role of IT governance accuracy of comparing graph-based business process models. in achieving organizational objectives and emphasized the W-LTLDAG effectively distinguishes between graphs with importance of implementing IT governance practices. varying branch weights, providing high similarity scores for The current manual audit process for COBIT 2019 is timeminordifferencesandlowerscoresforsubstantialdifferences,'
 ""holistic approach to evaluating and framework designed to assist organizations in managing and enhancing the effectiveness of an organization's information controlling information technology more effectively [1], [2]. systems [12]. Through the use of the COBIT 2019 framework, COBIT provides comprehensive guidance for identifying, auditors can pinpoint key controls necessary to achieve establishing, and monitoring the necessary controls within the predefined business objectives. Meanwhile, event log process IT environment to achieve defined business objectives [3], [4]. mining enables auditors to delve into the event log data In auditing systems with COBIT, auditors use COBIT generated by information systems to visually map process standards and principles to evaluate the maturity and flows. By combining these two approaches, auditors can effectiveness of internal controls within an organization's IT conduct in-depth analyses of system compliance with COBIT system [5]. This audit helps identify weaknesses and potential standards and identify noises from established procedures. risks,""]","COBIT Core Model and Capability Scores, it is necessary to undergo a mapping process according to the instructions in the COBIT 2019 manual. This can be time-consuming, especially when auditor should auditing multiple companies simultaneously. This research aim to simplify the process to get Activities of COBIT 2019 automatically from Input Text Company Strategy that aligned with the description of related Enterprise Goals. This research adopts Neo4j, a graph database platform, to manage KG and process data related to these objectives, to gain deeper and more applicable insights into the relationships between strategic and operational objectives in a company . Furthermore, this research also involves the function of preprocessing the input text in the form of Company Strat- egy using",0.75,0.6363385594604773,0.0,0.2
"(TP+FP). To determine how well a positive value is found, recall is employed. It applies true positives (TP) to all ground truth values, which include both true positives and false negatives (FN). The F1 score is an evaluation metric that combines a model’s precision and recall scores, as illustrated in the equation that calculates accuracy. The accuracy statistic computes the number of times the iYOLOV7-TPE-SS model predicted accurately throughout the entire dataset , : F1score = 2 · (P · R) (P + R) (13) The system performance of the iYOLOV7-TPE-SS model has been evaluated using a metric known as mean average accuracy (mAP), which takes into account the average recall (AR), F1-score, and inference time. The inference time has","The evaluation metrics used to assess the performance of the iYOLOV7-TPE-SS model include precision, recall, and F1 Score, which are critical for understanding model accuracy (Multi-class Oil Palm Trees Condition Detection from UAV Images using Faster R-CNN with EfficientNetV2).","['architectural choices. MobileNetV3 enhances the previous introduced in COCO dataset evaluation metrics and is version with squeeze-and-excitation layers and h-swish widely used in object detection studies as a benchmark for non-linearity [18], while EfficientNetV2 focuses on evaluating and comparing model performance. The mAP efficient scaling [19]. provides a comprehensive evaluation of the object detection model. mAP considers precision and recall values across Authorized licensed use limited to: Institut Teknologi Sepuluh Nopember. Downloaded on July 14,2025 at 08:18:27 UTC from IEEE Xplore. Restrictions apply. TABLE II. EVALUATION RESULTS F1 Score F1 Score Backbone mAP mAP@50 mAP@75 IoU@50 IoU@75 ResNet50v2 0.682 0.576 0.368 0.619 0.394 ResNet101 0.630 0.562 0.366 0.635 0.393 MobileNetV3-Large 0.736 0.634 0.487 0.796 0.564 EfficientNetV2-S 0.805 0.735 0.521 0.760 0.620 TABLE III. PRECISION, RECALL, AND F1 SCORE (IOU @ 50) FOR EACH CLASS Backbone Metrics Healthy Mismngd Smallish Yellowish Dead Average Precision 0.970 0.635 0.871 0.498 0.376 0.670 MobileNetV3-Large'
 '10.1016/j.isprsjprs.2021.01.024. 10.1016/j.sbsr.2022.100492 [6] R. Girshick, J. Donahue, T. Darrell, and J. Malik, ""Rich Feature [24] D. Bolya, S. Foley, J. Hays, and J. Hoffman, ""TIDE: A General Hierarchies for Accurate Object Detection and Semantic Toolbox for Identifying Object Detection Errors."" arXiv, Aug. 31, Segmentation"", doi: 10.1109/CVPR.2014.81. 2020. Accessed: May 12, 2024. [Online]. Available: [7] R. Girshick, ""Fast R-CNN."" arXiv, Sep. 27, 2015. doi: http://arxiv.org/abs/2008.08115 10.48550/arXiv.1504.08083. [8] S. Ren, K. He, R. Girshick, and J. Sun, ""Faster R-CNN: Towards Real-Time Object Detection with Region Proposal Networks."" arXiv, Jan. 06, 2016. Accessed: May 12, 2024. [Online]. Available: http://arxiv.org/abs/1506.01497 [9] J. Zheng, W. Li, M. Xia, R. Dong, H. Fu, and S. Yuan, ""Large-Scale Oil Palm Tree Detection from High-Resolution Remote Sensing Images Using Faster-R-CNN,"" in IGARSS 2019 - 2019 IEEE International Geoscience and Remote Sensing Symposium, Yokohama, Japan: IEEE, Jul. 2019, pp. 1422–1425. doi: 10.1109/IGARSS.2019.8898360. [10] J. K. Chorowski, D. Bahdanau, D.'
 ""32.77 9.86 involves training the YOLOv8 model through an iterative Stringing sequence of 200 epochs to ensure its adaptability to the and x HSV 26.89 8.97 relevant training data. Texture \uf0fc Grayscale 27.73 10.17 In this study, the main focus is on evaluating model metrics in the context of object detection. Two key x Grayscale 29.41 10.00 evaluation criteria applied are recall and mean Average Precision (mAP). Recall evaluates the model's ability to details. Rotation parameters ranging between -25 and 25 capture all the objects that should have been identified, degrees were chosen to simulate a wide range of possible emphasizing the importance of minimizing false negatives, orientations, allowing the model to learn from diverse which is crucial in many real-world applications. Recall was perspectives. Additionally, a 15-degree shear was applied to chosen because the goal was to reduce the amount of false introduce moderate distortion, mimicking real-world negatives. As""
 ""the previous version with similar accuracy. EfficientNetV2 is a family of CNN architectures offering faster training speed and better parameter efficiency than previous models [19]. EfficientNetV2 extensively uses MBConv (MobileNetV2-style inverted residual blocks) and the newly added layer fused-MBConv in the early layers. This study chose to adopt EfficientNetV2-S, the baseline architecture from this family, due to computational resource reasons to construct a smaller model while still maintaining model performance. The EfficientNetV1 family is the backbone of the EfficientDet family, which has achieved state-of-the-art results on object detection challenges. C. Model Evaluation Evaluation Metrics used in this study to evaluate model performance are precision, recall, and F1 Score. These metrics can be calculated by (1) – (3). This study's calculation of True Positive, False Positive, and False Negative differs from other classifications or detections [20]-[23]. These are chosen and calculated following previous studies [1]. Precision detects the truly correct prediction""
 ""process was carefully conducted TABLE II. EXPERIMENT RESULTS to ensure a balanced class distribution and to avoid any Augmentations Metrics selective tendencies in each data subset. This balanced Dataset Recall mAP95 distribution helps prevent biases in the model's training Geometric Color (%) (%) process and ensures that it learns effectively from all classes \uf0fc None 31.34 17.58 of data. The object detection model was trained using the training data, tested using the testing data, and validated \uf0fc HSV 37.31 19.36 using the validation data. The size of the dataset and the split Stringing x HSV 38.81 16.02 sizes for each dataset are presented in Table I. This research focuses on leveraging the latest YOLO \uf0fc Grayscale 40.30 15.78 (You Only Look Once) object detection model, specifically x Grayscale 39.87 16.81 YOLOv8, renowned for its exceptional speed and accuracy. The choice of YOLOv8 is driven by its advanced capabilities \uf0fc None""]","with the following formula: TP + TN TP + TN + FP + FN Accuracy = Precision = Recall/True Positive Rate(TPR) TP TP + FP TP TP + FN F1 = 2 × precision × recall precision + recall FP TN + TP (cid:90) 1 TPRd(FPR) False Positive Rate(FPR) = AUC = (4) (5) (6) (7) (8) (9) where TP is the number of correctly predicted positive labels, TN is the number of correctly predicted negative labels, FP is the number of incorrectly predicted positive labels, and FN is the number of incorrectly predicted negative labels. Accuracy is the ratio of true predictions to the overall data. Precision is the ratio between TP to the total number of positive predic-",0.2,0.873458029189267,0.0,0.0
"The interesting aspect of the stock transaction dataset is that the standard deviation from TPIA and BRPT is larger than the mean, which means that two stock issuers have high volatility. 2) DATASET OF NEWS HEADLINES The news portal kontan.co.id in the Indonesian language is used as a source of the news dataset with news published dates between 1 January 2017 and 31 May 2024. The news dataset contains the title, description, published date, and category gathered using scraping technique under sections investment, industry, and finance. This research uses the news section in the news portal as an aspect category. The rule of collecting the dataset is the stock issuer ticker is shown explicitly in the news title to distinguish","The high volatility observed in the stock transaction dataset aligns with findings that sentiment indicators significantly influence stock price forecasting (Haryono et al., 2023).","['Broby, “The use of predictive analytics in finance,” Journal of 1, p. 101051, 2022, doi: 10.1016/j.ecosys.2022.101051. Finance and Data Science, vol. 8, pp. 145–161, 2022, doi: [6] A. Azifah Dienillah and L. Anggraeni, “Impact of Financial Inclusion 10.1016/j.jfds.2022.05.003. on Financial Stability Based on Income Group Countries,” 2018. [31] W. Prihartanti, D. A. Rasyid, and N. Iriawan, “On the run-length of the [7] OJK, “Otoritas Jasa Keuangan: Statistics,” OJK. Accessed: Mar. 30, structural change in time series data,” AIP Conf Proc, vol. 2194, no. 2024. [Online]. Available: https://www.ojk.go.id/id/kanal/perbankan/ December, 2019, doi: 10.1063/1.5139819. data-dan-statistik [8] A. Kurniawan, A. Choiruddin, and N. Iriawan, “Indonesian Islamic Banks’ Post-Pandemic Profitability Alignment with Sustainability Authorized licensed use limited to: Institut Teknologi Sepuluh Nopember. Downloaded on July 14,2025 at 08:22:54 UTC from IEEE Xplore. Restrictions apply. 220 14,2025 at 08:22:54 UTC from IEEE Xplore. Restrictions apply. 220'
 'price forecasting [3] Sentiment analysis research is increasingly developing, and the stock trend prediction model [4]. The stock market making stock price analysis break through the limitation of is represented by financial news sentiments and multi fundamentalandtechnicalindicatorsasforecastingfeatures. aspects, such as corporate, stock, market, and economy The sentiment analysis results in qualitative data cannot be news [5]. The multi-aspect sentiment news represents stock combined with technical indicators in quantitative data to market conditions better and analyzes aspects significantly forecaststockprices.Theprocessingofconvertingqualitative influencingstockpriceforecasting. intoquantitativedatatypeisneeded[1].Inpreviousresearch, Thestockpriceforecastingmodelislearnedbytimeseries quantitative sentiment represents positive or negative stock data,whichmeanstimesequencedataisessential.Theaspect market conditions [2]. The average sentiment value was sentiment classification model commonly uses large data text that does not consider time sequence data. Therefore, The associate editor coordinating the review of this manuscript and anaspectsentimentclassificationmodelneedstobeproduced approvingitforpublicationwasGiacomoFiumara . using training data that evaluates the data time sequence so ThisworkislicensedunderaCreativeCommonsAttribution-NonCommercial-NoDerivatives4.0License. 77132 Formoreinformation,seehttps://creativecommons.org/licenses/by-nc-nd/4.0/ VOLUME11,2023 A.T.Haryonoetal.:Transformer-GatedRecurrentUnitMethodforPredictingStockPrice thatthesentimentaspectresultsfollowthestocktransaction vitalinevaluatingregressionforecastingmodelperformance data. The active learning method is utilized'
 'in the Performance of Micro Finance Institutions in Ecuador,"" International Journal of Economics and Financial Issues, vol. 7, no. 5, pp. 547-551, 2017. [9] K. Xing, D. Luo and L. Liu, ""Macroeconomic conditions, corporate default, and default clustering,"" Economic Modelling, p. 106079, 2023. [10] E. Tobback, D. Martens, T. V. Gestel and B. Baesens, ""Forecasting Loss Given Default models: impact of account characteristics and the macroeconomic state,"" Journal of the Operational Research Society , vol. 65, pp. 376-392, 2014. [11] S. J. Koopman, A. Lucas and B. Schwaab, ""Modeling frailtyFig. 5 Distribution of Shapiro Wilk p-values correlated defaults using many macroeconomic covariates,"" Journal of Econometrics, vol. 162, no. 2, pp. 312-325, 2011. [12] S.I. Sabilla, S. Sarno and K. Triyana, ""Optimizing threshold using macroeconomic indicators as independent indicators. pearson correlation for selecting features of electronic nose signals,"" Subsequently, the default percentage data from the Int. J. Intell. Eng. Syst, vol.'
 'uses eight stock issuers in VOLUME11,2023 77143 A.T.Haryonoetal.:Transformer-GatedRecurrentUnitMethodforPredictingStockPrice FIGURE9. FeaturescenarioperformancecomparisonusingAcMAPEevaluation. TABLE12. TEGRUmodelbest-fitparameteroneachissuerforstockforecasting. five scenarios. The CAS feature scenario produces the best Table 12 presents the best-fit parameter of each issuer performancewithaMAPEscoreis5.22.ComparingUNIand with TEGRU architecture as a forecasting model. The CASfeaturescenario,newssentimentsignificantlyinfluence criterion of the best-fit parameter had the best evaluation INDX and SMMT issuers. Issuers with the highest market value of at least 3 of 5 evaluation methods. The lookback capitalization are less affected by sentiment features. The parameter used for stock forecasting varies significantly in AcMAPE score comparison confirms that news sentiment theselectedparameterscenario,indicateseachissuerrequires influencesstockpriceforecasting.TheCASfeaturescenario a fitted parameter to produce the best model performance. yieldoutperformedotherfeaturescenarioswithanAcMAPE Based on the feature type, univariate features outperformed scoreis1.00,showninFig9.TheCASfeaturescenariohad multivariate features, especially on evaluation R2, RMSE, less error than the UNI feature scenario, with a deviation is MSE, and MAPE. Although the four methods evaluation 0.23.Featureswithoutnewssentiment,suchasUNI,OTI,and performedexcellently,AcMAPEshowedthattheforecasting ETI,yieldmoreerrorsthanfeatureswithnewssentiment.The result did not have good trend prediction accuracy.'
 'Young, ‘‘Predicting LQ45 financial sector indices [36] H. Zhou, S. Zhang, J. Peng, S. Zhang, J. Li, H. Xiong, and usingRNN-LSTM,’’J.BigData,vol.8,no.1,p.104,Dec.2021,doi: W. Zhang, ‘‘Informer: Beyond efficient transformer for long 10.1186/s40537-021-00495-x. sequence time-series forecasting,’’ in Proc. AAAI Conf. Artif. Intell., [18] Z. Jin, Y. Yang, and Y. Liu, ‘‘Stock closing price prediction based on vol. 35, no. 12, May 2021, pp.11106–11115. [Online]. Available: sentimentanalysisandLSTM,’’NeuralComput.Appl.,vol.32,no.13, https://ojs.aaai.org/index.php/AAAI/article/view/17325 pp.9713–9729,Jul.2020,doi:10.1007/s00521-019-04504-2. [37] F. Koto, A. Rahimi, J. H. Lau, and T. Baldwin, ‘‘IndoLEM and [19] C.LiandG.Qian,‘‘Stockpricepredictionusingafrequencydecompo- IndoBERT: A benchmark dataset and pre-trained language model for sitionbasedGRUtransformerneuralnetwork,’’Appl.Sci.,vol.13,no.1, IndonesianNLP,’’inProc.28thInt.Conf.Comput.Linguistics.Barcelona, p.222,Dec.2022,doi:10.3390/app13010222. Spain:InternationalCommitteeonComputationalLinguistics,Dec.2020, pp.757–770. [Online]. Available: https://aclanthology.org/2020.coling[20] M. D. Pratama, R. Sarno, and R. Abdullah, ‘‘Sentiment analysis user main.66 regardinghotelreviewsbyaspectbasedusinglatentDirichletallocation, [38] D. L. Padial. (2022). Technical Analysis Library in Python. [Online]. semanticsimilarity,andsupportvectormachinemethod,’’Int.J.Intell. Available:https://github.com/bukosabino/ta Eng. Syst., vol. 15, no. 3, pp.514–524, 2022. [Online]. Available: https://inass.org/wp-content/uploads/2021/12/2022063043-1.pdf [39] D.H.Vu,K.M.Muttaqi,andA.P.Agalgaonkar,‘‘Avarianceinflationfactorandbackwardeliminationbasedrobustregressionmodelforforecasting [21] B. Joyce and J. Deng, ‘‘Sentiment analysis of tweets for the 2016 monthly']","DATASET A. DATASET This sub-section explains the collection, labeling, and prepa- ration of the dataset used in this research. The dataset consists of time series and text; each is prepared independently. 1) DATASET OF NEWS HEADLINES The text dataset used in this work was gathered from the Indonesian news portal at kontan.co.id under the categories investment, finance, industry, national, and international. The scraping technique collects data between 1 January 2017 to 31 March 2022 and produces a title, URL, description, postdate, category, and subcategory. Statistics from collected data are shown in Table 1. To evaluate performance prediction, task classification in text requires ground truth. The dataset already has ground truth for aspect categorization, but sentiment classification does not have the",0.6666666666666666,0.9020546334005836,0.0,0.0
"titles on each stock issuer based on aspect category. available in English. The trained model siebert/sentiment- roberta-large-english is a binary sentiment classification with an accuracy of 93.2% and is used to determine sentiment polarity, negative and positive. The news dataset contains news published date, aspect category, sentiment polarity, stock ticker, and news title. FIGURE 3. Framework of labeling aspect-sentiment quadruplet. The pair aspect category-sentiment polarity with news trained using various pre-trained models titles was such as indobert-large-p2 , mxbai-embed-large-v1 , multilingual-e5-large , distiluse-base-multilingual- to develop cased-v2 , and bge-base-en-v1.5 VOLUME 12, 2024 178677 A. T. Haryono et al.: pTKANs for Stock Price Forecasting Using Generative ABSA aspect categorization and sentiment classification models. The indobert-large-p2 model is specifically designed for Indonesians,","As noted by Haryono et al. (2023), the aspect categorization process can utilize deep learning models to extract terms and measure semantic similarity, which is essential for sentiment classification in stock price forecasting.","['price forecasting [3] Sentiment analysis research is increasingly developing, and the stock trend prediction model [4]. The stock market making stock price analysis break through the limitation of is represented by financial news sentiments and multi fundamentalandtechnicalindicatorsasforecastingfeatures. aspects, such as corporate, stock, market, and economy The sentiment analysis results in qualitative data cannot be news [5]. The multi-aspect sentiment news represents stock combined with technical indicators in quantitative data to market conditions better and analyzes aspects significantly forecaststockprices.Theprocessingofconvertingqualitative influencingstockpriceforecasting. intoquantitativedatatypeisneeded[1].Inpreviousresearch, Thestockpriceforecastingmodelislearnedbytimeseries quantitative sentiment represents positive or negative stock data,whichmeanstimesequencedataisessential.Theaspect market conditions [2]. The average sentiment value was sentiment classification model commonly uses large data text that does not consider time sequence data. Therefore, The associate editor coordinating the review of this manuscript and anaspectsentimentclassificationmodelneedstobeproduced approvingitforpublicationwasGiacomoFiumara . using training data that evaluates the data time sequence so ThisworkislicensedunderaCreativeCommonsAttribution-NonCommercial-NoDerivatives4.0License. 77132 Formoreinformation,seehttps://creativecommons.org/licenses/by-nc-nd/4.0/ VOLUME11,2023 A.T.Haryonoetal.:Transformer-GatedRecurrentUnitMethodforPredictingStockPrice thatthesentimentaspectresultsfollowthestocktransaction vitalinevaluatingregressionforecastingmodelperformance data. The active learning method is utilized'
 'TABLE4. Sentimentindicatorexamplevalue. D. MULTIVARIATEFEATURESELECTION Aspect sentiments and technical indicators are used as features to forecast each issuer’s stock market close price. Correlation analysis is used to reduce multicollinearity between features and targets. Eq. (6) produces each indicator’svarianceinflationfactor(VIF)value.ThethresholdVIF value is less than 5, which means multicollinearity between featuresisweak[39].Thenumberofiterationsforselecting featureswithVIFvaluesincreaseduntilallselectedfeatures hadaVIFvaluelessthanthethreshold.Correlationanalysis features are used on each issuer to inform the selection feature,whichsignificantlyimpactstheforecastingmodel. average aspect sentiment positive score, the average aspect 1 VIF = (6) sentiment negative score, the maximum aspect sentiment i (1−R2) i positive score, the maximum aspect sentiment negative score, the minimum aspect sentiment positive score, and E. TRANSFORMERMODELS the minimum aspect sentiment negative score. The aspect Theseveralbaselinemodelsarereproducedasacomparison sentiment indicator with seven features on each aspect is to the proposed model. The Vanilla Transformer, Informer, more representative of daily sentiment than two features and FEDformer are built using the official FEDformer without aspect, such as the average sentiment positive and'
 'review of the literature on predicting stock prices based on combinationofTransformerandGRUarchitecture,inwhich featuresispresentedinthissection,followedbysomerelated theTransformerisalearnerofinputfeatures,andGRUisa worksontheactivelearningmethodandassociatedissuesof learnerofsequencedatatopredictstockprices.Theinputdata transformerarchitectureimplementedwithdatatimeseries. is numerically represented by indicator technical and news sentimentinquantitativeform. A. ASPECTSSENTIMENTCLASSIFICATION Evaluation model regression performance used Mean The aspects in the sentence are the attributes contained SquareError(MSE),MeanSquarePercentageError(MSPE), in the topic of discussion in the text sentiments. The andMeanAbsolutePercentageError(MAPE)[18].Theeval- aspect categorization process can use the semantic relation uationmethodonlycalculateserrorsonactualandpredicted method or deep learning models [5]. The semantic relation values without considering value movement classification. methodwouldextracttermsfromthetextandthenmeasure Theevaluationmethodbyconsideringtrendclassificationis semantic similarity to the aspect term list. The higher the VOLUME11,2023 77133 A.T.Haryonoetal.:Transformer-GatedRecurrentUnitMethodforPredictingStockPrice semantic similarity, the higher the value obtained [20]. The whereasstockforecastingneedsquantitativedataasafeature. aspect categorization model is trained using data sets with In previous research, sentiment results in quantitative data aspect labels in the deep learning method. Therefore, the canbeprovidedbysometechniques.TextBlobandVADER aspect categorization is determined by the model that has lexicon libraries can determine the polarity value of text beentrained. with'
 'base-p2 model is fitted with our dataset. In three scenario classifications, indobenchmark/indobert-base-p2 outperTrendclassdeterminedbyEq.(9)and(10)withTS as formed other pre-trained models because indobenchmark/ true groundtruthdataandTS aspredictiondata.TheTSvalue indobert-base-p2hadthemostextensivecorpusandcovered pred is produced by actual (A) and predicted (P) values. If the theformalIndonesianlanguage.AspresentedinTable6,split 77140 VOLUME11,2023 A.T.Haryonoetal.:Transformer-GatedRecurrentUnitMethodforPredictingStockPrice FIGURE6. Evaluationperformanceactivelearningmodelon(a)aspect FIGURE7. Datasettrainingusageonactivelearningmodelwithtask categorizationand(b)sentimentclassification. (a)aspectcategorizationand(b)sentimentclassification. classification, such as aspect categorization and sentiment successfullyanalyzestrainingdatathatmodelsdonotknow classification,arebetterthanaspect-sentimentsclassification withoutsignificantlyloweringperformance. becausethesplitclassificationmodelfocusesmoreonsmall classes than the aspect-sentiment model, which contains B. STOCKPRICESFORECASTING largerclassesamount. Stock forecasting performance evaluation employed RMSE Activelearningbuildsintoresolvingtwotasks:aspectcatandMAPE.Thecomparisonperformanceoneachforecasting egorizationandsentimentclassificationusingthepre-trained model operates the average score RMSE and MAPE with model indobenchmark/indobert-base-p2. Active learning different time lags, which are 5, 10, 20, 50, 100, and 200. produced62modelsisrepresenteachmonthbetweenJanuary Various time lags measure model performance consistency 2017 and February 2022. As shown in Fig. 6, the active inaninconsistentstockenvironment. learningmodeloneachtaskknewtoevolvewiththenewest information.Aspectcategorizationactivelearningonthelast model had an accuracy of 0.87 and an f1-score of 0.87. 1) UNIVARIATECLOSEPRICE(UNI) Sentiment classification reached a performance accuracy Stock forecasting univariate is used one feature as an'
 'the fitted pre-trained model matches our dataset. Pretrained the sentiment classification model with two types. Both modelsusedareindolem/indobert-base-uncased,cahya/bert- models use active learning to produce a model each month. base-indonesian-522M, indobenchmark/indobert-base-p2, As shown in Fig. 4, the active learning model from aspect cahya/distilbert-base-indonesian, and cahya/roberta-base- categorizationandsentimentclassificationisusedtopredict indonesian-522M[32],[37].Everypre-trainedmodelusedto the dataset from February 2017 to March 2022, with a construct aspect categorization and sentiment classification scenario model this month to predict the next month. The models with a scenario of split data are January 2017 to active learning classification models produce a confidence February 2022 as data training and March 2022 as data score.Theconfidencescoreisusedtobuildaspectsentiment testing. Evaluation aspect categorization and sentiment daily indicators, which are the average aspect score, the VOLUME11,2023 77137 A.T.Haryonoetal.:Transformer-GatedRecurrentUnitMethodforPredictingStockPrice FIGURE4. Quantifyingsentimentlabeltodailyaspectsentimentscore.Modelactivelearning(n)monthtopredictdataset(n+1)month. TABLE4. Sentimentindicatorexamplevalue. D. MULTIVARIATEFEATURESELECTION Aspect sentiments and technical indicators are used as features to forecast each issuer’s stock market close price. Correlation analysis is used to reduce multicollinearity between features']","learning with VOLUME 11, 2023 77135 A. T. Haryono et al.: Transformer-Gated Recurrent Unit Method for Predicting Stock Price TABLE 1. Statistic dataset of headline news. TABLE 2. Example headlines news on each category and sentiment. FIGURE 2. The method of Indonesian headline news dataset sentiment labeling. an English language-trained model. The labeling method is shown in Fig. 2. The cleaned news title will be translated from Indonesian to English using a translator application. The resulting translated news title will be passed into the sentiment label- ing using a trained model siebert/sentiment-roberta-large- english. The label sentiment complements the ground truth of the headline news dataset. A trained model siebert/sentiment- roberta-large-english has an accuracy of 93.2% in a binary sentiment classification",0.25,0.8206460124664836,0.0,0.42857142857142855
"using the mean sentiment score on each day trading, if not found, filled with zero value. The daily stock issuer sentiment score can be combined with stock transaction history. The illustration of the final dataset in the form of panel data is shown in Table. 2. D. FORECASTING MODELS D. FORECASTING MODELS This sub-section presents modified Transformer architec- ture, which are Transformer GRU (FormerGRU), Trans- former LSTM (FormerLSTM), Transformer Encoder GRU (TEGRU), and Transformer Encoder LSTM (TELSTM). Modified Transformer was chosen because TEGRU outper- formed other Transformer variants, such as vanilla Trans- former, Informer, FEDformer, and Transformer Encoder in stock price forecasting . This research proposes permuted Temporal Kolmogorov-Arnold Networks (pTKAN) architec- ture to develop a unified stock forecasting model","The modified Transformer architecture, particularly the TEGRU model, has demonstrated superior performance in stock price forecasting by effectively integrating sentiment scores with transaction history (Haryono et al., 2023).","['price forecasting [3] Sentiment analysis research is increasingly developing, and the stock trend prediction model [4]. The stock market making stock price analysis break through the limitation of is represented by financial news sentiments and multi fundamentalandtechnicalindicatorsasforecastingfeatures. aspects, such as corporate, stock, market, and economy The sentiment analysis results in qualitative data cannot be news [5]. The multi-aspect sentiment news represents stock combined with technical indicators in quantitative data to market conditions better and analyzes aspects significantly forecaststockprices.Theprocessingofconvertingqualitative influencingstockpriceforecasting. intoquantitativedatatypeisneeded[1].Inpreviousresearch, Thestockpriceforecastingmodelislearnedbytimeseries quantitative sentiment represents positive or negative stock data,whichmeanstimesequencedataisessential.Theaspect market conditions [2]. The average sentiment value was sentiment classification model commonly uses large data text that does not consider time sequence data. Therefore, The associate editor coordinating the review of this manuscript and anaspectsentimentclassificationmodelneedstobeproduced approvingitforpublicationwasGiacomoFiumara . using training data that evaluates the data time sequence so ThisworkislicensedunderaCreativeCommonsAttribution-NonCommercial-NoDerivatives4.0License. 77132 Formoreinformation,seehttps://creativecommons.org/licenses/by-nc-nd/4.0/ VOLUME11,2023 A.T.Haryonoetal.:Transformer-GatedRecurrentUnitMethodforPredictingStockPrice thatthesentimentaspectresultsfollowthestocktransaction vitalinevaluatingregressionforecastingmodelperformance data. The active learning method is utilized'
 'Young, ‘‘Predicting LQ45 financial sector indices [36] H. Zhou, S. Zhang, J. Peng, S. Zhang, J. Li, H. Xiong, and usingRNN-LSTM,’’J.BigData,vol.8,no.1,p.104,Dec.2021,doi: W. Zhang, ‘‘Informer: Beyond efficient transformer for long 10.1186/s40537-021-00495-x. sequence time-series forecasting,’’ in Proc. AAAI Conf. Artif. Intell., [18] Z. Jin, Y. Yang, and Y. Liu, ‘‘Stock closing price prediction based on vol. 35, no. 12, May 2021, pp.11106–11115. [Online]. Available: sentimentanalysisandLSTM,’’NeuralComput.Appl.,vol.32,no.13, https://ojs.aaai.org/index.php/AAAI/article/view/17325 pp.9713–9729,Jul.2020,doi:10.1007/s00521-019-04504-2. [37] F. Koto, A. Rahimi, J. H. Lau, and T. Baldwin, ‘‘IndoLEM and [19] C.LiandG.Qian,‘‘Stockpricepredictionusingafrequencydecompo- IndoBERT: A benchmark dataset and pre-trained language model for sitionbasedGRUtransformerneuralnetwork,’’Appl.Sci.,vol.13,no.1, IndonesianNLP,’’inProc.28thInt.Conf.Comput.Linguistics.Barcelona, p.222,Dec.2022,doi:10.3390/app13010222. Spain:InternationalCommitteeonComputationalLinguistics,Dec.2020, pp.757–770. [Online]. Available: https://aclanthology.org/2020.coling[20] M. D. Pratama, R. Sarno, and R. Abdullah, ‘‘Sentiment analysis user main.66 regardinghotelreviewsbyaspectbasedusinglatentDirichletallocation, [38] D. L. Padial. (2022). Technical Analysis Library in Python. [Online]. semanticsimilarity,andsupportvectormachinemethod,’’Int.J.Intell. Available:https://github.com/bukosabino/ta Eng. Syst., vol. 15, no. 3, pp.514–524, 2022. [Online]. Available: https://inass.org/wp-content/uploads/2021/12/2022063043-1.pdf [39] D.H.Vu,K.M.Muttaqi,andA.P.Agalgaonkar,‘‘Avarianceinflationfactorandbackwardeliminationbasedrobustregressionmodelforforecasting [21] B. Joyce and J. Deng, ‘‘Sentiment analysis of tweets for the 2016 monthly'
 'model. The Vanilla Transformer, Informer, more representative of daily sentiment than two features and FEDformer are built using the official FEDformer without aspect, such as the average sentiment positive and repository. The FEDformer repository was chosen because the average sentiment negative. In addition, this proposed FEDformer architecture outperformed other transformer methodproduces35aspectsentimentfeaturesthatcanutilize families, such as Autoformer, Informer, LogTrans, and to forecast stock prices and combined with the technical Reformer [15]. The implementation of the baseline and indicator to form a quantitative dataset. Table 4 shows the proposedmodelarediscussedinthissub-section aspectsentimentindicatorillustration. 1) TRANSFORMER C. EXPANDTECHNICALINDICATOR The Vanilla Transformer consists of an encoder and a The historical stock transaction dataset consists of the decoder parts, emulating as closely as possible to the transaction date, open price, lowest price, highest price, original Transformer [12]. The encoder part is stacked with closeprice,andvolumeoftransactions.Theexpandedstock two encoder layers containing multi-head attention, feedtransaction history can produce other technical indicators, forward, and'
 'outperindicator,sentimentanalysis,orboth. formed8of12classificationandsequencelabelingtasksafter Historical stock transaction processing using statistical being trained on 15 data sets containing over 275 million methods such as the moving average yielded information sentences[32]. about volatility, trend, and momentum. The stock trader uses the volatility, trend, and momentum as a signal to buy or sell stock. In previous research, a pre-processing D. GATEDRECURRENTUNIT(GRU) step is used to reduce the dimension or select an essential Time series forecasting already uses deep learning methods feature of the technical indicator. Principal Component likerecurrentneuralnetworks.ThesimplestvariantofRNN Analysis (PCA) and the LASSO method are implemented architecture to predict stock prices is the gated recurrent tominimize53indicatorsandusedtoforecasttheShanghai unit (GRU) [11]. The GRU layer had slightly better than Composite Index. The result is that LASSO had better the LSTM layer on stock price trend prediction [33]. The predictionperformancethanPCA[11].Theothermethodis most straightforward architecture because, compared with featuredecomposition,suchasEmpiricalWaveletTransform LSTM, GRU only has two gates in a cell: update and reset'
 'to produce a multi-aspect sentiment indicator a breakthrough in the deep learning method because the with time sequence data consideration to describe Transformerhadamulti-headattentionlayertolearnapattern detailedstockmarketconditions. of data input and an encoder-decoder section with different 2) The Transformer Encoder Gated Recurrent Unit input layers to resolve transformation data tasks [12]. The (TEGRU) architecture, which consists of a TransTransformerisalreadyusedinNaturalLanguageProcessing formerEncoderasextractioninformationandGRUasa (NLP)[13],Vision[14],andTimeSeries[15],butfewused recognizedsequencedatapattern,isusedinstockprice transformer architectures for forecasting stock price tasks. forecasting. The Gated Three-Tower Transformer (GT3) is a developed 3) The Accuracy Mean Absolute Percentage Error Transformer architecture for stock market prediction using (AcMAPE) is an evaluation performance method on numerical and text input. Two Transformers are used to a forecasting model, which have sensitive to the learn numerical data, channel-wise and time-wise embedmisclassificationofstockpricetrends. ding, and one Transformer to learn daily social text with 4) TheimpactoftheTEGRUfeatureparameteronstock Bidirectional Encoder Representations from Transformers priceforecastingisanalyzedtoproducealowfinancial (BERT) sentence embedding [16]. The Recurrent Neural riskmodelforeachstockissuer. Network (RNN) architecture has']","forecasting using Transformer Encoder Gated Recurrent Unit (TEGRU). The TEGRU can extract information with a multi-head attention layer and recognize pattern sequence data. The evaluation performance of the forecasting model uses Accuracy Mean Absolute Percentage Error (AcMAPE), which have sensitive to the misclassification of stock price trends. The significant contributions of this paper are summarized as follows. 1) The feature extraction method uses an active learning model to produce a multi-aspect sentiment indicator with time sequence data consideration to describe detailed stock market conditions. 2) The Transformer Encoder Gated Recurrent Unit (TEGRU) architecture, which consists of a Trans- former Encoder as extraction information and GRU as a recognized sequence data pattern, is used in stock price forecasting. 3) The Accuracy",0.2,0.8438514097303531,0.19999999998,0.7142857142857143
"and radial velocity detection of targets is not discussed yet. The contribution of this paper is in the receiver processing of CC-OFDM-MIMO radar, which is different from those in other types of OFDM MIMO radars or other multi-TRM radars due to the nature of the orthogonal multi-beam generation with Golay-coded OFDM waveforms and subbands. There are previous research on radar waveform for ISAC purposes , which discussed about cyclic prefix (CP) based OFDM waveform and how the CP is very much defining the maximum unambiguous range of the radar system. CC-OFDM MIMO radar waveform design which is discussed in this paper is not a CP based radar, the transmitters are transmitting multiple orthogonal symbols in series without any guard time","The CC-OFDM MIMO radar concept represents a significant advancement in multi-beam radar technology, enabling simultaneous range and Doppler detection through innovative waveform processing (Kuswidiastuti et al., 2022).","['ReceivedNovember21,2019,acceptedDecember27,2019,dateofpublicationJanuary9,2020,dateofcurrentversionJanuary17,2020. DigitalObjectIdentifier10.1109/ACCESS.2020.2965192 FPMIMO: A General MIMO Structure With Overlapping Subarrays for Various Radar Applications SYAHFRIZALTAHCFULLOH 1,2,(StudentMember,IEEE),AND GAMANTYOHENDRANTORO 1,(SeniorMember,IEEE) 1DepartmentofElectricalEngineering,InstitutTeknologiSepuluhNopember,Surabaya60111,Indonesia 2DepartmentofElectricalEngineering,UniversitasBorneoTarakan,Tarakan77123,Indonesia Correspondingauthor:SyahfrizalTahcfulloh(syahfrizal15@mhs.ee.its.ac.id) ThisworkwassupportedbytheIndonesianMinistryofResearch,Technology,andHigherEducationthroughthe2015-2018BPPDN ScholarshipNo.028872/IT2/HK.00.00/2015andthe2017PKPIScholarshipNo.1469/D3/PG/2017. ABSTRACT Unlike the phased array (PA) radar that achieves array gain in proportion to the number of elements, the MIMO radar provides improvement to parameter estimation, target detection, and so on. Recently, the combination of the PA and MIMO concepts into the Phased MIMO (PMIMO) radar was proposed with overlapping non-coherent subarrays at the transmitter and an array with non-coherent elements at the receiver that proved to outperform the more conventional radars. This paper examines the parameteridentifiability,i.e.,themaximumnumberofdetectabletargetsuniquelyidentifiedandthedetection performance,i.e.,theprobabilitiesofdetectionandfalsealarm,oftheFullPMIMOradar(FPMIMO),which isafurthergeneralizationofcombinationofthePAandMIMOconceptsthatusesoverlappingsubarrayson bothtransmitandreceivearrays.ThemaximumnumberofresolvabletargetsontheFPMIMOradarisderived bytheleastsquares(LS)methodanditsperformanceissubsequentlyevaluatednumericallybyconsidering themagnitudeoftargetreflectioncoefficientasfunctionofdirectionangleforcomparisonagainstPA,MIMO andPMIMOradars.Similarly,thederivationofexpressionsforprobabilitiesofdetectionandfalsealarmis given. In particular, the numerical evaluation is made on the maximum number of resolvable targets with respecttotheimpactofthenumberofsubarrays,thetotalnumberofelementsandtheelementspacing,while thedetectionperformanceisevaluatedbasedontheeffectofthreshold,SNR,andthenumberofsubarrays. The results demonstrate that, being the more general form of multi-antenna radars, the FPMIMO radar is capable of flexibly trading off the maximum number and the'
 'radar is a combination ted using different value of (cid:49)t. This idea is the primary of CC in MIMO radar and multi carrier OFDM radar to contribution of this paper, which will be elaborated in the take the advantages of both systems for beamforming at sequel. A second contribution in this paper concerns the transmit.ByusingOFDMsignalgeneration,subcarrieralloimprovement of time on target in a MIMO radar adopting cationforthemultiplesimultaneousbeamscanbedoneina CC-OFDMwaveforms.Whilemultiplebeamscanningintra- flexible manner. As will be demonstrated in this paper, it is ditional phased array radar results in limited time on target, possible to sparse the total OFDM bandwidth into multiple CC-OFDM MIMO radar could give a much longer time on carrier sets, i.e., sub-bands, responsible for beamforming to target because multiple beams in CC-OFDM radar can be the specified direction. Orthogonality between the OFDM transmittedsimultaneouslyovermuchlongertimeintervals. subcarriers combined with CC in multiple active antenna There are two key problems which may arise from radar systems'
 'for the delay specified scopeofourpaper.TheCC-OFDMMIMOconceptpresents foreachofthem.Inaddition,theMIMOstructureallowsfor abreakthroughintherealizationofmulti-beamradarinaway parallel processing at transmit and receive, which is useful thathasnotbeentriedbefore,combiningdifferentstrategies to accelerate preparation of the transmitted waveforms and in a novel way to obtain a powerful wide-scanning multi- processingofthereceivedsignals. beam radar system with simultaneous range and Doppler OFDM is a wideband multi-carrier waveform which has detection.Todescribethewholeconcept,itisthereforenec- the flexibility in the management of its spectrum compoessarytodividethediscussionintotwoparts.Thefirstpartis nents. The OFDM spectrum consists of several subcarriers onthetransmitter,whichispresentedinthispaper,whereas with smaller bandwidth which are orthogonal to each other thesecondpartdealswiththereceiver,whichisthetopicof and separated with a pre-defined frequency spacing of (cid:49)f. another paper currently being prepared. In order to clearly ItisassumedthattheOFDMsignalgenerationcanbedone and fully describe the concept of CC-OFDM MIMO radar, digitally at a lower frequency band, so that the waveforms whileatthesametimeprovidingarealisticexampleofitsuse can be flexibly designed down to their individual subcarriinaradarapplication,inthesequelwefocusthediscussion ers and controlled by software to meet the demand of the onthedesignofasurveillanceradarsystem.Intheexample, applications [40]. OFDM subcarriers can be coded for difparameters'
 'which is also an equivalent measure of d(θ) = a(θ), b(θ) = 1 L×1 , and h(θ) = b(θ) so that it is themaximumtargetrange[31],whilethewaveformdiversity obtained gainaffectsthenumberofdetectabletargets[22]. σˆ(θ)= (cid:80)Q q=1 bH(θ)R ˆ yψa∗(θ) (44) 1) IMPACTOFTHENUMBEROFSUBARRAYS (cid:107)b(θ)(cid:107)2aT(θ)R ˆ ψψa∗(θ) The MCA for the PA radar is relatively high because it has very high directional coherent gain, which also implies a Itcanbeseenthatσˆ(θ)in(44)issimilartothatobtained high maximum target range, relative to the other types of in[13]. radar.Anotherconsequenceofthehighdirectionalcoherent gainisthattheminimumreflectioncoefficientofdetectable 2) NCSTRANSMIT-NCRECEIVE targets is the lowest compared to the other types of radar. ThePMIMOradaremploysaNCSTxarray(1< M < K) This is the opposite of the MIMO radar that has a high andaNCRxarray(N =L),withd(θ)=[a (θ),...,a (θ)]T, 1 M waveform diversity gain, which results in the largest maxib(θ)=1 L×1 ,andh(θ)=b(θ).Therefore, mumnumberofdetectabletargets.Meanwhile,theFPMIMO √ σˆ(θ)= K/M (cid:80)Q q=1 bH(θ)R ˆ yψ(c(θ)◦d(θ))∗ (45) r b a e da d r es a i s gn t e h d e t g o en'
 'research and tifiability of phased-MIMO radar,’’ inProc. Int. Conf. Artif. Intell. Inf. astronomy,’’IEEEJ.Sel.TopicsSignalProcess,vol.2,no.5,pp.609–612, Technol.(ICAIIT),Yogyakarta,Indonesia,Mar.2019,pp.192–195. Oct.2008. [31] S.TahcfullohandG.Hendrantoro,‘‘FullphasedMIMOradarwithcolo[6] J. Li, P. Stoica, and X. Zheng, ‘‘Signal synthesis and receiver design catedantennas,’’Int.J.Commun.AntennaPropag.,vol.9,no.2,p.144, forMIMOradarimaging,’’IEEETrans.SignalProcess.,vol.56,no.8, Jul.2019. pp.3959–3968,Aug.2008. [32] E.Fishler,A.Haimovich,R.Blum,L.Cimini,D.Chizhik,andR.Valen[7] I.BekkermanandJ.Tabrikian,‘‘Targetdetectionandlocalizationusing zuela,‘‘Spatialdiversityinradars–modelsanddetectionperformance,’’ MIMOradarsandsonars,’’IEEETrans.SignalProcess.,vol.54,no.10, IEEETrans.SignalProcess.,vol.54,no.3,pp.823–838,Mar.2006. pp.3873–3883,Oct.2006. [33] M.I.Skolnik,IntroductiontoRadarSystems,3rded.NewYork,NY,USA: [8] W.Wang,‘‘ApplicationsofMIMOtechniqueforaerospaceremotesensMcGraw-Hill,2002. ing,’’inProc.IEEEAerosp.Conf.,BigSky,MT,USA,Mar.2007,pp.1–10. [34] H.Meikle,ModernRadarSystems,2nded.Boston,MA,USA:Artech [9] A.Haimovich,R.Blum,andL.Cimini,‘‘MIMOradarwithwidelysepa- House,2008. ratedantennas,’’IEEESignalProcess.Mag.,vol.25,no.1,pp.116–129, [35] R.H.RasshoferandK.Gresser,‘‘AutomotiveradarandLidarsystems Dec.2008. fornextgenerationdriverassistancefunctions,’’Adv.RadioSci.,vol.3, [10] Y.Li,H.Ma,Y.Wu,L.Cheng,andD.Yu,‘‘DOAestimationforecho pp.205–209,Apr.2010. signalsandexperimentalresultsintheAMradio-basedpassiveradar,’’ [36] E.Lissel,H.Rohling,andW.Plagge,‘‘Radarsensorforcarapplications,’’ IEEEAccess,vol.6,pp.73316–73327,2018. inProc.IEEEVeh.Technol.Conf.(VTC),Dec.2002,pp.438–442. [11] A. Hassanien and S. A. Vorobyov, ‘‘Transmit/receive beamforming for [37] B.R.Mahafza,RadarSignalAnalysisandProcessingUsingMATLAB. MIMOradarwithcolocatedantennas,’’inProc.IEEEInt.Conf.Acoust., BocaRaton,FL,USA:Chapman-Hall,2009. SpeechSignalProcess.,Taipei,Taiwan,Apr.2009,pp.2089–2092. [38] I. Bilik, O. Longman, S. Villeval, and J. Tabrikian, ‘‘The rise of radar [12] D. Wilcox and M. Sellathurai, ‘‘On MIMO radar subarrayed transmit forautonomousvehicles:Signalprocessingsolutionsandfutureresearch beamforming,’’IEEETrans.SignalProcess.,vol.60,no.4,pp.2076–2081, directions,’’ IEEE Signal Process. Mag., vol. 36, no. 5, pp. 20–31, Apr.2012. Sep.2019. [13] J.Li,P.Stoica,L.Xu,andW.Roberts,‘‘Onparameteridentifiabilityof MIMOradar,’’IEEESignalProcess.Lett.,vol.14,no.12,pp.968–971, Dec.2007. SYAHFRIZAL TAHCFULLOH received the [14] L.Xu,J.Li,andP.Stoica,‘‘Targetdetectionandparameterestimationfor B.Eng.degreeinelectricalengineeringfromUniMIMOradarsystems,’’IEEETrans.Aerosp.Electron.Syst.,vol.44,no.3, versitasGadjahMada,Yogyakarta,Indonesia,in pp.927–939,Jul.2008. 2003,andtheM.Eng.degreeinelectricalengineer[15] T. D. Backes, ‘‘Parameter identifiability in a phased-subarray MIMO ingfromtheInstitutTeknologiSepuluhNopemradar,’’ in Proc. IEEE Aerosp. Conf., Big Sky, MT,']","MIMO radar, intended to produce correlated waveforms with the purpose of acquiring better control over the beampattern. CC have been proposed for application in MIMO radars, originally for optimizing low sidelobes in MIMO radars employing LFM waveforms , but only recently the CC has gained attention in terms of in-depth analysis of LFM waveform optimization . Later in this paper, it can be seen that CC ﬁnd a different role as a consequence of their combination with OFDM waveforms. In this paper, a novel concept of CC-OFDM MIMO† radar is proposed as a solution for the wide-scanning multi-beam radar, which is based on the following principles. Firstly, a train of OFDM pulses are transmitted on an array of transmit antennas",0.5,0.7694822646244387,0.49999999995,0.0
"much defining the maximum unambiguous range of the radar system. CC-OFDM MIMO radar waveform design which is discussed in this paper is not a CP based radar, the transmitters are transmitting multiple orthogonal symbols in series without any guard time interval between the symbols. to each other, hence The symbol series are orthogonal VOLUME 13, 2025 109895 D. Kuswidiastuti et al.: Receiver Processing of the Multibeam Azimuth Scanning CC-OFDM-MIMO Radar receivers know how to distinguish the symbols received, and this could extend the maximum unambiguous range of the radar. The contributions of this paper are described as follow: 1) This paper describes the receiver processing of multi- beam CC-OFDM MIMO Radar which is designed for long-range radar surveillance application. The","The design of the CC-OFDM MIMO radar waveform allows for the transmission of multiple orthogonal symbols, which enhances the receiver's ability to distinguish between received signals, thereby extending the maximum unambiguous range of the radar (Kuswidiastuti et al., 2022).","['ReceivedNovember21,2019,acceptedDecember27,2019,dateofpublicationJanuary9,2020,dateofcurrentversionJanuary17,2020. DigitalObjectIdentifier10.1109/ACCESS.2020.2965192 FPMIMO: A General MIMO Structure With Overlapping Subarrays for Various Radar Applications SYAHFRIZALTAHCFULLOH 1,2,(StudentMember,IEEE),AND GAMANTYOHENDRANTORO 1,(SeniorMember,IEEE) 1DepartmentofElectricalEngineering,InstitutTeknologiSepuluhNopember,Surabaya60111,Indonesia 2DepartmentofElectricalEngineering,UniversitasBorneoTarakan,Tarakan77123,Indonesia Correspondingauthor:SyahfrizalTahcfulloh(syahfrizal15@mhs.ee.its.ac.id) ThisworkwassupportedbytheIndonesianMinistryofResearch,Technology,andHigherEducationthroughthe2015-2018BPPDN ScholarshipNo.028872/IT2/HK.00.00/2015andthe2017PKPIScholarshipNo.1469/D3/PG/2017. ABSTRACT Unlike the phased array (PA) radar that achieves array gain in proportion to the number of elements, the MIMO radar provides improvement to parameter estimation, target detection, and so on. Recently, the combination of the PA and MIMO concepts into the Phased MIMO (PMIMO) radar was proposed with overlapping non-coherent subarrays at the transmitter and an array with non-coherent elements at the receiver that proved to outperform the more conventional radars. This paper examines the parameteridentifiability,i.e.,themaximumnumberofdetectabletargetsuniquelyidentifiedandthedetection performance,i.e.,theprobabilitiesofdetectionandfalsealarm,oftheFullPMIMOradar(FPMIMO),which isafurthergeneralizationofcombinationofthePAandMIMOconceptsthatusesoverlappingsubarrayson bothtransmitandreceivearrays.ThemaximumnumberofresolvabletargetsontheFPMIMOradarisderived bytheleastsquares(LS)methodanditsperformanceissubsequentlyevaluatednumericallybyconsidering themagnitudeoftargetreflectioncoefficientasfunctionofdirectionangleforcomparisonagainstPA,MIMO andPMIMOradars.Similarly,thederivationofexpressionsforprobabilitiesofdetectionandfalsealarmis given. In particular, the numerical evaluation is made on the maximum number of resolvable targets with respecttotheimpactofthenumberofsubarrays,thetotalnumberofelementsandtheelementspacing,while thedetectionperformanceisevaluatedbasedontheeffectofthreshold,SNR,andthenumberofsubarrays. The results demonstrate that, being the more general form of multi-antenna radars, the FPMIMO radar is capable of flexibly trading off the maximum number and the'
 'the receiver, so that the Theadditionalrequirementisthattheremustbeorthogonalreceiver could properly detect and distinguish targets ities between the symbol series. The orthogonality is pronearbyandfarawayfromtheradar. vided by using orthogonal codes for coding the CC-OFDM In this paper we describe the waveform design of symbols, which can be realized using the Golay codes prea CC-OFDM quasi-continuous wave for MIMO long viouslychosentomitigatePAPR.Moreover,theuseofmulrange radar. Quasi-CW transmission could limit the tipleorthogonalOFDMsymbolsincoherentprocessingcan VOLUME10,2022 53685 D.Kuswidiastutietal.:TransmitterDesignforMultibeamCC-OFDMAzimuthScanningMIMORadar improvetheDopplerresolutionoftheradar.Uptothispoint antennaelementsbecomes: GolaycodesplaythreeimportantrolesinCC-OFDMradar. 2π(f +f +f ) α(θ)=kdsinθ = n IF up dsinθ (5) The codes help to lower the PAPR of the OFDM signals, c provide orthogonalities between the beams and achieve the When the constant phase difference given to the antenna samefortheseriallytransmittedsymbols. element for steering the beam to θ is specified to be β = b c −α(θ ),then(cid:49)t canbecalculatedfrom: b b B. PRINCIPLEOFCC-OFDMMIMORADAR CirculatingcodeinMIMOradarusingLFMsignalshasbeen β c (f nc,b ,(cid:49)t b )=2πf nc,b (cid:49)t b =−α(θ b ) (6) implemented for beamforming'
 'Part II: Signal processing,’’ ber, IEEE) was born in Jombang Regency, in Proc. IET Int. Conf. Radar Syst. (Radar), Oct. 2012, pp.1–5, doi: Indonesia, in November 1970. He received the 10.1049/cp.2012.1582. B.Eng. degree in electrical engineering from [39] G.Babur,P.Aubry,andF.LeChevalier,‘‘Space-timeradarwaveforms: the Institut Teknologi Sepuluh Nopember (ITS), Circulatingcodes,’’J.Electr.Comput.Eng.,vol.2013,pp.1–8,2013,doi: Surabaya, Indonesia, in 1992, and the M.Eng. 10.1155/2013/809691. andPh.D.degreesinelectricalengineeringfrom [40] C. Sturm and W. Wiesbeck, ‘‘Waveform design and signal processCarletonUniversity,Ottawa,ON,Canada,in1997 ing aspects for fusion of wireless communications and radar sensand2001,respectively.HeiscurrentlyaProfessor ing,’’ Proc. IEEE, vol. 99, no. 7, pp.1236–1259, Jul. 2011, doi: with the Department of Electrical Engineering, 10.1109/JPROC.2011.2131110. ITS.Hiscurrentresearchinterestsincluderadiopropagationchannelmod[41] G. E. A. Franken, H. Nikookar, and P. Van Genderen, ‘‘Doppler toleranceofOFDM-codedradarsignals,’’Proc.Eur.RadarConf.,Sep.2006, elingandwirelesscommunications.Hehasbeeninvolvedinvariousstudies, pp.108–111,doi:10.1109/EURAD.2006.280285. includinginvestigationintomillimeter-wavepropagation,channelmodeling [42] A. S. Paulus, W. L. Melvin, and D. B. Williams, ‘‘Multistage algo- andwirelesssystemsfortropicalareas,studiesonHFskywavechannelsand rithmforsingle-channelextended-dwellsignalintegration,’’IEEETrans. communicationsinequatorialregions,andthedevelopmentofradararray Aerosp. Electron. Syst., vol. 53, no. 6, pp.2998–3007, Dec. 2017, doi: andsignalprocessing. 10.1109/TAES.2017.2724358. 53702 VOLUME10,2022 Williams, ‘‘Multistage algo- andwirelesssystemsfortropicalareas,studiesonHFskywavechannelsand rithmforsingle-channelextended-dwellsignalintegration,’’IEEETrans. communicationsinequatorialregions,andthedevelopmentofradararray Aerosp. Electron. Syst., vol. 53, no. 6, pp.2998–3007, Dec. 2017, doi: andsignalprocessing. 10.1109/TAES.2017.2724358. 53702 VOLUME10,2022'
 'which is also an equivalent measure of d(θ) = a(θ), b(θ) = 1 L×1 , and h(θ) = b(θ) so that it is themaximumtargetrange[31],whilethewaveformdiversity obtained gainaffectsthenumberofdetectabletargets[22]. σˆ(θ)= (cid:80)Q q=1 bH(θ)R ˆ yψa∗(θ) (44) 1) IMPACTOFTHENUMBEROFSUBARRAYS (cid:107)b(θ)(cid:107)2aT(θ)R ˆ ψψa∗(θ) The MCA for the PA radar is relatively high because it has very high directional coherent gain, which also implies a Itcanbeseenthatσˆ(θ)in(44)issimilartothatobtained high maximum target range, relative to the other types of in[13]. radar.Anotherconsequenceofthehighdirectionalcoherent gainisthattheminimumreflectioncoefficientofdetectable 2) NCSTRANSMIT-NCRECEIVE targets is the lowest compared to the other types of radar. ThePMIMOradaremploysaNCSTxarray(1< M < K) This is the opposite of the MIMO radar that has a high andaNCRxarray(N =L),withd(θ)=[a (θ),...,a (θ)]T, 1 M waveform diversity gain, which results in the largest maxib(θ)=1 L×1 ,andh(θ)=b(θ).Therefore, mumnumberofdetectabletargets.Meanwhile,theFPMIMO √ σˆ(θ)= K/M (cid:80)Q q=1 bH(θ)R ˆ yψ(c(θ)◦d(θ))∗ (45) r b a e da d r es a i s gn t e h d e t g o en'
 'for the delay specified scopeofourpaper.TheCC-OFDMMIMOconceptpresents foreachofthem.Inaddition,theMIMOstructureallowsfor abreakthroughintherealizationofmulti-beamradarinaway parallel processing at transmit and receive, which is useful thathasnotbeentriedbefore,combiningdifferentstrategies to accelerate preparation of the transmitted waveforms and in a novel way to obtain a powerful wide-scanning multi- processingofthereceivedsignals. beam radar system with simultaneous range and Doppler OFDM is a wideband multi-carrier waveform which has detection.Todescribethewholeconcept,itisthereforenec- the flexibility in the management of its spectrum compoessarytodividethediscussionintotwoparts.Thefirstpartis nents. The OFDM spectrum consists of several subcarriers onthetransmitter,whichispresentedinthispaper,whereas with smaller bandwidth which are orthogonal to each other thesecondpartdealswiththereceiver,whichisthetopicof and separated with a pre-defined frequency spacing of (cid:49)f. another paper currently being prepared. In order to clearly ItisassumedthattheOFDMsignalgenerationcanbedone and fully describe the concept of CC-OFDM MIMO radar, digitally at a lower frequency band, so that the waveforms whileatthesametimeprovidingarealisticexampleofitsuse can be flexibly designed down to their individual subcarriinaradarapplication,inthesequelwefocusthediscussion ers and controlled by software to meet the demand of the onthedesignofasurveillanceradarsystem.Intheexample, applications [40]. OFDM subcarriers can be coded for difparameters']","to realize high gain, which makes the production cost higher. In addition, when operating in beam- scanning mode, the time-on-target achieved by electronically scanning radars is limited. Multi-beam radars, in which multiple beams are formed simultaneously and continuously at both the transmitter and the receiver at different angular directions, can eliminate 53682 This work is licensed under a Creative Commons Attribution 4.0 License. For more information, see VOLUME 10, 2022 D. Kuswidiastuti et al.: Transmitter Design for Multibeam CC-OFDM Azimuth Scanning MIMO Radar the aforesaid problem of limited time-on-target. Multi-beam radar technology is beneﬁcial to various radar applications, such as surveillance , , automotive radar , , radar imaging , , joint multiuser communication and radar , , etc. In",0.75,0.8757791537273476,0.0,0.0
"the transmitters transmit a frame consisting of 12 consecutive symbols in series. The frame period is 1.2 ms, when the symbols are orthogonal, then the maximum unambiguous range is not only 15 km but 12 times longer (i.e. 180 km). CC-OFDM transmitter and receiver block diagram incor- porates simple transmit and receive modules. Fig. 1 depicts the block diagram of a transmit/receive (T/R) module, which is one out of 101 that constitute the MIMO transmitter system 109896 VOLUME 13, 2025 D. Kuswidiastuti et al.: Receiver Processing of the Multibeam Azimuth Scanning CC-OFDM-MIMO Radar FIGURE 1. Block diagram of a transmit receive module of CC-OFDM MIMO radar. TABLE 1. CC-OFDM MIMO radar system specifications for surveillance applications. of the surveillance radar.","The CC-OFDM MIMO radar system is designed to achieve high resolution in angle, range, and velocity, demonstrating significant improvements in performance metrics such as beam isolation (Kuswidiastuti et al., 2022).","['is 0.1 ms and the spacing between subcarriers 1) The first beam will be the broadside beam θ (0) = 0. c is 1/T (i.e., 10 kHz). A surveillance radar requires a pencil According to Fig. 3, the first upper 3dB point is at VOLUME10,2022 53689 D.Kuswidiastutietal.:TransmitterDesignforMultibeamCC-OFDMAzimuthScanningMIMORadar 0.64 deg. Because the beam is symmetrical around the center mainlobe, θ , the first lower 3dB point value c is−0.64◦. 2) Thenextmainlobeθ (1)canbefoundusingthefollowc ingexpression: θ θ c (1)=θ 3dB,0 + cos 3 θ d 3 B d , B 0 ,0 (18) Thesecondtermin(18)isforfindingthenextθ value c which also considers the beamscanning loss as a functionof 1 . 3) Thenex c t os b θ e c am,b = 2,willhaveamainbeamwhichis at: θ θ c (2)=θ 3dB,0 +2θ 3dB,1 + cos(θ 3dB, 3 0 dB + ,1 2θ 3dB,1 ) (19) Thesecondtermin(19)isactuallythe3-dBbeamwidth ofbeam1. 4) Foranybeam,b=(cid:96),themaximumofthebeamisat: θ c ((cid:96)) = θ 3dB,0 +2θ 3dB,1 +···+2θ 3dB,(cid:96)−1'
 '−1 (N (cid:88) t 2 −1) N (cid:88)cb −1 (N (cid:88) r 2 −1) or at the maximum scan angle. While in Fig. 8(b) and = I I p q Fig. 9(b), respectively indicate that the angular resolun=0 p=−(Nt−1) m=0 q=−(Nr−1) tion of 1.3◦ and 1.7◦ at the broadside and at the edge 2 2 ×g a,b,n g ∗ a(cid:48),b(cid:48),m C n (cid:48) ,p,a,b C m (cid:48)∗ ,q,a(cid:48)b(cid:48) beamcanbeachieved.Theseresultsshowthatbyusing the proposed transmitter design, the surveillance radar ×ejp[α(θ 0)+β c,b)]e −jq[α(θ)+β c,b(cid:48)] requirementwhichhasbeenmentionedinTable1canbe ×e −j2πk(fa,n,b −f a(cid:48),m,b(cid:48))T0ej2πf a(cid:48),m,b(cid:48)τ fulfilled. ×ejπ(fa,n,b −f a(cid:48),m,b(cid:48)+fD)T0(2a(cid:48)−1) iii. χ a(cid:48)=a=1,b(cid:48)=b (τ,f D ,θ =θ 0 ,(cid:49)t b )thisambiguityfunction ×T 0 sinc(π(f a,n,b −f a(cid:48),m,b(cid:48) +f D )T 0 ) (32) as a function of time-delay variable τ, analyzed for a movingtargetwhichcauseaDopplerfrequencyshiftof where p,q again denote the indexes of the transmit and f atthereceivedbeamb(cid:48).Itisassumedthatthetargetis D receive elements respectively, I ,I denote the amplitude located at a specified'
 'By substituting (13) into (16), the digital IF waveform becomes: N (cid:88) cb −1 x p IF ,a,b (k) = I p C n,p,a,b g a,b,n n=0 ×e j2π(f (cid:49) IF f +n+(za,b −1)Ncb (cid:49)f(kT s IF−(a−1)T0 +p(cid:49)tb) for0≤kTIF −(a−1)T +p(cid:49)t ≤T . (17) s 0 b 0 III. ANEXAMPLEOFCC-OFDMMIMORADARFOR beamwithabeamwidthoflessthan2◦intheazimuthplane. LONG-RANGESURVEILLANCE The azimuth and elevation beamwidth requirements of less A. REQUIREMENTS than2◦ and20◦,respectively,canbeobtainedwithaplanar To elucidate the novel concept and detailed implementation array of 101 elements in the azimuth and 21 elements in of the CC-OFDM MIMO radar, we will take a surveillance elevation,whichleadstoagainof33dBassumingisotropic radar design as an example for analyses in the subsequent elements and no amplitude taper. The 21-element structure sections. The CC-OFDM MIMO radar waveform designed can be realized as a vertical array, instead of a single eleherein is based on the requirement of surveillance radars ment that is a part of the horizontal linear array previously'
 'which is also an equivalent measure of d(θ) = a(θ), b(θ) = 1 L×1 , and h(θ) = b(θ) so that it is themaximumtargetrange[31],whilethewaveformdiversity obtained gainaffectsthenumberofdetectabletargets[22]. σˆ(θ)= (cid:80)Q q=1 bH(θ)R ˆ yψa∗(θ) (44) 1) IMPACTOFTHENUMBEROFSUBARRAYS (cid:107)b(θ)(cid:107)2aT(θ)R ˆ ψψa∗(θ) The MCA for the PA radar is relatively high because it has very high directional coherent gain, which also implies a Itcanbeseenthatσˆ(θ)in(44)issimilartothatobtained high maximum target range, relative to the other types of in[13]. radar.Anotherconsequenceofthehighdirectionalcoherent gainisthattheminimumreflectioncoefficientofdetectable 2) NCSTRANSMIT-NCRECEIVE targets is the lowest compared to the other types of radar. ThePMIMOradaremploysaNCSTxarray(1< M < K) This is the opposite of the MIMO radar that has a high andaNCRxarray(N =L),withd(θ)=[a (θ),...,a (θ)]T, 1 M waveform diversity gain, which results in the largest maxib(θ)=1 L×1 ,andh(θ)=b(θ).Therefore, mumnumberofdetectabletargets.Meanwhile,theFPMIMO √ σˆ(θ)= K/M (cid:80)Q q=1 bH(θ)R ˆ yψ(c(θ)◦d(θ))∗ (45) r b a e da d r es a i s gn t e h d e t g o en'
 'ReceivedNovember21,2019,acceptedDecember27,2019,dateofpublicationJanuary9,2020,dateofcurrentversionJanuary17,2020. DigitalObjectIdentifier10.1109/ACCESS.2020.2965192 FPMIMO: A General MIMO Structure With Overlapping Subarrays for Various Radar Applications SYAHFRIZALTAHCFULLOH 1,2,(StudentMember,IEEE),AND GAMANTYOHENDRANTORO 1,(SeniorMember,IEEE) 1DepartmentofElectricalEngineering,InstitutTeknologiSepuluhNopember,Surabaya60111,Indonesia 2DepartmentofElectricalEngineering,UniversitasBorneoTarakan,Tarakan77123,Indonesia Correspondingauthor:SyahfrizalTahcfulloh(syahfrizal15@mhs.ee.its.ac.id) ThisworkwassupportedbytheIndonesianMinistryofResearch,Technology,andHigherEducationthroughthe2015-2018BPPDN ScholarshipNo.028872/IT2/HK.00.00/2015andthe2017PKPIScholarshipNo.1469/D3/PG/2017. ABSTRACT Unlike the phased array (PA) radar that achieves array gain in proportion to the number of elements, the MIMO radar provides improvement to parameter estimation, target detection, and so on. Recently, the combination of the PA and MIMO concepts into the Phased MIMO (PMIMO) radar was proposed with overlapping non-coherent subarrays at the transmitter and an array with non-coherent elements at the receiver that proved to outperform the more conventional radars. This paper examines the parameteridentifiability,i.e.,themaximumnumberofdetectabletargetsuniquelyidentifiedandthedetection performance,i.e.,theprobabilitiesofdetectionandfalsealarm,oftheFullPMIMOradar(FPMIMO),which isafurthergeneralizationofcombinationofthePAandMIMOconceptsthatusesoverlappingsubarrayson bothtransmitandreceivearrays.ThemaximumnumberofresolvabletargetsontheFPMIMOradarisderived bytheleastsquares(LS)methodanditsperformanceissubsequentlyevaluatednumericallybyconsidering themagnitudeoftargetreflectioncoefficientasfunctionofdirectionangleforcomparisonagainstPA,MIMO andPMIMOradars.Similarly,thederivationofexpressionsforprobabilitiesofdetectionandfalsealarmis given. In particular, the numerical evaluation is made on the maximum number of resolvable targets with respecttotheimpactofthenumberofsubarrays,thetotalnumberofelementsandtheelementspacing,while thedetectionperformanceisevaluatedbasedontheeffectofthreshold,SNR,andthenumberofsubarrays. The results demonstrate that, being the more general form of multi-antenna radars, the FPMIMO radar is capable of flexibly trading off the maximum number and the']","symbols and frame transmission and reception schedul- ing, including the low/high-power modes, beam processing at the receiver by parallel processing, range and Doppler processing involving OFDM symbols and frames. VOLUME 10, 2022 53683 D. Kuswidiastuti et al.: Transmitter Design for Multibeam CC-OFDM Azimuth Scanning MIMO Radar beamforming applications, SDR technology is preferred for its ﬂexibility and low cost , . In our case, the SDR implements all baseband processing at the transmitter and the receiver, including generating inter-element delay required for the application of CC at the transmitter. Beamforming design that meets the required maximum beamwidth in the azimuth is achieved by determining the suitable number of elements employed on the horizontal axis. A good beam pattern can be obtained",0.25,0.8409438121727636,0.0,0.0
"for the n-th subcarrier for symbol a in beam b is given by gn,a,b, with the sampling period of Ts. The maximum unambiguous range, Rmax, will depend on the OFDM symbol period of T0. However, by transmitting Ns orthogonal symbols in series can extend the maximum range up to Ns times further. According to the waveform specification in Table 1, the 12 symbols are transmitted in series over 12T0 to extend the maximum range from 15 up to 180 km. The beams and the CC-OFDM symbols are Golay VOLUME 13, 2025 109897 D. Kuswidiastuti et al.: Receiver Processing of the Multibeam Azimuth Scanning CC-OFDM-MIMO Radar coded and transmitted using the allocated sub-band following a specific schedule that is well known","As noted in the study by Kuswidiastuti et al. (2022), multi-beam radars can extend the maximum range by transmitting multiple orthogonal symbols in series, effectively increasing the time-on-target for radar systems.","['radar is a combination ted using different value of (cid:49)t. This idea is the primary of CC in MIMO radar and multi carrier OFDM radar to contribution of this paper, which will be elaborated in the take the advantages of both systems for beamforming at sequel. A second contribution in this paper concerns the transmit.ByusingOFDMsignalgeneration,subcarrieralloimprovement of time on target in a MIMO radar adopting cationforthemultiplesimultaneousbeamscanbedoneina CC-OFDMwaveforms.Whilemultiplebeamscanningintra- flexible manner. As will be demonstrated in this paper, it is ditional phased array radar results in limited time on target, possible to sparse the total OFDM bandwidth into multiple CC-OFDM MIMO radar could give a much longer time on carrier sets, i.e., sub-bands, responsible for beamforming to target because multiple beams in CC-OFDM radar can be the specified direction. Orthogonality between the OFDM transmittedsimultaneouslyovermuchlongertimeintervals. subcarriers combined with CC in multiple active antenna There are two key problems which may arise from radar systems'
 'a pencil beam pattern. Phased arrays acquire high scanningradarsislimited. Multi-beam radars, in which multiple beams are formed The associate editor coordinating the review of this manuscript and simultaneouslyandcontinuouslyatboththetransmitterand approvingitforpublicationwasChengpengHao . the receiver at different angular directions, can eliminate 53682 ThisworkislicensedunderaCreativeCommonsAttribution4.0License.Formoreinformation,seehttps://creativecommons.org/licenses/by/4.0/ VOLUME10,2022 D.Kuswidiastutietal.:TransmitterDesignforMultibeamCC-OFDMAzimuthScanningMIMORadar theaforesaidproblemoflimitedtime-on-target.Multi-beam OFDM MIMO waveform [31]. A set of orthogonal waveradar technology is beneficial to various radar applications, formscanbesimplyacquiredbyarrangingtheallocationof suchassurveillance[3],[4],automotiveradar[5],[6],radar orthogonal subcarriers into different antennas of the MIMO imaging[7],[8],jointmultiusercommunicationandradar[9], radar system. In this radar, the pulse width or the OFDM [10], etc. In this paper, we are interested in multi-beam symbol duration is obtained as the inverse of the subcarrier radarsystemscapableofcoveringalargeangularswathwith spacing. contiguous orthogonal beams, each sufficiently narrow to Another key element of our proposed radar system is the realizeadesiredangularresolution,capableofdetectingthe circulatingcodes(CC),whichareappliedbyimposingaspecdirection, range and Doppler frequency of multiple targets. ified delay between successive antennas of a MIMO radar, Multiple simultaneous beams can be generated by employ- intended to produce correlated'
 'which is also an equivalent measure of d(θ) = a(θ), b(θ) = 1 L×1 , and h(θ) = b(θ) so that it is themaximumtargetrange[31],whilethewaveformdiversity obtained gainaffectsthenumberofdetectabletargets[22]. σˆ(θ)= (cid:80)Q q=1 bH(θ)R ˆ yψa∗(θ) (44) 1) IMPACTOFTHENUMBEROFSUBARRAYS (cid:107)b(θ)(cid:107)2aT(θ)R ˆ ψψa∗(θ) The MCA for the PA radar is relatively high because it has very high directional coherent gain, which also implies a Itcanbeseenthatσˆ(θ)in(44)issimilartothatobtained high maximum target range, relative to the other types of in[13]. radar.Anotherconsequenceofthehighdirectionalcoherent gainisthattheminimumreflectioncoefficientofdetectable 2) NCSTRANSMIT-NCRECEIVE targets is the lowest compared to the other types of radar. ThePMIMOradaremploysaNCSTxarray(1< M < K) This is the opposite of the MIMO radar that has a high andaNCRxarray(N =L),withd(θ)=[a (θ),...,a (θ)]T, 1 M waveform diversity gain, which results in the largest maxib(θ)=1 L×1 ,andh(θ)=b(θ).Therefore, mumnumberofdetectabletargets.Meanwhile,theFPMIMO √ σˆ(θ)= K/M (cid:80)Q q=1 bH(θ)R ˆ yψ(c(θ)◦d(θ))∗ (45) r b a e da d r es a i s gn t e h d e t g o en'
 'ReceivedNovember21,2019,acceptedDecember27,2019,dateofpublicationJanuary9,2020,dateofcurrentversionJanuary17,2020. DigitalObjectIdentifier10.1109/ACCESS.2020.2965192 FPMIMO: A General MIMO Structure With Overlapping Subarrays for Various Radar Applications SYAHFRIZALTAHCFULLOH 1,2,(StudentMember,IEEE),AND GAMANTYOHENDRANTORO 1,(SeniorMember,IEEE) 1DepartmentofElectricalEngineering,InstitutTeknologiSepuluhNopember,Surabaya60111,Indonesia 2DepartmentofElectricalEngineering,UniversitasBorneoTarakan,Tarakan77123,Indonesia Correspondingauthor:SyahfrizalTahcfulloh(syahfrizal15@mhs.ee.its.ac.id) ThisworkwassupportedbytheIndonesianMinistryofResearch,Technology,andHigherEducationthroughthe2015-2018BPPDN ScholarshipNo.028872/IT2/HK.00.00/2015andthe2017PKPIScholarshipNo.1469/D3/PG/2017. ABSTRACT Unlike the phased array (PA) radar that achieves array gain in proportion to the number of elements, the MIMO radar provides improvement to parameter estimation, target detection, and so on. Recently, the combination of the PA and MIMO concepts into the Phased MIMO (PMIMO) radar was proposed with overlapping non-coherent subarrays at the transmitter and an array with non-coherent elements at the receiver that proved to outperform the more conventional radars. This paper examines the parameteridentifiability,i.e.,themaximumnumberofdetectabletargetsuniquelyidentifiedandthedetection performance,i.e.,theprobabilitiesofdetectionandfalsealarm,oftheFullPMIMOradar(FPMIMO),which isafurthergeneralizationofcombinationofthePAandMIMOconceptsthatusesoverlappingsubarrayson bothtransmitandreceivearrays.ThemaximumnumberofresolvabletargetsontheFPMIMOradarisderived bytheleastsquares(LS)methodanditsperformanceissubsequentlyevaluatednumericallybyconsidering themagnitudeoftargetreflectioncoefficientasfunctionofdirectionangleforcomparisonagainstPA,MIMO andPMIMOradars.Similarly,thederivationofexpressionsforprobabilitiesofdetectionandfalsealarmis given. In particular, the numerical evaluation is made on the maximum number of resolvable targets with respecttotheimpactofthenumberofsubarrays,thetotalnumberofelementsandtheelementspacing,while thedetectionperformanceisevaluatedbasedontheeffectofthreshold,SNR,andthenumberofsubarrays. The results demonstrate that, being the more general form of multi-antenna radars, the FPMIMO radar is capable of flexibly trading off the maximum number and the'
 '(θ / ) M ◦h (cid:80) (θ Q q ) = (cid:107) 1 2 ( ( g c ( ( θ θ ) ) ◦ ◦ h d ( ( θ θ ) ) ) ) H TR R ˆ ˆ ψ yψ ψ ( ( c c ( ( θ θ ) ) ◦ ◦ d d ( ( θ θ ) ) ) ) ∗ ∗ (37) indicates that the use of overlapping subarrays on the Tx array can control the magnitude of complex amplitude of withR ˆ ψψ =E{ψ(t)ψH(t)}=(1/Q) (cid:80)Q q=1 ψ(q)ψH(q). detectable target. The Rx array on the PMIMO radar does Simplificationofthedenominatorfrom(37)using(5),(6), not use subarrays, which means a non-coherent array (NC), (10),and(11)canbeachievedasfollows sothatitmaximizesthewaveformdiversitygaintoanextent limitedbythenumberofTxsubarraysandRxantennas.The (cid:107)g(θ)◦h(θ)(cid:107)2 = (g(θ)◦h(θ))H(g(θ)◦h(θ)) waveform diversity gain has an impact on the decrease of = N(cid:107)g(θ)(cid:107)2 (38) theMCAbutalsoimpliesanincreasingnumberofdetectable wherethelaststepresultsfrom||h(θ)||2 =N [22]. targets. While (32) and (33) are our own findings, the maximum FortheconditionwhereR']","the high PAPR of the OFDM signal. If orthogonal codes are given to successive OFDM symbols, it could also provide orthogonality between 53684 VOLUME 10, 2022 D. Kuswidiastuti et al.: Transmitter Design for Multibeam CC-OFDM Azimuth Scanning MIMO Radar the OFDM symbols, which in turn can extend the maxi- mum unambiguous range of the radar. The orthogonalities between OFDM subcarriers and between OFDM symbols allow OFDM radar to produce a range and Doppler proﬁle independent from each other . This is one of the advan- tages of using OFDM instead of LFM as radar waveform. The above considerations motivate the development of digitally generated beam steering without phase shifter, by providing phase control of the signal directly from waveform generation",0.0,0.7972174671593796,0.0,0.0
"The beams and the CC-OFDM symbols are Golay VOLUME 13, 2025 109897 D. Kuswidiastuti et al.: Receiver Processing of the Multibeam Azimuth Scanning CC-OFDM-MIMO Radar coded and transmitted using the allocated sub-band following a specific schedule that is well known by the transmitter and receiver. The neighboring beam must use different sub-band and sub-band reuse is allowed for beams that are at least 10◦ in separation. In order to generate CC-OFDM waveform, additional phase steering β(fn,a,b, (cid:49)tb) is given to the specified OFDM sub-band frequencies of beam b to provide phase difference between the transmit elements for creating the beam b. Circulating code in LFM MIMO radar which is discussed in , obtain this phase difference by transmitting coherent signals","As discussed by Kuswidiastuti et al. (2022), multi-beam radars can effectively eliminate the limitations of time-on-target by forming multiple beams simultaneously at both the transmitter and receiver.","['radar is a combination ted using different value of (cid:49)t. This idea is the primary of CC in MIMO radar and multi carrier OFDM radar to contribution of this paper, which will be elaborated in the take the advantages of both systems for beamforming at sequel. A second contribution in this paper concerns the transmit.ByusingOFDMsignalgeneration,subcarrieralloimprovement of time on target in a MIMO radar adopting cationforthemultiplesimultaneousbeamscanbedoneina CC-OFDMwaveforms.Whilemultiplebeamscanningintra- flexible manner. As will be demonstrated in this paper, it is ditional phased array radar results in limited time on target, possible to sparse the total OFDM bandwidth into multiple CC-OFDM MIMO radar could give a much longer time on carrier sets, i.e., sub-bands, responsible for beamforming to target because multiple beams in CC-OFDM radar can be the specified direction. Orthogonality between the OFDM transmittedsimultaneouslyovermuchlongertimeintervals. subcarriers combined with CC in multiple active antenna There are two key problems which may arise from radar systems'
 'is 0.1 ms and the spacing between subcarriers 1) The first beam will be the broadside beam θ (0) = 0. c is 1/T (i.e., 10 kHz). A surveillance radar requires a pencil According to Fig. 3, the first upper 3dB point is at VOLUME10,2022 53689 D.Kuswidiastutietal.:TransmitterDesignforMultibeamCC-OFDMAzimuthScanningMIMORadar 0.64 deg. Because the beam is symmetrical around the center mainlobe, θ , the first lower 3dB point value c is−0.64◦. 2) Thenextmainlobeθ (1)canbefoundusingthefollowc ingexpression: θ θ c (1)=θ 3dB,0 + cos 3 θ d 3 B d , B 0 ,0 (18) Thesecondtermin(18)isforfindingthenextθ value c which also considers the beamscanning loss as a functionof 1 . 3) Thenex c t os b θ e c am,b = 2,willhaveamainbeamwhichis at: θ θ c (2)=θ 3dB,0 +2θ 3dB,1 + cos(θ 3dB, 3 0 dB + ,1 2θ 3dB,1 ) (19) Thesecondtermin(19)isactuallythe3-dBbeamwidth ofbeam1. 4) Foranybeam,b=(cid:96),themaximumofthebeamisat: θ c ((cid:96)) = θ 3dB,0 +2θ 3dB,1 +···+2θ 3dB,(cid:96)−1'
 'a pencil beam pattern. Phased arrays acquire high scanningradarsislimited. Multi-beam radars, in which multiple beams are formed The associate editor coordinating the review of this manuscript and simultaneouslyandcontinuouslyatboththetransmitterand approvingitforpublicationwasChengpengHao . the receiver at different angular directions, can eliminate 53682 ThisworkislicensedunderaCreativeCommonsAttribution4.0License.Formoreinformation,seehttps://creativecommons.org/licenses/by/4.0/ VOLUME10,2022 D.Kuswidiastutietal.:TransmitterDesignforMultibeamCC-OFDMAzimuthScanningMIMORadar theaforesaidproblemoflimitedtime-on-target.Multi-beam OFDM MIMO waveform [31]. A set of orthogonal waveradar technology is beneficial to various radar applications, formscanbesimplyacquiredbyarrangingtheallocationof suchassurveillance[3],[4],automotiveradar[5],[6],radar orthogonal subcarriers into different antennas of the MIMO imaging[7],[8],jointmultiusercommunicationandradar[9], radar system. In this radar, the pulse width or the OFDM [10], etc. In this paper, we are interested in multi-beam symbol duration is obtained as the inverse of the subcarrier radarsystemscapableofcoveringalargeangularswathwith spacing. contiguous orthogonal beams, each sufficiently narrow to Another key element of our proposed radar system is the realizeadesiredangularresolution,capableofdetectingthe circulatingcodes(CC),whichareappliedbyimposingaspecdirection, range and Doppler frequency of multiple targets. ified delay between successive antennas of a MIMO radar, Multiple simultaneous beams can be generated by employ- intended to produce correlated'
 'which is also an equivalent measure of d(θ) = a(θ), b(θ) = 1 L×1 , and h(θ) = b(θ) so that it is themaximumtargetrange[31],whilethewaveformdiversity obtained gainaffectsthenumberofdetectabletargets[22]. σˆ(θ)= (cid:80)Q q=1 bH(θ)R ˆ yψa∗(θ) (44) 1) IMPACTOFTHENUMBEROFSUBARRAYS (cid:107)b(θ)(cid:107)2aT(θ)R ˆ ψψa∗(θ) The MCA for the PA radar is relatively high because it has very high directional coherent gain, which also implies a Itcanbeseenthatσˆ(θ)in(44)issimilartothatobtained high maximum target range, relative to the other types of in[13]. radar.Anotherconsequenceofthehighdirectionalcoherent gainisthattheminimumreflectioncoefficientofdetectable 2) NCSTRANSMIT-NCRECEIVE targets is the lowest compared to the other types of radar. ThePMIMOradaremploysaNCSTxarray(1< M < K) This is the opposite of the MIMO radar that has a high andaNCRxarray(N =L),withd(θ)=[a (θ),...,a (θ)]T, 1 M waveform diversity gain, which results in the largest maxib(θ)=1 L×1 ,andh(θ)=b(θ).Therefore, mumnumberofdetectabletargets.Meanwhile,theFPMIMO √ σˆ(θ)= K/M (cid:80)Q q=1 bH(θ)R ˆ yψ(c(θ)◦d(θ))∗ (45) r b a e da d r es a i s gn t e h d e t g o en'
 '(g(θ)◦h(θ))H(g(θ)◦h(θ)) waveform diversity gain has an impact on the decrease of = N(cid:107)g(θ)(cid:107)2 (38) theMCAbutalsoimpliesanincreasingnumberofdetectable wherethelaststepresultsfrom||h(θ)||2 =N [22]. targets. While (32) and (33) are our own findings, the maximum FortheconditionwhereR ˆ ψψ =I M×M ,itcanbeobtained numberofdetectedtargetsforPAandMIMOradarsasgiven (c(θ)◦d(θ))TR ˆ ψψ(c(θ)◦d(θ)) ∗ =M(cid:107)c(θ)(cid:107)2 (39) in [13, Eq. (25) and (22)] can also be obtained from (32), those being special conditions of the FPMIMO radar. Thus, sothat(37)simplifiesinto for the FPMIMO radar, the following relationship applies, P max,MIMO ≥P max,FPMIMO ≥P max,PA . σˆ FPMI√MO (θ) = K/M (cid:80)Q q=1 (g(θ)◦h(θ))HR ˆ yψ(c(θ)◦d(θ))∗ (40) D. COMPLEXAMPLITUDEOFTARGETECHO MN(cid:107)g(θ)(cid:107)2(cid:107)c(θ)(cid:107)2 It is necessary to estimate σ(θ) for each target direction θ from the received vector y (t). The estimate σˆ(θ) of By evaluating (40), the maximum number of detectable tarFPMIMO σ(θ) can be used to form spatial spectra, which in turn can getsfortheFPMIMOradarcanbeobtained. Inthefollowingweobtainy(t)forvariouswaveformconbeusedtoestimatelocationsofalltargetsbyfindingdistinfigurationsusing(9)withthenumberofsubarraysontheTx guishablepeaksinit.Toobtainthenumberofdetectedtargets array being 1 < M < K and on the Rx array']","beams pointing at increasing scan angles. In a previous patent , simultaneous multiple beams are generated using OFDM multiple antennas being fed at different points along a trans- mission line providing delay or phase differences between successive antennas, but the use of such a physical delay source limits its capability and ﬂexibility. On the other hand, OFDM signals with various delays can be produced with CC by ﬂexibly exploiting a programmable waveform gener- ator (WG). In the CC-OFDM MIMO radar, a novel technique can be used further to mitigate beam broadening for large scanning angles. In a way, the strategy of CC-OFDM MIMO radar can be viewed as a realization of hybrid between phased array and MIMO techniques , .",0.5,0.8057783234265122,0.0,0.0
"the specified OFDM sub-band frequencies of beam b to provide phase difference between the transmit elements for creating the beam b. Circulating code in LFM MIMO radar which is discussed in , obtain this phase difference by transmitting coherent signals with a small time delay difference ((cid:49)tb) between the antenna element. However, using an OFDM signal, this phase steering can be provided by giving a phase difference to the OFDM subcarrier phase in the frequency domain of the OFDM signal generation stage. The phase steering given to the CC-OFDM waveform can be defined as follow: β(fn,a,b, (cid:49)tb) = 2πfn,a,b(cid:49)tb Hence, the array factor of CC-OFDM will be: AF(θ, fn,a,b, (cid:49)tb) = Nt −1 2X Ipejp(α(θ)+β(fn,a,b,(cid:49)tb) where α(θ) = p=− Nt","The phase steering in CC-OFDM MIMO radar can be achieved through flexible subcarrier allocation, allowing for simultaneous beamforming, as discussed by Tahcfulloh and Hendrantoro (2020).","['radar is a combination ted using different value of (cid:49)t. This idea is the primary of CC in MIMO radar and multi carrier OFDM radar to contribution of this paper, which will be elaborated in the take the advantages of both systems for beamforming at sequel. A second contribution in this paper concerns the transmit.ByusingOFDMsignalgeneration,subcarrieralloimprovement of time on target in a MIMO radar adopting cationforthemultiplesimultaneousbeamscanbedoneina CC-OFDMwaveforms.Whilemultiplebeamscanningintra- flexible manner. As will be demonstrated in this paper, it is ditional phased array radar results in limited time on target, possible to sparse the total OFDM bandwidth into multiple CC-OFDM MIMO radar could give a much longer time on carrier sets, i.e., sub-bands, responsible for beamforming to target because multiple beams in CC-OFDM radar can be the specified direction. Orthogonality between the OFDM transmittedsimultaneouslyovermuchlongertimeintervals. subcarriers combined with CC in multiple active antenna There are two key problems which may arise from radar systems'
 'for the delay specified scopeofourpaper.TheCC-OFDMMIMOconceptpresents foreachofthem.Inaddition,theMIMOstructureallowsfor abreakthroughintherealizationofmulti-beamradarinaway parallel processing at transmit and receive, which is useful thathasnotbeentriedbefore,combiningdifferentstrategies to accelerate preparation of the transmitted waveforms and in a novel way to obtain a powerful wide-scanning multi- processingofthereceivedsignals. beam radar system with simultaneous range and Doppler OFDM is a wideband multi-carrier waveform which has detection.Todescribethewholeconcept,itisthereforenec- the flexibility in the management of its spectrum compoessarytodividethediscussionintotwoparts.Thefirstpartis nents. The OFDM spectrum consists of several subcarriers onthetransmitter,whichispresentedinthispaper,whereas with smaller bandwidth which are orthogonal to each other thesecondpartdealswiththereceiver,whichisthetopicof and separated with a pre-defined frequency spacing of (cid:49)f. another paper currently being prepared. In order to clearly ItisassumedthattheOFDMsignalgenerationcanbedone and fully describe the concept of CC-OFDM MIMO radar, digitally at a lower frequency band, so that the waveforms whileatthesametimeprovidingarealisticexampleofitsuse can be flexibly designed down to their individual subcarriinaradarapplication,inthesequelwefocusthediscussion ers and controlled by software to meet the demand of the onthedesignofasurveillanceradarsystem.Intheexample, applications [40]. OFDM subcarriers can be coded for difparameters'
 'research and tifiability of phased-MIMO radar,’’ inProc. Int. Conf. Artif. Intell. Inf. astronomy,’’IEEEJ.Sel.TopicsSignalProcess,vol.2,no.5,pp.609–612, Technol.(ICAIIT),Yogyakarta,Indonesia,Mar.2019,pp.192–195. Oct.2008. [31] S.TahcfullohandG.Hendrantoro,‘‘FullphasedMIMOradarwithcolo[6] J. Li, P. Stoica, and X. Zheng, ‘‘Signal synthesis and receiver design catedantennas,’’Int.J.Commun.AntennaPropag.,vol.9,no.2,p.144, forMIMOradarimaging,’’IEEETrans.SignalProcess.,vol.56,no.8, Jul.2019. pp.3959–3968,Aug.2008. [32] E.Fishler,A.Haimovich,R.Blum,L.Cimini,D.Chizhik,andR.Valen[7] I.BekkermanandJ.Tabrikian,‘‘Targetdetectionandlocalizationusing zuela,‘‘Spatialdiversityinradars–modelsanddetectionperformance,’’ MIMOradarsandsonars,’’IEEETrans.SignalProcess.,vol.54,no.10, IEEETrans.SignalProcess.,vol.54,no.3,pp.823–838,Mar.2006. pp.3873–3883,Oct.2006. [33] M.I.Skolnik,IntroductiontoRadarSystems,3rded.NewYork,NY,USA: [8] W.Wang,‘‘ApplicationsofMIMOtechniqueforaerospaceremotesensMcGraw-Hill,2002. ing,’’inProc.IEEEAerosp.Conf.,BigSky,MT,USA,Mar.2007,pp.1–10. [34] H.Meikle,ModernRadarSystems,2nded.Boston,MA,USA:Artech [9] A.Haimovich,R.Blum,andL.Cimini,‘‘MIMOradarwithwidelysepa- House,2008. ratedantennas,’’IEEESignalProcess.Mag.,vol.25,no.1,pp.116–129, [35] R.H.RasshoferandK.Gresser,‘‘AutomotiveradarandLidarsystems Dec.2008. fornextgenerationdriverassistancefunctions,’’Adv.RadioSci.,vol.3, [10] Y.Li,H.Ma,Y.Wu,L.Cheng,andD.Yu,‘‘DOAestimationforecho pp.205–209,Apr.2010. signalsandexperimentalresultsintheAMradio-basedpassiveradar,’’ [36] E.Lissel,H.Rohling,andW.Plagge,‘‘Radarsensorforcarapplications,’’ IEEEAccess,vol.6,pp.73316–73327,2018. inProc.IEEEVeh.Technol.Conf.(VTC),Dec.2002,pp.438–442. [11] A. Hassanien and S. A. Vorobyov, ‘‘Transmit/receive beamforming for [37] B.R.Mahafza,RadarSignalAnalysisandProcessingUsingMATLAB. MIMOradarwithcolocatedantennas,’’inProc.IEEEInt.Conf.Acoust., BocaRaton,FL,USA:Chapman-Hall,2009. SpeechSignalProcess.,Taipei,Taiwan,Apr.2009,pp.2089–2092. [38] I. Bilik, O. Longman, S. Villeval, and J. Tabrikian, ‘‘The rise of radar [12] D. Wilcox and M. Sellathurai, ‘‘On MIMO radar subarrayed transmit forautonomousvehicles:Signalprocessingsolutionsandfutureresearch beamforming,’’IEEETrans.SignalProcess.,vol.60,no.4,pp.2076–2081, directions,’’ IEEE Signal Process. Mag., vol. 36, no. 5, pp. 20–31, Apr.2012. Sep.2019. [13] J.Li,P.Stoica,L.Xu,andW.Roberts,‘‘Onparameteridentifiabilityof MIMOradar,’’IEEESignalProcess.Lett.,vol.14,no.12,pp.968–971, Dec.2007. SYAHFRIZAL TAHCFULLOH received the [14] L.Xu,J.Li,andP.Stoica,‘‘Targetdetectionandparameterestimationfor B.Eng.degreeinelectricalengineeringfromUniMIMOradarsystems,’’IEEETrans.Aerosp.Electron.Syst.,vol.44,no.3, versitasGadjahMada,Yogyakarta,Indonesia,in pp.927–939,Jul.2008. 2003,andtheM.Eng.degreeinelectricalengineer[15] T. D. Backes, ‘‘Parameter identifiability in a phased-subarray MIMO ingfromtheInstitutTeknologiSepuluhNopemradar,’’ in Proc. IEEE Aerosp. Conf., Big Sky, MT,'
 '(g(θ)◦h(θ))H(g(θ)◦h(θ)) waveform diversity gain has an impact on the decrease of = N(cid:107)g(θ)(cid:107)2 (38) theMCAbutalsoimpliesanincreasingnumberofdetectable wherethelaststepresultsfrom||h(θ)||2 =N [22]. targets. While (32) and (33) are our own findings, the maximum FortheconditionwhereR ˆ ψψ =I M×M ,itcanbeobtained numberofdetectedtargetsforPAandMIMOradarsasgiven (c(θ)◦d(θ))TR ˆ ψψ(c(θ)◦d(θ)) ∗ =M(cid:107)c(θ)(cid:107)2 (39) in [13, Eq. (25) and (22)] can also be obtained from (32), those being special conditions of the FPMIMO radar. Thus, sothat(37)simplifiesinto for the FPMIMO radar, the following relationship applies, P max,MIMO ≥P max,FPMIMO ≥P max,PA . σˆ FPMI√MO (θ) = K/M (cid:80)Q q=1 (g(θ)◦h(θ))HR ˆ yψ(c(θ)◦d(θ))∗ (40) D. COMPLEXAMPLITUDEOFTARGETECHO MN(cid:107)g(θ)(cid:107)2(cid:107)c(θ)(cid:107)2 It is necessary to estimate σ(θ) for each target direction θ from the received vector y (t). The estimate σˆ(θ) of By evaluating (40), the maximum number of detectable tarFPMIMO σ(θ) can be used to form spatial spectra, which in turn can getsfortheFPMIMOradarcanbeobtained. Inthefollowingweobtainy(t)forvariouswaveformconbeusedtoestimatelocationsofalltargetsbyfindingdistinfigurationsusing(9)withthenumberofsubarraysontheTx guishablepeaksinit.Toobtainthenumberofdetectedtargets array being 1 < M < K and on the Rx array'
 'ReceivedNovember21,2019,acceptedDecember27,2019,dateofpublicationJanuary9,2020,dateofcurrentversionJanuary17,2020. DigitalObjectIdentifier10.1109/ACCESS.2020.2965192 FPMIMO: A General MIMO Structure With Overlapping Subarrays for Various Radar Applications SYAHFRIZALTAHCFULLOH 1,2,(StudentMember,IEEE),AND GAMANTYOHENDRANTORO 1,(SeniorMember,IEEE) 1DepartmentofElectricalEngineering,InstitutTeknologiSepuluhNopember,Surabaya60111,Indonesia 2DepartmentofElectricalEngineering,UniversitasBorneoTarakan,Tarakan77123,Indonesia Correspondingauthor:SyahfrizalTahcfulloh(syahfrizal15@mhs.ee.its.ac.id) ThisworkwassupportedbytheIndonesianMinistryofResearch,Technology,andHigherEducationthroughthe2015-2018BPPDN ScholarshipNo.028872/IT2/HK.00.00/2015andthe2017PKPIScholarshipNo.1469/D3/PG/2017. ABSTRACT Unlike the phased array (PA) radar that achieves array gain in proportion to the number of elements, the MIMO radar provides improvement to parameter estimation, target detection, and so on. Recently, the combination of the PA and MIMO concepts into the Phased MIMO (PMIMO) radar was proposed with overlapping non-coherent subarrays at the transmitter and an array with non-coherent elements at the receiver that proved to outperform the more conventional radars. This paper examines the parameteridentifiability,i.e.,themaximumnumberofdetectabletargetsuniquelyidentifiedandthedetection performance,i.e.,theprobabilitiesofdetectionandfalsealarm,oftheFullPMIMOradar(FPMIMO),which isafurthergeneralizationofcombinationofthePAandMIMOconceptsthatusesoverlappingsubarrayson bothtransmitandreceivearrays.ThemaximumnumberofresolvabletargetsontheFPMIMOradarisderived bytheleastsquares(LS)methodanditsperformanceissubsequentlyevaluatednumericallybyconsidering themagnitudeoftargetreflectioncoefficientasfunctionofdirectionangleforcomparisonagainstPA,MIMO andPMIMOradars.Similarly,thederivationofexpressionsforprobabilitiesofdetectionandfalsealarmis given. In particular, the numerical evaluation is made on the maximum number of resolvable targets with respecttotheimpactofthenumberofsubarrays,thetotalnumberofelementsandtheelementspacing,while thedetectionperformanceisevaluatedbasedontheeffectofthreshold,SNR,andthenumberofsubarrays. The results demonstrate that, being the more general form of multi-antenna radars, the FPMIMO radar is capable of flexibly trading off the maximum number and the']","signal is circulated from one antenna element to another with a relatively small time-delay differ- ence ((cid:49)t), made possible by circulating codes (CC) , , . Hence the transmit signal from the p-th element for a transmit antenna array with an odd number of elements, Nt , can be written as: xp(t) = x(t − p(cid:49)t), Nt − 1 , . . . , Nt − 1 (1) The time delay difference of the circulating signal corre- sponds to a phase difference between the antenna elements at a given frequency: (cid:49)ϕ = 2πf (cid:49)t (2) It means that the phase steering that is usually provided by a phase shifter at each antenna element now can be realized directly in the",0.6666666666666666,0.8331780236997941,0.9999999999,0.75
"together with transmit scheduling to avoid transmit receive coupling. The receive scheduling is also related to the time scheduling of the correlation between symbols, which is an important stage in the beam and range processing. The transmit and receive time schedule of CC-OFDM radar is described in Fig. 4. The receive scheduling is very important, especially in a multiple target scheme. The echo signals caused by two or more targets at different ranges (i.e., one target is near to the radar, and the other is far) could cause range ambiguity. The clock synchronization between the multiple transmitters and the multiple receivers of CC-OFDM radars are very crucial to guarantee that the receiver can give the accurate detection. It can be","The importance of receive scheduling in CC-OFDM radar, particularly in multiple target scenarios, is underscored by the impact of waveform diversity gain on the maximum number of detectable targets (Tahcfulloh & Hendrantoro, 2020).","['(g(θ)◦h(θ))H(g(θ)◦h(θ)) waveform diversity gain has an impact on the decrease of = N(cid:107)g(θ)(cid:107)2 (38) theMCAbutalsoimpliesanincreasingnumberofdetectable wherethelaststepresultsfrom||h(θ)||2 =N [22]. targets. While (32) and (33) are our own findings, the maximum FortheconditionwhereR ˆ ψψ =I M×M ,itcanbeobtained numberofdetectedtargetsforPAandMIMOradarsasgiven (c(θ)◦d(θ))TR ˆ ψψ(c(θ)◦d(θ)) ∗ =M(cid:107)c(θ)(cid:107)2 (39) in [13, Eq. (25) and (22)] can also be obtained from (32), those being special conditions of the FPMIMO radar. Thus, sothat(37)simplifiesinto for the FPMIMO radar, the following relationship applies, P max,MIMO ≥P max,FPMIMO ≥P max,PA . σˆ FPMI√MO (θ) = K/M (cid:80)Q q=1 (g(θ)◦h(θ))HR ˆ yψ(c(θ)◦d(θ))∗ (40) D. COMPLEXAMPLITUDEOFTARGETECHO MN(cid:107)g(θ)(cid:107)2(cid:107)c(θ)(cid:107)2 It is necessary to estimate σ(θ) for each target direction θ from the received vector y (t). The estimate σˆ(θ) of By evaluating (40), the maximum number of detectable tarFPMIMO σ(θ) can be used to form spatial spectra, which in turn can getsfortheFPMIMOradarcanbeobtained. Inthefollowingweobtainy(t)forvariouswaveformconbeusedtoestimatelocationsofalltargetsbyfindingdistinfigurationsusing(9)withthenumberofsubarraysontheTx guishablepeaksinit.Toobtainthenumberofdetectedtargets array being 1 < M < K and on the Rx array'
 'research and tifiability of phased-MIMO radar,’’ inProc. Int. Conf. Artif. Intell. Inf. astronomy,’’IEEEJ.Sel.TopicsSignalProcess,vol.2,no.5,pp.609–612, Technol.(ICAIIT),Yogyakarta,Indonesia,Mar.2019,pp.192–195. Oct.2008. [31] S.TahcfullohandG.Hendrantoro,‘‘FullphasedMIMOradarwithcolo[6] J. Li, P. Stoica, and X. Zheng, ‘‘Signal synthesis and receiver design catedantennas,’’Int.J.Commun.AntennaPropag.,vol.9,no.2,p.144, forMIMOradarimaging,’’IEEETrans.SignalProcess.,vol.56,no.8, Jul.2019. pp.3959–3968,Aug.2008. [32] E.Fishler,A.Haimovich,R.Blum,L.Cimini,D.Chizhik,andR.Valen[7] I.BekkermanandJ.Tabrikian,‘‘Targetdetectionandlocalizationusing zuela,‘‘Spatialdiversityinradars–modelsanddetectionperformance,’’ MIMOradarsandsonars,’’IEEETrans.SignalProcess.,vol.54,no.10, IEEETrans.SignalProcess.,vol.54,no.3,pp.823–838,Mar.2006. pp.3873–3883,Oct.2006. [33] M.I.Skolnik,IntroductiontoRadarSystems,3rded.NewYork,NY,USA: [8] W.Wang,‘‘ApplicationsofMIMOtechniqueforaerospaceremotesensMcGraw-Hill,2002. ing,’’inProc.IEEEAerosp.Conf.,BigSky,MT,USA,Mar.2007,pp.1–10. [34] H.Meikle,ModernRadarSystems,2nded.Boston,MA,USA:Artech [9] A.Haimovich,R.Blum,andL.Cimini,‘‘MIMOradarwithwidelysepa- House,2008. ratedantennas,’’IEEESignalProcess.Mag.,vol.25,no.1,pp.116–129, [35] R.H.RasshoferandK.Gresser,‘‘AutomotiveradarandLidarsystems Dec.2008. fornextgenerationdriverassistancefunctions,’’Adv.RadioSci.,vol.3, [10] Y.Li,H.Ma,Y.Wu,L.Cheng,andD.Yu,‘‘DOAestimationforecho pp.205–209,Apr.2010. signalsandexperimentalresultsintheAMradio-basedpassiveradar,’’ [36] E.Lissel,H.Rohling,andW.Plagge,‘‘Radarsensorforcarapplications,’’ IEEEAccess,vol.6,pp.73316–73327,2018. inProc.IEEEVeh.Technol.Conf.(VTC),Dec.2002,pp.438–442. [11] A. Hassanien and S. A. Vorobyov, ‘‘Transmit/receive beamforming for [37] B.R.Mahafza,RadarSignalAnalysisandProcessingUsingMATLAB. MIMOradarwithcolocatedantennas,’’inProc.IEEEInt.Conf.Acoust., BocaRaton,FL,USA:Chapman-Hall,2009. SpeechSignalProcess.,Taipei,Taiwan,Apr.2009,pp.2089–2092. [38] I. Bilik, O. Longman, S. Villeval, and J. Tabrikian, ‘‘The rise of radar [12] D. Wilcox and M. Sellathurai, ‘‘On MIMO radar subarrayed transmit forautonomousvehicles:Signalprocessingsolutionsandfutureresearch beamforming,’’IEEETrans.SignalProcess.,vol.60,no.4,pp.2076–2081, directions,’’ IEEE Signal Process. Mag., vol. 36, no. 5, pp. 20–31, Apr.2012. Sep.2019. [13] J.Li,P.Stoica,L.Xu,andW.Roberts,‘‘Onparameteridentifiabilityof MIMOradar,’’IEEESignalProcess.Lett.,vol.14,no.12,pp.968–971, Dec.2007. SYAHFRIZAL TAHCFULLOH received the [14] L.Xu,J.Li,andP.Stoica,‘‘Targetdetectionandparameterestimationfor B.Eng.degreeinelectricalengineeringfromUniMIMOradarsystems,’’IEEETrans.Aerosp.Electron.Syst.,vol.44,no.3, versitasGadjahMada,Yogyakarta,Indonesia,in pp.927–939,Jul.2008. 2003,andtheM.Eng.degreeinelectricalengineer[15] T. D. Backes, ‘‘Parameter identifiability in a phased-subarray MIMO ingfromtheInstitutTeknologiSepuluhNopemradar,’’ in Proc. IEEE Aerosp. Conf., Big Sky, MT,'
 'ReceivedNovember21,2019,acceptedDecember27,2019,dateofpublicationJanuary9,2020,dateofcurrentversionJanuary17,2020. DigitalObjectIdentifier10.1109/ACCESS.2020.2965192 FPMIMO: A General MIMO Structure With Overlapping Subarrays for Various Radar Applications SYAHFRIZALTAHCFULLOH 1,2,(StudentMember,IEEE),AND GAMANTYOHENDRANTORO 1,(SeniorMember,IEEE) 1DepartmentofElectricalEngineering,InstitutTeknologiSepuluhNopember,Surabaya60111,Indonesia 2DepartmentofElectricalEngineering,UniversitasBorneoTarakan,Tarakan77123,Indonesia Correspondingauthor:SyahfrizalTahcfulloh(syahfrizal15@mhs.ee.its.ac.id) ThisworkwassupportedbytheIndonesianMinistryofResearch,Technology,andHigherEducationthroughthe2015-2018BPPDN ScholarshipNo.028872/IT2/HK.00.00/2015andthe2017PKPIScholarshipNo.1469/D3/PG/2017. ABSTRACT Unlike the phased array (PA) radar that achieves array gain in proportion to the number of elements, the MIMO radar provides improvement to parameter estimation, target detection, and so on. Recently, the combination of the PA and MIMO concepts into the Phased MIMO (PMIMO) radar was proposed with overlapping non-coherent subarrays at the transmitter and an array with non-coherent elements at the receiver that proved to outperform the more conventional radars. This paper examines the parameteridentifiability,i.e.,themaximumnumberofdetectabletargetsuniquelyidentifiedandthedetection performance,i.e.,theprobabilitiesofdetectionandfalsealarm,oftheFullPMIMOradar(FPMIMO),which isafurthergeneralizationofcombinationofthePAandMIMOconceptsthatusesoverlappingsubarrayson bothtransmitandreceivearrays.ThemaximumnumberofresolvabletargetsontheFPMIMOradarisderived bytheleastsquares(LS)methodanditsperformanceissubsequentlyevaluatednumericallybyconsidering themagnitudeoftargetreflectioncoefficientasfunctionofdirectionangleforcomparisonagainstPA,MIMO andPMIMOradars.Similarly,thederivationofexpressionsforprobabilitiesofdetectionandfalsealarmis given. In particular, the numerical evaluation is made on the maximum number of resolvable targets with respecttotheimpactofthenumberofsubarrays,thetotalnumberofelementsandtheelementspacing,while thedetectionperformanceisevaluatedbasedontheeffectofthreshold,SNR,andthenumberofsubarrays. The results demonstrate that, being the more general form of multi-antenna radars, the FPMIMO radar is capable of flexibly trading off the maximum number and the'
 'radar is a combination ted using different value of (cid:49)t. This idea is the primary of CC in MIMO radar and multi carrier OFDM radar to contribution of this paper, which will be elaborated in the take the advantages of both systems for beamforming at sequel. A second contribution in this paper concerns the transmit.ByusingOFDMsignalgeneration,subcarrieralloimprovement of time on target in a MIMO radar adopting cationforthemultiplesimultaneousbeamscanbedoneina CC-OFDMwaveforms.Whilemultiplebeamscanningintra- flexible manner. As will be demonstrated in this paper, it is ditional phased array radar results in limited time on target, possible to sparse the total OFDM bandwidth into multiple CC-OFDM MIMO radar could give a much longer time on carrier sets, i.e., sub-bands, responsible for beamforming to target because multiple beams in CC-OFDM radar can be the specified direction. Orthogonality between the OFDM transmittedsimultaneouslyovermuchlongertimeintervals. subcarriers combined with CC in multiple active antenna There are two key problems which may arise from radar systems'
 'radar can be the specified direction. Orthogonality between the OFDM transmittedsimultaneouslyovermuchlongertimeintervals. subcarriers combined with CC in multiple active antenna There are two key problems which may arise from radar systems makes it possible to produce multiple orthogonal transmittingoverlongcontinuoustimeintervals: beams. When the beams are orthogonal to each other, it is possible that those multiple beams are simultaneously and • Especially in the case of collocated radar, there will continuouslytransmittedtoachieveawideangularcoverage be coupling from the transmit signal to the receiver. atall-time.Thismeansalongertimeontargetincomparison Thiswilllimitthemaximumpowerthattheradarcould totheconventionalphasedarrayradar,allowingforimproved transmit to avoid saturation problems due to coupling. accuracy in target position [22], [42], [43]. Multiple beams Inacontinuouswave(CW)radarsystem,thetransmitter of CC-OFDM radar will further allow the application of a and receiver are always active. Hence, there must be monopulse-tracking radar mode, which is beyond the scope a good isolation between the receiver and transmitter ofthispaper. to prevent too high-power coupling of the transmitter Other advantages of using CC-OFDM signal include the']","In our case, quasi-continuous transmission is used through proper scheduling of OFDM transmission and echoes reception to prevent the coupling. • The receiver that continuously receives signal echoes coming from multiple targets must be able to distinguish which targets are very near or very far from the radar. This is the reason in this paper that orthogonal codes are given to successive CC-OFDM symbols. These unique codes are given and known by the receiver, so that the receiver could properly detect and distinguish targets nearby and far away from the radar. In this paper we describe the waveform design of a CC-OFDM quasi-continuous wave for MIMO long the range radar. Quasi-CW transmission could limit leakage/coupling problem by time-isolation of the",0.3333333333333333,0.893925898524569,0.19999999998,0.6666666666666666
"correlation function between the received signals with the reference signal can be derived as follow: χyx(θ, θ ′, τ, τ0, fD) = σ ejϑ R4 2NsT0X (cid:26) (Nt −1) 2X (Nt −1) 2X k=0 p=− (Nt −1) q=− (Nt −1) {IpIqejpα(θ)e−jqα(θ ′) Nc−1 Nc−1 n=0 m=0 (cid:26) Cn,p,a,bC ∗ m,q,a′,b′gn,a,bgm,a′,b′ × ej2πkTs(fIF +fn,a,b+fD) × e−j2πkTs(fIF +fm,a′,b′ ) × ej2πfn,a,b[p(cid:49)tb−(a−1)T0] × e−j2πfm,a′,b′ [q(cid:49)tb−(a′−1)T0]ej2π(τ −τ0)(fIF +fn,a,b) (cid:27)(cid:27) (14) PNc−1 Because the subcarrier frequency of the OFDM signal and the Golay codes are orthogonal, then the term PNc−1 m=0 gn,a,bgm,a′,b′ = 0 for n ̸= m, a ̸= a′, n=0 or b ̸= b′, hence the cross correlation, χyx(θ, θ ′, τ, τ0, fD) will be zero. The correlation function value will be","The correlation function between the received signals and the reference signal can be derived based on the optimal precoder and phase-shift vector in RIS-aided MIMO systems (Sirojuddin et al., 2024).","['using numerical simulations compared to benchmark 15 Bound θ m ,∀m using (22) and (23). methods, including AO [8] which worked on the same system 16 Update ΔC. modelandproblemformulation,andADMM[4]andDSM[5] 17 if ΔC >0 then which worked on a similar system model but under an ideal 18 Break. RISassumption.Insettingthesimulationparametersforlarge19 else scale fading, the distance-dependent path loss is given as ρ= 20 υ =cυ. ρ 0(d/d 0) −τ ,whered isthedistance,andρ 0 =−30dBisthe 21 end path loss value at the reference distance d 0 = 1 m. The path 22 end lossexponents τ forH d,G,and H r aresettobe3.5,2.2,and 23 end 2.8, respectively [8]. For small-scale fading, the simulation 24 end adopts the Rician mode(cid:19)l. In particular, all t(cid:19)he channel entities are expanded as H = κ/(κ+1)H los + 1/(κ+1)H nlos, where κ is the Rician factor, which is set to be 10 dB in this Based on the described proposed methods to obtain'
 'θ, problem (6) reduces to the conventional generality, this letter focuses on the former case since the capacity maximization problem for a MIMO system without analysis for the latter case can be obtained analogously. RIS assistance and can be solved using the singular value This letter considers a practical model of RIS in the sense decomposition (SVD) method. In particular, let the SVD that the RE reflection magnitude varies as a function of the operation on H eff be expressed as H eff = UΛVH , where RE reflection phase shift. Following [7], the value of φ m can U ∈ CNr×N d and VH ∈ CN d ×Nt are unitary, and Λ = be expressed as diag(λ 1 ,...,λ N ) is a matrix whose diagonal entries are d Z m −Z 0 the singular values of H eff in descending order. The optimal whereZ 0 isthefree-s φ pa'
 're M co , nstants representing the (5 R b E ) p 1 m ,... a ,p x Nd C = (cid:9) i N = d 1 log2 1+ p σ i λ 2 2 i (8a) characteristics determined by the specific electrical circuit (cid:9)N d implementationwithintheelement.Thethreeconstantscanbe s.t. p i ≤P s . (8b) obtainedviaaregressiontechniqueandareindependentofthe i=1 channel realization. Note that θ m is bounded by θ min ≥ −π The solution to problem (8) is given by [10] as and θ max ≤ π since the practical RIS circuit implementation (cid:5) (cid:6) in[7] lacks the capability to performfull360 ◦ fulltuning [9]. p i =max η−σ2/λ2 i ,0 , (9) This letter aims to maximize the capacity of the considered where η ∈ R can be found by solving the following root-ofRIS-aided MIMO system by finding the optimal precoder T equation problem, which comes from satisfying the transmit and phase-shift'
 'Technologies for Transmitter [32], [39], Channel State Information-Time Reversal (CSIThe signal emitted by the transmitter constitutes the core TR) [25], Multidimensional Scaling (MDS) [25], Sequencedataforpinpointingadevice’slocation.Basedontheliterature based Localization (SBL) [25], K-Nearest Neighbors (KNN) review outcomes, it is evident that Wi-Fi and Bluetooth [33], weighted-KNN [33], direct positioning algorithm (DPA) Low Energy (BLE) are the predominant signal technologies [39], lightweight fingerprinting [22], nonlinear least squares used for location determination in IPS. In addition to these [35], min-max [26], Angle of Arrival (AoA) [29], maximum technologies, other signal protocols employed in IPS research likelihood [42], and multilateration [43]. These methods are include Ultra Wide Band (UWB), Zigbee, LoRaWAN, and summarized in Table III. Our discussion focuses on trilateraCC2500RF. These findings are summarized in Table II. tion and fingerprinting because they are the most frequently adopted methods by researchers in the IPS domain. TABLEII WIRELESSTECHNOLOGIESFORTRANSMITTER TABLEIII Technology Reference Total METHODSTODETERMINEAPOSITION Wi-Fi [1],[2],[8],[11],[13],[14],[16]–[18],[20], 18 Methods'
 'CM×Nt, and H r ∈ CNr×M , respectively. The reflection H eff =H d+H r ΦG, (6c) C co N e d ffi , c T ie ∈ nts C o N f t× th N e d m , a th nd R R Es ∈ ar C e N d d e × n N ot r e b d e a t s he φ m tra ∈ nsm C i . tt L e e d t d s at ∈ a φ m =β m ejθm, (cid:4) (cid:5) (cid:6) (cid:7) (6d) α from the BS, the linear precoder at the BS, and the linear β m =(1−β min) 0.5sin θ m −θˆ +0.5 +β min , combiner at the UE, respectively. The received signal at the (6e) UE is then expressed as θ min ≤θ m ≤θ max ,∀m ∈M. (6f) y=R(H d+H r ΦG)Ts+Rn,']","frequency fa,n,b of the b-th beam, and C (cid:48)∗ m,q,a(cid:48),b(cid:48) denotes the complex conjugate of the correction phase of the received CC-OFDM symbols, given to the m-th carrier frequency of b(cid:48)-th beam, which use subcarrier fa(cid:48),m,b(cid:48). For the surveillance In the following, various ambiguity functions, each a func- tion of beam, of delay and of Doppler frequency, are pre- sented with transmitter time, sub band and codes scheduling for symbol-1 as visually described in Table 2. Based on the ambiguity function formulation in (32), the analyses are described as follows: i. χa(cid:48)=a=1,b(cid:48)=b(τ = 0, fD = 0, θ0, θ, (cid:49)tb) is the radar ambiguity function analyzed by taking a variable value of θ0 as a function of angular variable, θ.",0.0,0.8349469301567354,0.0,0.0
"B. DOPPLER PROCESSING SIMULATION AND ANALYSIS B. DOPPLER PROCESSING SIMULATION AND ANALYSIS In this subsection, the Doppler processing of a moving target is analyzed. For the Doppler processing in this paper, we set VOLUME 13, 2025 109903 D. Kuswidiastuti et al.: Receiver Processing of the Multibeam Azimuth Scanning CC-OFDM-MIMO Radar echoes received from targets. Beams that receive echoes by targets in their respective directions can be identified correctly by correlating the sum of signals containing echoes from all receive modules with individual signals transmitted individual beams. Correlations are done per symbol, and after delay compensation, coherence processing is done for all the 12 symbols. The simulation results based on the detection of 2 targets at 3 different scenarios show that","As noted by Kuswidiastuti et al. (2022), multi-beam radars, which form multiple beams simultaneously and continuously at both the transmitter and receiver, effectively address the limitations of time-on-target in radar applications.","['which is also an equivalent measure of d(θ) = a(θ), b(θ) = 1 L×1 , and h(θ) = b(θ) so that it is themaximumtargetrange[31],whilethewaveformdiversity obtained gainaffectsthenumberofdetectabletargets[22]. σˆ(θ)= (cid:80)Q q=1 bH(θ)R ˆ yψa∗(θ) (44) 1) IMPACTOFTHENUMBEROFSUBARRAYS (cid:107)b(θ)(cid:107)2aT(θ)R ˆ ψψa∗(θ) The MCA for the PA radar is relatively high because it has very high directional coherent gain, which also implies a Itcanbeseenthatσˆ(θ)in(44)issimilartothatobtained high maximum target range, relative to the other types of in[13]. radar.Anotherconsequenceofthehighdirectionalcoherent gainisthattheminimumreflectioncoefficientofdetectable 2) NCSTRANSMIT-NCRECEIVE targets is the lowest compared to the other types of radar. ThePMIMOradaremploysaNCSTxarray(1< M < K) This is the opposite of the MIMO radar that has a high andaNCRxarray(N =L),withd(θ)=[a (θ),...,a (θ)]T, 1 M waveform diversity gain, which results in the largest maxib(θ)=1 L×1 ,andh(θ)=b(θ).Therefore, mumnumberofdetectabletargets.Meanwhile,theFPMIMO √ σˆ(θ)= K/M (cid:80)Q q=1 bH(θ)R ˆ yψ(c(θ)◦d(θ))∗ (45) r b a e da d r es a i s gn t e h d e t g o en'
 'a pencil beam pattern. Phased arrays acquire high scanningradarsislimited. Multi-beam radars, in which multiple beams are formed The associate editor coordinating the review of this manuscript and simultaneouslyandcontinuouslyatboththetransmitterand approvingitforpublicationwasChengpengHao . the receiver at different angular directions, can eliminate 53682 ThisworkislicensedunderaCreativeCommonsAttribution4.0License.Formoreinformation,seehttps://creativecommons.org/licenses/by/4.0/ VOLUME10,2022 D.Kuswidiastutietal.:TransmitterDesignforMultibeamCC-OFDMAzimuthScanningMIMORadar theaforesaidproblemoflimitedtime-on-target.Multi-beam OFDM MIMO waveform [31]. A set of orthogonal waveradar technology is beneficial to various radar applications, formscanbesimplyacquiredbyarrangingtheallocationof suchassurveillance[3],[4],automotiveradar[5],[6],radar orthogonal subcarriers into different antennas of the MIMO imaging[7],[8],jointmultiusercommunicationandradar[9], radar system. In this radar, the pulse width or the OFDM [10], etc. In this paper, we are interested in multi-beam symbol duration is obtained as the inverse of the subcarrier radarsystemscapableofcoveringalargeangularswathwith spacing. contiguous orthogonal beams, each sufficiently narrow to Another key element of our proposed radar system is the realizeadesiredangularresolution,capableofdetectingthe circulatingcodes(CC),whichareappliedbyimposingaspecdirection, range and Doppler frequency of multiple targets. ified delay between successive antennas of a MIMO radar, Multiple simultaneous beams can be generated by employ- intended to produce correlated'
 '(N = L),with ψ(t) = ϕ (t), a(θ ) = a(θ), d(θ) = 1, 1 l gain to detect small or distant targets and that of waveform b(θ)=1 L×1 ,andh(θ)=b(θ).Hence, diversitygaintoobtainagreaternumberofdetectabletargets. √ σˆ(θ)= K (cid:80)Q q=1 bH(θ)R ˆ yψc∗(θ) (46) the F n ig u . m 2 be d r ep o i f ct t s ra t n h s e m p it er s f u o b r a m rr a a n y c s e M in o M n C th A e t F h P a M t v I a M ri O es r w ad it a h r (cid:107)b(θ)(cid:107)2c(θ)c∗(θ) with N = 16. MCA decreases with the increasing number From evaluation results for the maximum number of of transmit subarrays M. MCA for the PA radar (M = 1), detectedtargetswithdifferentwaveformconfigurations(for thePMIMOradar(M = 8),andtheMIMOradar(M ='
 'for the delay specified scopeofourpaper.TheCC-OFDMMIMOconceptpresents foreachofthem.Inaddition,theMIMOstructureallowsfor abreakthroughintherealizationofmulti-beamradarinaway parallel processing at transmit and receive, which is useful thathasnotbeentriedbefore,combiningdifferentstrategies to accelerate preparation of the transmitted waveforms and in a novel way to obtain a powerful wide-scanning multi- processingofthereceivedsignals. beam radar system with simultaneous range and Doppler OFDM is a wideband multi-carrier waveform which has detection.Todescribethewholeconcept,itisthereforenec- the flexibility in the management of its spectrum compoessarytodividethediscussionintotwoparts.Thefirstpartis nents. The OFDM spectrum consists of several subcarriers onthetransmitter,whichispresentedinthispaper,whereas with smaller bandwidth which are orthogonal to each other thesecondpartdealswiththereceiver,whichisthetopicof and separated with a pre-defined frequency spacing of (cid:49)f. another paper currently being prepared. In order to clearly ItisassumedthattheOFDMsignalgenerationcanbedone and fully describe the concept of CC-OFDM MIMO radar, digitally at a lower frequency band, so that the waveforms whileatthesametimeprovidingarealisticexampleofitsuse can be flexibly designed down to their individual subcarriinaradarapplication,inthesequelwefocusthediscussion ers and controlled by software to meet the demand of the onthedesignofasurveillanceradarsystem.Intheexample, applications [40]. OFDM subcarriers can be coded for difparameters'
 'evaluation of the probability of detection, the probability of miss detection, and the probability of false alarm for the PMIMO and the FPMIMO radars in determining the detection performance. 3) While [31] compares different cases of FPMIMO in terms of T-R gain, SINR, and maximum target range, thispaperdescribesamorecompleteviewoftheflexible subarrayedMIMOradarsystemconceptasthegeneric form of multiple-antenna radar structures that allows trade-off between different performance criteria, consistingofthosementionedinpoint1)and2)aswellas thosereportedin[31]. Following this section, Section II reviews the multiantennaradarsystemandsignalmodel,SectionIIIstartswith areviewoftheparameteridentifiabilityfortheMIMOradar system and proceeds with the extension of the MIMO case tothemoregeneralcaseofFPMIMOradaranditsnumerical evaluation.SectionIVbeginswithareviewofthedetection performance for the PA and MIMO radars and proceeds to discuss the extension of this performance for the FPMIMO radar and its numerical evalution for various parameter values.SectionVcoverstheconsiderationsforimplementation andapplications.TheconclusionisprovidedinSectionVI. II. MULTI-ANTENNARADARSYSTEMANDSIGNAL MODEL A. SYSTEMMODEL Fig.1presentsseveralexamplesofconfigurationsintheTx andRxarraysformultiple-antennaradarsystems.InFig.1a, thePAradarconsistsofthetransmitterofasingleACwaveform with a high coherent gain while the L elements in the Rx array operate as independent receivers (NC). Hence, it is capable of multi-target detection, although the detected targets']","symbols and frame transmission and reception schedul- ing, including the low/high-power modes, beam processing at the receiver by parallel processing, range and Doppler processing involving OFDM symbols and frames. VOLUME 10, 2022 53683 D. Kuswidiastuti et al.: Transmitter Design for Multibeam CC-OFDM Azimuth Scanning MIMO Radar beamforming applications, SDR technology is preferred for its ﬂexibility and low cost , . In our case, the SDR implements all baseband processing at the transmitter and the receiver, including generating inter-element delay required for the application of CC at the transmitter. Beamforming design that meets the required maximum beamwidth in the azimuth is achieved by determining the suitable number of elements employed on the horizontal axis. A good beam pattern can be obtained",1.0,0.7738137253461281,0.0,0.0
"and at the same beam direction, in this case around the range resolution of the radar, which is 60 meter are also can be distinguished with PSLL of −45 dB. The simulation results show that the coupling between beams and symbols are very low as the result of codes and sub-band scheduling at the transmitter. These results are valid for the three scenarios whether the targets are in the same beam, at the nearest neighboring beams and at the nearest co-channel beams. It shows that with the concept proposed in CC-OFDM MIMO Radar, it is possible to design a long-range radar with low power transmission by transmitting multi-orthogonal CC-OFDM symbols in series, to improve the Signal-to-Noise of the radar system.","The CC-OFDM MIMO concept presents a breakthrough in the realization of multi-beam radar, allowing for low power transmission and improved signal-to-noise ratios through the transmission of multi-orthogonal CC-OFDM symbols in series (Tahcfulloh & Hendrantoro, 2020).","['radar is a combination ted using different value of (cid:49)t. This idea is the primary of CC in MIMO radar and multi carrier OFDM radar to contribution of this paper, which will be elaborated in the take the advantages of both systems for beamforming at sequel. A second contribution in this paper concerns the transmit.ByusingOFDMsignalgeneration,subcarrieralloimprovement of time on target in a MIMO radar adopting cationforthemultiplesimultaneousbeamscanbedoneina CC-OFDMwaveforms.Whilemultiplebeamscanningintra- flexible manner. As will be demonstrated in this paper, it is ditional phased array radar results in limited time on target, possible to sparse the total OFDM bandwidth into multiple CC-OFDM MIMO radar could give a much longer time on carrier sets, i.e., sub-bands, responsible for beamforming to target because multiple beams in CC-OFDM radar can be the specified direction. Orthogonality between the OFDM transmittedsimultaneouslyovermuchlongertimeintervals. subcarriers combined with CC in multiple active antenna There are two key problems which may arise from radar systems'
 'ReceivedNovember21,2019,acceptedDecember27,2019,dateofpublicationJanuary9,2020,dateofcurrentversionJanuary17,2020. DigitalObjectIdentifier10.1109/ACCESS.2020.2965192 FPMIMO: A General MIMO Structure With Overlapping Subarrays for Various Radar Applications SYAHFRIZALTAHCFULLOH 1,2,(StudentMember,IEEE),AND GAMANTYOHENDRANTORO 1,(SeniorMember,IEEE) 1DepartmentofElectricalEngineering,InstitutTeknologiSepuluhNopember,Surabaya60111,Indonesia 2DepartmentofElectricalEngineering,UniversitasBorneoTarakan,Tarakan77123,Indonesia Correspondingauthor:SyahfrizalTahcfulloh(syahfrizal15@mhs.ee.its.ac.id) ThisworkwassupportedbytheIndonesianMinistryofResearch,Technology,andHigherEducationthroughthe2015-2018BPPDN ScholarshipNo.028872/IT2/HK.00.00/2015andthe2017PKPIScholarshipNo.1469/D3/PG/2017. ABSTRACT Unlike the phased array (PA) radar that achieves array gain in proportion to the number of elements, the MIMO radar provides improvement to parameter estimation, target detection, and so on. Recently, the combination of the PA and MIMO concepts into the Phased MIMO (PMIMO) radar was proposed with overlapping non-coherent subarrays at the transmitter and an array with non-coherent elements at the receiver that proved to outperform the more conventional radars. This paper examines the parameteridentifiability,i.e.,themaximumnumberofdetectabletargetsuniquelyidentifiedandthedetection performance,i.e.,theprobabilitiesofdetectionandfalsealarm,oftheFullPMIMOradar(FPMIMO),which isafurthergeneralizationofcombinationofthePAandMIMOconceptsthatusesoverlappingsubarrayson bothtransmitandreceivearrays.ThemaximumnumberofresolvabletargetsontheFPMIMOradarisderived bytheleastsquares(LS)methodanditsperformanceissubsequentlyevaluatednumericallybyconsidering themagnitudeoftargetreflectioncoefficientasfunctionofdirectionangleforcomparisonagainstPA,MIMO andPMIMOradars.Similarly,thederivationofexpressionsforprobabilitiesofdetectionandfalsealarmis given. In particular, the numerical evaluation is made on the maximum number of resolvable targets with respecttotheimpactofthenumberofsubarrays,thetotalnumberofelementsandtheelementspacing,while thedetectionperformanceisevaluatedbasedontheeffectofthreshold,SNR,andthenumberofsubarrays. The results demonstrate that, being the more general form of multi-antenna radars, the FPMIMO radar is capable of flexibly trading off the maximum number and the'
 'which is also an equivalent measure of d(θ) = a(θ), b(θ) = 1 L×1 , and h(θ) = b(θ) so that it is themaximumtargetrange[31],whilethewaveformdiversity obtained gainaffectsthenumberofdetectabletargets[22]. σˆ(θ)= (cid:80)Q q=1 bH(θ)R ˆ yψa∗(θ) (44) 1) IMPACTOFTHENUMBEROFSUBARRAYS (cid:107)b(θ)(cid:107)2aT(θ)R ˆ ψψa∗(θ) The MCA for the PA radar is relatively high because it has very high directional coherent gain, which also implies a Itcanbeseenthatσˆ(θ)in(44)issimilartothatobtained high maximum target range, relative to the other types of in[13]. radar.Anotherconsequenceofthehighdirectionalcoherent gainisthattheminimumreflectioncoefficientofdetectable 2) NCSTRANSMIT-NCRECEIVE targets is the lowest compared to the other types of radar. ThePMIMOradaremploysaNCSTxarray(1< M < K) This is the opposite of the MIMO radar that has a high andaNCRxarray(N =L),withd(θ)=[a (θ),...,a (θ)]T, 1 M waveform diversity gain, which results in the largest maxib(θ)=1 L×1 ,andh(θ)=b(θ).Therefore, mumnumberofdetectabletargets.Meanwhile,theFPMIMO √ σˆ(θ)= K/M (cid:80)Q q=1 bH(θ)R ˆ yψ(c(θ)◦d(θ))∗ (45) r b a e da d r es a i s gn t e h d e t g o en'
 'research and tifiability of phased-MIMO radar,’’ inProc. Int. Conf. Artif. Intell. Inf. astronomy,’’IEEEJ.Sel.TopicsSignalProcess,vol.2,no.5,pp.609–612, Technol.(ICAIIT),Yogyakarta,Indonesia,Mar.2019,pp.192–195. Oct.2008. [31] S.TahcfullohandG.Hendrantoro,‘‘FullphasedMIMOradarwithcolo[6] J. Li, P. Stoica, and X. Zheng, ‘‘Signal synthesis and receiver design catedantennas,’’Int.J.Commun.AntennaPropag.,vol.9,no.2,p.144, forMIMOradarimaging,’’IEEETrans.SignalProcess.,vol.56,no.8, Jul.2019. pp.3959–3968,Aug.2008. [32] E.Fishler,A.Haimovich,R.Blum,L.Cimini,D.Chizhik,andR.Valen[7] I.BekkermanandJ.Tabrikian,‘‘Targetdetectionandlocalizationusing zuela,‘‘Spatialdiversityinradars–modelsanddetectionperformance,’’ MIMOradarsandsonars,’’IEEETrans.SignalProcess.,vol.54,no.10, IEEETrans.SignalProcess.,vol.54,no.3,pp.823–838,Mar.2006. pp.3873–3883,Oct.2006. [33] M.I.Skolnik,IntroductiontoRadarSystems,3rded.NewYork,NY,USA: [8] W.Wang,‘‘ApplicationsofMIMOtechniqueforaerospaceremotesensMcGraw-Hill,2002. ing,’’inProc.IEEEAerosp.Conf.,BigSky,MT,USA,Mar.2007,pp.1–10. [34] H.Meikle,ModernRadarSystems,2nded.Boston,MA,USA:Artech [9] A.Haimovich,R.Blum,andL.Cimini,‘‘MIMOradarwithwidelysepa- House,2008. ratedantennas,’’IEEESignalProcess.Mag.,vol.25,no.1,pp.116–129, [35] R.H.RasshoferandK.Gresser,‘‘AutomotiveradarandLidarsystems Dec.2008. fornextgenerationdriverassistancefunctions,’’Adv.RadioSci.,vol.3, [10] Y.Li,H.Ma,Y.Wu,L.Cheng,andD.Yu,‘‘DOAestimationforecho pp.205–209,Apr.2010. signalsandexperimentalresultsintheAMradio-basedpassiveradar,’’ [36] E.Lissel,H.Rohling,andW.Plagge,‘‘Radarsensorforcarapplications,’’ IEEEAccess,vol.6,pp.73316–73327,2018. inProc.IEEEVeh.Technol.Conf.(VTC),Dec.2002,pp.438–442. [11] A. Hassanien and S. A. Vorobyov, ‘‘Transmit/receive beamforming for [37] B.R.Mahafza,RadarSignalAnalysisandProcessingUsingMATLAB. MIMOradarwithcolocatedantennas,’’inProc.IEEEInt.Conf.Acoust., BocaRaton,FL,USA:Chapman-Hall,2009. SpeechSignalProcess.,Taipei,Taiwan,Apr.2009,pp.2089–2092. [38] I. Bilik, O. Longman, S. Villeval, and J. Tabrikian, ‘‘The rise of radar [12] D. Wilcox and M. Sellathurai, ‘‘On MIMO radar subarrayed transmit forautonomousvehicles:Signalprocessingsolutionsandfutureresearch beamforming,’’IEEETrans.SignalProcess.,vol.60,no.4,pp.2076–2081, directions,’’ IEEE Signal Process. Mag., vol. 36, no. 5, pp. 20–31, Apr.2012. Sep.2019. [13] J.Li,P.Stoica,L.Xu,andW.Roberts,‘‘Onparameteridentifiabilityof MIMOradar,’’IEEESignalProcess.Lett.,vol.14,no.12,pp.968–971, Dec.2007. SYAHFRIZAL TAHCFULLOH received the [14] L.Xu,J.Li,andP.Stoica,‘‘Targetdetectionandparameterestimationfor B.Eng.degreeinelectricalengineeringfromUniMIMOradarsystems,’’IEEETrans.Aerosp.Electron.Syst.,vol.44,no.3, versitasGadjahMada,Yogyakarta,Indonesia,in pp.927–939,Jul.2008. 2003,andtheM.Eng.degreeinelectricalengineer[15] T. D. Backes, ‘‘Parameter identifiability in a phased-subarray MIMO ingfromtheInstitutTeknologiSepuluhNopemradar,’’ in Proc. IEEE Aerosp. Conf., Big Sky, MT,'
 'By substituting (13) into (16), the digital IF waveform becomes: N (cid:88) cb −1 x p IF ,a,b (k) = I p C n,p,a,b g a,b,n n=0 ×e j2π(f (cid:49) IF f +n+(za,b −1)Ncb (cid:49)f(kT s IF−(a−1)T0 +p(cid:49)tb) for0≤kTIF −(a−1)T +p(cid:49)t ≤T . (17) s 0 b 0 III. ANEXAMPLEOFCC-OFDMMIMORADARFOR beamwithabeamwidthoflessthan2◦intheazimuthplane. LONG-RANGESURVEILLANCE The azimuth and elevation beamwidth requirements of less A. REQUIREMENTS than2◦ and20◦,respectively,canbeobtainedwithaplanar To elucidate the novel concept and detailed implementation array of 101 elements in the azimuth and 21 elements in of the CC-OFDM MIMO radar, we will take a surveillance elevation,whichleadstoagainof33dBassumingisotropic radar design as an example for analyses in the subsequent elements and no amplitude taper. The 21-element structure sections. The CC-OFDM MIMO radar waveform designed can be realized as a vertical array, instead of a single eleherein is based on the requirement of surveillance radars ment that is a part of the horizontal linear array previously']","the transmitter design for long-range surveillance radar has been described to clarify the concept and demonstrate the potential advan- tages of the CC-OFDM MIMO radar. By using the proposed design, a range resolution of 52 meter and an azimuth resolu- tion of 1.7◦ can be achieved. For the multi-beam scheme, the beam isolation of −30 dB can be achieved for both between the co-channel beams and between the neighboring beams. The receiver design of CC-OFDM radar, including the beam, range and Doppler processing of the received signal will be discussed in a separate paper.",0.2,0.851678513463969,0.0,0.25
"with the following formula: TP + TN TP + TN + FP + FN Accuracy = Precision = Recall/True Positive Rate(TPR) TP TP + FP TP TP + FN F1 = 2 × precision × recall precision + recall FP TN + TP (cid:90) 1 TPRd(FPR) False Positive Rate(FPR) = AUC = (4) (5) (6) (7) (8) (9) where TP is the number of correctly predicted positive labels, TN is the number of correctly predicted negative labels, FP is the number of incorrectly predicted positive labels, and FN is the number of incorrectly predicted negative labels. Accuracy is the ratio of true predictions to the overall data. Precision is the ratio between TP to the total number of positive predic-","The accuracy, precision, and recall metrics are essential for evaluating model performance in classification tasks, as demonstrated in the context of improving intrusion detection systems (Suyanto et al., 2019).","['1488.8 3 955 1171 1425 1640 1856 1409.4 4 1096 1406 1686 1858 2113 1631.8 5 1201 1553 1906 2256 2599 1903 8 1626 2209 2855 3123 3653 2693.2 6 1372 1941 2233 2548 3057 2230.2 TABLE V. CLASSIFICATION RESULTS IN EACH ACCEPTED FEATURES Entropy Gini Index Depth Accuracy Sensitivity Specificity Accuracy Sensitivity Specificity 3 0.998682278 0.998137797 0.999314045 0.998658464 0.99810826 0.99929689 4 0.998706092 0.998152616 0.999348339 0.998666337 0.998152476 0.999262572 5 0.998793258 0.998285484 0.999382522 0.998809288 0.9983002 0.999399863 6 0.998927976 0.998521585 0.999399554 0.998927976 0.998521585 0.999399554 7 0.998927976 0.998521585 0.999399554 0.998753491 0.998226492 0.999365243 8 0.998475888 0.99781321 0.999245242 0.998491764 0.997783852 0.999313776 9 0.998452074 0.997857248 0.999142441 0.998460012 0.997842569 0.999176708 10 0.99850764 0.997916332 0.999193904 0.998452074 0.997857248 0.999142441 lower depth (i.e., 3 and 4) does not solve the infinite problem. Considering the number of iterations, entropy can solve So, the best-estimated parameter for depth is 7. the problem of the infinite loop at depth = 7. At this'
 '0.6090 0.6367 0.6229 Diabetes Mellitus,"" INFORM, no. Vol. 4 (1), 2019. 3 Random Forest 0.6211 0.6460 0.6336 [8] Suyanto, Data Mining untuk Klasifikasi dan Klasterisasi Data Edisi Revisi, Bandung: Informatika, 2019. 4 Ada Boost 0.6576 0.6112 0.6344 [9] J. Diz, G. Marreiros, and A. Freitas, ""Applying data mining techniques to 5 KNN 0.5785 0.6078 0.5932 improve breast cancer diagnosis,"" J. Med. Syst. , no. vol. 40, no. 9, pp. 1-7, 2016. Mean 0.6147 0.6267 0.6207 [10] S. Santiso, A. Casillas, and A. Pérez, ""The class imbalance problem detecting adverse drug reactions in electronic health records,"" Health Information, no. Vol. important in medical diagnoses to correctly identify patients 25, No. 4, p. 1768–1778, 2019. with disease than the F1 Score. [11] N. V. Chawla, K. W. Bowyer, L. O. Hall, and W. P. Kegelmeyer, ""SMOTE: Synthetic Minority Over-sampling Technique,"" Journal of Artificial Intelligence The scientific reason why SMOTE ENN is the'
 '23 0.99880929 0.9983002 0.99939986 36 Accepted 13506 9 11652 28 0.99853145 0.99793114 0.9992282 37 Accepted 13505 10 11653 27 0.99853145 0.99800473 0.99914259 IV. EXPERIMENTAL RESULTS AND DISCUSSION The method is implemented by the python programming language in Google Colaboratory with the specifications of Tesla K80 as GPU and 12 GB RAM. The dataset is NSLKDD, which consists of 125973 records. A. Depth and Number of Trees The results of classification and running time are analyzed to evaluate the performance of the feature selection algorithm in terms of accuracy, specificity, and sensitivity. Processing time is calculated based on the running process, which is run by considering the number of iterations of the Boruta Algorithm. As previously described, the Boruta Algorithm has an infinite loop problem on specific parameters. In this experiment, the maximum iteration is 100. It means that in case the loop has reached 100th, it is identified as an'
 'based on statistical learning theory [34], [35]. This score.Equation(10)describestheobjectivefunctionofeach modelcanseparatedataintoclassesbyconstructingseveral round. lines (hyperplanes), which are called SVM decision boundaries.Margins,thedistancebetweenhyperplanes,aredeter- L(t) = Xn l (cid:16) y,y (t−1) +f (x) (cid:17) +(cid:127)(f ) (10) minedbySVMkernelcalculations.Theradialbasisfunction i=1 i i t i t (RBF)isapopularkernelbasedontheGaussiandistribution (t) where l is the loss function, y is the predicted result of ifunction[36],whichisexpressedin(8). i th in t-th iteration, and (cid:127) is a regularization term. In this K (cid:0) x,x (cid:1)=exp − (cid:13) (cid:13)x i −x j (cid:13) (cid:13) 2! (8) case,theparametersofXGBoostwithRFwerethesameas i j 2σ2 theirrespectivevalues.However,XGBoosthasanadditional parameter, namely the learning rate, which was set at 0.3. (cid:13) (cid:13) where(cid:13)x i −x j(cid:13)istheEuclideandistancebetweentwopoints Increasingthelearningratemightexpeditethemodel’scomx andx,andσ2 isthevariance.Thisstudyinvolvesseveral putationalspeed;nevertheless,thismayresultininadequate i j SVMparameters:theRBFkernel,Cis1,andothersfollow prediction accuracy as a significant portion of the training thedefault.TheCfunctionregulatestheclassificationerror datamaynotbeeffectivelyutilized. byadjustingtheinclusionofaccuratetrainingdatainaccordancewiththemarginsizeofthedecisionfunction.Whenthe 4) LINEARDISCRIMINANTANALYSIS(LDA) C value is increased, the decision function aims to create a LDAisasupervisedlearningalgorithmusedforclassification narrowmarginonthedecisionlineinordertodistinguishthe tasks[44].Itcanalsobeusedasadimensionalityreduction dataclasses.Thiscanresultinthemodeloverfitting.Never- technique, which maximizes the separation between classes theless,whentheCvalueisreduced,itformsawidermargin, by finding a set'
 '[24]. Specificity assesses how well the inreal-timeapplications[27]. modelidentifiesnegativecaseswithoutproducingsignificant errors [34]. Negative predictive value indicates how often a negativepredictioniscorrect[31],[34].Precisionandrecall G. META-ANALYSIS can be combined into a single value using the F1-score and In this section, we conducted a meta-analysis to evaluate F2-score,wheretheF1-scoregivesequalweighttoprecision and compare the performance of various models tested on and recall, while the F2-score prioritizes recall [24]. The different datasets for lesion detection. Although the origiarea under the curve (AUC) shows the model’s ability to nal data table presents a comprehensive set of performance distinguishbetweenpositiveandnegativeclasses[51].Mean metrics, the graphs we created display the averages of four average precision (mAP) measures the average accuracy of keymetrics:Accuracy(Acc),Precision(Prec),Recall(Rec), the model in detecting objects across different classes [24]. andSpecificity(Spec)acrossdifferentcategoriesandstages. In image segmentation, the Dice coefficient is frequently Thesemetricswereselectedfortheirrelevanceinevaluating used to quantify the similarity between two samples [21]. modelperformanceforlesiondetectionandtheirwidespread The Matthew Correlation Coefficient (MCC) measures the useinrelatedliterature. VOLUME13,2025 43545 N.Rochmawatietal.:DeepLearning-BasedLesionDetectioninEndoscopy:ASystematicLiteratureReview Given the complexity of the']","(TP+FP). To determine how well a positive value is found, recall is employed. It applies true positives (TP) to all ground truth values, which include both true positives and false negatives (FN). The F1 score is an evaluation metric that combines a model’s precision and recall scores, as illustrated in the equation that calculates accuracy. The accuracy statistic computes the number of times the iYOLOV7-TPE-SS model predicted accurately throughout the entire dataset , : F1score = 2 · (P · R) (P + R) (13) The system performance of the iYOLOV7-TPE-SS model has been evaluated using a metric known as mean average accuracy (mAP), which takes into account the average recall (AR), F1-score, and inference time. The inference time has",0.0,0.8237708014602524,0.0,0.0
"exhib- ited better performance than the MobileNet model, in which the models achieved an accuracy of 85% and 84.52%, respectively. Furthermore, the ResNet-101 model achieved a higher recognition performance of 88.37%, while the MobileNetV2 achieved the performance with an accuracy of 85.46% and a precision, recall, and F1 of 91%, 84%, and 85%, respectively. Furthermore, we performed more experi- ments using several different architectures i.e., DenseNet169, InceptionResNetV2, Xception, and EfﬁcientNetB4 that yielded accuracy of 88.76%, 87.16%, 89.31%, and 88.21%, respectively. The highest accuracy achieved by the benchmark models was only 89.31%. Our previous study proposed a data aug- mentation technique based on neural style transfer and geo- metric transformation to address the scantiness of Balinese carving data , which increased","The VGG19 architecture has been identified as a superior model for style transfer tasks, which aligns with the findings of our study regarding the performance of various neural network architectures (Isnanto et al., 2024).","['REFERENCES third batch. The result of the third section showed that the ""conv2_1"" and ""conv3_1"" layers were found to be the best [1] K. Simonyan and A. Zisserman, ""Very deep convolutional networks layer for batik style reconstruction. No significant difference for large-scale image recognition,"" in 3rd International Conference on was found for all compositions of the VGG16 model. Learning Representations (ICLR 2015), San Diego, USA, 2015. However, some significant differences were found for VGG19 [2] L. A. Gatys, A. S. Ecker and M. Bethge, ""A Neural Algorithm of weighting compositions. Fig. 11 displays the difference. The Artistic Style,"" Journal of Vision, vol. 16, no. 12, p. 326, 2016. coloring of the image becomes less muddied with colors not [3] P. Wang, Y. Li and N. Vasconcelos, ""Rethinking and Improving the present in the original image. However, the changes made to Robustness of Image Style Transfer,"" in 2021 IEEE/CVF Conference on'
 '“A ConvNet for the 2020s,” in 2022 IEEE/CVF Conference on Computer Vision and Pattern Recognition (CVPR), 2022, pp. 11966–11976. doi: 10.1109/CVPR52688.2022.01167. [5] A. Howard et al., “Searching for MobilenetV3,” in 2019 IEEE/CVF International Conference on Computer Vision (ICCV), 2019, pp. 1314– 1324. doi: 10.1109/ICCV.2019.00140. [6] N. Naufal, Ahmad Afiif; Fatichah, Chastine; Suciati, “Preprocessed Mask RCNN for Parking Space Detection in Smart Parking Systems,” International Journal of Intelligent Engineering and Systems, vol. 13, no. 6, pp. 255–265, 2020, doi: 10.22266/ijies2020.1231.23. [7] S. Jiang, H. Jiang, S. Ma, and Z. Jiang, “Detection of Parking Slots Based on Mask R-CNN,” Applied Sciences, vol. 10, no. 12. 2020. doi: 10.3390/app10124295. [8] Pemerintah Indonesia, Pedoman Survai Pencacahan Lalu Lintas dengan cara Manual. Jakarta, 2004. [9] H. Gholamalinejad and H. Khosravi, “Vehicle classification using a real-time convolutional structure based on DWT pooling layer and SE blocks,” Expert Syst Appl, vol. 183, p. 115420, 2021, doi: https://doi.org/10.1016/j.eswa.2021.115420.'
 'study [8], the process was applications, future directions,"" Journal of Big Data, vol. 8, no. 53, 2021. done more extensively. A significant difference was found for all six images. Fig. 13 shows the result of the last section. The [10] S. Mascarenhas and M. Agarwal, ""A comparison between VGG16, VGG19 and ResNet50 architecture frameworks for Image bars represent the response from Strongly Not Good (1) with Classification,"" in 2021 International Conference on Disruptive red color to Strongly Good (5) with cyan color. The responses Technologies for Multi-Disciplinary Research and Applications for the post-processed images were positive. The post- (CENTCON), Bengaluru, India, 2021. processing of this study is shown to be effective in improving [11] N. L. H. Hien, L. V. Huy and N. V. Hieu, ""Artwork style transfer model the batik style transfer image quality. using deep learning approach,"" Cybernetics and Physics, vol. 10, no. 3, pp. 127-137, 2021. [12]'
 ""the previous version with similar accuracy. EfficientNetV2 is a family of CNN architectures offering faster training speed and better parameter efficiency than previous models [19]. EfficientNetV2 extensively uses MBConv (MobileNetV2-style inverted residual blocks) and the newly added layer fused-MBConv in the early layers. This study chose to adopt EfficientNetV2-S, the baseline architecture from this family, due to computational resource reasons to construct a smaller model while still maintaining model performance. The EfficientNetV1 family is the backbone of the EfficientDet family, which has achieved state-of-the-art results on object detection challenges. C. Model Evaluation Evaluation Metrics used in this study to evaluate model performance are precision, recall, and F1 Score. These metrics can be calculated by (1) – (3). This study's calculation of True Positive, False Positive, and False Negative differs from other classifications or detections [20]-[23]. These are chosen and calculated following previous studies [1]. Precision detects the truly correct prediction""
 '[16] K. He, X. Zhang, S. Ren, and J. Sun, ""Deep Residual Learning for Image Recognition,"" in 2016 IEEE Conference on Computer Vision Program, Penelitian Keilmuan, Penelitian Flagship, and Pattern Recognition (CVPR), Las Vegas, NV, USA: IEEE, Jun. Penelitian Kolaborasi Pusat and under the Project Scheme 2016, pp. 770–778. doi: 10.1109/CVPR.2016.90. of the Publication Writing and Intellectual Property Rights [17] Y. Li, S. Xie, X. Chen, P. Dollar, K. He, and R. Girshick, (IPR) Incentive (Penulisan Publikasi dan Hak Kekayaan ""Benchmarking Detection Transfer Learning with Vision Transformers."" arXiv, Nov. 22, 2021. Accessed: May 12, 2024. Intelektual/PPHKI) Program 2024. [Online]. Available: http://arxiv.org/abs/2111.11429 [18] A. Howard et al., ""Searching for MobileNetV3."" arXiv, Nov. 20, REFERENCES 2019. Accessed: May 12, 2024. [Online]. Available: http://arxiv.org/abs/1905.02244 [1] J. Zheng et al., ""Growing status observation for oil palm trees using [19] M. Tan and Q. V. Le, ""EfficientNetV2: Smaller Models and Faster Unmanned Aerial Vehicle (UAV)']","Results from the performance evaluation for CNN, BiLSTM, BiGRU, CNN-BiGRU, HWE-CBiGRU without attention, and HWE-CBiGRU with soft attention, with respect to accu- racy, recall, precision, and F1 score, are presented in Table 4. The conventional CNN architecture produced good per- formance with an accuracy, recall, precision, and F1 score of 84.35%, 86.24%, 84.26%, and 85.24%, respectively. The BiLSTM model obtained a lower accuracy and F1 score of 81.24% and 84.84%, respectively, compared to CNN despite having a relatively high recall rate. Mean- while, the BiGRU model obtained the highest accuracy, recall, precision, and F1 score among the baseline mod- els, with a value of 85.46%, 87.80%, 86.85%, and 86.31%, respectively. The CNN-BiGRU model exhibited enhanced accuracy and F1 score in",0.0,0.808509777871357,0.0,0.0
"process, an audit involves acquiring and objectively evaluating evidence related to allegations of economic activities and other operations. The aim is to assess the level of conformity between the reports and predefined criteria, and to communicate the results to relevant users, in this case, the organization responsible for establishing information system gover nan nance. One of the proven frameworks for information system auditing is the Control Objectives for Information and Related Technology (COBIT) 2019, which is utilized as the reference framework in this research . COBIT 2019 offers an effective methodology for evaluating the capability of information technology processes, specifically focusing on Deliver, Service and Support - Operation Management. This framework guarantees that the data (DSS01) is received, managed fully,","The COBIT 2019 framework provides comprehensive guidance for identifying and monitoring necessary controls within predefined business objectives, making it a proven methodology for information system auditing (Identifying Non-Conforming Process in Automobile Insurance Claims Using Process Mining and COBIT 2019).","[""holistic approach to evaluating and framework designed to assist organizations in managing and enhancing the effectiveness of an organization's information controlling information technology more effectively [1], [2]. systems [12]. Through the use of the COBIT 2019 framework, COBIT provides comprehensive guidance for identifying, auditors can pinpoint key controls necessary to achieve establishing, and monitoring the necessary controls within the predefined business objectives. Meanwhile, event log process IT environment to achieve defined business objectives [3], [4]. mining enables auditors to delve into the event log data In auditing systems with COBIT, auditors use COBIT generated by information systems to visually map process standards and principles to evaluate the maturity and flows. By combining these two approaches, auditors can effectiveness of internal controls within an organization's IT conduct in-depth analyses of system compliance with COBIT system [5]. This audit helps identify weaknesses and potential standards and identify noises from established procedures. risks,""
 ""controls within an organization's IT conduct in-depth analyses of system compliance with COBIT system [5]. This audit helps identify weaknesses and potential standards and identify noises from established procedures. risks, as well as providing recommendations for improving This integrated audit approach provides comprehensive and enhancing information technology management [6], [7]. insights into the performance of the organization's information Thus, the system audit with COBIT helps organizations systems, along with recommendations for more effective IT improve the reliability, security, and operational efficiency in management. Thus, audit with COBIT and process mining managing their information technology. [8], [9] from event logs aids organizations in improving the reliability, 979-8-3503-5161-3/24/$31.00 ©2024 IEEE 92116701.4202.72816AIITCI/9011.01 :IOD | EEEI 4202© 00.13$/42/3-1615-3053-8-979 | )AIITCI( snoitacilppA stI dna noitavonnI ygolonhceT no ecnerefnoC lanoitanretnI dn2 4202 Authorized licensed use limited to: Institut Teknologi Sepuluh Nopember. Downloaded on July 14,2025 at 08:18:28 UTC from IEEE Xplore. Restrictions apply. security, and operational""
 'to assist organizations in managing buildarecommendationsystembasedontheinternalbusiness and optimizing their use of information technology (IT) [1]. processes outlined in COBIT 2019. In today’s rapidly evolving digital landscape, effective IT Mapping is a crucial aspect of COBIT 2019, as it involves governance is essential for organizations to ensure that their establishing relationships between various elements such as IT investments align with business objectives, comply with business objectives, IT processes, control needs, and technolregulations, and mitigate risks [2]. ogy resources [6]. This mapping ensures that every aspect of COBIT 2019 provides a structured approach for organiza- IT management is linked to the appropriate business objections to establish, implement, and maintain effective gover- tives and control needs, thus enhancing overall governance nance over IT. It defines the components necessary to create effectiveness [1]. One effective way to perform this mapping and sustain a governance system, as well as guidelines for is by utilizing a'
 '24, no. 2, technology governance audit using cobit framework 2019 pp. 197–210, Oct. 2023. DOI: 10.55601/jsm.v24i2.1025. (case study: Mandiri university),” Budapest International Re- [18] M. Sergii V. and N. Oleksandr V., “Data preprocessing and search and Critics Institute-Journal (BIRCI-Journal), vol. 5, tokenizationtechniquesfortechnicalukrainiantexts,”Applied pp. 8030–8038, Feb. 2022. DOI: 10.33258/birci.v5i1.4566. AspectsofInformationTechnology,vol.6,no.3,pp.318–326, [5] M. Damayanti and A. A. Chrismastuti, “Internal audit model 2023. DOI: 10.15276/aait.06.2023.22. post-erp implementation (enterprise resource planning) at pt [19] D. Munkova´, M. Munk, and M. Voza´r, “Influence of stopxyz,” KEUNIS, vol. 11, no. 2, p. 188, Jul. 2023. DOI: 10. wordsremovalonsequencepatternsidentificationwithincom32497/keunis.v11i2.4358. parable corpora,” in ICT Innovations 2013, 2014, pp. 67–76. [6] S. D. Putra, H. Herman, and A. Yudhana, “Audit tata kelola DOI: 10.1007/978-3-319-01466-1 6. academic information system menggunakan framework co- [20] S. Pradha, M. N. Halgamuge, and N. T. Q. Vinh, “Effective bit 2019,” Jurnal Teknologi Informasi dan Ilmu Komputer, text data preprocessing technique for sentiment analysis in'
 'By This process aims to optimize the costs associated with using Neo4j, organizations can create dynamic and interactive internal business processes by reducing IT operational graphicalmodelstobetterunderstandandmanagethecomplex costsandincreasingtheoverallvalueofITinvestments. relationships between different COBIT 2019 elements [10]. 3) EG10: Staff Skills: This process focuses on improving This allows for deeper analysis, real-time monitoring, and the skills of IT staff to enhance the organization’s better decision-making in IT management, ultimately aiding abilitytomanageITeffectivelyandincreaseoperational in the achievement of business goals [11]. efficiency. In summary, this paper proposes the development of a 4) EG11: Risk Management Implementation: This prorecommendation system based on COBIT 2019’s internal cess emphasizes the importance of risk management in business processes, utilizing graph algorithms and similarity thecontextofinformationtechnology.Itisoneofseveral method to provide organizations with a dynamic tool for tasks and components within COBIT that highlight the managing risk, compliance, and performance in the realm of critical role of risk management in IT governance. information technology']","assist organizations in managing and optimizing their use of information technology (IT) . landscape, effective IT In today’s rapidly evolving digital governance is essential for organizations to ensure that their IT investments align with business objectives, comply with regulations, and mitigate risks . COBIT 2019 provides a structured approach for organiza- tions to establish, implement, and maintain effective gover- nance over IT. It defines the components necessary to create and sustain a governance system, as well as guidelines for building the most suitable governance system for an enterprise . By utilizing COBIT 2019, organizations can enhance the efficiency, effectiveness, and reliability of their IT usage, while also ensuring compliance with relevant regulations, policies, and standards . One of the key",0.6666666666666666,0.7425044257543724,0.3333333333,0.8333333333333334
"the Deliver, Service, and Support (DSS) domain to assess the performance of the system and the standards the governance capabilities at the Customer Care unit using the COBIT framework, specifically within the Deliver, Service, and Support (DSS) domain. The primary focus is on assessing process controls related to Information Technology (IT) services and technical support. Data collection is conducted through surveys to support this evaluation. This study adopts a novel approach in identifying COBIT processes, specifically DSS01, through process mining techniques rather than traditional surveys. Process mining utilizes event logs recorded from daily operations. This technique enables real-time process analysis by applying various analytical methods to process these logs. This approach provides deeper and more accurate insights into the effectiveness","This study adopts a novel approach in identifying COBIT processes, specifically DSS01, through process mining techniques rather than traditional surveys (Identifying Non-Conforming Process in Automobile Insurance Claims Using Process Mining and COBIT 2019).","['mining tool developed by claims. These procedures ensure that each claim is managed Fluxicon, aimed at helping organizations visualize, analyze, consistently, efficiently, and in compliance with regulatory and improve the efficiency of their business processes [18]. requirements. The SOP typically includes steps such as First Disco allows users to extract and analyze data from event logs Notification of Loss (FNOL) - Assign Claim (AC) - Claim generated by various information systems, such as ERP or Decision (CD) - Set Reserve (SR) - Payment Sent (PS) - Close CRM. Claim (CC). D. COBIT 2019 D. Process Mining Algorithm COBIT 2019 is a framework published by ISACA [19], Process mining is a technique used to analyze event log [20] to assist organizations in managing and optimizing the data with the aim of understanding and modeling the actual use of information technology (IT) to achieve their business business processes that occur. In this'
 'graph-based method provides a unique approach in identifying these anomalies and improving Domain DSS01 in COBIT 2019, titled ""Define and operational efficiency. An analysis of the method\'s Manage Service Levels,"" addresses the management and performance using an event log from a bank\'s credit establishment of service levels within the scope of an application process revealed that it was 100% accurate in organization\'s IT [22]. Within DSS01, organizations are identifying incorrect patterns and judgments. required to identify specific service requirements, including performance and reliability criteria, and manage user In this research, we will be doing an audit with the COBIT expectations regarding IT services. Additionally, this domain 2019 framework (domain DSS01) and process mining to also covers the measurement and monitoring of service detect processes that do not comply with Standard Operating performance, as well as the adjustment processes necessary to Procedures (SOP). The dataset used consists of automobile ensure that'
 ""controls within an organization's IT conduct in-depth analyses of system compliance with COBIT system [5]. This audit helps identify weaknesses and potential standards and identify noises from established procedures. risks, as well as providing recommendations for improving This integrated audit approach provides comprehensive and enhancing information technology management [6], [7]. insights into the performance of the organization's information Thus, the system audit with COBIT helps organizations systems, along with recommendations for more effective IT improve the reliability, security, and operational efficiency in management. Thus, audit with COBIT and process mining managing their information technology. [8], [9] from event logs aids organizations in improving the reliability, 979-8-3503-5161-3/24/$31.00 ©2024 IEEE 92116701.4202.72816AIITCI/9011.01 :IOD | EEEI 4202© 00.13$/42/3-1615-3053-8-979 | )AIITCI( snoitacilppA stI dna noitavonnI ygolonhceT no ecnerefnoC lanoitanretnI dn2 4202 Authorized licensed use limited to: Institut Teknologi Sepuluh Nopember. Downloaded on July 14,2025 at 08:18:28 UTC from IEEE Xplore. Restrictions apply. security, and operational""
 'in 2020 International Seminar on V. CONC LUSION Application for Technology of Information and Communication (iSemantic), IEEE, Sep. 2020, pp. 517–522. doi: By implementing process mining and COBIT 2019, this 10.1109/iSemantic50169.2020.9234301. research succeeded in detecting nonconforming processes in [3] A. Safitri, I. Syafii, and K. Adi, “Measuring the Performance of the event log of the car insurance claim process. The 2019 Information System Governance using Framework COBIT 2019,” Int J Comput Appl, vol. 174, no. 31, pp. 23–30, Apr. 2021, doi: Cobit matrix used is DSS01 regarding maintaining and 10.5120/ijca2021921253. carrying out operational procedures and operational tasks [4] A. C. Amorim, M. Mira da Silva, R. Pereira, and M. Gonçalves, “Using reliably and consistently. In this matrix the number of non- agile methodologies for adopting COBIT,” Inf Syst, vol. 101, p. standard operational procedures carried out will be calculated. 101496, Nov. 2021, doi: 10.1016/j.is.2020.101496. Process flows that do not comply'
 ""holistic approach to evaluating and framework designed to assist organizations in managing and enhancing the effectiveness of an organization's information controlling information technology more effectively [1], [2]. systems [12]. Through the use of the COBIT 2019 framework, COBIT provides comprehensive guidance for identifying, auditors can pinpoint key controls necessary to achieve establishing, and monitoring the necessary controls within the predefined business objectives. Meanwhile, event log process IT environment to achieve defined business objectives [3], [4]. mining enables auditors to delve into the event log data In auditing systems with COBIT, auditors use COBIT generated by information systems to visually map process standards and principles to evaluate the maturity and flows. By combining these two approaches, auditors can effectiveness of internal controls within an organization's IT conduct in-depth analyses of system compliance with COBIT system [5]. This audit helps identify weaknesses and potential standards and identify noises from established procedures. risks,""]","guidance for understanding, planning, and implementing effective and efficient IT management principles . By adopting COBIT 2019, organizations can improve their IT performance, reduce risks, and ensure that IT is used to support the achievement of business objectives optimally. Domain DSS01 in COBIT 2019, titled ""Define and Manage Service Levels,"" addresses the management and establishment of service levels within the scope of an organization's IT . Within DSS01, organizations are required to identify specific service requirements, including performance and reliability criteria, and manage user expectations regarding IT services. Additionally, this domain also covers the measurement and monitoring of service performance, as well as the adjustment processes necessary to ensure that the services provided remain in line with established standards. III.",0.2,0.7811731631091859,0.99999999995,0.6
"workflow progress and delivering important insights . A major benefit of this method is its ability to use existing database logs, which can decrease the time and cost needed for data collection. Furthermore, using recorded data can reduce the likelihood of information distortion. Given its capability to analyze log data across different systems, process mining has become popular among companies aiming to examine their processe Thus, process mining not only plays a role in improving operational efficiency but also in enhancing the overall quality of healthcare services. This study discusses how process mining can be implemented to support information system audits based on COBIT 2019 for DSS01 Objective, particularly as a method of collecting and validating data within the process","Process mining, when combined with the COBIT framework, significantly enhances the reliability and operational efficiency of information systems, particularly in the context of healthcare services (Identifying Non-Conforming Process in Automobile Insurance Claims Using Process Mining and COBIT 2019).","[""controls within an organization's IT conduct in-depth analyses of system compliance with COBIT system [5]. This audit helps identify weaknesses and potential standards and identify noises from established procedures. risks, as well as providing recommendations for improving This integrated audit approach provides comprehensive and enhancing information technology management [6], [7]. insights into the performance of the organization's information Thus, the system audit with COBIT helps organizations systems, along with recommendations for more effective IT improve the reliability, security, and operational efficiency in management. Thus, audit with COBIT and process mining managing their information technology. [8], [9] from event logs aids organizations in improving the reliability, 979-8-3503-5161-3/24/$31.00 ©2024 IEEE 92116701.4202.72816AIITCI/9011.01 :IOD | EEEI 4202© 00.13$/42/3-1615-3053-8-979 | )AIITCI( snoitacilppA stI dna noitavonnI ygolonhceT no ecnerefnoC lanoitanretnI dn2 4202 Authorized licensed use limited to: Institut Teknologi Sepuluh Nopember. Downloaded on July 14,2025 at 08:18:28 UTC from IEEE Xplore. Restrictions apply. security, and operational""
 'mining tool developed by claims. These procedures ensure that each claim is managed Fluxicon, aimed at helping organizations visualize, analyze, consistently, efficiently, and in compliance with regulatory and improve the efficiency of their business processes [18]. requirements. The SOP typically includes steps such as First Disco allows users to extract and analyze data from event logs Notification of Loss (FNOL) - Assign Claim (AC) - Claim generated by various information systems, such as ERP or Decision (CD) - Set Reserve (SR) - Payment Sent (PS) - Close CRM. Claim (CC). D. COBIT 2019 D. Process Mining Algorithm COBIT 2019 is a framework published by ISACA [19], Process mining is a technique used to analyze event log [20] to assist organizations in managing and optimizing the data with the aim of understanding and modeling the actual use of information technology (IT) to achieve their business business processes that occur. In this'
 'process, revealing events in The primary data source for process mining is the event emerging cases. Utilizing event logs generated in information log, which is a chronological record of every event or activity systems makes business model development easier. in an information system, capturing the time and important details of each step in a process. Disco is a process mining tool B. Process Mining that can analyze event logs to provide valuable insights. In this Process mining is an analytical method used to study, study, event log data from automobile insurance claims from understand, and improve business processes by leveraging 2020 to 2023 is used. With Disco, this data is analyzed to data automatically generated by information systems [16]. visualize and understand the claim process flow, identify This technique involves analyzing event logs or records of noises from established procedures, and find areas needing events that occur within a system,'
 'in managing and optimizing the data with the aim of understanding and modeling the actual use of information technology (IT) to achieve their business business processes that occur. In this research, two main goals. This framework consists of several domains, each algorithms are used: Inductive Miner and Heuristic Miner. covering a set of controls, practices, and objectives related to Authorized licensed use limited to: Institut Teknologi Sepuluh Nopember. Downloaded on July 14,2025 at 08:18:28 UTC from IEEE Xplore. Restrictions apply. Fig. 1 Log Event Map Inductive Miner is a process mining algorithm used to IV. RESULT AND ANALYSIS construct process models from event logs. Inductive Miner focuses on creating a model that is both simple and This research utilizes a public dataset from Kaggle on comprehensible while accurately representing the behavior automobile insurance claims. The dataset consists of 30,000 cases, 180,000 rows of data, and 15 columns. There are six'
 'and understand the claim process flow, identify This technique involves analyzing event logs or records of noises from established procedures, and find areas needing events that occur within a system, such as business improvement . This analysis provides insights to enhance transactions or user activities. From this data, process mining efficiency and compliance with SOPs in managing automobile maps the actual workflow, identifies patterns, trends, and insurance claims. anomalies within the process, and objectively measures C. Car Insurance SOP process performance. Methods for process data mining(PM), present new opportunities for knowledge discovery[17]. Standard Operating Procedures (SOP) for automobile insurance claims are detailed guidelines that outline the C. DISCO standardized process for handling and processing insurance Disco is an innovative process mining tool developed by claims. These procedures ensure that each claim is managed Fluxicon, aimed at helping organizations visualize, analyze, consistently, efficiently, and in compliance with regulatory and improve the']","audits enhance participation and engagement, allowing stakeholders to contribute to improving effectiveness and efficiency. Consequently, survey audits add a qualitative dimension to audit evaluations, facilitating better decision-making and more effective implementation of improvements. Audit with COBIT 2019 and process mining from event logs represents a holistic approach to evaluating and enhancing the effectiveness of an organization's information systems . Through the use of the COBIT 2019 framework, auditors can pinpoint key controls necessary to achieve predefined business objectives. Meanwhile, event log process mining enables auditors to delve into the event log data generated by information systems to visually map process flows. By combining these two approaches, auditors can conduct in-depth analyses of system compliance with COBIT standards and identify noises",0.6,0.9269126684984569,0.0,0.6666666666666666
"stage is performance analysis, where the effectiveness and efficiency of the billing processes are reviewed to identify potential areas for improvement. Overall, these stages are crucial to ensure that the billing practices at the hospital are conducted efficiently and transparently. A. Dataset The ""Hospital Billing"" event log was obtained from the financial module of the ERP system used by a regional hospital , This log records various incidents related to the billing of medical services provided by the hospital. Over a three-year period, from 2013 to 2016, a random sample of 100,000 traces was collected, each representing a recorded example of the process in the system. Within this event log, there are 18 different activities, each depicting distinct stages in","As noted by Putri et al. (2023), enhancing the effectiveness of billing processes is essential for improving service quality in healthcare settings.","['of service detect processes that do not comply with Standard Operating performance, as well as the adjustment processes necessary to Procedures (SOP). The dataset used consists of automobile ensure that the services provided remain in line with insurance claims data from 2020 to 2023. Through this established standards. analysis, it is expected to identify and evaluate discrepancies between actual processes and established procedures. Thus, III. PROPOSE METHOD the results of this audit will provide a better understanding of the effectiveness and compliance of the system with existing A. Data Source SOPs, as well as provide a basis for improving and enhancing The data used in this study comprises event logs from the performance of processes in automobile insurance claim automobile insurance claims spanning from 2020 to 2023. The management. dataset includes 14 attributes: case_id, activity_name, timestamp, claimant_name, agent_name, adjuster_name, II. LITERATURE REVIEW claim_amount, claimant_age, type_of_policy, car_make, A. Event Logs car_model,'
 'mining tool developed by claims. These procedures ensure that each claim is managed Fluxicon, aimed at helping organizations visualize, analyze, consistently, efficiently, and in compliance with regulatory and improve the efficiency of their business processes [18]. requirements. The SOP typically includes steps such as First Disco allows users to extract and analyze data from event logs Notification of Loss (FNOL) - Assign Claim (AC) - Claim generated by various information systems, such as ERP or Decision (CD) - Set Reserve (SR) - Payment Sent (PS) - Close CRM. Claim (CC). D. COBIT 2019 D. Process Mining Algorithm COBIT 2019 is a framework published by ISACA [19], Process mining is a technique used to analyze event log [20] to assist organizations in managing and optimizing the data with the aim of understanding and modeling the actual use of information technology (IT) to achieve their business business processes that occur. In this'
 ""insurance claims spanning from 2020 to 2023. The management. dataset includes 14 attributes: case_id, activity_name, timestamp, claimant_name, agent_name, adjuster_name, II. LITERATURE REVIEW claim_amount, claimant_age, type_of_policy, car_make, A. Event Logs car_model, car_year, type_of_accident, and user_type. These attributes provide comprehensive information about each An information system's event log is a historical record of insurance claim, capturing details of the claim process, the the events that have been stored there [14]. The event log involved parties, and the specifics of the insurance policy and records the sequence of activities of a transaction in order [15]. vehicle. These activities are interrelated with each other. A single transaction flow is indicated by the same case_id. B. Process Mining Tools Event logs offer insight into a process, revealing events in The primary data source for process mining is the event emerging cases. Utilizing event logs generated in information log, which is a chronological record of every""
 'and understand the claim process flow, identify This technique involves analyzing event logs or records of noises from established procedures, and find areas needing events that occur within a system, such as business improvement . This analysis provides insights to enhance transactions or user activities. From this data, process mining efficiency and compliance with SOPs in managing automobile maps the actual workflow, identifies patterns, trends, and insurance claims. anomalies within the process, and objectively measures C. Car Insurance SOP process performance. Methods for process data mining(PM), present new opportunities for knowledge discovery[17]. Standard Operating Procedures (SOP) for automobile insurance claims are detailed guidelines that outline the C. DISCO standardized process for handling and processing insurance Disco is an innovative process mining tool developed by claims. These procedures ensure that each claim is managed Fluxicon, aimed at helping organizations visualize, analyze, consistently, efficiently, and in compliance with regulatory and improve the'
 'J. Schuett, H. R. Kirk, and L. Floridi, “Auditing large fraud in business. There are three main findings in this language models: a three-layered approach,” AI and Ethics, May 2023, doi: 10.1007/s43681-023-00289-2. research. First, most activity sequence patterns in the car [7] J. Mökander, J. Morley, M. Taddeo, and L. Floridi, “Ethics-Based insurance claims process align with the established Standard Auditing of Automated Decision-Making Systems: Nature, Scope, and Operating Procedures (SOP). However, some cases were Limitations,” Sci Eng Ethics, vol. 27, no. 4, p. 44, Aug. 2021, doi: found with patterns that did not comply with the SOP. Among 10.1007/s11948-021-00319-4. 30,000 case IDs, 97.55% comply with the SOP, while 2.45% [8] A. Irsheid, A. Murad, M. AlNajdawi, and A. Qusef, “Information security risk management models for cloud hosted systems: A did not comply with the SOP. Second, the model produced by comparative study,” Procedia Comput Sci, vol. 204, pp. 205–217,']","organizations improve the reliability, security, and operational efficiency in managing their information technology. , Prema et al use process mining techniques to examine a regional hospital's billing procedure. This study emphasizes how crucial it is to increase the billing process' effectiveness in order to give patients higher-quality care. In this study, data from the finance module of the hospital's ERP system was explored to determine bottleneck activities in the invoice procedure. Using anonymised event logs, this study aims to find causality in the hospital's billing process and identify potential bottleneck activities. Audit with surveys is an effective method for gathering essential information to evaluate a process or system . Using carefully crafted questionnaires, auditors directly collect data from individuals or",0.0,0.7594564317017054,0.0,0.0
"Long Short-Term Memory (LSTM) , is a variation of Recurrent Neural Networks (RNN) that has been successfully applied to various Natural Language Processing (NLP) tasks. LSTM has the ability to capture long-range dependencies with sequences making it suitable for solving sequence labeling problems , , , such as Named Entity Recognition tagging (POS-Tag) and Neural (NER), Part-of-Speech combining (NMT). Study Machine Translation Bidirectional LSTM (BiLSTM) model with Conditional Random Field (CRF) to solve NER and POS-Tag Task. BiLSTM encodes word or character vectors into features, while CRF is a classifier to predict the target labels. Previous research has explored enhancing the feature extractor by integrating serves attention mechanisms with existing models or introducing alternative extractors such as Convolutional Neural Networks","As demonstrated in previous research, combining the BiLSTM model with Conditional Random Fields (CRF) has been shown to enhance performance in sequence labeling tasks such as Named Entity Recognition (NER) (Silahiet al., 2023).","['Convolutional Neural Netword (CNN) [27], LSTM [28], a sequence-to-sequence deep learning model for various GatedRecurrentUnit(GRU)[29],CNN-LSTM[30],Graph tasks, such as question answering, information retrieval, Convolutional Network (GCN) [31], and Transformer [32]. or information extraction [9]. In previous research, Long ThepreviousresearchconcludedthatGRUarchitectureperShort-Term Memory (LSTM) networks with latent Bag of formsbeston315of727Indonesianstockissuers[20].The Word (BoW) [10] or pre-trained Transformer model [11] otherresearchcomparingTransformerarchitectureproduces are used to learn source and target text. The generative Transformer Encoder Gated Recurrent Unit (TEGRU) as ABSAusesrawtextasthesourcetextandaspect-sentiment the best performance [33]. Kolmogorov-Arnold Network quadruplet,whichcontainsaspectcategory,sentimentpolar- (KAN) [34], as an emerging neural architecture to solve ity, aspect term, and opinion term, as the target text. The variousproblemsinnumerousdomains,hasbeenextendedin aspect-sentiment quadruplet is transformed into the natural thetime-seriesforecastingdomain.Existingworksutilizing text to fulfill the requirement of the paraphrase generation KANspansfromthecrypto-currencymarket[35]tosatellite model [12]. The context from the source text is learned traffic [36], and stock market [37]. The problem with the by contrastive learning, which employs an aspect-sentiment previousresearchisthatthemodelmustbecreatedoneach quadrupletlabelwithinthetargettext.Contrastivelearningin stockissuer,whichimpliesthathighcomputationisrequired. paraphrasegenerationisusedtodistinguishthelatentspace'
 'an input layer, a positional encoding layer, and four encoder layers, including a self-attention layer, 1) DATASETOFNEWSHEADLINES anormalizationlayer,andafeed-forwardlayer.Thedecoder The text dataset used in this work was gathered from the partbeginswiththeinputlayerandpass-throughfourdecoder Indonesian news portal at kontan.co.id under the categories layers, which contain the self-attention layer, normalization investment, finance, industry, national, and international. layer, encoder-decoder attention layer, and feed-forward The scraping technique collects data between 1 January layer, before reaching the decoder output. The encoder 2017 to 31 March 2022 and produces a title, URL, and decoder parts are linked via the encoder output. description, postdate, category, and subcategory. Statistics On influenza-like illness (ILI) data sets, the transformer fromcollecteddataareshowninTable1. time series architecture outperformed ARIMA, LSTM, and To evaluate performance prediction, task classification in Seq2Seq+attn[35]. text requires ground truth. The dataset already has ground FEDformer is another transformer of time series archi- truth for aspect categorization, but sentiment classification tecture that uses a'
 'architecture. Thus, givetheattentionmechanismabilitytomodelwhichdirection the forward propagation is slightly the same, except for the ofacertaincontextcomesfrom[50]and[51],whichisthen additional step for dividing the key and query vector by its called AdaTrans. Therefore, the modified formula to obtain normbeforeperformingthematrixmultiplication.Therefore, the attention score between query and key vector is shown the attention score between the query and key vector using 3264 VOLUME11,2023 S.Silalahietal.:Transformer-BasedNERonDroneFlightLogstoSupportForensicInvestigation where W and b is the weight and bias parameter for each linearlayerinFFN,andx istheinputvector.Theoutputof this sub-layer is then passed to a linear layer before being propagatedtothedecoder. D. CONDITIONALRANDOMFIELDLAYER In sequence labeling tasks, such as NER, CRF is a commonmethodused.Accordingtostudies,theHiddenMarkov ModelandtheMaximumEntropyMarkovModel(MEMM) are ineffective at analyzing sentence-level sequences comparedtotheCRFapproach[15].ThemainCRFfeaturesthat can compute cross-position label combination probability grab the researchers’ attention to apply this method to the FIGURE4. Softmaxbehavioronvectorsindifferentscales. NERproblem.Combiningthepreviousstate-of-the-artNER model, BiLSTM, with CRF has proven to improve performance [56]. In this paper, CRF is used as the decoder for allencodercombinationsinourexperiment.Foranobserved sequence x = (cid:104)x x ...'
 'technical terminolthe-art method in the sequence labeling task. Accompanied ogy,frequentconjunctionuse,andextensivenestingstructure byastatisticalmodel,CRF,whichcanmaximizetheproba- arethemainchallengesincybersecuritydata[33].Theprior bilityofalabelsequence,hasproventoimprovetheBiLSTM state-of-the-art model employed the XBiLSTM-CRF archiperformance[32].Manymoreadvancedmodelswitharicher tecturetoconductNERonapubliclyavailablecybersecurity inputrepresentationobtainedfrompre-trainedwordembed- dataset[18].Themodel’sperformancewasenhancedbythe dingmodels,suchasWord2vec[34],GloVe[35],ELMo[36], concept of concatenating the word’s vector representation and BERT [13], improved the BiLSTM-CRF architecture. with the Bidirectional Long Short-Term Memory (LSTM) However, the presence of Transformer has revolutionized layer output. The Conditional Random Field (CRF) layer is 3260 VOLUME11,2023 S.Silalahietal.:Transformer-BasedNERonDroneFlightLogstoSupportForensicInvestigation usedtodecodetheconcatenatedoutputsinceitcandetermine of information extraction techniques to obtain insight from howthesequencelabelsrelatetooneanother. unstructured evidentiary data. The retrieved information is Mostoftheworkinvolvedinimplementingdeeplearning expected can assist the forensic investigator in pinpointing modelsispredominantlyspentonfiguringouthowtoprepare thecriticalinformationrelatedtoanincidentintheflightlogs adequateinputrepresentations.Mostoften,wordembedding faster. techniqueslikeGloVe[39],Word2vec[40],BERT[22],and ELMo [41] are used to learn the input representation. Pre- A. DATAPREPROCESSING trained language models, such as BERT and ELMo, can Drone flight log data contains a number of columns with generate contextualized representational vectors after going numerous information regarding the drone’s condition and throughapre-trainedprocedureonalargecorpus.Contrary, state.Fromthosecolumns,wetakethedatafromthemessage, GloVe employs local and global statistics to build a word'
 '2013, pp.273–282. [26] Y. Liu, C. Sun, L. Lin, and X. Wang, ‘‘Learning natural language [Online]. Available: http://www.cfilt.iitb.ac.in/resources/surveys/Anish- inference using bidirectional LSTM model and inner-attention,’’ 2016, Survey-Entailment.pdf arXiv:1605.09090. [5] X.Xiong,Y.Li,R.Zhang,Z.Bu,G.Li,andS.Ju,‘‘DGI:Recognitionof [27] Q.Chen,X.Zhu,Z.-H.Ling,S.Wei,H.Jiang,andD.Inkpen,‘‘Enhanced textualentailmentviadynamicgatematching,’’Knowledge-BasedSyst., LSTMfornaturallanguageinference,’’inProc.55thAnnu.MeetingAssoc. vol.194,Apr.2020,Art.no.105544,doi:10.1016/j.knosys.2020.105544. Comput.Linguistics,vol.1,2017,pp.1657–1668. 110164 VOLUME13,2025 I.M.S.Putraetal.:RTEinIndonesianUsingIndividualBipletHead-Dependent [28] P.Li,‘‘Hybridneuralnetworkmodelbasedonmulti-headattentionfor I MADE SUWIJA PUTRA (Member, IEEE) Englishtextemotionanalysis,’’EAIEndorsedTrans.ScalableInf.Syst., received the master’s degree in electrical engivol.9,no.35,pp.1–10,2022. neeringfromUdayanaUniversity,Bali,Indonesia, [29] J.Zhang,X.Zhang,Z.Liu,F.Fu,Y.Jiao,andF.Xu,‘‘Anetworkintrusion in 2014, and the Ph.D. degree from Institut detectionmodelbasedonBiLSTMwithmulti-headattentionmechanism,’’ TeknologiSepuluhNopember,Surabaya,IndoneElectronics,vol.12,no.19,p.4170,Oct.2023. sia, in 2024. He is currently a Lecturer with [30] Y.JiangandY.Wang,‘‘Topic-awarehierarchicalmulti-attentionnetwork theFacultyofEngineering,UdayanaUniversity. for text classification,’’ Int. J. Mach. Learn. Cybern., vol. 14, no. 5, Hehaspublishedmorethan25journalarticlesand pp.1863–1875,May2023. conferencepapersrelatedtoinformationtechnol[31] R.A.Hidayat,I.N.Khasanah,W.C.Putri,andR.Mahendra,‘‘Featureogy.Hisresearchinterestsincludestudiesrelated richclassifiersforrecognizingtextualentailmentinIndonesian,’’inProc. to natural language processing, software engineering, and information 5thInt.Conf.AIComput.LinguisticsFeature-Rich,vol.189,Jan.2021, systems. pp.148–155,doi:10.1016/j.procs.2021.05.094. [32] P. Qi, Y. Zhang, Y. Zhang, J. Bolton, and C. D. Manning, ‘‘Stanza: A Python natural language processing toolkit for many human languages,’’ in Proc. 58th Annu. Meeting Assoc. Comput. Linguistics: Syst. Demonstrations, Jan. 2020, pp.101–108. [Online]. Available: https://nlp.stanford.edu/pubs/qi2020stanza.pdf [33] J.']","concept of concatenating the word’s vector representation with the Bidirectional Long Short-Term Memory (LSTM) layer output. The Conditional Random Field (CRF) layer is 3260 VOLUME 11, 2023 S. Silalahi et al.: Transformer-Based NER on Drone Flight Logs to Support Forensic Investigation used to decode the concatenated output since it can determine how the sequence labels relate to one another. Most of the work involved in implementing deep learning models is predominantly spent on ﬁguring out how to prepare adequate input representations. Most often, word embedding techniques like GloVe , Word2vec , BERT , and ELMo are used to learn the input representation. Pre- trained language models, such as BERT and ELMo, can generate contextualized representational vectors after going through a",0.75,0.827532446647607,0.249999999975,1.0
"as runtime logs that are constantly generated during the operational period of the device. The information recorded in log data is highly valuable for many purposes, including running system monitoring, running process conformance checks, and overall system evaluation . The use of log data is critical when incident cases occur, as the empirical events and incident scenarios can be discovered by analysing the log artefacts. Assuming that 64252 2024 The Authors. This work is licensed under a Creative Commons Attribution-NonCommercial-NoDerivatives 4.0 License. For more information, see VOLUME 12, 2024 S. Silalahi et al.: Severity-Oriented Multiclass Drone Flight Logs Anomaly Detection the integrity of the log is guaranteed, log data is one of the artefacts with the highest priority for investigating","The analysis of drone logs can reveal critical information that is essential for investigating incidents, such as altitude, speed, and battery levels at the time of the event (Silalahi et al., 2024).","['which is often collected over investigation. This analysis can help investigators identify the extended periods. root cause of the incident, establish timelines, and identify Another advantage of Transformer model is their ability potential witnesses [2]. to generalize well to unseen data, thanks to their ability to For example, in the case of a drone crash, the analysis of capture complex relationships in the input data. This makes the drone logs could reveal critical information such as the them suitable for use in real-world applications where the altitude and speed of the drone, the battery level at the time datasetmaybelimited,andthemodelneedstomakeaccurate of the crash, and the location of the drone at the time of the predictions on unseen data [5]. incident. This information could help investigators determine ThispaperproposestheTransformermethodforclassifying whether the crash was due to a malfunction, operator error, drone malfunctions based on telemetry data. By leveraging or external factors such as weather'
 'orphrases. setting, analysing a large number of log entries resulting from binary anomaly detection is considered inefficient and labour-intensive as the detection is performed on the C. SCOPEANDCONTRIBUTIONS acquired evidence at one time [12]. Therefore, too many Performing multiclass classification typically encodes the detected anomalies need to be detailed into a more fine- labelrepresentationinaone-hotencodingvector,whereeach grained detection to help the investigator better prioritise vector element represents a certain class. One-hot encoding the analysis objective. As a result, this study extends the relies on the assumption that the input data are mutually binary anomaly detection to multi-class anomaly detection, exclusive, where the characteristics of the data between asexemplifiedbyanotherdomainapplicationsuchasplane classes are distinctive. However, this case does not always flightdata[13],imagedata[14],andinternetofvehicle[15]. holdincertaindomains.Whenthedatafromdifferentclasses As a consequence, in a multi-class classification setting, arenotmutuallyexclusive,itmeansthatinstancesbelonging a supervised model is prone to class imbalance problems, todifferentcategoriessharecommonfeatures[17].Asshown wheretheclasscompositioninthedatasetisdisproportionate. inTable1,eachloggroupsharesacommonwordorphrase, To deal with this situation, a study proposed an ensemble making the'
 'in a multi-class classification setting, arenotmutuallyexclusive,itmeansthatinstancesbelonging a supervised model is prone to class imbalance problems, todifferentcategoriessharecommonfeatures[17].Asshown wheretheclasscompositioninthedatasetisdisproportionate. inTable1,eachloggroupsharesacommonwordorphrase, To deal with this situation, a study proposed an ensemble making the samples from different severity levels mutually VOLUME13,2025 105363 S.Silalahietal.:InterpretableOrdinal-AwareWithContrastive-EnhancedAnomalySeverityDetection approach is presented in Section III. The experimental settingsandprocedurearedescribedinSectionIV,whilethe results,findings,anddiscussionsareelaboratedinSectionV. Finally,weconcludethepaperinSectionVI. II. RELATEDWORKS A. LOG-BASEDANOMALYDETECTION Log-based anomaly detection is relatively well-studied, includingincorporatingML[1]anddeeplearning-based[18], [19] to facilitate log anomaly detection. Existing anomaly detection modelling techniques can be conducted either in a point, contextual, or collective setting. Point anomaly FIGURE4. Anillustrationofanomaliesthatoccurduringadrone’sflight. detectioncharacteriseseachlogentry,whetheraneventisan abnormalityoranormalevent.Forinstance,ifausertypesthe wrong password when trying to gain access to an operating inclusive. Therefore, this paper proposes a multitask-based systemprompt,thegeneratedlogmessagecanbeconsidered multiclass drone anomaly detection to assist in a forensic as an anomaly [7], [20], [21]. As for contextual anomaly, investigation. The main contributions of this paper are the detection involves analysing some contextually related summarizedasfollows: attributes to determine whether a log entry is'
 'involves the analysis of log entries recorded by systems either in sequence-based or pointThe associate editor coordinating the review of this manuscript and based modelling techniques, considering the case and data characteristics[1]. approvingitforpublicationwasYangTang . 2025TheAuthors.ThisworkislicensedunderaCreativeCommonsAttribution4.0License. VOLUME13,2025 Formoreinformation,seehttps://creativecommons.org/licenses/by/4.0/ 105361 S.Silalahietal.:InterpretableOrdinal-AwareWithContrastive-EnhancedAnomalySeverityDetection 1) Human-readable log messages can be found in the flightlog,whichishighlyrelevanttovariousincident cases,asshowninFig3.Notonlyisithighlyrelevant, but it is also highly prioritised evidence in diverse investigationcases. 2) Flight log messages cover events from the drone’s sensors,features,andcomponents,makingitonepiece of evidence to perform analysis related to different drone software and hardware components. Therefore, analysingthelogmessagesmeansanalysingthewhole deviceforvariouspossibleincidentscenarios. 3) Flight log messages contain contextual information about the occurring event as a description that FIGURE1. OptionsofartefactsthatcanbeacquiredfromtheUAVand involves multiple parts of the drone simultaneously. thecontrollerwhichcontainvaluableinformationtoperforman For example, a certain circumstance fails a feature or investigation[4]. anoperation,asshowninmessagegroupnumber4in Table1. Similartoothercomputingsystems,anInternetofThings TABLE1. Groupsofsamplemessagesthatsharecommonword(s)or (IoT)device,suchasaUAVordrone,recordsalltheevents phrase(s)yetbelongtodifferentclasses. and activities that happen during a flight and stores the recorded events in log files. These files contain not only empiricalprocessesbutalsorecordthesensordataforevery certaintimeperiod,makingthedroneforensic-readyincaseit'
 'called ”Ardupilot”. The Researchers have conducted investigation on drone engine resultoftheresearchistofindthemethodologyforcollecting failure using drone logs. Although not specific to the use the necessary information, analyzing it, and constructing the of the Transformer, existing research can be used as a basis corresponding timeline. for malfunction classification using the Transformer method. Different from previous research, this paper focuses on the ResearchonthetopicofdronelogsanalysisusingTransformer dataanalysisphase,especiallyindronelogs.Thelogdataused held by Silalahi et al. [3]. The research focused on investigatinthispaperfocusesondatathatcontainsasensorvalue,such ingthepotentialofNER(namedentityrecognition)toperform astheCPU,networksensor,gyroscopesensor,altitudesensor, information extraction from drone flight log data. The result and GPS sensor. of the research is that BERT and DistilBERT have F1 scores of 98.63% and 95.9%, respectively. III. PROPOSEDMETHOD Furthermore, Silalahi et al. [6] developed the Transformer The general flow of the proposed method is depicted in using cosine similiarity to discover and extractsome incidentFig 1. It begins with preprocessing datasets. Furthermore, this relatedinformation.Cosinesimiliarityisusedtosubstitutedotpaper classify malfunction data using three methods, namely product in the self-attention mechanism']","highly relevant to various incident cases, as shown in Fig 3. Not only is it highly relevant, but it is also highly prioritised evidence in diverse investigation cases. 2) Flight log messages cover events from the drone’s sensors, features, and components, making it one piece of evidence to perform analysis related to different drone software and hardware components. Therefore, analysing the log messages means analysing the whole device for various possible incident scenarios. 3) Flight log messages contain contextual information about the occurring event as a description that involves multiple parts of the drone simultaneously. For example, a certain circumstance fails a feature or an operation, as shown in message group number 4 in Table 1. TABLE 1. Groups of",0.8333333333333334,0.8736616233301454,0.249999999975,1.0
"particular system log may need different techniques from one type to another. Generally, log-based anomaly detection can be performed using either point, collective, or contextual approaches. In the log-based anomaly detection literature, most of the existing studies propose either a contextual or collective approach, where the decision is taken by examining a sequence of log events. However, detecting abnormalities in log data can be performed using a point-based approach, where one single log record is the only feature needed. Therefore, several studies explored utilising a point-based approach to detect anomalous events on logs data, such as in operating systems , , drone devices , and distribution systems , . In the drone context, a log message contains a description of","Log-based anomaly detection can be performed using various approaches, including point-based methods that focus on individual log records, as noted by Silalahi et al. (2025), who discuss the effectiveness of these techniques in analyzing UAV flight log messages.","['in a multi-class classification setting, arenotmutuallyexclusive,itmeansthatinstancesbelonging a supervised model is prone to class imbalance problems, todifferentcategoriessharecommonfeatures[17].Asshown wheretheclasscompositioninthedatasetisdisproportionate. inTable1,eachloggroupsharesacommonwordorphrase, To deal with this situation, a study proposed an ensemble making the samples from different severity levels mutually VOLUME13,2025 105363 S.Silalahietal.:InterpretableOrdinal-AwareWithContrastive-EnhancedAnomalySeverityDetection approach is presented in Section III. The experimental settingsandprocedurearedescribedinSectionIV,whilethe results,findings,anddiscussionsareelaboratedinSectionV. Finally,weconcludethepaperinSectionVI. II. RELATEDWORKS A. LOG-BASEDANOMALYDETECTION Log-based anomaly detection is relatively well-studied, includingincorporatingML[1]anddeeplearning-based[18], [19] to facilitate log anomaly detection. Existing anomaly detection modelling techniques can be conducted either in a point, contextual, or collective setting. Point anomaly FIGURE4. Anillustrationofanomaliesthatoccurduringadrone’sflight. detectioncharacteriseseachlogentry,whetheraneventisan abnormalityoranormalevent.Forinstance,ifausertypesthe wrong password when trying to gain access to an operating inclusive. Therefore, this paper proposes a multitask-based systemprompt,thegeneratedlogmessagecanbeconsidered multiclass drone anomaly detection to assist in a forensic as an anomaly [7], [20], [21]. As for contextual anomaly, investigation. The main contributions of this paper are the detection involves analysing some contextually related summarizedasfollows: attributes to determine whether a log entry is'
 'which is often collected over investigation. This analysis can help investigators identify the extended periods. root cause of the incident, establish timelines, and identify Another advantage of Transformer model is their ability potential witnesses [2]. to generalize well to unseen data, thanks to their ability to For example, in the case of a drone crash, the analysis of capture complex relationships in the input data. This makes the drone logs could reveal critical information such as the them suitable for use in real-world applications where the altitude and speed of the drone, the battery level at the time datasetmaybelimited,andthemodelneedstomakeaccurate of the crash, and the location of the drone at the time of the predictions on unseen data [5]. incident. This information could help investigators determine ThispaperproposestheTransformermethodforclassifying whether the crash was due to a malfunction, operator error, drone malfunctions based on telemetry data. By leveraging or external factors such as weather'
 'orphrases. setting, analysing a large number of log entries resulting from binary anomaly detection is considered inefficient and labour-intensive as the detection is performed on the C. SCOPEANDCONTRIBUTIONS acquired evidence at one time [12]. Therefore, too many Performing multiclass classification typically encodes the detected anomalies need to be detailed into a more fine- labelrepresentationinaone-hotencodingvector,whereeach grained detection to help the investigator better prioritise vector element represents a certain class. One-hot encoding the analysis objective. As a result, this study extends the relies on the assumption that the input data are mutually binary anomaly detection to multi-class anomaly detection, exclusive, where the characteristics of the data between asexemplifiedbyanotherdomainapplicationsuchasplane classes are distinctive. However, this case does not always flightdata[13],imagedata[14],andinternetofvehicle[15]. holdincertaindomains.Whenthedatafromdifferentclasses As a consequence, in a multi-class classification setting, arenotmutuallyexclusive,itmeansthatinstancesbelonging a supervised model is prone to class imbalance problems, todifferentcategoriessharecommonfeatures[17].Asshown wheretheclasscompositioninthedatasetisdisproportionate. inTable1,eachloggroupsharesacommonwordorphrase, To deal with this situation, a study proposed an ensemble making the'
 '[20], [21]. As for contextual anomaly, investigation. The main contributions of this paper are the detection involves analysing some contextually related summarizedasfollows: attributes to determine whether a log entry is an anomaly. 1) We propose DroneLog, an interpretable sentimentAs an example, the flight path taken by a drone during a based multiclass drone flight log anomaly detection flightisrecordedinlongitudeandlatitudecoordinates.These frameworkthatincludesthreeanomalyseveritylevels: datacanbeusedtodetectananomalybyfindingapeculiar low,medium,andhigh.Providingtheseveritylevelcan valuewithinthelogrecordsbycontrastingthenormalvalues provide better detection results for the investigator to toabnormalvaluesusingacertainthreshold[11].Uniqueto pinpoint the event of interest. Interpretability makes theprevioustwoapproaches,collectiveanomalyestablishes the model training and testing more transparent, anomaly criteria basedon a set of instancesassociatedwith trustworthy,andhuman-friendly. eachother,distinctfromtheoveralldata.Statisticalanomaly 2) WeproposeDroneSBERT,1 adomain-specificembeddetectionisoneofthecommoncasesforthistypeofanomaly dingtoextractsemanticfeaturesthatarewell-aligned detection. to the human perception of the log message samples. Another case scenario in log-based anomaly detection Supervised contrastive learning is employed to learn is a sequence-based approach, where an abnormality is distinctrepresentationsforeachanomalyseveritylevel. determined by analysing a group of events that occur 3) Weexploretwotargetlabelrepresentationstoaugment sequentially within a certain window size [22].'
 'Moreover, the proposed enrich the log features representation [23]. The relationship targetlabelisdesignedtoincorporatetheordinalnature between the log events is crucial in log-based anomaly ofthelabel. detection. To capture this relation, a directed acyclic graph 4) Weundertakeexperimentationwithasignificantnumcan be used to represent a hierarchical relation between a ber of hyperparameters to find the best-performing pair of log IDs. Upon detecting an anomalous sequence of configuration. With a total of 1,584 model configevents, the exact location of the abnormality can be found urations and several arrangements of state-of-the-art by utilising the constructed relation graph [24]. Noisy data methods, we verify the superiority of our proposed and heterogeneous structures are common problems in logapproach. based anomaly detection. Performing log parsing is one of 5) Provide the experimental code publicly available on the options to reduce the noise. Another approach is to a GitHub repository2 to promote reproducible and employacontextualembedding,suchasBERT[25],thatcan verifiableresearch. capture the semantics of the log messages']","Existing anomaly detection modelling techniques can be conducted either in a point, contextual, or collective setting. Point anomaly detection characterises each log entry, whether an event is an abnormality or a normal event. For instance, if a user types the wrong password when trying to gain access to an operating system prompt, the generated log message can be considered as an anomaly , , . As for contextual anomaly, the detection involves analysing some contextually related attributes to determine whether a log entry is an anomaly. As an example, the flight path taken by a drone during a flight is recorded in longitude and latitude coordinates. These data can be used to detect an anomaly by finding a peculiar value",0.5,0.9012048023496948,0.9166666666361111,1.0
"several studies explored utilising a point-based approach to detect anomalous events on logs data, such as in operating systems , , drone devices , and distribution systems , . In the drone context, a log message contains a description of occurring events which are triggered by various components such as sensors, peripherals, and firmware. Analysing the log message means analysing events from all aspects of the drone, including sensors, components and features . Typically, existing log-based anomaly detection stud- ies classify log events into two categories: normal and anomaly . This is helpful in an online setting, where the number of detected abnormalities in a certain period of time is considerably small. However, in a digital forensic setting, where the","As noted in the study by Al-Dahqm et al. (2023), drone logs serve as essential sources of information in forensic investigations, aiding in the identification of the root cause of malfunctions.","['can improve the forensics tool, the investigator will be able to easily analyze the drone performance, and analyse the drone’s malfunction when it accident. flies.Thedetailofthemethodcanbedescribedinthefollowin subsections. B. Drone Forensics Drone forensics is a technique to get, collect, and analyze A. Data Preprocessing the data stored in drones to determine the cause of drone The dataset for the experiment and its preprocessing stage incidents. Research has been done to solve various problems to satisfy the needs in drone forensics can be explained as arising and improve the performance. Al-Dahqm et al. [9] follows. Once the drone log data downloaded from the Airlab proposedaforensicframeworkfordrone.Themethodsupports [13], we select features into those that only have a value of the majority of drone types on the market. The developed CPU, network sensor, gyroscope sensor, altitude sensor, and framework has three phases. In the preparatory phase, the GPS sensor. Firstly, we write a script that drops'
 'which is often collected over investigation. This analysis can help investigators identify the extended periods. root cause of the incident, establish timelines, and identify Another advantage of Transformer model is their ability potential witnesses [2]. to generalize well to unseen data, thanks to their ability to For example, in the case of a drone crash, the analysis of capture complex relationships in the input data. This makes the drone logs could reveal critical information such as the them suitable for use in real-world applications where the altitude and speed of the drone, the battery level at the time datasetmaybelimited,andthemodelneedstomakeaccurate of the crash, and the location of the drone at the time of the predictions on unseen data [5]. incident. This information could help investigators determine ThispaperproposestheTransformermethodforclassifying whether the crash was due to a malfunction, operator error, drone malfunctions based on telemetry data. By leveraging or external factors such as weather'
 'verification. An analysis of a Thestructureofthispaperisasfollows.SectionIIpresents drone’sarchitectureandaforensicmodelwithgenericfeatures previous research relating to the drone log analysis and drone are proposed here in order to enhance the digital investigation forensics. Section III explains the proposed method, applying process. Also, Barton et al. [11] conducted the research to the Transformer technique to forensics of drone malfunctions. reconstruct the actions taken by these drones, identify their InSectionIV,thediscussionofperformancemethod,followed owners or operators, and extract data from associated mobile by conclusions and future works in Section V. devices. In other research in drone forensics, this paper also analyze II. PREVIOUSWORK data flash and telemetry logs from assembled drones. Mantas and Patsakis [12] analyze dataflash and telemetry logs from A. Drone Log Analysis open source for assembled drones called ”Ardupilot”. The Researchers have conducted investigation on drone engine resultoftheresearchistofindthemethodologyforcollecting failure using drone logs. Although not specific to the use the necessary information, analyzing it, and constructing the of'
 'information could help investigators determine ThispaperproposestheTransformermethodforclassifying whether the crash was due to a malfunction, operator error, drone malfunctions based on telemetry data. By leveraging or external factors such as weather conditions or interference their ability to handle sequential data and capture complex from other sources. relationships, Transformer model can provide accurate and 73299101.3202.99285SESSCI/9011.01 :IOD | EEEI 3202© 00.13$/32/6-9274-3053-8-979 | )SESSCI( secneicS lacirtcelE ni snoitacilppa rof smetsyS tramS no ecnerefnoC lanoitanretnI 3202 Authorized licensed use limited to: Institut Teknologi Sepuluh Nopember. Downloaded on July 14,2025 at 08:24:14 UTC from IEEE Xplore. Restrictions apply. robust predictions, enabling drone operators to detect and Furthermore, Jain et al. [10] proposed a framework for diagnose malfunctions quickly and take corrective actions. sensor data identification and verification. An analysis of a Thestructureofthispaperisasfollows.SectionIIpresents drone’sarchitectureandaforensicmodelwithgenericfeatures previous research relating to the drone log analysis and drone are proposed here in order to enhance the digital investigation forensics. Section III'
 'found to aid the forensic investigator in selecting the best study-based paper is the most popular among the published suitable tools for a particular type of task. In the general papersondroneforensics.Thissectionbrieflydiscussesand digital forensics domain, log2timeline is commonly used to summarizes the published works related to drone forensics. construct a forensic timeline from log records. The result is The following sub-section explains the other researchers’ in.CSVformatconsistingoflogrecordswithcorresponding worksonemployingadeeplearningmodelfornamedentity timestamps.Timeline2GUIcanbeusedtoparseandanalyze recognition.Sinceourresearchisasub-fieldofcybersecurity, thelog2timelineoutputfile’scontents.Itoffersanautomatic wealsorecapseveralrelatedattemptsatutilizingNERinthe analysisthatistoocomplexifconductedmanually.Itisalso cybersecuritydomaininthelastsubsection. equipped with sophisticated visualization features to highlight critical information and assist the forensic investigator A. DRONEFORENSICINVESTIGATION inanalyzing,interpreting,anddrawingconclusions[29]. The field of drone forensics is a relatively recent research Understanding the drone device and its parts is a crutopic. The growth and development of Unmanned Aerial cial step before beginning a forensic investigation [30]. VOLUME11,2023 3259 S.Silalahietal.:Transformer-BasedNERonDroneFlightLogstoSupportForensicInvestigation Accordingly, Jain et al. [30] proposed a framework com- manyNLPtasks,includingNER.Sincethepublication,many prising 12 phases. The first five phases were used to locate variantsofpre-trainedTransformer-basedmodelshavebeen and']","highly relevant to various incident cases, as shown in Fig 3. Not only is it highly relevant, but it is also highly prioritised evidence in diverse investigation cases. 2) Flight log messages cover events from the drone’s sensors, features, and components, making it one piece of evidence to perform analysis related to different drone software and hardware components. Therefore, analysing the log messages means analysing the whole device for various possible incident scenarios. 3) Flight log messages contain contextual information about the occurring event as a description that involves multiple parts of the drone simultaneously. For example, a certain circumstance fails a feature or an operation, as shown in message group number 4 in Table 1. TABLE 1. Groups of",0.5,0.8286204973621352,0.0,0.42857142857142855
"classify log events into two categories: normal and anomaly . This is helpful in an online setting, where the number of detected abnormalities in a certain period of time is considerably small. However, in a digital forensic setting, where the detection is performed on all collected artefacts which might be large in size, the number of the abnormalities is likely to be large . Thus, analysing the detection result in a binary setting is impractical for the investigator. Moreover, out of all detected peculiarities, there might be several negligible ones with less severe impacts on the system or less likely to be related to an incident. Extending binary to multiclass anomaly detection can provide more detailed and contextual detection results","As noted in the literature, analysing a large number of log entries resulting from binary anomaly detection is considered inefficient and labor-intensive, highlighting the need for a multiclass approach to improve detection efficiency (Silahi et al., 2025).","['in a multi-class classification setting, arenotmutuallyexclusive,itmeansthatinstancesbelonging a supervised model is prone to class imbalance problems, todifferentcategoriessharecommonfeatures[17].Asshown wheretheclasscompositioninthedatasetisdisproportionate. inTable1,eachloggroupsharesacommonwordorphrase, To deal with this situation, a study proposed an ensemble making the samples from different severity levels mutually VOLUME13,2025 105363 S.Silalahietal.:InterpretableOrdinal-AwareWithContrastive-EnhancedAnomalySeverityDetection approach is presented in Section III. The experimental settingsandprocedurearedescribedinSectionIV,whilethe results,findings,anddiscussionsareelaboratedinSectionV. Finally,weconcludethepaperinSectionVI. II. RELATEDWORKS A. LOG-BASEDANOMALYDETECTION Log-based anomaly detection is relatively well-studied, includingincorporatingML[1]anddeeplearning-based[18], [19] to facilitate log anomaly detection. Existing anomaly detection modelling techniques can be conducted either in a point, contextual, or collective setting. Point anomaly FIGURE4. Anillustrationofanomaliesthatoccurduringadrone’sflight. detectioncharacteriseseachlogentry,whetheraneventisan abnormalityoranormalevent.Forinstance,ifausertypesthe wrong password when trying to gain access to an operating inclusive. Therefore, this paper proposes a multitask-based systemprompt,thegeneratedlogmessagecanbeconsidered multiclass drone anomaly detection to assist in a forensic as an anomaly [7], [20], [21]. As for contextual anomaly, investigation. The main contributions of this paper are the detection involves analysing some contextually related summarizedasfollows: attributes to determine whether a log entry is'
 'orphrases. setting, analysing a large number of log entries resulting from binary anomaly detection is considered inefficient and labour-intensive as the detection is performed on the C. SCOPEANDCONTRIBUTIONS acquired evidence at one time [12]. Therefore, too many Performing multiclass classification typically encodes the detected anomalies need to be detailed into a more fine- labelrepresentationinaone-hotencodingvector,whereeach grained detection to help the investigator better prioritise vector element represents a certain class. One-hot encoding the analysis objective. As a result, this study extends the relies on the assumption that the input data are mutually binary anomaly detection to multi-class anomaly detection, exclusive, where the characteristics of the data between asexemplifiedbyanotherdomainapplicationsuchasplane classes are distinctive. However, this case does not always flightdata[13],imagedata[14],andinternetofvehicle[15]. holdincertaindomains.Whenthedatafromdifferentclasses As a consequence, in a multi-class classification setting, arenotmutuallyexclusive,itmeansthatinstancesbelonging a supervised model is prone to class imbalance problems, todifferentcategoriessharecommonfeatures[17].Asshown wheretheclasscompositioninthedatasetisdisproportionate. inTable1,eachloggroupsharesacommonwordorphrase, To deal with this situation, a study proposed an ensemble making the'
 'index, especially at time increases. depth 7. We realize that at depth = 5, the Gini index can get relatively good classification results. However, it is achieved In the future, we will implement outlier detection before because the process is still infinite, which means that the the feature selection stage. It aims to speed up the running time tentative feature still has an opportunity to be rejected at the and simplify the calculations of feature selection. It is because the anomalous data should be eliminated. maximum iteration. Authorized licensed use limited to: Institut Teknologi Sepuluh Nopember. Downloaded on July 14,2025 at 08:22:54 UTC from IEEE Xplore. Restrictions apply. 2020 International Conference on Smart Technology and Applications (ICoSTA) REFERENCES [10] I. S. Thaseen and C. A. Kumar, “Intrusion detection model using fusion of chi-square feature selection and multi class SVM,” J. King Saud [1] M. Małowidzki, P. Berezinski, and M. Mazur,'
 'several baselines and state-of-the-art methods from previous studies. The integrated gradient is employed to investigate the best-performing model’s trustworthiness and interpretability. We found that the model perceived the log messages’ semantics differently and were not aligned with how a human expert would. Therefore,DroneSBERT,adomain-specificembeddingtrainedusingcontrastivelearning,isproposedasa follow-uptotheinterpretabilityfindings.Fromtheexperimentalresults,theproposedmethodachievesthe highestperformancewithanimprovementinaccuracyandF1scoresof5.128%and4.453%ontheuniquefiltereddataset,respectively.Therefore,theproposedmethodaccordinglyaddressesthetaskobjectivewith apromisingperformancewhilebeinginterpretableandtrustworthy. INDEX TERMS Anomaly detection, sentiment analysis, ordinal classification, integrated gradient, informationsecurity. I. INTRODUCTION banking, medical, and manufacturing. To prevent loss and A. BACKGROUNDANDMOTIVATION minimize risks due to anomalies and incidents, a numDetecting anomalous events in a running computer-based ber of approaches have been proposed in the literature. system remains a topic of interest for the cybersecurity A common approach is the log-based anomaly detecresearch and practitioner communities, such as those in tion approach, which involves the analysis of log entries recorded by systems either in sequence-based or pointThe associate editor coordinating the review of this manuscript and based modelling techniques, considering the case and'
 '[20], [21]. As for contextual anomaly, investigation. The main contributions of this paper are the detection involves analysing some contextually related summarizedasfollows: attributes to determine whether a log entry is an anomaly. 1) We propose DroneLog, an interpretable sentimentAs an example, the flight path taken by a drone during a based multiclass drone flight log anomaly detection flightisrecordedinlongitudeandlatitudecoordinates.These frameworkthatincludesthreeanomalyseveritylevels: datacanbeusedtodetectananomalybyfindingapeculiar low,medium,andhigh.Providingtheseveritylevelcan valuewithinthelogrecordsbycontrastingthenormalvalues provide better detection results for the investigator to toabnormalvaluesusingacertainthreshold[11].Uniqueto pinpoint the event of interest. Interpretability makes theprevioustwoapproaches,collectiveanomalyestablishes the model training and testing more transparent, anomaly criteria basedon a set of instancesassociatedwith trustworthy,andhuman-friendly. eachother,distinctfromtheoveralldata.Statisticalanomaly 2) WeproposeDroneSBERT,1 adomain-specificembeddetectionisoneofthecommoncasesforthistypeofanomaly dingtoextractsemanticfeaturesthatarewell-aligned detection. to the human perception of the log message samples. Another case scenario in log-based anomaly detection Supervised contrastive learning is employed to learn is a sequence-based approach, where an abnormality is distinctrepresentationsforeachanomalyseveritylevel. determined by analysing a group of events that occur 3) Weexploretwotargetlabelrepresentationstoaugment sequentially within a certain window size [22].']","LLMs to detect anomalous log entries in a point-based approach . However, existing studies only detect whether an event or subsequent event is an anomaly. In a forensic setting, analysing a large number of log entries resulting from binary anomaly detection is considered inefficient and labour-intensive as the detection is performed on the acquired evidence at one time . Therefore, too many detected anomalies need to be detailed into a more fine- grained detection to help the investigator better prioritise the analysis objective. As a result, this study extends the binary anomaly detection to multi-class anomaly detection, as exemplified by another domain application such as plane flight data , image data , and internet of vehicle . As a consequence,",1.0,0.9088017945272376,0.99999999995,0.6666666666666666
"comparison of the proposed framework, several baselines are constructed, including those that are proposed in published works. This paper proposes a transformer encoder-based log- based anomaly detection optimised using multitask label representation to help the model learn from the overlapped features shared by the samples from different severity levels. A domain-specific decoding procedure is also proposed to infer the prediction result. In-depth analyses are performed to evaluate the proposed framework thoroughly. The main contributions of this paper are summarised as follows: 1) Propose Drone Log Severity (DroLoVe), a severity- oriented multiclass anomaly detection approach on drone flight log data. 2) Propose a data-driven vector representation of the label and a severity-oriented decoding procedure of the VOLUME 12, 2024 64253 S.","The proposed framework for anomaly detection in drone flight logs is supported by the multitask learning approach outlined in Silalahi et al. (2025), which emphasizes the importance of severity levels in log messages.","['an extended work ofthefirstbaseline,pylogsentiment,whichemployed IV. EXPERIMENTS a two-layer Transformer encoder with two attention A. DATASET heads as the substitute for the GRU in the encoder The dataset used in this paper is the same as in [9]. The layer of pylogsentiment and incorporated integrated datasetcontainsacollectionofhuman-readablelogmessages gradientstoperformexplainabilityanalysis. combinedfromtwopublicdroneflightlogdatasets,i.e.,from 5) DroLoVe[9].ThestudyproposedamultitasklearningMendeley[51]andadronewiki[52].Therearetwodatasets: based anomaly severity detection on drone flight unfiltered and filtered. The unfiltered dataset is a collection logs with an assumption that, samples belonging to of log messages in its original condition gathered from the twosourceswithoutperforminguniquefiltering.Therefore, thereareseveralduplicatelogmessagesbothintrainingand TABLE4. Datasetcompositionbeforeandafteruniquefiltering. testingsets.Thisisalignedwiththerealcasescenario,where a drone tends to generate the same log message when the event is still happening. It indicates that the current event has yet to be changed or solved (if it is an issue). On the otherhand,thefiltereddatasetisacollectionoflogmessages afterauniquefilteringprocess.Thisisalignedwiththenorm insupervisedlearning,wherethetrainandtestsetmustnot sharecommonsamples.Thedatasetcompositionispresented inTable4.Afterreadingallthemessagescarefully,weinfer TABLE5. Anomalyseveritycharacteristics. the characteristics of each severity level, as summarised in Table5. B. BASELINES Most of the studies use a sequence-based approach'
 'This paper investigates utilising a multitask learning messages acquired from 82 drone models, mostly from paradigmtoperformmulticlassanomalydetectionondrone DJI. This is one of the main challenges in drone forensics flight log messages. Aligning to the nature of multitask research, where human-readable flight log datasets from learning,weproposetwotargetlabelrepresentations,namely other drone models are unavailable. In the future, we plan Multitask-101 and Multitask-111. The integrated gradient toexploretheflightlogsofotherdronemodelstotrainmore is employed to interpret the model’s behavior. During the generalanomalydetectionmodels.Asforthemethod,multiinterpretabilityanalysis,wefoundthattheembeddingvectors objective learning that employs multiple loss functions to fromBERTdonotalignwiththedomain,makinguspropose trainananomalydetectionmodelwillbeexplored. DroneSBERT embedding to refine the semantic features. Anextensivehyperparametertuningisperformedtofindthe bestconfigurationforeachencodertype.Afterexperimenting DATAAVAILABILITY with all the resulting model configurations, the proposed The dataset used in the experiment is available upon a label schemas achieved the highest accuracy and improved reasonablerequest.Thecodefortheexperiment,theresulting thebaselinesandstate-of-the-artmodels’performancetested performance evaluation, the scripts for data analysis, and on filtered and unfiltered datasets. As an alternative to the figures in this paper are made publicly available on handle class imbalance, Focal'
 'detection can be used and extended the High severity. As depicted in Fig 18, the highlighted to multiclass anomaly detection while exploiting the shared words align more with the attribution label, supported by high- and low-level features within the log messages that seven out of eight examples belonging to the High severity belong to different severity levels. Therefore, the forensic having positive attribution scores. The model perceives the investigator can better pinpoint and prioritise the anomalies log messages better than the previous BERT-based model. to focus on critical findings. The proposed embedding, Thecompletereportofattributionstowardeachseveritylabel DroneSBERT, improved the trustworthiness of the model, canbeaccessedontherepo. asevidencedbytheword’simportancereport. Despite the promising results, the model’s generality VI. CONCLUSION remains untested as the training dataset contains only log This paper investigates utilising a multitask learning messages acquired from 82 drone models, mostly from paradigmtoperformmulticlassanomalydetectionondrone DJI. This is one of the main challenges in drone forensics flight log messages.'
 'it necessary to investigate drone logs as part of forensic binaryclassification(e.g.,malfunctionvs.nomalfunction)ora investigations. multi-classclassification(e.g.,batterymalfunction,propulsion In a forensic investigation, drone logs are essential sources malfunction, etc.). of information that can help investigators reconstruct the OneadvantageofusingTransformermodelistheirabilityto events leading up to an incident. Drone logs typically include handlesequentialdata,suchastelemetrydata,effectively.Uninformation such as flight paths, altitude, speed, battery life, liketraditionalrecurrentneuralnetworks(RNNs),Transformer sensor data, and other telemetry information [1]. use self-attention mechanism to selectively focus on relevant Important analysis of drone logs involves the identification parts of the input sequence, enabling the model to learn of the most critical pieces of information in the log data long-term dependencies effectively [4]. This is particularly and the analysis of how they relate to the incident under useful for drone telemetry data, which is often collected over investigation. This analysis can help investigators identify the extended periods. root cause of the incident, establish timelines, and identify Another advantage of Transformer model is'
 'Received14May2025,accepted8June2025,dateofpublication17June2025,dateofcurrentversion24June2025. DigitalObjectIdentifier10.1109/ACCESS.2025.3580056 Interpretable Ordinal-Aware With Contrastive-Enhanced Anomaly Severity Detection on UAV Flight Log Messages SWARDIANTARASILALAHI 1,(GraduateStudentMember,IEEE), TOHARIAHMAD 1,(Member,IEEE),HUDANSTUDIAWAN 1,(Member,IEEE), EIRINIANTHI 2,ANDLOWRIWILLIAMS 2 1DepartmentofInformatics,InstitutTeknologiSepuluhNopember,Surabaya60111,Indonesia 2SchoolofComputerScienceandInformatics,CardiffUniversity,CF244AGCardiff,U.K. Correspondingauthor:HudanStudiawan(hudan@its.ac.id) ThisworkwassupportedinpartbytheDepartmentResearchFundoftheInstitutTeknologiSepuluhNopember(ITS);andinpartbythe PendidikanMagisterMenujuDoktorUntukSarjanaUnggul(PMDSU)ScholarshipfromtheMinistryofEducation,Culture,Researchand Technology,Indonesia. ABSTRACT Detectingabnormalitiesinasystemusinglogrecordsisacommonapproach,althoughsuch applications may vary between different deployment domains. For example, in drone forensics, existing studiesgenerallyconsideranomaliesascontradictorytonormalevents.Inotherwords,alltypesofanomalies are considered equally important. However, the peculiar events experienced by a drone during a flight might contain distinct features indicating the anomalies’ importance or level of urgency. For instance, the message ‘‘Critically low power. Aircraft is landing’’ is more important than ‘‘Forward Obstacle Sensing notWorking’’.ThisstudyproposesDroneLog,aninterpretableframeworkfordetectinganomaliesandthe severity levels on drone flight logs, using a multitask learning approach in a unified pipeline. Complying withthemultitasklearningnature,twotargetlabelrepresentationsaredesignedtoleveragethesharedlowlevelcommonfeaturesoftheinputmessagesovervariousseveritylevels.Anextensiveexperimentwitha significant hyperparameter search space is performed to find the best-performing model to compare with several baselines and state-of-the-art methods from previous studies. The integrated gradient is employed to investigate the best-performing model’s trustworthiness and interpretability. We found that the model perceived the log messages’']","depicted in Fig 18, the highlighted words align more with the attribution label, supported by seven out of eight examples belonging to the High severity having positive attribution scores. The model perceives the log messages better than the previous BERT-based model. The complete report of attributions toward each severity label can be accessed on the repo. VI. CONCLUSION VI. CONCLUSION This paper investigates utilising a multitask learning paradigm to perform multiclass anomaly detection on drone flight log messages. Aligning to the nature of multitask learning, we propose two target label representations, namely Multitask-101 and Multitask-111. The integrated gradient is employed to interpret the model’s behavior. During the interpretability analysis, we found that the embedding vectors from BERT do not align",1.0,0.8221001163216705,0.49999999995,1.0
"follows: 1) Propose Drone Log Severity (DroLoVe), a severity- oriented multiclass anomaly detection approach on drone flight log data. 2) Propose a data-driven vector representation of the label and a severity-oriented decoding procedure of the VOLUME 12, 2024 64253 S. Silalahi et al.: Severity-Oriented Multiclass Drone Flight Logs Anomaly Detection FIGURE 2. A word cloud visualisation to see that the samples from different severity levels share common words and phrases. The remainder of the paper is structured as follows: Section II discusses relevant previous studies related to log-based anomaly detection and how to deal with class imbalance problems in log-based anomaly detection task, the proposed framework is explained in detail in Section III, Section IV provides the experimental setup, followed","The proposed DroneLog framework offers a severity-oriented multiclass anomaly detection approach for drone flight logs, enhancing the interpretability and prioritization of anomalies (Silalahi et al., 2025).","['detection can be used and extended the High severity. As depicted in Fig 18, the highlighted to multiclass anomaly detection while exploiting the shared words align more with the attribution label, supported by high- and low-level features within the log messages that seven out of eight examples belonging to the High severity belong to different severity levels. Therefore, the forensic having positive attribution scores. The model perceives the investigator can better pinpoint and prioritise the anomalies log messages better than the previous BERT-based model. to focus on critical findings. The proposed embedding, Thecompletereportofattributionstowardeachseveritylabel DroneSBERT, improved the trustworthiness of the model, canbeaccessedontherepo. asevidencedbytheword’simportancereport. Despite the promising results, the model’s generality VI. CONCLUSION remains untested as the training dataset contains only log This paper investigates utilising a multitask learning messages acquired from 82 drone models, mostly from paradigmtoperformmulticlassanomalydetectionondrone DJI. This is one of the main challenges in drone forensics flight log messages.'
 'in a multi-class classification setting, arenotmutuallyexclusive,itmeansthatinstancesbelonging a supervised model is prone to class imbalance problems, todifferentcategoriessharecommonfeatures[17].Asshown wheretheclasscompositioninthedatasetisdisproportionate. inTable1,eachloggroupsharesacommonwordorphrase, To deal with this situation, a study proposed an ensemble making the samples from different severity levels mutually VOLUME13,2025 105363 S.Silalahietal.:InterpretableOrdinal-AwareWithContrastive-EnhancedAnomalySeverityDetection approach is presented in Section III. The experimental settingsandprocedurearedescribedinSectionIV,whilethe results,findings,anddiscussionsareelaboratedinSectionV. Finally,weconcludethepaperinSectionVI. II. RELATEDWORKS A. LOG-BASEDANOMALYDETECTION Log-based anomaly detection is relatively well-studied, includingincorporatingML[1]anddeeplearning-based[18], [19] to facilitate log anomaly detection. Existing anomaly detection modelling techniques can be conducted either in a point, contextual, or collective setting. Point anomaly FIGURE4. Anillustrationofanomaliesthatoccurduringadrone’sflight. detectioncharacteriseseachlogentry,whetheraneventisan abnormalityoranormalevent.Forinstance,ifausertypesthe wrong password when trying to gain access to an operating inclusive. Therefore, this paper proposes a multitask-based systemprompt,thegeneratedlogmessagecanbeconsidered multiclass drone anomaly detection to assist in a forensic as an anomaly [7], [20], [21]. As for contextual anomaly, investigation. The main contributions of this paper are the detection involves analysing some contextually related summarizedasfollows: attributes to determine whether a log entry is'
 'anomaly detection involving four classes: Normal,Low,Medium,andHigh.Thethreeanomalyclasses representingtheseverityoftheabnormalityaredistinguished byseveralcharacteristicsdescribedinSectionIV-A.AsillustratedbyFig.4,adroneexperiencesvariouseventsfromthe takeoff(e )tothelanding(e ).Eacheventisrepresentedby 1 6 a log message that contains a description of the occurring phenomenon.Amongtheeventsthathappenduringaflight, there might be low, medium, or high severity anomalies, as depicted in Fig. 4. For instance, the event e tells us 4 that the core board of the drone is overheated, which might lead to a malfunction or even loss of the device. Then, FIGURE3. Priorityofartefactstoinvestigatedifferenttypesof the pilot tries to cancel the auto landing triggered by the incidents[4]. drone, but it fails. From the illustration in Fig. 4, it can be seen that the log contains sentiment words or phrases that determine whether an event is an anomaly or not. B. PROBLEMSTATEMENT For instance, at the e , the drone exceeds the maximum In the event that there is only benign data (i.e., no sample 3 flight distance. Several sentiment-baring words or phrases of abnormal data),'
 'which is often collected over investigation. This analysis can help investigators identify the extended periods. root cause of the incident, establish timelines, and identify Another advantage of Transformer model is their ability potential witnesses [2]. to generalize well to unseen data, thanks to their ability to For example, in the case of a drone crash, the analysis of capture complex relationships in the input data. This makes the drone logs could reveal critical information such as the them suitable for use in real-world applications where the altitude and speed of the drone, the battery level at the time datasetmaybelimited,andthemodelneedstomakeaccurate of the crash, and the location of the drone at the time of the predictions on unseen data [5]. incident. This information could help investigators determine ThispaperproposestheTransformermethodforclassifying whether the crash was due to a malfunction, operator error, drone malfunctions based on telemetry data. By leveraging or external factors such as weather'
 'orphrases. setting, analysing a large number of log entries resulting from binary anomaly detection is considered inefficient and labour-intensive as the detection is performed on the C. SCOPEANDCONTRIBUTIONS acquired evidence at one time [12]. Therefore, too many Performing multiclass classification typically encodes the detected anomalies need to be detailed into a more fine- labelrepresentationinaone-hotencodingvector,whereeach grained detection to help the investigator better prioritise vector element represents a certain class. One-hot encoding the analysis objective. As a result, this study extends the relies on the assumption that the input data are mutually binary anomaly detection to multi-class anomaly detection, exclusive, where the characteristics of the data between asexemplifiedbyanotherdomainapplicationsuchasplane classes are distinctive. However, this case does not always flightdata[13],imagedata[14],andinternetofvehicle[15]. holdincertaindomains.Whenthedatafromdifferentclasses As a consequence, in a multi-class classification setting, arenotmutuallyexclusive,itmeansthatinstancesbelonging a supervised model is prone to class imbalance problems, todifferentcategoriessharecommonfeatures[17].Asshown wheretheclasscompositioninthedatasetisdisproportionate. inTable1,eachloggroupsharesacommonwordorphrase, To deal with this situation, a study proposed an ensemble making the']","be employed to force the model to learn a distinctive representation of the positive FIGURE 4. An illustration of anomalies that occur during a drone’s flight. inclusive. Therefore, this paper proposes a multitask-based multiclass drone anomaly detection to assist in a forensic investigation. The main contributions of this paper are summarized as follows: 1) We propose DroneLog, an interpretable sentiment- based multiclass drone flight log anomaly detection framework that includes three anomaly severity levels: low, medium, and high. Providing the severity level can provide better detection results for the investigator to pinpoint the event of interest. Interpretability makes training and testing more transparent, the model trustworthy, and human-friendly. 2) We propose DroneSBERT,1 a domain-specific embed- ding to extract semantic features",0.0,0.8351525049561324,0.0,0.3333333333333333
"anomaly detection approach is adopted in this paper. Table 1 presents the summary of the previous related works. B. CLASS IMBALANCE PROBLEM (CIP) IN LOG-BASED ANOMALY DETECTION It is assured that in log-based anomaly detection, the number of anomalous samples is significantly less than the normal ones. Employing a supervised-based technique is prone to bias, as the model tends to learn from the majority samples. To overcome CIP, several studies proposed data-level and algorithm-level solutions . Moreover, in a certain case, there are no anomalous samples available. In this particular situation, a one-class approach can be used to construct a normal baseline model. During the detection, an anomaly score is used to decide if an input event is anomalous based","As noted by Silahiet al. (2025), supervised models in anomaly detection can be biased due to class imbalance, where the number of anomalous samples is significantly less than that of normal samples.","['in a multi-class classification setting, arenotmutuallyexclusive,itmeansthatinstancesbelonging a supervised model is prone to class imbalance problems, todifferentcategoriessharecommonfeatures[17].Asshown wheretheclasscompositioninthedatasetisdisproportionate. inTable1,eachloggroupsharesacommonwordorphrase, To deal with this situation, a study proposed an ensemble making the samples from different severity levels mutually VOLUME13,2025 105363 S.Silalahietal.:InterpretableOrdinal-AwareWithContrastive-EnhancedAnomalySeverityDetection approach is presented in Section III. The experimental settingsandprocedurearedescribedinSectionIV,whilethe results,findings,anddiscussionsareelaboratedinSectionV. Finally,weconcludethepaperinSectionVI. II. RELATEDWORKS A. LOG-BASEDANOMALYDETECTION Log-based anomaly detection is relatively well-studied, includingincorporatingML[1]anddeeplearning-based[18], [19] to facilitate log anomaly detection. Existing anomaly detection modelling techniques can be conducted either in a point, contextual, or collective setting. Point anomaly FIGURE4. Anillustrationofanomaliesthatoccurduringadrone’sflight. detectioncharacteriseseachlogentry,whetheraneventisan abnormalityoranormalevent.Forinstance,ifausertypesthe wrong password when trying to gain access to an operating inclusive. Therefore, this paper proposes a multitask-based systemprompt,thegeneratedlogmessagecanbeconsidered multiclass drone anomaly detection to assist in a forensic as an anomaly [7], [20], [21]. As for contextual anomaly, investigation. The main contributions of this paper are the detection involves analysing some contextually related summarizedasfollows: attributes to determine whether a log entry is'
 'orphrases. setting, analysing a large number of log entries resulting from binary anomaly detection is considered inefficient and labour-intensive as the detection is performed on the C. SCOPEANDCONTRIBUTIONS acquired evidence at one time [12]. Therefore, too many Performing multiclass classification typically encodes the detected anomalies need to be detailed into a more fine- labelrepresentationinaone-hotencodingvector,whereeach grained detection to help the investigator better prioritise vector element represents a certain class. One-hot encoding the analysis objective. As a result, this study extends the relies on the assumption that the input data are mutually binary anomaly detection to multi-class anomaly detection, exclusive, where the characteristics of the data between asexemplifiedbyanotherdomainapplicationsuchasplane classes are distinctive. However, this case does not always flightdata[13],imagedata[14],andinternetofvehicle[15]. holdincertaindomains.Whenthedatafromdifferentclasses As a consequence, in a multi-class classification setting, arenotmutuallyexclusive,itmeansthatinstancesbelonging a supervised model is prone to class imbalance problems, todifferentcategoriessharecommonfeatures[17].Asshown wheretheclasscompositioninthedatasetisdisproportionate. inTable1,eachloggroupsharesacommonwordorphrase, To deal with this situation, a study proposed an ensemble making the'
 'employed to learn is a sequence-based approach, where an abnormality is distinctrepresentationsforeachanomalyseveritylevel. determined by analysing a group of events that occur 3) Weexploretwotargetlabelrepresentationstoaugment sequentially within a certain window size [22]. Before a multitask learning paradigm for training multiclass analysing the log sequence, log parsing is commonly used classificationmodels.Aligningtothedatasetcharactertoextractthelogtemplatetotakeoutcertainvariablevalues, istics where the log messages from different anomaly such as timestamp, internet protocol (IP) address, memory severity levels share common words and phrases, address, and error code written in hexadecimal. Instead multitask learning can help the model make use of of removing these values completely, they can be used as the shared low-level features in the log messages to an additional feature to the log message feature vector to perform anomaly detection. Moreover, the proposed enrich the log features representation [23]. The relationship targetlabelisdesignedtoincorporatetheordinalnature between the log events is crucial in log-based anomaly ofthelabel. detection. To capture this relation, a directed acyclic'
 'index, especially at time increases. depth 7. We realize that at depth = 5, the Gini index can get relatively good classification results. However, it is achieved In the future, we will implement outlier detection before because the process is still infinite, which means that the the feature selection stage. It aims to speed up the running time tentative feature still has an opportunity to be rejected at the and simplify the calculations of feature selection. It is because the anomalous data should be eliminated. maximum iteration. Authorized licensed use limited to: Institut Teknologi Sepuluh Nopember. Downloaded on July 14,2025 at 08:22:54 UTC from IEEE Xplore. Restrictions apply. 2020 International Conference on Smart Technology and Applications (ICoSTA) REFERENCES [10] I. S. Thaseen and C. A. Kumar, “Intrusion detection model using fusion of chi-square feature selection and multi class SVM,” J. King Saud [1] M. Małowidzki, P. Berezinski, and M. Mazur,'
 '[20], [21]. As for contextual anomaly, investigation. The main contributions of this paper are the detection involves analysing some contextually related summarizedasfollows: attributes to determine whether a log entry is an anomaly. 1) We propose DroneLog, an interpretable sentimentAs an example, the flight path taken by a drone during a based multiclass drone flight log anomaly detection flightisrecordedinlongitudeandlatitudecoordinates.These frameworkthatincludesthreeanomalyseveritylevels: datacanbeusedtodetectananomalybyfindingapeculiar low,medium,andhigh.Providingtheseveritylevelcan valuewithinthelogrecordsbycontrastingthenormalvalues provide better detection results for the investigator to toabnormalvaluesusingacertainthreshold[11].Uniqueto pinpoint the event of interest. Interpretability makes theprevioustwoapproaches,collectiveanomalyestablishes the model training and testing more transparent, anomaly criteria basedon a set of instancesassociatedwith trustworthy,andhuman-friendly. eachother,distinctfromtheoveralldata.Statisticalanomaly 2) WeproposeDroneSBERT,1 adomain-specificembeddetectionisoneofthecommoncasesforthistypeofanomaly dingtoextractsemanticfeaturesthatarewell-aligned detection. to the human perception of the log message samples. Another case scenario in log-based anomaly detection Supervised contrastive learning is employed to learn is a sequence-based approach, where an abnormality is distinctrepresentationsforeachanomalyseveritylevel. determined by analysing a group of events that occur 3) Weexploretwotargetlabelrepresentationstoaugment sequentially within a certain window size [22].']","sequence-based approach in the log-based anomaly detection research, as shown in Table 2. In contrast, this paper uses a point-based approach based on the characteristics of the problem and the dataset. Therefore, there are limited references that can be used as baselines for comparison, as described in the following: 1) Pylogsentiment . Using a point-based approach, a sentiment analysis model is trained using a one-layer VOLUME 13, 2025 105369 S. Silalahi et al.: Interpretable Ordinal-Aware With Contrastive-Enhanced Anomaly Severity Detection TABLE 6. Hyperparameter search space for all scenarios. neighbouring classes share common features. GRU, LSTM, and Transformer are explored to find the best- performing encoder. To provide a fair comparison, the GloVe embedding used in pylogsentiment, SentiLog, and TransSentLog are",0.0,0.8743405680369088,0.19999999998,0.14285714285714285
"detection approach for drone flight log data. The overall flow of the proposed framework is depicted in Fig 4. The following section describes the approach in more detail. A. OVERVIEW A. OVERVIEW Performing point log-based anomaly detection that takes human-readable log messages as input is similar to conduct- ing sequence or text classification. As mentioned in Section I, this task may be interpreted as a sentiment analysis task that aims to detect negative sentiments within log messages. Taking an n-length log message m = [w1, w2, . . . , wn] from the dataset D = {(mi, ci)}|D| i=1 as the input, where c is the label class name, BERT is used to tokenise the input into a fixed length","As noted in the study on UAV flight log messages, the detection of anomalies can be influenced by the sentiment expressed in log entries, where words like 'failed' may indicate different meanings depending on context (Swardiantara et al., 2025).","['e , the drone exceeds the maximum In the event that there is only benign data (i.e., no sample 3 flight distance. Several sentiment-baring words or phrases of abnormal data), anomaly detection can be conducted by from the illustration include ‘‘out of range’’, ‘‘overheated’’, training a recurrent neural network (RNN)–based model and ‘‘failed’’. However, these words might have positive usingthesequenceofnormalevents.Theanomalyisdetected meanings in certain contexts, such as the word ‘‘failed’’ in if a subsequent event exceeds a pre-defined threshold [11]. e thatundergoesadoublenegation.Therefore,considering 5 Another closely related study fine-tuned several pre-trained the context when performing sentiment analysis to detect LLMs to detect anomalous log entries in a point-based anomaliesindronelogmessagesiscrucial,especiallywhen approach[6].However,existingstudiesonlydetectwhether thelogmessagesfromdifferentclassessharecommonwords an event or subsequent event is an anomaly. In a forensic orphrases. setting, analysing a large number of log entries resulting from binary anomaly detection is considered inefficient and labour-intensive as the detection is performed on the C. SCOPEANDCONTRIBUTIONS acquired evidence'
 'investigation, such as sentiment In fact, a flight log not only contains sensor data and analysis-based anomaly detection using Large Language component status, as illustrated in Fig 2, but also human- Models (LLM) [6]. Sentiment analysis-based log anomaly readablemessagesdescribingtheoccurringeventsduringthe detection was firstly introduced in [7], which rely on an operation of a drone. This file stores all information during assumptionthat,logmessagesthatcontainwordsorphrases aflight,suchasflighttimestamps,flightparameters,sensor with negative connotations considered anomalies. Another data, components’ status, and flight mode. The last three recent study employs sentence embedding to extract the columns contain human-readable messages: APP.message, semantic features from log messages, and utilize various APP.tip, and APP.warning, which is the source of the machine learning (ML) models to classify anomaly severevidence used in this paper. Sample messages can be seen ity[8].Themostrecentstudyemploysamultitasklearningin Table 1. From the table, it can be seen that samples in based solution to solve a mutually inclusive dataset [9]. thesamegroupsharecommonwordsyetbelongtodifferent The study relies on'
 'using a dataset, [33] proposed HilBERT, a BERT-based model pre-trained III. PROPOSEDFRAMEWORK using a number of public log datasets. The same masked A. OVERVIEW languagemodelisusedasoneofthepre-trainedobjectives. Adopting the concept of sentiment analysis in the general Similar to the next sentence prediction, a log sequence domain into log anomaly detection was first introduced replacement prediction is used as the second pre-trained by [7]. Inspired by the study, anomalous events on drone objective[33].Anotheralternativetoleveragethepre-trained flight logs can be detected by analysing log messages and model is fine-tuning the models using prompts [34]. With identifying suspect key phrases closely related to drone onlyafewtrainingdata,themodelcancapturethesemantics incident scenarios. Therefore, the region of interest in this of the input logs and detect anomalous log sequences well. paperisanalysingsentimentcontainedwithinalogmessage Asfortheunavailabilityoflabelleddata,activelearningcan to detect anomalous events. More specifically, we can be employed to make use of unlabelled data for training a distinguish between normal and abnormal events and also supervisedmodel[35].Manyofthepublishedstudiesfocus detail the severity'
 'detection can be used and extended the High severity. As depicted in Fig 18, the highlighted to multiclass anomaly detection while exploiting the shared words align more with the attribution label, supported by high- and low-level features within the log messages that seven out of eight examples belonging to the High severity belong to different severity levels. Therefore, the forensic having positive attribution scores. The model perceives the investigator can better pinpoint and prioritise the anomalies log messages better than the previous BERT-based model. to focus on critical findings. The proposed embedding, Thecompletereportofattributionstowardeachseveritylabel DroneSBERT, improved the trustworthiness of the model, canbeaccessedontherepo. asevidencedbytheword’simportancereport. Despite the promising results, the model’s generality VI. CONCLUSION remains untested as the training dataset contains only log This paper investigates utilising a multitask learning messages acquired from 82 drone models, mostly from paradigmtoperformmulticlassanomalydetectionondrone DJI. This is one of the main challenges in drone forensics flight log messages.'
 '[20], [21]. As for contextual anomaly, investigation. The main contributions of this paper are the detection involves analysing some contextually related summarizedasfollows: attributes to determine whether a log entry is an anomaly. 1) We propose DroneLog, an interpretable sentimentAs an example, the flight path taken by a drone during a based multiclass drone flight log anomaly detection flightisrecordedinlongitudeandlatitudecoordinates.These frameworkthatincludesthreeanomalyseveritylevels: datacanbeusedtodetectananomalybyfindingapeculiar low,medium,andhigh.Providingtheseveritylevelcan valuewithinthelogrecordsbycontrastingthenormalvalues provide better detection results for the investigator to toabnormalvaluesusingacertainthreshold[11].Uniqueto pinpoint the event of interest. Interpretability makes theprevioustwoapproaches,collectiveanomalyestablishes the model training and testing more transparent, anomaly criteria basedon a set of instancesassociatedwith trustworthy,andhuman-friendly. eachother,distinctfromtheoveralldata.Statisticalanomaly 2) WeproposeDroneSBERT,1 adomain-specificembeddetectionisoneofthecommoncasesforthistypeofanomaly dingtoextractsemanticfeaturesthatarewell-aligned detection. to the human perception of the log message samples. Another case scenario in log-based anomaly detection Supervised contrastive learning is employed to learn is a sequence-based approach, where an abnormality is distinctrepresentationsforeachanomalyseveritylevel. determined by analysing a group of events that occur 3) Weexploretwotargetlabelrepresentationstoaugment sequentially within a certain window size [22].']","be employed to force the model to learn a distinctive representation of the positive FIGURE 4. An illustration of anomalies that occur during a drone’s flight. inclusive. Therefore, this paper proposes a multitask-based multiclass drone anomaly detection to assist in a forensic investigation. The main contributions of this paper are summarized as follows: 1) We propose DroneLog, an interpretable sentiment- based multiclass drone flight log anomaly detection framework that includes three anomaly severity levels: low, medium, and high. Providing the severity level can provide better detection results for the investigator to pinpoint the event of interest. Interpretability makes training and testing more transparent, the model trustworthy, and human-friendly. 2) We propose DroneSBERT,1 a domain-specific embed- ding to extract semantic features",0.6666666666666666,0.860126329334919,0.249999999975,0.8333333333333334
"log message m = [w1, w2, . . . , wn] from the dataset D = {(mi, ci)}|D| i=1 as the input, where c is the label class name, BERT is used to tokenise the input into a fixed length sequence with m maximum length and retrieve the contextual embeddings, resulting in an input matrix X ∈ Rm×dBERT which is then paired with the encoded label y. Thus, the numerical input becomes (X, y). This study aims to train a neural network model Mθ to classify the message m into one of the predefined classes c ∈ C = {high, medium, low, normal}, or can be written as Mθ : m → c. Based on past literature discussed in Section","As noted in the study by Silahi et al. (2025), BERT is employed to capture the semantics of log messages through contextual embeddings, which aligns with the method of tokenizing inputs into fixed-length sequences for classification tasks.","['code publicly available on the options to reduce the noise. Another approach is to a GitHub repository2 to promote reproducible and employacontextualembedding,suchasBERT[25],thatcan verifiableresearch. capture the semantics of the log messages [26]. However, The remaining part of this paper is structured as follows: the resulting representational vectors can be closer to one SectionIIdiscussesrecentrelatedapproaches.Theproposed another since log records commonly share the same words. 1https://huggingface.co/swardiantara/drone-severity-embedding Therefore, a contrastive loss can be employed to force the 2https://github.com/swardiantara/DroneLog.git model to learn a distinctive representation of the positive 105364 VOLUME13,2025 S.Silalahietal.:InterpretableOrdinal-AwareWithContrastive-EnhancedAnomalySeverityDetection and negative samples [27]. In this paper, instead of using on the model performance and pay less attention to the contrastive loss, we augment a multitask learning paradigm explainabilityaspect.Therefore,astudyby[36]proposedan by proposing two soft label representations to exploit the explainablesentimentanalysisapproachusingaTransformer sharedlow-levelfeaturesamongtheinputlogmessages. encoder for anomaly detection. A similar study exploits Performing anomaly detection using a sequence-based theabundanceofpre-trainedtransformermodelstoperform approach is commonly conducted by training RNN-based anomalydetectionbyusingsentimentanalysisondroneflight models using'
 'issue). On the otherhand,thefiltereddatasetisacollectionoflogmessages afterauniquefilteringprocess.Thisisalignedwiththenorm insupervisedlearning,wherethetrainandtestsetmustnot sharecommonsamples.Thedatasetcompositionispresented inTable4.Afterreadingallthemessagescarefully,weinfer TABLE5. Anomalyseveritycharacteristics. the characteristics of each severity level, as summarised in Table5. B. BASELINES Most of the studies use a sequence-based approach in the log-based anomaly detection research, as shown in Table 2. Incontrast,thispaperusesapoint-basedapproachbasedon thecharacteristicsoftheproblemandthedataset.Therefore, therearelimitedreferencesthatcanbeusedasbaselinesfor comparison,asdescribedinthefollowing: 1) Pylogsentiment [7]. Using a point-based approach, asentimentanalysismodelistrainedusingaone-layer VOLUME13,2025 105369 S.Silalahietal.:InterpretableOrdinal-AwareWithContrastive-EnhancedAnomalySeverityDetection TABLE6. Hyperparametersearchspaceforallscenarios. encoders. In contrast, no pooling is used for the GRU and LSTM,andthe[CLS]representationisincludedintheinput. Bidirectionalityalsoonlyappliestothesetwoencodertypes since it can improve RNN-based models [55]. Stacking the encoder in layers is one of the common hyperparameter tuning techniques when using RNN-based and Transformer models[56].Therefore,wevarythenumberoflayers’values with one, two, or three, as the BERT’s parameters are also updated during the training [25]. Choosing the number of attentionheadsintheTransformerencoderisdeterminedby neighbouring classes share common features. GRU, theaveragelengthofthesentenceinthedataset.Theaverage LSTM,andTransformerareexploredtofindthebest- length of the log message in the dataset is 8.7. Thus, the performingencoder. messagesareunlikelytocontaintoomanycontextsthatneed To provide a fair comparison, the GloVe embedding to be'
 'employed to learn is a sequence-based approach, where an abnormality is distinctrepresentationsforeachanomalyseveritylevel. determined by analysing a group of events that occur 3) Weexploretwotargetlabelrepresentationstoaugment sequentially within a certain window size [22]. Before a multitask learning paradigm for training multiclass analysing the log sequence, log parsing is commonly used classificationmodels.Aligningtothedatasetcharactertoextractthelogtemplatetotakeoutcertainvariablevalues, istics where the log messages from different anomaly such as timestamp, internet protocol (IP) address, memory severity levels share common words and phrases, address, and error code written in hexadecimal. Instead multitask learning can help the model make use of of removing these values completely, they can be used as the shared low-level features in the log messages to an additional feature to the log message feature vector to perform anomaly detection. Moreover, the proposed enrich the log features representation [23]. The relationship targetlabelisdesignedtoincorporatetheordinalnature between the log events is crucial in log-based anomaly ofthelabel. detection. To capture this relation, a directed acyclic'
 'multitask learning paradigm, the target yˆ = (13) label representation is no longer one-hot encoding. Instead, i 1+exp(−α i ) 105368 VOLUME13,2025 S.Silalahietal.:InterpretableOrdinal-AwareWithContrastive-EnhancedAnomalySeverityDetection FIGURE8. Comparisonbetweenthestandardone-hotencode(a),baselines(b)[9]and(c)[10],andtheproposedlabel representation(dande)totrainthemodelusingamultitasklearningparadigm. then,toconvertthelabelvectorbacktothelabelclassname, gatedrecurrentunit(GRU)modeltodetectanomalous examinetheelementsofyˆ sequentially,startingfromthelast eventsonOSlogdatasets. andmovingtowardsthefirst.Ifaparticularelementisa1,the 2) SentiLog[20].Atwo-layerBiLSTMmodelistrained labelisdeterminedtobeeitherhigh,medium,low,ornormal, using a parallel file system logs dataset to detect correspondingly.Itcanbeseenthatonlyoneelementofthe anomalouslogrecordsinapoint-basedsetting. label vector is used to infer the predicted label. Therefore, 3) NeuralLog [21]. The study proposed a log-based it is called a soft label representation since the predicted anomaly detection without parsing to preprocess the vectorlabeldoesnotnecessarilyneedtobepreciselythesame logs. BERT is used as the embedding and one-layer as the training label. This decoding procedure helps reduce Transformerencoderwith12attentionheadstrainedon the number of false positives as the higher severity class is severalpubliclogdatasetsinasequence-basedsetting. prioritised. 4) TransSentLog [36]. The study is an extended work ofthefirstbaseline,pylogsentiment,whichemployed IV. EXPERIMENTS a two-layer Transformer encoder with two attention A. DATASET heads as the substitute for the GRU in the encoder The dataset used in this'
 'only applies to the Transformer and Linear expected to associate the contextual dependency among encoders.Thisfinalhiddenstatevectoristhenmappedinto wordsandphraseswithintheinputmessagetotheanomaly four target classes using a linear layer, resulting in the final severity label. This step is needed to make sure that the unnormalizedlogitsvectorusingthefollowingequation: modelperceivesthemessagesemanticsascloselyaspossible, α =zW ⊤+b, ∈R|C| (3) to how a human expert does. During the testing phase, the best-performing model is used to perform detection on the whereW ∈ R|C|×768,andb ∈ R|C| arethetypicaltrainable testdata,whichisthenanalysedfurther. weight and bias parameters in a linear layer. Knowing that In this paper, M = (cid:2) m 1 ,m 2 ,...,m|M| (cid:3) is defined as the number of classes is more than two, the task belongs the collection of log messages in the dataset. Given a log to multiclass classification. Typically, the target label is recordm = [w 1 ,w 2 ,...,w n ]containingnnumberofwords represented in a one-hot encoded vector, as depicted in as input, with m ∈']","detection on the test data, which is then analysed further. In this paper, M = (cid:2)m1, m2, . . . , m|M| (cid:3) is defined as the collection of log messages in the dataset. Given a log record m = [w1, w2, . . . , wn] containing n number of words as input, with m ∈ M, BERTbase is used to tokenize and obtain the input vector representation. In the implementation, computation is undertaken using matrix multiplication. Thus, a term maximum sequence length, m, is introduced to pack the input messages that vary in length into a matrix with a consistent size throughout all the samples in the dataset. Therefore, for each single input message, the input matrix becomes",0.5,0.5079665468164224,0.0,0.6666666666666666
"logits z ∈ R|C|, where |C| denotes the number of target class in the dataset. During the training phase, these vectors are used to compute the loss and update the parameter of the model after passing through a normalisation function. For the typical one-hot encoding representation of the label, the standard cross-entropy is used to compute the loss, as defined in the following equation: |C| LCE = − yi · log(ˆyi) i=1 ˆy = softmax(z) exp(zi) ˆyi = Pdim(z) exp(zj) (1) (2) (3) where y and ˆy are the true label vector and the prediction probability distribution, respectively. The prediction proba- bility ˆy is obtained from Eq 2, where each of the element in ˆy is computed using Eq 3.","As noted by Silahi et al. (2025), the training objective is to minimize the cross-entropy loss, which is computed using the equation LCE(y, ˆy) = −Σ yi · log(ˆyi), where y and ˆy represent the true label vector and the predicted probability distribution, respectively.","['score of each token. This helps investigate cross-entropy loss can be computed using the following the significant words or phrases in the input samples when equation: makingpredictions. |C| LC¯E =− X λ ·y ·log(yˆ ) (7) i i i B. LEARNINGFROMIMBALANCEDDATASET i=1 The performance of a neural-based model highly depends on the training dataset quality. Specifically, in the context Therefore, we include three class weights as a search space ofmulticlassclassification,iftheclassdistributionishighly in the experiment, i.e., uniform, balanced, and inverse [50]. imbalanced,themodeltendstolearnfromthemajorityclass Uniform refers to equal weight, while balanced and inverse VOLUME13,2025 105367 S.Silalahietal.:InterpretableOrdinal-AwareWithContrastive-EnhancedAnomalySeverityDetection each element in the target label vector represents one target class.Forthisreason,twolabelrepresentationsareproposed in this study, as depicted in Fig. 8d and 8e. The first vector element in the proposed schema is intended to represent a normal-anomaly detection task, with 0 representing normal and one representing anomaly. At the same time, 1 in the secondtothefourthelementsrepresentstheanomalyseverity level. Note that the representation'
 '0 while maintaining the positive ones. The ReLU function, (9) defined by using (6), was used in this model. where y is the actual target probability (0 or 1), p is the ( f(x)= 0, if x < 0 (6) predictedprobability,andthesumiscalculatedforallclasses. x, if x ≥ 0 However, assuming there are n training examples, then the totalloss H iscomputedastheaverageoftheindividuallosses The ReLU function is denoted as f(x) = max(0,x), across all examples. where x is the input to the function. When the input value, x, is greater than or equal to zero, the function returns x. IV. EXPERIMENTS Ontheotherhand,assumingx isnegative,thefunctionreturns We used Python 3.8.1, 1.6 GHz Intel Core i5, 2133 MHz zero. The ReLU function essentially keeps positive values LPDDR3, 8 GB RAM, with a macOS Mojave version unchanged and sets negative ones to zero. 10.14.5 for validation. In the DCNN model, a pooling layer was incorporated to reduce the dimensions of'
 'in the second to the fourth elements. the model to learn from the hard-to-classify examples by In the Multitask-101 schema, we turn the respective bit on penalising the predicted probability with low confidence as the level goes higher without turning the lower-level bit scores[37].Focallosscanbecomputedusingthefollowing representation off. It aligns with the data characteristics, equation: where samples of higher severity levels share common features with samples of lower severity levels. This label |C| Lfocal =− X λ ·(1−yˆ ) γ ·log(yˆ ) (10) schema is designed to mimic joint prediction of two tasks, i i i i.e.,anomalydetectionandanomalyseverityprediction. i=1 Training a neural model using a multitask learning where λ is the class weight, and γ is a hyperparameter to paradigm aims to minimise the loss between the predicted reducetherelativelossofpredictionwithahighprobability probabilityofeachtargetvectorelementandthetruthlabel. score and does the opposite for prediction with a low Since each target vector represents a single task, it equals confidencescore. performing multiple'
 '1488.8 3 955 1171 1425 1640 1856 1409.4 4 1096 1406 1686 1858 2113 1631.8 5 1201 1553 1906 2256 2599 1903 8 1626 2209 2855 3123 3653 2693.2 6 1372 1941 2233 2548 3057 2230.2 TABLE V. CLASSIFICATION RESULTS IN EACH ACCEPTED FEATURES Entropy Gini Index Depth Accuracy Sensitivity Specificity Accuracy Sensitivity Specificity 3 0.998682278 0.998137797 0.999314045 0.998658464 0.99810826 0.99929689 4 0.998706092 0.998152616 0.999348339 0.998666337 0.998152476 0.999262572 5 0.998793258 0.998285484 0.999382522 0.998809288 0.9983002 0.999399863 6 0.998927976 0.998521585 0.999399554 0.998927976 0.998521585 0.999399554 7 0.998927976 0.998521585 0.999399554 0.998753491 0.998226492 0.999365243 8 0.998475888 0.99781321 0.999245242 0.998491764 0.997783852 0.999313776 9 0.998452074 0.997857248 0.999142441 0.998460012 0.997842569 0.999176708 10 0.99850764 0.997916332 0.999193904 0.998452074 0.997857248 0.999142441 lower depth (i.e., 3 and 4) does not solve the infinite problem. Considering the number of iterations, entropy can solve So, the best-estimated parameter for depth is 7. the problem of the infinite loop at depth = 7. At this'
 'multiclass classification. Typically, the target label is recordm = [w 1 ,w 2 ,...,w n ]containingnnumberofwords represented in a one-hot encoded vector, as depicted in as input, with m ∈ M, BERT base is used to tokenize and Fig. 8a. Therefore, the training objective is to minimise the obtaintheinputvectorrepresentation.Intheimplementation, cross-entropy loss, which is computed using the following computationisundertakenusingmatrixmultiplication.Thus, equation: a term maximum sequence length, m, is introduced to pack |C| the input messages that vary in length into a matrix with LCE(y,yˆ)=− X y ·log(yˆ ) (4) i i a consistent size throughout all the samples in the dataset. i=1 Therefore, for each single input message, the input matrix yˆ =softmax(α) (5) becomesX∈Rm×dBERT,withd BERT =768.Theobjectiveis totrainamodelMθ :m→ctopredicttheanomalyseverity whereyandyˆarethetruthandthepredictedlabelprobability level,c ∈ C,withC = {HIGH, MEDIUM, LOW, NORMAL}. distributionrespectively.ThenormalizedlogitsinEq.5isnot Fig.6illustratesthecomputationalstepswithintheproposed usedinthetrainingprocessbutintheinferenceprocess. modelwhenprocessinganinputsampleusingtheproposed During the training phase, the best-performing model is multitasklabel. investigatedregardingthemodel’sbehaviorinperceivingthe Theinputmatrixisfedtotheencoderlayertolearnthelow- input samples when predicting the label. The objective is']","final unnormalized logits vector using the following equation: α = zW⊤ + b, ∈ R|C| (3) where W ∈ R|C|×768, and b ∈ R|C| are the typical trainable weight and bias parameters in a linear layer. Knowing that the number of classes is more than two, the task belongs to multiclass classification. Typically, the target label is represented in a one-hot encoded vector, as depicted in Fig. 8a. Therefore, the training objective is to minimise the cross-entropy loss, which is computed using the following equation: LCE(y, ˆy) = − |C| yi · log(ˆyi) i=1 ˆy = softmax(α) (4) (5) where y and ˆy are the truth and the predicted label probability distribution respectively. The normalized logits in Eq. 5 is",1.0,0.7299341447353502,0.19999999998,0.6
"study, one of the artefacts of drone devices, the flight log message, is used as the source of the evidence to perform multiclass anomaly severity detection. These human-readable messages, such as ‘‘Aircraft Core Board Overheated’’ and ‘‘Compass error, calibration required’’, can be found in most DJI-make flight logs in three columns: warning, tip, and message. Originally, the flight log was in encrypted.CSV files . Thus, the drone phantom help2 is needed to decrypt the flight log files and then extract the contents. The 2 FIGURE 6. Proposed vector representation of the label based on the dataset characteristics. is computed based on the frequency distribution of the class in the dataset. In this study, three class weights are explored and used","As noted by Silalahi et al. (2025), the proposed DroneLog framework utilizes a multitask learning approach to detect anomalies and their severity levels in drone flight logs, which aligns with the use of flight log messages as evidence for multiclass anomaly severity detection.","['Received14May2025,accepted8June2025,dateofpublication17June2025,dateofcurrentversion24June2025. DigitalObjectIdentifier10.1109/ACCESS.2025.3580056 Interpretable Ordinal-Aware With Contrastive-Enhanced Anomaly Severity Detection on UAV Flight Log Messages SWARDIANTARASILALAHI 1,(GraduateStudentMember,IEEE), TOHARIAHMAD 1,(Member,IEEE),HUDANSTUDIAWAN 1,(Member,IEEE), EIRINIANTHI 2,ANDLOWRIWILLIAMS 2 1DepartmentofInformatics,InstitutTeknologiSepuluhNopember,Surabaya60111,Indonesia 2SchoolofComputerScienceandInformatics,CardiffUniversity,CF244AGCardiff,U.K. Correspondingauthor:HudanStudiawan(hudan@its.ac.id) ThisworkwassupportedinpartbytheDepartmentResearchFundoftheInstitutTeknologiSepuluhNopember(ITS);andinpartbythe PendidikanMagisterMenujuDoktorUntukSarjanaUnggul(PMDSU)ScholarshipfromtheMinistryofEducation,Culture,Researchand Technology,Indonesia. ABSTRACT Detectingabnormalitiesinasystemusinglogrecordsisacommonapproach,althoughsuch applications may vary between different deployment domains. For example, in drone forensics, existing studiesgenerallyconsideranomaliesascontradictorytonormalevents.Inotherwords,alltypesofanomalies are considered equally important. However, the peculiar events experienced by a drone during a flight might contain distinct features indicating the anomalies’ importance or level of urgency. For instance, the message ‘‘Critically low power. Aircraft is landing’’ is more important than ‘‘Forward Obstacle Sensing notWorking’’.ThisstudyproposesDroneLog,aninterpretableframeworkfordetectinganomaliesandthe severity levels on drone flight logs, using a multitask learning approach in a unified pipeline. Complying withthemultitasklearningnature,twotargetlabelrepresentationsaredesignedtoleveragethesharedlowlevelcommonfeaturesoftheinputmessagesovervariousseveritylevels.Anextensiveexperimentwitha significant hyperparameter search space is performed to find the best-performing model to compare with several baselines and state-of-the-art methods from previous studies. The integrated gradient is employed to investigate the best-performing model’s trustworthiness and interpretability. We found that the model perceived the log messages’'
 'which is often collected over investigation. This analysis can help investigators identify the extended periods. root cause of the incident, establish timelines, and identify Another advantage of Transformer model is their ability potential witnesses [2]. to generalize well to unseen data, thanks to their ability to For example, in the case of a drone crash, the analysis of capture complex relationships in the input data. This makes the drone logs could reveal critical information such as the them suitable for use in real-world applications where the altitude and speed of the drone, the battery level at the time datasetmaybelimited,andthemodelneedstomakeaccurate of the crash, and the location of the drone at the time of the predictions on unseen data [5]. incident. This information could help investigators determine ThispaperproposestheTransformermethodforclassifying whether the crash was due to a malfunction, operator error, drone malfunctions based on telemetry data. By leveraging or external factors such as weather'
 'information could help investigators determine ThispaperproposestheTransformermethodforclassifying whether the crash was due to a malfunction, operator error, drone malfunctions based on telemetry data. By leveraging or external factors such as weather conditions or interference their ability to handle sequential data and capture complex from other sources. relationships, Transformer model can provide accurate and 73299101.3202.99285SESSCI/9011.01 :IOD | EEEI 3202© 00.13$/32/6-9274-3053-8-979 | )SESSCI( secneicS lacirtcelE ni snoitacilppa rof smetsyS tramS no ecnerefnoC lanoitanretnI 3202 Authorized licensed use limited to: Institut Teknologi Sepuluh Nopember. Downloaded on July 14,2025 at 08:24:14 UTC from IEEE Xplore. Restrictions apply. robust predictions, enabling drone operators to detect and Furthermore, Jain et al. [10] proposed a framework for diagnose malfunctions quickly and take corrective actions. sensor data identification and verification. An analysis of a Thestructureofthispaperisasfollows.SectionIIpresents drone’sarchitectureandaforensicmodelwithgenericfeatures previous research relating to the drone log analysis and drone are proposed here in order to enhance the digital investigation forensics. Section III'
 'detection can be used and extended the High severity. As depicted in Fig 18, the highlighted to multiclass anomaly detection while exploiting the shared words align more with the attribution label, supported by high- and low-level features within the log messages that seven out of eight examples belonging to the High severity belong to different severity levels. Therefore, the forensic having positive attribution scores. The model perceives the investigator can better pinpoint and prioritise the anomalies log messages better than the previous BERT-based model. to focus on critical findings. The proposed embedding, Thecompletereportofattributionstowardeachseveritylabel DroneSBERT, improved the trustworthiness of the model, canbeaccessedontherepo. asevidencedbytheword’simportancereport. Despite the promising results, the model’s generality VI. CONCLUSION remains untested as the training dataset contains only log This paper investigates utilising a multitask learning messages acquired from 82 drone models, mostly from paradigmtoperformmulticlassanomalydetectionondrone DJI. This is one of the main challenges in drone forensics flight log messages.'
 'anomaly detection involving four classes: Normal,Low,Medium,andHigh.Thethreeanomalyclasses representingtheseverityoftheabnormalityaredistinguished byseveralcharacteristicsdescribedinSectionIV-A.AsillustratedbyFig.4,adroneexperiencesvariouseventsfromthe takeoff(e )tothelanding(e ).Eacheventisrepresentedby 1 6 a log message that contains a description of the occurring phenomenon.Amongtheeventsthathappenduringaflight, there might be low, medium, or high severity anomalies, as depicted in Fig. 4. For instance, the event e tells us 4 that the core board of the drone is overheated, which might lead to a malfunction or even loss of the device. Then, FIGURE3. Priorityofartefactstoinvestigatedifferenttypesof the pilot tries to cancel the auto landing triggered by the incidents[4]. drone, but it fails. From the illustration in Fig. 4, it can be seen that the log contains sentiment words or phrases that determine whether an event is an anomaly or not. B. PROBLEMSTATEMENT For instance, at the e , the drone exceeds the maximum In the event that there is only benign data (i.e., no sample 3 flight distance. Several sentiment-baring words or phrases of abnormal data),']","the data is the DJI. After collecting the ﬂight log ﬁles, we use DJI Phantom Help tools to decrypt the ﬁles and get the plain data, which then is parsed to get the log message data. The number of messages from every drone image is shown in Table 1. The next step is identifying the entity type mentioned in the drone log messages. Before reading the log messages, we ﬁltered the duplicate message and got the unique message to read. After carefully reading the unique log message and comprehensively studying what every log message indicates, we categorized the entity types mentioned in the ﬂight log message into six groups, i.e., Component, Action, Parameter, Function, State, and Issue. These entity types",1.0,0.856370150555966,0.9999999999,0.3333333333333333
"the unfiltered is the actual collection of drone flight log messages gathered from the two sources mentioned previously. The dataset is split into training and testing with an 80:20 ratio. The summary of the per-class distribution in the dataset is presented in Table 2. B. BASELINES B. BASELINES In this study, an extensive experiment with various types of encoders is conducted to construct strong baselines for performance comparison. Ensuring the objectivity of the comparison, the hyperparameters of these baselines are fine-tuned using grid search on a finite search space, as shown in Table 3. The details of the baseline construction are described in the following subsections. 1) BASELINE FROM DIVERSE SUITABLE ENCODERS The distinction between the baseline and the proposed","The dataset used in this study includes an unfiltered collection of drone flight log messages, which aligns with the findings of the research conducted by Antara et al. (2025), where the unfiltered dataset is described as containing original log messages gathered from multiple sources without unique filtering.","['This paper investigates utilising a multitask learning messages acquired from 82 drone models, mostly from paradigmtoperformmulticlassanomalydetectionondrone DJI. This is one of the main challenges in drone forensics flight log messages. Aligning to the nature of multitask research, where human-readable flight log datasets from learning,weproposetwotargetlabelrepresentations,namely other drone models are unavailable. In the future, we plan Multitask-101 and Multitask-111. The integrated gradient toexploretheflightlogsofotherdronemodelstotrainmore is employed to interpret the model’s behavior. During the generalanomalydetectionmodels.Asforthemethod,multiinterpretabilityanalysis,wefoundthattheembeddingvectors objective learning that employs multiple loss functions to fromBERTdonotalignwiththedomain,makinguspropose trainananomalydetectionmodelwillbeexplored. DroneSBERT embedding to refine the semantic features. Anextensivehyperparametertuningisperformedtofindthe bestconfigurationforeachencodertype.Afterexperimenting DATAAVAILABILITY with all the resulting model configurations, the proposed The dataset used in the experiment is available upon a label schemas achieved the highest accuracy and improved reasonablerequest.Thecodefortheexperiment,theresulting thebaselinesandstate-of-the-artmodels’performancetested performance evaluation, the scripts for data analysis, and on filtered and unfiltered datasets. As an alternative to the figures in this paper are made publicly available on handle class imbalance, Focal'
 'an extended work ofthefirstbaseline,pylogsentiment,whichemployed IV. EXPERIMENTS a two-layer Transformer encoder with two attention A. DATASET heads as the substitute for the GRU in the encoder The dataset used in this paper is the same as in [9]. The layer of pylogsentiment and incorporated integrated datasetcontainsacollectionofhuman-readablelogmessages gradientstoperformexplainabilityanalysis. combinedfromtwopublicdroneflightlogdatasets,i.e.,from 5) DroLoVe[9].ThestudyproposedamultitasklearningMendeley[51]andadronewiki[52].Therearetwodatasets: based anomaly severity detection on drone flight unfiltered and filtered. The unfiltered dataset is a collection logs with an assumption that, samples belonging to of log messages in its original condition gathered from the twosourceswithoutperforminguniquefiltering.Therefore, thereareseveralduplicatelogmessagesbothintrainingand TABLE4. Datasetcompositionbeforeandafteruniquefiltering. testingsets.Thisisalignedwiththerealcasescenario,where a drone tends to generate the same log message when the event is still happening. It indicates that the current event has yet to be changed or solved (if it is an issue). On the otherhand,thefiltereddatasetisacollectionoflogmessages afterauniquefilteringprocess.Thisisalignedwiththenorm insupervisedlearning,wherethetrainandtestsetmustnot sharecommonsamples.Thedatasetcompositionispresented inTable4.Afterreadingallthemessagescarefully,weinfer TABLE5. Anomalyseveritycharacteristics. the characteristics of each severity level, as summarised in Table5. B. BASELINES Most of the studies use a sequence-based approach'
 'the number of Double Trucks 209 iterations or epochs. The optimal weight is then determined Non-Motorized Vehicles 4,496 for each model for additional FPS testing on the test video, as well as an evaluation of the average precision. Total Objects 70,370 For our model testing phase, we used CCTV video that was not part of the dataset used in the training phase. This After dataset successfully collected, we convert our technique is based on determining how robust the model dataset into COCO format and separate it into training data would be in highly varied data. and validation data. As for the results of separating the dataset according to the percentage of division mentioned before, training data consist of 38,427 annotated images while validation data consist of 9,608 annotated images. This division is based on class distribution so that it is evenly distributed or commonly called stratified sampling. Next, the training'
 'Received14May2025,accepted8June2025,dateofpublication17June2025,dateofcurrentversion24June2025. DigitalObjectIdentifier10.1109/ACCESS.2025.3580056 Interpretable Ordinal-Aware With Contrastive-Enhanced Anomaly Severity Detection on UAV Flight Log Messages SWARDIANTARASILALAHI 1,(GraduateStudentMember,IEEE), TOHARIAHMAD 1,(Member,IEEE),HUDANSTUDIAWAN 1,(Member,IEEE), EIRINIANTHI 2,ANDLOWRIWILLIAMS 2 1DepartmentofInformatics,InstitutTeknologiSepuluhNopember,Surabaya60111,Indonesia 2SchoolofComputerScienceandInformatics,CardiffUniversity,CF244AGCardiff,U.K. Correspondingauthor:HudanStudiawan(hudan@its.ac.id) ThisworkwassupportedinpartbytheDepartmentResearchFundoftheInstitutTeknologiSepuluhNopember(ITS);andinpartbythe PendidikanMagisterMenujuDoktorUntukSarjanaUnggul(PMDSU)ScholarshipfromtheMinistryofEducation,Culture,Researchand Technology,Indonesia. ABSTRACT Detectingabnormalitiesinasystemusinglogrecordsisacommonapproach,althoughsuch applications may vary between different deployment domains. For example, in drone forensics, existing studiesgenerallyconsideranomaliesascontradictorytonormalevents.Inotherwords,alltypesofanomalies are considered equally important. However, the peculiar events experienced by a drone during a flight might contain distinct features indicating the anomalies’ importance or level of urgency. For instance, the message ‘‘Critically low power. Aircraft is landing’’ is more important than ‘‘Forward Obstacle Sensing notWorking’’.ThisstudyproposesDroneLog,aninterpretableframeworkfordetectinganomaliesandthe severity levels on drone flight logs, using a multitask learning approach in a unified pipeline. Complying withthemultitasklearningnature,twotargetlabelrepresentationsaredesignedtoleveragethesharedlowlevelcommonfeaturesoftheinputmessagesovervariousseveritylevels.Anextensiveexperimentwitha significant hyperparameter search space is performed to find the best-performing model to compare with several baselines and state-of-the-art methods from previous studies. The integrated gradient is employed to investigate the best-performing model’s trustworthiness and interpretability. We found that the model perceived the log messages’'
 'it necessary to investigate drone logs as part of forensic binaryclassification(e.g.,malfunctionvs.nomalfunction)ora investigations. multi-classclassification(e.g.,batterymalfunction,propulsion In a forensic investigation, drone logs are essential sources malfunction, etc.). of information that can help investigators reconstruct the OneadvantageofusingTransformermodelistheirabilityto events leading up to an incident. Drone logs typically include handlesequentialdata,suchastelemetrydata,effectively.Uninformation such as flight paths, altitude, speed, battery life, liketraditionalrecurrentneuralnetworks(RNNs),Transformer sensor data, and other telemetry information [1]. use self-attention mechanism to selectively focus on relevant Important analysis of drone logs involves the identification parts of the input sequence, enabling the model to learn of the most critical pieces of information in the log data long-term dependencies effectively [4]. This is particularly and the analysis of how they relate to the incident under useful for drone telemetry data, which is often collected over investigation. This analysis can help investigators identify the extended periods. root cause of the incident, establish timelines, and identify Another advantage of Transformer model is']",". There are two datasets: unfiltered and filtered. The unfiltered dataset is a collection of log messages in its original condition gathered from the two sources without performing unique filtering. Therefore, there are several duplicate log messages both in training and testing sets. This is aligned with the real case scenario, where a drone tends to generate the same log message when the event is still happening. It indicates that the current event has yet to be changed or solved (if it is an issue). On the other hand, the filtered dataset is a collection of log messages after a unique filtering process. This is aligned with the norm in supervised learning, where the train and test set must not",0.6,0.7261784795363486,0.49999999995,1.0
"PREVIOUS WORKS Among the relevant published studies in the log-based anomaly detection space, sequence-based is one of the most commonly used approaches. Therefore, there are limited relevant references as this study employs a point-based approach. Below are the relevant baselines from previous research: 1) Pylogsentiment is the first study which employs sentiment analysis-based anomaly detection on operat- ing system logs using GRU and GloVe embedding. 2) SentiLog , similar to , use a two-layered BiLSTM and GloVe embedding model to perform anomaly detection on parallel file system logs. 3) TransSentLog is a further development of and uses a two-layered transformer encoder which used two attention heads and GloVe embedding along with integrated gradients to add explainability to the trained model.","As noted in recent research, while most studies in log-based anomaly detection utilize a sequence-based approach, the proposed method employs a point-based approach tailored to the specific characteristics of the dataset (Silahi et al., 2025).","['issue). On the otherhand,thefiltereddatasetisacollectionoflogmessages afterauniquefilteringprocess.Thisisalignedwiththenorm insupervisedlearning,wherethetrainandtestsetmustnot sharecommonsamples.Thedatasetcompositionispresented inTable4.Afterreadingallthemessagescarefully,weinfer TABLE5. Anomalyseveritycharacteristics. the characteristics of each severity level, as summarised in Table5. B. BASELINES Most of the studies use a sequence-based approach in the log-based anomaly detection research, as shown in Table 2. Incontrast,thispaperusesapoint-basedapproachbasedon thecharacteristicsoftheproblemandthedataset.Therefore, therearelimitedreferencesthatcanbeusedasbaselinesfor comparison,asdescribedinthefollowing: 1) Pylogsentiment [7]. Using a point-based approach, asentimentanalysismodelistrainedusingaone-layer VOLUME13,2025 105369 S.Silalahietal.:InterpretableOrdinal-AwareWithContrastive-EnhancedAnomalySeverityDetection TABLE6. Hyperparametersearchspaceforallscenarios. encoders. In contrast, no pooling is used for the GRU and LSTM,andthe[CLS]representationisincludedintheinput. Bidirectionalityalsoonlyappliestothesetwoencodertypes since it can improve RNN-based models [55]. Stacking the encoder in layers is one of the common hyperparameter tuning techniques when using RNN-based and Transformer models[56].Therefore,wevarythenumberoflayers’values with one, two, or three, as the BERT’s parameters are also updated during the training [25]. Choosing the number of attentionheadsintheTransformerencoderisdeterminedby neighbouring classes share common features. GRU, theaveragelengthofthesentenceinthedataset.Theaverage LSTM,andTransformerareexploredtofindthebest- length of the log message in the dataset is 8.7. Thus, the performingencoder. messagesareunlikelytocontaintoomanycontextsthatneed To provide a fair comparison, the GloVe embedding to be'
 'code publicly available on the options to reduce the noise. Another approach is to a GitHub repository2 to promote reproducible and employacontextualembedding,suchasBERT[25],thatcan verifiableresearch. capture the semantics of the log messages [26]. However, The remaining part of this paper is structured as follows: the resulting representational vectors can be closer to one SectionIIdiscussesrecentrelatedapproaches.Theproposed another since log records commonly share the same words. 1https://huggingface.co/swardiantara/drone-severity-embedding Therefore, a contrastive loss can be employed to force the 2https://github.com/swardiantara/DroneLog.git model to learn a distinctive representation of the positive 105364 VOLUME13,2025 S.Silalahietal.:InterpretableOrdinal-AwareWithContrastive-EnhancedAnomalySeverityDetection and negative samples [27]. In this paper, instead of using on the model performance and pay less attention to the contrastive loss, we augment a multitask learning paradigm explainabilityaspect.Therefore,astudyby[36]proposedan by proposing two soft label representations to exploit the explainablesentimentanalysisapproachusingaTransformer sharedlow-levelfeaturesamongtheinputlogmessages. encoder for anomaly detection. A similar study exploits Performing anomaly detection using a sequence-based theabundanceofpre-trainedtransformermodelstoperform approach is commonly conducted by training RNN-based anomalydetectionbyusingsentimentanalysisondroneflight models using'
 'Moreover, the proposed enrich the log features representation [23]. The relationship targetlabelisdesignedtoincorporatetheordinalnature between the log events is crucial in log-based anomaly ofthelabel. detection. To capture this relation, a directed acyclic graph 4) Weundertakeexperimentationwithasignificantnumcan be used to represent a hierarchical relation between a ber of hyperparameters to find the best-performing pair of log IDs. Upon detecting an anomalous sequence of configuration. With a total of 1,584 model configevents, the exact location of the abnormality can be found urations and several arrangements of state-of-the-art by utilising the constructed relation graph [24]. Noisy data methods, we verify the superiority of our proposed and heterogeneous structures are common problems in logapproach. based anomaly detection. Performing log parsing is one of 5) Provide the experimental code publicly available on the options to reduce the noise. Another approach is to a GitHub repository2 to promote reproducible and employacontextualembedding,suchasBERT[25],thatcan verifiableresearch. capture the semantics of the log messages'
 'convolutional layer is used to capture the local depenFinally,theposition-wisefeedforwardnetworkisastraightdencies in the input time series. The equation for computing forward two-layer neural network that independently applies the output of the convolutional layer as shown in (6): a fully connected layer and a ReLU activation function to each position in the sequence. The equation for computing y =ReLU(W ∗f (x )) (6) i f c i,k:i Authorized licensed use limited to: Institut Teknologi Sepuluh Nopember. Downloaded on July 14,2025 at 08:24:14 UTC from IEEE Xplore. Restrictions apply. where x is a sub-sequence of the input time series tohelpinidentifyingfailuresanddetectinganomalies.Itoffers i−k:i centered at time i, W is the convolutional filter, f is the four different types of data: processed data, RAW bag files, f c convolution function, and ReLU is the rectified linear unit telemetry logs, and dataflash logs. activation function. The datasets we used in the experiment have 11 columns: The last is'
 'to exploit the explainablesentimentanalysisapproachusingaTransformer sharedlow-levelfeaturesamongtheinputlogmessages. encoder for anomaly detection. A similar study exploits Performing anomaly detection using a sequence-based theabundanceofpre-trainedtransformermodelstoperform approach is commonly conducted by training RNN-based anomalydetectionbyusingsentimentanalysisondroneflight models using a dataset containing a collection of a series log messages [6], which then expanded to multiclass in [9]. of events. This approach is prone to several problems in a However,theproposedsolutionignoredtheordinalnatureof distributedsystemsetting,suchasdynamiclogsequencepat- thetargetlabelandisnotinterpretable.Therefore,thispaper terns, noisy data, and multiple anomalies concurrency [28]. isproposedtofilltheresearchgap,ashighlightedinTable2. Moreover, sequence-based modelling only considers the sequential relationship between the logs and ignores the B. MULTITASKLEARNING pairwise relationship that might exist. However, the first Traininganeuralmodeltoperformaparticulartaskinvolves event can be strongly related to the last event in a log oneormoreobjectivefunctionstooptimise.Multi-objective sequence. For instance, a network connection initiation learning refers to a neural model trained using two or event is strongly related to the connection termination in more objective functions, such as multitask learning [17]. a network log. During the communication, there']","analysing sentiment contained within a log message to detect anomalous events. More specifically, we can distinguish between normal and abnormal events and also detail the severity of the detected abnormalities. Therefore, VOLUME 13, 2025 105365 S. Silalahi et al.: Interpretable Ordinal-Aware With Contrastive-Enhanced Anomaly Severity Detection TABLE 2. Related works in log-based anomaly detection. the investigator can prioritise the analysis objective to focus only on severe abnormalities. Therefore, we propose an interpretable log anomaly detection framework based on sentiment analysis, as depicted in Fig. 5. During the training phase, we investigate the model’s perception of the semantics of the messages when making predictions. The model is expected to associate the contextual dependency among words and phrases within the input message",0.75,0.810293495340022,0.0,1.0
"this section reports the experimental results along with in-depth discussions and analyses. A. BEST PERFORMING SCENARIO A. BEST PERFORMING SCENARIO 1) EVALUATION METRIC After experimenting with all the designed scenarios, the models’ performance is evaluated on the test dataset. The best-performing model from each pair of encoder type and loss function is reported in Table 4 and Table 5 for unfiltered and filtered datasets. Based on the evaluation metrics shown in both tables, the proposed scenario outperforms all baseline scenarios on all encoder types tested on the unfiltered dataset, with an accuracy of 96.875 and an F1 score of 96.851. As for the filtered dataset, the transformer encoder trained on the baseline scenario outperforms the other scenarios on all encoder","The proposed scenario outperforms all baseline scenarios on all encoder types tested on the unfiltered dataset, with an accuracy of 96.875 and an F1 score of 96.851 (Silahi et al., 2025).","['that reason, the pre-training dataset P = {(m ,m ,y)}|P| , 1 2 i i=1 baseline approaches, Table 9 presents the performance of is prepared by constructing positive and negative pairs of GRU, BiLSTM, and Transformer paired with the proposed samples.Apositivepairreferstoapairofsamplesthatbelong label schema. Note that the reported scores are the best- tothesameclass,whileanegativepaircontainstwosamples performing ones as a result of hyperparameter tuning. fromdifferentclasses.FollowingthestepsinAlgorithm1,the Comparedtopylogsentiment,ourproposedapproach,which resultingdatasethas|P|numberofsamples,whichisgiven uses GRU as the encoder, consistently achieves higher bythefollowingformula: scoresonthefilteredandunfiltereddatasetswithsignificant |C| |C| |C| improvements. This is also the case for the LSTM-based |P|= Xn c (n −1)+ X X n ×n (14) approach, which outperforms the Sentilog on the filtered 2 c c k andunfiltereddatasets.Ourbest-performingapproach,which c=1 c=1k=c+1 uses a Transformer as the encoder, achieves the highest Intheaboveformula,n isthenumberofsamplesbelonging c amongalltheencodersandoutperformsthetwoTransformer- toclasscand|D|isthenumberofsamplesinthetrainingset basedbaselines,NeurallogandTransSentLog.Therefore,the ofthefiltereddataset.Letδ bethecosinedistancebetween cos proposedapproachissuperiornotonlytoourownbaselines twoembeddingvectorsofinputpair(x,x),andy∈{0,1}is i j butalsotostate-of-the-artbaselines. thelabelofthepair,0meansnegativeand1indicatespositive pair,thecontrastivelossisgivenbytheequation[61]: E. ABLATIONSTUDY 1h i Deep neural models consist of layers to accommodate Lcont = y·δ2'
 'score. Conversely, the Focal scenario shows less confident prediction on both datasets. Other than the prediction confidence, the convergence FIGURE9. Thedistributionofthemean(µ)predictionconfidencescore speedbetweendifferentscenariosisalsoanalysed.Duringthe fromeachscenario.Theconfidencescoresobtainedfromthemodelsthat experiment,westoredthebestepochforeachmodel.Thebest aretrainedusingLoglossissignificantlyhigherandmorestablethanCE lossandFocallossonbothdatasets. epochisthecheckpointwhenthemodelachievesthehighest bothaccuracyandF1scores.Fig10showsthedistributionof thebestepochonbothdatasetsgroupedbythescenario.Itcan beseenthattheproposedmultitasklabelsneedmoreepochs model’s performance. To this end, the Chi-square signifionaveragecomparedtotheBaselineandFocalscenarios. cancetestcanbeusedtoobservetheeffectofeachhyperparameterconfigurationontheaccuracyofthemodel.Asshown B. HYPERPARAMETERANALYSIS inFig11,classweightappearstohaveastronginfluenceon Having an extensive hyperparameter search space can help sixoutofeightencoder-datasetpairs.Atthesametime,the analyse which hyperparameter has a positive impact on the scenarioshowsanimpactonthreeencoder-datasetpairs:FVOLUME13,2025 105371 S.Silalahietal.:InterpretableOrdinal-AwareWithContrastive-EnhancedAnomalySeverityDetection different batch sizes, as shown in Fig. 12. The best score is achieved by the batch size of eight on both datasets. As discussed in Section V-A, the best-performing models on both datasets are achieved by our proposed method; we further analyse the effect of increasing the prediction thresholdupon inferringthelabel.As thethresholdvalueis closerto1,anotabledecreasecanbeseeninFig.13b,starting from0.94.Conversely,theunfiltereddatasetinFig13ashows anegligibledecrease. C. ERRORANALYSIS This section discusses the confusion matrix, learned representation, and the interpretability of the best-performing FIGURE10. Thedistributionofthebestepochfromeachlossfunction. model on the filtered dataset. The confusion matrix in this Loglosstendstorequiremoreepochscomparedtocross-entropyand focalloss. paperisredefinedtoalignwiththeanomalyseveritycontext, wherethedistancebetweentrueandpredictedlabelsmatters. If'
 'when using focal loss. A. PERFORMANCEEVALUATION 15 epochs were chosen because more than ten caused the After conducting an extensive experiment on a vast amount modelstooverfit,basedonourexperiment.Boththetraining ofhyperparametersearchspace,thebest-performingmodels and testing batch sizes are eight to comply with the GPU for each encoder-scenario pair tested on the unfiltered memory size. To ensure reproducibility, we set the random and filtered dataset are reported on Table 7 and Table 8, seed for all randomizable occasions in the experiment to respectively.Frombothtables,itcanbeseenthatthehighest 42. The other hyperparameters included in the experiments score is achieved by the proposed scenario. It demonstrates are listed in Table 6. Since we are using t-SNE to visualize the advantages of incorporating multitask label schema to the datasets’ vector embeddings, default parameters by train multiclass anomaly severity detection models with sklearn.manifold are used for all t-SNE parameters a customised label decoding procedure. An interesting witharandomstateof42. pattern is shown in Table 8 regarding the'
 'to the absence of local a hierarchical attention mechanism—achieved state-of-the-art feature bias and lack of prior knowledge transfer from CNNs. performance across multiple metrics. To compensate, improvement using knowledge distillation Specifically, our model obtained a BLEU-4 score of 0.127, (KD), transferring supervision from the CNN ensemble to the surpassing the ensemble baseline (VGG16 + InceptionV3 + ViT (KD ViT – GPT-2). This significantly improves DenseNet121 + GPT-2), which scored 0.104, as well as prior performance, boosting BLEU-4 to 0.125 and CIDEr to 0.410. transformer-based approaches such as PPKED [45] and This validates that KD allows the ViT to learn richer CMN [46], both at 0.106. Similarly, the model achieved the representations and recover the strengths of CNN-based highest ROUGE-L score of 0.285, outperforming both the ensemble baseline (0.220) and recent models like Normal case: Abnormal case: FIGURE 7. Attention map in normal and abnormal data using multi-stage hierarchical decoder VOLUME'
 'include compared to other models. accuracy, precision, recall, and the F1-score. An overview of The graphs in Fig. 6 and Fig. 8 show the training and the evaluation method is illustrated in Fig. 3. Furthermore, validation loss of the three models during the training process. a comparative analysis of the evaluation metrics obtained A lower loss value indicates better performance in terms of from four pre-existing deep learning models is planned. This predictions on data not seen during training. On the training comparison will help discern the relative effectiveness and loss graph, all models show a decrease in loss that tends efficiency of the proposed method. By doing so, the aim is to to flatten as the epoch increases. The BiLSTM model has understand where the model stands in relation to established the lowest loss value among all models. At the end of the 4 Authorized licensed use limited to:']","there are 1,584 resulting model configurations in total, 729 for each dataset. Considering the extensive number of hyperparameter search spaces, not all the results are presented in this paper. Therefore, for each encoder type and scenario, only the best- performing one is presented for comparison and explained in the following subsection. Several metrics are used to evaluate the overall models’ performance, i.e., accuracy, precision, recall, and F1. Note that the weighted average is used to compute the average score of precision, recall, F1, and prediction confidence. We investigate the confusion matrix, learned representation, and the interpretability of the model’s prediction to increase understanding of the model. Captum, a tool developed by version 0.7.0 is used for model’s interpretability analysis. V.",0.25,0.7414206533912491,0.49999999995,0.5
"on all encoder types tested on the unfiltered dataset, with an accuracy of 96.875 and an F1 score of 96.851. As for the filtered dataset, the transformer encoder trained on the baseline scenario outperforms the other scenarios on all encoder types with an accuracy of 83.761 and an F1 score of 82.967. The proposed scenario only performs better on the GRU and LSTM encoders than the baseline scenarios. 2) PREDICTION CONFIDENCE Evaluating the performance of a neural model strongly depends on the task and domain problem. In a particular task, accuracy can be the only important metric. However, in some other domains, having a high accuracy does not suffice. For example, in this study, the model needs to be sure","The proposed approach, which uses GRU as the encoder, consistently achieves higher scores on the filtered and unfiltered datasets with significant improvements (Silahi et al., 2025).","['that reason, the pre-training dataset P = {(m ,m ,y)}|P| , 1 2 i i=1 baseline approaches, Table 9 presents the performance of is prepared by constructing positive and negative pairs of GRU, BiLSTM, and Transformer paired with the proposed samples.Apositivepairreferstoapairofsamplesthatbelong label schema. Note that the reported scores are the best- tothesameclass,whileanegativepaircontainstwosamples performing ones as a result of hyperparameter tuning. fromdifferentclasses.FollowingthestepsinAlgorithm1,the Comparedtopylogsentiment,ourproposedapproach,which resultingdatasethas|P|numberofsamples,whichisgiven uses GRU as the encoder, consistently achieves higher bythefollowingformula: scoresonthefilteredandunfiltereddatasetswithsignificant |C| |C| |C| improvements. This is also the case for the LSTM-based |P|= Xn c (n −1)+ X X n ×n (14) approach, which outperforms the Sentilog on the filtered 2 c c k andunfiltereddatasets.Ourbest-performingapproach,which c=1 c=1k=c+1 uses a Transformer as the encoder, achieves the highest Intheaboveformula,n isthenumberofsamplesbelonging c amongalltheencodersandoutperformsthetwoTransformer- toclasscand|D|isthenumberofsamplesinthetrainingset basedbaselines,NeurallogandTransSentLog.Therefore,the ofthefiltereddataset.Letδ bethecosinedistancebetween cos proposedapproachissuperiornotonlytoourownbaselines twoembeddingvectorsofinputpair(x,x),andy∈{0,1}is i j butalsotostate-of-the-artbaselines. thelabelofthepair,0meansnegativeand1indicatespositive pair,thecontrastivelossisgivenbytheequation[61]: E. ABLATIONSTUDY 1h i Deep neural models consist of layers to accommodate Lcont = y·δ2'
 'score. Conversely, the Focal scenario shows less confident prediction on both datasets. Other than the prediction confidence, the convergence FIGURE9. Thedistributionofthemean(µ)predictionconfidencescore speedbetweendifferentscenariosisalsoanalysed.Duringthe fromeachscenario.Theconfidencescoresobtainedfromthemodelsthat experiment,westoredthebestepochforeachmodel.Thebest aretrainedusingLoglossissignificantlyhigherandmorestablethanCE lossandFocallossonbothdatasets. epochisthecheckpointwhenthemodelachievesthehighest bothaccuracyandF1scores.Fig10showsthedistributionof thebestepochonbothdatasetsgroupedbythescenario.Itcan beseenthattheproposedmultitasklabelsneedmoreepochs model’s performance. To this end, the Chi-square signifionaveragecomparedtotheBaselineandFocalscenarios. cancetestcanbeusedtoobservetheeffectofeachhyperparameterconfigurationontheaccuracyofthemodel.Asshown B. HYPERPARAMETERANALYSIS inFig11,classweightappearstohaveastronginfluenceon Having an extensive hyperparameter search space can help sixoutofeightencoder-datasetpairs.Atthesametime,the analyse which hyperparameter has a positive impact on the scenarioshowsanimpactonthreeencoder-datasetpairs:FVOLUME13,2025 105371 S.Silalahietal.:InterpretableOrdinal-AwareWithContrastive-EnhancedAnomalySeverityDetection different batch sizes, as shown in Fig. 12. The best score is achieved by the batch size of eight on both datasets. As discussed in Section V-A, the best-performing models on both datasets are achieved by our proposed method; we further analyse the effect of increasing the prediction thresholdupon inferringthelabel.As thethresholdvalueis closerto1,anotabledecreasecanbeseeninFig.13b,starting from0.94.Conversely,theunfiltereddatasetinFig13ashows anegligibledecrease. C. ERRORANALYSIS This section discusses the confusion matrix, learned representation, and the interpretability of the best-performing FIGURE10. Thedistributionofthebestepochfromeachlossfunction. model on the filtered dataset. The confusion matrix in this Loglosstendstorequiremoreepochscomparedtocross-entropyand focalloss. paperisredefinedtoalignwiththeanomalyseveritycontext, wherethedistancebetweentrueandpredictedlabelsmatters. If'
 'include compared to other models. accuracy, precision, recall, and the F1-score. An overview of The graphs in Fig. 6 and Fig. 8 show the training and the evaluation method is illustrated in Fig. 3. Furthermore, validation loss of the three models during the training process. a comparative analysis of the evaluation metrics obtained A lower loss value indicates better performance in terms of from four pre-existing deep learning models is planned. This predictions on data not seen during training. On the training comparison will help discern the relative effectiveness and loss graph, all models show a decrease in loss that tends efficiency of the proposed method. By doing so, the aim is to to flatten as the epoch increases. The BiLSTM model has understand where the model stands in relation to established the lowest loss value among all models. At the end of the 4 Authorized licensed use limited to:'
 'scenariosandabaselinefrompreviouswork[9].Thefigure shows that the proposed Multitask-111 scenario achieves betterperformance,wheretwoLowsamplesarepredictedas Normal. Furthermore, we analyse the learned representation of the filtered dataset from the best-performing model. This analysis aims to investigate whether the model learns the nature of the label accordingly. One expects the Normal samples to have a greater distance from the High samples while also preserving the order of the label. From Fig. 15, itcanbeseenthatourproposedMultitask-111scenariolearns better representation compared to the other scenarios for tworeasons:1)betterclassseparabilityand2)representthe ordinalnatureofthelabel.Anotabledifferenceisshownin FIGURE11. P-valuefromChi-squaretestforeachpairof Fig15f,whererepresentingtheNormalclasswith1worsens encoder-hyperparameteronbothdatasets.Onlythosehavingap-value lessthan0.05areshown. theclassseparability. To introduce interpretability to the model, we investigate LSTM,U-LSTM,andU-Trans.Interestingly,thenumberof the importance of the words within the input messages in attentionheadsshowsaninsignificanteffectfromexploring predictingtheseveritylabelsusingintegratedgradients.This four, six, and eight heads during the experiment. The same helps to understand the model behaviour in making predicoccurs with bidirectionality, which only affects U-GRU. tions by computing the attributions of the input sentence Varying pooling techniques appear to have less significant towardtheanomalyseveritylabel.Fig16showstheresulting effectaswell.Notethatimpactscanbepositiveornegative, interpretability report with several'
 'model. However, it can maintain being the The validation process is carried out after each training second-best with slightly different features. MobileNetV3epoch to monitor model performance in the training phase. Large also performs well for all evaluation metrics as the Early stopping callbacks are based on val mAP to prevent second-best model. The two ResNet models also have overfitting in the training phase. Dataset preprocessing used competitive performance, but compared to the others, the for data augmentation in the training phase is a Random model performances fall behind. So, from this model Horizontal Flip with a probability of 0.5. B. Evaluation Results ResNet50v2 ResNet101 The evaluation results for F1 Score and mAP from the MobileNetV3-Large EfficientNetV2-S Faster R-CNN model in this study are shown in Table II, 1 and the summary of these results is shown in Figure 2. The F1 score combines precision and recall metrics, providing a 0.8']","precision, recall, F1, and prediction confidence. We investigate the confusion matrix, learned representation, and the interpretability of the model’s prediction to increase understanding of the model. Captum, a tool developed by version 0.7.0 is used for model’s interpretability analysis. V. EVALUATION AND DISCUSSION V. EVALUATION AND DISCUSSION A. PERFORMANCE EVALUATION A. PERFORMANCE EVALUATION After conducting an extensive experiment on a vast amount of hyperparameter search space, the best-performing models for each encoder-scenario pair tested on the unfiltered and filtered dataset are reported on Table 7 and Table 8, respectively. From both tables, it can be seen that the highest score is achieved by the proposed scenario. It demonstrates the advantages of incorporating multitask label schema to train multiclass anomaly severity",1.0,0.8028003112802508,0.499999999975,0.625
"which hyperparameter the accuracy depends on. The dependency can be either increasing or decreasing the accuracy. Nevertheless, it can help choose which hyperparameter to modify in the next experiments. C. COMPARISON WITH STATE-OF-THE-ART MODELS C. COMPARISON WITH STATE-OF-THE-ART MODELS In this study, several baselines from previous studies are reproduced on the dataset to perform performance compar- isons. The reproduced performance from an experimental procedure explained in subsection IV-B2 is presented in Table 6. On both datasets, the proposed scenario outper- forms all the baselines with an improvement of 0.423 and 0.665 in the F1 score on the filtered and unfiltered datasets, respectively. Considering that Pylogsentiment used a GRU-based encoder and SentiLog used an LSTM-based the proposed scenarios on these two","The proposed scenarios leverage transformer architectures, which have shown promise in forecasting stock prices by effectively learning from time-sequenced data (Haryono et al., 2023).","['In this paper, we presented quantifying multi-aspect news LSTM and GRU models,’’ Scientific Program., vol. 2021, pp.1–8, sentiment with considered time sequence data and then Sep.2021,doi:10.1155/2021/4055281. forecasting stock prices next days using sentiment and [12] A.Vaswani,N.Shazeer,N.Parmar,J.Uszkoreit,L.Jones,A.N.Gomez, technicalindicators.Infeatureextraction,adailyconfidence Ł. Kaiser, and I. Polosukhin, ‘‘Attention is all you need,’’ in Proc. Adv. Neural Inf. Process. Syst., Dec. 2017, pp.5999–6009, doi: score from the classification model is used to quantify 10.48550/arXiv.1706.03762. sentiment. The active learning model produced a monthly [13] J.Devlin,M.-W.Chang,K.Lee,andK.Toutanova,‘‘BERT:Pre-training classification model to represent model knowledge. The ofdeepbidirectionaltransformersforlanguageunderstanding,’’inProc. Conf. North. Stroudsburg, PA, USA: Association for Computational Transformer Encoder Gated Recurrent Unit (TEGRU) outLinguistics,Oct.2019,pp.4171–4186,doi:10.18653/v1/N19-1423. performed another Transformer architecture for stock price [14] A. Dosovitskiy, L. Beyer, A. Kolesnikov, D. Weissenborn, X. Zhai, forecasting on eight stock issuers. The TEGRU model T. Unterthiner, M. Dehghani, M. Minderer, G. Heigold, S. Gelly, consistsofthetransformerencodertolearntimeseriespattern J. Uszkoreit, and N. Houlsby, ‘‘An image is worth 16×16 words: Transformersforimagerecognitionatscale,’’2020,arXiv:2010.11929.'
 'outperindicator,sentimentanalysis,orboth. formed8of12classificationandsequencelabelingtasksafter Historical stock transaction processing using statistical being trained on 15 data sets containing over 275 million methods such as the moving average yielded information sentences[32]. about volatility, trend, and momentum. The stock trader uses the volatility, trend, and momentum as a signal to buy or sell stock. In previous research, a pre-processing D. GATEDRECURRENTUNIT(GRU) step is used to reduce the dimension or select an essential Time series forecasting already uses deep learning methods feature of the technical indicator. Principal Component likerecurrentneuralnetworks.ThesimplestvariantofRNN Analysis (PCA) and the LASSO method are implemented architecture to predict stock prices is the gated recurrent tominimize53indicatorsandusedtoforecasttheShanghai unit (GRU) [11]. The GRU layer had slightly better than Composite Index. The result is that LASSO had better the LSTM layer on stock price trend prediction [33]. The predictionperformancethanPCA[11].Theothermethodis most straightforward architecture because, compared with featuredecomposition,suchasEmpiricalWaveletTransform LSTM, GRU only has two gates in a cell: update and reset'
 'Convolution Neural Network and Bidirectional Gated [14] M. Shafiq and Z. Gu, “Deep Residual Learning for Image Recurrent Unit for Sentence Semantic Classification,” IEEE Access, Recognition: A Survey,” Applied Sciences (Switzerland), vol. 12, vol. 6, pp. 73750–73759, 2018, doi: no. 18. 2022. doi: 10.3390/app12188972. 10.1109/ACCESS.2018.2882878. [15] K. He, X. Zhang, S. Ren, and J. Sun, “Deep residual learning for [22] X. Fu, J. Yang, J. Li, M. Fang, and H. Wang, “Lexicon-Enhanced image recognition,” in Proceedings of the IEEE Computer Society LSTM with Attention for General Sentiment Analysis,” IEEE Conference on Computer Vision and Pattern Recognition, 2016. Access, vol. 6, 2018, doi: 10.1109/ACCESS.2018.2878425. doi: 10.1109/CVPR.2016.90. [23] M. Bouazizi and T. Otsuki Ohtsuki, “A Pattern-Based Approach for [16] J. Kim, M. El-Khamy, and J. Lee, “Residual LSTM: Design of a Sarcasm Detection on Twitter,” IEEE Access, vol. 4, pp. 5477– Deep Recurrent Architecture for Distant Speech Recognition,” Jan. 5488, 2016, doi:'
 'best traditional architecture is CEM and REM score are 0.99997 R2, 18.32822 MAE, 916.76957 MSE, with the same evaluation score, which are 0.99947 R2, 0.00295 sMAPE, 0.56794 F1-score, and 0.32478 63.34156 MAE, 19,017.38782 MSE, 0.00744 sMAPE, MWRE@0.75. The TKAN has a better capture pattern 0.32963 F1-score, and 0.50463 MWRE@0.75. The best of ABSA sentiment score than the pTKAN. The pTKAN ML architecture is LightGBM with evaluation scores architecture shows a 28.40% reduction in MSE compared are 0.99834 R2, 98.23507 MAE, 60,047.07194 MSE, to TKAN, indicating that pTKAN successfully reduced the 0.00834 sMAPE, 0.32235 F1-score, and 0.51032 error by more than one. In the MWRE evaluation, pTKAN MWRE@0.75. The CEM and REM perform better than outperforms TKAN by 2.62%, which more accurately LightGBM. The best DL architectures without the Trans- predictsstockpricemovementdirection. former variant and TKAN variant are GRU and CNN- Thetoptraditionalarchitectures,CEMandREM,achieved LSTM. The GRU has best evaluation score in R2, MAE,'
 'by the daily second place best performance on TKAN with a daily ABSA sentiment score. The MSE represents the large error ABSA sentiment score is more than TKAN with the stock the daily ABSA sentiment score can reduce. Fig. 11 and transactionsonly. Fig. 12 use error normalization scaling to show different According to the MAE evaluation, the best performance performances with and without daily ABSA sentiment wasachievedbythePGASstockusingpTKANwithoutdaily scoresinvariousunifiedstockpriceforecasting.Thehigher ABSAsentiment,withanMAEof2.46841.Incontrast,the value is better performance. As shown in Fig. 11 using ITMGstockusingTKANwithdailyABSAsentimenthadthe scaled sMAPE, the daily ABSA sentiment score positively worstperformance,withanMAEof68.91092.FortheMSE influences 13 of 19 architectures. The scaled MSE in metric,PGASagainperformedthebestusingpTKANwithFig.12revealstheCEM,REM,FEM,LightGBM,CatBoost, outdailyABSAsentiment,registeringanMSEof10.40109, MLP, LSTM, GRU, TELSTM, TKANAtt, and pTKANAtt while the worst performance came from the BBCA stock, successinloweringsignificanterrorwhileusingdailyABSA which had an MSE of 10,401.39641 when using pTKAN sentiment score. The right combination of architecture and with daily ABSA sentiment. Regarding MWRE@0.75, the featuresisvitaltoproducethehighestperformanceinstock UNTR stock performed best using pTKAN without daily']","sequence-based approach in the log-based anomaly detection research, as shown in Table 2. In contrast, this paper uses a point-based approach based on the characteristics of the problem and the dataset. Therefore, there are limited references that can be used as baselines for comparison, as described in the following: 1) Pylogsentiment . Using a point-based approach, a sentiment analysis model is trained using a one-layer VOLUME 13, 2025 105369 S. Silalahi et al.: Interpretable Ordinal-Aware With Contrastive-Enhanced Anomaly Severity Detection TABLE 6. Hyperparameter search space for all scenarios. neighbouring classes share common features. GRU, LSTM, and Transformer are explored to find the best- performing encoder. To provide a fair comparison, the GloVe embedding used in pylogsentiment, SentiLog, and TransSentLog are",0.5,0.6365123438944862,0.0,0.14285714285714285
"proposed scenario can improve the detection performance of the model. D. ABLATION STUDY D. ABLATION STUDY Following the rapid advancement in neural network research, more complex and sophisticated architectures are emerging. A model can consist of layers of components that have a specific role in the learning process. After conducting an experiment on a certain dataset and task, verifying and checking which component in the model contributes posi- tively to the performance is crucial. Therefore, we perform an ablation study to explain which part of the proposed approach has a significant impact on the performance. Note that only the best-performing scenario on each dataset is explored. First, we investigate the significance of the CLS token from the BERT embedding. Secondly,","The significance of model components in enhancing performance is supported by findings that highlight the effectiveness of individual matching mechanisms and multi-head attention in improving neural network outcomes (Putra et al., 2025).","['embeddings using Siamese BERT-networks,’’ in Proc. Conf. Empirical Methods Natural Lang. Process. 9th Int. Joint Conf. Natural Lang. Process. (EMNLP-IJCNLP). Stroudsburg, PA, USA: Association for Computational Linguistics, 2019, pp.3982–3992. [Online]. Available: https://aclanthology.org/D19-1410 [53] S. Xiao, Z. Liu, P. Zhang, N. Muennighoff, D. Lian, and J.-Y. Nie, ‘‘C-pack: Packed resources for general Chinese embeddings,’’ in Proc. 47thInt.ACMSIGIRConf.Res.Develop.Inf.Retr.,Jul.2024,pp.641–649, doi:10.1145/3626772.3657878. [54] N. Kokhlikyan, V. Miglani, M. Martin, E. Wang, B. Alsallakh, RATIHNURESTIANGGRAINI(Member,IEEE) J. Reynolds, A. Melnikov, N. Kliushkina, C. Araya, S. Yan, and received the Ph.D. degree in engineering mathO.Reblitz-Richardson, ‘‘Captum: A unified and generic model interematics from the University of Bristol, in 2021. pretabilitylibraryforPyTorch,’’2020,arXiv:2009.07896. She is currently a Lecturer with the Informatics [55] M.Sundararajan,A.Taly,andQ.Yan,‘‘Axiomaticattributionfordeep Department, Institut Teknologi Sepuluh Nopemnetworks,’’inProc.Int.Conf.Mach.Learn.,vol.70,2017,pp.3319–3328. ber(ITS),Indonesia.Herresearchinterestsinclude [56] M. Lewis, Y. Liu, N. Goyal, M. Ghazvininejad, A. Mohamed, text mining, artificial intelligence, and software O. Levy, V. Stoyanov, and L. Zettlemoyer, ‘‘BART: Denoising engineering. sequence-to-sequence pre-training for natural language'
 'training process. To assess the final model’s Circular padding was employed as the padding techgeneralizationability,wemeasuredprecision(P),recall(R), nique. The multi-head attention mechanism incorporated F1score(F1),andaccuracy(te−acc)onaseparatetesting four attention heads and the BiLSTM layer was configured dataset. with 100 hidden units. We used pre-trained GloVe with 50 dimensions [36] and fastText embeddings [37] for word IV. EXPERIMENTS embeddings. These embedding methods were chosen to A. DATA effectivelycapturethesyntacticandsemanticinformationof We assessed Indo-BiEnt for RTE using the SNLI Indo words [38], [39]. At this stage, we deliberately opted not to dataset[34].Thisdatasetisspecificallydesignedtoevaluate use transformer-based word embedding techniques such as models in Indonesian text. SNLI Indo was generated from BERT or similar models, focusing instead on the more trathe SNLI corpus, a large English RTE dataset containing ditionalwordembeddingmethodstomaintaincomputational approximately 570,000 sentence pairs. Sentences in SNLI efficiencywhileaddressingthestudy’sprimarygoals. Indo were obtained by translating the original English The training process of the neural network involves sentencesinSNLItoIndonesian.[11].Statisticalinformation optimizing parameter values to learn a model'
 'highlighted a bold font. The presented scores in the tables TP+FN + ε containboth proposedandbaselinemodels. Eachtablerep2×(pre×rec) F1 = (24) resents a scenario that is grouped based on the character pre+rec + ε embedding used, as Table 4 shows the models employing pre = (cid:80)C c=1 TP c (25) AdaTransforextractingcharacterembedding.Subsequently, micro (cid:80)C TP +(cid:80)C FP +ε Table5and6showthemodels’architecturewhereLSTMand c=1 c c=1 c (cid:80)C TP CNNwereusedasthecharacterembedding,respectively. rec = c=1 c (26) From the evaluation score presented in Table 4 to 6, the micro (cid:80)C TP +(cid:80)C FN +ε c=1 c c=1 c bestperformancewasachievedbyGloVe–ScaledAdaTrans F1 = (1+β)×pre micro ×rec micro (27) combination with an 87.771% F1 score. AdaTrans attenmicro β×pre ×rec +ε tion consistently achieves the highest score for all character micro micro embeddingandwordembeddingoptions.GloVeoutperforms theBERTembeddingevaluatedonthenon-contextualdataset C. RESULTSONDIFFERENTANNOTATIONRULES for all scenarios. This is because the first dataset has conThissubsectionpresentsallthepossiblearrangementsfrom sistent tagging, meaning that a word has a consistent tag the available options of character embedding,'
 '2013, pp.273–282. [26] Y. Liu, C. Sun, L. Lin, and X. Wang, ‘‘Learning natural language [Online]. Available: http://www.cfilt.iitb.ac.in/resources/surveys/Anish- inference using bidirectional LSTM model and inner-attention,’’ 2016, Survey-Entailment.pdf arXiv:1605.09090. [5] X.Xiong,Y.Li,R.Zhang,Z.Bu,G.Li,andS.Ju,‘‘DGI:Recognitionof [27] Q.Chen,X.Zhu,Z.-H.Ling,S.Wei,H.Jiang,andD.Inkpen,‘‘Enhanced textualentailmentviadynamicgatematching,’’Knowledge-BasedSyst., LSTMfornaturallanguageinference,’’inProc.55thAnnu.MeetingAssoc. vol.194,Apr.2020,Art.no.105544,doi:10.1016/j.knosys.2020.105544. Comput.Linguistics,vol.1,2017,pp.1657–1668. 110164 VOLUME13,2025 I.M.S.Putraetal.:RTEinIndonesianUsingIndividualBipletHead-Dependent [28] P.Li,‘‘Hybridneuralnetworkmodelbasedonmulti-headattentionfor I MADE SUWIJA PUTRA (Member, IEEE) Englishtextemotionanalysis,’’EAIEndorsedTrans.ScalableInf.Syst., received the master’s degree in electrical engivol.9,no.35,pp.1–10,2022. neeringfromUdayanaUniversity,Bali,Indonesia, [29] J.Zhang,X.Zhang,Z.Liu,F.Fu,Y.Jiao,andF.Xu,‘‘Anetworkintrusion in 2014, and the Ph.D. degree from Institut detectionmodelbasedonBiLSTMwithmulti-headattentionmechanism,’’ TeknologiSepuluhNopember,Surabaya,IndoneElectronics,vol.12,no.19,p.4170,Oct.2023. sia, in 2024. He is currently a Lecturer with [30] Y.JiangandY.Wang,‘‘Topic-awarehierarchicalmulti-attentionnetwork theFacultyofEngineering,UdayanaUniversity. for text classification,’’ Int. J. Mach. Learn. Cybern., vol. 14, no. 5, Hehaspublishedmorethan25journalarticlesand pp.1863–1875,May2023. conferencepapersrelatedtoinformationtechnol[31] R.A.Hidayat,I.N.Khasanah,W.C.Putri,andR.Mahendra,‘‘Featureogy.Hisresearchinterestsincludestudiesrelated richclassifiersforrecognizingtextualentailmentinIndonesian,’’inProc. to natural language processing, software engineering, and information 5thInt.Conf.AIComput.LinguisticsFeature-Rich,vol.189,Jan.2021, systems. pp.148–155,doi:10.1016/j.procs.2021.05.094. [32] P. Qi, Y. Zhang, Y. Zhang, J. Bolton, and C. D. Manning, ‘‘Stanza: A Python natural language processing toolkit for many human languages,’’ in Proc. 58th Annu. Meeting Assoc. Comput. Linguistics: Syst. Demonstrations, Jan. 2020, pp.101–108. [Online]. Available: https://nlp.stanford.edu/pubs/qi2020stanza.pdf [33] J.'
 'on Computational expanding the dataset to refine the model’s capabilities in Linguistics, 12 2020, pp. 4619–4637. [Online]. Available: handling various manuscript styles and complexities. https://aclanthology.org/2020.coling-main.407 [16] T. Chay-intr, H. Kamigaito, K. Funakoshi, and M. Okumura, “Latte: ACKNOWLEDGMENT Lattice attentive encoding for character-based word segmentation,” , vol. 30, pp. 456–488, 2023. This research was funded by Institut Teknologi Sepuluh [17] S. Choi, T. Kim, J. Seol, and S. goo Lee, “A syllable-based technique Nopember (ITS) under Penelitian Dana Departemen Program, for word embeddings of korean words,” 8 2017. Penelitian Keilmuan, Penelitian Flagship, Penelitian Kolab- [18] Y. Chen, K. Lim, and J. Park, “Korean named entity recognition based on language-specific features,” orasi Pusat and under the Project Scheme of the Publica5 2023. [Online]. Available: http://arxiv.org/abs/2305.06330 tion Writing and Intellectual Property Rights (IPR) Incentive http://dx.doi.org/10.1017/S1351324923000311 (Penulisan Publikasi dan Hak Kekayaan Intelektual/PPHKI) [19] T. Chay-Intr, H. Kamigaito, and M. Okumura, “Character-based thai word segmentation']","model plays a significant role in performing the task is crucial to developing a high-performing model. To this end, in this paper, an ablation study is performed. First, we investigate the effect of employing multitask learning on the model’s performance. Secondly, we investigate the effect of using all zeroes for the Normal class label’s representation. Thirdly, the importance of the [CLS] token’s embedding vector and the BERT’s parameters are investigated. Lastly, we com- prehensively study the effect of the proposed DroneSBERT embedding on the model’s performance, interpretability, and learned representations. Overall, the multitask label can improve the detection performance, where the best-performing models on both datasets are achieved by the proposed Multitas-111 label. Using all zeroes to represent the Normal",0.0,0.5263168028744246,0.0,0.25
"to explain which part of the proposed approach has a significant impact on the performance. Note that only the best-performing scenario on each dataset is explored. First, we investigate the significance of the CLS token from the BERT embedding. Secondly, we analyse the impact of freezing the BERT’s parameter during training. Thirdly, we vary the batch size during the training. Finally, FIGURE 11. Analysis of the effect of different batch sizes on the evaluation scores of the best-performing models. we examine the effect of increasing the prediction threshold used in our proposed approach on the accuracy and F1 scores. As shown in Table 6, excluding the CLS token embedding before feeding the input matrix to the encoder significantly decreases performance.",,"['embeddings using Siamese BERT-networks,’’ in Proc. Conf. Empirical Methods Natural Lang. Process. 9th Int. Joint Conf. Natural Lang. Process. (EMNLP-IJCNLP). Stroudsburg, PA, USA: Association for Computational Linguistics, 2019, pp.3982–3992. [Online]. Available: https://aclanthology.org/D19-1410 [53] S. Xiao, Z. Liu, P. Zhang, N. Muennighoff, D. Lian, and J.-Y. Nie, ‘‘C-pack: Packed resources for general Chinese embeddings,’’ in Proc. 47thInt.ACMSIGIRConf.Res.Develop.Inf.Retr.,Jul.2024,pp.641–649, doi:10.1145/3626772.3657878. [54] N. Kokhlikyan, V. Miglani, M. Martin, E. Wang, B. Alsallakh, RATIHNURESTIANGGRAINI(Member,IEEE) J. Reynolds, A. Melnikov, N. Kliushkina, C. Araya, S. Yan, and received the Ph.D. degree in engineering mathO.Reblitz-Richardson, ‘‘Captum: A unified and generic model interematics from the University of Bristol, in 2021. pretabilitylibraryforPyTorch,’’2020,arXiv:2009.07896. She is currently a Lecturer with the Informatics [55] M.Sundararajan,A.Taly,andQ.Yan,‘‘Axiomaticattributionfordeep Department, Institut Teknologi Sepuluh Nopemnetworks,’’inProc.Int.Conf.Mach.Learn.,vol.70,2017,pp.3319–3328. ber(ITS),Indonesia.Herresearchinterestsinclude [56] M. Lewis, Y. Liu, N. Goyal, M. Ghazvininejad, A. Mohamed, text mining, artificial intelligence, and software O. Levy, V. Stoyanov, and L. Zettlemoyer, ‘‘BART: Denoising engineering. sequence-to-sequence pre-training for natural language'
 'input demonstrates promising stability for the proposed demonstratesconsistentresults.Incontrast,whilethemodel model by effectively capturing sentence syntax. However, utilizing whole sentence input achieves higher accuracy, future improvements, such as the integration of validated its training performance is less stable. This instability is word-to-word relational annotations or external knowledge evidenced by the divergence in training and validation bases,areessentialtoimproveaccuracyandoptimizemodel accuracy curves, as illustrated in Figure 9(a). Although the performance.Thecurrentstudydidnotexploretheseaspects trainingaccuracysteadilyincreases,thevalidationaccuracy due to the unavailability of validated resources for relation remains stagnant and even slightly declines, suggesting annotationsinIndonesian. 110160 VOLUME13,2025 I.M.S.Putraetal.:RTEinIndonesianUsingIndividualBipletHead-Dependent TABLE4. PerformancecomparisonofIndo-BiEntmodelusingdifferent globalco-occurrencestatistics,alignwellwiththesyntactic wordembeddingtechniques. and structural representations introduced by the Biplet formulation.WhileFastTextcontributessubword-levelfeatures beneficial for morphologically rich languages, its impact appears less pronounced in this architecture, likely due to theexplicitsyntacticencodingalreadyprovidedbytheBiplet structures. TheresultsconfirmthatGloVeandFastTextremaineffectiveandefficientembeddingchoicesforsyntactically-informed Another consideration is the integration of an external models like Indo-BiEnt, particularly when aiming for knowledge base module. This module could guide the interpretability and low computational requirements in lowattention mechanism, improving its ability'
 '2023. [31] P. Chormai, P. Prasertsom, and A. T. Rutherford, [11] B. An and C. Long, “Ancient tibetan word segmentation based on “Attacut: A fast and accurate neural thai word segdeep learning,” in 2021 International Conference on Asian Language menter,” ArXiv, vol. abs/1911.07056, 2019. [Online]. Available: Processing (IALP), 2021, pp. 292–297. https://api.semanticscholar.org/CorpusID:208138985 [12] P. Limkonchotiwat, W. Phatthiyaphaibun, R. Sarwar, E. Chuang- [32] K. Sirts and K. Peekman, “Evaluating sentence segmentation and word suwanich, and S. Nutanong, “Domain adaptation of thai word tokenization systems on estonian web texts,” vol. 328. IOS Press BV, segmentation models using stacked ensemble,” B. Webber, T. Cohn, 9 2020, pp. 174–181. Y. He, and Y. Liu, Eds. Association for Computational [33] “Indonesian oscar corpus,” https://huggingface.co/datasets/oscarLinguistics, 11 2020, pp. 3841–3847. [Online]. Available: corpus/OSCAR-2201/tree/main/compressed/id_meta, accessed: 2024https://aclanthology.org/2020.emnlp-main.315 05-01. [13] M. Maryamah, A. Arifin, R. Sarno, R. Indraswari, and R. Sholikah, “Pseudo-relevance feedback combining statistical and semantic term extraction for 2020, pp. 3841–3847. [Online]. Available: corpus/OSCAR-2201/tree/main/compressed/id_meta, accessed: 2024https://aclanthology.org/2020.emnlp-main.315 05-01. [13] M. Maryamah, A. Arifin, R. Sarno, R. Indraswari, and R. Sholikah, “Pseudo-relevance feedback combining statistical and semantic term extraction for searching arabic documents,” International Journal of Intelligent Engineering and Systems, vol. 14, no. 5, pp. 238–246, 2021, publisher Copyright: © 2021. All Rights Reserved. 6 Authorized licensed use limited to: Institut Teknologi Sepuluh Nopember. Downloaded on July 14,2025 at 08:18:27 UTC from IEEE Xplore. Restrictions apply.'
 'and testing them on the filtered findings, embedding plays a significant role in performing and unfiltered datasets, the results are reported in Table 9. the prediction. Therefore, we further explore the effect of Inthetable,thereportedscoreofourproposedframework’s improving the embedding by training a domain-specific performanceistakenfromthebest-performingconfiguration embedding. asshowninTable7andTable8.Itcanbeseenfromthescores One main challenge in this paper is the samples from shown in Table 9 that Neurallog consistently outperforms different classes are mutually inclusive. For this reason, theotherbaselinesonbothdatasets.However,ourproposed we train a sentence embedding [59] model named DroneSapproachoutperformsallthebaselinessignificantlytestedon BERT with the help of contrastive learning to learn distinct thefiltereddataset,witha2.564%improvementinaccuracy representationsofsamplesfromdifferentclasses[60].Itcan than Neurallog. While for the unfiltered dataset, Dronelog beachievedbytraininganeuralmodeltomaximizethecosine outperformsallthebaselineswitha0.446%improvementin distance between negative pairs and minimize the cosine accuracycomparedtoNeurallog. distancebetweenthepositivepairsatthesametime[61].For Considering the underlying encoder type used in the that reason, the pre-training dataset P = {(m ,m ,y)}|P| , 1 2 i i=1 baseline approaches, Table 9 presents the performance of is prepared by constructing positive and negative'
 'share common features. GRU, theaveragelengthofthesentenceinthedataset.Theaverage LSTM,andTransformerareexploredtofindthebest- length of the log message in the dataset is 8.7. Thus, the performingencoder. messagesareunlikelytocontaintoomanycontextsthatneed To provide a fair comparison, the GloVe embedding to be captured by each attention head [25]. Therefore, four, used in pylogsentiment, SentiLog, and TransSentLog are six,andeightareexploredintheexperiment.Astwodatasets replaced by BERT embedding as it is better used for text are used in the experiment, there are 1,584 resulting model classification than a static embedding such as GloVe [53]. configurationsintotal,729foreachdataset. Moreover, hyperparameter tuning is also performed on the Considering the extensive number of hyperparameter four aforementioned baselines. Compared to other pre- searchspaces,notalltheresultsarepresentedinthispaper. trained large language models (PLMs), BERT is commonly Therefore,foreachencodertypeandscenario,onlythebestusedinlog-basedanomalydetectionresearch,asdiscussedin performingoneispresentedforcomparisonandexplainedin SectionII.Therefore,allthemodelsinthispaperuseBERTas thefollowingsubsection.Severalmetricsareusedtoevaluate thewordembeddingmodel.Otherthanthesefourbaselines, the overall models’ performance, i.e., accuracy, precision, we construct our own baseline by performing a grid search recall, and F1. Note that the weighted average is used to over a significant number of hyperparameters to verify the compute']","CRF is used as the decoder. In terms of convergence speed, as depicted in Fig. 11, the proposed method converges as fast as Transformer and AdaTrans. Moreover, cosine atten- tion outperforms the BiLSTM model. From the F1 score, our proposed method achieves the second-best performance FIGURE 10. Comparison between different encoders with the best performance on the test set of the contextual dataset. results reported in Table 7 to 9, the involvement of either con- textual or static embedding signiﬁcantly affects the model’s performance evaluation score. This can be seen from the dot-product attention performance, with a 3.782% difference between the best dot-product attention that uses BERT and GloVe. This signiﬁcant difference is also happening to the cosine attention, with",0.375,0.0,0.0,0.14285714285714285
"effect of increasing the threshold on the accuracy and F1 scores of the best-performing model tested on both datasets. An interesting case is shown in Fig 12a when λ = 0.65, the accuracy reaches 97%, exceeding the best model’s accuracy when λ = 0.5. This happens when the prediction confidence score surpasses the threshold while the true label’s severity is lower than the prediction label’s. Thus, following the decoding procedure in section III-C, the predicted label is incorrect. This phenomenon also happens on the filtered dataset when λ > 0.94. Overall, the decrement in the accuracy and F1 scores is insignificant until λ = 0.9 and λ = 0.8 on the unfiltered and filtered datasets, respectively. Thus, it confirms the",,"['BiLSTM model has understand where the model stands in relation to established the lowest loss value among all models. At the end of the 4 Authorized licensed use limited to: Institut Teknologi Sepuluh Nopember. Downloaded on July 14,2025 at 08:18:27 UTC from IEEE Xplore. Restrictions apply. model accuracy model loss model accuracy model loss BiLSTM RNN GRU CNN BiLSTM RNN GRU CNN BiLSTM RNN GRU CNN BiLSTM RNN GRU CNN 100 25 100 20 yc g a n r i u n c ) ia % c r a ( t 9 9 9 9 9 8 6 4 2 0 gnin s ) i s % a o r ( t l 2 1 1 0 5 0 5 0 n y o c i a ta ru d c i ) l % a ca v ( 9 9 9 9 8 6 4 2 noitad s i'
 ""of errors, providing a measure of the quality of an performing these pre-processing steps, the data used in the estimator—it is always non-negative, and values closer to analysis is of good quality and ready for further steps. The zero are good. RMSE, the square root of MSE, gives a clearer dataset was split into training and testing sets using an 80:20 idea of the error magnitude between model's output and target ratio for all models, with the training set containing 80% of value, making interpretation straightforward. MAE measures the data used to train the models and the testing set containing the average magnitude of the prediction errors, directly 20% of the data used to evaluate model performance. providing the average error in the same units as the data. It This research will use GridSearchCV to search for the measures how accurate the predicted values are compared to ideal machine learning""
 'construct our own baseline by performing a grid search recall, and F1. Note that the weighted average is used to over a significant number of hyperparameters to verify the compute the average score of precision, recall, F1, and robustnessofDroneLog. prediction confidence. We investigate the confusion matrix, learnedrepresentation,andtheinterpretabilityofthemodel’s C. IMPLEMENTATIONDETAILS prediction to increase understanding of the model. Captum, The proposed method presented herein is implemented in a tool developed by [57] version 0.7.0 is used for model’s Python version 3.12 with the help of the Pytorch library interpretabilityanalysis. version 2.3.1 and executed on a personal computer with a 6GBGPUcard.Allthemodelsaretrainedusing15epochs, optimised using AdamW [54] with a learning rate of η = V. EVALUATIONANDDISCUSSION 2e − 5 [25], and γ = 2 [37] when using focal loss. A. PERFORMANCEEVALUATION 15 epochs were chosen because more than ten caused the After conducting an extensive experiment on a vast amount modelstooverfit,basedonourexperiment.Boththetraining ofhyperparametersearchspace,thebest-performingmodels and testing batch'
 '0.6090 0.6367 0.6229 Diabetes Mellitus,"" INFORM, no. Vol. 4 (1), 2019. 3 Random Forest 0.6211 0.6460 0.6336 [8] Suyanto, Data Mining untuk Klasifikasi dan Klasterisasi Data Edisi Revisi, Bandung: Informatika, 2019. 4 Ada Boost 0.6576 0.6112 0.6344 [9] J. Diz, G. Marreiros, and A. Freitas, ""Applying data mining techniques to 5 KNN 0.5785 0.6078 0.5932 improve breast cancer diagnosis,"" J. Med. Syst. , no. vol. 40, no. 9, pp. 1-7, 2016. Mean 0.6147 0.6267 0.6207 [10] S. Santiso, A. Casillas, and A. Pérez, ""The class imbalance problem detecting adverse drug reactions in electronic health records,"" Health Information, no. Vol. important in medical diagnoses to correctly identify patients 25, No. 4, p. 1768–1778, 2019. with disease than the F1 Score. [11] N. V. Chawla, K. W. Bowyer, L. O. Hall, and W. P. Kegelmeyer, ""SMOTE: Synthetic Minority Over-sampling Technique,"" Journal of Artificial Intelligence The scientific reason why SMOTE ENN is the'
 'based on statistical learning theory [34], [35]. This score.Equation(10)describestheobjectivefunctionofeach modelcanseparatedataintoclassesbyconstructingseveral round. lines (hyperplanes), which are called SVM decision boundaries.Margins,thedistancebetweenhyperplanes,aredeter- L(t) = Xn l (cid:16) y,y (t−1) +f (x) (cid:17) +(cid:127)(f ) (10) minedbySVMkernelcalculations.Theradialbasisfunction i=1 i i t i t (RBF)isapopularkernelbasedontheGaussiandistribution (t) where l is the loss function, y is the predicted result of ifunction[36],whichisexpressedin(8). i th in t-th iteration, and (cid:127) is a regularization term. In this K (cid:0) x,x (cid:1)=exp − (cid:13) (cid:13)x i −x j (cid:13) (cid:13) 2! (8) case,theparametersofXGBoostwithRFwerethesameas i j 2σ2 theirrespectivevalues.However,XGBoosthasanadditional parameter, namely the learning rate, which was set at 0.3. (cid:13) (cid:13) where(cid:13)x i −x j(cid:13)istheEuclideandistancebetweentwopoints Increasingthelearningratemightexpeditethemodel’scomx andx,andσ2 isthevariance.Thisstudyinvolvesseveral putationalspeed;nevertheless,thismayresultininadequate i j SVMparameters:theRBFkernel,Cis1,andothersfollow prediction accuracy as a significant portion of the training thedefault.TheCfunctionregulatestheclassificationerror datamaynotbeeffectivelyutilized. byadjustingtheinclusionofaccuratetrainingdatainaccordancewiththemarginsizeofthedecisionfunction.Whenthe 4) LINEARDISCRIMINANTANALYSIS(LDA) C value is increased, the decision function aims to create a LDAisasupervisedlearningalgorithmusedforclassification narrowmarginonthedecisionlineinordertodistinguishthe tasks[44].Itcanalsobeusedasadimensionalityreduction dataclasses.Thiscanresultinthemodeloverfitting.Never- technique, which maximizes the separation between classes theless,whentheCvalueisreduced,itformsawidermargin, by finding a set']","we further analyse the effect of increasing the prediction threshold upon inferring the label. As the threshold value is closer to 1, a notable decrease can be seen in Fig. 13b, starting from 0.94. Conversely, the unfiltered dataset in Fig 13a shows a negligible decrease. C. ERROR ANALYSIS C. ERROR ANALYSIS This section discusses the confusion matrix, learned rep- resentation, and the interpretability of the best-performing model on the filtered dataset. The confusion matrix in this paper is redefined to align with the anomaly severity context, where the distance between true and predicted labels matters. If the predicted label is lower than the true label, we define it False Positive (FP). Conversely, if the true label is lower than the",0.0,0.0,0.0,0.25
"each scenario. FIGURE 14. The number of misclassified samples from the best-performing model on each loss function tested on the unfiltered dataset. In a binary setting, let the Normal class be positive and the Anomaly is negative. Then, False Positive (FP) refers to samples with a true label negative but predicted as positive. At the same time, a False Negative (FN) is a case when a sample belongs to a positive class but is predicted as negative. However, in this study, we define the misclassification cases differently: • False Positive refers to a case when the true class is higher than the predicted class. • False Negative is a misclassification case where the true class is lower than the predicted","As defined in the context of anomaly severity detection, a False Positive occurs when the predicted label is lower than the true label, while a False Negative is when the true label is lower than the predicted label (Silahi et al., 2025).","['score of each token. This helps investigate cross-entropy loss can be computed using the following the significant words or phrases in the input samples when equation: makingpredictions. |C| LC¯E =− X λ ·y ·log(yˆ ) (7) i i i B. LEARNINGFROMIMBALANCEDDATASET i=1 The performance of a neural-based model highly depends on the training dataset quality. Specifically, in the context Therefore, we include three class weights as a search space ofmulticlassclassification,iftheclassdistributionishighly in the experiment, i.e., uniform, balanced, and inverse [50]. imbalanced,themodeltendstolearnfromthemajorityclass Uniform refers to equal weight, while balanced and inverse VOLUME13,2025 105367 S.Silalahietal.:InterpretableOrdinal-AwareWithContrastive-EnhancedAnomalySeverityDetection each element in the target label vector represents one target class.Forthisreason,twolabelrepresentationsareproposed in this study, as depicted in Fig. 8d and 8e. The first vector element in the proposed schema is intended to represent a normal-anomaly detection task, with 0 representing normal and one representing anomaly. At the same time, 1 in the secondtothefourthelementsrepresentstheanomalyseverity level. Note that the representation'
 'in the second to the fourth elements. the model to learn from the hard-to-classify examples by In the Multitask-101 schema, we turn the respective bit on penalising the predicted probability with low confidence as the level goes higher without turning the lower-level bit scores[37].Focallosscanbecomputedusingthefollowing representation off. It aligns with the data characteristics, equation: where samples of higher severity levels share common features with samples of lower severity levels. This label |C| Lfocal =− X λ ·(1−yˆ ) γ ·log(yˆ ) (10) schema is designed to mimic joint prediction of two tasks, i i i i.e.,anomalydetectionandanomalyseverityprediction. i=1 Training a neural model using a multitask learning where λ is the class weight, and γ is a hyperparameter to paradigm aims to minimise the loss between the predicted reducetherelativelossofpredictionwithahighprobability probabilityofeachtargetvectorelementandthetruthlabel. score and does the opposite for prediction with a low Since each target vector represents a single task, it equals confidencescore. performing multiple'
 'section discusses the confusion matrix, learned representation, and the interpretability of the best-performing FIGURE10. Thedistributionofthebestepochfromeachlossfunction. model on the filtered dataset. The confusion matrix in this Loglosstendstorequiremoreepochscomparedtocross-entropyand focalloss. paperisredefinedtoalignwiththeanomalyseveritycontext, wherethedistancebetweentrueandpredictedlabelsmatters. If the predicted label is lower than the true label, we define it False Positive (FP). Conversely, if the true label is lower than the predicted label, we define it False Negative (FN). In this context, having less FP is more important than having less FN, as the task objective is anomaly severity detection, where we aim to detect all abnormalities along withtheseveritylevel.Therefore,undetectedabnormalities, or detecting higher severity as lower ones, indicate that the model fails to meet the task’s objectives. Fig 14 shows the comparison of the confusion matrix between experimented scenariosandabaselinefrompreviouswork[9].Thefigure shows that the proposed Multitask-111 scenario achieves betterperformance,wheretwoLowsamplesarepredictedas Normal. Furthermore, we analyse the learned representation of the filtered dataset from the best-performing model. This analysis aims to investigate whether'
 'schema is intended to represent a normal-anomaly detection task, with 0 representing normal and one representing anomaly. At the same time, 1 in the secondtothefourthelementsrepresentstheanomalyseverity level. Note that the representation of samples belonging to FIGURE7. Poolingmechanismusedtogetthemessage’sfinalhidden thenormalclassisallzeros.Thisisintendedtomaximizethe statesrepresentationalvectorbeforeenteringthefinallinearclassifier separationbetweenthenormalandanomalyclasses,asshown layer.Alltheembeddingvectorsareusedasfeatures. inTable3. arecomputedusingthefollowingequations: TABLE3. Hammingdistanceandlogloss(ϵ=1e−15)valuesbetween NormalandHighclassesunderdifferentlabelrepresentationschemes. |M| λbal = (8) c |C|·|M | c (cid:18)|M |(cid:19)−1 λinv = c (9) c |M| where |M| is number of samples in the dataset, |C| is the number of target class, and |M | is the number of samples c belongingtoclasscwithM ∈M. In the Multitask-101 schema, the first vector element c Asanalternativewaytodealwiththeimbalanceproblem, functions the same as in the Multitask-101 schema. The we replace the cross-entropy with the focal loss to force main difference lies in the second to the fourth elements. the model to learn from the hard-to-classify examples by In the Multitask-101 schema, we turn the respective bit on penalising the predicted probability'
 'index, especially at time increases. depth 7. We realize that at depth = 5, the Gini index can get relatively good classification results. However, it is achieved In the future, we will implement outlier detection before because the process is still infinite, which means that the the feature selection stage. It aims to speed up the running time tentative feature still has an opportunity to be rejected at the and simplify the calculations of feature selection. It is because the anomalous data should be eliminated. maximum iteration. Authorized licensed use limited to: Institut Teknologi Sepuluh Nopember. Downloaded on July 14,2025 at 08:22:54 UTC from IEEE Xplore. Restrictions apply. 2020 International Conference on Smart Technology and Applications (ICoSTA) REFERENCES [10] I. S. Thaseen and C. A. Kumar, “Intrusion detection model using fusion of chi-square feature selection and multi class SVM,” J. King Saud [1] M. Małowidzki, P. Berezinski, and M. Mazur,']","we further analyse the effect of increasing the prediction threshold upon inferring the label. As the threshold value is closer to 1, a notable decrease can be seen in Fig. 13b, starting from 0.94. Conversely, the unfiltered dataset in Fig 13a shows a negligible decrease. C. ERROR ANALYSIS C. ERROR ANALYSIS This section discusses the confusion matrix, learned rep- resentation, and the interpretability of the best-performing model on the filtered dataset. The confusion matrix in this paper is redefined to align with the anomaly severity context, where the distance between true and predicted labels matters. If the predicted label is lower than the true label, we define it False Positive (FP). Conversely, if the true label is lower than the",0.6666666666666666,0.8173040994634376,0.8333333332916666,0.6666666666666666
"study, we define the misclassification cases differently: • False Positive refers to a case when the true class is higher than the predicted class. • False Negative is a misclassification case where the true class is lower than the predicted class. Table 7 shows the position of FP and FN based on the above definition in a multiclass confusion matrix. VOLUME 12, 2024 64263 S. Silalahi et al.: Severity-Oriented Multiclass Drone Flight Logs Anomaly Detection FIGURE 15. A 2D visualisation of the filtered dataset representation obtained from the best model from each loss function tested on the filtered dataset. t-SNE is used to reduce the dimension of the embeddings. In an anomaly detection setting, FP is more important than FN","As noted by Silalahi et al. (2024), in the context of anomaly severity detection, a False Positive is defined as a case where the predicted class is lower than the true class, while a False Negative occurs when the predicted class is higher than the true class.","['detection can be used and extended the High severity. As depicted in Fig 18, the highlighted to multiclass anomaly detection while exploiting the shared words align more with the attribution label, supported by high- and low-level features within the log messages that seven out of eight examples belonging to the High severity belong to different severity levels. Therefore, the forensic having positive attribution scores. The model perceives the investigator can better pinpoint and prioritise the anomalies log messages better than the previous BERT-based model. to focus on critical findings. The proposed embedding, Thecompletereportofattributionstowardeachseveritylabel DroneSBERT, improved the trustworthiness of the model, canbeaccessedontherepo. asevidencedbytheword’simportancereport. Despite the promising results, the model’s generality VI. CONCLUSION remains untested as the training dataset contains only log This paper investigates utilising a multitask learning messages acquired from 82 drone models, mostly from paradigmtoperformmulticlassanomalydetectionondrone DJI. This is one of the main challenges in drone forensics flight log messages.'
 'in a multi-class classification setting, arenotmutuallyexclusive,itmeansthatinstancesbelonging a supervised model is prone to class imbalance problems, todifferentcategoriessharecommonfeatures[17].Asshown wheretheclasscompositioninthedatasetisdisproportionate. inTable1,eachloggroupsharesacommonwordorphrase, To deal with this situation, a study proposed an ensemble making the samples from different severity levels mutually VOLUME13,2025 105363 S.Silalahietal.:InterpretableOrdinal-AwareWithContrastive-EnhancedAnomalySeverityDetection approach is presented in Section III. The experimental settingsandprocedurearedescribedinSectionIV,whilethe results,findings,anddiscussionsareelaboratedinSectionV. Finally,weconcludethepaperinSectionVI. II. RELATEDWORKS A. LOG-BASEDANOMALYDETECTION Log-based anomaly detection is relatively well-studied, includingincorporatingML[1]anddeeplearning-based[18], [19] to facilitate log anomaly detection. Existing anomaly detection modelling techniques can be conducted either in a point, contextual, or collective setting. Point anomaly FIGURE4. Anillustrationofanomaliesthatoccurduringadrone’sflight. detectioncharacteriseseachlogentry,whetheraneventisan abnormalityoranormalevent.Forinstance,ifausertypesthe wrong password when trying to gain access to an operating inclusive. Therefore, this paper proposes a multitask-based systemprompt,thegeneratedlogmessagecanbeconsidered multiclass drone anomaly detection to assist in a forensic as an anomaly [7], [20], [21]. As for contextual anomaly, investigation. The main contributions of this paper are the detection involves analysing some contextually related summarizedasfollows: attributes to determine whether a log entry is'
 'orphrases. setting, analysing a large number of log entries resulting from binary anomaly detection is considered inefficient and labour-intensive as the detection is performed on the C. SCOPEANDCONTRIBUTIONS acquired evidence at one time [12]. Therefore, too many Performing multiclass classification typically encodes the detected anomalies need to be detailed into a more fine- labelrepresentationinaone-hotencodingvector,whereeach grained detection to help the investigator better prioritise vector element represents a certain class. One-hot encoding the analysis objective. As a result, this study extends the relies on the assumption that the input data are mutually binary anomaly detection to multi-class anomaly detection, exclusive, where the characteristics of the data between asexemplifiedbyanotherdomainapplicationsuchasplane classes are distinctive. However, this case does not always flightdata[13],imagedata[14],andinternetofvehicle[15]. holdincertaindomains.Whenthedatafromdifferentclasses As a consequence, in a multi-class classification setting, arenotmutuallyexclusive,itmeansthatinstancesbelonging a supervised model is prone to class imbalance problems, todifferentcategoriessharecommonfeatures[17].Asshown wheretheclasscompositioninthedatasetisdisproportionate. inTable1,eachloggroupsharesacommonwordorphrase, To deal with this situation, a study proposed an ensemble making the'
 'This paper investigates utilising a multitask learning messages acquired from 82 drone models, mostly from paradigmtoperformmulticlassanomalydetectionondrone DJI. This is one of the main challenges in drone forensics flight log messages. Aligning to the nature of multitask research, where human-readable flight log datasets from learning,weproposetwotargetlabelrepresentations,namely other drone models are unavailable. In the future, we plan Multitask-101 and Multitask-111. The integrated gradient toexploretheflightlogsofotherdronemodelstotrainmore is employed to interpret the model’s behavior. During the generalanomalydetectionmodels.Asforthemethod,multiinterpretabilityanalysis,wefoundthattheembeddingvectors objective learning that employs multiple loss functions to fromBERTdonotalignwiththedomain,makinguspropose trainananomalydetectionmodelwillbeexplored. DroneSBERT embedding to refine the semantic features. Anextensivehyperparametertuningisperformedtofindthe bestconfigurationforeachencodertype.Afterexperimenting DATAAVAILABILITY with all the resulting model configurations, the proposed The dataset used in the experiment is available upon a label schemas achieved the highest accuracy and improved reasonablerequest.Thecodefortheexperiment,theresulting thebaselinesandstate-of-the-artmodels’performancetested performance evaluation, the scripts for data analysis, and on filtered and unfiltered datasets. As an alternative to the figures in this paper are made publicly available on handle class imbalance, Focal'
 'section discusses the confusion matrix, learned representation, and the interpretability of the best-performing FIGURE10. Thedistributionofthebestepochfromeachlossfunction. model on the filtered dataset. The confusion matrix in this Loglosstendstorequiremoreepochscomparedtocross-entropyand focalloss. paperisredefinedtoalignwiththeanomalyseveritycontext, wherethedistancebetweentrueandpredictedlabelsmatters. If the predicted label is lower than the true label, we define it False Positive (FP). Conversely, if the true label is lower than the predicted label, we define it False Negative (FN). In this context, having less FP is more important than having less FN, as the task objective is anomaly severity detection, where we aim to detect all abnormalities along withtheseveritylevel.Therefore,undetectedabnormalities, or detecting higher severity as lower ones, indicate that the model fails to meet the task’s objectives. Fig 14 shows the comparison of the confusion matrix between experimented scenariosandabaselinefrompreviouswork[9].Thefigure shows that the proposed Multitask-111 scenario achieves betterperformance,wheretwoLowsamplesarepredictedas Normal. Furthermore, we analyse the learned representation of the filtered dataset from the best-performing model. This analysis aims to investigate whether']","be employed to force the model to learn a distinctive representation of the positive FIGURE 4. An illustration of anomalies that occur during a drone’s flight. inclusive. Therefore, this paper proposes a multitask-based multiclass drone anomaly detection to assist in a forensic investigation. The main contributions of this paper are summarized as follows: 1) We propose DroneLog, an interpretable sentiment- based multiclass drone flight log anomaly detection framework that includes three anomaly severity levels: low, medium, and high. Providing the severity level can provide better detection results for the investigator to pinpoint the event of interest. Interpretability makes training and testing more transparent, the model trustworthy, and human-friendly. 2) We propose DroneSBERT,1 a domain-specific embed- ding to extract semantic features",0.6666666666666666,0.8586085261277174,0.0,0.3333333333333333
"the performance of the proposed framework has been discussed and analysed. In this section, challenges encountered during the study are disclosed, along with limitations and threats to validity. As drone forensics is an emerging topic, there are very limited public datasets available. The log messages used in this study are mainly acquired from DJI-made devices. There is yet to come a publicly available dataset of log messages from other drone manufacturers. Several publicly available datasets are mainly about sensor data and multimedia artefacts . While in this study, we solely depend on the human-readable messages generated by the drone during a flight. Given the condition where a small number of unique messages and most of them are acquired from DJI","As noted in the study by Silalahi et al. (2023), the proposed Transformer method effectively classifies drone malfunctions using telemetry data, which is crucial given the limited datasets available for drone forensics.","['verification. An analysis of a Thestructureofthispaperisasfollows.SectionIIpresents drone’sarchitectureandaforensicmodelwithgenericfeatures previous research relating to the drone log analysis and drone are proposed here in order to enhance the digital investigation forensics. Section III explains the proposed method, applying process. Also, Barton et al. [11] conducted the research to the Transformer technique to forensics of drone malfunctions. reconstruct the actions taken by these drones, identify their InSectionIV,thediscussionofperformancemethod,followed owners or operators, and extract data from associated mobile by conclusions and future works in Section V. devices. In other research in drone forensics, this paper also analyze II. PREVIOUSWORK data flash and telemetry logs from assembled drones. Mantas and Patsakis [12] analyze dataflash and telemetry logs from A. Drone Log Analysis open source for assembled drones called ”Ardupilot”. The Researchers have conducted investigation on drone engine resultoftheresearchistofindthemethodologyforcollecting failure using drone logs. Although not specific to the use the necessary information, analyzing it, and constructing the of'
 'which is often collected over investigation. This analysis can help investigators identify the extended periods. root cause of the incident, establish timelines, and identify Another advantage of Transformer model is their ability potential witnesses [2]. to generalize well to unseen data, thanks to their ability to For example, in the case of a drone crash, the analysis of capture complex relationships in the input data. This makes the drone logs could reveal critical information such as the them suitable for use in real-world applications where the altitude and speed of the drone, the battery level at the time datasetmaybelimited,andthemodelneedstomakeaccurate of the crash, and the location of the drone at the time of the predictions on unseen data [5]. incident. This information could help investigators determine ThispaperproposestheTransformermethodforclassifying whether the crash was due to a malfunction, operator error, drone malfunctions based on telemetry data. By leveraging or external factors such as weather'
 'can improve the forensics tool, the investigator will be able to easily analyze the drone performance, and analyse the drone’s malfunction when it accident. flies.Thedetailofthemethodcanbedescribedinthefollowin subsections. B. Drone Forensics Drone forensics is a technique to get, collect, and analyze A. Data Preprocessing the data stored in drones to determine the cause of drone The dataset for the experiment and its preprocessing stage incidents. Research has been done to solve various problems to satisfy the needs in drone forensics can be explained as arising and improve the performance. Al-Dahqm et al. [9] follows. Once the drone log data downloaded from the Airlab proposedaforensicframeworkfordrone.Themethodsupports [13], we select features into those that only have a value of the majority of drone types on the market. The developed CPU, network sensor, gyroscope sensor, altitude sensor, and framework has three phases. In the preparatory phase, the GPS sensor. Firstly, we write a script that drops'
 'MavicAirdronemodel.Inordertogathertheevidenceand droneforensicdomain.Tothebestofourknowledge, explain the successfully collected data, various techniques there is no publicly available NER dataset for drone are used, which may aid the investigation process. Several forensic problems yet. We identify and propose six similarstudiesweredoneonotherdronemodels,suchasthe entitytypesasthetagsetintheannotationprocess.The Yuneec Typhoon model [12], DJI Spark [26], and the DJI proposedmodelachievesacompetitivescorecompared Phantom [27]. According to those case studies, the drone’s to the state-of-the-art methods, with a 91.146% F1 controllerdevicesstoredvaluabledatathatcanbecompared score. Yet, one of the scenarios achieves high perfortotheotherartifactsenablingacorrelationstudybetweenthe mance,witha91.348%F1score. UAV and the mobile application used to control the drone. 2) This work showcases how to utilize specific evidence Some studies also suggest a technical procedure for drone datatoperformforensicinformationextractiontoassist forensic inquiry. In order to perform an end-to-end analysis aforensicinvestigation,includingasimpleframework from the preparation to the reporting of the findings, ten fordataextractionandannotation. proceduresproposedbySalamhetal.[12]mustbefollowed. 3) WeproposeandinvestigatecosinesimilarityasasubAnalyzing the encrypted files is one of the obstacles in stitutive of dot-product in the self-attention sub-layer the data collection phase. For'
 'images are acquired from log data. We found it in the flight log data. Then, we try the controller devices, which are considered the primary to find all the locations of flight log data in all directories evidence close to the owner and contain incident-related of every drone image we have downloaded and extracted. information[58].Afterexploringthedroneimageswiththe Unfortunately,wedidnotfindtheexpecteddatafromYuneec 4https://www.autopsy.com/ 3https://www.vtolabs.com/drone-forensics 5https://www.phantomhelp.com/LogViewer/upload/ 3266 VOLUME11,2023 S.Silalahietal.:Transformer-BasedNERonDroneFlightLogstoSupportForensicInvestigation FIGURE7. DifferencebetweenIOB2andBIOESannotationschemeforthesamelogmessage.Thelabelsareassignedusingthecontextualtagging procedure. TABLE1. Numberofextractedmessagesfromeverydronemodel. referstoassigningalabeltoawordbyonlyconsideringthe tokenandignoringthecontextwithinthesentence.Contrary, contextualtaggingassignsalabeltoeachwordinasentence byconsideringthepresentcontext.Thefollowingareseveral criteriafortheannotationprocessoneachentitytype. A ‘‘Component’’ label will be assigned to a span that indicates drone components, such as motors, sensors, and batteries. If the span is indicating of an action taken by the drone, then it will be assigned the ‘‘Action’’ label. The ‘‘parameter’’ label is assigned to the span, which indicates somevariablesstoredinthedrone,suchasmaximumflight distance, maximum flight altitude, and battery temperature. Every drone type has features or functions supporting the taskgiventoit.Someexampleofspanindicatesfunctionis obstacle avoidance, obstacle sensing, and remote controller settings.Thistypeofspanisassignedthe‘‘Function’’label. Some spans indicate']","a scenario design, data generation and acquisi- tion, data analysis, and ﬁnally, reporting. Several references are using DJI , , , Cheerson , Parrot , and Yuneec model as experimental devices. However, there is no attempt to utilize speciﬁc data, in this case, the log message, to perform a drone forensic investigation. For this reason, we propose a deep learning-based Natural Language Processing (NLP) technique to perform information extrac- tion from the log message to assist the forensic investigation process. Information Extraction (IE) is one of the sub-topic in the NLP research domain, which aims to infer knowledge from a lake of text data. There are several steps in performing information extraction; after data source collection and pre- processing, Named",0.2,0.7642441261656562,0.249999999975,0.3333333333333333
"the model can be convincing and accountable enough to the investigator to be included in the investigation report. VII. CONCLUSION AND FUTURE WORK VII. CONCLUSION AND FUTURE WORK In this paper, we demonstrate how to train a log-based anomaly detection model that can prioritise the prediction of higher severity anomalies on drone flight logs while increasing the prediction confidence score at the same time. Considering the nature of the dataset, where samples that belong to different severity levels share common features, a multitask vector label representation along with severity-oriented decoding is proposed. An extensive experiment proved that the proposed approach is better than the previous work baselines while being inferior to our baseline scenario based on the accuracy and F1","The proposed model demonstrates improved trustworthiness and interpretability in detecting anomalies of varying severity levels in drone flight logs (Silalah et al., 2025).","['detection can be used and extended the High severity. As depicted in Fig 18, the highlighted to multiclass anomaly detection while exploiting the shared words align more with the attribution label, supported by high- and low-level features within the log messages that seven out of eight examples belonging to the High severity belong to different severity levels. Therefore, the forensic having positive attribution scores. The model perceives the investigator can better pinpoint and prioritise the anomalies log messages better than the previous BERT-based model. to focus on critical findings. The proposed embedding, Thecompletereportofattributionstowardeachseveritylabel DroneSBERT, improved the trustworthiness of the model, canbeaccessedontherepo. asevidencedbytheword’simportancereport. Despite the promising results, the model’s generality VI. CONCLUSION remains untested as the training dataset contains only log This paper investigates utilising a multitask learning messages acquired from 82 drone models, mostly from paradigmtoperformmulticlassanomalydetectionondrone DJI. This is one of the main challenges in drone forensics flight log messages.'
 'code publicly available on the options to reduce the noise. Another approach is to a GitHub repository2 to promote reproducible and employacontextualembedding,suchasBERT[25],thatcan verifiableresearch. capture the semantics of the log messages [26]. However, The remaining part of this paper is structured as follows: the resulting representational vectors can be closer to one SectionIIdiscussesrecentrelatedapproaches.Theproposed another since log records commonly share the same words. 1https://huggingface.co/swardiantara/drone-severity-embedding Therefore, a contrastive loss can be employed to force the 2https://github.com/swardiantara/DroneLog.git model to learn a distinctive representation of the positive 105364 VOLUME13,2025 S.Silalahietal.:InterpretableOrdinal-AwareWithContrastive-EnhancedAnomalySeverityDetection and negative samples [27]. In this paper, instead of using on the model performance and pay less attention to the contrastive loss, we augment a multitask learning paradigm explainabilityaspect.Therefore,astudyby[36]proposedan by proposing two soft label representations to exploit the explainablesentimentanalysisapproachusingaTransformer sharedlow-levelfeaturesamongtheinputlogmessages. encoder for anomaly detection. A similar study exploits Performing anomaly detection using a sequence-based theabundanceofpre-trainedtransformermodelstoperform approach is commonly conducted by training RNN-based anomalydetectionbyusingsentimentanalysisondroneflight models using'
 'investigation, such as sentiment In fact, a flight log not only contains sensor data and analysis-based anomaly detection using Large Language component status, as illustrated in Fig 2, but also human- Models (LLM) [6]. Sentiment analysis-based log anomaly readablemessagesdescribingtheoccurringeventsduringthe detection was firstly introduced in [7], which rely on an operation of a drone. This file stores all information during assumptionthat,logmessagesthatcontainwordsorphrases aflight,suchasflighttimestamps,flightparameters,sensor with negative connotations considered anomalies. Another data, components’ status, and flight mode. The last three recent study employs sentence embedding to extract the columns contain human-readable messages: APP.message, semantic features from log messages, and utilize various APP.tip, and APP.warning, which is the source of the machine learning (ML) models to classify anomaly severevidence used in this paper. Sample messages can be seen ity[8].Themostrecentstudyemploysamultitasklearningin Table 1. From the table, it can be seen that samples in based solution to solve a mutually inclusive dataset [9]. thesamegroupsharecommonwordsyetbelongtodifferent The study relies on'
 'Received14May2025,accepted8June2025,dateofpublication17June2025,dateofcurrentversion24June2025. DigitalObjectIdentifier10.1109/ACCESS.2025.3580056 Interpretable Ordinal-Aware With Contrastive-Enhanced Anomaly Severity Detection on UAV Flight Log Messages SWARDIANTARASILALAHI 1,(GraduateStudentMember,IEEE), TOHARIAHMAD 1,(Member,IEEE),HUDANSTUDIAWAN 1,(Member,IEEE), EIRINIANTHI 2,ANDLOWRIWILLIAMS 2 1DepartmentofInformatics,InstitutTeknologiSepuluhNopember,Surabaya60111,Indonesia 2SchoolofComputerScienceandInformatics,CardiffUniversity,CF244AGCardiff,U.K. Correspondingauthor:HudanStudiawan(hudan@its.ac.id) ThisworkwassupportedinpartbytheDepartmentResearchFundoftheInstitutTeknologiSepuluhNopember(ITS);andinpartbythe PendidikanMagisterMenujuDoktorUntukSarjanaUnggul(PMDSU)ScholarshipfromtheMinistryofEducation,Culture,Researchand Technology,Indonesia. ABSTRACT Detectingabnormalitiesinasystemusinglogrecordsisacommonapproach,althoughsuch applications may vary between different deployment domains. For example, in drone forensics, existing studiesgenerallyconsideranomaliesascontradictorytonormalevents.Inotherwords,alltypesofanomalies are considered equally important. However, the peculiar events experienced by a drone during a flight might contain distinct features indicating the anomalies’ importance or level of urgency. For instance, the message ‘‘Critically low power. Aircraft is landing’’ is more important than ‘‘Forward Obstacle Sensing notWorking’’.ThisstudyproposesDroneLog,aninterpretableframeworkfordetectinganomaliesandthe severity levels on drone flight logs, using a multitask learning approach in a unified pipeline. Complying withthemultitasklearningnature,twotargetlabelrepresentationsaredesignedtoleveragethesharedlowlevelcommonfeaturesoftheinputmessagesovervariousseveritylevels.Anextensiveexperimentwitha significant hyperparameter search space is performed to find the best-performing model to compare with several baselines and state-of-the-art methods from previous studies. The integrated gradient is employed to investigate the best-performing model’s trustworthiness and interpretability. We found that the model perceived the log messages’'
 '[20], [21]. As for contextual anomaly, investigation. The main contributions of this paper are the detection involves analysing some contextually related summarizedasfollows: attributes to determine whether a log entry is an anomaly. 1) We propose DroneLog, an interpretable sentimentAs an example, the flight path taken by a drone during a based multiclass drone flight log anomaly detection flightisrecordedinlongitudeandlatitudecoordinates.These frameworkthatincludesthreeanomalyseveritylevels: datacanbeusedtodetectananomalybyfindingapeculiar low,medium,andhigh.Providingtheseveritylevelcan valuewithinthelogrecordsbycontrastingthenormalvalues provide better detection results for the investigator to toabnormalvaluesusingacertainthreshold[11].Uniqueto pinpoint the event of interest. Interpretability makes theprevioustwoapproaches,collectiveanomalyestablishes the model training and testing more transparent, anomaly criteria basedon a set of instancesassociatedwith trustworthy,andhuman-friendly. eachother,distinctfromtheoveralldata.Statisticalanomaly 2) WeproposeDroneSBERT,1 adomain-specificembeddetectionisoneofthecommoncasesforthistypeofanomaly dingtoextractsemanticfeaturesthatarewell-aligned detection. to the human perception of the log message samples. Another case scenario in log-based anomaly detection Supervised contrastive learning is employed to learn is a sequence-based approach, where an abnormality is distinctrepresentationsforeachanomalyseveritylevel. determined by analysing a group of events that occur 3) Weexploretwotargetlabelrepresentationstoaugment sequentially within a certain window size [22].']","severity level can provide better detection results for the investigator to pinpoint the event of interest. Interpretability makes training and testing more transparent, the model trustworthy, and human-friendly. 2) We propose DroneSBERT,1 a domain-specific embed- ding to extract semantic features that are well-aligned to the human perception of the log message samples. Supervised contrastive learning is employed to learn distinct representations for each anomaly severity level. 3) We explore two target label representations to augment a multitask learning paradigm for training multiclass classification models. Aligning to the dataset character- istics where the log messages from different anomaly severity levels share common words and phrases, multitask learning can help the model make use of the shared low-level features in the log",1.0,0.8429036494603371,0.99999999998,1.0
"ANALYSIS We conducted a controlled experiment to evaluate the influence of various word embedding methods on our model’s performance. We used different word embedding techniques, explicitly using fastText as an alternative method to provide comparative performance data for the architecture with different word embedding inputs. This experiment used 540k sentence pairs and maintained the same settings as the previous experiments. This experi- ment compared the results obtained in a previous experiment using the Glove word embedding technique. The performance comparison of the model using different word embedding techniques is shown in Table 4. As seen in 4, our model performs better with Glove word embedding than FastText. Glove’s advantages align with the findings of , which state that the Glove","As noted in the study by Rosidi et al. (2024), FastText and GloVe are both prominent word embedding techniques, with GloVe often outperforming FastText in various contexts.","['impacted NLP research recently. The main NER since mentioned entities commonly consist of a few advantageofcontextualoverstaticpre-trainedwordembedwords only [37]. Thus we experiment with every attention ding is the ability to generate a unique representational type with the scaled and unscaled scenario in the encoder vector of a word for each distinct context within two or layer, including the AdaTrans encoder. The employment of moredifferentsentences.Inthisexperiment,thesetwotypes CRF can undoubtedly improve the performance of a NER of pre-trained word embeddings were employed. From the 3270 VOLUME11,2023 S.Silalahietal.:Transformer-BasedNERonDroneFlightLogstoSupportForensicInvestigation FIGURE9. Messagelengthdistributioninthedataset. FIGURE11. Convergencespeedofthebestmodelforeachencoderon thetrainsetofthecontextualdataset. showaninsignificanteffectofusingdifferentcharacter-level embeddingonthemodels’performance. Thescalefactorimplementedinscaleddot-productattention,asproposedinthevanillaTransformer,hasbeenargued better not be used in the NER task [37]. The reason is to sharpen the probability distribution yielded by the softmax in the self-attention mechanism. The sharper the attention, the fewer contexts are captured by the attention, aligning to the span length of mentioned entities commonly exist [37]. However, the experimental results in Table 8 and 9 show a'
 'and testing them on the filtered findings, embedding plays a significant role in performing and unfiltered datasets, the results are reported in Table 9. the prediction. Therefore, we further explore the effect of Inthetable,thereportedscoreofourproposedframework’s improving the embedding by training a domain-specific performanceistakenfromthebest-performingconfiguration embedding. asshowninTable7andTable8.Itcanbeseenfromthescores One main challenge in this paper is the samples from shown in Table 9 that Neurallog consistently outperforms different classes are mutually inclusive. For this reason, theotherbaselinesonbothdatasets.However,ourproposed we train a sentence embedding [59] model named DroneSapproachoutperformsallthebaselinessignificantlytestedon BERT with the help of contrastive learning to learn distinct thefiltereddataset,witha2.564%improvementinaccuracy representationsofsamplesfromdifferentclasses[60].Itcan than Neurallog. While for the unfiltered dataset, Dronelog beachievedbytraininganeuralmodeltomaximizethecosine outperformsallthebaselineswitha0.446%improvementin distance between negative pairs and minimize the cosine accuracycomparedtoNeurallog. distancebetweenthepositivepairsatthesametime[61].For Considering the underlying encoder type used in the that reason, the pre-training dataset P = {(m ,m ,y)}|P| , 1 2 i i=1 baseline approaches, Table 9 presents the performance of is prepared by constructing positive and negative'
 'input layer is crucial in converting the and describing each subword as a vector. Furthermore, the 137068 VOLUME12,2024 M.A.Rosidetal.:SarcasmDetectioninIndonesian-EnglishCode-MixedText FIGURE2. ArchitectureoftheMHA-CovBimodelforsarcasmdetection. representation of a word is obtained by summing up the This study presents a word embedding selection stratvectors of its constituent subwords. The process of build- egy to deal with code-mixed tweets posted by Indonesian ing Word representations in FastText are done using neural usersonTwitter.FastTextofferswordvectorrepresentations network techniques, utilizing the skip-gram model of the for 157 different languages. This study used FastText word word2vec algorithm. However, FastText incorporates some embedding with 300 dimensions to represent Indonesian specialstrategies,suchashierarchicalsoftmaxandnegative words, while GloVe word embedding with 300 dimensions sampling,tooptimizeperformanceingeneratingwordrepre- was used to represent English words. This formed the basis sentations[40].TheFastTextmodeltrainedonanIndonesian ofthewordembeddingselectionstrategy.Theinitialstepin corpuswasusedinthisstudytogenerateavectorrepresenta- thisprocedureinvolvesidentifyingthelanguageofeachword tionofIndonesianwordsbasedonpreviousresearch[20]that intheformoftokens.TheGloVepretrainedwordembedding showedthatFastTextproducedthebestresultsforIndonesian willbeusedifawordisclassifiedasEnglish. text. Ontheotherhand,ifthewordisidentifiedasIndonesian, On the other hand, the GloVe model constructs vector the pretrained Indonesian FastText word embedding will be representations of words within a corpus predicated'
 'embeddings using Siamese BERT-networks,’’ in Proc. Conf. Empirical Methods Natural Lang. Process. 9th Int. Joint Conf. Natural Lang. Process. (EMNLP-IJCNLP). Stroudsburg, PA, USA: Association for Computational Linguistics, 2019, pp.3982–3992. [Online]. Available: https://aclanthology.org/D19-1410 [53] S. Xiao, Z. Liu, P. Zhang, N. Muennighoff, D. Lian, and J.-Y. Nie, ‘‘C-pack: Packed resources for general Chinese embeddings,’’ in Proc. 47thInt.ACMSIGIRConf.Res.Develop.Inf.Retr.,Jul.2024,pp.641–649, doi:10.1145/3626772.3657878. [54] N. Kokhlikyan, V. Miglani, M. Martin, E. Wang, B. Alsallakh, RATIHNURESTIANGGRAINI(Member,IEEE) J. Reynolds, A. Melnikov, N. Kliushkina, C. Araya, S. Yan, and received the Ph.D. degree in engineering mathO.Reblitz-Richardson, ‘‘Captum: A unified and generic model interematics from the University of Bristol, in 2021. pretabilitylibraryforPyTorch,’’2020,arXiv:2009.07896. She is currently a Lecturer with the Informatics [55] M.Sundararajan,A.Taly,andQ.Yan,‘‘Axiomaticattributionfordeep Department, Institut Teknologi Sepuluh Nopemnetworks,’’inProc.Int.Conf.Mach.Learn.,vol.70,2017,pp.3319–3328. ber(ITS),Indonesia.Herresearchinterestsinclude [56] M. Lewis, Y. Liu, N. Goyal, M. Ghazvininejad, A. Mohamed, text mining, artificial intelligence, and software O. Levy, V. Stoyanov, and L. Zettlemoyer, ‘‘BART: Denoising engineering. sequence-to-sequence pre-training for natural language'
 'highlighted a bold font. The presented scores in the tables TP+FN + ε containboth proposedandbaselinemodels. Eachtablerep2×(pre×rec) F1 = (24) resents a scenario that is grouped based on the character pre+rec + ε embedding used, as Table 4 shows the models employing pre = (cid:80)C c=1 TP c (25) AdaTransforextractingcharacterembedding.Subsequently, micro (cid:80)C TP +(cid:80)C FP +ε Table5and6showthemodels’architecturewhereLSTMand c=1 c c=1 c (cid:80)C TP CNNwereusedasthecharacterembedding,respectively. rec = c=1 c (26) From the evaluation score presented in Table 4 to 6, the micro (cid:80)C TP +(cid:80)C FN +ε c=1 c c=1 c bestperformancewasachievedbyGloVe–ScaledAdaTrans F1 = (1+β)×pre micro ×rec micro (27) combination with an 87.771% F1 score. AdaTrans attenmicro β×pre ×rec +ε tion consistently achieves the highest score for all character micro micro embeddingandwordembeddingoptions.GloVeoutperforms theBERTembeddingevaluatedonthenon-contextualdataset C. RESULTSONDIFFERENTANNOTATIONRULES for all scenarios. This is because the first dataset has conThissubsectionpresentsallthepossiblearrangementsfrom sistent tagging, meaning that a word has a consistent tag the available options of character embedding,']","6 show the models’ architecture where LSTM and CNN were used as the character embedding, respectively. From the evaluation score presented in Table 4 to 6, the best performance was achieved by GloVe – Scaled AdaTrans combination with an 87.771% F1 score. AdaTrans atten- tion consistently achieves the highest score for all character embedding and word embedding options. GloVe outperforms the BERT embedding evaluated on the non-contextual dataset for all scenarios. This is because the ﬁrst dataset has con- sistent tagging, meaning that a word has a consistent tag for all different contexts in the dataset. It complies with the GloVe behavior, where each word has exactly one representa- tional vector. BERT – Scaled Transformer achieved the best overall performance",0.0,0.6407002411901783,0.19999999998,0.8571428571428571
"research introduces a novel Activity Recom- mendation System built on the COBIT 2019 framework tailored for Financial Balance Scorecard. The motivation stems from the challenges faced by auditors when identifying essential activities aligned with strategy of a company, often hindered by manual COBIT 2019 guideline navigation. To address this, a system was developed, where inputting the company strategy, triggers the display of recommended activities automatically. The methodology involved creating interconnected nodes from COBIT 2019 Element in Neo4J. This research uses a real strategy plan case study from 3 different companies as input, followed by a preprocessing step, then compares it to Enterprise Goals using TF-IDF and cosine similarity. Goals with high similarity scores trigger a graph query to reveal connected","This research introduces a novel Activity Recommendation System built on the COBIT 2019 framework tailored for Financial Balance Scorecard, effectively suggesting activities aligned with enterprise goals (Jawad et al., 2023).","['structures. illustrated in Figure 5. Thisgraphicalrepresentationallowsuserstoeasilyvisualize activity recommendations without the need for additional documentationsuchasspreadsheets,therebyreducingtheneed for extra work. V. CONCLUSION This paper propose a novel recommendation system for internal business processes based on the COBIT 2019 framework.Byintegratinggraphalgorithmsandsimilaritymethods, Fig.2. MappingEnterpriseGoals(EG) our approach provides tailored activity recommendations that alignwithanorganization’sstrategicgoals.WemappedenterRevenue Growth, Cost Leadership Implementation, Organiza- prise goals to management objectives, identified relevant action Effectiveness and Group Synergy Reinforcement While tivities, and used graph queries to retrieve actionable insights. Focusing on High Standard of Safety and Customer-oriented UtilizingCypherQueryLanguage(CQL)andNeo4j’sgraph Services Delivered by Professional & Passionate Employees” database,we createdan interactivegraphical representationof The similarity results between the company goal and enter- COBIT2019-governedprocesses.Thisallowsorganizationsto prisegoaldescriptionsareshowninTableIII,calculatedusing visualize relationships between COBIT elements, facilitating Algorithm 2. deeper analysis, real-time monitoring, and informed IT manAfter identifying company goals with a similarity value agement decisions. greater than 50, these nodes are used as references for the Our results demonstrated the system’s effectiveness in sugnext graph'
 'manAfter identifying company goals with a similarity value agement decisions. greater than 50, these nodes are used as references for the Our results demonstrated the system’s effectiveness in sugnext graph query execution to obtain the required activities. gesting activities tailored to enterprise goals, enhancing IT The output matches the mapping results, displaying only management practices and operational efficiency. The Neo4j activities that correlate with Enterprise Goal EG02, which visualization tool offers a user-friendly interface for explordescribes ”Optimization of business process functionality.” ing COBIT framework relationships, enabling stakeholders to Using Algorithm 3, a graphical representation is created, as make data-driven decisions. Authorized licensed use limited to: Institut Teknologi Sepuluh Nopember. Downloaded on July 14,2025 at 08:22:06 UTC from IEEE Xplore. Restrictions apply. TABLEIII [4] M. M. Jawad, M. H. Ali, A. A. Khaleel, and M. F. SIMILARITYSCORE Hasan, “Evaluating the performance of it management undertheimplementationofthecobit2019framework,” Enterprise Goal (EG) Similarity Optimization of'
 'papers still rely on manual approaches to relationshipswithintheCOBITframework,facilitatinginformed COBIT 2019, which have limitations in providing automated decision-making.ThisresearchadvancesITgovernancepractices recommendationsforauditactivitiesbasedoncompanygoals. byprovidingorganizationswithavaluabletooltoautomateand improve IT strategies, effectively achieving business objectives. Thus,thisresearchcontributessignificantlybyaddressingthis IndexTerms—COBIT2019,graphalgorithms,ITgovernance, gap and overcoming the challenges associated with manual LSTM, Neo4j, recommendation system, regulatory compliance, COBIT utilization. semantic similarity, TF-IDF The primary objective of this paper is to develop a recommendation system that aligns with the internal business I. INTRODUCTION process strategy governed by COBIT 2019. This system aims COBIT 2019, which stands for Control Objectives for to help organizations manage risk, ensure compliance, and Information and Related Technologies, is a comprehensive enhanceperformanceinthecontextofinformationtechnology. framework developed by ISACA (Information Systems Audit To achieve this, the research will utilize graph algorithms to and Control Association) to assist organizations in managing buildarecommendationsystembasedontheinternalbusiness and optimizing their use of information technology (IT) [1]. processes outlined in COBIT 2019. In today’s rapidly evolving digital landscape, effective IT Mapping is'
 'edges to represent the relationships between tions for each Management Objective, as per CO- these entities. BIT 2019 guidelines. Algorithm1detailstheimplementationprocedureforcreating nodes and relationships in Neo4j. B. Preprocessing D. Recommendation System Data Cleaning and Transformation: Preprocess the collected data to ensure consistency and completeness. This The recommendation system leverages LSTM and TF-IDF involves: for similarity measurement and includes the following steps: 1) Removing duplicates and resolving inconsistencies. 1) User Input Processing: Receive and preprocess input 2) Transformingthedataintoaformatsuitableforintegra- from users in the form of enterprise strategy. tion with Neo4j. 2) Text Processing: Perform tokenization, stopword re3) Standardizing terminology and data formats. moval, and lemmatization to extract core terms. 3) TF-IDF Calculation: Calculate TF-IDF scores for the C. Neo4j Graph Database processed terms to identify their importance. Neo4jIntegration:Neo4jischosenforitsabilitytomanage 4) Similarity Measurement: Use LSTM to measure the complex relationships inherent in the COBIT framework. The similarity between user input and predefined goals. steps involved'
 'Python. The recomAlgorithm 3. mendation system is based on insights gained from the graph Table Format Display: Present the activity recommendations database analysis. It provides activity recommendations for in a table format for easy reference and analysis. The table users based on their specific requirements and objectives, will include detailed information about each recommended tailored to help organizations optimize their internal business activity, including its name, description, associated processes, processes according to COBIT 2019 guidelines. andpotentialbenefits.Thisformatwillallowuserstocompare To illustrate, we used an Indonesian airline company’s and evaluate different recommendations and select the ones goal: ”Strengthening Business Fundamental Through Strong Authorized licensed use limited to: Institut Teknologi Sepuluh Nopember. Downloaded on July 14,2025 at 08:22:06 UTC from IEEE Xplore. Restrictions apply. TABLEII MAPPINGFROMOBJECTIVETOACTIVITY Objective Activity Activity Description Get an understanding of the venture vision, heading, and methodology APO01 APO01.01 ACT01 as well as at that point current undertaking setting and challenges. Consider']","company goals by proposing a novel recommendation system for internal business processes, grounded in the COBIT 2019 framework. The system employs graph algorithms to map relationships, semantic similarity measure- ments to align enterprise goals with management objectives, and LSTM combined with TF-IDF methods to analyze and recommend specific activities. Experimental results show that this system optimizes IT management practices, enhances operational efficiency, and ensures regulatory compliance. Additionally, a user-friendly graphical representation of internal business pro- cesses using Neo4j enables stakeholders to visualize complex relationships within the COBIT framework, facilitating informed decision-making. This research advances IT governance practices by providing organizations with a valuable tool to automate and improve IT strategies, effectively achieving business objectives. Index Terms—COBIT 2019, graph algorithms, IT",0.6,0.774104691373464,0.99999999998,1.0
"management are vital for businesses in rapidly evolving landscape nowadays. Imple- menting an IT governance framework is crucial for several reasons. Firstly, it enables effective risk management against cyber threats, data breaches, and regulatory requirements, enhancing resilience and protecting sensitive data. Secondly, it ensures alignment between IT strategies and business ob- jectives, driving efficiency, innovation, and competitiveness. Lastly, it facilitates compliance with data privacy regulations and industry standards, ensuring transparency and accountabil- ity. Among these frameworks, COBIT is globally recognized for overseeing Enterprise Information and Technology (I&T) comprehensively, covering all systems regardless of their lo- cation within the organization. In essence, Enterprise I&T extends beyond the confines of the IT department and encompasses all facets of technology and information processing","The COBIT 2019 framework provides comprehensive guidance for establishing and monitoring necessary controls within an organization's IT environment, ensuring alignment with business objectives and enhancing risk management (Referensi 1).","[""holistic approach to evaluating and framework designed to assist organizations in managing and enhancing the effectiveness of an organization's information controlling information technology more effectively [1], [2]. systems [12]. Through the use of the COBIT 2019 framework, COBIT provides comprehensive guidance for identifying, auditors can pinpoint key controls necessary to achieve establishing, and monitoring the necessary controls within the predefined business objectives. Meanwhile, event log process IT environment to achieve defined business objectives [3], [4]. mining enables auditors to delve into the event log data In auditing systems with COBIT, auditors use COBIT generated by information systems to visually map process standards and principles to evaluate the maturity and flows. By combining these two approaches, auditors can effectiveness of internal controls within an organization's IT conduct in-depth analyses of system compliance with COBIT system [5]. This audit helps identify weaknesses and potential standards and identify noises from established procedures. risks,""
 'to assist organizations in managing buildarecommendationsystembasedontheinternalbusiness and optimizing their use of information technology (IT) [1]. processes outlined in COBIT 2019. In today’s rapidly evolving digital landscape, effective IT Mapping is a crucial aspect of COBIT 2019, as it involves governance is essential for organizations to ensure that their establishing relationships between various elements such as IT investments align with business objectives, comply with business objectives, IT processes, control needs, and technolregulations, and mitigate risks [2]. ogy resources [6]. This mapping ensures that every aspect of COBIT 2019 provides a structured approach for organiza- IT management is linked to the appropriate business objections to establish, implement, and maintain effective gover- tives and control needs, thus enhancing overall governance nance over IT. It defines the components necessary to create effectiveness [1]. One effective way to perform this mapping and sustain a governance system, as well as guidelines for is by utilizing a'
 'research aims to carry out structural calculations is a summary of the results of the bibliographic coupling of Information and Communication Technology (ICT) on the analysis in this study. economy in the Greek case study with a quantitative approach. Authorized licensed use limited to: Institut Teknologi Sepuluh Nopember. Downloaded on July 14,2025 at 08:22:06 UTC from IEEE Xplore. Restrictions apply. Performance Prism is an approach model that describes designed to be flexible and easily adaptable to various company performance in five areas, namely stakeholder organizational contexts. Performance Prism is a model that satisfaction, strategies, processes, and capabilities, there are illustrates corporate performance in five areas: stakeholder 68 research data that use the Performance Prism approach satisfaction, strategy, processes, and capabilities. model. One example of a research method is a study entitled Furthermore, these three methods can be readily customized A Resilience Framework for Digital Transformation in the to meet the'
 'dynamic tool for tasks and components within COBIT that highlight the managing risk, compliance, and performance in the realm of critical role of risk management in IT governance. information technology [12]. COBIT 2019 provides specific guidance on how organizations can improve the efficiency and effectiveness of their II. LITERATURESTUDY internal business processes, as well as enhance the skills of A. Neo4j as Graph Database their IT staff. By following the recommendations outlined in Neo4jisapopulargraphdatabasewidelyusedformanaging COBIT 2019, organizations can better manage IT, increase and querying complex relational data. One of the commonly the value of their IT investments, and achieve their business used command languages for Neo4j is Cypher Query Lan- objectives more effectively. guage(CQL).CypherprovidesanintuitiveandexpressivesynC. Term Frequency (TF)-Inverse Document Frequency (IDF) tax for interacting with graph data, allowing users to perform and Long Short Term Memory (LSTM) method various operations such as searching, adding, updating, and deleting data within the Neo4j'
 ""controls within an organization's IT conduct in-depth analyses of system compliance with COBIT system [5]. This audit helps identify weaknesses and potential standards and identify noises from established procedures. risks, as well as providing recommendations for improving This integrated audit approach provides comprehensive and enhancing information technology management [6], [7]. insights into the performance of the organization's information Thus, the system audit with COBIT helps organizations systems, along with recommendations for more effective IT improve the reliability, security, and operational efficiency in management. Thus, audit with COBIT and process mining managing their information technology. [8], [9] from event logs aids organizations in improving the reliability, 979-8-3503-5161-3/24/$31.00 ©2024 IEEE 92116701.4202.72816AIITCI/9011.01 :IOD | EEEI 4202© 00.13$/42/3-1615-3053-8-979 | )AIITCI( snoitacilppA stI dna noitavonnI ygolonhceT no ecnerefnoC lanoitanretnI dn2 4202 Authorized licensed use limited to: Institut Teknologi Sepuluh Nopember. Downloaded on July 14,2025 at 08:18:28 UTC from IEEE Xplore. Restrictions apply. security, and operational""]","assist organizations in managing and optimizing their use of information technology (IT) . landscape, effective IT In today’s rapidly evolving digital governance is essential for organizations to ensure that their IT investments align with business objectives, comply with regulations, and mitigate risks . COBIT 2019 provides a structured approach for organiza- tions to establish, implement, and maintain effective gover- nance over IT. It defines the components necessary to create and sustain a governance system, as well as guidelines for building the most suitable governance system for an enterprise . By utilizing COBIT 2019, organizations can enhance the efficiency, effectiveness, and reliability of their IT usage, while also ensuring compliance with relevant regulations, policies, and standards . One of the key",0.5,0.7566235049110288,0.8874999999778125,0.8333333333333334
"COBIT Core Model and Capability Scores, it is necessary to undergo a mapping process according to the instructions in the COBIT 2019 manual. This can be time-consuming, especially when auditor should auditing multiple companies simultaneously. This research aim to simplify the process to get Activities of COBIT 2019 automatically from Input Text Company Strategy that aligned with the description of related Enterprise Goals. This research adopts Neo4j, a graph database platform, to manage KG and process data related to these objectives, to gain deeper and more applicable insights into the relationships between strategic and operational objectives in a company . Furthermore, this research also involves the function of preprocessing the input text in the form of Company Strat- egy using","This research adopts Neo4j, a graph database platform, to manage knowledge graphs and process data related to these objectives, as it allows organizations to create dynamic and interactive graphical models to better understand and manage the complex relationships between different COBIT 2019 elements (Voigt, 2019).","['Voigt, “Updating graph databases with cypher,” Incentive (Penulisan Publikasi dan Hak Kekayaan IntelekProceedings of the VLDB Endowment, vol. 12, no. 12, tual/PPHKI) Program 2024. pp. 2242–2254, 2019. REFERENCES [14] M.NeedhamandA.E.Hodler,“Acomprehensiveguide to graph algorithms in neo4j,” Neo4j. com, 2018. [1] I. S. Audit and C. Association, COBIT 2019 Frame[15] E. Nachrowi, Y. Nurhadryani, and H. Sukoco, “Evalwork: Introduction and Methodology. ISACA, 2018, uation of governance and management of information ISBN: 1604206446. technology services using cobit 2019 and itil 4,” Jur[2] S. P.-J. Wu, D. W. Straub, and T.-P. Liang, “How infornal RESTI (Rekayasa Sistem dan Teknologi Informasi), mation technology governance mechanisms and stratevol. 4, pp. 764–774, Aug. 2020. DOI: 10.29207/resti. gic alignment influence organizational performance,” v4i4.2265. MIS quarterly, vol. 39, no. 2, pp. 497–518, 2015. [3] R. Sarno, STRATEGI SUKSES BISNIS DENGAN TI Berbasis Balanced Scorecard dan COBIT. ITS Press, 2009, ISBN: 978-979-8897-39-9. Authorized licensed use limited to: Institut Teknologi Sepuluh 2, pp. 497–518, 2015. [3] R. Sarno, STRATEGI SUKSES BISNIS DENGAN TI Berbasis Balanced Scorecard dan COBIT. ITS Press, 2009, ISBN: 978-979-8897-39-9. Authorized licensed use limited to: Institut Teknologi Sepuluh Nopember. Downloaded on July 14,2025 at 08:22:06 UTC from IEEE Xplore. Restrictions apply.'
 'It defines the components necessary to create effectiveness [1]. One effective way to perform this mapping and sustain a governance system, as well as guidelines for is by utilizing a graph database such as Neo4j [7]. 979-8-3503-5161-3/24/$31.00©2024IEEE 26516701.4202.72816AIITCI/9011.01 :IOD | EEEI 4202© 00.13$/42/3-1615-3053-8-979 | )AIITCI( snoitacilppA stI dna noitavonnI ygolonhceT no ecnerefnoC lanoitanretnI dn2 4202 Authorized licensed use limited to: Institut Teknologi Sepuluh Nopember. Downloaded on July 14,2025 at 08:22:06 UTC from IEEE Xplore. Restrictions apply. Neo4jisagraphdatabasespecificallydesignedtostoreand functions by enhancing the organization’s ability to manage data with complex relationships [8]. In the context manage IT effectively. of COBIT 2019, Neo4j can be utilized to build dynamic 2) EG09: Internal Business Process Cost Optimization: graphical representations of various COBIT elements [9]. By This process aims to optimize the costs associated with using Neo4j, organizations can create dynamic and interactive internal business processes by reducing IT operational graphicalmodelstobetterunderstandandmanagethecomplex costsandincreasingtheoverallvalueofITinvestments. relationships between different'
 'dynamic tool for tasks and components within COBIT that highlight the managing risk, compliance, and performance in the realm of critical role of risk management in IT governance. information technology [12]. COBIT 2019 provides specific guidance on how organizations can improve the efficiency and effectiveness of their II. LITERATURESTUDY internal business processes, as well as enhance the skills of A. Neo4j as Graph Database their IT staff. By following the recommendations outlined in Neo4jisapopulargraphdatabasewidelyusedformanaging COBIT 2019, organizations can better manage IT, increase and querying complex relational data. One of the commonly the value of their IT investments, and achieve their business used command languages for Neo4j is Cypher Query Lan- objectives more effectively. guage(CQL).CypherprovidesanintuitiveandexpressivesynC. Term Frequency (TF)-Inverse Document Frequency (IDF) tax for interacting with graph data, allowing users to perform and Long Short Term Memory (LSTM) method various operations such as searching, adding, updating, and deleting data within the Neo4j'
 'ygolonhceT no ecnerefnoC lanoitanretnI dn2 4202 Authorized licensed use limited to: Institut Teknologi Sepuluh Nopember. Downloaded on July 14,2025 at 08:18:28 UTC from IEEE Xplore. Restrictions apply. security, and operational efficiency of their information specific areas of IT management. COBIT 2019 provides systems. comprehensive guidance for understanding, planning, and implementing effective and efficient IT management Sungkono K et al., [13] explores the use of graphs to principles [21]. By adopting COBIT 2019, organizations can identify incorrect judgments and patterns in corporate improve their IT performance, reduce risks, and ensure that IT operations. This research aims to assist companies in is used to support the achievement of business objectives preventing fraud by identifying anomalies in their business optimally. processes. The proposed graph-based method provides a unique approach in identifying these anomalies and improving Domain DSS01 in COBIT 2019, titled ""Define and operational efficiency. An analysis of the method\'s Manage Service Levels,""'
 'internal Thesecommandscanbeusedtobuildandmanagecomplex business processes. The approach integrates data collection, graphstructuresintheNeo4jdatabase,aswellastoqueryand preprocessing, graph database modeling with Neo4j, and recanalyze data related to those structures [14]. ommendationgenerationusinggraphalgorithmsandsimilarity methods. The complete process shown in figure 1 B. COBIT 2019 Internal Business Process A. Input Dataset In the COBIT 2019 framework, internal business processes play a crucial role in improving the efficiency and effective- The input dataset comprises information from the COBIT ness of information technology (IT) management within an 2019framework,includinginternalbusinessprocesses,control organization [15]. These processes are designed to optimize objectives, IT processes, and related elements. Additionally, various aspects of IT operations and include the following: company-specific goals are incorporated to ensure that the 1) EG08: Optimization of Internal Business Process recommendations align with organizational objectives. Functions: This process focuses on improving the ef- 1) Data Collection: Gather data from COBIT 2019 docficiency and effectiveness of internal business process umentation and relevant enterprise sources, focusing']","company goals by proposing a novel recommendation system for internal business processes, grounded in the COBIT 2019 framework. The system employs graph algorithms to map relationships, semantic similarity measure- ments to align enterprise goals with management objectives, and LSTM combined with TF-IDF methods to analyze and recommend specific activities. Experimental results show that this system optimizes IT management practices, enhances operational efficiency, and ensures regulatory compliance. Additionally, a user-friendly graphical representation of internal business pro- cesses using Neo4j enables stakeholders to visualize complex relationships within the COBIT framework, facilitating informed decision-making. This research advances IT governance practices by providing organizations with a valuable tool to automate and improve IT strategies, effectively achieving business objectives. Index Terms—COBIT 2019, graph algorithms, IT",0.7142857142857143,0.8468907225880457,0.36666666664833336,0.16666666666666666
"in business process modeling. Using real- life data and public datasets, the research compared GPD++ to traditional methods like Inductive Miner (IM) and Split Miner (SM). Results showed that GPD++ effectively addressed ICRs and detected hierarchical blocks. The paper introduces the Invisible-Task Prime and Non-Prime ITPNP algorithm for mining invisible tasks in process models, focusing on XOR and AND/OR relationships. It detects invisible non-prime tasks in hybrid parallel rela- tionships. Tested on seven models, it outperformed traditional methods, achieving high fitness and precision, especially in complex scenarios. Research by introduces an improved method for detect- ing parallel process models in graph-based process discovery. By establishing relationship frequencies and using specific algorithms, the method accurately distinguishes XOR, AND, and OR relationships.","The research highlights the effectiveness of GPD++ in addressing ICRs and detecting hierarchical blocks, outperforming traditional methods like Inductive Miner and Split Miner in complex scenarios (Ridwanah et al., 2022).","['initial point After preprocessing, process discovery techniques are and follows a sequence of evaluations and decision-making applied to the cleaned data to identify the underlying stages, including the handling of code errors and status Fig. 2. Process Discovery Results Authorized licensed use limited to: Institut Teknologi Sepuluh Nopember. Downloaded on July 14,2025 at 08:18:28 UTC from IEEE Xplore. Restrictions apply. adjustments. There are also paths indicating manual TABLE III. TOP 10 MOST FREQUENT PROCESS PATTERNS interventions and options to modify, bill, or delete data entries. This process model is strategically designed to ensure that Case Activity Traces (Variants) Frequency each case is handled effectively and accurately, considering Ratio specific conditions that arise during the recovery process. The NEW > CHANGE DIAGN > FIN > 33,673 33.67 % RELEASE > CODE OKE > BILLED process model serves as a crucial tool for understanding and ensuring the efficiency and accuracy of case'
 'Intelligent Engineering and Systems, vol. 12, no. 4, pp. 31– process composition based on meta models,” in 2015 International 40, Aug. 2019, doi: 10.22266/ijies2019.0831.04. Seminar on Intelligent Technology and Its Applications (ISITIA), [13] Y. Caesarita, R. Sarno, and K. R. Sungkono, “Identifying bottlenecks Surabaya, Indonesia: IEEE, May 2015, pp. 315–318. doi: and fraud of business process using alpha ++ and heuristic miner 10.1109/ISITIA.2015.7219998. algorithms (Case study: CV. Wicaksana Artha),” in 2017 11th [17] F. Mannhardt, M. De Leoni, H. A. Reijers, and W. M. P. Van Der International Conference on Information & Communication Aalst, “Data-Driven Process Discovery - Revealing Conditional Technology and System (ICTS), Surabaya, Indonesia: IEEE, Oct. 2017, Infrequent Behavior from Event Logs,” in Advanced Information pp. 143–148. doi: 10.1109/ICTS.2017.8265660. Systems Engineering, vol. 10253, E. Dubois and K. Pohl, Eds., in [14] R. D. Ridwanah, R. Andreswari, and R. Fauzi, “Analysis and Lecture Notes in Computer Science, vol. 10253.'
 'data based on event logs stored in the information system, accurate business model [13]. thereby generating more effective processes overall. D. Heuristic Miner II. LITERATURE REVIEW Heuristic Miner, a process mining algorithm, is reliable A. DSS01 and has been effectively used in numerous scenarios [14]. It specifically mines data from the control flow perspective of a Deliver, Service, and Support (DSS) domain of the process. A key advantage of Heuristic Miner over the COBIT framework, with a specific emphasis on managing IT Alpha++ algorithm is its ability to calculate the frequency of operations [5]. Its main goal is to guarantee that IT operations activity relations [15]. Additionally, it can handle noisy data are executed effectively, securely, and in accordance with effectively, providing a more robust analysis where other business requirements. Essential activities under this process include the monitoring and management of IT service algorithms might fail. This capability makes Heuristic'
 'in managing and optimizing the data with the aim of understanding and modeling the actual use of information technology (IT) to achieve their business business processes that occur. In this research, two main goals. This framework consists of several domains, each algorithms are used: Inductive Miner and Heuristic Miner. covering a set of controls, practices, and objectives related to Authorized licensed use limited to: Institut Teknologi Sepuluh Nopember. Downloaded on July 14,2025 at 08:18:28 UTC from IEEE Xplore. Restrictions apply. Fig. 1 Log Event Map Inductive Miner is a process mining algorithm used to IV. RESULT AND ANALYSIS construct process models from event logs. Inductive Miner focuses on creating a model that is both simple and This research utilizes a public dataset from Kaggle on comprehensible while accurately representing the behavior automobile insurance claims. The dataset consists of 30,000 cases, 180,000 rows of data, and 15 columns. There are six'
 ""effectively, providing a more robust analysis where other business requirements. Essential activities under this process include the monitoring and management of IT service algorithms might fail. This capability makes Heuristic Miner performance, handling incidents and problems, and ensuring particularly useful in complex environments where data may the security of the system[7]. TABLE I provides a detailed not always be clean or well-structured [9]. Moreover, it offers overview of the activities and performance indicators insightful diagnostics about the process flow, helping to associated with the DSS01.01 domain of managed operations. identify bottlenecks and inefficiencies that other algorithms might overlook[16]. B. Process Mining Process mining involves deriving business processes from III. PROPOSED METHOD the log files associated with a company's business operations, This section discussed the research workflow illustrated in aimed at better understanding and optimizing each activity Fig. 1. The research stages encompass four critical steps more effectively[8] . From the""]","more reliable in detecting and handling ICR patterns. B. GRAPH-BASED PROCESS DISCOVERY PLUS B. GRAPH-BASED PROCESS DISCOVERY PLUS PLUS (GPD++) GPD++ consists of the main algorithm for detecting split and join blocks presented in Algorithm 1 and the algorithm for finding the block hierarchy and its types (XOR or AND) in Algorithm 2 and Algorithm 3. GPD++ utilizes the detected block structure to identify ICR in blocks parallel (long). As an illustration of how Algorithm 1 works in finding split-join blocks, an example of a DFG model with one split node (|T| = 1) and one join node is given in figure 4. The input for Algorithm 1 is the DFG model with split-node and join-node information. The results of",0.0,0.8507432387544195,0.0,0.0
"by identifying Enterprise Goals corre- lated with the Balanced Scorecard Financial. Then, Alignment Goals related to these Enterprise Goals were mapped. Subse- quently, Management Objectives from the COBIT Core Model associated with Alignment Goals were identified. Examples of these mappings are shown in TABLE I. Following this, Activ- ities and their descriptions were compiled for each Manage- ment Objective, based on COBIT guidelines, as demonstrated in TABLE II. A total of 1202 activities were found to correlate with the Balanced Scorecard Financial perspective during the mapping process. B. Create Graph Database After the completion of the Mapping process, the next step is to create nodes and their relationships using Neo4J Graph Database Tools, in order to construct a Knowledge Graph","According to a study, adopting COBIT 2019 allows organizations to enhance their IT performance and align it with business objectives effectively (Author, Year).","['on Firm 10.1016/j.joitmc.2023.100045. Performance,” Emerg. Mark. Finance Trade, vol. 56, [3] V. Popova and A. Sharpanskykh, “Modeling no. 10, pp. 2213–2230, 2020, doi: organizational performance indicators,” Inf. Syst. , vol. 10.1080/1540496X.2020.1785863. 35, no. 4, pp. 505–527, 2010, doi: [17] S. Kozak, ""The impact of COVID-19 on bank equity 10.1016/j.is.2009.12.001. and performance: the case of central-eastern south [4] MH saad, G. Hagelaar, G. van der Velde, and SWF Omta, European countries,"" Sustain. Switz. , vol. 13, no. 19, “Conceptualization of SMEs\' business resilience: A 2021, doi: 10.3390/su131911036. systematic literature review,” Cogent Business and [18] DM Stock and P. Erpf, ""Systematic literature review on Management, vol. 8, no. 1. 2021. doi: EO in nonprofit organizations – Far more than business10.1080/23311975.2021.1938347. like behavior,"" J. Philanthr. Mark. , vol. 28, no. 4, p. [5] E. Lampadarios, N. Kyriakidou, and G. Smith, “Towards e1753, Nov. 2023, doi: 10.1002/nvsm.1753. a new framework for SMEs success: A'
 'al. [2] analyzed performance measurement in all sectors to address this gap by employing bibliometric methods. using bibliometric methods. Research in the business Bibliometric methods are quantitative techniques used to management and accounting sectors has focused on the measure and analyze scientific literature, enabling researchers balanced scorecard method, data envelopment analysis, to identify and analyze research topics comprehensively. The analytical hierarchy process, and analytical network processes findings reveal that performance measurement in digital for performance measurement [2]. Other research that businesses predominantly utilizes models customized to discusses performance measurement is research conducted by individual company needs, with a preference for quantitative Cvetkovski and Eftimov [3], that found that research indicators. Key focus areas include operational management, discussing performance measurement in the fields of business, innovation, and technology. Bibliographic coupling and comanagement and accounting in the Scopus database has citation analyses indicate significant relationships between existed since 1978 to 2019. This'
 'dynamic tool for tasks and components within COBIT that highlight the managing risk, compliance, and performance in the realm of critical role of risk management in IT governance. information technology [12]. COBIT 2019 provides specific guidance on how organizations can improve the efficiency and effectiveness of their II. LITERATURESTUDY internal business processes, as well as enhance the skills of A. Neo4j as Graph Database their IT staff. By following the recommendations outlined in Neo4jisapopulargraphdatabasewidelyusedformanaging COBIT 2019, organizations can better manage IT, increase and querying complex relational data. One of the commonly the value of their IT investments, and achieve their business used command languages for Neo4j is Cypher Query Lan- objectives more effectively. guage(CQL).CypherprovidesanintuitiveandexpressivesynC. Term Frequency (TF)-Inverse Document Frequency (IDF) tax for interacting with graph data, allowing users to perform and Long Short Term Memory (LSTM) method various operations such as searching, adding, updating, and deleting data within the Neo4j'
